# Generated by:
#     target/debug/noria-logictest generate --operations avg,min,cte --compare-to mysql://root@localhost/mysql --subquery-depth 1 --rows-per-table 5 -o logictests/generated/avg,min,cte.test --include-deletes
# failure: ENG-341

statement ok
CREATE TABLE table_1 (column_4 INT(32), column_24 INT(32), column_18 INT(32), column_3 INT(32), column_13 INT(32), column_16 INT(32), column_11 INT(32), column_12 INT(32), column_10 INT(32), column_21 INT(32), column_6 INT(32), column_1 INT(32), column_9 INT(32), column_2 INT(32), column_14 INT(32), column_23 INT(32), column_25 INT(32), column_5 INT(32), column_8 INT(32), column_22 INT(32), column_19 INT(32), column_20 INT(32), column_15 INT(32), column_17 INT(32), column_7 INT(32), PRIMARY KEY (column_25))


statement ok
INSERT INTO table_1 (column_13, column_6, column_12, column_4, column_1, column_24, column_18, column_14, column_25, column_20, column_3, column_10, column_16, column_2, column_21, column_8, column_15, column_11, column_5, column_9, column_23, column_22, column_19, column_17, column_7) VALUES (1, 1, 1, 1, 1, 1, 1, 1, 2, 1, 1, 1, 1, 1, 1, 1, 1, 1, 1, 1, 1, 1, 1, 1, 1), (1, 1, 1, 1, 1, 1, 1, 1, 3, 1, 1, 1, 1, 1, 1, 1, 1, 1, 1, 1, 1, 1, 1, 1, 1), (1, 1, 1, 1, 1, 1, 1, 1, 4, 1, 1, 1, 1, 1, 1, 1, 1, 1, 1, 1, 1, 1, 1, 1, 1), (1, 1, 1, 1, 1, 1, 1, 1, 5, 1, 1, 1, 1, 1, 1, 1, 1, 1, 1, 1, 1, 1, 1, 1, 1), (1, 1, 1, 1, 1, 1, 1, 1, 6, 1, 1, 1, 1, 1, 1, 1, 1, 1, 1, 1, 1, 1, 1, 1, 1)


query  nosort
WITH alias_3 AS (SELECT avg(table_1.column_2) AS alias_2 FROM table_1) SELECT avg(table_1.column_1) AS alias_1 FROM table_1 INNER JOIN alias_3 ON (table_1.column_2 = alias_3.alias_2)
----
1.0000

query  nosort
WITH alias_3 AS (SELECT min(table_1.column_4) AS alias_2 FROM table_1) SELECT avg(table_1.column_3) AS alias_1 FROM table_1 INNER JOIN alias_3 ON (table_1.column_4 = alias_3.alias_2)
----
1.0000

query  nosort
WITH alias_4 AS (SELECT avg(table_1.column_6) AS alias_2, min(table_1.column_7) AS alias_3 FROM table_1) SELECT avg(table_1.column_5) AS alias_1 FROM table_1 INNER JOIN alias_4 ON (table_1.column_4 = alias_4.alias_2)
----
1.0000

query  nosort
WITH alias_3 AS (SELECT avg(table_1.column_9) AS alias_2 FROM table_1) SELECT min(table_1.column_8) AS alias_1 FROM table_1 INNER JOIN alias_3 ON (table_1.column_4 = alias_3.alias_2)
----
1

query  nosort
WITH alias_3 AS (SELECT min(table_1.column_11) AS alias_2 FROM table_1) SELECT min(table_1.column_10) AS alias_1 FROM table_1 INNER JOIN alias_3 ON (table_1.column_4 = alias_3.alias_2)
----
1

query  nosort
WITH alias_4 AS (SELECT avg(table_1.column_13) AS alias_2, min(table_1.column_14) AS alias_3 FROM table_1) SELECT min(table_1.column_12) AS alias_1 FROM table_1 INNER JOIN alias_4 ON (table_1.column_4 = alias_4.alias_2)
----
1

query  nosort
WITH alias_4 AS (SELECT avg(table_1.column_17) AS alias_3 FROM table_1) SELECT avg(table_1.column_15) AS alias_1, min(table_1.column_16) AS alias_2 FROM table_1 INNER JOIN alias_4 ON (table_1.column_4 = alias_4.alias_3)
----
1.0000
1

query  nosort
WITH alias_4 AS (SELECT min(table_1.column_20) AS alias_3 FROM table_1) SELECT avg(table_1.column_18) AS alias_1, min(table_1.column_19) AS alias_2 FROM table_1 INNER JOIN alias_4 ON (table_1.column_4 = alias_4.alias_3)
----
1.0000
1

query  nosort
WITH alias_5 AS (SELECT avg(table_1.column_23) AS alias_3, min(table_1.column_24) AS alias_4 FROM table_1) SELECT avg(table_1.column_21) AS alias_1, min(table_1.column_22) AS alias_2 FROM table_1 INNER JOIN alias_5 ON (table_1.column_4 = alias_5.alias_3)
----
1.0000
1

statement ok
DELETE FROM table_1 WHERE (column_25 = 2)


statement ok
DELETE FROM table_1 WHERE (column_25 = 3)


query  nosort
WITH alias_3 AS (SELECT avg(table_1.column_2) AS alias_2 FROM table_1) SELECT avg(table_1.column_1) AS alias_1 FROM table_1 INNER JOIN alias_3 ON (table_1.column_2 = alias_3.alias_2)
----
1.0000

query  nosort
WITH alias_3 AS (SELECT min(table_1.column_4) AS alias_2 FROM table_1) SELECT avg(table_1.column_3) AS alias_1 FROM table_1 INNER JOIN alias_3 ON (table_1.column_4 = alias_3.alias_2)
----
1.0000

query  nosort
WITH alias_4 AS (SELECT avg(table_1.column_6) AS alias_2, min(table_1.column_7) AS alias_3 FROM table_1) SELECT avg(table_1.column_5) AS alias_1 FROM table_1 INNER JOIN alias_4 ON (table_1.column_4 = alias_4.alias_2)
----
1.0000

query  nosort
WITH alias_3 AS (SELECT avg(table_1.column_9) AS alias_2 FROM table_1) SELECT min(table_1.column_8) AS alias_1 FROM table_1 INNER JOIN alias_3 ON (table_1.column_4 = alias_3.alias_2)
----
1

query  nosort
WITH alias_3 AS (SELECT min(table_1.column_11) AS alias_2 FROM table_1) SELECT min(table_1.column_10) AS alias_1 FROM table_1 INNER JOIN alias_3 ON (table_1.column_4 = alias_3.alias_2)
----
1

query  nosort
WITH alias_4 AS (SELECT avg(table_1.column_13) AS alias_2, min(table_1.column_14) AS alias_3 FROM table_1) SELECT min(table_1.column_12) AS alias_1 FROM table_1 INNER JOIN alias_4 ON (table_1.column_4 = alias_4.alias_2)
----
1

query  nosort
WITH alias_4 AS (SELECT avg(table_1.column_17) AS alias_3 FROM table_1) SELECT avg(table_1.column_15) AS alias_1, min(table_1.column_16) AS alias_2 FROM table_1 INNER JOIN alias_4 ON (table_1.column_4 = alias_4.alias_3)
----
1.0000
1

query  nosort
WITH alias_4 AS (SELECT min(table_1.column_20) AS alias_3 FROM table_1) SELECT avg(table_1.column_18) AS alias_1, min(table_1.column_19) AS alias_2 FROM table_1 INNER JOIN alias_4 ON (table_1.column_4 = alias_4.alias_3)
----
1.0000
1

query  nosort
WITH alias_5 AS (SELECT avg(table_1.column_23) AS alias_3, min(table_1.column_24) AS alias_4 FROM table_1) SELECT avg(table_1.column_21) AS alias_1, min(table_1.column_22) AS alias_2 FROM table_1 INNER JOIN alias_5 ON (table_1.column_4 = alias_5.alias_3)
----
1.0000
1
