# Generated by:
#     target/debug/noria-logictest generate --operations avg,equal_filters --compare-to mysql://root@localhost/mysql --subquery-depth 1 --rows-per-table 5 -o logictests/generated/avg,equal_filters.test --include-deletes
# failure: ENG-332

statement ok
CREATE TABLE table_1 (column_50 INT(32), column_23 INT(32), column_44 INT(32), column_48 INT(32), column_46 INT(32), column_2 INT(1), column_10 INT(32), column_13 INT(32), column_28 INT(32), column_30 INT(32), column_33 INT(32), column_45 INT(32), column_20 INT(32), column_21 INT(32), column_19 INT(32), column_22 INT(32), column_38 INT(32), column_41 INT(32), column_47 INT(32), column_1 INT(32), column_15 INT(32), column_17 INT(32), column_4 INT(32), column_35 INT(32), column_43 INT(32), column_11 INT(32), column_26 INT(32), column_24 INT(32), column_49 INT(32), column_7 INT(32), column_5 INT(32), column_25 INT(32), column_16 INT(32), column_14 INT(32), column_8 INT(32), column_6 INT(32), column_32 INT(32), column_9 INT(32), column_27 INT(32), column_12 INT(32), column_39 INT(32), column_42 INT(32), column_29 INT(32), column_31 INT(32), column_18 INT(32), column_34 INT(32), column_36 INT(32), column_37 INT(32), column_3 INT(32), column_40 INT(32), PRIMARY KEY (column_50))


statement ok
INSERT INTO table_1 (column_17, column_47, column_29, column_37, column_15, column_25, column_48, column_7, column_31, column_4, column_46, column_14, column_8, column_27, column_39, column_40, column_16, column_6, column_41, column_32, column_12, column_1, column_45, column_50, column_35, column_9, column_18, column_24, column_30, column_13, column_2, column_34, column_11, column_36, column_3, column_28, column_19, column_10, column_22, column_5, column_23, column_44, column_20, column_33, column_43, column_38, column_26, column_42, column_49, column_21) VALUES (1, 1, 1, 1, 1, 1, 1, 1, 1, 1, 1, 1, 1, 1, 1, 1, 1, 1, 1, 1, 1, 1, 1, 2, 1, 1, 1, 1, 1, 1, 1, 1, 1, 1, 1, 1, 1, 1, 1, 1, 1, 1, 1, 1, 1, 1, 1, 1, 1, 1), (1, 1, 1, 1, 1, 1, 1, 1, 1, 1, 1, 1, 1, 1, 1, 1, 1, 1, 1, 1, 1, 1, 1, 3, 1, 1, 1, 1, 1, 1, 1, 1, 1, 1, 1, 1, 1, 1, 1, 1, 1, 1, 1, 1, 1, 1, 1, 1, 1, 1), (1, 1, 1, 1, 1, 1, 1, 1, 1, 1, 1, 1, 1, 1, 1, 1, 1, 1, 1, 1, 1, 1, 1, 4, 1, 1, 1, 1, 1, 1, 1, 1, 1, 1, 1, 1, 1, 1, 1, 1, 1, 1, 1, 1, 1, 1, 1, 1, 1, 1), (1, 1, 1, 1, 1, 1, 1, 1, 1, 1, 1, 1, 1, 1, 1, 1, 1, 1, 1, 1, 1, 1, 1, 5, 1, 1, 1, 1, 1, 1, 1, 1, 1, 1, 1, 1, 1, 1, 1, 1, 1, 1, 1, 1, 1, 1, 1, 1, 1, 1), (1, 1, 1, 1, 1, 1, 1, 1, 1, 1, 1, 1, 1, 1, 1, 1, 1, 1, 1, 1, 1, 1, 1, 6, 1, 1, 1, 1, 1, 1, 1, 1, 1, 1, 1, 1, 1, 1, 1, 1, 1, 1, 1, 1, 1, 1, 1, 1, 1, 1)


query  nosort
SELECT avg(table_1.column_1) AS alias_1 FROM table_1
----
1.0000

query  nosort
SELECT table_1.column_2 AS alias_1 FROM table_1 WHERE (table_1.column_2 = 1)
----
1
1
1
1
1

query  nosort
SELECT table_1.column_2 AS alias_1 FROM table_1 WHERE (table_1.column_2 = 1)
----
1
1
1
1
1

query  nosort
SELECT table_1.column_2 AS alias_1 FROM table_1 WHERE (table_1.column_2 = table_1.column_3)
----
1
1
1
1
1

query  nosort
SELECT table_1.column_2 AS alias_1 FROM table_1 WHERE (table_1.column_2 = table_1.column_4)
----
1
1
1
1
1

query  nosort
SELECT avg(table_1.column_5) AS alias_1, table_1.column_2 AS alias_2 FROM table_1 WHERE (table_1.column_2 = 1) GROUP BY table_1.column_2
----
1.0000
1

query  nosort
SELECT avg(table_1.column_6) AS alias_1, table_1.column_2 AS alias_2 FROM table_1 WHERE (table_1.column_2 = 1) GROUP BY table_1.column_2
----
1.0000
1

query  nosort
SELECT avg(table_1.column_7) AS alias_1, table_1.column_2 AS alias_2 FROM table_1 WHERE (table_1.column_2 = table_1.column_8) GROUP BY table_1.column_2
----
1.0000
1

query  nosort
SELECT avg(table_1.column_9) AS alias_1, table_1.column_2 AS alias_2 FROM table_1 WHERE (table_1.column_2 = table_1.column_10) GROUP BY table_1.column_2
----
1.0000
1

query  nosort
SELECT table_1.column_2 AS alias_1, table_1.column_2 AS alias_2 FROM table_1 WHERE ((table_1.column_2 = 1) OR (table_1.column_2 = 1))
----
1
1
1
1
1
1
1
1
1
1

query  nosort
SELECT table_1.column_2 AS alias_1, table_1.column_2 AS alias_2 FROM table_1 WHERE ((table_1.column_2 = 1) AND (table_1.column_2 = table_1.column_11))
----
1
1
1
1
1
1
1
1
1
1

query  nosort
SELECT table_1.column_2 AS alias_1, table_1.column_2 AS alias_2 FROM table_1 WHERE ((table_1.column_2 = 1) OR (table_1.column_2 = table_1.column_12))
----
1
1
1
1
1
1
1
1
1
1

query  nosort
SELECT table_1.column_2 AS alias_1, table_1.column_2 AS alias_2 FROM table_1 WHERE ((table_1.column_2 = 1) AND (table_1.column_2 = table_1.column_13))
----
1
1
1
1
1
1
1
1
1
1

query  nosort
SELECT table_1.column_2 AS alias_1, table_1.column_2 AS alias_2 FROM table_1 WHERE ((table_1.column_2 = 1) OR (table_1.column_2 = table_1.column_14))
----
1
1
1
1
1
1
1
1
1
1

query  nosort
SELECT table_1.column_2 AS alias_1, table_1.column_2 AS alias_2 FROM table_1 WHERE ((table_1.column_2 = table_1.column_15) OR (table_1.column_2 = table_1.column_16))
----
1
1
1
1
1
1
1
1
1
1

query  nosort
SELECT avg(table_1.column_17) AS alias_1, table_1.column_2 AS alias_2, table_1.column_2 AS alias_3 FROM table_1 WHERE ((table_1.column_2 = 1) OR (table_1.column_2 = 1)) GROUP BY table_1.column_2, table_1.column_2
----
1.0000
1
1

query  nosort
SELECT avg(table_1.column_18) AS alias_1, table_1.column_2 AS alias_2, table_1.column_2 AS alias_3 FROM table_1 WHERE ((table_1.column_2 = 1) AND (table_1.column_2 = table_1.column_19)) GROUP BY table_1.column_2, table_1.column_2
----
1.0000
1
1

query  nosort
SELECT avg(table_1.column_20) AS alias_1, table_1.column_2 AS alias_2, table_1.column_2 AS alias_3 FROM table_1 WHERE ((table_1.column_2 = 1) OR (table_1.column_2 = table_1.column_21)) GROUP BY table_1.column_2, table_1.column_2
----
1.0000
1
1

query  nosort
SELECT avg(table_1.column_22) AS alias_1, table_1.column_2 AS alias_2, table_1.column_2 AS alias_3 FROM table_1 WHERE ((table_1.column_2 = 1) AND (table_1.column_2 = table_1.column_23)) GROUP BY table_1.column_2, table_1.column_2
----
1.0000
1
1

query  nosort
SELECT avg(table_1.column_24) AS alias_1, table_1.column_2 AS alias_2, table_1.column_2 AS alias_3 FROM table_1 WHERE ((table_1.column_2 = 1) OR (table_1.column_2 = table_1.column_25)) GROUP BY table_1.column_2, table_1.column_2
----
1.0000
1
1

query  nosort
SELECT avg(table_1.column_26) AS alias_1, table_1.column_2 AS alias_2, table_1.column_2 AS alias_3 FROM table_1 WHERE ((table_1.column_2 = table_1.column_27) OR (table_1.column_2 = table_1.column_28)) GROUP BY table_1.column_2, table_1.column_2
----
1.0000
1
1

query  nosort
SELECT table_1.column_2 AS alias_1, table_1.column_2 AS alias_2, table_1.column_2 AS alias_3 FROM table_1 WHERE (((table_1.column_2 = 1) OR (table_1.column_2 = 1)) AND (table_1.column_2 = table_1.column_29))
----
1
1
1
1
1
1
1
1
1
1
1
1
1
1
1

query  nosort
SELECT table_1.column_2 AS alias_1, table_1.column_2 AS alias_2, table_1.column_2 AS alias_3 FROM table_1 WHERE (((table_1.column_2 = 1) OR (table_1.column_2 = 1)) OR (table_1.column_2 = table_1.column_30))
----
1
1
1
1
1
1
1
1
1
1
1
1
1
1
1

query  nosort
SELECT table_1.column_2 AS alias_1, table_1.column_2 AS alias_2, table_1.column_2 AS alias_3 FROM table_1 WHERE (((table_1.column_2 = 1) AND (table_1.column_2 = table_1.column_31)) OR (table_1.column_2 = table_1.column_32))
----
1
1
1
1
1
1
1
1
1
1
1
1
1
1
1

query  nosort
SELECT table_1.column_2 AS alias_1, table_1.column_2 AS alias_2, table_1.column_2 AS alias_3 FROM table_1 WHERE (((table_1.column_2 = 1) AND (table_1.column_2 = table_1.column_33)) OR (table_1.column_2 = table_1.column_34))
----
1
1
1
1
1
1
1
1
1
1
1
1
1
1
1

query  nosort
SELECT avg(table_1.column_35) AS alias_1, table_1.column_2 AS alias_2, table_1.column_2 AS alias_3, table_1.column_2 AS alias_4 FROM table_1 WHERE (((table_1.column_2 = 1) OR (table_1.column_2 = 1)) AND (table_1.column_2 = table_1.column_36)) GROUP BY table_1.column_2, table_1.column_2, table_1.column_2
----
1.0000
1
1
1

query  nosort
SELECT avg(table_1.column_37) AS alias_1, table_1.column_2 AS alias_2, table_1.column_2 AS alias_3, table_1.column_2 AS alias_4 FROM table_1 WHERE (((table_1.column_2 = 1) OR (table_1.column_2 = 1)) OR (table_1.column_2 = table_1.column_38)) GROUP BY table_1.column_2, table_1.column_2, table_1.column_2
----
1.0000
1
1
1

query  nosort
SELECT avg(table_1.column_39) AS alias_1, table_1.column_2 AS alias_2, table_1.column_2 AS alias_3, table_1.column_2 AS alias_4 FROM table_1 WHERE (((table_1.column_2 = 1) AND (table_1.column_2 = table_1.column_40)) OR (table_1.column_2 = table_1.column_41)) GROUP BY table_1.column_2, table_1.column_2, table_1.column_2
----
1.0000
1
1
1

query  nosort
SELECT avg(table_1.column_42) AS alias_1, table_1.column_2 AS alias_2, table_1.column_2 AS alias_3, table_1.column_2 AS alias_4 FROM table_1 WHERE (((table_1.column_2 = 1) AND (table_1.column_2 = table_1.column_43)) OR (table_1.column_2 = table_1.column_44)) GROUP BY table_1.column_2, table_1.column_2, table_1.column_2
----
1.0000
1
1
1

query  nosort
SELECT table_1.column_2 AS alias_1, table_1.column_2 AS alias_2, table_1.column_2 AS alias_3, table_1.column_2 AS alias_4 FROM table_1 WHERE ((((table_1.column_2 = 1) OR (table_1.column_2 = 1)) AND (table_1.column_2 = table_1.column_45)) OR (table_1.column_2 = table_1.column_46))
----
1
1
1
1
1
1
1
1
1
1
1
1
1
1
1
1
1
1
1
1

query  nosort
SELECT avg(table_1.column_47) AS alias_1, table_1.column_2 AS alias_2, table_1.column_2 AS alias_3, table_1.column_2 AS alias_4, table_1.column_2 AS alias_5 FROM table_1 WHERE ((((table_1.column_2 = 1) OR (table_1.column_2 = 1)) AND (table_1.column_2 = table_1.column_48)) OR (table_1.column_2 = table_1.column_49)) GROUP BY table_1.column_2, table_1.column_2, table_1.column_2, table_1.column_2
----
1.0000
1
1
1
1

statement ok
DELETE FROM table_1 WHERE (column_50 = 2)


statement ok
DELETE FROM table_1 WHERE (column_50 = 3)


query  nosort
SELECT avg(table_1.column_1) AS alias_1 FROM table_1
----
1.0000

query  nosort
SELECT table_1.column_2 AS alias_1 FROM table_1 WHERE (table_1.column_2 = 1)
----
1
1
1

query  nosort
SELECT table_1.column_2 AS alias_1 FROM table_1 WHERE (table_1.column_2 = 1)
----
1
1
1

query  nosort
SELECT table_1.column_2 AS alias_1 FROM table_1 WHERE (table_1.column_2 = table_1.column_3)
----
1
1
1

query  nosort
SELECT table_1.column_2 AS alias_1 FROM table_1 WHERE (table_1.column_2 = table_1.column_4)
----
1
1
1

query  nosort
SELECT avg(table_1.column_5) AS alias_1, table_1.column_2 AS alias_2 FROM table_1 WHERE (table_1.column_2 = 1) GROUP BY table_1.column_2
----
1.0000
1

query  nosort
SELECT avg(table_1.column_6) AS alias_1, table_1.column_2 AS alias_2 FROM table_1 WHERE (table_1.column_2 = 1) GROUP BY table_1.column_2
----
1.0000
1

query  nosort
SELECT avg(table_1.column_7) AS alias_1, table_1.column_2 AS alias_2 FROM table_1 WHERE (table_1.column_2 = table_1.column_8) GROUP BY table_1.column_2
----
1.0000
1

query  nosort
SELECT avg(table_1.column_9) AS alias_1, table_1.column_2 AS alias_2 FROM table_1 WHERE (table_1.column_2 = table_1.column_10) GROUP BY table_1.column_2
----
1.0000
1

query  nosort
SELECT table_1.column_2 AS alias_1, table_1.column_2 AS alias_2 FROM table_1 WHERE ((table_1.column_2 = 1) OR (table_1.column_2 = 1))
----
1
1
1
1
1
1

query  nosort
SELECT table_1.column_2 AS alias_1, table_1.column_2 AS alias_2 FROM table_1 WHERE ((table_1.column_2 = 1) AND (table_1.column_2 = table_1.column_11))
----
1
1
1
1
1
1

query  nosort
SELECT table_1.column_2 AS alias_1, table_1.column_2 AS alias_2 FROM table_1 WHERE ((table_1.column_2 = 1) OR (table_1.column_2 = table_1.column_12))
----
1
1
1
1
1
1

query  nosort
SELECT table_1.column_2 AS alias_1, table_1.column_2 AS alias_2 FROM table_1 WHERE ((table_1.column_2 = 1) AND (table_1.column_2 = table_1.column_13))
----
1
1
1
1
1
1

query  nosort
SELECT table_1.column_2 AS alias_1, table_1.column_2 AS alias_2 FROM table_1 WHERE ((table_1.column_2 = 1) OR (table_1.column_2 = table_1.column_14))
----
1
1
1
1
1
1

query  nosort
SELECT table_1.column_2 AS alias_1, table_1.column_2 AS alias_2 FROM table_1 WHERE ((table_1.column_2 = table_1.column_15) OR (table_1.column_2 = table_1.column_16))
----
1
1
1
1
1
1

query  nosort
SELECT avg(table_1.column_17) AS alias_1, table_1.column_2 AS alias_2, table_1.column_2 AS alias_3 FROM table_1 WHERE ((table_1.column_2 = 1) OR (table_1.column_2 = 1)) GROUP BY table_1.column_2, table_1.column_2
----
1.0000
1
1

query  nosort
SELECT avg(table_1.column_18) AS alias_1, table_1.column_2 AS alias_2, table_1.column_2 AS alias_3 FROM table_1 WHERE ((table_1.column_2 = 1) AND (table_1.column_2 = table_1.column_19)) GROUP BY table_1.column_2, table_1.column_2
----
1.0000
1
1

query  nosort
SELECT avg(table_1.column_20) AS alias_1, table_1.column_2 AS alias_2, table_1.column_2 AS alias_3 FROM table_1 WHERE ((table_1.column_2 = 1) OR (table_1.column_2 = table_1.column_21)) GROUP BY table_1.column_2, table_1.column_2
----
1.0000
1
1

query  nosort
SELECT avg(table_1.column_22) AS alias_1, table_1.column_2 AS alias_2, table_1.column_2 AS alias_3 FROM table_1 WHERE ((table_1.column_2 = 1) AND (table_1.column_2 = table_1.column_23)) GROUP BY table_1.column_2, table_1.column_2
----
1.0000
1
1

query  nosort
SELECT avg(table_1.column_24) AS alias_1, table_1.column_2 AS alias_2, table_1.column_2 AS alias_3 FROM table_1 WHERE ((table_1.column_2 = 1) OR (table_1.column_2 = table_1.column_25)) GROUP BY table_1.column_2, table_1.column_2
----
1.0000
1
1

query  nosort
SELECT avg(table_1.column_26) AS alias_1, table_1.column_2 AS alias_2, table_1.column_2 AS alias_3 FROM table_1 WHERE ((table_1.column_2 = table_1.column_27) OR (table_1.column_2 = table_1.column_28)) GROUP BY table_1.column_2, table_1.column_2
----
1.0000
1
1

query  nosort
SELECT table_1.column_2 AS alias_1, table_1.column_2 AS alias_2, table_1.column_2 AS alias_3 FROM table_1 WHERE (((table_1.column_2 = 1) OR (table_1.column_2 = 1)) AND (table_1.column_2 = table_1.column_29))
----
1
1
1
1
1
1
1
1
1

query  nosort
SELECT table_1.column_2 AS alias_1, table_1.column_2 AS alias_2, table_1.column_2 AS alias_3 FROM table_1 WHERE (((table_1.column_2 = 1) OR (table_1.column_2 = 1)) OR (table_1.column_2 = table_1.column_30))
----
1
1
1
1
1
1
1
1
1

query  nosort
SELECT table_1.column_2 AS alias_1, table_1.column_2 AS alias_2, table_1.column_2 AS alias_3 FROM table_1 WHERE (((table_1.column_2 = 1) AND (table_1.column_2 = table_1.column_31)) OR (table_1.column_2 = table_1.column_32))
----
1
1
1
1
1
1
1
1
1

query  nosort
SELECT table_1.column_2 AS alias_1, table_1.column_2 AS alias_2, table_1.column_2 AS alias_3 FROM table_1 WHERE (((table_1.column_2 = 1) AND (table_1.column_2 = table_1.column_33)) OR (table_1.column_2 = table_1.column_34))
----
1
1
1
1
1
1
1
1
1

query  nosort
SELECT avg(table_1.column_35) AS alias_1, table_1.column_2 AS alias_2, table_1.column_2 AS alias_3, table_1.column_2 AS alias_4 FROM table_1 WHERE (((table_1.column_2 = 1) OR (table_1.column_2 = 1)) AND (table_1.column_2 = table_1.column_36)) GROUP BY table_1.column_2, table_1.column_2, table_1.column_2
----
1.0000
1
1
1

query  nosort
SELECT avg(table_1.column_37) AS alias_1, table_1.column_2 AS alias_2, table_1.column_2 AS alias_3, table_1.column_2 AS alias_4 FROM table_1 WHERE (((table_1.column_2 = 1) OR (table_1.column_2 = 1)) OR (table_1.column_2 = table_1.column_38)) GROUP BY table_1.column_2, table_1.column_2, table_1.column_2
----
1.0000
1
1
1

query  nosort
SELECT avg(table_1.column_39) AS alias_1, table_1.column_2 AS alias_2, table_1.column_2 AS alias_3, table_1.column_2 AS alias_4 FROM table_1 WHERE (((table_1.column_2 = 1) AND (table_1.column_2 = table_1.column_40)) OR (table_1.column_2 = table_1.column_41)) GROUP BY table_1.column_2, table_1.column_2, table_1.column_2
----
1.0000
1
1
1

query  nosort
SELECT avg(table_1.column_42) AS alias_1, table_1.column_2 AS alias_2, table_1.column_2 AS alias_3, table_1.column_2 AS alias_4 FROM table_1 WHERE (((table_1.column_2 = 1) AND (table_1.column_2 = table_1.column_43)) OR (table_1.column_2 = table_1.column_44)) GROUP BY table_1.column_2, table_1.column_2, table_1.column_2
----
1.0000
1
1
1

query  nosort
SELECT table_1.column_2 AS alias_1, table_1.column_2 AS alias_2, table_1.column_2 AS alias_3, table_1.column_2 AS alias_4 FROM table_1 WHERE ((((table_1.column_2 = 1) OR (table_1.column_2 = 1)) AND (table_1.column_2 = table_1.column_45)) OR (table_1.column_2 = table_1.column_46))
----
1
1
1
1
1
1
1
1
1
1
1
1

query  nosort
SELECT avg(table_1.column_47) AS alias_1, table_1.column_2 AS alias_2, table_1.column_2 AS alias_3, table_1.column_2 AS alias_4, table_1.column_2 AS alias_5 FROM table_1 WHERE ((((table_1.column_2 = 1) OR (table_1.column_2 = 1)) AND (table_1.column_2 = table_1.column_48)) OR (table_1.column_2 = table_1.column_49)) GROUP BY table_1.column_2, table_1.column_2, table_1.column_2, table_1.column_2
----
1.0000
1
1
1
1
