# Generated by:
#     target/debug/noria-logictest generate --operations between_filters,distinct --compare-to mysql://root@localhost/mysql --subquery-depth 1 --rows-per-table 5 -o logictests/generated/between_filters,distinct.test --include-deletes
# failure: ENG-257

statement ok
CREATE TABLE table_1 (column_1 INT(1), column_2 INT(32), PRIMARY KEY (column_2))


statement ok
INSERT INTO table_1 (column_1, column_2) VALUES (1, 2), (1, 3), (1, 4), (1, 5), (1, 6)


query  nosort
SELECT table_1.column_1 AS alias_1 FROM table_1 WHERE table_1.column_1 NOT BETWEEN 1 AND 5
----


query  nosort
SELECT table_1.column_1 AS alias_1 FROM table_1 WHERE table_1.column_1 BETWEEN 1 AND 5
----
1
1
1
1
1

query  nosort
SELECT table_1.column_1 AS alias_1 FROM table_1 WHERE table_1.column_1 NOT BETWEEN 1 AND 5
----


query  nosort
SELECT table_1.column_1 AS alias_1 FROM table_1 WHERE table_1.column_1 BETWEEN 1 AND 5
----
1
1
1
1
1

query  nosort
SELECT DISTINCT table_1.column_1 AS alias_1 FROM table_1
----
1

query  nosort
SELECT table_1.column_1 AS alias_1, table_1.column_1 AS alias_2 FROM table_1 WHERE (table_1.column_1 NOT BETWEEN 1 AND 5 AND table_1.column_1 BETWEEN 1 AND 5)
----


query  nosort
SELECT table_1.column_1 AS alias_1, table_1.column_1 AS alias_2 FROM table_1 WHERE (table_1.column_1 NOT BETWEEN 1 AND 5 OR table_1.column_1 NOT BETWEEN 1 AND 5)
----


query  nosort
SELECT table_1.column_1 AS alias_1, table_1.column_1 AS alias_2 FROM table_1 WHERE (table_1.column_1 NOT BETWEEN 1 AND 5 OR table_1.column_1 BETWEEN 1 AND 5)
----
1
1
1
1
1
1
1
1
1
1

query  nosort
SELECT DISTINCT table_1.column_1 AS alias_1 FROM table_1 WHERE table_1.column_1 NOT BETWEEN 1 AND 5
----


query  nosort
SELECT table_1.column_1 AS alias_1, table_1.column_1 AS alias_2 FROM table_1 WHERE (table_1.column_1 BETWEEN 1 AND 5 OR table_1.column_1 NOT BETWEEN 1 AND 5)
----
1
1
1
1
1
1
1
1
1
1

query  nosort
SELECT table_1.column_1 AS alias_1, table_1.column_1 AS alias_2 FROM table_1 WHERE (table_1.column_1 BETWEEN 1 AND 5 OR table_1.column_1 BETWEEN 1 AND 5)
----
1
1
1
1
1
1
1
1
1
1

query  nosort
SELECT DISTINCT table_1.column_1 AS alias_1 FROM table_1 WHERE table_1.column_1 BETWEEN 1 AND 5
----
1

query  nosort
SELECT table_1.column_1 AS alias_1, table_1.column_1 AS alias_2 FROM table_1 WHERE (table_1.column_1 NOT BETWEEN 1 AND 5 OR table_1.column_1 BETWEEN 1 AND 5)
----
1
1
1
1
1
1
1
1
1
1

query  nosort
SELECT DISTINCT table_1.column_1 AS alias_1 FROM table_1 WHERE table_1.column_1 NOT BETWEEN 1 AND 5
----


query  nosort
SELECT DISTINCT table_1.column_1 AS alias_1 FROM table_1 WHERE table_1.column_1 BETWEEN 1 AND 5
----
1

query  nosort
SELECT table_1.column_1 AS alias_1, table_1.column_1 AS alias_2, table_1.column_1 AS alias_3 FROM table_1 WHERE ((table_1.column_1 NOT BETWEEN 1 AND 5 AND table_1.column_1 BETWEEN 1 AND 5) OR table_1.column_1 NOT BETWEEN 1 AND 5)
----


query  nosort
SELECT table_1.column_1 AS alias_1, table_1.column_1 AS alias_2, table_1.column_1 AS alias_3 FROM table_1 WHERE ((table_1.column_1 NOT BETWEEN 1 AND 5 AND table_1.column_1 BETWEEN 1 AND 5) OR table_1.column_1 BETWEEN 1 AND 5)
----
1
1
1
1
1
1
1
1
1
1
1
1
1
1
1

query  nosort
SELECT DISTINCT table_1.column_1 AS alias_1, table_1.column_1 AS alias_2 FROM table_1 WHERE (table_1.column_1 NOT BETWEEN 1 AND 5 AND table_1.column_1 BETWEEN 1 AND 5)
----


query  nosort
SELECT table_1.column_1 AS alias_1, table_1.column_1 AS alias_2, table_1.column_1 AS alias_3 FROM table_1 WHERE ((table_1.column_1 NOT BETWEEN 1 AND 5 OR table_1.column_1 NOT BETWEEN 1 AND 5) OR table_1.column_1 BETWEEN 1 AND 5)
----
1
1
1
1
1
1
1
1
1
1
1
1
1
1
1

query  nosort
SELECT DISTINCT table_1.column_1 AS alias_1, table_1.column_1 AS alias_2 FROM table_1 WHERE (table_1.column_1 NOT BETWEEN 1 AND 5 OR table_1.column_1 NOT BETWEEN 1 AND 5)
----


query  nosort
SELECT DISTINCT table_1.column_1 AS alias_1, table_1.column_1 AS alias_2 FROM table_1 WHERE (table_1.column_1 NOT BETWEEN 1 AND 5 OR table_1.column_1 BETWEEN 1 AND 5)
----
1
1

query  nosort
SELECT table_1.column_1 AS alias_1, table_1.column_1 AS alias_2, table_1.column_1 AS alias_3 FROM table_1 WHERE ((table_1.column_1 BETWEEN 1 AND 5 OR table_1.column_1 NOT BETWEEN 1 AND 5) OR table_1.column_1 BETWEEN 1 AND 5)
----
1
1
1
1
1
1
1
1
1
1
1
1
1
1
1

query  nosort
SELECT DISTINCT table_1.column_1 AS alias_1, table_1.column_1 AS alias_2 FROM table_1 WHERE (table_1.column_1 BETWEEN 1 AND 5 OR table_1.column_1 NOT BETWEEN 1 AND 5)
----
1
1

query  nosort
SELECT DISTINCT table_1.column_1 AS alias_1, table_1.column_1 AS alias_2 FROM table_1 WHERE (table_1.column_1 BETWEEN 1 AND 5 OR table_1.column_1 BETWEEN 1 AND 5)
----
1
1

query  nosort
SELECT DISTINCT table_1.column_1 AS alias_1, table_1.column_1 AS alias_2 FROM table_1 WHERE (table_1.column_1 NOT BETWEEN 1 AND 5 OR table_1.column_1 BETWEEN 1 AND 5)
----
1
1

query  nosort
SELECT table_1.column_1 AS alias_1, table_1.column_1 AS alias_2, table_1.column_1 AS alias_3, table_1.column_1 AS alias_4 FROM table_1 WHERE (((table_1.column_1 NOT BETWEEN 1 AND 5 AND table_1.column_1 BETWEEN 1 AND 5) OR table_1.column_1 NOT BETWEEN 1 AND 5) OR table_1.column_1 BETWEEN 1 AND 5)
----
1
1
1
1
1
1
1
1
1
1
1
1
1
1
1
1
1
1
1
1

query  nosort
SELECT DISTINCT table_1.column_1 AS alias_1, table_1.column_1 AS alias_2, table_1.column_1 AS alias_3 FROM table_1 WHERE ((table_1.column_1 NOT BETWEEN 1 AND 5 AND table_1.column_1 BETWEEN 1 AND 5) OR table_1.column_1 NOT BETWEEN 1 AND 5)
----


query  nosort
SELECT DISTINCT table_1.column_1 AS alias_1, table_1.column_1 AS alias_2, table_1.column_1 AS alias_3 FROM table_1 WHERE ((table_1.column_1 NOT BETWEEN 1 AND 5 AND table_1.column_1 BETWEEN 1 AND 5) OR table_1.column_1 BETWEEN 1 AND 5)
----
1
1
1

query  nosort
SELECT DISTINCT table_1.column_1 AS alias_1, table_1.column_1 AS alias_2, table_1.column_1 AS alias_3 FROM table_1 WHERE ((table_1.column_1 NOT BETWEEN 1 AND 5 OR table_1.column_1 NOT BETWEEN 1 AND 5) OR table_1.column_1 BETWEEN 1 AND 5)
----
1
1
1

query  nosort
SELECT DISTINCT table_1.column_1 AS alias_1, table_1.column_1 AS alias_2, table_1.column_1 AS alias_3 FROM table_1 WHERE ((table_1.column_1 BETWEEN 1 AND 5 OR table_1.column_1 NOT BETWEEN 1 AND 5) OR table_1.column_1 BETWEEN 1 AND 5)
----
1
1
1

query  nosort
SELECT DISTINCT table_1.column_1 AS alias_1, table_1.column_1 AS alias_2, table_1.column_1 AS alias_3, table_1.column_1 AS alias_4 FROM table_1 WHERE (((table_1.column_1 NOT BETWEEN 1 AND 5 AND table_1.column_1 BETWEEN 1 AND 5) OR table_1.column_1 NOT BETWEEN 1 AND 5) OR table_1.column_1 BETWEEN 1 AND 5)
----
1
1
1
1

statement ok
DELETE FROM table_1 WHERE (column_2 = 2)


statement ok
DELETE FROM table_1 WHERE (column_2 = 3)


query  nosort
SELECT table_1.column_1 AS alias_1 FROM table_1 WHERE table_1.column_1 NOT BETWEEN 1 AND 5
----


query  nosort
SELECT table_1.column_1 AS alias_1 FROM table_1 WHERE table_1.column_1 BETWEEN 1 AND 5
----
1
1
1

query  nosort
SELECT table_1.column_1 AS alias_1 FROM table_1 WHERE table_1.column_1 NOT BETWEEN 1 AND 5
----


query  nosort
SELECT table_1.column_1 AS alias_1 FROM table_1 WHERE table_1.column_1 BETWEEN 1 AND 5
----
1
1
1

query  nosort
SELECT DISTINCT table_1.column_1 AS alias_1 FROM table_1
----
1

query  nosort
SELECT table_1.column_1 AS alias_1, table_1.column_1 AS alias_2 FROM table_1 WHERE (table_1.column_1 NOT BETWEEN 1 AND 5 AND table_1.column_1 BETWEEN 1 AND 5)
----


query  nosort
SELECT table_1.column_1 AS alias_1, table_1.column_1 AS alias_2 FROM table_1 WHERE (table_1.column_1 NOT BETWEEN 1 AND 5 OR table_1.column_1 NOT BETWEEN 1 AND 5)
----


query  nosort
SELECT table_1.column_1 AS alias_1, table_1.column_1 AS alias_2 FROM table_1 WHERE (table_1.column_1 NOT BETWEEN 1 AND 5 OR table_1.column_1 BETWEEN 1 AND 5)
----
1
1
1
1
1
1

query  nosort
SELECT DISTINCT table_1.column_1 AS alias_1 FROM table_1 WHERE table_1.column_1 NOT BETWEEN 1 AND 5
----


query  nosort
SELECT table_1.column_1 AS alias_1, table_1.column_1 AS alias_2 FROM table_1 WHERE (table_1.column_1 BETWEEN 1 AND 5 OR table_1.column_1 NOT BETWEEN 1 AND 5)
----
1
1
1
1
1
1

query  nosort
SELECT table_1.column_1 AS alias_1, table_1.column_1 AS alias_2 FROM table_1 WHERE (table_1.column_1 BETWEEN 1 AND 5 OR table_1.column_1 BETWEEN 1 AND 5)
----
1
1
1
1
1
1

query  nosort
SELECT DISTINCT table_1.column_1 AS alias_1 FROM table_1 WHERE table_1.column_1 BETWEEN 1 AND 5
----
1

query  nosort
SELECT table_1.column_1 AS alias_1, table_1.column_1 AS alias_2 FROM table_1 WHERE (table_1.column_1 NOT BETWEEN 1 AND 5 OR table_1.column_1 BETWEEN 1 AND 5)
----
1
1
1
1
1
1

query  nosort
SELECT DISTINCT table_1.column_1 AS alias_1 FROM table_1 WHERE table_1.column_1 NOT BETWEEN 1 AND 5
----


query  nosort
SELECT DISTINCT table_1.column_1 AS alias_1 FROM table_1 WHERE table_1.column_1 BETWEEN 1 AND 5
----
1

query  nosort
SELECT table_1.column_1 AS alias_1, table_1.column_1 AS alias_2, table_1.column_1 AS alias_3 FROM table_1 WHERE ((table_1.column_1 NOT BETWEEN 1 AND 5 AND table_1.column_1 BETWEEN 1 AND 5) OR table_1.column_1 NOT BETWEEN 1 AND 5)
----


query  nosort
SELECT table_1.column_1 AS alias_1, table_1.column_1 AS alias_2, table_1.column_1 AS alias_3 FROM table_1 WHERE ((table_1.column_1 NOT BETWEEN 1 AND 5 AND table_1.column_1 BETWEEN 1 AND 5) OR table_1.column_1 BETWEEN 1 AND 5)
----
1
1
1
1
1
1
1
1
1

query  nosort
SELECT DISTINCT table_1.column_1 AS alias_1, table_1.column_1 AS alias_2 FROM table_1 WHERE (table_1.column_1 NOT BETWEEN 1 AND 5 AND table_1.column_1 BETWEEN 1 AND 5)
----


query  nosort
SELECT table_1.column_1 AS alias_1, table_1.column_1 AS alias_2, table_1.column_1 AS alias_3 FROM table_1 WHERE ((table_1.column_1 NOT BETWEEN 1 AND 5 OR table_1.column_1 NOT BETWEEN 1 AND 5) OR table_1.column_1 BETWEEN 1 AND 5)
----
1
1
1
1
1
1
1
1
1

query  nosort
SELECT DISTINCT table_1.column_1 AS alias_1, table_1.column_1 AS alias_2 FROM table_1 WHERE (table_1.column_1 NOT BETWEEN 1 AND 5 OR table_1.column_1 NOT BETWEEN 1 AND 5)
----


query  nosort
SELECT DISTINCT table_1.column_1 AS alias_1, table_1.column_1 AS alias_2 FROM table_1 WHERE (table_1.column_1 NOT BETWEEN 1 AND 5 OR table_1.column_1 BETWEEN 1 AND 5)
----
1
1

query  nosort
SELECT table_1.column_1 AS alias_1, table_1.column_1 AS alias_2, table_1.column_1 AS alias_3 FROM table_1 WHERE ((table_1.column_1 BETWEEN 1 AND 5 OR table_1.column_1 NOT BETWEEN 1 AND 5) OR table_1.column_1 BETWEEN 1 AND 5)
----
1
1
1
1
1
1
1
1
1

query  nosort
SELECT DISTINCT table_1.column_1 AS alias_1, table_1.column_1 AS alias_2 FROM table_1 WHERE (table_1.column_1 BETWEEN 1 AND 5 OR table_1.column_1 NOT BETWEEN 1 AND 5)
----
1
1

query  nosort
SELECT DISTINCT table_1.column_1 AS alias_1, table_1.column_1 AS alias_2 FROM table_1 WHERE (table_1.column_1 BETWEEN 1 AND 5 OR table_1.column_1 BETWEEN 1 AND 5)
----
1
1

query  nosort
SELECT DISTINCT table_1.column_1 AS alias_1, table_1.column_1 AS alias_2 FROM table_1 WHERE (table_1.column_1 NOT BETWEEN 1 AND 5 OR table_1.column_1 BETWEEN 1 AND 5)
----
1
1

query  nosort
SELECT table_1.column_1 AS alias_1, table_1.column_1 AS alias_2, table_1.column_1 AS alias_3, table_1.column_1 AS alias_4 FROM table_1 WHERE (((table_1.column_1 NOT BETWEEN 1 AND 5 AND table_1.column_1 BETWEEN 1 AND 5) OR table_1.column_1 NOT BETWEEN 1 AND 5) OR table_1.column_1 BETWEEN 1 AND 5)
----
1
1
1
1
1
1
1
1
1
1
1
1

query  nosort
SELECT DISTINCT table_1.column_1 AS alias_1, table_1.column_1 AS alias_2, table_1.column_1 AS alias_3 FROM table_1 WHERE ((table_1.column_1 NOT BETWEEN 1 AND 5 AND table_1.column_1 BETWEEN 1 AND 5) OR table_1.column_1 NOT BETWEEN 1 AND 5)
----


query  nosort
SELECT DISTINCT table_1.column_1 AS alias_1, table_1.column_1 AS alias_2, table_1.column_1 AS alias_3 FROM table_1 WHERE ((table_1.column_1 NOT BETWEEN 1 AND 5 AND table_1.column_1 BETWEEN 1 AND 5) OR table_1.column_1 BETWEEN 1 AND 5)
----
1
1
1

query  nosort
SELECT DISTINCT table_1.column_1 AS alias_1, table_1.column_1 AS alias_2, table_1.column_1 AS alias_3 FROM table_1 WHERE ((table_1.column_1 NOT BETWEEN 1 AND 5 OR table_1.column_1 NOT BETWEEN 1 AND 5) OR table_1.column_1 BETWEEN 1 AND 5)
----
1
1
1

query  nosort
SELECT DISTINCT table_1.column_1 AS alias_1, table_1.column_1 AS alias_2, table_1.column_1 AS alias_3 FROM table_1 WHERE ((table_1.column_1 BETWEEN 1 AND 5 OR table_1.column_1 NOT BETWEEN 1 AND 5) OR table_1.column_1 BETWEEN 1 AND 5)
----
1
1
1

query  nosort
SELECT DISTINCT table_1.column_1 AS alias_1, table_1.column_1 AS alias_2, table_1.column_1 AS alias_3, table_1.column_1 AS alias_4 FROM table_1 WHERE (((table_1.column_1 NOT BETWEEN 1 AND 5 AND table_1.column_1 BETWEEN 1 AND 5) OR table_1.column_1 NOT BETWEEN 1 AND 5) OR table_1.column_1 BETWEEN 1 AND 5)
----
1
1
1
1
