# Generated by:
#     target/debug/noria-logictest generate --operations between_filters,inner_join --compare-to mysql://root@localhost/mysql --subquery-depth 1 --rows-per-table 5 -o logictests/generated/between_filters,inner_join.test --include-deletes
# failure: ENG-257

statement ok
CREATE TABLE table_9 (column_2 INT(32), column_7 INT(32), column_8 INT(32), column_1 INT(32), column_3 INT(1), column_10 INT(32), column_5 INT(32), column_4 INT(32), column_12 INT(32), column_6 INT(32), column_11 INT(32), column_9 INT(32), PRIMARY KEY (column_12))


statement ok
CREATE TABLE table_2 (column_6 INT(32), column_3 INT(1), column_1 INT(32), column_7 INT(32), column_5 INT(32), column_4 INT(32), column_2 INT(32), PRIMARY KEY (column_7))


statement ok
CREATE TABLE table_17 (column_1 INT(32), column_2 INT(32), column_3 INT(32), PRIMARY KEY (column_3))


statement ok
CREATE TABLE table_1 (column_2 INT(32), column_3 INT(32), column_1 INT(1), column_4 INT(32), PRIMARY KEY (column_4))


statement ok
CREATE TABLE table_5 (column_3 INT(1), column_5 INT(32), column_6 INT(32), column_7 INT(32), column_4 INT(32), column_1 INT(32), column_2 INT(32), PRIMARY KEY (column_7))


statement ok
CREATE TABLE table_8 (column_1 INT(32), column_3 INT(32), column_2 INT(32), PRIMARY KEY (column_3))


statement ok
CREATE TABLE table_12 (column_1 INT(32), column_2 INT(32), column_3 INT(32), PRIMARY KEY (column_3))


statement ok
CREATE TABLE table_11 (column_1 INT(32), column_2 INT(32), column_3 INT(32), PRIMARY KEY (column_3))


statement ok
CREATE TABLE table_3 (column_2 INT(32), column_1 INT(32), column_5 INT(32), column_3 INT(1), column_4 INT(32), PRIMARY KEY (column_5))


statement ok
CREATE TABLE table_15 (column_1 INT(32), column_3 INT(32), column_2 INT(32), PRIMARY KEY (column_3))


statement ok
CREATE TABLE table_16 (column_3 INT(32), column_2 INT(32), column_1 INT(32), PRIMARY KEY (column_3))


statement ok
CREATE TABLE table_7 (column_1 INT(32), column_2 INT(32), column_3 INT(32), PRIMARY KEY (column_3))


statement ok
CREATE TABLE table_13 (column_3 INT(32), column_2 INT(32), column_1 INT(32), PRIMARY KEY (column_3))


statement ok
CREATE TABLE table_4 (column_1 INT(32), column_3 INT(32), column_2 INT(32), PRIMARY KEY (column_3))


statement ok
CREATE TABLE table_6 (column_1 INT(32), column_2 INT(32), column_3 INT(32), PRIMARY KEY (column_3))


statement ok
CREATE TABLE table_14 (column_3 INT(32), column_1 INT(32), column_2 INT(32), PRIMARY KEY (column_3))


statement ok
CREATE TABLE table_10 (column_1 INT(32), column_2 INT(32), column_3 INT(32), PRIMARY KEY (column_3))


statement ok
INSERT INTO table_9 (column_9, column_7, column_2, column_3, column_10, column_4, column_5, column_12, column_1, column_6, column_11, column_8) VALUES (1, 1, 1, 1, 1, 1, 1, 2, 1, 1, 1, 1), (1, 1, 1, 1, 1, 1, 1, 3, 1, 1, 1, 1), (1, 1, 1, 1, 1, 1, 1, 4, 1, 1, 1, 1), (1, 1, 1, 1, 1, 1, 1, 5, 1, 1, 1, 1), (1, 1, 1, 1, 1, 1, 1, 6, 1, 1, 1, 1)


statement ok
INSERT INTO table_2 (column_4, column_3, column_1, column_7, column_6, column_5, column_2) VALUES (1, 1, 1, 2, 1, 1, 1), (1, 1, 1, 3, 1, 1, 1), (1, 1, 1, 4, 1, 1, 1), (1, 1, 1, 5, 1, 1, 1), (1, 1, 1, 6, 1, 1, 1)


statement ok
INSERT INTO table_17 (column_2, column_3, column_1) VALUES (1, 2, 1), (1, 3, 1), (1, 4, 1), (1, 5, 1), (1, 6, 1)


statement ok
INSERT INTO table_1 (column_1, column_4, column_2, column_3) VALUES (1, 2, 1, 1), (1, 3, 1, 1), (1, 4, 1, 1), (1, 5, 1, 1), (1, 6, 1, 1)


statement ok
INSERT INTO table_5 (column_3, column_5, column_4, column_1, column_2, column_7, column_6) VALUES (1, 1, 1, 1, 1, 2, 1), (1, 1, 1, 1, 1, 3, 1), (1, 1, 1, 1, 1, 4, 1), (1, 1, 1, 1, 1, 5, 1), (1, 1, 1, 1, 1, 6, 1)


statement ok
INSERT INTO table_8 (column_3, column_1, column_2) VALUES (2, 1, 1), (3, 1, 1), (4, 1, 1), (5, 1, 1), (6, 1, 1)


statement ok
INSERT INTO table_12 (column_2, column_3, column_1) VALUES (1, 2, 1), (1, 3, 1), (1, 4, 1), (1, 5, 1), (1, 6, 1)


statement ok
INSERT INTO table_11 (column_1, column_2, column_3) VALUES (1, 1, 2), (1, 1, 3), (1, 1, 4), (1, 1, 5), (1, 1, 6)


statement ok
INSERT INTO table_3 (column_1, column_3, column_4, column_2, column_5) VALUES (1, 1, 1, 1, 2), (1, 1, 1, 1, 3), (1, 1, 1, 1, 4), (1, 1, 1, 1, 5), (1, 1, 1, 1, 6)


statement ok
INSERT INTO table_15 (column_3, column_2, column_1) VALUES (2, 1, 1), (3, 1, 1), (4, 1, 1), (5, 1, 1), (6, 1, 1)


statement ok
INSERT INTO table_16 (column_2, column_1, column_3) VALUES (1, 1, 2), (1, 1, 3), (1, 1, 4), (1, 1, 5), (1, 1, 6)


statement ok
INSERT INTO table_7 (column_1, column_2, column_3) VALUES (1, 1, 2), (1, 1, 3), (1, 1, 4), (1, 1, 5), (1, 1, 6)


statement ok
INSERT INTO table_13 (column_1, column_3, column_2) VALUES (1, 2, 1), (1, 3, 1), (1, 4, 1), (1, 5, 1), (1, 6, 1)


statement ok
INSERT INTO table_4 (column_2, column_1, column_3) VALUES (1, 1, 2), (1, 1, 3), (1, 1, 4), (1, 1, 5), (1, 1, 6)


statement ok
INSERT INTO table_6 (column_1, column_3, column_2) VALUES (1, 2, 1), (1, 3, 1), (1, 4, 1), (1, 5, 1), (1, 6, 1)


statement ok
INSERT INTO table_14 (column_1, column_2, column_3) VALUES (1, 1, 2), (1, 1, 3), (1, 1, 4), (1, 1, 5), (1, 1, 6)


statement ok
INSERT INTO table_10 (column_2, column_1, column_3) VALUES (1, 1, 2), (1, 1, 3), (1, 1, 4), (1, 1, 5), (1, 1, 6)


query  nosort
SELECT table_1.column_1 AS alias_1 FROM table_1 WHERE table_1.column_1 NOT BETWEEN 1 AND 5
----


query  nosort
SELECT table_1.column_1 AS alias_1 FROM table_1 WHERE table_1.column_1 BETWEEN 1 AND 5
----
1
1
1
1
1

query  nosort
SELECT table_1.column_1 AS alias_1 FROM table_1 WHERE table_1.column_1 NOT BETWEEN 1 AND 5
----


query  nosort
SELECT table_1.column_1 AS alias_1 FROM table_1 WHERE table_1.column_1 BETWEEN 1 AND 5
----
1
1
1
1
1

query  nosort
SELECT table_1.column_3 AS alias_1, table_2.column_2 AS alias_2 FROM table_1 INNER JOIN table_2 ON (table_1.column_2 = table_2.column_1)
----
50 values hashing to 1f4709ccf33e9b44d9c58ab63929bdf1

query  nosort
SELECT table_2.column_3 AS alias_1, table_2.column_3 AS alias_2 FROM table_2 WHERE (table_2.column_3 NOT BETWEEN 1 AND 5 AND table_2.column_3 BETWEEN 1 AND 5)
----


query  nosort
SELECT table_2.column_3 AS alias_1, table_2.column_3 AS alias_2 FROM table_2 WHERE (table_2.column_3 NOT BETWEEN 1 AND 5 OR table_2.column_3 NOT BETWEEN 1 AND 5)
----


query  nosort
SELECT table_2.column_3 AS alias_1, table_2.column_3 AS alias_2 FROM table_2 WHERE (table_2.column_3 NOT BETWEEN 1 AND 5 OR table_2.column_3 BETWEEN 1 AND 5)
----
1
1
1
1
1
1
1
1
1
1

query  nosort
SELECT table_2.column_3 AS alias_1, table_2.column_4 AS alias_2, table_3.column_2 AS alias_3 FROM table_2 INNER JOIN table_3 ON (table_2.column_1 = table_3.column_1) WHERE table_2.column_3 NOT BETWEEN 1 AND 5
----


query  nosort
SELECT table_3.column_3 AS alias_1, table_3.column_3 AS alias_2 FROM table_3 WHERE (table_3.column_3 BETWEEN 1 AND 5 OR table_3.column_3 NOT BETWEEN 1 AND 5)
----
1
1
1
1
1
1
1
1
1
1

query  nosort
SELECT table_3.column_3 AS alias_1, table_3.column_3 AS alias_2 FROM table_3 WHERE (table_3.column_3 BETWEEN 1 AND 5 OR table_3.column_3 BETWEEN 1 AND 5)
----
1
1
1
1
1
1
1
1
1
1

query  nosort
SELECT table_3.column_3 AS alias_1, table_3.column_4 AS alias_2, table_4.column_2 AS alias_3 FROM table_3 INNER JOIN table_4 ON (table_3.column_2 = table_4.column_1) WHERE table_3.column_3 BETWEEN 1 AND 5
----
75 values hashing to f7f374e7b867af1aa4821514f1b96d8c

query  nosort
SELECT table_2.column_3 AS alias_1, table_2.column_3 AS alias_2 FROM table_2 WHERE (table_2.column_3 NOT BETWEEN 1 AND 5 OR table_2.column_3 BETWEEN 1 AND 5)
----
1
1
1
1
1
1
1
1
1
1

query  nosort
SELECT table_2.column_3 AS alias_1, table_2.column_5 AS alias_2, table_5.column_2 AS alias_3 FROM table_2 INNER JOIN table_5 ON (table_2.column_1 = table_5.column_1) WHERE table_2.column_3 NOT BETWEEN 1 AND 5
----


query  nosort
SELECT table_5.column_3 AS alias_1, table_5.column_4 AS alias_2, table_6.column_2 AS alias_3 FROM table_5 INNER JOIN table_6 ON (table_5.column_1 = table_6.column_1) WHERE table_5.column_3 BETWEEN 1 AND 5
----
75 values hashing to f7f374e7b867af1aa4821514f1b96d8c

query  nosort
SELECT table_5.column_3 AS alias_1, table_5.column_3 AS alias_2, table_5.column_3 AS alias_3 FROM table_5 WHERE ((table_5.column_3 NOT BETWEEN 1 AND 5 AND table_5.column_3 BETWEEN 1 AND 5) OR table_5.column_3 NOT BETWEEN 1 AND 5)
----


query  nosort
SELECT table_5.column_3 AS alias_1, table_5.column_3 AS alias_2, table_5.column_3 AS alias_3 FROM table_5 WHERE ((table_5.column_3 NOT BETWEEN 1 AND 5 AND table_5.column_3 BETWEEN 1 AND 5) OR table_5.column_3 BETWEEN 1 AND 5)
----
1
1
1
1
1
1
1
1
1
1
1
1
1
1
1

query  nosort
SELECT table_5.column_3 AS alias_1, table_5.column_3 AS alias_2, table_5.column_5 AS alias_3, table_7.column_2 AS alias_4 FROM table_5 INNER JOIN table_7 ON (table_5.column_4 = table_7.column_1) WHERE (table_5.column_3 NOT BETWEEN 1 AND 5 AND table_5.column_3 BETWEEN 1 AND 5)
----


query  nosort
SELECT table_5.column_3 AS alias_1, table_5.column_3 AS alias_2, table_5.column_3 AS alias_3 FROM table_5 WHERE ((table_5.column_3 NOT BETWEEN 1 AND 5 OR table_5.column_3 NOT BETWEEN 1 AND 5) OR table_5.column_3 BETWEEN 1 AND 5)
----
1
1
1
1
1
1
1
1
1
1
1
1
1
1
1

query  nosort
SELECT table_5.column_3 AS alias_1, table_5.column_3 AS alias_2, table_5.column_6 AS alias_3, table_8.column_2 AS alias_4 FROM table_5 INNER JOIN table_8 ON (table_5.column_5 = table_8.column_1) WHERE (table_5.column_3 NOT BETWEEN 1 AND 5 OR table_5.column_3 NOT BETWEEN 1 AND 5)
----


query  nosort
SELECT table_2.column_3 AS alias_1, table_2.column_3 AS alias_2, table_2.column_6 AS alias_3, table_9.column_2 AS alias_4 FROM table_2 INNER JOIN table_9 ON (table_2.column_1 = table_9.column_1) WHERE (table_2.column_3 NOT BETWEEN 1 AND 5 OR table_2.column_3 BETWEEN 1 AND 5)
----
100 values hashing to 2bd4fea509b32167eb41d148e293355c

query  nosort
SELECT table_9.column_3 AS alias_1, table_9.column_3 AS alias_2, table_9.column_3 AS alias_3 FROM table_9 WHERE ((table_9.column_3 BETWEEN 1 AND 5 OR table_9.column_3 NOT BETWEEN 1 AND 5) OR table_9.column_3 BETWEEN 1 AND 5)
----
1
1
1
1
1
1
1
1
1
1
1
1
1
1
1

query  nosort
SELECT table_9.column_3 AS alias_1, table_9.column_3 AS alias_2, table_9.column_4 AS alias_3, table_10.column_2 AS alias_4 FROM table_9 INNER JOIN table_10 ON (table_9.column_2 = table_10.column_1) WHERE (table_9.column_3 BETWEEN 1 AND 5 OR table_9.column_3 NOT BETWEEN 1 AND 5)
----
100 values hashing to 2bd4fea509b32167eb41d148e293355c

query  nosort
SELECT table_9.column_3 AS alias_1, table_9.column_3 AS alias_2, table_9.column_5 AS alias_3, table_11.column_2 AS alias_4 FROM table_9 INNER JOIN table_11 ON (table_9.column_2 = table_11.column_1) WHERE (table_9.column_3 BETWEEN 1 AND 5 OR table_9.column_3 BETWEEN 1 AND 5)
----
100 values hashing to 2bd4fea509b32167eb41d148e293355c

query  nosort
SELECT table_9.column_3 AS alias_1, table_9.column_3 AS alias_2, table_9.column_6 AS alias_3, table_12.column_2 AS alias_4 FROM table_9 INNER JOIN table_12 ON (table_9.column_2 = table_12.column_1) WHERE (table_9.column_3 NOT BETWEEN 1 AND 5 OR table_9.column_3 BETWEEN 1 AND 5)
----
100 values hashing to 2bd4fea509b32167eb41d148e293355c

query  nosort
SELECT table_9.column_3 AS alias_1, table_9.column_3 AS alias_2, table_9.column_3 AS alias_3, table_9.column_3 AS alias_4 FROM table_9 WHERE (((table_9.column_3 NOT BETWEEN 1 AND 5 AND table_9.column_3 BETWEEN 1 AND 5) OR table_9.column_3 NOT BETWEEN 1 AND 5) OR table_9.column_3 BETWEEN 1 AND 5)
----
1
1
1
1
1
1
1
1
1
1
1
1
1
1
1
1
1
1
1
1

query  nosort
SELECT table_9.column_3 AS alias_1, table_9.column_3 AS alias_2, table_9.column_3 AS alias_3, table_9.column_7 AS alias_4, table_13.column_2 AS alias_5 FROM table_9 INNER JOIN table_13 ON (table_9.column_2 = table_13.column_1) WHERE ((table_9.column_3 NOT BETWEEN 1 AND 5 AND table_9.column_3 BETWEEN 1 AND 5) OR table_9.column_3 NOT BETWEEN 1 AND 5)
----


query  nosort
SELECT table_9.column_3 AS alias_1, table_9.column_3 AS alias_2, table_9.column_3 AS alias_3, table_9.column_8 AS alias_4, table_14.column_2 AS alias_5 FROM table_9 INNER JOIN table_14 ON (table_9.column_2 = table_14.column_1) WHERE ((table_9.column_3 NOT BETWEEN 1 AND 5 AND table_9.column_3 BETWEEN 1 AND 5) OR table_9.column_3 BETWEEN 1 AND 5)
----
125 values hashing to 5abf30bf0129095ac01cfe68e7985b65

query  nosort
SELECT table_9.column_3 AS alias_1, table_9.column_3 AS alias_2, table_9.column_3 AS alias_3, table_9.column_9 AS alias_4, table_15.column_2 AS alias_5 FROM table_9 INNER JOIN table_15 ON (table_9.column_2 = table_15.column_1) WHERE ((table_9.column_3 NOT BETWEEN 1 AND 5 OR table_9.column_3 NOT BETWEEN 1 AND 5) OR table_9.column_3 BETWEEN 1 AND 5)
----
125 values hashing to 5abf30bf0129095ac01cfe68e7985b65

query  nosort
SELECT table_9.column_3 AS alias_1, table_9.column_3 AS alias_2, table_9.column_3 AS alias_3, table_9.column_10 AS alias_4, table_16.column_2 AS alias_5 FROM table_9 INNER JOIN table_16 ON (table_9.column_2 = table_16.column_1) WHERE ((table_9.column_3 BETWEEN 1 AND 5 OR table_9.column_3 NOT BETWEEN 1 AND 5) OR table_9.column_3 BETWEEN 1 AND 5)
----
125 values hashing to 5abf30bf0129095ac01cfe68e7985b65

query  nosort
SELECT table_9.column_3 AS alias_1, table_9.column_3 AS alias_2, table_9.column_3 AS alias_3, table_9.column_3 AS alias_4, table_9.column_11 AS alias_5, table_17.column_2 AS alias_6 FROM table_9 INNER JOIN table_17 ON (table_9.column_2 = table_17.column_1) WHERE (((table_9.column_3 NOT BETWEEN 1 AND 5 AND table_9.column_3 BETWEEN 1 AND 5) OR table_9.column_3 NOT BETWEEN 1 AND 5) OR table_9.column_3 BETWEEN 1 AND 5)
----
150 values hashing to 716d82fac06dd2321f904a3662c17ebd

statement ok
DELETE FROM table_9 WHERE (column_12 = 2)


statement ok
DELETE FROM table_9 WHERE (column_12 = 3)


statement ok
DELETE FROM table_2 WHERE (column_7 = 2)


statement ok
DELETE FROM table_2 WHERE (column_7 = 3)


statement ok
DELETE FROM table_17 WHERE (column_3 = 2)


statement ok
DELETE FROM table_17 WHERE (column_3 = 3)


statement ok
DELETE FROM table_1 WHERE (column_4 = 2)


statement ok
DELETE FROM table_1 WHERE (column_4 = 3)


statement ok
DELETE FROM table_5 WHERE (column_7 = 2)


statement ok
DELETE FROM table_5 WHERE (column_7 = 3)


statement ok
DELETE FROM table_8 WHERE (column_3 = 2)


statement ok
DELETE FROM table_8 WHERE (column_3 = 3)


statement ok
DELETE FROM table_12 WHERE (column_3 = 2)


statement ok
DELETE FROM table_12 WHERE (column_3 = 3)


statement ok
DELETE FROM table_11 WHERE (column_3 = 2)


statement ok
DELETE FROM table_11 WHERE (column_3 = 3)


statement ok
DELETE FROM table_3 WHERE (column_5 = 2)


statement ok
DELETE FROM table_3 WHERE (column_5 = 3)


statement ok
DELETE FROM table_15 WHERE (column_3 = 2)


statement ok
DELETE FROM table_15 WHERE (column_3 = 3)


statement ok
DELETE FROM table_16 WHERE (column_3 = 2)


statement ok
DELETE FROM table_16 WHERE (column_3 = 3)


statement ok
DELETE FROM table_7 WHERE (column_3 = 2)


statement ok
DELETE FROM table_7 WHERE (column_3 = 3)


statement ok
DELETE FROM table_13 WHERE (column_3 = 2)


statement ok
DELETE FROM table_13 WHERE (column_3 = 3)


statement ok
DELETE FROM table_4 WHERE (column_3 = 2)


statement ok
DELETE FROM table_4 WHERE (column_3 = 3)


statement ok
DELETE FROM table_6 WHERE (column_3 = 2)


statement ok
DELETE FROM table_6 WHERE (column_3 = 3)


statement ok
DELETE FROM table_14 WHERE (column_3 = 2)


statement ok
DELETE FROM table_14 WHERE (column_3 = 3)


statement ok
DELETE FROM table_10 WHERE (column_3 = 2)


statement ok
DELETE FROM table_10 WHERE (column_3 = 3)


query  nosort
SELECT table_1.column_1 AS alias_1 FROM table_1 WHERE table_1.column_1 NOT BETWEEN 1 AND 5
----


query  nosort
SELECT table_1.column_1 AS alias_1 FROM table_1 WHERE table_1.column_1 BETWEEN 1 AND 5
----
1
1
1

query  nosort
SELECT table_1.column_1 AS alias_1 FROM table_1 WHERE table_1.column_1 NOT BETWEEN 1 AND 5
----


query  nosort
SELECT table_1.column_1 AS alias_1 FROM table_1 WHERE table_1.column_1 BETWEEN 1 AND 5
----
1
1
1

query  nosort
SELECT table_1.column_3 AS alias_1, table_2.column_2 AS alias_2 FROM table_1 INNER JOIN table_2 ON (table_1.column_2 = table_2.column_1)
----
1
1
1
1
1
1
1
1
1
1
1
1
1
1
1
1
1
1

query  nosort
SELECT table_2.column_3 AS alias_1, table_2.column_3 AS alias_2 FROM table_2 WHERE (table_2.column_3 NOT BETWEEN 1 AND 5 AND table_2.column_3 BETWEEN 1 AND 5)
----


query  nosort
SELECT table_2.column_3 AS alias_1, table_2.column_3 AS alias_2 FROM table_2 WHERE (table_2.column_3 NOT BETWEEN 1 AND 5 OR table_2.column_3 NOT BETWEEN 1 AND 5)
----


query  nosort
SELECT table_2.column_3 AS alias_1, table_2.column_3 AS alias_2 FROM table_2 WHERE (table_2.column_3 NOT BETWEEN 1 AND 5 OR table_2.column_3 BETWEEN 1 AND 5)
----
1
1
1
1
1
1

query  nosort
SELECT table_2.column_3 AS alias_1, table_2.column_4 AS alias_2, table_3.column_2 AS alias_3 FROM table_2 INNER JOIN table_3 ON (table_2.column_1 = table_3.column_1) WHERE table_2.column_3 NOT BETWEEN 1 AND 5
----


query  nosort
SELECT table_3.column_3 AS alias_1, table_3.column_3 AS alias_2 FROM table_3 WHERE (table_3.column_3 BETWEEN 1 AND 5 OR table_3.column_3 NOT BETWEEN 1 AND 5)
----
1
1
1
1
1
1

query  nosort
SELECT table_3.column_3 AS alias_1, table_3.column_3 AS alias_2 FROM table_3 WHERE (table_3.column_3 BETWEEN 1 AND 5 OR table_3.column_3 BETWEEN 1 AND 5)
----
1
1
1
1
1
1

query  nosort
SELECT table_3.column_3 AS alias_1, table_3.column_4 AS alias_2, table_4.column_2 AS alias_3 FROM table_3 INNER JOIN table_4 ON (table_3.column_2 = table_4.column_1) WHERE table_3.column_3 BETWEEN 1 AND 5
----
27 values hashing to da8a72a7967c0c73d91239275230aed9

query  nosort
SELECT table_2.column_3 AS alias_1, table_2.column_3 AS alias_2 FROM table_2 WHERE (table_2.column_3 NOT BETWEEN 1 AND 5 OR table_2.column_3 BETWEEN 1 AND 5)
----
1
1
1
1
1
1

query  nosort
SELECT table_2.column_3 AS alias_1, table_2.column_5 AS alias_2, table_5.column_2 AS alias_3 FROM table_2 INNER JOIN table_5 ON (table_2.column_1 = table_5.column_1) WHERE table_2.column_3 NOT BETWEEN 1 AND 5
----


query  nosort
SELECT table_5.column_3 AS alias_1, table_5.column_4 AS alias_2, table_6.column_2 AS alias_3 FROM table_5 INNER JOIN table_6 ON (table_5.column_1 = table_6.column_1) WHERE table_5.column_3 BETWEEN 1 AND 5
----
27 values hashing to da8a72a7967c0c73d91239275230aed9

query  nosort
SELECT table_5.column_3 AS alias_1, table_5.column_3 AS alias_2, table_5.column_3 AS alias_3 FROM table_5 WHERE ((table_5.column_3 NOT BETWEEN 1 AND 5 AND table_5.column_3 BETWEEN 1 AND 5) OR table_5.column_3 NOT BETWEEN 1 AND 5)
----


query  nosort
SELECT table_5.column_3 AS alias_1, table_5.column_3 AS alias_2, table_5.column_3 AS alias_3 FROM table_5 WHERE ((table_5.column_3 NOT BETWEEN 1 AND 5 AND table_5.column_3 BETWEEN 1 AND 5) OR table_5.column_3 BETWEEN 1 AND 5)
----
1
1
1
1
1
1
1
1
1

query  nosort
SELECT table_5.column_3 AS alias_1, table_5.column_3 AS alias_2, table_5.column_5 AS alias_3, table_7.column_2 AS alias_4 FROM table_5 INNER JOIN table_7 ON (table_5.column_4 = table_7.column_1) WHERE (table_5.column_3 NOT BETWEEN 1 AND 5 AND table_5.column_3 BETWEEN 1 AND 5)
----


query  nosort
SELECT table_5.column_3 AS alias_1, table_5.column_3 AS alias_2, table_5.column_3 AS alias_3 FROM table_5 WHERE ((table_5.column_3 NOT BETWEEN 1 AND 5 OR table_5.column_3 NOT BETWEEN 1 AND 5) OR table_5.column_3 BETWEEN 1 AND 5)
----
1
1
1
1
1
1
1
1
1

query  nosort
SELECT table_5.column_3 AS alias_1, table_5.column_3 AS alias_2, table_5.column_6 AS alias_3, table_8.column_2 AS alias_4 FROM table_5 INNER JOIN table_8 ON (table_5.column_5 = table_8.column_1) WHERE (table_5.column_3 NOT BETWEEN 1 AND 5 OR table_5.column_3 NOT BETWEEN 1 AND 5)
----


query  nosort
SELECT table_2.column_3 AS alias_1, table_2.column_3 AS alias_2, table_2.column_6 AS alias_3, table_9.column_2 AS alias_4 FROM table_2 INNER JOIN table_9 ON (table_2.column_1 = table_9.column_1) WHERE (table_2.column_3 NOT BETWEEN 1 AND 5 OR table_2.column_3 BETWEEN 1 AND 5)
----
36 values hashing to 00004f87f1a5ef9c1ae8120ee074bb84

query  nosort
SELECT table_9.column_3 AS alias_1, table_9.column_3 AS alias_2, table_9.column_3 AS alias_3 FROM table_9 WHERE ((table_9.column_3 BETWEEN 1 AND 5 OR table_9.column_3 NOT BETWEEN 1 AND 5) OR table_9.column_3 BETWEEN 1 AND 5)
----
1
1
1
1
1
1
1
1
1

query  nosort
SELECT table_9.column_3 AS alias_1, table_9.column_3 AS alias_2, table_9.column_4 AS alias_3, table_10.column_2 AS alias_4 FROM table_9 INNER JOIN table_10 ON (table_9.column_2 = table_10.column_1) WHERE (table_9.column_3 BETWEEN 1 AND 5 OR table_9.column_3 NOT BETWEEN 1 AND 5)
----
36 values hashing to 00004f87f1a5ef9c1ae8120ee074bb84

query  nosort
SELECT table_9.column_3 AS alias_1, table_9.column_3 AS alias_2, table_9.column_5 AS alias_3, table_11.column_2 AS alias_4 FROM table_9 INNER JOIN table_11 ON (table_9.column_2 = table_11.column_1) WHERE (table_9.column_3 BETWEEN 1 AND 5 OR table_9.column_3 BETWEEN 1 AND 5)
----
36 values hashing to 00004f87f1a5ef9c1ae8120ee074bb84

query  nosort
SELECT table_9.column_3 AS alias_1, table_9.column_3 AS alias_2, table_9.column_6 AS alias_3, table_12.column_2 AS alias_4 FROM table_9 INNER JOIN table_12 ON (table_9.column_2 = table_12.column_1) WHERE (table_9.column_3 NOT BETWEEN 1 AND 5 OR table_9.column_3 BETWEEN 1 AND 5)
----
36 values hashing to 00004f87f1a5ef9c1ae8120ee074bb84

query  nosort
SELECT table_9.column_3 AS alias_1, table_9.column_3 AS alias_2, table_9.column_3 AS alias_3, table_9.column_3 AS alias_4 FROM table_9 WHERE (((table_9.column_3 NOT BETWEEN 1 AND 5 AND table_9.column_3 BETWEEN 1 AND 5) OR table_9.column_3 NOT BETWEEN 1 AND 5) OR table_9.column_3 BETWEEN 1 AND 5)
----
1
1
1
1
1
1
1
1
1
1
1
1

query  nosort
SELECT table_9.column_3 AS alias_1, table_9.column_3 AS alias_2, table_9.column_3 AS alias_3, table_9.column_7 AS alias_4, table_13.column_2 AS alias_5 FROM table_9 INNER JOIN table_13 ON (table_9.column_2 = table_13.column_1) WHERE ((table_9.column_3 NOT BETWEEN 1 AND 5 AND table_9.column_3 BETWEEN 1 AND 5) OR table_9.column_3 NOT BETWEEN 1 AND 5)
----


query  nosort
SELECT table_9.column_3 AS alias_1, table_9.column_3 AS alias_2, table_9.column_3 AS alias_3, table_9.column_8 AS alias_4, table_14.column_2 AS alias_5 FROM table_9 INNER JOIN table_14 ON (table_9.column_2 = table_14.column_1) WHERE ((table_9.column_3 NOT BETWEEN 1 AND 5 AND table_9.column_3 BETWEEN 1 AND 5) OR table_9.column_3 BETWEEN 1 AND 5)
----
45 values hashing to 930323d678b557f397333f1dc2efed79

query  nosort
SELECT table_9.column_3 AS alias_1, table_9.column_3 AS alias_2, table_9.column_3 AS alias_3, table_9.column_9 AS alias_4, table_15.column_2 AS alias_5 FROM table_9 INNER JOIN table_15 ON (table_9.column_2 = table_15.column_1) WHERE ((table_9.column_3 NOT BETWEEN 1 AND 5 OR table_9.column_3 NOT BETWEEN 1 AND 5) OR table_9.column_3 BETWEEN 1 AND 5)
----
45 values hashing to 930323d678b557f397333f1dc2efed79

query  nosort
SELECT table_9.column_3 AS alias_1, table_9.column_3 AS alias_2, table_9.column_3 AS alias_3, table_9.column_10 AS alias_4, table_16.column_2 AS alias_5 FROM table_9 INNER JOIN table_16 ON (table_9.column_2 = table_16.column_1) WHERE ((table_9.column_3 BETWEEN 1 AND 5 OR table_9.column_3 NOT BETWEEN 1 AND 5) OR table_9.column_3 BETWEEN 1 AND 5)
----
45 values hashing to 930323d678b557f397333f1dc2efed79

query  nosort
SELECT table_9.column_3 AS alias_1, table_9.column_3 AS alias_2, table_9.column_3 AS alias_3, table_9.column_3 AS alias_4, table_9.column_11 AS alias_5, table_17.column_2 AS alias_6 FROM table_9 INNER JOIN table_17 ON (table_9.column_2 = table_17.column_1) WHERE (((table_9.column_3 NOT BETWEEN 1 AND 5 AND table_9.column_3 BETWEEN 1 AND 5) OR table_9.column_3 NOT BETWEEN 1 AND 5) OR table_9.column_3 BETWEEN 1 AND 5)
----
54 values hashing to ad3049ffb0fc76f4c8b8a6e301076ea3
