# Generated by:
#     target/debug/noria-logictest generate --operations count,inner_join,cte --compare-to mysql://root@localhost/mysql --subquery-depth 1 --rows-per-table 5 -o logictests/generated/count,inner_join,cte.test --include-deletes

statement ok
CREATE TABLE table_7 (column_4 INT(32), column_5 INT(32), column_3 INT(32), column_10 INT(32), column_11 INT(32), column_12 INT(32), column_1 INT(32), column_6 INT(32), column_8 INT(32), column_9 INT(32), column_2 INT(32), column_7 INT(32), PRIMARY KEY (column_12))


statement ok
CREATE TABLE table_11 (column_1 INT(32), column_2 INT(32), column_3 INT(32), PRIMARY KEY (column_3))


statement ok
CREATE TABLE table_5 (column_1 INT(32), column_2 INT(32), column_3 INT(32), PRIMARY KEY (column_3))


statement ok
CREATE TABLE table_12 (column_1 INT(32), column_2 INT(32), column_3 INT(32), PRIMARY KEY (column_3))


statement ok
CREATE TABLE table_9 (column_1 INT(32), column_2 INT(32), column_3 INT(32), column_4 INT(32), PRIMARY KEY (column_4))


statement ok
CREATE TABLE table_2 (column_8 INT(32), column_3 INT(32), column_2 INT(32), column_6 INT(32), column_4 INT(32), column_5 INT(32), column_1 INT(32), column_7 INT(32), PRIMARY KEY (column_8))


statement ok
CREATE TABLE table_13 (column_2 INT(32), column_3 INT(32), column_1 INT(32), PRIMARY KEY (column_3))


statement ok
CREATE TABLE table_3 (column_1 INT(32), column_2 INT(32), column_3 INT(32), PRIMARY KEY (column_3))


statement ok
CREATE TABLE table_4 (column_1 INT(32), column_3 INT(32), column_2 INT(32), PRIMARY KEY (column_3))


statement ok
CREATE TABLE table_6 (column_1 INT(32), column_2 INT(32), column_3 INT(32), PRIMARY KEY (column_3))


statement ok
CREATE TABLE table_8 (column_3 INT(32), column_2 INT(32), column_1 INT(32), PRIMARY KEY (column_3))


statement ok
CREATE TABLE table_10 (column_2 INT(32), column_1 INT(32), column_3 INT(32), PRIMARY KEY (column_3))


statement ok
CREATE TABLE table_1 (column_7 INT(32), column_9 INT(32), column_5 INT(32), column_10 INT(32), column_8 INT(32), column_2 INT(32), column_1 INT(32), column_6 INT(32), column_4 INT(32), column_3 INT(32), PRIMARY KEY (column_10))


statement ok
INSERT INTO table_7 (column_6, column_9, column_3, column_4, column_5, column_11, column_7, column_10, column_12, column_1, column_8, column_2) VALUES (1, 1, 1, 1, 1, 1, 1, 1, 2, 1, 1, 1), (1, 1, 1, 1, 1, 1, 1, 1, 3, 1, 1, 1), (1, 1, 1, 1, 1, 1, 1, 1, 4, 1, 1, 1), (1, 1, 1, 1, 1, 1, 1, 1, 5, 1, 1, 1), (1, 1, 1, 1, 1, 1, 1, 1, 6, 1, 1, 1)


statement ok
INSERT INTO table_11 (column_3, column_2, column_1) VALUES (2, 1, 1), (3, 1, 1), (4, 1, 1), (5, 1, 1), (6, 1, 1)


statement ok
INSERT INTO table_5 (column_3, column_1, column_2) VALUES (2, 1, 1), (3, 1, 1), (4, 1, 1), (5, 1, 1), (6, 1, 1)


statement ok
INSERT INTO table_12 (column_3, column_2, column_1) VALUES (2, 1, 1), (3, 1, 1), (4, 1, 1), (5, 1, 1), (6, 1, 1)


statement ok
INSERT INTO table_9 (column_2, column_4, column_1, column_3) VALUES (1, 2, 1, 1), (1, 3, 1, 1), (1, 4, 1, 1), (1, 5, 1, 1), (1, 6, 1, 1)


statement ok
INSERT INTO table_2 (column_4, column_7, column_6, column_1, column_5, column_2, column_8, column_3) VALUES (1, 1, 1, 1, 1, 1, 2, 1), (1, 1, 1, 1, 1, 1, 3, 1), (1, 1, 1, 1, 1, 1, 4, 1), (1, 1, 1, 1, 1, 1, 5, 1), (1, 1, 1, 1, 1, 1, 6, 1)


statement ok
INSERT INTO table_13 (column_2, column_3, column_1) VALUES (1, 2, 1), (1, 3, 1), (1, 4, 1), (1, 5, 1), (1, 6, 1)


statement ok
INSERT INTO table_3 (column_3, column_1, column_2) VALUES (2, 1, 1), (3, 1, 1), (4, 1, 1), (5, 1, 1), (6, 1, 1)


statement ok
INSERT INTO table_4 (column_2, column_1, column_3) VALUES (1, 1, 2), (1, 1, 3), (1, 1, 4), (1, 1, 5), (1, 1, 6)


statement ok
INSERT INTO table_6 (column_1, column_2, column_3) VALUES (1, 1, 2), (1, 1, 3), (1, 1, 4), (1, 1, 5), (1, 1, 6)


statement ok
INSERT INTO table_8 (column_3, column_2, column_1) VALUES (2, 1, 1), (3, 1, 1), (4, 1, 1), (5, 1, 1), (6, 1, 1)


statement ok
INSERT INTO table_10 (column_1, column_3, column_2) VALUES (1, 2, 1), (1, 3, 1), (1, 4, 1), (1, 5, 1), (1, 6, 1)


statement ok
INSERT INTO table_1 (column_3, column_9, column_5, column_10, column_7, column_8, column_2, column_6, column_1, column_4) VALUES (1, 1, 1, 2, 1, 1, 1, 1, 1, 1), (1, 1, 1, 3, 1, 1, 1, 1, 1, 1), (1, 1, 1, 4, 1, 1, 1, 1, 1, 1), (1, 1, 1, 5, 1, 1, 1, 1, 1, 1), (1, 1, 1, 6, 1, 1, 1, 1, 1, 1)


query  nosort
WITH alias_3 AS (SELECT count(table_1.column_2) AS alias_2 FROM table_1) SELECT count(table_1.column_1) AS alias_1 FROM table_1 INNER JOIN alias_3 ON (table_1.column_2 = alias_3.alias_2)
----
0

query  nosort
WITH alias_4 AS (SELECT table_1.column_4 AS alias_2, table_2.column_2 AS alias_3 FROM table_1 INNER JOIN table_2 ON (table_1.column_2 = table_2.column_1)) SELECT count(table_1.column_3) AS alias_1 FROM table_1 INNER JOIN alias_4 ON (table_1.column_2 = alias_4.alias_2)
----
125

query  nosort
WITH alias_5 AS (SELECT count(table_2.column_4) AS alias_2, table_2.column_5 AS alias_3, table_3.column_2 AS alias_4 FROM table_2 INNER JOIN table_3 ON (table_2.column_1 = table_3.column_1) GROUP BY table_2.column_5, table_3.column_2) SELECT count(table_2.column_3) AS alias_1 FROM table_2 INNER JOIN alias_5 ON (table_2.column_1 = alias_5.alias_2)
----
0

query  nosort
WITH alias_4 AS (SELECT count(table_2.column_7) AS alias_3 FROM table_2) SELECT table_2.column_6 AS alias_1, table_4.column_2 AS alias_2 FROM table_2 INNER JOIN table_4 ON (table_2.column_1 = table_4.column_1) INNER JOIN alias_4 ON (table_2.column_6 = alias_4.alias_3)
----


query  nosort
WITH alias_5 AS (SELECT table_1.column_6 AS alias_3, table_6.column_2 AS alias_4 FROM table_1 INNER JOIN table_6 ON (table_1.column_2 = table_6.column_1)) SELECT table_1.column_5 AS alias_1, table_5.column_2 AS alias_2 FROM table_1 INNER JOIN table_5 ON (table_1.column_2 = table_5.column_1) INNER JOIN alias_5 ON (table_1.column_2 = alias_5.alias_3)
----
1250 values hashing to 297e8f72268fc4cf81241309ad0bbfc9

query  nosort
WITH alias_6 AS (SELECT count(table_1.column_8) AS alias_3, table_1.column_9 AS alias_4, table_8.column_2 AS alias_5 FROM table_1 INNER JOIN table_8 ON (table_1.column_7 = table_8.column_1) GROUP BY table_1.column_9, table_8.column_2) SELECT table_1.column_7 AS alias_1, table_7.column_2 AS alias_2 FROM table_1 INNER JOIN table_7 ON (table_1.column_2 = table_7.column_1) INNER JOIN alias_6 ON (table_1.column_7 = alias_6.alias_3)
----


query  nosort
WITH alias_5 AS (SELECT count(table_9.column_3) AS alias_4 FROM table_9) SELECT count(table_7.column_3) AS alias_1, table_7.column_4 AS alias_2, table_9.column_2 AS alias_3 FROM table_7 INNER JOIN table_9 ON (table_7.column_3 = table_9.column_1) INNER JOIN alias_5 ON (table_7.column_4 = alias_5.alias_4) GROUP BY table_7.column_4, table_9.column_2
----


query  nosort
WITH alias_6 AS (SELECT table_7.column_7 AS alias_4, table_11.column_2 AS alias_5 FROM table_7 INNER JOIN table_11 ON (table_7.column_4 = table_11.column_1)) SELECT count(table_7.column_5) AS alias_1, table_7.column_6 AS alias_2, table_10.column_2 AS alias_3 FROM table_7 INNER JOIN table_10 ON (table_7.column_4 = table_10.column_1) INNER JOIN alias_6 ON (table_7.column_4 = alias_6.alias_4) GROUP BY table_7.column_6, table_10.column_2
----
625
1
1

query  nosort
WITH alias_7 AS (SELECT count(table_7.column_10) AS alias_4, table_7.column_11 AS alias_5, table_13.column_2 AS alias_6 FROM table_7 INNER JOIN table_13 ON (table_7.column_4 = table_13.column_1) GROUP BY table_7.column_11, table_13.column_2) SELECT count(table_7.column_8) AS alias_1, table_7.column_9 AS alias_2, table_12.column_2 AS alias_3 FROM table_7 INNER JOIN table_12 ON (table_7.column_4 = table_12.column_1) INNER JOIN alias_7 ON (table_7.column_4 = alias_7.alias_4) GROUP BY table_7.column_9, table_12.column_2
----


statement ok
DELETE FROM table_7 WHERE (column_12 = 2)


statement ok
DELETE FROM table_7 WHERE (column_12 = 3)


statement ok
DELETE FROM table_11 WHERE (column_3 = 2)


statement ok
DELETE FROM table_11 WHERE (column_3 = 3)


statement ok
DELETE FROM table_5 WHERE (column_3 = 2)


statement ok
DELETE FROM table_5 WHERE (column_3 = 3)


statement ok
DELETE FROM table_12 WHERE (column_3 = 2)


statement ok
DELETE FROM table_12 WHERE (column_3 = 3)


statement ok
DELETE FROM table_9 WHERE (column_4 = 2)


statement ok
DELETE FROM table_9 WHERE (column_4 = 3)


statement ok
DELETE FROM table_2 WHERE (column_8 = 2)


statement ok
DELETE FROM table_2 WHERE (column_8 = 3)


statement ok
DELETE FROM table_13 WHERE (column_3 = 2)


statement ok
DELETE FROM table_13 WHERE (column_3 = 3)


statement ok
DELETE FROM table_3 WHERE (column_3 = 2)


statement ok
DELETE FROM table_3 WHERE (column_3 = 3)


statement ok
DELETE FROM table_4 WHERE (column_3 = 2)


statement ok
DELETE FROM table_4 WHERE (column_3 = 3)


statement ok
DELETE FROM table_6 WHERE (column_3 = 2)


statement ok
DELETE FROM table_6 WHERE (column_3 = 3)


statement ok
DELETE FROM table_8 WHERE (column_3 = 2)


statement ok
DELETE FROM table_8 WHERE (column_3 = 3)


statement ok
DELETE FROM table_10 WHERE (column_3 = 2)


statement ok
DELETE FROM table_10 WHERE (column_3 = 3)


statement ok
DELETE FROM table_1 WHERE (column_10 = 2)


statement ok
DELETE FROM table_1 WHERE (column_10 = 3)


query  nosort
WITH alias_3 AS (SELECT count(table_1.column_2) AS alias_2 FROM table_1) SELECT count(table_1.column_1) AS alias_1 FROM table_1 INNER JOIN alias_3 ON (table_1.column_2 = alias_3.alias_2)
----
0

query  nosort
WITH alias_4 AS (SELECT table_1.column_4 AS alias_2, table_2.column_2 AS alias_3 FROM table_1 INNER JOIN table_2 ON (table_1.column_2 = table_2.column_1)) SELECT count(table_1.column_3) AS alias_1 FROM table_1 INNER JOIN alias_4 ON (table_1.column_2 = alias_4.alias_2)
----
27

query  nosort
WITH alias_5 AS (SELECT count(table_2.column_4) AS alias_2, table_2.column_5 AS alias_3, table_3.column_2 AS alias_4 FROM table_2 INNER JOIN table_3 ON (table_2.column_1 = table_3.column_1) GROUP BY table_2.column_5, table_3.column_2) SELECT count(table_2.column_3) AS alias_1 FROM table_2 INNER JOIN alias_5 ON (table_2.column_1 = alias_5.alias_2)
----
0

query  nosort
WITH alias_4 AS (SELECT count(table_2.column_7) AS alias_3 FROM table_2) SELECT table_2.column_6 AS alias_1, table_4.column_2 AS alias_2 FROM table_2 INNER JOIN table_4 ON (table_2.column_1 = table_4.column_1) INNER JOIN alias_4 ON (table_2.column_6 = alias_4.alias_3)
----


query  nosort
WITH alias_5 AS (SELECT table_1.column_6 AS alias_3, table_6.column_2 AS alias_4 FROM table_1 INNER JOIN table_6 ON (table_1.column_2 = table_6.column_1)) SELECT table_1.column_5 AS alias_1, table_5.column_2 AS alias_2 FROM table_1 INNER JOIN table_5 ON (table_1.column_2 = table_5.column_1) INNER JOIN alias_5 ON (table_1.column_2 = alias_5.alias_3)
----
162 values hashing to 8a24283b115305730b917316cbe232d5

query  nosort
WITH alias_6 AS (SELECT count(table_1.column_8) AS alias_3, table_1.column_9 AS alias_4, table_8.column_2 AS alias_5 FROM table_1 INNER JOIN table_8 ON (table_1.column_7 = table_8.column_1) GROUP BY table_1.column_9, table_8.column_2) SELECT table_1.column_7 AS alias_1, table_7.column_2 AS alias_2 FROM table_1 INNER JOIN table_7 ON (table_1.column_2 = table_7.column_1) INNER JOIN alias_6 ON (table_1.column_7 = alias_6.alias_3)
----


query  nosort
WITH alias_5 AS (SELECT count(table_9.column_3) AS alias_4 FROM table_9) SELECT count(table_7.column_3) AS alias_1, table_7.column_4 AS alias_2, table_9.column_2 AS alias_3 FROM table_7 INNER JOIN table_9 ON (table_7.column_3 = table_9.column_1) INNER JOIN alias_5 ON (table_7.column_4 = alias_5.alias_4) GROUP BY table_7.column_4, table_9.column_2
----


query  nosort
WITH alias_6 AS (SELECT table_7.column_7 AS alias_4, table_11.column_2 AS alias_5 FROM table_7 INNER JOIN table_11 ON (table_7.column_4 = table_11.column_1)) SELECT count(table_7.column_5) AS alias_1, table_7.column_6 AS alias_2, table_10.column_2 AS alias_3 FROM table_7 INNER JOIN table_10 ON (table_7.column_4 = table_10.column_1) INNER JOIN alias_6 ON (table_7.column_4 = alias_6.alias_4) GROUP BY table_7.column_6, table_10.column_2
----
81
1
1

query  nosort
WITH alias_7 AS (SELECT count(table_7.column_10) AS alias_4, table_7.column_11 AS alias_5, table_13.column_2 AS alias_6 FROM table_7 INNER JOIN table_13 ON (table_7.column_4 = table_13.column_1) GROUP BY table_7.column_11, table_13.column_2) SELECT count(table_7.column_8) AS alias_1, table_7.column_9 AS alias_2, table_12.column_2 AS alias_3 FROM table_7 INNER JOIN table_12 ON (table_7.column_4 = table_12.column_1) INNER JOIN alias_7 ON (table_7.column_4 = alias_7.alias_4) GROUP BY table_7.column_9, table_12.column_2
----

