# Generated by:
#     target/debug/noria-logictest generate --operations count,sum --compare-to mysql://root@localhost/mysql --subquery-depth 1 --rows-per-table 5 -o logictests/generated/count,sum.test --include-deletes

statement ok
CREATE TABLE table_1 (column_1 INT(32), column_3 INT(32), column_4 INT(32), column_2 INT(32), column_5 INT(32), PRIMARY KEY (column_5))


statement ok
INSERT INTO table_1 (column_3, column_2, column_1, column_4, column_5) VALUES (1, 1, 1, 1, 2), (1, 1, 1, 1, 3), (1, 1, 1, 1, 4), (1, 1, 1, 1, 5), (1, 1, 1, 1, 6)


query  nosort
SELECT count(table_1.column_1) AS alias_1 FROM table_1
----
5

query  nosort
SELECT sum(table_1.column_2) AS alias_1 FROM table_1
----
5

query  nosort
SELECT count(table_1.column_3) AS alias_1, sum(table_1.column_4) AS alias_2 FROM table_1
----
5
5

statement ok
DELETE FROM table_1 WHERE (column_5 = 2)


statement ok
DELETE FROM table_1 WHERE (column_5 = 3)


query  nosort
SELECT count(table_1.column_1) AS alias_1 FROM table_1
----
3

query  nosort
SELECT sum(table_1.column_2) AS alias_1 FROM table_1
----
3

query  nosort
SELECT count(table_1.column_3) AS alias_1, sum(table_1.column_4) AS alias_2 FROM table_1
----
3
3
