# Generated by:
#     target/debug/noria-logictest generate --operations count,group_concat,left_join --compare-to mysql://root@localhost/mysql --subquery-depth 1 --rows-per-table 5 -o logictests/generated/count,group_concat,left_join.test --include-deletes
# failure: ENG-339

statement ok
CREATE TABLE table_4 (column_1 INT(32), column_4 TEXT, column_5 INT(32), column_6 INT(32), column_3 INT(32), column_2 INT(32), PRIMARY KEY (column_6))


statement ok
CREATE TABLE table_3 (column_2 INT(32), column_1 INT(32), column_5 INT(32), column_4 INT(32), column_3 TEXT, PRIMARY KEY (column_5))


statement ok
CREATE TABLE table_1 (column_2 TEXT, column_1 INT(32), column_3 INT(32), column_4 INT(32), PRIMARY KEY (column_4))


statement ok
CREATE TABLE table_5 (column_2 INT(32), column_3 INT(32), column_1 INT(32), PRIMARY KEY (column_3))


statement ok
CREATE TABLE table_2 (column_5 INT(32), column_6 INT(32), column_7 INT(32), column_4 TEXT, column_1 INT(32), column_2 INT(32), column_3 INT(32), PRIMARY KEY (column_7))


statement ok
INSERT INTO table_4 (column_1, column_6, column_4, column_5, column_3, column_2) VALUES (1, 2, 'a', 1, 1, 1), (1, 3, 'a', 1, 1, 1), (1, 4, 'a', 1, 1, 1), (1, 5, 'a', 1, 1, 1), (1, 6, 'a', 1, 1, 1)


statement ok
INSERT INTO table_3 (column_4, column_3, column_2, column_1, column_5) VALUES (1, 'a', 1, 1, 2), (1, 'a', 1, 1, 3), (1, 'a', 1, 1, 4), (1, 'a', 1, 1, 5), (1, 'a', 1, 1, 6)


statement ok
INSERT INTO table_1 (column_4, column_1, column_3, column_2) VALUES (2, 1, 1, 'a'), (3, 1, 1, 'a'), (4, 1, 1, 'a'), (5, 1, 1, 'a'), (6, 1, 1, 'a')


statement ok
INSERT INTO table_5 (column_3, column_1, column_2) VALUES (2, 1, 1), (3, 1, 1), (4, 1, 1), (5, 1, 1), (6, 1, 1)


statement ok
INSERT INTO table_2 (column_7, column_5, column_6, column_4, column_3, column_2, column_1) VALUES (2, 1, 1, 'a', 1, 1, 1), (3, 1, 1, 'a', 1, 1, 1), (4, 1, 1, 'a', 1, 1, 1), (5, 1, 1, 'a', 1, 1, 1), (6, 1, 1, 'a', 1, 1, 1)


query  nosort
SELECT count(table_1.column_1) AS alias_1 FROM table_1
----
5

query  nosort
SELECT group_concat(table_1.column_2 separator ', ') AS alias_1 FROM table_1
----
a, a, a, a, a

query  nosort
SELECT table_1.column_3 AS alias_1, table_2.column_2 AS alias_2 FROM table_1 LEFT JOIN table_2 ON (table_1.column_1 = table_2.column_1)
----
50 values hashing to 1f4709ccf33e9b44d9c58ab63929bdf1

query  nosort
SELECT count(table_2.column_3) AS alias_1, group_concat(table_2.column_4 separator ', ') AS alias_2 FROM table_2
----
5
a, a, a, a, a

query  nosort
SELECT count(table_2.column_5) AS alias_1, table_2.column_6 AS alias_2, table_3.column_2 AS alias_3 FROM table_2 LEFT JOIN table_3 ON (table_2.column_5 = table_3.column_1) GROUP BY table_2.column_6, table_3.column_2
----
25
1
1

query  nosort
SELECT group_concat(table_3.column_3 separator ', ') AS alias_1, table_3.column_4 AS alias_2, table_4.column_2 AS alias_3 FROM table_3 LEFT JOIN table_4 ON (table_3.column_2 = table_4.column_1) GROUP BY table_3.column_4, table_4.column_2
----
a, a, a, a, a, a, a, a, a, a, a, a, a, a, a, a, a, a, a, a, a, a, a, a, a
1
1

query  nosort
SELECT count(table_4.column_3) AS alias_1, group_concat(table_4.column_4 separator ', ') AS alias_2, table_4.column_5 AS alias_3, table_5.column_2 AS alias_4 FROM table_4 LEFT JOIN table_5 ON (table_4.column_1 = table_5.column_1) GROUP BY table_4.column_5, table_5.column_2
----
25
a, a, a, a, a, a, a, a, a, a, a, a, a, a, a, a, a, a, a, a, a, a, a, a, a
1
1

statement ok
DELETE FROM table_4 WHERE (column_6 = 2)


statement ok
DELETE FROM table_4 WHERE (column_6 = 3)


statement ok
DELETE FROM table_3 WHERE (column_5 = 2)


statement ok
DELETE FROM table_3 WHERE (column_5 = 3)


statement ok
DELETE FROM table_1 WHERE (column_4 = 2)


statement ok
DELETE FROM table_1 WHERE (column_4 = 3)


statement ok
DELETE FROM table_5 WHERE (column_3 = 2)


statement ok
DELETE FROM table_5 WHERE (column_3 = 3)


statement ok
DELETE FROM table_2 WHERE (column_7 = 2)


statement ok
DELETE FROM table_2 WHERE (column_7 = 3)


query  nosort
SELECT count(table_1.column_1) AS alias_1 FROM table_1
----
3

query  nosort
SELECT group_concat(table_1.column_2 separator ', ') AS alias_1 FROM table_1
----
a, a, a

query  nosort
SELECT table_1.column_3 AS alias_1, table_2.column_2 AS alias_2 FROM table_1 LEFT JOIN table_2 ON (table_1.column_1 = table_2.column_1)
----
1
1
1
1
1
1
1
1
1
1
1
1
1
1
1
1
1
1

query  nosort
SELECT count(table_2.column_3) AS alias_1, group_concat(table_2.column_4 separator ', ') AS alias_2 FROM table_2
----
3
a, a, a

query  nosort
SELECT count(table_2.column_5) AS alias_1, table_2.column_6 AS alias_2, table_3.column_2 AS alias_3 FROM table_2 LEFT JOIN table_3 ON (table_2.column_5 = table_3.column_1) GROUP BY table_2.column_6, table_3.column_2
----
9
1
1

query  nosort
SELECT group_concat(table_3.column_3 separator ', ') AS alias_1, table_3.column_4 AS alias_2, table_4.column_2 AS alias_3 FROM table_3 LEFT JOIN table_4 ON (table_3.column_2 = table_4.column_1) GROUP BY table_3.column_4, table_4.column_2
----
a, a, a, a, a, a, a, a, a
1
1

query  nosort
SELECT count(table_4.column_3) AS alias_1, group_concat(table_4.column_4 separator ', ') AS alias_2, table_4.column_5 AS alias_3, table_5.column_2 AS alias_4 FROM table_4 LEFT JOIN table_5 ON (table_4.column_1 = table_5.column_1) GROUP BY table_4.column_5, table_5.column_2
----
9
a, a, a, a, a, a, a, a, a
1
1
