# Generated by:
#     target/debug/noria-logictest generate --operations count,avg,group_concat --compare-to mysql://root@localhost/mysql --subquery-depth 1 --rows-per-table 5 -o logictests/generated/count,avg,group_concat.test --include-deletes
# failure: ENG-339

statement ok
CREATE TABLE table_1 (column_2 INT(32), column_12 TEXT, column_5 INT(32), column_13 INT(32), column_3 TEXT, column_8 INT(32), column_11 INT(32), column_6 INT(32), column_4 INT(32), column_9 TEXT, column_10 INT(32), column_1 INT(32), column_7 TEXT, PRIMARY KEY (column_13))


statement ok
INSERT INTO table_1 (column_13, column_12, column_2, column_3, column_11, column_4, column_5, column_9, column_6, column_1, column_8, column_7, column_10) VALUES (2, 'a', 1, 'a', 1, 1, 1, 'a', 1, 1, 1, 'a', 1), (3, 'a', 1, 'a', 1, 1, 1, 'a', 1, 1, 1, 'a', 1), (4, 'a', 1, 'a', 1, 1, 1, 'a', 1, 1, 1, 'a', 1), (5, 'a', 1, 'a', 1, 1, 1, 'a', 1, 1, 1, 'a', 1), (6, 'a', 1, 'a', 1, 1, 1, 'a', 1, 1, 1, 'a', 1)


query  nosort
SELECT count(table_1.column_1) AS alias_1 FROM table_1
----
5

query  nosort
SELECT avg(table_1.column_2) AS alias_1 FROM table_1
----
1.0000

query  nosort
SELECT group_concat(table_1.column_3 separator ', ') AS alias_1 FROM table_1
----
a, a, a, a, a

query  nosort
SELECT count(table_1.column_4) AS alias_1, avg(table_1.column_5) AS alias_2 FROM table_1
----
5
1.0000

query  nosort
SELECT count(table_1.column_6) AS alias_1, group_concat(table_1.column_7 separator ', ') AS alias_2 FROM table_1
----
5
a, a, a, a, a

query  nosort
SELECT avg(table_1.column_8) AS alias_1, group_concat(table_1.column_9 separator ', ') AS alias_2 FROM table_1
----
1.0000
a, a, a, a, a

query  nosort
SELECT count(table_1.column_10) AS alias_1, avg(table_1.column_11) AS alias_2, group_concat(table_1.column_12 separator ', ') AS alias_3 FROM table_1
----
5
1.0000
a, a, a, a, a

statement ok
DELETE FROM table_1 WHERE (column_13 = 2)


statement ok
DELETE FROM table_1 WHERE (column_13 = 3)


query  nosort
SELECT count(table_1.column_1) AS alias_1 FROM table_1
----
3

query  nosort
SELECT avg(table_1.column_2) AS alias_1 FROM table_1
----
1.0000

query  nosort
SELECT group_concat(table_1.column_3 separator ', ') AS alias_1 FROM table_1
----
a, a, a

query  nosort
SELECT count(table_1.column_4) AS alias_1, avg(table_1.column_5) AS alias_2 FROM table_1
----
3
1.0000

query  nosort
SELECT count(table_1.column_6) AS alias_1, group_concat(table_1.column_7 separator ', ') AS alias_2 FROM table_1
----
3
a, a, a

query  nosort
SELECT avg(table_1.column_8) AS alias_1, group_concat(table_1.column_9 separator ', ') AS alias_2 FROM table_1
----
1.0000
a, a, a

query  nosort
SELECT count(table_1.column_10) AS alias_1, avg(table_1.column_11) AS alias_2, group_concat(table_1.column_12 separator ', ') AS alias_3 FROM table_1
----
3
1.0000
a, a, a
