# Generated by:
#     target/debug/noria-logictest generate --operations count,group_concat,topk --compare-to mysql://root@localhost/mysql --subquery-depth 1 --rows-per-table 5 -o logictests/generated/count,group_concat,topk.test --include-deletes
# failure: ENG-339

statement ok
CREATE TABLE table_1 (column_10 TEXT, column_11 INT(32), column_9 INT(32), column_7 TEXT, column_12 TEXT, column_8 TEXT, column_1 INT(32), column_2 TEXT, column_13 INT(32), column_3 INT(32), column_16 TEXT, column_17 INT(32), column_5 INT(32), column_15 INT(32), column_4 TEXT, column_14 TEXT, column_6 INT(32), PRIMARY KEY (column_17))


statement ok
INSERT INTO table_1 (column_3, column_7, column_2, column_4, column_8, column_12, column_1, column_6, column_11, column_17, column_5, column_16, column_14, column_10, column_13, column_15, column_9) VALUES (1, 'a', 'a', 'a', 'a', 'a', 1, 1, 1, 2, 1, 'a', 'a', 'a', 1, 1, 1), (1, 'a', 'a', 'a', 'a', 'a', 1, 1, 1, 3, 1, 'a', 'a', 'a', 1, 1, 1), (1, 'a', 'a', 'a', 'a', 'a', 1, 1, 1, 4, 1, 'a', 'a', 'a', 1, 1, 1), (1, 'a', 'a', 'a', 'a', 'a', 1, 1, 1, 5, 1, 'a', 'a', 'a', 1, 1, 1), (1, 'a', 'a', 'a', 'a', 'a', 1, 1, 1, 6, 1, 'a', 'a', 'a', 1, 1, 1)


query  nosort
SELECT count(table_1.column_1) AS alias_1 FROM table_1
----
5

query  nosort
SELECT group_concat(table_1.column_2 separator ', ') AS alias_1 FROM table_1
----
a, a, a, a, a

query  nosort
SELECT table_1.column_1 AS alias_1 FROM table_1 ORDER BY table_1.column_1 ASC LIMIT 10
----
1
1
1
1
1

query  nosort
SELECT table_1.column_1 AS alias_1 FROM table_1 ORDER BY table_1.column_1 DESC LIMIT 10
----
1
1
1
1
1

query  nosort
SELECT count(table_1.column_3) AS alias_1, group_concat(table_1.column_4 separator ', ') AS alias_2 FROM table_1
----
5
a, a, a, a, a

query  nosort
SELECT count(table_1.column_5) AS alias_1 FROM table_1 ORDER BY table_1.column_5 ASC LIMIT 10
----
5

query  nosort
SELECT count(table_1.column_6) AS alias_1 FROM table_1 ORDER BY table_1.column_6 DESC LIMIT 10
----
5

query  nosort
SELECT group_concat(table_1.column_7 separator ', ') AS alias_1 FROM table_1 ORDER BY table_1.column_6 ASC LIMIT 10
----
a, a, a, a, a

query  nosort
SELECT group_concat(table_1.column_8 separator ', ') AS alias_1 FROM table_1 ORDER BY table_1.column_8 DESC LIMIT 10
----
a, a, a, a, a

query  nosort
SELECT table_1.column_8 AS alias_1 FROM table_1 ORDER BY table_1.column_8 DESC LIMIT 10
----
a
a
a
a
a

query  nosort
SELECT count(table_1.column_9) AS alias_1, group_concat(table_1.column_10 separator ', ') AS alias_2 FROM table_1 ORDER BY table_1.column_8 ASC LIMIT 10
----
5
a, a, a, a, a

query  nosort
SELECT count(table_1.column_11) AS alias_1, group_concat(table_1.column_12 separator ', ') AS alias_2 FROM table_1 ORDER BY table_1.column_8 DESC LIMIT 10
----
5
a, a, a, a, a

query  nosort
SELECT count(table_1.column_13) AS alias_1 FROM table_1 ORDER BY table_1.column_8 DESC LIMIT 10
----
5

query  nosort
SELECT group_concat(table_1.column_14 separator ', ') AS alias_1 FROM table_1 ORDER BY table_1.column_8 DESC LIMIT 10
----
a, a, a, a, a

query  nosort
SELECT count(table_1.column_15) AS alias_1, group_concat(table_1.column_16 separator ', ') AS alias_2 FROM table_1 ORDER BY table_1.column_10 DESC LIMIT 10
----
5
a, a, a, a, a

statement ok
DELETE FROM table_1 WHERE (column_17 = 2)


statement ok
DELETE FROM table_1 WHERE (column_17 = 3)


query  nosort
SELECT count(table_1.column_1) AS alias_1 FROM table_1
----
3

query  nosort
SELECT group_concat(table_1.column_2 separator ', ') AS alias_1 FROM table_1
----
a, a, a

query  nosort
SELECT table_1.column_1 AS alias_1 FROM table_1 ORDER BY table_1.column_1 ASC LIMIT 10
----
1
1
1

query  nosort
SELECT table_1.column_1 AS alias_1 FROM table_1 ORDER BY table_1.column_1 DESC LIMIT 10
----
1
1
1

query  nosort
SELECT count(table_1.column_3) AS alias_1, group_concat(table_1.column_4 separator ', ') AS alias_2 FROM table_1
----
3
a, a, a

query  nosort
SELECT count(table_1.column_5) AS alias_1 FROM table_1 ORDER BY table_1.column_5 ASC LIMIT 10
----
3

query  nosort
SELECT count(table_1.column_6) AS alias_1 FROM table_1 ORDER BY table_1.column_6 DESC LIMIT 10
----
3

query  nosort
SELECT group_concat(table_1.column_7 separator ', ') AS alias_1 FROM table_1 ORDER BY table_1.column_6 ASC LIMIT 10
----
a, a, a

query  nosort
SELECT group_concat(table_1.column_8 separator ', ') AS alias_1 FROM table_1 ORDER BY table_1.column_8 DESC LIMIT 10
----
a, a, a

query  nosort
SELECT table_1.column_8 AS alias_1 FROM table_1 ORDER BY table_1.column_8 DESC LIMIT 10
----
a
a
a

query  nosort
SELECT count(table_1.column_9) AS alias_1, group_concat(table_1.column_10 separator ', ') AS alias_2 FROM table_1 ORDER BY table_1.column_8 ASC LIMIT 10
----
3
a, a, a

query  nosort
SELECT count(table_1.column_11) AS alias_1, group_concat(table_1.column_12 separator ', ') AS alias_2 FROM table_1 ORDER BY table_1.column_8 DESC LIMIT 10
----
3
a, a, a

query  nosort
SELECT count(table_1.column_13) AS alias_1 FROM table_1 ORDER BY table_1.column_8 DESC LIMIT 10
----
3

query  nosort
SELECT group_concat(table_1.column_14 separator ', ') AS alias_1 FROM table_1 ORDER BY table_1.column_8 DESC LIMIT 10
----
a, a, a

query  nosort
SELECT count(table_1.column_15) AS alias_1, group_concat(table_1.column_16 separator ', ') AS alias_2 FROM table_1 ORDER BY table_1.column_10 DESC LIMIT 10
----
3
a, a, a
