# Generated by:
#     target/debug/noria-logictest generate --operations group_concat,min,join_subquery --compare-to mysql://root@localhost/mysql --subquery-depth 1 --rows-per-table 5 -o logictests/generated/group_concat,min,join_subquery.test --include-deletes
# failure: ENG-344

statement ok
CREATE TABLE table_1 (column_4 INT(32), column_24 INT(32), column_11 INT(32), column_10 INT(32), column_7 INT(32), column_6 TEXT, column_2 TEXT, column_5 TEXT, column_13 TEXT, column_8 INT(32), column_14 INT(32), column_17 TEXT, column_12 INT(32), column_16 INT(32), column_20 INT(32), column_21 TEXT, column_15 TEXT, column_22 INT(32), column_23 TEXT, column_25 INT(32), column_9 TEXT, column_1 TEXT, column_19 INT(32), column_18 TEXT, column_3 TEXT, PRIMARY KEY (column_25))


statement ok
INSERT INTO table_1 (column_13, column_16, column_6, column_5, column_10, column_8, column_15, column_23, column_9, column_21, column_19, column_18, column_14, column_12, column_1, column_24, column_2, column_11, column_7, column_22, column_4, column_25, column_17, column_20, column_3) VALUES ('a', 1, 'a', 'a', 1, 1, 'a', 'a', 'a', 'a', 1, 'a', 1, 1, 'a', 1, 'a', 1, 1, 1, 1, 2, 'a', 1, 'a'), ('a', 1, 'a', 'a', 1, 1, 'a', 'a', 'a', 'a', 1, 'a', 1, 1, 'a', 1, 'a', 1, 1, 1, 1, 3, 'a', 1, 'a'), ('a', 1, 'a', 'a', 1, 1, 'a', 'a', 'a', 'a', 1, 'a', 1, 1, 'a', 1, 'a', 1, 1, 1, 1, 4, 'a', 1, 'a'), ('a', 1, 'a', 'a', 1, 1, 'a', 'a', 'a', 'a', 1, 'a', 1, 1, 'a', 1, 'a', 1, 1, 1, 1, 5, 'a', 1, 'a'), ('a', 1, 'a', 'a', 1, 1, 'a', 'a', 'a', 'a', 1, 'a', 1, 1, 'a', 1, 'a', 1, 1, 1, 1, 6, 'a', 1, 'a')


query  nosort
SELECT group_concat(table_1.column_1 separator ', ') AS alias_1 FROM table_1 INNER JOIN (SELECT group_concat(table_1.column_2 separator ', ') AS alias_2 FROM table_1) AS alias_3 ON (table_1.column_2 = alias_3.alias_2)
----
NULL

query  nosort
SELECT group_concat(table_1.column_3 separator ', ') AS alias_1 FROM table_1 INNER JOIN (SELECT min(table_1.column_4) AS alias_2 FROM table_1) AS alias_3 ON (table_1.column_4 = alias_3.alias_2)
----
a, a, a, a, a

query  nosort
SELECT group_concat(table_1.column_5 separator ', ') AS alias_1 FROM table_1 INNER JOIN (SELECT group_concat(table_1.column_6 separator ', ') AS alias_2, min(table_1.column_7) AS alias_3 FROM table_1) AS alias_4 ON (table_1.column_4 = alias_4.alias_2)
----
NULL

query  nosort
SELECT min(table_1.column_8) AS alias_1 FROM table_1 INNER JOIN (SELECT group_concat(table_1.column_9 separator ', ') AS alias_2 FROM table_1) AS alias_3 ON (table_1.column_3 = alias_3.alias_2)
----
NULL

query  nosort
SELECT min(table_1.column_10) AS alias_1 FROM table_1 INNER JOIN (SELECT min(table_1.column_11) AS alias_2 FROM table_1) AS alias_3 ON (table_1.column_3 = alias_3.alias_2)
----
NULL

query  nosort
SELECT min(table_1.column_12) AS alias_1 FROM table_1 INNER JOIN (SELECT group_concat(table_1.column_13 separator ', ') AS alias_2, min(table_1.column_14) AS alias_3 FROM table_1) AS alias_4 ON (table_1.column_3 = alias_4.alias_2)
----
NULL

query  nosort
SELECT group_concat(table_1.column_15 separator ', ') AS alias_1, min(table_1.column_16) AS alias_2 FROM table_1 INNER JOIN (SELECT group_concat(table_1.column_17 separator ', ') AS alias_3 FROM table_1) AS alias_4 ON (table_1.column_4 = alias_4.alias_3)
----
NULL
NULL

query  nosort
SELECT group_concat(table_1.column_18 separator ', ') AS alias_1, min(table_1.column_19) AS alias_2 FROM table_1 INNER JOIN (SELECT min(table_1.column_20) AS alias_3 FROM table_1) AS alias_4 ON (table_1.column_4 = alias_4.alias_3)
----
a, a, a, a, a
1

query  nosort
SELECT group_concat(table_1.column_21 separator ', ') AS alias_1, min(table_1.column_22) AS alias_2 FROM table_1 INNER JOIN (SELECT group_concat(table_1.column_23 separator ', ') AS alias_3, min(table_1.column_24) AS alias_4 FROM table_1) AS alias_5 ON (table_1.column_4 = alias_5.alias_3)
----
NULL
NULL

statement ok
DELETE FROM table_1 WHERE (column_25 = 2)


statement ok
DELETE FROM table_1 WHERE (column_25 = 3)


query  nosort
SELECT group_concat(table_1.column_1 separator ', ') AS alias_1 FROM table_1 INNER JOIN (SELECT group_concat(table_1.column_2 separator ', ') AS alias_2 FROM table_1) AS alias_3 ON (table_1.column_2 = alias_3.alias_2)
----
NULL

query  nosort
SELECT group_concat(table_1.column_3 separator ', ') AS alias_1 FROM table_1 INNER JOIN (SELECT min(table_1.column_4) AS alias_2 FROM table_1) AS alias_3 ON (table_1.column_4 = alias_3.alias_2)
----
a, a, a

query  nosort
SELECT group_concat(table_1.column_5 separator ', ') AS alias_1 FROM table_1 INNER JOIN (SELECT group_concat(table_1.column_6 separator ', ') AS alias_2, min(table_1.column_7) AS alias_3 FROM table_1) AS alias_4 ON (table_1.column_4 = alias_4.alias_2)
----
NULL

query  nosort
SELECT min(table_1.column_8) AS alias_1 FROM table_1 INNER JOIN (SELECT group_concat(table_1.column_9 separator ', ') AS alias_2 FROM table_1) AS alias_3 ON (table_1.column_3 = alias_3.alias_2)
----
NULL

query  nosort
SELECT min(table_1.column_10) AS alias_1 FROM table_1 INNER JOIN (SELECT min(table_1.column_11) AS alias_2 FROM table_1) AS alias_3 ON (table_1.column_3 = alias_3.alias_2)
----
NULL

query  nosort
SELECT min(table_1.column_12) AS alias_1 FROM table_1 INNER JOIN (SELECT group_concat(table_1.column_13 separator ', ') AS alias_2, min(table_1.column_14) AS alias_3 FROM table_1) AS alias_4 ON (table_1.column_3 = alias_4.alias_2)
----
NULL

query  nosort
SELECT group_concat(table_1.column_15 separator ', ') AS alias_1, min(table_1.column_16) AS alias_2 FROM table_1 INNER JOIN (SELECT group_concat(table_1.column_17 separator ', ') AS alias_3 FROM table_1) AS alias_4 ON (table_1.column_4 = alias_4.alias_3)
----
NULL
NULL

query  nosort
SELECT group_concat(table_1.column_18 separator ', ') AS alias_1, min(table_1.column_19) AS alias_2 FROM table_1 INNER JOIN (SELECT min(table_1.column_20) AS alias_3 FROM table_1) AS alias_4 ON (table_1.column_4 = alias_4.alias_3)
----
a, a, a
1

query  nosort
SELECT group_concat(table_1.column_21 separator ', ') AS alias_1, min(table_1.column_22) AS alias_2 FROM table_1 INNER JOIN (SELECT group_concat(table_1.column_23 separator ', ') AS alias_3, min(table_1.column_24) AS alias_4 FROM table_1) AS alias_5 ON (table_1.column_4 = alias_5.alias_3)
----
NULL
NULL
