# Generated by:
#     target/debug/noria-logictest generate --operations group_concat,cte,join_subquery --compare-to mysql://root@localhost/mysql --subquery-depth 1 --rows-per-table 5 -o logictests/generated/group_concat,cte,join_subquery.test --include-deletes
# failure: ENG-344

statement ok
CREATE TABLE table_1 (column_3 TEXT, column_2 TEXT, column_4 INT(32), column_1 TEXT, PRIMARY KEY (column_4))


statement ok
INSERT INTO table_1 (column_3, column_2, column_1, column_4) VALUES ('a', 'a', 'a', 2), ('a', 'a', 'a', 3), ('a', 'a', 'a', 4), ('a', 'a', 'a', 5), ('a', 'a', 'a', 6)


query  nosort
WITH alias_3 AS (SELECT group_concat(table_1.column_2 separator ', ') AS alias_2 FROM table_1) SELECT group_concat(table_1.column_1 separator ', ') AS alias_1 FROM table_1 INNER JOIN alias_3 ON (table_1.column_2 = alias_3.alias_2) INNER JOIN (SELECT group_concat(table_1.column_3 separator ', ') AS alias_4 FROM table_1) AS alias_5 ON (table_1.column_2 = alias_5.alias_4)
----
NULL

statement ok
DELETE FROM table_1 WHERE (column_4 = 2)


statement ok
DELETE FROM table_1 WHERE (column_4 = 3)


query  nosort
WITH alias_3 AS (SELECT group_concat(table_1.column_2 separator ', ') AS alias_2 FROM table_1) SELECT group_concat(table_1.column_1 separator ', ') AS alias_1 FROM table_1 INNER JOIN alias_3 ON (table_1.column_2 = alias_3.alias_2) INNER JOIN (SELECT group_concat(table_1.column_3 separator ', ') AS alias_4 FROM table_1) AS alias_5 ON (table_1.column_2 = alias_5.alias_4)
----
NULL
