# Generated by:
#     target/debug/noria-logictest generate --operations group_concat,max,min --compare-to mysql://root@localhost/mysql --subquery-depth 1 --rows-per-table 5 -o logictests/generated/group_concat,max,min.test --include-deletes
# failure: ENG-339

statement ok
CREATE TABLE table_1 (column_6 TEXT, column_5 INT(32), column_9 INT(32), column_7 INT(32), column_2 INT(32), column_10 TEXT, column_8 INT(32), column_11 INT(32), column_13 INT(32), column_3 INT(32), column_1 TEXT, column_4 TEXT, column_12 INT(32), PRIMARY KEY (column_13))


statement ok
INSERT INTO table_1 (column_3, column_10, column_1, column_2, column_5, column_8, column_6, column_7, column_11, column_13, column_4, column_12, column_9) VALUES (1, 'a', 'a', 1, 1, 1, 'a', 1, 1, 2, 'a', 1, 1), (1, 'a', 'a', 1, 1, 1, 'a', 1, 1, 3, 'a', 1, 1), (1, 'a', 'a', 1, 1, 1, 'a', 1, 1, 4, 'a', 1, 1), (1, 'a', 'a', 1, 1, 1, 'a', 1, 1, 5, 'a', 1, 1), (1, 'a', 'a', 1, 1, 1, 'a', 1, 1, 6, 'a', 1, 1)


query  nosort
SELECT group_concat(table_1.column_1 separator ', ') AS alias_1 FROM table_1
----
a, a, a, a, a

query  nosort
SELECT max(table_1.column_2) AS alias_1 FROM table_1
----
1

query  nosort
SELECT min(table_1.column_3) AS alias_1 FROM table_1
----
1

query  nosort
SELECT group_concat(table_1.column_4 separator ', ') AS alias_1, max(table_1.column_5) AS alias_2 FROM table_1
----
a, a, a, a, a
1

query  nosort
SELECT group_concat(table_1.column_6 separator ', ') AS alias_1, min(table_1.column_7) AS alias_2 FROM table_1
----
a, a, a, a, a
1

query  nosort
SELECT max(table_1.column_8) AS alias_1, min(table_1.column_9) AS alias_2 FROM table_1
----
1
1

query  nosort
SELECT group_concat(table_1.column_10 separator ', ') AS alias_1, max(table_1.column_11) AS alias_2, min(table_1.column_12) AS alias_3 FROM table_1
----
a, a, a, a, a
1
1

statement ok
DELETE FROM table_1 WHERE (column_13 = 2)


statement ok
DELETE FROM table_1 WHERE (column_13 = 3)


query  nosort
SELECT group_concat(table_1.column_1 separator ', ') AS alias_1 FROM table_1
----
a, a, a

query  nosort
SELECT max(table_1.column_2) AS alias_1 FROM table_1
----
1

query  nosort
SELECT min(table_1.column_3) AS alias_1 FROM table_1
----
1

query  nosort
SELECT group_concat(table_1.column_4 separator ', ') AS alias_1, max(table_1.column_5) AS alias_2 FROM table_1
----
a, a, a
1

query  nosort
SELECT group_concat(table_1.column_6 separator ', ') AS alias_1, min(table_1.column_7) AS alias_2 FROM table_1
----
a, a, a
1

query  nosort
SELECT max(table_1.column_8) AS alias_1, min(table_1.column_9) AS alias_2 FROM table_1
----
1
1

query  nosort
SELECT group_concat(table_1.column_10 separator ', ') AS alias_1, max(table_1.column_11) AS alias_2, min(table_1.column_12) AS alias_3 FROM table_1
----
a, a, a
1
1
