# Generated by:
#     target/debug/noria-logictest generate --operations group_concat,distinct,cte --compare-to mysql://root@localhost/mysql --subquery-depth 1 --rows-per-table 5 -o logictests/generated/group_concat,distinct,cte.test --include-deletes
# failure: ENG-344

statement ok
CREATE TABLE table_1 (column_12 TEXT, column_4 TEXT, column_3 TEXT, column_5 TEXT, column_11 TEXT, column_13 INT(32), column_2 TEXT, column_7 TEXT, column_6 TEXT, column_8 TEXT, column_10 TEXT, column_1 TEXT, column_9 TEXT, PRIMARY KEY (column_13))


statement ok
INSERT INTO table_1 (column_1, column_9, column_5, column_4, column_6, column_7, column_2, column_11, column_3, column_12, column_13, column_8, column_10) VALUES ('a', 'a', 'a', 'a', 'a', 'a', 'a', 'a', 'a', 'a', 2, 'a', 'a'), ('a', 'a', 'a', 'a', 'a', 'a', 'a', 'a', 'a', 'a', 3, 'a', 'a'), ('a', 'a', 'a', 'a', 'a', 'a', 'a', 'a', 'a', 'a', 4, 'a', 'a'), ('a', 'a', 'a', 'a', 'a', 'a', 'a', 'a', 'a', 'a', 5, 'a', 'a'), ('a', 'a', 'a', 'a', 'a', 'a', 'a', 'a', 'a', 'a', 6, 'a', 'a')


query  nosort
WITH alias_3 AS (SELECT group_concat(table_1.column_2 separator ', ') AS alias_2 FROM table_1) SELECT group_concat(table_1.column_1 separator ', ') AS alias_1 FROM table_1 INNER JOIN alias_3 ON (table_1.column_1 = alias_3.alias_2)
----
NULL

query  nosort
WITH alias_3 AS (SELECT DISTINCT table_1.column_1 AS alias_2 FROM table_1) SELECT group_concat(table_1.column_3 separator ', ') AS alias_1 FROM table_1 INNER JOIN alias_3 ON (table_1.column_1 = alias_3.alias_2)
----
a, a, a, a, a

query  nosort
WITH alias_3 AS (SELECT DISTINCT group_concat(table_1.column_5 separator ', ') AS alias_2 FROM table_1) SELECT group_concat(table_1.column_4 separator ', ') AS alias_1 FROM table_1 INNER JOIN alias_3 ON (table_1.column_4 = alias_3.alias_2)
----
NULL

query  nosort
WITH alias_2 AS (SELECT group_concat(table_1.column_6 separator ', ') AS alias_1 FROM table_1) SELECT DISTINCT table_1.column_6 AS alias_3 FROM table_1 INNER JOIN alias_2 ON (table_1.column_6 = alias_2.alias_1)
----


query  nosort
WITH alias_2 AS (SELECT DISTINCT table_1.column_6 AS alias_1 FROM table_1) SELECT DISTINCT table_1.column_6 AS alias_3 FROM table_1 INNER JOIN alias_2 ON (table_1.column_6 = alias_2.alias_1)
----
a

query  nosort
WITH alias_2 AS (SELECT DISTINCT group_concat(table_1.column_7 separator ', ') AS alias_1 FROM table_1) SELECT DISTINCT table_1.column_6 AS alias_3 FROM table_1 INNER JOIN alias_2 ON (table_1.column_6 = alias_2.alias_1)
----


query  nosort
WITH alias_3 AS (SELECT group_concat(table_1.column_9 separator ', ') AS alias_2 FROM table_1) SELECT DISTINCT group_concat(table_1.column_8 separator ', ') AS alias_1 FROM table_1 INNER JOIN alias_3 ON (table_1.column_4 = alias_3.alias_2)
----
NULL

query  nosort
WITH alias_3 AS (SELECT DISTINCT table_1.column_4 AS alias_2 FROM table_1) SELECT DISTINCT group_concat(table_1.column_10 separator ', ') AS alias_1 FROM table_1 INNER JOIN alias_3 ON (table_1.column_4 = alias_3.alias_2)
----
a, a, a, a, a

query  nosort
WITH alias_3 AS (SELECT DISTINCT group_concat(table_1.column_12 separator ', ') AS alias_2 FROM table_1) SELECT DISTINCT group_concat(table_1.column_11 separator ', ') AS alias_1 FROM table_1 INNER JOIN alias_3 ON (table_1.column_12 = alias_3.alias_2)
----
NULL

statement ok
DELETE FROM table_1 WHERE (column_13 = 2)


statement ok
DELETE FROM table_1 WHERE (column_13 = 3)


query  nosort
WITH alias_3 AS (SELECT group_concat(table_1.column_2 separator ', ') AS alias_2 FROM table_1) SELECT group_concat(table_1.column_1 separator ', ') AS alias_1 FROM table_1 INNER JOIN alias_3 ON (table_1.column_1 = alias_3.alias_2)
----
NULL

query  nosort
WITH alias_3 AS (SELECT DISTINCT table_1.column_1 AS alias_2 FROM table_1) SELECT group_concat(table_1.column_3 separator ', ') AS alias_1 FROM table_1 INNER JOIN alias_3 ON (table_1.column_1 = alias_3.alias_2)
----
a, a, a

query  nosort
WITH alias_3 AS (SELECT DISTINCT group_concat(table_1.column_5 separator ', ') AS alias_2 FROM table_1) SELECT group_concat(table_1.column_4 separator ', ') AS alias_1 FROM table_1 INNER JOIN alias_3 ON (table_1.column_4 = alias_3.alias_2)
----
NULL

query  nosort
WITH alias_2 AS (SELECT group_concat(table_1.column_6 separator ', ') AS alias_1 FROM table_1) SELECT DISTINCT table_1.column_6 AS alias_3 FROM table_1 INNER JOIN alias_2 ON (table_1.column_6 = alias_2.alias_1)
----


query  nosort
WITH alias_2 AS (SELECT DISTINCT table_1.column_6 AS alias_1 FROM table_1) SELECT DISTINCT table_1.column_6 AS alias_3 FROM table_1 INNER JOIN alias_2 ON (table_1.column_6 = alias_2.alias_1)
----
a

query  nosort
WITH alias_2 AS (SELECT DISTINCT group_concat(table_1.column_7 separator ', ') AS alias_1 FROM table_1) SELECT DISTINCT table_1.column_6 AS alias_3 FROM table_1 INNER JOIN alias_2 ON (table_1.column_6 = alias_2.alias_1)
----


query  nosort
WITH alias_3 AS (SELECT group_concat(table_1.column_9 separator ', ') AS alias_2 FROM table_1) SELECT DISTINCT group_concat(table_1.column_8 separator ', ') AS alias_1 FROM table_1 INNER JOIN alias_3 ON (table_1.column_4 = alias_3.alias_2)
----
NULL

query  nosort
WITH alias_3 AS (SELECT DISTINCT table_1.column_4 AS alias_2 FROM table_1) SELECT DISTINCT group_concat(table_1.column_10 separator ', ') AS alias_1 FROM table_1 INNER JOIN alias_3 ON (table_1.column_4 = alias_3.alias_2)
----
a, a, a

query  nosort
WITH alias_3 AS (SELECT DISTINCT group_concat(table_1.column_12 separator ', ') AS alias_2 FROM table_1) SELECT DISTINCT group_concat(table_1.column_11 separator ', ') AS alias_1 FROM table_1 INNER JOIN alias_3 ON (table_1.column_12 = alias_3.alias_2)
----
NULL
