# Generated by:
#     target/debug/noria-logictest generate --operations group_concat,distinct,topk --compare-to mysql://root@localhost/mysql --subquery-depth 1 --rows-per-table 5 -o logictests/generated/group_concat,distinct,topk.test --include-deletes
# failure: ENG-339

statement ok
CREATE TABLE table_1 (column_8 TEXT, column_4 TEXT, column_1 TEXT, column_9 INT(32), column_6 TEXT, column_7 TEXT, column_2 TEXT, column_3 TEXT, column_5 TEXT, PRIMARY KEY (column_9))


statement ok
INSERT INTO table_1 (column_4, column_5, column_1, column_2, column_6, column_7, column_9, column_8, column_3) VALUES ('a', 'a', 'a', 'a', 'a', 'a', 2, 'a', 'a'), ('a', 'a', 'a', 'a', 'a', 'a', 3, 'a', 'a'), ('a', 'a', 'a', 'a', 'a', 'a', 4, 'a', 'a'), ('a', 'a', 'a', 'a', 'a', 'a', 5, 'a', 'a'), ('a', 'a', 'a', 'a', 'a', 'a', 6, 'a', 'a')


query  nosort
SELECT group_concat(table_1.column_1 separator ', ') AS alias_1 FROM table_1
----
a, a, a, a, a

query  nosort
SELECT DISTINCT table_1.column_1 AS alias_1 FROM table_1
----
a

query  nosort
SELECT table_1.column_1 AS alias_1 FROM table_1 ORDER BY table_1.column_1 ASC LIMIT 10
----
a
a
a
a
a

query  nosort
SELECT table_1.column_1 AS alias_1 FROM table_1 ORDER BY table_1.column_1 DESC LIMIT 10
----
a
a
a
a
a

query  nosort
SELECT DISTINCT group_concat(table_1.column_2 separator ', ') AS alias_1 FROM table_1
----
a, a, a, a, a

query  nosort
SELECT group_concat(table_1.column_3 separator ', ') AS alias_1 FROM table_1 ORDER BY table_1.column_2 ASC LIMIT 10
----
a, a, a, a, a

query  nosort
SELECT group_concat(table_1.column_4 separator ', ') AS alias_1 FROM table_1 ORDER BY table_1.column_4 DESC LIMIT 10
----
a, a, a, a, a

query  nosort
SELECT DISTINCT table_1.column_4 AS alias_1 FROM table_1 ORDER BY table_1.column_4 ASC LIMIT 10
----
a

query  nosort
SELECT DISTINCT table_1.column_4 AS alias_1 FROM table_1 ORDER BY table_1.column_4 DESC LIMIT 10
----
a

query  nosort
SELECT table_1.column_4 AS alias_1 FROM table_1 ORDER BY table_1.column_4 DESC LIMIT 10
----
a
a
a
a
a

query  nosort
SELECT DISTINCT group_concat(table_1.column_5 separator ', ') AS alias_1 FROM table_1 ORDER BY table_1.column_4 ASC LIMIT 10
----
a, a, a, a, a

query  nosort
SELECT DISTINCT group_concat(table_1.column_6 separator ', ') AS alias_1 FROM table_1 ORDER BY table_1.column_6 DESC LIMIT 10
----
a, a, a, a, a

query  nosort
SELECT group_concat(table_1.column_7 separator ', ') AS alias_1 FROM table_1 ORDER BY table_1.column_6 DESC LIMIT 10
----
a, a, a, a, a

query  nosort
SELECT DISTINCT table_1.column_6 AS alias_1 FROM table_1 ORDER BY table_1.column_6 DESC LIMIT 10
----
a

query  nosort
SELECT DISTINCT group_concat(table_1.column_8 separator ', ') AS alias_1 FROM table_1 ORDER BY table_1.column_8 DESC LIMIT 10
----
a, a, a, a, a

statement ok
DELETE FROM table_1 WHERE (column_9 = 2)


statement ok
DELETE FROM table_1 WHERE (column_9 = 3)


query  nosort
SELECT group_concat(table_1.column_1 separator ', ') AS alias_1 FROM table_1
----
a, a, a

query  nosort
SELECT DISTINCT table_1.column_1 AS alias_1 FROM table_1
----
a

query  nosort
SELECT table_1.column_1 AS alias_1 FROM table_1 ORDER BY table_1.column_1 ASC LIMIT 10
----
a
a
a

query  nosort
SELECT table_1.column_1 AS alias_1 FROM table_1 ORDER BY table_1.column_1 DESC LIMIT 10
----
a
a
a

query  nosort
SELECT DISTINCT group_concat(table_1.column_2 separator ', ') AS alias_1 FROM table_1
----
a, a, a

query  nosort
SELECT group_concat(table_1.column_3 separator ', ') AS alias_1 FROM table_1 ORDER BY table_1.column_2 ASC LIMIT 10
----
a, a, a

query  nosort
SELECT group_concat(table_1.column_4 separator ', ') AS alias_1 FROM table_1 ORDER BY table_1.column_4 DESC LIMIT 10
----
a, a, a

query  nosort
SELECT DISTINCT table_1.column_4 AS alias_1 FROM table_1 ORDER BY table_1.column_4 ASC LIMIT 10
----
a

query  nosort
SELECT DISTINCT table_1.column_4 AS alias_1 FROM table_1 ORDER BY table_1.column_4 DESC LIMIT 10
----
a

query  nosort
SELECT table_1.column_4 AS alias_1 FROM table_1 ORDER BY table_1.column_4 DESC LIMIT 10
----
a
a
a

query  nosort
SELECT DISTINCT group_concat(table_1.column_5 separator ', ') AS alias_1 FROM table_1 ORDER BY table_1.column_4 ASC LIMIT 10
----
a, a, a

query  nosort
SELECT DISTINCT group_concat(table_1.column_6 separator ', ') AS alias_1 FROM table_1 ORDER BY table_1.column_6 DESC LIMIT 10
----
a, a, a

query  nosort
SELECT group_concat(table_1.column_7 separator ', ') AS alias_1 FROM table_1 ORDER BY table_1.column_6 DESC LIMIT 10
----
a, a, a

query  nosort
SELECT DISTINCT table_1.column_6 AS alias_1 FROM table_1 ORDER BY table_1.column_6 DESC LIMIT 10
----
a

query  nosort
SELECT DISTINCT group_concat(table_1.column_8 separator ', ') AS alias_1 FROM table_1 ORDER BY table_1.column_8 DESC LIMIT 10
----
a, a, a
