# Generated by:
#     target/debug/noria-logictest generate --operations group_concat,single_parameter,topk --compare-to mysql://root@localhost/mysql --subquery-depth 1 --rows-per-table 5 -o logictests/generated/group_concat,single_parameter,topk.test --include-deletes
# failure: ENG-339

statement ok
CREATE TABLE table_1 (column_3 TEXT, column_6 TEXT, column_7 TEXT, column_4 TEXT, column_5 TEXT, column_8 TEXT, column_2 TEXT, column_9 INT(32), column_1 TEXT, PRIMARY KEY (column_9))


statement ok
INSERT INTO table_1 (column_3, column_4, column_5, column_2, column_7, column_1, column_6, column_8, column_9) VALUES ('a', 'a', 'a', 'a', 'a', 'a', 'a', 'a', 2), ('a', 'a', 'a', 'a', 'a', 'a', 'a', 'a', 3), ('a', 'a', 'a', 'a', 'a', 'a', 'a', 'a', 4), ('a', 'a', 'a', 'a', 'a', 'a', 'a', 'a', 5), ('a', 'a', 'a', 'a', 'a', 'a', 'a', 'a', 6)


query  nosort
SELECT group_concat(table_1.column_1 separator ', ') AS alias_1 FROM table_1
----
a, a, a, a, a

query  nosort
SELECT table_1.column_1 AS alias_1 FROM table_1 WHERE (table_1.column_1 = ?)
? = a
----
a
a
a
a
a

query  nosort
SELECT table_1.column_1 AS alias_1 FROM table_1 ORDER BY table_1.column_1 ASC LIMIT 10
----
a
a
a
a
a

query  nosort
SELECT table_1.column_1 AS alias_1 FROM table_1 ORDER BY table_1.column_1 DESC LIMIT 10
----
a
a
a
a
a

query  nosort
SELECT group_concat(table_1.column_2 separator ', ') AS alias_1 FROM table_1 WHERE (table_1.column_2 = ?)
? = a
----
a, a, a, a, a

query  nosort
SELECT group_concat(table_1.column_3 separator ', ') AS alias_1 FROM table_1 ORDER BY table_1.column_3 ASC LIMIT 10
----
a, a, a, a, a

query  nosort
SELECT group_concat(table_1.column_4 separator ', ') AS alias_1 FROM table_1 ORDER BY table_1.column_3 DESC LIMIT 10
----
a, a, a, a, a

query  nosort
SELECT table_1.column_3 AS alias_1 FROM table_1 WHERE (table_1.column_3 = ?) ORDER BY table_1.column_3 ASC LIMIT 10
? = a
----
a
a
a
a
a

query  nosort
SELECT table_1.column_3 AS alias_1 FROM table_1 WHERE (table_1.column_3 = ?) ORDER BY table_1.column_3 DESC LIMIT 10
? = a
----
a
a
a
a
a

query  nosort
SELECT table_1.column_3 AS alias_1 FROM table_1 ORDER BY table_1.column_3 DESC LIMIT 10
----
a
a
a
a
a

query  nosort
SELECT group_concat(table_1.column_5 separator ', ') AS alias_1 FROM table_1 WHERE (table_1.column_3 = ?) ORDER BY table_1.column_3 ASC LIMIT 10
? = a
----
a, a, a, a, a

query  nosort
SELECT group_concat(table_1.column_6 separator ', ') AS alias_1 FROM table_1 WHERE (table_1.column_3 = ?) ORDER BY table_1.column_3 DESC LIMIT 10
? = a
----
a, a, a, a, a

query  nosort
SELECT group_concat(table_1.column_7 separator ', ') AS alias_1 FROM table_1 ORDER BY table_1.column_3 DESC LIMIT 10
----
a, a, a, a, a

query  nosort
SELECT table_1.column_3 AS alias_1 FROM table_1 WHERE (table_1.column_3 = ?) ORDER BY table_1.column_3 DESC LIMIT 10
? = a
----
a
a
a
a
a

query  nosort
SELECT group_concat(table_1.column_8 separator ', ') AS alias_1 FROM table_1 WHERE (table_1.column_3 = ?) ORDER BY table_1.column_3 DESC LIMIT 10
? = a
----
a, a, a, a, a

statement ok
DELETE FROM table_1 WHERE (column_9 = 2)


statement ok
DELETE FROM table_1 WHERE (column_9 = 3)


query  nosort
SELECT group_concat(table_1.column_1 separator ', ') AS alias_1 FROM table_1
----
a, a, a

query  nosort
SELECT table_1.column_1 AS alias_1 FROM table_1 WHERE (table_1.column_1 = ?)
? = a
----
a
a
a

query  nosort
SELECT table_1.column_1 AS alias_1 FROM table_1 ORDER BY table_1.column_1 ASC LIMIT 10
----
a
a
a

query  nosort
SELECT table_1.column_1 AS alias_1 FROM table_1 ORDER BY table_1.column_1 DESC LIMIT 10
----
a
a
a

query  nosort
SELECT group_concat(table_1.column_2 separator ', ') AS alias_1 FROM table_1 WHERE (table_1.column_2 = ?)
? = a
----
a, a, a

query  nosort
SELECT group_concat(table_1.column_3 separator ', ') AS alias_1 FROM table_1 ORDER BY table_1.column_3 ASC LIMIT 10
----
a, a, a

query  nosort
SELECT group_concat(table_1.column_4 separator ', ') AS alias_1 FROM table_1 ORDER BY table_1.column_3 DESC LIMIT 10
----
a, a, a

query  nosort
SELECT table_1.column_3 AS alias_1 FROM table_1 WHERE (table_1.column_3 = ?) ORDER BY table_1.column_3 ASC LIMIT 10
? = a
----
a
a
a

query  nosort
SELECT table_1.column_3 AS alias_1 FROM table_1 WHERE (table_1.column_3 = ?) ORDER BY table_1.column_3 DESC LIMIT 10
? = a
----
a
a
a

query  nosort
SELECT table_1.column_3 AS alias_1 FROM table_1 ORDER BY table_1.column_3 DESC LIMIT 10
----
a
a
a

query  nosort
SELECT group_concat(table_1.column_5 separator ', ') AS alias_1 FROM table_1 WHERE (table_1.column_3 = ?) ORDER BY table_1.column_3 ASC LIMIT 10
? = a
----
a, a, a

query  nosort
SELECT group_concat(table_1.column_6 separator ', ') AS alias_1 FROM table_1 WHERE (table_1.column_3 = ?) ORDER BY table_1.column_3 DESC LIMIT 10
? = a
----
a, a, a

query  nosort
SELECT group_concat(table_1.column_7 separator ', ') AS alias_1 FROM table_1 ORDER BY table_1.column_3 DESC LIMIT 10
----
a, a, a

query  nosort
SELECT table_1.column_3 AS alias_1 FROM table_1 WHERE (table_1.column_3 = ?) ORDER BY table_1.column_3 DESC LIMIT 10
? = a
----
a
a
a

query  nosort
SELECT group_concat(table_1.column_8 separator ', ') AS alias_1 FROM table_1 WHERE (table_1.column_3 = ?) ORDER BY table_1.column_3 DESC LIMIT 10
? = a
----
a, a, a
