# Generated by:
#     target/debug/noria-logictest generate --operations group_concat,topk --compare-to mysql://root@localhost/mysql --subquery-depth 1 --rows-per-table 5 -o logictests/generated/group_concat,topk.test --include-deletes
# failure: ENG-339

statement ok
CREATE TABLE table_1 (column_4 TEXT, column_5 INT(32), column_2 TEXT, column_1 TEXT, column_3 TEXT, PRIMARY KEY (column_5))


statement ok
INSERT INTO table_1 (column_5, column_4, column_1, column_3, column_2) VALUES (2, 'a', 'a', 'a', 'a'), (3, 'a', 'a', 'a', 'a'), (4, 'a', 'a', 'a', 'a'), (5, 'a', 'a', 'a', 'a'), (6, 'a', 'a', 'a', 'a')


query  nosort
SELECT group_concat(table_1.column_1 separator ', ') AS alias_1 FROM table_1
----
a, a, a, a, a

query  nosort
SELECT table_1.column_1 AS alias_1 FROM table_1 ORDER BY table_1.column_1 ASC LIMIT 10
----
a
a
a
a
a

query  nosort
SELECT table_1.column_1 AS alias_1 FROM table_1 ORDER BY table_1.column_1 DESC LIMIT 10
----
a
a
a
a
a

query  nosort
SELECT group_concat(table_1.column_2 separator ', ') AS alias_1 FROM table_1 ORDER BY table_1.column_2 ASC LIMIT 10
----
a, a, a, a, a

query  nosort
SELECT group_concat(table_1.column_3 separator ', ') AS alias_1 FROM table_1 ORDER BY table_1.column_2 DESC LIMIT 10
----
a, a, a, a, a

query  nosort
SELECT table_1.column_2 AS alias_1 FROM table_1 ORDER BY table_1.column_2 DESC LIMIT 10
----
a
a
a
a
a

query  nosort
SELECT group_concat(table_1.column_4 separator ', ') AS alias_1 FROM table_1 ORDER BY table_1.column_4 DESC LIMIT 10
----
a, a, a, a, a

statement ok
DELETE FROM table_1 WHERE (column_5 = 2)


statement ok
DELETE FROM table_1 WHERE (column_5 = 3)


query  nosort
SELECT group_concat(table_1.column_1 separator ', ') AS alias_1 FROM table_1
----
a, a, a

query  nosort
SELECT table_1.column_1 AS alias_1 FROM table_1 ORDER BY table_1.column_1 ASC LIMIT 10
----
a
a
a

query  nosort
SELECT table_1.column_1 AS alias_1 FROM table_1 ORDER BY table_1.column_1 DESC LIMIT 10
----
a
a
a

query  nosort
SELECT group_concat(table_1.column_2 separator ', ') AS alias_1 FROM table_1 ORDER BY table_1.column_2 ASC LIMIT 10
----
a, a, a

query  nosort
SELECT group_concat(table_1.column_3 separator ', ') AS alias_1 FROM table_1 ORDER BY table_1.column_2 DESC LIMIT 10
----
a, a, a

query  nosort
SELECT table_1.column_2 AS alias_1 FROM table_1 ORDER BY table_1.column_2 DESC LIMIT 10
----
a
a
a

query  nosort
SELECT group_concat(table_1.column_4 separator ', ') AS alias_1 FROM table_1 ORDER BY table_1.column_4 DESC LIMIT 10
----
a, a, a
