# Generated by:
#     target/debug/noria-logictest generate --operations group_concat,is_null_filters --compare-to mysql://root@localhost/mysql --subquery-depth 1 --rows-per-table 5 -o logictests/generated/group_concat,is_null_filters.test --include-deletes
# failure: ENG-339

statement ok
CREATE TABLE table_1 (column_14 TEXT, column_18 INT(32), column_3 TEXT, column_17 TEXT, column_10 TEXT, column_7 TEXT, column_1 TEXT, column_16 TEXT, column_5 TEXT, column_15 TEXT, column_9 TEXT, column_13 TEXT, column_12 TEXT, column_11 TEXT, column_6 TEXT, column_4 TEXT, column_8 TEXT, column_2 INT(1), PRIMARY KEY (column_18))


statement ok
INSERT INTO table_1 (column_9, column_12, column_10, column_14, column_5, column_18, column_17, column_15, column_16, column_7, column_4, column_3, column_8, column_13, column_6, column_11, column_2, column_1) VALUES ('a', 'a', 'a', 'a', 'a', 2, 'a', 'a', 'a', 'a', 'a', 'a', 'a', 'a', 'a', 'a', 1, 'a'), ('a', 'a', 'a', 'a', 'a', 3, 'a', 'a', 'a', 'a', 'a', 'a', 'a', 'a', 'a', 'a', 1, 'a'), ('a', 'a', 'a', 'a', 'a', 4, 'a', 'a', 'a', 'a', 'a', 'a', 'a', 'a', 'a', 'a', 1, 'a'), ('a', 'a', 'a', 'a', 'a', 5, 'a', 'a', 'a', 'a', 'a', 'a', 'a', 'a', 'a', 'a', 1, 'a'), ('a', 'a', 'a', 'a', 'a', 6, 'a', 'a', 'a', 'a', 'a', 'a', 'a', 'a', 'a', 'a', 1, 'a')


query  nosort
SELECT group_concat(table_1.column_1 separator ', ') AS alias_1 FROM table_1
----
a, a, a, a, a

query  nosort
SELECT table_1.column_2 AS alias_1 FROM table_1 WHERE (table_1.column_2 IS NULL)
----


query  nosort
SELECT table_1.column_2 AS alias_1 FROM table_1 WHERE (table_1.column_2 IS NOT NULL)
----
1
1
1
1
1

query  nosort
SELECT table_1.column_2 AS alias_1 FROM table_1 WHERE (table_1.column_2 IS NULL)
----


query  nosort
SELECT table_1.column_2 AS alias_1 FROM table_1 WHERE (table_1.column_2 IS NOT NULL)
----
1
1
1
1
1

query  nosort
SELECT group_concat(table_1.column_3 separator ', ') AS alias_1, table_1.column_2 AS alias_2 FROM table_1 WHERE (table_1.column_2 IS NULL) GROUP BY table_1.column_2
----


query  nosort
SELECT group_concat(table_1.column_4 separator ', ') AS alias_1, table_1.column_2 AS alias_2 FROM table_1 WHERE (table_1.column_2 IS NOT NULL) GROUP BY table_1.column_2
----
a, a, a, a, a
1

query  nosort
SELECT group_concat(table_1.column_5 separator ', ') AS alias_1, table_1.column_2 AS alias_2 FROM table_1 WHERE (table_1.column_2 IS NULL) GROUP BY table_1.column_2
----


query  nosort
SELECT group_concat(table_1.column_6 separator ', ') AS alias_1, table_1.column_2 AS alias_2 FROM table_1 WHERE (table_1.column_2 IS NOT NULL) GROUP BY table_1.column_2
----
a, a, a, a, a
1

query  nosort
SELECT table_1.column_2 AS alias_1, table_1.column_2 AS alias_2 FROM table_1 WHERE ((table_1.column_2 IS NULL) AND (table_1.column_2 IS NOT NULL))
----


query  nosort
SELECT table_1.column_2 AS alias_1, table_1.column_2 AS alias_2 FROM table_1 WHERE ((table_1.column_2 IS NULL) OR (table_1.column_2 IS NULL))
----


query  nosort
SELECT table_1.column_2 AS alias_1, table_1.column_2 AS alias_2 FROM table_1 WHERE ((table_1.column_2 IS NULL) OR (table_1.column_2 IS NOT NULL))
----
1
1
1
1
1
1
1
1
1
1

query  nosort
SELECT table_1.column_2 AS alias_1, table_1.column_2 AS alias_2 FROM table_1 WHERE ((table_1.column_2 IS NOT NULL) OR (table_1.column_2 IS NULL))
----
1
1
1
1
1
1
1
1
1
1

query  nosort
SELECT table_1.column_2 AS alias_1, table_1.column_2 AS alias_2 FROM table_1 WHERE ((table_1.column_2 IS NOT NULL) OR (table_1.column_2 IS NOT NULL))
----
1
1
1
1
1
1
1
1
1
1

query  nosort
SELECT table_1.column_2 AS alias_1, table_1.column_2 AS alias_2 FROM table_1 WHERE ((table_1.column_2 IS NULL) OR (table_1.column_2 IS NOT NULL))
----
1
1
1
1
1
1
1
1
1
1

query  nosort
SELECT group_concat(table_1.column_7 separator ', ') AS alias_1, table_1.column_2 AS alias_2, table_1.column_2 AS alias_3 FROM table_1 WHERE ((table_1.column_2 IS NULL) AND (table_1.column_2 IS NOT NULL)) GROUP BY table_1.column_2, table_1.column_2
----


query  nosort
SELECT group_concat(table_1.column_8 separator ', ') AS alias_1, table_1.column_2 AS alias_2, table_1.column_2 AS alias_3 FROM table_1 WHERE ((table_1.column_2 IS NULL) OR (table_1.column_2 IS NULL)) GROUP BY table_1.column_2, table_1.column_2
----


query  nosort
SELECT group_concat(table_1.column_9 separator ', ') AS alias_1, table_1.column_2 AS alias_2, table_1.column_2 AS alias_3 FROM table_1 WHERE ((table_1.column_2 IS NULL) OR (table_1.column_2 IS NOT NULL)) GROUP BY table_1.column_2, table_1.column_2
----
a, a, a, a, a
1
1

query  nosort
SELECT group_concat(table_1.column_10 separator ', ') AS alias_1, table_1.column_2 AS alias_2, table_1.column_2 AS alias_3 FROM table_1 WHERE ((table_1.column_2 IS NOT NULL) OR (table_1.column_2 IS NULL)) GROUP BY table_1.column_2, table_1.column_2
----
a, a, a, a, a
1
1

query  nosort
SELECT group_concat(table_1.column_11 separator ', ') AS alias_1, table_1.column_2 AS alias_2, table_1.column_2 AS alias_3 FROM table_1 WHERE ((table_1.column_2 IS NOT NULL) OR (table_1.column_2 IS NOT NULL)) GROUP BY table_1.column_2, table_1.column_2
----
a, a, a, a, a
1
1

query  nosort
SELECT group_concat(table_1.column_12 separator ', ') AS alias_1, table_1.column_2 AS alias_2, table_1.column_2 AS alias_3 FROM table_1 WHERE ((table_1.column_2 IS NULL) OR (table_1.column_2 IS NOT NULL)) GROUP BY table_1.column_2, table_1.column_2
----
a, a, a, a, a
1
1

query  nosort
SELECT table_1.column_2 AS alias_1, table_1.column_2 AS alias_2, table_1.column_2 AS alias_3 FROM table_1 WHERE (((table_1.column_2 IS NULL) AND (table_1.column_2 IS NOT NULL)) OR (table_1.column_2 IS NULL))
----


query  nosort
SELECT table_1.column_2 AS alias_1, table_1.column_2 AS alias_2, table_1.column_2 AS alias_3 FROM table_1 WHERE (((table_1.column_2 IS NULL) AND (table_1.column_2 IS NOT NULL)) OR (table_1.column_2 IS NOT NULL))
----
1
1
1
1
1
1
1
1
1
1
1
1
1
1
1

query  nosort
SELECT table_1.column_2 AS alias_1, table_1.column_2 AS alias_2, table_1.column_2 AS alias_3 FROM table_1 WHERE (((table_1.column_2 IS NULL) OR (table_1.column_2 IS NULL)) OR (table_1.column_2 IS NOT NULL))
----
1
1
1
1
1
1
1
1
1
1
1
1
1
1
1

query  nosort
SELECT table_1.column_2 AS alias_1, table_1.column_2 AS alias_2, table_1.column_2 AS alias_3 FROM table_1 WHERE (((table_1.column_2 IS NOT NULL) OR (table_1.column_2 IS NULL)) OR (table_1.column_2 IS NOT NULL))
----
1
1
1
1
1
1
1
1
1
1
1
1
1
1
1

query  nosort
SELECT group_concat(table_1.column_13 separator ', ') AS alias_1, table_1.column_2 AS alias_2, table_1.column_2 AS alias_3, table_1.column_2 AS alias_4 FROM table_1 WHERE (((table_1.column_2 IS NULL) AND (table_1.column_2 IS NOT NULL)) OR (table_1.column_2 IS NULL)) GROUP BY table_1.column_2, table_1.column_2, table_1.column_2
----


query  nosort
SELECT group_concat(table_1.column_14 separator ', ') AS alias_1, table_1.column_2 AS alias_2, table_1.column_2 AS alias_3, table_1.column_2 AS alias_4 FROM table_1 WHERE (((table_1.column_2 IS NULL) AND (table_1.column_2 IS NOT NULL)) OR (table_1.column_2 IS NOT NULL)) GROUP BY table_1.column_2, table_1.column_2, table_1.column_2
----
a, a, a, a, a
1
1
1

query  nosort
SELECT group_concat(table_1.column_15 separator ', ') AS alias_1, table_1.column_2 AS alias_2, table_1.column_2 AS alias_3, table_1.column_2 AS alias_4 FROM table_1 WHERE (((table_1.column_2 IS NULL) OR (table_1.column_2 IS NULL)) OR (table_1.column_2 IS NOT NULL)) GROUP BY table_1.column_2, table_1.column_2, table_1.column_2
----
a, a, a, a, a
1
1
1

query  nosort
SELECT group_concat(table_1.column_16 separator ', ') AS alias_1, table_1.column_2 AS alias_2, table_1.column_2 AS alias_3, table_1.column_2 AS alias_4 FROM table_1 WHERE (((table_1.column_2 IS NOT NULL) OR (table_1.column_2 IS NULL)) OR (table_1.column_2 IS NOT NULL)) GROUP BY table_1.column_2, table_1.column_2, table_1.column_2
----
a, a, a, a, a
1
1
1

query  nosort
SELECT table_1.column_2 AS alias_1, table_1.column_2 AS alias_2, table_1.column_2 AS alias_3, table_1.column_2 AS alias_4 FROM table_1 WHERE ((((table_1.column_2 IS NULL) AND (table_1.column_2 IS NOT NULL)) OR (table_1.column_2 IS NULL)) OR (table_1.column_2 IS NOT NULL))
----
1
1
1
1
1
1
1
1
1
1
1
1
1
1
1
1
1
1
1
1

query  nosort
SELECT group_concat(table_1.column_17 separator ', ') AS alias_1, table_1.column_2 AS alias_2, table_1.column_2 AS alias_3, table_1.column_2 AS alias_4, table_1.column_2 AS alias_5 FROM table_1 WHERE ((((table_1.column_2 IS NULL) AND (table_1.column_2 IS NOT NULL)) OR (table_1.column_2 IS NULL)) OR (table_1.column_2 IS NOT NULL)) GROUP BY table_1.column_2, table_1.column_2, table_1.column_2, table_1.column_2
----
a, a, a, a, a
1
1
1
1

statement ok
DELETE FROM table_1 WHERE (column_18 = 2)


statement ok
DELETE FROM table_1 WHERE (column_18 = 3)


query  nosort
SELECT group_concat(table_1.column_1 separator ', ') AS alias_1 FROM table_1
----
a, a, a

query  nosort
SELECT table_1.column_2 AS alias_1 FROM table_1 WHERE (table_1.column_2 IS NULL)
----


query  nosort
SELECT table_1.column_2 AS alias_1 FROM table_1 WHERE (table_1.column_2 IS NOT NULL)
----
1
1
1

query  nosort
SELECT table_1.column_2 AS alias_1 FROM table_1 WHERE (table_1.column_2 IS NULL)
----


query  nosort
SELECT table_1.column_2 AS alias_1 FROM table_1 WHERE (table_1.column_2 IS NOT NULL)
----
1
1
1

query  nosort
SELECT group_concat(table_1.column_3 separator ', ') AS alias_1, table_1.column_2 AS alias_2 FROM table_1 WHERE (table_1.column_2 IS NULL) GROUP BY table_1.column_2
----


query  nosort
SELECT group_concat(table_1.column_4 separator ', ') AS alias_1, table_1.column_2 AS alias_2 FROM table_1 WHERE (table_1.column_2 IS NOT NULL) GROUP BY table_1.column_2
----
a, a, a
1

query  nosort
SELECT group_concat(table_1.column_5 separator ', ') AS alias_1, table_1.column_2 AS alias_2 FROM table_1 WHERE (table_1.column_2 IS NULL) GROUP BY table_1.column_2
----


query  nosort
SELECT group_concat(table_1.column_6 separator ', ') AS alias_1, table_1.column_2 AS alias_2 FROM table_1 WHERE (table_1.column_2 IS NOT NULL) GROUP BY table_1.column_2
----
a, a, a
1

query  nosort
SELECT table_1.column_2 AS alias_1, table_1.column_2 AS alias_2 FROM table_1 WHERE ((table_1.column_2 IS NULL) AND (table_1.column_2 IS NOT NULL))
----


query  nosort
SELECT table_1.column_2 AS alias_1, table_1.column_2 AS alias_2 FROM table_1 WHERE ((table_1.column_2 IS NULL) OR (table_1.column_2 IS NULL))
----


query  nosort
SELECT table_1.column_2 AS alias_1, table_1.column_2 AS alias_2 FROM table_1 WHERE ((table_1.column_2 IS NULL) OR (table_1.column_2 IS NOT NULL))
----
1
1
1
1
1
1

query  nosort
SELECT table_1.column_2 AS alias_1, table_1.column_2 AS alias_2 FROM table_1 WHERE ((table_1.column_2 IS NOT NULL) OR (table_1.column_2 IS NULL))
----
1
1
1
1
1
1

query  nosort
SELECT table_1.column_2 AS alias_1, table_1.column_2 AS alias_2 FROM table_1 WHERE ((table_1.column_2 IS NOT NULL) OR (table_1.column_2 IS NOT NULL))
----
1
1
1
1
1
1

query  nosort
SELECT table_1.column_2 AS alias_1, table_1.column_2 AS alias_2 FROM table_1 WHERE ((table_1.column_2 IS NULL) OR (table_1.column_2 IS NOT NULL))
----
1
1
1
1
1
1

query  nosort
SELECT group_concat(table_1.column_7 separator ', ') AS alias_1, table_1.column_2 AS alias_2, table_1.column_2 AS alias_3 FROM table_1 WHERE ((table_1.column_2 IS NULL) AND (table_1.column_2 IS NOT NULL)) GROUP BY table_1.column_2, table_1.column_2
----


query  nosort
SELECT group_concat(table_1.column_8 separator ', ') AS alias_1, table_1.column_2 AS alias_2, table_1.column_2 AS alias_3 FROM table_1 WHERE ((table_1.column_2 IS NULL) OR (table_1.column_2 IS NULL)) GROUP BY table_1.column_2, table_1.column_2
----


query  nosort
SELECT group_concat(table_1.column_9 separator ', ') AS alias_1, table_1.column_2 AS alias_2, table_1.column_2 AS alias_3 FROM table_1 WHERE ((table_1.column_2 IS NULL) OR (table_1.column_2 IS NOT NULL)) GROUP BY table_1.column_2, table_1.column_2
----
a, a, a
1
1

query  nosort
SELECT group_concat(table_1.column_10 separator ', ') AS alias_1, table_1.column_2 AS alias_2, table_1.column_2 AS alias_3 FROM table_1 WHERE ((table_1.column_2 IS NOT NULL) OR (table_1.column_2 IS NULL)) GROUP BY table_1.column_2, table_1.column_2
----
a, a, a
1
1

query  nosort
SELECT group_concat(table_1.column_11 separator ', ') AS alias_1, table_1.column_2 AS alias_2, table_1.column_2 AS alias_3 FROM table_1 WHERE ((table_1.column_2 IS NOT NULL) OR (table_1.column_2 IS NOT NULL)) GROUP BY table_1.column_2, table_1.column_2
----
a, a, a
1
1

query  nosort
SELECT group_concat(table_1.column_12 separator ', ') AS alias_1, table_1.column_2 AS alias_2, table_1.column_2 AS alias_3 FROM table_1 WHERE ((table_1.column_2 IS NULL) OR (table_1.column_2 IS NOT NULL)) GROUP BY table_1.column_2, table_1.column_2
----
a, a, a
1
1

query  nosort
SELECT table_1.column_2 AS alias_1, table_1.column_2 AS alias_2, table_1.column_2 AS alias_3 FROM table_1 WHERE (((table_1.column_2 IS NULL) AND (table_1.column_2 IS NOT NULL)) OR (table_1.column_2 IS NULL))
----


query  nosort
SELECT table_1.column_2 AS alias_1, table_1.column_2 AS alias_2, table_1.column_2 AS alias_3 FROM table_1 WHERE (((table_1.column_2 IS NULL) AND (table_1.column_2 IS NOT NULL)) OR (table_1.column_2 IS NOT NULL))
----
1
1
1
1
1
1
1
1
1

query  nosort
SELECT table_1.column_2 AS alias_1, table_1.column_2 AS alias_2, table_1.column_2 AS alias_3 FROM table_1 WHERE (((table_1.column_2 IS NULL) OR (table_1.column_2 IS NULL)) OR (table_1.column_2 IS NOT NULL))
----
1
1
1
1
1
1
1
1
1

query  nosort
SELECT table_1.column_2 AS alias_1, table_1.column_2 AS alias_2, table_1.column_2 AS alias_3 FROM table_1 WHERE (((table_1.column_2 IS NOT NULL) OR (table_1.column_2 IS NULL)) OR (table_1.column_2 IS NOT NULL))
----
1
1
1
1
1
1
1
1
1

query  nosort
SELECT group_concat(table_1.column_13 separator ', ') AS alias_1, table_1.column_2 AS alias_2, table_1.column_2 AS alias_3, table_1.column_2 AS alias_4 FROM table_1 WHERE (((table_1.column_2 IS NULL) AND (table_1.column_2 IS NOT NULL)) OR (table_1.column_2 IS NULL)) GROUP BY table_1.column_2, table_1.column_2, table_1.column_2
----


query  nosort
SELECT group_concat(table_1.column_14 separator ', ') AS alias_1, table_1.column_2 AS alias_2, table_1.column_2 AS alias_3, table_1.column_2 AS alias_4 FROM table_1 WHERE (((table_1.column_2 IS NULL) AND (table_1.column_2 IS NOT NULL)) OR (table_1.column_2 IS NOT NULL)) GROUP BY table_1.column_2, table_1.column_2, table_1.column_2
----
a, a, a
1
1
1

query  nosort
SELECT group_concat(table_1.column_15 separator ', ') AS alias_1, table_1.column_2 AS alias_2, table_1.column_2 AS alias_3, table_1.column_2 AS alias_4 FROM table_1 WHERE (((table_1.column_2 IS NULL) OR (table_1.column_2 IS NULL)) OR (table_1.column_2 IS NOT NULL)) GROUP BY table_1.column_2, table_1.column_2, table_1.column_2
----
a, a, a
1
1
1

query  nosort
SELECT group_concat(table_1.column_16 separator ', ') AS alias_1, table_1.column_2 AS alias_2, table_1.column_2 AS alias_3, table_1.column_2 AS alias_4 FROM table_1 WHERE (((table_1.column_2 IS NOT NULL) OR (table_1.column_2 IS NULL)) OR (table_1.column_2 IS NOT NULL)) GROUP BY table_1.column_2, table_1.column_2, table_1.column_2
----
a, a, a
1
1
1

query  nosort
SELECT table_1.column_2 AS alias_1, table_1.column_2 AS alias_2, table_1.column_2 AS alias_3, table_1.column_2 AS alias_4 FROM table_1 WHERE ((((table_1.column_2 IS NULL) AND (table_1.column_2 IS NOT NULL)) OR (table_1.column_2 IS NULL)) OR (table_1.column_2 IS NOT NULL))
----
1
1
1
1
1
1
1
1
1
1
1
1

query  nosort
SELECT group_concat(table_1.column_17 separator ', ') AS alias_1, table_1.column_2 AS alias_2, table_1.column_2 AS alias_3, table_1.column_2 AS alias_4, table_1.column_2 AS alias_5 FROM table_1 WHERE ((((table_1.column_2 IS NULL) AND (table_1.column_2 IS NOT NULL)) OR (table_1.column_2 IS NULL)) OR (table_1.column_2 IS NOT NULL)) GROUP BY table_1.column_2, table_1.column_2, table_1.column_2, table_1.column_2
----
a, a, a
1
1
1
1
