# Generated by:
#     target/debug/noria-logictest generate --operations group_concat,left_join,cte --compare-to mysql://root@localhost/mysql --subquery-depth 1 --rows-per-table 5 -o logictests/generated/group_concat,left_join,cte.test --include-deletes
# failure: ENG-344

statement ok
CREATE TABLE table_10 (column_6 INT(32), column_1 INT(32), column_2 INT(32), column_3 TEXT, column_4 INT(32), column_5 TEXT, column_7 INT(32), PRIMARY KEY (column_7))


statement ok
CREATE TABLE table_9 (column_4 INT(32), column_1 INT(32), column_5 INT(32), column_2 INT(32), column_6 INT(32), column_3 TEXT, PRIMARY KEY (column_6))


statement ok
CREATE TABLE table_5 (column_3 TEXT, column_4 INT(32), column_2 INT(32), column_5 TEXT, column_6 INT(32), column_1 INT(32), PRIMARY KEY (column_6))


statement ok
CREATE TABLE table_6 (column_1 INT(32), column_2 INT(32), column_3 INT(32), PRIMARY KEY (column_3))


statement ok
CREATE TABLE table_2 (column_1 INT(32), column_2 INT(32), column_4 TEXT, column_5 INT(32), column_6 INT(32), column_3 TEXT, PRIMARY KEY (column_6))


statement ok
CREATE TABLE table_8 (column_2 INT(32), column_1 INT(32), column_3 INT(32), PRIMARY KEY (column_3))


statement ok
CREATE TABLE table_13 (column_2 INT(32), column_3 INT(32), column_1 INT(32), PRIMARY KEY (column_3))


statement ok
CREATE TABLE table_12 (column_1 INT(32), column_2 INT(32), column_3 INT(32), PRIMARY KEY (column_3))


statement ok
CREATE TABLE table_4 (column_2 INT(32), column_4 INT(32), column_7 INT(32), column_8 INT(32), column_5 INT(32), column_1 INT(32), column_6 TEXT, column_3 INT(32), PRIMARY KEY (column_8))


statement ok
CREATE TABLE table_1 (column_2 TEXT, column_6 INT(32), column_3 TEXT, column_4 INT(32), column_5 INT(32), column_1 TEXT, PRIMARY KEY (column_6))


statement ok
CREATE TABLE table_7 (column_3 INT(32), column_1 INT(32), column_2 INT(32), PRIMARY KEY (column_3))


statement ok
CREATE TABLE table_11 (column_1 INT(32), column_3 INT(32), column_2 INT(32), PRIMARY KEY (column_3))


statement ok
CREATE TABLE table_3 (column_4 TEXT, column_1 INT(32), column_2 INT(32), column_5 INT(32), column_3 INT(32), PRIMARY KEY (column_5))


statement ok
INSERT INTO table_10 (column_1, column_7, column_3, column_4, column_2, column_5, column_6) VALUES (1, 2, 'a', 1, 1, 'a', 1), (1, 3, 'a', 1, 1, 'a', 1), (1, 4, 'a', 1, 1, 'a', 1), (1, 5, 'a', 1, 1, 'a', 1), (1, 6, 'a', 1, 1, 'a', 1)


statement ok
INSERT INTO table_9 (column_3, column_1, column_4, column_6, column_5, column_2) VALUES ('a', 1, 1, 2, 1, 1), ('a', 1, 1, 3, 1, 1), ('a', 1, 1, 4, 1, 1), ('a', 1, 1, 5, 1, 1), ('a', 1, 1, 6, 1, 1)


statement ok
INSERT INTO table_5 (column_3, column_6, column_1, column_2, column_5, column_4) VALUES ('a', 2, 1, 1, 'a', 1), ('a', 3, 1, 1, 'a', 1), ('a', 4, 1, 1, 'a', 1), ('a', 5, 1, 1, 'a', 1), ('a', 6, 1, 1, 'a', 1)


statement ok
INSERT INTO table_6 (column_1, column_2, column_3) VALUES (1, 1, 2), (1, 1, 3), (1, 1, 4), (1, 1, 5), (1, 1, 6)


statement ok
INSERT INTO table_2 (column_2, column_5, column_6, column_1, column_4, column_3) VALUES (1, 1, 2, 1, 'a', 'a'), (1, 1, 3, 1, 'a', 'a'), (1, 1, 4, 1, 'a', 'a'), (1, 1, 5, 1, 'a', 'a'), (1, 1, 6, 1, 'a', 'a')


statement ok
INSERT INTO table_8 (column_1, column_3, column_2) VALUES (1, 2, 1), (1, 3, 1), (1, 4, 1), (1, 5, 1), (1, 6, 1)


statement ok
INSERT INTO table_13 (column_3, column_1, column_2) VALUES (2, 1, 1), (3, 1, 1), (4, 1, 1), (5, 1, 1), (6, 1, 1)


statement ok
INSERT INTO table_12 (column_3, column_1, column_2) VALUES (2, 1, 1), (3, 1, 1), (4, 1, 1), (5, 1, 1), (6, 1, 1)


statement ok
INSERT INTO table_4 (column_4, column_8, column_5, column_1, column_3, column_2, column_6, column_7) VALUES (1, 2, 1, 1, 1, 1, 'a', 1), (1, 3, 1, 1, 1, 1, 'a', 1), (1, 4, 1, 1, 1, 1, 'a', 1), (1, 5, 1, 1, 1, 1, 'a', 1), (1, 6, 1, 1, 1, 1, 'a', 1)


statement ok
INSERT INTO table_1 (column_2, column_6, column_1, column_4, column_3, column_5) VALUES ('a', 2, 'a', 1, 'a', 1), ('a', 3, 'a', 1, 'a', 1), ('a', 4, 'a', 1, 'a', 1), ('a', 5, 'a', 1, 'a', 1), ('a', 6, 'a', 1, 'a', 1)


statement ok
INSERT INTO table_7 (column_1, column_2, column_3) VALUES (1, 1, 2), (1, 1, 3), (1, 1, 4), (1, 1, 5), (1, 1, 6)


statement ok
INSERT INTO table_11 (column_3, column_2, column_1) VALUES (2, 1, 1), (3, 1, 1), (4, 1, 1), (5, 1, 1), (6, 1, 1)


statement ok
INSERT INTO table_3 (column_5, column_4, column_3, column_1, column_2) VALUES (2, 'a', 1, 1, 1), (3, 'a', 1, 1, 1), (4, 'a', 1, 1, 1), (5, 'a', 1, 1, 1), (6, 'a', 1, 1, 1)


query  nosort
WITH alias_3 AS (SELECT group_concat(table_1.column_2 separator ', ') AS alias_2 FROM table_1) SELECT group_concat(table_1.column_1 separator ', ') AS alias_1 FROM table_1 INNER JOIN alias_3 ON (table_1.column_2 = alias_3.alias_2)
----
NULL

query  nosort
WITH alias_4 AS (SELECT table_1.column_5 AS alias_2, table_2.column_2 AS alias_3 FROM table_1 LEFT JOIN table_2 ON (table_1.column_4 = table_2.column_1)) SELECT group_concat(table_1.column_3 separator ', ') AS alias_1 FROM table_1 INNER JOIN alias_4 ON (table_1.column_2 = alias_4.alias_2)
----
NULL

query  nosort
WITH alias_5 AS (SELECT group_concat(table_2.column_4 separator ', ') AS alias_2, table_2.column_5 AS alias_3, table_3.column_2 AS alias_4 FROM table_2 LEFT JOIN table_3 ON (table_2.column_1 = table_3.column_1) GROUP BY table_2.column_5, table_3.column_2) SELECT group_concat(table_2.column_3 separator ', ') AS alias_1 FROM table_2 INNER JOIN alias_5 ON (table_2.column_1 = alias_5.alias_2)
----
NULL

query  nosort
WITH alias_4 AS (SELECT group_concat(table_3.column_4 separator ', ') AS alias_3 FROM table_3) SELECT table_3.column_3 AS alias_1, table_4.column_2 AS alias_2 FROM table_3 LEFT JOIN table_4 ON (table_3.column_2 = table_4.column_1) INNER JOIN alias_4 ON (table_3.column_4 = alias_4.alias_3)
----


query  nosort
WITH alias_5 AS (SELECT table_4.column_4 AS alias_3, table_6.column_2 AS alias_4 FROM table_4 LEFT JOIN table_6 ON (table_4.column_3 = table_6.column_1)) SELECT table_4.column_3 AS alias_1, table_5.column_2 AS alias_2 FROM table_4 LEFT JOIN table_5 ON (table_4.column_2 = table_5.column_1) INNER JOIN alias_5 ON (table_4.column_1 = alias_5.alias_3)
----
1250 values hashing to 297e8f72268fc4cf81241309ad0bbfc9

query  nosort
WITH alias_6 AS (SELECT group_concat(table_4.column_6 separator ', ') AS alias_3, table_4.column_7 AS alias_4, table_8.column_2 AS alias_5 FROM table_4 LEFT JOIN table_8 ON (table_4.column_1 = table_8.column_1) GROUP BY table_4.column_7, table_8.column_2) SELECT table_4.column_5 AS alias_1, table_7.column_2 AS alias_2 FROM table_4 LEFT JOIN table_7 ON (table_4.column_1 = table_7.column_1) INNER JOIN alias_6 ON (table_4.column_1 = alias_6.alias_3)
----


query  nosort
WITH alias_5 AS (SELECT group_concat(table_5.column_5 separator ', ') AS alias_4 FROM table_5) SELECT group_concat(table_5.column_3 separator ', ') AS alias_1, table_5.column_4 AS alias_2, table_9.column_2 AS alias_3 FROM table_5 LEFT JOIN table_9 ON (table_5.column_2 = table_9.column_1) INNER JOIN alias_5 ON (table_5.column_3 = alias_5.alias_4) GROUP BY table_5.column_4, table_9.column_2
----


query  nosort
WITH alias_6 AS (SELECT table_9.column_5 AS alias_4, table_11.column_2 AS alias_5 FROM table_9 LEFT JOIN table_11 ON (table_9.column_4 = table_11.column_1)) SELECT group_concat(table_9.column_3 separator ', ') AS alias_1, table_9.column_4 AS alias_2, table_10.column_2 AS alias_3 FROM table_9 LEFT JOIN table_10 ON (table_9.column_1 = table_10.column_1) INNER JOIN alias_6 ON (table_9.column_4 = alias_6.alias_4) GROUP BY table_9.column_4, table_10.column_2
----
a, a, a, a, a, a, a, a, a, a, a, a, a, a, a, a, a, a, a, a, a, a, a, a, a, a, a, a, a, a, a, a, a, a, a, a, a, a, a, a, a, a, a, a, a, a, a, a, a, a, a, a, a, a, a, a, a, a, a, a, a, a, a, a, a, a, a, a, a, a, a, a, a, a, a, a, a, a, a, a, a, a, a, a, a, a, a, a, a, a, a, a, a, a, a, a, a, a, a, a, a, a, a, a, a, a, a, a, a, a, a, a, a, a, a, a, a, a, a, a, a, a, a, a, a, a, a, a, a, a, a, a, a, a, a, a, a, a, a, a, a, a, a, a, a, a, a, a, a, a, a, a, a, a, a, a, a, a, a, a, a, a, a, a, a, a, a, a, a, a, a, a, a, a, a, a, a, a, a, a, a, a, a, a, a, a, a, a, a, a, a, a, a, a, a, a, a, a, a, a, a, a, a, a, a, a, a, a, a, a, a, a, a, a, a, a, a, a, a, a, a, a, a, a, a, a, a, a, a, a, a, a, a, a, a, a, a, a, a, a, a, a, a, a, a, a, a, a, a, a, a, a, a, a, a, a, a, a, a, a, a, a, a, a, a, a, a, a, a, a, a, a, a, a, a, a, a, a, a, a, a, a, a, a, a, a, a, a, a, a, a, a, a, a, a, a, a, a, a, a, a, a, a, a, a, a, a, a, a, a, a, a, a, a, a, a, a, a, a, a, a, a, a, a, a, a, a, a, a, a, a, a, a, a, a, a, a, a, a, a, a, a
1
1

query  nosort
WITH alias_7 AS (SELECT group_concat(table_10.column_5 separator ', ') AS alias_4, table_10.column_6 AS alias_5, table_13.column_2 AS alias_6 FROM table_10 LEFT JOIN table_13 ON (table_10.column_1 = table_13.column_1) GROUP BY table_10.column_6, table_13.column_2) SELECT group_concat(table_10.column_3 separator ', ') AS alias_1, table_10.column_4 AS alias_2, table_12.column_2 AS alias_3 FROM table_10 LEFT JOIN table_12 ON (table_10.column_1 = table_12.column_1) INNER JOIN alias_7 ON (table_10.column_6 = alias_7.alias_4) GROUP BY table_10.column_4, table_12.column_2
----


statement ok
DELETE FROM table_10 WHERE (column_7 = 2)


statement ok
DELETE FROM table_10 WHERE (column_7 = 3)


statement ok
DELETE FROM table_9 WHERE (column_6 = 2)


statement ok
DELETE FROM table_9 WHERE (column_6 = 3)


statement ok
DELETE FROM table_5 WHERE (column_6 = 2)


statement ok
DELETE FROM table_5 WHERE (column_6 = 3)


statement ok
DELETE FROM table_6 WHERE (column_3 = 2)


statement ok
DELETE FROM table_6 WHERE (column_3 = 3)


statement ok
DELETE FROM table_2 WHERE (column_6 = 2)


statement ok
DELETE FROM table_2 WHERE (column_6 = 3)


statement ok
DELETE FROM table_8 WHERE (column_3 = 2)


statement ok
DELETE FROM table_8 WHERE (column_3 = 3)


statement ok
DELETE FROM table_13 WHERE (column_3 = 2)


statement ok
DELETE FROM table_13 WHERE (column_3 = 3)


statement ok
DELETE FROM table_12 WHERE (column_3 = 2)


statement ok
DELETE FROM table_12 WHERE (column_3 = 3)


statement ok
DELETE FROM table_4 WHERE (column_8 = 2)


statement ok
DELETE FROM table_4 WHERE (column_8 = 3)


statement ok
DELETE FROM table_1 WHERE (column_6 = 2)


statement ok
DELETE FROM table_1 WHERE (column_6 = 3)


statement ok
DELETE FROM table_7 WHERE (column_3 = 2)


statement ok
DELETE FROM table_7 WHERE (column_3 = 3)


statement ok
DELETE FROM table_11 WHERE (column_3 = 2)


statement ok
DELETE FROM table_11 WHERE (column_3 = 3)


statement ok
DELETE FROM table_3 WHERE (column_5 = 2)


statement ok
DELETE FROM table_3 WHERE (column_5 = 3)


query  nosort
WITH alias_3 AS (SELECT group_concat(table_1.column_2 separator ', ') AS alias_2 FROM table_1) SELECT group_concat(table_1.column_1 separator ', ') AS alias_1 FROM table_1 INNER JOIN alias_3 ON (table_1.column_2 = alias_3.alias_2)
----
NULL

query  nosort
WITH alias_4 AS (SELECT table_1.column_5 AS alias_2, table_2.column_2 AS alias_3 FROM table_1 LEFT JOIN table_2 ON (table_1.column_4 = table_2.column_1)) SELECT group_concat(table_1.column_3 separator ', ') AS alias_1 FROM table_1 INNER JOIN alias_4 ON (table_1.column_2 = alias_4.alias_2)
----
NULL

query  nosort
WITH alias_5 AS (SELECT group_concat(table_2.column_4 separator ', ') AS alias_2, table_2.column_5 AS alias_3, table_3.column_2 AS alias_4 FROM table_2 LEFT JOIN table_3 ON (table_2.column_1 = table_3.column_1) GROUP BY table_2.column_5, table_3.column_2) SELECT group_concat(table_2.column_3 separator ', ') AS alias_1 FROM table_2 INNER JOIN alias_5 ON (table_2.column_1 = alias_5.alias_2)
----
NULL

query  nosort
WITH alias_4 AS (SELECT group_concat(table_3.column_4 separator ', ') AS alias_3 FROM table_3) SELECT table_3.column_3 AS alias_1, table_4.column_2 AS alias_2 FROM table_3 LEFT JOIN table_4 ON (table_3.column_2 = table_4.column_1) INNER JOIN alias_4 ON (table_3.column_4 = alias_4.alias_3)
----


query  nosort
WITH alias_5 AS (SELECT table_4.column_4 AS alias_3, table_6.column_2 AS alias_4 FROM table_4 LEFT JOIN table_6 ON (table_4.column_3 = table_6.column_1)) SELECT table_4.column_3 AS alias_1, table_5.column_2 AS alias_2 FROM table_4 LEFT JOIN table_5 ON (table_4.column_2 = table_5.column_1) INNER JOIN alias_5 ON (table_4.column_1 = alias_5.alias_3)
----
162 values hashing to 8a24283b115305730b917316cbe232d5

query  nosort
WITH alias_6 AS (SELECT group_concat(table_4.column_6 separator ', ') AS alias_3, table_4.column_7 AS alias_4, table_8.column_2 AS alias_5 FROM table_4 LEFT JOIN table_8 ON (table_4.column_1 = table_8.column_1) GROUP BY table_4.column_7, table_8.column_2) SELECT table_4.column_5 AS alias_1, table_7.column_2 AS alias_2 FROM table_4 LEFT JOIN table_7 ON (table_4.column_1 = table_7.column_1) INNER JOIN alias_6 ON (table_4.column_1 = alias_6.alias_3)
----


query  nosort
WITH alias_5 AS (SELECT group_concat(table_5.column_5 separator ', ') AS alias_4 FROM table_5) SELECT group_concat(table_5.column_3 separator ', ') AS alias_1, table_5.column_4 AS alias_2, table_9.column_2 AS alias_3 FROM table_5 LEFT JOIN table_9 ON (table_5.column_2 = table_9.column_1) INNER JOIN alias_5 ON (table_5.column_3 = alias_5.alias_4) GROUP BY table_5.column_4, table_9.column_2
----


query  nosort
WITH alias_6 AS (SELECT table_9.column_5 AS alias_4, table_11.column_2 AS alias_5 FROM table_9 LEFT JOIN table_11 ON (table_9.column_4 = table_11.column_1)) SELECT group_concat(table_9.column_3 separator ', ') AS alias_1, table_9.column_4 AS alias_2, table_10.column_2 AS alias_3 FROM table_9 LEFT JOIN table_10 ON (table_9.column_1 = table_10.column_1) INNER JOIN alias_6 ON (table_9.column_4 = alias_6.alias_4) GROUP BY table_9.column_4, table_10.column_2
----
a, a, a, a, a, a, a, a, a, a, a, a, a, a, a, a, a, a, a, a, a, a, a, a, a, a, a, a, a, a, a, a, a, a, a, a, a, a, a, a, a, a, a, a, a, a, a, a, a, a, a, a, a, a, a, a, a, a, a, a, a, a, a, a, a, a, a, a, a, a, a, a, a, a, a, a, a, a, a, a, a
1
1

query  nosort
WITH alias_7 AS (SELECT group_concat(table_10.column_5 separator ', ') AS alias_4, table_10.column_6 AS alias_5, table_13.column_2 AS alias_6 FROM table_10 LEFT JOIN table_13 ON (table_10.column_1 = table_13.column_1) GROUP BY table_10.column_6, table_13.column_2) SELECT group_concat(table_10.column_3 separator ', ') AS alias_1, table_10.column_4 AS alias_2, table_12.column_2 AS alias_3 FROM table_10 LEFT JOIN table_12 ON (table_10.column_1 = table_12.column_1) INNER JOIN alias_7 ON (table_10.column_6 = alias_7.alias_4) GROUP BY table_10.column_4, table_12.column_2
----

