# Generated by:
#     target/debug/noria-logictest generate --operations max,min --compare-to mysql://root@localhost/mysql --subquery-depth 1 --rows-per-table 5 -o logictests/generated/max,min.test --include-deletes
# failure: ENG-341

statement ok
CREATE TABLE table_1 (column_2 INT(32), column_5 INT(32), column_1 INT(32), column_4 INT(32), column_3 INT(32), PRIMARY KEY (column_5))


statement ok
INSERT INTO table_1 (column_1, column_2, column_4, column_3, column_5) VALUES (1, 1, 1, 1, 2), (1, 1, 1, 1, 3), (1, 1, 1, 1, 4), (1, 1, 1, 1, 5), (1, 1, 1, 1, 6)


query  nosort
SELECT max(table_1.column_1) AS alias_1 FROM table_1
----
1

query  nosort
SELECT min(table_1.column_2) AS alias_1 FROM table_1
----
1

query  nosort
SELECT max(table_1.column_3) AS alias_1, min(table_1.column_4) AS alias_2 FROM table_1
----
1
1

statement ok
DELETE FROM table_1 WHERE (column_5 = 2)


statement ok
DELETE FROM table_1 WHERE (column_5 = 3)


query  nosort
SELECT max(table_1.column_1) AS alias_1 FROM table_1
----
1

query  nosort
SELECT min(table_1.column_2) AS alias_1 FROM table_1
----
1

query  nosort
SELECT max(table_1.column_3) AS alias_1, min(table_1.column_4) AS alias_2 FROM table_1
----
1
1
