# Generated by:
#     /home/grfn/code/readyset/readyset/target/debug/noria-logictest generate --operations param,inner_join,count_distinct --compare-to mysql://root@127.1/mysql --random --include-deletes --rows-per-table 5 -o ../../logictests/generated/param,inner_join,count_distinct.test

statement ok
CREATE TABLE table_3 (column_1 INT(32), column_2 INT(32), column_3 INT(32), column_4 INT(32), column_5 INT(32), PRIMARY KEY (column_5))


statement ok
CREATE TABLE table_1 (column_3 INT(32), column_1 INT(32), column_2 INT(32), PRIMARY KEY (column_3))


statement ok
CREATE TABLE table_4 (column_1 INT(32), column_4 INT(32), column_2 INT(32), column_3 INT(32), PRIMARY KEY (column_4))


statement ok
CREATE TABLE table_2 (column_2 INT(32), column_1 INT(32), column_4 INT(32), column_6 INT(32), column_7 INT(32), column_3 INT(32), column_5 INT(32), PRIMARY KEY (column_7))


statement ok
CREATE TABLE table_5 (column_3 INT(32), column_2 INT(32), column_1 INT(32), PRIMARY KEY (column_3))


statement ok
INSERT INTO table_3 (column_1, column_3, column_5, column_2, column_4) VALUES (-893631087, -1977163668, 0, -1012429074, 1659594602), (-849371403, 405419582, 1, -1219115312, 656769321), (1501825253, -235388787, 2, 121443360, -448255423), (1434185432, -652800949, 3, -1751939477, 1075381018), (-1102212271, 1854399516, 4, 1859130327, 1337731702)


statement ok
INSERT INTO table_1 (column_1, column_2, column_3) VALUES (-812233969, -402186552, 0), (-1562738731, 2006251619, 1), (1934025964, -545133778, 2), (1143105867, -1860925220, 3), (-399119757, 108226860, 4)


statement ok
INSERT INTO table_4 (column_2, column_3, column_4, column_1) VALUES (761868604, -193624789, 0, 1561131018), (1593070384, 1525077700, 1, 1445924656), (1526505269, -1670101859, 2, -28022076), (-118436941, -120887807, 3, -828455448), (-597853372, 1579113447, 4, -337479269)


statement ok
INSERT INTO table_2 (column_1, column_5, column_3, column_6, column_4, column_2, column_7) VALUES (1620274455, 874962400, 266673730, -1935186624, 1802121392, 71527900, 0), (1783667304, -1476983070, 312357, -822439340, 1388891204, 1389350867, 1), (-20374095, 1107213427, -514646528, 917404404, 902565820, -284741999, 2), (2024304625, -365987574, 546509105, 2053393540, -405342750, -154200865, 3), (-527758930, -394042790, -570480517, 675217371, -1097083699, 570869031, 4)


statement ok
INSERT INTO table_5 (column_1, column_3, column_2) VALUES (-132507554, 0, -1060747657), (479312104, 1, 937772065), (-1587450335, 2, 740245933), (-1463716775, 3, 1443114559), (-1959837456, 4, -1709162696)


query  nosort
SELECT table_1.column_1 AS alias_1 FROM table_1 WHERE (table_1.column_1 = ?)
? = 1
----


query  nosort
SELECT table_1.column_2 AS alias_1, table_2.column_2 AS alias_2 FROM table_1 INNER JOIN table_2 ON (table_1.column_1 = table_2.column_1)
----


query  nosort
SELECT count(distinct table_2.column_3) AS alias_1 FROM table_2
----
5

query  nosort
SELECT table_2.column_4 AS alias_1, table_3.column_2 AS alias_2 FROM table_2 INNER JOIN table_3 ON (table_2.column_2 = table_3.column_1) WHERE (table_2.column_2 = ?)
? = 1
----


query  nosort
SELECT count(distinct table_2.column_5) AS alias_1 FROM table_2 WHERE (table_2.column_2 = ?)
? = 1
----
0

query  nosort
SELECT table_2.column_6 AS alias_1, table_4.column_2 AS alias_2, count(distinct table_4.column_3) AS alias_3 FROM table_2 INNER JOIN table_4 ON (table_2.column_2 = table_4.column_1) GROUP BY table_2.column_6, table_4.column_2
----


query  nosort
SELECT table_3.column_3 AS alias_1, table_5.column_2 AS alias_2, count(distinct table_3.column_4) AS alias_3 FROM table_3 INNER JOIN table_5 ON (table_3.column_1 = table_5.column_1) WHERE (table_3.column_1 = ?) GROUP BY table_3.column_3, table_5.column_2
? = 1
----


statement ok
DELETE FROM table_3 WHERE (column_5 = 0)


statement ok
DELETE FROM table_3 WHERE (column_5 = 1)


statement ok
DELETE FROM table_1 WHERE (column_3 = 0)


statement ok
DELETE FROM table_1 WHERE (column_3 = 1)


statement ok
DELETE FROM table_4 WHERE (column_4 = 0)


statement ok
DELETE FROM table_4 WHERE (column_4 = 1)


statement ok
DELETE FROM table_2 WHERE (column_7 = 0)


statement ok
DELETE FROM table_2 WHERE (column_7 = 1)


statement ok
DELETE FROM table_5 WHERE (column_3 = 0)


statement ok
DELETE FROM table_5 WHERE (column_3 = 1)


query  nosort
SELECT table_1.column_1 AS alias_1 FROM table_1 WHERE (table_1.column_1 = ?)
? = 1
----


query  nosort
SELECT table_1.column_2 AS alias_1, table_2.column_2 AS alias_2 FROM table_1 INNER JOIN table_2 ON (table_1.column_1 = table_2.column_1)
----


query  nosort
SELECT count(distinct table_2.column_3) AS alias_1 FROM table_2
----
3

query  nosort
SELECT table_2.column_4 AS alias_1, table_3.column_2 AS alias_2 FROM table_2 INNER JOIN table_3 ON (table_2.column_2 = table_3.column_1) WHERE (table_2.column_2 = ?)
? = 1
----


query  nosort
SELECT count(distinct table_2.column_5) AS alias_1 FROM table_2 WHERE (table_2.column_2 = ?)
? = 1
----
0

query  nosort
SELECT table_2.column_6 AS alias_1, table_4.column_2 AS alias_2, count(distinct table_4.column_3) AS alias_3 FROM table_2 INNER JOIN table_4 ON (table_2.column_2 = table_4.column_1) GROUP BY table_2.column_6, table_4.column_2
----


query  nosort
SELECT table_3.column_3 AS alias_1, table_5.column_2 AS alias_2, count(distinct table_3.column_4) AS alias_3 FROM table_3 INNER JOIN table_5 ON (table_3.column_1 = table_5.column_1) WHERE (table_3.column_1 = ?) GROUP BY table_3.column_3, table_5.column_2
? = 1
----

