# Generated by:
#     target/debug/noria-logictest generate --operations sum,project_literal,join_subquery --compare-to mysql://root@localhost/mysql --subquery-depth 1 --rows-per-table 5 -o logictests/generated/sum,project_literal,join_subquery.test --include-deletes
# failure: ENG-335

statement ok
CREATE TABLE table_1 (column_2 INT(32), column_1 INT(32), column_10 INT(32), column_4 INT(32), column_5 INT(32), column_7 INT(32), column_3 INT(32), column_9 INT(32), column_11 INT(32), column_13 INT(32), column_8 INT(32), column_6 INT(32), column_12 INT(32), PRIMARY KEY (column_13))


statement ok
INSERT INTO table_1 (column_12, column_2, column_10, column_3, column_13, column_7, column_11, column_9, column_6, column_1, column_4, column_5, column_8) VALUES (1, 1, 1, 1, 2, 1, 1, 1, 1, 1, 1, 1, 1), (1, 1, 1, 1, 3, 1, 1, 1, 1, 1, 1, 1, 1), (1, 1, 1, 1, 4, 1, 1, 1, 1, 1, 1, 1, 1), (1, 1, 1, 1, 5, 1, 1, 1, 1, 1, 1, 1, 1), (1, 1, 1, 1, 6, 1, 1, 1, 1, 1, 1, 1, 1)


query  nosort
SELECT sum(table_1.column_1) AS alias_1 FROM table_1 INNER JOIN (SELECT sum(table_1.column_2) AS alias_2 FROM table_1) AS alias_3 ON (table_1.column_2 = alias_3.alias_2)
----
NULL

query  nosort
SELECT sum(table_1.column_3) AS alias_1 FROM table_1 INNER JOIN (SELECT 1 AS alias_2) AS alias_3 ON (table_1.column_2 = alias_3.alias_2)
----
5

query  nosort
SELECT sum(table_1.column_4) AS alias_1 FROM table_1 INNER JOIN (SELECT sum(table_1.column_5) AS alias_2, 1 FROM table_1) AS alias_3 ON (table_1.column_2 = alias_3.alias_2)
----
NULL

query  nosort
SELECT 1 FROM table_1 INNER JOIN (SELECT sum(table_1.column_6) AS alias_1 FROM table_1) AS alias_2 ON (table_1.column_2 = alias_2.alias_1)
----


query  nosort
SELECT 1 FROM table_1 INNER JOIN (SELECT 1 AS alias_1) AS alias_2 ON (table_1.column_2 = alias_2.alias_1)
----
1
1
1
1
1

query  nosort
SELECT 1 FROM table_1 INNER JOIN (SELECT sum(table_1.column_7) AS alias_1, 1 FROM table_1) AS alias_2 ON (table_1.column_2 = alias_2.alias_1)
----


query  nosort
SELECT sum(table_1.column_8) AS alias_1, 1 FROM table_1 INNER JOIN (SELECT sum(table_1.column_9) AS alias_2 FROM table_1) AS alias_3 ON (table_1.column_2 = alias_3.alias_2)
----
NULL
1

query  nosort
SELECT sum(table_1.column_10) AS alias_1, 1 FROM table_1 INNER JOIN (SELECT 1 AS alias_2) AS alias_3 ON (table_1.column_2 = alias_3.alias_2)
----
5
1

query  nosort
SELECT sum(table_1.column_11) AS alias_1, 1 FROM table_1 INNER JOIN (SELECT sum(table_1.column_12) AS alias_2, 1 FROM table_1) AS alias_3 ON (table_1.column_2 = alias_3.alias_2)
----
NULL
1

statement ok
DELETE FROM table_1 WHERE (column_13 = 2)


statement ok
DELETE FROM table_1 WHERE (column_13 = 3)


query  nosort
SELECT sum(table_1.column_1) AS alias_1 FROM table_1 INNER JOIN (SELECT sum(table_1.column_2) AS alias_2 FROM table_1) AS alias_3 ON (table_1.column_2 = alias_3.alias_2)
----
NULL

query  nosort
SELECT sum(table_1.column_3) AS alias_1 FROM table_1 INNER JOIN (SELECT 1 AS alias_2) AS alias_3 ON (table_1.column_2 = alias_3.alias_2)
----
3

query  nosort
SELECT sum(table_1.column_4) AS alias_1 FROM table_1 INNER JOIN (SELECT sum(table_1.column_5) AS alias_2, 1 FROM table_1) AS alias_3 ON (table_1.column_2 = alias_3.alias_2)
----
NULL

query  nosort
SELECT 1 FROM table_1 INNER JOIN (SELECT sum(table_1.column_6) AS alias_1 FROM table_1) AS alias_2 ON (table_1.column_2 = alias_2.alias_1)
----


query  nosort
SELECT 1 FROM table_1 INNER JOIN (SELECT 1 AS alias_1) AS alias_2 ON (table_1.column_2 = alias_2.alias_1)
----
1
1
1

query  nosort
SELECT 1 FROM table_1 INNER JOIN (SELECT sum(table_1.column_7) AS alias_1, 1 FROM table_1) AS alias_2 ON (table_1.column_2 = alias_2.alias_1)
----


query  nosort
SELECT sum(table_1.column_8) AS alias_1, 1 FROM table_1 INNER JOIN (SELECT sum(table_1.column_9) AS alias_2 FROM table_1) AS alias_3 ON (table_1.column_2 = alias_3.alias_2)
----
NULL
1

query  nosort
SELECT sum(table_1.column_10) AS alias_1, 1 FROM table_1 INNER JOIN (SELECT 1 AS alias_2) AS alias_3 ON (table_1.column_2 = alias_3.alias_2)
----
3
1

query  nosort
SELECT sum(table_1.column_11) AS alias_1, 1 FROM table_1 INNER JOIN (SELECT sum(table_1.column_12) AS alias_2, 1 FROM table_1) AS alias_3 ON (table_1.column_2 = alias_3.alias_2)
----
NULL
1
