# Generated by:
#     target/debug/noria-logictest generate --operations sum,group_concat --compare-to mysql://root@localhost/mysql --subquery-depth 1 --rows-per-table 5 -o logictests/generated/sum,group_concat.test --include-deletes
# failure: ENG-339

statement ok
CREATE TABLE table_1 (column_1 INT(32), column_4 TEXT, column_3 INT(32), column_2 TEXT, column_5 INT(32), PRIMARY KEY (column_5))


statement ok
INSERT INTO table_1 (column_2, column_5, column_3, column_4, column_1) VALUES ('a', 2, 1, 'a', 1), ('a', 3, 1, 'a', 1), ('a', 4, 1, 'a', 1), ('a', 5, 1, 'a', 1), ('a', 6, 1, 'a', 1)


query  nosort
SELECT sum(table_1.column_1) AS alias_1 FROM table_1
----
5

query  nosort
SELECT group_concat(table_1.column_2 separator ', ') AS alias_1 FROM table_1
----
a, a, a, a, a

query  nosort
SELECT sum(table_1.column_3) AS alias_1, group_concat(table_1.column_4 separator ', ') AS alias_2 FROM table_1
----
5
a, a, a, a, a

statement ok
DELETE FROM table_1 WHERE (column_5 = 2)


statement ok
DELETE FROM table_1 WHERE (column_5 = 3)


query  nosort
SELECT sum(table_1.column_1) AS alias_1 FROM table_1
----
3

query  nosort
SELECT group_concat(table_1.column_2 separator ', ') AS alias_1 FROM table_1
----
a, a, a

query  nosort
SELECT sum(table_1.column_3) AS alias_1, group_concat(table_1.column_4 separator ', ') AS alias_2 FROM table_1
----
3
a, a, a
