# Generated by:
#     target/debug/noria-logictest generate --operations sum,group_concat,distinct --compare-to mysql://root@localhost/mysql --subquery-depth 1 --rows-per-table 5 -o logictests/generated/sum,group_concat,distinct.test --include-deletes
# failure: ENG-339

statement ok
CREATE TABLE table_1 (column_9 INT(32), column_8 TEXT, column_3 INT(32), column_1 INT(32), column_5 INT(32), column_4 TEXT, column_2 TEXT, column_6 TEXT, column_7 INT(32), PRIMARY KEY (column_9))


statement ok
INSERT INTO table_1 (column_8, column_4, column_9, column_1, column_5, column_3, column_2, column_6, column_7) VALUES ('a', 'a', 2, 1, 1, 1, 'a', 'a', 1), ('a', 'a', 3, 1, 1, 1, 'a', 'a', 1), ('a', 'a', 4, 1, 1, 1, 'a', 'a', 1), ('a', 'a', 5, 1, 1, 1, 'a', 'a', 1), ('a', 'a', 6, 1, 1, 1, 'a', 'a', 1)


query  nosort
SELECT sum(table_1.column_1) AS alias_1 FROM table_1
----
5

query  nosort
SELECT group_concat(table_1.column_2 separator ', ') AS alias_1 FROM table_1
----
a, a, a, a, a

query  nosort
SELECT DISTINCT table_1.column_1 AS alias_1 FROM table_1
----
1

query  nosort
SELECT sum(table_1.column_3) AS alias_1, group_concat(table_1.column_4 separator ', ') AS alias_2 FROM table_1
----
5
a, a, a, a, a

query  nosort
SELECT DISTINCT sum(table_1.column_5) AS alias_1 FROM table_1
----
5

query  nosort
SELECT DISTINCT group_concat(table_1.column_6 separator ', ') AS alias_1 FROM table_1
----
a, a, a, a, a

query  nosort
SELECT DISTINCT sum(table_1.column_7) AS alias_1, group_concat(table_1.column_8 separator ', ') AS alias_2 FROM table_1
----
5
a, a, a, a, a

statement ok
DELETE FROM table_1 WHERE (column_9 = 2)


statement ok
DELETE FROM table_1 WHERE (column_9 = 3)


query  nosort
SELECT sum(table_1.column_1) AS alias_1 FROM table_1
----
3

query  nosort
SELECT group_concat(table_1.column_2 separator ', ') AS alias_1 FROM table_1
----
a, a, a

query  nosort
SELECT DISTINCT table_1.column_1 AS alias_1 FROM table_1
----
1

query  nosort
SELECT sum(table_1.column_3) AS alias_1, group_concat(table_1.column_4 separator ', ') AS alias_2 FROM table_1
----
3
a, a, a

query  nosort
SELECT DISTINCT sum(table_1.column_5) AS alias_1 FROM table_1
----
3

query  nosort
SELECT DISTINCT group_concat(table_1.column_6 separator ', ') AS alias_1 FROM table_1
----
a, a, a

query  nosort
SELECT DISTINCT sum(table_1.column_7) AS alias_1, group_concat(table_1.column_8 separator ', ') AS alias_2 FROM table_1
----
3
a, a, a
