# Generated by:
#     target/debug/noria-logictest generate --operations sum,avg,group_concat --compare-to mysql://root@localhost/mysql --subquery-depth 1 --rows-per-table 5 -o logictests/generated/sum,avg,group_concat.test --include-deletes
# failure: ENG-339

statement ok
CREATE TABLE table_1 (column_9 TEXT, column_13 INT(32), column_10 INT(32), column_5 INT(32), column_3 TEXT, column_1 INT(32), column_2 INT(32), column_12 TEXT, column_6 INT(32), column_11 INT(32), column_4 INT(32), column_8 INT(32), column_7 TEXT, PRIMARY KEY (column_13))


statement ok
INSERT INTO table_1 (column_4, column_5, column_1, column_7, column_10, column_2, column_12, column_13, column_3, column_9, column_11, column_8, column_6) VALUES (1, 1, 1, 'a', 1, 1, 'a', 2, 'a', 'a', 1, 1, 1), (1, 1, 1, 'a', 1, 1, 'a', 3, 'a', 'a', 1, 1, 1), (1, 1, 1, 'a', 1, 1, 'a', 4, 'a', 'a', 1, 1, 1), (1, 1, 1, 'a', 1, 1, 'a', 5, 'a', 'a', 1, 1, 1), (1, 1, 1, 'a', 1, 1, 'a', 6, 'a', 'a', 1, 1, 1)


query  nosort
SELECT sum(table_1.column_1) AS alias_1 FROM table_1
----
5

query  nosort
SELECT avg(table_1.column_2) AS alias_1 FROM table_1
----
1.0000

query  nosort
SELECT group_concat(table_1.column_3 separator ', ') AS alias_1 FROM table_1
----
a, a, a, a, a

query  nosort
SELECT sum(table_1.column_4) AS alias_1, avg(table_1.column_5) AS alias_2 FROM table_1
----
5
1.0000

query  nosort
SELECT sum(table_1.column_6) AS alias_1, group_concat(table_1.column_7 separator ', ') AS alias_2 FROM table_1
----
5
a, a, a, a, a

query  nosort
SELECT avg(table_1.column_8) AS alias_1, group_concat(table_1.column_9 separator ', ') AS alias_2 FROM table_1
----
1.0000
a, a, a, a, a

query  nosort
SELECT sum(table_1.column_10) AS alias_1, avg(table_1.column_11) AS alias_2, group_concat(table_1.column_12 separator ', ') AS alias_3 FROM table_1
----
5
1.0000
a, a, a, a, a

statement ok
DELETE FROM table_1 WHERE (column_13 = 2)


statement ok
DELETE FROM table_1 WHERE (column_13 = 3)


query  nosort
SELECT sum(table_1.column_1) AS alias_1 FROM table_1
----
3

query  nosort
SELECT avg(table_1.column_2) AS alias_1 FROM table_1
----
1.0000

query  nosort
SELECT group_concat(table_1.column_3 separator ', ') AS alias_1 FROM table_1
----
a, a, a

query  nosort
SELECT sum(table_1.column_4) AS alias_1, avg(table_1.column_5) AS alias_2 FROM table_1
----
3
1.0000

query  nosort
SELECT sum(table_1.column_6) AS alias_1, group_concat(table_1.column_7 separator ', ') AS alias_2 FROM table_1
----
3
a, a, a

query  nosort
SELECT avg(table_1.column_8) AS alias_1, group_concat(table_1.column_9 separator ', ') AS alias_2 FROM table_1
----
1.0000
a, a, a

query  nosort
SELECT sum(table_1.column_10) AS alias_1, avg(table_1.column_11) AS alias_2, group_concat(table_1.column_12 separator ', ') AS alias_3 FROM table_1
----
3
1.0000
a, a, a
