# Generated by:
#     target/debug/noria-logictest permute --compare-to mysql://root:noria@127.1/noria -d 3 -o logictests/generated/mysql/ --only range_param --random --include-deletes --rows-per-table 10 --subquery-depth 1 --overwrite-tests

statement ok
CREATE TABLE `table_1` (`column_1` INT, `column_8` INT, `column_6` INT, `column_7` INT, `column_9` INT, `column_2` INT, `column_4` INT, `column_5` INT, `column_3` INT, PRIMARY KEY (`column_9`))


statement ok
INSERT INTO `table_1` (`column_1`, `column_8`, `column_6`, `column_7`, `column_9`, `column_2`, `column_4`, `column_5`, `column_3`) VALUES (-942627234, 266314423, 1534192940, 565900936, 0, 1618603835, -661525857, -699540034, 1217210192), (-1747067949, -1758763158, 986553374, -1421561897, 1, 1108660846, 1717706622, -256922042, 2012277101), (1842698462, -1221325235, -586660671, 1631081603, 2, 910450450, 1088129554, -681964234, -1854339346), (-2099979829, 1603811652, 906312071, 570093082, 3, 137148557, -2126943061, -301309309, -1299855455), (815554412, -500121500, 998217974, 1777120209, 4, -1129250972, -2008031426, 737975085, -908720089), (1050809917, 596564399, 1257725223, -1284782050, 5, -1062361692, -296804242, -1429621235, -1755008401), (-1667179275, 371663838, 2012811394, -1620081193, 6, -859274040, 631939465, 1290844955, 1402216934), (-444591855, -125627234, 1198414127, -2051178515, 7, 159278653, -169456703, -508972995, -812705586), (608054393, -1011185170, 1625207248, -1435240589, 8, 1939763871, 1870030867, -851305174, 1283483254), (-290112749, -387623317, -1815735134, -366036420, 9, -39607054, -1446651409, -2102963979, 2121112342)


query  rowsort
SELECT avg(distinct `table_1`.`column_1`) AS `alias_1` FROM `table_1`
----
-287444170.7000

query  rowsort
SELECT sum(distinct `table_1`.`column_2`) AS `alias_1` FROM `table_1`
----
2783412454

query  rowsort
SELECT `table_1`.`column_1` AS `alias_1` FROM `table_1` WHERE (`table_1`.`column_1` > ?)
? = 10
----
1050809917
1842698462
608054393
815554412

query  rowsort
SELECT avg(distinct `table_1`.`column_3`) AS `alias_1`, sum(distinct `table_1`.`column_4`) AS `alias_2` FROM `table_1`
----
140567094.6000
-1401606190

query  rowsort
SELECT avg(distinct `table_1`.`column_5`) AS `alias_1` FROM `table_1` WHERE (`table_1`.`column_1` > ?)
? = 10
----
-556228889.5000

query  rowsort
SELECT sum(distinct `table_1`.`column_6`) AS `alias_1` FROM `table_1` WHERE (`table_1`.`column_1` > ?)
? = 10
----
3294489774

query  rowsort
SELECT avg(distinct `table_1`.`column_7`) AS `alias_1`, sum(distinct `table_1`.`column_8`) AS `alias_2` FROM `table_1` WHERE (`table_1`.`column_1` > ?)
? = 10
----
172044793.2500
-2136067506

statement ok
DELETE FROM `table_1` WHERE (`column_9` = 0)


statement ok
DELETE FROM `table_1` WHERE (`column_9` = 1)


statement ok
DELETE FROM `table_1` WHERE (`column_9` = 2)


statement ok
DELETE FROM `table_1` WHERE (`column_9` = 3)


statement ok
DELETE FROM `table_1` WHERE (`column_9` = 4)


query  rowsort
SELECT avg(distinct `table_1`.`column_1`) AS `alias_1` FROM `table_1`
----
-148603913.8000

query  rowsort
SELECT sum(distinct `table_1`.`column_2`) AS `alias_1` FROM `table_1`
----
137799738

query  rowsort
SELECT `table_1`.`column_1` AS `alias_1` FROM `table_1` WHERE (`table_1`.`column_1` > ?)
? = 10
----
1050809917
608054393

query  rowsort
SELECT avg(distinct `table_1`.`column_3`) AS `alias_1`, sum(distinct `table_1`.`column_4`) AS `alias_2` FROM `table_1`
----
447819708.6000
589057978

query  rowsort
SELECT avg(distinct `table_1`.`column_5`) AS `alias_1` FROM `table_1` WHERE (`table_1`.`column_1` > ?)
? = 10
----
-1140463204.5000

query  rowsort
SELECT sum(distinct `table_1`.`column_6`) AS `alias_1` FROM `table_1` WHERE (`table_1`.`column_1` > ?)
? = 10
----
2882932471

query  rowsort
SELECT avg(distinct `table_1`.`column_7`) AS `alias_1`, sum(distinct `table_1`.`column_8`) AS `alias_2` FROM `table_1` WHERE (`table_1`.`column_1` > ?)
? = 10
----
-1360011319.5000
-414620771
