# Generated by:
#     target/debug/noria-logictest permute --compare-to mysql://root:noria@127.1/noria -d 3 -o logictests/generated/mysql/ --only range_param --random --include-deletes --rows-per-table 10 --subquery-depth 1 --overwrite-tests

statement ok
CREATE TABLE `table_1` (`column_8` INT, `column_1` INT, `column_9` INT, `column_3` INT, `column_4` INT, `column_7` INT, `column_5` INT, `column_2` INT, `column_6` INT, PRIMARY KEY (`column_9`))


statement ok
INSERT INTO `table_1` (`column_8`, `column_1`, `column_9`, `column_3`, `column_4`, `column_7`, `column_5`, `column_2`, `column_6`) VALUES (-1108876744, -1913915574, 0, -483327538, 47556626, 1822094657, 1427115584, 727197172, 1581593919), (443896487, -921908527, 1, 640359449, -359537027, -193001605, -988941335, 885052850, 1042269474), (-1002673977, -544282708, 2, 235573602, -1697038159, 1800014785, 567966157, -262242043, 297693418), (-334469576, -902513396, 3, -1736402966, -2117579679, 967576450, 453182142, 916158115, 1385791930), (-1700224038, 231627110, 4, 105327157, -42116775, 502258202, -2006283979, -2027174328, 1730942038), (-483992603, 1687571712, 5, -300494885, 854976597, 473029693, 178020788, -2114910649, 411865402), (-513533234, -73915457, 6, -1311039545, 1101198128, 851256729, 553051235, 2145977353, -1285147095), (-431478912, -401390723, 7, 886088797, 1723647744, 1247480609, -966588382, -662477114, -1419437941), (884201979, -550453522, 8, -492158642, -12713398, 1159137530, 630247554, -192757763, 375649289), (-1952190136, -757810204, 9, 1014329585, -1087833611, 1145840203, 229376845, 1570144616, -1846253214)


query  rowsort
SELECT avg(distinct `table_1`.`column_1`) AS `alias_1` FROM `table_1`
----
-414699128.9000

query  rowsort
SELECT max(`table_1`.`column_2`) AS `alias_1` FROM `table_1`
----
2145977353

query  rowsort
SELECT `table_1`.`column_1` AS `alias_1` FROM `table_1` WHERE (`table_1`.`column_1` > ?)
? = 10
----
1687571712
231627110

query  rowsort
SELECT avg(distinct `table_1`.`column_3`) AS `alias_1`, max(`table_1`.`column_4`) AS `alias_2` FROM `table_1`
----
-144174498.6000
1723647744

query  rowsort
SELECT avg(distinct `table_1`.`column_5`) AS `alias_1` FROM `table_1` WHERE (`table_1`.`column_3` > ?)
? = 10
----
-632894138.8000

query  rowsort
SELECT max(`table_1`.`column_6`) AS `alias_1` FROM `table_1` WHERE (`table_1`.`column_3` > ?)
? = 10
----
1730942038

query  rowsort
SELECT avg(distinct `table_1`.`column_7`) AS `alias_1`, max(`table_1`.`column_8`) AS `alias_2` FROM `table_1` WHERE (`table_1`.`column_8` > ?)
? = 10
----
483067962.5000
884201979

statement ok
DELETE FROM `table_1` WHERE (`column_9` = 0)


statement ok
DELETE FROM `table_1` WHERE (`column_9` = 1)


statement ok
DELETE FROM `table_1` WHERE (`column_9` = 2)


statement ok
DELETE FROM `table_1` WHERE (`column_9` = 3)


statement ok
DELETE FROM `table_1` WHERE (`column_9` = 4)


query  rowsort
SELECT avg(distinct `table_1`.`column_1`) AS `alias_1` FROM `table_1`
----
-19199638.8000

query  rowsort
SELECT max(`table_1`.`column_2`) AS `alias_1` FROM `table_1`
----
2145977353

query  rowsort
SELECT `table_1`.`column_1` AS `alias_1` FROM `table_1` WHERE (`table_1`.`column_1` > ?)
? = 10
----
1687571712

query  rowsort
SELECT avg(distinct `table_1`.`column_3`) AS `alias_1`, max(`table_1`.`column_4`) AS `alias_2` FROM `table_1`
----
-40654938.0000
1723647744

query  rowsort
SELECT avg(distinct `table_1`.`column_5`) AS `alias_1` FROM `table_1` WHERE (`table_1`.`column_3` > ?)
? = 10
----
-368605768.5000

query  rowsort
SELECT max(`table_1`.`column_6`) AS `alias_1` FROM `table_1` WHERE (`table_1`.`column_3` > ?)
? = 10
----
-1419437941

query  rowsort
SELECT avg(distinct `table_1`.`column_7`) AS `alias_1`, max(`table_1`.`column_8`) AS `alias_2` FROM `table_1` WHERE (`table_1`.`column_8` > ?)
? = 10
----
1159137530.0000
884201979
