# Generated by:
#     target/debug/noria-logictest permute --compare-to mysql://root:noria@127.1/noria -d 3 -o logictests/generated/mysql/ --only range_param --random --include-deletes --rows-per-table 10 --subquery-depth 1 --overwrite-tests

statement ok
CREATE TABLE `table_1` (`column_2` INT, `column_6` INT, `column_5` INT, `column_3` INT, `column_7` INT, `column_8` INT, `column_9` INT, `column_4` INT, `column_1` INT, PRIMARY KEY (`column_9`))


statement ok
INSERT INTO `table_1` (`column_2`, `column_6`, `column_5`, `column_3`, `column_7`, `column_8`, `column_9`, `column_4`, `column_1`) VALUES (-479728829, 1868072812, -843602100, 860396223, -985631056, -106075604, 0, -169141872, 775370079), (-1425680833, -1371888519, 747687136, -1757313999, 896584250, 217717871, 1, 988653146, 1644343949), (-1449415062, -643907237, -2016617745, 2072291258, 1812727955, -928142051, 2, 273328557, 1515609740), (-255175239, -826772532, 241752269, -77926834, 492059626, 1215310145, 3, 175080965, 187700030), (633888646, -1270504809, 1872199508, -1252693220, -1343759493, -2145458579, 4, 1901146747, 2084202074), (1165763931, 2053617303, -347769059, -377394648, -469881093, -1996791052, 5, -1996904071, -341188813), (1882381809, 388073250, 759228071, -813515369, 638713229, 920303662, 6, -2031000912, 398874865), (-1366179206, 58877327, -1666962569, 1835980832, -49047330, 353532278, 7, -1895943886, 2110138934), (1717016786, 361720192, -1202862395, -161950087, 1094905166, -467141602, 8, 1857229344, -1891380755), (393177387, -1097069776, -1458000922, 170702348, 67221486, -2084806662, 9, -1264671974, 1048446924)


query  rowsort
SELECT avg(distinct `table_1`.`column_1`) AS `alias_1` FROM `table_1`
----
753211702.7000

query  rowsort
SELECT count(`table_1`.`column_2`) AS `alias_1` FROM `table_1`
----
10

query  rowsort
SELECT `table_1`.`column_2` AS `alias_1` FROM `table_1` WHERE (`table_1`.`column_2` > ?)
? = 10
----
1165763931
1717016786
1882381809
393177387
633888646

query  rowsort
SELECT avg(distinct `table_1`.`column_3`) AS `alias_1`, count(`table_1`.`column_4`) AS `alias_2` FROM `table_1`
----
49857650.4000
10

query  rowsort
SELECT avg(distinct `table_1`.`column_5`) AS `alias_1` FROM `table_1` WHERE (`table_1`.`column_2` > ?)
? = 10
----
-75440959.4000

query  rowsort
SELECT count(`table_1`.`column_6`) AS `alias_1` FROM `table_1` WHERE (`table_1`.`column_6` > ?)
? = 10
----
5

query  rowsort
SELECT avg(distinct `table_1`.`column_7`) AS `alias_1`, count(`table_1`.`column_8`) AS `alias_2` FROM `table_1` WHERE (`table_1`.`column_2` > ?)
? = 10
----
-2560141.0000
5

statement ok
DELETE FROM `table_1` WHERE (`column_9` = 0)


statement ok
DELETE FROM `table_1` WHERE (`column_9` = 1)


statement ok
DELETE FROM `table_1` WHERE (`column_9` = 2)


statement ok
DELETE FROM `table_1` WHERE (`column_9` = 3)


statement ok
DELETE FROM `table_1` WHERE (`column_9` = 4)


query  rowsort
SELECT avg(distinct `table_1`.`column_1`) AS `alias_1` FROM `table_1`
----
264978231.0000

query  rowsort
SELECT count(`table_1`.`column_2`) AS `alias_1` FROM `table_1`
----
5

query  rowsort
SELECT `table_1`.`column_2` AS `alias_1` FROM `table_1` WHERE (`table_1`.`column_2` > ?)
? = 10
----
1165763931
1717016786
1882381809
393177387

query  rowsort
SELECT avg(distinct `table_1`.`column_3`) AS `alias_1`, count(`table_1`.`column_4`) AS `alias_2` FROM `table_1`
----
130764615.2000
5

query  rowsort
SELECT avg(distinct `table_1`.`column_5`) AS `alias_1` FROM `table_1` WHERE (`table_1`.`column_2` > ?)
? = 10
----
-562351076.2500

query  rowsort
SELECT count(`table_1`.`column_6`) AS `alias_1` FROM `table_1` WHERE (`table_1`.`column_6` > ?)
? = 10
----
4

query  rowsort
SELECT avg(distinct `table_1`.`column_7`) AS `alias_1`, count(`table_1`.`column_8`) AS `alias_2` FROM `table_1` WHERE (`table_1`.`column_2` > ?)
? = 10
----
332739697.0000
4
