# Generated by:
#     target/debug/noria-logictest permute --compare-to mysql://root:noria@127.1/noria -d 3 -o logictests/generated/mysql/ --only range_param --random --include-deletes --rows-per-table 10 --subquery-depth 1 --overwrite-tests

statement ok
CREATE TABLE `table_2` (`column_3` INT, `column_7` INT, `column_2` INT, `column_9` INT, `column_4` INT, `column_1` INT, `column_5` INT, `column_8` INT, `column_6` INT, PRIMARY KEY (`column_9`))


statement ok
CREATE TABLE `table_1` (`column_3` INT, `column_2` INT, `column_1` INT, PRIMARY KEY (`column_3`))


statement ok
CREATE TABLE `table_5` (`column_2` INT, `column_1` INT, `column_3` INT, PRIMARY KEY (`column_3`))


statement ok
CREATE TABLE `table_3` (`column_2` INT, `column_3` INT, `column_1` INT, PRIMARY KEY (`column_3`))


statement ok
CREATE TABLE `table_4` (`column_3` INT, `column_1` INT, `column_2` INT, PRIMARY KEY (`column_3`))


statement ok
INSERT INTO `table_2` (`column_3`, `column_7`, `column_2`, `column_9`, `column_4`, `column_1`, `column_5`, `column_8`, `column_6`) VALUES (-429793382, 1137296702, -842024394, 0, 331904874, 2081040407, 105439768, 1107532456, 1841232374), (-2143004053, 881499009, 268087501, 1, 1448303901, 190935149, -297111428, -981760582, -92534491), (578501752, -1302860305, 1284535599, 2, -937896800, -2039146299, 193778425, 1291560781, -1101218643), (-2123118848, 523124885, -1741912813, 3, 393468036, -823633823, 1579352773, 1760238578, 60270245), (-1186957977, -666359768, -928472103, 4, -150958227, -609694319, -1649086211, -33676033, 166272262), (745461451, 504483565, -764915584, 5, 1488803714, 1760866841, 742836775, 1199997806, 1813763498), (-1255758693, 1968030310, 859912421, 6, -1593385308, 789353242, 1492248924, 1420688359, 752867627), (612909792, 586514007, 1002375903, 7, -75493334, -1745373941, -1544375938, -1916563800, -1457660175), (-416449580, 26959189, -411284140, 8, -1022157204, 1221009789, 1394412764, -2018747139, -2120351700), (-510703525, 44153947, 463732060, 9, -850298896, -1447940124, 1348393730, 736695429, 1371323050)


statement ok
INSERT INTO `table_1` (`column_3`, `column_2`, `column_1`) VALUES (0, -478035511, -153013515), (1, 679139790, -359527088), (2, -1270009945, 27018926), (3, -137248675, -507574169), (4, 517577300, 1805355022), (5, -353726907, -1933175788), (6, -1566963056, -350656433), (7, 1716770991, -830363504), (8, 90286381, -1618543388), (9, 1085617006, 2001770582)


statement ok
INSERT INTO `table_5` (`column_2`, `column_1`, `column_3`) VALUES (-1861820069, -66738836, 0), (968797447, 1673345058, 1), (974326749, -1095246685, 2), (1602146305, 682149581, 3), (637739630, 1122382691, 4), (-566504957, -2085740168, 5), (38306414, -252102279, 6), (1146814404, -2122337808, 7), (821114746, -220811582, 8), (-55969211, 1440955260, 9)


statement ok
INSERT INTO `table_3` (`column_2`, `column_3`, `column_1`) VALUES (-626522031, 0, -480010359), (1318146083, 1, 2057201654), (-2069499442, 2, -926824780), (-1274859607, 3, -188110369), (-1360012468, 4, -1739907680), (-1809513055, 5, -431019119), (-1564013179, 6, 1726997168), (-496061387, 7, 1864449988), (2011874656, 8, -1167620474), (1300485188, 9, -1858451545)


statement ok
INSERT INTO `table_4` (`column_3`, `column_1`, `column_2`) VALUES (0, -726678576, -1923295212), (1, 6474847, -816638787), (2, -695924792, 1933895416), (3, 1058193017, 560369071), (4, 1492863948, -1674882120), (5, 1549016423, 274758823), (6, -1892068568, 383899872), (7, 967062678, -883103564), (8, 1072558547, -1743456021), (9, 1761034861, 1982293920)


query  rowsort
SELECT count(`table_1`.`column_1`) AS `alias_1` FROM `table_1`
----
10

query  rowsort
SELECT `table_1`.`column_2` AS `alias_1`, `table_2`.`column_2` AS `alias_2` FROM `table_1` INNER JOIN `table_2` ON (`table_1`.`column_1` = `table_2`.`column_1`)
----


query  rowsort
SELECT `table_2`.`column_2` AS `alias_1` FROM `table_2` WHERE (`table_2`.`column_2` > ?)
? = 10
----
1002375903
1284535599
268087501
463732060
859912421

query  rowsort
SELECT count(`table_2`.`column_3`) AS `alias_1`, `table_2`.`column_4` AS `alias_2`, `table_3`.`column_2` AS `alias_3` FROM `table_2` INNER JOIN `table_3` ON (`table_2`.`column_2` = `table_3`.`column_1`) GROUP BY `table_2`.`column_4`, `table_3`.`column_2`
----


query  rowsort
SELECT count(`table_2`.`column_5`) AS `alias_1` FROM `table_2` WHERE (`table_2`.`column_2` > ?)
? = 10
----
5

query  rowsort
SELECT `table_2`.`column_6` AS `alias_1`, `table_4`.`column_2` AS `alias_2` FROM `table_2` INNER JOIN `table_4` ON (`table_2`.`column_2` = `table_4`.`column_1`) WHERE (`table_2`.`column_2` > ?)
? = 10
----


query  rowsort
SELECT count(`table_2`.`column_7`) AS `alias_1`, `table_2`.`column_8` AS `alias_2`, `table_5`.`column_2` AS `alias_3` FROM `table_2` INNER JOIN `table_5` ON (`table_2`.`column_2` = `table_5`.`column_1`) WHERE (`table_2`.`column_3` > ?) GROUP BY `table_2`.`column_8`, `table_5`.`column_2`
? = 10
----


statement ok
DELETE FROM `table_2` WHERE (`column_9` = 0)


statement ok
DELETE FROM `table_2` WHERE (`column_9` = 1)


statement ok
DELETE FROM `table_2` WHERE (`column_9` = 2)


statement ok
DELETE FROM `table_2` WHERE (`column_9` = 3)


statement ok
DELETE FROM `table_2` WHERE (`column_9` = 4)


statement ok
DELETE FROM `table_1` WHERE (`column_3` = 0)


statement ok
DELETE FROM `table_1` WHERE (`column_3` = 1)


statement ok
DELETE FROM `table_1` WHERE (`column_3` = 2)


statement ok
DELETE FROM `table_1` WHERE (`column_3` = 3)


statement ok
DELETE FROM `table_1` WHERE (`column_3` = 4)


statement ok
DELETE FROM `table_5` WHERE (`column_3` = 0)


statement ok
DELETE FROM `table_5` WHERE (`column_3` = 1)


statement ok
DELETE FROM `table_5` WHERE (`column_3` = 2)


statement ok
DELETE FROM `table_5` WHERE (`column_3` = 3)


statement ok
DELETE FROM `table_5` WHERE (`column_3` = 4)


statement ok
DELETE FROM `table_3` WHERE (`column_3` = 0)


statement ok
DELETE FROM `table_3` WHERE (`column_3` = 1)


statement ok
DELETE FROM `table_3` WHERE (`column_3` = 2)


statement ok
DELETE FROM `table_3` WHERE (`column_3` = 3)


statement ok
DELETE FROM `table_3` WHERE (`column_3` = 4)


statement ok
DELETE FROM `table_4` WHERE (`column_3` = 0)


statement ok
DELETE FROM `table_4` WHERE (`column_3` = 1)


statement ok
DELETE FROM `table_4` WHERE (`column_3` = 2)


statement ok
DELETE FROM `table_4` WHERE (`column_3` = 3)


statement ok
DELETE FROM `table_4` WHERE (`column_3` = 4)


query  rowsort
SELECT count(`table_1`.`column_1`) AS `alias_1` FROM `table_1`
----
5

query  rowsort
SELECT `table_1`.`column_2` AS `alias_1`, `table_2`.`column_2` AS `alias_2` FROM `table_1` INNER JOIN `table_2` ON (`table_1`.`column_1` = `table_2`.`column_1`)
----


query  rowsort
SELECT `table_2`.`column_2` AS `alias_1` FROM `table_2` WHERE (`table_2`.`column_2` > ?)
? = 10
----
1002375903
463732060
859912421

query  rowsort
SELECT count(`table_2`.`column_3`) AS `alias_1`, `table_2`.`column_4` AS `alias_2`, `table_3`.`column_2` AS `alias_3` FROM `table_2` INNER JOIN `table_3` ON (`table_2`.`column_2` = `table_3`.`column_1`) GROUP BY `table_2`.`column_4`, `table_3`.`column_2`
----


query  rowsort
SELECT count(`table_2`.`column_5`) AS `alias_1` FROM `table_2` WHERE (`table_2`.`column_2` > ?)
? = 10
----
3

query  rowsort
SELECT `table_2`.`column_6` AS `alias_1`, `table_4`.`column_2` AS `alias_2` FROM `table_2` INNER JOIN `table_4` ON (`table_2`.`column_2` = `table_4`.`column_1`) WHERE (`table_2`.`column_2` > ?)
? = 10
----


query  rowsort
SELECT count(`table_2`.`column_7`) AS `alias_1`, `table_2`.`column_8` AS `alias_2`, `table_5`.`column_2` AS `alias_3` FROM `table_2` INNER JOIN `table_5` ON (`table_2`.`column_2` = `table_5`.`column_1`) WHERE (`table_2`.`column_3` > ?) GROUP BY `table_2`.`column_8`, `table_5`.`column_2`
? = 10
----

