# Generated by:
#     target/debug/noria-logictest permute --compare-to mysql://root:noria@127.1/noria -d 3 -o logictests/generated/mysql/ --only range_param --random --include-deletes --rows-per-table 10 --subquery-depth 1 --overwrite-tests

statement ok
CREATE TABLE `table_1` (`column_3` INT, `column_1` INT, `column_6` INT, `column_2` INT, `column_7` INT, `column_5` INT, `column_4` INT, `column_9` INT, `column_8` INT, PRIMARY KEY (`column_9`))


statement ok
INSERT INTO `table_1` (`column_3`, `column_1`, `column_6`, `column_2`, `column_7`, `column_5`, `column_4`, `column_9`, `column_8`) VALUES (424951613, -1423678682, -521747920, -1709046095, -770444657, 233645383, -271564141, 0, 359496088), (1863469721, -3212612, 484375850, 1458754756, 2085492029, -1745599254, 789591259, 1, -1972737646), (-358240782, 530537499, -992407155, -282897477, -2002715491, 643465716, 1655748651, 2, 567482961), (-1042619818, -1483819306, -927645604, 1184659098, -444791642, 1595765991, -1209256427, 3, 1562033967), (665297087, 1595339716, -475395705, -1640693973, -359648222, 55738033, -1198420802, 4, -1574411506), (-1956286521, 1159940181, 464102759, -2066719073, 1269906420, -1908183315, -387830986, 5, -1358241198), (69676490, -53304821, -3812224, 1664287878, -836908367, -1032788007, -1486538073, 6, 743142708), (-1240833495, -516153502, 2047218901, 1940210880, -465171640, 639813393, -748954649, 7, -1693523219), (-1406339911, -1450689788, 1783999325, -384059281, -1715020774, -1430068426, -1822271635, 8, 1101990282), (-1293525428, 875649152, -2038505450, 709606010, -334499812, 607242685, -1531702361, 9, -1398415427)


query  rowsort
SELECT count(distinct `table_1`.`column_1`) AS `alias_1` FROM `table_1`
----
10

query  nosort
SELECT `table_1`.`column_1` AS `alias_1` FROM `table_1` ORDER BY `table_1`.`column_1` ASC LIMIT 10
----
-1483819306
-1450689788
-1423678682
-516153502
-53304821
-3212612
530537499
875649152
1159940181
1595339716

query  nosort
SELECT `table_1`.`column_1` AS `alias_1` FROM `table_1` ORDER BY `table_1`.`column_1` DESC LIMIT 10
----
1595339716
1159940181
875649152
530537499
-3212612
-53304821
-516153502
-1423678682
-1450689788
-1483819306

query  rowsort
SELECT `table_1`.`column_1` AS `alias_1` FROM `table_1` WHERE (`table_1`.`column_1` > ?)
? = 10
----
1159940181
1595339716
530537499
875649152

query  nosort
SELECT count(distinct `table_1`.`column_2`) AS `alias_1` FROM `table_1` GROUP BY `table_1`.`column_1` ORDER BY `table_1`.`column_1` ASC LIMIT 10
----
1
1
1
1
1
1
1
1
1
1

query  nosort
SELECT count(distinct `table_1`.`column_3`) AS `alias_1` FROM `table_1` GROUP BY `table_1`.`column_3` ORDER BY `table_1`.`column_3` DESC LIMIT 10
----
1
1
1
1
1
1
1
1
1
1

query  rowsort
SELECT count(distinct `table_1`.`column_4`) AS `alias_1` FROM `table_1` WHERE (`table_1`.`column_3` > ?)
? = 10
----
4

query  nosort
SELECT `table_1`.`column_3` AS `alias_1` FROM `table_1` ORDER BY `table_1`.`column_3` DESC LIMIT 10
----
1863469721
665297087
424951613
69676490
-358240782
-1042619818
-1240833495
-1293525428
-1406339911
-1956286521

query  nosort
SELECT `table_1`.`column_3` AS `alias_1` FROM `table_1` WHERE (`table_1`.`column_3` > ?) ORDER BY `table_1`.`column_3` ASC LIMIT 10
? = 10
----
69676490
424951613
665297087
1863469721

query  nosort
SELECT `table_1`.`column_3` AS `alias_1` FROM `table_1` WHERE (`table_1`.`column_3` > ?) ORDER BY `table_1`.`column_3` DESC LIMIT 10
? = 10
----
1863469721
665297087
424951613
69676490

query  nosort
SELECT count(distinct `table_1`.`column_5`) AS `alias_1` FROM `table_1` GROUP BY `table_1`.`column_3` ORDER BY `table_1`.`column_3` DESC LIMIT 10
----
1
1
1
1
1
1
1
1
1
1

query  nosort
SELECT count(distinct `table_1`.`column_6`) AS `alias_1` FROM `table_1` WHERE (`table_1`.`column_3` > ?) GROUP BY `table_1`.`column_3` ORDER BY `table_1`.`column_3` ASC LIMIT 10
? = 10
----
1
1
1
1

query  nosort
SELECT count(distinct `table_1`.`column_7`) AS `alias_1` FROM `table_1` WHERE (`table_1`.`column_3` > ?) GROUP BY `table_1`.`column_3` ORDER BY `table_1`.`column_3` DESC LIMIT 10
? = 10
----
1
1
1
1

query  nosort
SELECT `table_1`.`column_3` AS `alias_1` FROM `table_1` WHERE (`table_1`.`column_3` > ?) ORDER BY `table_1`.`column_3` DESC LIMIT 10
? = 10
----
1863469721
665297087
424951613
69676490

query  nosort
SELECT count(distinct `table_1`.`column_8`) AS `alias_1` FROM `table_1` WHERE (`table_1`.`column_3` > ?) GROUP BY `table_1`.`column_3` ORDER BY `table_1`.`column_3` DESC LIMIT 10
? = 10
----
1
1
1
1

statement ok
DELETE FROM `table_1` WHERE (`column_9` = 0)


statement ok
DELETE FROM `table_1` WHERE (`column_9` = 1)


statement ok
DELETE FROM `table_1` WHERE (`column_9` = 2)


statement ok
DELETE FROM `table_1` WHERE (`column_9` = 3)


statement ok
DELETE FROM `table_1` WHERE (`column_9` = 4)


query  rowsort
SELECT count(distinct `table_1`.`column_1`) AS `alias_1` FROM `table_1`
----
5

query  nosort
SELECT `table_1`.`column_1` AS `alias_1` FROM `table_1` ORDER BY `table_1`.`column_1` ASC LIMIT 10
----
-1450689788
-516153502
-53304821
875649152
1159940181

query  nosort
SELECT `table_1`.`column_1` AS `alias_1` FROM `table_1` ORDER BY `table_1`.`column_1` DESC LIMIT 10
----
1159940181
875649152
-53304821
-516153502
-1450689788

query  rowsort
SELECT `table_1`.`column_1` AS `alias_1` FROM `table_1` WHERE (`table_1`.`column_1` > ?)
? = 10
----
1159940181
875649152

query  nosort
SELECT count(distinct `table_1`.`column_2`) AS `alias_1` FROM `table_1` GROUP BY `table_1`.`column_1` ORDER BY `table_1`.`column_1` ASC LIMIT 10
----
1
1
1
1
1

query  nosort
SELECT count(distinct `table_1`.`column_3`) AS `alias_1` FROM `table_1` GROUP BY `table_1`.`column_3` ORDER BY `table_1`.`column_3` DESC LIMIT 10
----
1
1
1
1
1

query  rowsort
SELECT count(distinct `table_1`.`column_4`) AS `alias_1` FROM `table_1` WHERE (`table_1`.`column_3` > ?)
? = 10
----
1

query  nosort
SELECT `table_1`.`column_3` AS `alias_1` FROM `table_1` ORDER BY `table_1`.`column_3` DESC LIMIT 10
----
69676490
-1240833495
-1293525428
-1406339911
-1956286521

query  nosort
SELECT `table_1`.`column_3` AS `alias_1` FROM `table_1` WHERE (`table_1`.`column_3` > ?) ORDER BY `table_1`.`column_3` ASC LIMIT 10
? = 10
----
69676490

query  nosort
SELECT `table_1`.`column_3` AS `alias_1` FROM `table_1` WHERE (`table_1`.`column_3` > ?) ORDER BY `table_1`.`column_3` DESC LIMIT 10
? = 10
----
69676490

query  nosort
SELECT count(distinct `table_1`.`column_5`) AS `alias_1` FROM `table_1` GROUP BY `table_1`.`column_3` ORDER BY `table_1`.`column_3` DESC LIMIT 10
----
1
1
1
1
1

query  nosort
SELECT count(distinct `table_1`.`column_6`) AS `alias_1` FROM `table_1` WHERE (`table_1`.`column_3` > ?) GROUP BY `table_1`.`column_3` ORDER BY `table_1`.`column_3` ASC LIMIT 10
? = 10
----
1

query  nosort
SELECT count(distinct `table_1`.`column_7`) AS `alias_1` FROM `table_1` WHERE (`table_1`.`column_3` > ?) GROUP BY `table_1`.`column_3` ORDER BY `table_1`.`column_3` DESC LIMIT 10
? = 10
----
1

query  nosort
SELECT `table_1`.`column_3` AS `alias_1` FROM `table_1` WHERE (`table_1`.`column_3` > ?) ORDER BY `table_1`.`column_3` DESC LIMIT 10
? = 10
----
69676490

query  nosort
SELECT count(distinct `table_1`.`column_8`) AS `alias_1` FROM `table_1` WHERE (`table_1`.`column_3` > ?) GROUP BY `table_1`.`column_3` ORDER BY `table_1`.`column_3` DESC LIMIT 10
? = 10
----
1
