# Generated by:
#     target/debug/noria-logictest generate --operations count,group_concat --compare-to mysql://root@localhost/mysql --subquery-depth 1 --rows-per-table 5 -o logictests/generated/count,group_concat.test --include-deletes
# failure: ENG-339

statement ok
CREATE TABLE table_1 (column_2 TEXT, column_3 INT(32), column_4 TEXT, column_5 INT(32), column_1 INT(32), PRIMARY KEY (column_5))


statement ok
INSERT INTO table_1 (column_5, column_2, column_1, column_4, column_3) VALUES (2, 'a', 1, 'a', 1), (3, 'a', 1, 'a', 1), (4, 'a', 1, 'a', 1), (5, 'a', 1, 'a', 1), (6, 'a', 1, 'a', 1)


query  nosort
SELECT count(table_1.column_1) AS alias_1 FROM table_1
----
5

query  nosort
SELECT group_concat(table_1.column_2 separator ', ') AS alias_1 FROM table_1
----
a, a, a, a, a

query  nosort
SELECT count(table_1.column_3) AS alias_1, group_concat(table_1.column_4 separator ', ') AS alias_2 FROM table_1
----
5
a, a, a, a, a

statement ok
DELETE FROM table_1 WHERE (column_5 = 2)


statement ok
DELETE FROM table_1 WHERE (column_5 = 3)


query  nosort
SELECT count(table_1.column_1) AS alias_1 FROM table_1
----
3

query  nosort
SELECT group_concat(table_1.column_2 separator ', ') AS alias_1 FROM table_1
----
a, a, a

query  nosort
SELECT count(table_1.column_3) AS alias_1, group_concat(table_1.column_4 separator ', ') AS alias_2 FROM table_1
----
3
a, a, a
