# Generated by:
#     target/debug/noria-logictest permute --compare-to mysql://root:noria@127.1/noria -d 3 -o logictests/generated/mysql/ --only range_param --random --include-deletes --rows-per-table 10 --subquery-depth 1

statement ok
CREATE TABLE `table_1` (`column_1` INT, `column_2` INT, PRIMARY KEY (`column_2`))


statement ok
INSERT INTO `table_1` (`column_1`, `column_2`) VALUES (-995195840, 0), (644759136, 1), (-763714046, 2), (-1165729917, 3), (-1019759167, 4), (-2001572985, 5), (1959112172, 6), (-876820985, 7), (-722682891, 8), (-1021210402, 9)


query  rowsort
WITH `alias_2` AS (SELECT `table_1`.`column_1` AS `alias_1` FROM `table_1`) SELECT `table_1`.`column_1` AS `alias_3` FROM `table_1` INNER JOIN `alias_2` ON (`table_1`.`column_1` = `alias_2`.`alias_1`) WHERE ((`table_1`.`column_1` = ?) AND (`table_1`.`column_1` = ?))
? = 1
? = 1
----


query  rowsort
WITH `alias_2` AS (SELECT `table_1`.`column_1` AS `alias_1` FROM `table_1`) SELECT `table_1`.`column_1` AS `alias_3` FROM `table_1` INNER JOIN `alias_2` ON (`table_1`.`column_1` = `alias_2`.`alias_1`) WHERE ((`table_1`.`column_1` = ?) AND (`table_1`.`column_1` = ?))
? = 1
? = 1
----


query  rowsort
WITH `alias_2` AS (SELECT `table_1`.`column_1` AS `alias_1` FROM `table_1`) SELECT `table_1`.`column_1` AS `alias_3` FROM `table_1` INNER JOIN `alias_2` ON (`table_1`.`column_1` = `alias_2`.`alias_1`) WHERE ((`table_1`.`column_1` = ?) AND (`table_1`.`column_1` = ?))
? = 1
? = 1
----


query  rowsort
WITH `alias_2` AS (SELECT `table_1`.`column_1` AS `alias_1` FROM `table_1`) SELECT `table_1`.`column_1` AS `alias_3` FROM `table_1` INNER JOIN `alias_2` ON (`table_1`.`column_1` = `alias_2`.`alias_1`) WHERE (`table_1`.`column_1` > ?)
? = 10
----
1959112172
644759136

query  rowsort
WITH `alias_2` AS (SELECT `table_1`.`column_1` AS `alias_1` FROM `table_1`) SELECT `table_1`.`column_1` AS `alias_3` FROM `table_1` INNER JOIN `alias_2` ON (`table_1`.`column_1` = `alias_2`.`alias_1`) WHERE (`table_1`.`column_1` > ?)
? = 10
----
1959112172
644759136

query  rowsort
WITH `alias_2` AS (SELECT `table_1`.`column_1` AS `alias_1` FROM `table_1`) SELECT `table_1`.`column_1` AS `alias_3` FROM `table_1` INNER JOIN `alias_2` ON (`table_1`.`column_1` = `alias_2`.`alias_1`) WHERE (`table_1`.`column_1` > ?)
? = 10
----
1959112172
644759136

query  rowsort
WITH `alias_2` AS (SELECT `table_1`.`column_1` AS `alias_1` FROM `table_1`) SELECT `table_1`.`column_1` AS `alias_3` FROM `table_1` INNER JOIN `alias_2` ON (`table_1`.`column_1` = `alias_2`.`alias_1`) WHERE (((`table_1`.`column_1` = ?) AND (`table_1`.`column_1` = ?)) AND (`table_1`.`column_1` > ?))
? = 1
? = 1
? = 10
----


query  rowsort
WITH `alias_2` AS (SELECT `table_1`.`column_1` AS `alias_1` FROM `table_1`) SELECT `table_1`.`column_1` AS `alias_3` FROM `table_1` INNER JOIN `alias_2` ON (`table_1`.`column_1` = `alias_2`.`alias_1`) WHERE (((`table_1`.`column_1` = ?) AND (`table_1`.`column_1` = ?)) AND (`table_1`.`column_1` > ?))
? = 1
? = 1
? = 10
----


query  rowsort
WITH `alias_2` AS (SELECT `table_1`.`column_1` AS `alias_1` FROM `table_1`) SELECT `table_1`.`column_1` AS `alias_3` FROM `table_1` INNER JOIN `alias_2` ON (`table_1`.`column_1` = `alias_2`.`alias_1`) WHERE (((`table_1`.`column_1` = ?) AND (`table_1`.`column_1` = ?)) AND (`table_1`.`column_1` > ?))
? = 1
? = 1
? = 10
----


statement ok
DELETE FROM `table_1` WHERE (`column_2` = 0)


statement ok
DELETE FROM `table_1` WHERE (`column_2` = 1)


statement ok
DELETE FROM `table_1` WHERE (`column_2` = 2)


statement ok
DELETE FROM `table_1` WHERE (`column_2` = 3)


statement ok
DELETE FROM `table_1` WHERE (`column_2` = 4)


query  rowsort
WITH `alias_2` AS (SELECT `table_1`.`column_1` AS `alias_1` FROM `table_1`) SELECT `table_1`.`column_1` AS `alias_3` FROM `table_1` INNER JOIN `alias_2` ON (`table_1`.`column_1` = `alias_2`.`alias_1`) WHERE ((`table_1`.`column_1` = ?) AND (`table_1`.`column_1` = ?))
? = 1
? = 1
----


query  rowsort
WITH `alias_2` AS (SELECT `table_1`.`column_1` AS `alias_1` FROM `table_1`) SELECT `table_1`.`column_1` AS `alias_3` FROM `table_1` INNER JOIN `alias_2` ON (`table_1`.`column_1` = `alias_2`.`alias_1`) WHERE ((`table_1`.`column_1` = ?) AND (`table_1`.`column_1` = ?))
? = 1
? = 1
----


query  rowsort
WITH `alias_2` AS (SELECT `table_1`.`column_1` AS `alias_1` FROM `table_1`) SELECT `table_1`.`column_1` AS `alias_3` FROM `table_1` INNER JOIN `alias_2` ON (`table_1`.`column_1` = `alias_2`.`alias_1`) WHERE ((`table_1`.`column_1` = ?) AND (`table_1`.`column_1` = ?))
? = 1
? = 1
----


query  rowsort
WITH `alias_2` AS (SELECT `table_1`.`column_1` AS `alias_1` FROM `table_1`) SELECT `table_1`.`column_1` AS `alias_3` FROM `table_1` INNER JOIN `alias_2` ON (`table_1`.`column_1` = `alias_2`.`alias_1`) WHERE (`table_1`.`column_1` > ?)
? = 10
----
1959112172

query  rowsort
WITH `alias_2` AS (SELECT `table_1`.`column_1` AS `alias_1` FROM `table_1`) SELECT `table_1`.`column_1` AS `alias_3` FROM `table_1` INNER JOIN `alias_2` ON (`table_1`.`column_1` = `alias_2`.`alias_1`) WHERE (`table_1`.`column_1` > ?)
? = 10
----
1959112172

query  rowsort
WITH `alias_2` AS (SELECT `table_1`.`column_1` AS `alias_1` FROM `table_1`) SELECT `table_1`.`column_1` AS `alias_3` FROM `table_1` INNER JOIN `alias_2` ON (`table_1`.`column_1` = `alias_2`.`alias_1`) WHERE (`table_1`.`column_1` > ?)
? = 10
----
1959112172

query  rowsort
WITH `alias_2` AS (SELECT `table_1`.`column_1` AS `alias_1` FROM `table_1`) SELECT `table_1`.`column_1` AS `alias_3` FROM `table_1` INNER JOIN `alias_2` ON (`table_1`.`column_1` = `alias_2`.`alias_1`) WHERE (((`table_1`.`column_1` = ?) AND (`table_1`.`column_1` = ?)) AND (`table_1`.`column_1` > ?))
? = 1
? = 1
? = 10
----


query  rowsort
WITH `alias_2` AS (SELECT `table_1`.`column_1` AS `alias_1` FROM `table_1`) SELECT `table_1`.`column_1` AS `alias_3` FROM `table_1` INNER JOIN `alias_2` ON (`table_1`.`column_1` = `alias_2`.`alias_1`) WHERE (((`table_1`.`column_1` = ?) AND (`table_1`.`column_1` = ?)) AND (`table_1`.`column_1` > ?))
? = 1
? = 1
? = 10
----


query  rowsort
WITH `alias_2` AS (SELECT `table_1`.`column_1` AS `alias_1` FROM `table_1`) SELECT `table_1`.`column_1` AS `alias_3` FROM `table_1` INNER JOIN `alias_2` ON (`table_1`.`column_1` = `alias_2`.`alias_1`) WHERE (((`table_1`.`column_1` = ?) AND (`table_1`.`column_1` = ?)) AND (`table_1`.`column_1` > ?))
? = 1
? = 1
? = 10
----

