# Generated by:
#     target/debug/noria-logictest permute -d 3 -o logictests/generated/mysql --only in_parameter --compare-to mysql://root:noria@localhost/mysql --subquery-depth 1 --rows-per-table 5 --include-deletes --overwrite-tests

statement ok
CREATE TABLE table_1 (column_1 TEXT, column_9 INT, column_5 TEXT, column_3 TEXT, column_8 INT, column_4 INT, column_7 TEXT, column_6 INT, column_2 INT, PRIMARY KEY (column_9))


statement ok
INSERT INTO table_1 (column_1, column_9, column_5, column_3, column_8, column_4, column_7, column_6, column_2) VALUES ('1', 0, 'a', 'a', 1, 1, 'a', 1, 2), ('a', 1, 'a', 'a', 1, 1, 'a', 1, 1), ('0', 2, 'a', 'a', 1, 1, 'a', 1, 0), ('a', 3, 'a', 'a', 1, 1, 'a', 1, 1), ('2', 4, 'a', 'a', 1, 1, 'a', 1, 1)


query  rowsort
SELECT group_concat(table_1.column_1 separator ', ') AS alias_1 FROM table_1
----
1, a, 0, a, 2

query  rowsort
SELECT sum(table_1.column_2) AS alias_1 FROM table_1
----
5

query  rowsort
SELECT table_1.column_1 AS alias_1 FROM table_1 WHERE table_1.column_1 IN (?, ?, ?)
? = 0
? = 1
? = 2
----
0
1
2

query  rowsort
SELECT group_concat(table_1.column_3 separator ', ') AS alias_1, sum(table_1.column_4) AS alias_2 FROM table_1
----
a, a, a, a, a
5

query  rowsort
SELECT group_concat(table_1.column_5 separator ', ') AS alias_1 FROM table_1 WHERE table_1.column_2 IN (?, ?, ?)
? = 0
? = 1
? = 2
----
a, a, a, a, a

query  rowsort
SELECT sum(table_1.column_6) AS alias_1 FROM table_1 WHERE table_1.column_2 IN (?, ?, ?)
? = 0
? = 1
? = 2
----
5

query  rowsort
SELECT group_concat(table_1.column_7 separator ', ') AS alias_1, sum(table_1.column_8) AS alias_2 FROM table_1 WHERE table_1.column_1 IN (?, ?, ?)
? = 0
? = 1
? = 2
----
a, a, a
3

statement ok
DELETE FROM table_1 WHERE (column_9 = 0)


statement ok
DELETE FROM table_1 WHERE (column_9 = 1)


query  rowsort
SELECT group_concat(table_1.column_1 separator ', ') AS alias_1 FROM table_1
----
0, a, 2

query  rowsort
SELECT sum(table_1.column_2) AS alias_1 FROM table_1
----
2

query  rowsort
SELECT table_1.column_1 AS alias_1 FROM table_1 WHERE table_1.column_1 IN (?, ?, ?)
? = 0
? = 1
? = 2
----
0
2

query  rowsort
SELECT group_concat(table_1.column_3 separator ', ') AS alias_1, sum(table_1.column_4) AS alias_2 FROM table_1
----
a, a, a
3

query  rowsort
SELECT group_concat(table_1.column_5 separator ', ') AS alias_1 FROM table_1 WHERE table_1.column_2 IN (?, ?, ?)
? = 0
? = 1
? = 2
----
a, a, a

query  rowsort
SELECT sum(table_1.column_6) AS alias_1 FROM table_1 WHERE table_1.column_2 IN (?, ?, ?)
? = 0
? = 1
? = 2
----
3

query  rowsort
SELECT group_concat(table_1.column_7 separator ', ') AS alias_1, sum(table_1.column_8) AS alias_2 FROM table_1 WHERE table_1.column_1 IN (?, ?, ?)
? = 0
? = 1
? = 2
----
a, a
2
