# Generated by:
#     target/debug/noria-logictest permute --compare-to mysql://root:noria@127.1/noria -d 3 -o logictests/generated/mysql/ --only range_param --random --include-deletes --rows-per-table 10 --subquery-depth 1

statement ok
CREATE TABLE `table_1` (`column_4` INT, `column_3` INT, `column_5` INT, `column_1` INT, `column_2` INT, PRIMARY KEY (`column_5`))


statement ok
CREATE TABLE `table_5` (`column_2` INT, `column_3` INT, `column_1` INT, PRIMARY KEY (`column_3`))


statement ok
CREATE TABLE `table_3` (`column_3` INT, `column_4` INT, `column_1` INT, `column_2` INT, PRIMARY KEY (`column_4`))


statement ok
CREATE TABLE `table_2` (`column_1` INT, `column_3` INT, `column_2` INT, PRIMARY KEY (`column_3`))


statement ok
CREATE TABLE `table_4` (`column_3` INT, `column_1` INT, `column_2` INT, PRIMARY KEY (`column_3`))


statement ok
INSERT INTO `table_1` (`column_4`, `column_3`, `column_5`, `column_1`, `column_2`) VALUES (123144882, -319465668, 0, 0, 1652486536), (-365846190, 192362052, 1, 534261064, 608940171), (1420498999, -1827505140, 2, 1, 1056981726), (65040997, -1902027352, 3, -1533179324, 363506794), (-1890188934, 1980780175, 4, 2, 60539240), (-1675641301, -184306420, 5, 1256367026, -1669522916), (211512918, 1398326112, 6, 0, 571247840), (1058066649, -1464026813, 7, 1452702078, 354403794), (-1551540463, 1183911086, 8, 1, 1184433811), (1740899978, 1086714114, 9, -583691992, 1702175893)


statement ok
INSERT INTO `table_5` (`column_2`, `column_3`, `column_1`) VALUES (-1406302524, 0, -1850933053), (1238950168, 1, 1965780739), (1066782053, 2, 274790191), (54480503, 3, 27959220), (-1010277601, 4, -1224723825), (1083125872, 5, -2047494866), (-1058273191, 6, -1001986816), (-2016222783, 7, -367314826), (106702049, 8, 264932753), (1180969246, 9, 1308906144)


statement ok
INSERT INTO `table_3` (`column_3`, `column_4`, `column_1`, `column_2`) VALUES (575976110, 0, 968672105, 0), (-118580132, 1, 1456705935, 406324397), (396663099, 2, 1647247215, 2), (-1905483494, 3, 1713217300, -1325743959), (1662320247, 4, 2129719817, 1), (398017776, 5, -1494119320, 464310838), (-1046370519, 6, -1763503608, 0), (76121063, 7, 2107315068, 3774136), (1469131912, 8, -155656396, 2), (1326861064, 9, 1547607388, 29675451)


statement ok
INSERT INTO `table_2` (`column_1`, `column_3`, `column_2`) VALUES (-1671629605, 0, -61579252), (1975096376, 1, 1551524232), (2068171571, 2, 1840565912), (605949467, 3, 1953462351), (-614589078, 4, 893688812), (1651549555, 5, 1750141745), (742749096, 6, -695201550), (553565461, 7, 1040891750), (-1047624906, 8, -1050601755), (2100567657, 9, -1940276016)


statement ok
INSERT INTO `table_4` (`column_3`, `column_1`, `column_2`) VALUES (0, 2135174944, -2005785621), (1, -1276990706, 1984584146), (2, 1172153022, 98397001), (3, 595205310, 320291005), (4, 1556858646, -811428445), (5, -637383679, -664574708), (6, -2102221936, 141183388), (7, 1456743012, 729080079), (8, 360488240, -1979598126), (9, 983309377, -1482345484)


query  rowsort
SELECT `table_1`.`column_1` AS `alias_1` FROM `table_1` WHERE `table_1`.`column_1` IN (?, ?, ?)
? = 0
? = 1
? = 2
----
0
0
1
1
2

query  rowsort
SELECT `table_1`.`column_2` AS `alias_1`, `table_2`.`column_2` AS `alias_2` FROM `table_1` LEFT JOIN `table_2` ON (`table_1`.`column_1` = `table_2`.`column_1`)
----
-1669522916
NULL
1056981726
NULL
1184433811
NULL
1652486536
NULL
1702175893
NULL
354403794
NULL
363506794
NULL
571247840
NULL
60539240
NULL
608940171
NULL

query  rowsort
SELECT `table_1`.`column_1` AS `alias_1` FROM `table_1` WHERE (`table_1`.`column_1` > ?)
? = 10
----
1256367026
1452702078
534261064

query  rowsort
SELECT `table_1`.`column_3` AS `alias_1`, `table_3`.`column_2` AS `alias_2` FROM `table_1` LEFT JOIN `table_3` ON (`table_1`.`column_1` = `table_3`.`column_1`) WHERE `table_1`.`column_1` IN (?, ?, ?)
? = 0
? = 1
? = 2
----
-1827505140
NULL
-319465668
NULL
1183911086
NULL
1398326112
NULL
1980780175
NULL

query  rowsort
SELECT `table_3`.`column_2` AS `alias_1` FROM `table_3` WHERE (`table_3`.`column_2` IN (?, ?, ?) AND (`table_3`.`column_2` > ?))
? = 0
? = 1
? = 2
? = 10
----


query  rowsort
SELECT `table_3`.`column_3` AS `alias_1`, `table_4`.`column_2` AS `alias_2` FROM `table_3` LEFT JOIN `table_4` ON (`table_3`.`column_2` = `table_4`.`column_1`) WHERE (`table_3`.`column_3` > ?)
? = 10
----
1326861064
NULL
1469131912
NULL
1662320247
NULL
396663099
NULL
398017776
NULL
575976110
NULL
76121063
NULL

query  rowsort
SELECT `table_1`.`column_4` AS `alias_1`, `table_5`.`column_2` AS `alias_2` FROM `table_1` LEFT JOIN `table_5` ON (`table_1`.`column_1` = `table_5`.`column_1`) WHERE (`table_1`.`column_1` IN (?, ?, ?) AND (`table_1`.`column_4` > ?))
? = 0
? = 1
? = 2
? = 10
----
123144882
NULL
1420498999
NULL
211512918
NULL

statement ok
DELETE FROM `table_1` WHERE (`column_5` = 0)


statement ok
DELETE FROM `table_1` WHERE (`column_5` = 1)


statement ok
DELETE FROM `table_1` WHERE (`column_5` = 2)


statement ok
DELETE FROM `table_1` WHERE (`column_5` = 3)


statement ok
DELETE FROM `table_1` WHERE (`column_5` = 4)


statement ok
DELETE FROM `table_5` WHERE (`column_3` = 0)


statement ok
DELETE FROM `table_5` WHERE (`column_3` = 1)


statement ok
DELETE FROM `table_5` WHERE (`column_3` = 2)


statement ok
DELETE FROM `table_5` WHERE (`column_3` = 3)


statement ok
DELETE FROM `table_5` WHERE (`column_3` = 4)


statement ok
DELETE FROM `table_3` WHERE (`column_4` = 0)


statement ok
DELETE FROM `table_3` WHERE (`column_4` = 1)


statement ok
DELETE FROM `table_3` WHERE (`column_4` = 2)


statement ok
DELETE FROM `table_3` WHERE (`column_4` = 3)


statement ok
DELETE FROM `table_3` WHERE (`column_4` = 4)


statement ok
DELETE FROM `table_2` WHERE (`column_3` = 0)


statement ok
DELETE FROM `table_2` WHERE (`column_3` = 1)


statement ok
DELETE FROM `table_2` WHERE (`column_3` = 2)


statement ok
DELETE FROM `table_2` WHERE (`column_3` = 3)


statement ok
DELETE FROM `table_2` WHERE (`column_3` = 4)


statement ok
DELETE FROM `table_4` WHERE (`column_3` = 0)


statement ok
DELETE FROM `table_4` WHERE (`column_3` = 1)


statement ok
DELETE FROM `table_4` WHERE (`column_3` = 2)


statement ok
DELETE FROM `table_4` WHERE (`column_3` = 3)


statement ok
DELETE FROM `table_4` WHERE (`column_3` = 4)


query  rowsort
SELECT `table_1`.`column_1` AS `alias_1` FROM `table_1` WHERE `table_1`.`column_1` IN (?, ?, ?)
? = 0
? = 1
? = 2
----
0
1

query  rowsort
SELECT `table_1`.`column_2` AS `alias_1`, `table_2`.`column_2` AS `alias_2` FROM `table_1` LEFT JOIN `table_2` ON (`table_1`.`column_1` = `table_2`.`column_1`)
----
-1669522916
NULL
1184433811
NULL
1702175893
NULL
354403794
NULL
571247840
NULL

query  rowsort
SELECT `table_1`.`column_1` AS `alias_1` FROM `table_1` WHERE (`table_1`.`column_1` > ?)
? = 10
----
1256367026
1452702078

query  rowsort
SELECT `table_1`.`column_3` AS `alias_1`, `table_3`.`column_2` AS `alias_2` FROM `table_1` LEFT JOIN `table_3` ON (`table_1`.`column_1` = `table_3`.`column_1`) WHERE `table_1`.`column_1` IN (?, ?, ?)
? = 0
? = 1
? = 2
----
1183911086
NULL
1398326112
NULL

query  rowsort
SELECT `table_3`.`column_2` AS `alias_1` FROM `table_3` WHERE (`table_3`.`column_2` IN (?, ?, ?) AND (`table_3`.`column_2` > ?))
? = 0
? = 1
? = 2
? = 10
----


query  rowsort
SELECT `table_3`.`column_3` AS `alias_1`, `table_4`.`column_2` AS `alias_2` FROM `table_3` LEFT JOIN `table_4` ON (`table_3`.`column_2` = `table_4`.`column_1`) WHERE (`table_3`.`column_3` > ?)
? = 10
----
1326861064
NULL
1469131912
NULL
398017776
NULL
76121063
NULL

query  rowsort
SELECT `table_1`.`column_4` AS `alias_1`, `table_5`.`column_2` AS `alias_2` FROM `table_1` LEFT JOIN `table_5` ON (`table_1`.`column_1` = `table_5`.`column_1`) WHERE (`table_1`.`column_1` IN (?, ?, ?) AND (`table_1`.`column_4` > ?))
? = 0
? = 1
? = 2
? = 10
----
211512918
NULL
