# Generated by:
#     target/debug/noria-logictest permute --compare-to mysql://root:noria@127.1/noria -d 3 -o logictests/generated/mysql/ --only range_param --random --include-deletes --rows-per-table 10 --subquery-depth 1

statement ok
CREATE TABLE `table_6` (`column_3` INT, `column_4` INT, `column_5` INT, `column_2` INT, `column_1` INT, `column_7` INT, `column_6` INT, `column_8` INT, `column_9` INT, PRIMARY KEY (`column_9`))


statement ok
CREATE TABLE `table_2` (`column_1` INT, `column_2` INT, `column_3` INT, `column_5` INT, `column_4` INT, `column_6` INT, PRIMARY KEY (`column_6`))


statement ok
CREATE TABLE `table_5` (`column_2` INT, `column_3` INT, `column_1` INT, PRIMARY KEY (`column_3`))


statement ok
CREATE TABLE `table_8` (`column_1` INT, `column_2` INT, `column_3` INT, PRIMARY KEY (`column_3`))


statement ok
CREATE TABLE `table_10` (`column_2` INT, `column_1` INT, `column_3` INT, PRIMARY KEY (`column_3`))


statement ok
CREATE TABLE `table_9` (`column_3` INT, `column_2` INT, `column_1` INT, `column_4` INT, PRIMARY KEY (`column_4`))


statement ok
CREATE TABLE `table_11` (`column_3` INT, `column_2` INT, `column_1` INT, PRIMARY KEY (`column_3`))


statement ok
CREATE TABLE `table_12` (`column_2` INT, `column_3` INT, `column_1` INT, PRIMARY KEY (`column_3`))


statement ok
CREATE TABLE `table_13` (`column_3` INT, `column_1` INT, `column_2` INT, PRIMARY KEY (`column_3`))


statement ok
CREATE TABLE `table_1` (`column_3` INT, `column_1` INT, `column_2` INT, `column_4` INT, PRIMARY KEY (`column_4`))


statement ok
CREATE TABLE `table_3` (`column_2` INT, `column_3` INT, `column_1` INT, PRIMARY KEY (`column_3`))


statement ok
CREATE TABLE `table_4` (`column_2` INT, `column_1` INT, `column_3` INT, PRIMARY KEY (`column_3`))


statement ok
CREATE TABLE `table_7` (`column_2` INT, `column_3` INT, `column_1` INT, PRIMARY KEY (`column_3`))


statement ok
INSERT INTO `table_6` (`column_3`, `column_4`, `column_5`, `column_2`, `column_1`, `column_7`, `column_6`, `column_8`, `column_9`) VALUES (278870269, 235912262, -1944905352, -1413953562, -1002166155, 266589098, -1177394138, -1669015670, 0), (1162889618, 670568059, -362211905, 2120548990, 1196610858, -585024552, 39783587, -1096185721, 1), (1226454174, -757277531, 1244351459, -708760295, -91432191, 122498140, 1594158718, -1939103322, 2), (-695123614, -9770960, 1761244527, 643890824, 627776766, -1215838540, -1316512056, 1523367704, 3), (255534562, 1224949434, -289385876, -48467090, -1147844888, 552330271, 200955801, -982696605, 4), (1719386172, -1917672649, 674450067, -860054451, 91814117, 465230655, 75182084, -1940338740, 5), (-506809055, -1766760580, 628796855, 438956879, 1609487715, -785634002, 2088043776, -2111455446, 6), (714456459, -1799311526, -1206659399, -1426802591, 1752876766, 602100332, 1645065465, -889950472, 7), (1902756131, -1999414438, -702739920, 2388068, -1964696694, 979107954, -1098583277, 542807038, 8), (-2126059612, -1581087058, 767317841, 470238146, 1191548948, 303757971, -1925490280, -1829192530, 9)


statement ok
INSERT INTO `table_2` (`column_1`, `column_2`, `column_3`, `column_5`, `column_4`, `column_6`) VALUES (37254146, -574133141, -1763648163, 1470527868, 820017777, 0), (-1439783386, 317503334, 310751509, 1334015707, 479920707, 1), (-754357910, 1783292670, 1351338072, -1427113044, 637412425, 2), (-609346868, -1121447428, -1118899249, -1316682876, 271730950, 3), (-72452769, -245255980, -846149322, 1788797767, -1169126886, 4), (1472239584, 633815265, 1614132734, 363002763, -1053129902, 5), (180785898, -680197796, 1602338837, -2053383924, 893668979, 6), (1366655736, -9886255, 434049509, 442851038, 1969334914, 7), (961577818, 1662620817, 1150024196, -509208369, 306267804, 8), (657236757, 534075806, 1762798404, 330043916, -530904866, 9)


statement ok
INSERT INTO `table_5` (`column_2`, `column_3`, `column_1`) VALUES (1082831039, 0, 372475671), (-1764652621, 1, 133508246), (1506114355, 2, -1912640242), (-76679729, 3, 1199810289), (815504046, 4, -390992007), (1866470721, 5, -118398347), (-1537956530, 6, 2094520006), (-257687379, 7, -203336602), (-270077145, 8, -1159882111), (825837390, 9, 572045971)


statement ok
INSERT INTO `table_8` (`column_1`, `column_2`, `column_3`) VALUES (433492731, -1962993097, 0), (334581104, -1907470011, 1), (845892302, -1715517125, 2), (-436308427, -2139766832, 3), (-355473020, -790737258, 4), (1470918065, 546206363, 5), (1768845974, -281187115, 6), (1575114530, 838211228, 7), (-1590673954, 1857688199, 8), (-1690601617, 148041825, 9)


statement ok
INSERT INTO `table_10` (`column_2`, `column_1`, `column_3`) VALUES (1397215930, 1844765291, 0), (-1114200060, 1864241586, 1), (893653328, -1112875395, 2), (-1237770680, -1553948599, 3), (2053988015, 2106088997, 4), (-397777907, 2076261884, 5), (-457587789, -1391602573, 6), (-1789745624, -2018371531, 7), (-239175104, 1855499250, 8), (-931648627, 895720078, 9)


statement ok
INSERT INTO `table_9` (`column_3`, `column_2`, `column_1`, `column_4`) VALUES (-1050640154, -415492638, 1962098947, 0), (-1702915716, -1040158727, 1568128819, 1), (1151284239, 440621007, 1300723313, 2), (-296038219, 1911572361, -78459002, 3), (-819737293, 1052238491, -164311810, 4), (-483124203, -2079187536, 1097669928, 5), (792479992, -2104767022, -1469952534, 6), (1460154341, 2118385057, 1227521244, 7), (-1931944049, -1972114712, -1122204507, 8), (102617371, 2034490075, -1143244624, 9)


statement ok
INSERT INTO `table_11` (`column_3`, `column_2`, `column_1`) VALUES (0, -582127590, -1407640305), (1, 937165812, -1259304535), (2, -1191243071, -1475191385), (3, 155718030, 265556446), (4, 473282431, -716977549), (5, 1991871301, -413010186), (6, 1331106894, -613945280), (7, -733105946, -1548610763), (8, 819816080, -201225193), (9, 1868450790, -737153733)


statement ok
INSERT INTO `table_12` (`column_2`, `column_3`, `column_1`) VALUES (1158093451, 0, -7033593), (-605093769, 1, 732758304), (1303703348, 2, -2080712623), (-1500751796, 3, -1107574416), (-1007119049, 4, -1681627874), (-1003992407, 5, -2035845610), (386485332, 6, 1319114542), (1874381651, 7, 483985215), (-1653565033, 8, -601856286), (-1248100066, 9, -1947215963)


statement ok
INSERT INTO `table_13` (`column_3`, `column_1`, `column_2`) VALUES (0, -1401063495, 49016453), (1, -715093103, -1145547364), (2, -597868925, 2026504862), (3, 2128702414, -1446214230), (4, -2130146309, -1961458430), (5, -1223705748, 709700980), (6, -1621189717, 995467860), (7, -1124763426, -2091872957), (8, 955708942, 457324986), (9, 106472971, -1428681569)


statement ok
INSERT INTO `table_1` (`column_3`, `column_1`, `column_2`, `column_4`) VALUES (-296317326, 1286897843, -398842200, 0), (-942362845, 1262005102, 2118096705, 1), (1673833870, 1201639456, -1056741223, 2), (-1333950022, -1971332476, 610903085, 3), (1954203926, -81960027, -1228481203, 4), (-65385357, 511508019, -1992391813, 5), (-1635619721, 1712126662, 1657200605, 6), (6808767, 891996582, -1896520473, 7), (1511510437, 1687435164, -357090586, 8), (-1282478535, 452863033, -1899653854, 9)


statement ok
INSERT INTO `table_3` (`column_2`, `column_3`, `column_1`) VALUES (2084467254, 0, -921400949), (-1469229635, 1, -1100057103), (-1533371635, 2, -1529209684), (-630432283, 3, -1514178968), (-438201086, 4, 1941993713), (380569324, 5, -1993615668), (-1870544195, 6, 200615299), (1279435264, 7, 751097667), (-742216473, 8, -1441770467), (544318787, 9, 849983717)


statement ok
INSERT INTO `table_4` (`column_2`, `column_1`, `column_3`) VALUES (192017648, -2071295464, 0), (183613375, 1362534651, 1), (1572554016, -1186745733, 2), (-897229564, -170063372, 3), (845699142, -692884292, 4), (704530212, 39041808, 5), (955553949, 620842216, 6), (178159404, -1956342952, 7), (1640355256, 197298388, 8), (1750419854, 565966416, 9)


statement ok
INSERT INTO `table_7` (`column_2`, `column_3`, `column_1`) VALUES (693048692, 0, 1273556061), (1883690281, 1, 888092054), (1670920222, 2, -1267852179), (1984660428, 3, -432617026), (2098362150, 4, -1144414085), (-303319576, 5, -685903696), (-368235761, 6, 212596667), (1026070380, 7, 359219702), (-234900130, 8, -1598702202), (1581707888, 9, -2056327062)


query  rowsort
SELECT `table_1`.`column_2` AS `alias_1`, `table_2`.`column_2` AS `alias_2` FROM `table_1` LEFT JOIN `table_2` ON (`table_1`.`column_1` = `table_2`.`column_1`) INNER JOIN (SELECT `table_2`.`column_3` AS `alias_3`, `table_3`.`column_2` AS `alias_4` FROM `table_2` LEFT JOIN `table_3` ON (`table_2`.`column_1` = `table_3`.`column_1`)) AS alias_5 ON (`table_1`.`column_2` = `alias_5`.`alias_3`)
----


query  rowsort
SELECT `table_1`.`column_3` AS `alias_1`, `table_4`.`column_2` AS `alias_2` FROM `table_1` LEFT JOIN `table_4` ON (`table_1`.`column_2` = `table_4`.`column_1`) INNER JOIN (SELECT `table_4`.`column_2` AS `alias_3` FROM `table_4`) AS alias_4 ON (`table_1`.`column_3` = `alias_4`.`alias_3`)
----


query  rowsort
SELECT `table_2`.`column_4` AS `alias_1`, `table_5`.`column_2` AS `alias_2` FROM `table_2` LEFT JOIN `table_5` ON (`table_2`.`column_1` = `table_5`.`column_1`) INNER JOIN (SELECT `table_2`.`column_5` AS `alias_3`, `table_6`.`column_2` AS `alias_4` FROM `table_2` LEFT JOIN `table_6` ON (`table_2`.`column_1` = `table_6`.`column_1`)) AS alias_5 ON (`table_2`.`column_1` = `alias_5`.`alias_3`)
----


query  rowsort
SELECT `table_6`.`column_1` AS `alias_4` FROM `table_6` INNER JOIN (SELECT `table_6`.`column_3` AS `alias_1`, `table_7`.`column_2` AS `alias_2` FROM `table_6` LEFT JOIN `table_7` ON (`table_6`.`column_1` = `table_7`.`column_1`)) AS alias_3 ON (`table_6`.`column_1` = `alias_3`.`alias_1`) WHERE (`table_6`.`column_1` > ?)
? = 10
----


query  rowsort
SELECT `table_6`.`column_1` AS `alias_3` FROM `table_6` INNER JOIN (SELECT `table_6`.`column_1` AS `alias_1` FROM `table_6`) AS alias_2 ON (`table_6`.`column_1` = `alias_2`.`alias_1`) WHERE (`table_6`.`column_1` > ?)
? = 10
----
1191548948
1196610858
1609487715
1752876766
627776766
91814117

query  rowsort
SELECT `table_6`.`column_1` AS `alias_4` FROM `table_6` INNER JOIN (SELECT `table_6`.`column_4` AS `alias_1`, `table_8`.`column_2` AS `alias_2` FROM `table_6` LEFT JOIN `table_8` ON (`table_6`.`column_1` = `table_8`.`column_1`)) AS alias_3 ON (`table_6`.`column_1` = `alias_3`.`alias_1`) WHERE (`table_6`.`column_1` > ?)
? = 10
----


query  rowsort
SELECT `table_6`.`column_5` AS `alias_1`, `table_9`.`column_2` AS `alias_2` FROM `table_6` LEFT JOIN `table_9` ON (`table_6`.`column_1` = `table_9`.`column_1`) INNER JOIN (SELECT `table_9`.`column_3` AS `alias_3`, `table_10`.`column_2` AS `alias_4` FROM `table_9` LEFT JOIN `table_10` ON (`table_9`.`column_2` = `table_10`.`column_1`)) AS alias_5 ON (`table_6`.`column_1` = `alias_5`.`alias_3`) WHERE (`table_6`.`column_1` > ?)
? = 10
----


query  rowsort
SELECT `table_6`.`column_6` AS `alias_1`, `table_11`.`column_2` AS `alias_2` FROM `table_6` LEFT JOIN `table_11` ON (`table_6`.`column_1` = `table_11`.`column_1`) INNER JOIN (SELECT `table_11`.`column_2` AS `alias_3` FROM `table_11`) AS alias_4 ON (`table_6`.`column_1` = `alias_4`.`alias_3`) WHERE (`table_6`.`column_1` > ?)
? = 10
----


query  rowsort
SELECT `table_6`.`column_7` AS `alias_1`, `table_12`.`column_2` AS `alias_2` FROM `table_6` LEFT JOIN `table_12` ON (`table_6`.`column_1` = `table_12`.`column_1`) INNER JOIN (SELECT `table_6`.`column_8` AS `alias_3`, `table_13`.`column_2` AS `alias_4` FROM `table_6` LEFT JOIN `table_13` ON (`table_6`.`column_1` = `table_13`.`column_1`)) AS alias_5 ON (`table_6`.`column_3` = `alias_5`.`alias_3`) WHERE (`table_6`.`column_1` > ?)
? = 10
----


statement ok
DELETE FROM `table_6` WHERE (`column_9` = 0)


statement ok
DELETE FROM `table_6` WHERE (`column_9` = 1)


statement ok
DELETE FROM `table_6` WHERE (`column_9` = 2)


statement ok
DELETE FROM `table_6` WHERE (`column_9` = 3)


statement ok
DELETE FROM `table_6` WHERE (`column_9` = 4)


statement ok
DELETE FROM `table_2` WHERE (`column_6` = 0)


statement ok
DELETE FROM `table_2` WHERE (`column_6` = 1)


statement ok
DELETE FROM `table_2` WHERE (`column_6` = 2)


statement ok
DELETE FROM `table_2` WHERE (`column_6` = 3)


statement ok
DELETE FROM `table_2` WHERE (`column_6` = 4)


statement ok
DELETE FROM `table_5` WHERE (`column_3` = 0)


statement ok
DELETE FROM `table_5` WHERE (`column_3` = 1)


statement ok
DELETE FROM `table_5` WHERE (`column_3` = 2)


statement ok
DELETE FROM `table_5` WHERE (`column_3` = 3)


statement ok
DELETE FROM `table_5` WHERE (`column_3` = 4)


statement ok
DELETE FROM `table_8` WHERE (`column_3` = 0)


statement ok
DELETE FROM `table_8` WHERE (`column_3` = 1)


statement ok
DELETE FROM `table_8` WHERE (`column_3` = 2)


statement ok
DELETE FROM `table_8` WHERE (`column_3` = 3)


statement ok
DELETE FROM `table_8` WHERE (`column_3` = 4)


statement ok
DELETE FROM `table_10` WHERE (`column_3` = 0)


statement ok
DELETE FROM `table_10` WHERE (`column_3` = 1)


statement ok
DELETE FROM `table_10` WHERE (`column_3` = 2)


statement ok
DELETE FROM `table_10` WHERE (`column_3` = 3)


statement ok
DELETE FROM `table_10` WHERE (`column_3` = 4)


statement ok
DELETE FROM `table_9` WHERE (`column_4` = 0)


statement ok
DELETE FROM `table_9` WHERE (`column_4` = 1)


statement ok
DELETE FROM `table_9` WHERE (`column_4` = 2)


statement ok
DELETE FROM `table_9` WHERE (`column_4` = 3)


statement ok
DELETE FROM `table_9` WHERE (`column_4` = 4)


statement ok
DELETE FROM `table_11` WHERE (`column_3` = 0)


statement ok
DELETE FROM `table_11` WHERE (`column_3` = 1)


statement ok
DELETE FROM `table_11` WHERE (`column_3` = 2)


statement ok
DELETE FROM `table_11` WHERE (`column_3` = 3)


statement ok
DELETE FROM `table_11` WHERE (`column_3` = 4)


statement ok
DELETE FROM `table_12` WHERE (`column_3` = 0)


statement ok
DELETE FROM `table_12` WHERE (`column_3` = 1)


statement ok
DELETE FROM `table_12` WHERE (`column_3` = 2)


statement ok
DELETE FROM `table_12` WHERE (`column_3` = 3)


statement ok
DELETE FROM `table_12` WHERE (`column_3` = 4)


statement ok
DELETE FROM `table_13` WHERE (`column_3` = 0)


statement ok
DELETE FROM `table_13` WHERE (`column_3` = 1)


statement ok
DELETE FROM `table_13` WHERE (`column_3` = 2)


statement ok
DELETE FROM `table_13` WHERE (`column_3` = 3)


statement ok
DELETE FROM `table_13` WHERE (`column_3` = 4)


statement ok
DELETE FROM `table_1` WHERE (`column_4` = 0)


statement ok
DELETE FROM `table_1` WHERE (`column_4` = 1)


statement ok
DELETE FROM `table_1` WHERE (`column_4` = 2)


statement ok
DELETE FROM `table_1` WHERE (`column_4` = 3)


statement ok
DELETE FROM `table_1` WHERE (`column_4` = 4)


statement ok
DELETE FROM `table_3` WHERE (`column_3` = 0)


statement ok
DELETE FROM `table_3` WHERE (`column_3` = 1)


statement ok
DELETE FROM `table_3` WHERE (`column_3` = 2)


statement ok
DELETE FROM `table_3` WHERE (`column_3` = 3)


statement ok
DELETE FROM `table_3` WHERE (`column_3` = 4)


statement ok
DELETE FROM `table_4` WHERE (`column_3` = 0)


statement ok
DELETE FROM `table_4` WHERE (`column_3` = 1)


statement ok
DELETE FROM `table_4` WHERE (`column_3` = 2)


statement ok
DELETE FROM `table_4` WHERE (`column_3` = 3)


statement ok
DELETE FROM `table_4` WHERE (`column_3` = 4)


statement ok
DELETE FROM `table_7` WHERE (`column_3` = 0)


statement ok
DELETE FROM `table_7` WHERE (`column_3` = 1)


statement ok
DELETE FROM `table_7` WHERE (`column_3` = 2)


statement ok
DELETE FROM `table_7` WHERE (`column_3` = 3)


statement ok
DELETE FROM `table_7` WHERE (`column_3` = 4)


query  rowsort
SELECT `table_1`.`column_2` AS `alias_1`, `table_2`.`column_2` AS `alias_2` FROM `table_1` LEFT JOIN `table_2` ON (`table_1`.`column_1` = `table_2`.`column_1`) INNER JOIN (SELECT `table_2`.`column_3` AS `alias_3`, `table_3`.`column_2` AS `alias_4` FROM `table_2` LEFT JOIN `table_3` ON (`table_2`.`column_1` = `table_3`.`column_1`)) AS alias_5 ON (`table_1`.`column_2` = `alias_5`.`alias_3`)
----


query  rowsort
SELECT `table_1`.`column_3` AS `alias_1`, `table_4`.`column_2` AS `alias_2` FROM `table_1` LEFT JOIN `table_4` ON (`table_1`.`column_2` = `table_4`.`column_1`) INNER JOIN (SELECT `table_4`.`column_2` AS `alias_3` FROM `table_4`) AS alias_4 ON (`table_1`.`column_3` = `alias_4`.`alias_3`)
----


query  rowsort
SELECT `table_2`.`column_4` AS `alias_1`, `table_5`.`column_2` AS `alias_2` FROM `table_2` LEFT JOIN `table_5` ON (`table_2`.`column_1` = `table_5`.`column_1`) INNER JOIN (SELECT `table_2`.`column_5` AS `alias_3`, `table_6`.`column_2` AS `alias_4` FROM `table_2` LEFT JOIN `table_6` ON (`table_2`.`column_1` = `table_6`.`column_1`)) AS alias_5 ON (`table_2`.`column_1` = `alias_5`.`alias_3`)
----


query  rowsort
SELECT `table_6`.`column_1` AS `alias_4` FROM `table_6` INNER JOIN (SELECT `table_6`.`column_3` AS `alias_1`, `table_7`.`column_2` AS `alias_2` FROM `table_6` LEFT JOIN `table_7` ON (`table_6`.`column_1` = `table_7`.`column_1`)) AS alias_3 ON (`table_6`.`column_1` = `alias_3`.`alias_1`) WHERE (`table_6`.`column_1` > ?)
? = 10
----


query  rowsort
SELECT `table_6`.`column_1` AS `alias_3` FROM `table_6` INNER JOIN (SELECT `table_6`.`column_1` AS `alias_1` FROM `table_6`) AS alias_2 ON (`table_6`.`column_1` = `alias_2`.`alias_1`) WHERE (`table_6`.`column_1` > ?)
? = 10
----
1191548948
1609487715
1752876766
91814117

query  rowsort
SELECT `table_6`.`column_1` AS `alias_4` FROM `table_6` INNER JOIN (SELECT `table_6`.`column_4` AS `alias_1`, `table_8`.`column_2` AS `alias_2` FROM `table_6` LEFT JOIN `table_8` ON (`table_6`.`column_1` = `table_8`.`column_1`)) AS alias_3 ON (`table_6`.`column_1` = `alias_3`.`alias_1`) WHERE (`table_6`.`column_1` > ?)
? = 10
----


query  rowsort
SELECT `table_6`.`column_5` AS `alias_1`, `table_9`.`column_2` AS `alias_2` FROM `table_6` LEFT JOIN `table_9` ON (`table_6`.`column_1` = `table_9`.`column_1`) INNER JOIN (SELECT `table_9`.`column_3` AS `alias_3`, `table_10`.`column_2` AS `alias_4` FROM `table_9` LEFT JOIN `table_10` ON (`table_9`.`column_2` = `table_10`.`column_1`)) AS alias_5 ON (`table_6`.`column_1` = `alias_5`.`alias_3`) WHERE (`table_6`.`column_1` > ?)
? = 10
----


query  rowsort
SELECT `table_6`.`column_6` AS `alias_1`, `table_11`.`column_2` AS `alias_2` FROM `table_6` LEFT JOIN `table_11` ON (`table_6`.`column_1` = `table_11`.`column_1`) INNER JOIN (SELECT `table_11`.`column_2` AS `alias_3` FROM `table_11`) AS alias_4 ON (`table_6`.`column_1` = `alias_4`.`alias_3`) WHERE (`table_6`.`column_1` > ?)
? = 10
----


query  rowsort
SELECT `table_6`.`column_7` AS `alias_1`, `table_12`.`column_2` AS `alias_2` FROM `table_6` LEFT JOIN `table_12` ON (`table_6`.`column_1` = `table_12`.`column_1`) INNER JOIN (SELECT `table_6`.`column_8` AS `alias_3`, `table_13`.`column_2` AS `alias_4` FROM `table_6` LEFT JOIN `table_13` ON (`table_6`.`column_1` = `table_13`.`column_1`)) AS alias_5 ON (`table_6`.`column_3` = `alias_5`.`alias_3`) WHERE (`table_6`.`column_1` > ?)
? = 10
----

