# Generated by:
#     target/debug/noria-logictest permute --compare-to mysql://root:noria@127.1/noria -d 3 -o logictests/generated/mysql/ --only range_param --random --include-deletes --rows-per-table 10 --subquery-depth 1

statement ok
CREATE TABLE `table_1` (`column_8` INT, `column_1` INT, `column_5` INT, `column_7` INT, `column_4` INT, `column_10` INT, `column_9` INT, `column_6` INT, `column_3` INT, `column_11` INT, `column_2` INT, `column_12` INT, `column_13` INT, PRIMARY KEY (`column_13`))


statement ok
INSERT INTO `table_1` (`column_8`, `column_1`, `column_5`, `column_7`, `column_4`, `column_10`, `column_9`, `column_6`, `column_3`, `column_11`, `column_2`, `column_12`, `column_13`) VALUES (-1457156907, 818833883, 1799471018, -2028918782, 1609003517, 136386722, -1778245182, 626948216, 1642302791, 1753620031, -480810385, -975648269, 0), (1948470420, 1217498164, 496671877, 884489038, 1803992382, -56023906, 1476030453, 792978175, 19488928, -1559142746, -862425445, 667470607, 1), (319031034, -544683829, 1078109950, 1258711143, 1123297851, -366251445, 2127928205, 1742142359, 1240728060, -1194075715, 2098828956, -810115117, 2), (142146680, -692194645, -897823838, -862359587, 862167945, 1355601216, -1056676547, 675896809, 872613763, -1123731765, -1539426417, -2100224734, 3), (1762089463, -946173953, -32141863, 1308849354, 424598990, 783704948, -2125279078, 1605621442, -1574377541, -564355422, -906174664, 133009343, 4), (-141938509, 897946407, 618470431, -624345285, -1796416612, -472809844, -722302373, 1440675222, 1757909395, 1063993590, 2138211766, 1003898989, 5), (608888870, -1146664941, -201622845, 528282316, 1413930691, 761659589, 142568333, 1480243561, -1147099691, 33873768, 1311251597, 124596192, 6), (-1058356661, 2010710153, 1062822488, -2128536983, 1686137689, -1344477865, 1661168277, 1536983156, 1494334248, 2122926663, 1733126474, 778102521, 7), (936722588, 1907632678, 660479042, 740508687, -1605990007, -1211043831, 583848170, 1767574691, -2089495352, -911996150, -1482988431, 394976166, 8), (-1444226506, -929093722, 2046346664, -1470261852, -1881335839, -1673629223, 1373983175, 23636555, 301567239, 278805602, -881410481, 2109453408, 9)


query  rowsort
SELECT sum(`table_1`.`column_1`) AS `alias_1` FROM `table_1` INNER JOIN (SELECT sum(`table_1`.`column_2`) AS `alias_2` FROM `table_1`) AS alias_3 ON (`table_1`.`column_1` = `alias_3`.`alias_2`)
----
NULL

query  rowsort
SELECT sum(`table_1`.`column_3`) AS `alias_1` FROM `table_1` INNER JOIN (SELECT `table_1`.`column_1` AS `alias_2` FROM `table_1`) AS alias_3 ON (`table_1`.`column_1` = `alias_3`.`alias_2`)
----
2517971840

query  rowsort
SELECT sum(`table_1`.`column_4`) AS `alias_1` FROM `table_1` INNER JOIN (SELECT sum(`table_1`.`column_5`) AS `alias_2` FROM `table_1`) AS alias_3 ON (`table_1`.`column_3` = `alias_3`.`alias_2`)
----
NULL

query  rowsort
SELECT `table_1`.`column_6` AS `alias_3` FROM `table_1` INNER JOIN (SELECT sum(`table_1`.`column_6`) AS `alias_1` FROM `table_1`) AS alias_2 ON (`table_1`.`column_6` = `alias_2`.`alias_1`) WHERE (`table_1`.`column_3` > ?)
? = 10
----


query  rowsort
SELECT `table_1`.`column_6` AS `alias_3` FROM `table_1` INNER JOIN (SELECT `table_1`.`column_6` AS `alias_1` FROM `table_1`) AS alias_2 ON (`table_1`.`column_6` = `alias_2`.`alias_1`) WHERE (`table_1`.`column_6` > ?)
? = 10
----
1440675222
1480243561
1536983156
1605621442
1742142359
1767574691
23636555
626948216
675896809
792978175

query  rowsort
SELECT `table_1`.`column_7` AS `alias_3` FROM `table_1` INNER JOIN (SELECT sum(`table_1`.`column_7`) AS `alias_1` FROM `table_1`) AS alias_2 ON (`table_1`.`column_7` = `alias_2`.`alias_1`) WHERE (`table_1`.`column_6` > ?)
? = 10
----


query  rowsort
SELECT sum(`table_1`.`column_8`) AS `alias_1` FROM `table_1` INNER JOIN (SELECT sum(`table_1`.`column_9`) AS `alias_2` FROM `table_1`) AS alias_3 ON (`table_1`.`column_8` = `alias_3`.`alias_2`) WHERE (`table_1`.`column_8` > ?)
? = 10
----
NULL

query  rowsort
SELECT sum(`table_1`.`column_10`) AS `alias_1` FROM `table_1` INNER JOIN (SELECT `table_1`.`column_8` AS `alias_2` FROM `table_1`) AS alias_3 ON (`table_1`.`column_8` = `alias_3`.`alias_2`) WHERE (`table_1`.`column_8` > ?)
? = 10
----
1267646571

query  rowsort
SELECT sum(`table_1`.`column_11`) AS `alias_1` FROM `table_1` INNER JOIN (SELECT sum(`table_1`.`column_12`) AS `alias_2` FROM `table_1`) AS alias_3 ON (`table_1`.`column_8` = `alias_3`.`alias_2`) WHERE (`table_1`.`column_8` > ?)
? = 10
----
NULL

statement ok
DELETE FROM `table_1` WHERE (`column_13` = 0)


statement ok
DELETE FROM `table_1` WHERE (`column_13` = 1)


statement ok
DELETE FROM `table_1` WHERE (`column_13` = 2)


statement ok
DELETE FROM `table_1` WHERE (`column_13` = 3)


statement ok
DELETE FROM `table_1` WHERE (`column_13` = 4)


query  rowsort
SELECT sum(`table_1`.`column_1`) AS `alias_1` FROM `table_1` INNER JOIN (SELECT sum(`table_1`.`column_2`) AS `alias_2` FROM `table_1`) AS alias_3 ON (`table_1`.`column_1` = `alias_3`.`alias_2`)
----
NULL

query  rowsort
SELECT sum(`table_1`.`column_3`) AS `alias_1` FROM `table_1` INNER JOIN (SELECT `table_1`.`column_1` AS `alias_2` FROM `table_1`) AS alias_3 ON (`table_1`.`column_1` = `alias_3`.`alias_2`)
----
317215839

query  rowsort
SELECT sum(`table_1`.`column_4`) AS `alias_1` FROM `table_1` INNER JOIN (SELECT sum(`table_1`.`column_5`) AS `alias_2` FROM `table_1`) AS alias_3 ON (`table_1`.`column_3` = `alias_3`.`alias_2`)
----
NULL

query  rowsort
SELECT `table_1`.`column_6` AS `alias_3` FROM `table_1` INNER JOIN (SELECT sum(`table_1`.`column_6`) AS `alias_1` FROM `table_1`) AS alias_2 ON (`table_1`.`column_6` = `alias_2`.`alias_1`) WHERE (`table_1`.`column_3` > ?)
? = 10
----


query  rowsort
SELECT `table_1`.`column_6` AS `alias_3` FROM `table_1` INNER JOIN (SELECT `table_1`.`column_6` AS `alias_1` FROM `table_1`) AS alias_2 ON (`table_1`.`column_6` = `alias_2`.`alias_1`) WHERE (`table_1`.`column_6` > ?)
? = 10
----
1440675222
1480243561
1536983156
1767574691
23636555

query  rowsort
SELECT `table_1`.`column_7` AS `alias_3` FROM `table_1` INNER JOIN (SELECT sum(`table_1`.`column_7`) AS `alias_1` FROM `table_1`) AS alias_2 ON (`table_1`.`column_7` = `alias_2`.`alias_1`) WHERE (`table_1`.`column_6` > ?)
? = 10
----


query  rowsort
SELECT sum(`table_1`.`column_8`) AS `alias_1` FROM `table_1` INNER JOIN (SELECT sum(`table_1`.`column_9`) AS `alias_2` FROM `table_1`) AS alias_3 ON (`table_1`.`column_8` = `alias_3`.`alias_2`) WHERE (`table_1`.`column_8` > ?)
? = 10
----
NULL

query  rowsort
SELECT sum(`table_1`.`column_10`) AS `alias_1` FROM `table_1` INNER JOIN (SELECT `table_1`.`column_8` AS `alias_2` FROM `table_1`) AS alias_3 ON (`table_1`.`column_8` = `alias_3`.`alias_2`) WHERE (`table_1`.`column_8` > ?)
? = 10
----
-449384242

query  rowsort
SELECT sum(`table_1`.`column_11`) AS `alias_1` FROM `table_1` INNER JOIN (SELECT sum(`table_1`.`column_12`) AS `alias_2` FROM `table_1`) AS alias_3 ON (`table_1`.`column_8` = `alias_3`.`alias_2`) WHERE (`table_1`.`column_8` > ?)
? = 10
----
NULL
