# Generated by:
#     target/debug/noria-logictest permute --compare-to mysql://root:noria@127.1/noria -d 3 -o logictests/generated/mysql/ --only range_param --random --include-deletes --rows-per-table 10 --subquery-depth 1

statement ok
CREATE TABLE `table_2` (`column_1` INT, `column_4` INT, `column_5` INT, `column_7` INT, `column_6` INT, `column_8` INT, `column_3` INT, `column_9` INT, `column_10` INT, `column_2` INT, PRIMARY KEY (`column_10`))


statement ok
CREATE TABLE `table_4` (`column_1` INT, `column_2` INT, `column_3` INT, PRIMARY KEY (`column_3`))


statement ok
CREATE TABLE `table_5` (`column_1` INT, `column_3` INT, `column_2` INT, PRIMARY KEY (`column_3`))


statement ok
CREATE TABLE `table_1` (`column_2` INT, `column_3` INT, `column_1` INT, PRIMARY KEY (`column_3`))


statement ok
CREATE TABLE `table_3` (`column_1` INT, `column_2` INT, `column_3` INT, PRIMARY KEY (`column_3`))


statement ok
INSERT INTO `table_2` (`column_1`, `column_4`, `column_5`, `column_7`, `column_6`, `column_8`, `column_3`, `column_9`, `column_10`, `column_2`) VALUES (-87268765, -1459310458, -1693505027, 438302072, 1020148322, 1249771963, 1055553439, 1783572332, 0, 193995194), (-15249640, 1421316646, 1212204059, -2110539185, 769223799, -1944505161, -1618805625, -975991584, 1, -1369873889), (1021633972, 243410319, 1341768372, 1927037845, -1818816, 2017094440, -1387715114, 2043193412, 2, -391809173), (-347450369, -1352447112, -370642096, 2034665798, 593382734, 1447366924, 2110513621, -2083697556, 3, 1948231110), (-1231708916, -1072829721, -723573371, -1119904066, -1158181947, 1891456943, 1860538403, 1218310391, 4, -1775282948), (-1853681069, -892834537, 1175624307, -431146369, -246829143, 600399386, -331029011, 954262721, 5, -1594992438), (-705752065, 1271358739, 1850145129, 1847340307, 1875652060, -1100943094, 1205507857, 2125212639, 6, -1210721609), (1686640531, 525277811, -1039256410, -446480059, 774905686, -324964125, 626056553, 39645645, 7, -1393776459), (-1528208880, -1551714449, -41053869, -1290957026, -1669413277, 412617755, -95601804, -610569856, 8, -2091287734), (-255140651, 1531285609, 1110055075, 1946783421, -88436304, -1104984236, -317421814, 1839345806, 9, -24642574)


statement ok
INSERT INTO `table_4` (`column_1`, `column_2`, `column_3`) VALUES (-38603306, -2070937183, 0), (-1994801163, 1604134320, 1), (-1814822277, 1425773464, 2), (-1978473302, -1456086910, 3), (334564585, 1144994541, 4), (-20620922, -1249241392, 5), (-1107192778, 335734656, 6), (1833258380, -1414117219, 7), (-310056855, 1025966254, 8), (-1943428146, -718348435, 9)


statement ok
INSERT INTO `table_5` (`column_1`, `column_3`, `column_2`) VALUES (1709336387, 0, 393259028), (-2131596916, 1, -1666388219), (46009113, 2, -17069730), (946170015, 3, 1463007769), (-73166545, 4, -833726946), (-1302574752, 5, -899769754), (-808233546, 6, 1143891998), (4997346, 7, 1719944331), (799960680, 8, 197817535), (52920504, 9, 1174757583)


statement ok
INSERT INTO `table_1` (`column_2`, `column_3`, `column_1`) VALUES (1101415797, 0, -1696521141), (1925696522, 1, 881555173), (-434647800, 2, -51502435), (199511049, 3, -1962776248), (-859131637, 4, 362345695), (1893405260, 5, 1228205705), (-1970107866, 6, 135958204), (-2110790778, 7, 1018167466), (-1286241049, 8, -993030330), (-1296911838, 9, 730235225)


statement ok
INSERT INTO `table_3` (`column_1`, `column_2`, `column_3`) VALUES (-1317176989, 259231992, 0), (-1388022141, -1647954357, 1), (338610067, 458260133, 2), (-459124459, 1958588278, 3), (944332104, 1881685585, 4), (-1723311932, 239759987, 5), (1028277118, -1915374805, 6), (1256674304, 593538416, 7), (173950087, 1167116953, 8), (-164689331, -1712424516, 9)


query  rowsort
SELECT `table_1`.`column_2` AS `alias_1`, `table_2`.`column_2` AS `alias_2` FROM `table_1` LEFT JOIN `table_2` ON (`table_1`.`column_1` = `table_2`.`column_1`)
----
-1286241049
NULL
-1296911838
NULL
-1970107866
NULL
-2110790778
NULL
-434647800
NULL
-859131637
NULL
1101415797
NULL
1893405260
NULL
1925696522
NULL
199511049
NULL

query  rowsort
SELECT sum(distinct `table_2`.`column_3`) AS `alias_1` FROM `table_2`
----
3107596505

query  rowsort
SELECT `table_2`.`column_3` AS `alias_1` FROM `table_2` WHERE (`table_2`.`column_3` > ?)
? = 10
----
1055553439
1205507857
1860538403
2110513621
626056553

query  rowsort
SELECT `table_2`.`column_4` AS `alias_1`, `table_3`.`column_2` AS `alias_2`, sum(distinct `table_2`.`column_5`) AS `alias_3` FROM `table_2` LEFT JOIN `table_3` ON (`table_2`.`column_3` = `table_3`.`column_1`) GROUP BY `table_2`.`column_4`, `table_3`.`column_2`
----
30 values hashing to 14caf0bcefd03fa7733c1c50c1df5d5f

query  rowsort
SELECT `table_2`.`column_6` AS `alias_1`, `table_4`.`column_2` AS `alias_2` FROM `table_2` LEFT JOIN `table_4` ON (`table_2`.`column_3` = `table_4`.`column_1`) WHERE (`table_2`.`column_6` > ?)
? = 10
----
1020148322
NULL
1875652060
NULL
593382734
NULL
769223799
NULL
774905686
NULL

query  rowsort
SELECT sum(distinct `table_2`.`column_7`) AS `alias_1` FROM `table_2` WHERE (`table_2`.`column_6` > ?)
? = 10
----
1763288933

query  rowsort
SELECT `table_2`.`column_8` AS `alias_1`, `table_5`.`column_2` AS `alias_2`, sum(distinct `table_2`.`column_9`) AS `alias_3` FROM `table_2` LEFT JOIN `table_5` ON (`table_2`.`column_6` = `table_5`.`column_1`) WHERE (`table_2`.`column_1` > ?) GROUP BY `table_2`.`column_8`, `table_5`.`column_2`
? = 10
----
-324964125
NULL
39645645
2017094440
NULL
2043193412

statement ok
DELETE FROM `table_2` WHERE (`column_10` = 0)


statement ok
DELETE FROM `table_2` WHERE (`column_10` = 1)


statement ok
DELETE FROM `table_2` WHERE (`column_10` = 2)


statement ok
DELETE FROM `table_2` WHERE (`column_10` = 3)


statement ok
DELETE FROM `table_2` WHERE (`column_10` = 4)


statement ok
DELETE FROM `table_4` WHERE (`column_3` = 0)


statement ok
DELETE FROM `table_4` WHERE (`column_3` = 1)


statement ok
DELETE FROM `table_4` WHERE (`column_3` = 2)


statement ok
DELETE FROM `table_4` WHERE (`column_3` = 3)


statement ok
DELETE FROM `table_4` WHERE (`column_3` = 4)


statement ok
DELETE FROM `table_5` WHERE (`column_3` = 0)


statement ok
DELETE FROM `table_5` WHERE (`column_3` = 1)


statement ok
DELETE FROM `table_5` WHERE (`column_3` = 2)


statement ok
DELETE FROM `table_5` WHERE (`column_3` = 3)


statement ok
DELETE FROM `table_5` WHERE (`column_3` = 4)


statement ok
DELETE FROM `table_1` WHERE (`column_3` = 0)


statement ok
DELETE FROM `table_1` WHERE (`column_3` = 1)


statement ok
DELETE FROM `table_1` WHERE (`column_3` = 2)


statement ok
DELETE FROM `table_1` WHERE (`column_3` = 3)


statement ok
DELETE FROM `table_1` WHERE (`column_3` = 4)


statement ok
DELETE FROM `table_3` WHERE (`column_3` = 0)


statement ok
DELETE FROM `table_3` WHERE (`column_3` = 1)


statement ok
DELETE FROM `table_3` WHERE (`column_3` = 2)


statement ok
DELETE FROM `table_3` WHERE (`column_3` = 3)


statement ok
DELETE FROM `table_3` WHERE (`column_3` = 4)


query  rowsort
SELECT `table_1`.`column_2` AS `alias_1`, `table_2`.`column_2` AS `alias_2` FROM `table_1` LEFT JOIN `table_2` ON (`table_1`.`column_1` = `table_2`.`column_1`)
----
-1286241049
NULL
-1296911838
NULL
-1970107866
NULL
-2110790778
NULL
1893405260
NULL

query  rowsort
SELECT sum(distinct `table_2`.`column_3`) AS `alias_1` FROM `table_2`
----
1087511781

query  rowsort
SELECT `table_2`.`column_3` AS `alias_1` FROM `table_2` WHERE (`table_2`.`column_3` > ?)
? = 10
----
1205507857
626056553

query  rowsort
SELECT `table_2`.`column_4` AS `alias_1`, `table_3`.`column_2` AS `alias_2`, sum(distinct `table_2`.`column_5`) AS `alias_3` FROM `table_2` LEFT JOIN `table_3` ON (`table_2`.`column_3` = `table_3`.`column_1`) GROUP BY `table_2`.`column_4`, `table_3`.`column_2`
----
-1551714449
NULL
-41053869
-892834537
NULL
1175624307
1271358739
NULL
1850145129
1531285609
NULL
1110055075
525277811
NULL
-1039256410

query  rowsort
SELECT `table_2`.`column_6` AS `alias_1`, `table_4`.`column_2` AS `alias_2` FROM `table_2` LEFT JOIN `table_4` ON (`table_2`.`column_3` = `table_4`.`column_1`) WHERE (`table_2`.`column_6` > ?)
? = 10
----
1875652060
NULL
774905686
NULL

query  rowsort
SELECT sum(distinct `table_2`.`column_7`) AS `alias_1` FROM `table_2` WHERE (`table_2`.`column_6` > ?)
? = 10
----
1400860248

query  rowsort
SELECT `table_2`.`column_8` AS `alias_1`, `table_5`.`column_2` AS `alias_2`, sum(distinct `table_2`.`column_9`) AS `alias_3` FROM `table_2` LEFT JOIN `table_5` ON (`table_2`.`column_6` = `table_5`.`column_1`) WHERE (`table_2`.`column_1` > ?) GROUP BY `table_2`.`column_8`, `table_5`.`column_2`
? = 10
----
-324964125
NULL
39645645
