# Generated by:
#     target/debug/noria-logictest permute --compare-to mysql://root:noria@127.1/noria -d 3 -o logictests/generated/mysql/ --only range_param --random --include-deletes --rows-per-table 10 --subquery-depth 1

statement ok
CREATE TABLE `table_1` (`column_3` INT, `column_4` INT, `column_5` INT, `column_1` INT, `column_2` INT, `column_6` INT, PRIMARY KEY (`column_6`))


statement ok
CREATE TABLE `table_3` (`column_1` INT, `column_3` INT, `column_2` INT, PRIMARY KEY (`column_3`))


statement ok
CREATE TABLE `table_5` (`column_3` INT, `column_2` INT, `column_1` INT, PRIMARY KEY (`column_3`))


statement ok
CREATE TABLE `table_2` (`column_7` INT, `column_2` INT, `column_3` INT, `column_4` INT, `column_1` INT, `column_6` INT, `column_5` INT, PRIMARY KEY (`column_7`))


statement ok
CREATE TABLE `table_4` (`column_3` INT, `column_1` INT, `column_2` INT, PRIMARY KEY (`column_3`))


statement ok
INSERT INTO `table_1` (`column_3`, `column_4`, `column_5`, `column_1`, `column_2`, `column_6`) VALUES (-1382546385, -1310103828, -1058559270, -1006842095, -1250367359, 0), (104954153, 2032439998, -1452074040, -1766662595, 944608820, 1), (-818958873, -1165850196, 472466395, -483994502, 102341119, 2), (1976844546, -1584724896, 1593404368, -1602872783, -1071954059, 3), (-1544490312, 75044042, 330127562, 1466717559, -1508466981, 4), (-1779092544, -1411002366, 1457798816, -705750433, 49719788, 5), (282356529, -58774648, -157902544, -500039231, 196014150, 6), (242914189, 1276642530, 1245806039, 704492259, 1776839264, 7), (1829374745, -889970178, 1401822379, -1637815814, 1513020986, 8), (1905967636, -1144942074, -1081278709, 1675819638, 1792188809, 9)


statement ok
INSERT INTO `table_3` (`column_1`, `column_3`, `column_2`) VALUES (1795901397, 0, -1443502804), (1626277791, 1, -850250309), (-1124870006, 2, 66534101), (-663323841, 3, -818540837), (1264759850, 4, 1603814205), (987091147, 5, -678871867), (511005863, 6, 1213313234), (1405757903, 7, 396406634), (-1558964512, 8, -930084867), (-342998748, 9, 1941027765)


statement ok
INSERT INTO `table_5` (`column_3`, `column_2`, `column_1`) VALUES (0, 1417152095, 1623642931), (1, -901921307, 780072942), (2, -10609672, 759587987), (3, -1786278882, -1183551165), (4, 1650371252, 54686775), (5, -1326685580, -1027120155), (6, 1079770640, -1670384408), (7, -526218062, 1724325818), (8, 449728795, -1762152961), (9, 579809422, 980350471)


statement ok
INSERT INTO `table_2` (`column_7`, `column_2`, `column_3`, `column_4`, `column_1`, `column_6`, `column_5`) VALUES (0, -780430990, 442342038, -1504527294, -1943106023, 908756151, 1780980303), (1, -135664279, 1265779063, -676794038, 2002915069, 601276827, -1833404324), (2, -1500939466, 1270586731, -1499723447, 1057317524, -80089724, 414347476), (3, 750373918, -321867833, 1513630320, -6009172, -574014689, 322228876), (4, 117167286, 777044347, 1170907989, -1882401982, -2009456005, 272939429), (5, 1312678545, -590059801, 1794449178, -639966235, 874618182, -1129974981), (6, -286555373, -405216550, 116116244, 143393744, 1520489694, -1167259165), (7, -513487513, -794395178, -1249471907, -138569914, -305805434, -708278979), (8, -1776136381, 1367939169, 531723334, -430197574, -1065516762, -1000302827), (9, 386993283, 921506791, -183523556, 1292566171, -192228599, -526484374)


statement ok
INSERT INTO `table_4` (`column_3`, `column_1`, `column_2`) VALUES (0, 1807719272, -484959075), (1, -476771995, 1536020777), (2, 169381364, 343025002), (3, 1911005577, 132951939), (4, -417594904, -768392305), (5, 1079253216, -897097192), (6, -620133815, 1315613553), (7, -89958400, -1945707026), (8, -1398646660, -848704437), (9, -1105148179, -558821148)


query  rowsort
SELECT `table_1`.`column_2` AS `alias_1`, `table_2`.`column_2` AS `alias_2` FROM `table_1` LEFT JOIN `table_2` ON (`table_1`.`column_1` = `table_2`.`column_1`)
----
-1071954059
NULL
-1250367359
NULL
-1508466981
NULL
102341119
NULL
1513020986
NULL
1776839264
NULL
1792188809
NULL
196014150
NULL
49719788
NULL
944608820
NULL

query  rowsort
SELECT count(`table_2`.`column_3`) AS `alias_1` FROM `table_2`
----
10

query  rowsort
SELECT `table_2`.`column_1` AS `alias_1` FROM `table_2` WHERE (`table_2`.`column_1` > ?)
? = 10
----
1057317524
1292566171
143393744
2002915069

query  rowsort
SELECT `table_2`.`column_4` AS `alias_1`, `table_3`.`column_2` AS `alias_2`, count(`table_2`.`column_5`) AS `alias_3` FROM `table_2` LEFT JOIN `table_3` ON (`table_2`.`column_1` = `table_3`.`column_1`) GROUP BY `table_2`.`column_4`, `table_3`.`column_2`
----
30 values hashing to 43b2ff0ba33a9cd6cc6c71492b806501

query  rowsort
SELECT `table_2`.`column_6` AS `alias_1`, `table_4`.`column_2` AS `alias_2` FROM `table_2` LEFT JOIN `table_4` ON (`table_2`.`column_2` = `table_4`.`column_1`) WHERE (`table_2`.`column_2` > ?)
? = 10
----
-192228599
NULL
-2009456005
NULL
-574014689
NULL
874618182
NULL

query  rowsort
SELECT count(`table_1`.`column_3`) AS `alias_1` FROM `table_1` WHERE (`table_1`.`column_1` > ?)
? = 10
----
3

query  rowsort
SELECT `table_1`.`column_4` AS `alias_1`, `table_5`.`column_2` AS `alias_2`, count(`table_1`.`column_5`) AS `alias_3` FROM `table_1` LEFT JOIN `table_5` ON (`table_1`.`column_1` = `table_5`.`column_1`) WHERE (`table_1`.`column_3` > ?) GROUP BY `table_1`.`column_4`, `table_5`.`column_2`
? = 10
----
-1144942074
NULL
1
-1584724896
NULL
1
-58774648
NULL
1
-889970178
NULL
1
1276642530
NULL
1
2032439998
NULL
1

statement ok
DELETE FROM `table_1` WHERE (`column_6` = 0)


statement ok
DELETE FROM `table_1` WHERE (`column_6` = 1)


statement ok
DELETE FROM `table_1` WHERE (`column_6` = 2)


statement ok
DELETE FROM `table_1` WHERE (`column_6` = 3)


statement ok
DELETE FROM `table_1` WHERE (`column_6` = 4)


statement ok
DELETE FROM `table_3` WHERE (`column_3` = 0)


statement ok
DELETE FROM `table_3` WHERE (`column_3` = 1)


statement ok
DELETE FROM `table_3` WHERE (`column_3` = 2)


statement ok
DELETE FROM `table_3` WHERE (`column_3` = 3)


statement ok
DELETE FROM `table_3` WHERE (`column_3` = 4)


statement ok
DELETE FROM `table_5` WHERE (`column_3` = 0)


statement ok
DELETE FROM `table_5` WHERE (`column_3` = 1)


statement ok
DELETE FROM `table_5` WHERE (`column_3` = 2)


statement ok
DELETE FROM `table_5` WHERE (`column_3` = 3)


statement ok
DELETE FROM `table_5` WHERE (`column_3` = 4)


statement ok
DELETE FROM `table_2` WHERE (`column_7` = 0)


statement ok
DELETE FROM `table_2` WHERE (`column_7` = 1)


statement ok
DELETE FROM `table_2` WHERE (`column_7` = 2)


statement ok
DELETE FROM `table_2` WHERE (`column_7` = 3)


statement ok
DELETE FROM `table_2` WHERE (`column_7` = 4)


statement ok
DELETE FROM `table_4` WHERE (`column_3` = 0)


statement ok
DELETE FROM `table_4` WHERE (`column_3` = 1)


statement ok
DELETE FROM `table_4` WHERE (`column_3` = 2)


statement ok
DELETE FROM `table_4` WHERE (`column_3` = 3)


statement ok
DELETE FROM `table_4` WHERE (`column_3` = 4)


query  rowsort
SELECT `table_1`.`column_2` AS `alias_1`, `table_2`.`column_2` AS `alias_2` FROM `table_1` LEFT JOIN `table_2` ON (`table_1`.`column_1` = `table_2`.`column_1`)
----
1513020986
NULL
1776839264
NULL
1792188809
NULL
196014150
NULL
49719788
NULL

query  rowsort
SELECT count(`table_2`.`column_3`) AS `alias_1` FROM `table_2`
----
5

query  rowsort
SELECT `table_2`.`column_1` AS `alias_1` FROM `table_2` WHERE (`table_2`.`column_1` > ?)
? = 10
----
1292566171
143393744

query  rowsort
SELECT `table_2`.`column_4` AS `alias_1`, `table_3`.`column_2` AS `alias_2`, count(`table_2`.`column_5`) AS `alias_3` FROM `table_2` LEFT JOIN `table_3` ON (`table_2`.`column_1` = `table_3`.`column_1`) GROUP BY `table_2`.`column_4`, `table_3`.`column_2`
----
-1249471907
NULL
1
-183523556
NULL
1
116116244
NULL
1
1794449178
NULL
1
531723334
NULL
1

query  rowsort
SELECT `table_2`.`column_6` AS `alias_1`, `table_4`.`column_2` AS `alias_2` FROM `table_2` LEFT JOIN `table_4` ON (`table_2`.`column_2` = `table_4`.`column_1`) WHERE (`table_2`.`column_2` > ?)
? = 10
----
-192228599
NULL
874618182
NULL

query  rowsort
SELECT count(`table_1`.`column_3`) AS `alias_1` FROM `table_1` WHERE (`table_1`.`column_1` > ?)
? = 10
----
2

query  rowsort
SELECT `table_1`.`column_4` AS `alias_1`, `table_5`.`column_2` AS `alias_2`, count(`table_1`.`column_5`) AS `alias_3` FROM `table_1` LEFT JOIN `table_5` ON (`table_1`.`column_1` = `table_5`.`column_1`) WHERE (`table_1`.`column_3` > ?) GROUP BY `table_1`.`column_4`, `table_5`.`column_2`
? = 10
----
-1144942074
NULL
1
-58774648
NULL
1
-889970178
NULL
1
1276642530
NULL
1
