# Generated by:
#     target/debug/noria-logictest permute --compare-to mysql://root:noria@127.1/noria -d 3 -o logictests/generated/mysql/ --only range_param --random --include-deletes --rows-per-table 10 --subquery-depth 1

statement ok
CREATE TABLE `table_5` (`column_4` INT, `column_8` INT, `column_9` INT, `column_6` INT, `column_2` INT, `column_7` INT, `column_5` INT, `column_3` INT, `column_1` INT, PRIMARY KEY (`column_9`))


statement ok
CREATE TABLE `table_4` (`column_5` INT, `column_1` INT, `column_4` INT, `column_3` INT, `column_2` INT, PRIMARY KEY (`column_5`))


statement ok
CREATE TABLE `table_6` (`column_1` INT, `column_2` INT, `column_3` INT, PRIMARY KEY (`column_3`))


statement ok
CREATE TABLE `table_10` (`column_1` INT, `column_2` INT, `column_3` INT, PRIMARY KEY (`column_3`))


statement ok
CREATE TABLE `table_3` (`column_1` INT, `column_2` INT, `column_3` INT, PRIMARY KEY (`column_3`))


statement ok
CREATE TABLE `table_8` (`column_1` INT, `column_3` INT, `column_2` INT, PRIMARY KEY (`column_3`))


statement ok
CREATE TABLE `table_1` (`column_3` INT, `column_2` INT, `column_1` INT, PRIMARY KEY (`column_3`))


statement ok
CREATE TABLE `table_11` (`column_3` INT, `column_1` INT, `column_2` INT, PRIMARY KEY (`column_3`))


statement ok
CREATE TABLE `table_7` (`column_1` INT, `column_2` INT, `column_3` INT, PRIMARY KEY (`column_3`))


statement ok
CREATE TABLE `table_9` (`column_3` INT, `column_4` INT, `column_1` INT, `column_2` INT, PRIMARY KEY (`column_4`))


statement ok
CREATE TABLE `table_2` (`column_3` INT, `column_5` INT, `column_1` INT, `column_4` INT, `column_2` INT, PRIMARY KEY (`column_5`))


statement ok
CREATE TABLE `table_12` (`column_3` INT, `column_2` INT, `column_1` INT, PRIMARY KEY (`column_3`))


statement ok
CREATE TABLE `table_13` (`column_2` INT, `column_1` INT, `column_3` INT, PRIMARY KEY (`column_3`))


statement ok
INSERT INTO `table_5` (`column_4`, `column_8`, `column_9`, `column_6`, `column_2`, `column_7`, `column_5`, `column_3`, `column_1`) VALUES (1406841640, -1634119578, 0, -1139082861, -687443771, -1216462414, 520499932, 1269888035, -1424934283), (728452354, -2126747826, 1, 398882158, 177845398, 423178558, -843724915, 1274336730, -988782535), (-73776423, 2047053227, 2, 1419113375, -1748904056, -1040469134, -682133129, -690134599, 497510991), (1740829720, 634633655, 3, -1062703947, 221482031, 970556978, 944014229, 1415023989, 335123082), (-1643091679, -759965475, 4, 167731412, 1488291088, -1136176373, 705512975, -810814963, -783304673), (-1963061848, 1019140646, 5, -1821751005, 1349101220, 1891599003, -1625493490, 546007878, 1261790112), (1950840574, -1357210665, 6, 555094243, -1497272958, 1599846834, 1469537362, 74778037, -1730685192), (1628240716, 1275095151, 7, -523866720, 1308808332, 53852928, -1799974893, 494412218, -9641727), (-1949306554, 303953440, 8, 430613075, -1597211005, -1302993322, -1122346518, 1895331620, 519216440), (-1522170877, -292519897, 9, 1127983273, -97779820, -1024838413, -967230270, -2061893482, 245063732)


statement ok
INSERT INTO `table_4` (`column_5`, `column_1`, `column_4`, `column_3`, `column_2`) VALUES (0, -1276319202, 2138463542, 1053146319, -651898932), (1, 893757114, -1107522134, 577600295, 1058562043), (2, 208914823, -1169102076, -456380490, -828628643), (3, 1948940024, 1360591340, 164162203, 378612674), (4, 1549844954, -733601651, 60405871, 1606471699), (5, 754007265, -997853394, 241378880, -755944980), (6, -1158929901, -864816280, 705143310, -773729008), (7, -1506031492, 1335792970, -763817719, 750931800), (8, -652853235, -1221546265, 1939815721, -594266235), (9, 979615278, 2033948471, -9341513, 1636105614)


statement ok
INSERT INTO `table_6` (`column_1`, `column_2`, `column_3`) VALUES (-1961162179, -1489667991, 0), (-1998011365, 978237435, 1), (-1870499984, -1062506282, 2), (861242322, -1318977044, 3), (-1919279889, -1536841060, 4), (1187438657, 2056860499, 5), (1571449907, -382446865, 6), (-229756768, -1865911994, 7), (-832242724, 713741078, 8), (-692973544, -2080922065, 9)


statement ok
INSERT INTO `table_10` (`column_1`, `column_2`, `column_3`) VALUES (1192058582, -252660035, 0), (-80646911, -12377208, 1), (-1828106296, 1678536347, 2), (743733176, -1148244445, 3), (-1938241195, 1707375353, 4), (-1826332400, 660339897, 5), (-1942400548, 611118062, 6), (1751946756, 1831671940, 7), (-1310428529, -258800673, 8), (604804271, -1300381965, 9)


statement ok
INSERT INTO `table_3` (`column_1`, `column_2`, `column_3`) VALUES (160865326, -1245978590, 0), (-2122056522, -693593576, 1), (91016986, -1173961125, 2), (-161740960, 315328493, 3), (-971507166, 2132974921, 4), (-1627471863, -376762012, 5), (-1972883892, 1873357225, 6), (1775852009, 1150642706, 7), (-52966981, 1824843652, 8), (150777142, -1756776340, 9)


statement ok
INSERT INTO `table_8` (`column_1`, `column_3`, `column_2`) VALUES (-1015487895, 0, -795011119), (1489347050, 1, -1359403233), (-1019448959, 2, -1185397723), (873113371, 3, -488590991), (888970987, 4, 3060458), (-559948978, 5, 548060128), (-2143810549, 6, -738514173), (367882267, 7, -711280990), (1216770850, 8, -1710933254), (-71050157, 9, 268429773)


statement ok
INSERT INTO `table_1` (`column_3`, `column_2`, `column_1`) VALUES (0, 910409453, -1228048058), (1, 2068910819, -78225769), (2, 1979164061, -732743096), (3, 1577620981, -1001303741), (4, 1517775604, -538837889), (5, -621064235, -1321133758), (6, -2090068541, -1440951823), (7, 1613486314, 440809385), (8, 1095554558, -775612116), (9, -172801007, 1318985990)


statement ok
INSERT INTO `table_11` (`column_3`, `column_1`, `column_2`) VALUES (0, -95083067, -220511761), (1, -1948511070, -802344345), (2, 852442123, -545077544), (3, 1869579426, -1586437632), (4, -832697008, 2030254093), (5, -907598971, 493523847), (6, -1361850470, 967941262), (7, -1975312417, -2122268274), (8, -1827726234, 1423513142), (9, -658936826, -2113774244)


statement ok
INSERT INTO `table_7` (`column_1`, `column_2`, `column_3`) VALUES (462295602, 1905275935, 0), (660454696, 1815929754, 1), (-210549851, 2136788661, 2), (-1921311736, 1000251231, 3), (886136349, -1580565868, 4), (655281202, -1822847388, 5), (-2070453541, -1286959274, 6), (-1596971184, 154357017, 7), (1027427206, -1762519781, 8), (2131985478, -1871758979, 9)


statement ok
INSERT INTO `table_9` (`column_3`, `column_4`, `column_1`, `column_2`) VALUES (808420504, 0, -1446736725, 1185095862), (-1086111746, 1, 1387013045, -710588024), (1220394108, 2, -898477129, -1524894896), (-1147602920, 3, -1649035938, -607027322), (-829677940, 4, 29449142, -339609804), (228798462, 5, 51558623, 1706470481), (-325987811, 6, 728285746, 1180446515), (-474935146, 7, -1562788364, -941107979), (-1506283815, 8, -935252489, 1713506107), (-213373634, 9, 2099548729, 700031612)


statement ok
INSERT INTO `table_2` (`column_3`, `column_5`, `column_1`, `column_4`, `column_2`) VALUES (46641301, 0, 1455131124, -1807234864, 883956064), (-1939277880, 1, -992768991, -509843911, 1429441910), (1365265590, 2, 1486372451, 1195580595, 1745352979), (110863755, 3, -991369357, 581099759, 791042618), (811606438, 4, -1824359498, -462899887, 1787709136), (-535711243, 5, 662242421, -459744858, -1456757902), (769003306, 6, -538657580, 823838427, -1434202731), (1281518438, 7, 1190494344, 1353896581, -668092231), (-42791999, 8, 403844034, -518542929, -1700902339), (-83612413, 9, -697562547, 1062486463, 1132909472)


statement ok
INSERT INTO `table_12` (`column_3`, `column_2`, `column_1`) VALUES (0, -1683466640, 452873519), (1, 1168771823, 1273107256), (2, -221614921, -59596735), (3, -574781419, -762410097), (4, 2003419598, 1442919919), (5, -609424741, 1223719452), (6, 1202999059, -2123287141), (7, 1538104391, 196014115), (8, -811808806, 566592278), (9, 860249953, -1918129608)


statement ok
INSERT INTO `table_13` (`column_2`, `column_1`, `column_3`) VALUES (1716239651, -1536280865, 0), (-1684894361, 378404017, 1), (-703049327, -1285659370, 2), (1566051939, 399563838, 3), (-415139003, -466929335, 4), (-1011279126, 1993887005, 5), (543425476, 1351218321, 6), (-1911537741, -454028888, 7), (1700928867, -1045621825, 8), (-545055694, -2104246825, 9)


query  rowsort
SELECT `table_1`.`column_2` AS `alias_1`, `table_2`.`column_2` AS `alias_2` FROM `table_1` LEFT JOIN `table_2` ON (`table_1`.`column_1` = `table_2`.`column_1`) INNER JOIN (SELECT `table_2`.`column_3` AS `alias_3`, `table_3`.`column_2` AS `alias_4` FROM `table_2` LEFT JOIN `table_3` ON (`table_2`.`column_1` = `table_3`.`column_1`)) AS alias_5 ON (`table_1`.`column_2` = `alias_5`.`alias_3`)
----


query  rowsort
SELECT `table_2`.`column_4` AS `alias_1`, `table_4`.`column_2` AS `alias_2` FROM `table_2` LEFT JOIN `table_4` ON (`table_2`.`column_3` = `table_4`.`column_1`) INNER JOIN (SELECT `table_2`.`column_3` AS `alias_3` FROM `table_2`) AS alias_4 ON (`table_2`.`column_3` = `alias_4`.`alias_3`)
----
-1807234864
NULL
-459744858
NULL
-462899887
NULL
-509843911
NULL
-518542929
NULL
1062486463
NULL
1195580595
NULL
1353896581
NULL
581099759
NULL
823838427
NULL

query  rowsort
SELECT `table_4`.`column_3` AS `alias_1`, `table_5`.`column_2` AS `alias_2` FROM `table_4` LEFT JOIN `table_5` ON (`table_4`.`column_2` = `table_5`.`column_1`) INNER JOIN (SELECT `table_4`.`column_4` AS `alias_3`, `table_6`.`column_2` AS `alias_4` FROM `table_4` LEFT JOIN `table_6` ON (`table_4`.`column_2` = `table_6`.`column_1`)) AS alias_5 ON (`table_4`.`column_1` = `alias_5`.`alias_3`)
----


query  rowsort
SELECT `table_5`.`column_3` AS `alias_4` FROM `table_5` INNER JOIN (SELECT `table_5`.`column_3` AS `alias_1`, `table_7`.`column_2` AS `alias_2` FROM `table_5` LEFT JOIN `table_7` ON (`table_5`.`column_1` = `table_7`.`column_1`)) AS alias_3 ON (`table_5`.`column_3` = `alias_3`.`alias_1`) WHERE (`table_5`.`column_1` > ?)
? = 10
----
-2061893482
-690134599
1415023989
1895331620
546007878

query  rowsort
SELECT `table_5`.`column_3` AS `alias_3` FROM `table_5` INNER JOIN (SELECT `table_5`.`column_3` AS `alias_1` FROM `table_5`) AS alias_2 ON (`table_5`.`column_3` = `alias_2`.`alias_1`) WHERE (`table_5`.`column_3` > ?)
? = 10
----
1269888035
1274336730
1415023989
1895331620
494412218
546007878
74778037

query  rowsort
SELECT `table_5`.`column_4` AS `alias_4` FROM `table_5` INNER JOIN (SELECT `table_5`.`column_4` AS `alias_1`, `table_8`.`column_2` AS `alias_2` FROM `table_5` LEFT JOIN `table_8` ON (`table_5`.`column_3` = `table_8`.`column_1`)) AS alias_3 ON (`table_5`.`column_4` = `alias_3`.`alias_1`) WHERE (`table_5`.`column_3` > ?)
? = 10
----
-1949306554
-1963061848
1406841640
1628240716
1740829720
1950840574
728452354

query  rowsort
SELECT `table_5`.`column_5` AS `alias_1`, `table_9`.`column_2` AS `alias_2` FROM `table_5` LEFT JOIN `table_9` ON (`table_5`.`column_4` = `table_9`.`column_1`) INNER JOIN (SELECT `table_9`.`column_3` AS `alias_3`, `table_10`.`column_2` AS `alias_4` FROM `table_9` LEFT JOIN `table_10` ON (`table_9`.`column_1` = `table_10`.`column_1`)) AS alias_5 ON (`table_5`.`column_4` = `alias_5`.`alias_3`) WHERE (`table_5`.`column_4` > ?)
? = 10
----


query  rowsort
SELECT `table_5`.`column_6` AS `alias_1`, `table_11`.`column_2` AS `alias_2` FROM `table_5` LEFT JOIN `table_11` ON (`table_5`.`column_4` = `table_11`.`column_1`) INNER JOIN (SELECT `table_11`.`column_1` AS `alias_3` FROM `table_11`) AS alias_4 ON (`table_5`.`column_4` = `alias_4`.`alias_3`) WHERE (`table_5`.`column_4` > ?)
? = 10
----


query  rowsort
SELECT `table_5`.`column_7` AS `alias_1`, `table_12`.`column_2` AS `alias_2` FROM `table_5` LEFT JOIN `table_12` ON (`table_5`.`column_4` = `table_12`.`column_1`) INNER JOIN (SELECT `table_5`.`column_8` AS `alias_3`, `table_13`.`column_2` AS `alias_4` FROM `table_5` LEFT JOIN `table_13` ON (`table_5`.`column_4` = `table_13`.`column_1`)) AS alias_5 ON (`table_5`.`column_4` = `alias_5`.`alias_3`) WHERE (`table_5`.`column_4` > ?)
? = 10
----


statement ok
DELETE FROM `table_5` WHERE (`column_9` = 0)


statement ok
DELETE FROM `table_5` WHERE (`column_9` = 1)


statement ok
DELETE FROM `table_5` WHERE (`column_9` = 2)


statement ok
DELETE FROM `table_5` WHERE (`column_9` = 3)


statement ok
DELETE FROM `table_5` WHERE (`column_9` = 4)


statement ok
DELETE FROM `table_4` WHERE (`column_5` = 0)


statement ok
DELETE FROM `table_4` WHERE (`column_5` = 1)


statement ok
DELETE FROM `table_4` WHERE (`column_5` = 2)


statement ok
DELETE FROM `table_4` WHERE (`column_5` = 3)


statement ok
DELETE FROM `table_4` WHERE (`column_5` = 4)


statement ok
DELETE FROM `table_6` WHERE (`column_3` = 0)


statement ok
DELETE FROM `table_6` WHERE (`column_3` = 1)


statement ok
DELETE FROM `table_6` WHERE (`column_3` = 2)


statement ok
DELETE FROM `table_6` WHERE (`column_3` = 3)


statement ok
DELETE FROM `table_6` WHERE (`column_3` = 4)


statement ok
DELETE FROM `table_10` WHERE (`column_3` = 0)


statement ok
DELETE FROM `table_10` WHERE (`column_3` = 1)


statement ok
DELETE FROM `table_10` WHERE (`column_3` = 2)


statement ok
DELETE FROM `table_10` WHERE (`column_3` = 3)


statement ok
DELETE FROM `table_10` WHERE (`column_3` = 4)


statement ok
DELETE FROM `table_3` WHERE (`column_3` = 0)


statement ok
DELETE FROM `table_3` WHERE (`column_3` = 1)


statement ok
DELETE FROM `table_3` WHERE (`column_3` = 2)


statement ok
DELETE FROM `table_3` WHERE (`column_3` = 3)


statement ok
DELETE FROM `table_3` WHERE (`column_3` = 4)


statement ok
DELETE FROM `table_8` WHERE (`column_3` = 0)


statement ok
DELETE FROM `table_8` WHERE (`column_3` = 1)


statement ok
DELETE FROM `table_8` WHERE (`column_3` = 2)


statement ok
DELETE FROM `table_8` WHERE (`column_3` = 3)


statement ok
DELETE FROM `table_8` WHERE (`column_3` = 4)


statement ok
DELETE FROM `table_1` WHERE (`column_3` = 0)


statement ok
DELETE FROM `table_1` WHERE (`column_3` = 1)


statement ok
DELETE FROM `table_1` WHERE (`column_3` = 2)


statement ok
DELETE FROM `table_1` WHERE (`column_3` = 3)


statement ok
DELETE FROM `table_1` WHERE (`column_3` = 4)


statement ok
DELETE FROM `table_11` WHERE (`column_3` = 0)


statement ok
DELETE FROM `table_11` WHERE (`column_3` = 1)


statement ok
DELETE FROM `table_11` WHERE (`column_3` = 2)


statement ok
DELETE FROM `table_11` WHERE (`column_3` = 3)


statement ok
DELETE FROM `table_11` WHERE (`column_3` = 4)


statement ok
DELETE FROM `table_7` WHERE (`column_3` = 0)


statement ok
DELETE FROM `table_7` WHERE (`column_3` = 1)


statement ok
DELETE FROM `table_7` WHERE (`column_3` = 2)


statement ok
DELETE FROM `table_7` WHERE (`column_3` = 3)


statement ok
DELETE FROM `table_7` WHERE (`column_3` = 4)


statement ok
DELETE FROM `table_9` WHERE (`column_4` = 0)


statement ok
DELETE FROM `table_9` WHERE (`column_4` = 1)


statement ok
DELETE FROM `table_9` WHERE (`column_4` = 2)


statement ok
DELETE FROM `table_9` WHERE (`column_4` = 3)


statement ok
DELETE FROM `table_9` WHERE (`column_4` = 4)


statement ok
DELETE FROM `table_2` WHERE (`column_5` = 0)


statement ok
DELETE FROM `table_2` WHERE (`column_5` = 1)


statement ok
DELETE FROM `table_2` WHERE (`column_5` = 2)


statement ok
DELETE FROM `table_2` WHERE (`column_5` = 3)


statement ok
DELETE FROM `table_2` WHERE (`column_5` = 4)


statement ok
DELETE FROM `table_12` WHERE (`column_3` = 0)


statement ok
DELETE FROM `table_12` WHERE (`column_3` = 1)


statement ok
DELETE FROM `table_12` WHERE (`column_3` = 2)


statement ok
DELETE FROM `table_12` WHERE (`column_3` = 3)


statement ok
DELETE FROM `table_12` WHERE (`column_3` = 4)


statement ok
DELETE FROM `table_13` WHERE (`column_3` = 0)


statement ok
DELETE FROM `table_13` WHERE (`column_3` = 1)


statement ok
DELETE FROM `table_13` WHERE (`column_3` = 2)


statement ok
DELETE FROM `table_13` WHERE (`column_3` = 3)


statement ok
DELETE FROM `table_13` WHERE (`column_3` = 4)


query  rowsort
SELECT `table_1`.`column_2` AS `alias_1`, `table_2`.`column_2` AS `alias_2` FROM `table_1` LEFT JOIN `table_2` ON (`table_1`.`column_1` = `table_2`.`column_1`) INNER JOIN (SELECT `table_2`.`column_3` AS `alias_3`, `table_3`.`column_2` AS `alias_4` FROM `table_2` LEFT JOIN `table_3` ON (`table_2`.`column_1` = `table_3`.`column_1`)) AS alias_5 ON (`table_1`.`column_2` = `alias_5`.`alias_3`)
----


query  rowsort
SELECT `table_2`.`column_4` AS `alias_1`, `table_4`.`column_2` AS `alias_2` FROM `table_2` LEFT JOIN `table_4` ON (`table_2`.`column_3` = `table_4`.`column_1`) INNER JOIN (SELECT `table_2`.`column_3` AS `alias_3` FROM `table_2`) AS alias_4 ON (`table_2`.`column_3` = `alias_4`.`alias_3`)
----
-459744858
NULL
-518542929
NULL
1062486463
NULL
1353896581
NULL
823838427
NULL

query  rowsort
SELECT `table_4`.`column_3` AS `alias_1`, `table_5`.`column_2` AS `alias_2` FROM `table_4` LEFT JOIN `table_5` ON (`table_4`.`column_2` = `table_5`.`column_1`) INNER JOIN (SELECT `table_4`.`column_4` AS `alias_3`, `table_6`.`column_2` AS `alias_4` FROM `table_4` LEFT JOIN `table_6` ON (`table_4`.`column_2` = `table_6`.`column_1`)) AS alias_5 ON (`table_4`.`column_1` = `alias_5`.`alias_3`)
----


query  rowsort
SELECT `table_5`.`column_3` AS `alias_4` FROM `table_5` INNER JOIN (SELECT `table_5`.`column_3` AS `alias_1`, `table_7`.`column_2` AS `alias_2` FROM `table_5` LEFT JOIN `table_7` ON (`table_5`.`column_1` = `table_7`.`column_1`)) AS alias_3 ON (`table_5`.`column_3` = `alias_3`.`alias_1`) WHERE (`table_5`.`column_1` > ?)
? = 10
----
-2061893482
1895331620
546007878

query  rowsort
SELECT `table_5`.`column_3` AS `alias_3` FROM `table_5` INNER JOIN (SELECT `table_5`.`column_3` AS `alias_1` FROM `table_5`) AS alias_2 ON (`table_5`.`column_3` = `alias_2`.`alias_1`) WHERE (`table_5`.`column_3` > ?)
? = 10
----
1895331620
494412218
546007878
74778037

query  rowsort
SELECT `table_5`.`column_4` AS `alias_4` FROM `table_5` INNER JOIN (SELECT `table_5`.`column_4` AS `alias_1`, `table_8`.`column_2` AS `alias_2` FROM `table_5` LEFT JOIN `table_8` ON (`table_5`.`column_3` = `table_8`.`column_1`)) AS alias_3 ON (`table_5`.`column_4` = `alias_3`.`alias_1`) WHERE (`table_5`.`column_3` > ?)
? = 10
----
-1949306554
-1963061848
1628240716
1950840574

query  rowsort
SELECT `table_5`.`column_5` AS `alias_1`, `table_9`.`column_2` AS `alias_2` FROM `table_5` LEFT JOIN `table_9` ON (`table_5`.`column_4` = `table_9`.`column_1`) INNER JOIN (SELECT `table_9`.`column_3` AS `alias_3`, `table_10`.`column_2` AS `alias_4` FROM `table_9` LEFT JOIN `table_10` ON (`table_9`.`column_1` = `table_10`.`column_1`)) AS alias_5 ON (`table_5`.`column_4` = `alias_5`.`alias_3`) WHERE (`table_5`.`column_4` > ?)
? = 10
----


query  rowsort
SELECT `table_5`.`column_6` AS `alias_1`, `table_11`.`column_2` AS `alias_2` FROM `table_5` LEFT JOIN `table_11` ON (`table_5`.`column_4` = `table_11`.`column_1`) INNER JOIN (SELECT `table_11`.`column_1` AS `alias_3` FROM `table_11`) AS alias_4 ON (`table_5`.`column_4` = `alias_4`.`alias_3`) WHERE (`table_5`.`column_4` > ?)
? = 10
----


query  rowsort
SELECT `table_5`.`column_7` AS `alias_1`, `table_12`.`column_2` AS `alias_2` FROM `table_5` LEFT JOIN `table_12` ON (`table_5`.`column_4` = `table_12`.`column_1`) INNER JOIN (SELECT `table_5`.`column_8` AS `alias_3`, `table_13`.`column_2` AS `alias_4` FROM `table_5` LEFT JOIN `table_13` ON (`table_5`.`column_4` = `table_13`.`column_1`)) AS alias_5 ON (`table_5`.`column_4` = `alias_5`.`alias_3`) WHERE (`table_5`.`column_4` > ?)
? = 10
----

