# Generated by:
#     target/debug/noria-logictest generate --operations less_or_equal_filters,distinct --compare-to mysql://root@localhost/mysql --subquery-depth 1 --rows-per-table 5 -o logictests/generated/less_or_equal_filters,distinct.test --include-deletes
# failure: ENG-338

statement ok
CREATE TABLE table_1 (column_6 INT(32), column_1 INT(1), column_31 INT(32), column_7 INT(32), column_2 INT(32), column_10 INT(32), column_12 INT(32), column_20 INT(32), column_24 INT(32), column_5 INT(32), column_26 INT(32), column_33 INT(32), column_22 INT(32), column_28 INT(32), column_14 INT(32), column_17 INT(32), column_15 INT(32), column_3 INT(32), column_19 INT(32), column_27 INT(32), column_29 INT(32), column_34 INT(32), column_9 INT(32), column_8 INT(32), column_11 INT(32), column_16 INT(32), column_23 INT(32), column_25 INT(32), column_13 INT(32), column_4 INT(32), column_21 INT(32), column_32 INT(32), column_18 INT(32), column_30 INT(32), PRIMARY KEY (column_34))


statement ok
INSERT INTO table_1 (column_27, column_2, column_33, column_22, column_15, column_32, column_28, column_29, column_17, column_5, column_8, column_21, column_1, column_3, column_31, column_10, column_14, column_11, column_12, column_25, column_18, column_19, column_13, column_20, column_34, column_4, column_16, column_24, column_23, column_6, column_9, column_30, column_7, column_26) VALUES (1, 1, 1, 1, 1, 1, 1, 1, 1, 1, 1, 1, 1, 1, 1, 1, 1, 1, 1, 1, 1, 1, 1, 1, 2, 1, 1, 1, 1, 1, 1, 1, 1, 1), (1, 1, 1, 1, 1, 1, 1, 1, 1, 1, 1, 1, 1, 1, 1, 1, 1, 1, 1, 1, 1, 1, 1, 1, 3, 1, 1, 1, 1, 1, 1, 1, 1, 1), (1, 1, 1, 1, 1, 1, 1, 1, 1, 1, 1, 1, 1, 1, 1, 1, 1, 1, 1, 1, 1, 1, 1, 1, 4, 1, 1, 1, 1, 1, 1, 1, 1, 1), (1, 1, 1, 1, 1, 1, 1, 1, 1, 1, 1, 1, 1, 1, 1, 1, 1, 1, 1, 1, 1, 1, 1, 1, 5, 1, 1, 1, 1, 1, 1, 1, 1, 1), (1, 1, 1, 1, 1, 1, 1, 1, 1, 1, 1, 1, 1, 1, 1, 1, 1, 1, 1, 1, 1, 1, 1, 1, 6, 1, 1, 1, 1, 1, 1, 1, 1, 1)


query  nosort
SELECT table_1.column_1 AS alias_1 FROM table_1 WHERE (table_1.column_1 <= 1)
----
1
1
1
1
1

query  nosort
SELECT table_1.column_1 AS alias_1 FROM table_1 WHERE (table_1.column_1 <= 1)
----
1
1
1
1
1

query  nosort
SELECT table_1.column_1 AS alias_1 FROM table_1 WHERE (table_1.column_1 <= table_1.column_2)
----
1
1
1
1
1

query  nosort
SELECT table_1.column_1 AS alias_1 FROM table_1 WHERE (table_1.column_1 <= table_1.column_3)
----
1
1
1
1
1

query  nosort
SELECT DISTINCT table_1.column_3 AS alias_1 FROM table_1
----
1

query  nosort
SELECT table_1.column_1 AS alias_1, table_1.column_1 AS alias_2 FROM table_1 WHERE ((table_1.column_1 <= 1) OR (table_1.column_1 <= 1))
----
1
1
1
1
1
1
1
1
1
1

query  nosort
SELECT table_1.column_1 AS alias_1, table_1.column_1 AS alias_2 FROM table_1 WHERE ((table_1.column_1 <= 1) AND (table_1.column_1 <= table_1.column_4))
----
1
1
1
1
1
1
1
1
1
1

query  nosort
SELECT table_1.column_1 AS alias_1, table_1.column_1 AS alias_2 FROM table_1 WHERE ((table_1.column_1 <= 1) OR (table_1.column_1 <= table_1.column_5))
----
1
1
1
1
1
1
1
1
1
1

query  nosort
SELECT DISTINCT table_1.column_1 AS alias_1 FROM table_1 WHERE (table_1.column_1 <= 1)
----
1

query  nosort
SELECT table_1.column_1 AS alias_1, table_1.column_1 AS alias_2 FROM table_1 WHERE ((table_1.column_1 <= 1) AND (table_1.column_1 <= table_1.column_6))
----
1
1
1
1
1
1
1
1
1
1

query  nosort
SELECT table_1.column_1 AS alias_1, table_1.column_1 AS alias_2 FROM table_1 WHERE ((table_1.column_1 <= 1) OR (table_1.column_1 <= table_1.column_7))
----
1
1
1
1
1
1
1
1
1
1

query  nosort
SELECT DISTINCT table_1.column_1 AS alias_1 FROM table_1 WHERE (table_1.column_1 <= 1)
----
1

query  nosort
SELECT table_1.column_1 AS alias_1, table_1.column_1 AS alias_2 FROM table_1 WHERE ((table_1.column_1 <= table_1.column_8) OR (table_1.column_1 <= table_1.column_9))
----
1
1
1
1
1
1
1
1
1
1

query  nosort
SELECT DISTINCT table_1.column_1 AS alias_1 FROM table_1 WHERE (table_1.column_1 <= table_1.column_10)
----
1

query  nosort
SELECT DISTINCT table_1.column_1 AS alias_1 FROM table_1 WHERE (table_1.column_1 <= table_1.column_11)
----
1

query  nosort
SELECT table_1.column_1 AS alias_1, table_1.column_1 AS alias_2, table_1.column_1 AS alias_3 FROM table_1 WHERE (((table_1.column_1 <= 1) OR (table_1.column_1 <= 1)) AND (table_1.column_1 <= table_1.column_12))
----
1
1
1
1
1
1
1
1
1
1
1
1
1
1
1

query  nosort
SELECT table_1.column_1 AS alias_1, table_1.column_1 AS alias_2, table_1.column_1 AS alias_3 FROM table_1 WHERE (((table_1.column_1 <= 1) OR (table_1.column_1 <= 1)) OR (table_1.column_1 <= table_1.column_13))
----
1
1
1
1
1
1
1
1
1
1
1
1
1
1
1

query  nosort
SELECT DISTINCT table_1.column_1 AS alias_1, table_1.column_1 AS alias_2 FROM table_1 WHERE ((table_1.column_1 <= 1) OR (table_1.column_1 <= 1))
----
1
1

query  nosort
SELECT table_1.column_1 AS alias_1, table_1.column_1 AS alias_2, table_1.column_1 AS alias_3 FROM table_1 WHERE (((table_1.column_1 <= 1) AND (table_1.column_1 <= table_1.column_14)) OR (table_1.column_1 <= table_1.column_15))
----
1
1
1
1
1
1
1
1
1
1
1
1
1
1
1

query  nosort
SELECT DISTINCT table_1.column_1 AS alias_1, table_1.column_1 AS alias_2 FROM table_1 WHERE ((table_1.column_1 <= 1) AND (table_1.column_1 <= table_1.column_16))
----
1
1

query  nosort
SELECT DISTINCT table_1.column_1 AS alias_1, table_1.column_1 AS alias_2 FROM table_1 WHERE ((table_1.column_1 <= 1) OR (table_1.column_1 <= table_1.column_17))
----
1
1

query  nosort
SELECT table_1.column_1 AS alias_1, table_1.column_1 AS alias_2, table_1.column_1 AS alias_3 FROM table_1 WHERE (((table_1.column_1 <= 1) AND (table_1.column_1 <= table_1.column_18)) OR (table_1.column_1 <= table_1.column_19))
----
1
1
1
1
1
1
1
1
1
1
1
1
1
1
1

query  nosort
SELECT DISTINCT table_1.column_1 AS alias_1, table_1.column_1 AS alias_2 FROM table_1 WHERE ((table_1.column_1 <= 1) AND (table_1.column_1 <= table_1.column_20))
----
1
1

query  nosort
SELECT DISTINCT table_1.column_1 AS alias_1, table_1.column_1 AS alias_2 FROM table_1 WHERE ((table_1.column_1 <= 1) OR (table_1.column_1 <= table_1.column_21))
----
1
1

query  nosort
SELECT DISTINCT table_1.column_1 AS alias_1, table_1.column_1 AS alias_2 FROM table_1 WHERE ((table_1.column_1 <= table_1.column_22) OR (table_1.column_1 <= table_1.column_23))
----
1
1

query  nosort
SELECT table_1.column_1 AS alias_1, table_1.column_1 AS alias_2, table_1.column_1 AS alias_3, table_1.column_1 AS alias_4 FROM table_1 WHERE ((((table_1.column_1 <= 1) OR (table_1.column_1 <= 1)) AND (table_1.column_1 <= table_1.column_24)) OR (table_1.column_1 <= table_1.column_25))
----
1
1
1
1
1
1
1
1
1
1
1
1
1
1
1
1
1
1
1
1

query  nosort
SELECT DISTINCT table_1.column_1 AS alias_1, table_1.column_1 AS alias_2, table_1.column_1 AS alias_3 FROM table_1 WHERE (((table_1.column_1 <= 1) OR (table_1.column_1 <= 1)) AND (table_1.column_1 <= table_1.column_26))
----
1
1
1

query  nosort
SELECT DISTINCT table_1.column_1 AS alias_1, table_1.column_1 AS alias_2, table_1.column_1 AS alias_3 FROM table_1 WHERE (((table_1.column_1 <= 1) OR (table_1.column_1 <= 1)) OR (table_1.column_1 <= table_1.column_27))
----
1
1
1

query  nosort
SELECT DISTINCT table_1.column_1 AS alias_1, table_1.column_1 AS alias_2, table_1.column_1 AS alias_3 FROM table_1 WHERE (((table_1.column_1 <= 1) AND (table_1.column_1 <= table_1.column_28)) OR (table_1.column_1 <= table_1.column_29))
----
1
1
1

query  nosort
SELECT DISTINCT table_1.column_1 AS alias_1, table_1.column_1 AS alias_2, table_1.column_1 AS alias_3 FROM table_1 WHERE (((table_1.column_1 <= 1) AND (table_1.column_1 <= table_1.column_30)) OR (table_1.column_1 <= table_1.column_31))
----
1
1
1

query  nosort
SELECT DISTINCT table_1.column_1 AS alias_1, table_1.column_1 AS alias_2, table_1.column_1 AS alias_3, table_1.column_1 AS alias_4 FROM table_1 WHERE ((((table_1.column_1 <= 1) OR (table_1.column_1 <= 1)) AND (table_1.column_1 <= table_1.column_32)) OR (table_1.column_1 <= table_1.column_33))
----
1
1
1
1

statement ok
DELETE FROM table_1 WHERE (column_34 = 2)


statement ok
DELETE FROM table_1 WHERE (column_34 = 3)


query  nosort
SELECT table_1.column_1 AS alias_1 FROM table_1 WHERE (table_1.column_1 <= 1)
----
1
1
1

query  nosort
SELECT table_1.column_1 AS alias_1 FROM table_1 WHERE (table_1.column_1 <= 1)
----
1
1
1

query  nosort
SELECT table_1.column_1 AS alias_1 FROM table_1 WHERE (table_1.column_1 <= table_1.column_2)
----
1
1
1

query  nosort
SELECT table_1.column_1 AS alias_1 FROM table_1 WHERE (table_1.column_1 <= table_1.column_3)
----
1
1
1

query  nosort
SELECT DISTINCT table_1.column_3 AS alias_1 FROM table_1
----
1

query  nosort
SELECT table_1.column_1 AS alias_1, table_1.column_1 AS alias_2 FROM table_1 WHERE ((table_1.column_1 <= 1) OR (table_1.column_1 <= 1))
----
1
1
1
1
1
1

query  nosort
SELECT table_1.column_1 AS alias_1, table_1.column_1 AS alias_2 FROM table_1 WHERE ((table_1.column_1 <= 1) AND (table_1.column_1 <= table_1.column_4))
----
1
1
1
1
1
1

query  nosort
SELECT table_1.column_1 AS alias_1, table_1.column_1 AS alias_2 FROM table_1 WHERE ((table_1.column_1 <= 1) OR (table_1.column_1 <= table_1.column_5))
----
1
1
1
1
1
1

query  nosort
SELECT DISTINCT table_1.column_1 AS alias_1 FROM table_1 WHERE (table_1.column_1 <= 1)
----
1

query  nosort
SELECT table_1.column_1 AS alias_1, table_1.column_1 AS alias_2 FROM table_1 WHERE ((table_1.column_1 <= 1) AND (table_1.column_1 <= table_1.column_6))
----
1
1
1
1
1
1

query  nosort
SELECT table_1.column_1 AS alias_1, table_1.column_1 AS alias_2 FROM table_1 WHERE ((table_1.column_1 <= 1) OR (table_1.column_1 <= table_1.column_7))
----
1
1
1
1
1
1

query  nosort
SELECT DISTINCT table_1.column_1 AS alias_1 FROM table_1 WHERE (table_1.column_1 <= 1)
----
1

query  nosort
SELECT table_1.column_1 AS alias_1, table_1.column_1 AS alias_2 FROM table_1 WHERE ((table_1.column_1 <= table_1.column_8) OR (table_1.column_1 <= table_1.column_9))
----
1
1
1
1
1
1

query  nosort
SELECT DISTINCT table_1.column_1 AS alias_1 FROM table_1 WHERE (table_1.column_1 <= table_1.column_10)
----
1

query  nosort
SELECT DISTINCT table_1.column_1 AS alias_1 FROM table_1 WHERE (table_1.column_1 <= table_1.column_11)
----
1

query  nosort
SELECT table_1.column_1 AS alias_1, table_1.column_1 AS alias_2, table_1.column_1 AS alias_3 FROM table_1 WHERE (((table_1.column_1 <= 1) OR (table_1.column_1 <= 1)) AND (table_1.column_1 <= table_1.column_12))
----
1
1
1
1
1
1
1
1
1

query  nosort
SELECT table_1.column_1 AS alias_1, table_1.column_1 AS alias_2, table_1.column_1 AS alias_3 FROM table_1 WHERE (((table_1.column_1 <= 1) OR (table_1.column_1 <= 1)) OR (table_1.column_1 <= table_1.column_13))
----
1
1
1
1
1
1
1
1
1

query  nosort
SELECT DISTINCT table_1.column_1 AS alias_1, table_1.column_1 AS alias_2 FROM table_1 WHERE ((table_1.column_1 <= 1) OR (table_1.column_1 <= 1))
----
1
1

query  nosort
SELECT table_1.column_1 AS alias_1, table_1.column_1 AS alias_2, table_1.column_1 AS alias_3 FROM table_1 WHERE (((table_1.column_1 <= 1) AND (table_1.column_1 <= table_1.column_14)) OR (table_1.column_1 <= table_1.column_15))
----
1
1
1
1
1
1
1
1
1

query  nosort
SELECT DISTINCT table_1.column_1 AS alias_1, table_1.column_1 AS alias_2 FROM table_1 WHERE ((table_1.column_1 <= 1) AND (table_1.column_1 <= table_1.column_16))
----
1
1

query  nosort
SELECT DISTINCT table_1.column_1 AS alias_1, table_1.column_1 AS alias_2 FROM table_1 WHERE ((table_1.column_1 <= 1) OR (table_1.column_1 <= table_1.column_17))
----
1
1

query  nosort
SELECT table_1.column_1 AS alias_1, table_1.column_1 AS alias_2, table_1.column_1 AS alias_3 FROM table_1 WHERE (((table_1.column_1 <= 1) AND (table_1.column_1 <= table_1.column_18)) OR (table_1.column_1 <= table_1.column_19))
----
1
1
1
1
1
1
1
1
1

query  nosort
SELECT DISTINCT table_1.column_1 AS alias_1, table_1.column_1 AS alias_2 FROM table_1 WHERE ((table_1.column_1 <= 1) AND (table_1.column_1 <= table_1.column_20))
----
1
1

query  nosort
SELECT DISTINCT table_1.column_1 AS alias_1, table_1.column_1 AS alias_2 FROM table_1 WHERE ((table_1.column_1 <= 1) OR (table_1.column_1 <= table_1.column_21))
----
1
1

query  nosort
SELECT DISTINCT table_1.column_1 AS alias_1, table_1.column_1 AS alias_2 FROM table_1 WHERE ((table_1.column_1 <= table_1.column_22) OR (table_1.column_1 <= table_1.column_23))
----
1
1

query  nosort
SELECT table_1.column_1 AS alias_1, table_1.column_1 AS alias_2, table_1.column_1 AS alias_3, table_1.column_1 AS alias_4 FROM table_1 WHERE ((((table_1.column_1 <= 1) OR (table_1.column_1 <= 1)) AND (table_1.column_1 <= table_1.column_24)) OR (table_1.column_1 <= table_1.column_25))
----
1
1
1
1
1
1
1
1
1
1
1
1

query  nosort
SELECT DISTINCT table_1.column_1 AS alias_1, table_1.column_1 AS alias_2, table_1.column_1 AS alias_3 FROM table_1 WHERE (((table_1.column_1 <= 1) OR (table_1.column_1 <= 1)) AND (table_1.column_1 <= table_1.column_26))
----
1
1
1

query  nosort
SELECT DISTINCT table_1.column_1 AS alias_1, table_1.column_1 AS alias_2, table_1.column_1 AS alias_3 FROM table_1 WHERE (((table_1.column_1 <= 1) OR (table_1.column_1 <= 1)) OR (table_1.column_1 <= table_1.column_27))
----
1
1
1

query  nosort
SELECT DISTINCT table_1.column_1 AS alias_1, table_1.column_1 AS alias_2, table_1.column_1 AS alias_3 FROM table_1 WHERE (((table_1.column_1 <= 1) AND (table_1.column_1 <= table_1.column_28)) OR (table_1.column_1 <= table_1.column_29))
----
1
1
1

query  nosort
SELECT DISTINCT table_1.column_1 AS alias_1, table_1.column_1 AS alias_2, table_1.column_1 AS alias_3 FROM table_1 WHERE (((table_1.column_1 <= 1) AND (table_1.column_1 <= table_1.column_30)) OR (table_1.column_1 <= table_1.column_31))
----
1
1
1

query  nosort
SELECT DISTINCT table_1.column_1 AS alias_1, table_1.column_1 AS alias_2, table_1.column_1 AS alias_3, table_1.column_1 AS alias_4 FROM table_1 WHERE ((((table_1.column_1 <= 1) OR (table_1.column_1 <= 1)) AND (table_1.column_1 <= table_1.column_32)) OR (table_1.column_1 <= table_1.column_33))
----
1
1
1
1
