# Generated by:
#     target/debug/noria-logictest permute --compare-to mysql://root:noria@127.1/noria -d 3 -o logictests/generated/mysql/ --only range_param --random --include-deletes --rows-per-table 10 --subquery-depth 1 --overwrite-tests

statement ok
CREATE TABLE `table_1` (`column_3` INT, `column_2` INT, `column_5` INT, `column_1` INT, `column_8` INT, `column_9` INT, `column_7` INT, `column_6` INT, `column_4` INT, PRIMARY KEY (`column_9`))


statement ok
INSERT INTO `table_1` (`column_3`, `column_2`, `column_5`, `column_1`, `column_8`, `column_9`, `column_7`, `column_6`, `column_4`) VALUES (78606172, -994056850, -2018332818, -472799961, 970089738, 0, -1024740410, -1760533288, 978792024), (-1001511283, -146647161, -1373735399, -966886712, 591866630, 1, 550745166, 1275732731, 754949261), (2050482977, 1721676866, -275391054, 171138377, 1730823190, 2, -283262281, -641628595, 1120491963), (-760332639, 1047299471, -49248680, -804079319, 1175085544, 3, 1728094863, -179456106, -481445849), (-850487650, 177431201, 1206620315, 998594494, 1781944377, 4, -1469398891, -459070262, -440134482), (1309777995, -1803414838, 397287812, -1246049782, 194333769, 5, 941074043, 1460040069, -46881312), (-1311704285, 481078818, -662058557, -1321356439, 1509576983, 6, -1997486866, -2057899275, 1836068827), (1219212458, 379640897, 1456481694, 2118642466, 790474437, 7, -982181191, -502661144, -145221253), (-1592761374, 1604056978, 327842509, -1632876573, 948810881, 8, -1150282970, -242280985, 16366302), (92952733, 513974239, -1241643992, -113532150, -595839044, 9, -33259345, -2103346896, -953376693)


query  rowsort
SELECT max(`table_1`.`column_1`) AS `alias_1` FROM `table_1`
----
2118642466

query  rowsort
SELECT sum(`table_1`.`column_2`) AS `alias_1` FROM `table_1`
----
2981039621

query  rowsort
SELECT `table_1`.`column_2` AS `alias_1` FROM `table_1` WHERE (`table_1`.`column_2` > ?)
? = 10
----
1047299471
1604056978
1721676866
177431201
379640897
481078818
513974239

query  rowsort
SELECT max(`table_1`.`column_3`) AS `alias_1`, sum(`table_1`.`column_4`) AS `alias_2` FROM `table_1`
----
2050482977
2639608788

query  rowsort
SELECT max(`table_1`.`column_5`) AS `alias_1` FROM `table_1` WHERE (`table_1`.`column_5` > ?)
? = 10
----
1456481694

query  rowsort
SELECT sum(`table_1`.`column_6`) AS `alias_1` FROM `table_1` WHERE (`table_1`.`column_5` > ?)
? = 10
----
256027678

query  rowsort
SELECT max(`table_1`.`column_7`) AS `alias_1`, sum(`table_1`.`column_8`) AS `alias_2` FROM `table_1` WHERE (`table_1`.`column_3` > ?)
? = 10
----
941074043
3089882090

statement ok
DELETE FROM `table_1` WHERE (`column_9` = 0)


statement ok
DELETE FROM `table_1` WHERE (`column_9` = 1)


statement ok
DELETE FROM `table_1` WHERE (`column_9` = 2)


statement ok
DELETE FROM `table_1` WHERE (`column_9` = 3)


statement ok
DELETE FROM `table_1` WHERE (`column_9` = 4)


query  rowsort
SELECT max(`table_1`.`column_1`) AS `alias_1` FROM `table_1`
----
2118642466

query  rowsort
SELECT sum(`table_1`.`column_2`) AS `alias_1` FROM `table_1`
----
1175336094

query  rowsort
SELECT `table_1`.`column_2` AS `alias_1` FROM `table_1` WHERE (`table_1`.`column_2` > ?)
? = 10
----
1604056978
379640897
481078818
513974239

query  rowsort
SELECT max(`table_1`.`column_3`) AS `alias_1`, sum(`table_1`.`column_4`) AS `alias_2` FROM `table_1`
----
1309777995
706955871

query  rowsort
SELECT max(`table_1`.`column_5`) AS `alias_1` FROM `table_1` WHERE (`table_1`.`column_5` > ?)
? = 10
----
1456481694

query  rowsort
SELECT sum(`table_1`.`column_6`) AS `alias_1` FROM `table_1` WHERE (`table_1`.`column_5` > ?)
? = 10
----
715097940

query  rowsort
SELECT max(`table_1`.`column_7`) AS `alias_1`, sum(`table_1`.`column_8`) AS `alias_2` FROM `table_1` WHERE (`table_1`.`column_3` > ?)
? = 10
----
941074043
388969162
