# Generated by:
#     target/debug/noria-logictest permute --compare-to mysql://root:noria@127.1/noria -d 3 -o logictests/generated/mysql/ --only range_param --random --include-deletes --rows-per-table 10 --subquery-depth 1 --overwrite-tests

statement ok
CREATE TABLE `table_1` (`column_2` INT, `column_4` INT, `column_5` INT, `column_3` INT, `column_1` INT, PRIMARY KEY (`column_5`))


statement ok
INSERT INTO `table_1` (`column_2`, `column_4`, `column_5`, `column_3`, `column_1`) VALUES (-90754195, -969034145, 0, -850498819, -1030005144), (-413335719, -2091707534, 1, -235794650, 2081901753), (1148202197, -986529544, 2, 1584803982, 1478792392), (1574191544, 936311760, 3, 112649245, -1661085670), (1874996956, 1953610492, 4, 89497093, 1673180551), (-516976966, 1089669199, 5, -1983306566, -1413658532), (1002560441, 538680464, 6, 1630734087, -2114150991), (547051720, -455090205, 7, 838575784, 187695070), (-683398924, 1237688597, 8, 113683360, 1795702783), (-1402264329, 800381863, 9, 784373367, -340024922)


query  rowsort
SELECT max(`table_1`.`column_1`) AS `alias_1` FROM `table_1`
----
2081901753

query  rowsort
SELECT 1 AS `alias_1`
----
1

query  rowsort
SELECT `table_1`.`column_1` AS `alias_1` FROM `table_1` WHERE (`table_1`.`column_1` > ?)
? = 10
----
1478792392
1673180551
1795702783
187695070
2081901753

query  rowsort
SELECT max(`table_1`.`column_2`) AS `alias_1`, 1 AS `alias_2` FROM `table_1`
----
1874996956
1

query  rowsort
SELECT max(`table_1`.`column_3`) AS `alias_1` FROM `table_1` WHERE (`table_1`.`column_3` > ?)
? = 10
----
1630734087

query  rowsort
SELECT 1 AS `alias_1` FROM `table_1` WHERE (`table_1`.`column_3` > ?)
? = 10
----
1
1
1
1
1
1
1

query  rowsort
SELECT max(`table_1`.`column_4`) AS `alias_1`, 1 AS `alias_2` FROM `table_1` WHERE (`table_1`.`column_2` > ?)
? = 10
----
1953610492
1

statement ok
DELETE FROM `table_1` WHERE (`column_5` = 0)


statement ok
DELETE FROM `table_1` WHERE (`column_5` = 1)


statement ok
DELETE FROM `table_1` WHERE (`column_5` = 2)


statement ok
DELETE FROM `table_1` WHERE (`column_5` = 3)


statement ok
DELETE FROM `table_1` WHERE (`column_5` = 4)


query  rowsort
SELECT max(`table_1`.`column_1`) AS `alias_1` FROM `table_1`
----
1795702783

query  rowsort
SELECT 1 AS `alias_1`
----
1

query  rowsort
SELECT `table_1`.`column_1` AS `alias_1` FROM `table_1` WHERE (`table_1`.`column_1` > ?)
? = 10
----
1795702783
187695070

query  rowsort
SELECT max(`table_1`.`column_2`) AS `alias_1`, 1 AS `alias_2` FROM `table_1`
----
1002560441
1

query  rowsort
SELECT max(`table_1`.`column_3`) AS `alias_1` FROM `table_1` WHERE (`table_1`.`column_3` > ?)
? = 10
----
1630734087

query  rowsort
SELECT 1 AS `alias_1` FROM `table_1` WHERE (`table_1`.`column_3` > ?)
? = 10
----
1
1
1
1

query  rowsort
SELECT max(`table_1`.`column_4`) AS `alias_1`, 1 AS `alias_2` FROM `table_1` WHERE (`table_1`.`column_2` > ?)
? = 10
----
538680464
1
