# Generated by:
#     target/debug/noria-logictest permute --compare-to mysql://root:noria@127.1/noria -d 3 -o logictests/generated/mysql/ --only range_param --random --include-deletes --rows-per-table 10 --subquery-depth 1

statement ok
CREATE TABLE `table_1` (`column_1` INT, `column_2` INT, PRIMARY KEY (`column_2`))


statement ok
INSERT INTO `table_1` (`column_1`, `column_2`) VALUES (-520955047, 0), (1088826211, 1), (-137726849, 2), (1056728826, 3), (-141854590, 4), (127261099, 5), (1776694270, 6), (-128130913, 7), (-207927584, 8), (1283096159, 9)


query  rowsort
SELECT `table_1`.`column_1` AS `alias_1` FROM `table_1` WHERE ((`table_1`.`column_1` = ?) AND (`table_1`.`column_1` = ?))
? = 1
? = 1
----


query  rowsort
SELECT `table_1`.`column_1` AS `alias_1` FROM `table_1` WHERE (`table_1`.`column_1` = ?)
? = 1
----


query  rowsort
SELECT `table_1`.`column_1` AS `alias_1` FROM `table_1` WHERE (`table_1`.`column_1` > ?)
? = 10
----
1056728826
1088826211
127261099
1283096159
1776694270

query  rowsort
SELECT `table_1`.`column_1` AS `alias_1` FROM `table_1` WHERE (((`table_1`.`column_1` = ?) AND (`table_1`.`column_1` = ?)) AND (`table_1`.`column_1` = ?))
? = 1
? = 1
? = 1
----


query  rowsort
SELECT `table_1`.`column_1` AS `alias_1` FROM `table_1` WHERE (((`table_1`.`column_1` = ?) AND (`table_1`.`column_1` = ?)) AND (`table_1`.`column_1` > ?))
? = 1
? = 1
? = 10
----


query  rowsort
SELECT `table_1`.`column_1` AS `alias_1` FROM `table_1` WHERE ((`table_1`.`column_1` = ?) AND (`table_1`.`column_1` > ?))
? = 1
? = 10
----


query  rowsort
SELECT `table_1`.`column_1` AS `alias_1` FROM `table_1` WHERE ((((`table_1`.`column_1` = ?) AND (`table_1`.`column_1` = ?)) AND (`table_1`.`column_1` = ?)) AND (`table_1`.`column_1` > ?))
? = 1
? = 1
? = 1
? = 10
----


statement ok
DELETE FROM `table_1` WHERE (`column_2` = 0)


statement ok
DELETE FROM `table_1` WHERE (`column_2` = 1)


statement ok
DELETE FROM `table_1` WHERE (`column_2` = 2)


statement ok
DELETE FROM `table_1` WHERE (`column_2` = 3)


statement ok
DELETE FROM `table_1` WHERE (`column_2` = 4)


query  rowsort
SELECT `table_1`.`column_1` AS `alias_1` FROM `table_1` WHERE ((`table_1`.`column_1` = ?) AND (`table_1`.`column_1` = ?))
? = 1
? = 1
----


query  rowsort
SELECT `table_1`.`column_1` AS `alias_1` FROM `table_1` WHERE (`table_1`.`column_1` = ?)
? = 1
----


query  rowsort
SELECT `table_1`.`column_1` AS `alias_1` FROM `table_1` WHERE (`table_1`.`column_1` > ?)
? = 10
----
127261099
1283096159
1776694270

query  rowsort
SELECT `table_1`.`column_1` AS `alias_1` FROM `table_1` WHERE (((`table_1`.`column_1` = ?) AND (`table_1`.`column_1` = ?)) AND (`table_1`.`column_1` = ?))
? = 1
? = 1
? = 1
----


query  rowsort
SELECT `table_1`.`column_1` AS `alias_1` FROM `table_1` WHERE (((`table_1`.`column_1` = ?) AND (`table_1`.`column_1` = ?)) AND (`table_1`.`column_1` > ?))
? = 1
? = 1
? = 10
----


query  rowsort
SELECT `table_1`.`column_1` AS `alias_1` FROM `table_1` WHERE ((`table_1`.`column_1` = ?) AND (`table_1`.`column_1` > ?))
? = 1
? = 10
----


query  rowsort
SELECT `table_1`.`column_1` AS `alias_1` FROM `table_1` WHERE ((((`table_1`.`column_1` = ?) AND (`table_1`.`column_1` = ?)) AND (`table_1`.`column_1` = ?)) AND (`table_1`.`column_1` > ?))
? = 1
? = 1
? = 1
? = 10
----

