# Generated by:
#     target/debug/noria-logictest permute --compare-to mysql://root:noria@127.1/noria -d 3 -o logictests/generated/mysql/ --only range_param --random --include-deletes --rows-per-table 10 --subquery-depth 1

statement ok
CREATE TABLE `table_5` (`column_3` INT, `column_2` INT, `column_1` INT, PRIMARY KEY (`column_3`))


statement ok
CREATE TABLE `table_2` (`column_4` INT, `column_1` INT, `column_2` INT, `column_3` INT, PRIMARY KEY (`column_4`))


statement ok
CREATE TABLE `table_4` (`column_3` INT, `column_1` INT, `column_2` INT, PRIMARY KEY (`column_3`))


statement ok
CREATE TABLE `table_1` (`column_2` INT, `column_5` INT, `column_3` INT, `column_1` INT, `column_4` INT, PRIMARY KEY (`column_5`))


statement ok
CREATE TABLE `table_3` (`column_3` INT, `column_2` INT, `column_1` INT, PRIMARY KEY (`column_3`))


statement ok
INSERT INTO `table_5` (`column_3`, `column_2`, `column_1`) VALUES (0, -1306576043, -1327472204), (1, 1194935188, -1776862273), (2, 1176582618, -1235565953), (3, -1509206012, -285590330), (4, -1484115662, -1315667225), (5, -1868772112, -1682615399), (6, -315025988, -84626215), (7, -1992592551, 339520823), (8, -1937812788, -1522036687), (9, -1570550016, -2115737423)


statement ok
INSERT INTO `table_2` (`column_4`, `column_1`, `column_2`, `column_3`) VALUES (0, 1596659812, 1355297464, 514676695), (1, -992192916, 142388856, 383499703), (2, 915246527, -218913121, -1836882659), (3, 235447323, 90903211, 1825538985), (4, 226847566, 772527682, -1211910118), (5, -1105961988, -1354808613, -116534949), (6, 1246627241, -1163242300, 1701416376), (7, 1750979281, -1764270147, 1178634984), (8, 110552991, 947850180, 1992710388), (9, -1224746959, -1384604042, -850471651)


statement ok
INSERT INTO `table_4` (`column_3`, `column_1`, `column_2`) VALUES (0, -939631884, 1858918415), (1, 826888746, -1002131773), (2, 344460790, -1912752929), (3, -996938801, -1614742430), (4, 600135353, 981703046), (5, -1845353901, -2143835407), (6, 1093656676, -2421465), (7, 943850487, -725540769), (8, 766792406, 1895667586), (9, 1910546562, 1954243414)


statement ok
INSERT INTO `table_1` (`column_2`, `column_5`, `column_3`, `column_1`, `column_4`) VALUES (-333796400, 0, 1917912247, -75636430, -1324796756), (-2077526940, 1, 1252930070, 1045945826, -1467710220), (-1412620282, 2, -1298858680, -1586099545, -218896373), (423881488, 3, -1409904169, -277429143, -1209559121), (735056640, 4, -1078418674, 544554633, -1195829619), (-287391668, 5, 1127917402, -1199947125, 1104471857), (-1285711056, 6, -413663511, -819319301, -24248406), (-1320963529, 7, 1374406842, 1495177644, -810707394), (2056580953, 8, -1033700036, 1298789463, -695370791), (-687260850, 9, -286316059, 1511738123, -672576880)


statement ok
INSERT INTO `table_3` (`column_3`, `column_2`, `column_1`) VALUES (0, 1768058711, 950958356), (1, 1788703338, -9473399), (2, 590260195, 2133022021), (3, -350364659, 1684280862), (4, -2093647452, 1545221516), (5, 539589609, 1367979625), (6, 1059278800, 434643564), (7, -88644501, 1032641017), (8, -794455126, 141499372), (9, -1800249651, -1671879296)


query  rowsort
SELECT `table_1`.`column_1` AS `alias_1` FROM `table_1` WHERE (`table_1`.`column_1` > ?)
? = 10
----
1045945826
1298789463
1495177644
1511738123
544554633

query  rowsort
SELECT `table_1`.`column_2` AS `alias_1`, `table_2`.`column_2` AS `alias_2` FROM `table_1` INNER JOIN `table_2` ON (`table_1`.`column_1` = `table_2`.`column_1`)
----


query  rowsort
SELECT `table_1`.`column_1` AS `alias_1` FROM `table_1` WHERE (`table_1`.`column_1` > ?)
? = 10
----
1045945826
1298789463
1495177644
1511738123
544554633

query  rowsort
SELECT `table_1`.`column_3` AS `alias_1`, `table_3`.`column_2` AS `alias_2` FROM `table_1` INNER JOIN `table_3` ON (`table_1`.`column_1` = `table_3`.`column_1`) WHERE (`table_1`.`column_1` > ?)
? = 10
----


query  rowsort
SELECT `table_1`.`column_1` AS `alias_1` FROM `table_1` WHERE ((`table_1`.`column_1` > ?) AND (`table_1`.`column_1` > ?))
? = 10
? = 10
----
1045945826
1298789463
1495177644
1511738123
544554633

query  rowsort
SELECT `table_1`.`column_4` AS `alias_1`, `table_4`.`column_2` AS `alias_2` FROM `table_1` INNER JOIN `table_4` ON (`table_1`.`column_1` = `table_4`.`column_1`) WHERE (`table_1`.`column_2` > ?)
? = 10
----


query  rowsort
SELECT `table_2`.`column_3` AS `alias_1`, `table_5`.`column_2` AS `alias_2` FROM `table_2` INNER JOIN `table_5` ON (`table_2`.`column_1` = `table_5`.`column_1`) WHERE ((`table_2`.`column_1` > ?) AND (`table_2`.`column_1` > ?))
? = 10
? = 10
----


statement ok
DELETE FROM `table_5` WHERE (`column_3` = 0)


statement ok
DELETE FROM `table_5` WHERE (`column_3` = 1)


statement ok
DELETE FROM `table_5` WHERE (`column_3` = 2)


statement ok
DELETE FROM `table_5` WHERE (`column_3` = 3)


statement ok
DELETE FROM `table_5` WHERE (`column_3` = 4)


statement ok
DELETE FROM `table_2` WHERE (`column_4` = 0)


statement ok
DELETE FROM `table_2` WHERE (`column_4` = 1)


statement ok
DELETE FROM `table_2` WHERE (`column_4` = 2)


statement ok
DELETE FROM `table_2` WHERE (`column_4` = 3)


statement ok
DELETE FROM `table_2` WHERE (`column_4` = 4)


statement ok
DELETE FROM `table_4` WHERE (`column_3` = 0)


statement ok
DELETE FROM `table_4` WHERE (`column_3` = 1)


statement ok
DELETE FROM `table_4` WHERE (`column_3` = 2)


statement ok
DELETE FROM `table_4` WHERE (`column_3` = 3)


statement ok
DELETE FROM `table_4` WHERE (`column_3` = 4)


statement ok
DELETE FROM `table_1` WHERE (`column_5` = 0)


statement ok
DELETE FROM `table_1` WHERE (`column_5` = 1)


statement ok
DELETE FROM `table_1` WHERE (`column_5` = 2)


statement ok
DELETE FROM `table_1` WHERE (`column_5` = 3)


statement ok
DELETE FROM `table_1` WHERE (`column_5` = 4)


statement ok
DELETE FROM `table_3` WHERE (`column_3` = 0)


statement ok
DELETE FROM `table_3` WHERE (`column_3` = 1)


statement ok
DELETE FROM `table_3` WHERE (`column_3` = 2)


statement ok
DELETE FROM `table_3` WHERE (`column_3` = 3)


statement ok
DELETE FROM `table_3` WHERE (`column_3` = 4)


query  rowsort
SELECT `table_1`.`column_1` AS `alias_1` FROM `table_1` WHERE (`table_1`.`column_1` > ?)
? = 10
----
1298789463
1495177644
1511738123

query  rowsort
SELECT `table_1`.`column_2` AS `alias_1`, `table_2`.`column_2` AS `alias_2` FROM `table_1` INNER JOIN `table_2` ON (`table_1`.`column_1` = `table_2`.`column_1`)
----


query  rowsort
SELECT `table_1`.`column_1` AS `alias_1` FROM `table_1` WHERE (`table_1`.`column_1` > ?)
? = 10
----
1298789463
1495177644
1511738123

query  rowsort
SELECT `table_1`.`column_3` AS `alias_1`, `table_3`.`column_2` AS `alias_2` FROM `table_1` INNER JOIN `table_3` ON (`table_1`.`column_1` = `table_3`.`column_1`) WHERE (`table_1`.`column_1` > ?)
? = 10
----


query  rowsort
SELECT `table_1`.`column_1` AS `alias_1` FROM `table_1` WHERE ((`table_1`.`column_1` > ?) AND (`table_1`.`column_1` > ?))
? = 10
? = 10
----
1298789463
1495177644
1511738123

query  rowsort
SELECT `table_1`.`column_4` AS `alias_1`, `table_4`.`column_2` AS `alias_2` FROM `table_1` INNER JOIN `table_4` ON (`table_1`.`column_1` = `table_4`.`column_1`) WHERE (`table_1`.`column_2` > ?)
? = 10
----


query  rowsort
SELECT `table_2`.`column_3` AS `alias_1`, `table_5`.`column_2` AS `alias_2` FROM `table_2` INNER JOIN `table_5` ON (`table_2`.`column_1` = `table_5`.`column_1`) WHERE ((`table_2`.`column_1` > ?) AND (`table_2`.`column_1` > ?))
? = 10
? = 10
----

