# Generated by:
#     target/debug/noria-logictest permute -d 3 -o logictests/generated/mysql --only in_parameter --compare-to mysql://root:noria@localhost/mysql --subquery-depth 1 --rows-per-table 5 --include-deletes --overwrite-tests

statement ok
CREATE TABLE table_3 (column_4 INT, column_2 INT, column_1 INT, column_3 INT, PRIMARY KEY (column_4))


statement ok
CREATE TABLE table_2 (column_1 INT, column_3 INT, column_5 INT, column_4 INT, column_2 INT, PRIMARY KEY (column_5))


statement ok
CREATE TABLE table_4 (column_3 INT, column_1 INT, column_2 INT, PRIMARY KEY (column_3))


statement ok
CREATE TABLE table_5 (column_1 INT, column_3 INT, column_2 INT, PRIMARY KEY (column_3))


statement ok
CREATE TABLE table_1 (column_3 INT, column_2 INT, column_1 INT, PRIMARY KEY (column_3))


statement ok
INSERT INTO table_3 (column_4, column_2, column_1, column_3) VALUES (0, 1, 2, 1), (1, 1, 1, 1), (2, 1, 0, 1), (3, 1, 1, 1), (4, 1, 1, 1)


statement ok
INSERT INTO table_2 (column_1, column_3, column_5, column_4, column_2) VALUES (0, 1, 0, 1, 1), (1, 1, 1, 1, 1), (1, 1, 2, 1, 2), (1, 1, 3, 1, 1), (2, 1, 4, 1, 0)


statement ok
INSERT INTO table_4 (column_3, column_1, column_2) VALUES (0, 1, 1), (1, 1, 1), (2, 1, 1), (3, 1, 1), (4, 1, 1)


statement ok
INSERT INTO table_5 (column_1, column_3, column_2) VALUES (1, 0, 1), (1, 1, 1), (1, 2, 1), (1, 3, 1), (1, 4, 1)


statement ok
INSERT INTO table_1 (column_3, column_2, column_1) VALUES (0, 1, 1), (1, 1, 1), (2, 1, 1), (3, 1, 1), (4, 1, 1)


query  rowsort
SELECT table_1.column_2 AS alias_1, table_2.column_2 AS alias_2 FROM table_1 INNER JOIN table_2 ON (table_1.column_1 = table_2.column_1)
----
30 values hashing to dec242ad7d0fa1a946dc9c1320fae9ab

query  rowsort
SELECT 1 AS alias_1
----
1

query  rowsort
SELECT table_2.column_2 AS alias_1 FROM table_2 WHERE table_2.column_2 IN (?, ?, ?)
? = 0
? = 1
? = 2
----
0
1
1
1
2

query  rowsort
SELECT table_2.column_3 AS alias_1, table_3.column_2 AS alias_2, 1 AS alias_3 FROM table_2 INNER JOIN table_3 ON (table_2.column_2 = table_3.column_1)
----
33 values hashing to 0e218e7012f4d5aebbb0775214cbd0d3

query  rowsort
SELECT table_2.column_4 AS alias_1, table_4.column_2 AS alias_2 FROM table_2 INNER JOIN table_4 ON (table_2.column_2 = table_4.column_1) WHERE table_2.column_1 IN (?, ?, ?)
? = 0
? = 1
? = 2
----
30 values hashing to 56a22a5394edccfc958048b005afa27b

query  rowsort
SELECT 1 AS alias_1 FROM table_3 WHERE table_3.column_1 IN (?, ?, ?)
? = 0
? = 1
? = 2
----
1
1
1
1
1

query  rowsort
SELECT table_3.column_3 AS alias_1, table_5.column_2 AS alias_2, 1 AS alias_3 FROM table_3 INNER JOIN table_5 ON (table_3.column_1 = table_5.column_1) WHERE table_3.column_1 IN (?, ?, ?)
? = 0
? = 1
? = 2
----
45 values hashing to 930323d678b557f397333f1dc2efed79

statement ok
DELETE FROM table_3 WHERE (column_4 = 0)


statement ok
DELETE FROM table_3 WHERE (column_4 = 1)


statement ok
DELETE FROM table_2 WHERE (column_5 = 0)


statement ok
DELETE FROM table_2 WHERE (column_5 = 1)


statement ok
DELETE FROM table_4 WHERE (column_3 = 0)


statement ok
DELETE FROM table_4 WHERE (column_3 = 1)


statement ok
DELETE FROM table_5 WHERE (column_3 = 0)


statement ok
DELETE FROM table_5 WHERE (column_3 = 1)


statement ok
DELETE FROM table_1 WHERE (column_3 = 0)


statement ok
DELETE FROM table_1 WHERE (column_3 = 1)


query  rowsort
SELECT table_1.column_2 AS alias_1, table_2.column_2 AS alias_2 FROM table_1 INNER JOIN table_2 ON (table_1.column_1 = table_2.column_1)
----
1
1
1
1
1
1
1
2
1
2
1
2

query  rowsort
SELECT 1 AS alias_1
----
1

query  rowsort
SELECT table_2.column_2 AS alias_1 FROM table_2 WHERE table_2.column_2 IN (?, ?, ?)
? = 0
? = 1
? = 2
----
0
1
2

query  rowsort
SELECT table_2.column_3 AS alias_1, table_3.column_2 AS alias_2, 1 AS alias_3 FROM table_2 INNER JOIN table_3 ON (table_2.column_2 = table_3.column_1)
----
1
1
1
1
1
1
1
1
1

query  rowsort
SELECT table_2.column_4 AS alias_1, table_4.column_2 AS alias_2 FROM table_2 INNER JOIN table_4 ON (table_2.column_2 = table_4.column_1) WHERE table_2.column_1 IN (?, ?, ?)
? = 0
? = 1
? = 2
----
1
1
1
1
1
1

query  rowsort
SELECT 1 AS alias_1 FROM table_3 WHERE table_3.column_1 IN (?, ?, ?)
? = 0
? = 1
? = 2
----
1
1
1

query  rowsort
SELECT table_3.column_3 AS alias_1, table_5.column_2 AS alias_2, 1 AS alias_3 FROM table_3 INNER JOIN table_5 ON (table_3.column_1 = table_5.column_1) WHERE table_3.column_1 IN (?, ?, ?)
? = 0
? = 1
? = 2
----
1
1
1
1
1
1
1
1
1
1
1
1
1
1
1
1
1
1
