# Generated by:
#     target/debug/noria-logictest permute -d 3 -o logictests/generated/mysql --only in_parameter --compare-to mysql://root:noria@localhost/mysql --subquery-depth 1 --rows-per-table 5 --include-deletes --overwrite-tests

statement ok
CREATE TABLE table_4 (column_1 INT, column_4 INT, column_2 INT, column_3 INT, PRIMARY KEY (column_4))


statement ok
CREATE TABLE table_1 (column_2 INT, column_1 INT, column_4 INT, column_5 INT, column_3 INT, PRIMARY KEY (column_5))


statement ok
CREATE TABLE table_5 (column_2 INT, column_1 INT, column_3 INT, PRIMARY KEY (column_3))


statement ok
CREATE TABLE table_3 (column_3 INT, column_1 INT, column_2 INT, PRIMARY KEY (column_3))


statement ok
CREATE TABLE table_2 (column_3 INT, column_2 INT, column_1 INT, PRIMARY KEY (column_3))


statement ok
INSERT INTO table_4 (column_1, column_4, column_2, column_3) VALUES (1, 0, 0, 1), (1, 1, 1, 1), (1, 2, 2, 1), (1, 3, 1, 1), (1, 4, 1, 1)


statement ok
INSERT INTO table_1 (column_2, column_1, column_4, column_5, column_3) VALUES (1, 1, 1, 0, 1), (1, 1, 1, 1, 1), (2, 1, 1, 2, 1), (1, 1, 1, 3, 1), (0, 1, 1, 4, 1)


statement ok
INSERT INTO table_5 (column_2, column_1, column_3) VALUES (1, 1, 0), (1, 1, 1), (1, 1, 2), (1, 1, 3), (1, 1, 4)


statement ok
INSERT INTO table_3 (column_3, column_1, column_2) VALUES (0, 1, 1), (1, 1, 1), (2, 1, 1), (3, 1, 1), (4, 1, 1)


statement ok
INSERT INTO table_2 (column_3, column_2, column_1) VALUES (0, 1, 1), (1, 1, 1), (2, 1, 1), (3, 1, 1), (4, 1, 1)


query  rowsort
SELECT 1 AS alias_1
----
1

query  rowsort
SELECT table_1.column_2 AS alias_1, table_2.column_2 AS alias_2 FROM table_1 LEFT JOIN table_2 ON (table_1.column_1 = table_2.column_1)
----
50 values hashing to b5d2b8344086ac9e2c9fd233458e5e97

query  rowsort
SELECT table_1.column_2 AS alias_1 FROM table_1 WHERE table_1.column_2 IN (?, ?, ?)
? = 0
? = 1
? = 2
----
0
1
1
1
2

query  rowsort
SELECT 1 AS alias_1, table_1.column_3 AS alias_2, table_3.column_2 AS alias_3 FROM table_1 LEFT JOIN table_3 ON (table_1.column_2 = table_3.column_1)
----
51 values hashing to dae99c0c118771671a04188b09d1af05

query  rowsort
SELECT 1 AS alias_1 FROM table_1 WHERE table_1.column_2 IN (?, ?, ?)
? = 0
? = 1
? = 2
----
1
1
1
1
1

query  rowsort
SELECT table_1.column_4 AS alias_1, table_4.column_2 AS alias_2 FROM table_1 LEFT JOIN table_4 ON (table_1.column_2 = table_4.column_1) WHERE table_1.column_2 IN (?, ?, ?)
? = 0
? = 1
? = 2
----
34 values hashing to 617099010eaf74e32bd1e66cb8b4dc48

query  rowsort
SELECT 1 AS alias_1, table_4.column_3 AS alias_2, table_5.column_2 AS alias_3 FROM table_4 LEFT JOIN table_5 ON (table_4.column_2 = table_5.column_1) WHERE table_4.column_2 IN (?, ?, ?)
? = 0
? = 1
? = 2
----
51 values hashing to dae99c0c118771671a04188b09d1af05

statement ok
DELETE FROM table_4 WHERE (column_4 = 0)


statement ok
DELETE FROM table_4 WHERE (column_4 = 1)


statement ok
DELETE FROM table_1 WHERE (column_5 = 0)


statement ok
DELETE FROM table_1 WHERE (column_5 = 1)


statement ok
DELETE FROM table_5 WHERE (column_3 = 0)


statement ok
DELETE FROM table_5 WHERE (column_3 = 1)


statement ok
DELETE FROM table_3 WHERE (column_3 = 0)


statement ok
DELETE FROM table_3 WHERE (column_3 = 1)


statement ok
DELETE FROM table_2 WHERE (column_3 = 0)


statement ok
DELETE FROM table_2 WHERE (column_3 = 1)


query  rowsort
SELECT 1 AS alias_1
----
1

query  rowsort
SELECT table_1.column_2 AS alias_1, table_2.column_2 AS alias_2 FROM table_1 LEFT JOIN table_2 ON (table_1.column_1 = table_2.column_1)
----
0
1
0
1
0
1
1
1
1
1
1
1
2
1
2
1
2
1

query  rowsort
SELECT table_1.column_2 AS alias_1 FROM table_1 WHERE table_1.column_2 IN (?, ?, ?)
? = 0
? = 1
? = 2
----
0
1
2

query  rowsort
SELECT 1 AS alias_1, table_1.column_3 AS alias_2, table_3.column_2 AS alias_3 FROM table_1 LEFT JOIN table_3 ON (table_1.column_2 = table_3.column_1)
----
1
1
1
1
1
1
1
1
1
1
1
NULL
1
1
NULL

query  rowsort
SELECT 1 AS alias_1 FROM table_1 WHERE table_1.column_2 IN (?, ?, ?)
? = 0
? = 1
? = 2
----
1
1
1

query  rowsort
SELECT table_1.column_4 AS alias_1, table_4.column_2 AS alias_2 FROM table_1 LEFT JOIN table_4 ON (table_1.column_2 = table_4.column_1) WHERE table_1.column_2 IN (?, ?, ?)
? = 0
? = 1
? = 2
----
1
1
1
1
1
2
1
NULL
1
NULL

query  rowsort
SELECT 1 AS alias_1, table_4.column_3 AS alias_2, table_5.column_2 AS alias_3 FROM table_4 LEFT JOIN table_5 ON (table_4.column_2 = table_5.column_1) WHERE table_4.column_2 IN (?, ?, ?)
? = 0
? = 1
? = 2
----
21 values hashing to d0fbd2851e5c1a0eeb8d6fefc0d0d1cd
