# Generated by:
#     target/debug/noria-logictest generate --operations sum,single_parameter,project_literal --compare-to mysql://root@localhost/mysql --subquery-depth 1 --rows-per-table 5 -o logictests/generated/sum,single_parameter,project_literal.test --include-deletes
# failure: ENG-336

statement ok
CREATE TABLE table_1 (column_2 INT(32), column_5 INT(32), column_1 INT(32), column_3 INT(32), column_4 INT(32), PRIMARY KEY (column_5))


statement ok
INSERT INTO table_1 (column_1, column_5, column_4, column_2, column_3) VALUES (1, 2, 1, 1, 1), (1, 3, 1, 1, 1), (1, 4, 1, 1, 1), (1, 5, 1, 1, 1), (1, 6, 1, 1, 1)


query  nosort
SELECT sum(table_1.column_1) AS alias_1 FROM table_1
----
5

query  nosort
SELECT table_1.column_1 AS alias_1 FROM table_1 WHERE (table_1.column_1 = ?)
? = 1
----
1
1
1
1
1

query  nosort
SELECT 1
----
1

query  nosort
SELECT sum(table_1.column_2) AS alias_1 FROM table_1 WHERE (table_1.column_2 = ?)
? = 1
----
5

query  nosort
SELECT sum(table_1.column_3) AS alias_1, 1 FROM table_1
----
5
1

query  nosort
SELECT 1 FROM table_1 WHERE (table_1.column_2 = ?)
? = 1
----
1
1
1
1
1

query  nosort
SELECT sum(table_1.column_4) AS alias_1, 1 FROM table_1 WHERE (table_1.column_2 = ?)
? = 1
----
5
1

statement ok
DELETE FROM table_1 WHERE (column_5 = 2)


statement ok
DELETE FROM table_1 WHERE (column_5 = 3)


query  nosort
SELECT sum(table_1.column_1) AS alias_1 FROM table_1
----
3

query  nosort
SELECT table_1.column_1 AS alias_1 FROM table_1 WHERE (table_1.column_1 = ?)
? = 1
----
1
1
1

query  nosort
SELECT 1
----
1

query  nosort
SELECT sum(table_1.column_2) AS alias_1 FROM table_1 WHERE (table_1.column_2 = ?)
? = 1
----
3

query  nosort
SELECT sum(table_1.column_3) AS alias_1, 1 FROM table_1
----
3
1

query  nosort
SELECT 1 FROM table_1 WHERE (table_1.column_2 = ?)
? = 1
----
1
1
1

query  nosort
SELECT sum(table_1.column_4) AS alias_1, 1 FROM table_1 WHERE (table_1.column_2 = ?)
? = 1
----
3
1
