# Generated by:
#     target/debug/noria-logictest generate --operations avg,group_concat,max --compare-to mysql://root@localhost/mysql --subquery-depth 1 --rows-per-table 5 -o logictests/generated/avg,group_concat,max.test --include-deletes
# failure: ENG-339

statement ok
CREATE TABLE table_1 (column_6 INT(32), column_7 INT(32), column_12 INT(32), column_13 INT(32), column_9 INT(32), column_10 INT(32), column_4 INT(32), column_3 INT(32), column_1 INT(32), column_2 TEXT, column_5 TEXT, column_8 TEXT, column_11 TEXT, PRIMARY KEY (column_13))


statement ok
INSERT INTO table_1 (column_8, column_12, column_4, column_7, column_6, column_9, column_3, column_1, column_5, column_10, column_13, column_2, column_11) VALUES ('a', 1, 1, 1, 1, 1, 1, 1, 'a', 1, 2, 'a', 'a'), ('a', 1, 1, 1, 1, 1, 1, 1, 'a', 1, 3, 'a', 'a'), ('a', 1, 1, 1, 1, 1, 1, 1, 'a', 1, 4, 'a', 'a'), ('a', 1, 1, 1, 1, 1, 1, 1, 'a', 1, 5, 'a', 'a'), ('a', 1, 1, 1, 1, 1, 1, 1, 'a', 1, 6, 'a', 'a')


query  nosort
SELECT avg(table_1.column_1) AS alias_1 FROM table_1
----
1.0000

query  nosort
SELECT group_concat(table_1.column_2 separator ', ') AS alias_1 FROM table_1
----
a, a, a, a, a

query  nosort
SELECT max(table_1.column_3) AS alias_1 FROM table_1
----
1

query  nosort
SELECT avg(table_1.column_4) AS alias_1, group_concat(table_1.column_5 separator ', ') AS alias_2 FROM table_1
----
1.0000
a, a, a, a, a

query  nosort
SELECT avg(table_1.column_6) AS alias_1, max(table_1.column_7) AS alias_2 FROM table_1
----
1.0000
1

query  nosort
SELECT group_concat(table_1.column_8 separator ', ') AS alias_1, max(table_1.column_9) AS alias_2 FROM table_1
----
a, a, a, a, a
1

query  nosort
SELECT avg(table_1.column_10) AS alias_1, group_concat(table_1.column_11 separator ', ') AS alias_2, max(table_1.column_12) AS alias_3 FROM table_1
----
1.0000
a, a, a, a, a
1

statement ok
DELETE FROM table_1 WHERE (column_13 = 2)


statement ok
DELETE FROM table_1 WHERE (column_13 = 3)


query  nosort
SELECT avg(table_1.column_1) AS alias_1 FROM table_1
----
1.0000

query  nosort
SELECT group_concat(table_1.column_2 separator ', ') AS alias_1 FROM table_1
----
a, a, a

query  nosort
SELECT max(table_1.column_3) AS alias_1 FROM table_1
----
1

query  nosort
SELECT avg(table_1.column_4) AS alias_1, group_concat(table_1.column_5 separator ', ') AS alias_2 FROM table_1
----
1.0000
a, a, a

query  nosort
SELECT avg(table_1.column_6) AS alias_1, max(table_1.column_7) AS alias_2 FROM table_1
----
1.0000
1

query  nosort
SELECT group_concat(table_1.column_8 separator ', ') AS alias_1, max(table_1.column_9) AS alias_2 FROM table_1
----
a, a, a
1

query  nosort
SELECT avg(table_1.column_10) AS alias_1, group_concat(table_1.column_11 separator ', ') AS alias_2, max(table_1.column_12) AS alias_3 FROM table_1
----
1.0000
a, a, a
1
