# Generated by:
#     target/debug/noria-logictest permute --compare-to mysql://root:noria@127.1/noria -d 3 -o logictests/generated/mysql/ --only range_param --random --include-deletes --rows-per-table 10 --subquery-depth 1 --overwrite-tests

statement ok
CREATE TABLE `table_1` (`column_3` INT, `column_2` INT, `column_9` INT, `column_7` INT, `column_6` INT, `column_1` INT, `column_5` INT, `column_8` INT, `column_4` INT, PRIMARY KEY (`column_9`))


statement ok
INSERT INTO `table_1` (`column_3`, `column_2`, `column_9`, `column_7`, `column_6`, `column_1`, `column_5`, `column_8`, `column_4`) VALUES (-30495821, -580850482, 0, 15821350, 1183068702, 1249806648, -1959818033, 1114274989, 55740457), (1512257533, 2121434508, 1, -517124819, 1064257433, 69730501, 256508273, 1544555653, -1518362236), (94780200, 1947704083, 2, 382676704, -1666203055, -976563938, 285969106, -692717502, 593267220), (-1955776533, 60816862, 3, 537169052, 2062140405, 762357347, -907102101, 1582034138, -1345193730), (-1160173933, -725433186, 4, -1629333232, 1055171419, 1281708193, -700726045, 228532356, -1537480290), (1834717281, -1510937512, 5, -2368019, 1571726973, -143850177, 1470374375, -1532588164, -1610128250), (-1560291340, -947056256, 6, 526133440, -1904461330, 393048256, -1119480686, 904283445, -113003152), (108078631, 4458328, 7, 959703715, -1228743493, 170419354, -5589822, -320292573, -588700383), (1782536757, 1445987231, 8, -1747011007, -1310895793, 323991923, 766185362, -709871581, -1764019654), (-1686009996, -851586260, 9, -1042629868, -619061000, -1311300671, -390310483, -1274926760, -1733715328)


query  rowsort
SELECT avg(`table_1`.`column_1`) AS `alias_1` FROM `table_1`
----
181934743.6000

query  rowsort
SELECT count(distinct `table_1`.`column_2`) AS `alias_1` FROM `table_1`
----
10

query  rowsort
SELECT `table_1`.`column_1` AS `alias_1` FROM `table_1` WHERE (`table_1`.`column_1` > ?)
? = 10
----
1249806648
1281708193
170419354
323991923
393048256
69730501
762357347

query  rowsort
SELECT avg(`table_1`.`column_3`) AS `alias_1`, count(distinct `table_1`.`column_4`) AS `alias_2` FROM `table_1`
----
-106037722.1000
10

query  rowsort
SELECT avg(`table_1`.`column_5`) AS `alias_1` FROM `table_1` WHERE (`table_1`.`column_3` > ?)
? = 10
----
554689458.8000

query  rowsort
SELECT count(distinct `table_1`.`column_6`) AS `alias_1` FROM `table_1` WHERE (`table_1`.`column_3` > ?)
? = 10
----
5

query  rowsort
SELECT avg(`table_1`.`column_7`) AS `alias_1`, count(distinct `table_1`.`column_8`) AS `alias_2` FROM `table_1` WHERE (`table_1`.`column_3` > ?)
? = 10
----
-184824685.2000
5

statement ok
DELETE FROM `table_1` WHERE (`column_9` = 0)


statement ok
DELETE FROM `table_1` WHERE (`column_9` = 1)


statement ok
DELETE FROM `table_1` WHERE (`column_9` = 2)


statement ok
DELETE FROM `table_1` WHERE (`column_9` = 3)


statement ok
DELETE FROM `table_1` WHERE (`column_9` = 4)


query  rowsort
SELECT avg(`table_1`.`column_1`) AS `alias_1` FROM `table_1`
----
-113538263.0000

query  rowsort
SELECT count(distinct `table_1`.`column_2`) AS `alias_1` FROM `table_1`
----
5

query  rowsort
SELECT `table_1`.`column_1` AS `alias_1` FROM `table_1` WHERE (`table_1`.`column_1` > ?)
? = 10
----
170419354
323991923
393048256

query  rowsort
SELECT avg(`table_1`.`column_3`) AS `alias_1`, count(distinct `table_1`.`column_4`) AS `alias_2` FROM `table_1`
----
95806266.6000
5

query  rowsort
SELECT avg(`table_1`.`column_5`) AS `alias_1` FROM `table_1` WHERE (`table_1`.`column_3` > ?)
? = 10
----
743656638.3333

query  rowsort
SELECT count(distinct `table_1`.`column_6`) AS `alias_1` FROM `table_1` WHERE (`table_1`.`column_3` > ?)
? = 10
----
3

query  rowsort
SELECT avg(`table_1`.`column_7`) AS `alias_1`, count(distinct `table_1`.`column_8`) AS `alias_2` FROM `table_1` WHERE (`table_1`.`column_3` > ?)
? = 10
----
-263225103.6667
3
