# Generated by:
#     target/debug/noria-logictest permute --compare-to mysql://root:noria@127.1/noria -d 3 -o logictests/generated/mysql/ --only range_param --random --include-deletes --rows-per-table 10 --subquery-depth 1 --overwrite-tests

statement ok
CREATE TABLE `table_1` (`column_9` INT, `column_6` INT, `column_1` INT, `column_3` INT, `column_4` INT, `column_2` INT, `column_8` INT, `column_7` INT, `column_5` INT, PRIMARY KEY (`column_9`))


statement ok
INSERT INTO `table_1` (`column_9`, `column_6`, `column_1`, `column_3`, `column_4`, `column_2`, `column_8`, `column_7`, `column_5`) VALUES (0, 1182198956, -1896813062, -1233390769, 2068810651, 1548780674, -101895589, -789324274, 1980308216), (1, -1374777205, -433796982, -588699041, 611345385, -491982885, 189655283, -1109930179, 1027339805), (2, -1700301439, 387392662, -74565991, 1744020930, 493950702, -1982359302, -1126434575, -425053003), (3, -1554193558, -937759475, -96492962, -972536782, 730268574, 1435800295, 857981093, -722277886), (4, 161934048, -1201052709, -419361416, -1211818546, -192511564, -1054143777, -1644059935, -1397128842), (5, -213858909, -983819806, 597549402, -228673796, -1732975156, 990911387, -1888601207, -1942607179), (6, -1408502594, 1301144167, -1042070708, 528257534, 528570166, -1757882347, -779177355, 644934825), (7, -35833761, -1219143519, -1495180690, 1469851004, -52772096, -567781213, 1498891372, 1750691565), (8, -691948931, -1559681975, 1883299680, -1201402103, -1159904931, -1896846406, 792764568, 611465293), (9, -138303012, -409985175, -1795955872, 1636627762, 496995827, -1680939853, 653401288, 1899179716)


query  rowsort
SELECT avg(`table_1`.`column_1`) AS `alias_1` FROM `table_1`
----
-695351587.4000

query  rowsort
SELECT count(`table_1`.`column_2`) AS `alias_1` FROM `table_1`
----
10

query  rowsort
SELECT `table_1`.`column_2` AS `alias_1` FROM `table_1` WHERE (`table_1`.`column_2` > ?)
? = 10
----
1548780674
493950702
496995827
528570166
730268574

query  rowsort
SELECT avg(`table_1`.`column_3`) AS `alias_1`, count(`table_1`.`column_4`) AS `alias_2` FROM `table_1`
----
-426486836.7000
10

query  rowsort
SELECT avg(`table_1`.`column_5`) AS `alias_1` FROM `table_1` WHERE (`table_1`.`column_3` > ?)
? = 10
----
-665570943.0000

query  rowsort
SELECT count(`table_1`.`column_6`) AS `alias_1` FROM `table_1` WHERE (`table_1`.`column_3` > ?)
? = 10
----
2

query  rowsort
SELECT avg(`table_1`.`column_7`) AS `alias_1`, count(`table_1`.`column_8`) AS `alias_2` FROM `table_1` WHERE (`table_1`.`column_6` > ?)
? = 10
----
-1216692104.5000
2

statement ok
DELETE FROM `table_1` WHERE (`column_9` = 0)


statement ok
DELETE FROM `table_1` WHERE (`column_9` = 1)


statement ok
DELETE FROM `table_1` WHERE (`column_9` = 2)


statement ok
DELETE FROM `table_1` WHERE (`column_9` = 3)


statement ok
DELETE FROM `table_1` WHERE (`column_9` = 4)


query  rowsort
SELECT avg(`table_1`.`column_1`) AS `alias_1` FROM `table_1`
----
-574297261.6000

query  rowsort
SELECT count(`table_1`.`column_2`) AS `alias_1` FROM `table_1`
----
5

query  rowsort
SELECT `table_1`.`column_2` AS `alias_1` FROM `table_1` WHERE (`table_1`.`column_2` > ?)
? = 10
----
496995827
528570166

query  rowsort
SELECT avg(`table_1`.`column_3`) AS `alias_1`, count(`table_1`.`column_4`) AS `alias_2` FROM `table_1`
----
-370471637.6000
5

query  rowsort
SELECT avg(`table_1`.`column_5`) AS `alias_1` FROM `table_1` WHERE (`table_1`.`column_3` > ?)
? = 10
----
-665570943.0000

query  rowsort
SELECT count(`table_1`.`column_6`) AS `alias_1` FROM `table_1` WHERE (`table_1`.`column_3` > ?)
? = 10
----
2

query  rowsort
SELECT avg(`table_1`.`column_7`) AS `alias_1`, count(`table_1`.`column_8`) AS `alias_2` FROM `table_1` WHERE (`table_1`.`column_6` > ?)
? = 10
----
NULL
0
