# Generated by:
#     target/debug/noria-logictest permute --compare-to mysql://root:noria@127.1/noria -d 3 -o logictests/generated/mysql/ --only range_param --random --include-deletes --rows-per-table 10 --subquery-depth 1 --overwrite-tests

statement ok
CREATE TABLE `table_1` (`column_3` INT, `column_2` INT, `column_9` INT, `column_1` INT, `column_8` INT, `column_7` INT, `column_5` INT, `column_4` INT, `column_6` INT, PRIMARY KEY (`column_9`))


statement ok
INSERT INTO `table_1` (`column_3`, `column_2`, `column_9`, `column_1`, `column_8`, `column_7`, `column_5`, `column_4`, `column_6`) VALUES (1675124968, -1270064766, 0, -2039747693, 1030222040, 613668468, -1524797230, -1872858361, -1604328983), (-1259639467, -1198085173, 1, -1490978263, -272836336, -1131595665, 1153566885, 226468959, 529546154), (446950067, 910705783, 2, 1904774700, -2146156536, -319970834, 565299790, -241494199, 1491315076), (-1422578424, 103801052, 3, -1000040085, 262686203, -1173636542, 28870555, -1334955696, -827380702), (1305838959, 771012813, 4, -1957149579, 1958328988, -952240997, -736850995, -1693192294, 1644796129), (-537386753, 728451929, 5, -88093850, 992540187, 212360404, 355550512, -700973131, -1081104341), (-601458501, -129631544, 6, -1180650430, 2088688057, -1123218004, -102975040, -364587795, -1742993070), (197258847, -2078959612, 7, 2007155766, 1272750153, 158579014, 773778617, 1681452791, 1450546974), (-669034992, 635152335, 8, -2119027815, 1442561222, -2059998242, 358773965, -546214308, 1104929316), (1735676376, 467920061, 9, -1033061407, 1598434823, -55174644, -419779608, -27689683, -1692029951)


query  rowsort
SELECT count(distinct `table_1`.`column_1`) AS `alias_1` FROM `table_1`
----
10

query  rowsort
SELECT count(`table_1`.`column_2`) AS `alias_1` FROM `table_1`
----
10

query  rowsort
SELECT `table_1`.`column_1` AS `alias_1` FROM `table_1` WHERE (`table_1`.`column_1` > ?)
? = 10
----
1904774700
2007155766

query  rowsort
SELECT count(distinct `table_1`.`column_3`) AS `alias_1`, count(`table_1`.`column_4`) AS `alias_2` FROM `table_1`
----
10
10

query  rowsort
SELECT count(distinct `table_1`.`column_5`) AS `alias_1` FROM `table_1` WHERE (`table_1`.`column_3` > ?)
? = 10
----
5

query  rowsort
SELECT count(`table_1`.`column_6`) AS `alias_1` FROM `table_1` WHERE (`table_1`.`column_3` > ?)
? = 10
----
5

query  rowsort
SELECT count(distinct `table_1`.`column_7`) AS `alias_1`, count(`table_1`.`column_8`) AS `alias_2` FROM `table_1` WHERE (`table_1`.`column_3` > ?)
? = 10
----
5
5

statement ok
DELETE FROM `table_1` WHERE (`column_9` = 0)


statement ok
DELETE FROM `table_1` WHERE (`column_9` = 1)


statement ok
DELETE FROM `table_1` WHERE (`column_9` = 2)


statement ok
DELETE FROM `table_1` WHERE (`column_9` = 3)


statement ok
DELETE FROM `table_1` WHERE (`column_9` = 4)


query  rowsort
SELECT count(distinct `table_1`.`column_1`) AS `alias_1` FROM `table_1`
----
5

query  rowsort
SELECT count(`table_1`.`column_2`) AS `alias_1` FROM `table_1`
----
5

query  rowsort
SELECT `table_1`.`column_1` AS `alias_1` FROM `table_1` WHERE (`table_1`.`column_1` > ?)
? = 10
----
2007155766

query  rowsort
SELECT count(distinct `table_1`.`column_3`) AS `alias_1`, count(`table_1`.`column_4`) AS `alias_2` FROM `table_1`
----
5
5

query  rowsort
SELECT count(distinct `table_1`.`column_5`) AS `alias_1` FROM `table_1` WHERE (`table_1`.`column_3` > ?)
? = 10
----
2

query  rowsort
SELECT count(`table_1`.`column_6`) AS `alias_1` FROM `table_1` WHERE (`table_1`.`column_3` > ?)
? = 10
----
2

query  rowsort
SELECT count(distinct `table_1`.`column_7`) AS `alias_1`, count(`table_1`.`column_8`) AS `alias_2` FROM `table_1` WHERE (`table_1`.`column_3` > ?)
? = 10
----
2
2
