# Generated by:
#     target/debug/noria-logictest permute --compare-to mysql://root:noria@127.1/noria -d 3 -o logictests/generated/mysql/ --only range_param --random --include-deletes --rows-per-table 10 --subquery-depth 1 --overwrite-tests

statement ok
CREATE TABLE `table_1` (`column_3` INT, `column_4` INT, `column_6` INT, `column_7` INT, `column_1` INT, `column_9` INT, `column_2` INT, `column_5` INT, `column_8` INT, PRIMARY KEY (`column_9`))


statement ok
INSERT INTO `table_1` (`column_3`, `column_4`, `column_6`, `column_7`, `column_1`, `column_9`, `column_2`, `column_5`, `column_8`) VALUES (-457026595, -1174421936, -1984043468, 2118021360, -1766218808, 0, 1938251465, -1742832927, -2086371309), (1848398022, 803621929, -1192799163, 357849215, -1255789257, 1, -955307123, -164988169, -1162959263), (22326471, 1171824991, -1352157726, -1208927227, -1989619594, 2, 59841264, -1771702041, -681474685), (-1377263435, -1171511484, 1639167312, 1130876478, 1652332413, 3, -1256367466, -437703477, -1105397848), (1149758397, -1132630496, -1664980488, 626950634, 669878026, 4, 521957865, 61721001, -250090617), (-991921141, 1716927619, 1028856975, -2067349215, 1604794680, 5, -828542955, -343184180, -1162487773), (2130344837, 2112698080, -360798564, 693925137, 753862693, 6, -1089753614, -691906775, -1404319989), (1141794165, -712251743, -503172576, 1240355200, -304259558, 7, -360907904, -2082404066, 94484292), (-795814610, 1186165553, -1860439355, 497075323, -721720914, 8, 2096215082, -1967823488, -1480011939), (776158527, 964577086, 1237963376, 2067447478, 427228241, 9, 1013007376, 1004258976, -2093028197)


query  rowsort
SELECT count(`table_1`.`column_1`) AS `alias_1` FROM `table_1`
----
10

query  rowsort
SELECT avg(`table_1`.`column_2`) AS `alias_1` FROM `table_1`
----
113839399.0000

query  rowsort
SELECT `table_1`.`column_2` AS `alias_1` FROM `table_1` WHERE (`table_1`.`column_2` > ?)
? = 10
----
1013007376
1938251465
2096215082
521957865
59841264

query  rowsort
SELECT count(`table_1`.`column_3`) AS `alias_1`, avg(`table_1`.`column_4`) AS `alias_2` FROM `table_1`
----
10
376499959.9000

query  rowsort
SELECT count(`table_1`.`column_5`) AS `alias_1` FROM `table_1` WHERE (`table_1`.`column_3` > ?)
? = 10
----
6

query  rowsort
SELECT avg(`table_1`.`column_6`) AS `alias_1` FROM `table_1` WHERE (`table_1`.`column_3` > ?)
? = 10
----
-639324190.1667

query  rowsort
SELECT count(`table_1`.`column_7`) AS `alias_1`, avg(`table_1`.`column_8`) AS `alias_2` FROM `table_1` WHERE (`table_1`.`column_3` > ?)
? = 10
----
6
-916231409.8333

statement ok
DELETE FROM `table_1` WHERE (`column_9` = 0)


statement ok
DELETE FROM `table_1` WHERE (`column_9` = 1)


statement ok
DELETE FROM `table_1` WHERE (`column_9` = 2)


statement ok
DELETE FROM `table_1` WHERE (`column_9` = 3)


statement ok
DELETE FROM `table_1` WHERE (`column_9` = 4)


query  rowsort
SELECT count(`table_1`.`column_1`) AS `alias_1` FROM `table_1`
----
5

query  rowsort
SELECT avg(`table_1`.`column_2`) AS `alias_1` FROM `table_1`
----
166003597.0000

query  rowsort
SELECT `table_1`.`column_2` AS `alias_1` FROM `table_1` WHERE (`table_1`.`column_2` > ?)
? = 10
----
1013007376
2096215082

query  rowsort
SELECT count(`table_1`.`column_3`) AS `alias_1`, avg(`table_1`.`column_4`) AS `alias_2` FROM `table_1`
----
5
1053623319.0000

query  rowsort
SELECT count(`table_1`.`column_5`) AS `alias_1` FROM `table_1` WHERE (`table_1`.`column_3` > ?)
? = 10
----
3

query  rowsort
SELECT avg(`table_1`.`column_6`) AS `alias_1` FROM `table_1` WHERE (`table_1`.`column_3` > ?)
? = 10
----
124664078.6667

query  rowsort
SELECT count(`table_1`.`column_7`) AS `alias_1`, avg(`table_1`.`column_8`) AS `alias_2` FROM `table_1` WHERE (`table_1`.`column_3` > ?)
? = 10
----
3
-1134287964.6667
