# Generated by:
#     target/debug/noria-logictest permute --compare-to mysql://root:noria@127.1/noria -d 3 -o logictests/generated/mysql/ --only range_param --random --include-deletes --rows-per-table 10 --subquery-depth 1

statement ok
CREATE TABLE `table_1` (`column_10` INT, `column_8` INT, `column_2` INT, `column_6` INT, `column_11` INT, `column_12` INT, `column_1` INT, `column_3` INT, `column_4` INT, `column_7` INT, `column_9` INT, `column_5` INT, `column_13` INT, PRIMARY KEY (`column_13`))


statement ok
INSERT INTO `table_1` (`column_10`, `column_8`, `column_2`, `column_6`, `column_11`, `column_12`, `column_1`, `column_3`, `column_4`, `column_7`, `column_9`, `column_5`, `column_13`) VALUES (-1775647328, 1652981519, 1707830675, 313948513, 1232565788, -1844502833, -355380104, 699518185, -1381379264, 1429555557, 1345987272, -1669427033, 0), (-1020869968, 1615276194, 168108849, -1868726688, 505265644, 692040273, -1177792212, 2075689410, 355754764, -1394289417, 1587121145, -1918905987, 1), (-1289378835, -299085201, -213256462, -347377104, -1506628171, 447467448, 1871649972, -521359421, -629396822, 1967205972, 434965724, 1111322289, 2), (-251002391, 1765658595, -1150079838, 1632960169, -1634202031, -126948268, 1486514595, -323850412, 1292776057, -209707650, -60158903, 215178907, 3), (-883408188, 681742188, -82368089, -1432129075, 1824305469, -1682370445, -123056187, 1598095438, 1914586564, -786380228, -1440085423, -464972783, 4), (-256060954, 964275497, 22736483, 787340094, -820480632, -92813619, -1904758182, -338206060, 2024590198, 1779464830, 409539344, -584886248, 5), (1368834629, -1458845704, -985856257, 2007082440, 389456735, -153133817, -1191552874, 1336381298, -92894999, 1043949455, 2086251484, -1606219387, 6), (2076421448, 1899827468, 1359448837, -1407836872, 498297043, 1434302841, 1600111026, 82780804, 758462909, -1612403663, 169306361, 1970048290, 7), (2096556494, -1842419566, -1733015955, 605713782, 2078160828, -591860398, 1190918257, -890663966, 909813048, 1035889406, 1989765016, 273361185, 8), (-792479505, 877102705, -1178016514, 1175803506, -501115922, -1080086794, 692940275, 1203188697, -2142487423, -210098072, -1393883258, 988217970, 9)


query  rowsort
WITH `alias_3` AS (SELECT min(`table_1`.`column_2`) AS `alias_2` FROM `table_1`) SELECT min(`table_1`.`column_1`) AS `alias_1` FROM `table_1` INNER JOIN `alias_3` ON (`table_1`.`column_1` = `alias_3`.`alias_2`)
----
NULL

query  rowsort
WITH `alias_3` AS (SELECT `table_1`.`column_1` AS `alias_2` FROM `table_1`) SELECT min(`table_1`.`column_3`) AS `alias_1` FROM `table_1` INNER JOIN `alias_3` ON (`table_1`.`column_1` = `alias_3`.`alias_2`)
----
-890663966

query  rowsort
WITH `alias_3` AS (SELECT min(`table_1`.`column_5`) AS `alias_2` FROM `table_1`) SELECT min(`table_1`.`column_4`) AS `alias_1` FROM `table_1` INNER JOIN `alias_3` ON (`table_1`.`column_1` = `alias_3`.`alias_2`)
----
NULL

query  rowsort
WITH `alias_2` AS (SELECT min(`table_1`.`column_6`) AS `alias_1` FROM `table_1`) SELECT `table_1`.`column_1` AS `alias_3` FROM `table_1` INNER JOIN `alias_2` ON (`table_1`.`column_1` = `alias_2`.`alias_1`) WHERE (`table_1`.`column_1` > ?)
? = 10
----


query  rowsort
WITH `alias_2` AS (SELECT `table_1`.`column_1` AS `alias_1` FROM `table_1`) SELECT `table_1`.`column_1` AS `alias_3` FROM `table_1` INNER JOIN `alias_2` ON (`table_1`.`column_1` = `alias_2`.`alias_1`) WHERE (`table_1`.`column_1` > ?)
? = 10
----
1190918257
1486514595
1600111026
1871649972
692940275

query  rowsort
WITH `alias_2` AS (SELECT min(`table_1`.`column_7`) AS `alias_1` FROM `table_1`) SELECT `table_1`.`column_1` AS `alias_3` FROM `table_1` INNER JOIN `alias_2` ON (`table_1`.`column_1` = `alias_2`.`alias_1`) WHERE (`table_1`.`column_1` > ?)
? = 10
----


query  rowsort
WITH `alias_3` AS (SELECT min(`table_1`.`column_9`) AS `alias_2` FROM `table_1`) SELECT min(`table_1`.`column_8`) AS `alias_1` FROM `table_1` INNER JOIN `alias_3` ON (`table_1`.`column_8` = `alias_3`.`alias_2`) WHERE (`table_1`.`column_8` > ?)
? = 10
----
NULL

query  rowsort
WITH `alias_3` AS (SELECT `table_1`.`column_10` AS `alias_2` FROM `table_1`) SELECT min(`table_1`.`column_10`) AS `alias_1` FROM `table_1` INNER JOIN `alias_3` ON (`table_1`.`column_10` = `alias_3`.`alias_2`) WHERE (`table_1`.`column_10` > ?)
? = 10
----
1368834629

query  rowsort
WITH `alias_3` AS (SELECT min(`table_1`.`column_12`) AS `alias_2` FROM `table_1`) SELECT min(`table_1`.`column_11`) AS `alias_1` FROM `table_1` INNER JOIN `alias_3` ON (`table_1`.`column_10` = `alias_3`.`alias_2`) WHERE (`table_1`.`column_10` > ?)
? = 10
----
NULL

statement ok
DELETE FROM `table_1` WHERE (`column_13` = 0)


statement ok
DELETE FROM `table_1` WHERE (`column_13` = 1)


statement ok
DELETE FROM `table_1` WHERE (`column_13` = 2)


statement ok
DELETE FROM `table_1` WHERE (`column_13` = 3)


statement ok
DELETE FROM `table_1` WHERE (`column_13` = 4)


query  rowsort
WITH `alias_3` AS (SELECT min(`table_1`.`column_2`) AS `alias_2` FROM `table_1`) SELECT min(`table_1`.`column_1`) AS `alias_1` FROM `table_1` INNER JOIN `alias_3` ON (`table_1`.`column_1` = `alias_3`.`alias_2`)
----
NULL

query  rowsort
WITH `alias_3` AS (SELECT `table_1`.`column_1` AS `alias_2` FROM `table_1`) SELECT min(`table_1`.`column_3`) AS `alias_1` FROM `table_1` INNER JOIN `alias_3` ON (`table_1`.`column_1` = `alias_3`.`alias_2`)
----
-890663966

query  rowsort
WITH `alias_3` AS (SELECT min(`table_1`.`column_5`) AS `alias_2` FROM `table_1`) SELECT min(`table_1`.`column_4`) AS `alias_1` FROM `table_1` INNER JOIN `alias_3` ON (`table_1`.`column_1` = `alias_3`.`alias_2`)
----
NULL

query  rowsort
WITH `alias_2` AS (SELECT min(`table_1`.`column_6`) AS `alias_1` FROM `table_1`) SELECT `table_1`.`column_1` AS `alias_3` FROM `table_1` INNER JOIN `alias_2` ON (`table_1`.`column_1` = `alias_2`.`alias_1`) WHERE (`table_1`.`column_1` > ?)
? = 10
----


query  rowsort
WITH `alias_2` AS (SELECT `table_1`.`column_1` AS `alias_1` FROM `table_1`) SELECT `table_1`.`column_1` AS `alias_3` FROM `table_1` INNER JOIN `alias_2` ON (`table_1`.`column_1` = `alias_2`.`alias_1`) WHERE (`table_1`.`column_1` > ?)
? = 10
----
1190918257
1600111026
692940275

query  rowsort
WITH `alias_2` AS (SELECT min(`table_1`.`column_7`) AS `alias_1` FROM `table_1`) SELECT `table_1`.`column_1` AS `alias_3` FROM `table_1` INNER JOIN `alias_2` ON (`table_1`.`column_1` = `alias_2`.`alias_1`) WHERE (`table_1`.`column_1` > ?)
? = 10
----


query  rowsort
WITH `alias_3` AS (SELECT min(`table_1`.`column_9`) AS `alias_2` FROM `table_1`) SELECT min(`table_1`.`column_8`) AS `alias_1` FROM `table_1` INNER JOIN `alias_3` ON (`table_1`.`column_8` = `alias_3`.`alias_2`) WHERE (`table_1`.`column_8` > ?)
? = 10
----
NULL

query  rowsort
WITH `alias_3` AS (SELECT `table_1`.`column_10` AS `alias_2` FROM `table_1`) SELECT min(`table_1`.`column_10`) AS `alias_1` FROM `table_1` INNER JOIN `alias_3` ON (`table_1`.`column_10` = `alias_3`.`alias_2`) WHERE (`table_1`.`column_10` > ?)
? = 10
----
1368834629

query  rowsort
WITH `alias_3` AS (SELECT min(`table_1`.`column_12`) AS `alias_2` FROM `table_1`) SELECT min(`table_1`.`column_11`) AS `alias_1` FROM `table_1` INNER JOIN `alias_3` ON (`table_1`.`column_10` = `alias_3`.`alias_2`) WHERE (`table_1`.`column_10` > ?)
? = 10
----
NULL
