# Generated by:
#     target/debug/noria-logictest permute --compare-to mysql://root:noria@127.1/noria -d 3 -o logictests/generated/mysql/ --only range_param --random --include-deletes --rows-per-table 10 --subquery-depth 1

statement ok
CREATE TABLE `table_1` (`column_1` INT, `column_2` INT, `column_5` INT, `column_3` INT, `column_4` INT, `column_6` INT, PRIMARY KEY (`column_6`))


statement ok
INSERT INTO `table_1` (`column_1`, `column_2`, `column_5`, `column_3`, `column_4`, `column_6`) VALUES (2, 567157365, -2089753523, 2, 1099021574, 0), (-2093074814, 1905052196, 1585516619, 1085757, -798244703, 1), (0, -1600701461, -1394627054, 0, -414545835, 2), (2041399803, 1980365731, 904408881, -944246708, 1859488004, 3), (1, -1944214247, 584726081, 1, -933367778, 4), (1081082778, 1444486159, -1513926593, 1023872188, 1615672232, 5), (2, -1066115105, -21009178, 2, -1645290771, 6), (946220787, 576372249, 513801793, 317026964, 1994163614, 7), (0, 1204142370, 1200273643, 0, -2116158190, 8), (170161696, 414847933, 308612234, 981087503, 1037993925, 9)


query  rowsort
SELECT `table_1`.`column_1` AS `alias_1` FROM `table_1` WHERE `table_1`.`column_1` IN (?, ?, ?)
? = 0
? = 1
? = 2
----
0
0
1
2
2

query  rowsort
SELECT max(`table_1`.`column_2`) AS `alias_1` FROM `table_1`
----
1980365731

query  rowsort
SELECT `table_1`.`column_1` AS `alias_1` FROM `table_1` WHERE (`table_1`.`column_1` > ?)
? = 10
----
1081082778
170161696
2041399803
946220787

query  rowsort
SELECT max(`table_1`.`column_3`) AS `alias_1` FROM `table_1` WHERE `table_1`.`column_1` IN (?, ?, ?)
? = 0
? = 1
? = 2
----
2

query  rowsort
SELECT `table_1`.`column_3` AS `alias_1` FROM `table_1` WHERE (`table_1`.`column_3` IN (?, ?, ?) AND (`table_1`.`column_3` > ?))
? = 0
? = 1
? = 2
? = 10
----


query  rowsort
SELECT max(`table_1`.`column_4`) AS `alias_1` FROM `table_1` WHERE (`table_1`.`column_1` > ?)
? = 10
----
1994163614

query  rowsort
SELECT max(`table_1`.`column_5`) AS `alias_1` FROM `table_1` WHERE (`table_1`.`column_1` IN (?, ?, ?) AND (`table_1`.`column_1` > ?))
? = 0
? = 1
? = 2
? = 10
----
NULL

statement ok
DELETE FROM `table_1` WHERE (`column_6` = 0)


statement ok
DELETE FROM `table_1` WHERE (`column_6` = 1)


statement ok
DELETE FROM `table_1` WHERE (`column_6` = 2)


statement ok
DELETE FROM `table_1` WHERE (`column_6` = 3)


statement ok
DELETE FROM `table_1` WHERE (`column_6` = 4)


query  rowsort
SELECT `table_1`.`column_1` AS `alias_1` FROM `table_1` WHERE `table_1`.`column_1` IN (?, ?, ?)
? = 0
? = 1
? = 2
----
0
2

query  rowsort
SELECT max(`table_1`.`column_2`) AS `alias_1` FROM `table_1`
----
1444486159

query  rowsort
SELECT `table_1`.`column_1` AS `alias_1` FROM `table_1` WHERE (`table_1`.`column_1` > ?)
? = 10
----
1081082778
170161696
946220787

query  rowsort
SELECT max(`table_1`.`column_3`) AS `alias_1` FROM `table_1` WHERE `table_1`.`column_1` IN (?, ?, ?)
? = 0
? = 1
? = 2
----
2

query  rowsort
SELECT `table_1`.`column_3` AS `alias_1` FROM `table_1` WHERE (`table_1`.`column_3` IN (?, ?, ?) AND (`table_1`.`column_3` > ?))
? = 0
? = 1
? = 2
? = 10
----


query  rowsort
SELECT max(`table_1`.`column_4`) AS `alias_1` FROM `table_1` WHERE (`table_1`.`column_1` > ?)
? = 10
----
1994163614

query  rowsort
SELECT max(`table_1`.`column_5`) AS `alias_1` FROM `table_1` WHERE (`table_1`.`column_1` IN (?, ?, ?) AND (`table_1`.`column_1` > ?))
? = 0
? = 1
? = 2
? = 10
----
NULL
