# Generated by:
#     target/debug/noria-logictest permute -d 3 -o logictests/generated/mysql --only in_parameter --compare-to mysql://root:noria@localhost/mysql --subquery-depth 1 --rows-per-table 5 --include-deletes --overwrite-tests

statement ok
CREATE TABLE table_6 (column_1 INT, column_2 INT, column_3 INT, PRIMARY KEY (column_3))


statement ok
CREATE TABLE table_8 (column_2 INT, column_1 INT, column_3 INT, PRIMARY KEY (column_3))


statement ok
CREATE TABLE table_1 (column_6 INT, column_5 INT, column_2 INT, column_1 INT, column_3 INT, column_4 INT, PRIMARY KEY (column_6))


statement ok
CREATE TABLE table_3 (column_3 INT, column_2 INT, column_1 INT, PRIMARY KEY (column_3))


statement ok
CREATE TABLE table_4 (column_3 INT, column_1 INT, column_2 INT, PRIMARY KEY (column_3))


statement ok
CREATE TABLE table_5 (column_5 INT, column_2 INT, column_1 INT, column_3 INT, column_4 INT, PRIMARY KEY (column_5))


statement ok
CREATE TABLE table_2 (column_1 INT, column_2 INT, column_3 INT, PRIMARY KEY (column_3))


statement ok
CREATE TABLE table_9 (column_2 INT, column_3 INT, column_1 INT, PRIMARY KEY (column_3))


statement ok
CREATE TABLE table_7 (column_2 INT, column_3 INT, column_5 INT, column_4 INT, column_1 INT, PRIMARY KEY (column_5))


statement ok
INSERT INTO table_6 (column_1, column_2, column_3) VALUES (1, 1, 0), (1, 1, 1), (1, 1, 2), (1, 1, 3), (1, 1, 4)


statement ok
INSERT INTO table_8 (column_2, column_1, column_3) VALUES (1, 1, 0), (1, 1, 1), (1, 1, 2), (1, 1, 3), (1, 1, 4)


statement ok
INSERT INTO table_1 (column_6, column_5, column_2, column_1, column_3, column_4) VALUES (0, 1, 0, 1, 1, 1), (1, 1, 1, 1, 1, 1), (2, 1, 1, 1, 1, 1), (3, 1, 1, 1, 1, 1), (4, 1, 2, 1, 1, 1)


statement ok
INSERT INTO table_3 (column_3, column_2, column_1) VALUES (0, 1, 1), (1, 1, 1), (2, 1, 1), (3, 1, 1), (4, 1, 1)


statement ok
INSERT INTO table_4 (column_3, column_1, column_2) VALUES (0, 1, 1), (1, 1, 1), (2, 1, 1), (3, 1, 1), (4, 1, 1)


statement ok
INSERT INTO table_5 (column_5, column_2, column_1, column_3, column_4) VALUES (0, 0, 1, 1, 1), (1, 1, 1, 1, 1), (2, 1, 1, 1, 1), (3, 1, 1, 1, 1), (4, 2, 1, 1, 1)


statement ok
INSERT INTO table_2 (column_1, column_2, column_3) VALUES (1, 1, 0), (1, 1, 1), (1, 1, 2), (1, 1, 3), (1, 1, 4)


statement ok
INSERT INTO table_9 (column_2, column_3, column_1) VALUES (1, 0, 1), (1, 1, 1), (1, 2, 1), (1, 3, 1), (1, 4, 1)


statement ok
INSERT INTO table_7 (column_2, column_3, column_5, column_4, column_1) VALUES (2, 1, 0, 1, 1), (1, 1, 1, 1, 1), (0, 1, 2, 1, 1), (1, 1, 3, 1, 1), (1, 1, 4, 1, 1)


query  rowsort
SELECT table_1.column_2 AS alias_1, table_2.column_2 AS alias_2 FROM table_1 INNER JOIN table_2 ON (table_1.column_1 = table_2.column_1)
----
50 values hashing to b5d2b8344086ac9e2c9fd233458e5e97

query  rowsort
SELECT table_1.column_3 AS alias_1, table_3.column_2 AS alias_2 FROM table_1 LEFT JOIN table_3 ON (table_1.column_2 = table_3.column_1)
----
34 values hashing to 72bba62bffd79ee7011a1c8102fad32b

query  rowsort
SELECT table_1.column_2 AS alias_1 FROM table_1 WHERE table_1.column_2 IN (?, ?, ?)
? = 0
? = 1
? = 2
----
0
1
1
1
2

query  rowsort
SELECT table_1.column_4 AS alias_1, table_4.column_2 AS alias_2, table_1.column_5 AS alias_3, table_5.column_2 AS alias_4 FROM table_1 INNER JOIN table_4 ON (table_1.column_2 = table_4.column_1) LEFT JOIN table_5 ON (table_1.column_2 = table_5.column_1)
----
300 values hashing to 50040f628fb6a2d430f1ffd25f1d7e8b

query  rowsort
SELECT table_5.column_3 AS alias_1, table_6.column_2 AS alias_2 FROM table_5 INNER JOIN table_6 ON (table_5.column_2 = table_6.column_1) WHERE table_5.column_2 IN (?, ?, ?)
? = 0
? = 1
? = 2
----
30 values hashing to 56a22a5394edccfc958048b005afa27b

query  rowsort
SELECT table_5.column_4 AS alias_1, table_7.column_2 AS alias_2 FROM table_5 LEFT JOIN table_7 ON (table_5.column_2 = table_7.column_1) WHERE table_5.column_2 IN (?, ?, ?)
? = 0
? = 1
? = 2
----
34 values hashing to 617099010eaf74e32bd1e66cb8b4dc48

query  rowsort
SELECT table_7.column_3 AS alias_1, table_8.column_2 AS alias_2, table_7.column_4 AS alias_3, table_9.column_2 AS alias_4 FROM table_7 INNER JOIN table_8 ON (table_7.column_2 = table_8.column_1) LEFT JOIN table_9 ON (table_7.column_2 = table_9.column_1) WHERE table_7.column_2 IN (?, ?, ?)
? = 0
? = 1
? = 2
----
300 values hashing to 757d4b070a8d87aff0a7807df73cca4e

statement ok
DELETE FROM table_6 WHERE (column_3 = 0)


statement ok
DELETE FROM table_6 WHERE (column_3 = 1)


statement ok
DELETE FROM table_8 WHERE (column_3 = 0)


statement ok
DELETE FROM table_8 WHERE (column_3 = 1)


statement ok
DELETE FROM table_1 WHERE (column_6 = 0)


statement ok
DELETE FROM table_1 WHERE (column_6 = 1)


statement ok
DELETE FROM table_3 WHERE (column_3 = 0)


statement ok
DELETE FROM table_3 WHERE (column_3 = 1)


statement ok
DELETE FROM table_4 WHERE (column_3 = 0)


statement ok
DELETE FROM table_4 WHERE (column_3 = 1)


statement ok
DELETE FROM table_5 WHERE (column_5 = 0)


statement ok
DELETE FROM table_5 WHERE (column_5 = 1)


statement ok
DELETE FROM table_2 WHERE (column_3 = 0)


statement ok
DELETE FROM table_2 WHERE (column_3 = 1)


statement ok
DELETE FROM table_9 WHERE (column_3 = 0)


statement ok
DELETE FROM table_9 WHERE (column_3 = 1)


statement ok
DELETE FROM table_7 WHERE (column_5 = 0)


statement ok
DELETE FROM table_7 WHERE (column_5 = 1)


query  rowsort
SELECT table_1.column_2 AS alias_1, table_2.column_2 AS alias_2 FROM table_1 INNER JOIN table_2 ON (table_1.column_1 = table_2.column_1)
----
1
1
1
1
1
1
1
1
1
1
1
1
2
1
2
1
2
1

query  rowsort
SELECT table_1.column_3 AS alias_1, table_3.column_2 AS alias_2 FROM table_1 LEFT JOIN table_3 ON (table_1.column_2 = table_3.column_1)
----
1
1
1
1
1
1
1
1
1
1
1
1
1
NULL

query  rowsort
SELECT table_1.column_2 AS alias_1 FROM table_1 WHERE table_1.column_2 IN (?, ?, ?)
? = 0
? = 1
? = 2
----
1
1
2

query  rowsort
SELECT table_1.column_4 AS alias_1, table_4.column_2 AS alias_2, table_1.column_5 AS alias_3, table_5.column_2 AS alias_4 FROM table_1 INNER JOIN table_4 ON (table_1.column_2 = table_4.column_1) LEFT JOIN table_5 ON (table_1.column_2 = table_5.column_1)
----
72 values hashing to ce8fa2ece23aad71d3fce8e42406fbc5

query  rowsort
SELECT table_5.column_3 AS alias_1, table_6.column_2 AS alias_2 FROM table_5 INNER JOIN table_6 ON (table_5.column_2 = table_6.column_1) WHERE table_5.column_2 IN (?, ?, ?)
? = 0
? = 1
? = 2
----
1
1
1
1
1
1
1
1
1
1
1
1

query  rowsort
SELECT table_5.column_4 AS alias_1, table_7.column_2 AS alias_2 FROM table_5 LEFT JOIN table_7 ON (table_5.column_2 = table_7.column_1) WHERE table_5.column_2 IN (?, ?, ?)
? = 0
? = 1
? = 2
----
1
0
1
0
1
1
1
1
1
1
1
1
1
NULL

query  rowsort
SELECT table_7.column_3 AS alias_1, table_8.column_2 AS alias_2, table_7.column_4 AS alias_3, table_9.column_2 AS alias_4 FROM table_7 INNER JOIN table_8 ON (table_7.column_2 = table_8.column_1) LEFT JOIN table_9 ON (table_7.column_2 = table_9.column_1) WHERE table_7.column_2 IN (?, ?, ?)
? = 0
? = 1
? = 2
----
72 values hashing to 6ace13b6ed6f29eba7a7f83db77398b3
