# Generated by:
#     target/debug/noria-logictest permute --compare-to mysql://root:noria@127.1/noria -d 3 -o logictests/generated/mysql/ --only range_param --random --include-deletes --rows-per-table 10 --subquery-depth 1

statement ok
CREATE TABLE `table_3` (`column_1` INT, `column_2` INT, `column_6` INT, `column_5` INT, `column_4` INT, `column_3` INT, PRIMARY KEY (`column_6`))


statement ok
CREATE TABLE `table_1` (`column_5` INT, `column_7` INT, `column_3` INT, `column_6` INT, `column_1` INT, `column_2` INT, `column_4` INT, PRIMARY KEY (`column_7`))


statement ok
CREATE TABLE `table_2` (`column_1` INT, `column_3` INT, `column_2` INT, PRIMARY KEY (`column_3`))


statement ok
CREATE TABLE `table_4` (`column_1` INT, `column_3` INT, `column_2` INT, PRIMARY KEY (`column_3`))


statement ok
CREATE TABLE `table_5` (`column_1` INT, `column_2` INT, `column_3` INT, PRIMARY KEY (`column_3`))


statement ok
INSERT INTO `table_3` (`column_1`, `column_2`, `column_6`, `column_5`, `column_4`, `column_3`) VALUES (-447474900, 1346079468, 0, 1483685907, -1704695523, 1223964656), (-312344143, -2078752629, 1, -356258969, 1425796125, 1723803092), (-817360755, 801958611, 2, -2077691423, 1866799871, 704352500), (-2041947186, 935324982, 3, 1682194465, 1845726401, 736251431), (2083153037, 551104389, 4, 1650878294, 1203795625, 339162804), (-376713455, 1320554588, 5, -224811174, 144887824, 67194627), (1141991299, -959505628, 6, -1627999556, 1039898963, -297869712), (2079496925, -274769354, 7, -1911222297, 866228190, -649804854), (613643526, 1035565472, 8, -1948230284, -92194431, 189100830), (720713591, 1963212202, 9, -73493105, -157080519, 2014320465)


statement ok
INSERT INTO `table_1` (`column_5`, `column_7`, `column_3`, `column_6`, `column_1`, `column_2`, `column_4`) VALUES (-911448237, 0, -237410553, 548278809, 1304758777, -635350169, 2046963057), (-1937733115, 1, -408879436, -1542397263, 470387775, 157140553, -490674540), (1258021119, 2, 231622800, -837945511, 1432426709, -2071202688, -1091647851), (199064018, 3, 983903420, 1971573029, -762850511, 416256951, 1282524261), (1857686687, 4, 1198262172, 1920436433, -691098442, -778024425, 1610107317), (-316865568, 5, -1190745833, 135554085, -534518084, -529688401, 152609838), (-1336546142, 6, 101319334, -1178279702, 1603142942, 1456184946, -1660101029), (982090909, 7, -1761933737, 600998814, 1683553604, -1524781847, 1013827681), (-646216791, 8, 2055018437, 1613582327, -952311145, -1876162875, 1046578258), (-971379175, 9, -1511276284, -159336441, 361618477, 2130664557, -422395439)


statement ok
INSERT INTO `table_2` (`column_1`, `column_3`, `column_2`) VALUES (330012431, 0, -1009467422), (-578283199, 1, 519582213), (-1464747554, 2, -664273267), (-820874175, 3, 1675639576), (2006840327, 4, -1243640260), (250132258, 5, -827711580), (-1545543344, 6, 1666591546), (225787644, 7, 292118436), (935331505, 8, 210860471), (781017125, 9, 987504579)


statement ok
INSERT INTO `table_4` (`column_1`, `column_3`, `column_2`) VALUES (1412436116, 0, 1700719015), (-1664625859, 1, -223311354), (382473415, 2, 1169744798), (-191604055, 3, 1260075971), (-262852419, 4, 1801947751), (1332475818, 5, 721649932), (2128002442, 6, 1711610337), (1433471922, 7, 1752997147), (1824657070, 8, -536519161), (-1081722545, 9, -672133253)


statement ok
INSERT INTO `table_5` (`column_1`, `column_2`, `column_3`) VALUES (1467661664, -999131387, 0), (-549043358, -152932055, 1), (89710181, 573158716, 2), (-1709389142, -1018228392, 3), (-977412514, 403867484, 4), (1895360122, 218472167, 5), (2069903651, -2055362390, 6), (-1501025576, 236107625, 7), (658077333, 2041348785, 8), (607892493, -1931744512, 9)


query  rowsort
SELECT `table_1`.`column_2` AS `alias_1`, `table_2`.`column_2` AS `alias_2` FROM `table_1` LEFT JOIN `table_2` ON (`table_1`.`column_1` = `table_2`.`column_1`)
----
-1524781847
NULL
-1876162875
NULL
-2071202688
NULL
-529688401
NULL
-635350169
NULL
-778024425
NULL
1456184946
NULL
157140553
NULL
2130664557
NULL
416256951
NULL

query  rowsort
SELECT min(`table_1`.`column_3`) AS `alias_1` FROM `table_1`
----
-1761933737

query  rowsort
SELECT `table_1`.`column_1` AS `alias_1` FROM `table_1` WHERE (`table_1`.`column_1` > ?)
? = 10
----
1304758777
1432426709
1603142942
1683553604
361618477
470387775

query  rowsort
SELECT `table_1`.`column_4` AS `alias_1`, `table_3`.`column_2` AS `alias_2`, min(`table_1`.`column_5`) AS `alias_3` FROM `table_1` LEFT JOIN `table_3` ON (`table_1`.`column_1` = `table_3`.`column_1`) GROUP BY `table_1`.`column_4`, `table_3`.`column_2`
----
30 values hashing to 95a3a1221cbfe433a2dfa936ed115431

query  rowsort
SELECT `table_1`.`column_6` AS `alias_1`, `table_4`.`column_2` AS `alias_2` FROM `table_1` LEFT JOIN `table_4` ON (`table_1`.`column_5` = `table_4`.`column_1`) WHERE (`table_1`.`column_5` > ?)
? = 10
----
-837945511
NULL
1920436433
NULL
1971573029
NULL
600998814
NULL

query  rowsort
SELECT min(`table_3`.`column_3`) AS `alias_1` FROM `table_3` WHERE (`table_3`.`column_1` > ?)
? = 10
----
-649804854

query  rowsort
SELECT `table_3`.`column_4` AS `alias_1`, `table_5`.`column_2` AS `alias_2`, min(`table_3`.`column_5`) AS `alias_3` FROM `table_3` LEFT JOIN `table_5` ON (`table_3`.`column_1` = `table_5`.`column_1`) WHERE (`table_3`.`column_1` > ?) GROUP BY `table_3`.`column_4`, `table_5`.`column_2`
? = 10
----
-157080519
NULL
-73493105
-92194431
NULL
-1948230284
1039898963
NULL
-1627999556
1203795625
NULL
1650878294
866228190
NULL
-1911222297

statement ok
DELETE FROM `table_3` WHERE (`column_6` = 0)


statement ok
DELETE FROM `table_3` WHERE (`column_6` = 1)


statement ok
DELETE FROM `table_3` WHERE (`column_6` = 2)


statement ok
DELETE FROM `table_3` WHERE (`column_6` = 3)


statement ok
DELETE FROM `table_3` WHERE (`column_6` = 4)


statement ok
DELETE FROM `table_1` WHERE (`column_7` = 0)


statement ok
DELETE FROM `table_1` WHERE (`column_7` = 1)


statement ok
DELETE FROM `table_1` WHERE (`column_7` = 2)


statement ok
DELETE FROM `table_1` WHERE (`column_7` = 3)


statement ok
DELETE FROM `table_1` WHERE (`column_7` = 4)


statement ok
DELETE FROM `table_2` WHERE (`column_3` = 0)


statement ok
DELETE FROM `table_2` WHERE (`column_3` = 1)


statement ok
DELETE FROM `table_2` WHERE (`column_3` = 2)


statement ok
DELETE FROM `table_2` WHERE (`column_3` = 3)


statement ok
DELETE FROM `table_2` WHERE (`column_3` = 4)


statement ok
DELETE FROM `table_4` WHERE (`column_3` = 0)


statement ok
DELETE FROM `table_4` WHERE (`column_3` = 1)


statement ok
DELETE FROM `table_4` WHERE (`column_3` = 2)


statement ok
DELETE FROM `table_4` WHERE (`column_3` = 3)


statement ok
DELETE FROM `table_4` WHERE (`column_3` = 4)


statement ok
DELETE FROM `table_5` WHERE (`column_3` = 0)


statement ok
DELETE FROM `table_5` WHERE (`column_3` = 1)


statement ok
DELETE FROM `table_5` WHERE (`column_3` = 2)


statement ok
DELETE FROM `table_5` WHERE (`column_3` = 3)


statement ok
DELETE FROM `table_5` WHERE (`column_3` = 4)


query  rowsort
SELECT `table_1`.`column_2` AS `alias_1`, `table_2`.`column_2` AS `alias_2` FROM `table_1` LEFT JOIN `table_2` ON (`table_1`.`column_1` = `table_2`.`column_1`)
----
-1524781847
NULL
-1876162875
NULL
-529688401
NULL
1456184946
NULL
2130664557
NULL

query  rowsort
SELECT min(`table_1`.`column_3`) AS `alias_1` FROM `table_1`
----
-1761933737

query  rowsort
SELECT `table_1`.`column_1` AS `alias_1` FROM `table_1` WHERE (`table_1`.`column_1` > ?)
? = 10
----
1603142942
1683553604
361618477

query  rowsort
SELECT `table_1`.`column_4` AS `alias_1`, `table_3`.`column_2` AS `alias_2`, min(`table_1`.`column_5`) AS `alias_3` FROM `table_1` LEFT JOIN `table_3` ON (`table_1`.`column_1` = `table_3`.`column_1`) GROUP BY `table_1`.`column_4`, `table_3`.`column_2`
----
-1660101029
NULL
-1336546142
-422395439
NULL
-971379175
1013827681
NULL
982090909
1046578258
NULL
-646216791
152609838
NULL
-316865568

query  rowsort
SELECT `table_1`.`column_6` AS `alias_1`, `table_4`.`column_2` AS `alias_2` FROM `table_1` LEFT JOIN `table_4` ON (`table_1`.`column_5` = `table_4`.`column_1`) WHERE (`table_1`.`column_5` > ?)
? = 10
----
600998814
NULL

query  rowsort
SELECT min(`table_3`.`column_3`) AS `alias_1` FROM `table_3` WHERE (`table_3`.`column_1` > ?)
? = 10
----
-649804854

query  rowsort
SELECT `table_3`.`column_4` AS `alias_1`, `table_5`.`column_2` AS `alias_2`, min(`table_3`.`column_5`) AS `alias_3` FROM `table_3` LEFT JOIN `table_5` ON (`table_3`.`column_1` = `table_5`.`column_1`) WHERE (`table_3`.`column_1` > ?) GROUP BY `table_3`.`column_4`, `table_5`.`column_2`
? = 10
----
-157080519
NULL
-73493105
-92194431
NULL
-1948230284
1039898963
NULL
-1627999556
866228190
NULL
-1911222297
