# Generated by:
#     target/debug/noria-logictest permute --compare-to mysql://root:noria@127.1/noria -d 3 -o logictests/generated/mysql/ --only range_param --random --include-deletes --rows-per-table 10 --subquery-depth 1 --overwrite-tests

statement ok
CREATE TABLE `table_1` (`column_8` INT, `column_7` INT, `column_5` INT, `column_2` INT, `column_4` INT, `column_3` INT, `column_1` INT, `column_6` INT, `column_9` INT, PRIMARY KEY (`column_9`))


statement ok
INSERT INTO `table_1` (`column_8`, `column_7`, `column_5`, `column_2`, `column_4`, `column_3`, `column_1`, `column_6`, `column_9`) VALUES (-1504746144, 1247953547, -131589524, -21999745, -594146238, -52027743, 366368426, -730641849, 0), (1698426865, 857243891, 1656061834, 439695, -203352740, -1960358274, -2005367982, -2099484896, 1), (1116784461, -1131044031, 1799929127, 782634018, -1686150072, -974135972, 1236150797, 213071464, 2), (-1748307679, 1319516271, 1222511618, 1552955964, -792630172, -1419915468, 2116406625, 1803517848, 3), (521233019, -658166415, -2138611147, 798626722, -694648112, -115838515, -828069365, -578730738, 4), (2131632490, 1985380618, 973788447, -1099209120, 695888069, 1234858258, -1496998812, -1685136606, 5), (1869070525, 1065312271, 304274009, 1259493457, -1977327718, 1718949755, 1980089580, -1427753473, 6), (475393722, 1385067456, -898044573, 403751541, 914195811, 3785763, 1323605567, -1980838224, 7), (956649001, 1146188864, -494363415, -1885277521, -573237573, 1561139813, 1658081514, -1461637067, 8), (1658481785, -534807122, 1223018636, 1337396844, 1897987975, 572082105, -1505443710, -1678257852, 9)


query  rowsort
SELECT min(`table_1`.`column_1`) AS `alias_1` FROM `table_1`
----
-2005367982

query  rowsort
SELECT sum(distinct `table_1`.`column_2`) AS `alias_1` FROM `table_1`
----
3128811855

query  rowsort
SELECT `table_1`.`column_1` AS `alias_1` FROM `table_1` WHERE (`table_1`.`column_1` > ?)
? = 10
----
1236150797
1323605567
1658081514
1980089580
2116406625
366368426

query  rowsort
SELECT min(`table_1`.`column_3`) AS `alias_1`, sum(distinct `table_1`.`column_4`) AS `alias_2` FROM `table_1`
----
-1960358274
-3013420770

query  rowsort
SELECT min(`table_1`.`column_5`) AS `alias_1` FROM `table_1` WHERE (`table_1`.`column_3` > ?)
? = 10
----
-898044573

query  rowsort
SELECT sum(distinct `table_1`.`column_6`) AS `alias_1` FROM `table_1` WHERE (`table_1`.`column_3` > ?)
? = 10
----
-8233623222

query  rowsort
SELECT min(`table_1`.`column_7`) AS `alias_1`, sum(distinct `table_1`.`column_8`) AS `alias_2` FROM `table_1` WHERE (`table_1`.`column_8` > ?)
? = 10
----
-1131044031
10427671868

statement ok
DELETE FROM `table_1` WHERE (`column_9` = 0)


statement ok
DELETE FROM `table_1` WHERE (`column_9` = 1)


statement ok
DELETE FROM `table_1` WHERE (`column_9` = 2)


statement ok
DELETE FROM `table_1` WHERE (`column_9` = 3)


statement ok
DELETE FROM `table_1` WHERE (`column_9` = 4)


query  rowsort
SELECT min(`table_1`.`column_1`) AS `alias_1` FROM `table_1`
----
-1505443710

query  rowsort
SELECT sum(distinct `table_1`.`column_2`) AS `alias_1` FROM `table_1`
----
16155201

query  rowsort
SELECT `table_1`.`column_1` AS `alias_1` FROM `table_1` WHERE (`table_1`.`column_1` > ?)
? = 10
----
1323605567
1658081514
1980089580

query  rowsort
SELECT min(`table_1`.`column_3`) AS `alias_1`, sum(distinct `table_1`.`column_4`) AS `alias_2` FROM `table_1`
----
3785763
957506564

query  rowsort
SELECT min(`table_1`.`column_5`) AS `alias_1` FROM `table_1` WHERE (`table_1`.`column_3` > ?)
? = 10
----
-898044573

query  rowsort
SELECT sum(distinct `table_1`.`column_6`) AS `alias_1` FROM `table_1` WHERE (`table_1`.`column_3` > ?)
? = 10
----
-8233623222

query  rowsort
SELECT min(`table_1`.`column_7`) AS `alias_1`, sum(distinct `table_1`.`column_8`) AS `alias_2` FROM `table_1` WHERE (`table_1`.`column_8` > ?)
? = 10
----
-534807122
7091227523
