# Generated by:
#     target/debug/noria-logictest permute --compare-to mysql://root:noria@127.1/noria -d 3 -o logictests/generated/mysql/ --only range_param --random --include-deletes --rows-per-table 10 --subquery-depth 1 --overwrite-tests

statement ok
CREATE TABLE `table_1` (`column_6` INT, `column_2` INT, `column_12` INT, `column_11` INT, `column_5` INT, `column_1` INT, `column_10` INT, `column_13` INT, `column_9` INT, `column_4` INT, `column_8` INT, `column_3` INT, `column_7` INT, PRIMARY KEY (`column_13`))


statement ok
INSERT INTO `table_1` (`column_6`, `column_2`, `column_12`, `column_11`, `column_5`, `column_1`, `column_10`, `column_13`, `column_9`, `column_4`, `column_8`, `column_3`, `column_7`) VALUES (1594303298, 1390345933, 863041920, 1340689332, -1989355529, 1826124716, -2127091291, 0, 1075801308, -1832977995, 2144736774, -1946032610, -322579076), (-1540977273, -18492232, 102743795, 714341073, 1870509958, 1570477625, 178829462, 1, 1302440442, 1734071648, -1298131754, 1939666134, 1898809071), (858703894, 1897961713, 1878034865, -1279902027, -176329486, -1596475791, -673762041, 2, 1745319463, 15716866, -1115599878, 633793274, 883308784), (1536456153, -1588575548, -1610919067, 1750936502, -1080028279, 1227223125, 394468498, 3, -1118176850, 674475434, 1153622783, -1633153448, 2114408053), (1917295624, 695942867, 2066361658, -1753813015, 149116299, 1538500218, 495277270, 4, 1039590411, 126360837, -1293584377, 2084141504, 663188169), (-840183831, -119327606, 707575843, -809991776, 312183174, -1339505762, -66865159, 5, -1050465824, -1998017135, 45139430, -1840291581, 1617147639), (-1098008972, -247122930, 2041214632, -1164618410, -1216156334, 207297417, 1277403142, 6, 1280677481, 75863906, 1733207647, -519977835, -1282267936), (1195877170, 160806959, -395194180, -753662652, -687349388, 920382736, 2008733670, 7, 1471781833, 1951479089, -2009807952, 1852725679, 1890393886), (414395384, 911967801, -71823441, 399368330, -159888923, 2107276626, -923236286, 8, 1279963823, 852883541, 1723905989, -1051700810, -1621676916), (-2103154589, -1193664137, 32674720, -747945440, 1528563870, 2069451794, -1763300345, 9, -1831699998, 587448410, 393191209, 1526190439, -274344475)


query  rowsort
SELECT min(`table_1`.`column_1`) AS `alias_1` FROM `table_1` INNER JOIN (SELECT min(`table_1`.`column_2`) AS `alias_2` FROM `table_1`) AS alias_3 ON (`table_1`.`column_1` = `alias_3`.`alias_2`)
----
NULL

query  rowsort
SELECT min(`table_1`.`column_3`) AS `alias_1` FROM `table_1` INNER JOIN (SELECT `table_1`.`column_1` AS `alias_2` FROM `table_1`) AS alias_3 ON (`table_1`.`column_1` = `alias_3`.`alias_2`)
----
-1946032610

query  rowsort
SELECT min(`table_1`.`column_4`) AS `alias_1` FROM `table_1` INNER JOIN (SELECT min(`table_1`.`column_5`) AS `alias_2` FROM `table_1`) AS alias_3 ON (`table_1`.`column_2` = `alias_3`.`alias_2`)
----
NULL

query  rowsort
SELECT `table_1`.`column_6` AS `alias_3` FROM `table_1` INNER JOIN (SELECT min(`table_1`.`column_6`) AS `alias_1` FROM `table_1`) AS alias_2 ON (`table_1`.`column_6` = `alias_2`.`alias_1`) WHERE (`table_1`.`column_2` > ?)
? = 10
----


query  rowsort
SELECT `table_1`.`column_6` AS `alias_3` FROM `table_1` INNER JOIN (SELECT `table_1`.`column_6` AS `alias_1` FROM `table_1`) AS alias_2 ON (`table_1`.`column_6` = `alias_2`.`alias_1`) WHERE (`table_1`.`column_6` > ?)
? = 10
----
1195877170
1536456153
1594303298
1917295624
414395384
858703894

query  rowsort
SELECT `table_1`.`column_6` AS `alias_3` FROM `table_1` INNER JOIN (SELECT min(`table_1`.`column_7`) AS `alias_1` FROM `table_1`) AS alias_2 ON (`table_1`.`column_6` = `alias_2`.`alias_1`) WHERE (`table_1`.`column_6` > ?)
? = 10
----


query  rowsort
SELECT min(`table_1`.`column_8`) AS `alias_1` FROM `table_1` INNER JOIN (SELECT min(`table_1`.`column_9`) AS `alias_2` FROM `table_1`) AS alias_3 ON (`table_1`.`column_6` = `alias_3`.`alias_2`) WHERE (`table_1`.`column_6` > ?)
? = 10
----
NULL

query  rowsort
SELECT min(`table_1`.`column_10`) AS `alias_1` FROM `table_1` INNER JOIN (SELECT `table_1`.`column_6` AS `alias_2` FROM `table_1`) AS alias_3 ON (`table_1`.`column_6` = `alias_3`.`alias_2`) WHERE (`table_1`.`column_6` > ?)
? = 10
----
-2127091291

query  rowsort
SELECT min(`table_1`.`column_11`) AS `alias_1` FROM `table_1` INNER JOIN (SELECT min(`table_1`.`column_12`) AS `alias_2` FROM `table_1`) AS alias_3 ON (`table_1`.`column_6` = `alias_3`.`alias_2`) WHERE (`table_1`.`column_6` > ?)
? = 10
----
NULL

statement ok
DELETE FROM `table_1` WHERE (`column_13` = 0)


statement ok
DELETE FROM `table_1` WHERE (`column_13` = 1)


statement ok
DELETE FROM `table_1` WHERE (`column_13` = 2)


statement ok
DELETE FROM `table_1` WHERE (`column_13` = 3)


statement ok
DELETE FROM `table_1` WHERE (`column_13` = 4)


query  rowsort
SELECT min(`table_1`.`column_1`) AS `alias_1` FROM `table_1` INNER JOIN (SELECT min(`table_1`.`column_2`) AS `alias_2` FROM `table_1`) AS alias_3 ON (`table_1`.`column_1` = `alias_3`.`alias_2`)
----
NULL

query  rowsort
SELECT min(`table_1`.`column_3`) AS `alias_1` FROM `table_1` INNER JOIN (SELECT `table_1`.`column_1` AS `alias_2` FROM `table_1`) AS alias_3 ON (`table_1`.`column_1` = `alias_3`.`alias_2`)
----
-1840291581

query  rowsort
SELECT min(`table_1`.`column_4`) AS `alias_1` FROM `table_1` INNER JOIN (SELECT min(`table_1`.`column_5`) AS `alias_2` FROM `table_1`) AS alias_3 ON (`table_1`.`column_2` = `alias_3`.`alias_2`)
----
NULL

query  rowsort
SELECT `table_1`.`column_6` AS `alias_3` FROM `table_1` INNER JOIN (SELECT min(`table_1`.`column_6`) AS `alias_1` FROM `table_1`) AS alias_2 ON (`table_1`.`column_6` = `alias_2`.`alias_1`) WHERE (`table_1`.`column_2` > ?)
? = 10
----


query  rowsort
SELECT `table_1`.`column_6` AS `alias_3` FROM `table_1` INNER JOIN (SELECT `table_1`.`column_6` AS `alias_1` FROM `table_1`) AS alias_2 ON (`table_1`.`column_6` = `alias_2`.`alias_1`) WHERE (`table_1`.`column_6` > ?)
? = 10
----
1195877170
414395384

query  rowsort
SELECT `table_1`.`column_6` AS `alias_3` FROM `table_1` INNER JOIN (SELECT min(`table_1`.`column_7`) AS `alias_1` FROM `table_1`) AS alias_2 ON (`table_1`.`column_6` = `alias_2`.`alias_1`) WHERE (`table_1`.`column_6` > ?)
? = 10
----


query  rowsort
SELECT min(`table_1`.`column_8`) AS `alias_1` FROM `table_1` INNER JOIN (SELECT min(`table_1`.`column_9`) AS `alias_2` FROM `table_1`) AS alias_3 ON (`table_1`.`column_6` = `alias_3`.`alias_2`) WHERE (`table_1`.`column_6` > ?)
? = 10
----
NULL

query  rowsort
SELECT min(`table_1`.`column_10`) AS `alias_1` FROM `table_1` INNER JOIN (SELECT `table_1`.`column_6` AS `alias_2` FROM `table_1`) AS alias_3 ON (`table_1`.`column_6` = `alias_3`.`alias_2`) WHERE (`table_1`.`column_6` > ?)
? = 10
----
-923236286

query  rowsort
SELECT min(`table_1`.`column_11`) AS `alias_1` FROM `table_1` INNER JOIN (SELECT min(`table_1`.`column_12`) AS `alias_2` FROM `table_1`) AS alias_3 ON (`table_1`.`column_6` = `alias_3`.`alias_2`) WHERE (`table_1`.`column_6` > ?)
? = 10
----
NULL
