# Generated by:
#     target/debug/noria-logictest permute --compare-to mysql://root:noria@127.1/noria -d 3 -o logictests/generated/mysql/ --only range_param --random --include-deletes --rows-per-table 10 --subquery-depth 1 --overwrite-tests

statement ok
CREATE TABLE `table_1` (`column_7` INT, `column_2` INT, `column_8` INT, `column_4` INT, `column_1` INT, `column_6` INT, `column_5` INT, `column_9` INT, `column_3` INT, PRIMARY KEY (`column_9`))


statement ok
INSERT INTO `table_1` (`column_7`, `column_2`, `column_8`, `column_4`, `column_1`, `column_6`, `column_5`, `column_9`, `column_3`) VALUES (-538001605, 2128984021, 911999217, 415560696, -1359448438, 1835355037, -419022919, 0, -2057164775), (-645696612, -585583137, -153248920, 812409804, 2099630518, -1952784421, 1539895793, 1, -1347138426), (-898017678, -318911903, 651119795, -447543491, -56409378, 736522321, 1028999988, 2, -618663420), (334232317, -1533205856, -457180544, 139870407, 1043358904, -1761700542, 262468594, 3, -327862908), (2135612312, -686036849, -180574498, 273519717, 1356091350, 1381945701, -873894046, 4, -1944392461), (-536395213, 743482230, 275606134, -1717643409, -1514893069, 1791713426, 867473712, 5, -2069812853), (-771904476, 429571420, 2033510399, 819824829, 1331861196, 576957543, 851119385, 6, 1210306545), (190304890, 931398986, 637126032, -1111352503, 1896629685, -2001423429, -2029067850, 7, -113578467), (-174749251, -2026549323, -1167764021, 1195508868, -1797078399, 625989431, -564407283, 8, 1442611979), (-316389357, 784707154, -812846627, 1897242080, -681074835, 551137116, 86350089, 9, -76962625)


query  rowsort
SELECT min(`table_1`.`column_1`) AS `alias_1` FROM `table_1`
----
-1797078399

query  rowsort
SELECT avg(`table_1`.`column_2`) AS `alias_1` FROM `table_1`
----
-13214325.7000

query  rowsort
SELECT `table_1`.`column_2` AS `alias_1` FROM `table_1` WHERE (`table_1`.`column_2` > ?)
? = 10
----
2128984021
429571420
743482230
784707154
931398986

query  rowsort
SELECT min(`table_1`.`column_3`) AS `alias_1`, avg(`table_1`.`column_4`) AS `alias_2` FROM `table_1`
----
-2069812853
227739699.8000

query  rowsort
SELECT min(`table_1`.`column_5`) AS `alias_1` FROM `table_1` WHERE (`table_1`.`column_3` > ?)
? = 10
----
-564407283

query  rowsort
SELECT avg(`table_1`.`column_6`) AS `alias_1` FROM `table_1` WHERE (`table_1`.`column_3` > ?)
? = 10
----
601473487.0000

query  rowsort
SELECT min(`table_1`.`column_7`) AS `alias_1`, avg(`table_1`.`column_8`) AS `alias_2` FROM `table_1` WHERE (`table_1`.`column_7` > ?)
? = 10
----
190304890
-209670.0000

statement ok
DELETE FROM `table_1` WHERE (`column_9` = 0)


statement ok
DELETE FROM `table_1` WHERE (`column_9` = 1)


statement ok
DELETE FROM `table_1` WHERE (`column_9` = 2)


statement ok
DELETE FROM `table_1` WHERE (`column_9` = 3)


statement ok
DELETE FROM `table_1` WHERE (`column_9` = 4)


query  rowsort
SELECT min(`table_1`.`column_1`) AS `alias_1` FROM `table_1`
----
-1797078399

query  rowsort
SELECT avg(`table_1`.`column_2`) AS `alias_1` FROM `table_1`
----
172522093.4000

query  rowsort
SELECT `table_1`.`column_2` AS `alias_1` FROM `table_1` WHERE (`table_1`.`column_2` > ?)
? = 10
----
429571420
743482230
784707154
931398986

query  rowsort
SELECT min(`table_1`.`column_3`) AS `alias_1`, avg(`table_1`.`column_4`) AS `alias_2` FROM `table_1`
----
-2069812853
216715973.0000

query  rowsort
SELECT min(`table_1`.`column_5`) AS `alias_1` FROM `table_1` WHERE (`table_1`.`column_3` > ?)
? = 10
----
-564407283

query  rowsort
SELECT avg(`table_1`.`column_6`) AS `alias_1` FROM `table_1` WHERE (`table_1`.`column_3` > ?)
? = 10
----
601473487.0000

query  rowsort
SELECT min(`table_1`.`column_7`) AS `alias_1`, avg(`table_1`.`column_8`) AS `alias_2` FROM `table_1` WHERE (`table_1`.`column_7` > ?)
? = 10
----
190304890
637126032.0000
