# Generated by:
#     target/debug/noria-logictest permute --compare-to mysql://root:noria@127.1/noria -d 3 -o logictests/generated/mysql/ --only range_param --random --include-deletes --rows-per-table 10 --subquery-depth 1

statement ok
CREATE TABLE `table_1` (`column_3` INT, `column_2` INT, `column_5` INT, `column_1` INT, `column_6` INT, `column_4` INT, PRIMARY KEY (`column_6`))


statement ok
INSERT INTO `table_1` (`column_3`, `column_2`, `column_5`, `column_1`, `column_6`, `column_4`) VALUES (-888481581, 374955581, -1940345106, -292377379, 0, 826408564), (75825805, -1602499376, -2078483291, 1152700129, 1, 349113534), (-409175313, -1703459138, -42190303, -459197456, 2, 354730831), (-903904502, 1836899482, -1194048120, 1091446642, 3, 1012137837), (1015798669, 501329425, -168608003, -186059250, 4, 878126603), (780122654, 1880955154, -1503493374, -2040437441, 5, -677751969), (-84575750, 279599343, 1438004434, 660264811, 6, -853757236), (2048227204, -38251097, -2033767418, -1943138206, 7, 1908931240), (-468120049, -642711769, 1482595734, -194995645, 8, -1713151692), (2147304119, -1892023224, 1755331385, -23618641, 9, -1880534284)


query  rowsort
SELECT `table_1`.`column_1` AS `alias_1` FROM `table_1` WHERE ((`table_1`.`column_1` > ?) AND (`table_1`.`column_1` > ?))
? = 10
? = 10
----
1091446642
1152700129
660264811

query  rowsort
SELECT count(`table_1`.`column_2`) AS `alias_1` FROM `table_1`
----
10

query  rowsort
SELECT `table_1`.`column_1` AS `alias_1` FROM `table_1` WHERE (`table_1`.`column_1` > ?)
? = 10
----
1091446642
1152700129
660264811

query  rowsort
SELECT count(`table_1`.`column_3`) AS `alias_1` FROM `table_1` WHERE ((`table_1`.`column_1` > ?) AND (`table_1`.`column_1` > ?))
? = 10
? = 10
----
3

query  rowsort
SELECT `table_1`.`column_1` AS `alias_1` FROM `table_1` WHERE (((`table_1`.`column_1` > ?) AND (`table_1`.`column_1` > ?)) AND (`table_1`.`column_1` > ?))
? = 10
? = 10
? = 10
----
1091446642
1152700129
660264811

query  rowsort
SELECT count(`table_1`.`column_4`) AS `alias_1` FROM `table_1` WHERE (`table_1`.`column_3` > ?)
? = 10
----
5

query  rowsort
SELECT count(`table_1`.`column_5`) AS `alias_1` FROM `table_1` WHERE (((`table_1`.`column_3` > ?) AND (`table_1`.`column_3` > ?)) AND (`table_1`.`column_3` > ?))
? = 10
? = 10
? = 10
----
5

statement ok
DELETE FROM `table_1` WHERE (`column_6` = 0)


statement ok
DELETE FROM `table_1` WHERE (`column_6` = 1)


statement ok
DELETE FROM `table_1` WHERE (`column_6` = 2)


statement ok
DELETE FROM `table_1` WHERE (`column_6` = 3)


statement ok
DELETE FROM `table_1` WHERE (`column_6` = 4)


query  rowsort
SELECT `table_1`.`column_1` AS `alias_1` FROM `table_1` WHERE ((`table_1`.`column_1` > ?) AND (`table_1`.`column_1` > ?))
? = 10
? = 10
----
660264811

query  rowsort
SELECT count(`table_1`.`column_2`) AS `alias_1` FROM `table_1`
----
5

query  rowsort
SELECT `table_1`.`column_1` AS `alias_1` FROM `table_1` WHERE (`table_1`.`column_1` > ?)
? = 10
----
660264811

query  rowsort
SELECT count(`table_1`.`column_3`) AS `alias_1` FROM `table_1` WHERE ((`table_1`.`column_1` > ?) AND (`table_1`.`column_1` > ?))
? = 10
? = 10
----
1

query  rowsort
SELECT `table_1`.`column_1` AS `alias_1` FROM `table_1` WHERE (((`table_1`.`column_1` > ?) AND (`table_1`.`column_1` > ?)) AND (`table_1`.`column_1` > ?))
? = 10
? = 10
? = 10
----
660264811

query  rowsort
SELECT count(`table_1`.`column_4`) AS `alias_1` FROM `table_1` WHERE (`table_1`.`column_3` > ?)
? = 10
----
3

query  rowsort
SELECT count(`table_1`.`column_5`) AS `alias_1` FROM `table_1` WHERE (((`table_1`.`column_3` > ?) AND (`table_1`.`column_3` > ?)) AND (`table_1`.`column_3` > ?))
? = 10
? = 10
? = 10
----
3
