# Generated by:
#     target/debug/noria-logictest permute --compare-to mysql://root:noria@127.1/noria -d 3 -o logictests/generated/mysql/ --only range_param --random --include-deletes --rows-per-table 10 --subquery-depth 1

statement ok
CREATE TABLE `table_1` (`column_2` INT, `column_1` INT, PRIMARY KEY (`column_2`))


statement ok
INSERT INTO `table_1` (`column_2`, `column_1`) VALUES (0, 1281651142), (1, 500604514), (2, -834321060), (3, -99879013), (4, -1447985350), (5, 941894549), (6, -1325424371), (7, 277664432), (8, -622020981), (9, 991550653)


query  rowsort
SELECT `table_1`.`column_1` AS `alias_1` FROM `table_1` WHERE (`table_1`.`column_1` > ?)
? = 10
----
1281651142
277664432
500604514
941894549
991550653

query  nosort
SELECT `table_1`.`column_1` AS `alias_1` FROM `table_1` ORDER BY `table_1`.`column_1` ASC LIMIT 10
----
-1447985350
-1325424371
-834321060
-622020981
-99879013
277664432
500604514
941894549
991550653
1281651142

query  nosort
SELECT `table_1`.`column_1` AS `alias_1` FROM `table_1` ORDER BY `table_1`.`column_1` DESC LIMIT 10
----
1281651142
991550653
941894549
500604514
277664432
-99879013
-622020981
-834321060
-1325424371
-1447985350

query  rowsort
SELECT `table_1`.`column_1` AS `alias_1` FROM `table_1` WHERE (`table_1`.`column_1` > ?)
? = 10
----
1281651142
277664432
500604514
941894549
991550653

query  nosort
SELECT `table_1`.`column_1` AS `alias_1` FROM `table_1` WHERE (`table_1`.`column_1` > ?) ORDER BY `table_1`.`column_1` ASC LIMIT 10
? = 10
----
277664432
500604514
941894549
991550653
1281651142

query  nosort
SELECT `table_1`.`column_1` AS `alias_1` FROM `table_1` WHERE (`table_1`.`column_1` > ?) ORDER BY `table_1`.`column_1` DESC LIMIT 10
? = 10
----
1281651142
991550653
941894549
500604514
277664432

query  rowsort
SELECT `table_1`.`column_1` AS `alias_1` FROM `table_1` WHERE ((`table_1`.`column_1` > ?) AND (`table_1`.`column_1` > ?))
? = 10
? = 10
----
1281651142
277664432
500604514
941894549
991550653

query  nosort
SELECT `table_1`.`column_1` AS `alias_1` FROM `table_1` ORDER BY `table_1`.`column_1` DESC LIMIT 10
----
1281651142
991550653
941894549
500604514
277664432
-99879013
-622020981
-834321060
-1325424371
-1447985350

query  nosort
SELECT `table_1`.`column_1` AS `alias_1` FROM `table_1` WHERE (`table_1`.`column_1` > ?) ORDER BY `table_1`.`column_1` ASC LIMIT 10
? = 10
----
277664432
500604514
941894549
991550653
1281651142

query  nosort
SELECT `table_1`.`column_1` AS `alias_1` FROM `table_1` WHERE (`table_1`.`column_1` > ?) ORDER BY `table_1`.`column_1` DESC LIMIT 10
? = 10
----
1281651142
991550653
941894549
500604514
277664432

query  nosort
SELECT `table_1`.`column_1` AS `alias_1` FROM `table_1` WHERE (`table_1`.`column_1` > ?) ORDER BY `table_1`.`column_1` DESC LIMIT 10
? = 10
----
1281651142
991550653
941894549
500604514
277664432

query  nosort
SELECT `table_1`.`column_1` AS `alias_1` FROM `table_1` WHERE ((`table_1`.`column_1` > ?) AND (`table_1`.`column_1` > ?)) ORDER BY `table_1`.`column_1` ASC LIMIT 10
? = 10
? = 10
----
277664432
500604514
941894549
991550653
1281651142

query  nosort
SELECT `table_1`.`column_1` AS `alias_1` FROM `table_1` WHERE ((`table_1`.`column_1` > ?) AND (`table_1`.`column_1` > ?)) ORDER BY `table_1`.`column_1` DESC LIMIT 10
? = 10
? = 10
----
1281651142
991550653
941894549
500604514
277664432

query  nosort
SELECT `table_1`.`column_1` AS `alias_1` FROM `table_1` WHERE (`table_1`.`column_1` > ?) ORDER BY `table_1`.`column_1` DESC LIMIT 10
? = 10
----
1281651142
991550653
941894549
500604514
277664432

query  nosort
SELECT `table_1`.`column_1` AS `alias_1` FROM `table_1` WHERE ((`table_1`.`column_1` > ?) AND (`table_1`.`column_1` > ?)) ORDER BY `table_1`.`column_1` DESC LIMIT 10
? = 10
? = 10
----
1281651142
991550653
941894549
500604514
277664432

statement ok
DELETE FROM `table_1` WHERE (`column_2` = 0)


statement ok
DELETE FROM `table_1` WHERE (`column_2` = 1)


statement ok
DELETE FROM `table_1` WHERE (`column_2` = 2)


statement ok
DELETE FROM `table_1` WHERE (`column_2` = 3)


statement ok
DELETE FROM `table_1` WHERE (`column_2` = 4)


query  rowsort
SELECT `table_1`.`column_1` AS `alias_1` FROM `table_1` WHERE (`table_1`.`column_1` > ?)
? = 10
----
277664432
941894549
991550653

query  nosort
SELECT `table_1`.`column_1` AS `alias_1` FROM `table_1` ORDER BY `table_1`.`column_1` ASC LIMIT 10
----
-1325424371
-622020981
277664432
941894549
991550653

query  nosort
SELECT `table_1`.`column_1` AS `alias_1` FROM `table_1` ORDER BY `table_1`.`column_1` DESC LIMIT 10
----
991550653
941894549
277664432
-622020981
-1325424371

query  rowsort
SELECT `table_1`.`column_1` AS `alias_1` FROM `table_1` WHERE (`table_1`.`column_1` > ?)
? = 10
----
277664432
941894549
991550653

query  nosort
SELECT `table_1`.`column_1` AS `alias_1` FROM `table_1` WHERE (`table_1`.`column_1` > ?) ORDER BY `table_1`.`column_1` ASC LIMIT 10
? = 10
----
277664432
941894549
991550653

query  nosort
SELECT `table_1`.`column_1` AS `alias_1` FROM `table_1` WHERE (`table_1`.`column_1` > ?) ORDER BY `table_1`.`column_1` DESC LIMIT 10
? = 10
----
991550653
941894549
277664432

query  rowsort
SELECT `table_1`.`column_1` AS `alias_1` FROM `table_1` WHERE ((`table_1`.`column_1` > ?) AND (`table_1`.`column_1` > ?))
? = 10
? = 10
----
277664432
941894549
991550653

query  nosort
SELECT `table_1`.`column_1` AS `alias_1` FROM `table_1` ORDER BY `table_1`.`column_1` DESC LIMIT 10
----
991550653
941894549
277664432
-622020981
-1325424371

query  nosort
SELECT `table_1`.`column_1` AS `alias_1` FROM `table_1` WHERE (`table_1`.`column_1` > ?) ORDER BY `table_1`.`column_1` ASC LIMIT 10
? = 10
----
277664432
941894549
991550653

query  nosort
SELECT `table_1`.`column_1` AS `alias_1` FROM `table_1` WHERE (`table_1`.`column_1` > ?) ORDER BY `table_1`.`column_1` DESC LIMIT 10
? = 10
----
991550653
941894549
277664432

query  nosort
SELECT `table_1`.`column_1` AS `alias_1` FROM `table_1` WHERE (`table_1`.`column_1` > ?) ORDER BY `table_1`.`column_1` DESC LIMIT 10
? = 10
----
991550653
941894549
277664432

query  nosort
SELECT `table_1`.`column_1` AS `alias_1` FROM `table_1` WHERE ((`table_1`.`column_1` > ?) AND (`table_1`.`column_1` > ?)) ORDER BY `table_1`.`column_1` ASC LIMIT 10
? = 10
? = 10
----
277664432
941894549
991550653

query  nosort
SELECT `table_1`.`column_1` AS `alias_1` FROM `table_1` WHERE ((`table_1`.`column_1` > ?) AND (`table_1`.`column_1` > ?)) ORDER BY `table_1`.`column_1` DESC LIMIT 10
? = 10
? = 10
----
991550653
941894549
277664432

query  nosort
SELECT `table_1`.`column_1` AS `alias_1` FROM `table_1` WHERE (`table_1`.`column_1` > ?) ORDER BY `table_1`.`column_1` DESC LIMIT 10
? = 10
----
991550653
941894549
277664432

query  nosort
SELECT `table_1`.`column_1` AS `alias_1` FROM `table_1` WHERE ((`table_1`.`column_1` > ?) AND (`table_1`.`column_1` > ?)) ORDER BY `table_1`.`column_1` DESC LIMIT 10
? = 10
? = 10
----
991550653
941894549
277664432
