# Generated by:
#     target/debug/noria-logictest permute --compare-to mysql://root:noria@127.1/noria -d 3 -o logictests/generated/mysql/ --only range_param --random --include-deletes --rows-per-table 10 --subquery-depth 1

statement ok
CREATE TABLE `table_1` (`column_4` INT, `column_1` INT, `column_6` INT, `column_2` INT, `column_5` INT, `column_3` INT, PRIMARY KEY (`column_6`))


statement ok
INSERT INTO `table_1` (`column_4`, `column_1`, `column_6`, `column_2`, `column_5`, `column_3`) VALUES (2129535431, 991941640, 0, 400745405, 1537916082, 1357437880), (-854950002, 1154884011, 1, 1554081964, -716387823, -848379956), (-219305773, 1363637467, 2, 2049139222, -2098621738, -1555387206), (1194191728, 1604942468, 3, -498087693, 460339515, 890596192), (-993699386, 244310100, 4, 574025204, -437135651, -1522569677), (1248332822, -2042676602, 5, -1212187252, -1847433767, 1552425049), (-1736164691, -875208913, 6, -1822548120, 632664188, -153518627), (495518574, -1771085777, 7, -116583573, -2058215415, 1327403020), (-1397372638, -1527243864, 8, 637151320, 701019400, 993969738), (-988379699, -1696662627, 9, 2072654419, 1843957045, 532773326)


query  rowsort
SELECT `table_1`.`column_1` AS `alias_1` FROM `table_1` WHERE (`table_1`.`column_1` > ?)
? = 10
----
1154884011
1363637467
1604942468
244310100
991941640

query  rowsort
SELECT max(`table_1`.`column_2`) AS `alias_1` FROM `table_1`
----
2072654419

query  rowsort
SELECT `table_1`.`column_1` AS `alias_1` FROM `table_1` WHERE (`table_1`.`column_1` > ?)
? = 10
----
1154884011
1363637467
1604942468
244310100
991941640

query  rowsort
SELECT max(`table_1`.`column_3`) AS `alias_1` FROM `table_1` WHERE (`table_1`.`column_1` > ?)
? = 10
----
1357437880

query  rowsort
SELECT `table_1`.`column_1` AS `alias_1` FROM `table_1` WHERE ((`table_1`.`column_1` > ?) AND (`table_1`.`column_1` > ?))
? = 10
? = 10
----
1154884011
1363637467
1604942468
244310100
991941640

query  rowsort
SELECT max(`table_1`.`column_4`) AS `alias_1` FROM `table_1` WHERE (`table_1`.`column_4` > ?)
? = 10
----
2129535431

query  rowsort
SELECT max(`table_1`.`column_5`) AS `alias_1` FROM `table_1` WHERE ((`table_1`.`column_4` > ?) AND (`table_1`.`column_4` > ?))
? = 10
? = 10
----
1537916082

statement ok
DELETE FROM `table_1` WHERE (`column_6` = 0)


statement ok
DELETE FROM `table_1` WHERE (`column_6` = 1)


statement ok
DELETE FROM `table_1` WHERE (`column_6` = 2)


statement ok
DELETE FROM `table_1` WHERE (`column_6` = 3)


statement ok
DELETE FROM `table_1` WHERE (`column_6` = 4)


query  rowsort
SELECT `table_1`.`column_1` AS `alias_1` FROM `table_1` WHERE (`table_1`.`column_1` > ?)
? = 10
----


query  rowsort
SELECT max(`table_1`.`column_2`) AS `alias_1` FROM `table_1`
----
2072654419

query  rowsort
SELECT `table_1`.`column_1` AS `alias_1` FROM `table_1` WHERE (`table_1`.`column_1` > ?)
? = 10
----


query  rowsort
SELECT max(`table_1`.`column_3`) AS `alias_1` FROM `table_1` WHERE (`table_1`.`column_1` > ?)
? = 10
----
NULL

query  rowsort
SELECT `table_1`.`column_1` AS `alias_1` FROM `table_1` WHERE ((`table_1`.`column_1` > ?) AND (`table_1`.`column_1` > ?))
? = 10
? = 10
----


query  rowsort
SELECT max(`table_1`.`column_4`) AS `alias_1` FROM `table_1` WHERE (`table_1`.`column_4` > ?)
? = 10
----
1248332822

query  rowsort
SELECT max(`table_1`.`column_5`) AS `alias_1` FROM `table_1` WHERE ((`table_1`.`column_4` > ?) AND (`table_1`.`column_4` > ?))
? = 10
? = 10
----
-1847433767
