# Generated by:
#     target/debug/noria-logictest permute --compare-to mysql://root:noria@127.1/noria -d 3 -o logictests/generated/mysql/ --only range_param --random --include-deletes --rows-per-table 10 --subquery-depth 1

statement ok
CREATE TABLE `table_1` (`column_1` INT, `column_2` INT, PRIMARY KEY (`column_2`))


statement ok
INSERT INTO `table_1` (`column_1`, `column_2`) VALUES (1571901932, 0), (1403577922, 1), (1033270937, 2), (1651104956, 3), (-1112658521, 4), (1520817680, 5), (1040718345, 6), (-1209374708, 7), (1585843050, 8), (-269007900, 9)


# REA-6472
query  rowsort error: ERROR\ HY000\ \(1105\):\ Error\ during\ RPC\ \(extend_recipe\):\ SQL\ SELECT\ query\ 'q_[a-f0-9]+'\ couldn't\ be\ added:\ Operation\ unsupported:\ Self\-joins\ using\ the\ same\ column\ are\ unsupported
SELECT `table_1`.`column_1` AS `alias_3` FROM `table_1` INNER JOIN (SELECT `table_1`.`column_1` AS `alias_1` FROM `table_1`) AS alias_2 ON (`table_1`.`column_1` = `alias_2`.`alias_1`) WHERE (`table_1`.`column_1` = ?)
? = 1
----


# REA-6472
query  rowsort error: ERROR\ HY000\ \(1105\):\ Error\ during\ RPC\ \(extend_recipe\):\ SQL\ SELECT\ query\ 'q_[a-f0-9]+'\ couldn't\ be\ added:\ Operation\ unsupported:\ Self\-joins\ using\ the\ same\ column\ are\ unsupported
SELECT `table_1`.`column_1` AS `alias_3` FROM `table_1` INNER JOIN (SELECT `table_1`.`column_1` AS `alias_1` FROM `table_1`) AS alias_2 ON (`table_1`.`column_1` = `alias_2`.`alias_1`) WHERE (`table_1`.`column_1` = ?)
? = 1
----


# REA-6472
query  rowsort error: ERROR\ HY000\ \(1105\):\ Error\ during\ RPC\ \(extend_recipe\):\ SQL\ SELECT\ query\ 'q_[a-f0-9]+'\ couldn't\ be\ added:\ Operation\ unsupported:\ Self\-joins\ using\ the\ same\ column\ are\ unsupported
SELECT `table_1`.`column_1` AS `alias_3` FROM `table_1` INNER JOIN (SELECT `table_1`.`column_1` AS `alias_1` FROM `table_1`) AS alias_2 ON (`table_1`.`column_1` = `alias_2`.`alias_1`) WHERE (`table_1`.`column_1` = ?)
? = 1
----


# REA-6472
query  rowsort error: ERROR\ HY000\ \(1105\):\ Error\ during\ RPC\ \(extend_recipe\):\ SQL\ SELECT\ query\ 'q_[a-f0-9]+'\ couldn't\ be\ added:\ Operation\ unsupported:\ Self\-joins\ using\ the\ same\ column\ are\ unsupported
SELECT `table_1`.`column_1` AS `alias_3` FROM `table_1` INNER JOIN (SELECT `table_1`.`column_1` AS `alias_1` FROM `table_1`) AS alias_2 ON (`table_1`.`column_1` = `alias_2`.`alias_1`) WHERE (`table_1`.`column_1` > ?)
? = 10
----
1033270937
1040718345
1403577922
1520817680
1571901932
1585843050
1651104956

# REA-6472
query  rowsort error: ERROR\ HY000\ \(1105\):\ Error\ during\ RPC\ \(extend_recipe\):\ SQL\ SELECT\ query\ 'q_[a-f0-9]+'\ couldn't\ be\ added:\ Operation\ unsupported:\ Self\-joins\ using\ the\ same\ column\ are\ unsupported
SELECT `table_1`.`column_1` AS `alias_3` FROM `table_1` INNER JOIN (SELECT `table_1`.`column_1` AS `alias_1` FROM `table_1`) AS alias_2 ON (`table_1`.`column_1` = `alias_2`.`alias_1`) WHERE (`table_1`.`column_1` > ?)
? = 10
----
1033270937
1040718345
1403577922
1520817680
1571901932
1585843050
1651104956

# REA-6472
query  rowsort error: ERROR\ HY000\ \(1105\):\ Error\ during\ RPC\ \(extend_recipe\):\ SQL\ SELECT\ query\ 'q_[a-f0-9]+'\ couldn't\ be\ added:\ Operation\ unsupported:\ Self\-joins\ using\ the\ same\ column\ are\ unsupported
SELECT `table_1`.`column_1` AS `alias_3` FROM `table_1` INNER JOIN (SELECT `table_1`.`column_1` AS `alias_1` FROM `table_1`) AS alias_2 ON (`table_1`.`column_1` = `alias_2`.`alias_1`) WHERE (`table_1`.`column_1` > ?)
? = 10
----
1033270937
1040718345
1403577922
1520817680
1571901932
1585843050
1651104956

# REA-6472
query  rowsort error: ERROR\ HY000\ \(1105\):\ Error\ during\ RPC\ \(extend_recipe\):\ SQL\ SELECT\ query\ 'q_[a-f0-9]+'\ couldn't\ be\ added:\ Operation\ unsupported:\ Self\-joins\ using\ the\ same\ column\ are\ unsupported
SELECT `table_1`.`column_1` AS `alias_3` FROM `table_1` INNER JOIN (SELECT `table_1`.`column_1` AS `alias_1` FROM `table_1`) AS alias_2 ON (`table_1`.`column_1` = `alias_2`.`alias_1`) WHERE ((`table_1`.`column_1` = ?) AND (`table_1`.`column_1` > ?))
? = 1
? = 10
----


# REA-6472
query  rowsort error: ERROR\ HY000\ \(1105\):\ Error\ during\ RPC\ \(extend_recipe\):\ SQL\ SELECT\ query\ 'q_[a-f0-9]+'\ couldn't\ be\ added:\ Operation\ unsupported:\ Self\-joins\ using\ the\ same\ column\ are\ unsupported
SELECT `table_1`.`column_1` AS `alias_3` FROM `table_1` INNER JOIN (SELECT `table_1`.`column_1` AS `alias_1` FROM `table_1`) AS alias_2 ON (`table_1`.`column_1` = `alias_2`.`alias_1`) WHERE ((`table_1`.`column_1` = ?) AND (`table_1`.`column_1` > ?))
? = 1
? = 10
----


# REA-6472
query  rowsort error: ERROR\ HY000\ \(1105\):\ Error\ during\ RPC\ \(extend_recipe\):\ SQL\ SELECT\ query\ 'q_[a-f0-9]+'\ couldn't\ be\ added:\ Operation\ unsupported:\ Self\-joins\ using\ the\ same\ column\ are\ unsupported
SELECT `table_1`.`column_1` AS `alias_3` FROM `table_1` INNER JOIN (SELECT `table_1`.`column_1` AS `alias_1` FROM `table_1`) AS alias_2 ON (`table_1`.`column_1` = `alias_2`.`alias_1`) WHERE ((`table_1`.`column_1` = ?) AND (`table_1`.`column_1` > ?))
? = 1
? = 10
----


statement ok
DELETE FROM `table_1` WHERE (`column_2` = 0)


statement ok
DELETE FROM `table_1` WHERE (`column_2` = 1)


statement ok
DELETE FROM `table_1` WHERE (`column_2` = 2)


statement ok
DELETE FROM `table_1` WHERE (`column_2` = 3)


statement ok
DELETE FROM `table_1` WHERE (`column_2` = 4)


# REA-6472
query  rowsort error: ERROR\ HY000\ \(1105\):\ Error\ during\ RPC\ \(extend_recipe\):\ SQL\ SELECT\ query\ 'q_[a-f0-9]+'\ couldn't\ be\ added:\ Operation\ unsupported:\ Self\-joins\ using\ the\ same\ column\ are\ unsupported
SELECT `table_1`.`column_1` AS `alias_3` FROM `table_1` INNER JOIN (SELECT `table_1`.`column_1` AS `alias_1` FROM `table_1`) AS alias_2 ON (`table_1`.`column_1` = `alias_2`.`alias_1`) WHERE (`table_1`.`column_1` = ?)
? = 1
----


# REA-6472
query  rowsort error: ERROR\ HY000\ \(1105\):\ Error\ during\ RPC\ \(extend_recipe\):\ SQL\ SELECT\ query\ 'q_[a-f0-9]+'\ couldn't\ be\ added:\ Operation\ unsupported:\ Self\-joins\ using\ the\ same\ column\ are\ unsupported
SELECT `table_1`.`column_1` AS `alias_3` FROM `table_1` INNER JOIN (SELECT `table_1`.`column_1` AS `alias_1` FROM `table_1`) AS alias_2 ON (`table_1`.`column_1` = `alias_2`.`alias_1`) WHERE (`table_1`.`column_1` = ?)
? = 1
----


# REA-6472
query  rowsort error: ERROR\ HY000\ \(1105\):\ Error\ during\ RPC\ \(extend_recipe\):\ SQL\ SELECT\ query\ 'q_[a-f0-9]+'\ couldn't\ be\ added:\ Operation\ unsupported:\ Self\-joins\ using\ the\ same\ column\ are\ unsupported
SELECT `table_1`.`column_1` AS `alias_3` FROM `table_1` INNER JOIN (SELECT `table_1`.`column_1` AS `alias_1` FROM `table_1`) AS alias_2 ON (`table_1`.`column_1` = `alias_2`.`alias_1`) WHERE (`table_1`.`column_1` = ?)
? = 1
----


# REA-6472
query  rowsort error: ERROR\ HY000\ \(1105\):\ Error\ during\ RPC\ \(extend_recipe\):\ SQL\ SELECT\ query\ 'q_[a-f0-9]+'\ couldn't\ be\ added:\ Operation\ unsupported:\ Self\-joins\ using\ the\ same\ column\ are\ unsupported
SELECT `table_1`.`column_1` AS `alias_3` FROM `table_1` INNER JOIN (SELECT `table_1`.`column_1` AS `alias_1` FROM `table_1`) AS alias_2 ON (`table_1`.`column_1` = `alias_2`.`alias_1`) WHERE (`table_1`.`column_1` > ?)
? = 10
----
1040718345
1520817680
1585843050

# REA-6472
query  rowsort error: ERROR\ HY000\ \(1105\):\ Error\ during\ RPC\ \(extend_recipe\):\ SQL\ SELECT\ query\ 'q_[a-f0-9]+'\ couldn't\ be\ added:\ Operation\ unsupported:\ Self\-joins\ using\ the\ same\ column\ are\ unsupported
SELECT `table_1`.`column_1` AS `alias_3` FROM `table_1` INNER JOIN (SELECT `table_1`.`column_1` AS `alias_1` FROM `table_1`) AS alias_2 ON (`table_1`.`column_1` = `alias_2`.`alias_1`) WHERE (`table_1`.`column_1` > ?)
? = 10
----
1040718345
1520817680
1585843050

# REA-6472
query  rowsort error: ERROR\ HY000\ \(1105\):\ Error\ during\ RPC\ \(extend_recipe\):\ SQL\ SELECT\ query\ 'q_[a-f0-9]+'\ couldn't\ be\ added:\ Operation\ unsupported:\ Self\-joins\ using\ the\ same\ column\ are\ unsupported
SELECT `table_1`.`column_1` AS `alias_3` FROM `table_1` INNER JOIN (SELECT `table_1`.`column_1` AS `alias_1` FROM `table_1`) AS alias_2 ON (`table_1`.`column_1` = `alias_2`.`alias_1`) WHERE (`table_1`.`column_1` > ?)
? = 10
----
1040718345
1520817680
1585843050

# REA-6472
query  rowsort error: ERROR\ HY000\ \(1105\):\ Error\ during\ RPC\ \(extend_recipe\):\ SQL\ SELECT\ query\ 'q_[a-f0-9]+'\ couldn't\ be\ added:\ Operation\ unsupported:\ Self\-joins\ using\ the\ same\ column\ are\ unsupported
SELECT `table_1`.`column_1` AS `alias_3` FROM `table_1` INNER JOIN (SELECT `table_1`.`column_1` AS `alias_1` FROM `table_1`) AS alias_2 ON (`table_1`.`column_1` = `alias_2`.`alias_1`) WHERE ((`table_1`.`column_1` = ?) AND (`table_1`.`column_1` > ?))
? = 1
? = 10
----


# REA-6472
query  rowsort error: ERROR\ HY000\ \(1105\):\ Error\ during\ RPC\ \(extend_recipe\):\ SQL\ SELECT\ query\ 'q_[a-f0-9]+'\ couldn't\ be\ added:\ Operation\ unsupported:\ Self\-joins\ using\ the\ same\ column\ are\ unsupported
SELECT `table_1`.`column_1` AS `alias_3` FROM `table_1` INNER JOIN (SELECT `table_1`.`column_1` AS `alias_1` FROM `table_1`) AS alias_2 ON (`table_1`.`column_1` = `alias_2`.`alias_1`) WHERE ((`table_1`.`column_1` = ?) AND (`table_1`.`column_1` > ?))
? = 1
? = 10
----


# REA-6472
query  rowsort error: ERROR\ HY000\ \(1105\):\ Error\ during\ RPC\ \(extend_recipe\):\ SQL\ SELECT\ query\ 'q_[a-f0-9]+'\ couldn't\ be\ added:\ Operation\ unsupported:\ Self\-joins\ using\ the\ same\ column\ are\ unsupported
SELECT `table_1`.`column_1` AS `alias_3` FROM `table_1` INNER JOIN (SELECT `table_1`.`column_1` AS `alias_1` FROM `table_1`) AS alias_2 ON (`table_1`.`column_1` = `alias_2`.`alias_1`) WHERE ((`table_1`.`column_1` = ?) AND (`table_1`.`column_1` > ?))
? = 1
? = 10
----

