# Generated by:
#     target/debug/noria-logictest permute --compare-to mysql://root:noria@127.1/noria -d 3 -o logictests/generated/mysql/ --only range_param --random --include-deletes --rows-per-table 10 --subquery-depth 1 --overwrite-tests

statement ok
CREATE TABLE `table_1` (`column_12` INT, `column_11` INT, `column_7` INT, `column_9` INT, `column_4` INT, `column_5` INT, `column_6` INT, `column_2` INT, `column_13` INT, `column_1` INT, `column_3` INT, `column_8` INT, `column_10` INT, PRIMARY KEY (`column_13`))


statement ok
INSERT INTO `table_1` (`column_12`, `column_11`, `column_7`, `column_9`, `column_4`, `column_5`, `column_6`, `column_2`, `column_13`, `column_1`, `column_3`, `column_8`, `column_10`) VALUES (926875181, -124062060, -1462891040, -1229094889, 443905300, 397674778, 601120671, 156993149, 0, -293103870, -1228403303, 760343770, -1336391254), (1121706244, 1267216046, 1394789019, 279758957, 1983026301, 409093705, 1864853407, -2015588239, 1, 1267036038, 857876495, -739811802, 418172088), (-1407901991, 863697565, -2052842292, 1437254785, 963269471, 1806530040, -1267107816, 1896555279, 2, 267306830, -1865229704, -817840050, 452919565), (1040441426, 1296017567, -495531390, 1320868672, 1950401820, 1711841806, -17383073, 2078400515, 3, -1440629451, 668930190, -818428401, 1720010007), (1624992271, 255069709, 1206241701, 1321902351, -1107197288, 1720170126, 1728891971, 1966530859, 4, -1097902530, 274446838, -598921734, 541094868), (-841154290, -2066836462, -487403166, 1998339229, 1347843379, 403675670, 1890533409, -1803309584, 5, -1751704445, -379667508, -557200872, -969034524), (-1445877609, -1942463572, 96080258, 1285241509, -1714177629, 558561603, 1653658071, -1366179132, 6, 1444597896, 1792560674, -2126951653, 872116652), (814029946, 684799510, -597734143, -470016715, 461492590, 1795742086, -931860587, 1923599258, 7, 1424044661, 1932113252, 237758651, 1253111437), (-533354523, -1742977280, 624204862, 740230245, -215555752, -511486182, -729389038, -635072543, 8, 2060305256, -885994606, -690714007, 737623363), (-274563524, -1518374984, 868084327, -1267140621, 576378515, 1120386276, -728958399, 360604936, 9, 147915963, -527257295, 1597962059, -789252124)


query  rowsort
WITH `alias_3` AS (SELECT sum(`table_1`.`column_2`) AS `alias_2` FROM `table_1`) SELECT sum(`table_1`.`column_1`) AS `alias_1` FROM `table_1` INNER JOIN `alias_3` ON (`table_1`.`column_1` = `alias_3`.`alias_2`)
----
NULL

query  rowsort
WITH `alias_3` AS (SELECT `table_1`.`column_1` AS `alias_2` FROM `table_1`) SELECT sum(`table_1`.`column_3`) AS `alias_1` FROM `table_1` INNER JOIN `alias_3` ON (`table_1`.`column_1` = `alias_3`.`alias_2`)
----
639375033

query  rowsort
WITH `alias_3` AS (SELECT sum(`table_1`.`column_5`) AS `alias_2` FROM `table_1`) SELECT sum(`table_1`.`column_4`) AS `alias_1` FROM `table_1` INNER JOIN `alias_3` ON (`table_1`.`column_2` = `alias_3`.`alias_2`)
----
NULL

query  rowsort
WITH `alias_2` AS (SELECT sum(`table_1`.`column_6`) AS `alias_1` FROM `table_1`) SELECT `table_1`.`column_6` AS `alias_3` FROM `table_1` INNER JOIN `alias_2` ON (`table_1`.`column_6` = `alias_2`.`alias_1`) WHERE (`table_1`.`column_2` > ?)
? = 10
----


query  rowsort
WITH `alias_2` AS (SELECT `table_1`.`column_6` AS `alias_1` FROM `table_1`) SELECT `table_1`.`column_6` AS `alias_3` FROM `table_1` INNER JOIN `alias_2` ON (`table_1`.`column_6` = `alias_2`.`alias_1`) WHERE (`table_1`.`column_6` > ?)
? = 10
----
1653658071
1728891971
1864853407
1890533409
601120671

query  rowsort
WITH `alias_2` AS (SELECT sum(`table_1`.`column_7`) AS `alias_1` FROM `table_1`) SELECT `table_1`.`column_6` AS `alias_3` FROM `table_1` INNER JOIN `alias_2` ON (`table_1`.`column_6` = `alias_2`.`alias_1`) WHERE (`table_1`.`column_6` > ?)
? = 10
----


query  rowsort
WITH `alias_3` AS (SELECT sum(`table_1`.`column_9`) AS `alias_2` FROM `table_1`) SELECT sum(`table_1`.`column_8`) AS `alias_1` FROM `table_1` INNER JOIN `alias_3` ON (`table_1`.`column_7` = `alias_3`.`alias_2`) WHERE (`table_1`.`column_7` > ?)
? = 10
----
NULL

query  rowsort
WITH `alias_3` AS (SELECT `table_1`.`column_7` AS `alias_2` FROM `table_1`) SELECT sum(`table_1`.`column_10`) AS `alias_1` FROM `table_1` INNER JOIN `alias_3` ON (`table_1`.`column_7` = `alias_3`.`alias_2`) WHERE (`table_1`.`column_7` > ?)
? = 10
----
1779754847

query  rowsort
WITH `alias_3` AS (SELECT sum(`table_1`.`column_12`) AS `alias_2` FROM `table_1`) SELECT sum(`table_1`.`column_11`) AS `alias_1` FROM `table_1` INNER JOIN `alias_3` ON (`table_1`.`column_12` = `alias_3`.`alias_2`) WHERE (`table_1`.`column_11` > ?)
? = 10
----
NULL

statement ok
DELETE FROM `table_1` WHERE (`column_13` = 0)


statement ok
DELETE FROM `table_1` WHERE (`column_13` = 1)


statement ok
DELETE FROM `table_1` WHERE (`column_13` = 2)


statement ok
DELETE FROM `table_1` WHERE (`column_13` = 3)


statement ok
DELETE FROM `table_1` WHERE (`column_13` = 4)


query  rowsort
WITH `alias_3` AS (SELECT sum(`table_1`.`column_2`) AS `alias_2` FROM `table_1`) SELECT sum(`table_1`.`column_1`) AS `alias_1` FROM `table_1` INNER JOIN `alias_3` ON (`table_1`.`column_1` = `alias_3`.`alias_2`)
----
NULL

query  rowsort
WITH `alias_3` AS (SELECT `table_1`.`column_1` AS `alias_2` FROM `table_1`) SELECT sum(`table_1`.`column_3`) AS `alias_1` FROM `table_1` INNER JOIN `alias_3` ON (`table_1`.`column_1` = `alias_3`.`alias_2`)
----
1931754517

query  rowsort
WITH `alias_3` AS (SELECT sum(`table_1`.`column_5`) AS `alias_2` FROM `table_1`) SELECT sum(`table_1`.`column_4`) AS `alias_1` FROM `table_1` INNER JOIN `alias_3` ON (`table_1`.`column_2` = `alias_3`.`alias_2`)
----
NULL

query  rowsort
WITH `alias_2` AS (SELECT sum(`table_1`.`column_6`) AS `alias_1` FROM `table_1`) SELECT `table_1`.`column_6` AS `alias_3` FROM `table_1` INNER JOIN `alias_2` ON (`table_1`.`column_6` = `alias_2`.`alias_1`) WHERE (`table_1`.`column_2` > ?)
? = 10
----


query  rowsort
WITH `alias_2` AS (SELECT `table_1`.`column_6` AS `alias_1` FROM `table_1`) SELECT `table_1`.`column_6` AS `alias_3` FROM `table_1` INNER JOIN `alias_2` ON (`table_1`.`column_6` = `alias_2`.`alias_1`) WHERE (`table_1`.`column_6` > ?)
? = 10
----
1653658071
1890533409

query  rowsort
WITH `alias_2` AS (SELECT sum(`table_1`.`column_7`) AS `alias_1` FROM `table_1`) SELECT `table_1`.`column_6` AS `alias_3` FROM `table_1` INNER JOIN `alias_2` ON (`table_1`.`column_6` = `alias_2`.`alias_1`) WHERE (`table_1`.`column_6` > ?)
? = 10
----


query  rowsort
WITH `alias_3` AS (SELECT sum(`table_1`.`column_9`) AS `alias_2` FROM `table_1`) SELECT sum(`table_1`.`column_8`) AS `alias_1` FROM `table_1` INNER JOIN `alias_3` ON (`table_1`.`column_7` = `alias_3`.`alias_2`) WHERE (`table_1`.`column_7` > ?)
? = 10
----
NULL

query  rowsort
WITH `alias_3` AS (SELECT `table_1`.`column_7` AS `alias_2` FROM `table_1`) SELECT sum(`table_1`.`column_10`) AS `alias_1` FROM `table_1` INNER JOIN `alias_3` ON (`table_1`.`column_7` = `alias_3`.`alias_2`) WHERE (`table_1`.`column_7` > ?)
? = 10
----
820487891

query  rowsort
WITH `alias_3` AS (SELECT sum(`table_1`.`column_12`) AS `alias_2` FROM `table_1`) SELECT sum(`table_1`.`column_11`) AS `alias_1` FROM `table_1` INNER JOIN `alias_3` ON (`table_1`.`column_12` = `alias_3`.`alias_2`) WHERE (`table_1`.`column_11` > ?)
? = 10
----
NULL
