# Generated by:
#     target/debug/noria-logictest permute --compare-to mysql://root:noria@127.1/noria -d 3 -o logictests/generated/mysql/ --only range_param --random --include-deletes --rows-per-table 10 --subquery-depth 1 --overwrite-tests

statement ok
CREATE TABLE `table_1` (`column_3` INT, `column_5` INT, `column_1` INT, `column_2` INT, `column_4` INT, PRIMARY KEY (`column_5`))


statement ok
INSERT INTO `table_1` (`column_3`, `column_5`, `column_1`, `column_2`, `column_4`) VALUES (1316804195, 0, -1194405592, -187610424, 1793712484), (-1134549139, 1, -1559618477, 37638391, 632077129), (-1811728801, 2, -991530716, 1729768146, -1179704734), (-2079628655, 3, 1726429513, 124963736, -332801628), (724097739, 4, 439275964, 1149445987, 1467845113), (-777095996, 5, 421551963, 988945588, -1797310144), (-947713294, 6, -413641541, -789710773, -76202009), (1628488883, 7, -1619973631, 961036272, 1981876598), (-79358804, 8, -1858943606, -966866409, 144761297), (354511166, 9, -804512190, -1900528981, 124324076)


query  rowsort
SELECT sum(`table_1`.`column_1`) AS `alias_1` FROM `table_1`
----
-5855368313

query  rowsort
SELECT `table_1`.`column_1` AS `alias_1` FROM `table_1` WHERE ((`table_1`.`column_1` = ?) AND (`table_1`.`column_1` = ?))
? = 1
? = 1
----


query  rowsort
SELECT `table_1`.`column_1` AS `alias_1` FROM `table_1` WHERE (`table_1`.`column_1` > ?)
? = 10
----
1726429513
421551963
439275964

query  rowsort
SELECT sum(`table_1`.`column_2`) AS `alias_1` FROM `table_1` WHERE ((`table_1`.`column_1` = ?) AND (`table_1`.`column_1` = ?))
? = 1
? = 1
----
NULL

query  rowsort
SELECT sum(`table_1`.`column_3`) AS `alias_1` FROM `table_1` WHERE (`table_1`.`column_1` > ?)
? = 10
----
-2132626912

query  rowsort
SELECT `table_1`.`column_1` AS `alias_1` FROM `table_1` WHERE (((`table_1`.`column_1` = ?) AND (`table_1`.`column_1` = ?)) AND (`table_1`.`column_1` > ?))
? = 1
? = 1
? = 10
----


query  rowsort
SELECT sum(`table_1`.`column_4`) AS `alias_1` FROM `table_1` WHERE (((`table_1`.`column_3` = ?) AND (`table_1`.`column_3` = ?)) AND (`table_1`.`column_3` > ?))
? = 1
? = 1
? = 10
----
NULL

statement ok
DELETE FROM `table_1` WHERE (`column_5` = 0)


statement ok
DELETE FROM `table_1` WHERE (`column_5` = 1)


statement ok
DELETE FROM `table_1` WHERE (`column_5` = 2)


statement ok
DELETE FROM `table_1` WHERE (`column_5` = 3)


statement ok
DELETE FROM `table_1` WHERE (`column_5` = 4)


query  rowsort
SELECT sum(`table_1`.`column_1`) AS `alias_1` FROM `table_1`
----
-4275519005

query  rowsort
SELECT `table_1`.`column_1` AS `alias_1` FROM `table_1` WHERE ((`table_1`.`column_1` = ?) AND (`table_1`.`column_1` = ?))
? = 1
? = 1
----


query  rowsort
SELECT `table_1`.`column_1` AS `alias_1` FROM `table_1` WHERE (`table_1`.`column_1` > ?)
? = 10
----
421551963

query  rowsort
SELECT sum(`table_1`.`column_2`) AS `alias_1` FROM `table_1` WHERE ((`table_1`.`column_1` = ?) AND (`table_1`.`column_1` = ?))
? = 1
? = 1
----
NULL

query  rowsort
SELECT sum(`table_1`.`column_3`) AS `alias_1` FROM `table_1` WHERE (`table_1`.`column_1` > ?)
? = 10
----
-777095996

query  rowsort
SELECT `table_1`.`column_1` AS `alias_1` FROM `table_1` WHERE (((`table_1`.`column_1` = ?) AND (`table_1`.`column_1` = ?)) AND (`table_1`.`column_1` > ?))
? = 1
? = 1
? = 10
----


query  rowsort
SELECT sum(`table_1`.`column_4`) AS `alias_1` FROM `table_1` WHERE (((`table_1`.`column_3` = ?) AND (`table_1`.`column_3` = ?)) AND (`table_1`.`column_3` > ?))
? = 1
? = 1
? = 10
----
NULL
