# Generated by:
#     target/debug/noria-logictest permute --compare-to mysql://root:noria@127.1/noria -d 3 -o logictests/generated/mysql/ --only range_param --random --include-deletes --rows-per-table 10 --subquery-depth 1 --overwrite-tests

statement ok
CREATE TABLE `table_1` (`column_6` INT, `column_4` INT, `column_1` INT, `column_2` INT, `column_7` INT, `column_3` INT, `column_5` INT, `column_8` INT, `column_9` INT, PRIMARY KEY (`column_9`))


statement ok
INSERT INTO `table_1` (`column_6`, `column_4`, `column_1`, `column_2`, `column_7`, `column_3`, `column_5`, `column_8`, `column_9`) VALUES (-1002991666, 1617681783, 2013029424, 1811775483, 1965759545, -1014925491, 192500514, 1821883123, 0), (144985114, 361236071, -727976333, 1861812927, 1334660442, -1200393908, 2019509050, 426734880, 1), (804323324, -1711790286, -1572587079, 426465372, 1224609799, 655302166, -1011865301, -1061931449, 2), (-789090647, 691695047, 1289562269, -734293982, 1373538107, 898418756, 1394541780, -1655992006, 3), (891274814, -766293690, 32656134, -998203325, 618645151, -1902989019, -1227865799, 787911673, 4), (-1206683276, -1286523891, -1134836115, -1649683712, 170944120, -1819358565, 1453470276, -1456739282, 5), (1608692718, 1222612128, -1637388466, 1579918795, -1409279412, -85948461, 1261427125, 3474018, 6), (1216041955, -1486574516, 1113419661, 432331647, 2047654386, 1150038241, 828180629, -1343864243, 7), (1071068521, -1056751279, -1181595929, -223688141, 1880387817, -641513278, 1191240444, 1255265085, 8), (78158609, -2091058165, 558285404, 1639456312, -1350192234, -1859831727, 1761076362, -774511772, 9)


query  rowsort
SELECT sum(`table_1`.`column_1`) AS `alias_1` FROM `table_1`
----
-1247431030

query  rowsort
SELECT avg(distinct `table_1`.`column_2`) AS `alias_1` FROM `table_1`
----
414589137.6000

query  rowsort
SELECT `table_1`.`column_1` AS `alias_1` FROM `table_1` WHERE (`table_1`.`column_1` > ?)
? = 10
----
1113419661
1289562269
2013029424
32656134
558285404

query  rowsort
SELECT sum(`table_1`.`column_3`) AS `alias_1`, avg(distinct `table_1`.`column_4`) AS `alias_2` FROM `table_1`
----
-5821201286
-450576679.8000

query  rowsort
SELECT sum(`table_1`.`column_5`) AS `alias_1` FROM `table_1` WHERE (`table_1`.`column_4` > ?)
? = 10
----
4867978469

query  rowsort
SELECT avg(distinct `table_1`.`column_6`) AS `alias_1` FROM `table_1` WHERE (`table_1`.`column_6` > ?)
? = 10
----
830649293.5714

query  rowsort
SELECT sum(`table_1`.`column_7`) AS `alias_1`, avg(distinct `table_1`.`column_8`) AS `alias_2` FROM `table_1` WHERE (`table_1`.`column_6` > ?)
? = 10
----
4346485949
-100988829.7143

statement ok
DELETE FROM `table_1` WHERE (`column_9` = 0)


statement ok
DELETE FROM `table_1` WHERE (`column_9` = 1)


statement ok
DELETE FROM `table_1` WHERE (`column_9` = 2)


statement ok
DELETE FROM `table_1` WHERE (`column_9` = 3)


statement ok
DELETE FROM `table_1` WHERE (`column_9` = 4)


query  rowsort
SELECT sum(`table_1`.`column_1`) AS `alias_1` FROM `table_1`
----
-2282115445

query  rowsort
SELECT avg(distinct `table_1`.`column_2`) AS `alias_1` FROM `table_1`
----
355666980.2000

query  rowsort
SELECT `table_1`.`column_1` AS `alias_1` FROM `table_1` WHERE (`table_1`.`column_1` > ?)
? = 10
----
1113419661
558285404

query  rowsort
SELECT sum(`table_1`.`column_3`) AS `alias_1`, avg(distinct `table_1`.`column_4`) AS `alias_2` FROM `table_1`
----
-3256613790
-939659144.6000

query  rowsort
SELECT sum(`table_1`.`column_5`) AS `alias_1` FROM `table_1` WHERE (`table_1`.`column_4` > ?)
? = 10
----
1261427125

query  rowsort
SELECT avg(distinct `table_1`.`column_6`) AS `alias_1` FROM `table_1` WHERE (`table_1`.`column_6` > ?)
? = 10
----
993490450.7500

query  rowsort
SELECT sum(`table_1`.`column_7`) AS `alias_1`, avg(distinct `table_1`.`column_8`) AS `alias_2` FROM `table_1` WHERE (`table_1`.`column_6` > ?)
? = 10
----
1168570557
-214909228.0000
