# Generated by:
#     target/debug/noria-logictest permute --compare-to mysql://root:noria@127.1/noria -d 3 -o logictests/generated/mysql/ --only range_param --random --include-deletes --rows-per-table 10 --subquery-depth 1 --overwrite-tests

statement ok
CREATE TABLE `table_1` (`column_2` INT, `column_4` INT, `column_1` INT, `column_5` INT, `column_3` INT, PRIMARY KEY (`column_5`))


statement ok
INSERT INTO `table_1` (`column_2`, `column_4`, `column_1`, `column_5`, `column_3`) VALUES (-1995665050, -971359217, -893461897, 0, 1219291603), (-1331535654, -1480860457, -1607706680, 1, 274155577), (2013749515, 520266064, -1832999191, 2, 129008418), (1673295661, -1984089112, -1840100071, 3, -1787655573), (412462151, -874292898, -1696115200, 4, 1806172708), (-1653836040, 32347236, -1341874344, 5, -643620010), (719251977, -1442736348, 1432284771, 6, 1836394527), (513166624, -484470660, -642044381, 7, 1670599241), (-1279979927, -809509326, 815400995, 8, 1643184636), (-687539143, -1341094619, -875933449, 9, 1175571389)


query  rowsort
SELECT sum(`table_1`.`column_1`) AS `alias_1` FROM `table_1`
----
-8482549447

query  rowsort
SELECT `table_1`.`column_1` AS `alias_1` FROM `table_1` WHERE (`table_1`.`column_1` > ?)
? = 10
----
1432284771
815400995

query  rowsort
SELECT `table_1`.`column_1` AS `alias_1` FROM `table_1` WHERE (`table_1`.`column_1` > ?)
? = 10
----
1432284771
815400995

query  rowsort
SELECT sum(`table_1`.`column_2`) AS `alias_1` FROM `table_1` WHERE (`table_1`.`column_2` > ?)
? = 10
----
5331925928

query  rowsort
SELECT sum(`table_1`.`column_3`) AS `alias_1` FROM `table_1` WHERE (`table_1`.`column_2` > ?)
? = 10
----
3654519321

query  rowsort
SELECT `table_1`.`column_2` AS `alias_1` FROM `table_1` WHERE ((`table_1`.`column_2` > ?) AND (`table_1`.`column_2` > ?))
? = 10
? = 10
----
1673295661
2013749515
412462151
513166624
719251977

query  rowsort
SELECT sum(`table_1`.`column_4`) AS `alias_1` FROM `table_1` WHERE ((`table_1`.`column_2` > ?) AND (`table_1`.`column_2` > ?))
? = 10
? = 10
----
-4265322954

statement ok
DELETE FROM `table_1` WHERE (`column_5` = 0)


statement ok
DELETE FROM `table_1` WHERE (`column_5` = 1)


statement ok
DELETE FROM `table_1` WHERE (`column_5` = 2)


statement ok
DELETE FROM `table_1` WHERE (`column_5` = 3)


statement ok
DELETE FROM `table_1` WHERE (`column_5` = 4)


query  rowsort
SELECT sum(`table_1`.`column_1`) AS `alias_1` FROM `table_1`
----
-612166408

query  rowsort
SELECT `table_1`.`column_1` AS `alias_1` FROM `table_1` WHERE (`table_1`.`column_1` > ?)
? = 10
----
1432284771
815400995

query  rowsort
SELECT `table_1`.`column_1` AS `alias_1` FROM `table_1` WHERE (`table_1`.`column_1` > ?)
? = 10
----
1432284771
815400995

query  rowsort
SELECT sum(`table_1`.`column_2`) AS `alias_1` FROM `table_1` WHERE (`table_1`.`column_2` > ?)
? = 10
----
1232418601

query  rowsort
SELECT sum(`table_1`.`column_3`) AS `alias_1` FROM `table_1` WHERE (`table_1`.`column_2` > ?)
? = 10
----
3506993768

query  rowsort
SELECT `table_1`.`column_2` AS `alias_1` FROM `table_1` WHERE ((`table_1`.`column_2` > ?) AND (`table_1`.`column_2` > ?))
? = 10
? = 10
----
513166624
719251977

query  rowsort
SELECT sum(`table_1`.`column_4`) AS `alias_1` FROM `table_1` WHERE ((`table_1`.`column_2` > ?) AND (`table_1`.`column_2` > ?))
? = 10
? = 10
----
-1927207008
