# Generated by:
#     target/debug/noria-logictest permute --compare-to mysql://root:noria@127.1/noria -d 3 -o logictests/generated/mysql/ --only range_param --random --include-deletes --rows-per-table 10 --subquery-depth 1

statement ok
CREATE TABLE `table_1` (`column_1` INT, `column_3` INT, `column_2` INT, `column_4` INT, `column_5` INT, PRIMARY KEY (`column_5`))


statement ok
CREATE TABLE `table_3` (`column_3` INT, `column_4` INT, `column_2` INT, `column_1` INT, PRIMARY KEY (`column_4`))


statement ok
CREATE TABLE `table_6` (`column_1` INT, `column_2` INT, `column_3` INT, PRIMARY KEY (`column_3`))


statement ok
CREATE TABLE `table_2` (`column_1` INT, `column_2` INT, `column_3` INT, PRIMARY KEY (`column_3`))


statement ok
CREATE TABLE `table_9` (`column_1` INT, `column_2` INT, `column_3` INT, PRIMARY KEY (`column_3`))


statement ok
CREATE TABLE `table_8` (`column_2` INT, `column_3` INT, `column_1` INT, PRIMARY KEY (`column_3`))


statement ok
CREATE TABLE `table_5` (`column_3` INT, `column_2` INT, `column_1` INT, PRIMARY KEY (`column_3`))


statement ok
CREATE TABLE `table_4` (`column_3` INT, `column_5` INT, `column_6` INT, `column_1` INT, `column_2` INT, `column_7` INT, `column_4` INT, PRIMARY KEY (`column_7`))


statement ok
CREATE TABLE `table_7` (`column_1` INT, `column_2` INT, `column_3` INT, PRIMARY KEY (`column_3`))


statement ok
INSERT INTO `table_1` (`column_1`, `column_3`, `column_2`, `column_4`, `column_5`) VALUES (342385893, 898214445, -530162171, 296901330, 0), (-173731414, -155827462, 1536003842, 706871234, 1), (395535389, 1374539849, 988687587, -2111513988, 2), (-1294602237, -1926440801, -576560064, 1317209490, 3), (-146887482, -1258361416, 1212162612, -1514981344, 4), (92569300, 539626821, 198365091, -1319960216, 5), (-706994408, 1104205206, 1644802559, -300555659, 6), (-1897767375, 482977967, 779708287, 1645407473, 7), (1524834300, -467525527, -1845768455, -393633400, 8), (-1180796849, 1639753450, 182847377, 1910053421, 9)


statement ok
INSERT INTO `table_3` (`column_3`, `column_4`, `column_2`, `column_1`) VALUES (-412017237, 0, 1705884619, 877029553), (-1634155693, 1, 2091770870, -1682662637), (862799531, 2, 468753813, -2101025147), (833745055, 3, -1682548920, 433603824), (-11130220, 4, -1016858856, -1232837991), (634701593, 5, 1751243392, 1532284022), (824023396, 6, 1092434158, -1774568367), (-1840899734, 7, -368984439, 182223661), (-659776945, 8, 1375417264, -663687045), (810555748, 9, -1846098400, 65775843)


statement ok
INSERT INTO `table_6` (`column_1`, `column_2`, `column_3`) VALUES (1751074904, -1418691201, 0), (-889651679, -1564317504, 1), (-780433032, -688219794, 2), (1954922933, -1929564958, 3), (-1688620042, -2044083469, 4), (-1112483797, 1125007480, 5), (1398139556, 1192075562, 6), (-526529550, -652788213, 7), (-285823978, 1875133099, 8), (985619078, -421462007, 9)


statement ok
INSERT INTO `table_2` (`column_1`, `column_2`, `column_3`) VALUES (1412281238, 844499664, 0), (774123781, -258310639, 1), (1970400621, -1294939053, 2), (2048175900, -189572958, 3), (-761997118, 1211146942, 4), (2094457055, -324658970, 5), (892000937, -1080316684, 6), (259033506, -2139812940, 7), (-1733037397, -481021240, 8), (-708987698, -593601194, 9)


statement ok
INSERT INTO `table_9` (`column_1`, `column_2`, `column_3`) VALUES (431011013, -152903777, 0), (824838961, 1089677587, 1), (454486734, 472590563, 2), (2128216280, -50303247, 3), (70900056, 1335968473, 4), (180494649, 456605159, 5), (-382253220, -2028659770, 6), (-560828682, -1315881790, 7), (-1228617794, 1037650569, 8), (-1040521255, -503531779, 9)


statement ok
INSERT INTO `table_8` (`column_2`, `column_3`, `column_1`) VALUES (-713117656, 0, 1024434802), (-859478806, 1, -1227372000), (-662232612, 2, -19662447), (1503131449, 3, -768957866), (255932596, 4, 781840323), (-1023362369, 5, -171225080), (-712935167, 6, 1881314637), (576823400, 7, 945132091), (1951000952, 8, 821327113), (1470256300, 9, -162481982)


statement ok
INSERT INTO `table_5` (`column_3`, `column_2`, `column_1`) VALUES (0, -692034352, -1859652755), (1, 1347877505, -1719350012), (2, -1841248309, -1691826179), (3, 1853535478, 1585308144), (4, 803634001, 1346425377), (5, 1478252296, 1577534007), (6, -898886825, 398927470), (7, -405855980, 1988301551), (8, -2008983563, -1073636708), (9, 1923506631, -239774036)


statement ok
INSERT INTO `table_4` (`column_3`, `column_5`, `column_6`, `column_1`, `column_2`, `column_7`, `column_4`) VALUES (1521682123, 1575619425, 905382735, -1825877156, -2097692330, 0, -2017243628), (200060911, -896838344, -1331419665, -216170829, -494067804, 1, -578230617), (-780180016, 878633652, -2101006472, -893234586, 1165212715, 2, 379686622), (-1720603942, 207596718, 1512895727, -639584647, -657546940, 3, 1415569426), (155695848, 121560975, -901236864, 958087449, -277265481, 4, -1390721225), (1906456334, 1690439780, 1128755841, -709089530, 1028005912, 5, -1481793207), (1861543108, -1071489079, 968587259, 2009472433, -500106108, 6, 2124851392), (-704098134, 460981506, 1011909829, -782799269, 87747760, 7, -1764062669), (562266400, -567282825, 1945095878, -1696285828, -1447415131, 8, -796256693), (51646626, -108114339, 394461758, -965852167, -1903692305, 9, -518596205)


statement ok
INSERT INTO `table_7` (`column_1`, `column_2`, `column_3`) VALUES (-1807884407, -19017076, 0), (-1846124082, 1059304742, 1), (1874878733, -1796936107, 2), (533777871, -344380958, 3), (-1007300859, -1627083606, 4), (1453639720, 648662032, 5), (17473315, 1980767124, 6), (289137190, -840070526, 7), (-1597821927, 579858222, 8), (-2073185333, 1583366834, 9)


query  nosort
SELECT `table_1`.`column_1` AS `alias_1` FROM `table_1` ORDER BY `table_1`.`column_1` ASC LIMIT 10
----
-1897767375
-1294602237
-1180796849
-706994408
-173731414
-146887482
92569300
342385893
395535389
1524834300

query  nosort
SELECT `table_1`.`column_1` AS `alias_1` FROM `table_1` ORDER BY `table_1`.`column_1` DESC LIMIT 10
----
1524834300
395535389
342385893
92569300
-146887482
-173731414
-706994408
-1180796849
-1294602237
-1897767375

query  rowsort
SELECT `table_1`.`column_2` AS `alias_1`, `table_2`.`column_2` AS `alias_2` FROM `table_1` LEFT JOIN `table_2` ON (`table_1`.`column_1` = `table_2`.`column_1`)
----
-1845768455
NULL
-530162171
NULL
-576560064
NULL
1212162612
NULL
1536003842
NULL
1644802559
NULL
182847377
NULL
198365091
NULL
779708287
NULL
988687587
NULL

query  rowsort
SELECT `table_1`.`column_1` AS `alias_1` FROM `table_1` WHERE (`table_1`.`column_1` > ?)
? = 10
----
1524834300
342385893
395535389
92569300

query  nosort
SELECT `table_1`.`column_1` AS `alias_1` FROM `table_1` ORDER BY `table_1`.`column_1` DESC LIMIT 10
----
1524834300
395535389
342385893
92569300
-146887482
-173731414
-706994408
-1180796849
-1294602237
-1897767375

query  nosort
SELECT `table_1`.`column_3` AS `alias_1`, `table_3`.`column_2` AS `alias_2` FROM `table_1` LEFT JOIN `table_3` ON (`table_1`.`column_1` = `table_3`.`column_1`) ORDER BY `table_1`.`column_1` ASC LIMIT 10
----
482977967
NULL
-1926440801
NULL
1639753450
NULL
1104205206
NULL
-155827462
NULL
-1258361416
NULL
539626821
NULL
898214445
NULL
1374539849
NULL
-467525527
NULL

query  nosort
SELECT `table_3`.`column_2` AS `alias_1` FROM `table_3` WHERE (`table_3`.`column_2` > ?) ORDER BY `table_3`.`column_2` ASC LIMIT 10
? = 10
----
468753813
1092434158
1375417264
1705884619
1751243392
2091770870

query  nosort
SELECT `table_3`.`column_3` AS `alias_1`, `table_4`.`column_2` AS `alias_2` FROM `table_3` LEFT JOIN `table_4` ON (`table_3`.`column_2` = `table_4`.`column_1`) ORDER BY `table_3`.`column_2` DESC LIMIT 10
----
-1634155693
NULL
634701593
NULL
-412017237
NULL
-659776945
NULL
824023396
NULL
862799531
NULL
-1840899734
NULL
-11130220
NULL
833745055
NULL
810555748
NULL

query  nosort
SELECT `table_4`.`column_2` AS `alias_1` FROM `table_4` WHERE (`table_4`.`column_2` > ?) ORDER BY `table_4`.`column_2` DESC LIMIT 10
? = 10
----
1165212715
1028005912
87747760

query  rowsort
SELECT `table_4`.`column_3` AS `alias_1`, `table_5`.`column_2` AS `alias_2` FROM `table_4` LEFT JOIN `table_5` ON (`table_4`.`column_2` = `table_5`.`column_1`) WHERE (`table_4`.`column_2` > ?)
? = 10
----
-704098134
NULL
-780180016
NULL
1906456334
NULL

query  nosort
SELECT `table_4`.`column_4` AS `alias_1`, `table_6`.`column_2` AS `alias_2` FROM `table_4` LEFT JOIN `table_6` ON (`table_4`.`column_2` = `table_6`.`column_1`) ORDER BY `table_4`.`column_2` DESC LIMIT 10
----
379686622
NULL
-1481793207
NULL
-1764062669
NULL
-1390721225
NULL
-578230617
NULL
2124851392
NULL
1415569426
NULL
-796256693
NULL
-518596205
NULL
-2017243628
NULL

query  nosort
SELECT `table_4`.`column_3` AS `alias_1` FROM `table_4` WHERE (`table_4`.`column_3` > ?) ORDER BY `table_4`.`column_3` DESC LIMIT 10
? = 10
----
1906456334
1861543108
1521682123
562266400
200060911
155695848
51646626

query  nosort
SELECT `table_4`.`column_5` AS `alias_1`, `table_7`.`column_2` AS `alias_2` FROM `table_4` LEFT JOIN `table_7` ON (`table_4`.`column_3` = `table_7`.`column_1`) WHERE (`table_4`.`column_3` > ?) ORDER BY `table_4`.`column_3` ASC LIMIT 10
? = 10
----
-108114339
NULL
121560975
NULL
-896838344
NULL
-567282825
NULL
1575619425
NULL
-1071489079
NULL
1690439780
NULL

query  nosort
SELECT `table_4`.`column_6` AS `alias_1`, `table_8`.`column_2` AS `alias_2` FROM `table_4` LEFT JOIN `table_8` ON (`table_4`.`column_3` = `table_8`.`column_1`) WHERE (`table_4`.`column_3` > ?) ORDER BY `table_4`.`column_3` DESC LIMIT 10
? = 10
----
1128755841
NULL
968587259
NULL
905382735
NULL
1945095878
NULL
-1331419665
NULL
-901236864
NULL
394461758
NULL

query  nosort
SELECT `table_1`.`column_4` AS `alias_1`, `table_9`.`column_2` AS `alias_2` FROM `table_1` LEFT JOIN `table_9` ON (`table_1`.`column_1` = `table_9`.`column_1`) WHERE (`table_1`.`column_1` > ?) ORDER BY `table_1`.`column_1` DESC LIMIT 10
? = 10
----
-393633400
NULL
-2111513988
NULL
296901330
NULL
-1319960216
NULL

statement ok
DELETE FROM `table_1` WHERE (`column_5` = 0)


statement ok
DELETE FROM `table_1` WHERE (`column_5` = 1)


statement ok
DELETE FROM `table_1` WHERE (`column_5` = 2)


statement ok
DELETE FROM `table_1` WHERE (`column_5` = 3)


statement ok
DELETE FROM `table_1` WHERE (`column_5` = 4)


statement ok
DELETE FROM `table_3` WHERE (`column_4` = 0)


statement ok
DELETE FROM `table_3` WHERE (`column_4` = 1)


statement ok
DELETE FROM `table_3` WHERE (`column_4` = 2)


statement ok
DELETE FROM `table_3` WHERE (`column_4` = 3)


statement ok
DELETE FROM `table_3` WHERE (`column_4` = 4)


statement ok
DELETE FROM `table_6` WHERE (`column_3` = 0)


statement ok
DELETE FROM `table_6` WHERE (`column_3` = 1)


statement ok
DELETE FROM `table_6` WHERE (`column_3` = 2)


statement ok
DELETE FROM `table_6` WHERE (`column_3` = 3)


statement ok
DELETE FROM `table_6` WHERE (`column_3` = 4)


statement ok
DELETE FROM `table_2` WHERE (`column_3` = 0)


statement ok
DELETE FROM `table_2` WHERE (`column_3` = 1)


statement ok
DELETE FROM `table_2` WHERE (`column_3` = 2)


statement ok
DELETE FROM `table_2` WHERE (`column_3` = 3)


statement ok
DELETE FROM `table_2` WHERE (`column_3` = 4)


statement ok
DELETE FROM `table_9` WHERE (`column_3` = 0)


statement ok
DELETE FROM `table_9` WHERE (`column_3` = 1)


statement ok
DELETE FROM `table_9` WHERE (`column_3` = 2)


statement ok
DELETE FROM `table_9` WHERE (`column_3` = 3)


statement ok
DELETE FROM `table_9` WHERE (`column_3` = 4)


statement ok
DELETE FROM `table_8` WHERE (`column_3` = 0)


statement ok
DELETE FROM `table_8` WHERE (`column_3` = 1)


statement ok
DELETE FROM `table_8` WHERE (`column_3` = 2)


statement ok
DELETE FROM `table_8` WHERE (`column_3` = 3)


statement ok
DELETE FROM `table_8` WHERE (`column_3` = 4)


statement ok
DELETE FROM `table_5` WHERE (`column_3` = 0)


statement ok
DELETE FROM `table_5` WHERE (`column_3` = 1)


statement ok
DELETE FROM `table_5` WHERE (`column_3` = 2)


statement ok
DELETE FROM `table_5` WHERE (`column_3` = 3)


statement ok
DELETE FROM `table_5` WHERE (`column_3` = 4)


statement ok
DELETE FROM `table_4` WHERE (`column_7` = 0)


statement ok
DELETE FROM `table_4` WHERE (`column_7` = 1)


statement ok
DELETE FROM `table_4` WHERE (`column_7` = 2)


statement ok
DELETE FROM `table_4` WHERE (`column_7` = 3)


statement ok
DELETE FROM `table_4` WHERE (`column_7` = 4)


statement ok
DELETE FROM `table_7` WHERE (`column_3` = 0)


statement ok
DELETE FROM `table_7` WHERE (`column_3` = 1)


statement ok
DELETE FROM `table_7` WHERE (`column_3` = 2)


statement ok
DELETE FROM `table_7` WHERE (`column_3` = 3)


statement ok
DELETE FROM `table_7` WHERE (`column_3` = 4)


query  nosort
SELECT `table_1`.`column_1` AS `alias_1` FROM `table_1` ORDER BY `table_1`.`column_1` ASC LIMIT 10
----
-1897767375
-1180796849
-706994408
92569300
1524834300

query  nosort
SELECT `table_1`.`column_1` AS `alias_1` FROM `table_1` ORDER BY `table_1`.`column_1` DESC LIMIT 10
----
1524834300
92569300
-706994408
-1180796849
-1897767375

query  rowsort
SELECT `table_1`.`column_2` AS `alias_1`, `table_2`.`column_2` AS `alias_2` FROM `table_1` LEFT JOIN `table_2` ON (`table_1`.`column_1` = `table_2`.`column_1`)
----
-1845768455
NULL
1644802559
NULL
182847377
NULL
198365091
NULL
779708287
NULL

query  rowsort
SELECT `table_1`.`column_1` AS `alias_1` FROM `table_1` WHERE (`table_1`.`column_1` > ?)
? = 10
----
1524834300
92569300

query  nosort
SELECT `table_1`.`column_1` AS `alias_1` FROM `table_1` ORDER BY `table_1`.`column_1` DESC LIMIT 10
----
1524834300
92569300
-706994408
-1180796849
-1897767375

query  nosort
SELECT `table_1`.`column_3` AS `alias_1`, `table_3`.`column_2` AS `alias_2` FROM `table_1` LEFT JOIN `table_3` ON (`table_1`.`column_1` = `table_3`.`column_1`) ORDER BY `table_1`.`column_1` ASC LIMIT 10
----
482977967
NULL
1639753450
NULL
1104205206
NULL
539626821
NULL
-467525527
NULL

query  nosort
SELECT `table_3`.`column_2` AS `alias_1` FROM `table_3` WHERE (`table_3`.`column_2` > ?) ORDER BY `table_3`.`column_2` ASC LIMIT 10
? = 10
----
1092434158
1375417264
1751243392

query  nosort
SELECT `table_3`.`column_3` AS `alias_1`, `table_4`.`column_2` AS `alias_2` FROM `table_3` LEFT JOIN `table_4` ON (`table_3`.`column_2` = `table_4`.`column_1`) ORDER BY `table_3`.`column_2` DESC LIMIT 10
----
634701593
NULL
-659776945
NULL
824023396
NULL
-1840899734
NULL
810555748
NULL

query  nosort
SELECT `table_4`.`column_2` AS `alias_1` FROM `table_4` WHERE (`table_4`.`column_2` > ?) ORDER BY `table_4`.`column_2` DESC LIMIT 10
? = 10
----
1028005912
87747760

query  rowsort
SELECT `table_4`.`column_3` AS `alias_1`, `table_5`.`column_2` AS `alias_2` FROM `table_4` LEFT JOIN `table_5` ON (`table_4`.`column_2` = `table_5`.`column_1`) WHERE (`table_4`.`column_2` > ?)
? = 10
----
-704098134
NULL
1906456334
NULL

query  nosort
SELECT `table_4`.`column_4` AS `alias_1`, `table_6`.`column_2` AS `alias_2` FROM `table_4` LEFT JOIN `table_6` ON (`table_4`.`column_2` = `table_6`.`column_1`) ORDER BY `table_4`.`column_2` DESC LIMIT 10
----
-1481793207
NULL
-1764062669
NULL
2124851392
NULL
-796256693
NULL
-518596205
NULL

query  nosort
SELECT `table_4`.`column_3` AS `alias_1` FROM `table_4` WHERE (`table_4`.`column_3` > ?) ORDER BY `table_4`.`column_3` DESC LIMIT 10
? = 10
----
1906456334
1861543108
562266400
51646626

query  nosort
SELECT `table_4`.`column_5` AS `alias_1`, `table_7`.`column_2` AS `alias_2` FROM `table_4` LEFT JOIN `table_7` ON (`table_4`.`column_3` = `table_7`.`column_1`) WHERE (`table_4`.`column_3` > ?) ORDER BY `table_4`.`column_3` ASC LIMIT 10
? = 10
----
-108114339
NULL
-567282825
NULL
-1071489079
NULL
1690439780
NULL

query  nosort
SELECT `table_4`.`column_6` AS `alias_1`, `table_8`.`column_2` AS `alias_2` FROM `table_4` LEFT JOIN `table_8` ON (`table_4`.`column_3` = `table_8`.`column_1`) WHERE (`table_4`.`column_3` > ?) ORDER BY `table_4`.`column_3` DESC LIMIT 10
? = 10
----
1128755841
NULL
968587259
NULL
1945095878
NULL
394461758
NULL

query  nosort
SELECT `table_1`.`column_4` AS `alias_1`, `table_9`.`column_2` AS `alias_2` FROM `table_1` LEFT JOIN `table_9` ON (`table_1`.`column_1` = `table_9`.`column_1`) WHERE (`table_1`.`column_1` > ?) ORDER BY `table_1`.`column_1` DESC LIMIT 10
? = 10
----
-393633400
NULL
-1319960216
NULL
