# Generated by:
#     target/debug/noria-logictest generate --operations avg,group_concat --compare-to mysql://root@localhost/mysql --subquery-depth 1 --rows-per-table 5 -o logictests/generated/avg,group_concat.test --include-deletes
# failure: ENG-339

statement ok
CREATE TABLE table_1 (column_5 INT(32), column_1 INT(32), column_2 TEXT, column_3 INT(32), column_4 TEXT, PRIMARY KEY (column_5))


statement ok
INSERT INTO table_1 (column_4, column_3, column_5, column_1, column_2) VALUES ('a', 1, 2, 1, 'a'), ('a', 1, 3, 1, 'a'), ('a', 1, 4, 1, 'a'), ('a', 1, 5, 1, 'a'), ('a', 1, 6, 1, 'a')


query  nosort
SELECT avg(table_1.column_1) AS alias_1 FROM table_1
----
1.0000

query  nosort
SELECT group_concat(table_1.column_2 separator ', ') AS alias_1 FROM table_1
----
a, a, a, a, a

query  nosort
SELECT avg(table_1.column_3) AS alias_1, group_concat(table_1.column_4 separator ', ') AS alias_2 FROM table_1
----
1.0000
a, a, a, a, a

statement ok
DELETE FROM table_1 WHERE (column_5 = 2)


statement ok
DELETE FROM table_1 WHERE (column_5 = 3)


query  nosort
SELECT avg(table_1.column_1) AS alias_1 FROM table_1
----
1.0000

query  nosort
SELECT group_concat(table_1.column_2 separator ', ') AS alias_1 FROM table_1
----
a, a, a

query  nosort
SELECT avg(table_1.column_3) AS alias_1, group_concat(table_1.column_4 separator ', ') AS alias_2 FROM table_1
----
1.0000
a, a, a
