# Generated by:
#     target/debug/noria-logictest permute --compare-to mysql://root:noria@127.1/noria -d 3 -o logictests/generated/mysql/ --only range_param --random --include-deletes --rows-per-table 10 --subquery-depth 1 --overwrite-tests

statement ok
CREATE TABLE `table_1` (`column_5` INT, `column_4` INT, `column_6` INT, `column_9` INT, `column_8` INT, `column_7` INT, `column_1` INT, `column_2` INT, `column_3` INT, PRIMARY KEY (`column_9`))


statement ok
INSERT INTO `table_1` (`column_5`, `column_4`, `column_6`, `column_9`, `column_8`, `column_7`, `column_1`, `column_2`, `column_3`) VALUES (871383889, -1386318733, -446251160, 0, 2099882525, 26859548, 1650586880, 1933640032, -2068403362), (1943334459, -836093555, -1799150413, 1, -1206914368, -769802885, -314483690, -2086646004, -939902045), (1368270265, -1302823271, 1342722048, 2, 2123276707, -491493866, -2082356290, 1098767024, -1753259303), (1165454272, 1375872055, 647928170, 3, 1831515699, -1033990291, -1539632993, 482797035, -777650457), (-470145723, -366855336, -1273497088, 4, -332083410, -1736824597, 1928004538, 1016108832, 2015491367), (-493761987, 77823013, -1297105494, 5, 102770157, -360949318, -674855962, -1241919002, -2012135278), (-150406379, -1400194216, -66463920, 6, -2013826647, 2019687986, 51424031, -1885515918, -325012434), (-310899737, 2130356562, 363052141, 7, -690712239, -1791666691, 1473905497, 119567052, -866316997), (-1313440705, 1014604596, 1496503406, 8, 1980391499, 1594788369, 602046656, -625421900, -1692386222), (-1296853279, -1955754532, -724211622, 9, 1689374304, -2019634433, 1980754281, 241989861, -2111562730)


query  rowsort
SELECT avg(`table_1`.`column_1`) AS `alias_1` FROM `table_1`
----
307539294.8000

query  rowsort
SELECT sum(distinct `table_1`.`column_2`) AS `alias_1` FROM `table_1`
----
-946632988

query  rowsort
SELECT `table_1`.`column_2` AS `alias_1` FROM `table_1` WHERE (`table_1`.`column_2` > ?)
? = 10
----
1016108832
1098767024
119567052
1933640032
241989861
482797035

query  rowsort
SELECT avg(`table_1`.`column_3`) AS `alias_1`, sum(distinct `table_1`.`column_4`) AS `alias_2` FROM `table_1`
----
-1053113746.1000
-2649383417

query  rowsort
SELECT avg(`table_1`.`column_5`) AS `alias_1` FROM `table_1` WHERE (`table_1`.`column_5` > ?)
? = 10
----
1337110721.2500

query  rowsort
SELECT sum(distinct `table_1`.`column_6`) AS `alias_1` FROM `table_1` WHERE (`table_1`.`column_5` > ?)
? = 10
----
-254751355

query  rowsort
SELECT avg(`table_1`.`column_7`) AS `alias_1`, sum(distinct `table_1`.`column_8`) AS `alias_2` FROM `table_1` WHERE (`table_1`.`column_5` > ?)
? = 10
----
-567106873.5000
4847760563

statement ok
DELETE FROM `table_1` WHERE (`column_9` = 0)


statement ok
DELETE FROM `table_1` WHERE (`column_9` = 1)


statement ok
DELETE FROM `table_1` WHERE (`column_9` = 2)


statement ok
DELETE FROM `table_1` WHERE (`column_9` = 3)


statement ok
DELETE FROM `table_1` WHERE (`column_9` = 4)


query  rowsort
SELECT avg(`table_1`.`column_1`) AS `alias_1` FROM `table_1`
----
686654900.6000

query  rowsort
SELECT sum(distinct `table_1`.`column_2`) AS `alias_1` FROM `table_1`
----
-3391299907

query  rowsort
SELECT `table_1`.`column_2` AS `alias_1` FROM `table_1` WHERE (`table_1`.`column_2` > ?)
? = 10
----
119567052
241989861

query  rowsort
SELECT avg(`table_1`.`column_3`) AS `alias_1`, sum(distinct `table_1`.`column_4`) AS `alias_2` FROM `table_1`
----
-1401482732.2000
-133164577

query  rowsort
SELECT avg(`table_1`.`column_5`) AS `alias_1` FROM `table_1` WHERE (`table_1`.`column_5` > ?)
? = 10
----
NULL

query  rowsort
SELECT sum(distinct `table_1`.`column_6`) AS `alias_1` FROM `table_1` WHERE (`table_1`.`column_5` > ?)
? = 10
----
NULL

query  rowsort
SELECT avg(`table_1`.`column_7`) AS `alias_1`, sum(distinct `table_1`.`column_8`) AS `alias_2` FROM `table_1` WHERE (`table_1`.`column_5` > ?)
? = 10
----
NULL
NULL
