# Generated by:
#     target/debug/noria-logictest permute --compare-to mysql://root:noria@127.1/noria -d 3 -o logictests/generated/mysql/ --only range_param --random --include-deletes --rows-per-table 10 --subquery-depth 1 --overwrite-tests

statement ok
CREATE TABLE `table_1` (`column_11` INT, `column_5` INT, `column_3` INT, `column_4` INT, `column_6` INT, `column_7` INT, `column_12` INT, `column_10` INT, `column_13` INT, `column_2` INT, `column_8` INT, `column_9` INT, `column_1` INT, PRIMARY KEY (`column_13`))


statement ok
INSERT INTO `table_1` (`column_11`, `column_5`, `column_3`, `column_4`, `column_6`, `column_7`, `column_12`, `column_10`, `column_13`, `column_2`, `column_8`, `column_9`, `column_1`) VALUES (1674151346, 452204837, 376555217, 955774243, 1229063760, 449923264, 1212552073, -1577141731, 0, -273404128, 1622936453, -1499084013, -1525025084), (1665635442, 118471996, -1353104400, 1103784159, 1369752613, -1503482936, 843225734, -738873671, 1, -657710221, 1514363692, -1221125742, -6026074), (-1374217597, 1522070732, -10825782, -662403052, 940324153, -390564462, 762341479, 470852119, 2, 1030790038, -34109035, 126712305, 512196305), (2073464942, -942783515, -739350048, 1284365835, 1007784955, 454623397, -150824029, 766041614, 3, 633051262, -780100217, -339036919, 785045869), (1789326607, 1529746640, -1895366369, -1584849753, -278299807, 1787129641, -637877038, 1669879117, 4, 759063918, 1443895653, 919741840, 881391656), (772884218, 1478110859, -878895312, -156464736, -1256887696, 1945204717, 670680970, 887681248, 5, 841635892, 2137583103, -479436470, 1221302477), (938908068, -1029036827, 1586349343, -1918782365, 1776787328, -1027852227, 1183678076, 865895940, 6, 137330045, -1867001874, -806810322, -576672677), (-818963715, 959038961, 1942489547, 1337929557, 1056137320, 2122348410, -525402909, -1802825939, 7, -571965033, -773118298, -507600058, 1482786843), (84380451, 393430005, 112355123, 1842608093, -1190121404, 105627969, -1317671561, -1052160471, 8, 412665624, 1024438159, -1824863702, 519022596), (-411147194, 224632786, -1604096729, -771842776, -708364941, 887836583, 2097397898, -34406200, 9, -669288170, 996871821, 1988837623, 1766654673)


query  rowsort
WITH `alias_3` AS (SELECT count(distinct `table_1`.`column_2`) AS `alias_2` FROM `table_1`) SELECT count(distinct `table_1`.`column_1`) AS `alias_1` FROM `table_1` INNER JOIN `alias_3` ON (`table_1`.`column_2` = `alias_3`.`alias_2`)
----
0

query  rowsort
WITH `alias_3` AS (SELECT `table_1`.`column_2` AS `alias_2` FROM `table_1`) SELECT count(distinct `table_1`.`column_3`) AS `alias_1` FROM `table_1` INNER JOIN `alias_3` ON (`table_1`.`column_2` = `alias_3`.`alias_2`)
----
10

query  rowsort
WITH `alias_3` AS (SELECT count(distinct `table_1`.`column_5`) AS `alias_2` FROM `table_1`) SELECT count(distinct `table_1`.`column_4`) AS `alias_1` FROM `table_1` INNER JOIN `alias_3` ON (`table_1`.`column_5` = `alias_3`.`alias_2`)
----
0

query  rowsort
WITH `alias_2` AS (SELECT count(distinct `table_1`.`column_6`) AS `alias_1` FROM `table_1`) SELECT `table_1`.`column_6` AS `alias_3` FROM `table_1` INNER JOIN `alias_2` ON (`table_1`.`column_6` = `alias_2`.`alias_1`) WHERE (`table_1`.`column_5` > ?)
? = 10
----


query  rowsort
WITH `alias_2` AS (SELECT `table_1`.`column_6` AS `alias_1` FROM `table_1`) SELECT `table_1`.`column_6` AS `alias_3` FROM `table_1` INNER JOIN `alias_2` ON (`table_1`.`column_6` = `alias_2`.`alias_1`) WHERE (`table_1`.`column_6` > ?)
? = 10
----
1007784955
1056137320
1229063760
1369752613
1776787328
940324153

query  rowsort
WITH `alias_2` AS (SELECT count(distinct `table_1`.`column_7`) AS `alias_1` FROM `table_1`) SELECT `table_1`.`column_6` AS `alias_3` FROM `table_1` INNER JOIN `alias_2` ON (`table_1`.`column_6` = `alias_2`.`alias_1`) WHERE (`table_1`.`column_6` > ?)
? = 10
----


query  rowsort
WITH `alias_3` AS (SELECT count(distinct `table_1`.`column_9`) AS `alias_2` FROM `table_1`) SELECT count(distinct `table_1`.`column_8`) AS `alias_1` FROM `table_1` INNER JOIN `alias_3` ON (`table_1`.`column_5` = `alias_3`.`alias_2`) WHERE (`table_1`.`column_5` > ?)
? = 10
----
0

query  rowsort
WITH `alias_3` AS (SELECT `table_1`.`column_5` AS `alias_2` FROM `table_1`) SELECT count(distinct `table_1`.`column_10`) AS `alias_1` FROM `table_1` INNER JOIN `alias_3` ON (`table_1`.`column_5` = `alias_3`.`alias_2`) WHERE (`table_1`.`column_5` > ?)
? = 10
----
8

query  rowsort
WITH `alias_3` AS (SELECT count(distinct `table_1`.`column_12`) AS `alias_2` FROM `table_1`) SELECT count(distinct `table_1`.`column_11`) AS `alias_1` FROM `table_1` INNER JOIN `alias_3` ON (`table_1`.`column_11` = `alias_3`.`alias_2`) WHERE (`table_1`.`column_11` > ?)
? = 10
----
0

statement ok
DELETE FROM `table_1` WHERE (`column_13` = 0)


statement ok
DELETE FROM `table_1` WHERE (`column_13` = 1)


statement ok
DELETE FROM `table_1` WHERE (`column_13` = 2)


statement ok
DELETE FROM `table_1` WHERE (`column_13` = 3)


statement ok
DELETE FROM `table_1` WHERE (`column_13` = 4)


query  rowsort
WITH `alias_3` AS (SELECT count(distinct `table_1`.`column_2`) AS `alias_2` FROM `table_1`) SELECT count(distinct `table_1`.`column_1`) AS `alias_1` FROM `table_1` INNER JOIN `alias_3` ON (`table_1`.`column_2` = `alias_3`.`alias_2`)
----
0

query  rowsort
WITH `alias_3` AS (SELECT `table_1`.`column_2` AS `alias_2` FROM `table_1`) SELECT count(distinct `table_1`.`column_3`) AS `alias_1` FROM `table_1` INNER JOIN `alias_3` ON (`table_1`.`column_2` = `alias_3`.`alias_2`)
----
5

query  rowsort
WITH `alias_3` AS (SELECT count(distinct `table_1`.`column_5`) AS `alias_2` FROM `table_1`) SELECT count(distinct `table_1`.`column_4`) AS `alias_1` FROM `table_1` INNER JOIN `alias_3` ON (`table_1`.`column_5` = `alias_3`.`alias_2`)
----
0

query  rowsort
WITH `alias_2` AS (SELECT count(distinct `table_1`.`column_6`) AS `alias_1` FROM `table_1`) SELECT `table_1`.`column_6` AS `alias_3` FROM `table_1` INNER JOIN `alias_2` ON (`table_1`.`column_6` = `alias_2`.`alias_1`) WHERE (`table_1`.`column_5` > ?)
? = 10
----


query  rowsort
WITH `alias_2` AS (SELECT `table_1`.`column_6` AS `alias_1` FROM `table_1`) SELECT `table_1`.`column_6` AS `alias_3` FROM `table_1` INNER JOIN `alias_2` ON (`table_1`.`column_6` = `alias_2`.`alias_1`) WHERE (`table_1`.`column_6` > ?)
? = 10
----
1056137320
1776787328

query  rowsort
WITH `alias_2` AS (SELECT count(distinct `table_1`.`column_7`) AS `alias_1` FROM `table_1`) SELECT `table_1`.`column_6` AS `alias_3` FROM `table_1` INNER JOIN `alias_2` ON (`table_1`.`column_6` = `alias_2`.`alias_1`) WHERE (`table_1`.`column_6` > ?)
? = 10
----


query  rowsort
WITH `alias_3` AS (SELECT count(distinct `table_1`.`column_9`) AS `alias_2` FROM `table_1`) SELECT count(distinct `table_1`.`column_8`) AS `alias_1` FROM `table_1` INNER JOIN `alias_3` ON (`table_1`.`column_5` = `alias_3`.`alias_2`) WHERE (`table_1`.`column_5` > ?)
? = 10
----
0

query  rowsort
WITH `alias_3` AS (SELECT `table_1`.`column_5` AS `alias_2` FROM `table_1`) SELECT count(distinct `table_1`.`column_10`) AS `alias_1` FROM `table_1` INNER JOIN `alias_3` ON (`table_1`.`column_5` = `alias_3`.`alias_2`) WHERE (`table_1`.`column_5` > ?)
? = 10
----
4

query  rowsort
WITH `alias_3` AS (SELECT count(distinct `table_1`.`column_12`) AS `alias_2` FROM `table_1`) SELECT count(distinct `table_1`.`column_11`) AS `alias_1` FROM `table_1` INNER JOIN `alias_3` ON (`table_1`.`column_11` = `alias_3`.`alias_2`) WHERE (`table_1`.`column_11` > ?)
? = 10
----
0
