# Generated by:
#     target/debug/noria-logictest permute --compare-to mysql://root:noria@127.1/noria -d 3 -o logictests/generated/mysql/ --only range_param --random --include-deletes --rows-per-table 10 --subquery-depth 1 --overwrite-tests

statement ok
CREATE TABLE `table_1` (`column_4` INT, `column_1` INT, `column_2` INT, `column_3` INT, `column_5` INT, PRIMARY KEY (`column_5`))


statement ok
INSERT INTO `table_1` (`column_4`, `column_1`, `column_2`, `column_3`, `column_5`) VALUES (1, 2, -292813456, 2, 0), (-2008017951, 1878356092, 688148138, -473342508, 1), (2, 0, 249490475, 0, 2), (-501839725, -79446682, 449244508, -2025798481, 3), (0, 1, -714398775, 1, 4), (476114308, 20540288, 1594868585, -2129172792, 5), (1, 2, -2052117549, 2, 6), (1944773421, -406642815, 1580435627, 8745149, 7), (2, 0, -1591687920, 0, 8), (-773786684, 341261648, -1028132812, -1044854272, 9)


query  rowsort
SELECT count(`table_1`.`column_1`) AS `alias_1` FROM `table_1`
----
10

query  rowsort
SELECT `table_1`.`column_1` AS `alias_1` FROM `table_1` WHERE `table_1`.`column_1` IN (?, ?, ?)
? = 0
? = 1
? = 2
----
0
0
1
2
2

query  rowsort
SELECT `table_1`.`column_1` AS `alias_1` FROM `table_1` WHERE (`table_1`.`column_1` > ?)
? = 10
----
1878356092
20540288
341261648

query  rowsort
SELECT count(`table_1`.`column_2`) AS `alias_1` FROM `table_1` WHERE `table_1`.`column_1` IN (?, ?, ?)
? = 0
? = 1
? = 2
----
5

query  rowsort
SELECT count(`table_1`.`column_3`) AS `alias_1` FROM `table_1` WHERE (`table_1`.`column_3` > ?)
? = 10
----
1

query  rowsort
SELECT `table_1`.`column_3` AS `alias_1` FROM `table_1` WHERE (`table_1`.`column_3` IN (?, ?, ?) AND (`table_1`.`column_3` > ?))
? = 0
? = 1
? = 2
? = 10
----


query  rowsort
SELECT count(`table_1`.`column_4`) AS `alias_1` FROM `table_1` WHERE (`table_1`.`column_4` IN (?, ?, ?) AND (`table_1`.`column_4` > ?))
? = 0
? = 1
? = 2
? = 10
----
0

statement ok
DELETE FROM `table_1` WHERE (`column_5` = 0)


statement ok
DELETE FROM `table_1` WHERE (`column_5` = 1)


statement ok
DELETE FROM `table_1` WHERE (`column_5` = 2)


statement ok
DELETE FROM `table_1` WHERE (`column_5` = 3)


statement ok
DELETE FROM `table_1` WHERE (`column_5` = 4)


query  rowsort
SELECT count(`table_1`.`column_1`) AS `alias_1` FROM `table_1`
----
5

query  rowsort
SELECT `table_1`.`column_1` AS `alias_1` FROM `table_1` WHERE `table_1`.`column_1` IN (?, ?, ?)
? = 0
? = 1
? = 2
----
0
2

query  rowsort
SELECT `table_1`.`column_1` AS `alias_1` FROM `table_1` WHERE (`table_1`.`column_1` > ?)
? = 10
----
20540288
341261648

query  rowsort
SELECT count(`table_1`.`column_2`) AS `alias_1` FROM `table_1` WHERE `table_1`.`column_1` IN (?, ?, ?)
? = 0
? = 1
? = 2
----
2

query  rowsort
SELECT count(`table_1`.`column_3`) AS `alias_1` FROM `table_1` WHERE (`table_1`.`column_3` > ?)
? = 10
----
1

query  rowsort
SELECT `table_1`.`column_3` AS `alias_1` FROM `table_1` WHERE (`table_1`.`column_3` IN (?, ?, ?) AND (`table_1`.`column_3` > ?))
? = 0
? = 1
? = 2
? = 10
----


query  rowsort
SELECT count(`table_1`.`column_4`) AS `alias_1` FROM `table_1` WHERE (`table_1`.`column_4` IN (?, ?, ?) AND (`table_1`.`column_4` > ?))
? = 0
? = 1
? = 2
? = 10
----
0
