# Generated by:
#     target/debug/noria-logictest permute --compare-to mysql://root:noria@127.1/noria -d 3 -o logictests/generated/mysql/ --only range_param --random --include-deletes --rows-per-table 10 --subquery-depth 1 --overwrite-tests

statement ok
CREATE TABLE `table_1` (`column_3` INT, `column_2` INT, `column_1` INT, `column_4` INT, `column_5` INT, PRIMARY KEY (`column_5`))


statement ok
INSERT INTO `table_1` (`column_3`, `column_2`, `column_1`, `column_4`, `column_5`) VALUES (185577953, 638344753, -1347340745, 121774404, 0), (2048176019, 1288395012, 690002448, -500938223, 1), (871157548, -273227891, 312191837, 649685038, 2), (-2038592962, -1853267493, 682626900, 398493872, 3), (-1550747398, 132998374, 219771734, -711974738, 4), (-1018969115, 2052313055, 29919265, 1298314025, 5), (-1091387222, -56339875, -1107432472, 1366262880, 6), (188072752, -642726164, 631576102, 345995511, 7), (-587564482, -1707441988, -513944579, 1180294364, 8), (1730828565, 486544219, 364376034, -1707934029, 9)


query  rowsort
SELECT count(distinct `table_1`.`column_1`) AS `alias_1` FROM `table_1`
----
10

query  rowsort
SELECT DISTINCT `table_1`.`column_1` AS `alias_1` FROM `table_1`
----
-1107432472
-1347340745
-513944579
219771734
29919265
312191837
364376034
631576102
682626900
690002448

query  rowsort
SELECT `table_1`.`column_1` AS `alias_1` FROM `table_1` WHERE (`table_1`.`column_1` > ?)
? = 10
----
219771734
29919265
312191837
364376034
631576102
682626900
690002448

query  rowsort
SELECT DISTINCT count(distinct `table_1`.`column_2`) AS `alias_1` FROM `table_1`
----
10

query  rowsort
SELECT count(distinct `table_1`.`column_3`) AS `alias_1` FROM `table_1` WHERE (`table_1`.`column_3` > ?)
? = 10
----
5

query  rowsort
SELECT DISTINCT `table_1`.`column_3` AS `alias_1` FROM `table_1` WHERE (`table_1`.`column_3` > ?)
? = 10
----
1730828565
185577953
188072752
2048176019
871157548

query  rowsort
SELECT DISTINCT count(distinct `table_1`.`column_4`) AS `alias_1` FROM `table_1` WHERE (`table_1`.`column_3` > ?)
? = 10
----
5

statement ok
DELETE FROM `table_1` WHERE (`column_5` = 0)


statement ok
DELETE FROM `table_1` WHERE (`column_5` = 1)


statement ok
DELETE FROM `table_1` WHERE (`column_5` = 2)


statement ok
DELETE FROM `table_1` WHERE (`column_5` = 3)


statement ok
DELETE FROM `table_1` WHERE (`column_5` = 4)


query  rowsort
SELECT count(distinct `table_1`.`column_1`) AS `alias_1` FROM `table_1`
----
5

query  rowsort
SELECT DISTINCT `table_1`.`column_1` AS `alias_1` FROM `table_1`
----
-1107432472
-513944579
29919265
364376034
631576102

query  rowsort
SELECT `table_1`.`column_1` AS `alias_1` FROM `table_1` WHERE (`table_1`.`column_1` > ?)
? = 10
----
29919265
364376034
631576102

query  rowsort
SELECT DISTINCT count(distinct `table_1`.`column_2`) AS `alias_1` FROM `table_1`
----
5

query  rowsort
SELECT count(distinct `table_1`.`column_3`) AS `alias_1` FROM `table_1` WHERE (`table_1`.`column_3` > ?)
? = 10
----
2

query  rowsort
SELECT DISTINCT `table_1`.`column_3` AS `alias_1` FROM `table_1` WHERE (`table_1`.`column_3` > ?)
? = 10
----
1730828565
188072752

query  rowsort
SELECT DISTINCT count(distinct `table_1`.`column_4`) AS `alias_1` FROM `table_1` WHERE (`table_1`.`column_3` > ?)
? = 10
----
2
