# Generated by:
#     target/debug/noria-logictest generate --operations count,group_concat,min --compare-to mysql://root@localhost/mysql --subquery-depth 1 --rows-per-table 5 -o logictests/generated/count,group_concat,min.test --include-deletes
# failure: ENG-339

statement ok
CREATE TABLE table_1 (column_9 INT(32), column_13 INT(32), column_3 INT(32), column_1 INT(32), column_5 TEXT, column_8 TEXT, column_11 TEXT, column_2 TEXT, column_4 INT(32), column_7 INT(32), column_6 INT(32), column_12 INT(32), column_10 INT(32), PRIMARY KEY (column_13))


statement ok
INSERT INTO table_1 (column_10, column_9, column_5, column_11, column_1, column_8, column_2, column_7, column_3, column_4, column_12, column_13, column_6) VALUES (1, 1, 'a', 'a', 1, 'a', 'a', 1, 1, 1, 1, 2, 1), (1, 1, 'a', 'a', 1, 'a', 'a', 1, 1, 1, 1, 3, 1), (1, 1, 'a', 'a', 1, 'a', 'a', 1, 1, 1, 1, 4, 1), (1, 1, 'a', 'a', 1, 'a', 'a', 1, 1, 1, 1, 5, 1), (1, 1, 'a', 'a', 1, 'a', 'a', 1, 1, 1, 1, 6, 1)


query  nosort
SELECT count(table_1.column_1) AS alias_1 FROM table_1
----
5

query  nosort
SELECT group_concat(table_1.column_2 separator ', ') AS alias_1 FROM table_1
----
a, a, a, a, a

query  nosort
SELECT min(table_1.column_3) AS alias_1 FROM table_1
----
1

query  nosort
SELECT count(table_1.column_4) AS alias_1, group_concat(table_1.column_5 separator ', ') AS alias_2 FROM table_1
----
5
a, a, a, a, a

query  nosort
SELECT count(table_1.column_6) AS alias_1, min(table_1.column_7) AS alias_2 FROM table_1
----
5
1

query  nosort
SELECT group_concat(table_1.column_8 separator ', ') AS alias_1, min(table_1.column_9) AS alias_2 FROM table_1
----
a, a, a, a, a
1

query  nosort
SELECT count(table_1.column_10) AS alias_1, group_concat(table_1.column_11 separator ', ') AS alias_2, min(table_1.column_12) AS alias_3 FROM table_1
----
5
a, a, a, a, a
1

statement ok
DELETE FROM table_1 WHERE (column_13 = 2)


statement ok
DELETE FROM table_1 WHERE (column_13 = 3)


query  nosort
SELECT count(table_1.column_1) AS alias_1 FROM table_1
----
3

query  nosort
SELECT group_concat(table_1.column_2 separator ', ') AS alias_1 FROM table_1
----
a, a, a

query  nosort
SELECT min(table_1.column_3) AS alias_1 FROM table_1
----
1

query  nosort
SELECT count(table_1.column_4) AS alias_1, group_concat(table_1.column_5 separator ', ') AS alias_2 FROM table_1
----
3
a, a, a

query  nosort
SELECT count(table_1.column_6) AS alias_1, min(table_1.column_7) AS alias_2 FROM table_1
----
3
1

query  nosort
SELECT group_concat(table_1.column_8 separator ', ') AS alias_1, min(table_1.column_9) AS alias_2 FROM table_1
----
a, a, a
1

query  nosort
SELECT count(table_1.column_10) AS alias_1, group_concat(table_1.column_11 separator ', ') AS alias_2, min(table_1.column_12) AS alias_3 FROM table_1
----
3
a, a, a
1
