# Generated by:
#     target/debug/noria-logictest permute --compare-to mysql://root:noria@127.1/noria -d 3 -o logictests/generated/mysql/ --only range_param --random --include-deletes --rows-per-table 10 --subquery-depth 1

statement ok
CREATE TABLE `table_1` (`column_3` INT, `column_6` INT, `column_5` INT, `column_2` INT, `column_1` INT, `column_4` INT, PRIMARY KEY (`column_6`))


statement ok
INSERT INTO `table_1` (`column_3`, `column_6`, `column_5`, `column_2`, `column_1`, `column_4`) VALUES (-545823096, 0, 1489645528, 1747166332, 1212461977, -1779402708), (1943443348, 1, 1881750672, -1555601722, -1947064882, -18681315), (-770543238, 2, 894175293, -2035407401, 682381669, -1836297079), (1712579571, 3, -135228968, -2051209181, 1484099186, -371088719), (-565866015, 4, 1074250883, -1104185970, -1586564305, -268979504), (-217318255, 5, 1161003987, -941033164, 1974158872, 1146576968), (-266741400, 6, 342665769, -620467729, -848327270, -2128187036), (-1506283701, 7, -1180493461, 802830070, -861383761, 65826924), (2086943962, 8, -1664843899, 1063507498, -20224031, -1361583487), (1780705199, 9, -464856416, -274391320, 2018285314, 1522942766)


query  rowsort
SELECT DISTINCT `table_1`.`column_1` AS `alias_1` FROM `table_1`
----
-1586564305
-1947064882
-20224031
-848327270
-861383761
1212461977
1484099186
1974158872
2018285314
682381669

query  rowsort
SELECT min(`table_1`.`column_2`) AS `alias_1` FROM `table_1`
----
-2051209181

query  rowsort
SELECT `table_1`.`column_2` AS `alias_1` FROM `table_1` WHERE (`table_1`.`column_2` > ?)
? = 10
----
1063507498
1747166332
802830070

query  rowsort
SELECT DISTINCT min(`table_1`.`column_3`) AS `alias_1` FROM `table_1`
----
-1506283701

query  rowsort
SELECT DISTINCT `table_1`.`column_3` AS `alias_1` FROM `table_1` WHERE (`table_1`.`column_3` > ?)
? = 10
----
1712579571
1780705199
1943443348
2086943962

query  rowsort
SELECT min(`table_1`.`column_4`) AS `alias_1` FROM `table_1` WHERE (`table_1`.`column_3` > ?)
? = 10
----
-1361583487

query  rowsort
SELECT DISTINCT min(`table_1`.`column_5`) AS `alias_1` FROM `table_1` WHERE (`table_1`.`column_3` > ?)
? = 10
----
-1664843899

statement ok
DELETE FROM `table_1` WHERE (`column_6` = 0)


statement ok
DELETE FROM `table_1` WHERE (`column_6` = 1)


statement ok
DELETE FROM `table_1` WHERE (`column_6` = 2)


statement ok
DELETE FROM `table_1` WHERE (`column_6` = 3)


statement ok
DELETE FROM `table_1` WHERE (`column_6` = 4)


query  rowsort
SELECT DISTINCT `table_1`.`column_1` AS `alias_1` FROM `table_1`
----
-20224031
-848327270
-861383761
1974158872
2018285314

query  rowsort
SELECT min(`table_1`.`column_2`) AS `alias_1` FROM `table_1`
----
-941033164

query  rowsort
SELECT `table_1`.`column_2` AS `alias_1` FROM `table_1` WHERE (`table_1`.`column_2` > ?)
? = 10
----
1063507498
802830070

query  rowsort
SELECT DISTINCT min(`table_1`.`column_3`) AS `alias_1` FROM `table_1`
----
-1506283701

query  rowsort
SELECT DISTINCT `table_1`.`column_3` AS `alias_1` FROM `table_1` WHERE (`table_1`.`column_3` > ?)
? = 10
----
1780705199
2086943962

query  rowsort
SELECT min(`table_1`.`column_4`) AS `alias_1` FROM `table_1` WHERE (`table_1`.`column_3` > ?)
? = 10
----
-1361583487

query  rowsort
SELECT DISTINCT min(`table_1`.`column_5`) AS `alias_1` FROM `table_1` WHERE (`table_1`.`column_3` > ?)
? = 10
----
-1664843899
