# Generated by:
#     target/debug/noria-logictest generate --operations group_concat,single_parameter --compare-to mysql://root@localhost/mysql --subquery-depth 1 --rows-per-table 5 -o logictests/generated/group_concat,single_parameter.test --include-deletes
# failure: ENG-339

statement ok
CREATE TABLE table_1 (column_3 INT(32), column_1 TEXT, column_2 TEXT, PRIMARY KEY (column_3))


statement ok
INSERT INTO table_1 (column_1, column_3, column_2) VALUES ('a', 2, 'a'), ('a', 3, 'a'), ('a', 4, 'a'), ('a', 5, 'a'), ('a', 6, 'a')


query  nosort
SELECT group_concat(table_1.column_1 separator ', ') AS alias_1 FROM table_1
----
a, a, a, a, a

query  nosort
SELECT table_1.column_1 AS alias_1 FROM table_1 WHERE (table_1.column_1 = ?)
? = a
----
a
a
a
a
a

query  nosort
SELECT group_concat(table_1.column_2 separator ', ') AS alias_1 FROM table_1 WHERE (table_1.column_1 = ?)
? = a
----
a, a, a, a, a

statement ok
DELETE FROM table_1 WHERE (column_3 = 2)


statement ok
DELETE FROM table_1 WHERE (column_3 = 3)


query  nosort
SELECT group_concat(table_1.column_1 separator ', ') AS alias_1 FROM table_1
----
a, a, a

query  nosort
SELECT table_1.column_1 AS alias_1 FROM table_1 WHERE (table_1.column_1 = ?)
? = a
----
a
a
a

query  nosort
SELECT group_concat(table_1.column_2 separator ', ') AS alias_1 FROM table_1 WHERE (table_1.column_1 = ?)
? = a
----
a, a, a
