# Generated by:
#     target/debug/noria-logictest generate --operations group_concat,max,distinct --compare-to mysql://root@localhost/mysql --subquery-depth 1 --rows-per-table 5 -o logictests/generated/group_concat,max,distinct.test --include-deletes
# failure: ENG-339

statement ok
CREATE TABLE table_1 (column_2 INT(32), column_5 TEXT, column_1 TEXT, column_7 TEXT, column_3 TEXT, column_9 INT(32), column_6 INT(32), column_8 INT(32), column_4 INT(32), PRIMARY KEY (column_9))


statement ok
INSERT INTO table_1 (column_5, column_9, column_2, column_1, column_8, column_4, column_6, column_7, column_3) VALUES ('a', 2, 1, 'a', 1, 1, 1, 'a', 'a'), ('a', 3, 1, 'a', 1, 1, 1, 'a', 'a'), ('a', 4, 1, 'a', 1, 1, 1, 'a', 'a'), ('a', 5, 1, 'a', 1, 1, 1, 'a', 'a'), ('a', 6, 1, 'a', 1, 1, 1, 'a', 'a')


query  nosort
SELECT group_concat(table_1.column_1 separator ', ') AS alias_1 FROM table_1
----
a, a, a, a, a

query  nosort
SELECT max(table_1.column_2) AS alias_1 FROM table_1
----
1

query  nosort
SELECT DISTINCT table_1.column_1 AS alias_1 FROM table_1
----
a

query  nosort
SELECT group_concat(table_1.column_3 separator ', ') AS alias_1, max(table_1.column_4) AS alias_2 FROM table_1
----
a, a, a, a, a
1

query  nosort
SELECT DISTINCT group_concat(table_1.column_5 separator ', ') AS alias_1 FROM table_1
----
a, a, a, a, a

query  nosort
SELECT DISTINCT max(table_1.column_6) AS alias_1 FROM table_1
----
1

query  nosort
SELECT DISTINCT group_concat(table_1.column_7 separator ', ') AS alias_1, max(table_1.column_8) AS alias_2 FROM table_1
----
a, a, a, a, a
1

statement ok
DELETE FROM table_1 WHERE (column_9 = 2)


statement ok
DELETE FROM table_1 WHERE (column_9 = 3)


query  nosort
SELECT group_concat(table_1.column_1 separator ', ') AS alias_1 FROM table_1
----
a, a, a

query  nosort
SELECT max(table_1.column_2) AS alias_1 FROM table_1
----
1

query  nosort
SELECT DISTINCT table_1.column_1 AS alias_1 FROM table_1
----
a

query  nosort
SELECT group_concat(table_1.column_3 separator ', ') AS alias_1, max(table_1.column_4) AS alias_2 FROM table_1
----
a, a, a
1

query  nosort
SELECT DISTINCT group_concat(table_1.column_5 separator ', ') AS alias_1 FROM table_1
----
a, a, a

query  nosort
SELECT DISTINCT max(table_1.column_6) AS alias_1 FROM table_1
----
1

query  nosort
SELECT DISTINCT group_concat(table_1.column_7 separator ', ') AS alias_1, max(table_1.column_8) AS alias_2 FROM table_1
----
a, a, a
1
