# Generated by:
#     target/debug/noria-logictest permute --compare-to mysql://root:noria@127.1/noria -d 3 -o logictests/generated/mysql/ --only range_param --random --include-deletes --rows-per-table 10 --subquery-depth 1

statement ok
CREATE TABLE `table_13` (`column_1` INT, `column_3` INT, `column_2` INT, PRIMARY KEY (`column_3`))


statement ok
CREATE TABLE `table_1` (`column_4` INT, `column_8` INT, `column_1` INT, `column_3` INT, `column_6` INT, `column_7` INT, `column_5` INT, `column_2` INT, PRIMARY KEY (`column_8`))


statement ok
CREATE TABLE `table_5` (`column_1` INT, `column_2` INT, `column_3` INT, PRIMARY KEY (`column_3`))


statement ok
CREATE TABLE `table_10` (`column_1` INT, `column_2` INT, `column_3` INT, PRIMARY KEY (`column_3`))


statement ok
CREATE TABLE `table_6` (`column_1` INT, `column_3` INT, `column_2` INT, PRIMARY KEY (`column_3`))


statement ok
CREATE TABLE `table_7` (`column_2` INT, `column_3` INT, `column_1` INT, PRIMARY KEY (`column_3`))


statement ok
CREATE TABLE `table_11` (`column_2` INT, `column_3` INT, `column_1` INT, PRIMARY KEY (`column_3`))


statement ok
CREATE TABLE `table_3` (`column_5` INT, `column_8` INT, `column_2` INT, `column_6` INT, `column_4` INT, `column_1` INT, `column_7` INT, `column_3` INT, PRIMARY KEY (`column_8`))


statement ok
CREATE TABLE `table_2` (`column_2` INT, `column_4` INT, `column_1` INT, `column_3` INT, PRIMARY KEY (`column_4`))


statement ok
CREATE TABLE `table_9` (`column_3` INT, `column_1` INT, `column_2` INT, PRIMARY KEY (`column_3`))


statement ok
CREATE TABLE `table_8` (`column_3` INT, `column_1` INT, `column_2` INT, PRIMARY KEY (`column_3`))


statement ok
CREATE TABLE `table_12` (`column_2` INT, `column_1` INT, `column_3` INT, PRIMARY KEY (`column_3`))


statement ok
CREATE TABLE `table_4` (`column_2` INT, `column_3` INT, `column_1` INT, PRIMARY KEY (`column_3`))


statement ok
INSERT INTO `table_13` (`column_1`, `column_3`, `column_2`) VALUES (-421619934, 0, 825387493), (486822416, 1, 2005728258), (-2055809776, 2, -1739788450), (-1642656325, 3, -746004358), (972548609, 4, -1093944860), (1014018619, 5, 1950363443), (251145695, 6, -1809009502), (78051419, 7, -82796654), (532918445, 8, 1789123584), (51967514, 9, 447720133)


statement ok
INSERT INTO `table_1` (`column_4`, `column_8`, `column_1`, `column_3`, `column_6`, `column_7`, `column_5`, `column_2`) VALUES (-1860414826, 0, 1215023867, -250614102, -1837958647, 2077978894, 960295503, -1835954851), (-1628377986, 1, 1852961594, 1052181595, -13673344, -1644390388, -1977126484, 2069916388), (-2025814274, 2, -799748993, 560018402, -2036305854, -1500428233, 1187402933, 345732612), (-1065836363, 3, -499525589, 614430209, 1398232520, 1314032146, 477806874, -1900941578), (-2086132388, 4, 735154324, -1417439767, -455642495, 741853454, 494138589, -671039657), (-491970931, 5, 183000863, -129328911, 946278468, -118718972, 193049658, -239311798), (2052047096, 6, 1644184679, -559430878, 1649175447, 711221373, 651991452, -1102473655), (2145046995, 7, -1230047632, -1128798931, -1374013668, -1885502057, 1470196066, 2103482673), (-583487548, 8, 1422300884, 2023993082, -82426864, -443289640, -688302456, -1883839867), (1883458603, 9, -246153771, -400350722, -178519345, 1719604502, 516068718, 294828323)


statement ok
INSERT INTO `table_5` (`column_1`, `column_2`, `column_3`) VALUES (-32733137, -2132003060, 0), (703864444, 1820654153, 1), (-1687552459, 1398023743, 2), (-694664959, -1407081540, 3), (-1987675742, 988048581, 4), (-1975584620, 830572083, 5), (819869278, -1677036133, 6), (1500295446, -1990594061, 7), (-285536946, 1789789975, 8), (-1728249846, -235926201, 9)


statement ok
INSERT INTO `table_10` (`column_1`, `column_2`, `column_3`) VALUES (-1171576355, 14862389, 0), (690938821, 1826074888, 1), (-1795988051, 566934957, 2), (21066547, -1987828986, 3), (-1231981796, 1629833121, 4), (870382490, -751101404, 5), (727645620, 1186524212, 6), (-1459728753, -581810193, 7), (-1492126984, -312808499, 8), (859017986, -2097422854, 9)


statement ok
INSERT INTO `table_6` (`column_1`, `column_3`, `column_2`) VALUES (-1105046818, 0, -1734544242), (1173777277, 1, 1557767247), (796486118, 2, 264930307), (356771814, 3, -223532414), (812286252, 4, -921230897), (-1486403915, 5, 173998160), (1219143901, 6, -843956896), (-2022470711, 7, -1641343980), (412717387, 8, -1205884942), (-1136394244, 9, -536860959)


statement ok
INSERT INTO `table_7` (`column_2`, `column_3`, `column_1`) VALUES (811532493, 0, -1201259204), (892723544, 1, 1527495674), (988649192, 2, -769798045), (-1543204175, 3, -363152939), (-2009738510, 4, 211588159), (-638599299, 5, -1825247644), (-37291057, 6, -506918037), (-59584531, 7, 114429835), (-1825580416, 8, 543494915), (1307793402, 9, -877299912)


statement ok
INSERT INTO `table_11` (`column_2`, `column_3`, `column_1`) VALUES (-323261169, 0, -74464050), (792845072, 1, 1684069123), (-771335111, 2, -1554215427), (-394670219, 3, 1090005384), (-501151566, 4, -955952630), (39752581, 5, -2103841921), (-1978880761, 6, 1703526586), (-633286832, 7, -1566666453), (-1432265476, 8, -707166941), (-973231506, 9, -1291302741)


statement ok
INSERT INTO `table_3` (`column_5`, `column_8`, `column_2`, `column_6`, `column_4`, `column_1`, `column_7`, `column_3`) VALUES (1101267412, 0, -925830902, -2067788134, 747258388, 739722085, 940524215, -1043717698), (-1988136549, 1, 1633739324, 1723202836, -783627952, 1268684396, 1101439336, 1373211984), (1830616237, 2, 441920714, 199849481, 2016912829, -1882618809, -2059511507, -153047924), (-1935263642, 3, -1244375392, -1072033192, -1718572907, -266558241, 1009254548, -1341847047), (1074613694, 4, -920299618, -14652270, -1918319128, 1574702925, -596169274, -1989538187), (1645151670, 5, -1157583885, 513168385, 797416578, 103026393, 510134085, -1486140323), (-1319817094, 6, 38990193, -1476969215, 1808804044, 1196437800, -820290669, -859257539), (-752822731, 7, -215816526, -104594389, 675463074, 2102090237, 1911646523, 1083183969), (-1550573989, 8, -2122417993, 1593239867, 1205726033, -706422985, 159247553, -2091866507), (1404114825, 9, -2118694656, 1590107683, 263912340, -220683084, 559295261, -1069321756)


statement ok
INSERT INTO `table_2` (`column_2`, `column_4`, `column_1`, `column_3`) VALUES (-12258889, 0, -1362888248, 540337359), (-121572314, 1, -1313334775, 697088900), (363184769, 2, -828795201, -543288376), (345996650, 3, 703851957, 1906208255), (-592755611, 4, -1357458680, -634526675), (-1065156326, 5, -507288410, 1067610850), (1484425552, 6, -312647317, -1463685571), (1345101418, 7, 1950095135, -1593874037), (-1363206154, 8, 1996080954, 796167121), (-1209391103, 9, 1656038186, -937551618)


statement ok
INSERT INTO `table_9` (`column_3`, `column_1`, `column_2`) VALUES (0, 56645409, -655325897), (1, 1587712022, -80373673), (2, -40330509, -748378358), (3, -751480484, -581499835), (4, 804761274, 1077354081), (5, 1945032409, -563444845), (6, 1969174820, 1290525704), (7, 2008881560, -1009134865), (8, 570259757, 162206700), (9, -626064387, -893460515)


statement ok
INSERT INTO `table_8` (`column_3`, `column_1`, `column_2`) VALUES (0, -303568596, 309729044), (1, 1573432227, 1250714325), (2, 1062943743, 1391881821), (3, -2034029624, 1029596626), (4, 1389301812, -396171577), (5, 2129862249, 1874620368), (6, 37045380, -1841973695), (7, 1460000446, 702628181), (8, -810669695, 1012882698), (9, -301794818, 1540193032)


statement ok
INSERT INTO `table_12` (`column_2`, `column_1`, `column_3`) VALUES (-1257063792, -583735493, 0), (2130043545, -1977549574, 1), (-2112307713, 886044362, 2), (-526245502, -1612622299, 3), (-958928175, -1491172790, 4), (-963643321, 1711997606, 5), (1198377920, -991659055, 6), (2146063975, 2071415625, 7), (1530135904, 605223670, 8), (-1743479348, 1532250855, 9)


statement ok
INSERT INTO `table_4` (`column_2`, `column_3`, `column_1`) VALUES (582269602, 0, 2008994108), (-314876998, 1, 1676619537), (1730510137, 2, 826913242), (-362453127, 3, 134381341), (1860668359, 4, 1908376886), (693223696, 5, 1519241427), (1500735127, 6, -1274224424), (-2128392823, 7, -1794446811), (-1777858046, 8, -576117904), (-2075825778, 9, 604033044)


query  rowsort
SELECT `table_1`.`column_2` AS `alias_1`, `table_2`.`column_2` AS `alias_2` FROM `table_1` INNER JOIN `table_2` ON (`table_1`.`column_1` = `table_2`.`column_1`) INNER JOIN (SELECT `table_2`.`column_3` AS `alias_3`, `table_3`.`column_2` AS `alias_4` FROM `table_2` INNER JOIN `table_3` ON (`table_2`.`column_1` = `table_3`.`column_1`)) AS alias_5 ON (`table_1`.`column_1` = `alias_5`.`alias_3`)
----


query  rowsort
SELECT `table_3`.`column_3` AS `alias_1`, `table_4`.`column_2` AS `alias_2` FROM `table_3` INNER JOIN `table_4` ON (`table_3`.`column_1` = `table_4`.`column_1`) INNER JOIN (SELECT `table_4`.`column_2` AS `alias_3` FROM `table_4`) AS alias_4 ON (`table_3`.`column_1` = `alias_4`.`alias_3`)
----


query  rowsort
SELECT `table_3`.`column_4` AS `alias_1`, `table_5`.`column_2` AS `alias_2` FROM `table_3` INNER JOIN `table_5` ON (`table_3`.`column_1` = `table_5`.`column_1`) INNER JOIN (SELECT `table_3`.`column_5` AS `alias_3`, `table_6`.`column_2` AS `alias_4` FROM `table_3` INNER JOIN `table_6` ON (`table_3`.`column_1` = `table_6`.`column_1`)) AS alias_5 ON (`table_3`.`column_1` = `alias_5`.`alias_3`)
----


query  rowsort
SELECT `table_3`.`column_1` AS `alias_4` FROM `table_3` INNER JOIN (SELECT `table_3`.`column_6` AS `alias_1`, `table_7`.`column_2` AS `alias_2` FROM `table_3` INNER JOIN `table_7` ON (`table_3`.`column_1` = `table_7`.`column_1`)) AS alias_3 ON (`table_3`.`column_1` = `alias_3`.`alias_1`) WHERE (`table_3`.`column_1` > ?)
? = 10
----


query  rowsort
SELECT `table_3`.`column_1` AS `alias_3` FROM `table_3` INNER JOIN (SELECT `table_3`.`column_1` AS `alias_1` FROM `table_3`) AS alias_2 ON (`table_3`.`column_1` = `alias_2`.`alias_1`) WHERE (`table_3`.`column_1` > ?)
? = 10
----
103026393
1196437800
1268684396
1574702925
2102090237
739722085

query  rowsort
SELECT `table_3`.`column_1` AS `alias_4` FROM `table_3` INNER JOIN (SELECT `table_3`.`column_7` AS `alias_1`, `table_8`.`column_2` AS `alias_2` FROM `table_3` INNER JOIN `table_8` ON (`table_3`.`column_1` = `table_8`.`column_1`)) AS alias_3 ON (`table_3`.`column_1` = `alias_3`.`alias_1`) WHERE (`table_3`.`column_1` > ?)
? = 10
----


query  rowsort
SELECT `table_1`.`column_3` AS `alias_1`, `table_9`.`column_2` AS `alias_2` FROM `table_1` INNER JOIN `table_9` ON (`table_1`.`column_1` = `table_9`.`column_1`) INNER JOIN (SELECT `table_1`.`column_4` AS `alias_3`, `table_10`.`column_2` AS `alias_4` FROM `table_1` INNER JOIN `table_10` ON (`table_1`.`column_1` = `table_10`.`column_1`)) AS alias_5 ON (`table_1`.`column_4` = `alias_5`.`alias_3`) WHERE (`table_1`.`column_1` > ?)
? = 10
----


query  rowsort
SELECT `table_1`.`column_5` AS `alias_1`, `table_11`.`column_2` AS `alias_2` FROM `table_1` INNER JOIN `table_11` ON (`table_1`.`column_4` = `table_11`.`column_1`) INNER JOIN (SELECT `table_1`.`column_4` AS `alias_3` FROM `table_1`) AS alias_4 ON (`table_1`.`column_4` = `alias_4`.`alias_3`) WHERE (`table_1`.`column_4` > ?)
? = 10
----


query  rowsort
SELECT `table_1`.`column_6` AS `alias_1`, `table_12`.`column_2` AS `alias_2` FROM `table_1` INNER JOIN `table_12` ON (`table_1`.`column_4` = `table_12`.`column_1`) INNER JOIN (SELECT `table_1`.`column_7` AS `alias_3`, `table_13`.`column_2` AS `alias_4` FROM `table_1` INNER JOIN `table_13` ON (`table_1`.`column_4` = `table_13`.`column_1`)) AS alias_5 ON (`table_1`.`column_4` = `alias_5`.`alias_3`) WHERE (`table_1`.`column_4` > ?)
? = 10
----


statement ok
DELETE FROM `table_13` WHERE (`column_3` = 0)


statement ok
DELETE FROM `table_13` WHERE (`column_3` = 1)


statement ok
DELETE FROM `table_13` WHERE (`column_3` = 2)


statement ok
DELETE FROM `table_13` WHERE (`column_3` = 3)


statement ok
DELETE FROM `table_13` WHERE (`column_3` = 4)


statement ok
DELETE FROM `table_1` WHERE (`column_8` = 0)


statement ok
DELETE FROM `table_1` WHERE (`column_8` = 1)


statement ok
DELETE FROM `table_1` WHERE (`column_8` = 2)


statement ok
DELETE FROM `table_1` WHERE (`column_8` = 3)


statement ok
DELETE FROM `table_1` WHERE (`column_8` = 4)


statement ok
DELETE FROM `table_5` WHERE (`column_3` = 0)


statement ok
DELETE FROM `table_5` WHERE (`column_3` = 1)


statement ok
DELETE FROM `table_5` WHERE (`column_3` = 2)


statement ok
DELETE FROM `table_5` WHERE (`column_3` = 3)


statement ok
DELETE FROM `table_5` WHERE (`column_3` = 4)


statement ok
DELETE FROM `table_10` WHERE (`column_3` = 0)


statement ok
DELETE FROM `table_10` WHERE (`column_3` = 1)


statement ok
DELETE FROM `table_10` WHERE (`column_3` = 2)


statement ok
DELETE FROM `table_10` WHERE (`column_3` = 3)


statement ok
DELETE FROM `table_10` WHERE (`column_3` = 4)


statement ok
DELETE FROM `table_6` WHERE (`column_3` = 0)


statement ok
DELETE FROM `table_6` WHERE (`column_3` = 1)


statement ok
DELETE FROM `table_6` WHERE (`column_3` = 2)


statement ok
DELETE FROM `table_6` WHERE (`column_3` = 3)


statement ok
DELETE FROM `table_6` WHERE (`column_3` = 4)


statement ok
DELETE FROM `table_7` WHERE (`column_3` = 0)


statement ok
DELETE FROM `table_7` WHERE (`column_3` = 1)


statement ok
DELETE FROM `table_7` WHERE (`column_3` = 2)


statement ok
DELETE FROM `table_7` WHERE (`column_3` = 3)


statement ok
DELETE FROM `table_7` WHERE (`column_3` = 4)


statement ok
DELETE FROM `table_11` WHERE (`column_3` = 0)


statement ok
DELETE FROM `table_11` WHERE (`column_3` = 1)


statement ok
DELETE FROM `table_11` WHERE (`column_3` = 2)


statement ok
DELETE FROM `table_11` WHERE (`column_3` = 3)


statement ok
DELETE FROM `table_11` WHERE (`column_3` = 4)


statement ok
DELETE FROM `table_3` WHERE (`column_8` = 0)


statement ok
DELETE FROM `table_3` WHERE (`column_8` = 1)


statement ok
DELETE FROM `table_3` WHERE (`column_8` = 2)


statement ok
DELETE FROM `table_3` WHERE (`column_8` = 3)


statement ok
DELETE FROM `table_3` WHERE (`column_8` = 4)


statement ok
DELETE FROM `table_2` WHERE (`column_4` = 0)


statement ok
DELETE FROM `table_2` WHERE (`column_4` = 1)


statement ok
DELETE FROM `table_2` WHERE (`column_4` = 2)


statement ok
DELETE FROM `table_2` WHERE (`column_4` = 3)


statement ok
DELETE FROM `table_2` WHERE (`column_4` = 4)


statement ok
DELETE FROM `table_9` WHERE (`column_3` = 0)


statement ok
DELETE FROM `table_9` WHERE (`column_3` = 1)


statement ok
DELETE FROM `table_9` WHERE (`column_3` = 2)


statement ok
DELETE FROM `table_9` WHERE (`column_3` = 3)


statement ok
DELETE FROM `table_9` WHERE (`column_3` = 4)


statement ok
DELETE FROM `table_8` WHERE (`column_3` = 0)


statement ok
DELETE FROM `table_8` WHERE (`column_3` = 1)


statement ok
DELETE FROM `table_8` WHERE (`column_3` = 2)


statement ok
DELETE FROM `table_8` WHERE (`column_3` = 3)


statement ok
DELETE FROM `table_8` WHERE (`column_3` = 4)


statement ok
DELETE FROM `table_12` WHERE (`column_3` = 0)


statement ok
DELETE FROM `table_12` WHERE (`column_3` = 1)


statement ok
DELETE FROM `table_12` WHERE (`column_3` = 2)


statement ok
DELETE FROM `table_12` WHERE (`column_3` = 3)


statement ok
DELETE FROM `table_12` WHERE (`column_3` = 4)


statement ok
DELETE FROM `table_4` WHERE (`column_3` = 0)


statement ok
DELETE FROM `table_4` WHERE (`column_3` = 1)


statement ok
DELETE FROM `table_4` WHERE (`column_3` = 2)


statement ok
DELETE FROM `table_4` WHERE (`column_3` = 3)


statement ok
DELETE FROM `table_4` WHERE (`column_3` = 4)


query  rowsort
SELECT `table_1`.`column_2` AS `alias_1`, `table_2`.`column_2` AS `alias_2` FROM `table_1` INNER JOIN `table_2` ON (`table_1`.`column_1` = `table_2`.`column_1`) INNER JOIN (SELECT `table_2`.`column_3` AS `alias_3`, `table_3`.`column_2` AS `alias_4` FROM `table_2` INNER JOIN `table_3` ON (`table_2`.`column_1` = `table_3`.`column_1`)) AS alias_5 ON (`table_1`.`column_1` = `alias_5`.`alias_3`)
----


query  rowsort
SELECT `table_3`.`column_3` AS `alias_1`, `table_4`.`column_2` AS `alias_2` FROM `table_3` INNER JOIN `table_4` ON (`table_3`.`column_1` = `table_4`.`column_1`) INNER JOIN (SELECT `table_4`.`column_2` AS `alias_3` FROM `table_4`) AS alias_4 ON (`table_3`.`column_1` = `alias_4`.`alias_3`)
----


query  rowsort
SELECT `table_3`.`column_4` AS `alias_1`, `table_5`.`column_2` AS `alias_2` FROM `table_3` INNER JOIN `table_5` ON (`table_3`.`column_1` = `table_5`.`column_1`) INNER JOIN (SELECT `table_3`.`column_5` AS `alias_3`, `table_6`.`column_2` AS `alias_4` FROM `table_3` INNER JOIN `table_6` ON (`table_3`.`column_1` = `table_6`.`column_1`)) AS alias_5 ON (`table_3`.`column_1` = `alias_5`.`alias_3`)
----


query  rowsort
SELECT `table_3`.`column_1` AS `alias_4` FROM `table_3` INNER JOIN (SELECT `table_3`.`column_6` AS `alias_1`, `table_7`.`column_2` AS `alias_2` FROM `table_3` INNER JOIN `table_7` ON (`table_3`.`column_1` = `table_7`.`column_1`)) AS alias_3 ON (`table_3`.`column_1` = `alias_3`.`alias_1`) WHERE (`table_3`.`column_1` > ?)
? = 10
----


query  rowsort
SELECT `table_3`.`column_1` AS `alias_3` FROM `table_3` INNER JOIN (SELECT `table_3`.`column_1` AS `alias_1` FROM `table_3`) AS alias_2 ON (`table_3`.`column_1` = `alias_2`.`alias_1`) WHERE (`table_3`.`column_1` > ?)
? = 10
----
103026393
1196437800
2102090237

query  rowsort
SELECT `table_3`.`column_1` AS `alias_4` FROM `table_3` INNER JOIN (SELECT `table_3`.`column_7` AS `alias_1`, `table_8`.`column_2` AS `alias_2` FROM `table_3` INNER JOIN `table_8` ON (`table_3`.`column_1` = `table_8`.`column_1`)) AS alias_3 ON (`table_3`.`column_1` = `alias_3`.`alias_1`) WHERE (`table_3`.`column_1` > ?)
? = 10
----


query  rowsort
SELECT `table_1`.`column_3` AS `alias_1`, `table_9`.`column_2` AS `alias_2` FROM `table_1` INNER JOIN `table_9` ON (`table_1`.`column_1` = `table_9`.`column_1`) INNER JOIN (SELECT `table_1`.`column_4` AS `alias_3`, `table_10`.`column_2` AS `alias_4` FROM `table_1` INNER JOIN `table_10` ON (`table_1`.`column_1` = `table_10`.`column_1`)) AS alias_5 ON (`table_1`.`column_4` = `alias_5`.`alias_3`) WHERE (`table_1`.`column_1` > ?)
? = 10
----


query  rowsort
SELECT `table_1`.`column_5` AS `alias_1`, `table_11`.`column_2` AS `alias_2` FROM `table_1` INNER JOIN `table_11` ON (`table_1`.`column_4` = `table_11`.`column_1`) INNER JOIN (SELECT `table_1`.`column_4` AS `alias_3` FROM `table_1`) AS alias_4 ON (`table_1`.`column_4` = `alias_4`.`alias_3`) WHERE (`table_1`.`column_4` > ?)
? = 10
----


query  rowsort
SELECT `table_1`.`column_6` AS `alias_1`, `table_12`.`column_2` AS `alias_2` FROM `table_1` INNER JOIN `table_12` ON (`table_1`.`column_4` = `table_12`.`column_1`) INNER JOIN (SELECT `table_1`.`column_7` AS `alias_3`, `table_13`.`column_2` AS `alias_4` FROM `table_1` INNER JOIN `table_13` ON (`table_1`.`column_4` = `table_13`.`column_1`)) AS alias_5 ON (`table_1`.`column_4` = `alias_5`.`alias_3`) WHERE (`table_1`.`column_4` > ?)
? = 10
----

