# Generated by:
#     target/debug/noria-logictest permute --compare-to mysql://root:noria@127.1/noria -d 3 -o logictests/generated/mysql/ --only range_param --random --include-deletes --rows-per-table 10 --subquery-depth 1 --overwrite-tests

statement ok
CREATE TABLE `table_1` (`column_3` INT, `column_4` INT, `column_5` INT, `column_1` INT, `column_2` INT, PRIMARY KEY (`column_5`))


statement ok
INSERT INTO `table_1` (`column_3`, `column_4`, `column_5`, `column_1`, `column_2`) VALUES (332164632, -566021984, 0, 859983085, 610969175), (647664202, 391429010, 1, -1119778569, 762958322), (1297281842, -773799291, 2, -1768394565, 445932376), (56600491, -909241949, 3, -1607428242, -1359679115), (598700463, 1548798806, 4, -68448521, 188960134), (37312856, 1938165754, 5, -241367749, 435312870), (-1128135896, -1882142971, 6, 1287920955, 200128165), (631615613, -701657139, 7, -1835107719, 2063745272), (-906521064, -835280674, 8, 1016257894, 928556737), (-1601328596, -2073296384, 9, -1408544772, -55034733)


query  rowsort
SELECT min(`table_1`.`column_1`) AS `alias_1` FROM `table_1`
----
-1835107719

query  rowsort
SELECT DISTINCT `table_1`.`column_1` AS `alias_1` FROM `table_1`
----
-1119778569
-1408544772
-1607428242
-1768394565
-1835107719
-241367749
-68448521
1016257894
1287920955
859983085

query  rowsort
SELECT `table_1`.`column_1` AS `alias_1` FROM `table_1` WHERE (`table_1`.`column_1` > ?)
? = 10
----
1016257894
1287920955
859983085

query  rowsort
SELECT DISTINCT min(`table_1`.`column_2`) AS `alias_1` FROM `table_1`
----
-1359679115

query  rowsort
SELECT min(`table_1`.`column_3`) AS `alias_1` FROM `table_1` WHERE (`table_1`.`column_3` > ?)
? = 10
----
37312856

query  rowsort
SELECT DISTINCT `table_1`.`column_3` AS `alias_1` FROM `table_1` WHERE (`table_1`.`column_3` > ?)
? = 10
----
1297281842
332164632
37312856
56600491
598700463
631615613
647664202

query  rowsort
SELECT DISTINCT min(`table_1`.`column_4`) AS `alias_1` FROM `table_1` WHERE (`table_1`.`column_3` > ?)
? = 10
----
-909241949

statement ok
DELETE FROM `table_1` WHERE (`column_5` = 0)


statement ok
DELETE FROM `table_1` WHERE (`column_5` = 1)


statement ok
DELETE FROM `table_1` WHERE (`column_5` = 2)


statement ok
DELETE FROM `table_1` WHERE (`column_5` = 3)


statement ok
DELETE FROM `table_1` WHERE (`column_5` = 4)


query  rowsort
SELECT min(`table_1`.`column_1`) AS `alias_1` FROM `table_1`
----
-1835107719

query  rowsort
SELECT DISTINCT `table_1`.`column_1` AS `alias_1` FROM `table_1`
----
-1408544772
-1835107719
-241367749
1016257894
1287920955

query  rowsort
SELECT `table_1`.`column_1` AS `alias_1` FROM `table_1` WHERE (`table_1`.`column_1` > ?)
? = 10
----
1016257894
1287920955

query  rowsort
SELECT DISTINCT min(`table_1`.`column_2`) AS `alias_1` FROM `table_1`
----
-55034733

query  rowsort
SELECT min(`table_1`.`column_3`) AS `alias_1` FROM `table_1` WHERE (`table_1`.`column_3` > ?)
? = 10
----
37312856

query  rowsort
SELECT DISTINCT `table_1`.`column_3` AS `alias_1` FROM `table_1` WHERE (`table_1`.`column_3` > ?)
? = 10
----
37312856
631615613

query  rowsort
SELECT DISTINCT min(`table_1`.`column_4`) AS `alias_1` FROM `table_1` WHERE (`table_1`.`column_3` > ?)
? = 10
----
-701657139
