# Generated by:
#     target/debug/noria-logictest permute --compare-to mysql://root:noria@127.1/noria -d 3 -o logictests/generated/mysql/ --only range_param --random --include-deletes --rows-per-table 10 --subquery-depth 1 --overwrite-tests

statement ok
CREATE TABLE `table_1` (`column_1` INT, `column_6` INT, `column_4` INT, `column_8` INT, `column_5` INT, `column_2` INT, `column_3` INT, `column_7` INT, `column_9` INT, PRIMARY KEY (`column_9`))


statement ok
INSERT INTO `table_1` (`column_1`, `column_6`, `column_4`, `column_8`, `column_5`, `column_2`, `column_3`, `column_7`, `column_9`) VALUES (267003753, 2008931492, 869356794, 2089962652, -1226178489, 2061683498, -887054799, 1755451420, 0), (-390996040, 750614752, 1543961704, -1133538100, 1099593190, -1650482881, -2088877746, -232317682, 1), (1012053238, -1861490970, 1269061170, -1095959934, 1377325299, -885741053, -119879756, -1293740833, 2), (-1782624451, 1347217094, 1032839992, -1071601771, 1693775403, -2100670109, -1443627389, -1507256896, 3), (-555029269, 1100086589, -1812677277, 250158583, -1539011282, -1990522603, -528977141, -1538250942, 4), (-1949881308, -720201555, -261968932, 252254674, 1738799389, -1441371270, -1108981190, 1866976248, 5), (446819557, 239411134, -753531579, -843436385, -299392555, 1127372137, -1604846678, -845356405, 6), (-993838137, 496195361, 31729414, -239395164, 58935316, 351472574, -1008084299, 331582867, 7), (560318320, -1028271123, -885031948, -1982159950, 487597842, -590551305, -230144233, -1088762287, 8), (-298962709, 2096767926, -564288243, 2077780218, -643107274, 1358478156, 865387036, 600234758, 9)


query  rowsort
SELECT min(`table_1`.`column_1`) AS `alias_1` FROM `table_1`
----
-1949881308

query  rowsort
SELECT avg(distinct `table_1`.`column_2`) AS `alias_1` FROM `table_1`
----
-376033285.6000

query  rowsort
SELECT `table_1`.`column_2` AS `alias_1` FROM `table_1` WHERE (`table_1`.`column_2` > ?)
? = 10
----
1127372137
1358478156
2061683498
351472574

query  rowsort
SELECT min(`table_1`.`column_3`) AS `alias_1`, avg(distinct `table_1`.`column_4`) AS `alias_2` FROM `table_1`
----
-2088877746
46945109.5000

query  rowsort
SELECT min(`table_1`.`column_5`) AS `alias_1` FROM `table_1` WHERE (`table_1`.`column_5` > ?)
? = 10
----
58935316

query  rowsort
SELECT avg(distinct `table_1`.`column_6`) AS `alias_1` FROM `table_1` WHERE (`table_1`.`column_5` > ?)
? = 10
----
-169322740.1667

query  rowsort
SELECT min(`table_1`.`column_7`) AS `alias_1`, avg(distinct `table_1`.`column_8`) AS `alias_2` FROM `table_1` WHERE (`table_1`.`column_1` > ?)
? = 10
----
-1293740833
-457898404.2500

statement ok
DELETE FROM `table_1` WHERE (`column_9` = 0)


statement ok
DELETE FROM `table_1` WHERE (`column_9` = 1)


statement ok
DELETE FROM `table_1` WHERE (`column_9` = 2)


statement ok
DELETE FROM `table_1` WHERE (`column_9` = 3)


statement ok
DELETE FROM `table_1` WHERE (`column_9` = 4)


query  rowsort
SELECT min(`table_1`.`column_1`) AS `alias_1` FROM `table_1`
----
-1949881308

query  rowsort
SELECT avg(distinct `table_1`.`column_2`) AS `alias_1` FROM `table_1`
----
161080058.4000

query  rowsort
SELECT `table_1`.`column_2` AS `alias_1` FROM `table_1` WHERE (`table_1`.`column_2` > ?)
? = 10
----
1127372137
1358478156
351472574

query  rowsort
SELECT min(`table_1`.`column_3`) AS `alias_1`, avg(distinct `table_1`.`column_4`) AS `alias_2` FROM `table_1`
----
-1604846678
-486618257.6000

query  rowsort
SELECT min(`table_1`.`column_5`) AS `alias_1` FROM `table_1` WHERE (`table_1`.`column_5` > ?)
? = 10
----
58935316

query  rowsort
SELECT avg(distinct `table_1`.`column_6`) AS `alias_1` FROM `table_1` WHERE (`table_1`.`column_5` > ?)
? = 10
----
-417425772.3333

query  rowsort
SELECT min(`table_1`.`column_7`) AS `alias_1`, avg(distinct `table_1`.`column_8`) AS `alias_2` FROM `table_1` WHERE (`table_1`.`column_1` > ?)
? = 10
----
-1088762287
-1412798167.5000
