# Generated by:
#     target/debug/noria-logictest permute --compare-to mysql://root:noria@127.1/noria -d 3 -o logictests/generated/mysql/ --only range_param --random --include-deletes --rows-per-table 10 --subquery-depth 1

statement ok
CREATE TABLE `table_1` (`column_1` INT, `column_2` INT, PRIMARY KEY (`column_2`))


statement ok
INSERT INTO `table_1` (`column_1`, `column_2`) VALUES (1376387028, 0), (-272214299, 1), (-1925504494, 2), (-1572566634, 3), (-487208227, 4), (-674419313, 5), (-1536401247, 6), (-980292116, 7), (-352021977, 8), (733967940, 9)


query  rowsort
SELECT 1 AS `alias_1`
----
1

query  rowsort
SELECT `table_1`.`column_1` AS `alias_1` FROM `table_1` WHERE (`table_1`.`column_1` > ?)
? = 10
----
1376387028
733967940

query  rowsort
SELECT `table_1`.`column_1` AS `alias_1` FROM `table_1` WHERE (`table_1`.`column_1` > ?)
? = 10
----
1376387028
733967940

query  rowsort
SELECT 1 AS `alias_1` FROM `table_1` WHERE (`table_1`.`column_1` > ?)
? = 10
----
1
1

query  rowsort
SELECT 1 AS `alias_1` FROM `table_1` WHERE (`table_1`.`column_1` > ?)
? = 10
----
1
1

query  rowsort
SELECT `table_1`.`column_1` AS `alias_1` FROM `table_1` WHERE ((`table_1`.`column_1` > ?) AND (`table_1`.`column_1` > ?))
? = 10
? = 10
----
1376387028
733967940

query  rowsort
SELECT 1 AS `alias_1` FROM `table_1` WHERE ((`table_1`.`column_1` > ?) AND (`table_1`.`column_1` > ?))
? = 10
? = 10
----
1
1

statement ok
DELETE FROM `table_1` WHERE (`column_2` = 0)


statement ok
DELETE FROM `table_1` WHERE (`column_2` = 1)


statement ok
DELETE FROM `table_1` WHERE (`column_2` = 2)


statement ok
DELETE FROM `table_1` WHERE (`column_2` = 3)


statement ok
DELETE FROM `table_1` WHERE (`column_2` = 4)


query  rowsort
SELECT 1 AS `alias_1`
----
1

query  rowsort
SELECT `table_1`.`column_1` AS `alias_1` FROM `table_1` WHERE (`table_1`.`column_1` > ?)
? = 10
----
733967940

query  rowsort
SELECT `table_1`.`column_1` AS `alias_1` FROM `table_1` WHERE (`table_1`.`column_1` > ?)
? = 10
----
733967940

query  rowsort
SELECT 1 AS `alias_1` FROM `table_1` WHERE (`table_1`.`column_1` > ?)
? = 10
----
1

query  rowsort
SELECT 1 AS `alias_1` FROM `table_1` WHERE (`table_1`.`column_1` > ?)
? = 10
----
1

query  rowsort
SELECT `table_1`.`column_1` AS `alias_1` FROM `table_1` WHERE ((`table_1`.`column_1` > ?) AND (`table_1`.`column_1` > ?))
? = 10
? = 10
----
733967940

query  rowsort
SELECT 1 AS `alias_1` FROM `table_1` WHERE ((`table_1`.`column_1` > ?) AND (`table_1`.`column_1` > ?))
? = 10
? = 10
----
1
