# Generated by:
#     target/debug/noria-logictest permute --compare-to mysql://root:noria@127.1/noria -d 3 -o logictests/generated/mysql/ --only range_param --random --include-deletes --rows-per-table 10 --subquery-depth 1

statement ok
CREATE TABLE `table_1` (`column_3` INT, `column_1` INT, `column_2` INT, `column_5` INT, `column_4` INT, PRIMARY KEY (`column_5`))


statement ok
INSERT INTO `table_1` (`column_3`, `column_1`, `column_2`, `column_5`, `column_4`) VALUES (872269857, 1423873651, 1848714273, 0, -527958285), (1583537920, -597976462, -1363483028, 1, 1983415979), (972783241, 1402202572, -50557465, 2, 1458937758), (1257362701, 676536064, 118136910, 3, 956990870), (-2004624767, -642070754, -1759181004, 4, -582001552), (-685788949, -251390538, 628139669, 5, -227158159), (66434894, 39459952, 1896127468, 6, 1531263962), (1291900318, -2055895652, -1590819955, 7, -595253401), (-2077470079, -1499812490, 483725643, 8, -466524478), (-188555257, -1509765245, 156856630, 9, -802007141)


query  rowsort
SELECT 1 AS `alias_1`
----
1

query  rowsort
SELECT max(`table_1`.`column_1`) AS `alias_1` FROM `table_1`
----
1423873651

query  rowsort
SELECT `table_1`.`column_1` AS `alias_1` FROM `table_1` WHERE (`table_1`.`column_1` > ?)
? = 10
----
1402202572
1423873651
39459952
676536064

query  rowsort
SELECT 1 AS `alias_1`, max(`table_1`.`column_2`) AS `alias_2` FROM `table_1`
----
1
1896127468

query  rowsort
SELECT 1 AS `alias_1` FROM `table_1` WHERE (`table_1`.`column_1` > ?)
? = 10
----
1
1
1
1

query  rowsort
SELECT max(`table_1`.`column_3`) AS `alias_1` FROM `table_1` WHERE (`table_1`.`column_3` > ?)
? = 10
----
1583537920

query  rowsort
SELECT 1 AS `alias_1`, max(`table_1`.`column_4`) AS `alias_2` FROM `table_1` WHERE (`table_1`.`column_3` > ?)
? = 10
----
1
1983415979

statement ok
DELETE FROM `table_1` WHERE (`column_5` = 0)


statement ok
DELETE FROM `table_1` WHERE (`column_5` = 1)


statement ok
DELETE FROM `table_1` WHERE (`column_5` = 2)


statement ok
DELETE FROM `table_1` WHERE (`column_5` = 3)


statement ok
DELETE FROM `table_1` WHERE (`column_5` = 4)


query  rowsort
SELECT 1 AS `alias_1`
----
1

query  rowsort
SELECT max(`table_1`.`column_1`) AS `alias_1` FROM `table_1`
----
39459952

query  rowsort
SELECT `table_1`.`column_1` AS `alias_1` FROM `table_1` WHERE (`table_1`.`column_1` > ?)
? = 10
----
39459952

query  rowsort
SELECT 1 AS `alias_1`, max(`table_1`.`column_2`) AS `alias_2` FROM `table_1`
----
1
1896127468

query  rowsort
SELECT 1 AS `alias_1` FROM `table_1` WHERE (`table_1`.`column_1` > ?)
? = 10
----
1

query  rowsort
SELECT max(`table_1`.`column_3`) AS `alias_1` FROM `table_1` WHERE (`table_1`.`column_3` > ?)
? = 10
----
1291900318

query  rowsort
SELECT 1 AS `alias_1`, max(`table_1`.`column_4`) AS `alias_2` FROM `table_1` WHERE (`table_1`.`column_3` > ?)
? = 10
----
1
1531263962
