# Generated by:
#     target/debug/noria-logictest permute --compare-to mysql://root:noria@127.1/noria -d 3 -o logictests/generated/mysql/ --only range_param --random --include-deletes --rows-per-table 10 --subquery-depth 1

statement ok
CREATE TABLE `table_1` (`column_5` INT, `column_6` INT, `column_4` INT, `column_3` INT, `column_2` INT, `column_1` INT, PRIMARY KEY (`column_6`))


statement ok
INSERT INTO `table_1` (`column_5`, `column_6`, `column_4`, `column_3`, `column_2`, `column_1`) VALUES (-2081039902, 0, -1841072362, -1924022224, 1651151034, -1916599942), (-1271131235, 1, 840637927, 479186318, -1366164800, -851996908), (-331460460, 2, 610072528, 1732562311, 1404659387, 1465475142), (1073539374, 3, 938352700, 1230504851, -732371883, -1803688372), (-496772423, 4, -1476206532, -386463830, 739726585, 732430497), (-633291646, 5, 1505007370, -1019113953, 2035134338, -1525427477), (-2068434455, 6, -2033293193, 1312567339, 1009500621, 2031216999), (1866837794, 7, -93661784, 1539650903, 762151521, -1032002853), (373458093, 8, 1345329751, 1110024593, 368459306, -1899350959), (-448157937, 9, 591137177, -1886258738, 242592838, -991871955)


query  rowsort
SELECT `table_1`.`column_1` AS `alias_1` FROM `table_1` WHERE (`table_1`.`column_1` > ?)
? = 10
----
1465475142
2031216999
732430497

query  rowsort
SELECT count(`table_1`.`column_2`) AS `alias_1` FROM `table_1`
----
10

query  rowsort
SELECT `table_1`.`column_2` AS `alias_1` FROM `table_1` WHERE (`table_1`.`column_2` > ?)
? = 10
----
1009500621
1404659387
1651151034
2035134338
242592838
368459306
739726585
762151521

query  rowsort
SELECT count(`table_1`.`column_3`) AS `alias_1` FROM `table_1` WHERE (`table_1`.`column_2` > ?)
? = 10
----
8

query  rowsort
SELECT `table_1`.`column_3` AS `alias_1` FROM `table_1` WHERE ((`table_1`.`column_3` > ?) AND (`table_1`.`column_3` > ?))
? = 10
? = 10
----
1110024593
1230504851
1312567339
1539650903
1732562311
479186318

query  rowsort
SELECT count(`table_1`.`column_4`) AS `alias_1` FROM `table_1` WHERE (`table_1`.`column_4` > ?)
? = 10
----
6

query  rowsort
SELECT count(`table_1`.`column_5`) AS `alias_1` FROM `table_1` WHERE ((`table_1`.`column_4` > ?) AND (`table_1`.`column_5` > ?))
? = 10
? = 10
----
2

statement ok
DELETE FROM `table_1` WHERE (`column_6` = 0)


statement ok
DELETE FROM `table_1` WHERE (`column_6` = 1)


statement ok
DELETE FROM `table_1` WHERE (`column_6` = 2)


statement ok
DELETE FROM `table_1` WHERE (`column_6` = 3)


statement ok
DELETE FROM `table_1` WHERE (`column_6` = 4)


query  rowsort
SELECT `table_1`.`column_1` AS `alias_1` FROM `table_1` WHERE (`table_1`.`column_1` > ?)
? = 10
----
2031216999

query  rowsort
SELECT count(`table_1`.`column_2`) AS `alias_1` FROM `table_1`
----
5

query  rowsort
SELECT `table_1`.`column_2` AS `alias_1` FROM `table_1` WHERE (`table_1`.`column_2` > ?)
? = 10
----
1009500621
2035134338
242592838
368459306
762151521

query  rowsort
SELECT count(`table_1`.`column_3`) AS `alias_1` FROM `table_1` WHERE (`table_1`.`column_2` > ?)
? = 10
----
5

query  rowsort
SELECT `table_1`.`column_3` AS `alias_1` FROM `table_1` WHERE ((`table_1`.`column_3` > ?) AND (`table_1`.`column_3` > ?))
? = 10
? = 10
----
1110024593
1312567339
1539650903

query  rowsort
SELECT count(`table_1`.`column_4`) AS `alias_1` FROM `table_1` WHERE (`table_1`.`column_4` > ?)
? = 10
----
3

query  rowsort
SELECT count(`table_1`.`column_5`) AS `alias_1` FROM `table_1` WHERE ((`table_1`.`column_4` > ?) AND (`table_1`.`column_5` > ?))
? = 10
? = 10
----
1
