# Generated by:
#     target/debug/noria-logictest permute -d 3 -o logictests/generated/mysql --only in_parameter --compare-to mysql://root:noria@localhost/mysql --subquery-depth 1 --rows-per-table 5 --include-deletes --overwrite-tests

statement ok
CREATE TABLE table_1 (column_7 INT, column_6 TEXT, column_1 INT, column_2 TEXT, column_5 INT, column_3 INT, column_8 TEXT, column_9 INT, column_4 TEXT, PRIMARY KEY (column_9))


statement ok
INSERT INTO table_1 (column_7, column_6, column_1, column_2, column_5, column_3, column_8, column_9, column_4) VALUES (2, 'a', 1, '0', 1, 1, 'a', 0, 'a'), (1, 'a', 1, 'a', 1, 1, 'a', 1, 'a'), (0, 'a', 1, '1', 1, 1, 'a', 2, 'a'), (1, 'a', 1, 'a', 1, 1, 'a', 3, 'a'), (1, 'a', 1, '2', 1, 1, 'a', 4, 'a')


query  rowsort
SELECT sum(table_1.column_1) AS alias_1 FROM table_1
----
5

query  rowsort
SELECT group_concat(table_1.column_2 separator ', ') AS alias_1 FROM table_1
----
0, a, 1, a, 2

query  rowsort
SELECT table_1.column_2 AS alias_1 FROM table_1 WHERE table_1.column_2 IN (?, ?, ?)
? = 0
? = 1
? = 2
----
0
1
2

query  rowsort
SELECT sum(table_1.column_3) AS alias_1, group_concat(table_1.column_4 separator ', ') AS alias_2 FROM table_1
----
5
a, a, a, a, a

query  rowsort
SELECT sum(table_1.column_5) AS alias_1 FROM table_1 WHERE table_1.column_2 IN (?, ?, ?)
? = 0
? = 1
? = 2
----
3

query  rowsort
SELECT group_concat(table_1.column_6 separator ', ') AS alias_1 FROM table_1 WHERE table_1.column_2 IN (?, ?, ?)
? = 0
? = 1
? = 2
----
a, a, a

query  rowsort
SELECT sum(table_1.column_7) AS alias_1, group_concat(table_1.column_8 separator ', ') AS alias_2 FROM table_1 WHERE table_1.column_7 IN (?, ?, ?)
? = 0
? = 1
? = 2
----
5
a, a, a, a, a

statement ok
DELETE FROM table_1 WHERE (column_9 = 0)


statement ok
DELETE FROM table_1 WHERE (column_9 = 1)


query  rowsort
SELECT sum(table_1.column_1) AS alias_1 FROM table_1
----
3

query  rowsort
SELECT group_concat(table_1.column_2 separator ', ') AS alias_1 FROM table_1
----
1, a, 2

query  rowsort
SELECT table_1.column_2 AS alias_1 FROM table_1 WHERE table_1.column_2 IN (?, ?, ?)
? = 0
? = 1
? = 2
----
1
2

query  rowsort
SELECT sum(table_1.column_3) AS alias_1, group_concat(table_1.column_4 separator ', ') AS alias_2 FROM table_1
----
3
a, a, a

query  rowsort
SELECT sum(table_1.column_5) AS alias_1 FROM table_1 WHERE table_1.column_2 IN (?, ?, ?)
? = 0
? = 1
? = 2
----
2

query  rowsort
SELECT group_concat(table_1.column_6 separator ', ') AS alias_1 FROM table_1 WHERE table_1.column_2 IN (?, ?, ?)
? = 0
? = 1
? = 2
----
a, a

query  rowsort
SELECT sum(table_1.column_7) AS alias_1, group_concat(table_1.column_8 separator ', ') AS alias_2 FROM table_1 WHERE table_1.column_7 IN (?, ?, ?)
? = 0
? = 1
? = 2
----
2
a, a, a
