# Generated by:
#     target/debug/noria-logictest generate --operations cte,topk --compare-to mysql://root@localhost/mysql --subquery-depth 1 --rows-per-table 5 -o logictests/generated/cte,topk.test --include-deletes
# failure: ENG-337

statement ok
CREATE TABLE table_1 (column_2 INT(32), column_1 INT(32), PRIMARY KEY (column_2))


statement ok
INSERT INTO table_1 (column_2, column_1) VALUES (2, 1), (3, 1), (4, 1), (5, 1), (6, 1)


query  nosort
WITH alias_2 AS (SELECT table_1.column_1 AS alias_1 FROM table_1 ORDER BY table_1.column_1 ASC LIMIT 10) SELECT table_1.column_1 AS alias_3 FROM table_1 INNER JOIN alias_2 ON (table_1.column_1 = alias_2.alias_1) ORDER BY table_1.column_1 ASC LIMIT 10
----
1
1
1
1
1
1
1
1
1
1

query  nosort
WITH alias_2 AS (SELECT table_1.column_1 AS alias_1 FROM table_1 ORDER BY table_1.column_1 DESC LIMIT 10) SELECT table_1.column_1 AS alias_3 FROM table_1 INNER JOIN alias_2 ON (table_1.column_1 = alias_2.alias_1) ORDER BY table_1.column_1 ASC LIMIT 10
----
1
1
1
1
1
1
1
1
1
1

query  nosort
WITH alias_2 AS (SELECT table_1.column_1 AS alias_1 FROM table_1 ORDER BY table_1.column_1 DESC LIMIT 10) SELECT table_1.column_1 AS alias_3 FROM table_1 INNER JOIN alias_2 ON (table_1.column_1 = alias_2.alias_1) ORDER BY table_1.column_1 ASC LIMIT 10
----
1
1
1
1
1
1
1
1
1
1

query  nosort
WITH alias_2 AS (SELECT table_1.column_1 AS alias_1 FROM table_1 ORDER BY table_1.column_1 ASC LIMIT 10) SELECT table_1.column_1 AS alias_3 FROM table_1 INNER JOIN alias_2 ON (table_1.column_1 = alias_2.alias_1) ORDER BY table_1.column_1 DESC LIMIT 10
----
1
1
1
1
1
1
1
1
1
1

query  nosort
WITH alias_2 AS (SELECT table_1.column_1 AS alias_1 FROM table_1 ORDER BY table_1.column_1 DESC LIMIT 10) SELECT table_1.column_1 AS alias_3 FROM table_1 INNER JOIN alias_2 ON (table_1.column_1 = alias_2.alias_1) ORDER BY table_1.column_1 DESC LIMIT 10
----
1
1
1
1
1
1
1
1
1
1

query  nosort
WITH alias_2 AS (SELECT table_1.column_1 AS alias_1 FROM table_1 ORDER BY table_1.column_1 DESC LIMIT 10) SELECT table_1.column_1 AS alias_3 FROM table_1 INNER JOIN alias_2 ON (table_1.column_1 = alias_2.alias_1) ORDER BY table_1.column_1 DESC LIMIT 10
----
1
1
1
1
1
1
1
1
1
1

query  nosort
WITH alias_2 AS (SELECT table_1.column_1 AS alias_1 FROM table_1 ORDER BY table_1.column_1 ASC LIMIT 10) SELECT table_1.column_1 AS alias_3 FROM table_1 INNER JOIN alias_2 ON (table_1.column_1 = alias_2.alias_1) ORDER BY table_1.column_1 DESC LIMIT 10
----
1
1
1
1
1
1
1
1
1
1

query  nosort
WITH alias_2 AS (SELECT table_1.column_1 AS alias_1 FROM table_1 ORDER BY table_1.column_1 DESC LIMIT 10) SELECT table_1.column_1 AS alias_3 FROM table_1 INNER JOIN alias_2 ON (table_1.column_1 = alias_2.alias_1) ORDER BY table_1.column_1 DESC LIMIT 10
----
1
1
1
1
1
1
1
1
1
1

query  nosort
WITH alias_2 AS (SELECT table_1.column_1 AS alias_1 FROM table_1 ORDER BY table_1.column_1 DESC LIMIT 10) SELECT table_1.column_1 AS alias_3 FROM table_1 INNER JOIN alias_2 ON (table_1.column_1 = alias_2.alias_1) ORDER BY table_1.column_1 DESC LIMIT 10
----
1
1
1
1
1
1
1
1
1
1

statement ok
DELETE FROM table_1 WHERE (column_2 = 2)


statement ok
DELETE FROM table_1 WHERE (column_2 = 3)


query  nosort
WITH alias_2 AS (SELECT table_1.column_1 AS alias_1 FROM table_1 ORDER BY table_1.column_1 ASC LIMIT 10) SELECT table_1.column_1 AS alias_3 FROM table_1 INNER JOIN alias_2 ON (table_1.column_1 = alias_2.alias_1) ORDER BY table_1.column_1 ASC LIMIT 10
----
1
1
1
1
1
1
1
1
1

query  nosort
WITH alias_2 AS (SELECT table_1.column_1 AS alias_1 FROM table_1 ORDER BY table_1.column_1 DESC LIMIT 10) SELECT table_1.column_1 AS alias_3 FROM table_1 INNER JOIN alias_2 ON (table_1.column_1 = alias_2.alias_1) ORDER BY table_1.column_1 ASC LIMIT 10
----
1
1
1
1
1
1
1
1
1

query  nosort
WITH alias_2 AS (SELECT table_1.column_1 AS alias_1 FROM table_1 ORDER BY table_1.column_1 DESC LIMIT 10) SELECT table_1.column_1 AS alias_3 FROM table_1 INNER JOIN alias_2 ON (table_1.column_1 = alias_2.alias_1) ORDER BY table_1.column_1 ASC LIMIT 10
----
1
1
1
1
1
1
1
1
1

query  nosort
WITH alias_2 AS (SELECT table_1.column_1 AS alias_1 FROM table_1 ORDER BY table_1.column_1 ASC LIMIT 10) SELECT table_1.column_1 AS alias_3 FROM table_1 INNER JOIN alias_2 ON (table_1.column_1 = alias_2.alias_1) ORDER BY table_1.column_1 DESC LIMIT 10
----
1
1
1
1
1
1
1
1
1

query  nosort
WITH alias_2 AS (SELECT table_1.column_1 AS alias_1 FROM table_1 ORDER BY table_1.column_1 DESC LIMIT 10) SELECT table_1.column_1 AS alias_3 FROM table_1 INNER JOIN alias_2 ON (table_1.column_1 = alias_2.alias_1) ORDER BY table_1.column_1 DESC LIMIT 10
----
1
1
1
1
1
1
1
1
1

query  nosort
WITH alias_2 AS (SELECT table_1.column_1 AS alias_1 FROM table_1 ORDER BY table_1.column_1 DESC LIMIT 10) SELECT table_1.column_1 AS alias_3 FROM table_1 INNER JOIN alias_2 ON (table_1.column_1 = alias_2.alias_1) ORDER BY table_1.column_1 DESC LIMIT 10
----
1
1
1
1
1
1
1
1
1

query  nosort
WITH alias_2 AS (SELECT table_1.column_1 AS alias_1 FROM table_1 ORDER BY table_1.column_1 ASC LIMIT 10) SELECT table_1.column_1 AS alias_3 FROM table_1 INNER JOIN alias_2 ON (table_1.column_1 = alias_2.alias_1) ORDER BY table_1.column_1 DESC LIMIT 10
----
1
1
1
1
1
1
1
1
1

query  nosort
WITH alias_2 AS (SELECT table_1.column_1 AS alias_1 FROM table_1 ORDER BY table_1.column_1 DESC LIMIT 10) SELECT table_1.column_1 AS alias_3 FROM table_1 INNER JOIN alias_2 ON (table_1.column_1 = alias_2.alias_1) ORDER BY table_1.column_1 DESC LIMIT 10
----
1
1
1
1
1
1
1
1
1

query  nosort
WITH alias_2 AS (SELECT table_1.column_1 AS alias_1 FROM table_1 ORDER BY table_1.column_1 DESC LIMIT 10) SELECT table_1.column_1 AS alias_3 FROM table_1 INNER JOIN alias_2 ON (table_1.column_1 = alias_2.alias_1) ORDER BY table_1.column_1 DESC LIMIT 10
----
1
1
1
1
1
1
1
1
1
