# Generated by:
#     target/debug/noria-logictest permute -d 3 -o logictests/generated/mysql --only in_parameter --compare-to mysql://root:noria@localhost/mysql --subquery-depth 1 --rows-per-table 5 --include-deletes --overwrite-tests

statement ok
CREATE TABLE table_1 (column_8 INT, column_10 INT, column_1 INT, column_3 INT, column_2 INT, column_9 INT, column_6 INT, column_11 INT, column_12 INT, column_5 INT, column_4 INT, column_13 INT, column_7 INT, PRIMARY KEY (column_13))


statement ok
INSERT INTO table_1 (column_8, column_10, column_1, column_3, column_2, column_9, column_6, column_11, column_12, column_5, column_4, column_13, column_7) VALUES (1, 1, 1, 1, 1, 1, 1, 1, 1, 1, 1, 0, 1), (1, 1, 1, 1, 1, 1, 1, 1, 1, 1, 1, 1, 1), (2, 1, 1, 1, 1, 1, 1, 1, 1, 2, 1, 2, 1), (1, 1, 1, 1, 1, 1, 1, 1, 1, 1, 1, 3, 1), (0, 1, 1, 1, 1, 1, 1, 1, 1, 0, 1, 4, 1)


query  rowsort
SELECT count(distinct table_1.column_1) AS alias_1 FROM table_1 INNER JOIN (SELECT count(distinct table_1.column_2) AS alias_2 FROM table_1) AS alias_3 ON (table_1.column_2 = alias_3.alias_2)
----
1

query  rowsort
SELECT count(distinct table_1.column_3) AS alias_1 FROM table_1 INNER JOIN (SELECT table_1.column_3 AS alias_2 FROM table_1) AS alias_3 ON (table_1.column_3 = alias_3.alias_2)
----
1

query  rowsort
SELECT count(distinct table_1.column_4) AS alias_1 FROM table_1 INNER JOIN (SELECT count(distinct table_1.column_5) AS alias_2 FROM table_1) AS alias_3 ON (table_1.column_5 = alias_3.alias_2)
----
0

query  rowsort
SELECT table_1.column_5 AS alias_3 FROM table_1 INNER JOIN (SELECT count(distinct table_1.column_6) AS alias_1 FROM table_1) AS alias_2 ON (table_1.column_5 = alias_2.alias_1) WHERE table_1.column_5 IN (?, ?, ?)
? = 0
? = 1
? = 2
----
1
1
1

query  rowsort
SELECT table_1.column_5 AS alias_3 FROM table_1 INNER JOIN (SELECT table_1.column_5 AS alias_1 FROM table_1) AS alias_2 ON (table_1.column_5 = alias_2.alias_1) WHERE table_1.column_5 IN (?, ?, ?)
? = 0
? = 1
? = 2
----
0
1
1
1
1
1
1
1
1
1
2

query  rowsort
SELECT table_1.column_7 AS alias_3 FROM table_1 INNER JOIN (SELECT count(distinct table_1.column_7) AS alias_1 FROM table_1) AS alias_2 ON (table_1.column_7 = alias_2.alias_1) WHERE table_1.column_5 IN (?, ?, ?)
? = 0
? = 1
? = 2
----
1
1
1
1
1

query  rowsort
SELECT count(distinct table_1.column_8) AS alias_1 FROM table_1 INNER JOIN (SELECT count(distinct table_1.column_9) AS alias_2 FROM table_1) AS alias_3 ON (table_1.column_8 = alias_3.alias_2) WHERE table_1.column_8 IN (?, ?, ?)
? = 0
? = 1
? = 2
----
1

query  rowsort
SELECT count(distinct table_1.column_10) AS alias_1 FROM table_1 INNER JOIN (SELECT table_1.column_8 AS alias_2 FROM table_1) AS alias_3 ON (table_1.column_8 = alias_3.alias_2) WHERE table_1.column_8 IN (?, ?, ?)
? = 0
? = 1
? = 2
----
1

query  rowsort
SELECT count(distinct table_1.column_11) AS alias_1 FROM table_1 INNER JOIN (SELECT count(distinct table_1.column_12) AS alias_2 FROM table_1) AS alias_3 ON (table_1.column_8 = alias_3.alias_2) WHERE table_1.column_8 IN (?, ?, ?)
? = 0
? = 1
? = 2
----
1

statement ok
DELETE FROM table_1 WHERE (column_13 = 0)


statement ok
DELETE FROM table_1 WHERE (column_13 = 1)


query  rowsort
SELECT count(distinct table_1.column_1) AS alias_1 FROM table_1 INNER JOIN (SELECT count(distinct table_1.column_2) AS alias_2 FROM table_1) AS alias_3 ON (table_1.column_2 = alias_3.alias_2)
----
1

query  rowsort
SELECT count(distinct table_1.column_3) AS alias_1 FROM table_1 INNER JOIN (SELECT table_1.column_3 AS alias_2 FROM table_1) AS alias_3 ON (table_1.column_3 = alias_3.alias_2)
----
1

query  rowsort
SELECT count(distinct table_1.column_4) AS alias_1 FROM table_1 INNER JOIN (SELECT count(distinct table_1.column_5) AS alias_2 FROM table_1) AS alias_3 ON (table_1.column_5 = alias_3.alias_2)
----
0

query  rowsort
SELECT table_1.column_5 AS alias_3 FROM table_1 INNER JOIN (SELECT count(distinct table_1.column_6) AS alias_1 FROM table_1) AS alias_2 ON (table_1.column_5 = alias_2.alias_1) WHERE table_1.column_5 IN (?, ?, ?)
? = 0
? = 1
? = 2
----
1

query  rowsort
SELECT table_1.column_5 AS alias_3 FROM table_1 INNER JOIN (SELECT table_1.column_5 AS alias_1 FROM table_1) AS alias_2 ON (table_1.column_5 = alias_2.alias_1) WHERE table_1.column_5 IN (?, ?, ?)
? = 0
? = 1
? = 2
----
0
1
2

query  rowsort
SELECT table_1.column_7 AS alias_3 FROM table_1 INNER JOIN (SELECT count(distinct table_1.column_7) AS alias_1 FROM table_1) AS alias_2 ON (table_1.column_7 = alias_2.alias_1) WHERE table_1.column_5 IN (?, ?, ?)
? = 0
? = 1
? = 2
----
1
1
1

query  rowsort
SELECT count(distinct table_1.column_8) AS alias_1 FROM table_1 INNER JOIN (SELECT count(distinct table_1.column_9) AS alias_2 FROM table_1) AS alias_3 ON (table_1.column_8 = alias_3.alias_2) WHERE table_1.column_8 IN (?, ?, ?)
? = 0
? = 1
? = 2
----
1

query  rowsort
SELECT count(distinct table_1.column_10) AS alias_1 FROM table_1 INNER JOIN (SELECT table_1.column_8 AS alias_2 FROM table_1) AS alias_3 ON (table_1.column_8 = alias_3.alias_2) WHERE table_1.column_8 IN (?, ?, ?)
? = 0
? = 1
? = 2
----
1

query  rowsort
SELECT count(distinct table_1.column_11) AS alias_1 FROM table_1 INNER JOIN (SELECT count(distinct table_1.column_12) AS alias_2 FROM table_1) AS alias_3 ON (table_1.column_8 = alias_3.alias_2) WHERE table_1.column_8 IN (?, ?, ?)
? = 0
? = 1
? = 2
----
1
