# Generated by:
#     target/debug/noria-logictest permute -d 3 -o logictests/generated/mysql --only in_parameter --compare-to mysql://root:noria@localhost/mysql --subquery-depth 1 --rows-per-table 5 --include-deletes --overwrite-tests

statement ok
CREATE TABLE table_1 (column_2 INT, column_1 INT, PRIMARY KEY (column_2))


statement ok
INSERT INTO table_1 (column_2, column_1) VALUES (0, 0), (1, 1), (2, 1), (3, 1), (4, 2)


query  rowsort
SELECT table_1.column_1 AS alias_3 FROM table_1 INNER JOIN (SELECT table_1.column_1 AS alias_1 FROM table_1) AS alias_2 ON (table_1.column_1 = alias_2.alias_1) WHERE table_1.column_1 IN (?, ?, ?)
? = 0
? = 1
? = 2
----
0
1
1
1
1
1
1
1
1
1
2

statement ok
DELETE FROM table_1 WHERE (column_2 = 0)


statement ok
DELETE FROM table_1 WHERE (column_2 = 1)


query  rowsort
SELECT table_1.column_1 AS alias_3 FROM table_1 INNER JOIN (SELECT table_1.column_1 AS alias_1 FROM table_1) AS alias_2 ON (table_1.column_1 = alias_2.alias_1) WHERE table_1.column_1 IN (?, ?, ?)
? = 0
? = 1
? = 2
----
1
1
1
1
2
