# Generated by:
#     target/debug/noria-logictest permute -d 3 -o logictests/generated/mysql --only in_parameter --compare-to mysql://root:noria@localhost/mysql --subquery-depth 1 --rows-per-table 5 --include-deletes --overwrite-tests

statement ok
CREATE TABLE table_1 (column_3 TEXT, column_12 TEXT, column_4 TEXT, column_9 TEXT, column_10 TEXT, column_6 TEXT, column_13 INT, column_1 TEXT, column_11 TEXT, column_5 TEXT, column_7 TEXT, column_8 TEXT, column_2 TEXT, PRIMARY KEY (column_13))


statement ok
INSERT INTO table_1 (column_3, column_12, column_4, column_9, column_10, column_6, column_13, column_1, column_11, column_5, column_7, column_8, column_2) VALUES ('0', 'a', 'a', 'a', 'a', 'a', 0, '0', 'a', 'a', 'a', 'a', 'a'), ('a', 'a', 'a', 'a', 'a', 'a', 1, 'a', 'a', 'a', 'a', 'a', 'a'), ('1', 'a', 'a', 'a', 'a', 'a', 2, '1', 'a', 'a', 'a', 'a', 'a'), ('a', 'a', 'a', 'a', 'a', 'a', 3, 'a', 'a', 'a', 'a', 'a', 'a'), ('2', 'a', 'a', 'a', 'a', 'a', 4, '2', 'a', 'a', 'a', 'a', 'a')


query  rowsort
SELECT group_concat(table_1.column_1 separator ', ') AS alias_1 FROM table_1 INNER JOIN (SELECT group_concat(table_1.column_2 separator ', ') AS alias_2 FROM table_1) AS alias_3 ON (table_1.column_1 = alias_3.alias_2)
----
NULL

query  rowsort
SELECT group_concat(table_1.column_3 separator ', ') AS alias_1 FROM table_1 INNER JOIN (SELECT table_1.column_1 AS alias_2 FROM table_1) AS alias_3 ON (table_1.column_1 = alias_3.alias_2)
----
0, a, a, 1, a, a, 2

query  rowsort
SELECT group_concat(table_1.column_4 separator ', ') AS alias_1 FROM table_1 INNER JOIN (SELECT group_concat(table_1.column_5 separator ', ') AS alias_2 FROM table_1) AS alias_3 ON (table_1.column_1 = alias_3.alias_2)
----
NULL

query  rowsort
SELECT table_1.column_1 AS alias_3 FROM table_1 INNER JOIN (SELECT group_concat(table_1.column_6 separator ', ') AS alias_1 FROM table_1) AS alias_2 ON (table_1.column_1 = alias_2.alias_1) WHERE table_1.column_1 IN (?, ?, ?)
? = 0
? = 1
? = 2
----


query  rowsort
SELECT table_1.column_1 AS alias_3 FROM table_1 INNER JOIN (SELECT table_1.column_1 AS alias_1 FROM table_1) AS alias_2 ON (table_1.column_1 = alias_2.alias_1) WHERE table_1.column_1 IN (?, ?, ?)
? = 0
? = 1
? = 2
----
0
1
2

query  rowsort
SELECT table_1.column_1 AS alias_3 FROM table_1 INNER JOIN (SELECT group_concat(table_1.column_7 separator ', ') AS alias_1 FROM table_1) AS alias_2 ON (table_1.column_1 = alias_2.alias_1) WHERE table_1.column_1 IN (?, ?, ?)
? = 0
? = 1
? = 2
----


query  rowsort
SELECT group_concat(table_1.column_8 separator ', ') AS alias_1 FROM table_1 INNER JOIN (SELECT group_concat(table_1.column_9 separator ', ') AS alias_2 FROM table_1) AS alias_3 ON (table_1.column_3 = alias_3.alias_2) WHERE table_1.column_3 IN (?, ?, ?)
? = 0
? = 1
? = 2
----
NULL

query  rowsort
SELECT group_concat(table_1.column_10 separator ', ') AS alias_1 FROM table_1 INNER JOIN (SELECT table_1.column_3 AS alias_2 FROM table_1) AS alias_3 ON (table_1.column_3 = alias_3.alias_2) WHERE table_1.column_3 IN (?, ?, ?)
? = 0
? = 1
? = 2
----
a, a, a

query  rowsort
SELECT group_concat(table_1.column_11 separator ', ') AS alias_1 FROM table_1 INNER JOIN (SELECT group_concat(table_1.column_12 separator ', ') AS alias_2 FROM table_1) AS alias_3 ON (table_1.column_3 = alias_3.alias_2) WHERE table_1.column_3 IN (?, ?, ?)
? = 0
? = 1
? = 2
----
NULL

statement ok
DELETE FROM table_1 WHERE (column_13 = 0)


statement ok
DELETE FROM table_1 WHERE (column_13 = 1)


query  rowsort
SELECT group_concat(table_1.column_1 separator ', ') AS alias_1 FROM table_1 INNER JOIN (SELECT group_concat(table_1.column_2 separator ', ') AS alias_2 FROM table_1) AS alias_3 ON (table_1.column_1 = alias_3.alias_2)
----
NULL

query  rowsort
SELECT group_concat(table_1.column_3 separator ', ') AS alias_1 FROM table_1 INNER JOIN (SELECT table_1.column_1 AS alias_2 FROM table_1) AS alias_3 ON (table_1.column_1 = alias_3.alias_2)
----
1, a, 2

query  rowsort
SELECT group_concat(table_1.column_4 separator ', ') AS alias_1 FROM table_1 INNER JOIN (SELECT group_concat(table_1.column_5 separator ', ') AS alias_2 FROM table_1) AS alias_3 ON (table_1.column_1 = alias_3.alias_2)
----
NULL

query  rowsort
SELECT table_1.column_1 AS alias_3 FROM table_1 INNER JOIN (SELECT group_concat(table_1.column_6 separator ', ') AS alias_1 FROM table_1) AS alias_2 ON (table_1.column_1 = alias_2.alias_1) WHERE table_1.column_1 IN (?, ?, ?)
? = 0
? = 1
? = 2
----


query  rowsort
SELECT table_1.column_1 AS alias_3 FROM table_1 INNER JOIN (SELECT table_1.column_1 AS alias_1 FROM table_1) AS alias_2 ON (table_1.column_1 = alias_2.alias_1) WHERE table_1.column_1 IN (?, ?, ?)
? = 0
? = 1
? = 2
----
1
2

query  rowsort
SELECT table_1.column_1 AS alias_3 FROM table_1 INNER JOIN (SELECT group_concat(table_1.column_7 separator ', ') AS alias_1 FROM table_1) AS alias_2 ON (table_1.column_1 = alias_2.alias_1) WHERE table_1.column_1 IN (?, ?, ?)
? = 0
? = 1
? = 2
----


query  rowsort
SELECT group_concat(table_1.column_8 separator ', ') AS alias_1 FROM table_1 INNER JOIN (SELECT group_concat(table_1.column_9 separator ', ') AS alias_2 FROM table_1) AS alias_3 ON (table_1.column_3 = alias_3.alias_2) WHERE table_1.column_3 IN (?, ?, ?)
? = 0
? = 1
? = 2
----
NULL

query  rowsort
SELECT group_concat(table_1.column_10 separator ', ') AS alias_1 FROM table_1 INNER JOIN (SELECT table_1.column_3 AS alias_2 FROM table_1) AS alias_3 ON (table_1.column_3 = alias_3.alias_2) WHERE table_1.column_3 IN (?, ?, ?)
? = 0
? = 1
? = 2
----
a, a

query  rowsort
SELECT group_concat(table_1.column_11 separator ', ') AS alias_1 FROM table_1 INNER JOIN (SELECT group_concat(table_1.column_12 separator ', ') AS alias_2 FROM table_1) AS alias_3 ON (table_1.column_3 = alias_3.alias_2) WHERE table_1.column_3 IN (?, ?, ?)
? = 0
? = 1
? = 2
----
NULL
