# Generated by:
#     target/debug/noria-logictest generate --operations count,group_concat,join_subquery --compare-to mysql://root@localhost/mysql --subquery-depth 1 --rows-per-table 5 -o logictests/generated/count,group_concat,join_subquery.test --include-deletes
# failure: ENG-247

statement ok
CREATE TABLE table_1 (column_6 INT(32), column_13 INT(32), column_18 INT(32), column_23 INT(32), column_15 INT(32), column_10 TEXT, column_2 INT(32), column_20 TEXT, column_16 TEXT, column_12 TEXT, column_7 TEXT, column_17 INT(32), column_21 INT(32), column_25 INT(32), column_5 INT(32), column_1 INT(32), column_24 TEXT, column_22 TEXT, column_9 INT(32), column_19 TEXT, column_14 TEXT, column_4 TEXT, column_8 TEXT, column_11 TEXT, column_3 INT(32), PRIMARY KEY (column_25))


statement ok
INSERT INTO table_1 (column_15, column_12, column_7, column_16, column_9, column_1, column_25, column_19, column_14, column_4, column_10, column_11, column_2, column_22, column_23, column_17, column_24, column_8, column_3, column_5, column_6, column_21, column_13, column_20, column_18) VALUES (1, 'a', 'a', 'a', 1, 1, 2, 'a', 'a', 'a', 'a', 'a', 1, 'a', 1, 1, 'a', 'a', 1, 1, 1, 1, 1, 'a', 1), (1, 'a', 'a', 'a', 1, 1, 3, 'a', 'a', 'a', 'a', 'a', 1, 'a', 1, 1, 'a', 'a', 1, 1, 1, 1, 1, 'a', 1), (1, 'a', 'a', 'a', 1, 1, 4, 'a', 'a', 'a', 'a', 'a', 1, 'a', 1, 1, 'a', 'a', 1, 1, 1, 1, 1, 'a', 1), (1, 'a', 'a', 'a', 1, 1, 5, 'a', 'a', 'a', 'a', 'a', 1, 'a', 1, 1, 'a', 'a', 1, 1, 1, 1, 1, 'a', 1), (1, 'a', 'a', 'a', 1, 1, 6, 'a', 'a', 'a', 'a', 'a', 1, 'a', 1, 1, 'a', 'a', 1, 1, 1, 1, 1, 'a', 1)


query  nosort
SELECT count(table_1.column_1) AS alias_1 FROM table_1 INNER JOIN (SELECT count(table_1.column_2) AS alias_2 FROM table_1) AS alias_3 ON (table_1.column_1 = alias_3.alias_2)
----
0

query  nosort
SELECT count(table_1.column_3) AS alias_1 FROM table_1 INNER JOIN (SELECT group_concat(table_1.column_4 separator ', ') AS alias_2 FROM table_1) AS alias_3 ON (table_1.column_1 = alias_3.alias_2)
----
0

query  nosort
SELECT count(table_1.column_5) AS alias_1 FROM table_1 INNER JOIN (SELECT count(table_1.column_6) AS alias_2, group_concat(table_1.column_7 separator ', ') AS alias_3 FROM table_1) AS alias_4 ON (table_1.column_5 = alias_4.alias_2)
----
0

query  nosort
SELECT group_concat(table_1.column_8 separator ', ') AS alias_1 FROM table_1 INNER JOIN (SELECT count(table_1.column_9) AS alias_2 FROM table_1) AS alias_3 ON (table_1.column_5 = alias_3.alias_2)
----
NULL

query  nosort
SELECT group_concat(table_1.column_10 separator ', ') AS alias_1 FROM table_1 INNER JOIN (SELECT group_concat(table_1.column_11 separator ', ') AS alias_2 FROM table_1) AS alias_3 ON (table_1.column_5 = alias_3.alias_2)
----
NULL

query  nosort
SELECT group_concat(table_1.column_12 separator ', ') AS alias_1 FROM table_1 INNER JOIN (SELECT count(table_1.column_13) AS alias_2, group_concat(table_1.column_14 separator ', ') AS alias_3 FROM table_1) AS alias_4 ON (table_1.column_5 = alias_4.alias_2)
----
NULL

query  nosort
SELECT count(table_1.column_15) AS alias_1, group_concat(table_1.column_16 separator ', ') AS alias_2 FROM table_1 INNER JOIN (SELECT count(table_1.column_17) AS alias_3 FROM table_1) AS alias_4 ON (table_1.column_6 = alias_4.alias_3)
----
0
NULL

query  nosort
SELECT count(table_1.column_18) AS alias_1, group_concat(table_1.column_19 separator ', ') AS alias_2 FROM table_1 INNER JOIN (SELECT group_concat(table_1.column_20 separator ', ') AS alias_3 FROM table_1) AS alias_4 ON (table_1.column_6 = alias_4.alias_3)
----
0
NULL

query  nosort
SELECT count(table_1.column_21) AS alias_1, group_concat(table_1.column_22 separator ', ') AS alias_2 FROM table_1 INNER JOIN (SELECT count(table_1.column_23) AS alias_3, group_concat(table_1.column_24 separator ', ') AS alias_4 FROM table_1) AS alias_5 ON (table_1.column_6 = alias_5.alias_3)
----
0
NULL

statement ok
DELETE FROM table_1 WHERE (column_25 = 2)


statement ok
DELETE FROM table_1 WHERE (column_25 = 3)


query  nosort
SELECT count(table_1.column_1) AS alias_1 FROM table_1 INNER JOIN (SELECT count(table_1.column_2) AS alias_2 FROM table_1) AS alias_3 ON (table_1.column_1 = alias_3.alias_2)
----
0

query  nosort
SELECT count(table_1.column_3) AS alias_1 FROM table_1 INNER JOIN (SELECT group_concat(table_1.column_4 separator ', ') AS alias_2 FROM table_1) AS alias_3 ON (table_1.column_1 = alias_3.alias_2)
----
0

query  nosort
SELECT count(table_1.column_5) AS alias_1 FROM table_1 INNER JOIN (SELECT count(table_1.column_6) AS alias_2, group_concat(table_1.column_7 separator ', ') AS alias_3 FROM table_1) AS alias_4 ON (table_1.column_5 = alias_4.alias_2)
----
0

query  nosort
SELECT group_concat(table_1.column_8 separator ', ') AS alias_1 FROM table_1 INNER JOIN (SELECT count(table_1.column_9) AS alias_2 FROM table_1) AS alias_3 ON (table_1.column_5 = alias_3.alias_2)
----
NULL

query  nosort
SELECT group_concat(table_1.column_10 separator ', ') AS alias_1 FROM table_1 INNER JOIN (SELECT group_concat(table_1.column_11 separator ', ') AS alias_2 FROM table_1) AS alias_3 ON (table_1.column_5 = alias_3.alias_2)
----
NULL

query  nosort
SELECT group_concat(table_1.column_12 separator ', ') AS alias_1 FROM table_1 INNER JOIN (SELECT count(table_1.column_13) AS alias_2, group_concat(table_1.column_14 separator ', ') AS alias_3 FROM table_1) AS alias_4 ON (table_1.column_5 = alias_4.alias_2)
----
NULL

query  nosort
SELECT count(table_1.column_15) AS alias_1, group_concat(table_1.column_16 separator ', ') AS alias_2 FROM table_1 INNER JOIN (SELECT count(table_1.column_17) AS alias_3 FROM table_1) AS alias_4 ON (table_1.column_6 = alias_4.alias_3)
----
0
NULL

query  nosort
SELECT count(table_1.column_18) AS alias_1, group_concat(table_1.column_19 separator ', ') AS alias_2 FROM table_1 INNER JOIN (SELECT group_concat(table_1.column_20 separator ', ') AS alias_3 FROM table_1) AS alias_4 ON (table_1.column_6 = alias_4.alias_3)
----
0
NULL

query  nosort
SELECT count(table_1.column_21) AS alias_1, group_concat(table_1.column_22 separator ', ') AS alias_2 FROM table_1 INNER JOIN (SELECT count(table_1.column_23) AS alias_3, group_concat(table_1.column_24 separator ', ') AS alias_4 FROM table_1) AS alias_5 ON (table_1.column_6 = alias_5.alias_3)
----
0
NULL
