# Generated by:
#     target/debug/noria-logictest generate --operations avg,join_subquery,topk --compare-to mysql://root@localhost/mysql --subquery-depth 1 --rows-per-table 5 -o logictests/generated/avg,join_subquery,topk.test --include-deletes
# failure: ENG-334

statement ok
CREATE TABLE table_1 (column_10 INT(32), column_2 INT(32), column_32 INT(32), column_52 INT(32), column_31 INT(32), column_26 INT(32), column_53 INT(32), column_49 INT(32), column_6 INT(32), column_41 INT(32), column_50 INT(32), column_28 INT(32), column_56 INT(32), column_36 INT(32), column_21 INT(32), column_57 INT(32), column_38 INT(32), column_34 INT(32), column_43 INT(32), column_22 INT(32), column_13 INT(32), column_25 INT(32), column_27 INT(32), column_45 INT(32), column_47 INT(32), column_54 INT(32), column_29 INT(32), column_9 INT(32), column_5 INT(32), column_46 INT(32), column_3 INT(32), column_1 INT(32), column_23 INT(32), column_48 INT(32), column_20 INT(32), column_24 INT(32), column_11 INT(32), column_4 INT(32), column_37 INT(32), column_55 INT(32), column_42 INT(32), column_19 INT(32), column_8 INT(32), column_30 INT(32), column_14 INT(32), column_16 INT(32), column_12 INT(32), column_33 INT(32), column_35 INT(32), column_44 INT(32), column_18 INT(32), column_17 INT(32), column_7 INT(32), column_40 INT(32), column_51 INT(32), column_39 INT(32), column_15 INT(32), PRIMARY KEY (column_57))


statement ok
INSERT INTO table_1 (column_43, column_38, column_6, column_50, column_24, column_37, column_51, column_54, column_36, column_13, column_11, column_29, column_14, column_42, column_57, column_9, column_7, column_35, column_17, column_22, column_32, column_53, column_39, column_41, column_5, column_31, column_28, column_2, column_21, column_4, column_12, column_30, column_25, column_34, column_52, column_47, column_23, column_49, column_15, column_27, column_45, column_3, column_20, column_56, column_8, column_46, column_55, column_16, column_48, column_33, column_18, column_1, column_40, column_10, column_44, column_26, column_19) VALUES (1, 1, 1, 1, 1, 1, 1, 1, 1, 1, 1, 1, 1, 1, 2, 1, 1, 1, 1, 1, 1, 1, 1, 1, 1, 1, 1, 1, 1, 1, 1, 1, 1, 1, 1, 1, 1, 1, 1, 1, 1, 1, 1, 1, 1, 1, 1, 1, 1, 1, 1, 1, 1, 1, 1, 1, 1), (1, 1, 1, 1, 1, 1, 1, 1, 1, 1, 1, 1, 1, 1, 3, 1, 1, 1, 1, 1, 1, 1, 1, 1, 1, 1, 1, 1, 1, 1, 1, 1, 1, 1, 1, 1, 1, 1, 1, 1, 1, 1, 1, 1, 1, 1, 1, 1, 1, 1, 1, 1, 1, 1, 1, 1, 1), (1, 1, 1, 1, 1, 1, 1, 1, 1, 1, 1, 1, 1, 1, 4, 1, 1, 1, 1, 1, 1, 1, 1, 1, 1, 1, 1, 1, 1, 1, 1, 1, 1, 1, 1, 1, 1, 1, 1, 1, 1, 1, 1, 1, 1, 1, 1, 1, 1, 1, 1, 1, 1, 1, 1, 1, 1), (1, 1, 1, 1, 1, 1, 1, 1, 1, 1, 1, 1, 1, 1, 5, 1, 1, 1, 1, 1, 1, 1, 1, 1, 1, 1, 1, 1, 1, 1, 1, 1, 1, 1, 1, 1, 1, 1, 1, 1, 1, 1, 1, 1, 1, 1, 1, 1, 1, 1, 1, 1, 1, 1, 1, 1, 1), (1, 1, 1, 1, 1, 1, 1, 1, 1, 1, 1, 1, 1, 1, 6, 1, 1, 1, 1, 1, 1, 1, 1, 1, 1, 1, 1, 1, 1, 1, 1, 1, 1, 1, 1, 1, 1, 1, 1, 1, 1, 1, 1, 1, 1, 1, 1, 1, 1, 1, 1, 1, 1, 1, 1, 1, 1)


query  nosort
SELECT avg(table_1.column_1) AS alias_1 FROM table_1 INNER JOIN (SELECT avg(table_1.column_2) AS alias_2 FROM table_1) AS alias_3 ON (table_1.column_1 = alias_3.alias_2)
----
1.0000

query  nosort
SELECT avg(table_1.column_3) AS alias_1 FROM table_1 INNER JOIN (SELECT table_1.column_3 AS alias_2 FROM table_1 ORDER BY table_1.column_3 ASC LIMIT 10) AS alias_3 ON (table_1.column_3 = alias_3.alias_2)
----
1.0000

query  nosort
SELECT avg(table_1.column_4) AS alias_1 FROM table_1 INNER JOIN (SELECT table_1.column_4 AS alias_2 FROM table_1 ORDER BY table_1.column_4 DESC LIMIT 10) AS alias_3 ON (table_1.column_4 = alias_3.alias_2)
----
1.0000

query  nosort
SELECT avg(table_1.column_5) AS alias_1 FROM table_1 INNER JOIN (SELECT avg(table_1.column_6) AS alias_2 FROM table_1 ORDER BY table_1.column_4 ASC LIMIT 10) AS alias_3 ON (table_1.column_4 = alias_3.alias_2)
----
1.0000

query  nosort
SELECT avg(table_1.column_7) AS alias_1 FROM table_1 INNER JOIN (SELECT avg(table_1.column_8) AS alias_2 FROM table_1 ORDER BY table_1.column_4 DESC LIMIT 10) AS alias_3 ON (table_1.column_4 = alias_3.alias_2)
----
1.0000

query  nosort
SELECT avg(table_1.column_9) AS alias_1 FROM table_1 INNER JOIN (SELECT table_1.column_4 AS alias_2 FROM table_1 ORDER BY table_1.column_4 DESC LIMIT 10) AS alias_3 ON (table_1.column_4 = alias_3.alias_2)
----
1.0000

query  nosort
SELECT avg(table_1.column_10) AS alias_1 FROM table_1 INNER JOIN (SELECT avg(table_1.column_11) AS alias_2 FROM table_1 ORDER BY table_1.column_4 DESC LIMIT 10) AS alias_3 ON (table_1.column_4 = alias_3.alias_2)
----
1.0000

query  nosort
SELECT table_1.column_4 AS alias_3 FROM table_1 INNER JOIN (SELECT avg(table_1.column_12) AS alias_1 FROM table_1) AS alias_2 ON (table_1.column_4 = alias_2.alias_1) ORDER BY table_1.column_4 ASC LIMIT 10
----
1
1
1
1
1

query  nosort
SELECT table_1.column_4 AS alias_3 FROM table_1 INNER JOIN (SELECT table_1.column_4 AS alias_1 FROM table_1 ORDER BY table_1.column_4 ASC LIMIT 10) AS alias_2 ON (table_1.column_4 = alias_2.alias_1) ORDER BY table_1.column_4 ASC LIMIT 10
----
1
1
1
1
1
1
1
1
1
1

query  nosort
SELECT table_1.column_4 AS alias_3 FROM table_1 INNER JOIN (SELECT table_1.column_4 AS alias_1 FROM table_1 ORDER BY table_1.column_4 DESC LIMIT 10) AS alias_2 ON (table_1.column_4 = alias_2.alias_1) ORDER BY table_1.column_4 ASC LIMIT 10
----
1
1
1
1
1
1
1
1
1
1

query  nosort
SELECT table_1.column_4 AS alias_3 FROM table_1 INNER JOIN (SELECT avg(table_1.column_13) AS alias_1 FROM table_1 ORDER BY table_1.column_4 ASC LIMIT 10) AS alias_2 ON (table_1.column_4 = alias_2.alias_1) ORDER BY table_1.column_4 ASC LIMIT 10
----
1
1
1
1
1

query  nosort
SELECT table_1.column_4 AS alias_3 FROM table_1 INNER JOIN (SELECT avg(table_1.column_14) AS alias_1 FROM table_1 ORDER BY table_1.column_4 DESC LIMIT 10) AS alias_2 ON (table_1.column_4 = alias_2.alias_1) ORDER BY table_1.column_4 ASC LIMIT 10
----
1
1
1
1
1

query  nosort
SELECT table_1.column_4 AS alias_3 FROM table_1 INNER JOIN (SELECT table_1.column_4 AS alias_1 FROM table_1 ORDER BY table_1.column_4 DESC LIMIT 10) AS alias_2 ON (table_1.column_4 = alias_2.alias_1) ORDER BY table_1.column_4 ASC LIMIT 10
----
1
1
1
1
1
1
1
1
1
1

query  nosort
SELECT table_1.column_4 AS alias_3 FROM table_1 INNER JOIN (SELECT avg(table_1.column_15) AS alias_1 FROM table_1 ORDER BY table_1.column_4 DESC LIMIT 10) AS alias_2 ON (table_1.column_4 = alias_2.alias_1) ORDER BY table_1.column_4 ASC LIMIT 10
----
1
1
1
1
1

query  nosort
SELECT table_1.column_4 AS alias_3 FROM table_1 INNER JOIN (SELECT avg(table_1.column_16) AS alias_1 FROM table_1) AS alias_2 ON (table_1.column_4 = alias_2.alias_1) ORDER BY table_1.column_4 DESC LIMIT 10
----
1
1
1
1
1

query  nosort
SELECT table_1.column_4 AS alias_3 FROM table_1 INNER JOIN (SELECT table_1.column_4 AS alias_1 FROM table_1 ORDER BY table_1.column_4 ASC LIMIT 10) AS alias_2 ON (table_1.column_4 = alias_2.alias_1) ORDER BY table_1.column_4 DESC LIMIT 10
----
1
1
1
1
1
1
1
1
1
1

query  nosort
SELECT table_1.column_4 AS alias_3 FROM table_1 INNER JOIN (SELECT table_1.column_4 AS alias_1 FROM table_1 ORDER BY table_1.column_4 DESC LIMIT 10) AS alias_2 ON (table_1.column_4 = alias_2.alias_1) ORDER BY table_1.column_4 DESC LIMIT 10
----
1
1
1
1
1
1
1
1
1
1

query  nosort
SELECT table_1.column_4 AS alias_3 FROM table_1 INNER JOIN (SELECT avg(table_1.column_17) AS alias_1 FROM table_1 ORDER BY table_1.column_4 ASC LIMIT 10) AS alias_2 ON (table_1.column_4 = alias_2.alias_1) ORDER BY table_1.column_4 DESC LIMIT 10
----
1
1
1
1
1

query  nosort
SELECT table_1.column_4 AS alias_3 FROM table_1 INNER JOIN (SELECT avg(table_1.column_18) AS alias_1 FROM table_1 ORDER BY table_1.column_4 DESC LIMIT 10) AS alias_2 ON (table_1.column_4 = alias_2.alias_1) ORDER BY table_1.column_4 DESC LIMIT 10
----
1
1
1
1
1

query  nosort
SELECT table_1.column_4 AS alias_3 FROM table_1 INNER JOIN (SELECT table_1.column_4 AS alias_1 FROM table_1 ORDER BY table_1.column_4 DESC LIMIT 10) AS alias_2 ON (table_1.column_4 = alias_2.alias_1) ORDER BY table_1.column_4 DESC LIMIT 10
----
1
1
1
1
1
1
1
1
1
1

query  nosort
SELECT table_1.column_4 AS alias_3 FROM table_1 INNER JOIN (SELECT avg(table_1.column_19) AS alias_1 FROM table_1 ORDER BY table_1.column_4 DESC LIMIT 10) AS alias_2 ON (table_1.column_4 = alias_2.alias_1) ORDER BY table_1.column_4 DESC LIMIT 10
----
1
1
1
1
1

query  nosort
SELECT avg(table_1.column_20) AS alias_1 FROM table_1 INNER JOIN (SELECT avg(table_1.column_21) AS alias_2 FROM table_1) AS alias_3 ON (table_1.column_4 = alias_3.alias_2) ORDER BY table_1.column_4 ASC LIMIT 10
----
1.0000

query  nosort
SELECT avg(table_1.column_22) AS alias_1 FROM table_1 INNER JOIN (SELECT table_1.column_4 AS alias_2 FROM table_1 ORDER BY table_1.column_4 ASC LIMIT 10) AS alias_3 ON (table_1.column_4 = alias_3.alias_2) ORDER BY table_1.column_4 ASC LIMIT 10
----
1.0000

query  nosort
SELECT avg(table_1.column_23) AS alias_1 FROM table_1 INNER JOIN (SELECT table_1.column_4 AS alias_2 FROM table_1 ORDER BY table_1.column_4 DESC LIMIT 10) AS alias_3 ON (table_1.column_4 = alias_3.alias_2) ORDER BY table_1.column_4 ASC LIMIT 10
----
1.0000

query  nosort
SELECT avg(table_1.column_24) AS alias_1 FROM table_1 INNER JOIN (SELECT avg(table_1.column_25) AS alias_2 FROM table_1 ORDER BY table_1.column_4 ASC LIMIT 10) AS alias_3 ON (table_1.column_4 = alias_3.alias_2) ORDER BY table_1.column_4 ASC LIMIT 10
----
1.0000

query  nosort
SELECT avg(table_1.column_26) AS alias_1 FROM table_1 INNER JOIN (SELECT avg(table_1.column_27) AS alias_2 FROM table_1 ORDER BY table_1.column_4 DESC LIMIT 10) AS alias_3 ON (table_1.column_4 = alias_3.alias_2) ORDER BY table_1.column_4 ASC LIMIT 10
----
1.0000

query  nosort
SELECT avg(table_1.column_28) AS alias_1 FROM table_1 INNER JOIN (SELECT table_1.column_4 AS alias_2 FROM table_1 ORDER BY table_1.column_4 DESC LIMIT 10) AS alias_3 ON (table_1.column_4 = alias_3.alias_2) ORDER BY table_1.column_4 ASC LIMIT 10
----
1.0000

query  nosort
SELECT avg(table_1.column_29) AS alias_1 FROM table_1 INNER JOIN (SELECT avg(table_1.column_30) AS alias_2 FROM table_1 ORDER BY table_1.column_10 DESC LIMIT 10) AS alias_3 ON (table_1.column_10 = alias_3.alias_2) ORDER BY table_1.column_10 ASC LIMIT 10
----
1.0000

query  nosort
SELECT avg(table_1.column_31) AS alias_1 FROM table_1 INNER JOIN (SELECT avg(table_1.column_32) AS alias_2 FROM table_1) AS alias_3 ON (table_1.column_10 = alias_3.alias_2) ORDER BY table_1.column_10 DESC LIMIT 10
----
1.0000

query  nosort
SELECT avg(table_1.column_33) AS alias_1 FROM table_1 INNER JOIN (SELECT table_1.column_10 AS alias_2 FROM table_1 ORDER BY table_1.column_10 ASC LIMIT 10) AS alias_3 ON (table_1.column_10 = alias_3.alias_2) ORDER BY table_1.column_10 DESC LIMIT 10
----
1.0000

query  nosort
SELECT avg(table_1.column_34) AS alias_1 FROM table_1 INNER JOIN (SELECT table_1.column_10 AS alias_2 FROM table_1 ORDER BY table_1.column_10 DESC LIMIT 10) AS alias_3 ON (table_1.column_10 = alias_3.alias_2) ORDER BY table_1.column_10 DESC LIMIT 10
----
1.0000

query  nosort
SELECT avg(table_1.column_35) AS alias_1 FROM table_1 INNER JOIN (SELECT avg(table_1.column_36) AS alias_2 FROM table_1 ORDER BY table_1.column_10 ASC LIMIT 10) AS alias_3 ON (table_1.column_10 = alias_3.alias_2) ORDER BY table_1.column_10 DESC LIMIT 10
----
1.0000

query  nosort
SELECT avg(table_1.column_37) AS alias_1 FROM table_1 INNER JOIN (SELECT avg(table_1.column_38) AS alias_2 FROM table_1 ORDER BY table_1.column_10 DESC LIMIT 10) AS alias_3 ON (table_1.column_10 = alias_3.alias_2) ORDER BY table_1.column_10 DESC LIMIT 10
----
1.0000

query  nosort
SELECT avg(table_1.column_39) AS alias_1 FROM table_1 INNER JOIN (SELECT table_1.column_10 AS alias_2 FROM table_1 ORDER BY table_1.column_10 DESC LIMIT 10) AS alias_3 ON (table_1.column_10 = alias_3.alias_2) ORDER BY table_1.column_10 DESC LIMIT 10
----
1.0000

query  nosort
SELECT avg(table_1.column_40) AS alias_1 FROM table_1 INNER JOIN (SELECT avg(table_1.column_41) AS alias_2 FROM table_1 ORDER BY table_1.column_10 DESC LIMIT 10) AS alias_3 ON (table_1.column_10 = alias_3.alias_2) ORDER BY table_1.column_10 DESC LIMIT 10
----
1.0000

query  nosort
SELECT table_1.column_10 AS alias_3 FROM table_1 INNER JOIN (SELECT avg(table_1.column_42) AS alias_1 FROM table_1) AS alias_2 ON (table_1.column_10 = alias_2.alias_1) ORDER BY table_1.column_10 DESC LIMIT 10
----
1
1
1
1
1

query  nosort
SELECT table_1.column_10 AS alias_3 FROM table_1 INNER JOIN (SELECT table_1.column_10 AS alias_1 FROM table_1 ORDER BY table_1.column_10 ASC LIMIT 10) AS alias_2 ON (table_1.column_10 = alias_2.alias_1) ORDER BY table_1.column_10 DESC LIMIT 10
----
1
1
1
1
1
1
1
1
1
1

query  nosort
SELECT table_1.column_10 AS alias_3 FROM table_1 INNER JOIN (SELECT table_1.column_10 AS alias_1 FROM table_1 ORDER BY table_1.column_10 DESC LIMIT 10) AS alias_2 ON (table_1.column_10 = alias_2.alias_1) ORDER BY table_1.column_10 DESC LIMIT 10
----
1
1
1
1
1
1
1
1
1
1

query  nosort
SELECT table_1.column_10 AS alias_3 FROM table_1 INNER JOIN (SELECT avg(table_1.column_43) AS alias_1 FROM table_1 ORDER BY table_1.column_10 ASC LIMIT 10) AS alias_2 ON (table_1.column_10 = alias_2.alias_1) ORDER BY table_1.column_10 DESC LIMIT 10
----
1
1
1
1
1

query  nosort
SELECT table_1.column_10 AS alias_3 FROM table_1 INNER JOIN (SELECT avg(table_1.column_44) AS alias_1 FROM table_1 ORDER BY table_1.column_10 DESC LIMIT 10) AS alias_2 ON (table_1.column_10 = alias_2.alias_1) ORDER BY table_1.column_10 DESC LIMIT 10
----
1
1
1
1
1

query  nosort
SELECT table_1.column_10 AS alias_3 FROM table_1 INNER JOIN (SELECT table_1.column_10 AS alias_1 FROM table_1 ORDER BY table_1.column_10 DESC LIMIT 10) AS alias_2 ON (table_1.column_10 = alias_2.alias_1) ORDER BY table_1.column_10 DESC LIMIT 10
----
1
1
1
1
1
1
1
1
1
1

query  nosort
SELECT table_1.column_10 AS alias_3 FROM table_1 INNER JOIN (SELECT avg(table_1.column_45) AS alias_1 FROM table_1 ORDER BY table_1.column_10 DESC LIMIT 10) AS alias_2 ON (table_1.column_10 = alias_2.alias_1) ORDER BY table_1.column_10 DESC LIMIT 10
----
1
1
1
1
1

query  nosort
SELECT avg(table_1.column_46) AS alias_1 FROM table_1 INNER JOIN (SELECT avg(table_1.column_47) AS alias_2 FROM table_1) AS alias_3 ON (table_1.column_10 = alias_3.alias_2) ORDER BY table_1.column_10 DESC LIMIT 10
----
1.0000

query  nosort
SELECT avg(table_1.column_48) AS alias_1 FROM table_1 INNER JOIN (SELECT table_1.column_10 AS alias_2 FROM table_1 ORDER BY table_1.column_10 ASC LIMIT 10) AS alias_3 ON (table_1.column_10 = alias_3.alias_2) ORDER BY table_1.column_10 DESC LIMIT 10
----
1.0000

query  nosort
SELECT avg(table_1.column_49) AS alias_1 FROM table_1 INNER JOIN (SELECT table_1.column_10 AS alias_2 FROM table_1 ORDER BY table_1.column_10 DESC LIMIT 10) AS alias_3 ON (table_1.column_10 = alias_3.alias_2) ORDER BY table_1.column_10 DESC LIMIT 10
----
1.0000

query  nosort
SELECT avg(table_1.column_50) AS alias_1 FROM table_1 INNER JOIN (SELECT avg(table_1.column_51) AS alias_2 FROM table_1 ORDER BY table_1.column_10 ASC LIMIT 10) AS alias_3 ON (table_1.column_10 = alias_3.alias_2) ORDER BY table_1.column_10 DESC LIMIT 10
----
1.0000

query  nosort
SELECT avg(table_1.column_52) AS alias_1 FROM table_1 INNER JOIN (SELECT avg(table_1.column_53) AS alias_2 FROM table_1 ORDER BY table_1.column_10 DESC LIMIT 10) AS alias_3 ON (table_1.column_10 = alias_3.alias_2) ORDER BY table_1.column_10 DESC LIMIT 10
----
1.0000

query  nosort
SELECT avg(table_1.column_54) AS alias_1 FROM table_1 INNER JOIN (SELECT table_1.column_10 AS alias_2 FROM table_1 ORDER BY table_1.column_10 DESC LIMIT 10) AS alias_3 ON (table_1.column_10 = alias_3.alias_2) ORDER BY table_1.column_10 DESC LIMIT 10
----
1.0000

query  nosort
SELECT avg(table_1.column_55) AS alias_1 FROM table_1 INNER JOIN (SELECT avg(table_1.column_56) AS alias_2 FROM table_1 ORDER BY table_1.column_10 DESC LIMIT 10) AS alias_3 ON (table_1.column_10 = alias_3.alias_2) ORDER BY table_1.column_10 DESC LIMIT 10
----
1.0000

statement ok
DELETE FROM table_1 WHERE (column_57 = 2)


statement ok
DELETE FROM table_1 WHERE (column_57 = 3)


query  nosort
SELECT avg(table_1.column_1) AS alias_1 FROM table_1 INNER JOIN (SELECT avg(table_1.column_2) AS alias_2 FROM table_1) AS alias_3 ON (table_1.column_1 = alias_3.alias_2)
----
1.0000

query  nosort
SELECT avg(table_1.column_3) AS alias_1 FROM table_1 INNER JOIN (SELECT table_1.column_3 AS alias_2 FROM table_1 ORDER BY table_1.column_3 ASC LIMIT 10) AS alias_3 ON (table_1.column_3 = alias_3.alias_2)
----
1.0000

query  nosort
SELECT avg(table_1.column_4) AS alias_1 FROM table_1 INNER JOIN (SELECT table_1.column_4 AS alias_2 FROM table_1 ORDER BY table_1.column_4 DESC LIMIT 10) AS alias_3 ON (table_1.column_4 = alias_3.alias_2)
----
1.0000

query  nosort
SELECT avg(table_1.column_5) AS alias_1 FROM table_1 INNER JOIN (SELECT avg(table_1.column_6) AS alias_2 FROM table_1 ORDER BY table_1.column_4 ASC LIMIT 10) AS alias_3 ON (table_1.column_4 = alias_3.alias_2)
----
1.0000

query  nosort
SELECT avg(table_1.column_7) AS alias_1 FROM table_1 INNER JOIN (SELECT avg(table_1.column_8) AS alias_2 FROM table_1 ORDER BY table_1.column_4 DESC LIMIT 10) AS alias_3 ON (table_1.column_4 = alias_3.alias_2)
----
1.0000

query  nosort
SELECT avg(table_1.column_9) AS alias_1 FROM table_1 INNER JOIN (SELECT table_1.column_4 AS alias_2 FROM table_1 ORDER BY table_1.column_4 DESC LIMIT 10) AS alias_3 ON (table_1.column_4 = alias_3.alias_2)
----
1.0000

query  nosort
SELECT avg(table_1.column_10) AS alias_1 FROM table_1 INNER JOIN (SELECT avg(table_1.column_11) AS alias_2 FROM table_1 ORDER BY table_1.column_4 DESC LIMIT 10) AS alias_3 ON (table_1.column_4 = alias_3.alias_2)
----
1.0000

query  nosort
SELECT table_1.column_4 AS alias_3 FROM table_1 INNER JOIN (SELECT avg(table_1.column_12) AS alias_1 FROM table_1) AS alias_2 ON (table_1.column_4 = alias_2.alias_1) ORDER BY table_1.column_4 ASC LIMIT 10
----
1
1
1

query  nosort
SELECT table_1.column_4 AS alias_3 FROM table_1 INNER JOIN (SELECT table_1.column_4 AS alias_1 FROM table_1 ORDER BY table_1.column_4 ASC LIMIT 10) AS alias_2 ON (table_1.column_4 = alias_2.alias_1) ORDER BY table_1.column_4 ASC LIMIT 10
----
1
1
1
1
1
1
1
1
1

query  nosort
SELECT table_1.column_4 AS alias_3 FROM table_1 INNER JOIN (SELECT table_1.column_4 AS alias_1 FROM table_1 ORDER BY table_1.column_4 DESC LIMIT 10) AS alias_2 ON (table_1.column_4 = alias_2.alias_1) ORDER BY table_1.column_4 ASC LIMIT 10
----
1
1
1
1
1
1
1
1
1

query  nosort
SELECT table_1.column_4 AS alias_3 FROM table_1 INNER JOIN (SELECT avg(table_1.column_13) AS alias_1 FROM table_1 ORDER BY table_1.column_4 ASC LIMIT 10) AS alias_2 ON (table_1.column_4 = alias_2.alias_1) ORDER BY table_1.column_4 ASC LIMIT 10
----
1
1
1

query  nosort
SELECT table_1.column_4 AS alias_3 FROM table_1 INNER JOIN (SELECT avg(table_1.column_14) AS alias_1 FROM table_1 ORDER BY table_1.column_4 DESC LIMIT 10) AS alias_2 ON (table_1.column_4 = alias_2.alias_1) ORDER BY table_1.column_4 ASC LIMIT 10
----
1
1
1

query  nosort
SELECT table_1.column_4 AS alias_3 FROM table_1 INNER JOIN (SELECT table_1.column_4 AS alias_1 FROM table_1 ORDER BY table_1.column_4 DESC LIMIT 10) AS alias_2 ON (table_1.column_4 = alias_2.alias_1) ORDER BY table_1.column_4 ASC LIMIT 10
----
1
1
1
1
1
1
1
1
1

query  nosort
SELECT table_1.column_4 AS alias_3 FROM table_1 INNER JOIN (SELECT avg(table_1.column_15) AS alias_1 FROM table_1 ORDER BY table_1.column_4 DESC LIMIT 10) AS alias_2 ON (table_1.column_4 = alias_2.alias_1) ORDER BY table_1.column_4 ASC LIMIT 10
----
1
1
1

query  nosort
SELECT table_1.column_4 AS alias_3 FROM table_1 INNER JOIN (SELECT avg(table_1.column_16) AS alias_1 FROM table_1) AS alias_2 ON (table_1.column_4 = alias_2.alias_1) ORDER BY table_1.column_4 DESC LIMIT 10
----
1
1
1

query  nosort
SELECT table_1.column_4 AS alias_3 FROM table_1 INNER JOIN (SELECT table_1.column_4 AS alias_1 FROM table_1 ORDER BY table_1.column_4 ASC LIMIT 10) AS alias_2 ON (table_1.column_4 = alias_2.alias_1) ORDER BY table_1.column_4 DESC LIMIT 10
----
1
1
1
1
1
1
1
1
1

query  nosort
SELECT table_1.column_4 AS alias_3 FROM table_1 INNER JOIN (SELECT table_1.column_4 AS alias_1 FROM table_1 ORDER BY table_1.column_4 DESC LIMIT 10) AS alias_2 ON (table_1.column_4 = alias_2.alias_1) ORDER BY table_1.column_4 DESC LIMIT 10
----
1
1
1
1
1
1
1
1
1

query  nosort
SELECT table_1.column_4 AS alias_3 FROM table_1 INNER JOIN (SELECT avg(table_1.column_17) AS alias_1 FROM table_1 ORDER BY table_1.column_4 ASC LIMIT 10) AS alias_2 ON (table_1.column_4 = alias_2.alias_1) ORDER BY table_1.column_4 DESC LIMIT 10
----
1
1
1

query  nosort
SELECT table_1.column_4 AS alias_3 FROM table_1 INNER JOIN (SELECT avg(table_1.column_18) AS alias_1 FROM table_1 ORDER BY table_1.column_4 DESC LIMIT 10) AS alias_2 ON (table_1.column_4 = alias_2.alias_1) ORDER BY table_1.column_4 DESC LIMIT 10
----
1
1
1

query  nosort
SELECT table_1.column_4 AS alias_3 FROM table_1 INNER JOIN (SELECT table_1.column_4 AS alias_1 FROM table_1 ORDER BY table_1.column_4 DESC LIMIT 10) AS alias_2 ON (table_1.column_4 = alias_2.alias_1) ORDER BY table_1.column_4 DESC LIMIT 10
----
1
1
1
1
1
1
1
1
1

query  nosort
SELECT table_1.column_4 AS alias_3 FROM table_1 INNER JOIN (SELECT avg(table_1.column_19) AS alias_1 FROM table_1 ORDER BY table_1.column_4 DESC LIMIT 10) AS alias_2 ON (table_1.column_4 = alias_2.alias_1) ORDER BY table_1.column_4 DESC LIMIT 10
----
1
1
1

query  nosort
SELECT avg(table_1.column_20) AS alias_1 FROM table_1 INNER JOIN (SELECT avg(table_1.column_21) AS alias_2 FROM table_1) AS alias_3 ON (table_1.column_4 = alias_3.alias_2) ORDER BY table_1.column_4 ASC LIMIT 10
----
1.0000

query  nosort
SELECT avg(table_1.column_22) AS alias_1 FROM table_1 INNER JOIN (SELECT table_1.column_4 AS alias_2 FROM table_1 ORDER BY table_1.column_4 ASC LIMIT 10) AS alias_3 ON (table_1.column_4 = alias_3.alias_2) ORDER BY table_1.column_4 ASC LIMIT 10
----
1.0000

query  nosort
SELECT avg(table_1.column_23) AS alias_1 FROM table_1 INNER JOIN (SELECT table_1.column_4 AS alias_2 FROM table_1 ORDER BY table_1.column_4 DESC LIMIT 10) AS alias_3 ON (table_1.column_4 = alias_3.alias_2) ORDER BY table_1.column_4 ASC LIMIT 10
----
1.0000

query  nosort
SELECT avg(table_1.column_24) AS alias_1 FROM table_1 INNER JOIN (SELECT avg(table_1.column_25) AS alias_2 FROM table_1 ORDER BY table_1.column_4 ASC LIMIT 10) AS alias_3 ON (table_1.column_4 = alias_3.alias_2) ORDER BY table_1.column_4 ASC LIMIT 10
----
1.0000

query  nosort
SELECT avg(table_1.column_26) AS alias_1 FROM table_1 INNER JOIN (SELECT avg(table_1.column_27) AS alias_2 FROM table_1 ORDER BY table_1.column_4 DESC LIMIT 10) AS alias_3 ON (table_1.column_4 = alias_3.alias_2) ORDER BY table_1.column_4 ASC LIMIT 10
----
1.0000

query  nosort
SELECT avg(table_1.column_28) AS alias_1 FROM table_1 INNER JOIN (SELECT table_1.column_4 AS alias_2 FROM table_1 ORDER BY table_1.column_4 DESC LIMIT 10) AS alias_3 ON (table_1.column_4 = alias_3.alias_2) ORDER BY table_1.column_4 ASC LIMIT 10
----
1.0000

query  nosort
SELECT avg(table_1.column_29) AS alias_1 FROM table_1 INNER JOIN (SELECT avg(table_1.column_30) AS alias_2 FROM table_1 ORDER BY table_1.column_10 DESC LIMIT 10) AS alias_3 ON (table_1.column_10 = alias_3.alias_2) ORDER BY table_1.column_10 ASC LIMIT 10
----
1.0000

query  nosort
SELECT avg(table_1.column_31) AS alias_1 FROM table_1 INNER JOIN (SELECT avg(table_1.column_32) AS alias_2 FROM table_1) AS alias_3 ON (table_1.column_10 = alias_3.alias_2) ORDER BY table_1.column_10 DESC LIMIT 10
----
1.0000

query  nosort
SELECT avg(table_1.column_33) AS alias_1 FROM table_1 INNER JOIN (SELECT table_1.column_10 AS alias_2 FROM table_1 ORDER BY table_1.column_10 ASC LIMIT 10) AS alias_3 ON (table_1.column_10 = alias_3.alias_2) ORDER BY table_1.column_10 DESC LIMIT 10
----
1.0000

query  nosort
SELECT avg(table_1.column_34) AS alias_1 FROM table_1 INNER JOIN (SELECT table_1.column_10 AS alias_2 FROM table_1 ORDER BY table_1.column_10 DESC LIMIT 10) AS alias_3 ON (table_1.column_10 = alias_3.alias_2) ORDER BY table_1.column_10 DESC LIMIT 10
----
1.0000

query  nosort
SELECT avg(table_1.column_35) AS alias_1 FROM table_1 INNER JOIN (SELECT avg(table_1.column_36) AS alias_2 FROM table_1 ORDER BY table_1.column_10 ASC LIMIT 10) AS alias_3 ON (table_1.column_10 = alias_3.alias_2) ORDER BY table_1.column_10 DESC LIMIT 10
----
1.0000

query  nosort
SELECT avg(table_1.column_37) AS alias_1 FROM table_1 INNER JOIN (SELECT avg(table_1.column_38) AS alias_2 FROM table_1 ORDER BY table_1.column_10 DESC LIMIT 10) AS alias_3 ON (table_1.column_10 = alias_3.alias_2) ORDER BY table_1.column_10 DESC LIMIT 10
----
1.0000

query  nosort
SELECT avg(table_1.column_39) AS alias_1 FROM table_1 INNER JOIN (SELECT table_1.column_10 AS alias_2 FROM table_1 ORDER BY table_1.column_10 DESC LIMIT 10) AS alias_3 ON (table_1.column_10 = alias_3.alias_2) ORDER BY table_1.column_10 DESC LIMIT 10
----
1.0000

query  nosort
SELECT avg(table_1.column_40) AS alias_1 FROM table_1 INNER JOIN (SELECT avg(table_1.column_41) AS alias_2 FROM table_1 ORDER BY table_1.column_10 DESC LIMIT 10) AS alias_3 ON (table_1.column_10 = alias_3.alias_2) ORDER BY table_1.column_10 DESC LIMIT 10
----
1.0000

query  nosort
SELECT table_1.column_10 AS alias_3 FROM table_1 INNER JOIN (SELECT avg(table_1.column_42) AS alias_1 FROM table_1) AS alias_2 ON (table_1.column_10 = alias_2.alias_1) ORDER BY table_1.column_10 DESC LIMIT 10
----
1
1
1

query  nosort
SELECT table_1.column_10 AS alias_3 FROM table_1 INNER JOIN (SELECT table_1.column_10 AS alias_1 FROM table_1 ORDER BY table_1.column_10 ASC LIMIT 10) AS alias_2 ON (table_1.column_10 = alias_2.alias_1) ORDER BY table_1.column_10 DESC LIMIT 10
----
1
1
1
1
1
1
1
1
1

query  nosort
SELECT table_1.column_10 AS alias_3 FROM table_1 INNER JOIN (SELECT table_1.column_10 AS alias_1 FROM table_1 ORDER BY table_1.column_10 DESC LIMIT 10) AS alias_2 ON (table_1.column_10 = alias_2.alias_1) ORDER BY table_1.column_10 DESC LIMIT 10
----
1
1
1
1
1
1
1
1
1

query  nosort
SELECT table_1.column_10 AS alias_3 FROM table_1 INNER JOIN (SELECT avg(table_1.column_43) AS alias_1 FROM table_1 ORDER BY table_1.column_10 ASC LIMIT 10) AS alias_2 ON (table_1.column_10 = alias_2.alias_1) ORDER BY table_1.column_10 DESC LIMIT 10
----
1
1
1

query  nosort
SELECT table_1.column_10 AS alias_3 FROM table_1 INNER JOIN (SELECT avg(table_1.column_44) AS alias_1 FROM table_1 ORDER BY table_1.column_10 DESC LIMIT 10) AS alias_2 ON (table_1.column_10 = alias_2.alias_1) ORDER BY table_1.column_10 DESC LIMIT 10
----
1
1
1

query  nosort
SELECT table_1.column_10 AS alias_3 FROM table_1 INNER JOIN (SELECT table_1.column_10 AS alias_1 FROM table_1 ORDER BY table_1.column_10 DESC LIMIT 10) AS alias_2 ON (table_1.column_10 = alias_2.alias_1) ORDER BY table_1.column_10 DESC LIMIT 10
----
1
1
1
1
1
1
1
1
1

query  nosort
SELECT table_1.column_10 AS alias_3 FROM table_1 INNER JOIN (SELECT avg(table_1.column_45) AS alias_1 FROM table_1 ORDER BY table_1.column_10 DESC LIMIT 10) AS alias_2 ON (table_1.column_10 = alias_2.alias_1) ORDER BY table_1.column_10 DESC LIMIT 10
----
1
1
1

query  nosort
SELECT avg(table_1.column_46) AS alias_1 FROM table_1 INNER JOIN (SELECT avg(table_1.column_47) AS alias_2 FROM table_1) AS alias_3 ON (table_1.column_10 = alias_3.alias_2) ORDER BY table_1.column_10 DESC LIMIT 10
----
1.0000

query  nosort
SELECT avg(table_1.column_48) AS alias_1 FROM table_1 INNER JOIN (SELECT table_1.column_10 AS alias_2 FROM table_1 ORDER BY table_1.column_10 ASC LIMIT 10) AS alias_3 ON (table_1.column_10 = alias_3.alias_2) ORDER BY table_1.column_10 DESC LIMIT 10
----
1.0000

query  nosort
SELECT avg(table_1.column_49) AS alias_1 FROM table_1 INNER JOIN (SELECT table_1.column_10 AS alias_2 FROM table_1 ORDER BY table_1.column_10 DESC LIMIT 10) AS alias_3 ON (table_1.column_10 = alias_3.alias_2) ORDER BY table_1.column_10 DESC LIMIT 10
----
1.0000

query  nosort
SELECT avg(table_1.column_50) AS alias_1 FROM table_1 INNER JOIN (SELECT avg(table_1.column_51) AS alias_2 FROM table_1 ORDER BY table_1.column_10 ASC LIMIT 10) AS alias_3 ON (table_1.column_10 = alias_3.alias_2) ORDER BY table_1.column_10 DESC LIMIT 10
----
1.0000

query  nosort
SELECT avg(table_1.column_52) AS alias_1 FROM table_1 INNER JOIN (SELECT avg(table_1.column_53) AS alias_2 FROM table_1 ORDER BY table_1.column_10 DESC LIMIT 10) AS alias_3 ON (table_1.column_10 = alias_3.alias_2) ORDER BY table_1.column_10 DESC LIMIT 10
----
1.0000

query  nosort
SELECT avg(table_1.column_54) AS alias_1 FROM table_1 INNER JOIN (SELECT table_1.column_10 AS alias_2 FROM table_1 ORDER BY table_1.column_10 DESC LIMIT 10) AS alias_3 ON (table_1.column_10 = alias_3.alias_2) ORDER BY table_1.column_10 DESC LIMIT 10
----
1.0000

query  nosort
SELECT avg(table_1.column_55) AS alias_1 FROM table_1 INNER JOIN (SELECT avg(table_1.column_56) AS alias_2 FROM table_1 ORDER BY table_1.column_10 DESC LIMIT 10) AS alias_3 ON (table_1.column_10 = alias_3.alias_2) ORDER BY table_1.column_10 DESC LIMIT 10
----
1.0000
