# Generated by:
#     target/debug/noria-logictest generate --operations count,cte,join_subquery --compare-to mysql://root@localhost/mysql --subquery-depth 1 --rows-per-table 5 -o logictests/generated/count,cte,join_subquery.test --include-deletes

statement ok
CREATE TABLE table_1 (column_2 INT(32), column_3 INT(32), column_4 INT(32), column_1 INT(32), PRIMARY KEY (column_4))


statement ok
INSERT INTO table_1 (column_3, column_4, column_2, column_1) VALUES (1, 2, 1, 1), (1, 3, 1, 1), (1, 4, 1, 1), (1, 5, 1, 1), (1, 6, 1, 1)


query  nosort
WITH alias_3 AS (SELECT count(table_1.column_2) AS alias_2 FROM table_1) SELECT count(table_1.column_1) AS alias_1 FROM table_1 INNER JOIN alias_3 ON (table_1.column_2 = alias_3.alias_2) INNER JOIN (SELECT count(table_1.column_3) AS alias_4 FROM table_1) AS alias_5 ON (table_1.column_2 = alias_5.alias_4)
----
0

statement ok
DELETE FROM table_1 WHERE (column_4 = 2)


statement ok
DELETE FROM table_1 WHERE (column_4 = 3)


query  nosort
WITH alias_3 AS (SELECT count(table_1.column_2) AS alias_2 FROM table_1) SELECT count(table_1.column_1) AS alias_1 FROM table_1 INNER JOIN alias_3 ON (table_1.column_2 = alias_3.alias_2) INNER JOIN (SELECT count(table_1.column_3) AS alias_4 FROM table_1) AS alias_5 ON (table_1.column_2 = alias_5.alias_4)
----
0
