# Generated by:
#     target/debug/noria-logictest generate --operations group_concat,cte --compare-to mysql://root@localhost/mysql --subquery-depth 1 --rows-per-table 5 -o logictests/generated/group_concat,cte.test --include-deletes
# failure: ENG-344

statement ok
CREATE TABLE table_1 (column_3 INT(32), column_1 TEXT, column_2 TEXT, PRIMARY KEY (column_3))


statement ok
INSERT INTO table_1 (column_3, column_1, column_2) VALUES (2, 'a', 'a'), (3, 'a', 'a'), (4, 'a', 'a'), (5, 'a', 'a'), (6, 'a', 'a')


query  nosort
WITH alias_3 AS (SELECT group_concat(table_1.column_2 separator ', ') AS alias_2 FROM table_1) SELECT group_concat(table_1.column_1 separator ', ') AS alias_1 FROM table_1 INNER JOIN alias_3 ON (table_1.column_1 = alias_3.alias_2)
----
NULL

statement ok
DELETE FROM table_1 WHERE (column_3 = 2)


statement ok
DELETE FROM table_1 WHERE (column_3 = 3)


query  nosort
WITH alias_3 AS (SELECT group_concat(table_1.column_2 separator ', ') AS alias_2 FROM table_1) SELECT group_concat(table_1.column_1 separator ', ') AS alias_1 FROM table_1 INNER JOIN alias_3 ON (table_1.column_1 = alias_3.alias_2)
----
NULL
