# Generated by:
#     target/debug/noria-logictest permute -d 3 -o logictests/generated/mysql --only in_parameter --compare-to mysql://root:noria@localhost/mysql --subquery-depth 1 --rows-per-table 5 --include-deletes --overwrite-tests

statement ok
CREATE TABLE table_1 (column_3 INT, column_5 INT, column_4 INT, column_1 INT, column_2 INT, PRIMARY KEY (column_5))


statement ok
INSERT INTO table_1 (column_3, column_5, column_4, column_1, column_2) VALUES (0, 0, 1, 1, 1), (1, 1, 1, 1, 1), (1, 2, 1, 2, 1), (1, 3, 1, 1, 1), (2, 4, 1, 0, 1)


query  rowsort
SELECT avg(table_1.column_1) AS alias_1 FROM table_1
----
1.0000

query  rowsort
SELECT DISTINCT table_1.column_1 AS alias_1 FROM table_1
----
0
1
2

query  rowsort
SELECT table_1.column_1 AS alias_1 FROM table_1 WHERE table_1.column_1 IN (?, ?, ?)
? = 0
? = 1
? = 2
----
0
1
1
1
2

query  rowsort
SELECT DISTINCT avg(table_1.column_2) AS alias_1 FROM table_1
----
1.0000

query  rowsort
SELECT avg(table_1.column_3) AS alias_1 FROM table_1 WHERE table_1.column_1 IN (?, ?, ?)
? = 0
? = 1
? = 2
----
1.0000

query  rowsort
SELECT DISTINCT table_1.column_1 AS alias_1 FROM table_1 WHERE table_1.column_1 IN (?, ?, ?)
? = 0
? = 1
? = 2
----
0
1
2

query  rowsort
SELECT DISTINCT avg(table_1.column_4) AS alias_1 FROM table_1 WHERE table_1.column_3 IN (?, ?, ?)
? = 0
? = 1
? = 2
----
1.0000

statement ok
DELETE FROM table_1 WHERE (column_5 = 0)


statement ok
DELETE FROM table_1 WHERE (column_5 = 1)


query  rowsort
SELECT avg(table_1.column_1) AS alias_1 FROM table_1
----
1.0000

query  rowsort
SELECT DISTINCT table_1.column_1 AS alias_1 FROM table_1
----
0
1
2

query  rowsort
SELECT table_1.column_1 AS alias_1 FROM table_1 WHERE table_1.column_1 IN (?, ?, ?)
? = 0
? = 1
? = 2
----
0
1
2

query  rowsort
SELECT DISTINCT avg(table_1.column_2) AS alias_1 FROM table_1
----
1.0000

query  rowsort
SELECT avg(table_1.column_3) AS alias_1 FROM table_1 WHERE table_1.column_1 IN (?, ?, ?)
? = 0
? = 1
? = 2
----
1.3333

query  rowsort
SELECT DISTINCT table_1.column_1 AS alias_1 FROM table_1 WHERE table_1.column_1 IN (?, ?, ?)
? = 0
? = 1
? = 2
----
0
1
2

query  rowsort
SELECT DISTINCT avg(table_1.column_4) AS alias_1 FROM table_1 WHERE table_1.column_3 IN (?, ?, ?)
? = 0
? = 1
? = 2
----
1.0000
