# Generated by:
#     target/debug/noria-logictest permute -d 3 -o logictests/generated/mysql --only in_parameter --compare-to mysql://root:noria@localhost/mysql --subquery-depth 1 --rows-per-table 5 --include-deletes --overwrite-tests

statement ok
CREATE TABLE table_2 (column_5 TEXT, column_1 INT, column_4 INT, column_6 INT, column_2 INT, column_3 TEXT, PRIMARY KEY (column_6))


statement ok
CREATE TABLE table_4 (column_1 INT, column_3 INT, column_2 INT, PRIMARY KEY (column_3))


statement ok
CREATE TABLE table_5 (column_3 INT, column_1 INT, column_2 INT, PRIMARY KEY (column_3))


statement ok
CREATE TABLE table_1 (column_4 INT, column_5 TEXT, column_6 INT, column_7 INT, column_2 INT, column_3 TEXT, column_1 INT, PRIMARY KEY (column_7))


statement ok
CREATE TABLE table_3 (column_3 INT, column_1 INT, column_2 INT, PRIMARY KEY (column_3))


statement ok
INSERT INTO table_2 (column_5, column_1, column_4, column_6, column_2, column_3) VALUES ('1', 1, 1, 0, 2, 'a'), ('a', 1, 1, 1, 1, 'a'), ('2', 1, 1, 2, 1, 'a'), ('a', 1, 1, 3, 1, 'a'), ('0', 1, 1, 4, 0, 'a')


statement ok
INSERT INTO table_4 (column_1, column_3, column_2) VALUES (1, 0, 1), (1, 1, 1), (1, 2, 1), (1, 3, 1), (1, 4, 1)


statement ok
INSERT INTO table_5 (column_3, column_1, column_2) VALUES (0, 1, 1), (1, 1, 1), (2, 1, 1), (3, 1, 1), (4, 1, 1)


statement ok
INSERT INTO table_1 (column_4, column_5, column_6, column_7, column_2, column_3, column_1) VALUES (2, 'a', 1, 0, 1, 'a', 1), (1, 'a', 1, 1, 1, 'a', 1), (0, 'a', 1, 2, 0, 'a', 1), (1, 'a', 1, 3, 1, 'a', 1), (1, 'a', 1, 4, 2, 'a', 1)


statement ok
INSERT INTO table_3 (column_3, column_1, column_2) VALUES (0, 1, 1), (1, 1, 1), (2, 1, 1), (3, 1, 1), (4, 1, 1)


query  rowsort
SELECT table_1.column_2 AS alias_1, table_2.column_2 AS alias_2 FROM table_1 INNER JOIN table_2 ON (table_1.column_1 = table_2.column_1)
----
50 values hashing to 9dffe3805063558834acf140f79611ab

query  rowsort
SELECT group_concat(table_1.column_3 separator ', ') AS alias_1 FROM table_1
----
a, a, a, a, a

query  rowsort
SELECT table_1.column_2 AS alias_1 FROM table_1 WHERE table_1.column_2 IN (?, ?, ?)
? = 0
? = 1
? = 2
----
0
1
1
1
2

query  rowsort
SELECT table_1.column_4 AS alias_1, table_3.column_2 AS alias_2, group_concat(table_1.column_5 separator ', ') AS alias_3 FROM table_1 INNER JOIN table_3 ON (table_1.column_2 = table_3.column_1) GROUP BY table_1.column_4, table_3.column_2
----
1
1
a, a, a, a, a, a, a, a, a, a
2
1
a, a, a, a, a

query  rowsort
SELECT table_1.column_6 AS alias_1, table_4.column_2 AS alias_2 FROM table_1 INNER JOIN table_4 ON (table_1.column_4 = table_4.column_1) WHERE table_1.column_4 IN (?, ?, ?)
? = 0
? = 1
? = 2
----
30 values hashing to 56a22a5394edccfc958048b005afa27b

query  rowsort
SELECT group_concat(table_2.column_3 separator ', ') AS alias_1 FROM table_2 WHERE table_2.column_2 IN (?, ?, ?)
? = 0
? = 1
? = 2
----
a, a, a, a, a

query  rowsort
SELECT table_2.column_4 AS alias_1, table_5.column_2 AS alias_2, group_concat(table_2.column_5 separator ', ') AS alias_3 FROM table_2 INNER JOIN table_5 ON (table_2.column_2 = table_5.column_1) WHERE table_2.column_5 IN (?, ?, ?) GROUP BY table_2.column_4, table_5.column_2
? = 0
? = 1
? = 2
----
1
1
2, 2, 2, 2, 2

statement ok
DELETE FROM table_2 WHERE (column_6 = 0)


statement ok
DELETE FROM table_2 WHERE (column_6 = 1)


statement ok
DELETE FROM table_4 WHERE (column_3 = 0)


statement ok
DELETE FROM table_4 WHERE (column_3 = 1)


statement ok
DELETE FROM table_5 WHERE (column_3 = 0)


statement ok
DELETE FROM table_5 WHERE (column_3 = 1)


statement ok
DELETE FROM table_1 WHERE (column_7 = 0)


statement ok
DELETE FROM table_1 WHERE (column_7 = 1)


statement ok
DELETE FROM table_3 WHERE (column_3 = 0)


statement ok
DELETE FROM table_3 WHERE (column_3 = 1)


query  rowsort
SELECT table_1.column_2 AS alias_1, table_2.column_2 AS alias_2 FROM table_1 INNER JOIN table_2 ON (table_1.column_1 = table_2.column_1)
----
0
0
0
1
0
1
1
0
1
1
1
1
2
0
2
1
2
1

query  rowsort
SELECT group_concat(table_1.column_3 separator ', ') AS alias_1 FROM table_1
----
a, a, a

query  rowsort
SELECT table_1.column_2 AS alias_1 FROM table_1 WHERE table_1.column_2 IN (?, ?, ?)
? = 0
? = 1
? = 2
----
0
1
2

query  rowsort
SELECT table_1.column_4 AS alias_1, table_3.column_2 AS alias_2, group_concat(table_1.column_5 separator ', ') AS alias_3 FROM table_1 INNER JOIN table_3 ON (table_1.column_2 = table_3.column_1) GROUP BY table_1.column_4, table_3.column_2
----
1
1
a, a, a

query  rowsort
SELECT table_1.column_6 AS alias_1, table_4.column_2 AS alias_2 FROM table_1 INNER JOIN table_4 ON (table_1.column_4 = table_4.column_1) WHERE table_1.column_4 IN (?, ?, ?)
? = 0
? = 1
? = 2
----
1
1
1
1
1
1
1
1
1
1
1
1

query  rowsort
SELECT group_concat(table_2.column_3 separator ', ') AS alias_1 FROM table_2 WHERE table_2.column_2 IN (?, ?, ?)
? = 0
? = 1
? = 2
----
a, a, a

query  rowsort
SELECT table_2.column_4 AS alias_1, table_5.column_2 AS alias_2, group_concat(table_2.column_5 separator ', ') AS alias_3 FROM table_2 INNER JOIN table_5 ON (table_2.column_2 = table_5.column_1) WHERE table_2.column_5 IN (?, ?, ?) GROUP BY table_2.column_4, table_5.column_2
? = 0
? = 1
? = 2
----
1
1
2, 2, 2
