# Generated by:
#     target/debug/noria-logictest generate --operations max,min,cte --compare-to postgresql://root@localhost/psql --subquery-depth 1 --rows-per-table 5 -o logictests/generated/test2/max,min,cte.test --include-deletes

statement ok
CREATE TABLE table_1 (column_2 INT, column_1 INT, PRIMARY KEY (column_2))


statement ok
INSERT INTO table_1 (column_2, column_1) VALUES (0, 1), (1, 1), (2, 1), (3, 1), (4, 1)


query  nosort
WITH alias_3 AS (SELECT max(table_1.column_1) AS alias_2 FROM table_1) SELECT max(table_1.column_1) AS alias_1 FROM table_1 INNER JOIN alias_3 ON (table_1.column_1 = alias_3.alias_2)
----
1

query  nosort
WITH alias_3 AS (SELECT min(table_1.column_1) AS alias_2 FROM table_1) SELECT max(table_1.column_1) AS alias_1 FROM table_1 INNER JOIN alias_3 ON (table_1.column_1 = alias_3.alias_2)
----
1

query  nosort
WITH alias_4 AS (SELECT max(table_1.column_1) AS alias_2, min(table_1.column_1) AS alias_3 FROM table_1) SELECT max(table_1.column_1) AS alias_1 FROM table_1 INNER JOIN alias_4 ON (table_1.column_1 = alias_4.alias_2)
----
1

query  nosort
WITH alias_3 AS (SELECT max(table_1.column_1) AS alias_2 FROM table_1) SELECT min(table_1.column_1) AS alias_1 FROM table_1 INNER JOIN alias_3 ON (table_1.column_1 = alias_3.alias_2)
----
1

query  nosort
WITH alias_3 AS (SELECT min(table_1.column_1) AS alias_2 FROM table_1) SELECT min(table_1.column_1) AS alias_1 FROM table_1 INNER JOIN alias_3 ON (table_1.column_1 = alias_3.alias_2)
----
1

query  nosort
WITH alias_4 AS (SELECT max(table_1.column_1) AS alias_2, min(table_1.column_1) AS alias_3 FROM table_1) SELECT min(table_1.column_1) AS alias_1 FROM table_1 INNER JOIN alias_4 ON (table_1.column_1 = alias_4.alias_2)
----
1

query  nosort
WITH alias_4 AS (SELECT max(table_1.column_1) AS alias_3 FROM table_1) SELECT max(table_1.column_1) AS alias_1, min(table_1.column_1) AS alias_2 FROM table_1 INNER JOIN alias_4 ON (table_1.column_1 = alias_4.alias_3)
----
1
1

query  nosort
WITH alias_4 AS (SELECT min(table_1.column_1) AS alias_3 FROM table_1) SELECT max(table_1.column_1) AS alias_1, min(table_1.column_1) AS alias_2 FROM table_1 INNER JOIN alias_4 ON (table_1.column_1 = alias_4.alias_3)
----
1
1

query  nosort
WITH alias_5 AS (SELECT max(table_1.column_1) AS alias_3, min(table_1.column_1) AS alias_4 FROM table_1) SELECT max(table_1.column_1) AS alias_1, min(table_1.column_1) AS alias_2 FROM table_1 INNER JOIN alias_5 ON (table_1.column_1 = alias_5.alias_3)
----
1
1

statement ok
DELETE FROM table_1 WHERE (column_2 = 0)


statement ok
DELETE FROM table_1 WHERE (column_2 = 1)


query  nosort
WITH alias_3 AS (SELECT max(table_1.column_1) AS alias_2 FROM table_1) SELECT max(table_1.column_1) AS alias_1 FROM table_1 INNER JOIN alias_3 ON (table_1.column_1 = alias_3.alias_2)
----
1

query  nosort
WITH alias_3 AS (SELECT min(table_1.column_1) AS alias_2 FROM table_1) SELECT max(table_1.column_1) AS alias_1 FROM table_1 INNER JOIN alias_3 ON (table_1.column_1 = alias_3.alias_2)
----
1

query  nosort
WITH alias_4 AS (SELECT max(table_1.column_1) AS alias_2, min(table_1.column_1) AS alias_3 FROM table_1) SELECT max(table_1.column_1) AS alias_1 FROM table_1 INNER JOIN alias_4 ON (table_1.column_1 = alias_4.alias_2)
----
1

query  nosort
WITH alias_3 AS (SELECT max(table_1.column_1) AS alias_2 FROM table_1) SELECT min(table_1.column_1) AS alias_1 FROM table_1 INNER JOIN alias_3 ON (table_1.column_1 = alias_3.alias_2)
----
1

query  nosort
WITH alias_3 AS (SELECT min(table_1.column_1) AS alias_2 FROM table_1) SELECT min(table_1.column_1) AS alias_1 FROM table_1 INNER JOIN alias_3 ON (table_1.column_1 = alias_3.alias_2)
----
1

query  nosort
WITH alias_4 AS (SELECT max(table_1.column_1) AS alias_2, min(table_1.column_1) AS alias_3 FROM table_1) SELECT min(table_1.column_1) AS alias_1 FROM table_1 INNER JOIN alias_4 ON (table_1.column_1 = alias_4.alias_2)
----
1

query  nosort
WITH alias_4 AS (SELECT max(table_1.column_1) AS alias_3 FROM table_1) SELECT max(table_1.column_1) AS alias_1, min(table_1.column_1) AS alias_2 FROM table_1 INNER JOIN alias_4 ON (table_1.column_1 = alias_4.alias_3)
----
1
1

query  nosort
WITH alias_4 AS (SELECT min(table_1.column_1) AS alias_3 FROM table_1) SELECT max(table_1.column_1) AS alias_1, min(table_1.column_1) AS alias_2 FROM table_1 INNER JOIN alias_4 ON (table_1.column_1 = alias_4.alias_3)
----
1
1

query  nosort
WITH alias_5 AS (SELECT max(table_1.column_1) AS alias_3, min(table_1.column_1) AS alias_4 FROM table_1) SELECT max(table_1.column_1) AS alias_1, min(table_1.column_1) AS alias_2 FROM table_1 INNER JOIN alias_5 ON (table_1.column_1 = alias_5.alias_3)
----
1
1
