# Generated by:
#     target/debug/noria-logictest generate --operations min,left_join,join_subquery --compare-to postgresql://root@localhost/psql --subquery-depth 1 --rows-per-table 5 -o logictests/generated/test2/min,left_join,join_subquery.test --include-deletes

statement ok
CREATE TABLE table_12 (column_1 INT, column_3 INT, column_2 INT, column_4 INT, PRIMARY KEY (column_4))


statement ok
CREATE TABLE table_9 (column_1 INT, column_4 INT, column_5 INT, column_3 INT, column_2 INT, PRIMARY KEY (column_5))


statement ok
CREATE TABLE table_10 (column_3 INT, column_4 INT, column_1 INT, column_2 INT, PRIMARY KEY (column_4))


statement ok
CREATE TABLE table_13 (column_2 INT, column_1 INT, column_3 INT, PRIMARY KEY (column_3))


statement ok
CREATE TABLE table_11 (column_3 INT, column_1 INT, column_2 INT, PRIMARY KEY (column_3))


statement ok
CREATE TABLE table_1 (column_6 INT, column_3 INT, column_8 INT, column_9 INT, column_4 INT, column_7 INT, column_2 INT, column_1 INT, column_5 INT, column_10 INT, PRIMARY KEY (column_10))


statement ok
CREATE TABLE table_6 (column_1 INT, column_2 INT, column_3 INT, PRIMARY KEY (column_3))


statement ok
CREATE TABLE table_7 (column_2 INT, column_1 INT, column_3 INT, PRIMARY KEY (column_3))


statement ok
CREATE TABLE table_2 (column_3 INT, column_1 INT, column_2 INT, PRIMARY KEY (column_3))


statement ok
CREATE TABLE table_8 (column_1 INT, column_2 INT, column_3 INT, PRIMARY KEY (column_3))


statement ok
CREATE TABLE table_3 (column_3 INT, column_1 INT, column_2 INT, PRIMARY KEY (column_3))


statement ok
CREATE TABLE table_4 (column_1 INT, column_3 INT, column_2 INT, PRIMARY KEY (column_3))


statement ok
CREATE TABLE table_5 (column_2 INT, column_1 INT, column_3 INT, PRIMARY KEY (column_3))


statement ok
INSERT INTO table_12 (column_4, column_1, column_3, column_2) VALUES (0, 1, 1, 1), (1, 1, 1, 1), (2, 1, 1, 1), (3, 1, 1, 1), (4, 1, 1, 1)


statement ok
INSERT INTO table_9 (column_2, column_4, column_1, column_5, column_3) VALUES (1, 1, 1, 0, 1), (1, 1, 1, 1, 1), (1, 1, 1, 2, 1), (1, 1, 1, 3, 1), (1, 1, 1, 4, 1)


statement ok
INSERT INTO table_10 (column_3, column_1, column_4, column_2) VALUES (1, 1, 0, 1), (1, 1, 1, 1), (1, 1, 2, 1), (1, 1, 3, 1), (1, 1, 4, 1)


statement ok
INSERT INTO table_13 (column_2, column_1, column_3) VALUES (1, 1, 0), (1, 1, 1), (1, 1, 2), (1, 1, 3), (1, 1, 4)


statement ok
INSERT INTO table_11 (column_1, column_2, column_3) VALUES (1, 1, 0), (1, 1, 1), (1, 1, 2), (1, 1, 3), (1, 1, 4)


statement ok
INSERT INTO table_1 (column_10, column_5, column_9, column_4, column_2, column_3, column_1, column_8, column_6, column_7) VALUES (0, 1, 1, 1, 1, 1, 1, 1, 1, 1), (1, 1, 1, 1, 1, 1, 1, 1, 1, 1), (2, 1, 1, 1, 1, 1, 1, 1, 1, 1), (3, 1, 1, 1, 1, 1, 1, 1, 1, 1), (4, 1, 1, 1, 1, 1, 1, 1, 1, 1)


statement ok
INSERT INTO table_6 (column_1, column_2, column_3) VALUES (1, 1, 0), (1, 1, 1), (1, 1, 2), (1, 1, 3), (1, 1, 4)


statement ok
INSERT INTO table_7 (column_2, column_1, column_3) VALUES (1, 1, 0), (1, 1, 1), (1, 1, 2), (1, 1, 3), (1, 1, 4)


statement ok
INSERT INTO table_2 (column_3, column_1, column_2) VALUES (0, 1, 1), (1, 1, 1), (2, 1, 1), (3, 1, 1), (4, 1, 1)


statement ok
INSERT INTO table_8 (column_1, column_2, column_3) VALUES (1, 1, 0), (1, 1, 1), (1, 1, 2), (1, 1, 3), (1, 1, 4)


statement ok
INSERT INTO table_3 (column_1, column_2, column_3) VALUES (1, 1, 0), (1, 1, 1), (1, 1, 2), (1, 1, 3), (1, 1, 4)


statement ok
INSERT INTO table_4 (column_3, column_1, column_2) VALUES (0, 1, 1), (1, 1, 1), (2, 1, 1), (3, 1, 1), (4, 1, 1)


statement ok
INSERT INTO table_5 (column_1, column_3, column_2) VALUES (1, 0, 1), (1, 1, 1), (1, 2, 1), (1, 3, 1), (1, 4, 1)


query  nosort
SELECT min(table_1.column_1) AS alias_1 FROM table_1 INNER JOIN (SELECT min(table_1.column_1) AS alias_2 FROM table_1) AS alias_3 ON (table_1.column_1 = alias_3.alias_2)
----
1

query  nosort
SELECT min(table_1.column_1) AS alias_1 FROM table_1 INNER JOIN (SELECT table_1.column_2 AS alias_2, table_2.column_2 AS alias_3 FROM table_1 LEFT JOIN table_2 ON (table_1.column_1 = table_2.column_1)) AS alias_4 ON (table_1.column_1 = alias_4.alias_2)
----
1

query  nosort
SELECT min(table_1.column_1) AS alias_1 FROM table_1 INNER JOIN (SELECT min(table_1.column_1) AS alias_2, table_1.column_3 AS alias_3, table_3.column_2 AS alias_4 FROM table_1 LEFT JOIN table_3 ON (table_1.column_1 = table_3.column_1) GROUP BY table_1.column_3, table_3.column_2) AS alias_5 ON (table_1.column_1 = alias_5.alias_2)
----
1

query  nosort
SELECT table_1.column_4 AS alias_1, table_4.column_2 AS alias_2 FROM table_1 LEFT JOIN table_4 ON (table_1.column_1 = table_4.column_1) INNER JOIN (SELECT min(table_1.column_3) AS alias_3 FROM table_1) AS alias_4 ON (table_1.column_3 = alias_4.alias_3)
----
50 values hashing to 1f4709ccf33e9b44d9c58ab63929bdf1

query  nosort
SELECT table_1.column_5 AS alias_1, table_5.column_2 AS alias_2 FROM table_1 LEFT JOIN table_5 ON (table_1.column_3 = table_5.column_1) INNER JOIN (SELECT table_1.column_6 AS alias_3, table_6.column_2 AS alias_4 FROM table_1 LEFT JOIN table_6 ON (table_1.column_3 = table_6.column_1)) AS alias_5 ON (table_1.column_6 = alias_5.alias_3)
----
1250 values hashing to 297e8f72268fc4cf81241309ad0bbfc9

query  nosort
SELECT table_1.column_7 AS alias_1, table_7.column_2 AS alias_2 FROM table_1 LEFT JOIN table_7 ON (table_1.column_6 = table_7.column_1) INNER JOIN (SELECT min(table_1.column_6) AS alias_3, table_1.column_8 AS alias_4, table_8.column_2 AS alias_5 FROM table_1 LEFT JOIN table_8 ON (table_1.column_6 = table_8.column_1) GROUP BY table_1.column_8, table_8.column_2) AS alias_6 ON (table_1.column_6 = alias_6.alias_3)
----
50 values hashing to 1f4709ccf33e9b44d9c58ab63929bdf1

query  nosort
SELECT min(table_1.column_6) AS alias_1, table_1.column_9 AS alias_2, table_9.column_2 AS alias_3 FROM table_1 LEFT JOIN table_9 ON (table_1.column_6 = table_9.column_1) INNER JOIN (SELECT min(table_9.column_1) AS alias_4 FROM table_9) AS alias_5 ON (table_1.column_6 = alias_5.alias_4) GROUP BY table_1.column_9, table_9.column_2
----
1
1
1

query  nosort
SELECT min(table_9.column_1) AS alias_1, table_9.column_3 AS alias_2, table_10.column_2 AS alias_3 FROM table_9 LEFT JOIN table_10 ON (table_9.column_1 = table_10.column_1) INNER JOIN (SELECT table_10.column_3 AS alias_4, table_11.column_2 AS alias_5 FROM table_10 LEFT JOIN table_11 ON (table_10.column_1 = table_11.column_1)) AS alias_6 ON (table_9.column_1 = alias_6.alias_4) GROUP BY table_9.column_3, table_10.column_2
----
1
1
1

query  nosort
SELECT min(table_9.column_1) AS alias_1, table_9.column_4 AS alias_2, table_12.column_2 AS alias_3 FROM table_9 LEFT JOIN table_12 ON (table_9.column_1 = table_12.column_1) INNER JOIN (SELECT min(table_12.column_2) AS alias_4, table_12.column_3 AS alias_5, table_13.column_2 AS alias_6 FROM table_12 LEFT JOIN table_13 ON (table_12.column_2 = table_13.column_1) GROUP BY table_12.column_3, table_13.column_2) AS alias_7 ON (table_9.column_1 = alias_7.alias_4) GROUP BY table_9.column_4, table_12.column_2
----
1
1
1

statement ok
DELETE FROM table_12 WHERE (column_4 = 0)


statement ok
DELETE FROM table_12 WHERE (column_4 = 1)


statement ok
DELETE FROM table_9 WHERE (column_5 = 0)


statement ok
DELETE FROM table_9 WHERE (column_5 = 1)


statement ok
DELETE FROM table_10 WHERE (column_4 = 0)


statement ok
DELETE FROM table_10 WHERE (column_4 = 1)


statement ok
DELETE FROM table_13 WHERE (column_3 = 0)


statement ok
DELETE FROM table_13 WHERE (column_3 = 1)


statement ok
DELETE FROM table_11 WHERE (column_3 = 0)


statement ok
DELETE FROM table_11 WHERE (column_3 = 1)


statement ok
DELETE FROM table_1 WHERE (column_10 = 0)


statement ok
DELETE FROM table_1 WHERE (column_10 = 1)


statement ok
DELETE FROM table_6 WHERE (column_3 = 0)


statement ok
DELETE FROM table_6 WHERE (column_3 = 1)


statement ok
DELETE FROM table_7 WHERE (column_3 = 0)


statement ok
DELETE FROM table_7 WHERE (column_3 = 1)


statement ok
DELETE FROM table_2 WHERE (column_3 = 0)


statement ok
DELETE FROM table_2 WHERE (column_3 = 1)


statement ok
DELETE FROM table_8 WHERE (column_3 = 0)


statement ok
DELETE FROM table_8 WHERE (column_3 = 1)


statement ok
DELETE FROM table_3 WHERE (column_3 = 0)


statement ok
DELETE FROM table_3 WHERE (column_3 = 1)


statement ok
DELETE FROM table_4 WHERE (column_3 = 0)


statement ok
DELETE FROM table_4 WHERE (column_3 = 1)


statement ok
DELETE FROM table_5 WHERE (column_3 = 0)


statement ok
DELETE FROM table_5 WHERE (column_3 = 1)


query  nosort
SELECT min(table_1.column_1) AS alias_1 FROM table_1 INNER JOIN (SELECT min(table_1.column_1) AS alias_2 FROM table_1) AS alias_3 ON (table_1.column_1 = alias_3.alias_2)
----
1

query  nosort
SELECT min(table_1.column_1) AS alias_1 FROM table_1 INNER JOIN (SELECT table_1.column_2 AS alias_2, table_2.column_2 AS alias_3 FROM table_1 LEFT JOIN table_2 ON (table_1.column_1 = table_2.column_1)) AS alias_4 ON (table_1.column_1 = alias_4.alias_2)
----
1

query  nosort
SELECT min(table_1.column_1) AS alias_1 FROM table_1 INNER JOIN (SELECT min(table_1.column_1) AS alias_2, table_1.column_3 AS alias_3, table_3.column_2 AS alias_4 FROM table_1 LEFT JOIN table_3 ON (table_1.column_1 = table_3.column_1) GROUP BY table_1.column_3, table_3.column_2) AS alias_5 ON (table_1.column_1 = alias_5.alias_2)
----
1

query  nosort
SELECT table_1.column_4 AS alias_1, table_4.column_2 AS alias_2 FROM table_1 LEFT JOIN table_4 ON (table_1.column_1 = table_4.column_1) INNER JOIN (SELECT min(table_1.column_3) AS alias_3 FROM table_1) AS alias_4 ON (table_1.column_3 = alias_4.alias_3)
----
1
1
1
1
1
1
1
1
1
1
1
1
1
1
1
1
1
1

query  nosort
SELECT table_1.column_5 AS alias_1, table_5.column_2 AS alias_2 FROM table_1 LEFT JOIN table_5 ON (table_1.column_3 = table_5.column_1) INNER JOIN (SELECT table_1.column_6 AS alias_3, table_6.column_2 AS alias_4 FROM table_1 LEFT JOIN table_6 ON (table_1.column_3 = table_6.column_1)) AS alias_5 ON (table_1.column_6 = alias_5.alias_3)
----
162 values hashing to 8a24283b115305730b917316cbe232d5

query  nosort
SELECT table_1.column_7 AS alias_1, table_7.column_2 AS alias_2 FROM table_1 LEFT JOIN table_7 ON (table_1.column_6 = table_7.column_1) INNER JOIN (SELECT min(table_1.column_6) AS alias_3, table_1.column_8 AS alias_4, table_8.column_2 AS alias_5 FROM table_1 LEFT JOIN table_8 ON (table_1.column_6 = table_8.column_1) GROUP BY table_1.column_8, table_8.column_2) AS alias_6 ON (table_1.column_6 = alias_6.alias_3)
----
1
1
1
1
1
1
1
1
1
1
1
1
1
1
1
1
1
1

query  nosort
SELECT min(table_1.column_6) AS alias_1, table_1.column_9 AS alias_2, table_9.column_2 AS alias_3 FROM table_1 LEFT JOIN table_9 ON (table_1.column_6 = table_9.column_1) INNER JOIN (SELECT min(table_9.column_1) AS alias_4 FROM table_9) AS alias_5 ON (table_1.column_6 = alias_5.alias_4) GROUP BY table_1.column_9, table_9.column_2
----
1
1
1

query  nosort
SELECT min(table_9.column_1) AS alias_1, table_9.column_3 AS alias_2, table_10.column_2 AS alias_3 FROM table_9 LEFT JOIN table_10 ON (table_9.column_1 = table_10.column_1) INNER JOIN (SELECT table_10.column_3 AS alias_4, table_11.column_2 AS alias_5 FROM table_10 LEFT JOIN table_11 ON (table_10.column_1 = table_11.column_1)) AS alias_6 ON (table_9.column_1 = alias_6.alias_4) GROUP BY table_9.column_3, table_10.column_2
----
1
1
1

query  nosort
SELECT min(table_9.column_1) AS alias_1, table_9.column_4 AS alias_2, table_12.column_2 AS alias_3 FROM table_9 LEFT JOIN table_12 ON (table_9.column_1 = table_12.column_1) INNER JOIN (SELECT min(table_12.column_2) AS alias_4, table_12.column_3 AS alias_5, table_13.column_2 AS alias_6 FROM table_12 LEFT JOIN table_13 ON (table_12.column_2 = table_13.column_1) GROUP BY table_12.column_3, table_13.column_2) AS alias_7 ON (table_9.column_1 = alias_7.alias_4) GROUP BY table_9.column_4, table_12.column_2
----
1
1
1
