statement ok
create table t1 (id int, number int);

statement ok
create table t2 (t1_id int, value int);

statement ok
insert into t1 (id, number) values
(0, 10),
(1, 10),
(1, 10),
(1, NULL);

statement ok
insert into t2 (t1_id, value) values
(0, 20),
(1, 20),
(1, 20),
(1, NULL);

query I nosort
select count(id) from t1 GROUP BY id;
----
1
3

query I nosort
select count(*) from t1 GROUP BY id;
----
1
3

query I nosort
select count(*) from t1 WHERE id=1;
----
3

query I nosort
select count(*) from t1 INNER JOIN t2 ON (t1.id = t2.t1_id) GROUP BY id;
----
1
9

query I nosort
select count(*) from t1 INNER JOIN t2 ON (t1.id = t2.t1_id) WHERE id=1;
----
9

statement ok
create table t3 (id int, state int, number int, PRIMARY KEY(id));

statement ok
insert into t3 (id, state, number) values
(0, 0, 10),
(1, 1, 10),
(2, 1, 10),
(3, 1, NULL);

query I nosort
select count(*) from t3 GROUP BY state;
----
1
3

statement ok
DELETE FROM t3 WHERE id=3;

query I nosort
select count(*) from t3 GROUP BY state;
----
1
2
