statement ok
CREATE TABLE t1 (value int primary key);

statement ok
INSERT INTO t1 (value) values (1), (2), (3), (4), (5), (6), (7), (8), (9), (10), (11), (12);

query I rowsort
SELECT value FROM t1 WHERE value < 5 OR value < 6
----
1
2
3
4
5

statement ok
DELETE FROM t1 WHERE value = 2

query I rowsort
SELECT value FROM t1 WHERE value < 5 OR value < 6
----
1
3
4
5
