statement ok
CREATE TABLE distinct_test(
  value INTEGER,
  number INTEGER
)

statement ok
CREATE TABLE delete_test(
  id INTEGER PRIMARY KEY,
  number INTEGER
)

statement ok
CREATE TABLE lefttable (
  id INT PRIMARY KEY,
  number INT
)

statement ok
CREATE TABLE righttable (
  lefttable_id INTEGER,
  value INTEGER
)

statement ok
INSERT INTO distinct_test (value, number) VALUES (1, 4)

statement ok
INSERT INTO distinct_test (value, number) VALUES (1, 4)

statement ok
INSERT INTO distinct_test (value, number) VALUES (2, 5)

statement ok
INSERT INTO distinct_test (value, number) VALUES (2, 5)

statement ok
INSERT INTO distinct_test (value, number) VALUES (3, 6)

statement ok
INSERT INTO distinct_test (value, number) VALUES (3, 7)

statement ok
INSERT INTO delete_test (id, number) VALUES (1, 4)

statement ok
INSERT INTO delete_test (id, number) VALUES (2, 4)

statement ok
INSERT INTO delete_test (id, number) VALUES (3, 6)

statement ok
INSERT INTO delete_test (id, number) VALUES (4, 6)

statement ok
INSERT INTO lefttable (id, number) VALUES (0, 10)

statement ok
INSERT INTO lefttable (id, number) VALUES (1, 10)

statement ok
INSERT INTO lefttable (id, number) VALUES (2, 10)

statement ok
INSERT INTO righttable (lefttable_id, value) VALUES (0, 20)

statement ok
INSERT INTO righttable (lefttable_id, value) VALUES (1, 20)

statement ok
INSERT INTO righttable (lefttable_id, value) VALUES (2, 20)

query II nosort
SELECT DISTINCT value as v, number as n FROM distinct_test
----
1
4
2
5
3
6
3
7

query I nosort
SELECT DISTINCT count(DISTINCT number) as c FROM distinct_test GROUP BY value
----
1
2

query I nosort
SELECT count(DISTINCT number) as c FROM distinct_test
----
4

query II nosort
SELECT DISTINCT number AS n, righttable.value AS v FROM lefttable INNER JOIN righttable ON (lefttable.id = righttable.lefttable_id)
----
10
20

query I nosort
SELECT DISTINCT number FROM distinct_test WHERE value = ?;
? = 1
----
4

query I rowsort
SELECT DISTINCT number FROM delete_test
----
4
6

query I nosort
SELECT DISTINCT number FROM delete_test WHERE id = ?;
? = 1
----
4

statement ok
DELETE FROM delete_test WHERE id = 1;

query I rowsort
SELECT DISTINCT number FROM delete_test
----
4
6

query I nosort
SELECT DISTINCT number FROM delete_test WHERE id = ?;
? = 2
----
4

statement ok
DELETE FROM delete_test WHERE id = 2;

query I nosort
SELECT DISTINCT number FROM delete_test
----
6

statement ok
INSERT INTO delete_test (id, number) VALUES (1, 7)

query I nosort
SELECT DISTINCT number FROM delete_test
----
6
7
