# Marked failing due to REA-6138

statement ok
CREATE TABLE t (column_3 INT, column_1 INT, column_2 INT, column_4 INT, PRIMARY KEY (column_4))

statement ok
INSERT INTO t (column_1, column_4, column_2, column_3) VALUES (1, 2, 1, 1), (1, 3, 1, 1), (1, 4, 1, 1), (1, 5, 1, 1), (1, 6, 1, 1)

query  nosort
SELECT t.column_2 AS alias_1, t1.column_2 AS alias_2 FROM t INNER JOIN t AS t1 ON t.column_1 = t1.column_3
----
1
1
1
1
1
1
1
1
1
1
1
1
1
1
1
1
1
1
1
1
1
1
1
1
1
1
1
1
1
1
1
1
1
1
1
1
1
1
1
1
1
1
1
1
1
1
1
1
1
1

statement ok
DELETE FROM t WHERE (column_4 = 2)

statement ok
DELETE FROM t WHERE (column_4 = 3)

query  nosort
SELECT t.column_2 AS alias_1, t1.column_2 AS alias_2 FROM t INNER JOIN t AS t1 ON t.column_1 = t1.column_3
----
1
1
1
1
1
1
1
1
1
1
1
1
1
1
1
1
1
1
