# Generated by:
#     target/debug/noria-logictest generate --operations topk --compare-to mysql://root@localhost/mysql --subquery-depth 1 --rows-per-table 5 -o logictests/generated/topk.test --include-deletes
# failure: ENG-337

statement ok
CREATE TABLE table_1 (column_1 INT(32), column_2 INT(32), PRIMARY KEY (column_2))


statement ok
INSERT INTO table_1 (column_1, column_2) VALUES (1, 2), (1, 3), (1, 4), (1, 5), (1, 6)


query  nosort
SELECT table_1.column_1 AS alias_1 FROM table_1 ORDER BY table_1.column_1 ASC LIMIT ?
? = 3
----
1
1
1

query  nosort
SELECT table_1.column_1 AS alias_1 FROM table_1 ORDER BY table_1.column_1 DESC LIMIT ?
? = 2
----
1
1

query  nosort
SELECT table_1.column_1 AS alias_1 FROM table_1 ORDER BY table_1.column_1 DESC LIMIT 10
----
1
1
1
1
1

statement ok
DELETE FROM table_1 WHERE (column_2 = 2)


statement ok
DELETE FROM table_1 WHERE (column_2 = 3)


query  nosort
SELECT table_1.column_1 AS alias_1 FROM table_1 ORDER BY table_1.column_1 ASC LIMIT 10
----
1
1
1

query  nosort
SELECT table_1.column_1 AS alias_1 FROM table_1 ORDER BY table_1.column_1 DESC LIMIT 10
----
1
1
1

query  nosort
SELECT table_1.column_2 AS alias_1 FROM table_1
ORDER BY
  CASE WHEN table_1.column_2 = 5
  THEN table_1.column_1
  ELSE table_1.column_2
  END
ASC
LIMIT 2
----
5
4

# test expressions in order by clause
query I nosort
select column_2 from table_1 order by column_2 + 1 limit 3
----
4
5
6

# test aliases in order by clause
query I nosort
select column_2 + 1 as alias from table_1 order by alias limit 3
----
5
6
7

# test aliased aggreagates in order by clause
query I nosort
select count(*) as total from table_1 group by column_1 order by total limit 3
----
3

statement ok
INSERT INTO table_1 (column_1, column_2) VALUES (2, 7), (2, 8), (2, 9), (2, 10), (2, 11);

query I nosort
select min(column_2) as minimum from table_1 group by column_1 order by minimum desc limit 3
----
7
4

query I nosort
select count(column_2) as total from table_1 group by column_1 order by total desc limit 3
----
5
3

# global topk without predicates keeps duplicate multiplicity after deletes
statement ok
create table topk_no_predicates (id int, val int, primary key (id))

statement ok
insert into topk_no_predicates (id, val) values (1, 1), (2, 1), (3, 1), (4, 1)

query I nosort
select val from topk_no_predicates order by val asc limit 3
----
1
1
1

statement ok
delete from topk_no_predicates where id = 1

statement ok
delete from topk_no_predicates where id = 2

query I nosort
select val from topk_no_predicates order by val asc limit 3
----
1
1

# ---- Aggregates + TopK ----

statement ok
CREATE TABLE agg_topk (id INT, grp INT, val INT, PRIMARY KEY (id))

statement ok
INSERT INTO agg_topk VALUES
  (1, 1, 10), (2, 1, 20), (3, 1, 30),
  (4, 2, 5),  (5, 2, 15),
  (6, 3, 100), (7, 3, 200), (8, 3, 50),
  (9, 4, 1)

# SUM aggregate ordered by the aggregate result with LIMIT
query II nosort
SELECT grp, sum(val) AS s FROM agg_topk GROUP BY grp ORDER BY s ASC LIMIT 2
----
4
1
2
20

# COUNT aggregate with LIMIT
query II nosort
SELECT grp, count(*) AS cnt FROM agg_topk GROUP BY grp ORDER BY cnt DESC LIMIT 2
----
1
3
3
3

# MIN/MAX aggregate with LIMIT
query II nosort
SELECT grp, min(val) AS m FROM agg_topk GROUP BY grp ORDER BY m ASC LIMIT 3
----
4
1
2
5
1
10

# AVG aggregate with LIMIT
query IR nosort
SELECT grp, avg(val) AS a FROM agg_topk GROUP BY grp ORDER BY a DESC LIMIT 2
----
3
116.6667
1
20.0000

# Aggregate with HAVING + LIMIT
query II nosort
SELECT grp, sum(val) AS s FROM agg_topk GROUP BY grp HAVING sum(val) > 10 ORDER BY s DESC LIMIT 2
----
3
350
1
60

# Delete a row and verify aggregate + topk updates
statement ok
DELETE FROM agg_topk WHERE id = 6

# grp=3 now has sum=250 instead of 350
query II nosort
SELECT grp, sum(val) AS s FROM agg_topk GROUP BY grp ORDER BY s DESC LIMIT 2
----
3
250
1
60

# Delete all rows in a group
statement ok
DELETE FROM agg_topk WHERE id = 9

# grp=4 is gone, only 3 groups remain
query II nosort
SELECT grp, sum(val) AS s FROM agg_topk GROUP BY grp ORDER BY s ASC LIMIT 3
----
2
20
1
60
3
250

# Window function + aggregate + TopK tests are in
# logictests/sqlparser/window_functions_aggs_topk.test
