# Generated by:
#     target/debug/noria-logictest generate --operations max,min,left_join --compare-to postgresql://root@localhost/psql --subquery-depth 1 --rows-per-table 5 -o logictests/generated/test2/max,min,left_join.test --include-deletes

statement ok
CREATE TABLE table_1 (column_2 INT, column_3 INT, column_6 INT, column_4 INT, column_5 INT, column_1 INT, PRIMARY KEY (column_6))


statement ok
CREATE TABLE table_2 (column_2 INT, column_1 INT, column_3 INT, PRIMARY KEY (column_3))


statement ok
CREATE TABLE table_5 (column_1 INT, column_2 INT, column_3 INT, PRIMARY KEY (column_3))


statement ok
CREATE TABLE table_3 (column_1 INT, column_2 INT, column_3 INT, PRIMARY KEY (column_3))


statement ok
CREATE TABLE table_4 (column_3 INT, column_2 INT, column_1 INT, PRIMARY KEY (column_3))


statement ok
INSERT INTO table_1 (column_4, column_5, column_1, column_2, column_6, column_3) VALUES (1, 1, 1, 1, 0, 1), (1, 1, 1, 1, 1, 1), (1, 1, 1, 1, 2, 1), (1, 1, 1, 1, 3, 1), (1, 1, 1, 1, 4, 1)


statement ok
INSERT INTO table_2 (column_2, column_1, column_3) VALUES (1, 1, 0), (1, 1, 1), (1, 1, 2), (1, 1, 3), (1, 1, 4)


statement ok
INSERT INTO table_5 (column_2, column_1, column_3) VALUES (1, 1, 0), (1, 1, 1), (1, 1, 2), (1, 1, 3), (1, 1, 4)


statement ok
INSERT INTO table_3 (column_2, column_3, column_1) VALUES (1, 0, 1), (1, 1, 1), (1, 2, 1), (1, 3, 1), (1, 4, 1)


statement ok
INSERT INTO table_4 (column_2, column_3, column_1) VALUES (1, 0, 1), (1, 1, 1), (1, 2, 1), (1, 3, 1), (1, 4, 1)


query  nosort
SELECT max(table_1.column_1) AS alias_1 FROM table_1
----
1

query  nosort
SELECT min(table_1.column_1) AS alias_1 FROM table_1
----
1

query  nosort
SELECT table_1.column_2 AS alias_1, table_2.column_2 AS alias_2 FROM table_1 LEFT JOIN table_2 ON (table_1.column_1 = table_2.column_1)
----
50 values hashing to 1f4709ccf33e9b44d9c58ab63929bdf1

query  nosort
SELECT max(table_1.column_2) AS alias_1, min(table_1.column_2) AS alias_2 FROM table_1
----
1
1

query  nosort
SELECT max(table_1.column_2) AS alias_1, table_1.column_3 AS alias_2, table_3.column_2 AS alias_3 FROM table_1 LEFT JOIN table_3 ON (table_1.column_2 = table_3.column_1) GROUP BY table_1.column_3, table_3.column_2
----
1
1
1

query  nosort
SELECT min(table_1.column_2) AS alias_1, table_1.column_4 AS alias_2, table_4.column_2 AS alias_3 FROM table_1 LEFT JOIN table_4 ON (table_1.column_2 = table_4.column_1) GROUP BY table_1.column_4, table_4.column_2
----
1
1
1

query  nosort
SELECT max(table_1.column_2) AS alias_1, min(table_1.column_2) AS alias_2, table_1.column_5 AS alias_3, table_5.column_2 AS alias_4 FROM table_1 LEFT JOIN table_5 ON (table_1.column_2 = table_5.column_1) GROUP BY table_1.column_5, table_5.column_2
----
1
1
1
1

statement ok
DELETE FROM table_1 WHERE (column_6 = 0)


statement ok
DELETE FROM table_1 WHERE (column_6 = 1)


statement ok
DELETE FROM table_2 WHERE (column_3 = 0)


statement ok
DELETE FROM table_2 WHERE (column_3 = 1)


statement ok
DELETE FROM table_5 WHERE (column_3 = 0)


statement ok
DELETE FROM table_5 WHERE (column_3 = 1)


statement ok
DELETE FROM table_3 WHERE (column_3 = 0)


statement ok
DELETE FROM table_3 WHERE (column_3 = 1)


statement ok
DELETE FROM table_4 WHERE (column_3 = 0)


statement ok
DELETE FROM table_4 WHERE (column_3 = 1)


query  nosort
SELECT max(table_1.column_1) AS alias_1 FROM table_1
----
1

query  nosort
SELECT min(table_1.column_1) AS alias_1 FROM table_1
----
1

query  nosort
SELECT table_1.column_2 AS alias_1, table_2.column_2 AS alias_2 FROM table_1 LEFT JOIN table_2 ON (table_1.column_1 = table_2.column_1)
----
1
1
1
1
1
1
1
1
1
1
1
1
1
1
1
1
1
1

query  nosort
SELECT max(table_1.column_2) AS alias_1, min(table_1.column_2) AS alias_2 FROM table_1
----
1
1

query  nosort
SELECT max(table_1.column_2) AS alias_1, table_1.column_3 AS alias_2, table_3.column_2 AS alias_3 FROM table_1 LEFT JOIN table_3 ON (table_1.column_2 = table_3.column_1) GROUP BY table_1.column_3, table_3.column_2
----
1
1
1

query  nosort
SELECT min(table_1.column_2) AS alias_1, table_1.column_4 AS alias_2, table_4.column_2 AS alias_3 FROM table_1 LEFT JOIN table_4 ON (table_1.column_2 = table_4.column_1) GROUP BY table_1.column_4, table_4.column_2
----
1
1
1

query  nosort
SELECT max(table_1.column_2) AS alias_1, min(table_1.column_2) AS alias_2, table_1.column_5 AS alias_3, table_5.column_2 AS alias_4 FROM table_1 LEFT JOIN table_5 ON (table_1.column_2 = table_5.column_1) GROUP BY table_1.column_5, table_5.column_2
----
1
1
1
1
