# Generated by:
#     target/debug/noria-logictest generate --operations max,project_literal,topk --compare-to mysql://root@localhost/mysql --subquery-depth 1 --rows-per-table 5 -o logictests/generated/max,project_literal,topk.test --include-deletes
# failure: ENG-335

statement ok
CREATE TABLE table_1 (column_2 INT(32), column_5 INT(32), column_6 INT(32), column_4 INT(32), column_8 INT(32), column_3 INT(32), column_7 INT(32), column_1 INT(32), column_9 INT(32), PRIMARY KEY (column_9))


statement ok
INSERT INTO table_1 (column_8, column_6, column_5, column_9, column_7, column_3, column_4, column_1, column_2) VALUES (1, 1, 1, 2, 1, 1, 1, 1, 1), (1, 1, 1, 3, 1, 1, 1, 1, 1), (1, 1, 1, 4, 1, 1, 1, 1, 1), (1, 1, 1, 5, 1, 1, 1, 1, 1), (1, 1, 1, 6, 1, 1, 1, 1, 1)


query  nosort
SELECT max(table_1.column_1) AS alias_1 FROM table_1
----
1

query  nosort
SELECT 1
----
1

query  nosort
SELECT table_1.column_1 AS alias_1 FROM table_1 ORDER BY table_1.column_1 ASC LIMIT 10
----
1
1
1
1
1

query  nosort
SELECT table_1.column_1 AS alias_1 FROM table_1 ORDER BY table_1.column_1 DESC LIMIT 10
----
1
1
1
1
1

query  nosort
SELECT max(table_1.column_2) AS alias_1, 1 FROM table_1
----
1
1

query  nosort
SELECT max(table_1.column_3) AS alias_1 FROM table_1 ORDER BY table_1.column_1 ASC LIMIT 10
----
1

query  nosort
SELECT max(table_1.column_4) AS alias_1 FROM table_1 ORDER BY table_1.column_2 DESC LIMIT 10
----
1

query  nosort
SELECT 1 FROM table_1 ORDER BY table_1.column_2 ASC LIMIT 10
----
1
1
1
1
1

query  nosort
SELECT 1 FROM table_1 ORDER BY table_1.column_2 DESC LIMIT 10
----
1
1
1
1
1

query  nosort
SELECT table_1.column_2 AS alias_1 FROM table_1 ORDER BY table_1.column_2 DESC LIMIT 10
----
1
1
1
1
1

query  nosort
SELECT max(table_1.column_5) AS alias_1, 1 FROM table_1 ORDER BY table_1.column_2 ASC LIMIT 10
----
1
1

query  nosort
SELECT max(table_1.column_6) AS alias_1, 1 FROM table_1 ORDER BY table_1.column_2 DESC LIMIT 10
----
1
1

query  nosort
SELECT max(table_1.column_7) AS alias_1 FROM table_1 ORDER BY table_1.column_2 DESC LIMIT 10
----
1

query  nosort
SELECT 1 FROM table_1 ORDER BY table_1.column_2 DESC LIMIT 10
----
1
1
1
1
1

query  nosort
SELECT max(table_1.column_8) AS alias_1, 1 FROM table_1 ORDER BY table_1.column_2 DESC LIMIT 10
----
1
1

statement ok
DELETE FROM table_1 WHERE (column_9 = 2)


statement ok
DELETE FROM table_1 WHERE (column_9 = 3)


query  nosort
SELECT max(table_1.column_1) AS alias_1 FROM table_1
----
1

query  nosort
SELECT 1
----
1

query  nosort
SELECT table_1.column_1 AS alias_1 FROM table_1 ORDER BY table_1.column_1 ASC LIMIT 10
----
1
1
1

query  nosort
SELECT table_1.column_1 AS alias_1 FROM table_1 ORDER BY table_1.column_1 DESC LIMIT 10
----
1
1
1

query  nosort
SELECT max(table_1.column_2) AS alias_1, 1 FROM table_1
----
1
1

query  nosort
SELECT max(table_1.column_3) AS alias_1 FROM table_1 ORDER BY table_1.column_1 ASC LIMIT 10
----
1

query  nosort
SELECT max(table_1.column_4) AS alias_1 FROM table_1 ORDER BY table_1.column_2 DESC LIMIT 10
----
1

query  nosort
SELECT 1 FROM table_1 ORDER BY table_1.column_2 ASC LIMIT 10
----
1
1
1

query  nosort
SELECT 1 FROM table_1 ORDER BY table_1.column_2 DESC LIMIT 10
----
1
1
1

query  nosort
SELECT table_1.column_2 AS alias_1 FROM table_1 ORDER BY table_1.column_2 DESC LIMIT 10
----
1
1
1

query  nosort
SELECT max(table_1.column_5) AS alias_1, 1 FROM table_1 ORDER BY table_1.column_2 ASC LIMIT 10
----
1
1

query  nosort
SELECT max(table_1.column_6) AS alias_1, 1 FROM table_1 ORDER BY table_1.column_2 DESC LIMIT 10
----
1
1

query  nosort
SELECT max(table_1.column_7) AS alias_1 FROM table_1 ORDER BY table_1.column_2 DESC LIMIT 10
----
1

query  nosort
SELECT 1 FROM table_1 ORDER BY table_1.column_2 DESC LIMIT 10
----
1
1
1

query  nosort
SELECT max(table_1.column_8) AS alias_1, 1 FROM table_1 ORDER BY table_1.column_2 DESC LIMIT 10
----
1
1
