# Generated by:
#     target/debug/noria-logictest permute -d 3 -o logictests/generated/mysql --only in_parameter --compare-to mysql://root:noria@localhost/mysql --subquery-depth 1 --rows-per-table 5 --include-deletes --overwrite-tests

statement ok
CREATE TABLE table_1 (column_4 TEXT, column_3 TEXT, column_1 TEXT, column_5 INT, column_2 TEXT, PRIMARY KEY (column_5))


statement ok
INSERT INTO table_1 (column_4, column_3, column_1, column_5, column_2) VALUES ('1', 'a', '0', 0, 'a'), ('a', 'a', 'a', 1, 'a'), ('0', 'a', '1', 2, 'a'), ('a', 'a', 'a', 3, 'a'), ('2', 'a', '2', 4, 'a')


query  rowsort
SELECT 1 AS alias_1
----
1

query  rowsort
SELECT group_concat(table_1.column_1 separator ', ') AS alias_1 FROM table_1
----
0, a, 1, a, 2

query  rowsort
SELECT table_1.column_1 AS alias_1 FROM table_1 WHERE table_1.column_1 IN (?, ?, ?)
? = 0
? = 1
? = 2
----
0
1
2

query  rowsort
SELECT 1 AS alias_1, group_concat(table_1.column_2 separator ', ') AS alias_2 FROM table_1
----
1
a, a, a, a, a

query  rowsort
SELECT 1 AS alias_1 FROM table_1 WHERE table_1.column_1 IN (?, ?, ?)
? = 0
? = 1
? = 2
----
1
1
1

query  rowsort
SELECT group_concat(table_1.column_3 separator ', ') AS alias_1 FROM table_1 WHERE table_1.column_1 IN (?, ?, ?)
? = 0
? = 1
? = 2
----
a, a, a

query  rowsort
SELECT 1 AS alias_1, group_concat(table_1.column_4 separator ', ') AS alias_2 FROM table_1 WHERE table_1.column_4 IN (?, ?, ?)
? = 0
? = 1
? = 2
----
1
1, 0, 2

statement ok
DELETE FROM table_1 WHERE (column_5 = 0)


statement ok
DELETE FROM table_1 WHERE (column_5 = 1)


query  rowsort
SELECT 1 AS alias_1
----
1

query  rowsort
SELECT group_concat(table_1.column_1 separator ', ') AS alias_1 FROM table_1
----
1, a, 2

query  rowsort
SELECT table_1.column_1 AS alias_1 FROM table_1 WHERE table_1.column_1 IN (?, ?, ?)
? = 0
? = 1
? = 2
----
1
2

query  rowsort
SELECT 1 AS alias_1, group_concat(table_1.column_2 separator ', ') AS alias_2 FROM table_1
----
1
a, a, a

query  rowsort
SELECT 1 AS alias_1 FROM table_1 WHERE table_1.column_1 IN (?, ?, ?)
? = 0
? = 1
? = 2
----
1
1

query  rowsort
SELECT group_concat(table_1.column_3 separator ', ') AS alias_1 FROM table_1 WHERE table_1.column_1 IN (?, ?, ?)
? = 0
? = 1
? = 2
----
a, a

query  rowsort
SELECT 1 AS alias_1, group_concat(table_1.column_4 separator ', ') AS alias_2 FROM table_1 WHERE table_1.column_4 IN (?, ?, ?)
? = 0
? = 1
? = 2
----
1
0, 2
