# Generated by:
#     target/debug/noria-logictest generate --operations project_literal,join_subquery --compare-to mysql://root@localhost/mysql --subquery-depth 1 --rows-per-table 5 -o logictests/generated/project_literal,join_subquery.test --include-deletes
# failure: ENG-335

statement ok
CREATE TABLE table_1 (column_2 INT(32), column_1 INT(32), PRIMARY KEY (column_2))


statement ok
INSERT INTO table_1 (column_2, column_1) VALUES (2, 1), (3, 1), (4, 1), (5, 1), (6, 1)


query  nosort
SELECT 1 FROM table_1 INNER JOIN (SELECT 1 AS alias_1) AS alias_2 ON (table_1.column_1 = alias_2.alias_1)
----
1
1
1
1
1

statement ok
DELETE FROM table_1 WHERE (column_2 = 2)


statement ok
DELETE FROM table_1 WHERE (column_2 = 3)


query  nosort
SELECT 1 FROM table_1 INNER JOIN (SELECT 1 AS alias_1) AS alias_2 ON (table_1.column_1 = alias_2.alias_1)
----
1
1
1
