# Generated by:
#     target/debug/noria-logictest permute -d 3 -o logictests/generated/mysql --only in_parameter --compare-to mysql://root:noria@localhost/mysql --subquery-depth 1 --rows-per-table 5 --include-deletes --overwrite-tests

statement ok
CREATE TABLE table_1 (column_4 INT, column_2 INT, column_6 INT, column_9 INT, column_1 INT, column_8 INT, column_5 INT, column_7 INT, column_3 INT, PRIMARY KEY (column_9))


statement ok
INSERT INTO table_1 (column_4, column_2, column_6, column_9, column_1, column_8, column_5, column_7, column_3) VALUES (2, 1, 1, 0, 0, 1, 1, 1, 1), (1, 1, 1, 1, 1, 1, 1, 1, 1), (1, 1, 1, 2, 1, 1, 1, 1, 1), (1, 1, 1, 3, 1, 1, 1, 1, 1), (0, 1, 1, 4, 2, 1, 1, 1, 1)


query  rowsort
SELECT count(table_1.column_1) AS alias_1 FROM table_1
----
5

query  rowsort
SELECT sum(table_1.column_2) AS alias_1 FROM table_1
----
5

query  rowsort
SELECT table_1.column_1 AS alias_1 FROM table_1 WHERE table_1.column_1 IN (?, ?, ?)
? = 0
? = 1
? = 2
----
0
1
1
1
2

query  rowsort
SELECT count(table_1.column_3) AS alias_1, sum(table_1.column_4) AS alias_2 FROM table_1
----
5
5

query  rowsort
SELECT count(table_1.column_5) AS alias_1 FROM table_1 WHERE table_1.column_4 IN (?, ?, ?)
? = 0
? = 1
? = 2
----
5

query  rowsort
SELECT sum(table_1.column_6) AS alias_1 FROM table_1 WHERE table_1.column_4 IN (?, ?, ?)
? = 0
? = 1
? = 2
----
5

query  rowsort
SELECT count(table_1.column_7) AS alias_1, sum(table_1.column_8) AS alias_2 FROM table_1 WHERE table_1.column_4 IN (?, ?, ?)
? = 0
? = 1
? = 2
----
5
5

statement ok
DELETE FROM table_1 WHERE (column_9 = 0)


statement ok
DELETE FROM table_1 WHERE (column_9 = 1)


query  rowsort
SELECT count(table_1.column_1) AS alias_1 FROM table_1
----
3

query  rowsort
SELECT sum(table_1.column_2) AS alias_1 FROM table_1
----
3

query  rowsort
SELECT table_1.column_1 AS alias_1 FROM table_1 WHERE table_1.column_1 IN (?, ?, ?)
? = 0
? = 1
? = 2
----
1
1
2

query  rowsort
SELECT count(table_1.column_3) AS alias_1, sum(table_1.column_4) AS alias_2 FROM table_1
----
3
2

query  rowsort
SELECT count(table_1.column_5) AS alias_1 FROM table_1 WHERE table_1.column_4 IN (?, ?, ?)
? = 0
? = 1
? = 2
----
3

query  rowsort
SELECT sum(table_1.column_6) AS alias_1 FROM table_1 WHERE table_1.column_4 IN (?, ?, ?)
? = 0
? = 1
? = 2
----
3

query  rowsort
SELECT count(table_1.column_7) AS alias_1, sum(table_1.column_8) AS alias_2 FROM table_1 WHERE table_1.column_4 IN (?, ?, ?)
? = 0
? = 1
? = 2
----
3
3
