# Generated by:
#     target/debug/noria-logictest permute -d 3 -o logictests/generated/mysql --only in_parameter --compare-to mysql://root:noria@localhost/mysql --subquery-depth 1 --rows-per-table 5 --include-deletes --overwrite-tests

statement ok
CREATE TABLE table_1 (column_1 INT, column_3 TEXT, column_6 INT, column_5 TEXT, column_2 TEXT, column_4 TEXT, PRIMARY KEY (column_6))


statement ok
INSERT INTO table_1 (column_1, column_3, column_6, column_5, column_2, column_4) VALUES (2, 'a', 0, 'a', 'a', 'a'), (1, 'a', 1, 'a', 'a', 'a'), (0, 'a', 2, 'a', 'a', 'a'), (1, 'a', 3, 'a', 'a', 'a'), (1, 'a', 4, 'a', 'a', 'a')


query  rowsort
SELECT DISTINCT table_1.column_1 AS alias_1 FROM table_1
----
0
1
2

query  rowsort
SELECT group_concat(table_1.column_2 separator ', ') AS alias_1 FROM table_1
----
a, a, a, a, a

query  rowsort
SELECT table_1.column_1 AS alias_1 FROM table_1 WHERE table_1.column_1 IN (?, ?, ?)
? = 0
? = 1
? = 2
----
0
1
1
1
2

query  rowsort
SELECT DISTINCT group_concat(table_1.column_3 separator ', ') AS alias_1 FROM table_1
----
a, a, a, a, a

query  rowsort
SELECT DISTINCT table_1.column_1 AS alias_1 FROM table_1 WHERE table_1.column_1 IN (?, ?, ?)
? = 0
? = 1
? = 2
----
0
1
2

query  rowsort
SELECT group_concat(table_1.column_4 separator ', ') AS alias_1 FROM table_1 WHERE table_1.column_1 IN (?, ?, ?)
? = 0
? = 1
? = 2
----
a, a, a, a, a

query  rowsort
SELECT DISTINCT group_concat(table_1.column_5 separator ', ') AS alias_1 FROM table_1 WHERE table_1.column_1 IN (?, ?, ?)
? = 0
? = 1
? = 2
----
a, a, a, a, a

statement ok
DELETE FROM table_1 WHERE (column_6 = 0)


statement ok
DELETE FROM table_1 WHERE (column_6 = 1)


query  rowsort
SELECT DISTINCT table_1.column_1 AS alias_1 FROM table_1
----
0
1

query  rowsort
SELECT group_concat(table_1.column_2 separator ', ') AS alias_1 FROM table_1
----
a, a, a

query  rowsort
SELECT table_1.column_1 AS alias_1 FROM table_1 WHERE table_1.column_1 IN (?, ?, ?)
? = 0
? = 1
? = 2
----
0
1
1

query  rowsort
SELECT DISTINCT group_concat(table_1.column_3 separator ', ') AS alias_1 FROM table_1
----
a, a, a

query  rowsort
SELECT DISTINCT table_1.column_1 AS alias_1 FROM table_1 WHERE table_1.column_1 IN (?, ?, ?)
? = 0
? = 1
? = 2
----
0
1

query  rowsort
SELECT group_concat(table_1.column_4 separator ', ') AS alias_1 FROM table_1 WHERE table_1.column_1 IN (?, ?, ?)
? = 0
? = 1
? = 2
----
a, a, a

query  rowsort
SELECT DISTINCT group_concat(table_1.column_5 separator ', ') AS alias_1 FROM table_1 WHERE table_1.column_1 IN (?, ?, ?)
? = 0
? = 1
? = 2
----
a, a, a
