# Generated by:
#     target/debug/noria-logictest generate --operations count,sum,topk --compare-to postgresql://root@localhost/psql --subquery-depth 1 --rows-per-table 5 -o logictests/generated/test2/count,sum,topk.test --include-deletes

statement ok
CREATE TABLE table_1 (column_1 INT, column_2 INT, PRIMARY KEY (column_2))


statement ok
INSERT INTO table_1 (column_2, column_1) VALUES (0, 1), (1, 1), (2, 1), (3, 1), (4, 1)


query  nosort
SELECT count(table_1.column_1) AS alias_1 FROM table_1
----
5

query  nosort
SELECT sum(table_1.column_1) AS alias_1 FROM table_1
----
5

query  nosort
SELECT table_1.column_1 AS alias_1 FROM table_1 ORDER BY table_1.column_1 ASC LIMIT 10
----
1
1
1
1
1

query  nosort
SELECT table_1.column_1 AS alias_1 FROM table_1 ORDER BY table_1.column_1 DESC LIMIT 10
----
1
1
1
1
1

query  nosort
SELECT count(table_1.column_1) AS alias_1, sum(table_1.column_1) AS alias_2 FROM table_1
----
5
5

query  nosort
SELECT count(table_1.column_1) AS alias_1 FROM table_1 GROUP BY table_1.column_1 ORDER BY table_1.column_1 ASC LIMIT 10
----
5

query  nosort
SELECT count(table_1.column_1) AS alias_1 FROM table_1 GROUP BY table_1.column_1 ORDER BY table_1.column_1 DESC LIMIT 10
----
5

query  nosort
SELECT sum(table_1.column_1) AS alias_1 FROM table_1 GROUP BY table_1.column_1 ORDER BY table_1.column_1 ASC LIMIT 10
----
5

query  nosort
SELECT sum(table_1.column_1) AS alias_1 FROM table_1 GROUP BY table_1.column_1 ORDER BY table_1.column_1 DESC LIMIT 10
----
5

query  nosort
SELECT table_1.column_1 AS alias_1 FROM table_1 ORDER BY table_1.column_1 DESC LIMIT 10
----
1
1
1
1
1

query  nosort
SELECT count(table_1.column_1) AS alias_1, sum(table_1.column_1) AS alias_2 FROM table_1 GROUP BY table_1.column_1 ORDER BY table_1.column_1 ASC LIMIT 10
----
5
5

query  nosort
SELECT count(table_1.column_1) AS alias_1, sum(table_1.column_1) AS alias_2 FROM table_1 GROUP BY table_1.column_1 ORDER BY table_1.column_1 DESC LIMIT 10
----
5
5

query  nosort
SELECT count(table_1.column_1) AS alias_1 FROM table_1 GROUP BY table_1.column_1 ORDER BY table_1.column_1 DESC LIMIT 10
----
5

query  nosort
SELECT sum(table_1.column_1) AS alias_1 FROM table_1 GROUP BY table_1.column_1 ORDER BY table_1.column_1 DESC LIMIT 10
----
5

query  nosort
SELECT count(table_1.column_1) AS alias_1, sum(table_1.column_1) AS alias_2 FROM table_1 GROUP BY table_1.column_1 ORDER BY table_1.column_1 DESC LIMIT 10
----
5
5

statement ok
DELETE FROM table_1 WHERE (column_2 = 0)


statement ok
DELETE FROM table_1 WHERE (column_2 = 1)


query  nosort
SELECT count(table_1.column_1) AS alias_1 FROM table_1
----
3

query  nosort
SELECT sum(table_1.column_1) AS alias_1 FROM table_1
----
3

query  nosort
SELECT table_1.column_1 AS alias_1 FROM table_1 ORDER BY table_1.column_1 ASC LIMIT 10
----
1
1
1

query  nosort
SELECT table_1.column_1 AS alias_1 FROM table_1 ORDER BY table_1.column_1 DESC LIMIT 10
----
1
1
1

query  nosort
SELECT count(table_1.column_1) AS alias_1, sum(table_1.column_1) AS alias_2 FROM table_1
----
3
3

query  nosort
SELECT count(table_1.column_1) AS alias_1 FROM table_1 GROUP BY table_1.column_1 ORDER BY table_1.column_1 ASC LIMIT 10
----
3

query  nosort
SELECT count(table_1.column_1) AS alias_1 FROM table_1 GROUP BY table_1.column_1 ORDER BY table_1.column_1 DESC LIMIT 10
----
3

query  nosort
SELECT sum(table_1.column_1) AS alias_1 FROM table_1 GROUP BY table_1.column_1 ORDER BY table_1.column_1 ASC LIMIT 10
----
3

query  nosort
SELECT sum(table_1.column_1) AS alias_1 FROM table_1 GROUP BY table_1.column_1 ORDER BY table_1.column_1 DESC LIMIT 10
----
3

query  nosort
SELECT table_1.column_1 AS alias_1 FROM table_1 ORDER BY table_1.column_1 DESC LIMIT 10
----
1
1
1

query  nosort
SELECT count(table_1.column_1) AS alias_1, sum(table_1.column_1) AS alias_2 FROM table_1 GROUP BY table_1.column_1 ORDER BY table_1.column_1 ASC LIMIT 10
----
3
3

query  nosort
SELECT count(table_1.column_1) AS alias_1, sum(table_1.column_1) AS alias_2 FROM table_1 GROUP BY table_1.column_1 ORDER BY table_1.column_1 DESC LIMIT 10
----
3
3

query  nosort
SELECT count(table_1.column_1) AS alias_1 FROM table_1 GROUP BY table_1.column_1 ORDER BY table_1.column_1 DESC LIMIT 10
----
3

query  nosort
SELECT sum(table_1.column_1) AS alias_1 FROM table_1 GROUP BY table_1.column_1 ORDER BY table_1.column_1 DESC LIMIT 10
----
3

query  nosort
SELECT count(table_1.column_1) AS alias_1, sum(table_1.column_1) AS alias_2 FROM table_1 GROUP BY table_1.column_1 ORDER BY table_1.column_1 DESC LIMIT 10
----
3
3
