# Generated by:
#     target/debug/noria-logictest permute --compare-to mysql://root:noria@127.1/noria -d 3 -o logictests/generated/mysql/ --only range_param --random --include-deletes --rows-per-table 10 --subquery-depth 1 --overwrite-tests

statement ok
CREATE TABLE `table_1` (`column_9` INT, `column_5` INT, `column_3` INT, `column_8` INT, `column_1` INT, `column_4` INT, `column_6` INT, `column_7` INT, `column_2` INT, PRIMARY KEY (`column_9`))


statement ok
INSERT INTO `table_1` (`column_9`, `column_5`, `column_3`, `column_8`, `column_1`, `column_4`, `column_6`, `column_7`, `column_2`) VALUES (0, 1117701116, -2004868430, -1280253093, 2120867055, 1571379396, 395767502, -1746818203, -1479365329), (1, 255502157, -1411354336, 1512234571, 1298098769, 964507451, -1844910430, 696500517, -907351910), (2, -2061262636, -812904446, -1420108466, -819662201, 315920888, -1197519406, 313511229, 986333210), (3, 1435282413, -189440279, -859235645, -1663378660, 986323083, -1860108739, -1662308766, 1158039933), (4, -531675926, 1004019551, -1468246025, 998054554, -441099925, -1516780574, -1689679823, -2012983553), (5, -893736614, -2022708377, -994400823, -1367712662, 1455725882, 720330425, 407958342, -511272596), (6, 1932769243, 1707993256, -796150213, 1415261140, -1107527967, -1351756198, -2033185521, 78315478), (7, 1930935414, -1503138251, -1147523527, -1701313058, 287197902, 1575315892, -1319404987, -94323745), (8, 953073705, 1451444441, 844508837, 488302021, -2027641982, -1297247771, 1767351984, 1726576122), (9, -600957208, -926188527, -1557257449, 777168787, 878352864, -732312938, 2011944863, -2025007312)


query  rowsort
SELECT avg(`table_1`.`column_1`) AS `alias_1` FROM `table_1`
----
154568574.5000

query  rowsort
SELECT min(`table_1`.`column_2`) AS `alias_1` FROM `table_1`
----
-2025007312

query  rowsort
SELECT `table_1`.`column_2` AS `alias_1` FROM `table_1` WHERE (`table_1`.`column_2` > ?)
? = 10
----
1158039933
1726576122
78315478
986333210

query  rowsort
SELECT avg(`table_1`.`column_3`) AS `alias_1`, min(`table_1`.`column_4`) AS `alias_2` FROM `table_1`
----
-470714539.8000
-2027641982

query  rowsort
SELECT avg(`table_1`.`column_5`) AS `alias_1` FROM `table_1` WHERE (`table_1`.`column_1` > ?)
? = 10
----
521068847.8333

query  rowsort
SELECT min(`table_1`.`column_6`) AS `alias_1` FROM `table_1` WHERE (`table_1`.`column_6` > ?)
? = 10
----
395767502

query  rowsort
SELECT avg(`table_1`.`column_7`) AS `alias_1`, min(`table_1`.`column_8`) AS `alias_2` FROM `table_1` WHERE (`table_1`.`column_5` > ?)
? = 10
----
-716310829.3333
-1280253093

statement ok
DELETE FROM `table_1` WHERE (`column_9` = 0)


statement ok
DELETE FROM `table_1` WHERE (`column_9` = 1)


statement ok
DELETE FROM `table_1` WHERE (`column_9` = 2)


statement ok
DELETE FROM `table_1` WHERE (`column_9` = 3)


statement ok
DELETE FROM `table_1` WHERE (`column_9` = 4)


query  rowsort
SELECT avg(`table_1`.`column_1`) AS `alias_1` FROM `table_1`
----
-77658754.4000

query  rowsort
SELECT min(`table_1`.`column_2`) AS `alias_1` FROM `table_1`
----
-2025007312

query  rowsort
SELECT `table_1`.`column_2` AS `alias_1` FROM `table_1` WHERE (`table_1`.`column_2` > ?)
? = 10
----
1726576122
78315478

query  rowsort
SELECT avg(`table_1`.`column_3`) AS `alias_1`, min(`table_1`.`column_4`) AS `alias_2` FROM `table_1`
----
-258519491.6000
-2027641982

query  rowsort
SELECT avg(`table_1`.`column_5`) AS `alias_1` FROM `table_1` WHERE (`table_1`.`column_1` > ?)
? = 10
----
761628580.0000

query  rowsort
SELECT min(`table_1`.`column_6`) AS `alias_1` FROM `table_1` WHERE (`table_1`.`column_6` > ?)
? = 10
----
720330425

query  rowsort
SELECT avg(`table_1`.`column_7`) AS `alias_1`, min(`table_1`.`column_8`) AS `alias_2` FROM `table_1` WHERE (`table_1`.`column_5` > ?)
? = 10
----
-528412841.3333
-1147523527
