# Generated by:
#     target/debug/noria-logictest permute --compare-to mysql://root:noria@127.1/noria -d 3 -o logictests/generated/mysql/ --only range_param --random --include-deletes --rows-per-table 10 --subquery-depth 1 --overwrite-tests

statement ok
CREATE TABLE `table_1` (`column_5` INT, `column_1` INT, `column_2` INT, `column_3` INT, `column_4` INT, PRIMARY KEY (`column_5`))


statement ok
INSERT INTO `table_1` (`column_5`, `column_1`, `column_2`, `column_3`, `column_4`) VALUES (0, -335891318, 983041141, 141653526, 1770909523), (1, 1392125100, 1383618718, 1332548189, -134831888), (2, 1065884686, 492727207, -1393018294, 211013342), (3, 1545572400, 1779622970, 184674793, -2142234813), (4, 1288393183, 1392838322, -298246133, -696464829), (5, -1258023972, 1314670832, -1657605496, 828628792), (6, -931001220, -233947260, -1721459845, 2036360870), (7, -1068452491, 51674910, 549324735, -313177376), (8, 827918125, 620572049, -807831974, 1660766869), (9, -946400364, 1449697542, -1322698431, -1687271008)


query  rowsort
SELECT avg(`table_1`.`column_1`) AS `alias_1` FROM `table_1`
----
158012412.9000

query  rowsort
SELECT `table_1`.`column_1` AS `alias_1` FROM `table_1` WHERE ((`table_1`.`column_1` = ?) AND (`table_1`.`column_1` = ?))
? = 1
? = 1
----


query  rowsort
SELECT `table_1`.`column_1` AS `alias_1` FROM `table_1` WHERE (`table_1`.`column_1` > ?)
? = 10
----
1065884686
1288393183
1392125100
1545572400
827918125

query  rowsort
SELECT avg(`table_1`.`column_2`) AS `alias_1` FROM `table_1` WHERE ((`table_1`.`column_2` = ?) AND (`table_1`.`column_2` = ?))
? = 1
? = 1
----
NULL

query  rowsort
SELECT avg(`table_1`.`column_3`) AS `alias_1` FROM `table_1` WHERE (`table_1`.`column_2` > ?)
? = 10
----
-363466565.0000

query  rowsort
SELECT `table_1`.`column_2` AS `alias_1` FROM `table_1` WHERE (((`table_1`.`column_2` = ?) AND (`table_1`.`column_2` = ?)) AND (`table_1`.`column_2` > ?))
? = 1
? = 1
? = 10
----


query  rowsort
SELECT avg(`table_1`.`column_4`) AS `alias_1` FROM `table_1` WHERE (((`table_1`.`column_1` = ?) AND (`table_1`.`column_1` = ?)) AND (`table_1`.`column_1` > ?))
? = 1
? = 1
? = 10
----
NULL

statement ok
DELETE FROM `table_1` WHERE (`column_5` = 0)


statement ok
DELETE FROM `table_1` WHERE (`column_5` = 1)


statement ok
DELETE FROM `table_1` WHERE (`column_5` = 2)


statement ok
DELETE FROM `table_1` WHERE (`column_5` = 3)


statement ok
DELETE FROM `table_1` WHERE (`column_5` = 4)


query  rowsort
SELECT avg(`table_1`.`column_1`) AS `alias_1` FROM `table_1`
----
-675191984.4000

query  rowsort
SELECT `table_1`.`column_1` AS `alias_1` FROM `table_1` WHERE ((`table_1`.`column_1` = ?) AND (`table_1`.`column_1` = ?))
? = 1
? = 1
----


query  rowsort
SELECT `table_1`.`column_1` AS `alias_1` FROM `table_1` WHERE (`table_1`.`column_1` > ?)
? = 10
----
827918125

query  rowsort
SELECT avg(`table_1`.`column_2`) AS `alias_1` FROM `table_1` WHERE ((`table_1`.`column_2` = ?) AND (`table_1`.`column_2` = ?))
? = 1
? = 1
----
NULL

query  rowsort
SELECT avg(`table_1`.`column_3`) AS `alias_1` FROM `table_1` WHERE (`table_1`.`column_2` > ?)
? = 10
----
-809702791.5000

query  rowsort
SELECT `table_1`.`column_2` AS `alias_1` FROM `table_1` WHERE (((`table_1`.`column_2` = ?) AND (`table_1`.`column_2` = ?)) AND (`table_1`.`column_2` > ?))
? = 1
? = 1
? = 10
----


query  rowsort
SELECT avg(`table_1`.`column_4`) AS `alias_1` FROM `table_1` WHERE (((`table_1`.`column_1` = ?) AND (`table_1`.`column_1` = ?)) AND (`table_1`.`column_1` > ?))
? = 1
? = 1
? = 10
----
NULL
