# Generated by:
#     target/debug/noria-logictest generate --operations avg,left_join --compare-to mysql://root@localhost/mysql --subquery-depth 1 --rows-per-table 5 -o logictests/generated/avg,left_join.test --include-deletes

statement ok
CREATE TABLE table_3 (column_1 INT(32), column_2 INT(32), column_3 INT(32), PRIMARY KEY (column_3))


statement ok
CREATE TABLE table_2 (column_1 INT(32), column_3 INT(32), column_5 INT(32), column_2 INT(32), column_4 INT(32), PRIMARY KEY (column_5))


statement ok
CREATE TABLE table_1 (column_1 INT(32), column_2 INT(32), column_3 INT(32), PRIMARY KEY (column_3))


statement ok
INSERT INTO table_3 (column_3, column_1, column_2) VALUES (2, 1, 1), (3, 1, 1), (4, 1, 1), (5, 1, 1), (6, 1, 1)


statement ok
INSERT INTO table_2 (column_4, column_1, column_5, column_3, column_2) VALUES (1, 1, 2, 1, 1), (1, 1, 3, 1, 1), (1, 1, 4, 1, 1), (1, 1, 5, 1, 1), (1, 1, 6, 1, 1)


statement ok
INSERT INTO table_1 (column_2, column_1, column_3) VALUES (1, 1, 2), (1, 1, 3), (1, 1, 4), (1, 1, 5), (1, 1, 6)


query  nosort
SELECT avg(table_1.column_1) AS alias_1 FROM table_1
----
1.0000

query  nosort
SELECT table_1.column_2 AS alias_1, table_2.column_2 AS alias_2 FROM table_1 LEFT JOIN table_2 ON (table_1.column_1 = table_2.column_1)
----
50 values hashing to 1f4709ccf33e9b44d9c58ab63929bdf1

query  nosort
SELECT avg(table_2.column_3) AS alias_1, table_2.column_4 AS alias_2, table_3.column_2 AS alias_3 FROM table_2 LEFT JOIN table_3 ON (table_2.column_3 = table_3.column_1) GROUP BY table_2.column_4, table_3.column_2
----
1.0000
1
1

statement ok
DELETE FROM table_3 WHERE (column_3 = 2)


statement ok
DELETE FROM table_3 WHERE (column_3 = 3)


statement ok
DELETE FROM table_2 WHERE (column_5 = 2)


statement ok
DELETE FROM table_2 WHERE (column_5 = 3)


statement ok
DELETE FROM table_1 WHERE (column_3 = 2)


statement ok
DELETE FROM table_1 WHERE (column_3 = 3)


query  nosort
SELECT avg(table_1.column_1) AS alias_1 FROM table_1
----
1.0000

query  nosort
SELECT table_1.column_2 AS alias_1, table_2.column_2 AS alias_2 FROM table_1 LEFT JOIN table_2 ON (table_1.column_1 = table_2.column_1)
----
1
1
1
1
1
1
1
1
1
1
1
1
1
1
1
1
1
1

query  nosort
SELECT avg(table_2.column_3) AS alias_1, table_2.column_4 AS alias_2, table_3.column_2 AS alias_3 FROM table_2 LEFT JOIN table_3 ON (table_2.column_3 = table_3.column_1) GROUP BY table_2.column_4, table_3.column_2
----
1.0000
1
1
