# Generated by:
#     target/debug/noria-logictest generate --operations avg,between_filters --compare-to mysql://root@localhost/mysql --subquery-depth 1 --rows-per-table 5 -o logictests/generated/avg,between_filters.test --include-deletes
# failure: ENG-257

statement ok
CREATE TABLE table_1 (column_6 INT(32), column_10 INT(32), column_14 INT(32), column_11 INT(32), column_16 INT(32), column_12 INT(32), column_4 INT(32), column_7 INT(32), column_9 INT(32), column_2 INT(1), column_5 INT(32), column_1 INT(32), column_13 INT(32), column_18 INT(32), column_3 INT(32), column_17 INT(32), column_8 INT(32), column_15 INT(32), PRIMARY KEY (column_18))


statement ok
INSERT INTO table_1 (column_14, column_9, column_2, column_6, column_7, column_13, column_18, column_3, column_8, column_15, column_12, column_5, column_1, column_16, column_17, column_11, column_4, column_10) VALUES (1, 1, 1, 1, 1, 1, 2, 1, 1, 1, 1, 1, 1, 1, 1, 1, 1, 1), (1, 1, 1, 1, 1, 1, 3, 1, 1, 1, 1, 1, 1, 1, 1, 1, 1, 1), (1, 1, 1, 1, 1, 1, 4, 1, 1, 1, 1, 1, 1, 1, 1, 1, 1, 1), (1, 1, 1, 1, 1, 1, 5, 1, 1, 1, 1, 1, 1, 1, 1, 1, 1, 1), (1, 1, 1, 1, 1, 1, 6, 1, 1, 1, 1, 1, 1, 1, 1, 1, 1, 1)


query  nosort
SELECT avg(table_1.column_1) AS alias_1 FROM table_1
----
1.0000

query  nosort
SELECT table_1.column_2 AS alias_1 FROM table_1 WHERE table_1.column_2 NOT BETWEEN 1 AND 5
----


query  nosort
SELECT table_1.column_2 AS alias_1 FROM table_1 WHERE table_1.column_2 BETWEEN 1 AND 5
----
1
1
1
1
1

query  nosort
SELECT table_1.column_2 AS alias_1 FROM table_1 WHERE table_1.column_2 NOT BETWEEN 1 AND 5
----


query  nosort
SELECT table_1.column_2 AS alias_1 FROM table_1 WHERE table_1.column_2 BETWEEN 1 AND 5
----
1
1
1
1
1

query  nosort
SELECT avg(table_1.column_3) AS alias_1, table_1.column_2 AS alias_2 FROM table_1 WHERE table_1.column_2 NOT BETWEEN 1 AND 5 GROUP BY table_1.column_2
----


query  nosort
SELECT avg(table_1.column_4) AS alias_1, table_1.column_2 AS alias_2 FROM table_1 WHERE table_1.column_2 BETWEEN 1 AND 5 GROUP BY table_1.column_2
----
1.0000
1

query  nosort
SELECT avg(table_1.column_5) AS alias_1, table_1.column_2 AS alias_2 FROM table_1 WHERE table_1.column_2 NOT BETWEEN 1 AND 5 GROUP BY table_1.column_2
----


query  nosort
SELECT avg(table_1.column_6) AS alias_1, table_1.column_2 AS alias_2 FROM table_1 WHERE table_1.column_2 BETWEEN 1 AND 5 GROUP BY table_1.column_2
----
1.0000
1

query  nosort
SELECT table_1.column_2 AS alias_1, table_1.column_2 AS alias_2 FROM table_1 WHERE (table_1.column_2 NOT BETWEEN 1 AND 5 AND table_1.column_2 BETWEEN 1 AND 5)
----


query  nosort
SELECT table_1.column_2 AS alias_1, table_1.column_2 AS alias_2 FROM table_1 WHERE (table_1.column_2 NOT BETWEEN 1 AND 5 OR table_1.column_2 NOT BETWEEN 1 AND 5)
----


query  nosort
SELECT table_1.column_2 AS alias_1, table_1.column_2 AS alias_2 FROM table_1 WHERE (table_1.column_2 NOT BETWEEN 1 AND 5 OR table_1.column_2 BETWEEN 1 AND 5)
----
1
1
1
1
1
1
1
1
1
1

query  nosort
SELECT table_1.column_2 AS alias_1, table_1.column_2 AS alias_2 FROM table_1 WHERE (table_1.column_2 BETWEEN 1 AND 5 OR table_1.column_2 NOT BETWEEN 1 AND 5)
----
1
1
1
1
1
1
1
1
1
1

query  nosort
SELECT table_1.column_2 AS alias_1, table_1.column_2 AS alias_2 FROM table_1 WHERE (table_1.column_2 BETWEEN 1 AND 5 OR table_1.column_2 BETWEEN 1 AND 5)
----
1
1
1
1
1
1
1
1
1
1

query  nosort
SELECT table_1.column_2 AS alias_1, table_1.column_2 AS alias_2 FROM table_1 WHERE (table_1.column_2 NOT BETWEEN 1 AND 5 OR table_1.column_2 BETWEEN 1 AND 5)
----
1
1
1
1
1
1
1
1
1
1

query  nosort
SELECT avg(table_1.column_7) AS alias_1, table_1.column_2 AS alias_2, table_1.column_2 AS alias_3 FROM table_1 WHERE (table_1.column_2 NOT BETWEEN 1 AND 5 AND table_1.column_2 BETWEEN 1 AND 5) GROUP BY table_1.column_2, table_1.column_2
----


query  nosort
SELECT avg(table_1.column_8) AS alias_1, table_1.column_2 AS alias_2, table_1.column_2 AS alias_3 FROM table_1 WHERE (table_1.column_2 NOT BETWEEN 1 AND 5 OR table_1.column_2 NOT BETWEEN 1 AND 5) GROUP BY table_1.column_2, table_1.column_2
----


query  nosort
SELECT avg(table_1.column_9) AS alias_1, table_1.column_2 AS alias_2, table_1.column_2 AS alias_3 FROM table_1 WHERE (table_1.column_2 NOT BETWEEN 1 AND 5 OR table_1.column_2 BETWEEN 1 AND 5) GROUP BY table_1.column_2, table_1.column_2
----
1.0000
1
1

query  nosort
SELECT avg(table_1.column_10) AS alias_1, table_1.column_2 AS alias_2, table_1.column_2 AS alias_3 FROM table_1 WHERE (table_1.column_2 BETWEEN 1 AND 5 OR table_1.column_2 NOT BETWEEN 1 AND 5) GROUP BY table_1.column_2, table_1.column_2
----
1.0000
1
1

query  nosort
SELECT avg(table_1.column_11) AS alias_1, table_1.column_2 AS alias_2, table_1.column_2 AS alias_3 FROM table_1 WHERE (table_1.column_2 BETWEEN 1 AND 5 OR table_1.column_2 BETWEEN 1 AND 5) GROUP BY table_1.column_2, table_1.column_2
----
1.0000
1
1

query  nosort
SELECT avg(table_1.column_12) AS alias_1, table_1.column_2 AS alias_2, table_1.column_2 AS alias_3 FROM table_1 WHERE (table_1.column_2 NOT BETWEEN 1 AND 5 OR table_1.column_2 BETWEEN 1 AND 5) GROUP BY table_1.column_2, table_1.column_2
----
1.0000
1
1

query  nosort
SELECT table_1.column_2 AS alias_1, table_1.column_2 AS alias_2, table_1.column_2 AS alias_3 FROM table_1 WHERE ((table_1.column_2 NOT BETWEEN 1 AND 5 AND table_1.column_2 BETWEEN 1 AND 5) OR table_1.column_2 NOT BETWEEN 1 AND 5)
----


query  nosort
SELECT table_1.column_2 AS alias_1, table_1.column_2 AS alias_2, table_1.column_2 AS alias_3 FROM table_1 WHERE ((table_1.column_2 NOT BETWEEN 1 AND 5 AND table_1.column_2 BETWEEN 1 AND 5) OR table_1.column_2 BETWEEN 1 AND 5)
----
1
1
1
1
1
1
1
1
1
1
1
1
1
1
1

query  nosort
SELECT table_1.column_2 AS alias_1, table_1.column_2 AS alias_2, table_1.column_2 AS alias_3 FROM table_1 WHERE ((table_1.column_2 NOT BETWEEN 1 AND 5 OR table_1.column_2 NOT BETWEEN 1 AND 5) OR table_1.column_2 BETWEEN 1 AND 5)
----
1
1
1
1
1
1
1
1
1
1
1
1
1
1
1

query  nosort
SELECT table_1.column_2 AS alias_1, table_1.column_2 AS alias_2, table_1.column_2 AS alias_3 FROM table_1 WHERE ((table_1.column_2 BETWEEN 1 AND 5 OR table_1.column_2 NOT BETWEEN 1 AND 5) OR table_1.column_2 BETWEEN 1 AND 5)
----
1
1
1
1
1
1
1
1
1
1
1
1
1
1
1

query  nosort
SELECT avg(table_1.column_13) AS alias_1, table_1.column_2 AS alias_2, table_1.column_2 AS alias_3, table_1.column_2 AS alias_4 FROM table_1 WHERE ((table_1.column_2 NOT BETWEEN 1 AND 5 AND table_1.column_2 BETWEEN 1 AND 5) OR table_1.column_2 NOT BETWEEN 1 AND 5) GROUP BY table_1.column_2, table_1.column_2, table_1.column_2
----


query  nosort
SELECT avg(table_1.column_14) AS alias_1, table_1.column_2 AS alias_2, table_1.column_2 AS alias_3, table_1.column_2 AS alias_4 FROM table_1 WHERE ((table_1.column_2 NOT BETWEEN 1 AND 5 AND table_1.column_2 BETWEEN 1 AND 5) OR table_1.column_2 BETWEEN 1 AND 5) GROUP BY table_1.column_2, table_1.column_2, table_1.column_2
----
1.0000
1
1
1

query  nosort
SELECT avg(table_1.column_15) AS alias_1, table_1.column_2 AS alias_2, table_1.column_2 AS alias_3, table_1.column_2 AS alias_4 FROM table_1 WHERE ((table_1.column_2 NOT BETWEEN 1 AND 5 OR table_1.column_2 NOT BETWEEN 1 AND 5) OR table_1.column_2 BETWEEN 1 AND 5) GROUP BY table_1.column_2, table_1.column_2, table_1.column_2
----
1.0000
1
1
1

query  nosort
SELECT avg(table_1.column_16) AS alias_1, table_1.column_2 AS alias_2, table_1.column_2 AS alias_3, table_1.column_2 AS alias_4 FROM table_1 WHERE ((table_1.column_2 BETWEEN 1 AND 5 OR table_1.column_2 NOT BETWEEN 1 AND 5) OR table_1.column_2 BETWEEN 1 AND 5) GROUP BY table_1.column_2, table_1.column_2, table_1.column_2
----
1.0000
1
1
1

query  nosort
SELECT table_1.column_2 AS alias_1, table_1.column_2 AS alias_2, table_1.column_2 AS alias_3, table_1.column_2 AS alias_4 FROM table_1 WHERE (((table_1.column_2 NOT BETWEEN 1 AND 5 AND table_1.column_2 BETWEEN 1 AND 5) OR table_1.column_2 NOT BETWEEN 1 AND 5) OR table_1.column_2 BETWEEN 1 AND 5)
----
1
1
1
1
1
1
1
1
1
1
1
1
1
1
1
1
1
1
1
1

query  nosort
SELECT avg(table_1.column_17) AS alias_1, table_1.column_2 AS alias_2, table_1.column_2 AS alias_3, table_1.column_2 AS alias_4, table_1.column_2 AS alias_5 FROM table_1 WHERE (((table_1.column_2 NOT BETWEEN 1 AND 5 AND table_1.column_2 BETWEEN 1 AND 5) OR table_1.column_2 NOT BETWEEN 1 AND 5) OR table_1.column_2 BETWEEN 1 AND 5) GROUP BY table_1.column_2, table_1.column_2, table_1.column_2, table_1.column_2
----
1.0000
1
1
1
1

statement ok
DELETE FROM table_1 WHERE (column_18 = 2)


statement ok
DELETE FROM table_1 WHERE (column_18 = 3)


query  nosort
SELECT avg(table_1.column_1) AS alias_1 FROM table_1
----
1.0000

query  nosort
SELECT table_1.column_2 AS alias_1 FROM table_1 WHERE table_1.column_2 NOT BETWEEN 1 AND 5
----


query  nosort
SELECT table_1.column_2 AS alias_1 FROM table_1 WHERE table_1.column_2 BETWEEN 1 AND 5
----
1
1
1

query  nosort
SELECT table_1.column_2 AS alias_1 FROM table_1 WHERE table_1.column_2 NOT BETWEEN 1 AND 5
----


query  nosort
SELECT table_1.column_2 AS alias_1 FROM table_1 WHERE table_1.column_2 BETWEEN 1 AND 5
----
1
1
1

query  nosort
SELECT avg(table_1.column_3) AS alias_1, table_1.column_2 AS alias_2 FROM table_1 WHERE table_1.column_2 NOT BETWEEN 1 AND 5 GROUP BY table_1.column_2
----


query  nosort
SELECT avg(table_1.column_4) AS alias_1, table_1.column_2 AS alias_2 FROM table_1 WHERE table_1.column_2 BETWEEN 1 AND 5 GROUP BY table_1.column_2
----
1.0000
1

query  nosort
SELECT avg(table_1.column_5) AS alias_1, table_1.column_2 AS alias_2 FROM table_1 WHERE table_1.column_2 NOT BETWEEN 1 AND 5 GROUP BY table_1.column_2
----


query  nosort
SELECT avg(table_1.column_6) AS alias_1, table_1.column_2 AS alias_2 FROM table_1 WHERE table_1.column_2 BETWEEN 1 AND 5 GROUP BY table_1.column_2
----
1.0000
1

query  nosort
SELECT table_1.column_2 AS alias_1, table_1.column_2 AS alias_2 FROM table_1 WHERE (table_1.column_2 NOT BETWEEN 1 AND 5 AND table_1.column_2 BETWEEN 1 AND 5)
----


query  nosort
SELECT table_1.column_2 AS alias_1, table_1.column_2 AS alias_2 FROM table_1 WHERE (table_1.column_2 NOT BETWEEN 1 AND 5 OR table_1.column_2 NOT BETWEEN 1 AND 5)
----


query  nosort
SELECT table_1.column_2 AS alias_1, table_1.column_2 AS alias_2 FROM table_1 WHERE (table_1.column_2 NOT BETWEEN 1 AND 5 OR table_1.column_2 BETWEEN 1 AND 5)
----
1
1
1
1
1
1

query  nosort
SELECT table_1.column_2 AS alias_1, table_1.column_2 AS alias_2 FROM table_1 WHERE (table_1.column_2 BETWEEN 1 AND 5 OR table_1.column_2 NOT BETWEEN 1 AND 5)
----
1
1
1
1
1
1

query  nosort
SELECT table_1.column_2 AS alias_1, table_1.column_2 AS alias_2 FROM table_1 WHERE (table_1.column_2 BETWEEN 1 AND 5 OR table_1.column_2 BETWEEN 1 AND 5)
----
1
1
1
1
1
1

query  nosort
SELECT table_1.column_2 AS alias_1, table_1.column_2 AS alias_2 FROM table_1 WHERE (table_1.column_2 NOT BETWEEN 1 AND 5 OR table_1.column_2 BETWEEN 1 AND 5)
----
1
1
1
1
1
1

query  nosort
SELECT avg(table_1.column_7) AS alias_1, table_1.column_2 AS alias_2, table_1.column_2 AS alias_3 FROM table_1 WHERE (table_1.column_2 NOT BETWEEN 1 AND 5 AND table_1.column_2 BETWEEN 1 AND 5) GROUP BY table_1.column_2, table_1.column_2
----


query  nosort
SELECT avg(table_1.column_8) AS alias_1, table_1.column_2 AS alias_2, table_1.column_2 AS alias_3 FROM table_1 WHERE (table_1.column_2 NOT BETWEEN 1 AND 5 OR table_1.column_2 NOT BETWEEN 1 AND 5) GROUP BY table_1.column_2, table_1.column_2
----


query  nosort
SELECT avg(table_1.column_9) AS alias_1, table_1.column_2 AS alias_2, table_1.column_2 AS alias_3 FROM table_1 WHERE (table_1.column_2 NOT BETWEEN 1 AND 5 OR table_1.column_2 BETWEEN 1 AND 5) GROUP BY table_1.column_2, table_1.column_2
----
1.0000
1
1

query  nosort
SELECT avg(table_1.column_10) AS alias_1, table_1.column_2 AS alias_2, table_1.column_2 AS alias_3 FROM table_1 WHERE (table_1.column_2 BETWEEN 1 AND 5 OR table_1.column_2 NOT BETWEEN 1 AND 5) GROUP BY table_1.column_2, table_1.column_2
----
1.0000
1
1

query  nosort
SELECT avg(table_1.column_11) AS alias_1, table_1.column_2 AS alias_2, table_1.column_2 AS alias_3 FROM table_1 WHERE (table_1.column_2 BETWEEN 1 AND 5 OR table_1.column_2 BETWEEN 1 AND 5) GROUP BY table_1.column_2, table_1.column_2
----
1.0000
1
1

query  nosort
SELECT avg(table_1.column_12) AS alias_1, table_1.column_2 AS alias_2, table_1.column_2 AS alias_3 FROM table_1 WHERE (table_1.column_2 NOT BETWEEN 1 AND 5 OR table_1.column_2 BETWEEN 1 AND 5) GROUP BY table_1.column_2, table_1.column_2
----
1.0000
1
1

query  nosort
SELECT table_1.column_2 AS alias_1, table_1.column_2 AS alias_2, table_1.column_2 AS alias_3 FROM table_1 WHERE ((table_1.column_2 NOT BETWEEN 1 AND 5 AND table_1.column_2 BETWEEN 1 AND 5) OR table_1.column_2 NOT BETWEEN 1 AND 5)
----


query  nosort
SELECT table_1.column_2 AS alias_1, table_1.column_2 AS alias_2, table_1.column_2 AS alias_3 FROM table_1 WHERE ((table_1.column_2 NOT BETWEEN 1 AND 5 AND table_1.column_2 BETWEEN 1 AND 5) OR table_1.column_2 BETWEEN 1 AND 5)
----
1
1
1
1
1
1
1
1
1

query  nosort
SELECT table_1.column_2 AS alias_1, table_1.column_2 AS alias_2, table_1.column_2 AS alias_3 FROM table_1 WHERE ((table_1.column_2 NOT BETWEEN 1 AND 5 OR table_1.column_2 NOT BETWEEN 1 AND 5) OR table_1.column_2 BETWEEN 1 AND 5)
----
1
1
1
1
1
1
1
1
1

query  nosort
SELECT table_1.column_2 AS alias_1, table_1.column_2 AS alias_2, table_1.column_2 AS alias_3 FROM table_1 WHERE ((table_1.column_2 BETWEEN 1 AND 5 OR table_1.column_2 NOT BETWEEN 1 AND 5) OR table_1.column_2 BETWEEN 1 AND 5)
----
1
1
1
1
1
1
1
1
1

query  nosort
SELECT avg(table_1.column_13) AS alias_1, table_1.column_2 AS alias_2, table_1.column_2 AS alias_3, table_1.column_2 AS alias_4 FROM table_1 WHERE ((table_1.column_2 NOT BETWEEN 1 AND 5 AND table_1.column_2 BETWEEN 1 AND 5) OR table_1.column_2 NOT BETWEEN 1 AND 5) GROUP BY table_1.column_2, table_1.column_2, table_1.column_2
----


query  nosort
SELECT avg(table_1.column_14) AS alias_1, table_1.column_2 AS alias_2, table_1.column_2 AS alias_3, table_1.column_2 AS alias_4 FROM table_1 WHERE ((table_1.column_2 NOT BETWEEN 1 AND 5 AND table_1.column_2 BETWEEN 1 AND 5) OR table_1.column_2 BETWEEN 1 AND 5) GROUP BY table_1.column_2, table_1.column_2, table_1.column_2
----
1.0000
1
1
1

query  nosort
SELECT avg(table_1.column_15) AS alias_1, table_1.column_2 AS alias_2, table_1.column_2 AS alias_3, table_1.column_2 AS alias_4 FROM table_1 WHERE ((table_1.column_2 NOT BETWEEN 1 AND 5 OR table_1.column_2 NOT BETWEEN 1 AND 5) OR table_1.column_2 BETWEEN 1 AND 5) GROUP BY table_1.column_2, table_1.column_2, table_1.column_2
----
1.0000
1
1
1

query  nosort
SELECT avg(table_1.column_16) AS alias_1, table_1.column_2 AS alias_2, table_1.column_2 AS alias_3, table_1.column_2 AS alias_4 FROM table_1 WHERE ((table_1.column_2 BETWEEN 1 AND 5 OR table_1.column_2 NOT BETWEEN 1 AND 5) OR table_1.column_2 BETWEEN 1 AND 5) GROUP BY table_1.column_2, table_1.column_2, table_1.column_2
----
1.0000
1
1
1

query  nosort
SELECT table_1.column_2 AS alias_1, table_1.column_2 AS alias_2, table_1.column_2 AS alias_3, table_1.column_2 AS alias_4 FROM table_1 WHERE (((table_1.column_2 NOT BETWEEN 1 AND 5 AND table_1.column_2 BETWEEN 1 AND 5) OR table_1.column_2 NOT BETWEEN 1 AND 5) OR table_1.column_2 BETWEEN 1 AND 5)
----
1
1
1
1
1
1
1
1
1
1
1
1

query  nosort
SELECT avg(table_1.column_17) AS alias_1, table_1.column_2 AS alias_2, table_1.column_2 AS alias_3, table_1.column_2 AS alias_4, table_1.column_2 AS alias_5 FROM table_1 WHERE (((table_1.column_2 NOT BETWEEN 1 AND 5 AND table_1.column_2 BETWEEN 1 AND 5) OR table_1.column_2 NOT BETWEEN 1 AND 5) OR table_1.column_2 BETWEEN 1 AND 5) GROUP BY table_1.column_2, table_1.column_2, table_1.column_2, table_1.column_2
----
1.0000
1
1
1
1
