# Generated by:
#     target/debug/noria-logictest permute --compare-to mysql://root:noria@127.1/noria -d 3 -o logictests/generated/mysql/ --only range_param --random --include-deletes --rows-per-table 10 --subquery-depth 1 --overwrite-tests

statement ok
CREATE TABLE `table_2` (`column_6` INT, `column_2` INT, `column_1` INT, `column_3` INT, `column_4` INT, `column_5` INT, `column_8` INT, `column_7` INT, `column_9` INT, PRIMARY KEY (`column_9`))


statement ok
CREATE TABLE `table_3` (`column_3` INT, `column_1` INT, `column_2` INT, PRIMARY KEY (`column_3`))


statement ok
CREATE TABLE `table_5` (`column_1` INT, `column_2` INT, `column_3` INT, PRIMARY KEY (`column_3`))


statement ok
CREATE TABLE `table_4` (`column_1` INT, `column_3` INT, `column_2` INT, PRIMARY KEY (`column_3`))


statement ok
CREATE TABLE `table_1` (`column_2` INT, `column_1` INT, `column_3` INT, PRIMARY KEY (`column_3`))


statement ok
INSERT INTO `table_2` (`column_6`, `column_2`, `column_1`, `column_3`, `column_4`, `column_5`, `column_8`, `column_7`, `column_9`) VALUES (1646252790, -1943499451, 824711582, -988004840, 1032775428, 1322852498, -514025254, -1688787180, 0), (937029855, -210437737, 1562519559, 2020095253, 1335483905, -259622816, -391077350, 1016655687, 1), (2144049329, -535769223, 1976470768, 1752886018, -1639172272, -924118506, 675275817, -1165764056, 2), (622262529, -588284780, -1526398190, 98850701, 2123248001, -892196652, -704352647, -1567209775, 3), (-459990176, -1914872096, 12002224, -1336006054, 1730147370, 426082893, -997771495, 1644190480, 4), (905656686, -33424489, 1973546511, -1462687898, -1280074634, -385778618, 301048129, 568459927, 5), (-1495580548, 1452912201, -926693515, -1267873194, 1043655938, 373771443, 1344239451, -450578331, 6), (529318214, 530761230, 915806037, -1357988476, -990796600, -1960008433, -1870130514, -906655997, 7), (1211192276, 740756492, 830564564, -1457827927, 919946257, 1340293067, -1614939883, -1864564550, 8), (1833023033, -711944870, -1344196973, -1468437539, -325978762, -1180786352, 1912573357, 1963548667, 9)


statement ok
INSERT INTO `table_3` (`column_3`, `column_1`, `column_2`) VALUES (0, -150405054, 1908481587), (1, 375128661, 1225081568), (2, 543984992, 869033910), (3, 420125413, -1689962968), (4, 2051191957, 1616667962), (5, 2079182333, -1656247846), (6, 1302302415, -1111593280), (7, 1025662100, 519307647), (8, -1589803870, 1816199749), (9, -38880156, -1896570527)


statement ok
INSERT INTO `table_5` (`column_1`, `column_2`, `column_3`) VALUES (-796070532, -80343963, 0), (1067034445, 1306054693, 1), (-279398401, -469769164, 2), (664327356, -943764711, 3), (-333375109, 1627132173, 4), (957214849, 1259423231, 5), (976468369, 679142080, 6), (-147417773, 337349195, 7), (-163930332, -1980179374, 8), (-599621030, -1280576801, 9)


statement ok
INSERT INTO `table_4` (`column_1`, `column_3`, `column_2`) VALUES (-471957479, 0, -57504592), (1143634440, 1, -760686161), (-1338371508, 2, -1241047994), (1565359225, 3, -555407246), (1166903031, 4, 1444500103), (1523338683, 5, 56003052), (-794397368, 6, 254982348), (754742397, 7, -1279491430), (-619727244, 8, 1522657655), (827755937, 9, 1673864460)


statement ok
INSERT INTO `table_1` (`column_2`, `column_1`, `column_3`) VALUES (-764915158, 502065453, 0), (3983607, 762045893, 1), (-107668003, -755062506, 2), (2142956241, 1942948970, 3), (947558874, -274513824, 4), (1013953701, 935971544, 5), (109512789, 1173033301, 6), (403892327, -597552196, 7), (1443289123, 43777432, 8), (1127751696, 1433989464, 9)


query  rowsort
SELECT avg(`table_1`.`column_1`) AS `alias_1` FROM `table_1`
----
516670353.1000

query  rowsort
SELECT `table_1`.`column_2` AS `alias_1`, `table_2`.`column_2` AS `alias_2` FROM `table_1` INNER JOIN `table_2` ON (`table_1`.`column_1` = `table_2`.`column_1`)
----


query  rowsort
SELECT `table_2`.`column_1` AS `alias_1` FROM `table_2` WHERE (`table_2`.`column_1` > ?)
? = 10
----
12002224
1562519559
1973546511
1976470768
824711582
830564564
915806037

query  rowsort
SELECT avg(`table_2`.`column_3`) AS `alias_1`, `table_2`.`column_4` AS `alias_2`, `table_3`.`column_2` AS `alias_3` FROM `table_2` INNER JOIN `table_3` ON (`table_2`.`column_1` = `table_3`.`column_1`) GROUP BY `table_2`.`column_4`, `table_3`.`column_2`
----


query  rowsort
SELECT avg(`table_2`.`column_5`) AS `alias_1` FROM `table_2` WHERE (`table_2`.`column_1` > ?)
? = 10
----
-62899987.8571

query  rowsort
SELECT `table_2`.`column_6` AS `alias_1`, `table_4`.`column_2` AS `alias_2` FROM `table_2` INNER JOIN `table_4` ON (`table_2`.`column_1` = `table_4`.`column_1`) WHERE (`table_2`.`column_1` > ?)
? = 10
----


query  rowsort
SELECT avg(`table_2`.`column_7`) AS `alias_1`, `table_2`.`column_8` AS `alias_2`, `table_5`.`column_2` AS `alias_3` FROM `table_2` INNER JOIN `table_5` ON (`table_2`.`column_1` = `table_5`.`column_1`) WHERE (`table_2`.`column_6` > ?) GROUP BY `table_2`.`column_8`, `table_5`.`column_2`
? = 10
----


statement ok
DELETE FROM `table_2` WHERE (`column_9` = 0)


statement ok
DELETE FROM `table_2` WHERE (`column_9` = 1)


statement ok
DELETE FROM `table_2` WHERE (`column_9` = 2)


statement ok
DELETE FROM `table_2` WHERE (`column_9` = 3)


statement ok
DELETE FROM `table_2` WHERE (`column_9` = 4)


statement ok
DELETE FROM `table_3` WHERE (`column_3` = 0)


statement ok
DELETE FROM `table_3` WHERE (`column_3` = 1)


statement ok
DELETE FROM `table_3` WHERE (`column_3` = 2)


statement ok
DELETE FROM `table_3` WHERE (`column_3` = 3)


statement ok
DELETE FROM `table_3` WHERE (`column_3` = 4)


statement ok
DELETE FROM `table_5` WHERE (`column_3` = 0)


statement ok
DELETE FROM `table_5` WHERE (`column_3` = 1)


statement ok
DELETE FROM `table_5` WHERE (`column_3` = 2)


statement ok
DELETE FROM `table_5` WHERE (`column_3` = 3)


statement ok
DELETE FROM `table_5` WHERE (`column_3` = 4)


statement ok
DELETE FROM `table_4` WHERE (`column_3` = 0)


statement ok
DELETE FROM `table_4` WHERE (`column_3` = 1)


statement ok
DELETE FROM `table_4` WHERE (`column_3` = 2)


statement ok
DELETE FROM `table_4` WHERE (`column_3` = 3)


statement ok
DELETE FROM `table_4` WHERE (`column_3` = 4)


statement ok
DELETE FROM `table_1` WHERE (`column_3` = 0)


statement ok
DELETE FROM `table_1` WHERE (`column_3` = 1)


statement ok
DELETE FROM `table_1` WHERE (`column_3` = 2)


statement ok
DELETE FROM `table_1` WHERE (`column_3` = 3)


statement ok
DELETE FROM `table_1` WHERE (`column_3` = 4)


query  rowsort
SELECT avg(`table_1`.`column_1`) AS `alias_1` FROM `table_1`
----
597843909.0000

query  rowsort
SELECT `table_1`.`column_2` AS `alias_1`, `table_2`.`column_2` AS `alias_2` FROM `table_1` INNER JOIN `table_2` ON (`table_1`.`column_1` = `table_2`.`column_1`)
----


query  rowsort
SELECT `table_2`.`column_1` AS `alias_1` FROM `table_2` WHERE (`table_2`.`column_1` > ?)
? = 10
----
1973546511
830564564
915806037

query  rowsort
SELECT avg(`table_2`.`column_3`) AS `alias_1`, `table_2`.`column_4` AS `alias_2`, `table_3`.`column_2` AS `alias_3` FROM `table_2` INNER JOIN `table_3` ON (`table_2`.`column_1` = `table_3`.`column_1`) GROUP BY `table_2`.`column_4`, `table_3`.`column_2`
----


query  rowsort
SELECT avg(`table_2`.`column_5`) AS `alias_1` FROM `table_2` WHERE (`table_2`.`column_1` > ?)
? = 10
----
-335164661.3333

query  rowsort
SELECT `table_2`.`column_6` AS `alias_1`, `table_4`.`column_2` AS `alias_2` FROM `table_2` INNER JOIN `table_4` ON (`table_2`.`column_1` = `table_4`.`column_1`) WHERE (`table_2`.`column_1` > ?)
? = 10
----


query  rowsort
SELECT avg(`table_2`.`column_7`) AS `alias_1`, `table_2`.`column_8` AS `alias_2`, `table_5`.`column_2` AS `alias_3` FROM `table_2` INNER JOIN `table_5` ON (`table_2`.`column_1` = `table_5`.`column_1`) WHERE (`table_2`.`column_6` > ?) GROUP BY `table_2`.`column_8`, `table_5`.`column_2`
? = 10
----

