# Generated by:
#     target/debug/noria-logictest permute --compare-to mysql://root:noria@127.1/noria -d 3 -o logictests/generated/mysql/ --only range_param --random --include-deletes --rows-per-table 10 --subquery-depth 1 --overwrite-tests

statement ok
CREATE TABLE `table_1` (`column_3` INT, `column_4` INT, `column_1` INT, `column_6` INT, `column_8` INT, `column_9` INT, `column_5` INT, `column_7` INT, `column_2` INT, PRIMARY KEY (`column_9`))


statement ok
INSERT INTO `table_1` (`column_3`, `column_4`, `column_1`, `column_6`, `column_8`, `column_9`, `column_5`, `column_7`, `column_2`) VALUES (1080207699, 432474737, 1769076096, 294503954, -1326019223, 0, -620394673, -1748843216, -1324946282), (225105742, -445425425, -414756570, 17970613, -2002786429, 1, 1661265448, 2105872703, -231878697), (-1240527461, -1973845457, -1539441989, -14475495, -1160898764, 2, -1189937637, -1700543912, -1046231727), (-1808152834, 1269119732, 2111296749, -1947802871, 367812947, 3, 2113730688, 487203036, 838374462), (-709317631, -1645116732, -1682419806, 821196939, 908502848, 4, 2097503642, 1318618141, -1104456454), (-1212789870, -147464438, -1935662297, -1907478271, -300336856, 5, -2025814771, 501154878, 1706776622), (-1210445935, -2004581848, -1256506218, 1419474228, 1748947972, 6, 584840546, -648850889, 1645250127), (627657851, 714383566, -1683554082, 1086671995, 1702094313, 7, -1348761840, 607766618, -1724442534), (-1072344166, 1092784708, -1663980556, 47437574, 696044332, 8, 477616324, -1597926553, 669895881), (-1135237225, -1364433390, -548879429, 1251199444, 1866516057, 9, 1991701116, 1790885760, -1966437167)


query  rowsort
SELECT avg(`table_1`.`column_1`) AS `alias_1` FROM `table_1`
----
-684482810.2000

query  rowsort
SELECT max(`table_1`.`column_2`) AS `alias_1` FROM `table_1`
----
1706776622

query  rowsort
SELECT `table_1`.`column_2` AS `alias_1` FROM `table_1` WHERE (`table_1`.`column_2` > ?)
? = 10
----
1645250127
1706776622
669895881
838374462

query  rowsort
SELECT avg(`table_1`.`column_3`) AS `alias_1`, max(`table_1`.`column_4`) AS `alias_2` FROM `table_1`
----
-645584383.0000
1269119732

query  rowsort
SELECT avg(`table_1`.`column_5`) AS `alias_1` FROM `table_1` WHERE (`table_1`.`column_3` > ?)
? = 10
----
-102630355.0000

query  rowsort
SELECT max(`table_1`.`column_6`) AS `alias_1` FROM `table_1` WHERE (`table_1`.`column_3` > ?)
? = 10
----
1086671995

query  rowsort
SELECT avg(`table_1`.`column_7`) AS `alias_1`, max(`table_1`.`column_8`) AS `alias_2` FROM `table_1` WHERE (`table_1`.`column_3` > ?)
? = 10
----
321598701.6667
1702094313

statement ok
DELETE FROM `table_1` WHERE (`column_9` = 0)


statement ok
DELETE FROM `table_1` WHERE (`column_9` = 1)


statement ok
DELETE FROM `table_1` WHERE (`column_9` = 2)


statement ok
DELETE FROM `table_1` WHERE (`column_9` = 3)


statement ok
DELETE FROM `table_1` WHERE (`column_9` = 4)


query  rowsort
SELECT avg(`table_1`.`column_1`) AS `alias_1` FROM `table_1`
----
-1417716516.4000

query  rowsort
SELECT max(`table_1`.`column_2`) AS `alias_1` FROM `table_1`
----
1706776622

query  rowsort
SELECT `table_1`.`column_2` AS `alias_1` FROM `table_1` WHERE (`table_1`.`column_2` > ?)
? = 10
----
1645250127
1706776622
669895881

query  rowsort
SELECT avg(`table_1`.`column_3`) AS `alias_1`, max(`table_1`.`column_4`) AS `alias_2` FROM `table_1`
----
-800631869.0000
1092784708

query  rowsort
SELECT avg(`table_1`.`column_5`) AS `alias_1` FROM `table_1` WHERE (`table_1`.`column_3` > ?)
? = 10
----
-1348761840.0000

query  rowsort
SELECT max(`table_1`.`column_6`) AS `alias_1` FROM `table_1` WHERE (`table_1`.`column_3` > ?)
? = 10
----
1086671995

query  rowsort
SELECT avg(`table_1`.`column_7`) AS `alias_1`, max(`table_1`.`column_8`) AS `alias_2` FROM `table_1` WHERE (`table_1`.`column_3` > ?)
? = 10
----
607766618.0000
1702094313
