# Generated by:
#     target/debug/noria-logictest permute --compare-to mysql://root:noria@127.1/noria -d 3 -o logictests/generated/mysql/ --only range_param --random --include-deletes --rows-per-table 10 --subquery-depth 1 --overwrite-tests

statement ok
CREATE TABLE `table_1` (`column_9` INT, `column_8` INT, `column_5` INT, `column_6` INT, `column_2` INT, `column_3` INT, `column_4` INT, `column_7` INT, `column_1` INT, PRIMARY KEY (`column_9`))


statement ok
INSERT INTO `table_1` (`column_9`, `column_8`, `column_5`, `column_6`, `column_2`, `column_3`, `column_4`, `column_7`, `column_1`) VALUES (0, -47416918, 718751686, -1868767292, -937604416, -1719855408, -1995946019, -1830310080, 1258918548), (1, -2123360611, -1558339703, 1043735002, 994033454, 1046133587, 1234391771, -244231489, -996156276), (2, -1260238925, -455326214, -2057595945, -1521945782, 131974094, -615387196, 1186429410, -39342339), (3, 870814615, -1954349135, 1284676722, -1315988236, -1614065392, 539429043, 639151070, -981419206), (4, -1335944881, -1909309131, 905785223, -1699419338, -524549082, 1363513405, -1408585744, -1358204340), (5, 1500665624, 492659213, 219392867, -1664742232, -1505616012, 1862299679, -209041397, 2125597463), (6, 500242915, 2129481796, -332694905, 1294657017, 1969375848, 1965568226, -177912192, -277024930), (7, -1261514723, 1402233977, -2004962909, 779786957, -571209556, 856118925, -662611818, -709750500), (8, 1868031166, 389146114, 1050313830, 289315409, 544490423, -1382249967, -855175860, -1758752505), (9, 1372339288, 1025880276, 27449432, -535503668, -1756126586, -1088107878, 2049216570, -740015179)


query  rowsort
SELECT avg(`table_1`.`column_1`) AS `alias_1` FROM `table_1`
----
-347614926.4000

query  rowsort
SELECT sum(`table_1`.`column_2`) AS `alias_1` FROM `table_1`
----
-4317410835

query  rowsort
SELECT `table_1`.`column_2` AS `alias_1` FROM `table_1` WHERE (`table_1`.`column_2` > ?)
? = 10
----
1294657017
289315409
779786957
994033454

query  rowsort
SELECT avg(`table_1`.`column_3`) AS `alias_1`, sum(`table_1`.`column_4`) AS `alias_2` FROM `table_1`
----
-399944808.4000
2739629989

query  rowsort
SELECT avg(`table_1`.`column_5`) AS `alias_1` FROM `table_1` WHERE (`table_1`.`column_5` > ?)
? = 10
----
1026358843.6667

query  rowsort
SELECT sum(`table_1`.`column_6`) AS `alias_1` FROM `table_1` WHERE (`table_1`.`column_5` > ?)
? = 10
----
-2909268977

query  rowsort
SELECT avg(`table_1`.`column_7`) AS `alias_1`, sum(`table_1`.`column_8`) AS `alias_2` FROM `table_1` WHERE (`table_1`.`column_8` > ?)
? = 10
----
289247638.2000
6112093608

statement ok
DELETE FROM `table_1` WHERE (`column_9` = 0)


statement ok
DELETE FROM `table_1` WHERE (`column_9` = 1)


statement ok
DELETE FROM `table_1` WHERE (`column_9` = 2)


statement ok
DELETE FROM `table_1` WHERE (`column_9` = 3)


statement ok
DELETE FROM `table_1` WHERE (`column_9` = 4)


query  rowsort
SELECT avg(`table_1`.`column_1`) AS `alias_1` FROM `table_1`
----
-271989130.2000

query  rowsort
SELECT sum(`table_1`.`column_2`) AS `alias_1` FROM `table_1`
----
163513483

query  rowsort
SELECT `table_1`.`column_2` AS `alias_1` FROM `table_1` WHERE (`table_1`.`column_2` > ?)
? = 10
----
1294657017
289315409
779786957

query  rowsort
SELECT avg(`table_1`.`column_3`) AS `alias_1`, sum(`table_1`.`column_4`) AS `alias_2` FROM `table_1`
----
-263817176.6000
2213628985

query  rowsort
SELECT avg(`table_1`.`column_5`) AS `alias_1` FROM `table_1` WHERE (`table_1`.`column_5` > ?)
? = 10
----
1087880275.2000

query  rowsort
SELECT sum(`table_1`.`column_6`) AS `alias_1` FROM `table_1` WHERE (`table_1`.`column_5` > ?)
? = 10
----
-1040501685

query  rowsort
SELECT avg(`table_1`.`column_7`) AS `alias_1`, sum(`table_1`.`column_8`) AS `alias_2` FROM `table_1` WHERE (`table_1`.`column_8` > ?)
? = 10
----
201771780.2500
5241278993
