# Generated by:
#     target/debug/noria-logictest permute --compare-to mysql://root:noria@127.1/noria -d 3 -o logictests/generated/mysql/ --only range_param --random --include-deletes --rows-per-table 10 --subquery-depth 1 --overwrite-tests

statement ok
CREATE TABLE `table_3` (`column_4` INT, `column_1` INT, `column_5` INT, `column_3` INT, `column_2` INT, PRIMARY KEY (`column_5`))


statement ok
CREATE TABLE `table_1` (`column_2` INT, `column_3` INT, `column_1` INT, PRIMARY KEY (`column_3`))


statement ok
CREATE TABLE `table_2` (`column_3` INT, `column_1` INT, `column_7` INT, `column_2` INT, `column_4` INT, `column_5` INT, `column_6` INT, PRIMARY KEY (`column_7`))


statement ok
CREATE TABLE `table_4` (`column_3` INT, `column_1` INT, `column_2` INT, PRIMARY KEY (`column_3`))


statement ok
CREATE TABLE `table_5` (`column_1` INT, `column_2` INT, `column_3` INT, PRIMARY KEY (`column_3`))


statement ok
INSERT INTO `table_3` (`column_4`, `column_1`, `column_5`, `column_3`, `column_2`) VALUES (-242328908, -1593309732, 0, -1154894690, -1810111008), (749571586, 264044227, 1, -864659967, 1354328505), (467780015, -1308441699, 2, 1451859829, 1311771968), (2101239218, -1766708216, 3, -824138853, 1122560381), (-848875416, -1335523979, 4, 2047243393, 160735583), (1021903035, 1952860788, 5, 995478249, 72144927), (2872765, -508988460, 6, 715953263, -1844740593), (524418938, -1471829103, 7, -1472801019, 1161887390), (1338514963, 1462663704, 8, 390684208, 419585519), (-1647667663, 1861794986, 9, -357425852, 20232427)


statement ok
INSERT INTO `table_1` (`column_2`, `column_3`, `column_1`) VALUES (1483902581, 0, 661490905), (2134494634, 1, 1963388059), (-676509817, 2, 2024627803), (-2071008956, 3, 421232297), (-822358761, 4, 815212102), (513335828, 5, -1662600499), (84261314, 6, 68700566), (-1961071707, 7, 1296289708), (-1372876102, 8, 1625335249), (1668656862, 9, -1412691698)


statement ok
INSERT INTO `table_2` (`column_3`, `column_1`, `column_7`, `column_2`, `column_4`, `column_5`, `column_6`) VALUES (-809733604, 679529492, 0, 776903179, 1320317759, 1507907347, -2050549358), (1680939256, -721978869, 1, 1882391624, 1086102288, -730519670, 777543581), (-1568545910, -1898390302, 2, 1244785971, -1287940252, 1118341759, -630300232), (774324466, -696688951, 3, -989573319, 2017764410, 335842060, 1791585137), (1655132875, -356496134, 4, 1074466107, -242356820, -95869506, 1604567768), (-1704205715, -191491876, 5, 1527534891, 1366490851, 833975802, 62685553), (2145860668, 1413572186, 6, 1359648048, -773574785, -1792358433, 677575599), (185486871, -310714411, 7, -586121938, 356444993, 61412097, 1962516663), (-411756412, 430849327, 8, -1858252545, -1500077453, -239024679, 906856625), (1417996016, 530572144, 9, -140496257, -1074602933, -2090440515, 1338101520)


statement ok
INSERT INTO `table_4` (`column_3`, `column_1`, `column_2`) VALUES (0, 816944327, 1884364069), (1, -707047155, 87768366), (2, -1163713118, 905745693), (3, -183812431, 1063482101), (4, -200966611, 547964396), (5, 1628971213, -693253253), (6, 1130856798, 243787366), (7, 858057501, 429074922), (8, 1877064506, 1062734981), (9, 1344032078, -1930223214)


statement ok
INSERT INTO `table_5` (`column_1`, `column_2`, `column_3`) VALUES (-651232890, 1665092179, 0), (-1997741525, -207981746, 1), (1281092866, -1139925297, 2), (-2119428511, 1694221682, 3), (-1820928981, 648862115, 4), (-406112756, 1875075075, 5), (851143144, 339449266, 6), (1101219568, 2049998251, 7), (1955056829, -1765127784, 8), (1974882037, 27812925, 9)


query  rowsort
SELECT avg(`table_1`.`column_1`) AS `alias_1` FROM `table_1`
----
580098449.2000

query  rowsort
SELECT `table_1`.`column_2` AS `alias_1`, `table_2`.`column_2` AS `alias_2` FROM `table_1` LEFT JOIN `table_2` ON (`table_1`.`column_1` = `table_2`.`column_1`)
----
-1372876102
NULL
-1961071707
NULL
-2071008956
NULL
-676509817
NULL
-822358761
NULL
1483902581
NULL
1668656862
NULL
2134494634
NULL
513335828
NULL
84261314
NULL

query  rowsort
SELECT `table_2`.`column_2` AS `alias_1` FROM `table_2` WHERE (`table_2`.`column_2` > ?)
? = 10
----
1074466107
1244785971
1359648048
1527534891
1882391624
776903179

query  rowsort
SELECT avg(`table_2`.`column_3`) AS `alias_1`, `table_2`.`column_4` AS `alias_2`, `table_3`.`column_2` AS `alias_3` FROM `table_2` LEFT JOIN `table_3` ON (`table_2`.`column_2` = `table_3`.`column_1`) GROUP BY `table_2`.`column_4`, `table_3`.`column_2`
----
30 values hashing to 9f6b607f4996ebbcadf956e3f3b5164a

query  rowsort
SELECT avg(`table_2`.`column_5`) AS `alias_1` FROM `table_2` WHERE (`table_2`.`column_3` > ?)
? = 10
----
-718655661.1667

query  rowsort
SELECT `table_2`.`column_6` AS `alias_1`, `table_4`.`column_2` AS `alias_2` FROM `table_2` LEFT JOIN `table_4` ON (`table_2`.`column_3` = `table_4`.`column_1`) WHERE (`table_2`.`column_3` > ?)
? = 10
----
1338101520
NULL
1604567768
NULL
1791585137
NULL
1962516663
NULL
677575599
NULL
777543581
NULL

query  rowsort
SELECT avg(`table_3`.`column_3`) AS `alias_1`, `table_3`.`column_4` AS `alias_2`, `table_5`.`column_2` AS `alias_3` FROM `table_3` LEFT JOIN `table_5` ON (`table_3`.`column_3` = `table_5`.`column_1`) WHERE (`table_3`.`column_4` > ?) GROUP BY `table_3`.`column_4`, `table_5`.`column_2`
? = 10
----
21 values hashing to cd1e7c63521b9c9b0d80ccadf19b80f5

statement ok
DELETE FROM `table_3` WHERE (`column_5` = 0)


statement ok
DELETE FROM `table_3` WHERE (`column_5` = 1)


statement ok
DELETE FROM `table_3` WHERE (`column_5` = 2)


statement ok
DELETE FROM `table_3` WHERE (`column_5` = 3)


statement ok
DELETE FROM `table_3` WHERE (`column_5` = 4)


statement ok
DELETE FROM `table_1` WHERE (`column_3` = 0)


statement ok
DELETE FROM `table_1` WHERE (`column_3` = 1)


statement ok
DELETE FROM `table_1` WHERE (`column_3` = 2)


statement ok
DELETE FROM `table_1` WHERE (`column_3` = 3)


statement ok
DELETE FROM `table_1` WHERE (`column_3` = 4)


statement ok
DELETE FROM `table_2` WHERE (`column_7` = 0)


statement ok
DELETE FROM `table_2` WHERE (`column_7` = 1)


statement ok
DELETE FROM `table_2` WHERE (`column_7` = 2)


statement ok
DELETE FROM `table_2` WHERE (`column_7` = 3)


statement ok
DELETE FROM `table_2` WHERE (`column_7` = 4)


statement ok
DELETE FROM `table_4` WHERE (`column_3` = 0)


statement ok
DELETE FROM `table_4` WHERE (`column_3` = 1)


statement ok
DELETE FROM `table_4` WHERE (`column_3` = 2)


statement ok
DELETE FROM `table_4` WHERE (`column_3` = 3)


statement ok
DELETE FROM `table_4` WHERE (`column_3` = 4)


statement ok
DELETE FROM `table_5` WHERE (`column_3` = 0)


statement ok
DELETE FROM `table_5` WHERE (`column_3` = 1)


statement ok
DELETE FROM `table_5` WHERE (`column_3` = 2)


statement ok
DELETE FROM `table_5` WHERE (`column_3` = 3)


statement ok
DELETE FROM `table_5` WHERE (`column_3` = 4)


query  rowsort
SELECT avg(`table_1`.`column_1`) AS `alias_1` FROM `table_1`
----
-16993334.8000

query  rowsort
SELECT `table_1`.`column_2` AS `alias_1`, `table_2`.`column_2` AS `alias_2` FROM `table_1` LEFT JOIN `table_2` ON (`table_1`.`column_1` = `table_2`.`column_1`)
----
-1372876102
NULL
-1961071707
NULL
1668656862
NULL
513335828
NULL
84261314
NULL

query  rowsort
SELECT `table_2`.`column_2` AS `alias_1` FROM `table_2` WHERE (`table_2`.`column_2` > ?)
? = 10
----
1359648048
1527534891

query  rowsort
SELECT avg(`table_2`.`column_3`) AS `alias_1`, `table_2`.`column_4` AS `alias_2`, `table_3`.`column_2` AS `alias_3` FROM `table_2` LEFT JOIN `table_3` ON (`table_2`.`column_2` = `table_3`.`column_1`) GROUP BY `table_2`.`column_4`, `table_3`.`column_2`
----
-1704205715.0000
1366490851
NULL
-411756412.0000
-1500077453
NULL
1417996016.0000
-1074602933
NULL
185486871.0000
356444993
NULL
2145860668.0000
-773574785
NULL

query  rowsort
SELECT avg(`table_2`.`column_5`) AS `alias_1` FROM `table_2` WHERE (`table_2`.`column_3` > ?)
? = 10
----
-1273795617.0000

query  rowsort
SELECT `table_2`.`column_6` AS `alias_1`, `table_4`.`column_2` AS `alias_2` FROM `table_2` LEFT JOIN `table_4` ON (`table_2`.`column_3` = `table_4`.`column_1`) WHERE (`table_2`.`column_3` > ?)
? = 10
----
1338101520
NULL
1962516663
NULL
677575599
NULL

query  rowsort
SELECT avg(`table_3`.`column_3`) AS `alias_1`, `table_3`.`column_4` AS `alias_2`, `table_5`.`column_2` AS `alias_3` FROM `table_3` LEFT JOIN `table_5` ON (`table_3`.`column_3` = `table_5`.`column_1`) WHERE (`table_3`.`column_4` > ?) GROUP BY `table_3`.`column_4`, `table_5`.`column_2`
? = 10
----
-1472801019.0000
524418938
NULL
390684208.0000
1338514963
NULL
715953263.0000
2872765
NULL
995478249.0000
1021903035
NULL
