# Generated by:
#     target/debug/noria-logictest permute --compare-to mysql://root:noria@127.1/noria -d 3 -o logictests/generated/mysql/ --only range_param --random --include-deletes --rows-per-table 10 --subquery-depth 1 --overwrite-tests

statement ok
CREATE TABLE `table_1` (`column_5` INT, `column_4` INT, `column_2` INT, `column_1` INT, `column_3` INT, PRIMARY KEY (`column_5`))


statement ok
INSERT INTO `table_1` (`column_5`, `column_4`, `column_2`, `column_1`, `column_3`) VALUES (0, -613636610, -1110015328, -955366444, 31552906), (1, 436317611, 1564774451, 2008040905, 1631628663), (2, 422193755, -1903261595, 954122404, -1190298673), (3, 619511644, -1038073852, -1600353181, -1647741181), (4, 854087174, -832996426, 1457892141, -35444523), (5, -484885756, -994879874, -683097897, 1661378256), (6, 607521523, 1929516258, -794329304, 417481001), (7, 790862433, 1747574605, -1323642654, 1487830447), (8, 1133194093, 686061375, -137679587, 1035578842), (9, 496779969, -537670411, -1934831208, 238271204)


query  rowsort
SELECT avg(`table_1`.`column_1`) AS `alias_1` FROM `table_1`
----
-300924482.5000

query  rowsort
SELECT 1 AS `alias_1`
----
1

query  rowsort
SELECT `table_1`.`column_1` AS `alias_1` FROM `table_1` WHERE (`table_1`.`column_1` > ?)
? = 10
----
1457892141
2008040905
954122404

query  rowsort
SELECT avg(`table_1`.`column_2`) AS `alias_1`, 1 AS `alias_2` FROM `table_1`
----
-48897079.7000
1

query  rowsort
SELECT avg(`table_1`.`column_3`) AS `alias_1` FROM `table_1` WHERE (`table_1`.`column_1` > ?)
? = 10
----
135295155.6667

query  rowsort
SELECT 1 AS `alias_1` FROM `table_1` WHERE (`table_1`.`column_1` > ?)
? = 10
----
1
1
1

query  rowsort
SELECT avg(`table_1`.`column_4`) AS `alias_1`, 1 AS `alias_2` FROM `table_1` WHERE (`table_1`.`column_4` > ?)
? = 10
----
670058525.2500
1

statement ok
DELETE FROM `table_1` WHERE (`column_5` = 0)


statement ok
DELETE FROM `table_1` WHERE (`column_5` = 1)


statement ok
DELETE FROM `table_1` WHERE (`column_5` = 2)


statement ok
DELETE FROM `table_1` WHERE (`column_5` = 3)


statement ok
DELETE FROM `table_1` WHERE (`column_5` = 4)


query  rowsort
SELECT avg(`table_1`.`column_1`) AS `alias_1` FROM `table_1`
----
-974716130.0000

query  rowsort
SELECT 1 AS `alias_1`
----
1

query  rowsort
SELECT `table_1`.`column_1` AS `alias_1` FROM `table_1` WHERE (`table_1`.`column_1` > ?)
? = 10
----


query  rowsort
SELECT avg(`table_1`.`column_2`) AS `alias_1`, 1 AS `alias_2` FROM `table_1`
----
566120390.6000
1

query  rowsort
SELECT avg(`table_1`.`column_3`) AS `alias_1` FROM `table_1` WHERE (`table_1`.`column_1` > ?)
? = 10
----
NULL

query  rowsort
SELECT 1 AS `alias_1` FROM `table_1` WHERE (`table_1`.`column_1` > ?)
? = 10
----


query  rowsort
SELECT avg(`table_1`.`column_4`) AS `alias_1`, 1 AS `alias_2` FROM `table_1` WHERE (`table_1`.`column_4` > ?)
? = 10
----
757089504.5000
1
