# Generated by:
#     target/debug/noria-logictest permute --compare-to mysql://root:noria@127.1/noria -d 3 -o logictests/generated/mysql/ --only range_param --random --include-deletes --rows-per-table 10 --subquery-depth 1 --overwrite-tests

statement ok
CREATE TABLE `table_1` (`column_9` INT, `column_7` INT, `column_5` INT, `column_8` INT, `column_1` INT, `column_2` INT, `column_4` INT, `column_3` INT, `column_6` INT, PRIMARY KEY (`column_9`))


statement ok
INSERT INTO `table_1` (`column_9`, `column_7`, `column_5`, `column_8`, `column_1`, `column_2`, `column_4`, `column_3`, `column_6`) VALUES (0, 631623672, -769816868, -7536285, -690368174, 1108370431, -237034798, 735953903, -1236674142), (1, 645989550, 1951509518, 1013225953, -504803884, 589075029, -1619097228, 1592782160, 1324029369), (2, 446659270, -1281472819, 2120537460, -11901102, -383962798, 1878853724, -1409774491, -1168646421), (3, -1629618682, 752519159, 234866915, -884767438, 1367095928, 1003192380, -215278304, 431484354), (4, -1173597995, -464715537, -1843278957, -2094976874, -1450282676, 2022484070, 431355738, 273094681), (5, 407160330, -1860742579, -1622575006, 510990123, -1639474958, 1309949354, 372872660, -1289013113), (6, -1272265123, -14975938, -1736092864, 1038030708, 1686996540, -2121969028, -1897777161, 910736331), (7, -582034976, -110592150, 513255793, -2110193814, 1986466419, -1762915771, -116064642, 945287418), (8, -677548670, -882654267, -1896008245, 47976307, 1252060009, 1524122177, 698533263, -1517762295), (9, 1303687054, 1172506546, -2064213070, 7110589, 1978375667, 1873603254, 673541167, -2112599237)


query  rowsort
SELECT avg(distinct `table_1`.`column_1`) AS `alias_1` FROM `table_1`
----
-469290355.9000

query  rowsort
SELECT avg(`table_1`.`column_2`) AS `alias_1` FROM `table_1`
----
649471959.1000

query  rowsort
SELECT `table_1`.`column_1` AS `alias_1` FROM `table_1` WHERE (`table_1`.`column_1` > ?)
? = 10
----
1038030708
47976307
510990123
7110589

query  rowsort
SELECT avg(distinct `table_1`.`column_3`) AS `alias_1`, avg(`table_1`.`column_4`) AS `alias_2` FROM `table_1`
----
86614429.3000
387118813.4000

query  rowsort
SELECT avg(distinct `table_1`.`column_5`) AS `alias_1` FROM `table_1` WHERE (`table_1`.`column_4` > ?)
? = 10
----
-427426582.8333

query  rowsort
SELECT avg(`table_1`.`column_6`) AS `alias_1` FROM `table_1` WHERE (`table_1`.`column_4` > ?)
? = 10
----
-897240338.5000

query  rowsort
SELECT avg(distinct `table_1`.`column_7`) AS `alias_1`, avg(`table_1`.`column_8`) AS `alias_2` FROM `table_1` WHERE (`table_1`.`column_7` > ?)
? = 10
----
687023975.2000
-112112189.6000

statement ok
DELETE FROM `table_1` WHERE (`column_9` = 0)


statement ok
DELETE FROM `table_1` WHERE (`column_9` = 1)


statement ok
DELETE FROM `table_1` WHERE (`column_9` = 2)


statement ok
DELETE FROM `table_1` WHERE (`column_9` = 3)


statement ok
DELETE FROM `table_1` WHERE (`column_9` = 4)


query  rowsort
SELECT avg(distinct `table_1`.`column_1`) AS `alias_1` FROM `table_1`
----
-101217217.4000

query  rowsort
SELECT avg(`table_1`.`column_2`) AS `alias_1` FROM `table_1`
----
1052884735.4000

query  rowsort
SELECT `table_1`.`column_1` AS `alias_1` FROM `table_1` WHERE (`table_1`.`column_1` > ?)
? = 10
----
1038030708
47976307
510990123
7110589

query  rowsort
SELECT avg(distinct `table_1`.`column_3`) AS `alias_1`, avg(`table_1`.`column_4`) AS `alias_2` FROM `table_1`
----
-53778942.6000
164557997.2000

query  rowsort
SELECT avg(distinct `table_1`.`column_5`) AS `alias_1` FROM `table_1` WHERE (`table_1`.`column_4` > ?)
? = 10
----
-523630100.0000

query  rowsort
SELECT avg(`table_1`.`column_6`) AS `alias_1` FROM `table_1` WHERE (`table_1`.`column_4` > ?)
? = 10
----
-1639791548.3333

query  rowsort
SELECT avg(distinct `table_1`.`column_7`) AS `alias_1`, avg(`table_1`.`column_8`) AS `alias_2` FROM `table_1` WHERE (`table_1`.`column_7` > ?)
? = 10
----
855423692.0000
-1843394038.0000
