# Generated by:
#     target/debug/noria-logictest permute --compare-to mysql://root:noria@127.1/noria -d 3 -o logictests/generated/mysql/ --only range_param --random --include-deletes --rows-per-table 10 --subquery-depth 1 --overwrite-tests

statement ok
CREATE TABLE `table_1` (`column_3` INT, `column_5` INT, `column_1` INT, `column_2` INT, `column_4` INT, PRIMARY KEY (`column_5`))


statement ok
INSERT INTO `table_1` (`column_3`, `column_5`, `column_1`, `column_2`, `column_4`) VALUES (1170077331, 0, -2042109532, -100009904, -290210268), (15487756, 1, 865765809, -1812732391, 2014247154), (-2013338625, 2, -1207005052, -556747560, -1469358046), (282390457, 3, 286786864, -170113863, 1963467221), (-473505137, 4, -2050341255, -829062260, -850177326), (-1207440933, 5, 36353648, -1354770549, -24746614), (-558468300, 6, 1138345497, -603381600, -954218820), (1200634004, 7, -1561364833, 1494363074, 1276510152), (-581879449, 8, 1459002930, -1520465397, 824783827), (895143877, 9, -1976460377, 1307633822, 2007583576)


query  rowsort
SELECT avg(distinct `table_1`.`column_1`) AS `alias_1` FROM `table_1`
----
-505102630.1000

query  rowsort
SELECT `table_1`.`column_1` AS `alias_1` FROM `table_1` WHERE (`table_1`.`column_1` = ?)
? = 1
----


query  rowsort
SELECT `table_1`.`column_1` AS `alias_1` FROM `table_1` WHERE (`table_1`.`column_1` > ?)
? = 10
----
1138345497
1459002930
286786864
36353648
865765809

query  rowsort
SELECT avg(distinct `table_1`.`column_2`) AS `alias_1` FROM `table_1` WHERE (`table_1`.`column_1` = ?)
? = 1
----
NULL

query  rowsort
SELECT avg(distinct `table_1`.`column_3`) AS `alias_1` FROM `table_1` WHERE (`table_1`.`column_1` > ?)
? = 10
----
-409982093.8000

query  rowsort
SELECT `table_1`.`column_1` AS `alias_1` FROM `table_1` WHERE ((`table_1`.`column_1` = ?) AND (`table_1`.`column_1` > ?))
? = 1
? = 10
----


query  rowsort
SELECT avg(distinct `table_1`.`column_4`) AS `alias_1` FROM `table_1` WHERE ((`table_1`.`column_3` = ?) AND (`table_1`.`column_3` > ?))
? = 1
? = 10
----
NULL

statement ok
DELETE FROM `table_1` WHERE (`column_5` = 0)


statement ok
DELETE FROM `table_1` WHERE (`column_5` = 1)


statement ok
DELETE FROM `table_1` WHERE (`column_5` = 2)


statement ok
DELETE FROM `table_1` WHERE (`column_5` = 3)


statement ok
DELETE FROM `table_1` WHERE (`column_5` = 4)


query  rowsort
SELECT avg(distinct `table_1`.`column_1`) AS `alias_1` FROM `table_1`
----
-180824627.0000

query  rowsort
SELECT `table_1`.`column_1` AS `alias_1` FROM `table_1` WHERE (`table_1`.`column_1` = ?)
? = 1
----


query  rowsort
SELECT `table_1`.`column_1` AS `alias_1` FROM `table_1` WHERE (`table_1`.`column_1` > ?)
? = 10
----
1138345497
1459002930
36353648

query  rowsort
SELECT avg(distinct `table_1`.`column_2`) AS `alias_1` FROM `table_1` WHERE (`table_1`.`column_1` = ?)
? = 1
----
NULL

query  rowsort
SELECT avg(distinct `table_1`.`column_3`) AS `alias_1` FROM `table_1` WHERE (`table_1`.`column_1` > ?)
? = 10
----
-782596227.3333

query  rowsort
SELECT `table_1`.`column_1` AS `alias_1` FROM `table_1` WHERE ((`table_1`.`column_1` = ?) AND (`table_1`.`column_1` > ?))
? = 1
? = 10
----


query  rowsort
SELECT avg(distinct `table_1`.`column_4`) AS `alias_1` FROM `table_1` WHERE ((`table_1`.`column_3` = ?) AND (`table_1`.`column_3` > ?))
? = 1
? = 10
----
NULL
