# Generated by:
#     target/debug/noria-logictest permute --compare-to mysql://root:noria@127.1/noria -d 3 -o logictests/generated/mysql/ --only range_param --random --include-deletes --rows-per-table 10 --subquery-depth 1 --overwrite-tests

statement ok
CREATE TABLE `table_2` (`column_2` INT, `column_4` INT, `column_5` INT, `column_1` INT, `column_3` INT, PRIMARY KEY (`column_5`))


statement ok
CREATE TABLE `table_4` (`column_3` INT, `column_1` INT, `column_2` INT, PRIMARY KEY (`column_3`))


statement ok
CREATE TABLE `table_5` (`column_2` INT, `column_3` INT, `column_1` INT, PRIMARY KEY (`column_3`))


statement ok
CREATE TABLE `table_3` (`column_2` INT, `column_5` INT, `column_1` INT, `column_3` INT, `column_4` INT, PRIMARY KEY (`column_5`))


statement ok
CREATE TABLE `table_1` (`column_4` INT, `column_3` INT, `column_5` INT, `column_2` INT, `column_1` INT, PRIMARY KEY (`column_5`))


statement ok
INSERT INTO `table_2` (`column_2`, `column_4`, `column_5`, `column_1`, `column_3`) VALUES (-245765198, 1153455164, 0, 1201547577, -294469017), (-667665933, -1937183091, 1, 636047761, -224737195), (133330228, -1219879663, 2, 370045095, 898775099), (-1285607250, 355292322, 3, -2018463283, 1469736287), (931394330, -1376489333, 4, -1360549411, -1404188819), (958773876, -1386256681, 5, 780078109, -1443653709), (-649155666, -511673724, 6, 1317605934, -374210810), (-1086778414, -417085962, 7, 904265696, 574407442), (-1061365195, 1799450094, 8, -1148931734, -1828672985), (1827813574, -1483409202, 9, 2087444136, -817363237)


statement ok
INSERT INTO `table_4` (`column_3`, `column_1`, `column_2`) VALUES (0, -79816910, 392213955), (1, -2029491773, 1903733493), (2, -515340539, 1496001750), (3, 2104387174, 364975285), (4, 921122749, 110789335), (5, -1245848004, 1625570817), (6, 1872980030, -212539179), (7, 1474234594, 577112586), (8, 1202787290, 1418849979), (9, 1148722714, -2136071874)


statement ok
INSERT INTO `table_5` (`column_2`, `column_3`, `column_1`) VALUES (-624403332, 0, 636328145), (-855852272, 1, 1393811084), (-236922473, 2, 1283368803), (-1439478178, 3, -1945526730), (394170086, 4, -1828676097), (301782356, 5, 1546775152), (-849607853, 6, 321325757), (-549252954, 7, -1774522685), (2107745647, 8, 2106136553), (-1559643751, 9, 385736742)


statement ok
INSERT INTO `table_3` (`column_2`, `column_5`, `column_1`, `column_3`, `column_4`) VALUES (1648016280, 0, -400494041, 476348331, -945650713), (-1954457673, 1, 1094038085, -471414768, 1822499316), (559028297, 2, -1210330789, -313038985, -348144675), (875466641, 3, -999407282, 727703849, 985548684), (-722124514, 4, 854259195, 2083554966, -2033287477), (488839834, 5, 1475724500, 1018666782, 508492599), (-1330248991, 6, 1078482460, 1460509897, -1752415464), (1494728779, 7, -991016450, 1193164879, -491893542), (1869397003, 8, 1037264481, 1135016131, -1962423138), (1711579347, 9, -417912604, -1241049181, -2108491650)


statement ok
INSERT INTO `table_1` (`column_4`, `column_3`, `column_5`, `column_2`, `column_1`) VALUES (-1761985938, 1438458526, 0, 1458536214, 1433690896), (-1455452126, 1101447764, 1, 866603978, -1953094155), (1020159261, 166594590, 2, 147992692, -756653560), (846971056, 729926579, 3, -1082087434, 1249371291), (2114928250, -1868638422, 4, 121305600, 1603804388), (1492089885, -1029811777, 5, 585554477, 1374091936), (1288699669, 1566757205, 6, 2137394049, 1832905509), (-834370239, -1912111943, 7, -157599986, 898440195), (-1257349685, 1296479337, 8, -331799908, -1623485700), (-1839004966, 1098501468, 9, -1678391222, 951490226)


query  rowsort
SELECT avg(distinct `table_1`.`column_1`) AS `alias_1` FROM `table_1`
----
501056102.6000

query  rowsort
SELECT `table_1`.`column_2` AS `alias_1`, `table_2`.`column_2` AS `alias_2` FROM `table_1` LEFT JOIN `table_2` ON (`table_1`.`column_1` = `table_2`.`column_1`)
----
-1082087434
NULL
-157599986
NULL
-1678391222
NULL
-331799908
NULL
121305600
NULL
1458536214
NULL
147992692
NULL
2137394049
NULL
585554477
NULL
866603978
NULL

query  rowsort
SELECT `table_1`.`column_2` AS `alias_1` FROM `table_1` WHERE (`table_1`.`column_2` > ?)
? = 10
----
121305600
1458536214
147992692
2137394049
585554477
866603978

query  rowsort
SELECT avg(distinct `table_1`.`column_3`) AS `alias_1`, `table_1`.`column_4` AS `alias_2`, `table_3`.`column_2` AS `alias_3` FROM `table_1` LEFT JOIN `table_3` ON (`table_1`.`column_2` = `table_3`.`column_1`) GROUP BY `table_1`.`column_4`, `table_3`.`column_2`
----
30 values hashing to 592a2f7a533e7957a22e44316cf9f450

query  rowsort
SELECT avg(distinct `table_3`.`column_3`) AS `alias_1` FROM `table_3` WHERE (`table_3`.`column_2` > ?)
? = 10
----
428115972.2857

query  rowsort
SELECT `table_3`.`column_4` AS `alias_1`, `table_4`.`column_2` AS `alias_2` FROM `table_3` LEFT JOIN `table_4` ON (`table_3`.`column_2` = `table_4`.`column_1`) WHERE (`table_3`.`column_2` > ?)
? = 10
----
-1962423138
NULL
-2108491650
NULL
-348144675
NULL
-491893542
NULL
-945650713
NULL
508492599
NULL
985548684
NULL

query  rowsort
SELECT avg(distinct `table_2`.`column_3`) AS `alias_1`, `table_2`.`column_4` AS `alias_2`, `table_5`.`column_2` AS `alias_3` FROM `table_2` LEFT JOIN `table_5` ON (`table_2`.`column_1` = `table_5`.`column_1`) WHERE (`table_2`.`column_2` > ?) GROUP BY `table_2`.`column_4`, `table_5`.`column_2`
? = 10
----
-1404188819.0000
-1376489333
NULL
-1443653709.0000
-1386256681
NULL
-817363237.0000
-1483409202
NULL
898775099.0000
-1219879663
NULL

statement ok
DELETE FROM `table_2` WHERE (`column_5` = 0)


statement ok
DELETE FROM `table_2` WHERE (`column_5` = 1)


statement ok
DELETE FROM `table_2` WHERE (`column_5` = 2)


statement ok
DELETE FROM `table_2` WHERE (`column_5` = 3)


statement ok
DELETE FROM `table_2` WHERE (`column_5` = 4)


statement ok
DELETE FROM `table_4` WHERE (`column_3` = 0)


statement ok
DELETE FROM `table_4` WHERE (`column_3` = 1)


statement ok
DELETE FROM `table_4` WHERE (`column_3` = 2)


statement ok
DELETE FROM `table_4` WHERE (`column_3` = 3)


statement ok
DELETE FROM `table_4` WHERE (`column_3` = 4)


statement ok
DELETE FROM `table_5` WHERE (`column_3` = 0)


statement ok
DELETE FROM `table_5` WHERE (`column_3` = 1)


statement ok
DELETE FROM `table_5` WHERE (`column_3` = 2)


statement ok
DELETE FROM `table_5` WHERE (`column_3` = 3)


statement ok
DELETE FROM `table_5` WHERE (`column_3` = 4)


statement ok
DELETE FROM `table_3` WHERE (`column_5` = 0)


statement ok
DELETE FROM `table_3` WHERE (`column_5` = 1)


statement ok
DELETE FROM `table_3` WHERE (`column_5` = 2)


statement ok
DELETE FROM `table_3` WHERE (`column_5` = 3)


statement ok
DELETE FROM `table_3` WHERE (`column_5` = 4)


statement ok
DELETE FROM `table_1` WHERE (`column_5` = 0)


statement ok
DELETE FROM `table_1` WHERE (`column_5` = 1)


statement ok
DELETE FROM `table_1` WHERE (`column_5` = 2)


statement ok
DELETE FROM `table_1` WHERE (`column_5` = 3)


statement ok
DELETE FROM `table_1` WHERE (`column_5` = 4)


query  rowsort
SELECT avg(distinct `table_1`.`column_1`) AS `alias_1` FROM `table_1`
----
686688433.2000

query  rowsort
SELECT `table_1`.`column_2` AS `alias_1`, `table_2`.`column_2` AS `alias_2` FROM `table_1` LEFT JOIN `table_2` ON (`table_1`.`column_1` = `table_2`.`column_1`)
----
-157599986
NULL
-1678391222
NULL
-331799908
NULL
2137394049
NULL
585554477
NULL

query  rowsort
SELECT `table_1`.`column_2` AS `alias_1` FROM `table_1` WHERE (`table_1`.`column_2` > ?)
? = 10
----
2137394049
585554477

query  rowsort
SELECT avg(distinct `table_1`.`column_3`) AS `alias_1`, `table_1`.`column_4` AS `alias_2`, `table_3`.`column_2` AS `alias_3` FROM `table_1` LEFT JOIN `table_3` ON (`table_1`.`column_2` = `table_3`.`column_1`) GROUP BY `table_1`.`column_4`, `table_3`.`column_2`
----
-1029811777.0000
1492089885
NULL
-1912111943.0000
-834370239
NULL
1098501468.0000
-1839004966
NULL
1296479337.0000
-1257349685
NULL
1566757205.0000
1288699669
NULL

query  rowsort
SELECT avg(distinct `table_3`.`column_3`) AS `alias_1` FROM `table_3` WHERE (`table_3`.`column_2` > ?)
? = 10
----
526449652.7500

query  rowsort
SELECT `table_3`.`column_4` AS `alias_1`, `table_4`.`column_2` AS `alias_2` FROM `table_3` LEFT JOIN `table_4` ON (`table_3`.`column_2` = `table_4`.`column_1`) WHERE (`table_3`.`column_2` > ?)
? = 10
----
-1962423138
NULL
-2108491650
NULL
-491893542
NULL
508492599
NULL

query  rowsort
SELECT avg(distinct `table_2`.`column_3`) AS `alias_1`, `table_2`.`column_4` AS `alias_2`, `table_5`.`column_2` AS `alias_3` FROM `table_2` LEFT JOIN `table_5` ON (`table_2`.`column_1` = `table_5`.`column_1`) WHERE (`table_2`.`column_2` > ?) GROUP BY `table_2`.`column_4`, `table_5`.`column_2`
? = 10
----
-1443653709.0000
-1386256681
NULL
-817363237.0000
-1483409202
NULL
