# Generated by:
#     target/debug/noria-logictest permute --compare-to mysql://root:noria@127.1/noria -d 3 -o logictests/generated/mysql/ --only range_param --random --include-deletes --rows-per-table 10 --subquery-depth 1 --overwrite-tests

statement ok
CREATE TABLE `table_1` (`column_4` INT, `column_3` INT, `column_5` INT, `column_2` INT, `column_1` INT, PRIMARY KEY (`column_5`))


statement ok
CREATE TABLE `table_4` (`column_2` INT, `column_3` INT, `column_1` INT, PRIMARY KEY (`column_3`))


statement ok
CREATE TABLE `table_3` (`column_2` INT, `column_3` INT, `column_1` INT, PRIMARY KEY (`column_3`))


statement ok
CREATE TABLE `table_2` (`column_7` INT, `column_3` INT, `column_2` INT, `column_1` INT, `column_5` INT, `column_6` INT, `column_4` INT, PRIMARY KEY (`column_7`))


statement ok
CREATE TABLE `table_5` (`column_2` INT, `column_1` INT, `column_3` INT, PRIMARY KEY (`column_3`))


statement ok
INSERT INTO `table_1` (`column_4`, `column_3`, `column_5`, `column_2`, `column_1`) VALUES (1841679065, -598953768, 0, -185940421, 119636023), (1779629286, -102001294, 1, -1857321447, 1501042350), (1510710278, 935801455, 2, 710939691, -180857981), (-55124431, -361421978, 3, 795438226, 1795918580), (-1561915540, -89915115, 4, 1261926590, -57462591), (-1404000182, 1482293752, 5, -1227532219, 852338136), (678145942, 437146168, 6, -178927090, -665971039), (1039172848, -1332176424, 7, 763609237, 232831302), (1501525587, 2125601346, 8, 1405896220, -836722816), (-1488565303, -485723756, 9, -1399651728, -1176682484)


statement ok
INSERT INTO `table_4` (`column_2`, `column_3`, `column_1`) VALUES (-1344719279, 0, -1829670773), (755745556, 1, -177917413), (624622270, 2, 461911379), (499797297, 3, -1159480113), (1604707400, 4, 778886710), (-1807423051, 5, 931057014), (1109465565, 6, 1143776042), (1409683669, 7, -1424294348), (-306937539, 8, 178068673), (613831785, 9, 1045092882)


statement ok
INSERT INTO `table_3` (`column_2`, `column_3`, `column_1`) VALUES (274260412, 0, 541021308), (1215543941, 1, 987902527), (-2145910645, 2, 1276542767), (2098482554, 3, -671890743), (1086821409, 4, -934823320), (-1430151659, 5, 1681679478), (631323029, 6, 662083156), (1802729844, 7, 1999669951), (-935154692, 8, -1590208381), (-27889166, 9, 1112082097)


statement ok
INSERT INTO `table_2` (`column_7`, `column_3`, `column_2`, `column_1`, `column_5`, `column_6`, `column_4`) VALUES (0, -1403471080, 1022744407, -621504376, -1221270688, 1552978800, -816983454), (1, 173283269, 872647133, 1435919221, 331893008, -1575953307, 1752934545), (2, 1722567823, -602522699, -1521588321, 1113006745, 247902041, 1216176623), (3, -1734201557, 763904879, 1623628252, -273443740, 485909967, -550337731), (4, 80404074, 527716160, -806359572, -267534147, -149394783, 1931342823), (5, 417031519, -1450516194, -1636081377, -251781131, 1750093165, 1262370947), (6, 1724141244, 1714486161, 2045232502, 1120388042, 1597401788, 593871779), (7, 915412554, -1327809738, 506477941, -217170178, -1766339979, 1644958807), (8, 134355780, 257690461, -1319491339, -730895658, -1356525221, -1571118957), (9, 2113739058, -1459405117, 365272092, -2020624244, 1451517379, 832539055)


statement ok
INSERT INTO `table_5` (`column_2`, `column_1`, `column_3`) VALUES (-810675167, 55387936, 0), (-511339232, -1205723751, 1), (789412681, -135229241, 2), (1819088041, 81191021, 3), (1972384417, -1367798075, 4), (56495358, -771134071, 5), (104348427, -1689862283, 6), (-209449716, -651890294, 7), (1740454759, 297093042, 8), (-1959040930, -592538846, 9)


query  rowsort
SELECT avg(distinct `table_1`.`column_1`) AS `alias_1` FROM `table_1`
----
158406948.0000

query  rowsort
SELECT `table_1`.`column_2` AS `alias_1`, `table_2`.`column_2` AS `alias_2` FROM `table_1` INNER JOIN `table_2` ON (`table_1`.`column_1` = `table_2`.`column_1`)
----


query  rowsort
SELECT `table_2`.`column_2` AS `alias_1` FROM `table_2` WHERE (`table_2`.`column_2` > ?)
? = 10
----
1022744407
1714486161
257690461
527716160
763904879
872647133

query  rowsort
SELECT avg(distinct `table_2`.`column_3`) AS `alias_1`, `table_2`.`column_4` AS `alias_2`, `table_3`.`column_2` AS `alias_3` FROM `table_2` INNER JOIN `table_3` ON (`table_2`.`column_2` = `table_3`.`column_1`) GROUP BY `table_2`.`column_4`, `table_3`.`column_2`
----


query  rowsort
SELECT avg(distinct `table_2`.`column_5`) AS `alias_1` FROM `table_2` WHERE (`table_2`.`column_3` > ?)
? = 10
----
-115339695.3750

query  rowsort
SELECT `table_2`.`column_6` AS `alias_1`, `table_4`.`column_2` AS `alias_2` FROM `table_2` INNER JOIN `table_4` ON (`table_2`.`column_3` = `table_4`.`column_1`) WHERE (`table_2`.`column_3` > ?)
? = 10
----


query  rowsort
SELECT avg(distinct `table_1`.`column_3`) AS `alias_1`, `table_1`.`column_4` AS `alias_2`, `table_5`.`column_2` AS `alias_3` FROM `table_1` INNER JOIN `table_5` ON (`table_1`.`column_3` = `table_5`.`column_1`) WHERE (`table_1`.`column_4` > ?) GROUP BY `table_1`.`column_4`, `table_5`.`column_2`
? = 10
----


statement ok
DELETE FROM `table_1` WHERE (`column_5` = 0)


statement ok
DELETE FROM `table_1` WHERE (`column_5` = 1)


statement ok
DELETE FROM `table_1` WHERE (`column_5` = 2)


statement ok
DELETE FROM `table_1` WHERE (`column_5` = 3)


statement ok
DELETE FROM `table_1` WHERE (`column_5` = 4)


statement ok
DELETE FROM `table_4` WHERE (`column_3` = 0)


statement ok
DELETE FROM `table_4` WHERE (`column_3` = 1)


statement ok
DELETE FROM `table_4` WHERE (`column_3` = 2)


statement ok
DELETE FROM `table_4` WHERE (`column_3` = 3)


statement ok
DELETE FROM `table_4` WHERE (`column_3` = 4)


statement ok
DELETE FROM `table_3` WHERE (`column_3` = 0)


statement ok
DELETE FROM `table_3` WHERE (`column_3` = 1)


statement ok
DELETE FROM `table_3` WHERE (`column_3` = 2)


statement ok
DELETE FROM `table_3` WHERE (`column_3` = 3)


statement ok
DELETE FROM `table_3` WHERE (`column_3` = 4)


statement ok
DELETE FROM `table_2` WHERE (`column_7` = 0)


statement ok
DELETE FROM `table_2` WHERE (`column_7` = 1)


statement ok
DELETE FROM `table_2` WHERE (`column_7` = 2)


statement ok
DELETE FROM `table_2` WHERE (`column_7` = 3)


statement ok
DELETE FROM `table_2` WHERE (`column_7` = 4)


statement ok
DELETE FROM `table_5` WHERE (`column_3` = 0)


statement ok
DELETE FROM `table_5` WHERE (`column_3` = 1)


statement ok
DELETE FROM `table_5` WHERE (`column_3` = 2)


statement ok
DELETE FROM `table_5` WHERE (`column_3` = 3)


statement ok
DELETE FROM `table_5` WHERE (`column_3` = 4)


query  rowsort
SELECT avg(distinct `table_1`.`column_1`) AS `alias_1` FROM `table_1`
----
-318841380.2000

query  rowsort
SELECT `table_1`.`column_2` AS `alias_1`, `table_2`.`column_2` AS `alias_2` FROM `table_1` INNER JOIN `table_2` ON (`table_1`.`column_1` = `table_2`.`column_1`)
----


query  rowsort
SELECT `table_2`.`column_2` AS `alias_1` FROM `table_2` WHERE (`table_2`.`column_2` > ?)
? = 10
----
1714486161
257690461

query  rowsort
SELECT avg(distinct `table_2`.`column_3`) AS `alias_1`, `table_2`.`column_4` AS `alias_2`, `table_3`.`column_2` AS `alias_3` FROM `table_2` INNER JOIN `table_3` ON (`table_2`.`column_2` = `table_3`.`column_1`) GROUP BY `table_2`.`column_4`, `table_3`.`column_2`
----


query  rowsort
SELECT avg(distinct `table_2`.`column_5`) AS `alias_1` FROM `table_2` WHERE (`table_2`.`column_3` > ?)
? = 10
----
-420016633.8000

query  rowsort
SELECT `table_2`.`column_6` AS `alias_1`, `table_4`.`column_2` AS `alias_2` FROM `table_2` INNER JOIN `table_4` ON (`table_2`.`column_3` = `table_4`.`column_1`) WHERE (`table_2`.`column_3` > ?)
? = 10
----


query  rowsort
SELECT avg(distinct `table_1`.`column_3`) AS `alias_1`, `table_1`.`column_4` AS `alias_2`, `table_5`.`column_2` AS `alias_3` FROM `table_1` INNER JOIN `table_5` ON (`table_1`.`column_3` = `table_5`.`column_1`) WHERE (`table_1`.`column_4` > ?) GROUP BY `table_1`.`column_4`, `table_5`.`column_2`
? = 10
----

