# Generated by:
#     target/debug/noria-logictest permute --compare-to mysql://root:noria@127.1/noria -d 3 -o logictests/generated/mysql/ --only range_param --random --include-deletes --rows-per-table 10 --subquery-depth 1 --overwrite-tests

statement ok
CREATE TABLE `table_1` (`column_2` INT, `column_1` INT, `column_3` INT, `column_5` INT, `column_4` INT, PRIMARY KEY (`column_5`))


statement ok
INSERT INTO `table_1` (`column_2`, `column_1`, `column_3`, `column_5`, `column_4`) VALUES (-981872887, 392697078, -1999040709, 0, -1816703694), (-1800713117, -814800622, -1123912106, 1, -552511670), (-1584736934, -2116917199, 519196735, 2, -640498514), (1190689009, -1817331306, -741827510, 3, 731155557), (887088644, 2139732381, 1935932935, 4, 799316768), (1322322770, -1852359013, 833980841, 5, 2046159513), (18398408, 943231807, -466732751, 6, -296690529), (716749031, -1419834320, 2011119365, 7, 75477454), (1433127495, -744433442, 988653124, 8, 2116399590), (-561951208, 1139791907, -1339934239, 9, -1589819983)


query  rowsort
SELECT avg(distinct `table_1`.`column_1`) AS `alias_1` FROM `table_1`
----
-415022272.9000

query  rowsort
SELECT `table_1`.`column_1` AS `alias_1` FROM `table_1` WHERE (`table_1`.`column_1` > ?)
? = 10
----
1139791907
2139732381
392697078
943231807

query  rowsort
SELECT `table_1`.`column_1` AS `alias_1` FROM `table_1` WHERE (`table_1`.`column_1` > ?)
? = 10
----
1139791907
2139732381
392697078
943231807

query  rowsort
SELECT avg(distinct `table_1`.`column_2`) AS `alias_1` FROM `table_1` WHERE (`table_1`.`column_2` > ?)
? = 10
----
928062559.5000

query  rowsort
SELECT avg(distinct `table_1`.`column_3`) AS `alias_1` FROM `table_1` WHERE (`table_1`.`column_2` > ?)
? = 10
----
760187667.3333

query  rowsort
SELECT `table_1`.`column_2` AS `alias_1` FROM `table_1` WHERE ((`table_1`.`column_2` > ?) AND (`table_1`.`column_2` > ?))
? = 10
? = 10
----
1190689009
1322322770
1433127495
18398408
716749031
887088644

query  rowsort
SELECT avg(distinct `table_1`.`column_4`) AS `alias_1` FROM `table_1` WHERE ((`table_1`.`column_2` > ?) AND (`table_1`.`column_2` > ?))
? = 10
? = 10
----
911969725.5000

statement ok
DELETE FROM `table_1` WHERE (`column_5` = 0)


statement ok
DELETE FROM `table_1` WHERE (`column_5` = 1)


statement ok
DELETE FROM `table_1` WHERE (`column_5` = 2)


statement ok
DELETE FROM `table_1` WHERE (`column_5` = 3)


statement ok
DELETE FROM `table_1` WHERE (`column_5` = 4)


query  rowsort
SELECT avg(distinct `table_1`.`column_1`) AS `alias_1` FROM `table_1`
----
-386720612.2000

query  rowsort
SELECT `table_1`.`column_1` AS `alias_1` FROM `table_1` WHERE (`table_1`.`column_1` > ?)
? = 10
----
1139791907
943231807

query  rowsort
SELECT `table_1`.`column_1` AS `alias_1` FROM `table_1` WHERE (`table_1`.`column_1` > ?)
? = 10
----
1139791907
943231807

query  rowsort
SELECT avg(distinct `table_1`.`column_2`) AS `alias_1` FROM `table_1` WHERE (`table_1`.`column_2` > ?)
? = 10
----
872649426.0000

query  rowsort
SELECT avg(distinct `table_1`.`column_3`) AS `alias_1` FROM `table_1` WHERE (`table_1`.`column_2` > ?)
? = 10
----
841755144.7500

query  rowsort
SELECT `table_1`.`column_2` AS `alias_1` FROM `table_1` WHERE ((`table_1`.`column_2` > ?) AND (`table_1`.`column_2` > ?))
? = 10
? = 10
----
1322322770
1433127495
18398408
716749031

query  rowsort
SELECT avg(distinct `table_1`.`column_4`) AS `alias_1` FROM `table_1` WHERE ((`table_1`.`column_2` > ?) AND (`table_1`.`column_2` > ?))
? = 10
? = 10
----
985336507.0000
