# Generated by:
#     target/debug/noria-logictest permute --compare-to mysql://root:noria@127.1/noria -d 3 -o logictests/generated/mysql/ --only range_param --random --include-deletes --rows-per-table 10 --subquery-depth 1 --overwrite-tests

statement ok
CREATE TABLE `table_1` (`column_3` INT, `column_8` INT, `column_4` INT, `column_5` INT, `column_1` INT, `column_9` INT, `column_6` INT, `column_7` INT, `column_2` INT, PRIMARY KEY (`column_9`))


statement ok
INSERT INTO `table_1` (`column_3`, `column_8`, `column_4`, `column_5`, `column_1`, `column_9`, `column_6`, `column_7`, `column_2`) VALUES (220065262, 382725903, 932399645, -1757732884, 1684076657, 0, -565094413, 554610549, 2118029349), (-104591168, 1385568616, -1140575347, 1039105335, 944289561, 1, 1953655045, -393242354, 2088539394), (1122843010, -681100696, 1452515857, -1163533232, 897250128, 2, -1426962156, 1989666675, 1889874546), (1194271075, -1049425887, 1565266664, 636993529, -1196897349, 3, -1203066852, -614132813, 1353921368), (2060132386, -1566827626, 980901291, -496041654, 1455428112, 4, -1621862302, 590708628, 1682167284), (1564122397, -335240693, 258425564, -1366852463, 985029955, 5, -1769233116, -1768635215, -1301327668), (-2013024118, 1239800220, 1144547940, 1505522672, -1693215774, 6, 183891922, 805236027, -202245527), (-1106050519, 1672050614, -352316548, 687422726, -346865966, 7, -1320521239, -1289777970, 1936418768), (2020075780, -279018317, 44277123, 1748115129, -154661389, 8, -1101553821, 1660705216, 732624612), (1823740799, 119634655, -2008299987, -877343950, -256284784, 9, -161903912, 1427683373, -849837472)


query  rowsort
SELECT avg(distinct `table_1`.`column_1`) AS `alias_1` FROM `table_1`
----
231814915.1000

query  rowsort
SELECT sum(`table_1`.`column_2`) AS `alias_1` FROM `table_1`
----
9448164654

query  rowsort
SELECT `table_1`.`column_1` AS `alias_1` FROM `table_1` WHERE (`table_1`.`column_1` > ?)
? = 10
----
1455428112
1684076657
897250128
944289561
985029955

query  rowsort
SELECT avg(distinct `table_1`.`column_3`) AS `alias_1`, sum(`table_1`.`column_4`) AS `alias_2` FROM `table_1`
----
678158490.4000
2877142202

query  rowsort
SELECT avg(distinct `table_1`.`column_5`) AS `alias_1` FROM `table_1` WHERE (`table_1`.`column_1` > ?)
? = 10
----
-749010979.6000

query  rowsort
SELECT sum(`table_1`.`column_6`) AS `alias_1` FROM `table_1` WHERE (`table_1`.`column_1` > ?)
? = 10
----
-3429496942

query  rowsort
SELECT avg(distinct `table_1`.`column_7`) AS `alias_1`, sum(`table_1`.`column_8`) AS `alias_2` FROM `table_1` WHERE (`table_1`.`column_3` > ?)
? = 10
----
548658059.0000
-3409252661

statement ok
DELETE FROM `table_1` WHERE (`column_9` = 0)


statement ok
DELETE FROM `table_1` WHERE (`column_9` = 1)


statement ok
DELETE FROM `table_1` WHERE (`column_9` = 2)


statement ok
DELETE FROM `table_1` WHERE (`column_9` = 3)


statement ok
DELETE FROM `table_1` WHERE (`column_9` = 4)


query  rowsort
SELECT avg(distinct `table_1`.`column_1`) AS `alias_1` FROM `table_1`
----
-293199591.6000

query  rowsort
SELECT sum(`table_1`.`column_2`) AS `alias_1` FROM `table_1`
----
315632713

query  rowsort
SELECT `table_1`.`column_1` AS `alias_1` FROM `table_1` WHERE (`table_1`.`column_1` > ?)
? = 10
----
985029955

query  rowsort
SELECT avg(distinct `table_1`.`column_3`) AS `alias_1`, sum(`table_1`.`column_4`) AS `alias_2` FROM `table_1`
----
457772867.8000
-913365908

query  rowsort
SELECT avg(distinct `table_1`.`column_5`) AS `alias_1` FROM `table_1` WHERE (`table_1`.`column_1` > ?)
? = 10
----
-1366852463.0000

query  rowsort
SELECT sum(`table_1`.`column_6`) AS `alias_1` FROM `table_1` WHERE (`table_1`.`column_1` > ?)
? = 10
----
-1769233116

query  rowsort
SELECT avg(distinct `table_1`.`column_7`) AS `alias_1`, sum(`table_1`.`column_8`) AS `alias_2` FROM `table_1` WHERE (`table_1`.`column_3` > ?)
? = 10
----
439917791.3333
-494624355
