# Generated by:
#     target/debug/noria-logictest permute --compare-to mysql://root:noria@127.1/noria -d 3 -o logictests/generated/mysql/ --only range_param --random --include-deletes --rows-per-table 10 --subquery-depth 1 --overwrite-tests

statement ok
CREATE TABLE `table_1` (`column_2` INT, `column_1` INT, PRIMARY KEY (`column_2`))


statement ok
INSERT INTO `table_1` (`column_2`, `column_1`) VALUES (0, 1221662829), (1, -1708946381), (2, -1499655272), (3, -2116759780), (4, -156921416), (5, -2088438952), (6, -567360636), (7, -2025118595), (8, 555671065), (9, 925768521)


query  rowsort
SELECT `table_1`.`column_1` AS `alias_1` FROM `table_1` WHERE `table_1`.`column_1` NOT BETWEEN 1 AND 5
----
-1499655272
-156921416
-1708946381
-2025118595
-2088438952
-2116759780
-567360636
1221662829
555671065
925768521

query  rowsort
SELECT `table_1`.`column_1` AS `alias_1` FROM `table_1` WHERE `table_1`.`column_1` BETWEEN 1 AND 5
----


query  rowsort
SELECT `table_1`.`column_1` AS `alias_1` FROM `table_1` WHERE `table_1`.`column_1` NOT BETWEEN 1 AND 5
----
-1499655272
-156921416
-1708946381
-2025118595
-2088438952
-2116759780
-567360636
1221662829
555671065
925768521

query  rowsort
SELECT `table_1`.`column_1` AS `alias_1` FROM `table_1` WHERE `table_1`.`column_1` BETWEEN 1 AND 5
----


query  rowsort
SELECT `table_1`.`column_1` AS `alias_1` FROM `table_1` WHERE (`table_1`.`column_1` > ?)
? = 10
----
1221662829
555671065
925768521

query  rowsort
SELECT `table_1`.`column_1` AS `alias_1`, `table_1`.`column_1` AS `alias_2` FROM `table_1` WHERE (`table_1`.`column_1` NOT BETWEEN 1 AND 5 AND `table_1`.`column_1` BETWEEN 1 AND 5)
----


query  rowsort
SELECT `table_1`.`column_1` AS `alias_1`, `table_1`.`column_1` AS `alias_2` FROM `table_1` WHERE (`table_1`.`column_1` NOT BETWEEN 1 AND 5 OR `table_1`.`column_1` NOT BETWEEN 1 AND 5)
----
-1499655272
-1499655272
-156921416
-156921416
-1708946381
-1708946381
-2025118595
-2025118595
-2088438952
-2088438952
-2116759780
-2116759780
-567360636
-567360636
1221662829
1221662829
555671065
555671065
925768521
925768521

query  rowsort
SELECT `table_1`.`column_1` AS `alias_1`, `table_1`.`column_1` AS `alias_2` FROM `table_1` WHERE (`table_1`.`column_1` NOT BETWEEN 1 AND 5 OR `table_1`.`column_1` BETWEEN 1 AND 5)
----
-1499655272
-1499655272
-156921416
-156921416
-1708946381
-1708946381
-2025118595
-2025118595
-2088438952
-2088438952
-2116759780
-2116759780
-567360636
-567360636
1221662829
1221662829
555671065
555671065
925768521
925768521

query  rowsort
SELECT `table_1`.`column_1` AS `alias_1` FROM `table_1` WHERE (`table_1`.`column_1` NOT BETWEEN 1 AND 5 AND (`table_1`.`column_1` > ?))
? = 10
----
1221662829
555671065
925768521

query  rowsort
SELECT `table_1`.`column_1` AS `alias_1`, `table_1`.`column_1` AS `alias_2` FROM `table_1` WHERE (`table_1`.`column_1` BETWEEN 1 AND 5 OR `table_1`.`column_1` NOT BETWEEN 1 AND 5)
----
-1499655272
-1499655272
-156921416
-156921416
-1708946381
-1708946381
-2025118595
-2025118595
-2088438952
-2088438952
-2116759780
-2116759780
-567360636
-567360636
1221662829
1221662829
555671065
555671065
925768521
925768521

query  rowsort
SELECT `table_1`.`column_1` AS `alias_1`, `table_1`.`column_1` AS `alias_2` FROM `table_1` WHERE (`table_1`.`column_1` BETWEEN 1 AND 5 OR `table_1`.`column_1` BETWEEN 1 AND 5)
----


query  rowsort
SELECT `table_1`.`column_1` AS `alias_1` FROM `table_1` WHERE (`table_1`.`column_1` BETWEEN 1 AND 5 AND (`table_1`.`column_1` > ?))
? = 10
----


query  rowsort
SELECT `table_1`.`column_1` AS `alias_1`, `table_1`.`column_1` AS `alias_2` FROM `table_1` WHERE (`table_1`.`column_1` NOT BETWEEN 1 AND 5 OR `table_1`.`column_1` BETWEEN 1 AND 5)
----
-1499655272
-1499655272
-156921416
-156921416
-1708946381
-1708946381
-2025118595
-2025118595
-2088438952
-2088438952
-2116759780
-2116759780
-567360636
-567360636
1221662829
1221662829
555671065
555671065
925768521
925768521

query  rowsort
SELECT `table_1`.`column_1` AS `alias_1` FROM `table_1` WHERE (`table_1`.`column_1` NOT BETWEEN 1 AND 5 AND (`table_1`.`column_1` > ?))
? = 10
----
1221662829
555671065
925768521

query  rowsort
SELECT `table_1`.`column_1` AS `alias_1` FROM `table_1` WHERE (`table_1`.`column_1` BETWEEN 1 AND 5 AND (`table_1`.`column_1` > ?))
? = 10
----


query  rowsort
SELECT `table_1`.`column_1` AS `alias_1`, `table_1`.`column_1` AS `alias_2`, `table_1`.`column_1` AS `alias_3` FROM `table_1` WHERE ((`table_1`.`column_1` NOT BETWEEN 1 AND 5 AND `table_1`.`column_1` BETWEEN 1 AND 5) OR `table_1`.`column_1` NOT BETWEEN 1 AND 5)
----
30 values hashing to fb958fbc6e858f1f5caaa1a5a60ebcb0

query  rowsort
SELECT `table_1`.`column_1` AS `alias_1`, `table_1`.`column_1` AS `alias_2`, `table_1`.`column_1` AS `alias_3` FROM `table_1` WHERE ((`table_1`.`column_1` NOT BETWEEN 1 AND 5 AND `table_1`.`column_1` BETWEEN 1 AND 5) OR `table_1`.`column_1` BETWEEN 1 AND 5)
----


query  rowsort
SELECT `table_1`.`column_1` AS `alias_1`, `table_1`.`column_1` AS `alias_2` FROM `table_1` WHERE ((`table_1`.`column_1` NOT BETWEEN 1 AND 5 AND `table_1`.`column_1` BETWEEN 1 AND 5) AND (`table_1`.`column_1` > ?))
? = 10
----


query  rowsort
SELECT `table_1`.`column_1` AS `alias_1`, `table_1`.`column_1` AS `alias_2`, `table_1`.`column_1` AS `alias_3` FROM `table_1` WHERE ((`table_1`.`column_1` NOT BETWEEN 1 AND 5 OR `table_1`.`column_1` NOT BETWEEN 1 AND 5) OR `table_1`.`column_1` BETWEEN 1 AND 5)
----
30 values hashing to fb958fbc6e858f1f5caaa1a5a60ebcb0

query  rowsort
SELECT `table_1`.`column_1` AS `alias_1`, `table_1`.`column_1` AS `alias_2` FROM `table_1` WHERE ((`table_1`.`column_1` NOT BETWEEN 1 AND 5 OR `table_1`.`column_1` NOT BETWEEN 1 AND 5) AND (`table_1`.`column_1` > ?))
? = 10
----
1221662829
1221662829
555671065
555671065
925768521
925768521

query  rowsort
SELECT `table_1`.`column_1` AS `alias_1`, `table_1`.`column_1` AS `alias_2` FROM `table_1` WHERE ((`table_1`.`column_1` NOT BETWEEN 1 AND 5 OR `table_1`.`column_1` BETWEEN 1 AND 5) AND (`table_1`.`column_1` > ?))
? = 10
----
1221662829
1221662829
555671065
555671065
925768521
925768521

query  rowsort
SELECT `table_1`.`column_1` AS `alias_1`, `table_1`.`column_1` AS `alias_2`, `table_1`.`column_1` AS `alias_3` FROM `table_1` WHERE ((`table_1`.`column_1` BETWEEN 1 AND 5 OR `table_1`.`column_1` NOT BETWEEN 1 AND 5) OR `table_1`.`column_1` BETWEEN 1 AND 5)
----
30 values hashing to fb958fbc6e858f1f5caaa1a5a60ebcb0

query  rowsort
SELECT `table_1`.`column_1` AS `alias_1`, `table_1`.`column_1` AS `alias_2` FROM `table_1` WHERE ((`table_1`.`column_1` BETWEEN 1 AND 5 OR `table_1`.`column_1` NOT BETWEEN 1 AND 5) AND (`table_1`.`column_1` > ?))
? = 10
----
1221662829
1221662829
555671065
555671065
925768521
925768521

query  rowsort
SELECT `table_1`.`column_1` AS `alias_1`, `table_1`.`column_1` AS `alias_2` FROM `table_1` WHERE ((`table_1`.`column_1` BETWEEN 1 AND 5 OR `table_1`.`column_1` BETWEEN 1 AND 5) AND (`table_1`.`column_1` > ?))
? = 10
----


query  rowsort
SELECT `table_1`.`column_1` AS `alias_1`, `table_1`.`column_1` AS `alias_2` FROM `table_1` WHERE ((`table_1`.`column_1` NOT BETWEEN 1 AND 5 OR `table_1`.`column_1` BETWEEN 1 AND 5) AND (`table_1`.`column_1` > ?))
? = 10
----
1221662829
1221662829
555671065
555671065
925768521
925768521

query  rowsort
SELECT `table_1`.`column_1` AS `alias_1`, `table_1`.`column_1` AS `alias_2`, `table_1`.`column_1` AS `alias_3`, `table_1`.`column_1` AS `alias_4` FROM `table_1` WHERE (((`table_1`.`column_1` NOT BETWEEN 1 AND 5 AND `table_1`.`column_1` BETWEEN 1 AND 5) OR `table_1`.`column_1` NOT BETWEEN 1 AND 5) OR `table_1`.`column_1` BETWEEN 1 AND 5)
----
40 values hashing to 43bac4b1c3cce248d56c76ece58bf753

query  rowsort
SELECT `table_1`.`column_1` AS `alias_1`, `table_1`.`column_1` AS `alias_2`, `table_1`.`column_1` AS `alias_3` FROM `table_1` WHERE (((`table_1`.`column_1` NOT BETWEEN 1 AND 5 AND `table_1`.`column_1` BETWEEN 1 AND 5) OR `table_1`.`column_1` NOT BETWEEN 1 AND 5) AND (`table_1`.`column_1` > ?))
? = 10
----
1221662829
1221662829
1221662829
555671065
555671065
555671065
925768521
925768521
925768521

query  rowsort
SELECT `table_1`.`column_1` AS `alias_1`, `table_1`.`column_1` AS `alias_2`, `table_1`.`column_1` AS `alias_3` FROM `table_1` WHERE (((`table_1`.`column_1` NOT BETWEEN 1 AND 5 AND `table_1`.`column_1` BETWEEN 1 AND 5) OR `table_1`.`column_1` BETWEEN 1 AND 5) AND (`table_1`.`column_1` > ?))
? = 10
----


query  rowsort
SELECT `table_1`.`column_1` AS `alias_1`, `table_1`.`column_1` AS `alias_2`, `table_1`.`column_1` AS `alias_3` FROM `table_1` WHERE (((`table_1`.`column_1` NOT BETWEEN 1 AND 5 OR `table_1`.`column_1` NOT BETWEEN 1 AND 5) OR `table_1`.`column_1` BETWEEN 1 AND 5) AND (`table_1`.`column_1` > ?))
? = 10
----
1221662829
1221662829
1221662829
555671065
555671065
555671065
925768521
925768521
925768521

query  rowsort
SELECT `table_1`.`column_1` AS `alias_1`, `table_1`.`column_1` AS `alias_2`, `table_1`.`column_1` AS `alias_3` FROM `table_1` WHERE (((`table_1`.`column_1` BETWEEN 1 AND 5 OR `table_1`.`column_1` NOT BETWEEN 1 AND 5) OR `table_1`.`column_1` BETWEEN 1 AND 5) AND (`table_1`.`column_1` > ?))
? = 10
----
1221662829
1221662829
1221662829
555671065
555671065
555671065
925768521
925768521
925768521

query  rowsort
SELECT `table_1`.`column_1` AS `alias_1`, `table_1`.`column_1` AS `alias_2`, `table_1`.`column_1` AS `alias_3`, `table_1`.`column_1` AS `alias_4` FROM `table_1` WHERE ((((`table_1`.`column_1` NOT BETWEEN 1 AND 5 AND `table_1`.`column_1` BETWEEN 1 AND 5) OR `table_1`.`column_1` NOT BETWEEN 1 AND 5) OR `table_1`.`column_1` BETWEEN 1 AND 5) AND (`table_1`.`column_1` > ?))
? = 10
----
1221662829
1221662829
1221662829
1221662829
555671065
555671065
555671065
555671065
925768521
925768521
925768521
925768521

statement ok
DELETE FROM `table_1` WHERE (`column_2` = 0)


statement ok
DELETE FROM `table_1` WHERE (`column_2` = 1)


statement ok
DELETE FROM `table_1` WHERE (`column_2` = 2)


statement ok
DELETE FROM `table_1` WHERE (`column_2` = 3)


statement ok
DELETE FROM `table_1` WHERE (`column_2` = 4)


query  rowsort
SELECT `table_1`.`column_1` AS `alias_1` FROM `table_1` WHERE `table_1`.`column_1` NOT BETWEEN 1 AND 5
----
-2025118595
-2088438952
-567360636
555671065
925768521

query  rowsort
SELECT `table_1`.`column_1` AS `alias_1` FROM `table_1` WHERE `table_1`.`column_1` BETWEEN 1 AND 5
----


query  rowsort
SELECT `table_1`.`column_1` AS `alias_1` FROM `table_1` WHERE `table_1`.`column_1` NOT BETWEEN 1 AND 5
----
-2025118595
-2088438952
-567360636
555671065
925768521

query  rowsort
SELECT `table_1`.`column_1` AS `alias_1` FROM `table_1` WHERE `table_1`.`column_1` BETWEEN 1 AND 5
----


query  rowsort
SELECT `table_1`.`column_1` AS `alias_1` FROM `table_1` WHERE (`table_1`.`column_1` > ?)
? = 10
----
555671065
925768521

query  rowsort
SELECT `table_1`.`column_1` AS `alias_1`, `table_1`.`column_1` AS `alias_2` FROM `table_1` WHERE (`table_1`.`column_1` NOT BETWEEN 1 AND 5 AND `table_1`.`column_1` BETWEEN 1 AND 5)
----


query  rowsort
SELECT `table_1`.`column_1` AS `alias_1`, `table_1`.`column_1` AS `alias_2` FROM `table_1` WHERE (`table_1`.`column_1` NOT BETWEEN 1 AND 5 OR `table_1`.`column_1` NOT BETWEEN 1 AND 5)
----
-2025118595
-2025118595
-2088438952
-2088438952
-567360636
-567360636
555671065
555671065
925768521
925768521

query  rowsort
SELECT `table_1`.`column_1` AS `alias_1`, `table_1`.`column_1` AS `alias_2` FROM `table_1` WHERE (`table_1`.`column_1` NOT BETWEEN 1 AND 5 OR `table_1`.`column_1` BETWEEN 1 AND 5)
----
-2025118595
-2025118595
-2088438952
-2088438952
-567360636
-567360636
555671065
555671065
925768521
925768521

query  rowsort
SELECT `table_1`.`column_1` AS `alias_1` FROM `table_1` WHERE (`table_1`.`column_1` NOT BETWEEN 1 AND 5 AND (`table_1`.`column_1` > ?))
? = 10
----
555671065
925768521

query  rowsort
SELECT `table_1`.`column_1` AS `alias_1`, `table_1`.`column_1` AS `alias_2` FROM `table_1` WHERE (`table_1`.`column_1` BETWEEN 1 AND 5 OR `table_1`.`column_1` NOT BETWEEN 1 AND 5)
----
-2025118595
-2025118595
-2088438952
-2088438952
-567360636
-567360636
555671065
555671065
925768521
925768521

query  rowsort
SELECT `table_1`.`column_1` AS `alias_1`, `table_1`.`column_1` AS `alias_2` FROM `table_1` WHERE (`table_1`.`column_1` BETWEEN 1 AND 5 OR `table_1`.`column_1` BETWEEN 1 AND 5)
----


query  rowsort
SELECT `table_1`.`column_1` AS `alias_1` FROM `table_1` WHERE (`table_1`.`column_1` BETWEEN 1 AND 5 AND (`table_1`.`column_1` > ?))
? = 10
----


query  rowsort
SELECT `table_1`.`column_1` AS `alias_1`, `table_1`.`column_1` AS `alias_2` FROM `table_1` WHERE (`table_1`.`column_1` NOT BETWEEN 1 AND 5 OR `table_1`.`column_1` BETWEEN 1 AND 5)
----
-2025118595
-2025118595
-2088438952
-2088438952
-567360636
-567360636
555671065
555671065
925768521
925768521

query  rowsort
SELECT `table_1`.`column_1` AS `alias_1` FROM `table_1` WHERE (`table_1`.`column_1` NOT BETWEEN 1 AND 5 AND (`table_1`.`column_1` > ?))
? = 10
----
555671065
925768521

query  rowsort
SELECT `table_1`.`column_1` AS `alias_1` FROM `table_1` WHERE (`table_1`.`column_1` BETWEEN 1 AND 5 AND (`table_1`.`column_1` > ?))
? = 10
----


query  rowsort
SELECT `table_1`.`column_1` AS `alias_1`, `table_1`.`column_1` AS `alias_2`, `table_1`.`column_1` AS `alias_3` FROM `table_1` WHERE ((`table_1`.`column_1` NOT BETWEEN 1 AND 5 AND `table_1`.`column_1` BETWEEN 1 AND 5) OR `table_1`.`column_1` NOT BETWEEN 1 AND 5)
----
-2025118595
-2025118595
-2025118595
-2088438952
-2088438952
-2088438952
-567360636
-567360636
-567360636
555671065
555671065
555671065
925768521
925768521
925768521

query  rowsort
SELECT `table_1`.`column_1` AS `alias_1`, `table_1`.`column_1` AS `alias_2`, `table_1`.`column_1` AS `alias_3` FROM `table_1` WHERE ((`table_1`.`column_1` NOT BETWEEN 1 AND 5 AND `table_1`.`column_1` BETWEEN 1 AND 5) OR `table_1`.`column_1` BETWEEN 1 AND 5)
----


query  rowsort
SELECT `table_1`.`column_1` AS `alias_1`, `table_1`.`column_1` AS `alias_2` FROM `table_1` WHERE ((`table_1`.`column_1` NOT BETWEEN 1 AND 5 AND `table_1`.`column_1` BETWEEN 1 AND 5) AND (`table_1`.`column_1` > ?))
? = 10
----


query  rowsort
SELECT `table_1`.`column_1` AS `alias_1`, `table_1`.`column_1` AS `alias_2`, `table_1`.`column_1` AS `alias_3` FROM `table_1` WHERE ((`table_1`.`column_1` NOT BETWEEN 1 AND 5 OR `table_1`.`column_1` NOT BETWEEN 1 AND 5) OR `table_1`.`column_1` BETWEEN 1 AND 5)
----
-2025118595
-2025118595
-2025118595
-2088438952
-2088438952
-2088438952
-567360636
-567360636
-567360636
555671065
555671065
555671065
925768521
925768521
925768521

query  rowsort
SELECT `table_1`.`column_1` AS `alias_1`, `table_1`.`column_1` AS `alias_2` FROM `table_1` WHERE ((`table_1`.`column_1` NOT BETWEEN 1 AND 5 OR `table_1`.`column_1` NOT BETWEEN 1 AND 5) AND (`table_1`.`column_1` > ?))
? = 10
----
555671065
555671065
925768521
925768521

query  rowsort
SELECT `table_1`.`column_1` AS `alias_1`, `table_1`.`column_1` AS `alias_2` FROM `table_1` WHERE ((`table_1`.`column_1` NOT BETWEEN 1 AND 5 OR `table_1`.`column_1` BETWEEN 1 AND 5) AND (`table_1`.`column_1` > ?))
? = 10
----
555671065
555671065
925768521
925768521

query  rowsort
SELECT `table_1`.`column_1` AS `alias_1`, `table_1`.`column_1` AS `alias_2`, `table_1`.`column_1` AS `alias_3` FROM `table_1` WHERE ((`table_1`.`column_1` BETWEEN 1 AND 5 OR `table_1`.`column_1` NOT BETWEEN 1 AND 5) OR `table_1`.`column_1` BETWEEN 1 AND 5)
----
-2025118595
-2025118595
-2025118595
-2088438952
-2088438952
-2088438952
-567360636
-567360636
-567360636
555671065
555671065
555671065
925768521
925768521
925768521

query  rowsort
SELECT `table_1`.`column_1` AS `alias_1`, `table_1`.`column_1` AS `alias_2` FROM `table_1` WHERE ((`table_1`.`column_1` BETWEEN 1 AND 5 OR `table_1`.`column_1` NOT BETWEEN 1 AND 5) AND (`table_1`.`column_1` > ?))
? = 10
----
555671065
555671065
925768521
925768521

query  rowsort
SELECT `table_1`.`column_1` AS `alias_1`, `table_1`.`column_1` AS `alias_2` FROM `table_1` WHERE ((`table_1`.`column_1` BETWEEN 1 AND 5 OR `table_1`.`column_1` BETWEEN 1 AND 5) AND (`table_1`.`column_1` > ?))
? = 10
----


query  rowsort
SELECT `table_1`.`column_1` AS `alias_1`, `table_1`.`column_1` AS `alias_2` FROM `table_1` WHERE ((`table_1`.`column_1` NOT BETWEEN 1 AND 5 OR `table_1`.`column_1` BETWEEN 1 AND 5) AND (`table_1`.`column_1` > ?))
? = 10
----
555671065
555671065
925768521
925768521

query  rowsort
SELECT `table_1`.`column_1` AS `alias_1`, `table_1`.`column_1` AS `alias_2`, `table_1`.`column_1` AS `alias_3`, `table_1`.`column_1` AS `alias_4` FROM `table_1` WHERE (((`table_1`.`column_1` NOT BETWEEN 1 AND 5 AND `table_1`.`column_1` BETWEEN 1 AND 5) OR `table_1`.`column_1` NOT BETWEEN 1 AND 5) OR `table_1`.`column_1` BETWEEN 1 AND 5)
----
-2025118595
-2025118595
-2025118595
-2025118595
-2088438952
-2088438952
-2088438952
-2088438952
-567360636
-567360636
-567360636
-567360636
555671065
555671065
555671065
555671065
925768521
925768521
925768521
925768521

query  rowsort
SELECT `table_1`.`column_1` AS `alias_1`, `table_1`.`column_1` AS `alias_2`, `table_1`.`column_1` AS `alias_3` FROM `table_1` WHERE (((`table_1`.`column_1` NOT BETWEEN 1 AND 5 AND `table_1`.`column_1` BETWEEN 1 AND 5) OR `table_1`.`column_1` NOT BETWEEN 1 AND 5) AND (`table_1`.`column_1` > ?))
? = 10
----
555671065
555671065
555671065
925768521
925768521
925768521

query  rowsort
SELECT `table_1`.`column_1` AS `alias_1`, `table_1`.`column_1` AS `alias_2`, `table_1`.`column_1` AS `alias_3` FROM `table_1` WHERE (((`table_1`.`column_1` NOT BETWEEN 1 AND 5 AND `table_1`.`column_1` BETWEEN 1 AND 5) OR `table_1`.`column_1` BETWEEN 1 AND 5) AND (`table_1`.`column_1` > ?))
? = 10
----


query  rowsort
SELECT `table_1`.`column_1` AS `alias_1`, `table_1`.`column_1` AS `alias_2`, `table_1`.`column_1` AS `alias_3` FROM `table_1` WHERE (((`table_1`.`column_1` NOT BETWEEN 1 AND 5 OR `table_1`.`column_1` NOT BETWEEN 1 AND 5) OR `table_1`.`column_1` BETWEEN 1 AND 5) AND (`table_1`.`column_1` > ?))
? = 10
----
555671065
555671065
555671065
925768521
925768521
925768521

query  rowsort
SELECT `table_1`.`column_1` AS `alias_1`, `table_1`.`column_1` AS `alias_2`, `table_1`.`column_1` AS `alias_3` FROM `table_1` WHERE (((`table_1`.`column_1` BETWEEN 1 AND 5 OR `table_1`.`column_1` NOT BETWEEN 1 AND 5) OR `table_1`.`column_1` BETWEEN 1 AND 5) AND (`table_1`.`column_1` > ?))
? = 10
----
555671065
555671065
555671065
925768521
925768521
925768521

query  rowsort
SELECT `table_1`.`column_1` AS `alias_1`, `table_1`.`column_1` AS `alias_2`, `table_1`.`column_1` AS `alias_3`, `table_1`.`column_1` AS `alias_4` FROM `table_1` WHERE ((((`table_1`.`column_1` NOT BETWEEN 1 AND 5 AND `table_1`.`column_1` BETWEEN 1 AND 5) OR `table_1`.`column_1` NOT BETWEEN 1 AND 5) OR `table_1`.`column_1` BETWEEN 1 AND 5) AND (`table_1`.`column_1` > ?))
? = 10
----
555671065
555671065
555671065
555671065
925768521
925768521
925768521
925768521
