# Generated by:
#     target/debug/noria-logictest permute --compare-to mysql://root:noria@127.1/noria -d 3 -o logictests/generated/mysql/ --only range_param --random --include-deletes --rows-per-table 10 --subquery-depth 1 --overwrite-tests

statement ok
CREATE TABLE `table_1` (`column_6` INT, `column_12` INT, `column_3` INT, `column_2` INT, `column_8` INT, `column_11` INT, `column_9` INT, `column_5` INT, `column_7` INT, `column_4` INT, `column_1` INT, `column_13` INT, `column_10` INT, PRIMARY KEY (`column_13`))


statement ok
INSERT INTO `table_1` (`column_6`, `column_12`, `column_3`, `column_2`, `column_8`, `column_11`, `column_9`, `column_5`, `column_7`, `column_4`, `column_1`, `column_13`, `column_10`) VALUES (1790586720, -1942816801, 1084306630, -742365037, 1995389843, -410329688, -2821445, -450698757, 261133198, 67813142, 673317178, 0, 959049563), (1931870062, -899884759, -122320274, -1324437219, 687428373, 1816150935, 136967458, 152525477, -138056739, -747284811, 264232382, 1, 687182078), (-67073199, 589052256, 1677706572, -1282906633, -1467332566, -1233467029, 600763266, 1590185381, -595410812, -2061496761, 536443339, 2, -179689987), (-1794539989, -291781298, 1961864287, -1629412159, 339356177, -1256786167, 312322055, -1098657484, 825974281, -788054975, 908626682, 3, -1980411664), (-1912388897, 128711968, 1002629621, 1775750408, -1034753501, 1822956534, 1797387360, 1370362894, -723263214, -1711371857, -1377139326, 4, 1487449073), (-1637996135, -795631617, 64819099, -969209658, -1290023603, -1928223201, 964143576, -534518784, -842203653, 1293352846, 125001507, 5, -1910673746), (201488276, -1144593504, 473622383, -1361833077, -1866039578, -911153745, 1480349011, 604309376, -1994183107, 1722152835, -1852255423, 6, 693018675), (697812811, -933564097, -451214467, 302625471, 68600653, -740824555, 70992179, 784498017, -1767581652, 40101084, -1116080045, 7, 1138399897), (-947918248, 345598402, 778882778, -556254980, -1780923799, -1110978244, 1634343610, 1546977672, 412050326, -1206727530, 191369318, 8, -763080651), (653340156, -1186735921, 1987809575, 1898996050, -221000825, -1978067590, 1049695510, 1609883055, 928750599, 2115237718, -1199142303, 9, -123749995)


query  rowsort
SELECT count(distinct `table_1`.`column_1`) AS `alias_1` FROM `table_1` INNER JOIN (SELECT count(distinct `table_1`.`column_2`) AS `alias_2` FROM `table_1`) AS alias_3 ON (`table_1`.`column_1` = `alias_3`.`alias_2`)
----
0

query  rowsort
SELECT count(distinct `table_1`.`column_3`) AS `alias_1` FROM `table_1` INNER JOIN (SELECT `table_1`.`column_1` AS `alias_2` FROM `table_1`) AS alias_3 ON (`table_1`.`column_1` = `alias_3`.`alias_2`)
----
10

query  rowsort
SELECT count(distinct `table_1`.`column_4`) AS `alias_1` FROM `table_1` INNER JOIN (SELECT count(distinct `table_1`.`column_5`) AS `alias_2` FROM `table_1`) AS alias_3 ON (`table_1`.`column_5` = `alias_3`.`alias_2`)
----
0

query  rowsort
SELECT `table_1`.`column_6` AS `alias_3` FROM `table_1` INNER JOIN (SELECT count(distinct `table_1`.`column_6`) AS `alias_1` FROM `table_1`) AS alias_2 ON (`table_1`.`column_6` = `alias_2`.`alias_1`) WHERE (`table_1`.`column_5` > ?)
? = 10
----


query  rowsort
SELECT `table_1`.`column_6` AS `alias_3` FROM `table_1` INNER JOIN (SELECT `table_1`.`column_6` AS `alias_1` FROM `table_1`) AS alias_2 ON (`table_1`.`column_6` = `alias_2`.`alias_1`) WHERE (`table_1`.`column_6` > ?)
? = 10
----
1790586720
1931870062
201488276
653340156
697812811

query  rowsort
SELECT `table_1`.`column_6` AS `alias_3` FROM `table_1` INNER JOIN (SELECT count(distinct `table_1`.`column_7`) AS `alias_1` FROM `table_1`) AS alias_2 ON (`table_1`.`column_6` = `alias_2`.`alias_1`) WHERE (`table_1`.`column_6` > ?)
? = 10
----


query  rowsort
SELECT count(distinct `table_1`.`column_8`) AS `alias_1` FROM `table_1` INNER JOIN (SELECT count(distinct `table_1`.`column_9`) AS `alias_2` FROM `table_1`) AS alias_3 ON (`table_1`.`column_6` = `alias_3`.`alias_2`) WHERE (`table_1`.`column_6` > ?)
? = 10
----
0

query  rowsort
SELECT count(distinct `table_1`.`column_10`) AS `alias_1` FROM `table_1` INNER JOIN (SELECT `table_1`.`column_6` AS `alias_2` FROM `table_1`) AS alias_3 ON (`table_1`.`column_6` = `alias_3`.`alias_2`) WHERE (`table_1`.`column_6` > ?)
? = 10
----
5

query  rowsort
SELECT count(distinct `table_1`.`column_11`) AS `alias_1` FROM `table_1` INNER JOIN (SELECT count(distinct `table_1`.`column_12`) AS `alias_2` FROM `table_1`) AS alias_3 ON (`table_1`.`column_6` = `alias_3`.`alias_2`) WHERE (`table_1`.`column_6` > ?)
? = 10
----
0

statement ok
DELETE FROM `table_1` WHERE (`column_13` = 0)


statement ok
DELETE FROM `table_1` WHERE (`column_13` = 1)


statement ok
DELETE FROM `table_1` WHERE (`column_13` = 2)


statement ok
DELETE FROM `table_1` WHERE (`column_13` = 3)


statement ok
DELETE FROM `table_1` WHERE (`column_13` = 4)


query  rowsort
SELECT count(distinct `table_1`.`column_1`) AS `alias_1` FROM `table_1` INNER JOIN (SELECT count(distinct `table_1`.`column_2`) AS `alias_2` FROM `table_1`) AS alias_3 ON (`table_1`.`column_1` = `alias_3`.`alias_2`)
----
0

query  rowsort
SELECT count(distinct `table_1`.`column_3`) AS `alias_1` FROM `table_1` INNER JOIN (SELECT `table_1`.`column_1` AS `alias_2` FROM `table_1`) AS alias_3 ON (`table_1`.`column_1` = `alias_3`.`alias_2`)
----
5

query  rowsort
SELECT count(distinct `table_1`.`column_4`) AS `alias_1` FROM `table_1` INNER JOIN (SELECT count(distinct `table_1`.`column_5`) AS `alias_2` FROM `table_1`) AS alias_3 ON (`table_1`.`column_5` = `alias_3`.`alias_2`)
----
0

query  rowsort
SELECT `table_1`.`column_6` AS `alias_3` FROM `table_1` INNER JOIN (SELECT count(distinct `table_1`.`column_6`) AS `alias_1` FROM `table_1`) AS alias_2 ON (`table_1`.`column_6` = `alias_2`.`alias_1`) WHERE (`table_1`.`column_5` > ?)
? = 10
----


query  rowsort
SELECT `table_1`.`column_6` AS `alias_3` FROM `table_1` INNER JOIN (SELECT `table_1`.`column_6` AS `alias_1` FROM `table_1`) AS alias_2 ON (`table_1`.`column_6` = `alias_2`.`alias_1`) WHERE (`table_1`.`column_6` > ?)
? = 10
----
201488276
653340156
697812811

query  rowsort
SELECT `table_1`.`column_6` AS `alias_3` FROM `table_1` INNER JOIN (SELECT count(distinct `table_1`.`column_7`) AS `alias_1` FROM `table_1`) AS alias_2 ON (`table_1`.`column_6` = `alias_2`.`alias_1`) WHERE (`table_1`.`column_6` > ?)
? = 10
----


query  rowsort
SELECT count(distinct `table_1`.`column_8`) AS `alias_1` FROM `table_1` INNER JOIN (SELECT count(distinct `table_1`.`column_9`) AS `alias_2` FROM `table_1`) AS alias_3 ON (`table_1`.`column_6` = `alias_3`.`alias_2`) WHERE (`table_1`.`column_6` > ?)
? = 10
----
0

query  rowsort
SELECT count(distinct `table_1`.`column_10`) AS `alias_1` FROM `table_1` INNER JOIN (SELECT `table_1`.`column_6` AS `alias_2` FROM `table_1`) AS alias_3 ON (`table_1`.`column_6` = `alias_3`.`alias_2`) WHERE (`table_1`.`column_6` > ?)
? = 10
----
3

query  rowsort
SELECT count(distinct `table_1`.`column_11`) AS `alias_1` FROM `table_1` INNER JOIN (SELECT count(distinct `table_1`.`column_12`) AS `alias_2` FROM `table_1`) AS alias_3 ON (`table_1`.`column_6` = `alias_3`.`alias_2`) WHERE (`table_1`.`column_6` > ?)
? = 10
----
0
