# Generated by:
#     target/debug/noria-logictest permute --compare-to mysql://root:noria@127.1/noria -d 3 -o logictests/generated/mysql/ --only range_param --random --include-deletes --rows-per-table 10 --subquery-depth 1 --overwrite-tests

statement ok
CREATE TABLE `table_1` (`column_7` INT, `column_6` INT, `column_3` INT, `column_1` INT, `column_8` INT, `column_9` INT, `column_4` INT, `column_2` INT, `column_5` INT, PRIMARY KEY (`column_9`))


statement ok
INSERT INTO `table_1` (`column_7`, `column_6`, `column_3`, `column_1`, `column_8`, `column_9`, `column_4`, `column_2`, `column_5`) VALUES (-579485046, -1536059786, 1248524750, 963323803, -1972168625, 0, -1524147881, -728661140, 757616380), (-134751750, 2125907128, -1889676873, 679249603, 62732578, 1, -1750623403, -1512127323, 2045208614), (1449102487, 1609308262, 1942207941, -1246265014, -1403951152, 2, 1030053338, -962766140, -1704571100), (-975361085, -1034530499, -1599748368, -386950650, -398995895, 3, 464486737, -441476354, 1765078999), (1291285309, 74479089, 971598760, 11333678, 956509704, 4, -1451750692, -1005234201, -614541241), (1361652097, 1715663354, 1935864973, 329284514, -1651818099, 5, -1800320570, 849462260, 1517119207), (2132683467, -2036666362, -1390514826, -685982906, 2053397904, 6, 2012982982, 2089098812, -458559792), (-759480758, 1710354758, 470267085, 1388311022, 1507752001, 7, 2066791673, -1492747794, 1828881178), (1511550424, -1125804880, -212533297, -1615938328, 1820520501, 8, -1357422661, -2050099855, -833421379), (1574308412, 1798423684, 1200669460, 235145855, 574967904, 9, -239453779, -1321542928, 34415885)


query  rowsort
SELECT count(distinct `table_1`.`column_1`) AS `alias_1` FROM `table_1`
----
10

query  rowsort
SELECT sum(`table_1`.`column_2`) AS `alias_1` FROM `table_1`
----
-6576094663

query  rowsort
SELECT `table_1`.`column_1` AS `alias_1` FROM `table_1` WHERE (`table_1`.`column_1` > ?)
? = 10
----
11333678
1388311022
235145855
329284514
679249603
963323803

query  rowsort
SELECT count(distinct `table_1`.`column_3`) AS `alias_1`, sum(`table_1`.`column_4`) AS `alias_2` FROM `table_1`
----
10
-2549404256

query  rowsort
SELECT count(distinct `table_1`.`column_5`) AS `alias_1` FROM `table_1` WHERE (`table_1`.`column_5` > ?)
? = 10
----
6

query  rowsort
SELECT sum(`table_1`.`column_6`) AS `alias_1` FROM `table_1` WHERE (`table_1`.`column_5` > ?)
? = 10
----
4779758639

query  rowsort
SELECT count(distinct `table_1`.`column_7`) AS `alias_1`, sum(`table_1`.`column_8`) AS `alias_2` FROM `table_1` WHERE (`table_1`.`column_7` > ?)
? = 10
----
6
2349626762

statement ok
DELETE FROM `table_1` WHERE (`column_9` = 0)


statement ok
DELETE FROM `table_1` WHERE (`column_9` = 1)


statement ok
DELETE FROM `table_1` WHERE (`column_9` = 2)


statement ok
DELETE FROM `table_1` WHERE (`column_9` = 3)


statement ok
DELETE FROM `table_1` WHERE (`column_9` = 4)


query  rowsort
SELECT count(distinct `table_1`.`column_1`) AS `alias_1` FROM `table_1`
----
5

query  rowsort
SELECT sum(`table_1`.`column_2`) AS `alias_1` FROM `table_1`
----
-1925829505

query  rowsort
SELECT `table_1`.`column_1` AS `alias_1` FROM `table_1` WHERE (`table_1`.`column_1` > ?)
? = 10
----
1388311022
235145855
329284514

query  rowsort
SELECT count(distinct `table_1`.`column_3`) AS `alias_1`, sum(`table_1`.`column_4`) AS `alias_2` FROM `table_1`
----
5
682577645

query  rowsort
SELECT count(distinct `table_1`.`column_5`) AS `alias_1` FROM `table_1` WHERE (`table_1`.`column_5` > ?)
? = 10
----
3

query  rowsort
SELECT sum(`table_1`.`column_6`) AS `alias_1` FROM `table_1` WHERE (`table_1`.`column_5` > ?)
? = 10
----
5224441796

query  rowsort
SELECT count(distinct `table_1`.`column_7`) AS `alias_1`, sum(`table_1`.`column_8`) AS `alias_2` FROM `table_1` WHERE (`table_1`.`column_7` > ?)
? = 10
----
4
2797068210
