# Generated by:
#     target/debug/noria-logictest permute --compare-to mysql://root:noria@127.1/noria -d 3 -o logictests/generated/mysql/ --only range_param --random --include-deletes --rows-per-table 10 --subquery-depth 1 --overwrite-tests

statement ok
CREATE TABLE `table_1` (`column_2` INT, `column_1` INT, `column_4` INT, `column_5` INT, `column_3` INT, PRIMARY KEY (`column_5`))


statement ok
INSERT INTO `table_1` (`column_2`, `column_1`, `column_4`, `column_5`, `column_3`) VALUES (2123040368, 1140563892, 409732525, 0, 1768348615), (-256334111, -508048197, 2143325666, 1, -1296682690), (-1181528046, 1934754102, 1821928248, 2, -1427118985), (1367005777, -1173352722, 1419594911, 3, 865760070), (-497154332, 677697893, 701659194, 4, -870258264), (1397026406, 1480229197, -223287498, 5, -30431417), (-1564880189, -2113001993, 630095411, 6, -2009878164), (-656571220, 2063948282, -802240242, 7, -1214266444), (-1216609252, -1058280416, -981776610, 8, -1641797807), (-1940229837, -841238165, -712444436, 9, 1049618595)


query  rowsort
SELECT count(`table_1`.`column_1`) AS `alias_1` FROM `table_1`
----
10

query  rowsort
SELECT `table_1`.`column_1` AS `alias_1` FROM `table_1` WHERE ((`table_1`.`column_1` > ?) AND (`table_1`.`column_1` > ?))
? = 10
? = 10
----
1140563892
1480229197
1934754102
2063948282
677697893

query  rowsort
SELECT `table_1`.`column_1` AS `alias_1` FROM `table_1` WHERE (`table_1`.`column_1` > ?)
? = 10
----
1140563892
1480229197
1934754102
2063948282
677697893

query  rowsort
SELECT count(`table_1`.`column_2`) AS `alias_1` FROM `table_1` WHERE ((`table_1`.`column_2` > ?) AND (`table_1`.`column_2` > ?))
? = 10
? = 10
----
3

query  rowsort
SELECT count(`table_1`.`column_3`) AS `alias_1` FROM `table_1` WHERE (`table_1`.`column_2` > ?)
? = 10
----
3

query  rowsort
SELECT `table_1`.`column_2` AS `alias_1` FROM `table_1` WHERE (((`table_1`.`column_2` > ?) AND (`table_1`.`column_2` > ?)) AND (`table_1`.`column_2` > ?))
? = 10
? = 10
? = 10
----
1367005777
1397026406
2123040368

query  rowsort
SELECT count(`table_1`.`column_4`) AS `alias_1` FROM `table_1` WHERE (((`table_1`.`column_2` > ?) AND (`table_1`.`column_2` > ?)) AND (`table_1`.`column_2` > ?))
? = 10
? = 10
? = 10
----
3

statement ok
DELETE FROM `table_1` WHERE (`column_5` = 0)


statement ok
DELETE FROM `table_1` WHERE (`column_5` = 1)


statement ok
DELETE FROM `table_1` WHERE (`column_5` = 2)


statement ok
DELETE FROM `table_1` WHERE (`column_5` = 3)


statement ok
DELETE FROM `table_1` WHERE (`column_5` = 4)


query  rowsort
SELECT count(`table_1`.`column_1`) AS `alias_1` FROM `table_1`
----
5

query  rowsort
SELECT `table_1`.`column_1` AS `alias_1` FROM `table_1` WHERE ((`table_1`.`column_1` > ?) AND (`table_1`.`column_1` > ?))
? = 10
? = 10
----
1480229197
2063948282

query  rowsort
SELECT `table_1`.`column_1` AS `alias_1` FROM `table_1` WHERE (`table_1`.`column_1` > ?)
? = 10
----
1480229197
2063948282

query  rowsort
SELECT count(`table_1`.`column_2`) AS `alias_1` FROM `table_1` WHERE ((`table_1`.`column_2` > ?) AND (`table_1`.`column_2` > ?))
? = 10
? = 10
----
1

query  rowsort
SELECT count(`table_1`.`column_3`) AS `alias_1` FROM `table_1` WHERE (`table_1`.`column_2` > ?)
? = 10
----
1

query  rowsort
SELECT `table_1`.`column_2` AS `alias_1` FROM `table_1` WHERE (((`table_1`.`column_2` > ?) AND (`table_1`.`column_2` > ?)) AND (`table_1`.`column_2` > ?))
? = 10
? = 10
? = 10
----
1397026406

query  rowsort
SELECT count(`table_1`.`column_4`) AS `alias_1` FROM `table_1` WHERE (((`table_1`.`column_2` > ?) AND (`table_1`.`column_2` > ?)) AND (`table_1`.`column_2` > ?))
? = 10
? = 10
? = 10
----
1
