# Generated by:
#     target/debug/noria-logictest permute --compare-to mysql://root:noria@127.1/noria -d 3 -o logictests/generated/mysql/ --only range_param --random --include-deletes --rows-per-table 10 --subquery-depth 1 --overwrite-tests

statement ok
CREATE TABLE `table_1` (`column_4` INT, `column_1` INT, `column_5` INT, `column_2` INT, `column_3` INT, PRIMARY KEY (`column_5`))


statement ok
INSERT INTO `table_1` (`column_4`, `column_1`, `column_5`, `column_2`, `column_3`) VALUES (-1991346238, -2145834047, 0, -1842553462, -307411371), (340506726, 2127744352, 1, -350863562, -243313092), (-530977187, 1598383034, 2, -644507059, 1933739354), (1415843295, -364959522, 3, 1443017223, 894134392), (-510458336, -1987897812, 4, 1794243331, -152371488), (2027310918, 716241951, 5, 570243336, -232865629), (980759714, -1137612061, 6, 1373289995, 1744807882), (38074803, -803984503, 7, -1672304741, -2034077425), (1876018196, 164828197, 8, 1496706823, 1845652431), (2008999137, 2052786309, 9, 1092822861, 1226691347)


query  rowsort
SELECT count(`table_1`.`column_1`) AS `alias_1` FROM `table_1`
----
10

query  rowsort
SELECT 1 AS `alias_1`
----
1

query  rowsort
SELECT `table_1`.`column_1` AS `alias_1` FROM `table_1` WHERE (`table_1`.`column_1` > ?)
? = 10
----
1598383034
164828197
2052786309
2127744352
716241951

query  rowsort
SELECT count(`table_1`.`column_2`) AS `alias_1`, 1 AS `alias_2` FROM `table_1`
----
10
1

query  rowsort
SELECT count(`table_1`.`column_3`) AS `alias_1` FROM `table_1` WHERE (`table_1`.`column_1` > ?)
? = 10
----
5

query  rowsort
SELECT 1 AS `alias_1` FROM `table_1` WHERE (`table_1`.`column_1` > ?)
? = 10
----
1
1
1
1
1

query  rowsort
SELECT count(`table_1`.`column_4`) AS `alias_1`, 1 AS `alias_2` FROM `table_1` WHERE (`table_1`.`column_4` > ?)
? = 10
----
7
1

statement ok
DELETE FROM `table_1` WHERE (`column_5` = 0)


statement ok
DELETE FROM `table_1` WHERE (`column_5` = 1)


statement ok
DELETE FROM `table_1` WHERE (`column_5` = 2)


statement ok
DELETE FROM `table_1` WHERE (`column_5` = 3)


statement ok
DELETE FROM `table_1` WHERE (`column_5` = 4)


query  rowsort
SELECT count(`table_1`.`column_1`) AS `alias_1` FROM `table_1`
----
5

query  rowsort
SELECT 1 AS `alias_1`
----
1

query  rowsort
SELECT `table_1`.`column_1` AS `alias_1` FROM `table_1` WHERE (`table_1`.`column_1` > ?)
? = 10
----
164828197
2052786309
716241951

query  rowsort
SELECT count(`table_1`.`column_2`) AS `alias_1`, 1 AS `alias_2` FROM `table_1`
----
5
1

query  rowsort
SELECT count(`table_1`.`column_3`) AS `alias_1` FROM `table_1` WHERE (`table_1`.`column_1` > ?)
? = 10
----
3

query  rowsort
SELECT 1 AS `alias_1` FROM `table_1` WHERE (`table_1`.`column_1` > ?)
? = 10
----
1
1
1

query  rowsort
SELECT count(`table_1`.`column_4`) AS `alias_1`, 1 AS `alias_2` FROM `table_1` WHERE (`table_1`.`column_4` > ?)
? = 10
----
5
1
