# Generated by:
#     target/debug/noria-logictest permute --compare-to mysql://root:noria@127.1/noria -d 3 -o logictests/generated/mysql/ --only range_param --random --include-deletes --rows-per-table 10 --subquery-depth 1 --overwrite-tests

statement ok
CREATE TABLE `table_5` (`column_2` INT, `column_1` INT, `column_3` INT, PRIMARY KEY (`column_3`))


statement ok
CREATE TABLE `table_2` (`column_4` INT, `column_7` INT, `column_1` INT, `column_3` INT, `column_2` INT, `column_6` INT, `column_5` INT, PRIMARY KEY (`column_7`))


statement ok
CREATE TABLE `table_3` (`column_5` INT, `column_2` INT, `column_1` INT, `column_3` INT, `column_4` INT, PRIMARY KEY (`column_5`))


statement ok
CREATE TABLE `table_1` (`column_1` INT, `column_3` INT, `column_2` INT, PRIMARY KEY (`column_3`))


statement ok
CREATE TABLE `table_4` (`column_2` INT, `column_1` INT, `column_3` INT, PRIMARY KEY (`column_3`))


statement ok
INSERT INTO `table_5` (`column_2`, `column_1`, `column_3`) VALUES (1410442309, -1528685394, 0), (1943356357, -393652536, 1), (-1831466874, -1182281039, 2), (964044685, 524265982, 3), (1400502734, -976781780, 4), (-437417616, -561409510, 5), (1806575009, 945446776, 6), (1358402500, 176181880, 7), (1784231166, 1125948749, 8), (60574799, 690053010, 9)


statement ok
INSERT INTO `table_2` (`column_4`, `column_7`, `column_1`, `column_3`, `column_2`, `column_6`, `column_5`) VALUES (-242223513, 0, 2019421232, 507219658, -1685603710, -1538487220, -1565688008), (-750063254, 1, -667154724, -1559342831, 2020987094, -440974842, -393804581), (1866593722, 2, 380434102, 1336449759, -1385537874, 1748796871, -1117468535), (-352989068, 3, -54242640, 1810699479, -230876582, 1336585179, -1574178048), (1509930678, 4, -2118732347, 2079097688, 1166499330, 1822585001, 1261780733), (1951697139, 5, -2139780902, 1974276782, 1646936570, -663245290, -577579487), (-26439611, 6, 880683210, -1375875966, 1328371832, 459789011, 524523675), (-626768854, 7, 873779902, 277379828, -1065760519, -1811408426, -2000422213), (404232749, 8, 1128458616, 132004965, 434240350, 919988091, 966639982), (258184978, 9, -1028434767, 1964898877, 714437175, 581557103, -2093095078)


statement ok
INSERT INTO `table_3` (`column_5`, `column_2`, `column_1`, `column_3`, `column_4`) VALUES (0, 340586482, -1705334922, 1264874909, 2015757529), (1, -105739829, 1173182517, 704749778, -1060338665), (2, -543980805, 226785626, -580570982, 517610909), (3, -1401050299, -1745215275, 1069140038, -1752420342), (4, -1823721399, 1198245598, 51913320, 1534539670), (5, -90865887, -91896376, 1441672627, 2058782039), (6, -1893637039, 1808049172, -785236993, 1007632737), (7, -847770404, -1095010797, 1416389348, -828487109), (8, -443926933, 225883631, -496315000, 1835788682), (9, -458385340, 1674817833, -38118309, -250067349)


statement ok
INSERT INTO `table_1` (`column_1`, `column_3`, `column_2`) VALUES (-801818712, 0, 1557752376), (-285652938, 1, -1415472980), (-533882401, 2, 2069076837), (-1119659273, 3, -665072665), (1447838949, 4, 1594528963), (637091819, 5, 2105309827), (-1160923919, 6, -1315060965), (-1918457935, 7, -1646201697), (994020142, 8, 1613828158), (-1477444496, 9, -1575178009)


statement ok
INSERT INTO `table_4` (`column_2`, `column_1`, `column_3`) VALUES (1953335822, 369148696, 0), (-1239703797, 1968612566, 1), (2016942570, 1879283864, 2), (703939918, 1318162605, 3), (-2104877530, 2031851079, 4), (-851864899, -379517574, 5), (-1469105713, -1965906610, 6), (-1021145757, 1221202731, 7), (-1764290862, -1432675220, 8), (2112500227, -723805700, 9)


query  rowsort
SELECT count(distinct `table_1`.`column_1`) AS `alias_1` FROM `table_1`
----
10

query  rowsort
SELECT `table_1`.`column_2` AS `alias_1`, `table_2`.`column_2` AS `alias_2` FROM `table_1` INNER JOIN `table_2` ON (`table_1`.`column_1` = `table_2`.`column_1`)
----


query  rowsort
SELECT `table_2`.`column_1` AS `alias_1` FROM `table_2` WHERE (`table_2`.`column_1` > ?)
? = 10
----
1128458616
2019421232
380434102
873779902
880683210

query  rowsort
SELECT count(distinct `table_2`.`column_3`) AS `alias_1`, `table_2`.`column_4` AS `alias_2`, `table_3`.`column_2` AS `alias_3` FROM `table_2` INNER JOIN `table_3` ON (`table_2`.`column_3` = `table_3`.`column_1`) GROUP BY `table_2`.`column_4`, `table_3`.`column_2`
----


query  rowsort
SELECT count(distinct `table_3`.`column_3`) AS `alias_1` FROM `table_3` WHERE (`table_3`.`column_1` > ?)
? = 10
----
6

query  rowsort
SELECT `table_3`.`column_4` AS `alias_1`, `table_4`.`column_2` AS `alias_2` FROM `table_3` INNER JOIN `table_4` ON (`table_3`.`column_1` = `table_4`.`column_1`) WHERE (`table_3`.`column_2` > ?)
? = 10
----


query  rowsort
SELECT count(distinct `table_2`.`column_5`) AS `alias_1`, `table_2`.`column_6` AS `alias_2`, `table_5`.`column_2` AS `alias_3` FROM `table_2` INNER JOIN `table_5` ON (`table_2`.`column_4` = `table_5`.`column_1`) WHERE (`table_2`.`column_4` > ?) GROUP BY `table_2`.`column_6`, `table_5`.`column_2`
? = 10
----


statement ok
DELETE FROM `table_5` WHERE (`column_3` = 0)


statement ok
DELETE FROM `table_5` WHERE (`column_3` = 1)


statement ok
DELETE FROM `table_5` WHERE (`column_3` = 2)


statement ok
DELETE FROM `table_5` WHERE (`column_3` = 3)


statement ok
DELETE FROM `table_5` WHERE (`column_3` = 4)


statement ok
DELETE FROM `table_2` WHERE (`column_7` = 0)


statement ok
DELETE FROM `table_2` WHERE (`column_7` = 1)


statement ok
DELETE FROM `table_2` WHERE (`column_7` = 2)


statement ok
DELETE FROM `table_2` WHERE (`column_7` = 3)


statement ok
DELETE FROM `table_2` WHERE (`column_7` = 4)


statement ok
DELETE FROM `table_3` WHERE (`column_5` = 0)


statement ok
DELETE FROM `table_3` WHERE (`column_5` = 1)


statement ok
DELETE FROM `table_3` WHERE (`column_5` = 2)


statement ok
DELETE FROM `table_3` WHERE (`column_5` = 3)


statement ok
DELETE FROM `table_3` WHERE (`column_5` = 4)


statement ok
DELETE FROM `table_1` WHERE (`column_3` = 0)


statement ok
DELETE FROM `table_1` WHERE (`column_3` = 1)


statement ok
DELETE FROM `table_1` WHERE (`column_3` = 2)


statement ok
DELETE FROM `table_1` WHERE (`column_3` = 3)


statement ok
DELETE FROM `table_1` WHERE (`column_3` = 4)


statement ok
DELETE FROM `table_4` WHERE (`column_3` = 0)


statement ok
DELETE FROM `table_4` WHERE (`column_3` = 1)


statement ok
DELETE FROM `table_4` WHERE (`column_3` = 2)


statement ok
DELETE FROM `table_4` WHERE (`column_3` = 3)


statement ok
DELETE FROM `table_4` WHERE (`column_3` = 4)


query  rowsort
SELECT count(distinct `table_1`.`column_1`) AS `alias_1` FROM `table_1`
----
5

query  rowsort
SELECT `table_1`.`column_2` AS `alias_1`, `table_2`.`column_2` AS `alias_2` FROM `table_1` INNER JOIN `table_2` ON (`table_1`.`column_1` = `table_2`.`column_1`)
----


query  rowsort
SELECT `table_2`.`column_1` AS `alias_1` FROM `table_2` WHERE (`table_2`.`column_1` > ?)
? = 10
----
1128458616
873779902
880683210

query  rowsort
SELECT count(distinct `table_2`.`column_3`) AS `alias_1`, `table_2`.`column_4` AS `alias_2`, `table_3`.`column_2` AS `alias_3` FROM `table_2` INNER JOIN `table_3` ON (`table_2`.`column_3` = `table_3`.`column_1`) GROUP BY `table_2`.`column_4`, `table_3`.`column_2`
----


query  rowsort
SELECT count(distinct `table_3`.`column_3`) AS `alias_1` FROM `table_3` WHERE (`table_3`.`column_1` > ?)
? = 10
----
3

query  rowsort
SELECT `table_3`.`column_4` AS `alias_1`, `table_4`.`column_2` AS `alias_2` FROM `table_3` INNER JOIN `table_4` ON (`table_3`.`column_1` = `table_4`.`column_1`) WHERE (`table_3`.`column_2` > ?)
? = 10
----


query  rowsort
SELECT count(distinct `table_2`.`column_5`) AS `alias_1`, `table_2`.`column_6` AS `alias_2`, `table_5`.`column_2` AS `alias_3` FROM `table_2` INNER JOIN `table_5` ON (`table_2`.`column_4` = `table_5`.`column_1`) WHERE (`table_2`.`column_4` > ?) GROUP BY `table_2`.`column_6`, `table_5`.`column_2`
? = 10
----

