# Generated by:
#     target/debug/noria-logictest permute --compare-to mysql://root:noria@127.1/noria -d 3 -o logictests/generated/mysql/ --only range_param --random --include-deletes --rows-per-table 10 --subquery-depth 1 --overwrite-tests

statement ok
CREATE TABLE `table_1` (`column_13` INT, `column_7` INT, `column_10` INT, `column_4` INT, `column_5` INT, `column_6` INT, `column_11` INT, `column_1` INT, `column_8` INT, `column_2` INT, `column_12` INT, `column_3` INT, `column_9` INT, PRIMARY KEY (`column_13`))


statement ok
INSERT INTO `table_1` (`column_13`, `column_7`, `column_10`, `column_4`, `column_5`, `column_6`, `column_11`, `column_1`, `column_8`, `column_2`, `column_12`, `column_3`, `column_9`) VALUES (0, -2011226871, 1508805585, 1953580631, -552641808, -255760083, -1037695409, 1098400427, -586575090, -254432777, 1511977918, -2085567307, -199177315), (1, 935201633, -74762361, 885794545, -2108229646, -138258755, 629845767, 73360501, 299115484, 1772427414, -382847274, 1189676294, -1918710211), (2, -896114685, 902713868, -844544723, -1057553322, -347490216, 426454328, -686640708, 1083595919, -1927412870, 1892761277, 266260596, 1968174976), (3, 1263374007, -53968882, -111076654, 1845383695, 946464406, -1575705226, 634524636, 1952596788, 1702295055, -2060834709, -590884850, 1306503497), (4, 855202284, -99733446, -57847586, 2037430445, 1617225760, -1451549143, 1462913074, -122544429, -1164686149, 1648447392, -1292777969, -2087698948), (5, -1253429904, -1547239138, -484136363, 464286634, -111568696, -1716939518, 544860510, 601269838, 457971046, 941063601, 102763077, 1937279474), (6, -2057990941, -1073528295, -1913338278, 1524668543, 947962500, 90150840, -848728025, -486534941, -1585368231, -444075777, 339149358, 1220126347), (7, -1261392085, -567996712, -1534605385, 1051734886, 1539782710, -419590841, 1266000599, 1388321781, -1335843656, 227834859, -1627201221, 228101851), (8, 987219399, -246023230, 230903875, 1053049537, -630498846, 717131103, -247218260, 981826312, 2024906831, 1221414197, -828422719, -224744701), (9, 1812551227, -2130268006, 1198799862, -1006800597, 1208764915, -992022046, 591098778, -1882438640, 1826159937, 1214166231, -759257348, -2141419831)


query  rowsort
WITH `alias_3` AS (SELECT count(`table_1`.`column_2`) AS `alias_2` FROM `table_1`) SELECT count(`table_1`.`column_1`) AS `alias_1` FROM `table_1` INNER JOIN `alias_3` ON (`table_1`.`column_2` = `alias_3`.`alias_2`)
----
0

query  rowsort
WITH `alias_3` AS (SELECT `table_1`.`column_2` AS `alias_2` FROM `table_1`) SELECT count(`table_1`.`column_3`) AS `alias_1` FROM `table_1` INNER JOIN `alias_3` ON (`table_1`.`column_2` = `alias_3`.`alias_2`)
----
10

query  rowsort
WITH `alias_3` AS (SELECT count(`table_1`.`column_5`) AS `alias_2` FROM `table_1`) SELECT count(`table_1`.`column_4`) AS `alias_1` FROM `table_1` INNER JOIN `alias_3` ON (`table_1`.`column_1` = `alias_3`.`alias_2`)
----
0

query  rowsort
WITH `alias_2` AS (SELECT count(`table_1`.`column_6`) AS `alias_1` FROM `table_1`) SELECT `table_1`.`column_1` AS `alias_3` FROM `table_1` INNER JOIN `alias_2` ON (`table_1`.`column_1` = `alias_2`.`alias_1`) WHERE (`table_1`.`column_1` > ?)
? = 10
----


query  rowsort
WITH `alias_2` AS (SELECT `table_1`.`column_1` AS `alias_1` FROM `table_1`) SELECT `table_1`.`column_1` AS `alias_3` FROM `table_1` INNER JOIN `alias_2` ON (`table_1`.`column_1` = `alias_2`.`alias_1`) WHERE (`table_1`.`column_1` > ?)
? = 10
----
1098400427
1266000599
1462913074
544860510
591098778
634524636
73360501

query  rowsort
WITH `alias_2` AS (SELECT count(`table_1`.`column_7`) AS `alias_1` FROM `table_1`) SELECT `table_1`.`column_7` AS `alias_3` FROM `table_1` INNER JOIN `alias_2` ON (`table_1`.`column_7` = `alias_2`.`alias_1`) WHERE (`table_1`.`column_1` > ?)
? = 10
----


query  rowsort
WITH `alias_3` AS (SELECT count(`table_1`.`column_9`) AS `alias_2` FROM `table_1`) SELECT count(`table_1`.`column_8`) AS `alias_1` FROM `table_1` INNER JOIN `alias_3` ON (`table_1`.`column_7` = `alias_3`.`alias_2`) WHERE (`table_1`.`column_7` > ?)
? = 10
----
0

query  rowsort
WITH `alias_3` AS (SELECT `table_1`.`column_7` AS `alias_2` FROM `table_1`) SELECT count(`table_1`.`column_10`) AS `alias_1` FROM `table_1` INNER JOIN `alias_3` ON (`table_1`.`column_7` = `alias_3`.`alias_2`) WHERE (`table_1`.`column_7` > ?)
? = 10
----
5

query  rowsort
WITH `alias_3` AS (SELECT count(`table_1`.`column_12`) AS `alias_2` FROM `table_1`) SELECT count(`table_1`.`column_11`) AS `alias_1` FROM `table_1` INNER JOIN `alias_3` ON (`table_1`.`column_7` = `alias_3`.`alias_2`) WHERE (`table_1`.`column_7` > ?)
? = 10
----
0

statement ok
DELETE FROM `table_1` WHERE (`column_13` = 0)


statement ok
DELETE FROM `table_1` WHERE (`column_13` = 1)


statement ok
DELETE FROM `table_1` WHERE (`column_13` = 2)


statement ok
DELETE FROM `table_1` WHERE (`column_13` = 3)


statement ok
DELETE FROM `table_1` WHERE (`column_13` = 4)


query  rowsort
WITH `alias_3` AS (SELECT count(`table_1`.`column_2`) AS `alias_2` FROM `table_1`) SELECT count(`table_1`.`column_1`) AS `alias_1` FROM `table_1` INNER JOIN `alias_3` ON (`table_1`.`column_2` = `alias_3`.`alias_2`)
----
0

query  rowsort
WITH `alias_3` AS (SELECT `table_1`.`column_2` AS `alias_2` FROM `table_1`) SELECT count(`table_1`.`column_3`) AS `alias_1` FROM `table_1` INNER JOIN `alias_3` ON (`table_1`.`column_2` = `alias_3`.`alias_2`)
----
5

query  rowsort
WITH `alias_3` AS (SELECT count(`table_1`.`column_5`) AS `alias_2` FROM `table_1`) SELECT count(`table_1`.`column_4`) AS `alias_1` FROM `table_1` INNER JOIN `alias_3` ON (`table_1`.`column_1` = `alias_3`.`alias_2`)
----
0

query  rowsort
WITH `alias_2` AS (SELECT count(`table_1`.`column_6`) AS `alias_1` FROM `table_1`) SELECT `table_1`.`column_1` AS `alias_3` FROM `table_1` INNER JOIN `alias_2` ON (`table_1`.`column_1` = `alias_2`.`alias_1`) WHERE (`table_1`.`column_1` > ?)
? = 10
----


query  rowsort
WITH `alias_2` AS (SELECT `table_1`.`column_1` AS `alias_1` FROM `table_1`) SELECT `table_1`.`column_1` AS `alias_3` FROM `table_1` INNER JOIN `alias_2` ON (`table_1`.`column_1` = `alias_2`.`alias_1`) WHERE (`table_1`.`column_1` > ?)
? = 10
----
1266000599
544860510
591098778

query  rowsort
WITH `alias_2` AS (SELECT count(`table_1`.`column_7`) AS `alias_1` FROM `table_1`) SELECT `table_1`.`column_7` AS `alias_3` FROM `table_1` INNER JOIN `alias_2` ON (`table_1`.`column_7` = `alias_2`.`alias_1`) WHERE (`table_1`.`column_1` > ?)
? = 10
----


query  rowsort
WITH `alias_3` AS (SELECT count(`table_1`.`column_9`) AS `alias_2` FROM `table_1`) SELECT count(`table_1`.`column_8`) AS `alias_1` FROM `table_1` INNER JOIN `alias_3` ON (`table_1`.`column_7` = `alias_3`.`alias_2`) WHERE (`table_1`.`column_7` > ?)
? = 10
----
0

query  rowsort
WITH `alias_3` AS (SELECT `table_1`.`column_7` AS `alias_2` FROM `table_1`) SELECT count(`table_1`.`column_10`) AS `alias_1` FROM `table_1` INNER JOIN `alias_3` ON (`table_1`.`column_7` = `alias_3`.`alias_2`) WHERE (`table_1`.`column_7` > ?)
? = 10
----
2

query  rowsort
WITH `alias_3` AS (SELECT count(`table_1`.`column_12`) AS `alias_2` FROM `table_1`) SELECT count(`table_1`.`column_11`) AS `alias_1` FROM `table_1` INNER JOIN `alias_3` ON (`table_1`.`column_7` = `alias_3`.`alias_2`) WHERE (`table_1`.`column_7` > ?)
? = 10
----
0
