# Generated by:
#     target/debug/noria-logictest permute --compare-to mysql://root:noria@127.1/noria -d 3 -o logictests/generated/mysql/ --only range_param --random --include-deletes --rows-per-table 10 --subquery-depth 1 --overwrite-tests

statement ok
CREATE TABLE `table_1` (`column_2` INT, `column_3` INT, `column_4` INT, `column_5` INT, `column_1` INT, PRIMARY KEY (`column_5`))


statement ok
INSERT INTO `table_1` (`column_2`, `column_3`, `column_4`, `column_5`, `column_1`) VALUES (863451782, 2061664677, -343022120, 0, 460701814), (1193384782, -153630648, 818846645, 1, -1726854301), (-881138174, 1675734246, 629370215, 2, 1539517451), (-189175129, -485180532, -1121006941, 3, -292414738), (-1160984062, 289355288, 222165295, 4, 2011877993), (-892261680, 1246489459, 1986628558, 5, -1322031189), (-291494341, 1398550056, -1750690244, 6, -1071044392), (1865797745, -548567605, -1353264658, 7, 630606378), (1429735045, 2053538777, -117572386, 8, 1493448418), (-1115426081, -1400008909, 513366872, 9, 1888677389)


query  rowsort
SELECT count(`table_1`.`column_1`) AS `alias_1` FROM `table_1`
----
10

query  rowsort
SELECT `table_1`.`column_1` AS `alias_1` FROM `table_1` WHERE (`table_1`.`column_1` > ?)
? = 10
----
1493448418
1539517451
1888677389
2011877993
460701814
630606378

query  rowsort
SELECT `table_1`.`column_1` AS `alias_1` FROM `table_1` WHERE (`table_1`.`column_1` > ?)
? = 10
----
1493448418
1539517451
1888677389
2011877993
460701814
630606378

query  rowsort
SELECT count(`table_1`.`column_2`) AS `alias_1` FROM `table_1` WHERE (`table_1`.`column_1` > ?)
? = 10
----
6

query  rowsort
SELECT count(`table_1`.`column_3`) AS `alias_1` FROM `table_1` WHERE (`table_1`.`column_3` > ?)
? = 10
----
6

query  rowsort
SELECT `table_1`.`column_3` AS `alias_1` FROM `table_1` WHERE ((`table_1`.`column_3` > ?) AND (`table_1`.`column_3` > ?))
? = 10
? = 10
----
1246489459
1398550056
1675734246
2053538777
2061664677
289355288

query  rowsort
SELECT count(`table_1`.`column_4`) AS `alias_1` FROM `table_1` WHERE ((`table_1`.`column_2` > ?) AND (`table_1`.`column_2` > ?))
? = 10
? = 10
----
4

statement ok
DELETE FROM `table_1` WHERE (`column_5` = 0)


statement ok
DELETE FROM `table_1` WHERE (`column_5` = 1)


statement ok
DELETE FROM `table_1` WHERE (`column_5` = 2)


statement ok
DELETE FROM `table_1` WHERE (`column_5` = 3)


statement ok
DELETE FROM `table_1` WHERE (`column_5` = 4)


query  rowsort
SELECT count(`table_1`.`column_1`) AS `alias_1` FROM `table_1`
----
5

query  rowsort
SELECT `table_1`.`column_1` AS `alias_1` FROM `table_1` WHERE (`table_1`.`column_1` > ?)
? = 10
----
1493448418
1888677389
630606378

query  rowsort
SELECT `table_1`.`column_1` AS `alias_1` FROM `table_1` WHERE (`table_1`.`column_1` > ?)
? = 10
----
1493448418
1888677389
630606378

query  rowsort
SELECT count(`table_1`.`column_2`) AS `alias_1` FROM `table_1` WHERE (`table_1`.`column_1` > ?)
? = 10
----
3

query  rowsort
SELECT count(`table_1`.`column_3`) AS `alias_1` FROM `table_1` WHERE (`table_1`.`column_3` > ?)
? = 10
----
3

query  rowsort
SELECT `table_1`.`column_3` AS `alias_1` FROM `table_1` WHERE ((`table_1`.`column_3` > ?) AND (`table_1`.`column_3` > ?))
? = 10
? = 10
----
1246489459
1398550056
2053538777

query  rowsort
SELECT count(`table_1`.`column_4`) AS `alias_1` FROM `table_1` WHERE ((`table_1`.`column_2` > ?) AND (`table_1`.`column_2` > ?))
? = 10
? = 10
----
2
