# Generated by:
#     target/debug/noria-logictest permute --compare-to mysql://root:noria@127.1/noria -d 3 -o logictests/generated/mysql/ --only range_param --random --include-deletes --rows-per-table 10 --subquery-depth 1 --overwrite-tests

statement ok
CREATE TABLE `table_1` (`column_1` INT, `column_4` INT, `column_9` INT, `column_3` INT, `column_8` INT, `column_5` INT, `column_6` INT, `column_7` INT, `column_2` INT, PRIMARY KEY (`column_9`))


statement ok
INSERT INTO `table_1` (`column_1`, `column_4`, `column_9`, `column_3`, `column_8`, `column_5`, `column_6`, `column_7`, `column_2`) VALUES (873881069, -516996527, 0, -850761835, 709588905, -1828680893, -1999271161, 697810051, -1902358353), (-49501637, 1833082120, 1, -155335009, -665635842, 1970234585, -1974741803, -224068781, 1888270921), (-2095289170, -1397807566, 2, -1407312987, 1904754556, -578999940, -1144415754, 1294936896, 219734449), (685006416, 760895811, 3, 1833795865, -1290053039, -380052954, -499737905, 1923829632, 2071273169), (207696038, 99397947, 4, -1832546453, -569450571, 2135749478, 426251580, 14292043, -1510596463), (-1483957293, -868391389, 5, 714747507, 427399384, 654493096, 1076139329, 1724385669, -179393753), (643987714, 1400907454, 6, -2094780193, 1503469548, 1283880236, 951623665, -1048589659, 4796054), (-748406480, 1267102129, 7, -361046125, 1867149452, 249982437, 1243794500, 452133885, 1711604356), (-192733156, 2130334138, 8, -167241802, 131782728, -771663364, 150127532, -150395117, -1767853286), (1184704870, -1394990269, 9, -492470682, -219528323, -1116260208, 134021276, 854704208, 1068878383)


query  rowsort
SELECT count(`table_1`.`column_1`) AS `alias_1` FROM `table_1`
----
10

query  rowsort
SELECT count(distinct `table_1`.`column_2`) AS `alias_1` FROM `table_1`
----
10

query  rowsort
SELECT `table_1`.`column_1` AS `alias_1` FROM `table_1` WHERE (`table_1`.`column_1` > ?)
? = 10
----
1184704870
207696038
643987714
685006416
873881069

query  rowsort
SELECT count(`table_1`.`column_3`) AS `alias_1`, count(distinct `table_1`.`column_4`) AS `alias_2` FROM `table_1`
----
10
10

query  rowsort
SELECT count(`table_1`.`column_5`) AS `alias_1` FROM `table_1` WHERE (`table_1`.`column_5` > ?)
? = 10
----
5

query  rowsort
SELECT count(distinct `table_1`.`column_6`) AS `alias_1` FROM `table_1` WHERE (`table_1`.`column_6` > ?)
? = 10
----
6

query  rowsort
SELECT count(`table_1`.`column_7`) AS `alias_1`, count(distinct `table_1`.`column_8`) AS `alias_2` FROM `table_1` WHERE (`table_1`.`column_1` > ?)
? = 10
----
5
5

statement ok
DELETE FROM `table_1` WHERE (`column_9` = 0)


statement ok
DELETE FROM `table_1` WHERE (`column_9` = 1)


statement ok
DELETE FROM `table_1` WHERE (`column_9` = 2)


statement ok
DELETE FROM `table_1` WHERE (`column_9` = 3)


statement ok
DELETE FROM `table_1` WHERE (`column_9` = 4)


query  rowsort
SELECT count(`table_1`.`column_1`) AS `alias_1` FROM `table_1`
----
5

query  rowsort
SELECT count(distinct `table_1`.`column_2`) AS `alias_1` FROM `table_1`
----
5

query  rowsort
SELECT `table_1`.`column_1` AS `alias_1` FROM `table_1` WHERE (`table_1`.`column_1` > ?)
? = 10
----
1184704870
643987714

query  rowsort
SELECT count(`table_1`.`column_3`) AS `alias_1`, count(distinct `table_1`.`column_4`) AS `alias_2` FROM `table_1`
----
5
5

query  rowsort
SELECT count(`table_1`.`column_5`) AS `alias_1` FROM `table_1` WHERE (`table_1`.`column_5` > ?)
? = 10
----
3

query  rowsort
SELECT count(distinct `table_1`.`column_6`) AS `alias_1` FROM `table_1` WHERE (`table_1`.`column_6` > ?)
? = 10
----
5

query  rowsort
SELECT count(`table_1`.`column_7`) AS `alias_1`, count(distinct `table_1`.`column_8`) AS `alias_2` FROM `table_1` WHERE (`table_1`.`column_1` > ?)
? = 10
----
2
2
