# Generated by:
#     target/debug/noria-logictest permute --compare-to mysql://root:noria@127.1/noria -d 3 -o logictests/generated/mysql/ --only range_param --random --include-deletes --rows-per-table 10 --subquery-depth 1 --overwrite-tests

statement ok
CREATE TABLE `table_1` (`column_7` INT, `column_6` INT, `column_9` INT, `column_5` INT, `column_1` INT, `column_2` INT, `column_3` INT, `column_8` INT, `column_4` INT, PRIMARY KEY (`column_9`))


statement ok
INSERT INTO `table_1` (`column_7`, `column_6`, `column_9`, `column_5`, `column_1`, `column_2`, `column_3`, `column_8`, `column_4`) VALUES (-1737578268, -1810131433, 0, 529471692, 422103618, -65820501, -426754667, -1787629890, -633406317), (-161360414, 1470904414, 1, 472256604, 1902808714, 893008573, -1315421227, -2087804880, 781495494), (731128693, -388494017, 2, 17282535, -1791636498, -1275362616, 656841687, -1284207671, 226586023), (-1674380399, -722238175, 3, -348022992, -129210132, -1058746128, 101198244, -1962003980, -1348714886), (979402639, -1775596842, 4, -1874354595, 71356147, -1090909110, 380413250, -412500589, 307197723), (499162410, -1579720401, 5, -117600479, 1845272084, -533882619, -683275557, -2120839081, -1137344098), (-311597284, -805720177, 6, -216497038, 366166304, 2086750943, 1592175928, -1202406451, 2088811737), (-1340431335, -1061387488, 7, -1986957869, 1638253879, -1580847982, 1110564921, 1062884865, -912728089), (-962569739, -1770960506, 8, -2023980235, 426451142, 2071361645, 29986077, 295572251, -668119982), (-427934371, 982134785, 9, 684595672, -405298267, -1699437798, 1056520879, -865659938, -901544633)


query  rowsort
SELECT count(`table_1`.`column_1`) AS `alias_1` FROM `table_1`
----
10

query  rowsort
SELECT sum(distinct `table_1`.`column_2`) AS `alias_1` FROM `table_1`
----
-2253885593

query  rowsort
SELECT `table_1`.`column_2` AS `alias_1` FROM `table_1` WHERE (`table_1`.`column_2` > ?)
? = 10
----
2071361645
2086750943
893008573

query  rowsort
SELECT count(`table_1`.`column_3`) AS `alias_1`, sum(distinct `table_1`.`column_4`) AS `alias_2` FROM `table_1`
----
10
-2197767028

query  rowsort
SELECT count(`table_1`.`column_5`) AS `alias_1` FROM `table_1` WHERE (`table_1`.`column_4` > ?)
? = 10
----
4

query  rowsort
SELECT sum(distinct `table_1`.`column_6`) AS `alias_1` FROM `table_1` WHERE (`table_1`.`column_4` > ?)
? = 10
----
-1498906622

query  rowsort
SELECT count(`table_1`.`column_7`) AS `alias_1`, sum(distinct `table_1`.`column_8`) AS `alias_2` FROM `table_1` WHERE (`table_1`.`column_7` > ?)
? = 10
----
3
-3817547341

statement ok
DELETE FROM `table_1` WHERE (`column_9` = 0)


statement ok
DELETE FROM `table_1` WHERE (`column_9` = 1)


statement ok
DELETE FROM `table_1` WHERE (`column_9` = 2)


statement ok
DELETE FROM `table_1` WHERE (`column_9` = 3)


statement ok
DELETE FROM `table_1` WHERE (`column_9` = 4)


query  rowsort
SELECT count(`table_1`.`column_1`) AS `alias_1` FROM `table_1`
----
5

query  rowsort
SELECT sum(distinct `table_1`.`column_2`) AS `alias_1` FROM `table_1`
----
343944189

query  rowsort
SELECT `table_1`.`column_2` AS `alias_1` FROM `table_1` WHERE (`table_1`.`column_2` > ?)
? = 10
----
2071361645
2086750943

query  rowsort
SELECT count(`table_1`.`column_3`) AS `alias_1`, sum(distinct `table_1`.`column_4`) AS `alias_2` FROM `table_1`
----
5
-1530925065

query  rowsort
SELECT count(`table_1`.`column_5`) AS `alias_1` FROM `table_1` WHERE (`table_1`.`column_4` > ?)
? = 10
----
1

query  rowsort
SELECT sum(distinct `table_1`.`column_6`) AS `alias_1` FROM `table_1` WHERE (`table_1`.`column_4` > ?)
? = 10
----
-805720177

query  rowsort
SELECT count(`table_1`.`column_7`) AS `alias_1`, sum(distinct `table_1`.`column_8`) AS `alias_2` FROM `table_1` WHERE (`table_1`.`column_7` > ?)
? = 10
----
1
-2120839081
