# Generated by:
#     target/debug/noria-logictest permute --compare-to mysql://root:noria@127.1/noria -d 3 -o logictests/generated/mysql/ --only range_param --random --include-deletes --rows-per-table 10 --subquery-depth 1 --overwrite-tests

statement ok
CREATE TABLE `table_1` (`column_2` INT, `column_1` INT, `column_4` INT, `column_3` INT, `column_5` INT, PRIMARY KEY (`column_5`))


statement ok
INSERT INTO `table_1` (`column_2`, `column_1`, `column_4`, `column_3`, `column_5`) VALUES (974779420, 1511226024, 988918915, 1600281115, 0), (1714924911, -509151931, 1549785065, 758160439, 1), (-1995851424, 1258510100, -820370899, -1018866954, 2), (342314909, -395634965, 1561733874, -1903371045, 3), (-1699406150, 325271787, 899194278, -927308999, 4), (-1047937041, -1011098974, -952194944, -2146348256, 5), (-147038149, 162673807, 1661921972, -1353925755, 6), (25623744, 1033823055, -84253407, 1560173421, 7), (651021882, 706255722, 100014531, 679551685, 8), (1282272122, -571905106, -1440321194, 2045517287, 9)


query  rowsort
SELECT count(`table_1`.`column_1`) AS `alias_1` FROM `table_1`
----
10

query  rowsort
SELECT `table_1`.`column_1` AS `alias_1` FROM `table_1` WHERE ((`table_1`.`column_1` = ?) AND (`table_1`.`column_1` = ?))
? = 1
? = 1
----


query  rowsort
SELECT `table_1`.`column_1` AS `alias_1` FROM `table_1` WHERE (`table_1`.`column_1` > ?)
? = 10
----
1033823055
1258510100
1511226024
162673807
325271787
706255722

query  rowsort
SELECT count(`table_1`.`column_2`) AS `alias_1` FROM `table_1` WHERE ((`table_1`.`column_2` = ?) AND (`table_1`.`column_2` = ?))
? = 1
? = 1
----
0

query  rowsort
SELECT count(`table_1`.`column_3`) AS `alias_1` FROM `table_1` WHERE (`table_1`.`column_2` > ?)
? = 10
----
6

query  rowsort
SELECT `table_1`.`column_2` AS `alias_1` FROM `table_1` WHERE (((`table_1`.`column_2` = ?) AND (`table_1`.`column_2` = ?)) AND (`table_1`.`column_2` > ?))
? = 1
? = 1
? = 10
----


query  rowsort
SELECT count(`table_1`.`column_4`) AS `alias_1` FROM `table_1` WHERE (((`table_1`.`column_2` = ?) AND (`table_1`.`column_2` = ?)) AND (`table_1`.`column_2` > ?))
? = 1
? = 1
? = 10
----
0

statement ok
DELETE FROM `table_1` WHERE (`column_5` = 0)


statement ok
DELETE FROM `table_1` WHERE (`column_5` = 1)


statement ok
DELETE FROM `table_1` WHERE (`column_5` = 2)


statement ok
DELETE FROM `table_1` WHERE (`column_5` = 3)


statement ok
DELETE FROM `table_1` WHERE (`column_5` = 4)


query  rowsort
SELECT count(`table_1`.`column_1`) AS `alias_1` FROM `table_1`
----
5

query  rowsort
SELECT `table_1`.`column_1` AS `alias_1` FROM `table_1` WHERE ((`table_1`.`column_1` = ?) AND (`table_1`.`column_1` = ?))
? = 1
? = 1
----


query  rowsort
SELECT `table_1`.`column_1` AS `alias_1` FROM `table_1` WHERE (`table_1`.`column_1` > ?)
? = 10
----
1033823055
162673807
706255722

query  rowsort
SELECT count(`table_1`.`column_2`) AS `alias_1` FROM `table_1` WHERE ((`table_1`.`column_2` = ?) AND (`table_1`.`column_2` = ?))
? = 1
? = 1
----
0

query  rowsort
SELECT count(`table_1`.`column_3`) AS `alias_1` FROM `table_1` WHERE (`table_1`.`column_2` > ?)
? = 10
----
3

query  rowsort
SELECT `table_1`.`column_2` AS `alias_1` FROM `table_1` WHERE (((`table_1`.`column_2` = ?) AND (`table_1`.`column_2` = ?)) AND (`table_1`.`column_2` > ?))
? = 1
? = 1
? = 10
----


query  rowsort
SELECT count(`table_1`.`column_4`) AS `alias_1` FROM `table_1` WHERE (((`table_1`.`column_2` = ?) AND (`table_1`.`column_2` = ?)) AND (`table_1`.`column_2` > ?))
? = 1
? = 1
? = 10
----
0
