# Generated by:
#     target/debug/noria-logictest permute --compare-to mysql://root:noria@127.1/noria -d 3 -o logictests/generated/mysql/ --only range_param --random --include-deletes --rows-per-table 10 --subquery-depth 1 --overwrite-tests

statement ok
CREATE TABLE `table_1` (`column_7` INT, `column_8` INT, `column_9` INT, `column_1` INT, `column_4` INT, `column_5` INT, `column_2` INT, `column_3` INT, `column_6` INT, PRIMARY KEY (`column_9`))


statement ok
INSERT INTO `table_1` (`column_7`, `column_8`, `column_9`, `column_1`, `column_4`, `column_5`, `column_2`, `column_3`, `column_6`) VALUES (1925642467, 1887915384, 0, 1606454752, -391063094, -1027286252, 483055305, 1235939724, 527795071), (2070342984, -900332379, 1, -90804434, 2094013041, 825145705, -822508699, -2040630430, -1163068513), (-1601433959, 939287740, 2, -1795383597, 240640890, 12668462, -1467673944, 159463765, 1344570328), (-471143894, 1767747404, 3, 1792625104, 1876795208, -1300511879, 1402555057, 1137739826, -1094815492), (-1000522443, 799490424, 4, -367301022, -746833817, -447684310, 2027823273, -1629828960, -797018544), (1089808360, 682079735, 5, 1657837019, 333739382, -1782753448, 248948628, 314683878, 1725156202), (-1584095000, 396821368, 6, -1931423331, -2099851577, -941389712, -1420188023, 2108397311, -1454510952), (730586696, 257781458, 7, -1003619879, 1090064227, 67931183, 595338162, 587961613, 1194653942), (1639462866, 1085257949, 8, -1939835170, -179069266, 2102640625, -129955435, -1391168333, -204836425), (-1870179260, 61853239, 9, -516513478, -1008463458, 181975612, 1105856260, -1765124927, -1985945963)


query  rowsort
SELECT count(`table_1`.`column_1`) AS `alias_1` FROM `table_1`
----
10

query  nosort
SELECT `table_1`.`column_1` AS `alias_1` FROM `table_1` ORDER BY `table_1`.`column_1` ASC LIMIT 10
----
-1939835170
-1931423331
-1795383597
-1003619879
-516513478
-367301022
-90804434
1606454752
1657837019
1792625104

query  nosort
SELECT `table_1`.`column_1` AS `alias_1` FROM `table_1` ORDER BY `table_1`.`column_1` DESC LIMIT 10
----
1792625104
1657837019
1606454752
-90804434
-367301022
-516513478
-1003619879
-1795383597
-1931423331
-1939835170

query  rowsort
SELECT `table_1`.`column_1` AS `alias_1` FROM `table_1` WHERE (`table_1`.`column_1` > ?)
? = 10
----
1606454752
1657837019
1792625104

query  nosort
SELECT count(`table_1`.`column_2`) AS `alias_1` FROM `table_1` GROUP BY `table_1`.`column_1` ORDER BY `table_1`.`column_1` ASC LIMIT 10
----
1
1
1
1
1
1
1
1
1
1

query  nosort
SELECT count(`table_1`.`column_3`) AS `alias_1` FROM `table_1` GROUP BY `table_1`.`column_1` ORDER BY `table_1`.`column_1` DESC LIMIT 10
----
1
1
1
1
1
1
1
1
1
1

query  rowsort
SELECT count(`table_1`.`column_4`) AS `alias_1` FROM `table_1` WHERE (`table_1`.`column_1` > ?)
? = 10
----
3

query  nosort
SELECT `table_1`.`column_1` AS `alias_1` FROM `table_1` ORDER BY `table_1`.`column_1` DESC LIMIT 10
----
1792625104
1657837019
1606454752
-90804434
-367301022
-516513478
-1003619879
-1795383597
-1931423331
-1939835170

query  nosort
SELECT `table_1`.`column_1` AS `alias_1` FROM `table_1` WHERE (`table_1`.`column_1` > ?) ORDER BY `table_1`.`column_1` ASC LIMIT 10
? = 10
----
1606454752
1657837019
1792625104

query  nosort
SELECT `table_1`.`column_1` AS `alias_1` FROM `table_1` WHERE (`table_1`.`column_1` > ?) ORDER BY `table_1`.`column_1` DESC LIMIT 10
? = 10
----
1792625104
1657837019
1606454752

query  nosort
SELECT count(`table_1`.`column_5`) AS `alias_1` FROM `table_1` GROUP BY `table_1`.`column_1` ORDER BY `table_1`.`column_1` DESC LIMIT 10
----
1
1
1
1
1
1
1
1
1
1

query  nosort
SELECT count(`table_1`.`column_6`) AS `alias_1` FROM `table_1` WHERE (`table_1`.`column_1` > ?) GROUP BY `table_1`.`column_1` ORDER BY `table_1`.`column_1` ASC LIMIT 10
? = 10
----
1
1
1

query  nosort
SELECT count(`table_1`.`column_7`) AS `alias_1` FROM `table_1` WHERE (`table_1`.`column_1` > ?) GROUP BY `table_1`.`column_1` ORDER BY `table_1`.`column_1` DESC LIMIT 10
? = 10
----
1
1
1

query  nosort
SELECT `table_1`.`column_1` AS `alias_1` FROM `table_1` WHERE (`table_1`.`column_1` > ?) ORDER BY `table_1`.`column_1` DESC LIMIT 10
? = 10
----
1792625104
1657837019
1606454752

query  nosort
SELECT count(`table_1`.`column_8`) AS `alias_1` FROM `table_1` WHERE (`table_1`.`column_7` > ?) GROUP BY `table_1`.`column_7` ORDER BY `table_1`.`column_7` DESC LIMIT 10
? = 10
----
1
1
1
1
1

statement ok
DELETE FROM `table_1` WHERE (`column_9` = 0)


statement ok
DELETE FROM `table_1` WHERE (`column_9` = 1)


statement ok
DELETE FROM `table_1` WHERE (`column_9` = 2)


statement ok
DELETE FROM `table_1` WHERE (`column_9` = 3)


statement ok
DELETE FROM `table_1` WHERE (`column_9` = 4)


query  rowsort
SELECT count(`table_1`.`column_1`) AS `alias_1` FROM `table_1`
----
5

query  nosort
SELECT `table_1`.`column_1` AS `alias_1` FROM `table_1` ORDER BY `table_1`.`column_1` ASC LIMIT 10
----
-1939835170
-1931423331
-1003619879
-516513478
1657837019

query  nosort
SELECT `table_1`.`column_1` AS `alias_1` FROM `table_1` ORDER BY `table_1`.`column_1` DESC LIMIT 10
----
1657837019
-516513478
-1003619879
-1931423331
-1939835170

query  rowsort
SELECT `table_1`.`column_1` AS `alias_1` FROM `table_1` WHERE (`table_1`.`column_1` > ?)
? = 10
----
1657837019

query  nosort
SELECT count(`table_1`.`column_2`) AS `alias_1` FROM `table_1` GROUP BY `table_1`.`column_1` ORDER BY `table_1`.`column_1` ASC LIMIT 10
----
1
1
1
1
1

query  nosort
SELECT count(`table_1`.`column_3`) AS `alias_1` FROM `table_1` GROUP BY `table_1`.`column_1` ORDER BY `table_1`.`column_1` DESC LIMIT 10
----
1
1
1
1
1

query  rowsort
SELECT count(`table_1`.`column_4`) AS `alias_1` FROM `table_1` WHERE (`table_1`.`column_1` > ?)
? = 10
----
1

query  nosort
SELECT `table_1`.`column_1` AS `alias_1` FROM `table_1` ORDER BY `table_1`.`column_1` DESC LIMIT 10
----
1657837019
-516513478
-1003619879
-1931423331
-1939835170

query  nosort
SELECT `table_1`.`column_1` AS `alias_1` FROM `table_1` WHERE (`table_1`.`column_1` > ?) ORDER BY `table_1`.`column_1` ASC LIMIT 10
? = 10
----
1657837019

query  nosort
SELECT `table_1`.`column_1` AS `alias_1` FROM `table_1` WHERE (`table_1`.`column_1` > ?) ORDER BY `table_1`.`column_1` DESC LIMIT 10
? = 10
----
1657837019

query  nosort
SELECT count(`table_1`.`column_5`) AS `alias_1` FROM `table_1` GROUP BY `table_1`.`column_1` ORDER BY `table_1`.`column_1` DESC LIMIT 10
----
1
1
1
1
1

query  nosort
SELECT count(`table_1`.`column_6`) AS `alias_1` FROM `table_1` WHERE (`table_1`.`column_1` > ?) GROUP BY `table_1`.`column_1` ORDER BY `table_1`.`column_1` ASC LIMIT 10
? = 10
----
1

query  nosort
SELECT count(`table_1`.`column_7`) AS `alias_1` FROM `table_1` WHERE (`table_1`.`column_1` > ?) GROUP BY `table_1`.`column_1` ORDER BY `table_1`.`column_1` DESC LIMIT 10
? = 10
----
1

query  nosort
SELECT `table_1`.`column_1` AS `alias_1` FROM `table_1` WHERE (`table_1`.`column_1` > ?) ORDER BY `table_1`.`column_1` DESC LIMIT 10
? = 10
----
1657837019

query  nosort
SELECT count(`table_1`.`column_8`) AS `alias_1` FROM `table_1` WHERE (`table_1`.`column_7` > ?) GROUP BY `table_1`.`column_7` ORDER BY `table_1`.`column_7` DESC LIMIT 10
? = 10
----
1
1
1
