# Generated by:
#     target/debug/noria-logictest permute --compare-to mysql://root:noria@127.1/noria -d 3 -o logictests/generated/mysql/ --only range_param --random --include-deletes --rows-per-table 10 --subquery-depth 1 --overwrite-tests

statement ok
CREATE TABLE `table_1` (`column_1` INT, `column_6` INT, `column_9` INT, `column_8` INT, `column_4` INT, `column_3` INT, `column_2` INT, `column_7` INT, `column_5` INT, PRIMARY KEY (`column_9`))


statement ok
INSERT INTO `table_1` (`column_1`, `column_6`, `column_9`, `column_8`, `column_4`, `column_3`, `column_2`, `column_7`, `column_5`) VALUES (727308480, -1106921132, 0, 1250487360, -659102407, 1344572609, 189149600, 474203171, -905586724), (-891692381, -5994226, 1, -623524412, -460560967, 1984285633, -1340427629, -2015088001, 464673835), (-1214288612, -1574191062, 2, 1853524530, -368063397, 1603051384, 1488822325, -1340908462, -663853036), (1619498588, 1576918573, 3, 882498982, -1216691410, -1219233953, -763921887, 1897487688, -1962896300), (-731118770, -1333260090, 4, -139595101, -567766878, 2022800928, 559202442, -1033585634, -1823429), (919096289, -717430222, 5, -1305239324, -651690654, 427733018, 380627973, -1778341540, 2132709788), (-1736265498, 219651678, 6, 1515781019, -272323228, -1030630405, -1276035018, -79439077, 1055925276), (-607426468, -1126498073, 7, -1667566365, -705973734, 1465065032, -1524745474, -988365497, -226979575), (1864813717, -1166468922, 8, 338273982, -816068032, 1320856095, 1026594408, 1054631209, -338189891), (-525879944, 2069176333, 9, 191680309, 1100375464, -1349126731, 777845561, 2109754477, 28869702)


query  rowsort
SELECT count(distinct `table_1`.`column_1`) AS `alias_1` FROM `table_1`
----
10

query  rowsort
SELECT sum(distinct `table_1`.`column_2`) AS `alias_1` FROM `table_1`
----
-482887699

query  rowsort
SELECT `table_1`.`column_1` AS `alias_1` FROM `table_1` WHERE (`table_1`.`column_1` > ?)
? = 10
----
1619498588
1864813717
727308480
919096289

query  rowsort
SELECT count(distinct `table_1`.`column_3`) AS `alias_1`, sum(distinct `table_1`.`column_4`) AS `alias_2` FROM `table_1`
----
10
-4617865243

query  rowsort
SELECT count(distinct `table_1`.`column_5`) AS `alias_1` FROM `table_1` WHERE (`table_1`.`column_3` > ?)
? = 10
----
7

query  rowsort
SELECT sum(distinct `table_1`.`column_6`) AS `alias_1` FROM `table_1` WHERE (`table_1`.`column_3` > ?)
? = 10
----
-7030763727

query  rowsort
SELECT count(distinct `table_1`.`column_7`) AS `alias_1`, sum(distinct `table_1`.`column_8`) AS `alias_2` FROM `table_1` WHERE (`table_1`.`column_1` > ?)
? = 10
----
4
1166021000

statement ok
DELETE FROM `table_1` WHERE (`column_9` = 0)


statement ok
DELETE FROM `table_1` WHERE (`column_9` = 1)


statement ok
DELETE FROM `table_1` WHERE (`column_9` = 2)


statement ok
DELETE FROM `table_1` WHERE (`column_9` = 3)


statement ok
DELETE FROM `table_1` WHERE (`column_9` = 4)


query  rowsort
SELECT count(distinct `table_1`.`column_1`) AS `alias_1` FROM `table_1`
----
5

query  rowsort
SELECT sum(distinct `table_1`.`column_2`) AS `alias_1` FROM `table_1`
----
-615712550

query  rowsort
SELECT `table_1`.`column_1` AS `alias_1` FROM `table_1` WHERE (`table_1`.`column_1` > ?)
? = 10
----
1864813717
919096289

query  rowsort
SELECT count(distinct `table_1`.`column_3`) AS `alias_1`, sum(distinct `table_1`.`column_4`) AS `alias_2` FROM `table_1`
----
5
-1345680184

query  rowsort
SELECT count(distinct `table_1`.`column_5`) AS `alias_1` FROM `table_1` WHERE (`table_1`.`column_3` > ?)
? = 10
----
3

query  rowsort
SELECT sum(distinct `table_1`.`column_6`) AS `alias_1` FROM `table_1` WHERE (`table_1`.`column_3` > ?)
? = 10
----
-3010397217

query  rowsort
SELECT count(distinct `table_1`.`column_7`) AS `alias_1`, sum(distinct `table_1`.`column_8`) AS `alias_2` FROM `table_1` WHERE (`table_1`.`column_1` > ?)
? = 10
----
2
-966965342
