# Generated by:
#     target/debug/noria-logictest permute --compare-to mysql://root:noria@127.1/noria -d 3 -o logictests/generated/mysql/ --only range_param --random --include-deletes --rows-per-table 10 --subquery-depth 1 --overwrite-tests

statement ok
CREATE TABLE `table_1` (`column_1` INT, `column_3` INT, `column_6` INT, `column_2` INT, `column_9` INT, `column_5` INT, `column_4` INT, `column_8` INT, `column_7` INT, PRIMARY KEY (`column_9`))


statement ok
INSERT INTO `table_1` (`column_1`, `column_3`, `column_6`, `column_2`, `column_9`, `column_5`, `column_4`, `column_8`, `column_7`) VALUES (1796903558, -448819179, 1648861307, -1824333750, 0, 505245980, -806939323, -179631608, -1386022653), (-302171664, 1875378320, -1522575962, -269839426, 1, -537094019, -1317999997, 552391331, -251912936), (-1804933461, -626678658, -45114103, -245948825, 2, 997940478, 1595595205, -1837459241, 1602696935), (-2115519771, -38376832, -1665937269, 1623124976, 3, 405738473, 1587140015, -106194116, 1872822211), (-543567335, -458414642, -999995892, 899858052, 4, -1805251814, -807958092, 1845994620, 2073765387), (1243495719, 130110744, 1468436341, -855520809, 5, 1407962970, 305566733, 2139050230, 1414270844), (-1771007464, 595317698, -745676106, -703471809, 6, -1448720515, -314950102, -1179637769, 1953742529), (-402373608, 1513078974, -939150824, 1630980585, 7, -1237845287, 627519202, 1356880209, 1812569174), (-797295725, 1053895942, -676519356, 592260419, 8, -2032338004, -1281504797, -562290951, -982263351), (1278463462, 704710309, 922069888, 440621519, 9, 1261386228, -2101318214, 1308565799, 817883424)


query  rowsort
SELECT count(distinct `table_1`.`column_1`) AS `alias_1` FROM `table_1`
----
10

query  rowsort
SELECT avg(distinct `table_1`.`column_2`) AS `alias_1` FROM `table_1`
----
128773093.2000

query  rowsort
SELECT `table_1`.`column_1` AS `alias_1` FROM `table_1` WHERE (`table_1`.`column_1` > ?)
? = 10
----
1243495719
1278463462
1796903558

query  rowsort
SELECT count(distinct `table_1`.`column_3`) AS `alias_1`, avg(distinct `table_1`.`column_4`) AS `alias_2` FROM `table_1`
----
10
-251484937.0000

query  rowsort
SELECT count(distinct `table_1`.`column_5`) AS `alias_1` FROM `table_1` WHERE (`table_1`.`column_1` > ?)
? = 10
----
3

query  rowsort
SELECT avg(distinct `table_1`.`column_6`) AS `alias_1` FROM `table_1` WHERE (`table_1`.`column_1` > ?)
? = 10
----
1346455845.3333

query  rowsort
SELECT count(distinct `table_1`.`column_7`) AS `alias_1`, avg(distinct `table_1`.`column_8`) AS `alias_2` FROM `table_1` WHERE (`table_1`.`column_1` > ?)
? = 10
----
3
1089328140.3333

statement ok
DELETE FROM `table_1` WHERE (`column_9` = 0)


statement ok
DELETE FROM `table_1` WHERE (`column_9` = 1)


statement ok
DELETE FROM `table_1` WHERE (`column_9` = 2)


statement ok
DELETE FROM `table_1` WHERE (`column_9` = 3)


statement ok
DELETE FROM `table_1` WHERE (`column_9` = 4)


query  rowsort
SELECT count(distinct `table_1`.`column_1`) AS `alias_1` FROM `table_1`
----
5

query  rowsort
SELECT avg(distinct `table_1`.`column_2`) AS `alias_1` FROM `table_1`
----
220973981.0000

query  rowsort
SELECT `table_1`.`column_1` AS `alias_1` FROM `table_1` WHERE (`table_1`.`column_1` > ?)
? = 10
----
1243495719
1278463462

query  rowsort
SELECT count(distinct `table_1`.`column_3`) AS `alias_1`, avg(distinct `table_1`.`column_4`) AS `alias_2` FROM `table_1`
----
5
-552937435.6000

query  rowsort
SELECT count(distinct `table_1`.`column_5`) AS `alias_1` FROM `table_1` WHERE (`table_1`.`column_1` > ?)
? = 10
----
2

query  rowsort
SELECT avg(distinct `table_1`.`column_6`) AS `alias_1` FROM `table_1` WHERE (`table_1`.`column_1` > ?)
? = 10
----
1195253114.5000

query  rowsort
SELECT count(distinct `table_1`.`column_7`) AS `alias_1`, avg(distinct `table_1`.`column_8`) AS `alias_2` FROM `table_1` WHERE (`table_1`.`column_1` > ?)
? = 10
----
2
1723808014.5000
