# Generated by:
#     target/debug/noria-logictest permute --compare-to mysql://root:noria@127.1/noria -d 3 -o logictests/generated/mysql/ --only range_param --random --include-deletes --rows-per-table 10 --subquery-depth 1 --overwrite-tests

statement ok
CREATE TABLE `table_1` (`column_8` INT, `column_9` INT, `column_2` INT, `column_11` INT, `column_1` INT, `column_7` INT, `column_3` INT, `column_12` INT, `column_4` INT, `column_5` INT, `column_10` INT, `column_13` INT, `column_6` INT, PRIMARY KEY (`column_13`))


statement ok
INSERT INTO `table_1` (`column_8`, `column_9`, `column_2`, `column_11`, `column_1`, `column_7`, `column_3`, `column_12`, `column_4`, `column_5`, `column_10`, `column_13`, `column_6`) VALUES (2019804216, 598532503, -1683631655, 1835667565, -28020904, 972676300, -103675621, -1603803867, -1584084273, 1883108495, -2091320015, 0, -1995451443), (1101846407, 1255139917, 313904801, 725114866, -369207305, -1477244856, 754665754, 2035545489, 1134842281, 2042590968, 586259671, 1, -1980896358), (-1976601176, 1090817338, -1503401419, 1617348863, 1693963673, -2106764345, -123731293, 71389964, -1631230489, -1465109161, 820716965, 2, -1435070346), (-169543401, -9819903, -1606497644, 1418913389, 1714373456, -1143896897, 474987175, -1477697650, 969624081, -2047152205, 706725471, 3, 1503786263), (125529365, 1860127686, 51756555, -1471456987, 749656794, 1370689984, -1105324205, 2118073956, -970490222, 75041441, 1568989345, 4, 977717084), (-955417871, 841827532, -1342970684, -404583383, -1379848161, 733715762, 278860173, -1614699470, 373680270, 499681895, 2099313353, 5, -869895880), (686963498, 470744607, -1527002481, 685915381, -1354789816, -2062607272, 178518089, -249495980, 519593776, 1514766093, 446707574, 6, -1374316492), (-1330977387, -1699860794, 981324848, 119175919, 908217183, 1576116562, -937358262, -1564367939, 1589207628, -2142684862, -1857517095, 7, -189878622), (-539090593, -313294277, -1957259748, 1233967312, -1698491713, 1034109603, -263577247, -823771786, 1888601216, -1499067258, -771871651, 8, 551692124), (-797560171, 1083624255, 849016930, 675007517, -1078854169, -206332887, -1167079682, 759560816, 2143453140, 857180521, 752381034, 9, -224552846)


query  rowsort
SELECT count(`table_1`.`column_1`) AS `alias_1` FROM `table_1` INNER JOIN (SELECT count(`table_1`.`column_2`) AS `alias_2` FROM `table_1`) AS alias_3 ON (`table_1`.`column_2` = `alias_3`.`alias_2`)
----
0

query  rowsort
SELECT count(`table_1`.`column_3`) AS `alias_1` FROM `table_1` INNER JOIN (SELECT `table_1`.`column_2` AS `alias_2` FROM `table_1`) AS alias_3 ON (`table_1`.`column_2` = `alias_3`.`alias_2`)
----
10

query  rowsort
SELECT count(`table_1`.`column_4`) AS `alias_1` FROM `table_1` INNER JOIN (SELECT count(`table_1`.`column_5`) AS `alias_2` FROM `table_1`) AS alias_3 ON (`table_1`.`column_1` = `alias_3`.`alias_2`)
----
0

query  rowsort
SELECT `table_1`.`column_1` AS `alias_3` FROM `table_1` INNER JOIN (SELECT count(`table_1`.`column_6`) AS `alias_1` FROM `table_1`) AS alias_2 ON (`table_1`.`column_1` = `alias_2`.`alias_1`) WHERE (`table_1`.`column_1` > ?)
? = 10
----


query  rowsort
SELECT `table_1`.`column_1` AS `alias_3` FROM `table_1` INNER JOIN (SELECT `table_1`.`column_1` AS `alias_1` FROM `table_1`) AS alias_2 ON (`table_1`.`column_1` = `alias_2`.`alias_1`) WHERE (`table_1`.`column_1` > ?)
? = 10
----
1693963673
1714373456
749656794
908217183

query  rowsort
SELECT `table_1`.`column_1` AS `alias_3` FROM `table_1` INNER JOIN (SELECT count(`table_1`.`column_7`) AS `alias_1` FROM `table_1`) AS alias_2 ON (`table_1`.`column_1` = `alias_2`.`alias_1`) WHERE (`table_1`.`column_1` > ?)
? = 10
----


query  rowsort
SELECT count(`table_1`.`column_8`) AS `alias_1` FROM `table_1` INNER JOIN (SELECT count(`table_1`.`column_9`) AS `alias_2` FROM `table_1`) AS alias_3 ON (`table_1`.`column_8` = `alias_3`.`alias_2`) WHERE (`table_1`.`column_8` > ?)
? = 10
----
0

query  rowsort
SELECT count(`table_1`.`column_10`) AS `alias_1` FROM `table_1` INNER JOIN (SELECT `table_1`.`column_8` AS `alias_2` FROM `table_1`) AS alias_3 ON (`table_1`.`column_8` = `alias_3`.`alias_2`) WHERE (`table_1`.`column_8` > ?)
? = 10
----
4

query  rowsort
SELECT count(`table_1`.`column_11`) AS `alias_1` FROM `table_1` INNER JOIN (SELECT count(`table_1`.`column_12`) AS `alias_2` FROM `table_1`) AS alias_3 ON (`table_1`.`column_8` = `alias_3`.`alias_2`) WHERE (`table_1`.`column_8` > ?)
? = 10
----
0

statement ok
DELETE FROM `table_1` WHERE (`column_13` = 0)


statement ok
DELETE FROM `table_1` WHERE (`column_13` = 1)


statement ok
DELETE FROM `table_1` WHERE (`column_13` = 2)


statement ok
DELETE FROM `table_1` WHERE (`column_13` = 3)


statement ok
DELETE FROM `table_1` WHERE (`column_13` = 4)


query  rowsort
SELECT count(`table_1`.`column_1`) AS `alias_1` FROM `table_1` INNER JOIN (SELECT count(`table_1`.`column_2`) AS `alias_2` FROM `table_1`) AS alias_3 ON (`table_1`.`column_2` = `alias_3`.`alias_2`)
----
0

query  rowsort
SELECT count(`table_1`.`column_3`) AS `alias_1` FROM `table_1` INNER JOIN (SELECT `table_1`.`column_2` AS `alias_2` FROM `table_1`) AS alias_3 ON (`table_1`.`column_2` = `alias_3`.`alias_2`)
----
5

query  rowsort
SELECT count(`table_1`.`column_4`) AS `alias_1` FROM `table_1` INNER JOIN (SELECT count(`table_1`.`column_5`) AS `alias_2` FROM `table_1`) AS alias_3 ON (`table_1`.`column_1` = `alias_3`.`alias_2`)
----
0

query  rowsort
SELECT `table_1`.`column_1` AS `alias_3` FROM `table_1` INNER JOIN (SELECT count(`table_1`.`column_6`) AS `alias_1` FROM `table_1`) AS alias_2 ON (`table_1`.`column_1` = `alias_2`.`alias_1`) WHERE (`table_1`.`column_1` > ?)
? = 10
----


query  rowsort
SELECT `table_1`.`column_1` AS `alias_3` FROM `table_1` INNER JOIN (SELECT `table_1`.`column_1` AS `alias_1` FROM `table_1`) AS alias_2 ON (`table_1`.`column_1` = `alias_2`.`alias_1`) WHERE (`table_1`.`column_1` > ?)
? = 10
----
908217183

query  rowsort
SELECT `table_1`.`column_1` AS `alias_3` FROM `table_1` INNER JOIN (SELECT count(`table_1`.`column_7`) AS `alias_1` FROM `table_1`) AS alias_2 ON (`table_1`.`column_1` = `alias_2`.`alias_1`) WHERE (`table_1`.`column_1` > ?)
? = 10
----


query  rowsort
SELECT count(`table_1`.`column_8`) AS `alias_1` FROM `table_1` INNER JOIN (SELECT count(`table_1`.`column_9`) AS `alias_2` FROM `table_1`) AS alias_3 ON (`table_1`.`column_8` = `alias_3`.`alias_2`) WHERE (`table_1`.`column_8` > ?)
? = 10
----
0

query  rowsort
SELECT count(`table_1`.`column_10`) AS `alias_1` FROM `table_1` INNER JOIN (SELECT `table_1`.`column_8` AS `alias_2` FROM `table_1`) AS alias_3 ON (`table_1`.`column_8` = `alias_3`.`alias_2`) WHERE (`table_1`.`column_8` > ?)
? = 10
----
1

query  rowsort
SELECT count(`table_1`.`column_11`) AS `alias_1` FROM `table_1` INNER JOIN (SELECT count(`table_1`.`column_12`) AS `alias_2` FROM `table_1`) AS alias_3 ON (`table_1`.`column_8` = `alias_3`.`alias_2`) WHERE (`table_1`.`column_8` > ?)
? = 10
----
0
