# Generated by:
#     target/debug/noria-logictest permute --compare-to mysql://root:noria@127.1/noria -d 3 -o logictests/generated/mysql/ --only range_param --random --include-deletes --rows-per-table 10 --subquery-depth 1 --overwrite-tests

statement ok
CREATE TABLE `table_1` (`column_1` INT, `column_5` INT, `column_2` INT, `column_8` INT, `column_7` INT, `column_9` INT, `column_4` INT, `column_3` INT, `column_6` INT, PRIMARY KEY (`column_9`))


statement ok
INSERT INTO `table_1` (`column_1`, `column_5`, `column_2`, `column_8`, `column_7`, `column_9`, `column_4`, `column_3`, `column_6`) VALUES (-1397041753, 222387308, 1398894179, 442018774, -1135832749, 0, -935420432, -291851018, -1496208704), (-1193699034, 557944065, 1223883567, 1986950194, -645095624, 1, 954209664, 692922073, -261625262), (489789890, 579375754, 1957995170, 390962333, -1894879278, 2, 639608928, 803979794, -1444911245), (903302127, 2057560409, 1039641587, 1588698258, 1364209716, 3, -238399219, -1709201384, 1710798925), (-957729334, 73403852, -73030614, -1544209330, 253966371, 4, 58072090, -633463318, -1219422185), (1241975404, -1738318200, 648965971, -588717089, 1007702349, 5, -601273204, 2063224400, -1789748846), (1358021861, -1183119365, 1129393189, -1575457430, -1643237319, 6, 1557610504, 1554704783, 174976918), (-1162766838, -1504405869, -1871583389, 615417743, -417756015, 7, -1014565237, 84714207, 2105226856), (-489155036, 2123114028, -1040814720, -805418961, -1332453125, 8, -705320144, 779849722, 1575773910), (-1326993749, 1870537103, 1970837408, 1624516818, -934704585, 9, -1244349432, -14014096, -837755065)


query  rowsort
SELECT count(`table_1`.`column_1`) AS `alias_1` FROM `table_1`
----
10

query  rowsort
SELECT min(`table_1`.`column_2`) AS `alias_1` FROM `table_1`
----
-1871583389

query  rowsort
SELECT `table_1`.`column_1` AS `alias_1` FROM `table_1` WHERE (`table_1`.`column_1` > ?)
? = 10
----
1241975404
1358021861
489789890
903302127

query  rowsort
SELECT count(`table_1`.`column_3`) AS `alias_1`, min(`table_1`.`column_4`) AS `alias_2` FROM `table_1`
----
10
-1244349432

query  rowsort
SELECT count(`table_1`.`column_5`) AS `alias_1` FROM `table_1` WHERE (`table_1`.`column_1` > ?)
? = 10
----
4

query  rowsort
SELECT min(`table_1`.`column_6`) AS `alias_1` FROM `table_1` WHERE (`table_1`.`column_1` > ?)
? = 10
----
-1789748846

query  rowsort
SELECT count(`table_1`.`column_7`) AS `alias_1`, min(`table_1`.`column_8`) AS `alias_2` FROM `table_1` WHERE (`table_1`.`column_1` > ?)
? = 10
----
4
-1575457430

statement ok
DELETE FROM `table_1` WHERE (`column_9` = 0)


statement ok
DELETE FROM `table_1` WHERE (`column_9` = 1)


statement ok
DELETE FROM `table_1` WHERE (`column_9` = 2)


statement ok
DELETE FROM `table_1` WHERE (`column_9` = 3)


statement ok
DELETE FROM `table_1` WHERE (`column_9` = 4)


query  rowsort
SELECT count(`table_1`.`column_1`) AS `alias_1` FROM `table_1`
----
5

query  rowsort
SELECT min(`table_1`.`column_2`) AS `alias_1` FROM `table_1`
----
-1871583389

query  rowsort
SELECT `table_1`.`column_1` AS `alias_1` FROM `table_1` WHERE (`table_1`.`column_1` > ?)
? = 10
----
1241975404
1358021861

query  rowsort
SELECT count(`table_1`.`column_3`) AS `alias_1`, min(`table_1`.`column_4`) AS `alias_2` FROM `table_1`
----
5
-1244349432

query  rowsort
SELECT count(`table_1`.`column_5`) AS `alias_1` FROM `table_1` WHERE (`table_1`.`column_1` > ?)
? = 10
----
2

query  rowsort
SELECT min(`table_1`.`column_6`) AS `alias_1` FROM `table_1` WHERE (`table_1`.`column_1` > ?)
? = 10
----
-1789748846

query  rowsort
SELECT count(`table_1`.`column_7`) AS `alias_1`, min(`table_1`.`column_8`) AS `alias_2` FROM `table_1` WHERE (`table_1`.`column_1` > ?)
? = 10
----
2
-1575457430
