# Generated by:
#     target/debug/noria-logictest permute --compare-to mysql://root:noria@127.1/noria -d 3 -o logictests/generated/mysql/ --only range_param --random --include-deletes --rows-per-table 10 --subquery-depth 1 --overwrite-tests

statement ok
CREATE TABLE `table_1` (`column_9` INT, `column_7` INT, `column_5` INT, `column_3` INT, `column_1` INT, `column_2` INT, `column_6` INT, `column_4` INT, `column_8` INT, PRIMARY KEY (`column_9`))


statement ok
INSERT INTO `table_1` (`column_9`, `column_7`, `column_5`, `column_3`, `column_1`, `column_2`, `column_6`, `column_4`, `column_8`) VALUES (0, 2059767210, 608690304, -911691620, 465988681, -1542055387, -1597364401, 394873734, -1848205745), (1, -34591383, -498693745, -961428172, -1444642311, -1961411752, -1722857101, -676458354, -906201902), (2, -241156848, -478690282, -1265433663, -411389550, -883993590, 1504797429, -544991429, -2146557207), (3, -317357489, -80261810, 1098222190, -1679275260, -1722303465, 473050216, -1657004582, 898279340), (4, -1081365905, 1954787939, -490564107, -563987078, 1616581895, -1526872182, 614759156, -741404582), (5, 1890145188, 394830197, 1826342239, -2031118289, -239892461, -11529553, 375133224, 1742246270), (6, -815746646, 1452685457, -1012581836, -455520027, 846137403, 1739812291, -1408559696, 909667575), (7, -289041551, 1859089907, 2090132219, -1337918572, -1515324975, -139726468, 1367221733, 622761214), (8, 575537300, 278425904, 810711510, 363202847, -218989375, -668724604, 1213790938, -1081459327), (9, -1238942158, -1872582864, 1921078151, -824432273, 537289163, 634683718, -1540520773, 461976560)


query  rowsort
SELECT count(distinct `table_1`.`column_1`) AS `alias_1` FROM `table_1`
----
10

query  rowsort
SELECT min(`table_1`.`column_2`) AS `alias_1` FROM `table_1`
----
-1961411752

query  rowsort
SELECT `table_1`.`column_1` AS `alias_1` FROM `table_1` WHERE (`table_1`.`column_1` > ?)
? = 10
----
363202847
465988681

query  rowsort
SELECT count(distinct `table_1`.`column_3`) AS `alias_1`, min(`table_1`.`column_4`) AS `alias_2` FROM `table_1`
----
10
-1657004582

query  rowsort
SELECT count(distinct `table_1`.`column_5`) AS `alias_1` FROM `table_1` WHERE (`table_1`.`column_1` > ?)
? = 10
----
2

query  rowsort
SELECT min(`table_1`.`column_6`) AS `alias_1` FROM `table_1` WHERE (`table_1`.`column_1` > ?)
? = 10
----
-1597364401

query  rowsort
SELECT count(distinct `table_1`.`column_7`) AS `alias_1`, min(`table_1`.`column_8`) AS `alias_2` FROM `table_1` WHERE (`table_1`.`column_7` > ?)
? = 10
----
3
-1848205745

statement ok
DELETE FROM `table_1` WHERE (`column_9` = 0)


statement ok
DELETE FROM `table_1` WHERE (`column_9` = 1)


statement ok
DELETE FROM `table_1` WHERE (`column_9` = 2)


statement ok
DELETE FROM `table_1` WHERE (`column_9` = 3)


statement ok
DELETE FROM `table_1` WHERE (`column_9` = 4)


query  rowsort
SELECT count(distinct `table_1`.`column_1`) AS `alias_1` FROM `table_1`
----
5

query  rowsort
SELECT min(`table_1`.`column_2`) AS `alias_1` FROM `table_1`
----
-1515324975

query  rowsort
SELECT `table_1`.`column_1` AS `alias_1` FROM `table_1` WHERE (`table_1`.`column_1` > ?)
? = 10
----
363202847

query  rowsort
SELECT count(distinct `table_1`.`column_3`) AS `alias_1`, min(`table_1`.`column_4`) AS `alias_2` FROM `table_1`
----
5
-1540520773

query  rowsort
SELECT count(distinct `table_1`.`column_5`) AS `alias_1` FROM `table_1` WHERE (`table_1`.`column_1` > ?)
? = 10
----
1

query  rowsort
SELECT min(`table_1`.`column_6`) AS `alias_1` FROM `table_1` WHERE (`table_1`.`column_1` > ?)
? = 10
----
-668724604

query  rowsort
SELECT count(distinct `table_1`.`column_7`) AS `alias_1`, min(`table_1`.`column_8`) AS `alias_2` FROM `table_1` WHERE (`table_1`.`column_7` > ?)
? = 10
----
2
-1081459327
