# Generated by:
#     target/debug/noria-logictest permute --compare-to mysql://root:noria@127.1/noria -d 3 -o logictests/generated/mysql/ --only range_param --random --include-deletes --rows-per-table 10 --subquery-depth 1 --overwrite-tests

statement ok
CREATE TABLE `table_2` (`column_4` INT, `column_6` INT, `column_8` INT, `column_5` INT, `column_3` INT, `column_9` INT, `column_1` INT, `column_2` INT, `column_7` INT, PRIMARY KEY (`column_9`))


statement ok
CREATE TABLE `table_3` (`column_2` INT, `column_3` INT, `column_1` INT, PRIMARY KEY (`column_3`))


statement ok
CREATE TABLE `table_1` (`column_2` INT, `column_3` INT, `column_1` INT, PRIMARY KEY (`column_3`))


statement ok
CREATE TABLE `table_5` (`column_1` INT, `column_2` INT, `column_3` INT, PRIMARY KEY (`column_3`))


statement ok
CREATE TABLE `table_4` (`column_2` INT, `column_3` INT, `column_1` INT, PRIMARY KEY (`column_3`))


statement ok
INSERT INTO `table_2` (`column_4`, `column_6`, `column_8`, `column_5`, `column_3`, `column_9`, `column_1`, `column_2`, `column_7`) VALUES (1761193683, -2077342880, 689549747, -1020793817, 1273930012, 0, -69707787, -1146014082, -616913266), (-1985209943, -2090841953, -1521563652, -1849152612, 1262055071, 1, 1539765957, 926160791, 943506436), (73882467, -359281783, -1681221861, 1928802212, 897194904, 2, -1718536549, 1723156036, -1450469914), (-922350075, -138391718, -354585591, -801853884, -549718647, 3, 1370902683, 412600569, 935796993), (-736880794, 278730552, -906028001, -1484682167, -626248068, 4, -2058393297, -1770238113, 489303213), (1643643609, 2066662484, 949589454, -971795989, 216247493, 5, 410312014, 554040457, 1196585022), (-1399626269, 647883790, -1169144374, -1578740176, -485970024, 6, -101528564, -2118396539, -2058572043), (2054689358, -1211908330, 926141115, 1310261079, 1174357635, 7, 702836621, -1686878393, 1694734382), (593736865, 1587089214, 408818854, 1003427140, 1551174261, 8, -1170210822, 1220485873, 1589809604), (472783590, -717041545, 1764402645, 1536914148, 1127734389, 9, -989349708, 168599116, -1801837984)


statement ok
INSERT INTO `table_3` (`column_2`, `column_3`, `column_1`) VALUES (-1718337009, 0, -1625215429), (1351284341, 1, 1864340808), (1263198112, 2, 382310583), (1660963695, 3, 1824984761), (1664360701, 4, -288818135), (1280795768, 5, 141184374), (-1652629405, 6, 1172533479), (-1884642902, 7, -148067403), (1975986660, 8, -2103838914), (2125336909, 9, 2094519824)


statement ok
INSERT INTO `table_1` (`column_2`, `column_3`, `column_1`) VALUES (-977314997, 0, 984479014), (-1445318755, 1, 1146645691), (881774165, 2, -636331539), (1600617303, 3, 427559974), (710970353, 4, 254078247), (-94719517, 5, 37689037), (1536347361, 6, -1405653542), (-642244084, 7, -1013122296), (2041238020, 8, -663424575), (1906069541, 9, -533863138)


statement ok
INSERT INTO `table_5` (`column_1`, `column_2`, `column_3`) VALUES (2046236038, -323430744, 0), (1789220489, -210747315, 1), (-1524247869, -1354895573, 2), (-1350730831, -635615464, 3), (1692014968, -1214728294, 4), (-414182577, 2055827598, 5), (473447668, -458811307, 6), (898388, -153485959, 7), (1498445460, -1948761059, 8), (-1365687119, -49960387, 9)


statement ok
INSERT INTO `table_4` (`column_2`, `column_3`, `column_1`) VALUES (-1019426561, 0, 1440299649), (-1543461427, 1, -342618140), (1703138444, 2, -319073832), (547003462, 3, 1701463314), (1582453831, 4, 356659007), (-1508746642, 5, -1659718890), (596812553, 6, -54734046), (-971633614, 7, -726182253), (-897144374, 8, -486085781), (1106144811, 9, 1376024104)


query  rowsort
SELECT count(`table_1`.`column_1`) AS `alias_1` FROM `table_1`
----
10

query  rowsort
SELECT `table_1`.`column_2` AS `alias_1`, `table_2`.`column_2` AS `alias_2` FROM `table_1` LEFT JOIN `table_2` ON (`table_1`.`column_1` = `table_2`.`column_1`)
----
-1445318755
NULL
-642244084
NULL
-94719517
NULL
-977314997
NULL
1536347361
NULL
1600617303
NULL
1906069541
NULL
2041238020
NULL
710970353
NULL
881774165
NULL

query  rowsort
SELECT `table_2`.`column_1` AS `alias_1` FROM `table_2` WHERE (`table_2`.`column_1` > ?)
? = 10
----
1370902683
1539765957
410312014
702836621

query  rowsort
SELECT count(`table_2`.`column_3`) AS `alias_1`, `table_2`.`column_4` AS `alias_2`, `table_3`.`column_2` AS `alias_3` FROM `table_2` LEFT JOIN `table_3` ON (`table_2`.`column_1` = `table_3`.`column_1`) GROUP BY `table_2`.`column_4`, `table_3`.`column_2`
----
30 values hashing to 68e45119d50e1d444a29f45453d95e63

query  rowsort
SELECT count(`table_2`.`column_5`) AS `alias_1` FROM `table_2` WHERE (`table_2`.`column_4` > ?)
? = 10
----
6

query  rowsort
SELECT `table_2`.`column_6` AS `alias_1`, `table_4`.`column_2` AS `alias_2` FROM `table_2` LEFT JOIN `table_4` ON (`table_2`.`column_4` = `table_4`.`column_1`) WHERE (`table_2`.`column_4` > ?)
? = 10
----
-1211908330
NULL
-2077342880
NULL
-359281783
NULL
-717041545
NULL
1587089214
NULL
2066662484
NULL

query  rowsort
SELECT count(`table_2`.`column_7`) AS `alias_1`, `table_2`.`column_8` AS `alias_2`, `table_5`.`column_2` AS `alias_3` FROM `table_2` LEFT JOIN `table_5` ON (`table_2`.`column_4` = `table_5`.`column_1`) WHERE (`table_2`.`column_4` > ?) GROUP BY `table_2`.`column_8`, `table_5`.`column_2`
? = 10
----
1
-1681221861
NULL
1
1764402645
NULL
1
408818854
NULL
1
689549747
NULL
1
926141115
NULL
1
949589454
NULL

statement ok
DELETE FROM `table_2` WHERE (`column_9` = 0)


statement ok
DELETE FROM `table_2` WHERE (`column_9` = 1)


statement ok
DELETE FROM `table_2` WHERE (`column_9` = 2)


statement ok
DELETE FROM `table_2` WHERE (`column_9` = 3)


statement ok
DELETE FROM `table_2` WHERE (`column_9` = 4)


statement ok
DELETE FROM `table_3` WHERE (`column_3` = 0)


statement ok
DELETE FROM `table_3` WHERE (`column_3` = 1)


statement ok
DELETE FROM `table_3` WHERE (`column_3` = 2)


statement ok
DELETE FROM `table_3` WHERE (`column_3` = 3)


statement ok
DELETE FROM `table_3` WHERE (`column_3` = 4)


statement ok
DELETE FROM `table_1` WHERE (`column_3` = 0)


statement ok
DELETE FROM `table_1` WHERE (`column_3` = 1)


statement ok
DELETE FROM `table_1` WHERE (`column_3` = 2)


statement ok
DELETE FROM `table_1` WHERE (`column_3` = 3)


statement ok
DELETE FROM `table_1` WHERE (`column_3` = 4)


statement ok
DELETE FROM `table_5` WHERE (`column_3` = 0)


statement ok
DELETE FROM `table_5` WHERE (`column_3` = 1)


statement ok
DELETE FROM `table_5` WHERE (`column_3` = 2)


statement ok
DELETE FROM `table_5` WHERE (`column_3` = 3)


statement ok
DELETE FROM `table_5` WHERE (`column_3` = 4)


statement ok
DELETE FROM `table_4` WHERE (`column_3` = 0)


statement ok
DELETE FROM `table_4` WHERE (`column_3` = 1)


statement ok
DELETE FROM `table_4` WHERE (`column_3` = 2)


statement ok
DELETE FROM `table_4` WHERE (`column_3` = 3)


statement ok
DELETE FROM `table_4` WHERE (`column_3` = 4)


query  rowsort
SELECT count(`table_1`.`column_1`) AS `alias_1` FROM `table_1`
----
5

query  rowsort
SELECT `table_1`.`column_2` AS `alias_1`, `table_2`.`column_2` AS `alias_2` FROM `table_1` LEFT JOIN `table_2` ON (`table_1`.`column_1` = `table_2`.`column_1`)
----
-642244084
NULL
-94719517
NULL
1536347361
NULL
1906069541
NULL
2041238020
NULL

query  rowsort
SELECT `table_2`.`column_1` AS `alias_1` FROM `table_2` WHERE (`table_2`.`column_1` > ?)
? = 10
----
410312014
702836621

query  rowsort
SELECT count(`table_2`.`column_3`) AS `alias_1`, `table_2`.`column_4` AS `alias_2`, `table_3`.`column_2` AS `alias_3` FROM `table_2` LEFT JOIN `table_3` ON (`table_2`.`column_1` = `table_3`.`column_1`) GROUP BY `table_2`.`column_4`, `table_3`.`column_2`
----
1
-1399626269
NULL
1
1643643609
NULL
1
2054689358
NULL
1
472783590
NULL
1
593736865
NULL

query  rowsort
SELECT count(`table_2`.`column_5`) AS `alias_1` FROM `table_2` WHERE (`table_2`.`column_4` > ?)
? = 10
----
4

query  rowsort
SELECT `table_2`.`column_6` AS `alias_1`, `table_4`.`column_2` AS `alias_2` FROM `table_2` LEFT JOIN `table_4` ON (`table_2`.`column_4` = `table_4`.`column_1`) WHERE (`table_2`.`column_4` > ?)
? = 10
----
-1211908330
NULL
-717041545
NULL
1587089214
NULL
2066662484
NULL

query  rowsort
SELECT count(`table_2`.`column_7`) AS `alias_1`, `table_2`.`column_8` AS `alias_2`, `table_5`.`column_2` AS `alias_3` FROM `table_2` LEFT JOIN `table_5` ON (`table_2`.`column_4` = `table_5`.`column_1`) WHERE (`table_2`.`column_4` > ?) GROUP BY `table_2`.`column_8`, `table_5`.`column_2`
? = 10
----
1
1764402645
NULL
1
408818854
NULL
1
926141115
NULL
1
949589454
NULL
