# Generated by:
#     target/debug/noria-logictest permute --compare-to mysql://root:noria@127.1/noria -d 3 -o logictests/generated/mysql/ --only range_param --random --include-deletes --rows-per-table 10 --subquery-depth 1 --overwrite-tests

statement ok
CREATE TABLE `table_1` (`column_1` INT, `column_5` INT, `column_3` INT, `column_2` INT, `column_7` INT, `column_4` INT, `column_6` INT, `column_8` INT, `column_9` INT, PRIMARY KEY (`column_9`))


statement ok
INSERT INTO `table_1` (`column_1`, `column_5`, `column_3`, `column_2`, `column_7`, `column_4`, `column_6`, `column_8`, `column_9`) VALUES (-2011564309, -1357412444, -1075124726, -45336256, -503320041, 1933092433, -1025651118, 2130820041, 0), (-1624568877, 225669651, -1515359351, 885925610, -1963763577, -876766913, 1125806809, 1881221233, 1), (1210748061, -711146880, 913161979, 1079678717, -1599332866, -437574969, -918044025, 264231713, 2), (973894071, 1657252639, 485696479, -1342174339, -869910975, 2122972928, -18955294, -205843775, 3), (1121986481, 1518375425, -546167200, -1945474265, 1582350422, -1414901325, -237266417, 382471109, 4), (578582209, -290976035, -629620055, -841546999, -516166904, 166946113, 882766797, 143674702, 5), (1542965675, 1904633950, -1490497978, -1682085228, 1718943919, 546475489, -1102008187, -754415320, 6), (1015607227, 259333910, 1211061960, 125239107, 705332711, 314258275, 1265369738, -1279613231, 7), (-1750488595, 146272487, -2032844495, 1941697597, -1732729081, -215503498, -1481911349, -523604139, 8), (-839020780, 1062325345, 1631870126, 1514957061, 406647070, 633437171, 2014386936, 872104493, 9)


query  rowsort
SELECT count(distinct `table_1`.`column_1`) AS `alias_1` FROM `table_1`
----
10

query  rowsort
SELECT max(`table_1`.`column_2`) AS `alias_1` FROM `table_1`
----
1941697597

query  rowsort
SELECT `table_1`.`column_1` AS `alias_1` FROM `table_1` WHERE (`table_1`.`column_1` > ?)
? = 10
----
1015607227
1121986481
1210748061
1542965675
578582209
973894071

query  rowsort
SELECT count(distinct `table_1`.`column_3`) AS `alias_1`, max(`table_1`.`column_4`) AS `alias_2` FROM `table_1`
----
10
2122972928

query  rowsort
SELECT count(distinct `table_1`.`column_5`) AS `alias_1` FROM `table_1` WHERE (`table_1`.`column_1` > ?)
? = 10
----
6

query  rowsort
SELECT max(`table_1`.`column_6`) AS `alias_1` FROM `table_1` WHERE (`table_1`.`column_1` > ?)
? = 10
----
1265369738

query  rowsort
SELECT count(distinct `table_1`.`column_7`) AS `alias_1`, max(`table_1`.`column_8`) AS `alias_2` FROM `table_1` WHERE (`table_1`.`column_1` > ?)
? = 10
----
6
382471109

statement ok
DELETE FROM `table_1` WHERE (`column_9` = 0)


statement ok
DELETE FROM `table_1` WHERE (`column_9` = 1)


statement ok
DELETE FROM `table_1` WHERE (`column_9` = 2)


statement ok
DELETE FROM `table_1` WHERE (`column_9` = 3)


statement ok
DELETE FROM `table_1` WHERE (`column_9` = 4)


query  rowsort
SELECT count(distinct `table_1`.`column_1`) AS `alias_1` FROM `table_1`
----
5

query  rowsort
SELECT max(`table_1`.`column_2`) AS `alias_1` FROM `table_1`
----
1941697597

query  rowsort
SELECT `table_1`.`column_1` AS `alias_1` FROM `table_1` WHERE (`table_1`.`column_1` > ?)
? = 10
----
1015607227
1542965675
578582209

query  rowsort
SELECT count(distinct `table_1`.`column_3`) AS `alias_1`, max(`table_1`.`column_4`) AS `alias_2` FROM `table_1`
----
5
633437171

query  rowsort
SELECT count(distinct `table_1`.`column_5`) AS `alias_1` FROM `table_1` WHERE (`table_1`.`column_1` > ?)
? = 10
----
3

query  rowsort
SELECT max(`table_1`.`column_6`) AS `alias_1` FROM `table_1` WHERE (`table_1`.`column_1` > ?)
? = 10
----
1265369738

query  rowsort
SELECT count(distinct `table_1`.`column_7`) AS `alias_1`, max(`table_1`.`column_8`) AS `alias_2` FROM `table_1` WHERE (`table_1`.`column_1` > ?)
? = 10
----
3
143674702
