# Generated by:
#     target/debug/noria-logictest permute --compare-to mysql://root:noria@127.1/noria -d 3 -o logictests/generated/mysql/ --only range_param --random --include-deletes --rows-per-table 10 --subquery-depth 1

statement ok
CREATE TABLE `table_11` (`column_2` INT, `column_4` INT, `column_5` INT, `column_1` INT, `column_3` INT, PRIMARY KEY (`column_5`))


statement ok
CREATE TABLE `table_5` (`column_3` INT, `column_2` INT, `column_4` INT, `column_6` INT, `column_1` INT, `column_8` INT, `column_7` INT, `column_5` INT, PRIMARY KEY (`column_8`))


statement ok
CREATE TABLE `table_7` (`column_2` INT, `column_1` INT, `column_3` INT, `column_4` INT, PRIMARY KEY (`column_4`))


statement ok
CREATE TABLE `table_3` (`column_1` INT, `column_2` INT, `column_3` INT, `column_4` INT, `column_5` INT, PRIMARY KEY (`column_5`))


statement ok
CREATE TABLE `table_4` (`column_1` INT, `column_3` INT, `column_2` INT, PRIMARY KEY (`column_3`))


statement ok
CREATE TABLE `table_6` (`column_1` INT, `column_3` INT, `column_2` INT, PRIMARY KEY (`column_3`))


statement ok
CREATE TABLE `table_9` (`column_3` INT, `column_1` INT, `column_2` INT, PRIMARY KEY (`column_3`))


statement ok
CREATE TABLE `table_12` (`column_2` INT, `column_1` INT, `column_3` INT, PRIMARY KEY (`column_3`))


statement ok
CREATE TABLE `table_1` (`column_3` INT, `column_2` INT, `column_4` INT, `column_1` INT, PRIMARY KEY (`column_4`))


statement ok
CREATE TABLE `table_8` (`column_2` INT, `column_3` INT, `column_1` INT, PRIMARY KEY (`column_3`))


statement ok
CREATE TABLE `table_2` (`column_2` INT, `column_1` INT, `column_3` INT, PRIMARY KEY (`column_3`))


statement ok
CREATE TABLE `table_13` (`column_3` INT, `column_1` INT, `column_2` INT, PRIMARY KEY (`column_3`))


statement ok
CREATE TABLE `table_10` (`column_1` INT, `column_3` INT, `column_2` INT, PRIMARY KEY (`column_3`))


statement ok
INSERT INTO `table_11` (`column_2`, `column_4`, `column_5`, `column_1`, `column_3`) VALUES (-1982219886, -522145668, 0, -1941704246, 1932099148), (-2089272200, 403996770, 1, -1412717464, -1522713212), (1402004633, -514568677, 2, 209958172, 973496724), (-1457547154, 1853957512, 3, -1651348561, 1470684064), (844108670, 345861835, 4, -701192961, -365079804), (-1855265894, 443791467, 5, 2073159309, -395347446), (-219999882, 1238855302, 6, 2120919593, 985640425), (-1447258842, 294491736, 7, -120543506, 1827718674), (-411625430, 1693801009, 8, 2125438096, -11876718), (-2078386966, 1572896242, 9, 392591365, 363228189)


statement ok
INSERT INTO `table_5` (`column_3`, `column_2`, `column_4`, `column_6`, `column_1`, `column_8`, `column_7`, `column_5`) VALUES (970165904, 615692194, -1384538100, 1982485404, -740861327, 0, -2131526145, -1075330813), (-30767336, 1944035993, -1592596242, -372447537, 1981386820, 1, -1080614403, 903567916), (-2013410205, -1274403496, 1634977714, 39129919, -1332038649, 2, 83109968, -1768648960), (-1340002141, 1982180743, 900214156, -1484582892, 1817681613, 3, 2138503330, 912497926), (-271530546, -1110639116, 1174496935, 266931959, 132411057, 4, 389528945, 1569326531), (995298888, 1219352690, 152621945, -1961873103, -511448958, 5, 966885456, -1819748764), (996816523, 1470222001, 586416917, 1416928202, 1094560621, 6, 2061331819, -1125485509), (-1360268420, -1499218944, 51770397, 1183495808, 1953026196, 7, 1992643748, -1871084868), (414886615, 956650678, -1153980243, 803200756, 1598154774, 8, 1646850200, -1154830067), (-1222676804, 2067748090, -1214029995, -1430048239, -854795205, 9, -961371585, -78788182)


statement ok
INSERT INTO `table_7` (`column_2`, `column_1`, `column_3`, `column_4`) VALUES (-690105988, 192270404, -131786288, 0), (1589887050, 1211884595, 1209004779, 1), (752837942, -2038901978, 765181920, 2), (696459227, 189636432, 1936205377, 3), (1852411490, 1961454530, 448202473, 4), (-59790686, -1398044360, -878360485, 5), (62069779, 885008268, -804191583, 6), (-1548937742, 1961357848, -2063883130, 7), (-679001780, -34932568, -612002698, 8), (1426837951, 1012138721, 51717119, 9)


statement ok
INSERT INTO `table_3` (`column_1`, `column_2`, `column_3`, `column_4`, `column_5`) VALUES (-1195493126, -1391886510, -1436091670, -8477888, 0), (1867279983, -911923498, -206898446, 1906021038, 1), (176027025, -1446263344, 134298424, 1575442303, 2), (2050926348, -919503190, 15838939, 883689353, 3), (-2078299689, 534559568, -1606046188, -1814801812, 4), (-618816885, -1090262832, -1862588337, 556057068, 5), (752996678, -1299131545, -580380560, -999763480, 6), (1101581389, -1931310176, 1491970614, -1128510004, 7), (-813419176, 651476556, -703525185, 1512487268, 8), (-1677181813, -636715149, -1320752089, -1238301672, 9)


statement ok
INSERT INTO `table_4` (`column_1`, `column_3`, `column_2`) VALUES (-1767886125, 0, -2109657356), (-1912192558, 1, 979164008), (1127016766, 2, -1533312057), (-272025275, 3, -367450046), (-1905968102, 4, 13346912), (601760383, 5, -1658293443), (-435305884, 6, -1505046476), (-2030940528, 7, 473137392), (751351445, 8, 1392927506), (-821072894, 9, 1182214835)


statement ok
INSERT INTO `table_6` (`column_1`, `column_3`, `column_2`) VALUES (278305657, 0, -1237322471), (-701787232, 1, -45235297), (-1338490340, 2, -1523980587), (-1652624646, 3, 666605888), (406637185, 4, 34332303), (846480550, 5, -1703121393), (566206774, 6, 720652811), (780001280, 7, 1589322892), (1957110583, 8, 47329770), (2126408449, 9, 920444358)


statement ok
INSERT INTO `table_9` (`column_3`, `column_1`, `column_2`) VALUES (0, 1751693404, -1223119226), (1, -794870233, 863658175), (2, 638773806, -417395843), (3, -2128491442, -362471999), (4, -1861231742, 114518131), (5, 755993108, 1543938788), (6, -465985608, -1652688528), (7, 824084031, 346217864), (8, 1035873565, 2106871700), (9, -1092967499, 306011027)


statement ok
INSERT INTO `table_12` (`column_2`, `column_1`, `column_3`) VALUES (-1832557800, -54481618, 0), (22914727, -1966057678, 1), (-802875245, -1651177762, 2), (-282442590, 793483681, 3), (-550349984, -121321634, 4), (411784068, 1530273446, 5), (-617218553, 44037306, 6), (630698881, -955416760, 7), (-233715321, -896788577, 8), (1948556521, 449843789, 9)


statement ok
INSERT INTO `table_1` (`column_3`, `column_2`, `column_4`, `column_1`) VALUES (1389726723, 2115773527, 0, 67098373), (-913615971, -604806763, 1, 446900092), (1541946393, -1392351496, 2, 573429029), (1025231946, 1632427883, 3, 1438498180), (-1964823637, -1967667844, 4, 2039200714), (-1845525362, -1388829676, 5, -597090272), (-1337813905, -1484154086, 6, 1454409084), (1095079486, 1533408148, 7, -1206394083), (1384816824, -2078893566, 8, -440435929), (1631495784, -1588269360, 9, -146808265)


statement ok
INSERT INTO `table_8` (`column_2`, `column_3`, `column_1`) VALUES (1428637591, 0, 1652576641), (230777483, 1, 1414127075), (787072178, 2, -1670379093), (-210851074, 3, 1127127165), (-2070694894, 4, 727992944), (237840949, 5, 1327991446), (-302052626, 6, 1405331122), (1925134499, 7, -1470678328), (-398399212, 8, 1514123662), (1572268011, 9, -1005942845)


statement ok
INSERT INTO `table_2` (`column_2`, `column_1`, `column_3`) VALUES (-1486425200, -1488563662, 0), (1780213405, 960946302, 1), (291390214, -1164612906, 2), (-1499784462, 629844075, 3), (201978935, 1964938553, 4), (-1922621991, 34632695, 5), (-1004206432, -2081836992, 6), (987290381, 1203181446, 7), (807716364, 1011439627, 8), (-1712536269, 1786045084, 9)


statement ok
INSERT INTO `table_13` (`column_3`, `column_1`, `column_2`) VALUES (0, -1971098648, 1610799941), (1, -2052434077, 1531768392), (2, -73052887, -756712835), (3, 1762553791, -15277153), (4, -1071816315, 341033892), (5, -454302362, -452189064), (6, -523541499, -922920491), (7, 1434021544, -132148402), (8, 68233123, 1434273170), (9, -899846384, -923913454)


statement ok
INSERT INTO `table_10` (`column_1`, `column_3`, `column_2`) VALUES (335590711, 0, -594221684), (-1977586571, 1, -554652106), (204244130, 2, 395356882), (355627974, 3, 1967561363), (767671224, 4, -633788021), (864452136, 5, 1398290489), (387335948, 6, 973749129), (-1465599149, 7, -176179061), (-43045118, 8, -625313531), (-206921799, 9, -1275585702)


query  rowsort
WITH `alias_5` AS (SELECT `table_1`.`column_3` AS `alias_3`, `table_3`.`column_2` AS `alias_4` FROM `table_1` LEFT JOIN `table_3` ON (`table_1`.`column_1` = `table_3`.`column_1`)) SELECT `table_1`.`column_2` AS `alias_1`, `table_2`.`column_2` AS `alias_2` FROM `table_1` LEFT JOIN `table_2` ON (`table_1`.`column_1` = `table_2`.`column_1`) INNER JOIN `alias_5` ON (`table_1`.`column_3` = `alias_5`.`alias_3`)
----
-1388829676
NULL
-1392351496
NULL
-1484154086
NULL
-1588269360
NULL
-1967667844
NULL
-2078893566
NULL
-604806763
NULL
1533408148
NULL
1632427883
NULL
2115773527
NULL

query  rowsort
WITH `alias_4` AS (SELECT `table_3`.`column_1` AS `alias_3` FROM `table_3`) SELECT `table_3`.`column_3` AS `alias_1`, `table_4`.`column_2` AS `alias_2` FROM `table_3` LEFT JOIN `table_4` ON (`table_3`.`column_1` = `table_4`.`column_1`) INNER JOIN `alias_4` ON (`table_3`.`column_1` = `alias_4`.`alias_3`)
----
-1320752089
NULL
-1436091670
NULL
-1606046188
NULL
-1862588337
NULL
-206898446
NULL
-580380560
NULL
-703525185
NULL
134298424
NULL
1491970614
NULL
15838939
NULL

query  rowsort
WITH `alias_5` AS (SELECT `table_5`.`column_3` AS `alias_3`, `table_6`.`column_2` AS `alias_4` FROM `table_5` LEFT JOIN `table_6` ON (`table_5`.`column_2` = `table_6`.`column_1`)) SELECT `table_3`.`column_4` AS `alias_1`, `table_5`.`column_2` AS `alias_2` FROM `table_3` LEFT JOIN `table_5` ON (`table_3`.`column_1` = `table_5`.`column_1`) INNER JOIN `alias_5` ON (`table_3`.`column_1` = `alias_5`.`alias_3`)
----


query  rowsort
WITH `alias_3` AS (SELECT `table_5`.`column_4` AS `alias_1`, `table_7`.`column_2` AS `alias_2` FROM `table_5` LEFT JOIN `table_7` ON (`table_5`.`column_2` = `table_7`.`column_1`)) SELECT `table_5`.`column_3` AS `alias_4` FROM `table_5` INNER JOIN `alias_3` ON (`table_5`.`column_3` = `alias_3`.`alias_1`) WHERE (`table_5`.`column_2` > ?)
? = 10
----


query  rowsort
WITH `alias_2` AS (SELECT `table_7`.`column_2` AS `alias_1` FROM `table_7`) SELECT `table_7`.`column_2` AS `alias_3` FROM `table_7` INNER JOIN `alias_2` ON (`table_7`.`column_2` = `alias_2`.`alias_1`) WHERE (`table_7`.`column_2` > ?)
? = 10
----
1426837951
1589887050
1852411490
62069779
696459227
752837942

query  rowsort
WITH `alias_3` AS (SELECT `table_7`.`column_3` AS `alias_1`, `table_8`.`column_2` AS `alias_2` FROM `table_7` LEFT JOIN `table_8` ON (`table_7`.`column_2` = `table_8`.`column_1`)) SELECT `table_7`.`column_2` AS `alias_4` FROM `table_7` INNER JOIN `alias_3` ON (`table_7`.`column_2` = `alias_3`.`alias_1`) WHERE (`table_7`.`column_2` > ?)
? = 10
----


query  rowsort
WITH `alias_5` AS (SELECT `table_5`.`column_6` AS `alias_3`, `table_10`.`column_2` AS `alias_4` FROM `table_5` LEFT JOIN `table_10` ON (`table_5`.`column_3` = `table_10`.`column_1`)) SELECT `table_5`.`column_5` AS `alias_1`, `table_9`.`column_2` AS `alias_2` FROM `table_5` LEFT JOIN `table_9` ON (`table_5`.`column_3` = `table_9`.`column_1`) INNER JOIN `alias_5` ON (`table_5`.`column_3` = `alias_5`.`alias_3`) WHERE (`table_5`.`column_3` > ?)
? = 10
----


query  rowsort
WITH `alias_4` AS (SELECT `table_11`.`column_2` AS `alias_3` FROM `table_11`) SELECT `table_5`.`column_7` AS `alias_1`, `table_11`.`column_2` AS `alias_2` FROM `table_5` LEFT JOIN `table_11` ON (`table_5`.`column_3` = `table_11`.`column_1`) INNER JOIN `alias_4` ON (`table_5`.`column_3` = `alias_4`.`alias_3`) WHERE (`table_5`.`column_3` > ?)
? = 10
----


query  rowsort
WITH `alias_5` AS (SELECT `table_11`.`column_4` AS `alias_3`, `table_13`.`column_2` AS `alias_4` FROM `table_11` LEFT JOIN `table_13` ON (`table_11`.`column_2` = `table_13`.`column_1`)) SELECT `table_11`.`column_3` AS `alias_1`, `table_12`.`column_2` AS `alias_2` FROM `table_11` LEFT JOIN `table_12` ON (`table_11`.`column_2` = `table_12`.`column_1`) INNER JOIN `alias_5` ON (`table_11`.`column_2` = `alias_5`.`alias_3`) WHERE (`table_11`.`column_2` > ?)
? = 10
----


statement ok
DELETE FROM `table_11` WHERE (`column_5` = 0)


statement ok
DELETE FROM `table_11` WHERE (`column_5` = 1)


statement ok
DELETE FROM `table_11` WHERE (`column_5` = 2)


statement ok
DELETE FROM `table_11` WHERE (`column_5` = 3)


statement ok
DELETE FROM `table_11` WHERE (`column_5` = 4)


statement ok
DELETE FROM `table_5` WHERE (`column_8` = 0)


statement ok
DELETE FROM `table_5` WHERE (`column_8` = 1)


statement ok
DELETE FROM `table_5` WHERE (`column_8` = 2)


statement ok
DELETE FROM `table_5` WHERE (`column_8` = 3)


statement ok
DELETE FROM `table_5` WHERE (`column_8` = 4)


statement ok
DELETE FROM `table_7` WHERE (`column_4` = 0)


statement ok
DELETE FROM `table_7` WHERE (`column_4` = 1)


statement ok
DELETE FROM `table_7` WHERE (`column_4` = 2)


statement ok
DELETE FROM `table_7` WHERE (`column_4` = 3)


statement ok
DELETE FROM `table_7` WHERE (`column_4` = 4)


statement ok
DELETE FROM `table_3` WHERE (`column_5` = 0)


statement ok
DELETE FROM `table_3` WHERE (`column_5` = 1)


statement ok
DELETE FROM `table_3` WHERE (`column_5` = 2)


statement ok
DELETE FROM `table_3` WHERE (`column_5` = 3)


statement ok
DELETE FROM `table_3` WHERE (`column_5` = 4)


statement ok
DELETE FROM `table_4` WHERE (`column_3` = 0)


statement ok
DELETE FROM `table_4` WHERE (`column_3` = 1)


statement ok
DELETE FROM `table_4` WHERE (`column_3` = 2)


statement ok
DELETE FROM `table_4` WHERE (`column_3` = 3)


statement ok
DELETE FROM `table_4` WHERE (`column_3` = 4)


statement ok
DELETE FROM `table_6` WHERE (`column_3` = 0)


statement ok
DELETE FROM `table_6` WHERE (`column_3` = 1)


statement ok
DELETE FROM `table_6` WHERE (`column_3` = 2)


statement ok
DELETE FROM `table_6` WHERE (`column_3` = 3)


statement ok
DELETE FROM `table_6` WHERE (`column_3` = 4)


statement ok
DELETE FROM `table_9` WHERE (`column_3` = 0)


statement ok
DELETE FROM `table_9` WHERE (`column_3` = 1)


statement ok
DELETE FROM `table_9` WHERE (`column_3` = 2)


statement ok
DELETE FROM `table_9` WHERE (`column_3` = 3)


statement ok
DELETE FROM `table_9` WHERE (`column_3` = 4)


statement ok
DELETE FROM `table_12` WHERE (`column_3` = 0)


statement ok
DELETE FROM `table_12` WHERE (`column_3` = 1)


statement ok
DELETE FROM `table_12` WHERE (`column_3` = 2)


statement ok
DELETE FROM `table_12` WHERE (`column_3` = 3)


statement ok
DELETE FROM `table_12` WHERE (`column_3` = 4)


statement ok
DELETE FROM `table_1` WHERE (`column_4` = 0)


statement ok
DELETE FROM `table_1` WHERE (`column_4` = 1)


statement ok
DELETE FROM `table_1` WHERE (`column_4` = 2)


statement ok
DELETE FROM `table_1` WHERE (`column_4` = 3)


statement ok
DELETE FROM `table_1` WHERE (`column_4` = 4)


statement ok
DELETE FROM `table_8` WHERE (`column_3` = 0)


statement ok
DELETE FROM `table_8` WHERE (`column_3` = 1)


statement ok
DELETE FROM `table_8` WHERE (`column_3` = 2)


statement ok
DELETE FROM `table_8` WHERE (`column_3` = 3)


statement ok
DELETE FROM `table_8` WHERE (`column_3` = 4)


statement ok
DELETE FROM `table_2` WHERE (`column_3` = 0)


statement ok
DELETE FROM `table_2` WHERE (`column_3` = 1)


statement ok
DELETE FROM `table_2` WHERE (`column_3` = 2)


statement ok
DELETE FROM `table_2` WHERE (`column_3` = 3)


statement ok
DELETE FROM `table_2` WHERE (`column_3` = 4)


statement ok
DELETE FROM `table_13` WHERE (`column_3` = 0)


statement ok
DELETE FROM `table_13` WHERE (`column_3` = 1)


statement ok
DELETE FROM `table_13` WHERE (`column_3` = 2)


statement ok
DELETE FROM `table_13` WHERE (`column_3` = 3)


statement ok
DELETE FROM `table_13` WHERE (`column_3` = 4)


statement ok
DELETE FROM `table_10` WHERE (`column_3` = 0)


statement ok
DELETE FROM `table_10` WHERE (`column_3` = 1)


statement ok
DELETE FROM `table_10` WHERE (`column_3` = 2)


statement ok
DELETE FROM `table_10` WHERE (`column_3` = 3)


statement ok
DELETE FROM `table_10` WHERE (`column_3` = 4)


query  rowsort
WITH `alias_5` AS (SELECT `table_1`.`column_3` AS `alias_3`, `table_3`.`column_2` AS `alias_4` FROM `table_1` LEFT JOIN `table_3` ON (`table_1`.`column_1` = `table_3`.`column_1`)) SELECT `table_1`.`column_2` AS `alias_1`, `table_2`.`column_2` AS `alias_2` FROM `table_1` LEFT JOIN `table_2` ON (`table_1`.`column_1` = `table_2`.`column_1`) INNER JOIN `alias_5` ON (`table_1`.`column_3` = `alias_5`.`alias_3`)
----
-1388829676
NULL
-1484154086
NULL
-1588269360
NULL
-2078893566
NULL
1533408148
NULL

query  rowsort
WITH `alias_4` AS (SELECT `table_3`.`column_1` AS `alias_3` FROM `table_3`) SELECT `table_3`.`column_3` AS `alias_1`, `table_4`.`column_2` AS `alias_2` FROM `table_3` LEFT JOIN `table_4` ON (`table_3`.`column_1` = `table_4`.`column_1`) INNER JOIN `alias_4` ON (`table_3`.`column_1` = `alias_4`.`alias_3`)
----
-1320752089
NULL
-1862588337
NULL
-580380560
NULL
-703525185
NULL
1491970614
NULL

query  rowsort
WITH `alias_5` AS (SELECT `table_5`.`column_3` AS `alias_3`, `table_6`.`column_2` AS `alias_4` FROM `table_5` LEFT JOIN `table_6` ON (`table_5`.`column_2` = `table_6`.`column_1`)) SELECT `table_3`.`column_4` AS `alias_1`, `table_5`.`column_2` AS `alias_2` FROM `table_3` LEFT JOIN `table_5` ON (`table_3`.`column_1` = `table_5`.`column_1`) INNER JOIN `alias_5` ON (`table_3`.`column_1` = `alias_5`.`alias_3`)
----


query  rowsort
WITH `alias_3` AS (SELECT `table_5`.`column_4` AS `alias_1`, `table_7`.`column_2` AS `alias_2` FROM `table_5` LEFT JOIN `table_7` ON (`table_5`.`column_2` = `table_7`.`column_1`)) SELECT `table_5`.`column_3` AS `alias_4` FROM `table_5` INNER JOIN `alias_3` ON (`table_5`.`column_3` = `alias_3`.`alias_1`) WHERE (`table_5`.`column_2` > ?)
? = 10
----


query  rowsort
WITH `alias_2` AS (SELECT `table_7`.`column_2` AS `alias_1` FROM `table_7`) SELECT `table_7`.`column_2` AS `alias_3` FROM `table_7` INNER JOIN `alias_2` ON (`table_7`.`column_2` = `alias_2`.`alias_1`) WHERE (`table_7`.`column_2` > ?)
? = 10
----
1426837951
62069779

query  rowsort
WITH `alias_3` AS (SELECT `table_7`.`column_3` AS `alias_1`, `table_8`.`column_2` AS `alias_2` FROM `table_7` LEFT JOIN `table_8` ON (`table_7`.`column_2` = `table_8`.`column_1`)) SELECT `table_7`.`column_2` AS `alias_4` FROM `table_7` INNER JOIN `alias_3` ON (`table_7`.`column_2` = `alias_3`.`alias_1`) WHERE (`table_7`.`column_2` > ?)
? = 10
----


query  rowsort
WITH `alias_5` AS (SELECT `table_5`.`column_6` AS `alias_3`, `table_10`.`column_2` AS `alias_4` FROM `table_5` LEFT JOIN `table_10` ON (`table_5`.`column_3` = `table_10`.`column_1`)) SELECT `table_5`.`column_5` AS `alias_1`, `table_9`.`column_2` AS `alias_2` FROM `table_5` LEFT JOIN `table_9` ON (`table_5`.`column_3` = `table_9`.`column_1`) INNER JOIN `alias_5` ON (`table_5`.`column_3` = `alias_5`.`alias_3`) WHERE (`table_5`.`column_3` > ?)
? = 10
----


query  rowsort
WITH `alias_4` AS (SELECT `table_11`.`column_2` AS `alias_3` FROM `table_11`) SELECT `table_5`.`column_7` AS `alias_1`, `table_11`.`column_2` AS `alias_2` FROM `table_5` LEFT JOIN `table_11` ON (`table_5`.`column_3` = `table_11`.`column_1`) INNER JOIN `alias_4` ON (`table_5`.`column_3` = `alias_4`.`alias_3`) WHERE (`table_5`.`column_3` > ?)
? = 10
----


query  rowsort
WITH `alias_5` AS (SELECT `table_11`.`column_4` AS `alias_3`, `table_13`.`column_2` AS `alias_4` FROM `table_11` LEFT JOIN `table_13` ON (`table_11`.`column_2` = `table_13`.`column_1`)) SELECT `table_11`.`column_3` AS `alias_1`, `table_12`.`column_2` AS `alias_2` FROM `table_11` LEFT JOIN `table_12` ON (`table_11`.`column_2` = `table_12`.`column_1`) INNER JOIN `alias_5` ON (`table_11`.`column_2` = `alias_5`.`alias_3`) WHERE (`table_11`.`column_2` > ?)
? = 10
----

