# Generated by:
#     target/debug/noria-logictest permute --compare-to mysql://root:noria@127.1/noria -d 3 -o logictests/generated/mysql/ --only range_param --random --include-deletes --rows-per-table 10 --subquery-depth 1

statement ok
CREATE TABLE `table_1` (`column_1` INT, `column_2` INT, PRIMARY KEY (`column_2`))


statement ok
INSERT INTO `table_1` (`column_1`, `column_2`) VALUES (-1079008451, 0), (-2057399431, 1), (-741785383, 2), (-210330647, 3), (-958285350, 4), (651950436, 5), (-572338063, 6), (1839910300, 7), (2125297954, 8), (-1020608332, 9)


query  rowsort
WITH `alias_2` AS (SELECT `table_1`.`column_1` AS `alias_1` FROM `table_1`) SELECT `table_1`.`column_1` AS `alias_5` FROM `table_1` INNER JOIN `alias_2` ON (`table_1`.`column_1` = `alias_2`.`alias_1`) INNER JOIN (SELECT `table_1`.`column_1` AS `alias_3` FROM `table_1`) AS alias_4 ON (`table_1`.`column_1` = `alias_4`.`alias_3`) WHERE (`table_1`.`column_1` > ?)
? = 10
----
1839910300
2125297954
651950436

statement ok
DELETE FROM `table_1` WHERE (`column_2` = 0)


statement ok
DELETE FROM `table_1` WHERE (`column_2` = 1)


statement ok
DELETE FROM `table_1` WHERE (`column_2` = 2)


statement ok
DELETE FROM `table_1` WHERE (`column_2` = 3)


statement ok
DELETE FROM `table_1` WHERE (`column_2` = 4)


query  rowsort
WITH `alias_2` AS (SELECT `table_1`.`column_1` AS `alias_1` FROM `table_1`) SELECT `table_1`.`column_1` AS `alias_5` FROM `table_1` INNER JOIN `alias_2` ON (`table_1`.`column_1` = `alias_2`.`alias_1`) INNER JOIN (SELECT `table_1`.`column_1` AS `alias_3` FROM `table_1`) AS alias_4 ON (`table_1`.`column_1` = `alias_4`.`alias_3`) WHERE (`table_1`.`column_1` > ?)
? = 10
----
1839910300
2125297954
651950436
