# Generated by:
#     target/debug/noria-logictest permute --compare-to mysql://root:noria@127.1/noria -d 3 -o logictests/generated/mysql/ --only range_param --random --include-deletes --rows-per-table 10 --subquery-depth 1

statement ok
CREATE TABLE `table_1` (`column_13` INT, `column_6` INT, `column_2` INT, `column_9` INT, `column_12` INT, `column_4` INT, `column_1` INT, `column_11` INT, `column_5` INT, `column_3` INT, `column_8` INT, `column_7` INT, `column_10` INT, PRIMARY KEY (`column_13`))


statement ok
INSERT INTO `table_1` (`column_13`, `column_6`, `column_2`, `column_9`, `column_12`, `column_4`, `column_1`, `column_11`, `column_5`, `column_3`, `column_8`, `column_7`, `column_10`) VALUES (0, -240308436, -1697836349, -880745619, 752987646, 2042934388, 1067890870, -504322480, -355623510, -1598778801, -1986242391, -2118583815, 1480462156), (1, 1533095169, -133778245, -1103960951, 1742403323, -1761399250, -2061138521, 795343673, 1880958118, -927643908, -1712756359, -2075467009, 809974807), (2, -253967948, 1698249647, 1705467640, -1951276797, 1070223245, 1227466500, -145523650, 1213837781, 2009567204, -2032928967, -818531539, 2026832575), (3, -1985581597, -718541851, 411098375, -1454688692, 195508175, 1325399323, 666367293, -516399519, -2112952281, -1479241623, -430621599, 1863008457), (4, -397114744, 371164640, -2088405223, -666565736, 1375880447, 358700607, -1845396812, -200064926, 455392440, 1215169861, 1414316035, 182722923), (5, 510198124, 1414017478, 1326126376, -274743436, -384984094, 1560452473, 1547473692, -163823844, -1878928079, 329116568, 1357695828, -959943448), (6, 1432553837, -1962812614, -129806178, 737879442, 675753387, 372153370, -1565246712, -1524948882, -1388967858, 86446642, 299625815, 2087545435), (7, -364537194, -1703154644, 480005269, -324272289, 737681472, -605588722, -537988098, 2133679398, 367462200, 145693951, -314670006, 1314450686), (8, 1784998798, -554542567, -78463817, 299531872, -1999310201, 2003360928, -1633908819, 294621809, -117112515, 1779290974, -1668392412, -523598913), (9, -1512730348, 2041142284, 1902458840, 1890326630, 789057711, 2123384533, 1450429880, 2015954511, -508614009, -310619993, 938581760, 704328025)


query  rowsort
WITH `alias_3` AS (SELECT sum(`table_1`.`column_2`) AS `alias_2` FROM `table_1`) SELECT sum(`table_1`.`column_1`) AS `alias_1` FROM `table_1` INNER JOIN `alias_3` ON (`table_1`.`column_1` = `alias_3`.`alias_2`)
----
NULL

query  rowsort
WITH `alias_3` AS (SELECT `table_1`.`column_1` AS `alias_2` FROM `table_1`) SELECT sum(`table_1`.`column_3`) AS `alias_1` FROM `table_1` INNER JOIN `alias_3` ON (`table_1`.`column_1` = `alias_3`.`alias_2`)
----
-5700575607

query  rowsort
WITH `alias_3` AS (SELECT sum(`table_1`.`column_5`) AS `alias_2` FROM `table_1`) SELECT sum(`table_1`.`column_4`) AS `alias_1` FROM `table_1` INNER JOIN `alias_3` ON (`table_1`.`column_1` = `alias_3`.`alias_2`)
----
NULL

query  rowsort
WITH `alias_2` AS (SELECT sum(`table_1`.`column_6`) AS `alias_1` FROM `table_1`) SELECT `table_1`.`column_1` AS `alias_3` FROM `table_1` INNER JOIN `alias_2` ON (`table_1`.`column_1` = `alias_2`.`alias_1`) WHERE (`table_1`.`column_1` > ?)
? = 10
----


query  rowsort
WITH `alias_2` AS (SELECT `table_1`.`column_1` AS `alias_1` FROM `table_1`) SELECT `table_1`.`column_1` AS `alias_3` FROM `table_1` INNER JOIN `alias_2` ON (`table_1`.`column_1` = `alias_2`.`alias_1`) WHERE (`table_1`.`column_1` > ?)
? = 10
----
1067890870
1227466500
1325399323
1560452473
2003360928
2123384533
358700607
372153370

query  rowsort
WITH `alias_2` AS (SELECT sum(`table_1`.`column_7`) AS `alias_1` FROM `table_1`) SELECT `table_1`.`column_1` AS `alias_3` FROM `table_1` INNER JOIN `alias_2` ON (`table_1`.`column_1` = `alias_2`.`alias_1`) WHERE (`table_1`.`column_1` > ?)
? = 10
----


query  rowsort
WITH `alias_3` AS (SELECT sum(`table_1`.`column_9`) AS `alias_2` FROM `table_1`) SELECT sum(`table_1`.`column_8`) AS `alias_1` FROM `table_1` INNER JOIN `alias_3` ON (`table_1`.`column_6` = `alias_3`.`alias_2`) WHERE (`table_1`.`column_6` > ?)
? = 10
----
NULL

query  rowsort
WITH `alias_3` AS (SELECT `table_1`.`column_6` AS `alias_2` FROM `table_1`) SELECT sum(`table_1`.`column_10`) AS `alias_1` FROM `table_1` INNER JOIN `alias_3` ON (`table_1`.`column_6` = `alias_3`.`alias_2`) WHERE (`table_1`.`column_6` > ?)
? = 10
----
1413977881

query  rowsort
WITH `alias_3` AS (SELECT sum(`table_1`.`column_12`) AS `alias_2` FROM `table_1`) SELECT sum(`table_1`.`column_11`) AS `alias_1` FROM `table_1` INNER JOIN `alias_3` ON (`table_1`.`column_6` = `alias_3`.`alias_2`) WHERE (`table_1`.`column_6` > ?)
? = 10
----
NULL

statement ok
DELETE FROM `table_1` WHERE (`column_13` = 0)


statement ok
DELETE FROM `table_1` WHERE (`column_13` = 1)


statement ok
DELETE FROM `table_1` WHERE (`column_13` = 2)


statement ok
DELETE FROM `table_1` WHERE (`column_13` = 3)


statement ok
DELETE FROM `table_1` WHERE (`column_13` = 4)


query  rowsort
WITH `alias_3` AS (SELECT sum(`table_1`.`column_2`) AS `alias_2` FROM `table_1`) SELECT sum(`table_1`.`column_1`) AS `alias_1` FROM `table_1` INNER JOIN `alias_3` ON (`table_1`.`column_1` = `alias_3`.`alias_2`)
----
NULL

query  rowsort
WITH `alias_3` AS (SELECT `table_1`.`column_1` AS `alias_2` FROM `table_1`) SELECT sum(`table_1`.`column_3`) AS `alias_1` FROM `table_1` INNER JOIN `alias_3` ON (`table_1`.`column_1` = `alias_3`.`alias_2`)
----
-3526160261

query  rowsort
WITH `alias_3` AS (SELECT sum(`table_1`.`column_5`) AS `alias_2` FROM `table_1`) SELECT sum(`table_1`.`column_4`) AS `alias_1` FROM `table_1` INNER JOIN `alias_3` ON (`table_1`.`column_1` = `alias_3`.`alias_2`)
----
NULL

query  rowsort
WITH `alias_2` AS (SELECT sum(`table_1`.`column_6`) AS `alias_1` FROM `table_1`) SELECT `table_1`.`column_1` AS `alias_3` FROM `table_1` INNER JOIN `alias_2` ON (`table_1`.`column_1` = `alias_2`.`alias_1`) WHERE (`table_1`.`column_1` > ?)
? = 10
----


query  rowsort
WITH `alias_2` AS (SELECT `table_1`.`column_1` AS `alias_1` FROM `table_1`) SELECT `table_1`.`column_1` AS `alias_3` FROM `table_1` INNER JOIN `alias_2` ON (`table_1`.`column_1` = `alias_2`.`alias_1`) WHERE (`table_1`.`column_1` > ?)
? = 10
----
1560452473
2003360928
2123384533
372153370

query  rowsort
WITH `alias_2` AS (SELECT sum(`table_1`.`column_7`) AS `alias_1` FROM `table_1`) SELECT `table_1`.`column_1` AS `alias_3` FROM `table_1` INNER JOIN `alias_2` ON (`table_1`.`column_1` = `alias_2`.`alias_1`) WHERE (`table_1`.`column_1` > ?)
? = 10
----


query  rowsort
WITH `alias_3` AS (SELECT sum(`table_1`.`column_9`) AS `alias_2` FROM `table_1`) SELECT sum(`table_1`.`column_8`) AS `alias_1` FROM `table_1` INNER JOIN `alias_3` ON (`table_1`.`column_6` = `alias_3`.`alias_2`) WHERE (`table_1`.`column_6` > ?)
? = 10
----
NULL

query  rowsort
WITH `alias_3` AS (SELECT `table_1`.`column_6` AS `alias_2` FROM `table_1`) SELECT sum(`table_1`.`column_10`) AS `alias_1` FROM `table_1` INNER JOIN `alias_3` ON (`table_1`.`column_6` = `alias_3`.`alias_2`) WHERE (`table_1`.`column_6` > ?)
? = 10
----
604003074

query  rowsort
WITH `alias_3` AS (SELECT sum(`table_1`.`column_12`) AS `alias_2` FROM `table_1`) SELECT sum(`table_1`.`column_11`) AS `alias_1` FROM `table_1` INNER JOIN `alias_3` ON (`table_1`.`column_6` = `alias_3`.`alias_2`) WHERE (`table_1`.`column_6` > ?)
? = 10
----
NULL
