# Generated by:
#     target/debug/noria-logictest permute --compare-to mysql://root:noria@127.1/noria -d 3 -o logictests/generated/mysql/ --only range_param --random --include-deletes --rows-per-table 10 --subquery-depth 1

statement ok
CREATE TABLE `table_13` (`column_2` INT, `column_3` INT, `column_1` INT, PRIMARY KEY (`column_3`))


statement ok
CREATE TABLE `table_11` (`column_1` INT, `column_4` INT, `column_3` INT, `column_2` INT, PRIMARY KEY (`column_4`))


statement ok
CREATE TABLE `table_1` (`column_3` INT, `column_5` INT, `column_6` INT, `column_8` INT, `column_4` INT, `column_1` INT, `column_7` INT, `column_2` INT, PRIMARY KEY (`column_8`))


statement ok
CREATE TABLE `table_7` (`column_1` INT, `column_2` INT, `column_3` INT, PRIMARY KEY (`column_3`))


statement ok
CREATE TABLE `table_3` (`column_1` INT, `column_2` INT, `column_3` INT, PRIMARY KEY (`column_3`))


statement ok
CREATE TABLE `table_6` (`column_3` INT, `column_1` INT, `column_2` INT, PRIMARY KEY (`column_3`))


statement ok
CREATE TABLE `table_5` (`column_1` INT, `column_3` INT, `column_2` INT, `column_4` INT, `column_5` INT, PRIMARY KEY (`column_5`))


statement ok
CREATE TABLE `table_8` (`column_2` INT, `column_3` INT, `column_1` INT, PRIMARY KEY (`column_3`))


statement ok
CREATE TABLE `table_4` (`column_3` INT, `column_2` INT, `column_4` INT, `column_1` INT, `column_5` INT, PRIMARY KEY (`column_5`))


statement ok
CREATE TABLE `table_9` (`column_3` INT, `column_1` INT, `column_2` INT, PRIMARY KEY (`column_3`))


statement ok
CREATE TABLE `table_2` (`column_1` INT, `column_2` INT, `column_3` INT, PRIMARY KEY (`column_3`))


statement ok
CREATE TABLE `table_10` (`column_3` INT, `column_1` INT, `column_2` INT, PRIMARY KEY (`column_3`))


statement ok
CREATE TABLE `table_12` (`column_4` INT, `column_3` INT, `column_2` INT, `column_1` INT, PRIMARY KEY (`column_4`))


statement ok
INSERT INTO `table_13` (`column_2`, `column_3`, `column_1`) VALUES (1927662853, 0, -1551482909), (1349764361, 1, -1114739036), (-412123902, 2, -1575761582), (1958056041, 3, 1354931677), (577029658, 4, 1688526123), (-1560710401, 5, 1021458913), (-1217678768, 6, 146301961), (119617727, 7, -1028969595), (1425081790, 8, -1498317070), (700980793, 9, 43400560)


statement ok
INSERT INTO `table_11` (`column_1`, `column_4`, `column_3`, `column_2`) VALUES (-1903854690, 0, -201775336, -1765846871), (616030954, 1, 558165397, 1691225145), (124963371, 2, -611697192, 588474453), (-1472541779, 3, 5562384, 564245892), (1584969245, 4, 597183426, 1104016146), (-1218536043, 5, -69985634, -555943485), (-109641935, 6, 247273866, 1086234050), (-876277977, 7, 1316263291, 1069133630), (-1968252735, 8, 1104148888, -947654810), (46915596, 9, 153870609, -1070170356)


statement ok
INSERT INTO `table_1` (`column_3`, `column_5`, `column_6`, `column_8`, `column_4`, `column_1`, `column_7`, `column_2`) VALUES (1459913679, -394131767, 603413054, 0, -1368075970, 1318220139, 689829164, 1103468852), (1335032696, 1119885343, -1170664647, 1, -88104064, 2065952636, -1967235793, -1240648895), (1427181113, -1256749228, 186490892, 2, -992828317, 373732119, -631610333, -1268442520), (1039088954, 64713139, -1885546487, 3, 1009727205, -2112087161, 212373554, 1332090735), (-1387770936, 96576857, -1506161892, 4, 1072133118, -1001126014, 1894760249, 66264264), (-506102701, -2761103, 382874177, 5, 1824686671, 1075522122, -325338333, 996730861), (2134224700, -2060822068, 2046967837, 6, -849682476, 1619572528, 1088476861, -1327837042), (325918949, 1738367206, -1380341378, 7, -2143317098, -1903821617, -735924943, -1459277939), (352539952, -1389600361, 871702794, 8, 42242879, -1661354435, 735221310, -433687622), (-2050575309, -422927289, -1603301071, 9, 1059429214, -1157147524, 1128425923, -775826637)


statement ok
INSERT INTO `table_7` (`column_1`, `column_2`, `column_3`) VALUES (247449450, -856655293, 0), (38609109, 36464427, 1), (-274343742, 2024895119, 2), (-284839265, -1756327119, 3), (-1425564532, -991443411, 4), (159873538, -1332672761, 5), (539919399, -1676582092, 6), (-601804601, -926973982, 7), (-1584666517, 535280670, 8), (-1230983859, -882374991, 9)


statement ok
INSERT INTO `table_3` (`column_1`, `column_2`, `column_3`) VALUES (-122856670, -535436662, 0), (-1852317435, -1598712829, 1), (1849330257, -1015739070, 2), (-1378363477, 215980570, 3), (2119658393, 876420020, 4), (-1058839218, -960733244, 5), (1554768898, -1811506039, 6), (-2038458018, -1005626685, 7), (-1884862541, -709601083, 8), (-227818116, -554908846, 9)


statement ok
INSERT INTO `table_6` (`column_3`, `column_1`, `column_2`) VALUES (0, -662256148, 821802202), (1, -640433001, 828302784), (2, 1916203298, 939269222), (3, -407806228, 1683894046), (4, -330248980, 1927163928), (5, 235614709, -617066935), (6, 1920514044, -196303717), (7, 144978140, -1922438484), (8, 1709734377, 202408001), (9, 1968618228, 102406783)


statement ok
INSERT INTO `table_5` (`column_1`, `column_3`, `column_2`, `column_4`, `column_5`) VALUES (-1939465515, 892903959, 1066558322, 961952226, 0), (873171538, -1239768705, 1139376025, 1073250898, 1), (885393358, 1261061239, 1562976474, 1214813344, 2), (45954868, 1521750087, -2036821423, -1939164645, 3), (-83538715, -127622729, 1842945478, -1682758737, 4), (-1893488676, -537857469, 590717164, -1311046118, 5), (-2024075313, -1770141015, -532916570, 1855525422, 6), (-1822585622, -1627290747, 378787990, -565182974, 7), (-755721219, 1017039558, 1327365337, 542795020, 8), (1286769165, -147126553, 531241830, 301532942, 9)


statement ok
INSERT INTO `table_8` (`column_2`, `column_3`, `column_1`) VALUES (-655409549, 0, 196470123), (410468463, 1, -826371626), (-124786432, 2, 2053470393), (-1203142203, 3, 1335286165), (1301757301, 4, 213292740), (1439789210, 5, -882600342), (1410547059, 6, 1663709676), (-1494960193, 7, 107956441), (1367856876, 8, 501007553), (-1570038168, 9, -1045313722)


statement ok
INSERT INTO `table_4` (`column_3`, `column_2`, `column_4`, `column_1`, `column_5`) VALUES (-302776769, 1032588187, -78291337, 120292556, 0), (-1859382890, 1339208173, 353255091, 299956094, 1), (717189726, 904746415, -29476672, -1522990226, 2), (1339535073, 398741466, -84115908, -657767017, 3), (928919169, 1807189358, 1204112212, -1495886481, 4), (-290139079, -30627073, 67729190, -1898138451, 5), (798078324, 1943481554, -245428212, 966276466, 6), (-72595086, 2041076721, 918819266, 1076830726, 7), (-1797305894, -880188961, 1920878154, 494054941, 8), (-238873644, -776801740, -1409511799, 689624360, 9)


statement ok
INSERT INTO `table_9` (`column_3`, `column_1`, `column_2`) VALUES (0, -678150455, 665231247), (1, -578499617, 723187350), (2, 2047006121, -1039069411), (3, -1687307981, 313401322), (4, -1738627150, -433267377), (5, -344280627, -1289940887), (6, 354705471, 734585945), (7, -213793504, 154737290), (8, 2106431683, -1747280050), (9, 303225209, 992995161)


statement ok
INSERT INTO `table_2` (`column_1`, `column_2`, `column_3`) VALUES (-1289246715, -1049333163, 0), (1159358293, -1337414531, 1), (-1417686615, -467500252, 2), (397461142, 1003503041, 3), (-591339633, 375945160, 4), (-339178685, -1794968187, 5), (484522974, -730341246, 6), (-1823986677, -1280441551, 7), (-1721378724, 1261794215, 8), (-559325133, 688883154, 9)


statement ok
INSERT INTO `table_10` (`column_3`, `column_1`, `column_2`) VALUES (0, 677736460, -1965464319), (1, 1362959330, -531432655), (2, 134032556, 1113647283), (3, 1249922812, -1261253168), (4, 42407336, -1346785953), (5, 973791640, 145082568), (6, -2058620198, 1101719840), (7, -710376248, 1484352689), (8, -315240759, -661692545), (9, -745060043, 547466293)


statement ok
INSERT INTO `table_12` (`column_4`, `column_3`, `column_2`, `column_1`) VALUES (0, -14417462, -839967639, 1271682790), (1, -981641406, -1898946758, -859313720), (2, 119636828, 1886479879, -442308399), (3, -430424384, -53165114, -1870676158), (4, 2064570532, 790234198, 1888141990), (5, 830249154, -653881469, 883725942), (6, 518713525, -1797150525, 1751301045), (7, 2046034796, -17404650, 323622721), (8, 1589654281, -1987591646, -1210161111), (9, -1191775008, 1317422959, -1384243432)


query  rowsort
WITH `alias_5` AS (SELECT `table_1`.`column_3` AS `alias_3`, `table_3`.`column_2` AS `alias_4` FROM `table_1` INNER JOIN `table_3` ON (`table_1`.`column_2` = `table_3`.`column_1`)) SELECT `table_1`.`column_2` AS `alias_1`, `table_2`.`column_2` AS `alias_2` FROM `table_1` INNER JOIN `table_2` ON (`table_1`.`column_1` = `table_2`.`column_1`) INNER JOIN `alias_5` ON (`table_1`.`column_3` = `alias_5`.`alias_3`)
----


query  rowsort
WITH `alias_4` AS (SELECT `table_1`.`column_3` AS `alias_3` FROM `table_1`) SELECT `table_1`.`column_4` AS `alias_1`, `table_4`.`column_2` AS `alias_2` FROM `table_1` INNER JOIN `table_4` ON (`table_1`.`column_3` = `table_4`.`column_1`) INNER JOIN `alias_4` ON (`table_1`.`column_3` = `alias_4`.`alias_3`)
----


query  rowsort
WITH `alias_5` AS (SELECT `table_4`.`column_4` AS `alias_3`, `table_6`.`column_2` AS `alias_4` FROM `table_4` INNER JOIN `table_6` ON (`table_4`.`column_1` = `table_6`.`column_1`)) SELECT `table_4`.`column_3` AS `alias_1`, `table_5`.`column_2` AS `alias_2` FROM `table_4` INNER JOIN `table_5` ON (`table_4`.`column_1` = `table_5`.`column_1`) INNER JOIN `alias_5` ON (`table_4`.`column_3` = `alias_5`.`alias_3`)
----


query  rowsort
WITH `alias_3` AS (SELECT `table_5`.`column_3` AS `alias_1`, `table_7`.`column_2` AS `alias_2` FROM `table_5` INNER JOIN `table_7` ON (`table_5`.`column_2` = `table_7`.`column_1`)) SELECT `table_5`.`column_2` AS `alias_4` FROM `table_5` INNER JOIN `alias_3` ON (`table_5`.`column_2` = `alias_3`.`alias_1`) WHERE (`table_5`.`column_2` > ?)
? = 10
----


query  rowsort
WITH `alias_2` AS (SELECT `table_5`.`column_2` AS `alias_1` FROM `table_5`) SELECT `table_5`.`column_2` AS `alias_3` FROM `table_5` INNER JOIN `alias_2` ON (`table_5`.`column_2` = `alias_2`.`alias_1`) WHERE (`table_5`.`column_2` > ?)
? = 10
----
1066558322
1139376025
1327365337
1562976474
1842945478
378787990
531241830
590717164

query  rowsort
WITH `alias_3` AS (SELECT `table_5`.`column_4` AS `alias_1`, `table_8`.`column_2` AS `alias_2` FROM `table_5` INNER JOIN `table_8` ON (`table_5`.`column_2` = `table_8`.`column_1`)) SELECT `table_5`.`column_1` AS `alias_4` FROM `table_5` INNER JOIN `alias_3` ON (`table_5`.`column_1` = `alias_3`.`alias_1`) WHERE (`table_5`.`column_2` > ?)
? = 10
----


query  rowsort
WITH `alias_5` AS (SELECT `table_1`.`column_6` AS `alias_3`, `table_10`.`column_2` AS `alias_4` FROM `table_1` INNER JOIN `table_10` ON (`table_1`.`column_3` = `table_10`.`column_1`)) SELECT `table_1`.`column_5` AS `alias_1`, `table_9`.`column_2` AS `alias_2` FROM `table_1` INNER JOIN `table_9` ON (`table_1`.`column_3` = `table_9`.`column_1`) INNER JOIN `alias_5` ON (`table_1`.`column_3` = `alias_5`.`alias_3`) WHERE (`table_1`.`column_3` > ?)
? = 10
----


query  rowsort
WITH `alias_4` AS (SELECT `table_11`.`column_1` AS `alias_3` FROM `table_11`) SELECT `table_1`.`column_7` AS `alias_1`, `table_11`.`column_2` AS `alias_2` FROM `table_1` INNER JOIN `table_11` ON (`table_1`.`column_3` = `table_11`.`column_1`) INNER JOIN `alias_4` ON (`table_1`.`column_3` = `alias_4`.`alias_3`) WHERE (`table_1`.`column_3` > ?)
? = 10
----


query  rowsort
WITH `alias_5` AS (SELECT `table_12`.`column_3` AS `alias_3`, `table_13`.`column_2` AS `alias_4` FROM `table_12` INNER JOIN `table_13` ON (`table_12`.`column_2` = `table_13`.`column_1`)) SELECT `table_11`.`column_3` AS `alias_1`, `table_12`.`column_2` AS `alias_2` FROM `table_11` INNER JOIN `table_12` ON (`table_11`.`column_1` = `table_12`.`column_1`) INNER JOIN `alias_5` ON (`table_11`.`column_1` = `alias_5`.`alias_3`) WHERE (`table_11`.`column_1` > ?)
? = 10
----


statement ok
DELETE FROM `table_13` WHERE (`column_3` = 0)


statement ok
DELETE FROM `table_13` WHERE (`column_3` = 1)


statement ok
DELETE FROM `table_13` WHERE (`column_3` = 2)


statement ok
DELETE FROM `table_13` WHERE (`column_3` = 3)


statement ok
DELETE FROM `table_13` WHERE (`column_3` = 4)


statement ok
DELETE FROM `table_11` WHERE (`column_4` = 0)


statement ok
DELETE FROM `table_11` WHERE (`column_4` = 1)


statement ok
DELETE FROM `table_11` WHERE (`column_4` = 2)


statement ok
DELETE FROM `table_11` WHERE (`column_4` = 3)


statement ok
DELETE FROM `table_11` WHERE (`column_4` = 4)


statement ok
DELETE FROM `table_1` WHERE (`column_8` = 0)


statement ok
DELETE FROM `table_1` WHERE (`column_8` = 1)


statement ok
DELETE FROM `table_1` WHERE (`column_8` = 2)


statement ok
DELETE FROM `table_1` WHERE (`column_8` = 3)


statement ok
DELETE FROM `table_1` WHERE (`column_8` = 4)


statement ok
DELETE FROM `table_7` WHERE (`column_3` = 0)


statement ok
DELETE FROM `table_7` WHERE (`column_3` = 1)


statement ok
DELETE FROM `table_7` WHERE (`column_3` = 2)


statement ok
DELETE FROM `table_7` WHERE (`column_3` = 3)


statement ok
DELETE FROM `table_7` WHERE (`column_3` = 4)


statement ok
DELETE FROM `table_3` WHERE (`column_3` = 0)


statement ok
DELETE FROM `table_3` WHERE (`column_3` = 1)


statement ok
DELETE FROM `table_3` WHERE (`column_3` = 2)


statement ok
DELETE FROM `table_3` WHERE (`column_3` = 3)


statement ok
DELETE FROM `table_3` WHERE (`column_3` = 4)


statement ok
DELETE FROM `table_6` WHERE (`column_3` = 0)


statement ok
DELETE FROM `table_6` WHERE (`column_3` = 1)


statement ok
DELETE FROM `table_6` WHERE (`column_3` = 2)


statement ok
DELETE FROM `table_6` WHERE (`column_3` = 3)


statement ok
DELETE FROM `table_6` WHERE (`column_3` = 4)


statement ok
DELETE FROM `table_5` WHERE (`column_5` = 0)


statement ok
DELETE FROM `table_5` WHERE (`column_5` = 1)


statement ok
DELETE FROM `table_5` WHERE (`column_5` = 2)


statement ok
DELETE FROM `table_5` WHERE (`column_5` = 3)


statement ok
DELETE FROM `table_5` WHERE (`column_5` = 4)


statement ok
DELETE FROM `table_8` WHERE (`column_3` = 0)


statement ok
DELETE FROM `table_8` WHERE (`column_3` = 1)


statement ok
DELETE FROM `table_8` WHERE (`column_3` = 2)


statement ok
DELETE FROM `table_8` WHERE (`column_3` = 3)


statement ok
DELETE FROM `table_8` WHERE (`column_3` = 4)


statement ok
DELETE FROM `table_4` WHERE (`column_5` = 0)


statement ok
DELETE FROM `table_4` WHERE (`column_5` = 1)


statement ok
DELETE FROM `table_4` WHERE (`column_5` = 2)


statement ok
DELETE FROM `table_4` WHERE (`column_5` = 3)


statement ok
DELETE FROM `table_4` WHERE (`column_5` = 4)


statement ok
DELETE FROM `table_9` WHERE (`column_3` = 0)


statement ok
DELETE FROM `table_9` WHERE (`column_3` = 1)


statement ok
DELETE FROM `table_9` WHERE (`column_3` = 2)


statement ok
DELETE FROM `table_9` WHERE (`column_3` = 3)


statement ok
DELETE FROM `table_9` WHERE (`column_3` = 4)


statement ok
DELETE FROM `table_2` WHERE (`column_3` = 0)


statement ok
DELETE FROM `table_2` WHERE (`column_3` = 1)


statement ok
DELETE FROM `table_2` WHERE (`column_3` = 2)


statement ok
DELETE FROM `table_2` WHERE (`column_3` = 3)


statement ok
DELETE FROM `table_2` WHERE (`column_3` = 4)


statement ok
DELETE FROM `table_10` WHERE (`column_3` = 0)


statement ok
DELETE FROM `table_10` WHERE (`column_3` = 1)


statement ok
DELETE FROM `table_10` WHERE (`column_3` = 2)


statement ok
DELETE FROM `table_10` WHERE (`column_3` = 3)


statement ok
DELETE FROM `table_10` WHERE (`column_3` = 4)


statement ok
DELETE FROM `table_12` WHERE (`column_4` = 0)


statement ok
DELETE FROM `table_12` WHERE (`column_4` = 1)


statement ok
DELETE FROM `table_12` WHERE (`column_4` = 2)


statement ok
DELETE FROM `table_12` WHERE (`column_4` = 3)


statement ok
DELETE FROM `table_12` WHERE (`column_4` = 4)


query  rowsort
WITH `alias_5` AS (SELECT `table_1`.`column_3` AS `alias_3`, `table_3`.`column_2` AS `alias_4` FROM `table_1` INNER JOIN `table_3` ON (`table_1`.`column_2` = `table_3`.`column_1`)) SELECT `table_1`.`column_2` AS `alias_1`, `table_2`.`column_2` AS `alias_2` FROM `table_1` INNER JOIN `table_2` ON (`table_1`.`column_1` = `table_2`.`column_1`) INNER JOIN `alias_5` ON (`table_1`.`column_3` = `alias_5`.`alias_3`)
----


query  rowsort
WITH `alias_4` AS (SELECT `table_1`.`column_3` AS `alias_3` FROM `table_1`) SELECT `table_1`.`column_4` AS `alias_1`, `table_4`.`column_2` AS `alias_2` FROM `table_1` INNER JOIN `table_4` ON (`table_1`.`column_3` = `table_4`.`column_1`) INNER JOIN `alias_4` ON (`table_1`.`column_3` = `alias_4`.`alias_3`)
----


query  rowsort
WITH `alias_5` AS (SELECT `table_4`.`column_4` AS `alias_3`, `table_6`.`column_2` AS `alias_4` FROM `table_4` INNER JOIN `table_6` ON (`table_4`.`column_1` = `table_6`.`column_1`)) SELECT `table_4`.`column_3` AS `alias_1`, `table_5`.`column_2` AS `alias_2` FROM `table_4` INNER JOIN `table_5` ON (`table_4`.`column_1` = `table_5`.`column_1`) INNER JOIN `alias_5` ON (`table_4`.`column_3` = `alias_5`.`alias_3`)
----


query  rowsort
WITH `alias_3` AS (SELECT `table_5`.`column_3` AS `alias_1`, `table_7`.`column_2` AS `alias_2` FROM `table_5` INNER JOIN `table_7` ON (`table_5`.`column_2` = `table_7`.`column_1`)) SELECT `table_5`.`column_2` AS `alias_4` FROM `table_5` INNER JOIN `alias_3` ON (`table_5`.`column_2` = `alias_3`.`alias_1`) WHERE (`table_5`.`column_2` > ?)
? = 10
----


query  rowsort
WITH `alias_2` AS (SELECT `table_5`.`column_2` AS `alias_1` FROM `table_5`) SELECT `table_5`.`column_2` AS `alias_3` FROM `table_5` INNER JOIN `alias_2` ON (`table_5`.`column_2` = `alias_2`.`alias_1`) WHERE (`table_5`.`column_2` > ?)
? = 10
----
1327365337
378787990
531241830
590717164

query  rowsort
WITH `alias_3` AS (SELECT `table_5`.`column_4` AS `alias_1`, `table_8`.`column_2` AS `alias_2` FROM `table_5` INNER JOIN `table_8` ON (`table_5`.`column_2` = `table_8`.`column_1`)) SELECT `table_5`.`column_1` AS `alias_4` FROM `table_5` INNER JOIN `alias_3` ON (`table_5`.`column_1` = `alias_3`.`alias_1`) WHERE (`table_5`.`column_2` > ?)
? = 10
----


query  rowsort
WITH `alias_5` AS (SELECT `table_1`.`column_6` AS `alias_3`, `table_10`.`column_2` AS `alias_4` FROM `table_1` INNER JOIN `table_10` ON (`table_1`.`column_3` = `table_10`.`column_1`)) SELECT `table_1`.`column_5` AS `alias_1`, `table_9`.`column_2` AS `alias_2` FROM `table_1` INNER JOIN `table_9` ON (`table_1`.`column_3` = `table_9`.`column_1`) INNER JOIN `alias_5` ON (`table_1`.`column_3` = `alias_5`.`alias_3`) WHERE (`table_1`.`column_3` > ?)
? = 10
----


query  rowsort
WITH `alias_4` AS (SELECT `table_11`.`column_1` AS `alias_3` FROM `table_11`) SELECT `table_1`.`column_7` AS `alias_1`, `table_11`.`column_2` AS `alias_2` FROM `table_1` INNER JOIN `table_11` ON (`table_1`.`column_3` = `table_11`.`column_1`) INNER JOIN `alias_4` ON (`table_1`.`column_3` = `alias_4`.`alias_3`) WHERE (`table_1`.`column_3` > ?)
? = 10
----


query  rowsort
WITH `alias_5` AS (SELECT `table_12`.`column_3` AS `alias_3`, `table_13`.`column_2` AS `alias_4` FROM `table_12` INNER JOIN `table_13` ON (`table_12`.`column_2` = `table_13`.`column_1`)) SELECT `table_11`.`column_3` AS `alias_1`, `table_12`.`column_2` AS `alias_2` FROM `table_11` INNER JOIN `table_12` ON (`table_11`.`column_1` = `table_12`.`column_1`) INNER JOIN `alias_5` ON (`table_11`.`column_1` = `alias_5`.`alias_3`) WHERE (`table_11`.`column_1` > ?)
? = 10
----

