# Generated by:
#     target/debug/noria-logictest permute --compare-to mysql://root:noria@127.1/noria -d 3 -o logictests/generated/mysql/ --only range_param --random --include-deletes --rows-per-table 10 --subquery-depth 1

statement ok
CREATE TABLE `table_1` (`column_4` INT, `column_7` INT, `column_10` INT, `column_11` INT, `column_12` INT, `column_2` INT, `column_13` INT, `column_8` INT, `column_6` INT, `column_9` INT, `column_3` INT, `column_5` INT, `column_1` INT, PRIMARY KEY (`column_13`))


statement ok
INSERT INTO `table_1` (`column_4`, `column_7`, `column_10`, `column_11`, `column_12`, `column_2`, `column_13`, `column_8`, `column_6`, `column_9`, `column_3`, `column_5`, `column_1`) VALUES (590947324, 1965997615, 1455535024, -293065080, 820186960, -324820111, 0, 1692959571, 1085198671, -1975062436, 1088909218, -1038680310, 492256322), (-639294607, -812905486, 886593208, -384694928, -1590945138, 430627692, 1, 1113622239, 59725611, 17073186, -290181411, -229861025, -1830725780), (986353786, 1384174997, 185509963, 1315696579, -205132236, 1330421920, 2, 574293102, -1955148480, -1126705836, -1875063169, -1620137019, -695954857), (-279667883, 187162532, 718991690, 1709803383, -1664245471, -1488288940, 3, 473462805, 886470563, 2102848169, 254282969, 1720209213, -1510994060), (-1011048232, -2132826714, -1752834819, 1102646005, -967813509, -1921660383, 4, 859828403, -1285406185, -883919967, 1168446918, 1708648964, 680293102), (2043734681, -1385034014, 692574658, 1425902027, 1357906569, 1043670591, 5, -200274867, 625160954, -1050725295, -1150995621, 777986273, 304591558), (1523123051, 909670515, -1155390217, 1024985056, -904973574, 503133928, 6, 1599947634, -1255156837, 1845863861, -1591872473, -1006845674, -2120632273), (-963471347, 671525827, 359959839, 489860277, -1025179744, 683310893, 7, -1789952965, 1139801660, -1376203596, 599432019, -975321767, 1497132103), (1827846726, 1799383030, 1573571887, 1783143455, -624938488, -1551780904, 8, 245439770, -1560147710, 550862546, 2059075129, -468794202, 880652269), (619213717, 1240109211, 1112748544, -1581779632, -2113543285, -2042648593, 9, 609840982, 2041347012, 2132834499, 1105607557, -1120747177, -769334719)


query  rowsort
WITH `alias_3` AS (SELECT count(distinct `table_1`.`column_2`) AS `alias_2` FROM `table_1`) SELECT count(distinct `table_1`.`column_1`) AS `alias_1` FROM `table_1` INNER JOIN `alias_3` ON (`table_1`.`column_2` = `alias_3`.`alias_2`)
----
0

query  rowsort
WITH `alias_3` AS (SELECT `table_1`.`column_2` AS `alias_2` FROM `table_1`) SELECT count(distinct `table_1`.`column_3`) AS `alias_1` FROM `table_1` INNER JOIN `alias_3` ON (`table_1`.`column_2` = `alias_3`.`alias_2`)
----
10

query  rowsort
WITH `alias_3` AS (SELECT count(distinct `table_1`.`column_5`) AS `alias_2` FROM `table_1`) SELECT count(distinct `table_1`.`column_4`) AS `alias_1` FROM `table_1` INNER JOIN `alias_3` ON (`table_1`.`column_1` = `alias_3`.`alias_2`)
----
0

query  rowsort
WITH `alias_2` AS (SELECT count(distinct `table_1`.`column_6`) AS `alias_1` FROM `table_1`) SELECT `table_1`.`column_1` AS `alias_3` FROM `table_1` INNER JOIN `alias_2` ON (`table_1`.`column_1` = `alias_2`.`alias_1`) WHERE (`table_1`.`column_1` > ?)
? = 10
----


query  rowsort
WITH `alias_2` AS (SELECT `table_1`.`column_1` AS `alias_1` FROM `table_1`) SELECT `table_1`.`column_1` AS `alias_3` FROM `table_1` INNER JOIN `alias_2` ON (`table_1`.`column_1` = `alias_2`.`alias_1`) WHERE (`table_1`.`column_1` > ?)
? = 10
----
1497132103
304591558
492256322
680293102
880652269

query  rowsort
WITH `alias_2` AS (SELECT count(distinct `table_1`.`column_7`) AS `alias_1` FROM `table_1`) SELECT `table_1`.`column_1` AS `alias_3` FROM `table_1` INNER JOIN `alias_2` ON (`table_1`.`column_1` = `alias_2`.`alias_1`) WHERE (`table_1`.`column_1` > ?)
? = 10
----


query  rowsort
WITH `alias_3` AS (SELECT count(distinct `table_1`.`column_9`) AS `alias_2` FROM `table_1`) SELECT count(distinct `table_1`.`column_8`) AS `alias_1` FROM `table_1` INNER JOIN `alias_3` ON (`table_1`.`column_4` = `alias_3`.`alias_2`) WHERE (`table_1`.`column_4` > ?)
? = 10
----
0

query  rowsort
WITH `alias_3` AS (SELECT `table_1`.`column_4` AS `alias_2` FROM `table_1`) SELECT count(distinct `table_1`.`column_10`) AS `alias_1` FROM `table_1` INNER JOIN `alias_3` ON (`table_1`.`column_4` = `alias_3`.`alias_2`) WHERE (`table_1`.`column_4` > ?)
? = 10
----
6

query  rowsort
WITH `alias_3` AS (SELECT count(distinct `table_1`.`column_12`) AS `alias_2` FROM `table_1`) SELECT count(distinct `table_1`.`column_11`) AS `alias_1` FROM `table_1` INNER JOIN `alias_3` ON (`table_1`.`column_4` = `alias_3`.`alias_2`) WHERE (`table_1`.`column_4` > ?)
? = 10
----
0

statement ok
DELETE FROM `table_1` WHERE (`column_13` = 0)


statement ok
DELETE FROM `table_1` WHERE (`column_13` = 1)


statement ok
DELETE FROM `table_1` WHERE (`column_13` = 2)


statement ok
DELETE FROM `table_1` WHERE (`column_13` = 3)


statement ok
DELETE FROM `table_1` WHERE (`column_13` = 4)


query  rowsort
WITH `alias_3` AS (SELECT count(distinct `table_1`.`column_2`) AS `alias_2` FROM `table_1`) SELECT count(distinct `table_1`.`column_1`) AS `alias_1` FROM `table_1` INNER JOIN `alias_3` ON (`table_1`.`column_2` = `alias_3`.`alias_2`)
----
0

query  rowsort
WITH `alias_3` AS (SELECT `table_1`.`column_2` AS `alias_2` FROM `table_1`) SELECT count(distinct `table_1`.`column_3`) AS `alias_1` FROM `table_1` INNER JOIN `alias_3` ON (`table_1`.`column_2` = `alias_3`.`alias_2`)
----
5

query  rowsort
WITH `alias_3` AS (SELECT count(distinct `table_1`.`column_5`) AS `alias_2` FROM `table_1`) SELECT count(distinct `table_1`.`column_4`) AS `alias_1` FROM `table_1` INNER JOIN `alias_3` ON (`table_1`.`column_1` = `alias_3`.`alias_2`)
----
0

query  rowsort
WITH `alias_2` AS (SELECT count(distinct `table_1`.`column_6`) AS `alias_1` FROM `table_1`) SELECT `table_1`.`column_1` AS `alias_3` FROM `table_1` INNER JOIN `alias_2` ON (`table_1`.`column_1` = `alias_2`.`alias_1`) WHERE (`table_1`.`column_1` > ?)
? = 10
----


query  rowsort
WITH `alias_2` AS (SELECT `table_1`.`column_1` AS `alias_1` FROM `table_1`) SELECT `table_1`.`column_1` AS `alias_3` FROM `table_1` INNER JOIN `alias_2` ON (`table_1`.`column_1` = `alias_2`.`alias_1`) WHERE (`table_1`.`column_1` > ?)
? = 10
----
1497132103
304591558
880652269

query  rowsort
WITH `alias_2` AS (SELECT count(distinct `table_1`.`column_7`) AS `alias_1` FROM `table_1`) SELECT `table_1`.`column_1` AS `alias_3` FROM `table_1` INNER JOIN `alias_2` ON (`table_1`.`column_1` = `alias_2`.`alias_1`) WHERE (`table_1`.`column_1` > ?)
? = 10
----


query  rowsort
WITH `alias_3` AS (SELECT count(distinct `table_1`.`column_9`) AS `alias_2` FROM `table_1`) SELECT count(distinct `table_1`.`column_8`) AS `alias_1` FROM `table_1` INNER JOIN `alias_3` ON (`table_1`.`column_4` = `alias_3`.`alias_2`) WHERE (`table_1`.`column_4` > ?)
? = 10
----
0

query  rowsort
WITH `alias_3` AS (SELECT `table_1`.`column_4` AS `alias_2` FROM `table_1`) SELECT count(distinct `table_1`.`column_10`) AS `alias_1` FROM `table_1` INNER JOIN `alias_3` ON (`table_1`.`column_4` = `alias_3`.`alias_2`) WHERE (`table_1`.`column_4` > ?)
? = 10
----
4

query  rowsort
WITH `alias_3` AS (SELECT count(distinct `table_1`.`column_12`) AS `alias_2` FROM `table_1`) SELECT count(distinct `table_1`.`column_11`) AS `alias_1` FROM `table_1` INNER JOIN `alias_3` ON (`table_1`.`column_4` = `alias_3`.`alias_2`) WHERE (`table_1`.`column_4` > ?)
? = 10
----
0
