# Generated by:
#     target/debug/noria-logictest permute --compare-to mysql://root:noria@127.1/noria -d 3 -o logictests/generated/mysql/ --only range_param --random --include-deletes --rows-per-table 10 --subquery-depth 1

statement ok
CREATE TABLE `table_1` (`column_2` INT, `column_1` INT, PRIMARY KEY (`column_2`))


statement ok
INSERT INTO `table_1` (`column_2`, `column_1`) VALUES (0, 409293075), (1, -1075904160), (2, -366809369), (3, -419179147), (4, -462632495), (5, 548661917), (6, -667692241), (7, -1193613393), (8, -1847685616), (9, -1283314502)


query  rowsort
WITH `alias_2` AS (SELECT `table_1`.`column_1` AS `alias_1` FROM `table_1`) SELECT `table_1`.`column_1` AS `alias_3` FROM `table_1` INNER JOIN `alias_2` ON (`table_1`.`column_1` = `alias_2`.`alias_1`) WHERE (`table_1`.`column_1` = ?)
? = 1
----


query  rowsort
WITH `alias_2` AS (SELECT `table_1`.`column_1` AS `alias_1` FROM `table_1`) SELECT `table_1`.`column_1` AS `alias_3` FROM `table_1` INNER JOIN `alias_2` ON (`table_1`.`column_1` = `alias_2`.`alias_1`) WHERE (`table_1`.`column_1` = ?)
? = 1
----


query  rowsort
WITH `alias_2` AS (SELECT `table_1`.`column_1` AS `alias_1` FROM `table_1`) SELECT `table_1`.`column_1` AS `alias_3` FROM `table_1` INNER JOIN `alias_2` ON (`table_1`.`column_1` = `alias_2`.`alias_1`) WHERE (`table_1`.`column_1` = ?)
? = 1
----


query  rowsort
WITH `alias_2` AS (SELECT `table_1`.`column_1` AS `alias_1` FROM `table_1`) SELECT `table_1`.`column_1` AS `alias_3` FROM `table_1` INNER JOIN `alias_2` ON (`table_1`.`column_1` = `alias_2`.`alias_1`) WHERE (`table_1`.`column_1` > ?)
? = 10
----
409293075
548661917

query  rowsort
WITH `alias_2` AS (SELECT `table_1`.`column_1` AS `alias_1` FROM `table_1`) SELECT `table_1`.`column_1` AS `alias_3` FROM `table_1` INNER JOIN `alias_2` ON (`table_1`.`column_1` = `alias_2`.`alias_1`) WHERE (`table_1`.`column_1` > ?)
? = 10
----
409293075
548661917

query  rowsort
WITH `alias_2` AS (SELECT `table_1`.`column_1` AS `alias_1` FROM `table_1`) SELECT `table_1`.`column_1` AS `alias_3` FROM `table_1` INNER JOIN `alias_2` ON (`table_1`.`column_1` = `alias_2`.`alias_1`) WHERE (`table_1`.`column_1` > ?)
? = 10
----
409293075
548661917

query  rowsort
WITH `alias_2` AS (SELECT `table_1`.`column_1` AS `alias_1` FROM `table_1`) SELECT `table_1`.`column_1` AS `alias_3` FROM `table_1` INNER JOIN `alias_2` ON (`table_1`.`column_1` = `alias_2`.`alias_1`) WHERE ((`table_1`.`column_1` = ?) AND (`table_1`.`column_1` > ?))
? = 1
? = 10
----


query  rowsort
WITH `alias_2` AS (SELECT `table_1`.`column_1` AS `alias_1` FROM `table_1`) SELECT `table_1`.`column_1` AS `alias_3` FROM `table_1` INNER JOIN `alias_2` ON (`table_1`.`column_1` = `alias_2`.`alias_1`) WHERE ((`table_1`.`column_1` = ?) AND (`table_1`.`column_1` > ?))
? = 1
? = 10
----


query  rowsort
WITH `alias_2` AS (SELECT `table_1`.`column_1` AS `alias_1` FROM `table_1`) SELECT `table_1`.`column_1` AS `alias_3` FROM `table_1` INNER JOIN `alias_2` ON (`table_1`.`column_1` = `alias_2`.`alias_1`) WHERE ((`table_1`.`column_1` = ?) AND (`table_1`.`column_1` > ?))
? = 1
? = 10
----


statement ok
DELETE FROM `table_1` WHERE (`column_2` = 0)


statement ok
DELETE FROM `table_1` WHERE (`column_2` = 1)


statement ok
DELETE FROM `table_1` WHERE (`column_2` = 2)


statement ok
DELETE FROM `table_1` WHERE (`column_2` = 3)


statement ok
DELETE FROM `table_1` WHERE (`column_2` = 4)


query  rowsort
WITH `alias_2` AS (SELECT `table_1`.`column_1` AS `alias_1` FROM `table_1`) SELECT `table_1`.`column_1` AS `alias_3` FROM `table_1` INNER JOIN `alias_2` ON (`table_1`.`column_1` = `alias_2`.`alias_1`) WHERE (`table_1`.`column_1` = ?)
? = 1
----


query  rowsort
WITH `alias_2` AS (SELECT `table_1`.`column_1` AS `alias_1` FROM `table_1`) SELECT `table_1`.`column_1` AS `alias_3` FROM `table_1` INNER JOIN `alias_2` ON (`table_1`.`column_1` = `alias_2`.`alias_1`) WHERE (`table_1`.`column_1` = ?)
? = 1
----


query  rowsort
WITH `alias_2` AS (SELECT `table_1`.`column_1` AS `alias_1` FROM `table_1`) SELECT `table_1`.`column_1` AS `alias_3` FROM `table_1` INNER JOIN `alias_2` ON (`table_1`.`column_1` = `alias_2`.`alias_1`) WHERE (`table_1`.`column_1` = ?)
? = 1
----


query  rowsort
WITH `alias_2` AS (SELECT `table_1`.`column_1` AS `alias_1` FROM `table_1`) SELECT `table_1`.`column_1` AS `alias_3` FROM `table_1` INNER JOIN `alias_2` ON (`table_1`.`column_1` = `alias_2`.`alias_1`) WHERE (`table_1`.`column_1` > ?)
? = 10
----
548661917

query  rowsort
WITH `alias_2` AS (SELECT `table_1`.`column_1` AS `alias_1` FROM `table_1`) SELECT `table_1`.`column_1` AS `alias_3` FROM `table_1` INNER JOIN `alias_2` ON (`table_1`.`column_1` = `alias_2`.`alias_1`) WHERE (`table_1`.`column_1` > ?)
? = 10
----
548661917

query  rowsort
WITH `alias_2` AS (SELECT `table_1`.`column_1` AS `alias_1` FROM `table_1`) SELECT `table_1`.`column_1` AS `alias_3` FROM `table_1` INNER JOIN `alias_2` ON (`table_1`.`column_1` = `alias_2`.`alias_1`) WHERE (`table_1`.`column_1` > ?)
? = 10
----
548661917

query  rowsort
WITH `alias_2` AS (SELECT `table_1`.`column_1` AS `alias_1` FROM `table_1`) SELECT `table_1`.`column_1` AS `alias_3` FROM `table_1` INNER JOIN `alias_2` ON (`table_1`.`column_1` = `alias_2`.`alias_1`) WHERE ((`table_1`.`column_1` = ?) AND (`table_1`.`column_1` > ?))
? = 1
? = 10
----


query  rowsort
WITH `alias_2` AS (SELECT `table_1`.`column_1` AS `alias_1` FROM `table_1`) SELECT `table_1`.`column_1` AS `alias_3` FROM `table_1` INNER JOIN `alias_2` ON (`table_1`.`column_1` = `alias_2`.`alias_1`) WHERE ((`table_1`.`column_1` = ?) AND (`table_1`.`column_1` > ?))
? = 1
? = 10
----


query  rowsort
WITH `alias_2` AS (SELECT `table_1`.`column_1` AS `alias_1` FROM `table_1`) SELECT `table_1`.`column_1` AS `alias_3` FROM `table_1` INNER JOIN `alias_2` ON (`table_1`.`column_1` = `alias_2`.`alias_1`) WHERE ((`table_1`.`column_1` = ?) AND (`table_1`.`column_1` > ?))
? = 1
? = 10
----

