# Generated by:
#     target/debug/noria-logictest permute --compare-to mysql://root:noria@127.1/noria -d 3 -o logictests/generated/mysql/ --only range_param --random --include-deletes --rows-per-table 10 --subquery-depth 1

statement ok
CREATE TABLE `table_1` (`column_12` INT, `column_1` INT, `column_3` INT, `column_4` INT, `column_8` INT, `column_9` INT, `column_6` INT, `column_11` INT, `column_13` INT, `column_10` INT, `column_2` INT, `column_5` INT, `column_7` INT, PRIMARY KEY (`column_13`))


statement ok
INSERT INTO `table_1` (`column_12`, `column_1`, `column_3`, `column_4`, `column_8`, `column_9`, `column_6`, `column_11`, `column_13`, `column_10`, `column_2`, `column_5`, `column_7`) VALUES (1597001009, -2049371914, 1595504939, -256809523, -504368177, 1054776692, 1066773326, -1654491081, 0, -1665505425, 240364435, 1083898644, -918441354), (-1732159233, -1233747109, -680702333, 745575242, -518751140, -302826269, -745932960, -2125463994, 1, -917425010, 62251971, 1610630698, 1794358066), (-1563715564, -208003830, 967732511, -2108755869, -1959670305, -871785041, -975885707, 1770113748, 2, 1909565773, 1192332636, -1892341726, -1773117627), (-104580438, 564904085, -1545171218, -1683430841, -1309580007, 1856806995, -904930781, -814420508, 3, -1783170388, 905269554, 329978466, 1283259695), (-2024592990, 567715528, 1517022345, -1153977858, 1091798128, -1450877743, 395221121, 1625344035, 4, 1608155774, -1071384635, -290168988, -497338485), (-1996681842, 1553745191, 723795371, 1645809511, 582100161, -1795448745, 1594661626, 1879098826, 5, 1599223832, 1075463766, 36546769, 1710736847), (-810331992, 1922424890, 1514771021, 492319843, -863968608, -1313082102, 1974998171, -1741052856, 6, -1974867250, -1552794533, -1134558322, -1499271704), (-2103603059, 1703635054, -1907386193, -377039817, -330301419, -1348276350, 330766550, -274207342, 7, 2002352483, 1472113108, -1521175993, -2140493486), (-877595572, 1647685132, 2141155447, -617290186, 114828906, 122813423, 1356733177, -520290571, 8, 605518627, 1825284449, 1878725882, -986233081), (-590219733, 275041288, 2061298226, 1955927047, -1933611328, -705128656, 1589705841, -872705726, 9, 986546298, -826829772, 727603983, -1242182513)


query  rowsort
WITH `alias_3` AS (SELECT count(`table_1`.`column_2`) AS `alias_2` FROM `table_1`) SELECT count(`table_1`.`column_1`) AS `alias_1` FROM `table_1` INNER JOIN `alias_3` ON (`table_1`.`column_2` = `alias_3`.`alias_2`)
----
0

query  rowsort
WITH `alias_3` AS (SELECT `table_1`.`column_2` AS `alias_2` FROM `table_1`) SELECT count(`table_1`.`column_3`) AS `alias_1` FROM `table_1` INNER JOIN `alias_3` ON (`table_1`.`column_2` = `alias_3`.`alias_2`)
----
10

query  rowsort
WITH `alias_3` AS (SELECT count(`table_1`.`column_5`) AS `alias_2` FROM `table_1`) SELECT count(`table_1`.`column_4`) AS `alias_1` FROM `table_1` INNER JOIN `alias_3` ON (`table_1`.`column_1` = `alias_3`.`alias_2`)
----
0

query  rowsort
WITH `alias_2` AS (SELECT count(`table_1`.`column_6`) AS `alias_1` FROM `table_1`) SELECT `table_1`.`column_1` AS `alias_3` FROM `table_1` INNER JOIN `alias_2` ON (`table_1`.`column_1` = `alias_2`.`alias_1`) WHERE (`table_1`.`column_1` > ?)
? = 10
----


query  rowsort
WITH `alias_2` AS (SELECT `table_1`.`column_1` AS `alias_1` FROM `table_1`) SELECT `table_1`.`column_1` AS `alias_3` FROM `table_1` INNER JOIN `alias_2` ON (`table_1`.`column_1` = `alias_2`.`alias_1`) WHERE (`table_1`.`column_1` > ?)
? = 10
----
1553745191
1647685132
1703635054
1922424890
275041288
564904085
567715528

query  rowsort
WITH `alias_2` AS (SELECT count(`table_1`.`column_7`) AS `alias_1` FROM `table_1`) SELECT `table_1`.`column_7` AS `alias_3` FROM `table_1` INNER JOIN `alias_2` ON (`table_1`.`column_7` = `alias_2`.`alias_1`) WHERE (`table_1`.`column_1` > ?)
? = 10
----


query  rowsort
WITH `alias_3` AS (SELECT count(`table_1`.`column_9`) AS `alias_2` FROM `table_1`) SELECT count(`table_1`.`column_8`) AS `alias_1` FROM `table_1` INNER JOIN `alias_3` ON (`table_1`.`column_1` = `alias_3`.`alias_2`) WHERE (`table_1`.`column_1` > ?)
? = 10
----
0

query  rowsort
WITH `alias_3` AS (SELECT `table_1`.`column_1` AS `alias_2` FROM `table_1`) SELECT count(`table_1`.`column_10`) AS `alias_1` FROM `table_1` INNER JOIN `alias_3` ON (`table_1`.`column_1` = `alias_3`.`alias_2`) WHERE (`table_1`.`column_1` > ?)
? = 10
----
7

query  rowsort
WITH `alias_3` AS (SELECT count(`table_1`.`column_12`) AS `alias_2` FROM `table_1`) SELECT count(`table_1`.`column_11`) AS `alias_1` FROM `table_1` INNER JOIN `alias_3` ON (`table_1`.`column_12` = `alias_3`.`alias_2`) WHERE (`table_1`.`column_1` > ?)
? = 10
----
0

statement ok
DELETE FROM `table_1` WHERE (`column_13` = 0)


statement ok
DELETE FROM `table_1` WHERE (`column_13` = 1)


statement ok
DELETE FROM `table_1` WHERE (`column_13` = 2)


statement ok
DELETE FROM `table_1` WHERE (`column_13` = 3)


statement ok
DELETE FROM `table_1` WHERE (`column_13` = 4)


query  rowsort
WITH `alias_3` AS (SELECT count(`table_1`.`column_2`) AS `alias_2` FROM `table_1`) SELECT count(`table_1`.`column_1`) AS `alias_1` FROM `table_1` INNER JOIN `alias_3` ON (`table_1`.`column_2` = `alias_3`.`alias_2`)
----
0

query  rowsort
WITH `alias_3` AS (SELECT `table_1`.`column_2` AS `alias_2` FROM `table_1`) SELECT count(`table_1`.`column_3`) AS `alias_1` FROM `table_1` INNER JOIN `alias_3` ON (`table_1`.`column_2` = `alias_3`.`alias_2`)
----
5

query  rowsort
WITH `alias_3` AS (SELECT count(`table_1`.`column_5`) AS `alias_2` FROM `table_1`) SELECT count(`table_1`.`column_4`) AS `alias_1` FROM `table_1` INNER JOIN `alias_3` ON (`table_1`.`column_1` = `alias_3`.`alias_2`)
----
0

query  rowsort
WITH `alias_2` AS (SELECT count(`table_1`.`column_6`) AS `alias_1` FROM `table_1`) SELECT `table_1`.`column_1` AS `alias_3` FROM `table_1` INNER JOIN `alias_2` ON (`table_1`.`column_1` = `alias_2`.`alias_1`) WHERE (`table_1`.`column_1` > ?)
? = 10
----


query  rowsort
WITH `alias_2` AS (SELECT `table_1`.`column_1` AS `alias_1` FROM `table_1`) SELECT `table_1`.`column_1` AS `alias_3` FROM `table_1` INNER JOIN `alias_2` ON (`table_1`.`column_1` = `alias_2`.`alias_1`) WHERE (`table_1`.`column_1` > ?)
? = 10
----
1553745191
1647685132
1703635054
1922424890
275041288

query  rowsort
WITH `alias_2` AS (SELECT count(`table_1`.`column_7`) AS `alias_1` FROM `table_1`) SELECT `table_1`.`column_7` AS `alias_3` FROM `table_1` INNER JOIN `alias_2` ON (`table_1`.`column_7` = `alias_2`.`alias_1`) WHERE (`table_1`.`column_1` > ?)
? = 10
----


query  rowsort
WITH `alias_3` AS (SELECT count(`table_1`.`column_9`) AS `alias_2` FROM `table_1`) SELECT count(`table_1`.`column_8`) AS `alias_1` FROM `table_1` INNER JOIN `alias_3` ON (`table_1`.`column_1` = `alias_3`.`alias_2`) WHERE (`table_1`.`column_1` > ?)
? = 10
----
0

query  rowsort
WITH `alias_3` AS (SELECT `table_1`.`column_1` AS `alias_2` FROM `table_1`) SELECT count(`table_1`.`column_10`) AS `alias_1` FROM `table_1` INNER JOIN `alias_3` ON (`table_1`.`column_1` = `alias_3`.`alias_2`) WHERE (`table_1`.`column_1` > ?)
? = 10
----
5

query  rowsort
WITH `alias_3` AS (SELECT count(`table_1`.`column_12`) AS `alias_2` FROM `table_1`) SELECT count(`table_1`.`column_11`) AS `alias_1` FROM `table_1` INNER JOIN `alias_3` ON (`table_1`.`column_12` = `alias_3`.`alias_2`) WHERE (`table_1`.`column_1` > ?)
? = 10
----
0
