# Generated by:
#     target/debug/noria-logictest permute --compare-to mysql://root:noria@127.1/noria -d 3 -o logictests/generated/mysql/ --only range_param --random --include-deletes --rows-per-table 10 --subquery-depth 1

statement ok
CREATE TABLE `table_1` (`column_6` INT, `column_1` INT, `column_5` INT, `column_2` INT, `column_3` INT, `column_4` INT, PRIMARY KEY (`column_6`))


statement ok
CREATE TABLE `table_4` (`column_2` INT, `column_3` INT, `column_1` INT, PRIMARY KEY (`column_3`))


statement ok
CREATE TABLE `table_3` (`column_2` INT, `column_3` INT, `column_1` INT, PRIMARY KEY (`column_3`))


statement ok
CREATE TABLE `table_2` (`column_2` INT, `column_3` INT, `column_1` INT, PRIMARY KEY (`column_3`))


statement ok
CREATE TABLE `table_5` (`column_1` INT, `column_2` INT, `column_3` INT, PRIMARY KEY (`column_3`))


statement ok
INSERT INTO `table_1` (`column_6`, `column_1`, `column_5`, `column_2`, `column_3`, `column_4`) VALUES (0, 893565784, -447431777, 128466489, -1633440395, -1818183760), (1, 301829501, -1949259985, 1380110260, 1826261447, -1824704425), (2, -2121871514, -1496308884, -985978313, 723126358, -631818298), (3, -1549702796, 299394268, 679325471, 567416299, 1092383795), (4, 1876172479, 49583507, -565333669, 313996243, 2107034033), (5, 123336972, -1571585202, 1335827201, 1921971407, -1681197221), (6, -1271601233, 1431690458, -178174780, 1472377716, 1190528637), (7, 2123874887, -1714363031, -306101999, -97677964, -474699897), (8, 749725487, -178676169, -1345452925, -1711511034, 2017988184), (9, 1513788524, 2060932153, 115085851, -884281413, 1584204649)


statement ok
INSERT INTO `table_4` (`column_2`, `column_3`, `column_1`) VALUES (-1740202567, 0, -1923642586), (586210873, 1, -1933927895), (1673583939, 2, -693486769), (1260036801, 3, -1067705096), (1272342836, 4, -1559092493), (1337966621, 5, 904583356), (1641106382, 6, 17674340), (-1064792638, 7, -173775575), (-1685478722, 8, -1794968565), (1401083469, 9, 345603025)


statement ok
INSERT INTO `table_3` (`column_2`, `column_3`, `column_1`) VALUES (1523668698, 0, -924675348), (1546559950, 1, -344419296), (67317015, 2, -654356994), (-264150338, 3, 516167421), (248073109, 4, -19046313), (776809192, 5, 746578222), (131317781, 6, -2133706169), (-1562479887, 7, 297571737), (-1499835116, 8, -37122251), (206391973, 9, -2092537681)


statement ok
INSERT INTO `table_2` (`column_2`, `column_3`, `column_1`) VALUES (119513358, 0, -1556821961), (1929067495, 1, 615661127), (578720456, 2, 220821520), (-1404551150, 3, -1592845204), (1470420741, 4, -173114015), (-217223100, 5, 975343197), (-2121202649, 6, -229384977), (464753686, 7, 1004851552), (635997050, 8, 1041059007), (1492231160, 9, -1984724524)


statement ok
INSERT INTO `table_5` (`column_1`, `column_2`, `column_3`) VALUES (-997192059, 426064880, 0), (540837313, -139794287, 1), (626069056, -1593572569, 2), (-319925773, -28019039, 3), (-1698265329, -238311842, 4), (1326962448, -707080680, 5), (-649817654, 1170710274, 6), (1209121855, 1021102502, 7), (-2029410725, -1263198804, 8), (109840791, -783905918, 9)


query  rowsort
SELECT DISTINCT `table_1`.`column_1` AS `alias_1` FROM `table_1`
----
-1271601233
-1549702796
-2121871514
123336972
1513788524
1876172479
2123874887
301829501
749725487
893565784

query  rowsort
SELECT `table_1`.`column_2` AS `alias_1`, `table_2`.`column_2` AS `alias_2` FROM `table_1` INNER JOIN `table_2` ON (`table_1`.`column_1` = `table_2`.`column_1`)
----


query  rowsort
SELECT `table_1`.`column_2` AS `alias_1` FROM `table_1` WHERE (`table_1`.`column_2` > ?)
? = 10
----
115085851
128466489
1335827201
1380110260
679325471

query  rowsort
SELECT DISTINCT `table_1`.`column_3` AS `alias_1`, `table_3`.`column_2` AS `alias_2` FROM `table_1` INNER JOIN `table_3` ON (`table_1`.`column_2` = `table_3`.`column_1`)
----


query  rowsort
SELECT DISTINCT `table_1`.`column_2` AS `alias_1` FROM `table_1` WHERE (`table_1`.`column_2` > ?)
? = 10
----
115085851
128466489
1335827201
1380110260
679325471

query  rowsort
SELECT `table_1`.`column_4` AS `alias_1`, `table_4`.`column_2` AS `alias_2` FROM `table_1` INNER JOIN `table_4` ON (`table_1`.`column_2` = `table_4`.`column_1`) WHERE (`table_1`.`column_1` > ?)
? = 10
----


query  rowsort
SELECT DISTINCT `table_1`.`column_5` AS `alias_1`, `table_5`.`column_2` AS `alias_2` FROM `table_1` INNER JOIN `table_5` ON (`table_1`.`column_1` = `table_5`.`column_1`) WHERE (`table_1`.`column_1` > ?)
? = 10
----


statement ok
DELETE FROM `table_1` WHERE (`column_6` = 0)


statement ok
DELETE FROM `table_1` WHERE (`column_6` = 1)


statement ok
DELETE FROM `table_1` WHERE (`column_6` = 2)


statement ok
DELETE FROM `table_1` WHERE (`column_6` = 3)


statement ok
DELETE FROM `table_1` WHERE (`column_6` = 4)


statement ok
DELETE FROM `table_4` WHERE (`column_3` = 0)


statement ok
DELETE FROM `table_4` WHERE (`column_3` = 1)


statement ok
DELETE FROM `table_4` WHERE (`column_3` = 2)


statement ok
DELETE FROM `table_4` WHERE (`column_3` = 3)


statement ok
DELETE FROM `table_4` WHERE (`column_3` = 4)


statement ok
DELETE FROM `table_3` WHERE (`column_3` = 0)


statement ok
DELETE FROM `table_3` WHERE (`column_3` = 1)


statement ok
DELETE FROM `table_3` WHERE (`column_3` = 2)


statement ok
DELETE FROM `table_3` WHERE (`column_3` = 3)


statement ok
DELETE FROM `table_3` WHERE (`column_3` = 4)


statement ok
DELETE FROM `table_2` WHERE (`column_3` = 0)


statement ok
DELETE FROM `table_2` WHERE (`column_3` = 1)


statement ok
DELETE FROM `table_2` WHERE (`column_3` = 2)


statement ok
DELETE FROM `table_2` WHERE (`column_3` = 3)


statement ok
DELETE FROM `table_2` WHERE (`column_3` = 4)


statement ok
DELETE FROM `table_5` WHERE (`column_3` = 0)


statement ok
DELETE FROM `table_5` WHERE (`column_3` = 1)


statement ok
DELETE FROM `table_5` WHERE (`column_3` = 2)


statement ok
DELETE FROM `table_5` WHERE (`column_3` = 3)


statement ok
DELETE FROM `table_5` WHERE (`column_3` = 4)


query  rowsort
SELECT DISTINCT `table_1`.`column_1` AS `alias_1` FROM `table_1`
----
-1271601233
123336972
1513788524
2123874887
749725487

query  rowsort
SELECT `table_1`.`column_2` AS `alias_1`, `table_2`.`column_2` AS `alias_2` FROM `table_1` INNER JOIN `table_2` ON (`table_1`.`column_1` = `table_2`.`column_1`)
----


query  rowsort
SELECT `table_1`.`column_2` AS `alias_1` FROM `table_1` WHERE (`table_1`.`column_2` > ?)
? = 10
----
115085851
1335827201

query  rowsort
SELECT DISTINCT `table_1`.`column_3` AS `alias_1`, `table_3`.`column_2` AS `alias_2` FROM `table_1` INNER JOIN `table_3` ON (`table_1`.`column_2` = `table_3`.`column_1`)
----


query  rowsort
SELECT DISTINCT `table_1`.`column_2` AS `alias_1` FROM `table_1` WHERE (`table_1`.`column_2` > ?)
? = 10
----
115085851
1335827201

query  rowsort
SELECT `table_1`.`column_4` AS `alias_1`, `table_4`.`column_2` AS `alias_2` FROM `table_1` INNER JOIN `table_4` ON (`table_1`.`column_2` = `table_4`.`column_1`) WHERE (`table_1`.`column_1` > ?)
? = 10
----


query  rowsort
SELECT DISTINCT `table_1`.`column_5` AS `alias_1`, `table_5`.`column_2` AS `alias_2` FROM `table_1` INNER JOIN `table_5` ON (`table_1`.`column_1` = `table_5`.`column_1`) WHERE (`table_1`.`column_1` > ?)
? = 10
----

