# Generated by:
#     target/debug/noria-logictest permute --compare-to mysql://root:noria@127.1/noria -d 3 -o logictests/generated/mysql/ --only range_param --random --include-deletes --rows-per-table 10 --subquery-depth 1

statement ok
CREATE TABLE `table_1` (`column_1` INT, `column_2` INT, PRIMARY KEY (`column_2`))


statement ok
INSERT INTO `table_1` (`column_1`, `column_2`) VALUES (921041635, 0), (406868625, 1), (1406089315, 2), (2019541256, 3), (2114135872, 4), (-1422489732, 5), (334589292, 6), (-1922075266, 7), (-1279147223, 8), (657210738, 9)


query  rowsort
WITH `alias_2` AS (SELECT DISTINCT `table_1`.`column_1` AS `alias_1` FROM `table_1`) SELECT DISTINCT `table_1`.`column_1` AS `alias_3` FROM `table_1` INNER JOIN `alias_2` ON (`table_1`.`column_1` = `alias_2`.`alias_1`)
----
-1279147223
-1422489732
-1922075266
1406089315
2019541256
2114135872
334589292
406868625
657210738
921041635

query  rowsort
WITH `alias_2` AS (SELECT `table_1`.`column_1` AS `alias_1` FROM `table_1`) SELECT DISTINCT `table_1`.`column_1` AS `alias_3` FROM `table_1` INNER JOIN `alias_2` ON (`table_1`.`column_1` = `alias_2`.`alias_1`)
----
-1279147223
-1422489732
-1922075266
1406089315
2019541256
2114135872
334589292
406868625
657210738
921041635

query  rowsort
WITH `alias_2` AS (SELECT DISTINCT `table_1`.`column_1` AS `alias_1` FROM `table_1`) SELECT DISTINCT `table_1`.`column_1` AS `alias_3` FROM `table_1` INNER JOIN `alias_2` ON (`table_1`.`column_1` = `alias_2`.`alias_1`)
----
-1279147223
-1422489732
-1922075266
1406089315
2019541256
2114135872
334589292
406868625
657210738
921041635

query  rowsort
WITH `alias_2` AS (SELECT DISTINCT `table_1`.`column_1` AS `alias_1` FROM `table_1`) SELECT `table_1`.`column_1` AS `alias_3` FROM `table_1` INNER JOIN `alias_2` ON (`table_1`.`column_1` = `alias_2`.`alias_1`) WHERE (`table_1`.`column_1` > ?)
? = 10
----
1406089315
2019541256
2114135872
334589292
406868625
657210738
921041635

query  rowsort
WITH `alias_2` AS (SELECT `table_1`.`column_1` AS `alias_1` FROM `table_1`) SELECT `table_1`.`column_1` AS `alias_3` FROM `table_1` INNER JOIN `alias_2` ON (`table_1`.`column_1` = `alias_2`.`alias_1`) WHERE (`table_1`.`column_1` > ?)
? = 10
----
1406089315
2019541256
2114135872
334589292
406868625
657210738
921041635

query  rowsort
WITH `alias_2` AS (SELECT DISTINCT `table_1`.`column_1` AS `alias_1` FROM `table_1`) SELECT `table_1`.`column_1` AS `alias_3` FROM `table_1` INNER JOIN `alias_2` ON (`table_1`.`column_1` = `alias_2`.`alias_1`) WHERE (`table_1`.`column_1` > ?)
? = 10
----
1406089315
2019541256
2114135872
334589292
406868625
657210738
921041635

query  rowsort
WITH `alias_2` AS (SELECT DISTINCT `table_1`.`column_1` AS `alias_1` FROM `table_1`) SELECT DISTINCT `table_1`.`column_1` AS `alias_3` FROM `table_1` INNER JOIN `alias_2` ON (`table_1`.`column_1` = `alias_2`.`alias_1`) WHERE (`table_1`.`column_1` > ?)
? = 10
----
1406089315
2019541256
2114135872
334589292
406868625
657210738
921041635

query  rowsort
WITH `alias_2` AS (SELECT `table_1`.`column_1` AS `alias_1` FROM `table_1`) SELECT DISTINCT `table_1`.`column_1` AS `alias_3` FROM `table_1` INNER JOIN `alias_2` ON (`table_1`.`column_1` = `alias_2`.`alias_1`) WHERE (`table_1`.`column_1` > ?)
? = 10
----
1406089315
2019541256
2114135872
334589292
406868625
657210738
921041635

query  rowsort
WITH `alias_2` AS (SELECT DISTINCT `table_1`.`column_1` AS `alias_1` FROM `table_1`) SELECT DISTINCT `table_1`.`column_1` AS `alias_3` FROM `table_1` INNER JOIN `alias_2` ON (`table_1`.`column_1` = `alias_2`.`alias_1`) WHERE (`table_1`.`column_1` > ?)
? = 10
----
1406089315
2019541256
2114135872
334589292
406868625
657210738
921041635

statement ok
DELETE FROM `table_1` WHERE (`column_2` = 0)


statement ok
DELETE FROM `table_1` WHERE (`column_2` = 1)


statement ok
DELETE FROM `table_1` WHERE (`column_2` = 2)


statement ok
DELETE FROM `table_1` WHERE (`column_2` = 3)


statement ok
DELETE FROM `table_1` WHERE (`column_2` = 4)


query  rowsort
WITH `alias_2` AS (SELECT DISTINCT `table_1`.`column_1` AS `alias_1` FROM `table_1`) SELECT DISTINCT `table_1`.`column_1` AS `alias_3` FROM `table_1` INNER JOIN `alias_2` ON (`table_1`.`column_1` = `alias_2`.`alias_1`)
----
-1279147223
-1422489732
-1922075266
334589292
657210738

query  rowsort
WITH `alias_2` AS (SELECT `table_1`.`column_1` AS `alias_1` FROM `table_1`) SELECT DISTINCT `table_1`.`column_1` AS `alias_3` FROM `table_1` INNER JOIN `alias_2` ON (`table_1`.`column_1` = `alias_2`.`alias_1`)
----
-1279147223
-1422489732
-1922075266
334589292
657210738

query  rowsort
WITH `alias_2` AS (SELECT DISTINCT `table_1`.`column_1` AS `alias_1` FROM `table_1`) SELECT DISTINCT `table_1`.`column_1` AS `alias_3` FROM `table_1` INNER JOIN `alias_2` ON (`table_1`.`column_1` = `alias_2`.`alias_1`)
----
-1279147223
-1422489732
-1922075266
334589292
657210738

query  rowsort
WITH `alias_2` AS (SELECT DISTINCT `table_1`.`column_1` AS `alias_1` FROM `table_1`) SELECT `table_1`.`column_1` AS `alias_3` FROM `table_1` INNER JOIN `alias_2` ON (`table_1`.`column_1` = `alias_2`.`alias_1`) WHERE (`table_1`.`column_1` > ?)
? = 10
----
334589292
657210738

query  rowsort
WITH `alias_2` AS (SELECT `table_1`.`column_1` AS `alias_1` FROM `table_1`) SELECT `table_1`.`column_1` AS `alias_3` FROM `table_1` INNER JOIN `alias_2` ON (`table_1`.`column_1` = `alias_2`.`alias_1`) WHERE (`table_1`.`column_1` > ?)
? = 10
----
334589292
657210738

query  rowsort
WITH `alias_2` AS (SELECT DISTINCT `table_1`.`column_1` AS `alias_1` FROM `table_1`) SELECT `table_1`.`column_1` AS `alias_3` FROM `table_1` INNER JOIN `alias_2` ON (`table_1`.`column_1` = `alias_2`.`alias_1`) WHERE (`table_1`.`column_1` > ?)
? = 10
----
334589292
657210738

query  rowsort
WITH `alias_2` AS (SELECT DISTINCT `table_1`.`column_1` AS `alias_1` FROM `table_1`) SELECT DISTINCT `table_1`.`column_1` AS `alias_3` FROM `table_1` INNER JOIN `alias_2` ON (`table_1`.`column_1` = `alias_2`.`alias_1`) WHERE (`table_1`.`column_1` > ?)
? = 10
----
334589292
657210738

query  rowsort
WITH `alias_2` AS (SELECT `table_1`.`column_1` AS `alias_1` FROM `table_1`) SELECT DISTINCT `table_1`.`column_1` AS `alias_3` FROM `table_1` INNER JOIN `alias_2` ON (`table_1`.`column_1` = `alias_2`.`alias_1`) WHERE (`table_1`.`column_1` > ?)
? = 10
----
334589292
657210738

query  rowsort
WITH `alias_2` AS (SELECT DISTINCT `table_1`.`column_1` AS `alias_1` FROM `table_1`) SELECT DISTINCT `table_1`.`column_1` AS `alias_3` FROM `table_1` INNER JOIN `alias_2` ON (`table_1`.`column_1` = `alias_2`.`alias_1`) WHERE (`table_1`.`column_1` > ?)
? = 10
----
334589292
657210738
