# Generated by:
#     target/debug/noria-logictest permute --compare-to mysql://root:noria@127.1/noria -d 3 -o logictests/generated/mysql/ --only range_param --random --include-deletes --rows-per-table 10 --subquery-depth 1

statement ok
CREATE TABLE `table_1` (`column_1` INT, `column_2` INT, `column_4` INT, `column_3` INT, `column_5` INT, `column_6` INT, PRIMARY KEY (`column_6`))


statement ok
INSERT INTO `table_1` (`column_1`, `column_2`, `column_4`, `column_3`, `column_5`, `column_6`) VALUES (-529255928, -743931001, 483357543, 110174835, -66486166, 0), (1026591285, 1192875401, 2034031649, -373601118, -1663893923, 1), (1173886190, -1641752999, -810430789, -6822231, -1537870715, 2), (1690111675, 712730726, -1907547136, -21739829, 1847884874, 3), (-1065660945, -1007558676, -779652596, -1000594294, 1030000400, 4), (-2071505448, -972720738, 772340330, 630359028, -1835622920, 5), (-1848856988, 1742327022, -528493777, 1652743523, 630608769, 6), (-419625706, -1935732404, 212274568, 280572161, 1178575230, 7), (1387808480, 702596908, 19265884, 1733814111, -479685129, 8), (870524336, 623116090, 40263341, -256025145, -1751633158, 9)


query  rowsort
SELECT DISTINCT `table_1`.`column_1` AS `alias_1` FROM `table_1`
----
-1065660945
-1848856988
-2071505448
-419625706
-529255928
1026591285
1173886190
1387808480
1690111675
870524336

query  rowsort
SELECT sum(`table_1`.`column_2`) AS `alias_1` FROM `table_1`
----
-1328049671

query  rowsort
SELECT `table_1`.`column_1` AS `alias_1` FROM `table_1` WHERE (`table_1`.`column_1` > ?)
? = 10
----
1026591285
1173886190
1387808480
1690111675
870524336

query  rowsort
SELECT DISTINCT sum(`table_1`.`column_3`) AS `alias_1` FROM `table_1`
----
2748881041

query  rowsort
SELECT DISTINCT `table_1`.`column_1` AS `alias_1` FROM `table_1` WHERE (`table_1`.`column_1` > ?)
? = 10
----
1026591285
1173886190
1387808480
1690111675
870524336

query  rowsort
SELECT sum(`table_1`.`column_4`) AS `alias_1` FROM `table_1` WHERE (`table_1`.`column_1` > ?)
? = 10
----
-624417051

query  rowsort
SELECT DISTINCT sum(`table_1`.`column_5`) AS `alias_1` FROM `table_1` WHERE (`table_1`.`column_1` > ?)
? = 10
----
-3585198051

statement ok
DELETE FROM `table_1` WHERE (`column_6` = 0)


statement ok
DELETE FROM `table_1` WHERE (`column_6` = 1)


statement ok
DELETE FROM `table_1` WHERE (`column_6` = 2)


statement ok
DELETE FROM `table_1` WHERE (`column_6` = 3)


statement ok
DELETE FROM `table_1` WHERE (`column_6` = 4)


query  rowsort
SELECT DISTINCT `table_1`.`column_1` AS `alias_1` FROM `table_1`
----
-1848856988
-2071505448
-419625706
1387808480
870524336

query  rowsort
SELECT sum(`table_1`.`column_2`) AS `alias_1` FROM `table_1`
----
159586878

query  rowsort
SELECT `table_1`.`column_1` AS `alias_1` FROM `table_1` WHERE (`table_1`.`column_1` > ?)
? = 10
----
1387808480
870524336

query  rowsort
SELECT DISTINCT sum(`table_1`.`column_3`) AS `alias_1` FROM `table_1`
----
4041463678

query  rowsort
SELECT DISTINCT `table_1`.`column_1` AS `alias_1` FROM `table_1` WHERE (`table_1`.`column_1` > ?)
? = 10
----
1387808480
870524336

query  rowsort
SELECT sum(`table_1`.`column_4`) AS `alias_1` FROM `table_1` WHERE (`table_1`.`column_1` > ?)
? = 10
----
59529225

query  rowsort
SELECT DISTINCT sum(`table_1`.`column_5`) AS `alias_1` FROM `table_1` WHERE (`table_1`.`column_1` > ?)
? = 10
----
-2231318287
