# Generated by:
#     target/debug/noria-logictest permute --compare-to mysql://root:noria@127.1/noria -d 3 -o logictests/generated/mysql/ --only range_param --random --include-deletes --rows-per-table 10 --subquery-depth 1

statement ok
CREATE TABLE `table_1` (`column_2` INT, `column_4` INT, `column_6` INT, `column_1` INT, `column_3` INT, `column_5` INT, PRIMARY KEY (`column_6`))


statement ok
INSERT INTO `table_1` (`column_2`, `column_4`, `column_6`, `column_1`, `column_3`, `column_5`) VALUES (-545558073, -213656332, 0, 131588303, 813009816, -198670153), (-2111838698, 673066230, 1, -1596560752, -1390107113, -445286503), (-480246940, -919478946, 2, 213136027, -1680981142, 1668584289), (-999836669, 376299375, 3, 40916782, 295080620, -478909196), (-283094532, 563824396, 4, -844539285, 1026950597, 1246451987), (1898600971, -192179030, 5, -14427380, -1143322382, 57727523), (-72697325, -1762393494, 6, 2010575707, -1923378333, -576147417), (-527525308, -863804674, 7, 1590362556, -1934144959, 165978632), (1008346812, 272836377, 8, 1110621041, -1998101410, 1440478005), (-669889065, -1813583015, 9, 1908722706, 335249275, -1829785516)


query  rowsort
SELECT DISTINCT `table_1`.`column_1` AS `alias_1` FROM `table_1`
----
-14427380
-1596560752
-844539285
1110621041
131588303
1590362556
1908722706
2010575707
213136027
40916782

query  rowsort
SELECT avg(distinct `table_1`.`column_2`) AS `alias_1` FROM `table_1`
----
-278373882.7000

query  rowsort
SELECT `table_1`.`column_1` AS `alias_1` FROM `table_1` WHERE (`table_1`.`column_1` > ?)
? = 10
----
1110621041
131588303
1590362556
1908722706
2010575707
213136027
40916782

query  rowsort
SELECT DISTINCT avg(distinct `table_1`.`column_3`) AS `alias_1` FROM `table_1`
----
-759974503.1000

query  rowsort
SELECT DISTINCT `table_1`.`column_1` AS `alias_1` FROM `table_1` WHERE (`table_1`.`column_1` > ?)
? = 10
----
1110621041
131588303
1590362556
1908722706
2010575707
213136027
40916782

query  rowsort
SELECT avg(distinct `table_1`.`column_4`) AS `alias_1` FROM `table_1` WHERE (`table_1`.`column_2` > ?)
? = 10
----
40328673.5000

query  rowsort
SELECT DISTINCT avg(distinct `table_1`.`column_5`) AS `alias_1` FROM `table_1` WHERE (`table_1`.`column_2` > ?)
? = 10
----
749102764.0000

statement ok
DELETE FROM `table_1` WHERE (`column_6` = 0)


statement ok
DELETE FROM `table_1` WHERE (`column_6` = 1)


statement ok
DELETE FROM `table_1` WHERE (`column_6` = 2)


statement ok
DELETE FROM `table_1` WHERE (`column_6` = 3)


statement ok
DELETE FROM `table_1` WHERE (`column_6` = 4)


query  rowsort
SELECT DISTINCT `table_1`.`column_1` AS `alias_1` FROM `table_1`
----
-14427380
1110621041
1590362556
1908722706
2010575707

query  rowsort
SELECT avg(distinct `table_1`.`column_2`) AS `alias_1` FROM `table_1`
----
327367217.0000

query  rowsort
SELECT `table_1`.`column_1` AS `alias_1` FROM `table_1` WHERE (`table_1`.`column_1` > ?)
? = 10
----
1110621041
1590362556
1908722706
2010575707

query  rowsort
SELECT DISTINCT avg(distinct `table_1`.`column_3`) AS `alias_1` FROM `table_1`
----
-1332739561.8000

query  rowsort
SELECT DISTINCT `table_1`.`column_1` AS `alias_1` FROM `table_1` WHERE (`table_1`.`column_1` > ?)
? = 10
----
1110621041
1590362556
1908722706
2010575707

query  rowsort
SELECT avg(distinct `table_1`.`column_4`) AS `alias_1` FROM `table_1` WHERE (`table_1`.`column_2` > ?)
? = 10
----
40328673.5000

query  rowsort
SELECT DISTINCT avg(distinct `table_1`.`column_5`) AS `alias_1` FROM `table_1` WHERE (`table_1`.`column_2` > ?)
? = 10
----
749102764.0000
