# Generated by:
#     target/debug/noria-logictest permute --compare-to mysql://root:noria@127.1/noria -d 3 -o logictests/generated/mysql/ --only range_param --random --include-deletes --rows-per-table 10 --subquery-depth 1

statement ok
CREATE TABLE `table_1` (`column_4` INT, `column_3` INT, `column_2` INT, `column_5` INT, `column_6` INT, `column_1` INT, PRIMARY KEY (`column_6`))


statement ok
INSERT INTO `table_1` (`column_4`, `column_3`, `column_2`, `column_5`, `column_6`, `column_1`) VALUES (-1091383515, -805515122, 1616952957, -749094650, 0, 1198097299), (-1707860533, 2024844685, 1667923466, -1626307018, 1, -1102116223), (-806246613, -1606376263, -2081414233, -1675786119, 2, 1373425694), (-130178346, -1191906370, -239452995, 376680572, 3, -1260330453), (2092613667, 2052145566, -1626641371, 1253036246, 4, -1332610061), (1948323682, 328785609, -2063066744, 1509547490, 5, -552030948), (199857264, -1715878527, 1467272584, 596989249, 6, 608669020), (-49998628, 774311846, 1836203741, 625812354, 7, -381351102), (2142763487, -672547231, 878993214, 846032052, 8, -738329467), (-289398729, -1299391017, -2139625760, -897535694, 9, -147636905)


query  rowsort
SELECT DISTINCT `table_1`.`column_1` AS `alias_1` FROM `table_1`
----
-1102116223
-1260330453
-1332610061
-147636905
-381351102
-552030948
-738329467
1198097299
1373425694
608669020

query  rowsort
SELECT avg(`table_1`.`column_2`) AS `alias_1` FROM `table_1`
----
-68285514.1000

query  rowsort
SELECT `table_1`.`column_2` AS `alias_1` FROM `table_1` WHERE (`table_1`.`column_2` > ?)
? = 10
----
1467272584
1616952957
1667923466
1836203741
878993214

query  rowsort
SELECT DISTINCT avg(`table_1`.`column_3`) AS `alias_1` FROM `table_1`
----
-211152682.4000

query  rowsort
SELECT DISTINCT `table_1`.`column_2` AS `alias_1` FROM `table_1` WHERE (`table_1`.`column_2` > ?)
? = 10
----
1467272584
1616952957
1667923466
1836203741
878993214

query  rowsort
SELECT avg(`table_1`.`column_4`) AS `alias_1` FROM `table_1` WHERE (`table_1`.`column_4` > ?)
? = 10
----
1595889525.0000

query  rowsort
SELECT DISTINCT avg(`table_1`.`column_5`) AS `alias_1` FROM `table_1` WHERE (`table_1`.`column_4` > ?)
? = 10
----
1051401259.2500

statement ok
DELETE FROM `table_1` WHERE (`column_6` = 0)


statement ok
DELETE FROM `table_1` WHERE (`column_6` = 1)


statement ok
DELETE FROM `table_1` WHERE (`column_6` = 2)


statement ok
DELETE FROM `table_1` WHERE (`column_6` = 3)


statement ok
DELETE FROM `table_1` WHERE (`column_6` = 4)


query  rowsort
SELECT DISTINCT `table_1`.`column_1` AS `alias_1` FROM `table_1`
----
-147636905
-381351102
-552030948
-738329467
608669020

query  rowsort
SELECT avg(`table_1`.`column_2`) AS `alias_1` FROM `table_1`
----
-4044593.0000

query  rowsort
SELECT `table_1`.`column_2` AS `alias_1` FROM `table_1` WHERE (`table_1`.`column_2` > ?)
? = 10
----
1467272584
1836203741
878993214

query  rowsort
SELECT DISTINCT avg(`table_1`.`column_3`) AS `alias_1` FROM `table_1`
----
-516943864.0000

query  rowsort
SELECT DISTINCT `table_1`.`column_2` AS `alias_1` FROM `table_1` WHERE (`table_1`.`column_2` > ?)
? = 10
----
1467272584
1836203741
878993214

query  rowsort
SELECT avg(`table_1`.`column_4`) AS `alias_1` FROM `table_1` WHERE (`table_1`.`column_4` > ?)
? = 10
----
1430314811.0000

query  rowsort
SELECT DISTINCT avg(`table_1`.`column_5`) AS `alias_1` FROM `table_1` WHERE (`table_1`.`column_4` > ?)
? = 10
----
984189597.0000
