# Generated by:
#     target/debug/noria-logictest permute --compare-to mysql://root:noria@127.1/noria -d 3 -o logictests/generated/mysql/ --only range_param --random --include-deletes --rows-per-table 10 --subquery-depth 1

statement ok
CREATE TABLE `table_1` (`column_1` INT, `column_2` INT, PRIMARY KEY (`column_2`))


statement ok
INSERT INTO `table_1` (`column_1`, `column_2`) VALUES (904174441, 0), (962276853, 1), (117234474, 2), (302738984, 3), (-623783541, 4), (-93263223, 5), (1156908344, 6), (-75698301, 7), (-695474525, 8), (578156234, 9)


query  rowsort
SELECT DISTINCT `table_1`.`column_1` AS `alias_1` FROM `table_1`
----
-623783541
-695474525
-75698301
-93263223
1156908344
117234474
302738984
578156234
904174441
962276853

query  nosort
SELECT `table_1`.`column_1` AS `alias_1` FROM `table_1` ORDER BY `table_1`.`column_1` ASC LIMIT 10
----
-695474525
-623783541
-93263223
-75698301
117234474
302738984
578156234
904174441
962276853
1156908344

query  nosort
SELECT `table_1`.`column_1` AS `alias_1` FROM `table_1` ORDER BY `table_1`.`column_1` DESC LIMIT 10
----
1156908344
962276853
904174441
578156234
302738984
117234474
-75698301
-93263223
-623783541
-695474525

query  rowsort
SELECT `table_1`.`column_1` AS `alias_1` FROM `table_1` WHERE (`table_1`.`column_1` > ?)
? = 10
----
1156908344
117234474
302738984
578156234
904174441
962276853

query  nosort
SELECT DISTINCT `table_1`.`column_1` AS `alias_1` FROM `table_1` ORDER BY `table_1`.`column_1` ASC LIMIT 10
----
-695474525
-623783541
-93263223
-75698301
117234474
302738984
578156234
904174441
962276853
1156908344

query  nosort
SELECT DISTINCT `table_1`.`column_1` AS `alias_1` FROM `table_1` ORDER BY `table_1`.`column_1` DESC LIMIT 10
----
1156908344
962276853
904174441
578156234
302738984
117234474
-75698301
-93263223
-623783541
-695474525

query  rowsort
SELECT DISTINCT `table_1`.`column_1` AS `alias_1` FROM `table_1` WHERE (`table_1`.`column_1` > ?)
? = 10
----
1156908344
117234474
302738984
578156234
904174441
962276853

query  nosort
SELECT `table_1`.`column_1` AS `alias_1` FROM `table_1` ORDER BY `table_1`.`column_1` DESC LIMIT 10
----
1156908344
962276853
904174441
578156234
302738984
117234474
-75698301
-93263223
-623783541
-695474525

query  nosort
SELECT `table_1`.`column_1` AS `alias_1` FROM `table_1` WHERE (`table_1`.`column_1` > ?) ORDER BY `table_1`.`column_1` ASC LIMIT 10
? = 10
----
117234474
302738984
578156234
904174441
962276853
1156908344

query  nosort
SELECT `table_1`.`column_1` AS `alias_1` FROM `table_1` WHERE (`table_1`.`column_1` > ?) ORDER BY `table_1`.`column_1` DESC LIMIT 10
? = 10
----
1156908344
962276853
904174441
578156234
302738984
117234474

query  nosort
SELECT DISTINCT `table_1`.`column_1` AS `alias_1`, `table_1`.`column_1` AS `alias_2` FROM `table_1` ORDER BY `table_1`.`column_1` DESC LIMIT 10
----
1156908344
1156908344
962276853
962276853
904174441
904174441
578156234
578156234
302738984
302738984
117234474
117234474
-75698301
-75698301
-93263223
-93263223
-623783541
-623783541
-695474525
-695474525

query  nosort
SELECT DISTINCT `table_1`.`column_1` AS `alias_1` FROM `table_1` WHERE (`table_1`.`column_1` > ?) ORDER BY `table_1`.`column_1` ASC LIMIT 10
? = 10
----
117234474
302738984
578156234
904174441
962276853
1156908344

query  nosort
SELECT DISTINCT `table_1`.`column_1` AS `alias_1` FROM `table_1` WHERE (`table_1`.`column_1` > ?) ORDER BY `table_1`.`column_1` DESC LIMIT 10
? = 10
----
1156908344
962276853
904174441
578156234
302738984
117234474

query  nosort
SELECT `table_1`.`column_1` AS `alias_1` FROM `table_1` WHERE (`table_1`.`column_1` > ?) ORDER BY `table_1`.`column_1` DESC LIMIT 10
? = 10
----
1156908344
962276853
904174441
578156234
302738984
117234474

query  nosort
SELECT DISTINCT `table_1`.`column_1` AS `alias_1`, `table_1`.`column_1` AS `alias_2` FROM `table_1` WHERE (`table_1`.`column_1` > ?) ORDER BY `table_1`.`column_1` DESC LIMIT 10
? = 10
----
1156908344
1156908344
962276853
962276853
904174441
904174441
578156234
578156234
302738984
302738984
117234474
117234474

statement ok
DELETE FROM `table_1` WHERE (`column_2` = 0)


statement ok
DELETE FROM `table_1` WHERE (`column_2` = 1)


statement ok
DELETE FROM `table_1` WHERE (`column_2` = 2)


statement ok
DELETE FROM `table_1` WHERE (`column_2` = 3)


statement ok
DELETE FROM `table_1` WHERE (`column_2` = 4)


query  rowsort
SELECT DISTINCT `table_1`.`column_1` AS `alias_1` FROM `table_1`
----
-695474525
-75698301
-93263223
1156908344
578156234

query  nosort
SELECT `table_1`.`column_1` AS `alias_1` FROM `table_1` ORDER BY `table_1`.`column_1` ASC LIMIT 10
----
-695474525
-93263223
-75698301
578156234
1156908344

query  nosort
SELECT `table_1`.`column_1` AS `alias_1` FROM `table_1` ORDER BY `table_1`.`column_1` DESC LIMIT 10
----
1156908344
578156234
-75698301
-93263223
-695474525

query  rowsort
SELECT `table_1`.`column_1` AS `alias_1` FROM `table_1` WHERE (`table_1`.`column_1` > ?)
? = 10
----
1156908344
578156234

query  nosort
SELECT DISTINCT `table_1`.`column_1` AS `alias_1` FROM `table_1` ORDER BY `table_1`.`column_1` ASC LIMIT 10
----
-695474525
-93263223
-75698301
578156234
1156908344

query  nosort
SELECT DISTINCT `table_1`.`column_1` AS `alias_1` FROM `table_1` ORDER BY `table_1`.`column_1` DESC LIMIT 10
----
1156908344
578156234
-75698301
-93263223
-695474525

query  rowsort
SELECT DISTINCT `table_1`.`column_1` AS `alias_1` FROM `table_1` WHERE (`table_1`.`column_1` > ?)
? = 10
----
1156908344
578156234

query  nosort
SELECT `table_1`.`column_1` AS `alias_1` FROM `table_1` ORDER BY `table_1`.`column_1` DESC LIMIT 10
----
1156908344
578156234
-75698301
-93263223
-695474525

query  nosort
SELECT `table_1`.`column_1` AS `alias_1` FROM `table_1` WHERE (`table_1`.`column_1` > ?) ORDER BY `table_1`.`column_1` ASC LIMIT 10
? = 10
----
578156234
1156908344

query  nosort
SELECT `table_1`.`column_1` AS `alias_1` FROM `table_1` WHERE (`table_1`.`column_1` > ?) ORDER BY `table_1`.`column_1` DESC LIMIT 10
? = 10
----
1156908344
578156234

query  nosort
SELECT DISTINCT `table_1`.`column_1` AS `alias_1`, `table_1`.`column_1` AS `alias_2` FROM `table_1` ORDER BY `table_1`.`column_1` DESC LIMIT 10
----
1156908344
1156908344
578156234
578156234
-75698301
-75698301
-93263223
-93263223
-695474525
-695474525

query  nosort
SELECT DISTINCT `table_1`.`column_1` AS `alias_1` FROM `table_1` WHERE (`table_1`.`column_1` > ?) ORDER BY `table_1`.`column_1` ASC LIMIT 10
? = 10
----
578156234
1156908344

query  nosort
SELECT DISTINCT `table_1`.`column_1` AS `alias_1` FROM `table_1` WHERE (`table_1`.`column_1` > ?) ORDER BY `table_1`.`column_1` DESC LIMIT 10
? = 10
----
1156908344
578156234

query  nosort
SELECT `table_1`.`column_1` AS `alias_1` FROM `table_1` WHERE (`table_1`.`column_1` > ?) ORDER BY `table_1`.`column_1` DESC LIMIT 10
? = 10
----
1156908344
578156234

query  nosort
SELECT DISTINCT `table_1`.`column_1` AS `alias_1`, `table_1`.`column_1` AS `alias_2` FROM `table_1` WHERE (`table_1`.`column_1` > ?) ORDER BY `table_1`.`column_1` DESC LIMIT 10
? = 10
----
1156908344
1156908344
578156234
578156234
