# Generated by:
#     target/debug/noria-logictest permute --compare-to mysql://root:noria@127.1/noria -d 3 -o logictests/generated/mysql/ --only range_param --random --include-deletes --rows-per-table 10 --subquery-depth 1

statement ok
CREATE TABLE `table_1` (`column_5` INT, `column_1` INT, `column_6` INT, `column_2` INT, `column_3` INT, `column_4` INT, PRIMARY KEY (`column_6`))


statement ok
INSERT INTO `table_1` (`column_5`, `column_1`, `column_6`, `column_2`, `column_3`, `column_4`) VALUES (778952715, -283342676, 0, 2035658196, 1758445607, -109431345), (1339873854, 1970325863, 1, -481637881, -813091127, 178744898), (-620721253, -1410874260, 2, -1455747013, -1982503644, -1552238785), (998905403, -823869843, 3, -172759454, 235228583, -1168446320), (-176690698, 296059040, 4, 1895978522, -83926012, 1588239890), (547577569, -2117891255, 5, 795347643, 11609864, -886672776), (-2110824580, 1304243207, 6, -1712949203, 706748634, 1401981945), (-366580665, 1839379369, 7, -821264946, -1274233510, 1374473302), (930147730, 966528524, 8, -1937281834, -12927325, 1390294093), (-2094930265, -951631224, 9, 1909385690, 1900863106, 1318141639)


query  rowsort
SELECT DISTINCT `table_1`.`column_1` AS `alias_1` FROM `table_1`
----
-1410874260
-2117891255
-283342676
-823869843
-951631224
1304243207
1839379369
1970325863
296059040
966528524

query  rowsort
SELECT count(`table_1`.`column_2`) AS `alias_1` FROM `table_1`
----
10

query  rowsort
SELECT `table_1`.`column_2` AS `alias_1` FROM `table_1` WHERE (`table_1`.`column_2` > ?)
? = 10
----
1895978522
1909385690
2035658196
795347643

query  rowsort
SELECT DISTINCT count(`table_1`.`column_3`) AS `alias_1` FROM `table_1`
----
10

query  rowsort
SELECT DISTINCT `table_1`.`column_2` AS `alias_1` FROM `table_1` WHERE (`table_1`.`column_2` > ?)
? = 10
----
1895978522
1909385690
2035658196
795347643

query  rowsort
SELECT count(`table_1`.`column_4`) AS `alias_1` FROM `table_1` WHERE (`table_1`.`column_1` > ?)
? = 10
----
5

query  rowsort
SELECT DISTINCT count(`table_1`.`column_5`) AS `alias_1` FROM `table_1` WHERE (`table_1`.`column_5` > ?)
? = 10
----
5

statement ok
DELETE FROM `table_1` WHERE (`column_6` = 0)


statement ok
DELETE FROM `table_1` WHERE (`column_6` = 1)


statement ok
DELETE FROM `table_1` WHERE (`column_6` = 2)


statement ok
DELETE FROM `table_1` WHERE (`column_6` = 3)


statement ok
DELETE FROM `table_1` WHERE (`column_6` = 4)


query  rowsort
SELECT DISTINCT `table_1`.`column_1` AS `alias_1` FROM `table_1`
----
-2117891255
-951631224
1304243207
1839379369
966528524

query  rowsort
SELECT count(`table_1`.`column_2`) AS `alias_1` FROM `table_1`
----
5

query  rowsort
SELECT `table_1`.`column_2` AS `alias_1` FROM `table_1` WHERE (`table_1`.`column_2` > ?)
? = 10
----
1909385690
795347643

query  rowsort
SELECT DISTINCT count(`table_1`.`column_3`) AS `alias_1` FROM `table_1`
----
5

query  rowsort
SELECT DISTINCT `table_1`.`column_2` AS `alias_1` FROM `table_1` WHERE (`table_1`.`column_2` > ?)
? = 10
----
1909385690
795347643

query  rowsort
SELECT count(`table_1`.`column_4`) AS `alias_1` FROM `table_1` WHERE (`table_1`.`column_1` > ?)
? = 10
----
3

query  rowsort
SELECT DISTINCT count(`table_1`.`column_5`) AS `alias_1` FROM `table_1` WHERE (`table_1`.`column_5` > ?)
? = 10
----
2
