# Generated by:
#     target/debug/noria-logictest permute --compare-to mysql://root:noria@127.1/noria -d 3 -o logictests/generated/mysql/ --only range_param --random --include-deletes --rows-per-table 10 --subquery-depth 1

statement ok
CREATE TABLE `table_1` (`column_3` INT, `column_6` INT, `column_1` INT, `column_2` INT, `column_4` INT, `column_5` INT, PRIMARY KEY (`column_6`))


statement ok
CREATE TABLE `table_3` (`column_1` INT, `column_2` INT, `column_3` INT, PRIMARY KEY (`column_3`))


statement ok
CREATE TABLE `table_5` (`column_2` INT, `column_1` INT, `column_3` INT, PRIMARY KEY (`column_3`))


statement ok
CREATE TABLE `table_2` (`column_1` INT, `column_3` INT, `column_2` INT, PRIMARY KEY (`column_3`))


statement ok
CREATE TABLE `table_4` (`column_1` INT, `column_3` INT, `column_2` INT, PRIMARY KEY (`column_3`))


statement ok
INSERT INTO `table_1` (`column_3`, `column_6`, `column_1`, `column_2`, `column_4`, `column_5`) VALUES (-1525636499, 0, 1789401978, -1850486143, -1030425588, 1614616768), (1374905777, 1, 1953337666, 484767573, 277961203, 6593681), (235711665, 2, -65041526, 1512156424, 1278639340, 53163116), (1428415981, 3, -2074651651, -1055949036, -676729186, -630552806), (1054928742, 4, 838997697, 23267563, -509532135, -475847067), (-1464127283, 5, 661898031, 1245387971, 1722050390, 701052027), (-1253018420, 6, -457958988, 98913376, 1455969198, -389476426), (609859077, 7, 479605099, -1486023040, 2099710039, 120898301), (430199157, 8, -1518470648, -1232363420, -1796082365, 1008972246), (2082695955, 9, -1650508060, -279264554, 1889327611, 1347205352)


statement ok
INSERT INTO `table_3` (`column_1`, `column_2`, `column_3`) VALUES (-570025438, -2047989792, 0), (1597097174, 1018735009, 1), (-108064144, 16498813, 2), (1615040485, -1169271382, 3), (-2140343120, 1132510075, 4), (-429860752, 201359098, 5), (-109913295, -890470895, 6), (-1384806894, -81034858, 7), (1395490332, -1384393136, 8), (954388647, 2059820785, 9)


statement ok
INSERT INTO `table_5` (`column_2`, `column_1`, `column_3`) VALUES (908000770, -91725020, 0), (260128542, 1008595067, 1), (-941103328, -1685929997, 2), (1462245859, -365408713, 3), (768359488, -849122406, 4), (-1659789907, -1531918011, 5), (-1513162118, 6467410, 6), (182770557, -100797950, 7), (-1001797534, 493622525, 8), (-1134513461, -1195521147, 9)


statement ok
INSERT INTO `table_2` (`column_1`, `column_3`, `column_2`) VALUES (-539971764, 0, -1125896354), (-1790840325, 1, -1441685271), (-911684681, 2, -852182818), (-813029611, 3, -1268263184), (1185524977, 4, -1712854911), (768103696, 5, -1446024975), (455967529, 6, 1704770893), (-286846849, 7, -1133373775), (-980613027, 8, 1069979677), (293200907, 9, -271019883)


statement ok
INSERT INTO `table_4` (`column_1`, `column_3`, `column_2`) VALUES (-565703414, 0, -1952381242), (-759299814, 1, 21312427), (-1146375146, 2, -618957695), (317000112, 3, 139424209), (359939704, 4, 1115452259), (-634954004, 5, -2128741237), (380839082, 6, 987156220), (-550368574, 7, -2036730589), (-1581906868, 8, -500910153), (943533402, 9, -1345666398)


query  rowsort
SELECT DISTINCT `table_1`.`column_1` AS `alias_1` FROM `table_1`
----
-1518470648
-1650508060
-2074651651
-457958988
-65041526
1789401978
1953337666
479605099
661898031
838997697

query  rowsort
SELECT `table_1`.`column_2` AS `alias_1`, `table_2`.`column_2` AS `alias_2` FROM `table_1` LEFT JOIN `table_2` ON (`table_1`.`column_1` = `table_2`.`column_1`)
----
-1055949036
NULL
-1232363420
NULL
-1486023040
NULL
-1850486143
NULL
-279264554
NULL
1245387971
NULL
1512156424
NULL
23267563
NULL
484767573
NULL
98913376
NULL

query  rowsort
SELECT `table_1`.`column_1` AS `alias_1` FROM `table_1` WHERE (`table_1`.`column_1` > ?)
? = 10
----
1789401978
1953337666
479605099
661898031
838997697

query  rowsort
SELECT DISTINCT `table_1`.`column_3` AS `alias_1`, `table_3`.`column_2` AS `alias_2` FROM `table_1` LEFT JOIN `table_3` ON (`table_1`.`column_1` = `table_3`.`column_1`)
----
-1253018420
NULL
-1464127283
NULL
-1525636499
NULL
1054928742
NULL
1374905777
NULL
1428415981
NULL
2082695955
NULL
235711665
NULL
430199157
NULL
609859077
NULL

query  rowsort
SELECT DISTINCT `table_1`.`column_1` AS `alias_1` FROM `table_1` WHERE (`table_1`.`column_1` > ?)
? = 10
----
1789401978
1953337666
479605099
661898031
838997697

query  rowsort
SELECT `table_1`.`column_4` AS `alias_1`, `table_4`.`column_2` AS `alias_2` FROM `table_1` LEFT JOIN `table_4` ON (`table_1`.`column_1` = `table_4`.`column_1`) WHERE (`table_1`.`column_3` > ?)
? = 10
----
-1796082365
NULL
-509532135
NULL
-676729186
NULL
1278639340
NULL
1889327611
NULL
2099710039
NULL
277961203
NULL

query  rowsort
SELECT DISTINCT `table_1`.`column_5` AS `alias_1`, `table_5`.`column_2` AS `alias_2` FROM `table_1` LEFT JOIN `table_5` ON (`table_1`.`column_3` = `table_5`.`column_1`) WHERE (`table_1`.`column_3` > ?)
? = 10
----
-475847067
NULL
-630552806
NULL
1008972246
NULL
120898301
NULL
1347205352
NULL
53163116
NULL
6593681
NULL

statement ok
DELETE FROM `table_1` WHERE (`column_6` = 0)


statement ok
DELETE FROM `table_1` WHERE (`column_6` = 1)


statement ok
DELETE FROM `table_1` WHERE (`column_6` = 2)


statement ok
DELETE FROM `table_1` WHERE (`column_6` = 3)


statement ok
DELETE FROM `table_1` WHERE (`column_6` = 4)


statement ok
DELETE FROM `table_3` WHERE (`column_3` = 0)


statement ok
DELETE FROM `table_3` WHERE (`column_3` = 1)


statement ok
DELETE FROM `table_3` WHERE (`column_3` = 2)


statement ok
DELETE FROM `table_3` WHERE (`column_3` = 3)


statement ok
DELETE FROM `table_3` WHERE (`column_3` = 4)


statement ok
DELETE FROM `table_5` WHERE (`column_3` = 0)


statement ok
DELETE FROM `table_5` WHERE (`column_3` = 1)


statement ok
DELETE FROM `table_5` WHERE (`column_3` = 2)


statement ok
DELETE FROM `table_5` WHERE (`column_3` = 3)


statement ok
DELETE FROM `table_5` WHERE (`column_3` = 4)


statement ok
DELETE FROM `table_2` WHERE (`column_3` = 0)


statement ok
DELETE FROM `table_2` WHERE (`column_3` = 1)


statement ok
DELETE FROM `table_2` WHERE (`column_3` = 2)


statement ok
DELETE FROM `table_2` WHERE (`column_3` = 3)


statement ok
DELETE FROM `table_2` WHERE (`column_3` = 4)


statement ok
DELETE FROM `table_4` WHERE (`column_3` = 0)


statement ok
DELETE FROM `table_4` WHERE (`column_3` = 1)


statement ok
DELETE FROM `table_4` WHERE (`column_3` = 2)


statement ok
DELETE FROM `table_4` WHERE (`column_3` = 3)


statement ok
DELETE FROM `table_4` WHERE (`column_3` = 4)


query  rowsort
SELECT DISTINCT `table_1`.`column_1` AS `alias_1` FROM `table_1`
----
-1518470648
-1650508060
-457958988
479605099
661898031

query  rowsort
SELECT `table_1`.`column_2` AS `alias_1`, `table_2`.`column_2` AS `alias_2` FROM `table_1` LEFT JOIN `table_2` ON (`table_1`.`column_1` = `table_2`.`column_1`)
----
-1232363420
NULL
-1486023040
NULL
-279264554
NULL
1245387971
NULL
98913376
NULL

query  rowsort
SELECT `table_1`.`column_1` AS `alias_1` FROM `table_1` WHERE (`table_1`.`column_1` > ?)
? = 10
----
479605099
661898031

query  rowsort
SELECT DISTINCT `table_1`.`column_3` AS `alias_1`, `table_3`.`column_2` AS `alias_2` FROM `table_1` LEFT JOIN `table_3` ON (`table_1`.`column_1` = `table_3`.`column_1`)
----
-1253018420
NULL
-1464127283
NULL
2082695955
NULL
430199157
NULL
609859077
NULL

query  rowsort
SELECT DISTINCT `table_1`.`column_1` AS `alias_1` FROM `table_1` WHERE (`table_1`.`column_1` > ?)
? = 10
----
479605099
661898031

query  rowsort
SELECT `table_1`.`column_4` AS `alias_1`, `table_4`.`column_2` AS `alias_2` FROM `table_1` LEFT JOIN `table_4` ON (`table_1`.`column_1` = `table_4`.`column_1`) WHERE (`table_1`.`column_3` > ?)
? = 10
----
-1796082365
NULL
1889327611
NULL
2099710039
NULL

query  rowsort
SELECT DISTINCT `table_1`.`column_5` AS `alias_1`, `table_5`.`column_2` AS `alias_2` FROM `table_1` LEFT JOIN `table_5` ON (`table_1`.`column_3` = `table_5`.`column_1`) WHERE (`table_1`.`column_3` > ?)
? = 10
----
1008972246
NULL
120898301
NULL
1347205352
NULL
