# Generated by:
#     target/debug/noria-logictest permute -d 3 -o logictests/generated/mysql --only in_parameter --compare-to mysql://root:noria@localhost/mysql --subquery-depth 1 --rows-per-table 5 --include-deletes --overwrite-tests

statement ok
CREATE TABLE table_1 (column_1 INT, column_2 INT, PRIMARY KEY (column_2))


statement ok
INSERT INTO table_1 (column_1, column_2) VALUES (1, 0), (1, 1), (2, 2), (1, 3), (0, 4)


query  rowsort
SELECT DISTINCT table_1.column_1 AS alias_1 FROM table_1
----
0
1
2

query  nosort
SELECT table_1.column_1 AS alias_1 FROM table_1 ORDER BY table_1.column_1 ASC LIMIT 10
----
0
1
1
1
2

query  nosort
SELECT table_1.column_1 AS alias_1 FROM table_1 ORDER BY table_1.column_1 DESC LIMIT 10
----
2
1
1
1
0

query  rowsort
SELECT table_1.column_1 AS alias_1 FROM table_1 WHERE table_1.column_1 IN (?, ?, ?)
? = 0
? = 1
? = 2
----
0
1
1
1
2

query  nosort
SELECT DISTINCT table_1.column_1 AS alias_1 FROM table_1 ORDER BY table_1.column_1 ASC LIMIT 10
----
0
1
2

query  nosort
SELECT DISTINCT table_1.column_1 AS alias_1 FROM table_1 ORDER BY table_1.column_1 DESC LIMIT 10
----
2
1
0

query  rowsort
SELECT DISTINCT table_1.column_1 AS alias_1 FROM table_1 WHERE table_1.column_1 IN (?, ?, ?)
? = 0
? = 1
? = 2
----
0
1
2

query  nosort
SELECT table_1.column_1 AS alias_1 FROM table_1 ORDER BY table_1.column_1 DESC LIMIT 10
----
2
1
1
1
0

query  nosort
SELECT table_1.column_1 AS alias_1 FROM table_1 WHERE table_1.column_1 IN (?, ?, ?) ORDER BY table_1.column_1 ASC LIMIT 10
? = 0
? = 1
? = 2
----
0
1
1
1
2

query  nosort
SELECT table_1.column_1 AS alias_1 FROM table_1 WHERE table_1.column_1 IN (?, ?, ?) ORDER BY table_1.column_1 DESC LIMIT 10
? = 0
? = 1
? = 2
----
2
1
1
1
0

query  nosort
SELECT DISTINCT table_1.column_1 AS alias_1, table_1.column_1 AS alias_2 FROM table_1 ORDER BY table_1.column_1 DESC LIMIT 10
----
2
2
1
1
0
0

query  nosort
SELECT DISTINCT table_1.column_1 AS alias_1 FROM table_1 WHERE table_1.column_1 IN (?, ?, ?) ORDER BY table_1.column_1 ASC LIMIT 10
? = 0
? = 1
? = 2
----
0
1
2

query  nosort
SELECT DISTINCT table_1.column_1 AS alias_1 FROM table_1 WHERE table_1.column_1 IN (?, ?, ?) ORDER BY table_1.column_1 DESC LIMIT 10
? = 0
? = 1
? = 2
----
2
1
0

query  nosort
SELECT table_1.column_1 AS alias_1 FROM table_1 WHERE table_1.column_1 IN (?, ?, ?) ORDER BY table_1.column_1 DESC LIMIT 10
? = 0
? = 1
? = 2
----
2
1
1
1
0

query  nosort
SELECT DISTINCT table_1.column_1 AS alias_1, table_1.column_1 AS alias_2 FROM table_1 WHERE table_1.column_1 IN (?, ?, ?) ORDER BY table_1.column_1 DESC LIMIT 10
? = 0
? = 1
? = 2
----
2
2
1
1
0
0

statement ok
DELETE FROM table_1 WHERE (column_2 = 0)


statement ok
DELETE FROM table_1 WHERE (column_2 = 1)


query  rowsort
SELECT DISTINCT table_1.column_1 AS alias_1 FROM table_1
----
0
1
2

query  nosort
SELECT table_1.column_1 AS alias_1 FROM table_1 ORDER BY table_1.column_1 ASC LIMIT 10
----
0
1
2

query  nosort
SELECT table_1.column_1 AS alias_1 FROM table_1 ORDER BY table_1.column_1 DESC LIMIT 10
----
2
1
0

query  rowsort
SELECT table_1.column_1 AS alias_1 FROM table_1 WHERE table_1.column_1 IN (?, ?, ?)
? = 0
? = 1
? = 2
----
0
1
2

query  nosort
SELECT DISTINCT table_1.column_1 AS alias_1 FROM table_1 ORDER BY table_1.column_1 ASC LIMIT 10
----
0
1
2

query  nosort
SELECT DISTINCT table_1.column_1 AS alias_1 FROM table_1 ORDER BY table_1.column_1 DESC LIMIT 10
----
2
1
0

query  rowsort
SELECT DISTINCT table_1.column_1 AS alias_1 FROM table_1 WHERE table_1.column_1 IN (?, ?, ?)
? = 0
? = 1
? = 2
----
0
1
2

query  nosort
SELECT table_1.column_1 AS alias_1 FROM table_1 ORDER BY table_1.column_1 DESC LIMIT 10
----
2
1
0

query  nosort
SELECT table_1.column_1 AS alias_1 FROM table_1 WHERE table_1.column_1 IN (?, ?, ?) ORDER BY table_1.column_1 ASC LIMIT 10
? = 0
? = 1
? = 2
----
0
1
2

query  nosort
SELECT table_1.column_1 AS alias_1 FROM table_1 WHERE table_1.column_1 IN (?, ?, ?) ORDER BY table_1.column_1 DESC LIMIT 10
? = 0
? = 1
? = 2
----
2
1
0

query  nosort
SELECT DISTINCT table_1.column_1 AS alias_1, table_1.column_1 AS alias_2 FROM table_1 ORDER BY table_1.column_1 DESC LIMIT 10
----
2
2
1
1
0
0

query  nosort
SELECT DISTINCT table_1.column_1 AS alias_1 FROM table_1 WHERE table_1.column_1 IN (?, ?, ?) ORDER BY table_1.column_1 ASC LIMIT 10
? = 0
? = 1
? = 2
----
0
1
2

query  nosort
SELECT DISTINCT table_1.column_1 AS alias_1 FROM table_1 WHERE table_1.column_1 IN (?, ?, ?) ORDER BY table_1.column_1 DESC LIMIT 10
? = 0
? = 1
? = 2
----
2
1
0

query  nosort
SELECT table_1.column_1 AS alias_1 FROM table_1 WHERE table_1.column_1 IN (?, ?, ?) ORDER BY table_1.column_1 DESC LIMIT 10
? = 0
? = 1
? = 2
----
2
1
0

query  nosort
SELECT DISTINCT table_1.column_1 AS alias_1, table_1.column_1 AS alias_2 FROM table_1 WHERE table_1.column_1 IN (?, ?, ?) ORDER BY table_1.column_1 DESC LIMIT 10
? = 0
? = 1
? = 2
----
2
2
1
1
0
0
