# Generated by:
#     target/debug/noria-logictest permute --compare-to mysql://root:noria@127.1/noria -d 3 -o logictests/generated/mysql/ --only range_param --random --include-deletes --rows-per-table 10 --subquery-depth 1

statement ok
CREATE TABLE `table_1` (`column_2` INT, `column_1` INT, PRIMARY KEY (`column_2`))


statement ok
INSERT INTO `table_1` (`column_2`, `column_1`) VALUES (0, -287034357), (1, -1315844094), (2, 121056817), (3, -538800793), (4, -251777010), (5, 1468360461), (6, 1884879564), (7, -1395493964), (8, -421531781), (9, -1470857150)


query  rowsort
SELECT DISTINCT `table_1`.`column_1` AS `alias_1` FROM `table_1`
----
-1315844094
-1395493964
-1470857150
-251777010
-287034357
-421531781
-538800793
121056817
1468360461
1884879564

query  rowsort
SELECT `table_1`.`column_1` AS `alias_1` FROM `table_1` WHERE (`table_1`.`column_1` > ?)
? = 10
----
121056817
1468360461
1884879564

query  rowsort
SELECT `table_1`.`column_1` AS `alias_1` FROM `table_1` WHERE (`table_1`.`column_1` > ?)
? = 10
----
121056817
1468360461
1884879564

query  rowsort
SELECT DISTINCT `table_1`.`column_1` AS `alias_1` FROM `table_1` WHERE (`table_1`.`column_1` > ?)
? = 10
----
121056817
1468360461
1884879564

query  rowsort
SELECT DISTINCT `table_1`.`column_1` AS `alias_1` FROM `table_1` WHERE (`table_1`.`column_1` > ?)
? = 10
----
121056817
1468360461
1884879564

query  rowsort
SELECT `table_1`.`column_1` AS `alias_1` FROM `table_1` WHERE ((`table_1`.`column_1` > ?) AND (`table_1`.`column_1` > ?))
? = 10
? = 10
----
121056817
1468360461
1884879564

query  rowsort
SELECT DISTINCT `table_1`.`column_1` AS `alias_1` FROM `table_1` WHERE ((`table_1`.`column_1` > ?) AND (`table_1`.`column_1` > ?))
? = 10
? = 10
----
121056817
1468360461
1884879564

statement ok
DELETE FROM `table_1` WHERE (`column_2` = 0)


statement ok
DELETE FROM `table_1` WHERE (`column_2` = 1)


statement ok
DELETE FROM `table_1` WHERE (`column_2` = 2)


statement ok
DELETE FROM `table_1` WHERE (`column_2` = 3)


statement ok
DELETE FROM `table_1` WHERE (`column_2` = 4)


query  rowsort
SELECT DISTINCT `table_1`.`column_1` AS `alias_1` FROM `table_1`
----
-1395493964
-1470857150
-421531781
1468360461
1884879564

query  rowsort
SELECT `table_1`.`column_1` AS `alias_1` FROM `table_1` WHERE (`table_1`.`column_1` > ?)
? = 10
----
1468360461
1884879564

query  rowsort
SELECT `table_1`.`column_1` AS `alias_1` FROM `table_1` WHERE (`table_1`.`column_1` > ?)
? = 10
----
1468360461
1884879564

query  rowsort
SELECT DISTINCT `table_1`.`column_1` AS `alias_1` FROM `table_1` WHERE (`table_1`.`column_1` > ?)
? = 10
----
1468360461
1884879564

query  rowsort
SELECT DISTINCT `table_1`.`column_1` AS `alias_1` FROM `table_1` WHERE (`table_1`.`column_1` > ?)
? = 10
----
1468360461
1884879564

query  rowsort
SELECT `table_1`.`column_1` AS `alias_1` FROM `table_1` WHERE ((`table_1`.`column_1` > ?) AND (`table_1`.`column_1` > ?))
? = 10
? = 10
----
1468360461
1884879564

query  rowsort
SELECT DISTINCT `table_1`.`column_1` AS `alias_1` FROM `table_1` WHERE ((`table_1`.`column_1` > ?) AND (`table_1`.`column_1` > ?))
? = 10
? = 10
----
1468360461
1884879564
