# Generated by:
#     target/debug/noria-logictest permute --compare-to mysql://root:noria@127.1/noria -d 3 -o logictests/generated/mysql/ --only range_param --random --include-deletes --rows-per-table 10 --subquery-depth 1 --overwrite-tests

statement ok
CREATE TABLE `table_1` (`column_1` INT, `column_2` INT, `column_3` INT, PRIMARY KEY (`column_3`))


statement ok
INSERT INTO `table_1` (`column_1`, `column_2`, `column_3`) VALUES (1, 2044065318, 0), (1335275983, 1184167994, 1), (1, -1107179923, 2), (1442279796, -622597489, 3), (1, -221369148, 4), (688329821, -1088177996, 5), (1, 706235346, 6), (1001255369, 2144412066, 7), (1, -858467761, 8), (519656345, -1645647926, 9)


query  rowsort
SELECT `table_1`.`column_1` AS `alias_1` FROM `table_1` WHERE (`table_1`.`column_1` >= `table_1`.`column_2`)
----
1
1
1
1335275983
1442279796
519656345
688329821

query  rowsort
SELECT `table_1`.`column_1` AS `alias_1` FROM `table_1` WHERE (`table_1`.`column_1` >= `table_1`.`column_2`)
----
1
1
1
1335275983
1442279796
519656345
688329821

query  rowsort
SELECT `table_1`.`column_1` AS `alias_1` FROM `table_1` WHERE (`table_1`.`column_1` >= 1)
----
1
1
1
1
1
1001255369
1335275983
1442279796
519656345
688329821

query  rowsort
SELECT `table_1`.`column_1` AS `alias_1` FROM `table_1` WHERE (`table_1`.`column_1` >= 1)
----
1
1
1
1
1
1001255369
1335275983
1442279796
519656345
688329821

query  rowsort
SELECT `table_1`.`column_1` AS `alias_1` FROM `table_1` WHERE (`table_1`.`column_1` > ?)
? = 10
----
1001255369
1335275983
1442279796
519656345
688329821

query  rowsort
SELECT `table_1`.`column_1` AS `alias_1`, `table_1`.`column_1` AS `alias_2` FROM `table_1` WHERE ((`table_1`.`column_1` >= `table_1`.`column_2`) OR (`table_1`.`column_1` >= `table_1`.`column_2`))
----
1
1
1
1
1
1
1335275983
1335275983
1442279796
1442279796
519656345
519656345
688329821
688329821

query  rowsort
SELECT `table_1`.`column_1` AS `alias_1`, `table_1`.`column_1` AS `alias_2` FROM `table_1` WHERE ((`table_1`.`column_1` >= `table_1`.`column_2`) AND (`table_1`.`column_1` >= 1))
----
1
1
1
1
1
1
1335275983
1335275983
1442279796
1442279796
519656345
519656345
688329821
688329821

query  rowsort
SELECT `table_1`.`column_1` AS `alias_1`, `table_1`.`column_1` AS `alias_2` FROM `table_1` WHERE ((`table_1`.`column_1` >= `table_1`.`column_2`) OR (`table_1`.`column_1` >= 1))
----
1
1
1
1
1
1
1
1
1
1
1001255369
1001255369
1335275983
1335275983
1442279796
1442279796
519656345
519656345
688329821
688329821

query  rowsort
SELECT `table_1`.`column_1` AS `alias_1` FROM `table_1` WHERE ((`table_1`.`column_1` >= `table_1`.`column_2`) AND (`table_1`.`column_1` > ?))
? = 10
----
1335275983
1442279796
519656345
688329821

query  rowsort
SELECT `table_1`.`column_1` AS `alias_1`, `table_1`.`column_1` AS `alias_2` FROM `table_1` WHERE ((`table_1`.`column_1` >= `table_1`.`column_2`) AND (`table_1`.`column_1` >= 1))
----
1
1
1
1
1
1
1335275983
1335275983
1442279796
1442279796
519656345
519656345
688329821
688329821

query  rowsort
SELECT `table_1`.`column_1` AS `alias_1`, `table_1`.`column_1` AS `alias_2` FROM `table_1` WHERE ((`table_1`.`column_1` >= `table_1`.`column_2`) OR (`table_1`.`column_1` >= 1))
----
1
1
1
1
1
1
1
1
1
1
1001255369
1001255369
1335275983
1335275983
1442279796
1442279796
519656345
519656345
688329821
688329821

query  rowsort
SELECT `table_1`.`column_1` AS `alias_1` FROM `table_1` WHERE ((`table_1`.`column_1` >= `table_1`.`column_2`) AND (`table_1`.`column_1` > ?))
? = 10
----
1335275983
1442279796
519656345
688329821

query  rowsort
SELECT `table_1`.`column_1` AS `alias_1`, `table_1`.`column_1` AS `alias_2` FROM `table_1` WHERE ((`table_1`.`column_1` >= 1) OR (`table_1`.`column_1` >= 1))
----
1
1
1
1
1
1
1
1
1
1
1001255369
1001255369
1335275983
1335275983
1442279796
1442279796
519656345
519656345
688329821
688329821

query  rowsort
SELECT `table_1`.`column_1` AS `alias_1` FROM `table_1` WHERE ((`table_1`.`column_1` >= 1) AND (`table_1`.`column_1` > ?))
? = 10
----
1001255369
1335275983
1442279796
519656345
688329821

query  rowsort
SELECT `table_1`.`column_1` AS `alias_1` FROM `table_1` WHERE ((`table_1`.`column_1` >= 1) AND (`table_1`.`column_1` > ?))
? = 10
----
1001255369
1335275983
1442279796
519656345
688329821

query  rowsort
SELECT `table_1`.`column_1` AS `alias_1`, `table_1`.`column_1` AS `alias_2`, `table_1`.`column_1` AS `alias_3` FROM `table_1` WHERE (((`table_1`.`column_1` >= `table_1`.`column_2`) OR (`table_1`.`column_1` >= `table_1`.`column_2`)) AND (`table_1`.`column_1` >= 1))
----
21 values hashing to 15318a9ed6ea4946277e1bfb5a1b4782

query  rowsort
SELECT `table_1`.`column_1` AS `alias_1`, `table_1`.`column_1` AS `alias_2`, `table_1`.`column_1` AS `alias_3` FROM `table_1` WHERE (((`table_1`.`column_1` >= `table_1`.`column_2`) OR (`table_1`.`column_1` >= `table_1`.`column_2`)) OR (`table_1`.`column_1` >= 1))
----
30 values hashing to 83be9036d3fa5721cb5be6016fbc04aa

query  rowsort
SELECT `table_1`.`column_1` AS `alias_1`, `table_1`.`column_1` AS `alias_2` FROM `table_1` WHERE (((`table_1`.`column_1` >= `table_1`.`column_2`) OR (`table_1`.`column_1` >= `table_1`.`column_2`)) AND (`table_1`.`column_1` > ?))
? = 10
----
1335275983
1335275983
1442279796
1442279796
519656345
519656345
688329821
688329821

query  rowsort
SELECT `table_1`.`column_1` AS `alias_1`, `table_1`.`column_1` AS `alias_2`, `table_1`.`column_1` AS `alias_3` FROM `table_1` WHERE (((`table_1`.`column_1` >= `table_1`.`column_2`) AND (`table_1`.`column_1` >= 1)) OR (`table_1`.`column_1` >= 1))
----
30 values hashing to 83be9036d3fa5721cb5be6016fbc04aa

query  rowsort
SELECT `table_1`.`column_1` AS `alias_1`, `table_1`.`column_1` AS `alias_2` FROM `table_1` WHERE (((`table_1`.`column_1` >= `table_1`.`column_2`) AND (`table_1`.`column_1` >= 1)) AND (`table_1`.`column_1` > ?))
? = 10
----
1335275983
1335275983
1442279796
1442279796
519656345
519656345
688329821
688329821

query  rowsort
SELECT `table_1`.`column_1` AS `alias_1`, `table_1`.`column_1` AS `alias_2` FROM `table_1` WHERE (((`table_1`.`column_1` >= `table_1`.`column_2`) OR (`table_1`.`column_1` >= 1)) AND (`table_1`.`column_1` > ?))
? = 10
----
1001255369
1001255369
1335275983
1335275983
1442279796
1442279796
519656345
519656345
688329821
688329821

query  rowsort
SELECT `table_1`.`column_1` AS `alias_1`, `table_1`.`column_1` AS `alias_2`, `table_1`.`column_1` AS `alias_3` FROM `table_1` WHERE (((`table_1`.`column_1` >= `table_1`.`column_2`) AND (`table_1`.`column_1` >= 1)) OR (`table_1`.`column_1` >= 1))
----
30 values hashing to 83be9036d3fa5721cb5be6016fbc04aa

query  rowsort
SELECT `table_1`.`column_1` AS `alias_1`, `table_1`.`column_1` AS `alias_2` FROM `table_1` WHERE (((`table_1`.`column_1` >= `table_1`.`column_2`) AND (`table_1`.`column_1` >= 1)) AND (`table_1`.`column_1` > ?))
? = 10
----
1335275983
1335275983
1442279796
1442279796
519656345
519656345
688329821
688329821

query  rowsort
SELECT `table_1`.`column_1` AS `alias_1`, `table_1`.`column_1` AS `alias_2` FROM `table_1` WHERE (((`table_1`.`column_1` >= `table_1`.`column_2`) OR (`table_1`.`column_1` >= 1)) AND (`table_1`.`column_1` > ?))
? = 10
----
1001255369
1001255369
1335275983
1335275983
1442279796
1442279796
519656345
519656345
688329821
688329821

query  rowsort
SELECT `table_1`.`column_1` AS `alias_1`, `table_1`.`column_1` AS `alias_2` FROM `table_1` WHERE (((`table_1`.`column_1` >= 1) OR (`table_1`.`column_1` >= 1)) AND (`table_1`.`column_1` > ?))
? = 10
----
1001255369
1001255369
1335275983
1335275983
1442279796
1442279796
519656345
519656345
688329821
688329821

query  rowsort
SELECT `table_1`.`column_1` AS `alias_1`, `table_1`.`column_1` AS `alias_2`, `table_1`.`column_1` AS `alias_3`, `table_1`.`column_1` AS `alias_4` FROM `table_1` WHERE ((((`table_1`.`column_1` >= `table_1`.`column_2`) OR (`table_1`.`column_1` >= `table_1`.`column_2`)) AND (`table_1`.`column_1` >= 1)) OR (`table_1`.`column_1` >= 1))
----
40 values hashing to 4fc53c20a45b1044406da6dc17efb98a

query  rowsort
SELECT `table_1`.`column_1` AS `alias_1`, `table_1`.`column_1` AS `alias_2`, `table_1`.`column_1` AS `alias_3` FROM `table_1` WHERE ((((`table_1`.`column_1` >= `table_1`.`column_2`) OR (`table_1`.`column_1` >= `table_1`.`column_2`)) AND (`table_1`.`column_1` >= 1)) AND (`table_1`.`column_1` > ?))
? = 10
----
1335275983
1335275983
1335275983
1442279796
1442279796
1442279796
519656345
519656345
519656345
688329821
688329821
688329821

query  rowsort
SELECT `table_1`.`column_1` AS `alias_1`, `table_1`.`column_1` AS `alias_2`, `table_1`.`column_1` AS `alias_3` FROM `table_1` WHERE ((((`table_1`.`column_1` >= `table_1`.`column_2`) OR (`table_1`.`column_1` >= `table_1`.`column_2`)) OR (`table_1`.`column_1` >= 1)) AND (`table_1`.`column_1` > ?))
? = 10
----
1001255369
1001255369
1001255369
1335275983
1335275983
1335275983
1442279796
1442279796
1442279796
519656345
519656345
519656345
688329821
688329821
688329821

query  rowsort
SELECT `table_1`.`column_1` AS `alias_1`, `table_1`.`column_1` AS `alias_2`, `table_1`.`column_1` AS `alias_3` FROM `table_1` WHERE ((((`table_1`.`column_1` >= `table_1`.`column_2`) AND (`table_1`.`column_1` >= 1)) OR (`table_1`.`column_1` >= 1)) AND (`table_1`.`column_1` > ?))
? = 10
----
1001255369
1001255369
1001255369
1335275983
1335275983
1335275983
1442279796
1442279796
1442279796
519656345
519656345
519656345
688329821
688329821
688329821

query  rowsort
SELECT `table_1`.`column_1` AS `alias_1`, `table_1`.`column_1` AS `alias_2`, `table_1`.`column_1` AS `alias_3` FROM `table_1` WHERE ((((`table_1`.`column_1` >= `table_1`.`column_2`) AND (`table_1`.`column_1` >= 1)) OR (`table_1`.`column_1` >= 1)) AND (`table_1`.`column_1` > ?))
? = 10
----
1001255369
1001255369
1001255369
1335275983
1335275983
1335275983
1442279796
1442279796
1442279796
519656345
519656345
519656345
688329821
688329821
688329821

query  rowsort
SELECT `table_1`.`column_1` AS `alias_1`, `table_1`.`column_1` AS `alias_2`, `table_1`.`column_1` AS `alias_3`, `table_1`.`column_1` AS `alias_4` FROM `table_1` WHERE (((((`table_1`.`column_1` >= `table_1`.`column_2`) OR (`table_1`.`column_1` >= `table_1`.`column_2`)) AND (`table_1`.`column_1` >= 1)) OR (`table_1`.`column_1` >= 1)) AND (`table_1`.`column_1` > ?))
? = 10
----
1001255369
1001255369
1001255369
1001255369
1335275983
1335275983
1335275983
1335275983
1442279796
1442279796
1442279796
1442279796
519656345
519656345
519656345
519656345
688329821
688329821
688329821
688329821

statement ok
DELETE FROM `table_1` WHERE (`column_3` = 0)


statement ok
DELETE FROM `table_1` WHERE (`column_3` = 1)


statement ok
DELETE FROM `table_1` WHERE (`column_3` = 2)


statement ok
DELETE FROM `table_1` WHERE (`column_3` = 3)


statement ok
DELETE FROM `table_1` WHERE (`column_3` = 4)


query  rowsort
SELECT `table_1`.`column_1` AS `alias_1` FROM `table_1` WHERE (`table_1`.`column_1` >= `table_1`.`column_2`)
----
1
519656345
688329821

query  rowsort
SELECT `table_1`.`column_1` AS `alias_1` FROM `table_1` WHERE (`table_1`.`column_1` >= `table_1`.`column_2`)
----
1
519656345
688329821

query  rowsort
SELECT `table_1`.`column_1` AS `alias_1` FROM `table_1` WHERE (`table_1`.`column_1` >= 1)
----
1
1
1001255369
519656345
688329821

query  rowsort
SELECT `table_1`.`column_1` AS `alias_1` FROM `table_1` WHERE (`table_1`.`column_1` >= 1)
----
1
1
1001255369
519656345
688329821

query  rowsort
SELECT `table_1`.`column_1` AS `alias_1` FROM `table_1` WHERE (`table_1`.`column_1` > ?)
? = 10
----
1001255369
519656345
688329821

query  rowsort
SELECT `table_1`.`column_1` AS `alias_1`, `table_1`.`column_1` AS `alias_2` FROM `table_1` WHERE ((`table_1`.`column_1` >= `table_1`.`column_2`) OR (`table_1`.`column_1` >= `table_1`.`column_2`))
----
1
1
519656345
519656345
688329821
688329821

query  rowsort
SELECT `table_1`.`column_1` AS `alias_1`, `table_1`.`column_1` AS `alias_2` FROM `table_1` WHERE ((`table_1`.`column_1` >= `table_1`.`column_2`) AND (`table_1`.`column_1` >= 1))
----
1
1
519656345
519656345
688329821
688329821

query  rowsort
SELECT `table_1`.`column_1` AS `alias_1`, `table_1`.`column_1` AS `alias_2` FROM `table_1` WHERE ((`table_1`.`column_1` >= `table_1`.`column_2`) OR (`table_1`.`column_1` >= 1))
----
1
1
1
1
1001255369
1001255369
519656345
519656345
688329821
688329821

query  rowsort
SELECT `table_1`.`column_1` AS `alias_1` FROM `table_1` WHERE ((`table_1`.`column_1` >= `table_1`.`column_2`) AND (`table_1`.`column_1` > ?))
? = 10
----
519656345
688329821

query  rowsort
SELECT `table_1`.`column_1` AS `alias_1`, `table_1`.`column_1` AS `alias_2` FROM `table_1` WHERE ((`table_1`.`column_1` >= `table_1`.`column_2`) AND (`table_1`.`column_1` >= 1))
----
1
1
519656345
519656345
688329821
688329821

query  rowsort
SELECT `table_1`.`column_1` AS `alias_1`, `table_1`.`column_1` AS `alias_2` FROM `table_1` WHERE ((`table_1`.`column_1` >= `table_1`.`column_2`) OR (`table_1`.`column_1` >= 1))
----
1
1
1
1
1001255369
1001255369
519656345
519656345
688329821
688329821

query  rowsort
SELECT `table_1`.`column_1` AS `alias_1` FROM `table_1` WHERE ((`table_1`.`column_1` >= `table_1`.`column_2`) AND (`table_1`.`column_1` > ?))
? = 10
----
519656345
688329821

query  rowsort
SELECT `table_1`.`column_1` AS `alias_1`, `table_1`.`column_1` AS `alias_2` FROM `table_1` WHERE ((`table_1`.`column_1` >= 1) OR (`table_1`.`column_1` >= 1))
----
1
1
1
1
1001255369
1001255369
519656345
519656345
688329821
688329821

query  rowsort
SELECT `table_1`.`column_1` AS `alias_1` FROM `table_1` WHERE ((`table_1`.`column_1` >= 1) AND (`table_1`.`column_1` > ?))
? = 10
----
1001255369
519656345
688329821

query  rowsort
SELECT `table_1`.`column_1` AS `alias_1` FROM `table_1` WHERE ((`table_1`.`column_1` >= 1) AND (`table_1`.`column_1` > ?))
? = 10
----
1001255369
519656345
688329821

query  rowsort
SELECT `table_1`.`column_1` AS `alias_1`, `table_1`.`column_1` AS `alias_2`, `table_1`.`column_1` AS `alias_3` FROM `table_1` WHERE (((`table_1`.`column_1` >= `table_1`.`column_2`) OR (`table_1`.`column_1` >= `table_1`.`column_2`)) AND (`table_1`.`column_1` >= 1))
----
1
1
1
519656345
519656345
519656345
688329821
688329821
688329821

query  rowsort
SELECT `table_1`.`column_1` AS `alias_1`, `table_1`.`column_1` AS `alias_2`, `table_1`.`column_1` AS `alias_3` FROM `table_1` WHERE (((`table_1`.`column_1` >= `table_1`.`column_2`) OR (`table_1`.`column_1` >= `table_1`.`column_2`)) OR (`table_1`.`column_1` >= 1))
----
1
1
1
1
1
1
1001255369
1001255369
1001255369
519656345
519656345
519656345
688329821
688329821
688329821

query  rowsort
SELECT `table_1`.`column_1` AS `alias_1`, `table_1`.`column_1` AS `alias_2` FROM `table_1` WHERE (((`table_1`.`column_1` >= `table_1`.`column_2`) OR (`table_1`.`column_1` >= `table_1`.`column_2`)) AND (`table_1`.`column_1` > ?))
? = 10
----
519656345
519656345
688329821
688329821

query  rowsort
SELECT `table_1`.`column_1` AS `alias_1`, `table_1`.`column_1` AS `alias_2`, `table_1`.`column_1` AS `alias_3` FROM `table_1` WHERE (((`table_1`.`column_1` >= `table_1`.`column_2`) AND (`table_1`.`column_1` >= 1)) OR (`table_1`.`column_1` >= 1))
----
1
1
1
1
1
1
1001255369
1001255369
1001255369
519656345
519656345
519656345
688329821
688329821
688329821

query  rowsort
SELECT `table_1`.`column_1` AS `alias_1`, `table_1`.`column_1` AS `alias_2` FROM `table_1` WHERE (((`table_1`.`column_1` >= `table_1`.`column_2`) AND (`table_1`.`column_1` >= 1)) AND (`table_1`.`column_1` > ?))
? = 10
----
519656345
519656345
688329821
688329821

query  rowsort
SELECT `table_1`.`column_1` AS `alias_1`, `table_1`.`column_1` AS `alias_2` FROM `table_1` WHERE (((`table_1`.`column_1` >= `table_1`.`column_2`) OR (`table_1`.`column_1` >= 1)) AND (`table_1`.`column_1` > ?))
? = 10
----
1001255369
1001255369
519656345
519656345
688329821
688329821

query  rowsort
SELECT `table_1`.`column_1` AS `alias_1`, `table_1`.`column_1` AS `alias_2`, `table_1`.`column_1` AS `alias_3` FROM `table_1` WHERE (((`table_1`.`column_1` >= `table_1`.`column_2`) AND (`table_1`.`column_1` >= 1)) OR (`table_1`.`column_1` >= 1))
----
1
1
1
1
1
1
1001255369
1001255369
1001255369
519656345
519656345
519656345
688329821
688329821
688329821

query  rowsort
SELECT `table_1`.`column_1` AS `alias_1`, `table_1`.`column_1` AS `alias_2` FROM `table_1` WHERE (((`table_1`.`column_1` >= `table_1`.`column_2`) AND (`table_1`.`column_1` >= 1)) AND (`table_1`.`column_1` > ?))
? = 10
----
519656345
519656345
688329821
688329821

query  rowsort
SELECT `table_1`.`column_1` AS `alias_1`, `table_1`.`column_1` AS `alias_2` FROM `table_1` WHERE (((`table_1`.`column_1` >= `table_1`.`column_2`) OR (`table_1`.`column_1` >= 1)) AND (`table_1`.`column_1` > ?))
? = 10
----
1001255369
1001255369
519656345
519656345
688329821
688329821

query  rowsort
SELECT `table_1`.`column_1` AS `alias_1`, `table_1`.`column_1` AS `alias_2` FROM `table_1` WHERE (((`table_1`.`column_1` >= 1) OR (`table_1`.`column_1` >= 1)) AND (`table_1`.`column_1` > ?))
? = 10
----
1001255369
1001255369
519656345
519656345
688329821
688329821

query  rowsort
SELECT `table_1`.`column_1` AS `alias_1`, `table_1`.`column_1` AS `alias_2`, `table_1`.`column_1` AS `alias_3`, `table_1`.`column_1` AS `alias_4` FROM `table_1` WHERE ((((`table_1`.`column_1` >= `table_1`.`column_2`) OR (`table_1`.`column_1` >= `table_1`.`column_2`)) AND (`table_1`.`column_1` >= 1)) OR (`table_1`.`column_1` >= 1))
----
1
1
1
1
1
1
1
1
1001255369
1001255369
1001255369
1001255369
519656345
519656345
519656345
519656345
688329821
688329821
688329821
688329821

query  rowsort
SELECT `table_1`.`column_1` AS `alias_1`, `table_1`.`column_1` AS `alias_2`, `table_1`.`column_1` AS `alias_3` FROM `table_1` WHERE ((((`table_1`.`column_1` >= `table_1`.`column_2`) OR (`table_1`.`column_1` >= `table_1`.`column_2`)) AND (`table_1`.`column_1` >= 1)) AND (`table_1`.`column_1` > ?))
? = 10
----
519656345
519656345
519656345
688329821
688329821
688329821

query  rowsort
SELECT `table_1`.`column_1` AS `alias_1`, `table_1`.`column_1` AS `alias_2`, `table_1`.`column_1` AS `alias_3` FROM `table_1` WHERE ((((`table_1`.`column_1` >= `table_1`.`column_2`) OR (`table_1`.`column_1` >= `table_1`.`column_2`)) OR (`table_1`.`column_1` >= 1)) AND (`table_1`.`column_1` > ?))
? = 10
----
1001255369
1001255369
1001255369
519656345
519656345
519656345
688329821
688329821
688329821

query  rowsort
SELECT `table_1`.`column_1` AS `alias_1`, `table_1`.`column_1` AS `alias_2`, `table_1`.`column_1` AS `alias_3` FROM `table_1` WHERE ((((`table_1`.`column_1` >= `table_1`.`column_2`) AND (`table_1`.`column_1` >= 1)) OR (`table_1`.`column_1` >= 1)) AND (`table_1`.`column_1` > ?))
? = 10
----
1001255369
1001255369
1001255369
519656345
519656345
519656345
688329821
688329821
688329821

query  rowsort
SELECT `table_1`.`column_1` AS `alias_1`, `table_1`.`column_1` AS `alias_2`, `table_1`.`column_1` AS `alias_3` FROM `table_1` WHERE ((((`table_1`.`column_1` >= `table_1`.`column_2`) AND (`table_1`.`column_1` >= 1)) OR (`table_1`.`column_1` >= 1)) AND (`table_1`.`column_1` > ?))
? = 10
----
1001255369
1001255369
1001255369
519656345
519656345
519656345
688329821
688329821
688329821

query  rowsort
SELECT `table_1`.`column_1` AS `alias_1`, `table_1`.`column_1` AS `alias_2`, `table_1`.`column_1` AS `alias_3`, `table_1`.`column_1` AS `alias_4` FROM `table_1` WHERE (((((`table_1`.`column_1` >= `table_1`.`column_2`) OR (`table_1`.`column_1` >= `table_1`.`column_2`)) AND (`table_1`.`column_1` >= 1)) OR (`table_1`.`column_1` >= 1)) AND (`table_1`.`column_1` > ?))
? = 10
----
1001255369
1001255369
1001255369
1001255369
519656345
519656345
519656345
519656345
688329821
688329821
688329821
688329821
