# Generated by:
#     target/debug/noria-logictest permute --compare-to mysql://root:noria@127.1/noria -d 3 -o logictests/generated/mysql/ --only range_param --random --include-deletes --rows-per-table 10 --subquery-depth 1 --overwrite-tests

statement ok
CREATE TABLE `table_1` (`column_3` INT, `column_1` INT, `column_2` INT, PRIMARY KEY (`column_3`))


statement ok
INSERT INTO `table_1` (`column_3`, `column_1`, `column_2`) VALUES (0, 1, 12485793), (1, -1284050924, 812939366), (2, 1, -2078918806), (3, 1958141795, 351978588), (4, 1, 353408209), (5, 266905530, 558328845), (6, 1, -2063490533), (7, -1679237906, 1717982893), (8, 1, 1861339418), (9, 932048492, 1810628680)


query  rowsort
SELECT `table_1`.`column_1` AS `alias_1` FROM `table_1` WHERE (`table_1`.`column_1` > `table_1`.`column_2`)
----
1
1
1958141795

query  rowsort
SELECT `table_1`.`column_1` AS `alias_1` FROM `table_1` WHERE (`table_1`.`column_1` > `table_1`.`column_2`)
----
1
1
1958141795

query  rowsort
SELECT `table_1`.`column_1` AS `alias_1` FROM `table_1` WHERE (`table_1`.`column_1` > 1)
----
1958141795
266905530
932048492

query  rowsort
SELECT `table_1`.`column_1` AS `alias_1` FROM `table_1` WHERE (`table_1`.`column_1` > 1)
----
1958141795
266905530
932048492

query  rowsort
SELECT `table_1`.`column_1` AS `alias_1` FROM `table_1` WHERE (`table_1`.`column_1` > ?)
? = 10
----
1958141795
266905530
932048492

query  rowsort
SELECT `table_1`.`column_1` AS `alias_1`, `table_1`.`column_1` AS `alias_2` FROM `table_1` WHERE ((`table_1`.`column_1` > `table_1`.`column_2`) OR (`table_1`.`column_1` > `table_1`.`column_2`))
----
1
1
1
1
1958141795
1958141795

query  rowsort
SELECT `table_1`.`column_1` AS `alias_1`, `table_1`.`column_1` AS `alias_2` FROM `table_1` WHERE ((`table_1`.`column_1` > `table_1`.`column_2`) AND (`table_1`.`column_1` > 1))
----
1958141795
1958141795

query  rowsort
SELECT `table_1`.`column_1` AS `alias_1`, `table_1`.`column_1` AS `alias_2` FROM `table_1` WHERE ((`table_1`.`column_1` > `table_1`.`column_2`) OR (`table_1`.`column_1` > 1))
----
1
1
1
1
1958141795
1958141795
266905530
266905530
932048492
932048492

query  rowsort
SELECT `table_1`.`column_1` AS `alias_1` FROM `table_1` WHERE ((`table_1`.`column_1` > `table_1`.`column_2`) AND (`table_1`.`column_1` > ?))
? = 10
----
1958141795

query  rowsort
SELECT `table_1`.`column_1` AS `alias_1`, `table_1`.`column_1` AS `alias_2` FROM `table_1` WHERE ((`table_1`.`column_1` > `table_1`.`column_2`) AND (`table_1`.`column_1` > 1))
----
1958141795
1958141795

query  rowsort
SELECT `table_1`.`column_1` AS `alias_1`, `table_1`.`column_1` AS `alias_2` FROM `table_1` WHERE ((`table_1`.`column_1` > `table_1`.`column_2`) OR (`table_1`.`column_1` > 1))
----
1
1
1
1
1958141795
1958141795
266905530
266905530
932048492
932048492

query  rowsort
SELECT `table_1`.`column_1` AS `alias_1` FROM `table_1` WHERE ((`table_1`.`column_1` > `table_1`.`column_2`) AND (`table_1`.`column_1` > ?))
? = 10
----
1958141795

query  rowsort
SELECT `table_1`.`column_1` AS `alias_1`, `table_1`.`column_1` AS `alias_2` FROM `table_1` WHERE ((`table_1`.`column_1` > 1) OR (`table_1`.`column_1` > 1))
----
1958141795
1958141795
266905530
266905530
932048492
932048492

query  rowsort
SELECT `table_1`.`column_1` AS `alias_1` FROM `table_1` WHERE ((`table_1`.`column_1` > 1) AND (`table_1`.`column_1` > ?))
? = 10
----
1958141795
266905530
932048492

query  rowsort
SELECT `table_1`.`column_1` AS `alias_1` FROM `table_1` WHERE ((`table_1`.`column_1` > 1) AND (`table_1`.`column_1` > ?))
? = 10
----
1958141795
266905530
932048492

query  rowsort
SELECT `table_1`.`column_1` AS `alias_1`, `table_1`.`column_1` AS `alias_2`, `table_1`.`column_1` AS `alias_3` FROM `table_1` WHERE (((`table_1`.`column_1` > `table_1`.`column_2`) OR (`table_1`.`column_1` > `table_1`.`column_2`)) AND (`table_1`.`column_1` > 1))
----
1958141795
1958141795
1958141795

query  rowsort
SELECT `table_1`.`column_1` AS `alias_1`, `table_1`.`column_1` AS `alias_2`, `table_1`.`column_1` AS `alias_3` FROM `table_1` WHERE (((`table_1`.`column_1` > `table_1`.`column_2`) OR (`table_1`.`column_1` > `table_1`.`column_2`)) OR (`table_1`.`column_1` > 1))
----
1
1
1
1
1
1
1958141795
1958141795
1958141795
266905530
266905530
266905530
932048492
932048492
932048492

query  rowsort
SELECT `table_1`.`column_1` AS `alias_1`, `table_1`.`column_1` AS `alias_2` FROM `table_1` WHERE (((`table_1`.`column_1` > `table_1`.`column_2`) OR (`table_1`.`column_1` > `table_1`.`column_2`)) AND (`table_1`.`column_1` > ?))
? = 10
----
1958141795
1958141795

query  rowsort
SELECT `table_1`.`column_1` AS `alias_1`, `table_1`.`column_1` AS `alias_2`, `table_1`.`column_1` AS `alias_3` FROM `table_1` WHERE (((`table_1`.`column_1` > `table_1`.`column_2`) AND (`table_1`.`column_1` > 1)) OR (`table_1`.`column_1` > 1))
----
1958141795
1958141795
1958141795
266905530
266905530
266905530
932048492
932048492
932048492

query  rowsort
SELECT `table_1`.`column_1` AS `alias_1`, `table_1`.`column_1` AS `alias_2` FROM `table_1` WHERE (((`table_1`.`column_1` > `table_1`.`column_2`) AND (`table_1`.`column_1` > 1)) AND (`table_1`.`column_1` > ?))
? = 10
----
1958141795
1958141795

query  rowsort
SELECT `table_1`.`column_1` AS `alias_1`, `table_1`.`column_1` AS `alias_2` FROM `table_1` WHERE (((`table_1`.`column_1` > `table_1`.`column_2`) OR (`table_1`.`column_1` > 1)) AND (`table_1`.`column_1` > ?))
? = 10
----
1958141795
1958141795
266905530
266905530
932048492
932048492

query  rowsort
SELECT `table_1`.`column_1` AS `alias_1`, `table_1`.`column_1` AS `alias_2`, `table_1`.`column_1` AS `alias_3` FROM `table_1` WHERE (((`table_1`.`column_1` > `table_1`.`column_2`) AND (`table_1`.`column_1` > 1)) OR (`table_1`.`column_1` > 1))
----
1958141795
1958141795
1958141795
266905530
266905530
266905530
932048492
932048492
932048492

query  rowsort
SELECT `table_1`.`column_1` AS `alias_1`, `table_1`.`column_1` AS `alias_2` FROM `table_1` WHERE (((`table_1`.`column_1` > `table_1`.`column_2`) AND (`table_1`.`column_1` > 1)) AND (`table_1`.`column_1` > ?))
? = 10
----
1958141795
1958141795

query  rowsort
SELECT `table_1`.`column_1` AS `alias_1`, `table_1`.`column_1` AS `alias_2` FROM `table_1` WHERE (((`table_1`.`column_1` > `table_1`.`column_2`) OR (`table_1`.`column_1` > 1)) AND (`table_1`.`column_1` > ?))
? = 10
----
1958141795
1958141795
266905530
266905530
932048492
932048492

query  rowsort
SELECT `table_1`.`column_1` AS `alias_1`, `table_1`.`column_1` AS `alias_2` FROM `table_1` WHERE (((`table_1`.`column_1` > 1) OR (`table_1`.`column_1` > 1)) AND (`table_1`.`column_1` > ?))
? = 10
----
1958141795
1958141795
266905530
266905530
932048492
932048492

query  rowsort
SELECT `table_1`.`column_1` AS `alias_1`, `table_1`.`column_1` AS `alias_2`, `table_1`.`column_1` AS `alias_3`, `table_1`.`column_1` AS `alias_4` FROM `table_1` WHERE ((((`table_1`.`column_1` > `table_1`.`column_2`) OR (`table_1`.`column_1` > `table_1`.`column_2`)) AND (`table_1`.`column_1` > 1)) OR (`table_1`.`column_1` > 1))
----
1958141795
1958141795
1958141795
1958141795
266905530
266905530
266905530
266905530
932048492
932048492
932048492
932048492

query  rowsort
SELECT `table_1`.`column_1` AS `alias_1`, `table_1`.`column_1` AS `alias_2`, `table_1`.`column_1` AS `alias_3` FROM `table_1` WHERE ((((`table_1`.`column_1` > `table_1`.`column_2`) OR (`table_1`.`column_1` > `table_1`.`column_2`)) AND (`table_1`.`column_1` > 1)) AND (`table_1`.`column_1` > ?))
? = 10
----
1958141795
1958141795
1958141795

query  rowsort
SELECT `table_1`.`column_1` AS `alias_1`, `table_1`.`column_1` AS `alias_2`, `table_1`.`column_1` AS `alias_3` FROM `table_1` WHERE ((((`table_1`.`column_1` > `table_1`.`column_2`) OR (`table_1`.`column_1` > `table_1`.`column_2`)) OR (`table_1`.`column_1` > 1)) AND (`table_1`.`column_1` > ?))
? = 10
----
1958141795
1958141795
1958141795
266905530
266905530
266905530
932048492
932048492
932048492

query  rowsort
SELECT `table_1`.`column_1` AS `alias_1`, `table_1`.`column_1` AS `alias_2`, `table_1`.`column_1` AS `alias_3` FROM `table_1` WHERE ((((`table_1`.`column_1` > `table_1`.`column_2`) AND (`table_1`.`column_1` > 1)) OR (`table_1`.`column_1` > 1)) AND (`table_1`.`column_1` > ?))
? = 10
----
1958141795
1958141795
1958141795
266905530
266905530
266905530
932048492
932048492
932048492

query  rowsort
SELECT `table_1`.`column_1` AS `alias_1`, `table_1`.`column_1` AS `alias_2`, `table_1`.`column_1` AS `alias_3` FROM `table_1` WHERE ((((`table_1`.`column_1` > `table_1`.`column_2`) AND (`table_1`.`column_1` > 1)) OR (`table_1`.`column_1` > 1)) AND (`table_1`.`column_1` > ?))
? = 10
----
1958141795
1958141795
1958141795
266905530
266905530
266905530
932048492
932048492
932048492

query  rowsort
SELECT `table_1`.`column_1` AS `alias_1`, `table_1`.`column_1` AS `alias_2`, `table_1`.`column_1` AS `alias_3`, `table_1`.`column_1` AS `alias_4` FROM `table_1` WHERE (((((`table_1`.`column_1` > `table_1`.`column_2`) OR (`table_1`.`column_1` > `table_1`.`column_2`)) AND (`table_1`.`column_1` > 1)) OR (`table_1`.`column_1` > 1)) AND (`table_1`.`column_1` > ?))
? = 10
----
1958141795
1958141795
1958141795
1958141795
266905530
266905530
266905530
266905530
932048492
932048492
932048492
932048492

statement ok
DELETE FROM `table_1` WHERE (`column_3` = 0)


statement ok
DELETE FROM `table_1` WHERE (`column_3` = 1)


statement ok
DELETE FROM `table_1` WHERE (`column_3` = 2)


statement ok
DELETE FROM `table_1` WHERE (`column_3` = 3)


statement ok
DELETE FROM `table_1` WHERE (`column_3` = 4)


query  rowsort
SELECT `table_1`.`column_1` AS `alias_1` FROM `table_1` WHERE (`table_1`.`column_1` > `table_1`.`column_2`)
----
1

query  rowsort
SELECT `table_1`.`column_1` AS `alias_1` FROM `table_1` WHERE (`table_1`.`column_1` > `table_1`.`column_2`)
----
1

query  rowsort
SELECT `table_1`.`column_1` AS `alias_1` FROM `table_1` WHERE (`table_1`.`column_1` > 1)
----
266905530
932048492

query  rowsort
SELECT `table_1`.`column_1` AS `alias_1` FROM `table_1` WHERE (`table_1`.`column_1` > 1)
----
266905530
932048492

query  rowsort
SELECT `table_1`.`column_1` AS `alias_1` FROM `table_1` WHERE (`table_1`.`column_1` > ?)
? = 10
----
266905530
932048492

query  rowsort
SELECT `table_1`.`column_1` AS `alias_1`, `table_1`.`column_1` AS `alias_2` FROM `table_1` WHERE ((`table_1`.`column_1` > `table_1`.`column_2`) OR (`table_1`.`column_1` > `table_1`.`column_2`))
----
1
1

query  rowsort
SELECT `table_1`.`column_1` AS `alias_1`, `table_1`.`column_1` AS `alias_2` FROM `table_1` WHERE ((`table_1`.`column_1` > `table_1`.`column_2`) AND (`table_1`.`column_1` > 1))
----


query  rowsort
SELECT `table_1`.`column_1` AS `alias_1`, `table_1`.`column_1` AS `alias_2` FROM `table_1` WHERE ((`table_1`.`column_1` > `table_1`.`column_2`) OR (`table_1`.`column_1` > 1))
----
1
1
266905530
266905530
932048492
932048492

query  rowsort
SELECT `table_1`.`column_1` AS `alias_1` FROM `table_1` WHERE ((`table_1`.`column_1` > `table_1`.`column_2`) AND (`table_1`.`column_1` > ?))
? = 10
----


query  rowsort
SELECT `table_1`.`column_1` AS `alias_1`, `table_1`.`column_1` AS `alias_2` FROM `table_1` WHERE ((`table_1`.`column_1` > `table_1`.`column_2`) AND (`table_1`.`column_1` > 1))
----


query  rowsort
SELECT `table_1`.`column_1` AS `alias_1`, `table_1`.`column_1` AS `alias_2` FROM `table_1` WHERE ((`table_1`.`column_1` > `table_1`.`column_2`) OR (`table_1`.`column_1` > 1))
----
1
1
266905530
266905530
932048492
932048492

query  rowsort
SELECT `table_1`.`column_1` AS `alias_1` FROM `table_1` WHERE ((`table_1`.`column_1` > `table_1`.`column_2`) AND (`table_1`.`column_1` > ?))
? = 10
----


query  rowsort
SELECT `table_1`.`column_1` AS `alias_1`, `table_1`.`column_1` AS `alias_2` FROM `table_1` WHERE ((`table_1`.`column_1` > 1) OR (`table_1`.`column_1` > 1))
----
266905530
266905530
932048492
932048492

query  rowsort
SELECT `table_1`.`column_1` AS `alias_1` FROM `table_1` WHERE ((`table_1`.`column_1` > 1) AND (`table_1`.`column_1` > ?))
? = 10
----
266905530
932048492

query  rowsort
SELECT `table_1`.`column_1` AS `alias_1` FROM `table_1` WHERE ((`table_1`.`column_1` > 1) AND (`table_1`.`column_1` > ?))
? = 10
----
266905530
932048492

query  rowsort
SELECT `table_1`.`column_1` AS `alias_1`, `table_1`.`column_1` AS `alias_2`, `table_1`.`column_1` AS `alias_3` FROM `table_1` WHERE (((`table_1`.`column_1` > `table_1`.`column_2`) OR (`table_1`.`column_1` > `table_1`.`column_2`)) AND (`table_1`.`column_1` > 1))
----


query  rowsort
SELECT `table_1`.`column_1` AS `alias_1`, `table_1`.`column_1` AS `alias_2`, `table_1`.`column_1` AS `alias_3` FROM `table_1` WHERE (((`table_1`.`column_1` > `table_1`.`column_2`) OR (`table_1`.`column_1` > `table_1`.`column_2`)) OR (`table_1`.`column_1` > 1))
----
1
1
1
266905530
266905530
266905530
932048492
932048492
932048492

query  rowsort
SELECT `table_1`.`column_1` AS `alias_1`, `table_1`.`column_1` AS `alias_2` FROM `table_1` WHERE (((`table_1`.`column_1` > `table_1`.`column_2`) OR (`table_1`.`column_1` > `table_1`.`column_2`)) AND (`table_1`.`column_1` > ?))
? = 10
----


query  rowsort
SELECT `table_1`.`column_1` AS `alias_1`, `table_1`.`column_1` AS `alias_2`, `table_1`.`column_1` AS `alias_3` FROM `table_1` WHERE (((`table_1`.`column_1` > `table_1`.`column_2`) AND (`table_1`.`column_1` > 1)) OR (`table_1`.`column_1` > 1))
----
266905530
266905530
266905530
932048492
932048492
932048492

query  rowsort
SELECT `table_1`.`column_1` AS `alias_1`, `table_1`.`column_1` AS `alias_2` FROM `table_1` WHERE (((`table_1`.`column_1` > `table_1`.`column_2`) AND (`table_1`.`column_1` > 1)) AND (`table_1`.`column_1` > ?))
? = 10
----


query  rowsort
SELECT `table_1`.`column_1` AS `alias_1`, `table_1`.`column_1` AS `alias_2` FROM `table_1` WHERE (((`table_1`.`column_1` > `table_1`.`column_2`) OR (`table_1`.`column_1` > 1)) AND (`table_1`.`column_1` > ?))
? = 10
----
266905530
266905530
932048492
932048492

query  rowsort
SELECT `table_1`.`column_1` AS `alias_1`, `table_1`.`column_1` AS `alias_2`, `table_1`.`column_1` AS `alias_3` FROM `table_1` WHERE (((`table_1`.`column_1` > `table_1`.`column_2`) AND (`table_1`.`column_1` > 1)) OR (`table_1`.`column_1` > 1))
----
266905530
266905530
266905530
932048492
932048492
932048492

query  rowsort
SELECT `table_1`.`column_1` AS `alias_1`, `table_1`.`column_1` AS `alias_2` FROM `table_1` WHERE (((`table_1`.`column_1` > `table_1`.`column_2`) AND (`table_1`.`column_1` > 1)) AND (`table_1`.`column_1` > ?))
? = 10
----


query  rowsort
SELECT `table_1`.`column_1` AS `alias_1`, `table_1`.`column_1` AS `alias_2` FROM `table_1` WHERE (((`table_1`.`column_1` > `table_1`.`column_2`) OR (`table_1`.`column_1` > 1)) AND (`table_1`.`column_1` > ?))
? = 10
----
266905530
266905530
932048492
932048492

query  rowsort
SELECT `table_1`.`column_1` AS `alias_1`, `table_1`.`column_1` AS `alias_2` FROM `table_1` WHERE (((`table_1`.`column_1` > 1) OR (`table_1`.`column_1` > 1)) AND (`table_1`.`column_1` > ?))
? = 10
----
266905530
266905530
932048492
932048492

query  rowsort
SELECT `table_1`.`column_1` AS `alias_1`, `table_1`.`column_1` AS `alias_2`, `table_1`.`column_1` AS `alias_3`, `table_1`.`column_1` AS `alias_4` FROM `table_1` WHERE ((((`table_1`.`column_1` > `table_1`.`column_2`) OR (`table_1`.`column_1` > `table_1`.`column_2`)) AND (`table_1`.`column_1` > 1)) OR (`table_1`.`column_1` > 1))
----
266905530
266905530
266905530
266905530
932048492
932048492
932048492
932048492

query  rowsort
SELECT `table_1`.`column_1` AS `alias_1`, `table_1`.`column_1` AS `alias_2`, `table_1`.`column_1` AS `alias_3` FROM `table_1` WHERE ((((`table_1`.`column_1` > `table_1`.`column_2`) OR (`table_1`.`column_1` > `table_1`.`column_2`)) AND (`table_1`.`column_1` > 1)) AND (`table_1`.`column_1` > ?))
? = 10
----


query  rowsort
SELECT `table_1`.`column_1` AS `alias_1`, `table_1`.`column_1` AS `alias_2`, `table_1`.`column_1` AS `alias_3` FROM `table_1` WHERE ((((`table_1`.`column_1` > `table_1`.`column_2`) OR (`table_1`.`column_1` > `table_1`.`column_2`)) OR (`table_1`.`column_1` > 1)) AND (`table_1`.`column_1` > ?))
? = 10
----
266905530
266905530
266905530
932048492
932048492
932048492

query  rowsort
SELECT `table_1`.`column_1` AS `alias_1`, `table_1`.`column_1` AS `alias_2`, `table_1`.`column_1` AS `alias_3` FROM `table_1` WHERE ((((`table_1`.`column_1` > `table_1`.`column_2`) AND (`table_1`.`column_1` > 1)) OR (`table_1`.`column_1` > 1)) AND (`table_1`.`column_1` > ?))
? = 10
----
266905530
266905530
266905530
932048492
932048492
932048492

query  rowsort
SELECT `table_1`.`column_1` AS `alias_1`, `table_1`.`column_1` AS `alias_2`, `table_1`.`column_1` AS `alias_3` FROM `table_1` WHERE ((((`table_1`.`column_1` > `table_1`.`column_2`) AND (`table_1`.`column_1` > 1)) OR (`table_1`.`column_1` > 1)) AND (`table_1`.`column_1` > ?))
? = 10
----
266905530
266905530
266905530
932048492
932048492
932048492

query  rowsort
SELECT `table_1`.`column_1` AS `alias_1`, `table_1`.`column_1` AS `alias_2`, `table_1`.`column_1` AS `alias_3`, `table_1`.`column_1` AS `alias_4` FROM `table_1` WHERE (((((`table_1`.`column_1` > `table_1`.`column_2`) OR (`table_1`.`column_1` > `table_1`.`column_2`)) AND (`table_1`.`column_1` > 1)) OR (`table_1`.`column_1` > 1)) AND (`table_1`.`column_1` > ?))
? = 10
----
266905530
266905530
266905530
266905530
932048492
932048492
932048492
932048492
