# Generated by:
#     target/debug/noria-logictest permute -d 3 -o logictests/generated/mysql --only in_parameter --compare-to mysql://root:noria@localhost/mysql --subquery-depth 1 --rows-per-table 5 --include-deletes --overwrite-tests

statement ok
CREATE TABLE table_1 (column_8 TEXT, column_7 INT, column_5 INT, column_2 INT, column_6 TEXT, column_10 INT, column_4 TEXT, column_9 INT, column_1 TEXT, column_3 INT, PRIMARY KEY (column_10))


statement ok
CREATE TABLE table_3 (column_2 INT, column_3 INT, column_1 INT, PRIMARY KEY (column_3))


statement ok
CREATE TABLE table_2 (column_1 INT, column_3 INT, column_2 INT, PRIMARY KEY (column_3))


statement ok
CREATE TABLE table_4 (column_3 INT, column_2 INT, column_1 INT, PRIMARY KEY (column_3))


statement ok
CREATE TABLE table_5 (column_1 INT, column_2 INT, column_3 INT, PRIMARY KEY (column_3))


statement ok
INSERT INTO table_1 (column_8, column_7, column_5, column_2, column_6, column_10, column_4, column_9, column_1, column_3) VALUES ('1', 1, 1, 0, 'a', 0, 'a', 1, 'a', 0), ('a', 1, 1, 1, 'a', 1, 'a', 1, 'a', 1), ('0', 1, 1, 1, 'a', 2, 'a', 1, 'a', 1), ('a', 1, 1, 1, 'a', 3, 'a', 1, 'a', 1), ('2', 1, 1, 2, 'a', 4, 'a', 1, 'a', 2)


statement ok
INSERT INTO table_3 (column_2, column_3, column_1) VALUES (1, 0, 1), (1, 1, 1), (1, 2, 1), (1, 3, 1), (1, 4, 1)


statement ok
INSERT INTO table_2 (column_1, column_3, column_2) VALUES (1, 0, 1), (1, 1, 1), (1, 2, 1), (1, 3, 1), (1, 4, 1)


statement ok
INSERT INTO table_4 (column_3, column_2, column_1) VALUES (0, 1, 1), (1, 1, 1), (2, 1, 1), (3, 1, 1), (4, 1, 1)


statement ok
INSERT INTO table_5 (column_1, column_2, column_3) VALUES (1, 1, 0), (1, 1, 1), (1, 1, 2), (1, 1, 3), (1, 1, 4)


query  rowsort
SELECT group_concat(table_1.column_1 separator ', ') AS alias_1 FROM table_1
----
a, a, a, a, a

query  rowsort
SELECT table_1.column_3 AS alias_1, table_2.column_2 AS alias_2 FROM table_1 LEFT JOIN table_2 ON (table_1.column_2 = table_2.column_1)
----
34 values hashing to 2077ca801fccfae0b01449c99614cd98

query  rowsort
SELECT table_1.column_3 AS alias_1 FROM table_1 WHERE table_1.column_3 IN (?, ?, ?)
? = 0
? = 1
? = 2
----
0
1
1
1
2

query  rowsort
SELECT group_concat(table_1.column_4 separator ', ') AS alias_1, table_1.column_5 AS alias_2, table_3.column_2 AS alias_3 FROM table_1 LEFT JOIN table_3 ON (table_1.column_2 = table_3.column_1) GROUP BY table_1.column_5, table_3.column_2
----
a, a
1
NULL
a, a, a, a, a, a, a, a, a, a, a, a, a, a, a
1
1

query  rowsort
SELECT group_concat(table_1.column_6 separator ', ') AS alias_1 FROM table_1 WHERE table_1.column_2 IN (?, ?, ?)
? = 0
? = 1
? = 2
----
a, a, a, a, a

query  rowsort
SELECT table_1.column_7 AS alias_1, table_4.column_2 AS alias_2 FROM table_1 LEFT JOIN table_4 ON (table_1.column_2 = table_4.column_1) WHERE table_1.column_2 IN (?, ?, ?)
? = 0
? = 1
? = 2
----
34 values hashing to 72bba62bffd79ee7011a1c8102fad32b

query  rowsort
SELECT group_concat(table_1.column_8 separator ', ') AS alias_1, table_1.column_9 AS alias_2, table_5.column_2 AS alias_3 FROM table_1 LEFT JOIN table_5 ON (table_1.column_7 = table_5.column_1) WHERE table_1.column_8 IN (?, ?, ?) GROUP BY table_1.column_9, table_5.column_2
? = 0
? = 1
? = 2
----
1, 1, 1, 1, 1, 0, 0, 0, 0, 0, 2, 2, 2, 2, 2
1
1

statement ok
DELETE FROM table_1 WHERE (column_10 = 0)


statement ok
DELETE FROM table_1 WHERE (column_10 = 1)


statement ok
DELETE FROM table_3 WHERE (column_3 = 0)


statement ok
DELETE FROM table_3 WHERE (column_3 = 1)


statement ok
DELETE FROM table_2 WHERE (column_3 = 0)


statement ok
DELETE FROM table_2 WHERE (column_3 = 1)


statement ok
DELETE FROM table_4 WHERE (column_3 = 0)


statement ok
DELETE FROM table_4 WHERE (column_3 = 1)


statement ok
DELETE FROM table_5 WHERE (column_3 = 0)


statement ok
DELETE FROM table_5 WHERE (column_3 = 1)


query  rowsort
SELECT group_concat(table_1.column_1 separator ', ') AS alias_1 FROM table_1
----
a, a, a

query  rowsort
SELECT table_1.column_3 AS alias_1, table_2.column_2 AS alias_2 FROM table_1 LEFT JOIN table_2 ON (table_1.column_2 = table_2.column_1)
----
1
1
1
1
1
1
1
1
1
1
1
1
2
NULL

query  rowsort
SELECT table_1.column_3 AS alias_1 FROM table_1 WHERE table_1.column_3 IN (?, ?, ?)
? = 0
? = 1
? = 2
----
1
1
2

query  rowsort
SELECT group_concat(table_1.column_4 separator ', ') AS alias_1, table_1.column_5 AS alias_2, table_3.column_2 AS alias_3 FROM table_1 LEFT JOIN table_3 ON (table_1.column_2 = table_3.column_1) GROUP BY table_1.column_5, table_3.column_2
----
a
1
NULL
a, a, a, a, a, a
1
1

query  rowsort
SELECT group_concat(table_1.column_6 separator ', ') AS alias_1 FROM table_1 WHERE table_1.column_2 IN (?, ?, ?)
? = 0
? = 1
? = 2
----
a, a, a

query  rowsort
SELECT table_1.column_7 AS alias_1, table_4.column_2 AS alias_2 FROM table_1 LEFT JOIN table_4 ON (table_1.column_2 = table_4.column_1) WHERE table_1.column_2 IN (?, ?, ?)
? = 0
? = 1
? = 2
----
1
1
1
1
1
1
1
1
1
1
1
1
1
NULL

query  rowsort
SELECT group_concat(table_1.column_8 separator ', ') AS alias_1, table_1.column_9 AS alias_2, table_5.column_2 AS alias_3 FROM table_1 LEFT JOIN table_5 ON (table_1.column_7 = table_5.column_1) WHERE table_1.column_8 IN (?, ?, ?) GROUP BY table_1.column_9, table_5.column_2
? = 0
? = 1
? = 2
----
0, 0, 0, 2, 2, 2
1
1
