# Generated by:
#     target/debug/noria-logictest generate --operations group_concat,min --compare-to mysql://root@localhost/mysql --subquery-depth 1 --rows-per-table 5 -o logictests/generated/group_concat,min.test --include-deletes
# failure: ENG-339

statement ok
CREATE TABLE table_1 (column_2 INT(32), column_5 INT(32), column_4 INT(32), column_1 TEXT, column_3 TEXT, PRIMARY KEY (column_5))


statement ok
INSERT INTO table_1 (column_2, column_3, column_4, column_1, column_5) VALUES (1, 'a', 1, 'a', 2), (1, 'a', 1, 'a', 3), (1, 'a', 1, 'a', 4), (1, 'a', 1, 'a', 5), (1, 'a', 1, 'a', 6)


query  nosort
SELECT group_concat(table_1.column_1 separator ', ') AS alias_1 FROM table_1
----
a, a, a, a, a

query  nosort
SELECT min(table_1.column_2) AS alias_1 FROM table_1
----
1

query  nosort
SELECT group_concat(table_1.column_3 separator ', ') AS alias_1, min(table_1.column_4) AS alias_2 FROM table_1
----
a, a, a, a, a
1

statement ok
DELETE FROM table_1 WHERE (column_5 = 2)


statement ok
DELETE FROM table_1 WHERE (column_5 = 3)


query  nosort
SELECT group_concat(table_1.column_1 separator ', ') AS alias_1 FROM table_1
----
a, a, a

query  nosort
SELECT min(table_1.column_2) AS alias_1 FROM table_1
----
1

query  nosort
SELECT group_concat(table_1.column_3 separator ', ') AS alias_1, min(table_1.column_4) AS alias_2 FROM table_1
----
a, a, a
1
