# Generated by:
#     target/debug/noria-logictest generate --operations group_concat,min,inner_join --compare-to mysql://root@localhost/mysql --subquery-depth 1 --rows-per-table 5 -o logictests/generated/group_concat,min,inner_join.test --include-deletes
# failure: ENG-339

statement ok
CREATE TABLE table_5 (column_2 INT(32), column_1 INT(32), column_3 INT(32), PRIMARY KEY (column_3))


statement ok
CREATE TABLE table_1 (column_12 INT(32), column_9 INT(32), column_13 INT(32), column_8 INT(32), column_3 INT(32), column_5 INT(32), column_4 TEXT, column_10 TEXT, column_6 TEXT, column_1 TEXT, column_2 INT(32), column_11 INT(32), column_7 INT(32), PRIMARY KEY (column_13))


statement ok
CREATE TABLE table_3 (column_2 INT(32), column_3 INT(32), column_1 INT(32), PRIMARY KEY (column_3))


statement ok
CREATE TABLE table_4 (column_2 INT(32), column_1 INT(32), column_3 INT(32), PRIMARY KEY (column_3))


statement ok
CREATE TABLE table_2 (column_3 INT(32), column_1 INT(32), column_2 INT(32), PRIMARY KEY (column_3))


statement ok
INSERT INTO table_5 (column_3, column_2, column_1) VALUES (2, 1, 1), (3, 1, 1), (4, 1, 1), (5, 1, 1), (6, 1, 1)


statement ok
INSERT INTO table_1 (column_8, column_6, column_12, column_3, column_13, column_10, column_2, column_9, column_5, column_4, column_1, column_11, column_7) VALUES (1, 'a', 1, 1, 2, 'a', 1, 1, 1, 'a', 'a', 1, 1), (1, 'a', 1, 1, 3, 'a', 1, 1, 1, 'a', 'a', 1, 1), (1, 'a', 1, 1, 4, 'a', 1, 1, 1, 'a', 'a', 1, 1), (1, 'a', 1, 1, 5, 'a', 1, 1, 1, 'a', 'a', 1, 1), (1, 'a', 1, 1, 6, 'a', 1, 1, 1, 'a', 'a', 1, 1)


statement ok
INSERT INTO table_3 (column_3, column_2, column_1) VALUES (2, 1, 1), (3, 1, 1), (4, 1, 1), (5, 1, 1), (6, 1, 1)


statement ok
INSERT INTO table_4 (column_3, column_1, column_2) VALUES (2, 1, 1), (3, 1, 1), (4, 1, 1), (5, 1, 1), (6, 1, 1)


statement ok
INSERT INTO table_2 (column_1, column_2, column_3) VALUES (1, 1, 2), (1, 1, 3), (1, 1, 4), (1, 1, 5), (1, 1, 6)


query  nosort
SELECT group_concat(table_1.column_1 separator ', ') AS alias_1 FROM table_1
----
a, a, a, a, a

query  nosort
SELECT min(table_1.column_2) AS alias_1 FROM table_1
----
1

query  nosort
SELECT table_1.column_3 AS alias_1, table_2.column_2 AS alias_2 FROM table_1 INNER JOIN table_2 ON (table_1.column_2 = table_2.column_1)
----
50 values hashing to 1f4709ccf33e9b44d9c58ab63929bdf1

query  nosort
SELECT group_concat(table_1.column_4 separator ', ') AS alias_1, min(table_1.column_5) AS alias_2 FROM table_1
----
a, a, a, a, a
1

query  nosort
SELECT group_concat(table_1.column_6 separator ', ') AS alias_1, table_1.column_7 AS alias_2, table_3.column_2 AS alias_3 FROM table_1 INNER JOIN table_3 ON (table_1.column_5 = table_3.column_1) GROUP BY table_1.column_7, table_3.column_2
----
a, a, a, a, a, a, a, a, a, a, a, a, a, a, a, a, a, a, a, a, a, a, a, a, a
1
1

query  nosort
SELECT min(table_1.column_8) AS alias_1, table_1.column_9 AS alias_2, table_4.column_2 AS alias_3 FROM table_1 INNER JOIN table_4 ON (table_1.column_8 = table_4.column_1) GROUP BY table_1.column_9, table_4.column_2
----
1
1
1

query  nosort
SELECT group_concat(table_1.column_10 separator ', ') AS alias_1, min(table_1.column_11) AS alias_2, table_1.column_12 AS alias_3, table_5.column_2 AS alias_4 FROM table_1 INNER JOIN table_5 ON (table_1.column_9 = table_5.column_1) GROUP BY table_1.column_12, table_5.column_2
----
a, a, a, a, a, a, a, a, a, a, a, a, a, a, a, a, a, a, a, a, a, a, a, a, a
1
1
1

statement ok
DELETE FROM table_5 WHERE (column_3 = 2)


statement ok
DELETE FROM table_5 WHERE (column_3 = 3)


statement ok
DELETE FROM table_1 WHERE (column_13 = 2)


statement ok
DELETE FROM table_1 WHERE (column_13 = 3)


statement ok
DELETE FROM table_3 WHERE (column_3 = 2)


statement ok
DELETE FROM table_3 WHERE (column_3 = 3)


statement ok
DELETE FROM table_4 WHERE (column_3 = 2)


statement ok
DELETE FROM table_4 WHERE (column_3 = 3)


statement ok
DELETE FROM table_2 WHERE (column_3 = 2)


statement ok
DELETE FROM table_2 WHERE (column_3 = 3)


query  nosort
SELECT group_concat(table_1.column_1 separator ', ') AS alias_1 FROM table_1
----
a, a, a

query  nosort
SELECT min(table_1.column_2) AS alias_1 FROM table_1
----
1

query  nosort
SELECT table_1.column_3 AS alias_1, table_2.column_2 AS alias_2 FROM table_1 INNER JOIN table_2 ON (table_1.column_2 = table_2.column_1)
----
1
1
1
1
1
1
1
1
1
1
1
1
1
1
1
1
1
1

query  nosort
SELECT group_concat(table_1.column_4 separator ', ') AS alias_1, min(table_1.column_5) AS alias_2 FROM table_1
----
a, a, a
1

query  nosort
SELECT group_concat(table_1.column_6 separator ', ') AS alias_1, table_1.column_7 AS alias_2, table_3.column_2 AS alias_3 FROM table_1 INNER JOIN table_3 ON (table_1.column_5 = table_3.column_1) GROUP BY table_1.column_7, table_3.column_2
----
a, a, a, a, a, a, a, a, a
1
1

query  nosort
SELECT min(table_1.column_8) AS alias_1, table_1.column_9 AS alias_2, table_4.column_2 AS alias_3 FROM table_1 INNER JOIN table_4 ON (table_1.column_8 = table_4.column_1) GROUP BY table_1.column_9, table_4.column_2
----
1
1
1

query  nosort
SELECT group_concat(table_1.column_10 separator ', ') AS alias_1, min(table_1.column_11) AS alias_2, table_1.column_12 AS alias_3, table_5.column_2 AS alias_4 FROM table_1 INNER JOIN table_5 ON (table_1.column_9 = table_5.column_1) GROUP BY table_1.column_12, table_5.column_2
----
a, a, a, a, a, a, a, a, a
1
1
1
