# Generated by:
#     target/debug/noria-logictest generate --operations group_concat --compare-to mysql://root@localhost/mysql --subquery-depth 1 --rows-per-table 5 -o logictests/generated/group_concat.test --include-deletes
# failure: ENG-339

statement ok
CREATE TABLE table_1 (column_1 TEXT, column_2 INT(32), PRIMARY KEY (column_2))


statement ok
INSERT INTO table_1 (column_2, column_1) VALUES (2, 'a'), (3, 'a'), (4, 'a'), (5, 'a'), (6, 'a')


query  nosort
SELECT group_concat(table_1.column_1 separator ', ') AS alias_1 FROM table_1
----
a, a, a, a, a

statement ok
DELETE FROM table_1 WHERE (column_2 = 2)


statement ok
DELETE FROM table_1 WHERE (column_2 = 3)


query  nosort
SELECT group_concat(table_1.column_1 separator ', ') AS alias_1 FROM table_1
----
a, a, a
