# Generated by:
#     target/debug/noria-logictest permute -d 3 -o logictests/generated/mysql --only in_parameter --compare-to mysql://root:noria@localhost/mysql --subquery-depth 1 --rows-per-table 5 --include-deletes --overwrite-tests

statement ok
CREATE TABLE table_1 (column_2 TEXT, column_3 INT, column_1 TEXT, PRIMARY KEY (column_3))


statement ok
INSERT INTO table_1 (column_2, column_3, column_1) VALUES ('0', 0, '2'), ('a', 1, 'a'), ('2', 2, '0'), ('a', 3, 'a'), ('1', 4, '1')


query  rowsort
SELECT group_concat(table_1.column_1 separator ', ') AS alias_1 FROM table_1
----
2, a, 0, a, 1

query  rowsort
SELECT table_1.column_1 AS alias_1 FROM table_1 WHERE table_1.column_1 IN (?, ?, ?)
? = 0
? = 1
? = 2
----
0
1
2

query  rowsort
SELECT group_concat(table_1.column_2 separator ', ') AS alias_1 FROM table_1 WHERE table_1.column_2 IN (?, ?, ?)
? = 0
? = 1
? = 2
----
0, 2, 1

statement ok
DELETE FROM table_1 WHERE (column_3 = 0)


statement ok
DELETE FROM table_1 WHERE (column_3 = 1)


query  rowsort
SELECT group_concat(table_1.column_1 separator ', ') AS alias_1 FROM table_1
----
0, a, 1

query  rowsort
SELECT table_1.column_1 AS alias_1 FROM table_1 WHERE table_1.column_1 IN (?, ?, ?)
? = 0
? = 1
? = 2
----
0
1

query  rowsort
SELECT group_concat(table_1.column_2 separator ', ') AS alias_1 FROM table_1 WHERE table_1.column_2 IN (?, ?, ?)
? = 0
? = 1
? = 2
----
2, 1
