# Generated by:
#     target/debug/noria-logictest permute --compare-to mysql://root:noria@127.1/noria -d 3 -o logictests/generated/mysql/ --only range_param --random --include-deletes --rows-per-table 10 --subquery-depth 1

statement ok
CREATE TABLE `table_3` (`column_5` INT, `column_4` INT, `column_1` INT, `column_3` INT, `column_2` INT, PRIMARY KEY (`column_5`))


statement ok
CREATE TABLE `table_1` (`column_2` INT, `column_3` INT, `column_4` INT, `column_1` INT, PRIMARY KEY (`column_4`))


statement ok
CREATE TABLE `table_4` (`column_2` INT, `column_3` INT, `column_1` INT, PRIMARY KEY (`column_3`))


statement ok
CREATE TABLE `table_5` (`column_2` INT, `column_3` INT, `column_1` INT, PRIMARY KEY (`column_3`))


statement ok
CREATE TABLE `table_2` (`column_2` INT, `column_1` INT, `column_3` INT, PRIMARY KEY (`column_3`))


statement ok
INSERT INTO `table_3` (`column_5`, `column_4`, `column_1`, `column_3`, `column_2`) VALUES (0, 1773258231, 470876291, 1, 0), (1, 874316508, 283939744, -107633527, 1765953244), (2, -542369453, 64649712, 0, 1), (3, 1153409153, 1014922657, -972291616, -152016353), (4, 613132601, -1888410592, 2, 2), (5, -399089370, -151513941, -1849753568, 1154983317), (6, -2082795677, 1672554501, 1, 0), (7, -1946492093, 770833342, -1561951429, 1267603969), (8, 483462154, -30458675, 0, 1), (9, -1570684962, 1129073430, 1590647010, -1916593081)


statement ok
INSERT INTO `table_1` (`column_2`, `column_3`, `column_4`, `column_1`) VALUES (1, 79830334, 0, 2), (504826000, -183443939, 1, -94550043), (2, -1519270999, 2, 1), (-2063550315, 2034407867, 3, -92220963), (0, -794862959, 4, 0), (2028552216, 1100374852, 5, -123431751), (1, -35872783, 6, 2), (-433500438, -1216694438, 7, 1198906099), (2, 676209885, 8, 1), (1919792817, 184036207, 9, -82049134)


statement ok
INSERT INTO `table_4` (`column_2`, `column_3`, `column_1`) VALUES (641862165, 0, 1929490411), (-581283859, 1, -1475515535), (-2101496041, 2, 885104790), (1608638515, 3, -1493208628), (-855718551, 4, -1300913204), (435051932, 5, -1726674601), (-1308892366, 6, -952455700), (281122777, 7, 1291092219), (-75541516, 8, 1676499084), (2143757489, 9, 1709551519)


statement ok
INSERT INTO `table_5` (`column_2`, `column_3`, `column_1`) VALUES (988276901, 0, -1480056204), (473566685, 1, 528592112), (1149899071, 2, -1026106895), (1992713245, 3, 1390571178), (1956109243, 4, 1094250091), (-1323071447, 5, -1310348971), (-1275673192, 6, 1263003568), (1419889034, 7, 2093130270), (1360730035, 8, -943282789), (-79471344, 9, -795670425)


statement ok
INSERT INTO `table_2` (`column_2`, `column_1`, `column_3`) VALUES (-1737569945, 942306405, 0), (-672601003, 1952295822, 1), (-1664488412, 368989983, 2), (426307247, 426023008, 3), (1301791678, -184362391, 4), (-697430313, -33980973, 5), (-1920968067, 1578558825, 6), (-380861860, -2073070378, 7), (2053753420, 1139554765, 8), (-599051335, 1926597275, 9)


query  rowsort
SELECT `table_1`.`column_1` AS `alias_1` FROM `table_1` WHERE `table_1`.`column_1` IN (?, ?, ?)
? = 0
? = 1
? = 2
----
0
1
1
2
2

query  rowsort
SELECT `table_1`.`column_2` AS `alias_1`, `table_2`.`column_2` AS `alias_2` FROM `table_1` INNER JOIN `table_2` ON (`table_1`.`column_1` = `table_2`.`column_1`)
----


query  rowsort
SELECT `table_1`.`column_2` AS `alias_1` FROM `table_1` WHERE (`table_1`.`column_2` > ?)
? = 10
----
1919792817
2028552216
504826000

query  rowsort
SELECT `table_1`.`column_3` AS `alias_1`, `table_3`.`column_2` AS `alias_2` FROM `table_1` INNER JOIN `table_3` ON (`table_1`.`column_2` = `table_3`.`column_1`) WHERE `table_1`.`column_2` IN (?, ?, ?)
? = 0
? = 1
? = 2
----


query  rowsort
SELECT `table_3`.`column_2` AS `alias_1` FROM `table_3` WHERE (`table_3`.`column_2` IN (?, ?, ?) AND (`table_3`.`column_2` > ?))
? = 0
? = 1
? = 2
? = 10
----


query  rowsort
SELECT `table_3`.`column_3` AS `alias_1`, `table_4`.`column_2` AS `alias_2` FROM `table_3` INNER JOIN `table_4` ON (`table_3`.`column_2` = `table_4`.`column_1`) WHERE (`table_3`.`column_3` > ?)
? = 10
----


query  rowsort
SELECT `table_3`.`column_4` AS `alias_1`, `table_5`.`column_2` AS `alias_2` FROM `table_3` INNER JOIN `table_5` ON (`table_3`.`column_3` = `table_5`.`column_1`) WHERE (`table_3`.`column_3` IN (?, ?, ?) AND (`table_3`.`column_4` > ?))
? = 0
? = 1
? = 2
? = 10
----


statement ok
DELETE FROM `table_3` WHERE (`column_5` = 0)


statement ok
DELETE FROM `table_3` WHERE (`column_5` = 1)


statement ok
DELETE FROM `table_3` WHERE (`column_5` = 2)


statement ok
DELETE FROM `table_3` WHERE (`column_5` = 3)


statement ok
DELETE FROM `table_3` WHERE (`column_5` = 4)


statement ok
DELETE FROM `table_1` WHERE (`column_4` = 0)


statement ok
DELETE FROM `table_1` WHERE (`column_4` = 1)


statement ok
DELETE FROM `table_1` WHERE (`column_4` = 2)


statement ok
DELETE FROM `table_1` WHERE (`column_4` = 3)


statement ok
DELETE FROM `table_1` WHERE (`column_4` = 4)


statement ok
DELETE FROM `table_4` WHERE (`column_3` = 0)


statement ok
DELETE FROM `table_4` WHERE (`column_3` = 1)


statement ok
DELETE FROM `table_4` WHERE (`column_3` = 2)


statement ok
DELETE FROM `table_4` WHERE (`column_3` = 3)


statement ok
DELETE FROM `table_4` WHERE (`column_3` = 4)


statement ok
DELETE FROM `table_5` WHERE (`column_3` = 0)


statement ok
DELETE FROM `table_5` WHERE (`column_3` = 1)


statement ok
DELETE FROM `table_5` WHERE (`column_3` = 2)


statement ok
DELETE FROM `table_5` WHERE (`column_3` = 3)


statement ok
DELETE FROM `table_5` WHERE (`column_3` = 4)


statement ok
DELETE FROM `table_2` WHERE (`column_3` = 0)


statement ok
DELETE FROM `table_2` WHERE (`column_3` = 1)


statement ok
DELETE FROM `table_2` WHERE (`column_3` = 2)


statement ok
DELETE FROM `table_2` WHERE (`column_3` = 3)


statement ok
DELETE FROM `table_2` WHERE (`column_3` = 4)


query  rowsort
SELECT `table_1`.`column_1` AS `alias_1` FROM `table_1` WHERE `table_1`.`column_1` IN (?, ?, ?)
? = 0
? = 1
? = 2
----
1
2

query  rowsort
SELECT `table_1`.`column_2` AS `alias_1`, `table_2`.`column_2` AS `alias_2` FROM `table_1` INNER JOIN `table_2` ON (`table_1`.`column_1` = `table_2`.`column_1`)
----


query  rowsort
SELECT `table_1`.`column_2` AS `alias_1` FROM `table_1` WHERE (`table_1`.`column_2` > ?)
? = 10
----
1919792817
2028552216

query  rowsort
SELECT `table_1`.`column_3` AS `alias_1`, `table_3`.`column_2` AS `alias_2` FROM `table_1` INNER JOIN `table_3` ON (`table_1`.`column_2` = `table_3`.`column_1`) WHERE `table_1`.`column_2` IN (?, ?, ?)
? = 0
? = 1
? = 2
----


query  rowsort
SELECT `table_3`.`column_2` AS `alias_1` FROM `table_3` WHERE (`table_3`.`column_2` IN (?, ?, ?) AND (`table_3`.`column_2` > ?))
? = 0
? = 1
? = 2
? = 10
----


query  rowsort
SELECT `table_3`.`column_3` AS `alias_1`, `table_4`.`column_2` AS `alias_2` FROM `table_3` INNER JOIN `table_4` ON (`table_3`.`column_2` = `table_4`.`column_1`) WHERE (`table_3`.`column_3` > ?)
? = 10
----


query  rowsort
SELECT `table_3`.`column_4` AS `alias_1`, `table_5`.`column_2` AS `alias_2` FROM `table_3` INNER JOIN `table_5` ON (`table_3`.`column_3` = `table_5`.`column_1`) WHERE (`table_3`.`column_3` IN (?, ?, ?) AND (`table_3`.`column_4` > ?))
? = 0
? = 1
? = 2
? = 10
----

