# Generated by:
#     target/debug/noria-logictest permute --compare-to mysql://root:noria@127.1/noria -d 3 -o logictests/generated/mysql/ --only range_param --random --include-deletes --rows-per-table 10 --subquery-depth 1

statement ok
CREATE TABLE `table_1` (`column_2` INT, `column_1` INT, `column_3` INT, `column_5` INT, `column_6` INT, `column_4` INT, PRIMARY KEY (`column_6`))


statement ok
INSERT INTO `table_1` (`column_2`, `column_1`, `column_3`, `column_5`, `column_6`, `column_4`) VALUES (2, 0, 114423409, 461596323, 0, 20114409), (-867673310, 1218687996, -2138286910, -1005591514, 1, 1927251206), (0, 1, -1238613512, 2055490757, 2, 1867044829), (896244982, 1001205271, -105556107, 404447958, 3, 523490244), (1, 2, 1696553451, -1576147542, 4, 108313052), (893504459, -1552480341, 13256042, 622931743, 5, -59106815), (2, 0, -1671884526, -997146604, 6, -1277990096), (363698335, 784131743, 1510049121, 582638425, 7, -177145152), (0, 1, -1150806484, -1277597376, 8, -674005539), (1138700582, 1255768568, 2068292732, -2109606103, 9, 1092751750)


query  rowsort
SELECT `table_1`.`column_1` AS `alias_1` FROM `table_1` WHERE `table_1`.`column_1` IN (?, ?, ?)
? = 0
? = 1
? = 2
----
0
0
1
1
2

query  rowsort
SELECT min(`table_1`.`column_2`) AS `alias_1` FROM `table_1`
----
-867673310

query  rowsort
SELECT `table_1`.`column_2` AS `alias_1` FROM `table_1` WHERE (`table_1`.`column_2` > ?)
? = 10
----
1138700582
363698335
893504459
896244982

query  rowsort
SELECT min(`table_1`.`column_3`) AS `alias_1` FROM `table_1` WHERE `table_1`.`column_2` IN (?, ?, ?)
? = 0
? = 1
? = 2
----
-1671884526

query  rowsort
SELECT `table_1`.`column_2` AS `alias_1` FROM `table_1` WHERE (`table_1`.`column_2` IN (?, ?, ?) AND (`table_1`.`column_2` > ?))
? = 0
? = 1
? = 2
? = 10
----


query  rowsort
SELECT min(`table_1`.`column_4`) AS `alias_1` FROM `table_1` WHERE (`table_1`.`column_2` > ?)
? = 10
----
-177145152

query  rowsort
SELECT min(`table_1`.`column_5`) AS `alias_1` FROM `table_1` WHERE (`table_1`.`column_2` IN (?, ?, ?) AND (`table_1`.`column_2` > ?))
? = 0
? = 1
? = 2
? = 10
----
NULL

statement ok
DELETE FROM `table_1` WHERE (`column_6` = 0)


statement ok
DELETE FROM `table_1` WHERE (`column_6` = 1)


statement ok
DELETE FROM `table_1` WHERE (`column_6` = 2)


statement ok
DELETE FROM `table_1` WHERE (`column_6` = 3)


statement ok
DELETE FROM `table_1` WHERE (`column_6` = 4)


query  rowsort
SELECT `table_1`.`column_1` AS `alias_1` FROM `table_1` WHERE `table_1`.`column_1` IN (?, ?, ?)
? = 0
? = 1
? = 2
----
0
1

query  rowsort
SELECT min(`table_1`.`column_2`) AS `alias_1` FROM `table_1`
----
0

query  rowsort
SELECT `table_1`.`column_2` AS `alias_1` FROM `table_1` WHERE (`table_1`.`column_2` > ?)
? = 10
----
1138700582
363698335
893504459

query  rowsort
SELECT min(`table_1`.`column_3`) AS `alias_1` FROM `table_1` WHERE `table_1`.`column_2` IN (?, ?, ?)
? = 0
? = 1
? = 2
----
-1671884526

query  rowsort
SELECT `table_1`.`column_2` AS `alias_1` FROM `table_1` WHERE (`table_1`.`column_2` IN (?, ?, ?) AND (`table_1`.`column_2` > ?))
? = 0
? = 1
? = 2
? = 10
----


query  rowsort
SELECT min(`table_1`.`column_4`) AS `alias_1` FROM `table_1` WHERE (`table_1`.`column_2` > ?)
? = 10
----
-177145152

query  rowsort
SELECT min(`table_1`.`column_5`) AS `alias_1` FROM `table_1` WHERE (`table_1`.`column_2` IN (?, ?, ?) AND (`table_1`.`column_2` > ?))
? = 0
? = 1
? = 2
? = 10
----
NULL
