# Generated by:
#     target/debug/noria-logictest permute --compare-to mysql://root:noria@127.1/noria -d 3 -o logictests/generated/mysql/ --only range_param --random --include-deletes --rows-per-table 10 --subquery-depth 1 --overwrite-tests

statement ok
CREATE TABLE `table_1` (`column_3` INT, `column_1` INT, `column_2` INT, `column_4` INT, PRIMARY KEY (`column_4`))


statement ok
CREATE TABLE `table_2` (`column_1` INT, `column_2` INT, `column_3` INT, PRIMARY KEY (`column_3`))


statement ok
CREATE TABLE `table_3` (`column_2` INT, `column_3` INT, `column_1` INT, PRIMARY KEY (`column_3`))


statement ok
INSERT INTO `table_1` (`column_3`, `column_1`, `column_2`, `column_4`) VALUES (-2037707542, 505963278, 1820785464, 0), (888271984, 1970821798, -2129470020, 1), (-2139687687, 1063220332, 1541026136, 2), (967788120, 1451862311, 460871560, 3), (-462674049, 301327935, -2016800697, 4), (1716030785, -429846457, -673792164, 5), (1471331910, -685426961, 1877169175, 6), (-166786101, 1604588641, 912717663, 7), (1293593697, -969798799, 1070783152, 8), (825922092, -2133480383, 660968938, 9)


statement ok
INSERT INTO `table_2` (`column_1`, `column_2`, `column_3`) VALUES (-170491762, 1033766304, 0), (1823337616, 49741122, 1), (1783565621, 1847649174, 2), (980425388, 1343555482, 3), (-1592233244, -835401463, 4), (787525520, 1134095328, 5), (999590374, 433345018, 6), (-1610591425, 1654096260, 7), (-2130190907, 712562163, 8), (-2104602310, 627062411, 9)


statement ok
INSERT INTO `table_3` (`column_2`, `column_3`, `column_1`) VALUES (1978782689, 0, 958438048), (-2016009502, 1, 2145639155), (-1581452139, 2, 1708811851), (-1907424271, 3, 1019885133), (623120090, 4, -1418054981), (132094970, 5, 95112391), (1619993428, 6, 1677480430), (2066192340, 7, 1518794651), (-409063872, 8, 1449541724), (-356200130, 9, 1586925038)


query  rowsort
SELECT `table_1`.`column_2` AS `alias_1`, `table_2`.`column_2` AS `alias_2` FROM `table_1` INNER JOIN `table_2` ON (`table_1`.`column_1` = `table_2`.`column_1`)
----


query  rowsort
SELECT `table_1`.`column_2` AS `alias_1` FROM `table_1` WHERE (`table_1`.`column_2` > ?)
? = 10
----
1070783152
1541026136
1820785464
1877169175
460871560
660968938
912717663

query  rowsort
SELECT `table_1`.`column_3` AS `alias_1`, `table_3`.`column_2` AS `alias_2` FROM `table_1` INNER JOIN `table_3` ON (`table_1`.`column_2` = `table_3`.`column_1`) WHERE (`table_1`.`column_3` > ?)
? = 10
----


statement ok
DELETE FROM `table_1` WHERE (`column_4` = 0)


statement ok
DELETE FROM `table_1` WHERE (`column_4` = 1)


statement ok
DELETE FROM `table_1` WHERE (`column_4` = 2)


statement ok
DELETE FROM `table_1` WHERE (`column_4` = 3)


statement ok
DELETE FROM `table_1` WHERE (`column_4` = 4)


statement ok
DELETE FROM `table_2` WHERE (`column_3` = 0)


statement ok
DELETE FROM `table_2` WHERE (`column_3` = 1)


statement ok
DELETE FROM `table_2` WHERE (`column_3` = 2)


statement ok
DELETE FROM `table_2` WHERE (`column_3` = 3)


statement ok
DELETE FROM `table_2` WHERE (`column_3` = 4)


statement ok
DELETE FROM `table_3` WHERE (`column_3` = 0)


statement ok
DELETE FROM `table_3` WHERE (`column_3` = 1)


statement ok
DELETE FROM `table_3` WHERE (`column_3` = 2)


statement ok
DELETE FROM `table_3` WHERE (`column_3` = 3)


statement ok
DELETE FROM `table_3` WHERE (`column_3` = 4)


query  rowsort
SELECT `table_1`.`column_2` AS `alias_1`, `table_2`.`column_2` AS `alias_2` FROM `table_1` INNER JOIN `table_2` ON (`table_1`.`column_1` = `table_2`.`column_1`)
----


query  rowsort
SELECT `table_1`.`column_2` AS `alias_1` FROM `table_1` WHERE (`table_1`.`column_2` > ?)
? = 10
----
1070783152
1877169175
660968938
912717663

query  rowsort
SELECT `table_1`.`column_3` AS `alias_1`, `table_3`.`column_2` AS `alias_2` FROM `table_1` INNER JOIN `table_3` ON (`table_1`.`column_2` = `table_3`.`column_1`) WHERE (`table_1`.`column_3` > ?)
? = 10
----

