# Generated by:
#     target/debug/noria-logictest permute --compare-to mysql://root:noria@127.1/noria -d 3 -o logictests/generated/mysql/ --only range_param --random --include-deletes --rows-per-table 10 --subquery-depth 1

statement ok
CREATE TABLE `table_2` (`column_1` INT, `column_5` INT, `column_2` INT, `column_4` INT, `column_6` INT, `column_3` INT, PRIMARY KEY (`column_6`))


statement ok
CREATE TABLE `table_1` (`column_5` INT, `column_2` INT, `column_3` INT, `column_6` INT, `column_1` INT, `column_4` INT, PRIMARY KEY (`column_6`))


statement ok
CREATE TABLE `table_4` (`column_2` INT, `column_3` INT, `column_1` INT, PRIMARY KEY (`column_3`))


statement ok
CREATE TABLE `table_5` (`column_2` INT, `column_3` INT, `column_1` INT, PRIMARY KEY (`column_3`))


statement ok
CREATE TABLE `table_3` (`column_1` INT, `column_4` INT, `column_3` INT, `column_2` INT, PRIMARY KEY (`column_4`))


statement ok
INSERT INTO `table_2` (`column_1`, `column_5`, `column_2`, `column_4`, `column_6`, `column_3`) VALUES (204487392, 1858821465, 121599453, -1972127602, 0, 87521876), (-1685086519, 1010201393, -1024363940, 1141851391, 1, 944966669), (863814792, -1537810014, 1161989427, -405302439, 2, 1884957722), (1097829835, 30451514, -959073542, -930582762, 3, -1737009451), (1777513674, -1701853678, -2135146385, -104015841, 4, -1501347502), (354232520, 1033158808, -1252898387, -272011792, 5, 1952158542), (1827761714, 1410320459, 1003225736, 1907146599, 6, -983432508), (-1716937737, 1892296210, -657493340, -871090131, 7, 511784776), (688833502, 1741703704, -1471452887, -1012630966, 8, 1764083013), (-965589344, 1082834032, -455125894, -1986986897, 9, 2115636078)


statement ok
INSERT INTO `table_1` (`column_5`, `column_2`, `column_3`, `column_6`, `column_1`, `column_4`) VALUES (293037473, -1413914192, -846065726, 0, -928721206, 1833594080), (1958896045, 658853317, 318044611, 1, -810305419, -245305254), (-693275224, -1888641726, -1754675178, 2, 547962514, 644277275), (2066167717, -1090703874, 1824548855, 3, 1713854041, 23185795), (-1680044317, -766505505, 769170168, 4, 501204850, 543973209), (1505010967, 732905975, 120152802, 5, -604433902, 361291207), (-26727115, 1423826715, -771686491, 6, 1848040140, 1513035285), (1999860153, 188267144, -1665161262, 7, 653617190, 1943233435), (1330061485, 1257970590, 727735258, 8, -1750872072, -1101145726), (-1845509822, 714273247, 244175029, 9, 332915484, 436302131)


statement ok
INSERT INTO `table_4` (`column_2`, `column_3`, `column_1`) VALUES (1302201554, 0, 1584561133), (-1950239554, 1, -1328666393), (1654357029, 2, -1824583942), (335165030, 3, -258321581), (-811213727, 4, 1358568093), (473338506, 5, 1974690907), (1058300149, 6, 1180992384), (-2123095669, 7, -163853748), (2041257585, 8, -2104191545), (-156317312, 9, -685177044)


statement ok
INSERT INTO `table_5` (`column_2`, `column_3`, `column_1`) VALUES (-1302521221, 0, -1931161261), (1856509026, 1, -1904009115), (1896720250, 2, -616181909), (-592801626, 3, 289071193), (-1071175857, 4, -1517826152), (306760005, 5, -56059428), (1346652409, 6, -1565878199), (1187158714, 7, 2142840883), (1275644764, 8, -695716062), (240040605, 9, 1354697000)


statement ok
INSERT INTO `table_3` (`column_1`, `column_4`, `column_3`, `column_2`) VALUES (752942886, 0, 2141304686, -1049429358), (781876638, 1, 619195410, -696766526), (448662972, 2, 428366970, -205600072), (1816396301, 3, 1016792473, 801839274), (-1053562296, 4, 1056279053, -1991897379), (1157088393, 5, 468251382, 1038913511), (1875875546, 6, -1464239113, 395184787), (1707167630, 7, -1372865697, 171682901), (-1022570131, 8, 467447781, -35192753), (-1393459944, 9, -1689419730, -480463812)


query  rowsort
SELECT `table_1`.`column_2` AS `alias_1`, `table_2`.`column_2` AS `alias_2` FROM `table_1` INNER JOIN `table_2` ON (`table_1`.`column_1` = `table_2`.`column_1`)
----


query  rowsort
SELECT min(`table_1`.`column_3`) AS `alias_1` FROM `table_1`
----
-1754675178

query  rowsort
SELECT `table_1`.`column_1` AS `alias_1` FROM `table_1` WHERE (`table_1`.`column_1` > ?)
? = 10
----
1713854041
1848040140
332915484
501204850
547962514
653617190

query  rowsort
SELECT `table_1`.`column_4` AS `alias_1`, `table_3`.`column_2` AS `alias_2`, min(`table_1`.`column_5`) AS `alias_3` FROM `table_1` INNER JOIN `table_3` ON (`table_1`.`column_1` = `table_3`.`column_1`) GROUP BY `table_1`.`column_4`, `table_3`.`column_2`
----


query  rowsort
SELECT `table_3`.`column_3` AS `alias_1`, `table_4`.`column_2` AS `alias_2` FROM `table_3` INNER JOIN `table_4` ON (`table_3`.`column_1` = `table_4`.`column_1`) WHERE (`table_3`.`column_3` > ?)
? = 10
----


query  rowsort
SELECT min(`table_2`.`column_3`) AS `alias_1` FROM `table_2` WHERE (`table_2`.`column_3` > ?)
? = 10
----
87521876

query  rowsort
SELECT `table_2`.`column_4` AS `alias_1`, `table_5`.`column_2` AS `alias_2`, min(`table_2`.`column_5`) AS `alias_3` FROM `table_2` INNER JOIN `table_5` ON (`table_2`.`column_3` = `table_5`.`column_1`) WHERE (`table_2`.`column_1` > ?) GROUP BY `table_2`.`column_4`, `table_5`.`column_2`
? = 10
----


statement ok
DELETE FROM `table_2` WHERE (`column_6` = 0)


statement ok
DELETE FROM `table_2` WHERE (`column_6` = 1)


statement ok
DELETE FROM `table_2` WHERE (`column_6` = 2)


statement ok
DELETE FROM `table_2` WHERE (`column_6` = 3)


statement ok
DELETE FROM `table_2` WHERE (`column_6` = 4)


statement ok
DELETE FROM `table_1` WHERE (`column_6` = 0)


statement ok
DELETE FROM `table_1` WHERE (`column_6` = 1)


statement ok
DELETE FROM `table_1` WHERE (`column_6` = 2)


statement ok
DELETE FROM `table_1` WHERE (`column_6` = 3)


statement ok
DELETE FROM `table_1` WHERE (`column_6` = 4)


statement ok
DELETE FROM `table_4` WHERE (`column_3` = 0)


statement ok
DELETE FROM `table_4` WHERE (`column_3` = 1)


statement ok
DELETE FROM `table_4` WHERE (`column_3` = 2)


statement ok
DELETE FROM `table_4` WHERE (`column_3` = 3)


statement ok
DELETE FROM `table_4` WHERE (`column_3` = 4)


statement ok
DELETE FROM `table_5` WHERE (`column_3` = 0)


statement ok
DELETE FROM `table_5` WHERE (`column_3` = 1)


statement ok
DELETE FROM `table_5` WHERE (`column_3` = 2)


statement ok
DELETE FROM `table_5` WHERE (`column_3` = 3)


statement ok
DELETE FROM `table_5` WHERE (`column_3` = 4)


statement ok
DELETE FROM `table_3` WHERE (`column_4` = 0)


statement ok
DELETE FROM `table_3` WHERE (`column_4` = 1)


statement ok
DELETE FROM `table_3` WHERE (`column_4` = 2)


statement ok
DELETE FROM `table_3` WHERE (`column_4` = 3)


statement ok
DELETE FROM `table_3` WHERE (`column_4` = 4)


query  rowsort
SELECT `table_1`.`column_2` AS `alias_1`, `table_2`.`column_2` AS `alias_2` FROM `table_1` INNER JOIN `table_2` ON (`table_1`.`column_1` = `table_2`.`column_1`)
----


query  rowsort
SELECT min(`table_1`.`column_3`) AS `alias_1` FROM `table_1`
----
-1665161262

query  rowsort
SELECT `table_1`.`column_1` AS `alias_1` FROM `table_1` WHERE (`table_1`.`column_1` > ?)
? = 10
----
1848040140
332915484
653617190

query  rowsort
SELECT `table_1`.`column_4` AS `alias_1`, `table_3`.`column_2` AS `alias_2`, min(`table_1`.`column_5`) AS `alias_3` FROM `table_1` INNER JOIN `table_3` ON (`table_1`.`column_1` = `table_3`.`column_1`) GROUP BY `table_1`.`column_4`, `table_3`.`column_2`
----


query  rowsort
SELECT `table_3`.`column_3` AS `alias_1`, `table_4`.`column_2` AS `alias_2` FROM `table_3` INNER JOIN `table_4` ON (`table_3`.`column_1` = `table_4`.`column_1`) WHERE (`table_3`.`column_3` > ?)
? = 10
----


query  rowsort
SELECT min(`table_2`.`column_3`) AS `alias_1` FROM `table_2` WHERE (`table_2`.`column_3` > ?)
? = 10
----
511784776

query  rowsort
SELECT `table_2`.`column_4` AS `alias_1`, `table_5`.`column_2` AS `alias_2`, min(`table_2`.`column_5`) AS `alias_3` FROM `table_2` INNER JOIN `table_5` ON (`table_2`.`column_3` = `table_5`.`column_1`) WHERE (`table_2`.`column_1` > ?) GROUP BY `table_2`.`column_4`, `table_5`.`column_2`
? = 10
----

