# Generated by:
#     target/debug/noria-logictest permute --compare-to mysql://root:noria@127.1/noria -d 3 -o logictests/generated/mysql/ --only range_param --random --include-deletes --rows-per-table 10 --subquery-depth 1

statement ok
CREATE TABLE `table_4` (`column_1` INT, `column_4` INT, `column_3` INT, `column_2` INT, PRIMARY KEY (`column_4`))


statement ok
CREATE TABLE `table_5` (`column_1` INT, `column_3` INT, `column_2` INT, PRIMARY KEY (`column_3`))


statement ok
CREATE TABLE `table_2` (`column_3` INT, `column_1` INT, `column_2` INT, PRIMARY KEY (`column_3`))


statement ok
CREATE TABLE `table_1` (`column_4` INT, `column_3` INT, `column_2` INT, `column_1` INT, `column_5` INT, PRIMARY KEY (`column_5`))


statement ok
CREATE TABLE `table_3` (`column_3` INT, `column_1` INT, `column_2` INT, PRIMARY KEY (`column_3`))


statement ok
INSERT INTO `table_4` (`column_1`, `column_4`, `column_3`, `column_2`) VALUES (-1726476340, 0, -1425980166, -593453772), (-1292395840, 1, 2139091153, -915907330), (1718886778, 2, -317516117, -1448504027), (1960429223, 3, 1558332064, 1739809514), (-687648677, 4, 570300618, -2077742120), (-681003472, 5, -1235721841, 158307610), (-1244219177, 6, -1637745417, -2037131639), (-871534000, 7, -810670830, -1499232501), (-651661887, 8, -1055847927, -1562277590), (-1209898652, 9, -793200315, 1635729740)


statement ok
INSERT INTO `table_5` (`column_1`, `column_3`, `column_2`) VALUES (-1800821272, 0, 1668915733), (909179002, 1, -1861054806), (1052982032, 2, -1354998372), (1493560312, 3, -1921974055), (-1306219163, 4, 1313245879), (200633457, 5, -2072009581), (-893872039, 6, -1097081366), (66942469, 7, -1144190182), (-971595252, 8, 882356471), (135564296, 9, 368640492)


statement ok
INSERT INTO `table_2` (`column_3`, `column_1`, `column_2`) VALUES (0, 1005849914, -1293371997), (1, -125957648, 1978167056), (2, -1165716051, -1023074539), (3, 1953496318, -311964580), (4, 1990871212, -1738085392), (5, -94351288, 1295571622), (6, -2131526279, -196062935), (7, 1951900565, 1062191563), (8, 1981010827, 733505575), (9, 513317751, -386344868)


statement ok
INSERT INTO `table_1` (`column_4`, `column_3`, `column_2`, `column_1`, `column_5`) VALUES (1032158367, 1207187553, 1176610996, 1663982982, 0), (397530686, 1361439964, 1334865144, -631151557, 1), (1077176557, -136845859, 1726993681, -1474068667, 2), (1463546418, -695361632, -26630424, -1416438034, 3), (-1212228550, 1324540517, 560244146, 1289130937, 4), (-1233513560, 990277430, -1623587890, -1479170316, 5), (-1574884744, 617945823, -1804807520, 1181566623, 6), (-234188258, -1644018779, -385591591, 300273579, 7), (1361990969, -1871147763, 1242246433, -1420052748, 8), (1183582497, -1594320716, -868010054, -830049642, 9)


statement ok
INSERT INTO `table_3` (`column_3`, `column_1`, `column_2`) VALUES (0, 583953204, 211428513), (1, 1878381818, 1568800260), (2, -1850944994, -1628006818), (3, -1413176918, 1010746785), (4, 507526438, 2069945913), (5, 1383712174, -1434376656), (6, 1452687910, -729963252), (7, 659667156, -1710200125), (8, -631167544, -967507470), (9, -61993953, 751217512)


query  rowsort
SELECT `table_1`.`column_2` AS `alias_1`, `table_2`.`column_2` AS `alias_2` FROM `table_1` INNER JOIN `table_2` ON (`table_1`.`column_1` = `table_2`.`column_1`)
----


query  rowsort
SELECT `table_1`.`column_1` AS `alias_1` FROM `table_1` WHERE ((`table_1`.`column_1` = ?) AND (`table_1`.`column_1` = ?))
? = 1
? = 1
----


query  rowsort
SELECT `table_1`.`column_1` AS `alias_1` FROM `table_1` WHERE (`table_1`.`column_1` > ?)
? = 10
----
1181566623
1289130937
1663982982
300273579

query  rowsort
SELECT `table_1`.`column_3` AS `alias_1`, `table_3`.`column_2` AS `alias_2` FROM `table_1` INNER JOIN `table_3` ON (`table_1`.`column_1` = `table_3`.`column_1`) WHERE ((`table_1`.`column_1` = ?) AND (`table_1`.`column_1` = ?))
? = 1
? = 1
----


query  rowsort
SELECT `table_1`.`column_4` AS `alias_1`, `table_4`.`column_2` AS `alias_2` FROM `table_1` INNER JOIN `table_4` ON (`table_1`.`column_1` = `table_4`.`column_1`) WHERE (`table_1`.`column_4` > ?)
? = 10
----


query  rowsort
SELECT `table_4`.`column_1` AS `alias_1` FROM `table_4` WHERE (((`table_4`.`column_1` = ?) AND (`table_4`.`column_1` = ?)) AND (`table_4`.`column_1` > ?))
? = 1
? = 1
? = 10
----


query  rowsort
SELECT `table_4`.`column_3` AS `alias_1`, `table_5`.`column_2` AS `alias_2` FROM `table_4` INNER JOIN `table_5` ON (`table_4`.`column_1` = `table_5`.`column_1`) WHERE (((`table_4`.`column_1` = ?) AND (`table_4`.`column_1` = ?)) AND (`table_4`.`column_1` > ?))
? = 1
? = 1
? = 10
----


statement ok
DELETE FROM `table_4` WHERE (`column_4` = 0)


statement ok
DELETE FROM `table_4` WHERE (`column_4` = 1)


statement ok
DELETE FROM `table_4` WHERE (`column_4` = 2)


statement ok
DELETE FROM `table_4` WHERE (`column_4` = 3)


statement ok
DELETE FROM `table_4` WHERE (`column_4` = 4)


statement ok
DELETE FROM `table_5` WHERE (`column_3` = 0)


statement ok
DELETE FROM `table_5` WHERE (`column_3` = 1)


statement ok
DELETE FROM `table_5` WHERE (`column_3` = 2)


statement ok
DELETE FROM `table_5` WHERE (`column_3` = 3)


statement ok
DELETE FROM `table_5` WHERE (`column_3` = 4)


statement ok
DELETE FROM `table_2` WHERE (`column_3` = 0)


statement ok
DELETE FROM `table_2` WHERE (`column_3` = 1)


statement ok
DELETE FROM `table_2` WHERE (`column_3` = 2)


statement ok
DELETE FROM `table_2` WHERE (`column_3` = 3)


statement ok
DELETE FROM `table_2` WHERE (`column_3` = 4)


statement ok
DELETE FROM `table_1` WHERE (`column_5` = 0)


statement ok
DELETE FROM `table_1` WHERE (`column_5` = 1)


statement ok
DELETE FROM `table_1` WHERE (`column_5` = 2)


statement ok
DELETE FROM `table_1` WHERE (`column_5` = 3)


statement ok
DELETE FROM `table_1` WHERE (`column_5` = 4)


statement ok
DELETE FROM `table_3` WHERE (`column_3` = 0)


statement ok
DELETE FROM `table_3` WHERE (`column_3` = 1)


statement ok
DELETE FROM `table_3` WHERE (`column_3` = 2)


statement ok
DELETE FROM `table_3` WHERE (`column_3` = 3)


statement ok
DELETE FROM `table_3` WHERE (`column_3` = 4)


query  rowsort
SELECT `table_1`.`column_2` AS `alias_1`, `table_2`.`column_2` AS `alias_2` FROM `table_1` INNER JOIN `table_2` ON (`table_1`.`column_1` = `table_2`.`column_1`)
----


query  rowsort
SELECT `table_1`.`column_1` AS `alias_1` FROM `table_1` WHERE ((`table_1`.`column_1` = ?) AND (`table_1`.`column_1` = ?))
? = 1
? = 1
----


query  rowsort
SELECT `table_1`.`column_1` AS `alias_1` FROM `table_1` WHERE (`table_1`.`column_1` > ?)
? = 10
----
1181566623
300273579

query  rowsort
SELECT `table_1`.`column_3` AS `alias_1`, `table_3`.`column_2` AS `alias_2` FROM `table_1` INNER JOIN `table_3` ON (`table_1`.`column_1` = `table_3`.`column_1`) WHERE ((`table_1`.`column_1` = ?) AND (`table_1`.`column_1` = ?))
? = 1
? = 1
----


query  rowsort
SELECT `table_1`.`column_4` AS `alias_1`, `table_4`.`column_2` AS `alias_2` FROM `table_1` INNER JOIN `table_4` ON (`table_1`.`column_1` = `table_4`.`column_1`) WHERE (`table_1`.`column_4` > ?)
? = 10
----


query  rowsort
SELECT `table_4`.`column_1` AS `alias_1` FROM `table_4` WHERE (((`table_4`.`column_1` = ?) AND (`table_4`.`column_1` = ?)) AND (`table_4`.`column_1` > ?))
? = 1
? = 1
? = 10
----


query  rowsort
SELECT `table_4`.`column_3` AS `alias_1`, `table_5`.`column_2` AS `alias_2` FROM `table_4` INNER JOIN `table_5` ON (`table_4`.`column_1` = `table_5`.`column_1`) WHERE (((`table_4`.`column_1` = ?) AND (`table_4`.`column_1` = ?)) AND (`table_4`.`column_1` > ?))
? = 1
? = 1
? = 10
----

