# Generated by:
#     target/debug/noria-logictest permute --compare-to mysql://root:noria@127.1/noria -d 3 -o logictests/generated/mysql/ --only range_param --random --include-deletes --rows-per-table 10 --subquery-depth 1

statement ok
CREATE TABLE `table_5` (`column_2` INT, `column_1` INT, `column_3` INT, PRIMARY KEY (`column_3`))


statement ok
CREATE TABLE `table_1` (`column_4` INT, `column_1` INT, `column_8` INT, `column_9` INT, `column_2` INT, `column_5` INT, `column_3` INT, `column_6` INT, `column_7` INT, PRIMARY KEY (`column_9`))


statement ok
CREATE TABLE `table_2` (`column_2` INT, `column_1` INT, `column_3` INT, PRIMARY KEY (`column_3`))


statement ok
CREATE TABLE `table_4` (`column_1` INT, `column_2` INT, `column_3` INT, PRIMARY KEY (`column_3`))


statement ok
CREATE TABLE `table_3` (`column_4` INT, `column_3` INT, `column_2` INT, `column_1` INT, PRIMARY KEY (`column_4`))


statement ok
INSERT INTO `table_5` (`column_2`, `column_1`, `column_3`) VALUES (584977337, -348774015, 0), (-399942264, 1227401614, 1), (-1159318134, 755474739, 2), (1000604524, -1400708260, 3), (560962846, -1351766878, 4), (-1741211698, 992666259, 5), (-99433323, -1036195077, 6), (1413143555, -1340398184, 7), (1146900001, 744871968, 8), (511596314, -1459579983, 9)


statement ok
INSERT INTO `table_1` (`column_4`, `column_1`, `column_8`, `column_9`, `column_2`, `column_5`, `column_3`, `column_6`, `column_7`) VALUES (-603457901, -712491377, 1136782784, 0, -1563433836, 1763162340, -1055657394, 530284041, 403203133), (495433283, 398861676, 1080741244, 1, 1702827035, -1903937869, 39093836, -937822077, -692057497), (-1209559424, -385186448, 1523065895, 2, 809966778, -791581860, -1077584614, 397030448, -1242104413), (1549320434, 105579695, -618170731, 3, 563610477, -1062859446, 80218093, -189455766, 1266908602), (-1109450202, -867613121, 518894530, 4, 2119487034, -221665625, 1943482240, -1836398094, 1125492065), (78271604, -2075358839, 912869739, 5, 1365038268, 543680711, -933267390, 1566601723, -948720500), (531503861, 1582548808, -940920369, 6, -1296836885, -272255433, 1194336553, -111981850, -1128578460), (-408001217, 631910789, -1746256148, 7, -1499762354, -70757811, -798170479, -988625166, -162848138), (1761665060, 1312978413, 719310782, 8, 265119310, 148342041, 1160053905, -784643196, -1117901530), (2131736556, 1332245805, 2082162910, 9, -443154582, -1748164199, 1462084412, 1688688830, -380424959)


statement ok
INSERT INTO `table_2` (`column_2`, `column_1`, `column_3`) VALUES (584270389, 414394362, 0), (-1819981723, -233135268, 1), (-1570526716, -1362022914, 2), (1519027282, 1104138563, 3), (-976369658, 2086543440, 4), (-1731364948, 1318756673, 5), (-2115710038, 1921041841, 6), (-1671157427, 553918710, 7), (-1532656664, 884324675, 8), (-902334873, 1077891571, 9)


statement ok
INSERT INTO `table_4` (`column_1`, `column_2`, `column_3`) VALUES (-1409091720, -1273735143, 0), (1136423817, 1350206398, 1), (-1651683368, -2131577614, 2), (-1947368416, -657548234, 3), (-1232349700, 500190359, 4), (-1178010625, 80292396, 5), (-1542192776, 1714099275, 6), (1161064519, 1648435161, 7), (369680265, -1206342492, 8), (714221363, 1517527376, 9)


statement ok
INSERT INTO `table_3` (`column_4`, `column_3`, `column_2`, `column_1`) VALUES (0, 1149989691, 1889902177, -1215961464), (1, -1503925144, 1479093084, -409951310), (2, -949378428, -1263206453, -982470229), (3, 1969331699, -1068631701, 320616596), (4, 136825261, -74397276, 169757683), (5, 906741767, 1658719986, 1661269303), (6, 1302514003, -981020022, 1465592643), (7, 351245666, -274200126, -279048368), (8, 1163529544, -1509103110, -995899642), (9, -522437831, -1975520845, -1326424485)


query  rowsort
SELECT `table_1`.`column_2` AS `alias_1`, `table_2`.`column_2` AS `alias_2` FROM `table_1` INNER JOIN `table_2` ON (`table_1`.`column_1` = `table_2`.`column_1`)
----


query  rowsort
SELECT sum(distinct `table_1`.`column_3`) AS `alias_1` FROM `table_1`
----
2014589162

query  rowsort
SELECT `table_1`.`column_2` AS `alias_1` FROM `table_1` WHERE (`table_1`.`column_2` > ?)
? = 10
----
1365038268
1702827035
2119487034
265119310
563610477
809966778

query  rowsort
SELECT `table_1`.`column_4` AS `alias_1`, `table_3`.`column_2` AS `alias_2`, sum(distinct `table_1`.`column_5`) AS `alias_3` FROM `table_1` INNER JOIN `table_3` ON (`table_1`.`column_2` = `table_3`.`column_1`) GROUP BY `table_1`.`column_4`, `table_3`.`column_2`
----


query  rowsort
SELECT `table_3`.`column_3` AS `alias_1`, `table_4`.`column_2` AS `alias_2` FROM `table_3` INNER JOIN `table_4` ON (`table_3`.`column_2` = `table_4`.`column_1`) WHERE (`table_3`.`column_3` > ?)
? = 10
----


query  rowsort
SELECT sum(distinct `table_1`.`column_6`) AS `alias_1` FROM `table_1` WHERE (`table_1`.`column_4` > ?)
? = 10
----
1231387664

query  rowsort
SELECT `table_1`.`column_7` AS `alias_1`, `table_5`.`column_2` AS `alias_2`, sum(distinct `table_1`.`column_8`) AS `alias_3` FROM `table_1` INNER JOIN `table_5` ON (`table_1`.`column_4` = `table_5`.`column_1`) WHERE (`table_1`.`column_4` > ?) GROUP BY `table_1`.`column_7`, `table_5`.`column_2`
? = 10
----


statement ok
DELETE FROM `table_5` WHERE (`column_3` = 0)


statement ok
DELETE FROM `table_5` WHERE (`column_3` = 1)


statement ok
DELETE FROM `table_5` WHERE (`column_3` = 2)


statement ok
DELETE FROM `table_5` WHERE (`column_3` = 3)


statement ok
DELETE FROM `table_5` WHERE (`column_3` = 4)


statement ok
DELETE FROM `table_1` WHERE (`column_9` = 0)


statement ok
DELETE FROM `table_1` WHERE (`column_9` = 1)


statement ok
DELETE FROM `table_1` WHERE (`column_9` = 2)


statement ok
DELETE FROM `table_1` WHERE (`column_9` = 3)


statement ok
DELETE FROM `table_1` WHERE (`column_9` = 4)


statement ok
DELETE FROM `table_2` WHERE (`column_3` = 0)


statement ok
DELETE FROM `table_2` WHERE (`column_3` = 1)


statement ok
DELETE FROM `table_2` WHERE (`column_3` = 2)


statement ok
DELETE FROM `table_2` WHERE (`column_3` = 3)


statement ok
DELETE FROM `table_2` WHERE (`column_3` = 4)


statement ok
DELETE FROM `table_4` WHERE (`column_3` = 0)


statement ok
DELETE FROM `table_4` WHERE (`column_3` = 1)


statement ok
DELETE FROM `table_4` WHERE (`column_3` = 2)


statement ok
DELETE FROM `table_4` WHERE (`column_3` = 3)


statement ok
DELETE FROM `table_4` WHERE (`column_3` = 4)


statement ok
DELETE FROM `table_3` WHERE (`column_4` = 0)


statement ok
DELETE FROM `table_3` WHERE (`column_4` = 1)


statement ok
DELETE FROM `table_3` WHERE (`column_4` = 2)


statement ok
DELETE FROM `table_3` WHERE (`column_4` = 3)


statement ok
DELETE FROM `table_3` WHERE (`column_4` = 4)


query  rowsort
SELECT `table_1`.`column_2` AS `alias_1`, `table_2`.`column_2` AS `alias_2` FROM `table_1` INNER JOIN `table_2` ON (`table_1`.`column_1` = `table_2`.`column_1`)
----


query  rowsort
SELECT sum(distinct `table_1`.`column_3`) AS `alias_1` FROM `table_1`
----
2085037001

query  rowsort
SELECT `table_1`.`column_2` AS `alias_1` FROM `table_1` WHERE (`table_1`.`column_2` > ?)
? = 10
----
1365038268
265119310

query  rowsort
SELECT `table_1`.`column_4` AS `alias_1`, `table_3`.`column_2` AS `alias_2`, sum(distinct `table_1`.`column_5`) AS `alias_3` FROM `table_1` INNER JOIN `table_3` ON (`table_1`.`column_2` = `table_3`.`column_1`) GROUP BY `table_1`.`column_4`, `table_3`.`column_2`
----


query  rowsort
SELECT `table_3`.`column_3` AS `alias_1`, `table_4`.`column_2` AS `alias_2` FROM `table_3` INNER JOIN `table_4` ON (`table_3`.`column_2` = `table_4`.`column_1`) WHERE (`table_3`.`column_3` > ?)
? = 10
----


query  rowsort
SELECT sum(distinct `table_1`.`column_6`) AS `alias_1` FROM `table_1` WHERE (`table_1`.`column_4` > ?)
? = 10
----
2358665507

query  rowsort
SELECT `table_1`.`column_7` AS `alias_1`, `table_5`.`column_2` AS `alias_2`, sum(distinct `table_1`.`column_8`) AS `alias_3` FROM `table_1` INNER JOIN `table_5` ON (`table_1`.`column_4` = `table_5`.`column_1`) WHERE (`table_1`.`column_4` > ?) GROUP BY `table_1`.`column_7`, `table_5`.`column_2`
? = 10
----

