# Generated by:
#     target/debug/noria-logictest permute -d 3 -o logictests/generated/mysql --only in_parameter --compare-to mysql://root:noria@localhost/mysql --subquery-depth 1 --rows-per-table 5 --include-deletes --overwrite-tests

statement ok
CREATE TABLE table_4 (column_3 INT, column_6 INT, column_4 INT, column_2 INT, column_5 INT, column_1 INT, PRIMARY KEY (column_6))


statement ok
CREATE TABLE table_5 (column_2 INT, column_3 INT, column_1 INT, PRIMARY KEY (column_3))


statement ok
CREATE TABLE table_6 (column_5 INT, column_1 INT, column_2 INT, column_4 INT, column_3 INT, PRIMARY KEY (column_5))


statement ok
CREATE TABLE table_3 (column_2 INT, column_1 INT, column_3 INT, PRIMARY KEY (column_3))


statement ok
CREATE TABLE table_7 (column_1 INT, column_2 INT, column_3 INT, PRIMARY KEY (column_3))


statement ok
CREATE TABLE table_9 (column_1 INT, column_2 INT, column_3 INT, PRIMARY KEY (column_3))


statement ok
CREATE TABLE table_1 (column_3 INT, column_5 INT, column_2 INT, column_1 INT, column_4 INT, PRIMARY KEY (column_5))


statement ok
CREATE TABLE table_2 (column_2 INT, column_3 INT, column_1 INT, PRIMARY KEY (column_3))


statement ok
CREATE TABLE table_8 (column_1 INT, column_2 INT, column_3 INT, PRIMARY KEY (column_3))


statement ok
INSERT INTO table_4 (column_3, column_6, column_4, column_2, column_5, column_1) VALUES (1, 0, 1, 0, 1, 1), (1, 1, 1, 1, 1, 1), (2, 2, 1, 1, 1, 1), (1, 3, 1, 1, 1, 1), (0, 4, 1, 2, 1, 1)


statement ok
INSERT INTO table_5 (column_2, column_3, column_1) VALUES (1, 0, 1), (1, 1, 1), (1, 2, 1), (1, 3, 1), (1, 4, 1)


statement ok
INSERT INTO table_6 (column_5, column_1, column_2, column_4, column_3) VALUES (0, 1, 2, 1, 1), (1, 1, 1, 1, 1), (2, 2, 1, 1, 1), (3, 1, 1, 1, 1), (4, 0, 0, 1, 1)


statement ok
INSERT INTO table_3 (column_2, column_1, column_3) VALUES (1, 1, 0), (1, 1, 1), (1, 1, 2), (1, 1, 3), (1, 1, 4)


statement ok
INSERT INTO table_7 (column_1, column_2, column_3) VALUES (1, 1, 0), (1, 1, 1), (1, 1, 2), (1, 1, 3), (1, 1, 4)


statement ok
INSERT INTO table_9 (column_1, column_2, column_3) VALUES (1, 1, 0), (1, 1, 1), (1, 1, 2), (1, 1, 3), (1, 1, 4)


statement ok
INSERT INTO table_1 (column_3, column_5, column_2, column_1, column_4) VALUES (1, 0, 1, 1, 1), (1, 1, 1, 1, 1), (1, 2, 1, 2, 1), (1, 3, 1, 1, 1), (1, 4, 1, 0, 1)


statement ok
INSERT INTO table_2 (column_2, column_3, column_1) VALUES (1, 0, 1), (1, 1, 1), (1, 2, 1), (1, 3, 1), (1, 4, 1)


statement ok
INSERT INTO table_8 (column_1, column_2, column_3) VALUES (1, 1, 0), (1, 1, 1), (1, 1, 2), (1, 1, 3), (1, 1, 4)


query  rowsort
SELECT table_1.column_2 AS alias_1, table_2.column_2 AS alias_2 FROM table_1 INNER JOIN table_2 ON (table_1.column_1 = table_2.column_1)
----
30 values hashing to 56a22a5394edccfc958048b005afa27b

query  nosort
SELECT table_1.column_1 AS alias_1 FROM table_1 ORDER BY table_1.column_1 ASC LIMIT 10
----
0
1
1
1
2

query  nosort
SELECT table_1.column_1 AS alias_1 FROM table_1 ORDER BY table_1.column_1 DESC LIMIT 10
----
2
1
1
1
0

query  rowsort
SELECT table_1.column_1 AS alias_1 FROM table_1 WHERE table_1.column_1 IN (?, ?, ?)
? = 0
? = 1
? = 2
----
0
1
1
1
2

query  nosort
SELECT table_1.column_3 AS alias_1, table_3.column_2 AS alias_2 FROM table_1 INNER JOIN table_3 ON (table_1.column_1 = table_3.column_1) ORDER BY table_1.column_1 ASC LIMIT 10
----
1
1
1
1
1
1
1
1
1
1
1
1
1
1
1
1
1
1
1
1

query  nosort
SELECT table_1.column_4 AS alias_1, table_4.column_2 AS alias_2 FROM table_1 INNER JOIN table_4 ON (table_1.column_1 = table_4.column_1) ORDER BY table_1.column_3 DESC LIMIT 10
----
1
0
1
0
1
0
1
1
1
1
1
1
1
1
1
1
1
1
1
1

query  rowsort
SELECT table_4.column_3 AS alias_1, table_5.column_2 AS alias_2 FROM table_4 INNER JOIN table_5 ON (table_4.column_2 = table_5.column_1) WHERE table_4.column_2 IN (?, ?, ?)
? = 0
? = 1
? = 2
----
30 values hashing to d6a35598c9ef197171a2e1ca7598ccbd

query  nosort
SELECT table_4.column_2 AS alias_1 FROM table_4 ORDER BY table_4.column_2 DESC LIMIT 10
----
2
1
1
1
0

query  nosort
SELECT table_4.column_2 AS alias_1 FROM table_4 WHERE table_4.column_2 IN (?, ?, ?) ORDER BY table_4.column_2 ASC LIMIT 10
? = 0
? = 1
? = 2
----
0
1
1
1
2

query  nosort
SELECT table_4.column_2 AS alias_1 FROM table_4 WHERE table_4.column_2 IN (?, ?, ?) ORDER BY table_4.column_2 DESC LIMIT 10
? = 0
? = 1
? = 2
----
2
1
1
1
0

query  nosort
SELECT table_4.column_4 AS alias_1, table_6.column_2 AS alias_2 FROM table_4 INNER JOIN table_6 ON (table_4.column_2 = table_6.column_1) ORDER BY table_4.column_3 DESC LIMIT 10
----
1
2
1
1
1
1
1
2
1
2
1
1
1
1
1
1
1
1
1
0

query  nosort
SELECT table_6.column_3 AS alias_1, table_7.column_2 AS alias_2 FROM table_6 INNER JOIN table_7 ON (table_6.column_2 = table_7.column_1) WHERE table_6.column_2 IN (?, ?, ?) ORDER BY table_6.column_2 ASC LIMIT 10
? = 0
? = 1
? = 2
----
1
1
1
1
1
1
1
1
1
1
1
1
1
1
1
1
1
1
1
1

query  nosort
SELECT table_6.column_4 AS alias_1, table_8.column_2 AS alias_2 FROM table_6 INNER JOIN table_8 ON (table_6.column_2 = table_8.column_1) WHERE table_6.column_1 IN (?, ?, ?) ORDER BY table_6.column_1 DESC LIMIT 10
? = 0
? = 1
? = 2
----
1
1
1
1
1
1
1
1
1
1
1
1
1
1
1
1
1
1
1
1

query  nosort
SELECT table_4.column_3 AS alias_1 FROM table_4 WHERE table_4.column_3 IN (?, ?, ?) ORDER BY table_4.column_3 DESC LIMIT 10
? = 0
? = 1
? = 2
----
2
1
1
1
0

query  nosort
SELECT table_4.column_5 AS alias_1, table_9.column_2 AS alias_2 FROM table_4 INNER JOIN table_9 ON (table_4.column_3 = table_9.column_1) WHERE table_4.column_3 IN (?, ?, ?) ORDER BY table_4.column_3 DESC LIMIT 10
? = 0
? = 1
? = 2
----
1
1
1
1
1
1
1
1
1
1
1
1
1
1
1
1
1
1
1
1

statement ok
DELETE FROM table_4 WHERE (column_6 = 0)


statement ok
DELETE FROM table_4 WHERE (column_6 = 1)


statement ok
DELETE FROM table_5 WHERE (column_3 = 0)


statement ok
DELETE FROM table_5 WHERE (column_3 = 1)


statement ok
DELETE FROM table_6 WHERE (column_5 = 0)


statement ok
DELETE FROM table_6 WHERE (column_5 = 1)


statement ok
DELETE FROM table_3 WHERE (column_3 = 0)


statement ok
DELETE FROM table_3 WHERE (column_3 = 1)


statement ok
DELETE FROM table_7 WHERE (column_3 = 0)


statement ok
DELETE FROM table_7 WHERE (column_3 = 1)


statement ok
DELETE FROM table_9 WHERE (column_3 = 0)


statement ok
DELETE FROM table_9 WHERE (column_3 = 1)


statement ok
DELETE FROM table_1 WHERE (column_5 = 0)


statement ok
DELETE FROM table_1 WHERE (column_5 = 1)


statement ok
DELETE FROM table_2 WHERE (column_3 = 0)


statement ok
DELETE FROM table_2 WHERE (column_3 = 1)


statement ok
DELETE FROM table_8 WHERE (column_3 = 0)


statement ok
DELETE FROM table_8 WHERE (column_3 = 1)


query  rowsort
SELECT table_1.column_2 AS alias_1, table_2.column_2 AS alias_2 FROM table_1 INNER JOIN table_2 ON (table_1.column_1 = table_2.column_1)
----
1
1
1
1
1
1

query  nosort
SELECT table_1.column_1 AS alias_1 FROM table_1 ORDER BY table_1.column_1 ASC LIMIT 10
----
0
1
2

query  nosort
SELECT table_1.column_1 AS alias_1 FROM table_1 ORDER BY table_1.column_1 DESC LIMIT 10
----
2
1
0

query  rowsort
SELECT table_1.column_1 AS alias_1 FROM table_1 WHERE table_1.column_1 IN (?, ?, ?)
? = 0
? = 1
? = 2
----
0
1
2

query  nosort
SELECT table_1.column_3 AS alias_1, table_3.column_2 AS alias_2 FROM table_1 INNER JOIN table_3 ON (table_1.column_1 = table_3.column_1) ORDER BY table_1.column_1 ASC LIMIT 10
----
1
1
1
1
1
1

query  nosort
SELECT table_1.column_4 AS alias_1, table_4.column_2 AS alias_2 FROM table_1 INNER JOIN table_4 ON (table_1.column_1 = table_4.column_1) ORDER BY table_1.column_3 DESC LIMIT 10
----
1
1
1
1
1
2

query  rowsort
SELECT table_4.column_3 AS alias_1, table_5.column_2 AS alias_2 FROM table_4 INNER JOIN table_5 ON (table_4.column_2 = table_5.column_1) WHERE table_4.column_2 IN (?, ?, ?)
? = 0
? = 1
? = 2
----
1
1
1
1
1
1
2
1
2
1
2
1

query  nosort
SELECT table_4.column_2 AS alias_1 FROM table_4 ORDER BY table_4.column_2 DESC LIMIT 10
----
2
1
1

query  nosort
SELECT table_4.column_2 AS alias_1 FROM table_4 WHERE table_4.column_2 IN (?, ?, ?) ORDER BY table_4.column_2 ASC LIMIT 10
? = 0
? = 1
? = 2
----
1
1
2

query  nosort
SELECT table_4.column_2 AS alias_1 FROM table_4 WHERE table_4.column_2 IN (?, ?, ?) ORDER BY table_4.column_2 DESC LIMIT 10
? = 0
? = 1
? = 2
----
2
1
1

query  nosort
SELECT table_4.column_4 AS alias_1, table_6.column_2 AS alias_2 FROM table_4 INNER JOIN table_6 ON (table_4.column_2 = table_6.column_1) ORDER BY table_4.column_3 DESC LIMIT 10
----
1
1
1
1
1
1

query  nosort
SELECT table_6.column_3 AS alias_1, table_7.column_2 AS alias_2 FROM table_6 INNER JOIN table_7 ON (table_6.column_2 = table_7.column_1) WHERE table_6.column_2 IN (?, ?, ?) ORDER BY table_6.column_2 ASC LIMIT 10
? = 0
? = 1
? = 2
----
1
1
1
1
1
1
1
1
1
1
1
1

query  nosort
SELECT table_6.column_4 AS alias_1, table_8.column_2 AS alias_2 FROM table_6 INNER JOIN table_8 ON (table_6.column_2 = table_8.column_1) WHERE table_6.column_1 IN (?, ?, ?) ORDER BY table_6.column_1 DESC LIMIT 10
? = 0
? = 1
? = 2
----
1
1
1
1
1
1
1
1
1
1
1
1

query  nosort
SELECT table_4.column_3 AS alias_1 FROM table_4 WHERE table_4.column_3 IN (?, ?, ?) ORDER BY table_4.column_3 DESC LIMIT 10
? = 0
? = 1
? = 2
----
2
1
0

query  nosort
SELECT table_4.column_5 AS alias_1, table_9.column_2 AS alias_2 FROM table_4 INNER JOIN table_9 ON (table_4.column_3 = table_9.column_1) WHERE table_4.column_3 IN (?, ?, ?) ORDER BY table_4.column_3 DESC LIMIT 10
? = 0
? = 1
? = 2
----
1
1
1
1
1
1
