# Generated by:
#     target/debug/noria-logictest permute --compare-to mysql://root:noria@127.1/noria -d 3 -o logictests/generated/mysql/ --only range_param --random --include-deletes --rows-per-table 10 --subquery-depth 1

statement ok
CREATE TABLE `table_3` (`column_2` INT, `column_4` INT, `column_3` INT, `column_1` INT, PRIMARY KEY (`column_4`))


statement ok
CREATE TABLE `table_4` (`column_2` INT, `column_1` INT, `column_3` INT, PRIMARY KEY (`column_3`))


statement ok
CREATE TABLE `table_1` (`column_3` INT, `column_2` INT, `column_1` INT, PRIMARY KEY (`column_3`))


statement ok
CREATE TABLE `table_2` (`column_1` INT, `column_2` INT, `column_4` INT, `column_3` INT, `column_5` INT, PRIMARY KEY (`column_5`))


statement ok
CREATE TABLE `table_5` (`column_2` INT, `column_3` INT, `column_1` INT, PRIMARY KEY (`column_3`))


statement ok
INSERT INTO `table_3` (`column_2`, `column_4`, `column_3`, `column_1`) VALUES (2, 0, -1178478805, -799934298), (-1102907018, 1, 291120812, -1162309566), (0, 2, -2035910489, 970457419), (-790831905, 3, -444008894, 731228338), (1, 4, 429095798, 957463486), (368782195, 5, -1242773553, -1030142022), (2, 6, 1804378461, -611864741), (1818468189, 7, 1858856186, 400228328), (0, 8, 2089741867, -503221495), (29537823, 9, -288598233, 1577198258)


statement ok
INSERT INTO `table_4` (`column_2`, `column_1`, `column_3`) VALUES (1729738615, -1465365046, 0), (-626332295, -1344375067, 1), (325600404, -1535327228, 2), (-1870761833, -1859510339, 3), (-1926501130, -1964085844, 4), (2013641553, 1304811034, 5), (1731715033, -2051543810, 6), (-291771584, -1338416223, 7), (556302059, 1286647790, 8), (1803464694, 646887579, 9)


statement ok
INSERT INTO `table_1` (`column_3`, `column_2`, `column_1`) VALUES (0, 783341721, 2113587990), (1, 321964919, 921194097), (2, 1892378631, 1903230630), (3, -1437138342, -276202246), (4, -1218757568, 945990040), (5, -302225237, 718553367), (6, 1816277244, -1238917003), (7, 2068588933, 1789173045), (8, 2052595400, -1071308907), (9, -2122420927, -1526693665)


statement ok
INSERT INTO `table_2` (`column_1`, `column_2`, `column_4`, `column_3`, `column_5`) VALUES (2, 1703285726, 29393443, -1457850456, 0), (2001815527, -230572255, 745666358, -1176251457, 1), (0, 1968440197, 788543999, -123948070, 2), (-550747593, 1399715223, 1566614408, -619359467, 3), (1, -1086646597, 415709413, -613647437, 4), (544515856, -1874862935, -1475426951, 1363909938, 5), (2, 941045302, -1441639924, -1892349653, 6), (522496947, 1826906338, 574897195, -658270367, 7), (0, -2094922416, 963938571, 1234854448, 8), (-1929056810, 1801735187, -1578464017, -743201713, 9)


statement ok
INSERT INTO `table_5` (`column_2`, `column_3`, `column_1`) VALUES (2024646345, 0, -831281988), (-2128439151, 1, 1056457442), (1414854502, 2, 1925963922), (-1393397507, 3, 296484817), (1516745850, 4, 628920403), (-1581319024, 5, -1766558069), (-1855364732, 6, -977606829), (-1359787276, 7, -859122996), (1135382630, 8, 1578648144), (-1820735128, 9, 86557693)


query  rowsort
SELECT `table_1`.`column_2` AS `alias_1`, `table_2`.`column_2` AS `alias_2` FROM `table_1` INNER JOIN `table_2` ON (`table_1`.`column_1` = `table_2`.`column_1`)
----


query  rowsort
SELECT `table_2`.`column_1` AS `alias_1` FROM `table_2` WHERE `table_2`.`column_1` IN (?, ?, ?)
? = 0
? = 1
? = 2
----
0
0
1
2
2

query  rowsort
SELECT `table_2`.`column_1` AS `alias_1` FROM `table_2` WHERE (`table_2`.`column_1` > ?)
? = 10
----
2001815527
522496947
544515856

query  rowsort
SELECT `table_2`.`column_3` AS `alias_1`, `table_3`.`column_2` AS `alias_2` FROM `table_2` INNER JOIN `table_3` ON (`table_2`.`column_1` = `table_3`.`column_1`) WHERE `table_2`.`column_1` IN (?, ?, ?)
? = 0
? = 1
? = 2
----


query  rowsort
SELECT `table_2`.`column_4` AS `alias_1`, `table_4`.`column_2` AS `alias_2` FROM `table_2` INNER JOIN `table_4` ON (`table_2`.`column_1` = `table_4`.`column_1`) WHERE (`table_2`.`column_1` > ?)
? = 10
----


query  rowsort
SELECT `table_3`.`column_2` AS `alias_1` FROM `table_3` WHERE (`table_3`.`column_2` IN (?, ?, ?) AND (`table_3`.`column_2` > ?))
? = 0
? = 1
? = 2
? = 10
----


query  rowsort
SELECT `table_3`.`column_3` AS `alias_1`, `table_5`.`column_2` AS `alias_2` FROM `table_3` INNER JOIN `table_5` ON (`table_3`.`column_2` = `table_5`.`column_1`) WHERE (`table_3`.`column_2` IN (?, ?, ?) AND (`table_3`.`column_2` > ?))
? = 0
? = 1
? = 2
? = 10
----


statement ok
DELETE FROM `table_3` WHERE (`column_4` = 0)


statement ok
DELETE FROM `table_3` WHERE (`column_4` = 1)


statement ok
DELETE FROM `table_3` WHERE (`column_4` = 2)


statement ok
DELETE FROM `table_3` WHERE (`column_4` = 3)


statement ok
DELETE FROM `table_3` WHERE (`column_4` = 4)


statement ok
DELETE FROM `table_4` WHERE (`column_3` = 0)


statement ok
DELETE FROM `table_4` WHERE (`column_3` = 1)


statement ok
DELETE FROM `table_4` WHERE (`column_3` = 2)


statement ok
DELETE FROM `table_4` WHERE (`column_3` = 3)


statement ok
DELETE FROM `table_4` WHERE (`column_3` = 4)


statement ok
DELETE FROM `table_1` WHERE (`column_3` = 0)


statement ok
DELETE FROM `table_1` WHERE (`column_3` = 1)


statement ok
DELETE FROM `table_1` WHERE (`column_3` = 2)


statement ok
DELETE FROM `table_1` WHERE (`column_3` = 3)


statement ok
DELETE FROM `table_1` WHERE (`column_3` = 4)


statement ok
DELETE FROM `table_2` WHERE (`column_5` = 0)


statement ok
DELETE FROM `table_2` WHERE (`column_5` = 1)


statement ok
DELETE FROM `table_2` WHERE (`column_5` = 2)


statement ok
DELETE FROM `table_2` WHERE (`column_5` = 3)


statement ok
DELETE FROM `table_2` WHERE (`column_5` = 4)


statement ok
DELETE FROM `table_5` WHERE (`column_3` = 0)


statement ok
DELETE FROM `table_5` WHERE (`column_3` = 1)


statement ok
DELETE FROM `table_5` WHERE (`column_3` = 2)


statement ok
DELETE FROM `table_5` WHERE (`column_3` = 3)


statement ok
DELETE FROM `table_5` WHERE (`column_3` = 4)


query  rowsort
SELECT `table_1`.`column_2` AS `alias_1`, `table_2`.`column_2` AS `alias_2` FROM `table_1` INNER JOIN `table_2` ON (`table_1`.`column_1` = `table_2`.`column_1`)
----


query  rowsort
SELECT `table_2`.`column_1` AS `alias_1` FROM `table_2` WHERE `table_2`.`column_1` IN (?, ?, ?)
? = 0
? = 1
? = 2
----
0
2

query  rowsort
SELECT `table_2`.`column_1` AS `alias_1` FROM `table_2` WHERE (`table_2`.`column_1` > ?)
? = 10
----
522496947
544515856

query  rowsort
SELECT `table_2`.`column_3` AS `alias_1`, `table_3`.`column_2` AS `alias_2` FROM `table_2` INNER JOIN `table_3` ON (`table_2`.`column_1` = `table_3`.`column_1`) WHERE `table_2`.`column_1` IN (?, ?, ?)
? = 0
? = 1
? = 2
----


query  rowsort
SELECT `table_2`.`column_4` AS `alias_1`, `table_4`.`column_2` AS `alias_2` FROM `table_2` INNER JOIN `table_4` ON (`table_2`.`column_1` = `table_4`.`column_1`) WHERE (`table_2`.`column_1` > ?)
? = 10
----


query  rowsort
SELECT `table_3`.`column_2` AS `alias_1` FROM `table_3` WHERE (`table_3`.`column_2` IN (?, ?, ?) AND (`table_3`.`column_2` > ?))
? = 0
? = 1
? = 2
? = 10
----


query  rowsort
SELECT `table_3`.`column_3` AS `alias_1`, `table_5`.`column_2` AS `alias_2` FROM `table_3` INNER JOIN `table_5` ON (`table_3`.`column_2` = `table_5`.`column_1`) WHERE (`table_3`.`column_2` IN (?, ?, ?) AND (`table_3`.`column_2` > ?))
? = 0
? = 1
? = 2
? = 10
----

