# Generated by:
#     target/debug/noria-logictest permute --compare-to mysql://root:noria@127.1/noria -d 3 -o logictests/generated/mysql/ --only range_param --random --include-deletes --rows-per-table 10 --subquery-depth 1

statement ok
CREATE TABLE `table_4` (`column_2` INT, `column_4` INT, `column_6` INT, `column_1` INT, `column_3` INT, `column_5` INT, PRIMARY KEY (`column_6`))


statement ok
CREATE TABLE `table_5` (`column_2` INT, `column_1` INT, `column_3` INT, PRIMARY KEY (`column_3`))


statement ok
CREATE TABLE `table_3` (`column_2` INT, `column_4` INT, `column_1` INT, `column_3` INT, PRIMARY KEY (`column_4`))


statement ok
CREATE TABLE `table_1` (`column_1` INT, `column_2` INT, `column_4` INT, `column_6` INT, `column_5` INT, `column_3` INT, PRIMARY KEY (`column_6`))


statement ok
CREATE TABLE `table_2` (`column_1` INT, `column_3` INT, `column_2` INT, PRIMARY KEY (`column_3`))


statement ok
INSERT INTO `table_4` (`column_2`, `column_4`, `column_6`, `column_1`, `column_3`, `column_5`) VALUES (-208925482, 1273985713, 0, -962396498, 465008200, 465971244), (-290482392, -1874730222, 1, 1439361591, -1083581726, -715346901), (803702847, -346658982, 2, -1293295401, -886782086, 1702003727), (-1374808364, -608618668, 3, 991417804, 1430139443, -1034544081), (-1300740810, -758576014, 4, 1478006921, -514801779, 1944522122), (1398731817, 467506025, 5, -1988690256, -383730537, -620644410), (-1807453640, -509468111, 6, 1909103479, 680247566, -1245548100), (-1385560880, -84265698, 7, -536095116, -1843342750, -629058220), (1902258380, -750572896, 8, 321557685, -1314912603, 418305171), (-1612603879, -1622201329, 9, 2131043603, -1231240757, -1735821731)


statement ok
INSERT INTO `table_5` (`column_2`, `column_1`, `column_3`) VALUES (-72382214, -143833482, 0), (-721738993, 624427031, 1), (1608080278, -691379775, 2), (139477322, 130154212, 3), (1791383661, 1611416872, 4), (-459488071, 2103096557, 5), (-2098058285, 1691716676, 6), (-55682888, 1827849587, 7), (513684918, 1529222759, 8), (1928489871, -498818942, 9)


statement ok
INSERT INTO `table_3` (`column_2`, `column_4`, `column_1`, `column_3`) VALUES (-180697308, 0, 1364016981, 1621981588), (1264005876, 1, 782517500, -523954570), (-637595703, 2, -1797798134, 1462345470), (1321889993, 3, -1904394315, -897360093), (-864463355, 4, 1071878344, -2082652020), (207446731, 5, 1103406838, -2085761999), (685605953, 6, 1070052296, -591604281), (-1413559208, 7, 310808255, 1419188806), (339627645, 8, -1935826127, -1531838686), (-188595263, 9, 7999792, 362678392)


statement ok
INSERT INTO `table_1` (`column_1`, `column_2`, `column_4`, `column_6`, `column_5`, `column_3`) VALUES (1836104249, -1141841310, -1978703896, 0, 993683232, 1968521607), (-1541598416, -452995621, -1965746300, 1, -49669364, -785442723), (-553864535, -848573864, 1518427856, 2, 1291054349, 245086490), (-619563830, 81915302, -1309738056, 3, -386186448, -1260865708), (196709394, -2044743870, -1924900379, 4, -1718229835, 1003885556), (-2096204322, -1703575479, 1982604298, 5, 1367227964, -1075548508), (-2018325873, 597824151, 424601278, 6, 1856211585, 850368481), (1331121354, -897232568, -1051359207, 7, 1568618945, 2118561963), (680764805, -602630548, -129414224, 8, 37348511, 786326115), (992337755, 1833703343, 1952106204, 9, -1591149045, 1623285160)


statement ok
INSERT INTO `table_2` (`column_1`, `column_3`, `column_2`) VALUES (348526689, 0, 713011772), (-1768953438, 1, -2098929984), (-2122507848, 2, -1188990640), (-815780770, 3, -1399209102), (940805427, 4, 1746756616), (1352850897, 5, -1785613963), (1458022235, 6, -1758251601), (1269061465, 7, 1247409283), (2139494617, 8, 2066360552), (442587070, 9, 105382796)


query  rowsort
SELECT `table_1`.`column_2` AS `alias_1`, `table_2`.`column_2` AS `alias_2` FROM `table_1` INNER JOIN `table_2` ON (`table_1`.`column_1` = `table_2`.`column_1`)
----


query  rowsort
SELECT avg(`table_1`.`column_3`) AS `alias_1` FROM `table_1`
----
547417843.3000

query  rowsort
SELECT `table_1`.`column_1` AS `alias_1` FROM `table_1` WHERE (`table_1`.`column_1` > ?)
? = 10
----
1331121354
1836104249
196709394
680764805
992337755

query  rowsort
SELECT `table_1`.`column_4` AS `alias_1`, `table_3`.`column_2` AS `alias_2`, avg(`table_1`.`column_5`) AS `alias_3` FROM `table_1` INNER JOIN `table_3` ON (`table_1`.`column_1` = `table_3`.`column_1`) GROUP BY `table_1`.`column_4`, `table_3`.`column_2`
----


query  rowsort
SELECT `table_3`.`column_3` AS `alias_1`, `table_4`.`column_2` AS `alias_2` FROM `table_3` INNER JOIN `table_4` ON (`table_3`.`column_1` = `table_4`.`column_1`) WHERE (`table_3`.`column_3` > ?)
? = 10
----


query  rowsort
SELECT avg(`table_4`.`column_3`) AS `alias_1` FROM `table_4` WHERE (`table_4`.`column_1` > ?)
? = 10
----
-339024976.0000

query  rowsort
SELECT `table_4`.`column_4` AS `alias_1`, `table_5`.`column_2` AS `alias_2`, avg(`table_4`.`column_5`) AS `alias_3` FROM `table_4` INNER JOIN `table_5` ON (`table_4`.`column_1` = `table_5`.`column_1`) WHERE (`table_4`.`column_2` > ?) GROUP BY `table_4`.`column_4`, `table_5`.`column_2`
? = 10
----


statement ok
DELETE FROM `table_4` WHERE (`column_6` = 0)


statement ok
DELETE FROM `table_4` WHERE (`column_6` = 1)


statement ok
DELETE FROM `table_4` WHERE (`column_6` = 2)


statement ok
DELETE FROM `table_4` WHERE (`column_6` = 3)


statement ok
DELETE FROM `table_4` WHERE (`column_6` = 4)


statement ok
DELETE FROM `table_5` WHERE (`column_3` = 0)


statement ok
DELETE FROM `table_5` WHERE (`column_3` = 1)


statement ok
DELETE FROM `table_5` WHERE (`column_3` = 2)


statement ok
DELETE FROM `table_5` WHERE (`column_3` = 3)


statement ok
DELETE FROM `table_5` WHERE (`column_3` = 4)


statement ok
DELETE FROM `table_3` WHERE (`column_4` = 0)


statement ok
DELETE FROM `table_3` WHERE (`column_4` = 1)


statement ok
DELETE FROM `table_3` WHERE (`column_4` = 2)


statement ok
DELETE FROM `table_3` WHERE (`column_4` = 3)


statement ok
DELETE FROM `table_3` WHERE (`column_4` = 4)


statement ok
DELETE FROM `table_1` WHERE (`column_6` = 0)


statement ok
DELETE FROM `table_1` WHERE (`column_6` = 1)


statement ok
DELETE FROM `table_1` WHERE (`column_6` = 2)


statement ok
DELETE FROM `table_1` WHERE (`column_6` = 3)


statement ok
DELETE FROM `table_1` WHERE (`column_6` = 4)


statement ok
DELETE FROM `table_2` WHERE (`column_3` = 0)


statement ok
DELETE FROM `table_2` WHERE (`column_3` = 1)


statement ok
DELETE FROM `table_2` WHERE (`column_3` = 2)


statement ok
DELETE FROM `table_2` WHERE (`column_3` = 3)


statement ok
DELETE FROM `table_2` WHERE (`column_3` = 4)


query  rowsort
SELECT `table_1`.`column_2` AS `alias_1`, `table_2`.`column_2` AS `alias_2` FROM `table_1` INNER JOIN `table_2` ON (`table_1`.`column_1` = `table_2`.`column_1`)
----


query  rowsort
SELECT avg(`table_1`.`column_3`) AS `alias_1` FROM `table_1`
----
860598642.2000

query  rowsort
SELECT `table_1`.`column_1` AS `alias_1` FROM `table_1` WHERE (`table_1`.`column_1` > ?)
? = 10
----
1331121354
680764805
992337755

query  rowsort
SELECT `table_1`.`column_4` AS `alias_1`, `table_3`.`column_2` AS `alias_2`, avg(`table_1`.`column_5`) AS `alias_3` FROM `table_1` INNER JOIN `table_3` ON (`table_1`.`column_1` = `table_3`.`column_1`) GROUP BY `table_1`.`column_4`, `table_3`.`column_2`
----


query  rowsort
SELECT `table_3`.`column_3` AS `alias_1`, `table_4`.`column_2` AS `alias_2` FROM `table_3` INNER JOIN `table_4` ON (`table_3`.`column_1` = `table_4`.`column_1`) WHERE (`table_3`.`column_3` > ?)
? = 10
----


query  rowsort
SELECT avg(`table_4`.`column_3`) AS `alias_1` FROM `table_4` WHERE (`table_4`.`column_1` > ?)
? = 10
----
-621968598.0000

query  rowsort
SELECT `table_4`.`column_4` AS `alias_1`, `table_5`.`column_2` AS `alias_2`, avg(`table_4`.`column_5`) AS `alias_3` FROM `table_4` INNER JOIN `table_5` ON (`table_4`.`column_1` = `table_5`.`column_1`) WHERE (`table_4`.`column_2` > ?) GROUP BY `table_4`.`column_4`, `table_5`.`column_2`
? = 10
----

