# Generated by:
#     target/debug/noria-logictest permute --compare-to mysql://root:noria@127.1/noria -d 3 -o logictests/generated/mysql/ --only range_param --random --include-deletes --rows-per-table 10 --subquery-depth 1

statement ok
CREATE TABLE `table_1` (`column_7` INT, `column_3` INT, `column_1` INT, `column_5` INT, `column_8` INT, `column_9` INT, `column_4` INT, `column_10` INT, `column_2` INT, `column_6` INT, PRIMARY KEY (`column_10`))


statement ok
CREATE TABLE `table_5` (`column_2` INT, `column_3` INT, `column_1` INT, PRIMARY KEY (`column_3`))


statement ok
CREATE TABLE `table_3` (`column_3` INT, `column_1` INT, `column_2` INT, PRIMARY KEY (`column_3`))


statement ok
CREATE TABLE `table_4` (`column_3` INT, `column_1` INT, `column_2` INT, PRIMARY KEY (`column_3`))


statement ok
CREATE TABLE `table_2` (`column_1` INT, `column_2` INT, `column_3` INT, PRIMARY KEY (`column_3`))


statement ok
INSERT INTO `table_1` (`column_7`, `column_3`, `column_1`, `column_5`, `column_8`, `column_9`, `column_4`, `column_10`, `column_2`, `column_6`) VALUES (-1108478418, 209261964, -349499847, 173087379, -1944118195, -439369539, 519740176, 0, -1529453177, 1273894458), (-1037284945, 1968919393, -710128894, -1574551433, -1929692514, -609528661, -361135896, 1, 2081415704, -250445676), (-1176707098, -1458796987, 1527264572, 65830181, 2008298100, -357588962, -1831046974, 2, 291363564, -1185798248), (-427121742, -1923589781, -1963974902, 71350701, -510014953, -490094669, 1772912186, 3, 676877088, -785459291), (1977363712, 762387006, -1742985827, 940695959, 1783245642, -127644774, 1646791121, 4, -267269036, 1894716069), (1817021019, -456280843, -565935350, -1455245608, -17459574, 1831739550, -1994785078, 5, -369046830, 64377775), (-1832068080, 429990680, -766488648, -908965380, 1000241785, 280698761, -646257114, 6, 1987594870, -1732927428), (767269810, 916180898, -1204109509, 1437526906, 1368216922, -426781964, -559897413, 7, 523700678, 474830366), (1385899952, -1128483588, -1777103350, -2001654097, 563658428, -278043547, 486868348, 8, 1097882418, 1299115514), (1482894939, -1504932404, -1442324965, -383698283, 5906655, -1116202098, 2121081999, 9, -1949380743, -1545296864)


statement ok
INSERT INTO `table_5` (`column_2`, `column_3`, `column_1`) VALUES (1777047664, 0, 798958069), (-1112557172, 1, 1954152357), (644640519, 2, 807589832), (-1480738879, 3, -1958313657), (-887534560, 4, 599007724), (1255519802, 5, 112796761), (933432371, 6, -2113518348), (1013802275, 7, -850073570), (-6961932, 8, -1737262259), (2123597832, 9, 973128830)


statement ok
INSERT INTO `table_3` (`column_3`, `column_1`, `column_2`) VALUES (0, 2061850355, -1035192106), (1, -884503609, -2134077948), (2, 478452666, 526749705), (3, -2140891460, 514621487), (4, 754977070, -1947946589), (5, 1996936704, 625080799), (6, -1292537126, 1028588006), (7, -1227897875, 291928320), (8, 254396269, 315420724), (9, 202615715, -1280002027)


statement ok
INSERT INTO `table_4` (`column_3`, `column_1`, `column_2`) VALUES (0, -2033549747, -1459909060), (1, 793795027, 661887698), (2, 1319436030, 1045328143), (3, 170435603, 2044243245), (4, 1429066861, -1481445710), (5, -2019935866, -1441435050), (6, 15346715, 1867054786), (7, 388360770, -2126622327), (8, 1109306925, -478244339), (9, -1921775554, -1995516326)


statement ok
INSERT INTO `table_2` (`column_1`, `column_2`, `column_3`) VALUES (-274250503, 1437911558, 0), (1821385313, -109823042, 1), (-377822590, 1366261930, 2), (1541266503, 111942801, 3), (-1636598454, -759808934, 4), (-1338295496, 881248196, 5), (1208580467, -207357426, 6), (1206553070, -2132521938, 7), (1055414860, 896496470, 8), (-139282388, -429341544, 9)


query  rowsort
SELECT `table_1`.`column_2` AS `alias_1`, `table_2`.`column_2` AS `alias_2` FROM `table_1` INNER JOIN `table_2` ON (`table_1`.`column_1` = `table_2`.`column_1`)
----


query  rowsort
SELECT avg(distinct `table_1`.`column_3`) AS `alias_1` FROM `table_1`
----
-218534366.2000

query  rowsort
SELECT `table_1`.`column_3` AS `alias_1` FROM `table_1` WHERE (`table_1`.`column_3` > ?)
? = 10
----
1968919393
209261964
429990680
762387006
916180898

query  rowsort
SELECT `table_1`.`column_4` AS `alias_1`, `table_3`.`column_2` AS `alias_2`, avg(distinct `table_1`.`column_5`) AS `alias_3` FROM `table_1` INNER JOIN `table_3` ON (`table_1`.`column_3` = `table_3`.`column_1`) GROUP BY `table_1`.`column_4`, `table_3`.`column_2`
----


query  rowsort
SELECT `table_1`.`column_6` AS `alias_1`, `table_4`.`column_2` AS `alias_2` FROM `table_1` INNER JOIN `table_4` ON (`table_1`.`column_3` = `table_4`.`column_1`) WHERE (`table_1`.`column_3` > ?)
? = 10
----


query  rowsort
SELECT avg(distinct `table_1`.`column_7`) AS `alias_1` FROM `table_1` WHERE (`table_1`.`column_7` > ?)
? = 10
----
1486089886.4000

query  rowsort
SELECT `table_1`.`column_8` AS `alias_1`, `table_5`.`column_2` AS `alias_2`, avg(distinct `table_1`.`column_9`) AS `alias_3` FROM `table_1` INNER JOIN `table_5` ON (`table_1`.`column_7` = `table_5`.`column_1`) WHERE (`table_1`.`column_7` > ?) GROUP BY `table_1`.`column_8`, `table_5`.`column_2`
? = 10
----


statement ok
DELETE FROM `table_1` WHERE (`column_10` = 0)


statement ok
DELETE FROM `table_1` WHERE (`column_10` = 1)


statement ok
DELETE FROM `table_1` WHERE (`column_10` = 2)


statement ok
DELETE FROM `table_1` WHERE (`column_10` = 3)


statement ok
DELETE FROM `table_1` WHERE (`column_10` = 4)


statement ok
DELETE FROM `table_5` WHERE (`column_3` = 0)


statement ok
DELETE FROM `table_5` WHERE (`column_3` = 1)


statement ok
DELETE FROM `table_5` WHERE (`column_3` = 2)


statement ok
DELETE FROM `table_5` WHERE (`column_3` = 3)


statement ok
DELETE FROM `table_5` WHERE (`column_3` = 4)


statement ok
DELETE FROM `table_3` WHERE (`column_3` = 0)


statement ok
DELETE FROM `table_3` WHERE (`column_3` = 1)


statement ok
DELETE FROM `table_3` WHERE (`column_3` = 2)


statement ok
DELETE FROM `table_3` WHERE (`column_3` = 3)


statement ok
DELETE FROM `table_3` WHERE (`column_3` = 4)


statement ok
DELETE FROM `table_4` WHERE (`column_3` = 0)


statement ok
DELETE FROM `table_4` WHERE (`column_3` = 1)


statement ok
DELETE FROM `table_4` WHERE (`column_3` = 2)


statement ok
DELETE FROM `table_4` WHERE (`column_3` = 3)


statement ok
DELETE FROM `table_4` WHERE (`column_3` = 4)


statement ok
DELETE FROM `table_2` WHERE (`column_3` = 0)


statement ok
DELETE FROM `table_2` WHERE (`column_3` = 1)


statement ok
DELETE FROM `table_2` WHERE (`column_3` = 2)


statement ok
DELETE FROM `table_2` WHERE (`column_3` = 3)


statement ok
DELETE FROM `table_2` WHERE (`column_3` = 4)


query  rowsort
SELECT `table_1`.`column_2` AS `alias_1`, `table_2`.`column_2` AS `alias_2` FROM `table_1` INNER JOIN `table_2` ON (`table_1`.`column_1` = `table_2`.`column_1`)
----


query  rowsort
SELECT avg(distinct `table_1`.`column_3`) AS `alias_1` FROM `table_1`
----
-348705051.4000

query  rowsort
SELECT `table_1`.`column_3` AS `alias_1` FROM `table_1` WHERE (`table_1`.`column_3` > ?)
? = 10
----
429990680
916180898

query  rowsort
SELECT `table_1`.`column_4` AS `alias_1`, `table_3`.`column_2` AS `alias_2`, avg(distinct `table_1`.`column_5`) AS `alias_3` FROM `table_1` INNER JOIN `table_3` ON (`table_1`.`column_3` = `table_3`.`column_1`) GROUP BY `table_1`.`column_4`, `table_3`.`column_2`
----


query  rowsort
SELECT `table_1`.`column_6` AS `alias_1`, `table_4`.`column_2` AS `alias_2` FROM `table_1` INNER JOIN `table_4` ON (`table_1`.`column_3` = `table_4`.`column_1`) WHERE (`table_1`.`column_3` > ?)
? = 10
----


query  rowsort
SELECT avg(distinct `table_1`.`column_7`) AS `alias_1` FROM `table_1` WHERE (`table_1`.`column_7` > ?)
? = 10
----
1363271430.0000

query  rowsort
SELECT `table_1`.`column_8` AS `alias_1`, `table_5`.`column_2` AS `alias_2`, avg(distinct `table_1`.`column_9`) AS `alias_3` FROM `table_1` INNER JOIN `table_5` ON (`table_1`.`column_7` = `table_5`.`column_1`) WHERE (`table_1`.`column_7` > ?) GROUP BY `table_1`.`column_8`, `table_5`.`column_2`
? = 10
----

