# Generated by:
#     target/debug/noria-logictest permute --compare-to mysql://root:noria@127.1/noria -d 3 -o logictests/generated/mysql/ --only range_param --random --include-deletes --rows-per-table 10 --subquery-depth 1

statement ok
CREATE TABLE `table_4` (`column_1` INT, `column_3` INT, `column_4` INT, `column_2` INT, PRIMARY KEY (`column_4`))


statement ok
CREATE TABLE `table_5` (`column_2` INT, `column_3` INT, `column_1` INT, PRIMARY KEY (`column_3`))


statement ok
CREATE TABLE `table_2` (`column_4` INT, `column_5` INT, `column_2` INT, `column_1` INT, `column_3` INT, PRIMARY KEY (`column_5`))


statement ok
CREATE TABLE `table_3` (`column_1` INT, `column_3` INT, `column_2` INT, PRIMARY KEY (`column_3`))


statement ok
CREATE TABLE `table_1` (`column_3` INT, `column_2` INT, `column_1` INT, PRIMARY KEY (`column_3`))


statement ok
INSERT INTO `table_4` (`column_1`, `column_3`, `column_4`, `column_2`) VALUES (1962113777, -1392510743, 0, 1606190301), (-1818156766, -1609506028, 1, -555765727), (1741090171, -160986467, 2, -2039411822), (-405814302, 1088672669, 3, -1190415729), (767893841, -1145485243, 4, 1258443143), (-1960179092, 679356953, 5, -1911663664), (95828047, -388347061, 6, -967163956), (-926857044, -1172163734, 7, 2086343292), (-668872695, -523752058, 8, 239754059), (1798218498, -1691164017, 9, -1820747557)


statement ok
INSERT INTO `table_5` (`column_2`, `column_3`, `column_1`) VALUES (-935518319, 0, 844709321), (78622037, 1, -993963405), (1970222030, 2, 1699314507), (-1336717821, 3, -1742400721), (641576476, 4, -1077874276), (267518382, 5, 1693583912), (1868479545, 6, 546810322), (-1954137288, 7, -27589384), (-1599497849, 8, 1710461507), (-96525654, 9, -815402201)


statement ok
INSERT INTO `table_2` (`column_4`, `column_5`, `column_2`, `column_1`, `column_3`) VALUES (1830621169, 0, 1938419317, 2065181530, 245234910), (1673758117, 1, -699851552, 1032982648, -2129977492), (-1077989483, 2, -1544870726, -805167341, 309155053), (-47193251, 3, 958996385, 1592222910, -447121085), (1097229711, 4, 483308788, 148861977, 200428201), (-1059688483, 5, 412143051, 1859508520, 939145429), (-1585877966, 6, -1978987491, -699002781, 1245368645), (-1426640112, 7, -43415784, 752419176, 1942819035), (354941608, 8, -1815590872, 1855780263, -971582907), (363058107, 9, -1885564705, 1431138566, 1562969731)


statement ok
INSERT INTO `table_3` (`column_1`, `column_3`, `column_2`) VALUES (-2071124811, 0, 801886596), (700919847, 1, 1836075078), (-491700039, 2, 2069902957), (972302846, 3, 981448309), (-180203387, 4, -485698683), (1420570356, 5, -755124179), (-1777161973, 6, -543457459), (42903938, 7, 1591593686), (-1157977695, 8, 362784587), (30811130, 9, 1393334384)


statement ok
INSERT INTO `table_1` (`column_3`, `column_2`, `column_1`) VALUES (0, 1422027160, 1503435418), (1, 142090467, 1270878137), (2, 797894301, 50840993), (3, 895496563, -906334604), (4, -737232396, 1644499830), (5, 1997343802, 96396799), (6, 906254668, -723470525), (7, 1859023709, -111569799), (8, 1193240498, -1304410788), (9, 189806259, -2057311015)


query  rowsort
SELECT `table_1`.`column_2` AS `alias_1`, `table_2`.`column_2` AS `alias_2` FROM `table_1` INNER JOIN `table_2` ON (`table_1`.`column_1` = `table_2`.`column_1`)
----


query  rowsort
SELECT `table_2`.`column_2` AS `alias_1` FROM `table_2` WHERE (`table_2`.`column_2` > ?)
? = 10
----
1938419317
412143051
483308788
958996385

query  rowsort
SELECT `table_2`.`column_2` AS `alias_1` FROM `table_2` WHERE (`table_2`.`column_2` > ?)
? = 10
----
1938419317
412143051
483308788
958996385

query  rowsort
SELECT `table_2`.`column_3` AS `alias_1`, `table_3`.`column_2` AS `alias_2` FROM `table_2` INNER JOIN `table_3` ON (`table_2`.`column_2` = `table_3`.`column_1`) WHERE (`table_2`.`column_2` > ?)
? = 10
----


query  rowsort
SELECT `table_2`.`column_4` AS `alias_1`, `table_4`.`column_2` AS `alias_2` FROM `table_2` INNER JOIN `table_4` ON (`table_2`.`column_2` = `table_4`.`column_1`) WHERE (`table_2`.`column_4` > ?)
? = 10
----


query  rowsort
SELECT `table_4`.`column_1` AS `alias_1` FROM `table_4` WHERE ((`table_4`.`column_1` > ?) AND (`table_4`.`column_1` > ?))
? = 10
? = 10
----
1741090171
1798218498
1962113777
767893841
95828047

query  rowsort
SELECT `table_4`.`column_3` AS `alias_1`, `table_5`.`column_2` AS `alias_2` FROM `table_4` INNER JOIN `table_5` ON (`table_4`.`column_1` = `table_5`.`column_1`) WHERE ((`table_4`.`column_1` > ?) AND (`table_4`.`column_1` > ?))
? = 10
? = 10
----


statement ok
DELETE FROM `table_4` WHERE (`column_4` = 0)


statement ok
DELETE FROM `table_4` WHERE (`column_4` = 1)


statement ok
DELETE FROM `table_4` WHERE (`column_4` = 2)


statement ok
DELETE FROM `table_4` WHERE (`column_4` = 3)


statement ok
DELETE FROM `table_4` WHERE (`column_4` = 4)


statement ok
DELETE FROM `table_5` WHERE (`column_3` = 0)


statement ok
DELETE FROM `table_5` WHERE (`column_3` = 1)


statement ok
DELETE FROM `table_5` WHERE (`column_3` = 2)


statement ok
DELETE FROM `table_5` WHERE (`column_3` = 3)


statement ok
DELETE FROM `table_5` WHERE (`column_3` = 4)


statement ok
DELETE FROM `table_2` WHERE (`column_5` = 0)


statement ok
DELETE FROM `table_2` WHERE (`column_5` = 1)


statement ok
DELETE FROM `table_2` WHERE (`column_5` = 2)


statement ok
DELETE FROM `table_2` WHERE (`column_5` = 3)


statement ok
DELETE FROM `table_2` WHERE (`column_5` = 4)


statement ok
DELETE FROM `table_3` WHERE (`column_3` = 0)


statement ok
DELETE FROM `table_3` WHERE (`column_3` = 1)


statement ok
DELETE FROM `table_3` WHERE (`column_3` = 2)


statement ok
DELETE FROM `table_3` WHERE (`column_3` = 3)


statement ok
DELETE FROM `table_3` WHERE (`column_3` = 4)


statement ok
DELETE FROM `table_1` WHERE (`column_3` = 0)


statement ok
DELETE FROM `table_1` WHERE (`column_3` = 1)


statement ok
DELETE FROM `table_1` WHERE (`column_3` = 2)


statement ok
DELETE FROM `table_1` WHERE (`column_3` = 3)


statement ok
DELETE FROM `table_1` WHERE (`column_3` = 4)


query  rowsort
SELECT `table_1`.`column_2` AS `alias_1`, `table_2`.`column_2` AS `alias_2` FROM `table_1` INNER JOIN `table_2` ON (`table_1`.`column_1` = `table_2`.`column_1`)
----


query  rowsort
SELECT `table_2`.`column_2` AS `alias_1` FROM `table_2` WHERE (`table_2`.`column_2` > ?)
? = 10
----
412143051

query  rowsort
SELECT `table_2`.`column_2` AS `alias_1` FROM `table_2` WHERE (`table_2`.`column_2` > ?)
? = 10
----
412143051

query  rowsort
SELECT `table_2`.`column_3` AS `alias_1`, `table_3`.`column_2` AS `alias_2` FROM `table_2` INNER JOIN `table_3` ON (`table_2`.`column_2` = `table_3`.`column_1`) WHERE (`table_2`.`column_2` > ?)
? = 10
----


query  rowsort
SELECT `table_2`.`column_4` AS `alias_1`, `table_4`.`column_2` AS `alias_2` FROM `table_2` INNER JOIN `table_4` ON (`table_2`.`column_2` = `table_4`.`column_1`) WHERE (`table_2`.`column_4` > ?)
? = 10
----


query  rowsort
SELECT `table_4`.`column_1` AS `alias_1` FROM `table_4` WHERE ((`table_4`.`column_1` > ?) AND (`table_4`.`column_1` > ?))
? = 10
? = 10
----
1798218498
95828047

query  rowsort
SELECT `table_4`.`column_3` AS `alias_1`, `table_5`.`column_2` AS `alias_2` FROM `table_4` INNER JOIN `table_5` ON (`table_4`.`column_1` = `table_5`.`column_1`) WHERE ((`table_4`.`column_1` > ?) AND (`table_4`.`column_1` > ?))
? = 10
? = 10
----

