# Generated by:
#     target/debug/noria-logictest permute --compare-to mysql://root:noria@127.1/noria -d 3 -o logictests/generated/mysql/ --only range_param --random --include-deletes --rows-per-table 10 --subquery-depth 1

statement ok
CREATE TABLE `table_1` (`column_2` INT, `column_10` INT, `column_8` INT, `column_5` INT, `column_7` INT, `column_1` INT, `column_9` INT, `column_4` INT, `column_6` INT, `column_3` INT, PRIMARY KEY (`column_10`))


statement ok
CREATE TABLE `table_2` (`column_2` INT, `column_3` INT, `column_1` INT, PRIMARY KEY (`column_3`))


statement ok
CREATE TABLE `table_4` (`column_2` INT, `column_3` INT, `column_1` INT, PRIMARY KEY (`column_3`))


statement ok
CREATE TABLE `table_5` (`column_3` INT, `column_1` INT, `column_2` INT, PRIMARY KEY (`column_3`))


statement ok
CREATE TABLE `table_3` (`column_2` INT, `column_3` INT, `column_1` INT, PRIMARY KEY (`column_3`))


statement ok
INSERT INTO `table_1` (`column_2`, `column_10`, `column_8`, `column_5`, `column_7`, `column_1`, `column_9`, `column_4`, `column_6`, `column_3`) VALUES (-1566903000, 0, 1875310210, -450666840, -913238625, -2031766807, -1459510396, -753002098, -503358687, 1160025544), (403869555, 1, 223856780, 1496552774, -442804732, -1811222589, -522190550, 1149654883, 1995651011, 1555024147), (-799530328, 2, 989343555, -2135071976, -1470917541, 1658850478, -752213722, -1717817418, 13579977, 360327966), (-786529770, 3, -1726517739, -1023532578, -2036985778, 591644132, -630016577, 220755764, 1628986512, -921420497), (335646186, 4, -460350144, -1168035593, -149635096, 1217205744, -719961143, 264455640, -964648042, -306863505), (1163439074, 5, 1340871610, 1376829222, 1555100847, -1100324116, 1588835607, -1950216652, -1083720127, -1267389431), (-1207646058, 6, 220377095, 1994550643, -981589634, 799967497, 297687514, 975690436, -2074843659, 781823225), (1036508923, 7, 1884838296, -1389145660, 1632115401, -1376993482, 848884881, -1802163361, -506668426, 1209968543), (-1028851718, 8, 1983110642, -65595093, -1348490549, 1767432922, 1085927832, -695974318, -436357085, 844273941), (14337099, 9, -190644076, 303051800, 1141938124, 1293862157, -1524587995, -1474269998, 1376810738, 247595544)


statement ok
INSERT INTO `table_2` (`column_2`, `column_3`, `column_1`) VALUES (-267113321, 0, 1088929152), (717742691, 1, -1768499549), (415863628, 2, 1021885821), (1984387184, 3, 1774815908), (106542400, 4, 821469225), (796571023, 5, -1935696702), (211160964, 6, -568936420), (981570522, 7, -1992640455), (-1139637400, 8, -1470961261), (-832034792, 9, -1642117512)


statement ok
INSERT INTO `table_4` (`column_2`, `column_3`, `column_1`) VALUES (-1358027270, 0, 405678030), (974570899, 1, 190153564), (-319367397, 2, -549397373), (1362191833, 3, -896534675), (918125268, 4, 1710502683), (-554446273, 5, -1216442444), (-669406602, 6, 437725664), (964678340, 7, -601377923), (1986515910, 8, -1594312579), (-1403204533, 9, 1221160877)


statement ok
INSERT INTO `table_5` (`column_3`, `column_1`, `column_2`) VALUES (0, 180794986, -1252494035), (1, -307049504, 1696343466), (2, 795695024, -2016063727), (3, -1786745275, 1328063025), (4, -1442218743, -304452161), (5, -1767229482, 860478840), (6, 1886013521, -754698804), (7, -540095492, -1594357103), (8, 1208030707, -398655906), (9, 1605442492, -1871591905)


statement ok
INSERT INTO `table_3` (`column_2`, `column_3`, `column_1`) VALUES (-828102277, 0, -604753352), (-728534858, 1, -2108933934), (-1554025592, 2, 2125403652), (1686947226, 3, 174239296), (-1666294807, 4, -1013310625), (-106846993, 5, -1080242998), (2046952657, 6, -192253688), (-1572332956, 7, -590818117), (302991227, 8, 1445566498), (-1930778099, 9, 265450040)


query  rowsort
SELECT `table_1`.`column_2` AS `alias_1`, `table_2`.`column_2` AS `alias_2` FROM `table_1` INNER JOIN `table_2` ON (`table_1`.`column_1` = `table_2`.`column_1`)
----


query  rowsort
SELECT count(distinct `table_1`.`column_3`) AS `alias_1` FROM `table_1`
----
10

query  rowsort
SELECT `table_1`.`column_1` AS `alias_1` FROM `table_1` WHERE (`table_1`.`column_1` > ?)
? = 10
----
1217205744
1293862157
1658850478
1767432922
591644132
799967497

query  rowsort
SELECT `table_1`.`column_4` AS `alias_1`, `table_3`.`column_2` AS `alias_2`, count(distinct `table_1`.`column_5`) AS `alias_3` FROM `table_1` INNER JOIN `table_3` ON (`table_1`.`column_1` = `table_3`.`column_1`) GROUP BY `table_1`.`column_4`, `table_3`.`column_2`
----


query  rowsort
SELECT `table_1`.`column_6` AS `alias_1`, `table_4`.`column_2` AS `alias_2` FROM `table_1` INNER JOIN `table_4` ON (`table_1`.`column_1` = `table_4`.`column_1`) WHERE (`table_1`.`column_1` > ?)
? = 10
----


query  rowsort
SELECT count(distinct `table_1`.`column_7`) AS `alias_1` FROM `table_1` WHERE (`table_1`.`column_1` > ?)
? = 10
----
6

query  rowsort
SELECT `table_1`.`column_8` AS `alias_1`, `table_5`.`column_2` AS `alias_2`, count(distinct `table_1`.`column_9`) AS `alias_3` FROM `table_1` INNER JOIN `table_5` ON (`table_1`.`column_1` = `table_5`.`column_1`) WHERE (`table_1`.`column_2` > ?) GROUP BY `table_1`.`column_8`, `table_5`.`column_2`
? = 10
----


statement ok
DELETE FROM `table_1` WHERE (`column_10` = 0)


statement ok
DELETE FROM `table_1` WHERE (`column_10` = 1)


statement ok
DELETE FROM `table_1` WHERE (`column_10` = 2)


statement ok
DELETE FROM `table_1` WHERE (`column_10` = 3)


statement ok
DELETE FROM `table_1` WHERE (`column_10` = 4)


statement ok
DELETE FROM `table_2` WHERE (`column_3` = 0)


statement ok
DELETE FROM `table_2` WHERE (`column_3` = 1)


statement ok
DELETE FROM `table_2` WHERE (`column_3` = 2)


statement ok
DELETE FROM `table_2` WHERE (`column_3` = 3)


statement ok
DELETE FROM `table_2` WHERE (`column_3` = 4)


statement ok
DELETE FROM `table_4` WHERE (`column_3` = 0)


statement ok
DELETE FROM `table_4` WHERE (`column_3` = 1)


statement ok
DELETE FROM `table_4` WHERE (`column_3` = 2)


statement ok
DELETE FROM `table_4` WHERE (`column_3` = 3)


statement ok
DELETE FROM `table_4` WHERE (`column_3` = 4)


statement ok
DELETE FROM `table_5` WHERE (`column_3` = 0)


statement ok
DELETE FROM `table_5` WHERE (`column_3` = 1)


statement ok
DELETE FROM `table_5` WHERE (`column_3` = 2)


statement ok
DELETE FROM `table_5` WHERE (`column_3` = 3)


statement ok
DELETE FROM `table_5` WHERE (`column_3` = 4)


statement ok
DELETE FROM `table_3` WHERE (`column_3` = 0)


statement ok
DELETE FROM `table_3` WHERE (`column_3` = 1)


statement ok
DELETE FROM `table_3` WHERE (`column_3` = 2)


statement ok
DELETE FROM `table_3` WHERE (`column_3` = 3)


statement ok
DELETE FROM `table_3` WHERE (`column_3` = 4)


query  rowsort
SELECT `table_1`.`column_2` AS `alias_1`, `table_2`.`column_2` AS `alias_2` FROM `table_1` INNER JOIN `table_2` ON (`table_1`.`column_1` = `table_2`.`column_1`)
----


query  rowsort
SELECT count(distinct `table_1`.`column_3`) AS `alias_1` FROM `table_1`
----
5

query  rowsort
SELECT `table_1`.`column_1` AS `alias_1` FROM `table_1` WHERE (`table_1`.`column_1` > ?)
? = 10
----
1293862157
1767432922
799967497

query  rowsort
SELECT `table_1`.`column_4` AS `alias_1`, `table_3`.`column_2` AS `alias_2`, count(distinct `table_1`.`column_5`) AS `alias_3` FROM `table_1` INNER JOIN `table_3` ON (`table_1`.`column_1` = `table_3`.`column_1`) GROUP BY `table_1`.`column_4`, `table_3`.`column_2`
----


query  rowsort
SELECT `table_1`.`column_6` AS `alias_1`, `table_4`.`column_2` AS `alias_2` FROM `table_1` INNER JOIN `table_4` ON (`table_1`.`column_1` = `table_4`.`column_1`) WHERE (`table_1`.`column_1` > ?)
? = 10
----


query  rowsort
SELECT count(distinct `table_1`.`column_7`) AS `alias_1` FROM `table_1` WHERE (`table_1`.`column_1` > ?)
? = 10
----
3

query  rowsort
SELECT `table_1`.`column_8` AS `alias_1`, `table_5`.`column_2` AS `alias_2`, count(distinct `table_1`.`column_9`) AS `alias_3` FROM `table_1` INNER JOIN `table_5` ON (`table_1`.`column_1` = `table_5`.`column_1`) WHERE (`table_1`.`column_2` > ?) GROUP BY `table_1`.`column_8`, `table_5`.`column_2`
? = 10
----

