# Generated by:
#     target/debug/noria-logictest permute --compare-to mysql://root:noria@127.1/noria -d 3 -o logictests/generated/mysql/ --only range_param --random --include-deletes --rows-per-table 10 --subquery-depth 1

statement ok
CREATE TABLE `table_4` (`column_1` INT, `column_3` INT, `column_4` INT, `column_2` INT, `column_5` INT, `column_6` INT, PRIMARY KEY (`column_6`))


statement ok
CREATE TABLE `table_5` (`column_1` INT, `column_2` INT, `column_3` INT, PRIMARY KEY (`column_3`))


statement ok
CREATE TABLE `table_1` (`column_4` INT, `column_5` INT, `column_6` INT, `column_3` INT, `column_1` INT, `column_2` INT, PRIMARY KEY (`column_6`))


statement ok
CREATE TABLE `table_3` (`column_1` INT, `column_2` INT, `column_4` INT, `column_3` INT, PRIMARY KEY (`column_4`))


statement ok
CREATE TABLE `table_2` (`column_1` INT, `column_2` INT, `column_3` INT, PRIMARY KEY (`column_3`))


statement ok
INSERT INTO `table_4` (`column_1`, `column_3`, `column_4`, `column_2`, `column_5`, `column_6`) VALUES (-727406785, 2051392208, -1490255799, -1160972872, 1357817484, 0), (2147457988, 959256892, -1861861777, 923075008, -506917428, 1), (1242894486, 962215532, -1197570567, 1788142177, 435918824, 2), (490157934, -482294256, 507281461, -1519377350, 1670418320, 3), (-106641022, -2088416111, 892393462, -560125214, 1588520928, 4), (956321698, -793062684, -1818648916, 493356091, -1900911699, 5), (-2057256198, 583426817, -659022667, 732053777, 606267483, 6), (580730578, 1871067061, 392692722, 211612977, -1149372298, 7), (1313163797, 499932372, -981979026, 1652836098, 959248020, 8), (-1226783017, 1438338380, 2128059719, -1141499447, 909935144, 9)


statement ok
INSERT INTO `table_5` (`column_1`, `column_2`, `column_3`) VALUES (-1624744906, 1021073947, 0), (-446979326, 131930344, 1), (645639491, 610849251, 2), (-636351871, -1603516744, 3), (1201125989, 376236942, 4), (1220616901, -871607518, 5), (-537746737, -1946318180, 6), (1462702146, -920671561, 7), (129619725, 722208251, 8), (-654230754, 447468091, 9)


statement ok
INSERT INTO `table_1` (`column_4`, `column_5`, `column_6`, `column_3`, `column_1`, `column_2`) VALUES (986771078, -1070065882, 0, -1789102780, -660361632, 1096893287), (-1754433946, 1519990645, 1, 1969197362, 1709224410, -1036944377), (-1846243457, 456918952, 2, -83600820, -772980283, -1892083808), (-446935281, 1254604483, 3, -1787843272, -1548359395, 700319784), (-469095166, 1351861636, 4, 317410726, -190339972, -270846478), (1281629225, -288470241, 5, 711625347, 534967094, -1817932022), (-2116612687, 953364256, 6, 1215432632, -1407666110, -1986828699), (1289710541, 786538023, 7, -2096978983, 242202010, -1381461770), (1380461507, 649720623, 8, 752072014, -744904341, -623601154), (-455135507, 880795816, 9, 1080476209, 1864807390, 666848632)


statement ok
INSERT INTO `table_3` (`column_1`, `column_2`, `column_4`, `column_3`) VALUES (1699685388, 570198938, 0, -15411899), (-1868850156, -575957077, 1, 113398624), (594837845, 1269005419, 2, 658298345), (1355777663, -1530074358, 3, -1085742169), (1551356464, 789467327, 4, -409786459), (-587477248, 1881576206, 5, 2013023694), (200504711, -1858315854, 6, 1728329550), (-777606200, 1008588144, 7, -1774434599), (998281817, 1200647944, 8, -1129079794), (-1355520257, -38198579, 9, 665109132)


statement ok
INSERT INTO `table_2` (`column_1`, `column_2`, `column_3`) VALUES (1245923919, -1087106690, 0), (-174673270, -846366692, 1), (-973983511, -1148677368, 2), (3841590, 1429061566, 3), (1067658572, 1789355695, 4), (2035417289, -1158534429, 5), (-275075772, -895265751, 6), (1974172599, 175753780, 7), (-207940599, -554892501, 8), (462897918, -821042674, 9)


query  rowsort
SELECT `table_1`.`column_2` AS `alias_1`, `table_2`.`column_2` AS `alias_2` FROM `table_1` INNER JOIN `table_2` ON (`table_1`.`column_1` = `table_2`.`column_1`)
----


query  rowsort
SELECT max(`table_1`.`column_3`) AS `alias_1` FROM `table_1`
----
1969197362

query  rowsort
SELECT `table_1`.`column_3` AS `alias_1` FROM `table_1` WHERE (`table_1`.`column_3` > ?)
? = 10
----
1080476209
1215432632
1969197362
317410726
711625347
752072014

query  rowsort
SELECT `table_1`.`column_4` AS `alias_1`, `table_3`.`column_2` AS `alias_2`, max(`table_1`.`column_5`) AS `alias_3` FROM `table_1` INNER JOIN `table_3` ON (`table_1`.`column_3` = `table_3`.`column_1`) GROUP BY `table_1`.`column_4`, `table_3`.`column_2`
----


query  rowsort
SELECT `table_3`.`column_3` AS `alias_1`, `table_4`.`column_2` AS `alias_2` FROM `table_3` INNER JOIN `table_4` ON (`table_3`.`column_1` = `table_4`.`column_1`) WHERE (`table_3`.`column_1` > ?)
? = 10
----


query  rowsort
SELECT max(`table_4`.`column_3`) AS `alias_1` FROM `table_4` WHERE (`table_4`.`column_1` > ?)
? = 10
----
1871067061

query  rowsort
SELECT `table_4`.`column_4` AS `alias_1`, `table_5`.`column_2` AS `alias_2`, max(`table_4`.`column_5`) AS `alias_3` FROM `table_4` INNER JOIN `table_5` ON (`table_4`.`column_1` = `table_5`.`column_1`) WHERE (`table_4`.`column_1` > ?) GROUP BY `table_4`.`column_4`, `table_5`.`column_2`
? = 10
----


statement ok
DELETE FROM `table_4` WHERE (`column_6` = 0)


statement ok
DELETE FROM `table_4` WHERE (`column_6` = 1)


statement ok
DELETE FROM `table_4` WHERE (`column_6` = 2)


statement ok
DELETE FROM `table_4` WHERE (`column_6` = 3)


statement ok
DELETE FROM `table_4` WHERE (`column_6` = 4)


statement ok
DELETE FROM `table_5` WHERE (`column_3` = 0)


statement ok
DELETE FROM `table_5` WHERE (`column_3` = 1)


statement ok
DELETE FROM `table_5` WHERE (`column_3` = 2)


statement ok
DELETE FROM `table_5` WHERE (`column_3` = 3)


statement ok
DELETE FROM `table_5` WHERE (`column_3` = 4)


statement ok
DELETE FROM `table_1` WHERE (`column_6` = 0)


statement ok
DELETE FROM `table_1` WHERE (`column_6` = 1)


statement ok
DELETE FROM `table_1` WHERE (`column_6` = 2)


statement ok
DELETE FROM `table_1` WHERE (`column_6` = 3)


statement ok
DELETE FROM `table_1` WHERE (`column_6` = 4)


statement ok
DELETE FROM `table_3` WHERE (`column_4` = 0)


statement ok
DELETE FROM `table_3` WHERE (`column_4` = 1)


statement ok
DELETE FROM `table_3` WHERE (`column_4` = 2)


statement ok
DELETE FROM `table_3` WHERE (`column_4` = 3)


statement ok
DELETE FROM `table_3` WHERE (`column_4` = 4)


statement ok
DELETE FROM `table_2` WHERE (`column_3` = 0)


statement ok
DELETE FROM `table_2` WHERE (`column_3` = 1)


statement ok
DELETE FROM `table_2` WHERE (`column_3` = 2)


statement ok
DELETE FROM `table_2` WHERE (`column_3` = 3)


statement ok
DELETE FROM `table_2` WHERE (`column_3` = 4)


query  rowsort
SELECT `table_1`.`column_2` AS `alias_1`, `table_2`.`column_2` AS `alias_2` FROM `table_1` INNER JOIN `table_2` ON (`table_1`.`column_1` = `table_2`.`column_1`)
----


query  rowsort
SELECT max(`table_1`.`column_3`) AS `alias_1` FROM `table_1`
----
1215432632

query  rowsort
SELECT `table_1`.`column_3` AS `alias_1` FROM `table_1` WHERE (`table_1`.`column_3` > ?)
? = 10
----
1080476209
1215432632
711625347
752072014

query  rowsort
SELECT `table_1`.`column_4` AS `alias_1`, `table_3`.`column_2` AS `alias_2`, max(`table_1`.`column_5`) AS `alias_3` FROM `table_1` INNER JOIN `table_3` ON (`table_1`.`column_3` = `table_3`.`column_1`) GROUP BY `table_1`.`column_4`, `table_3`.`column_2`
----


query  rowsort
SELECT `table_3`.`column_3` AS `alias_1`, `table_4`.`column_2` AS `alias_2` FROM `table_3` INNER JOIN `table_4` ON (`table_3`.`column_1` = `table_4`.`column_1`) WHERE (`table_3`.`column_1` > ?)
? = 10
----


query  rowsort
SELECT max(`table_4`.`column_3`) AS `alias_1` FROM `table_4` WHERE (`table_4`.`column_1` > ?)
? = 10
----
1871067061

query  rowsort
SELECT `table_4`.`column_4` AS `alias_1`, `table_5`.`column_2` AS `alias_2`, max(`table_4`.`column_5`) AS `alias_3` FROM `table_4` INNER JOIN `table_5` ON (`table_4`.`column_1` = `table_5`.`column_1`) WHERE (`table_4`.`column_1` > ?) GROUP BY `table_4`.`column_4`, `table_5`.`column_2`
? = 10
----

