# Generated by:
#     target/debug/noria-logictest permute --compare-to mysql://root:noria@127.1/noria -d 3 -o logictests/generated/mysql/ --only range_param --random --include-deletes --rows-per-table 10 --subquery-depth 1

statement ok
CREATE TABLE `table_5` (`column_1` INT, `column_2` INT, `column_3` INT, PRIMARY KEY (`column_3`))


statement ok
CREATE TABLE `table_3` (`column_7` INT, `column_1` INT, `column_4` INT, `column_2` INT, `column_5` INT, `column_6` INT, `column_3` INT, PRIMARY KEY (`column_7`))


statement ok
CREATE TABLE `table_2` (`column_3` INT, `column_2` INT, `column_1` INT, PRIMARY KEY (`column_3`))


statement ok
CREATE TABLE `table_1` (`column_6` INT, `column_3` INT, `column_4` INT, `column_2` INT, `column_1` INT, `column_5` INT, PRIMARY KEY (`column_6`))


statement ok
CREATE TABLE `table_4` (`column_2` INT, `column_3` INT, `column_1` INT, PRIMARY KEY (`column_3`))


statement ok
INSERT INTO `table_5` (`column_1`, `column_2`, `column_3`) VALUES (-1833551004, -359626231, 0), (-93139937, -1818776518, 1), (1318143387, -800581514, 2), (-364077730, -2026339407, 3), (1764126802, -48660825, 4), (1967389310, 1624830027, 5), (57527831, 1848265165, 6), (-1716142939, 1526010189, 7), (-1546918390, -1887997146, 8), (-1242742263, 1700531871, 9)


statement ok
INSERT INTO `table_3` (`column_7`, `column_1`, `column_4`, `column_2`, `column_5`, `column_6`, `column_3`) VALUES (0, -938350142, -140982323, -688948149, -1934415825, -1840100778, 7330955), (1, -406922290, 558259341, 1584301683, -968713145, -1785068139, -381372389), (2, 913893937, 426803406, 2095358150, -1330623413, 1570381453, 1524625642), (3, 447839070, -1303061924, 392888056, 1504032905, -1255731069, 1557587569), (4, 1858402893, 66512627, 976986784, -1478165244, -703149870, 1056572420), (5, -572985861, -1949175024, -584388632, 1920035431, 891423984, -977500898), (6, 2000974002, -104125735, -1686470035, 2055289754, -1412276723, -961590868), (7, -1766015136, -132885144, -971709583, 1575444184, 2061448145, 721599923), (8, -1291174220, -797268326, 1454479327, 853111480, -77034665, -585113334), (9, -1036732537, -798218220, 1376378164, 1105642354, 1284142511, -1597491341)


statement ok
INSERT INTO `table_2` (`column_3`, `column_2`, `column_1`) VALUES (0, 1532197045, 1043299154), (1, 833263539, 1048414), (2, 2053787185, -278086511), (3, -483312500, 2137529943), (4, 1159358263, 2093329541), (5, -527614272, -2125714005), (6, -1262669063, 1815156928), (7, -475247658, 156708587), (8, -924780263, -377448347), (9, -1776872933, 931670061)


statement ok
INSERT INTO `table_1` (`column_6`, `column_3`, `column_4`, `column_2`, `column_1`, `column_5`) VALUES (0, -872793571, -1646610308, 805178455, -1243364632, 1520130776), (1, 407123419, -1361865852, 2091803357, 262611779, -643104534), (2, -16391706, 2048997036, 1054302888, -1163320741, -1634289079), (3, -2040889011, 860165605, -85350276, -862743933, 315847174), (4, -1452926415, -177130674, 1532682950, 1707434915, 1576912892), (5, 1793656710, 1407131382, -648625369, 1401028900, 582062388), (6, -1541229212, -1996783443, -1494578690, 1490670516, -865101816), (7, 965576260, 1113462582, -2073287966, 1396560199, -1783284492), (8, -601372036, -1849995583, 622843318, 592424843, 1794359623), (9, -293403385, 1636964662, -2008861126, 1918619941, 377633498)


statement ok
INSERT INTO `table_4` (`column_2`, `column_3`, `column_1`) VALUES (1249198269, 0, -1215744111), (-1049536598, 1, -1895327213), (695230866, 2, 1439326424), (-137908907, 3, -648482641), (2136462112, 4, 1016166551), (-2112144590, 5, 483335469), (-576044642, 6, -360256892), (-1317294865, 7, -1920874368), (-2113562961, 8, 603277413), (571135376, 9, -1785502977)


query  rowsort
SELECT `table_1`.`column_2` AS `alias_1`, `table_2`.`column_2` AS `alias_2` FROM `table_1` INNER JOIN `table_2` ON (`table_1`.`column_1` = `table_2`.`column_1`)
----


query  rowsort
SELECT sum(`table_1`.`column_3`) AS `alias_1` FROM `table_1`
----
-3652648947

query  rowsort
SELECT `table_1`.`column_2` AS `alias_1` FROM `table_1` WHERE (`table_1`.`column_2` > ?)
? = 10
----
1054302888
1532682950
2091803357
622843318
805178455

query  rowsort
SELECT `table_1`.`column_4` AS `alias_1`, `table_3`.`column_2` AS `alias_2`, sum(`table_1`.`column_5`) AS `alias_3` FROM `table_1` INNER JOIN `table_3` ON (`table_1`.`column_2` = `table_3`.`column_1`) GROUP BY `table_1`.`column_4`, `table_3`.`column_2`
----


query  rowsort
SELECT `table_3`.`column_3` AS `alias_1`, `table_4`.`column_2` AS `alias_2` FROM `table_3` INNER JOIN `table_4` ON (`table_3`.`column_1` = `table_4`.`column_1`) WHERE (`table_3`.`column_1` > ?)
? = 10
----


query  rowsort
SELECT sum(`table_3`.`column_4`) AS `alias_1` FROM `table_3` WHERE (`table_3`.`column_1` > ?)
? = 10
----
-913871626

query  rowsort
SELECT `table_3`.`column_5` AS `alias_1`, `table_5`.`column_2` AS `alias_2`, sum(`table_3`.`column_6`) AS `alias_3` FROM `table_3` INNER JOIN `table_5` ON (`table_3`.`column_1` = `table_5`.`column_1`) WHERE (`table_3`.`column_1` > ?) GROUP BY `table_3`.`column_5`, `table_5`.`column_2`
? = 10
----


statement ok
DELETE FROM `table_5` WHERE (`column_3` = 0)


statement ok
DELETE FROM `table_5` WHERE (`column_3` = 1)


statement ok
DELETE FROM `table_5` WHERE (`column_3` = 2)


statement ok
DELETE FROM `table_5` WHERE (`column_3` = 3)


statement ok
DELETE FROM `table_5` WHERE (`column_3` = 4)


statement ok
DELETE FROM `table_3` WHERE (`column_7` = 0)


statement ok
DELETE FROM `table_3` WHERE (`column_7` = 1)


statement ok
DELETE FROM `table_3` WHERE (`column_7` = 2)


statement ok
DELETE FROM `table_3` WHERE (`column_7` = 3)


statement ok
DELETE FROM `table_3` WHERE (`column_7` = 4)


statement ok
DELETE FROM `table_2` WHERE (`column_3` = 0)


statement ok
DELETE FROM `table_2` WHERE (`column_3` = 1)


statement ok
DELETE FROM `table_2` WHERE (`column_3` = 2)


statement ok
DELETE FROM `table_2` WHERE (`column_3` = 3)


statement ok
DELETE FROM `table_2` WHERE (`column_3` = 4)


statement ok
DELETE FROM `table_1` WHERE (`column_6` = 0)


statement ok
DELETE FROM `table_1` WHERE (`column_6` = 1)


statement ok
DELETE FROM `table_1` WHERE (`column_6` = 2)


statement ok
DELETE FROM `table_1` WHERE (`column_6` = 3)


statement ok
DELETE FROM `table_1` WHERE (`column_6` = 4)


statement ok
DELETE FROM `table_4` WHERE (`column_3` = 0)


statement ok
DELETE FROM `table_4` WHERE (`column_3` = 1)


statement ok
DELETE FROM `table_4` WHERE (`column_3` = 2)


statement ok
DELETE FROM `table_4` WHERE (`column_3` = 3)


statement ok
DELETE FROM `table_4` WHERE (`column_3` = 4)


query  rowsort
SELECT `table_1`.`column_2` AS `alias_1`, `table_2`.`column_2` AS `alias_2` FROM `table_1` INNER JOIN `table_2` ON (`table_1`.`column_1` = `table_2`.`column_1`)
----


query  rowsort
SELECT sum(`table_1`.`column_3`) AS `alias_1` FROM `table_1`
----
323228337

query  rowsort
SELECT `table_1`.`column_2` AS `alias_1` FROM `table_1` WHERE (`table_1`.`column_2` > ?)
? = 10
----
622843318

query  rowsort
SELECT `table_1`.`column_4` AS `alias_1`, `table_3`.`column_2` AS `alias_2`, sum(`table_1`.`column_5`) AS `alias_3` FROM `table_1` INNER JOIN `table_3` ON (`table_1`.`column_2` = `table_3`.`column_1`) GROUP BY `table_1`.`column_4`, `table_3`.`column_2`
----


query  rowsort
SELECT `table_3`.`column_3` AS `alias_1`, `table_4`.`column_2` AS `alias_2` FROM `table_3` INNER JOIN `table_4` ON (`table_3`.`column_1` = `table_4`.`column_1`) WHERE (`table_3`.`column_1` > ?)
? = 10
----


query  rowsort
SELECT sum(`table_3`.`column_4`) AS `alias_1` FROM `table_3` WHERE (`table_3`.`column_1` > ?)
? = 10
----
-104125735

query  rowsort
SELECT `table_3`.`column_5` AS `alias_1`, `table_5`.`column_2` AS `alias_2`, sum(`table_3`.`column_6`) AS `alias_3` FROM `table_3` INNER JOIN `table_5` ON (`table_3`.`column_1` = `table_5`.`column_1`) WHERE (`table_3`.`column_1` > ?) GROUP BY `table_3`.`column_5`, `table_5`.`column_2`
? = 10
----

