# Generated by:
#     target/debug/noria-logictest permute -d 3 -o logictests/generated/mysql --only in_parameter --compare-to mysql://root:noria@localhost/mysql --subquery-depth 1 --rows-per-table 5 --include-deletes --overwrite-tests

statement ok
CREATE TABLE table_1 (column_2 INT, column_1 INT, PRIMARY KEY (column_2))


statement ok
INSERT INTO table_1 (column_2, column_1) VALUES (0, 1), (1, 1), (2, 2), (3, 1), (4, NULL)


query  rowsort
SELECT table_1.column_1 AS alias_1 FROM table_1 WHERE (table_1.column_1 IS NULL)
----
NULL

query  rowsort
SELECT table_1.column_1 AS alias_1 FROM table_1 WHERE (table_1.column_1 IS NOT NULL)
----
1
1
1
2

query  rowsort
SELECT table_1.column_1 AS alias_1 FROM table_1 WHERE (table_1.column_1 IS NULL)
----
NULL

query  rowsort
SELECT table_1.column_1 AS alias_1 FROM table_1 WHERE (table_1.column_1 IS NOT NULL)
----
1
1
1
2

query  rowsort
SELECT 1 AS alias_1
----
1

query  rowsort
SELECT table_1.column_1 AS alias_1 FROM table_1 WHERE table_1.column_1 IN (?, ?, ?)
? = 0
? = 1
? = 2
----
1
1
1
2

query  rowsort
SELECT table_1.column_1 AS alias_1, table_1.column_1 AS alias_2 FROM table_1 WHERE ((table_1.column_1 IS NULL) AND (table_1.column_1 IS NOT NULL))
----


query  rowsort
SELECT table_1.column_1 AS alias_1, table_1.column_1 AS alias_2 FROM table_1 WHERE ((table_1.column_1 IS NULL) OR (table_1.column_1 IS NULL))
----
NULL
NULL

query  rowsort
SELECT table_1.column_1 AS alias_1, table_1.column_1 AS alias_2 FROM table_1 WHERE ((table_1.column_1 IS NULL) OR (table_1.column_1 IS NOT NULL))
----
1
1
1
1
1
1
2
2
NULL
NULL

query  rowsort
SELECT table_1.column_1 AS alias_1, 1 AS alias_2 FROM table_1 WHERE (table_1.column_1 IS NULL)
----
NULL
1

query  rowsort
SELECT table_1.column_1 AS alias_1 FROM table_1 WHERE ((table_1.column_1 IS NULL) AND table_1.column_1 IN (?, ?, ?))
? = 0
? = 1
? = 2
----


query  rowsort
SELECT table_1.column_1 AS alias_1, table_1.column_1 AS alias_2 FROM table_1 WHERE ((table_1.column_1 IS NOT NULL) OR (table_1.column_1 IS NULL))
----
1
1
1
1
1
1
2
2
NULL
NULL

query  rowsort
SELECT table_1.column_1 AS alias_1, table_1.column_1 AS alias_2 FROM table_1 WHERE ((table_1.column_1 IS NOT NULL) OR (table_1.column_1 IS NOT NULL))
----
1
1
1
1
1
1
2
2

query  rowsort
SELECT table_1.column_1 AS alias_1, 1 AS alias_2 FROM table_1 WHERE (table_1.column_1 IS NOT NULL)
----
1
1
1
1
1
1
2
1

query  rowsort
SELECT table_1.column_1 AS alias_1 FROM table_1 WHERE ((table_1.column_1 IS NOT NULL) AND table_1.column_1 IN (?, ?, ?))
? = 0
? = 1
? = 2
----
1
1
1
2

query  rowsort
SELECT table_1.column_1 AS alias_1, table_1.column_1 AS alias_2 FROM table_1 WHERE ((table_1.column_1 IS NULL) OR (table_1.column_1 IS NOT NULL))
----
1
1
1
1
1
1
2
2
NULL
NULL

query  rowsort
SELECT table_1.column_1 AS alias_1, 1 AS alias_2 FROM table_1 WHERE (table_1.column_1 IS NULL)
----
NULL
1

query  rowsort
SELECT table_1.column_1 AS alias_1 FROM table_1 WHERE ((table_1.column_1 IS NULL) AND table_1.column_1 IN (?, ?, ?))
? = 0
? = 1
? = 2
----


query  rowsort
SELECT table_1.column_1 AS alias_1, 1 AS alias_2 FROM table_1 WHERE (table_1.column_1 IS NOT NULL)
----
1
1
1
1
1
1
2
1

query  rowsort
SELECT table_1.column_1 AS alias_1 FROM table_1 WHERE ((table_1.column_1 IS NOT NULL) AND table_1.column_1 IN (?, ?, ?))
? = 0
? = 1
? = 2
----
1
1
1
2

query  rowsort
SELECT 1 AS alias_1 FROM table_1 WHERE table_1.column_1 IN (?, ?, ?)
? = 0
? = 1
? = 2
----
1
1
1
1

query  rowsort
SELECT table_1.column_1 AS alias_1, table_1.column_1 AS alias_2, table_1.column_1 AS alias_3 FROM table_1 WHERE (((table_1.column_1 IS NULL) AND (table_1.column_1 IS NOT NULL)) OR (table_1.column_1 IS NULL))
----
NULL
NULL
NULL

query  rowsort
SELECT table_1.column_1 AS alias_1, table_1.column_1 AS alias_2, table_1.column_1 AS alias_3 FROM table_1 WHERE (((table_1.column_1 IS NULL) AND (table_1.column_1 IS NOT NULL)) OR (table_1.column_1 IS NOT NULL))
----
1
1
1
1
1
1
1
1
1
2
2
2

query  rowsort
SELECT table_1.column_1 AS alias_1, table_1.column_1 AS alias_2, 1 AS alias_3 FROM table_1 WHERE ((table_1.column_1 IS NULL) AND (table_1.column_1 IS NOT NULL))
----


query  rowsort
SELECT table_1.column_1 AS alias_1, table_1.column_1 AS alias_2 FROM table_1 WHERE (((table_1.column_1 IS NULL) AND (table_1.column_1 IS NOT NULL)) AND table_1.column_1 IN (?, ?, ?))
? = 0
? = 1
? = 2
----


query  rowsort
SELECT table_1.column_1 AS alias_1, table_1.column_1 AS alias_2, table_1.column_1 AS alias_3 FROM table_1 WHERE (((table_1.column_1 IS NULL) OR (table_1.column_1 IS NULL)) OR (table_1.column_1 IS NOT NULL))
----
1
1
1
1
1
1
1
1
1
2
2
2
NULL
NULL
NULL

query  rowsort
SELECT table_1.column_1 AS alias_1, table_1.column_1 AS alias_2, 1 AS alias_3 FROM table_1 WHERE ((table_1.column_1 IS NULL) OR (table_1.column_1 IS NULL))
----
NULL
NULL
1

query  rowsort
SELECT table_1.column_1 AS alias_1, table_1.column_1 AS alias_2 FROM table_1 WHERE (((table_1.column_1 IS NULL) OR (table_1.column_1 IS NULL)) AND table_1.column_1 IN (?, ?, ?))
? = 0
? = 1
? = 2
----


query  rowsort
SELECT table_1.column_1 AS alias_1, table_1.column_1 AS alias_2, 1 AS alias_3 FROM table_1 WHERE ((table_1.column_1 IS NULL) OR (table_1.column_1 IS NOT NULL))
----
1
1
1
1
1
1
1
1
1
2
2
1
NULL
NULL
1

query  rowsort
SELECT table_1.column_1 AS alias_1, table_1.column_1 AS alias_2 FROM table_1 WHERE (((table_1.column_1 IS NULL) OR (table_1.column_1 IS NOT NULL)) AND table_1.column_1 IN (?, ?, ?))
? = 0
? = 1
? = 2
----
1
1
1
1
1
1
2
2

query  rowsort
SELECT table_1.column_1 AS alias_1, 1 AS alias_2 FROM table_1 WHERE ((table_1.column_1 IS NULL) AND table_1.column_1 IN (?, ?, ?))
? = 0
? = 1
? = 2
----


query  rowsort
SELECT table_1.column_1 AS alias_1, table_1.column_1 AS alias_2, table_1.column_1 AS alias_3 FROM table_1 WHERE (((table_1.column_1 IS NOT NULL) OR (table_1.column_1 IS NULL)) OR (table_1.column_1 IS NOT NULL))
----
1
1
1
1
1
1
1
1
1
2
2
2
NULL
NULL
NULL

query  rowsort
SELECT table_1.column_1 AS alias_1, table_1.column_1 AS alias_2, 1 AS alias_3 FROM table_1 WHERE ((table_1.column_1 IS NOT NULL) OR (table_1.column_1 IS NULL))
----
1
1
1
1
1
1
1
1
1
2
2
1
NULL
NULL
1

query  rowsort
SELECT table_1.column_1 AS alias_1, table_1.column_1 AS alias_2 FROM table_1 WHERE (((table_1.column_1 IS NOT NULL) OR (table_1.column_1 IS NULL)) AND table_1.column_1 IN (?, ?, ?))
? = 0
? = 1
? = 2
----
1
1
1
1
1
1
2
2

query  rowsort
SELECT table_1.column_1 AS alias_1, table_1.column_1 AS alias_2, 1 AS alias_3 FROM table_1 WHERE ((table_1.column_1 IS NOT NULL) OR (table_1.column_1 IS NOT NULL))
----
1
1
1
1
1
1
1
1
1
2
2
1

query  rowsort
SELECT table_1.column_1 AS alias_1, table_1.column_1 AS alias_2 FROM table_1 WHERE (((table_1.column_1 IS NOT NULL) OR (table_1.column_1 IS NOT NULL)) AND table_1.column_1 IN (?, ?, ?))
? = 0
? = 1
? = 2
----
1
1
1
1
1
1
2
2

query  rowsort
SELECT table_1.column_1 AS alias_1, 1 AS alias_2 FROM table_1 WHERE ((table_1.column_1 IS NOT NULL) AND table_1.column_1 IN (?, ?, ?))
? = 0
? = 1
? = 2
----
1
1
1
1
1
1
2
1

query  rowsort
SELECT table_1.column_1 AS alias_1, table_1.column_1 AS alias_2, 1 AS alias_3 FROM table_1 WHERE ((table_1.column_1 IS NULL) OR (table_1.column_1 IS NOT NULL))
----
1
1
1
1
1
1
1
1
1
2
2
1
NULL
NULL
1

query  rowsort
SELECT table_1.column_1 AS alias_1, table_1.column_1 AS alias_2 FROM table_1 WHERE (((table_1.column_1 IS NULL) OR (table_1.column_1 IS NOT NULL)) AND table_1.column_1 IN (?, ?, ?))
? = 0
? = 1
? = 2
----
1
1
1
1
1
1
2
2

query  rowsort
SELECT table_1.column_1 AS alias_1, 1 AS alias_2 FROM table_1 WHERE ((table_1.column_1 IS NULL) AND table_1.column_1 IN (?, ?, ?))
? = 0
? = 1
? = 2
----


query  rowsort
SELECT table_1.column_1 AS alias_1, 1 AS alias_2 FROM table_1 WHERE ((table_1.column_1 IS NOT NULL) AND table_1.column_1 IN (?, ?, ?))
? = 0
? = 1
? = 2
----
1
1
1
1
1
1
2
1

query  rowsort
SELECT table_1.column_1 AS alias_1, table_1.column_1 AS alias_2, table_1.column_1 AS alias_3, table_1.column_1 AS alias_4 FROM table_1 WHERE ((((table_1.column_1 IS NULL) AND (table_1.column_1 IS NOT NULL)) OR (table_1.column_1 IS NULL)) OR (table_1.column_1 IS NOT NULL))
----
1
1
1
1
1
1
1
1
1
1
1
1
2
2
2
2
NULL
NULL
NULL
NULL

query  rowsort
SELECT table_1.column_1 AS alias_1, table_1.column_1 AS alias_2, table_1.column_1 AS alias_3, 1 AS alias_4 FROM table_1 WHERE (((table_1.column_1 IS NULL) AND (table_1.column_1 IS NOT NULL)) OR (table_1.column_1 IS NULL))
----
NULL
NULL
NULL
1

query  rowsort
SELECT table_1.column_1 AS alias_1, table_1.column_1 AS alias_2, table_1.column_1 AS alias_3 FROM table_1 WHERE ((((table_1.column_1 IS NULL) AND (table_1.column_1 IS NOT NULL)) OR (table_1.column_1 IS NULL)) AND table_1.column_1 IN (?, ?, ?))
? = 0
? = 1
? = 2
----


query  rowsort
SELECT table_1.column_1 AS alias_1, table_1.column_1 AS alias_2, table_1.column_1 AS alias_3, 1 AS alias_4 FROM table_1 WHERE (((table_1.column_1 IS NULL) AND (table_1.column_1 IS NOT NULL)) OR (table_1.column_1 IS NOT NULL))
----
1
1
1
1
1
1
1
1
1
1
1
1
2
2
2
1

query  rowsort
SELECT table_1.column_1 AS alias_1, table_1.column_1 AS alias_2, table_1.column_1 AS alias_3 FROM table_1 WHERE ((((table_1.column_1 IS NULL) AND (table_1.column_1 IS NOT NULL)) OR (table_1.column_1 IS NOT NULL)) AND table_1.column_1 IN (?, ?, ?))
? = 0
? = 1
? = 2
----
1
1
1
1
1
1
1
1
1
2
2
2

query  rowsort
SELECT table_1.column_1 AS alias_1, table_1.column_1 AS alias_2, 1 AS alias_3 FROM table_1 WHERE (((table_1.column_1 IS NULL) AND (table_1.column_1 IS NOT NULL)) AND table_1.column_1 IN (?, ?, ?))
? = 0
? = 1
? = 2
----


query  rowsort
SELECT table_1.column_1 AS alias_1, table_1.column_1 AS alias_2, table_1.column_1 AS alias_3, 1 AS alias_4 FROM table_1 WHERE (((table_1.column_1 IS NULL) OR (table_1.column_1 IS NULL)) OR (table_1.column_1 IS NOT NULL))
----
1
1
1
1
1
1
1
1
1
1
1
1
2
2
2
1
NULL
NULL
NULL
1

query  rowsort
SELECT table_1.column_1 AS alias_1, table_1.column_1 AS alias_2, table_1.column_1 AS alias_3 FROM table_1 WHERE ((((table_1.column_1 IS NULL) OR (table_1.column_1 IS NULL)) OR (table_1.column_1 IS NOT NULL)) AND table_1.column_1 IN (?, ?, ?))
? = 0
? = 1
? = 2
----
1
1
1
1
1
1
1
1
1
2
2
2

query  rowsort
SELECT table_1.column_1 AS alias_1, table_1.column_1 AS alias_2, 1 AS alias_3 FROM table_1 WHERE (((table_1.column_1 IS NULL) OR (table_1.column_1 IS NULL)) AND table_1.column_1 IN (?, ?, ?))
? = 0
? = 1
? = 2
----


query  rowsort
SELECT table_1.column_1 AS alias_1, table_1.column_1 AS alias_2, 1 AS alias_3 FROM table_1 WHERE (((table_1.column_1 IS NULL) OR (table_1.column_1 IS NOT NULL)) AND table_1.column_1 IN (?, ?, ?))
? = 0
? = 1
? = 2
----
1
1
1
1
1
1
1
1
1
2
2
1

query  rowsort
SELECT table_1.column_1 AS alias_1, table_1.column_1 AS alias_2, table_1.column_1 AS alias_3, 1 AS alias_4 FROM table_1 WHERE (((table_1.column_1 IS NOT NULL) OR (table_1.column_1 IS NULL)) OR (table_1.column_1 IS NOT NULL))
----
1
1
1
1
1
1
1
1
1
1
1
1
2
2
2
1
NULL
NULL
NULL
1

query  rowsort
SELECT table_1.column_1 AS alias_1, table_1.column_1 AS alias_2, table_1.column_1 AS alias_3 FROM table_1 WHERE ((((table_1.column_1 IS NOT NULL) OR (table_1.column_1 IS NULL)) OR (table_1.column_1 IS NOT NULL)) AND table_1.column_1 IN (?, ?, ?))
? = 0
? = 1
? = 2
----
1
1
1
1
1
1
1
1
1
2
2
2

query  rowsort
SELECT table_1.column_1 AS alias_1, table_1.column_1 AS alias_2, 1 AS alias_3 FROM table_1 WHERE (((table_1.column_1 IS NOT NULL) OR (table_1.column_1 IS NULL)) AND table_1.column_1 IN (?, ?, ?))
? = 0
? = 1
? = 2
----
1
1
1
1
1
1
1
1
1
2
2
1

query  rowsort
SELECT table_1.column_1 AS alias_1, table_1.column_1 AS alias_2, 1 AS alias_3 FROM table_1 WHERE (((table_1.column_1 IS NOT NULL) OR (table_1.column_1 IS NOT NULL)) AND table_1.column_1 IN (?, ?, ?))
? = 0
? = 1
? = 2
----
1
1
1
1
1
1
1
1
1
2
2
1

query  rowsort
SELECT table_1.column_1 AS alias_1, table_1.column_1 AS alias_2, 1 AS alias_3 FROM table_1 WHERE (((table_1.column_1 IS NULL) OR (table_1.column_1 IS NOT NULL)) AND table_1.column_1 IN (?, ?, ?))
? = 0
? = 1
? = 2
----
1
1
1
1
1
1
1
1
1
2
2
1

query  rowsort
SELECT table_1.column_1 AS alias_1, table_1.column_1 AS alias_2, table_1.column_1 AS alias_3, table_1.column_1 AS alias_4, 1 AS alias_5 FROM table_1 WHERE ((((table_1.column_1 IS NULL) AND (table_1.column_1 IS NOT NULL)) OR (table_1.column_1 IS NULL)) OR (table_1.column_1 IS NOT NULL))
----
25 values hashing to aba1499e4ebb355a1a872190bedcf0a0

query  rowsort
SELECT table_1.column_1 AS alias_1, table_1.column_1 AS alias_2, table_1.column_1 AS alias_3, table_1.column_1 AS alias_4 FROM table_1 WHERE (((((table_1.column_1 IS NULL) AND (table_1.column_1 IS NOT NULL)) OR (table_1.column_1 IS NULL)) OR (table_1.column_1 IS NOT NULL)) AND table_1.column_1 IN (?, ?, ?))
? = 0
? = 1
? = 2
----
1
1
1
1
1
1
1
1
1
1
1
1
2
2
2
2

query  rowsort
SELECT table_1.column_1 AS alias_1, table_1.column_1 AS alias_2, table_1.column_1 AS alias_3, 1 AS alias_4 FROM table_1 WHERE ((((table_1.column_1 IS NULL) AND (table_1.column_1 IS NOT NULL)) OR (table_1.column_1 IS NULL)) AND table_1.column_1 IN (?, ?, ?))
? = 0
? = 1
? = 2
----


query  rowsort
SELECT table_1.column_1 AS alias_1, table_1.column_1 AS alias_2, table_1.column_1 AS alias_3, 1 AS alias_4 FROM table_1 WHERE ((((table_1.column_1 IS NULL) AND (table_1.column_1 IS NOT NULL)) OR (table_1.column_1 IS NOT NULL)) AND table_1.column_1 IN (?, ?, ?))
? = 0
? = 1
? = 2
----
1
1
1
1
1
1
1
1
1
1
1
1
2
2
2
1

query  rowsort
SELECT table_1.column_1 AS alias_1, table_1.column_1 AS alias_2, table_1.column_1 AS alias_3, 1 AS alias_4 FROM table_1 WHERE ((((table_1.column_1 IS NULL) OR (table_1.column_1 IS NULL)) OR (table_1.column_1 IS NOT NULL)) AND table_1.column_1 IN (?, ?, ?))
? = 0
? = 1
? = 2
----
1
1
1
1
1
1
1
1
1
1
1
1
2
2
2
1

query  rowsort
SELECT table_1.column_1 AS alias_1, table_1.column_1 AS alias_2, table_1.column_1 AS alias_3, 1 AS alias_4 FROM table_1 WHERE ((((table_1.column_1 IS NOT NULL) OR (table_1.column_1 IS NULL)) OR (table_1.column_1 IS NOT NULL)) AND table_1.column_1 IN (?, ?, ?))
? = 0
? = 1
? = 2
----
1
1
1
1
1
1
1
1
1
1
1
1
2
2
2
1

query  rowsort
SELECT table_1.column_1 AS alias_1, table_1.column_1 AS alias_2, table_1.column_1 AS alias_3, table_1.column_1 AS alias_4, 1 AS alias_5 FROM table_1 WHERE (((((table_1.column_1 IS NULL) AND (table_1.column_1 IS NOT NULL)) OR (table_1.column_1 IS NULL)) OR (table_1.column_1 IS NOT NULL)) AND table_1.column_1 IN (?, ?, ?))
? = 0
? = 1
? = 2
----
1
1
1
1
1
1
1
1
1
1
1
1
1
1
1
2
2
2
2
1

statement ok
DELETE FROM table_1 WHERE (column_2 = 0)


statement ok
DELETE FROM table_1 WHERE (column_2 = 1)


query  rowsort
SELECT table_1.column_1 AS alias_1 FROM table_1 WHERE (table_1.column_1 IS NULL)
----
NULL

query  rowsort
SELECT table_1.column_1 AS alias_1 FROM table_1 WHERE (table_1.column_1 IS NOT NULL)
----
1
2

query  rowsort
SELECT table_1.column_1 AS alias_1 FROM table_1 WHERE (table_1.column_1 IS NULL)
----
NULL

query  rowsort
SELECT table_1.column_1 AS alias_1 FROM table_1 WHERE (table_1.column_1 IS NOT NULL)
----
1
2

query  rowsort
SELECT 1 AS alias_1
----
1

query  rowsort
SELECT table_1.column_1 AS alias_1 FROM table_1 WHERE table_1.column_1 IN (?, ?, ?)
? = 0
? = 1
? = 2
----
1
2

query  rowsort
SELECT table_1.column_1 AS alias_1, table_1.column_1 AS alias_2 FROM table_1 WHERE ((table_1.column_1 IS NULL) AND (table_1.column_1 IS NOT NULL))
----


query  rowsort
SELECT table_1.column_1 AS alias_1, table_1.column_1 AS alias_2 FROM table_1 WHERE ((table_1.column_1 IS NULL) OR (table_1.column_1 IS NULL))
----
NULL
NULL

query  rowsort
SELECT table_1.column_1 AS alias_1, table_1.column_1 AS alias_2 FROM table_1 WHERE ((table_1.column_1 IS NULL) OR (table_1.column_1 IS NOT NULL))
----
1
1
2
2
NULL
NULL

query  rowsort
SELECT table_1.column_1 AS alias_1, 1 AS alias_2 FROM table_1 WHERE (table_1.column_1 IS NULL)
----
NULL
1

query  rowsort
SELECT table_1.column_1 AS alias_1 FROM table_1 WHERE ((table_1.column_1 IS NULL) AND table_1.column_1 IN (?, ?, ?))
? = 0
? = 1
? = 2
----


query  rowsort
SELECT table_1.column_1 AS alias_1, table_1.column_1 AS alias_2 FROM table_1 WHERE ((table_1.column_1 IS NOT NULL) OR (table_1.column_1 IS NULL))
----
1
1
2
2
NULL
NULL

query  rowsort
SELECT table_1.column_1 AS alias_1, table_1.column_1 AS alias_2 FROM table_1 WHERE ((table_1.column_1 IS NOT NULL) OR (table_1.column_1 IS NOT NULL))
----
1
1
2
2

query  rowsort
SELECT table_1.column_1 AS alias_1, 1 AS alias_2 FROM table_1 WHERE (table_1.column_1 IS NOT NULL)
----
1
1
2
1

query  rowsort
SELECT table_1.column_1 AS alias_1 FROM table_1 WHERE ((table_1.column_1 IS NOT NULL) AND table_1.column_1 IN (?, ?, ?))
? = 0
? = 1
? = 2
----
1
2

query  rowsort
SELECT table_1.column_1 AS alias_1, table_1.column_1 AS alias_2 FROM table_1 WHERE ((table_1.column_1 IS NULL) OR (table_1.column_1 IS NOT NULL))
----
1
1
2
2
NULL
NULL

query  rowsort
SELECT table_1.column_1 AS alias_1, 1 AS alias_2 FROM table_1 WHERE (table_1.column_1 IS NULL)
----
NULL
1

query  rowsort
SELECT table_1.column_1 AS alias_1 FROM table_1 WHERE ((table_1.column_1 IS NULL) AND table_1.column_1 IN (?, ?, ?))
? = 0
? = 1
? = 2
----


query  rowsort
SELECT table_1.column_1 AS alias_1, 1 AS alias_2 FROM table_1 WHERE (table_1.column_1 IS NOT NULL)
----
1
1
2
1

query  rowsort
SELECT table_1.column_1 AS alias_1 FROM table_1 WHERE ((table_1.column_1 IS NOT NULL) AND table_1.column_1 IN (?, ?, ?))
? = 0
? = 1
? = 2
----
1
2

query  rowsort
SELECT 1 AS alias_1 FROM table_1 WHERE table_1.column_1 IN (?, ?, ?)
? = 0
? = 1
? = 2
----
1
1

query  rowsort
SELECT table_1.column_1 AS alias_1, table_1.column_1 AS alias_2, table_1.column_1 AS alias_3 FROM table_1 WHERE (((table_1.column_1 IS NULL) AND (table_1.column_1 IS NOT NULL)) OR (table_1.column_1 IS NULL))
----
NULL
NULL
NULL

query  rowsort
SELECT table_1.column_1 AS alias_1, table_1.column_1 AS alias_2, table_1.column_1 AS alias_3 FROM table_1 WHERE (((table_1.column_1 IS NULL) AND (table_1.column_1 IS NOT NULL)) OR (table_1.column_1 IS NOT NULL))
----
1
1
1
2
2
2

query  rowsort
SELECT table_1.column_1 AS alias_1, table_1.column_1 AS alias_2, 1 AS alias_3 FROM table_1 WHERE ((table_1.column_1 IS NULL) AND (table_1.column_1 IS NOT NULL))
----


query  rowsort
SELECT table_1.column_1 AS alias_1, table_1.column_1 AS alias_2 FROM table_1 WHERE (((table_1.column_1 IS NULL) AND (table_1.column_1 IS NOT NULL)) AND table_1.column_1 IN (?, ?, ?))
? = 0
? = 1
? = 2
----


query  rowsort
SELECT table_1.column_1 AS alias_1, table_1.column_1 AS alias_2, table_1.column_1 AS alias_3 FROM table_1 WHERE (((table_1.column_1 IS NULL) OR (table_1.column_1 IS NULL)) OR (table_1.column_1 IS NOT NULL))
----
1
1
1
2
2
2
NULL
NULL
NULL

query  rowsort
SELECT table_1.column_1 AS alias_1, table_1.column_1 AS alias_2, 1 AS alias_3 FROM table_1 WHERE ((table_1.column_1 IS NULL) OR (table_1.column_1 IS NULL))
----
NULL
NULL
1

query  rowsort
SELECT table_1.column_1 AS alias_1, table_1.column_1 AS alias_2 FROM table_1 WHERE (((table_1.column_1 IS NULL) OR (table_1.column_1 IS NULL)) AND table_1.column_1 IN (?, ?, ?))
? = 0
? = 1
? = 2
----


query  rowsort
SELECT table_1.column_1 AS alias_1, table_1.column_1 AS alias_2, 1 AS alias_3 FROM table_1 WHERE ((table_1.column_1 IS NULL) OR (table_1.column_1 IS NOT NULL))
----
1
1
1
2
2
1
NULL
NULL
1

query  rowsort
SELECT table_1.column_1 AS alias_1, table_1.column_1 AS alias_2 FROM table_1 WHERE (((table_1.column_1 IS NULL) OR (table_1.column_1 IS NOT NULL)) AND table_1.column_1 IN (?, ?, ?))
? = 0
? = 1
? = 2
----
1
1
2
2

query  rowsort
SELECT table_1.column_1 AS alias_1, 1 AS alias_2 FROM table_1 WHERE ((table_1.column_1 IS NULL) AND table_1.column_1 IN (?, ?, ?))
? = 0
? = 1
? = 2
----


query  rowsort
SELECT table_1.column_1 AS alias_1, table_1.column_1 AS alias_2, table_1.column_1 AS alias_3 FROM table_1 WHERE (((table_1.column_1 IS NOT NULL) OR (table_1.column_1 IS NULL)) OR (table_1.column_1 IS NOT NULL))
----
1
1
1
2
2
2
NULL
NULL
NULL

query  rowsort
SELECT table_1.column_1 AS alias_1, table_1.column_1 AS alias_2, 1 AS alias_3 FROM table_1 WHERE ((table_1.column_1 IS NOT NULL) OR (table_1.column_1 IS NULL))
----
1
1
1
2
2
1
NULL
NULL
1

query  rowsort
SELECT table_1.column_1 AS alias_1, table_1.column_1 AS alias_2 FROM table_1 WHERE (((table_1.column_1 IS NOT NULL) OR (table_1.column_1 IS NULL)) AND table_1.column_1 IN (?, ?, ?))
? = 0
? = 1
? = 2
----
1
1
2
2

query  rowsort
SELECT table_1.column_1 AS alias_1, table_1.column_1 AS alias_2, 1 AS alias_3 FROM table_1 WHERE ((table_1.column_1 IS NOT NULL) OR (table_1.column_1 IS NOT NULL))
----
1
1
1
2
2
1

query  rowsort
SELECT table_1.column_1 AS alias_1, table_1.column_1 AS alias_2 FROM table_1 WHERE (((table_1.column_1 IS NOT NULL) OR (table_1.column_1 IS NOT NULL)) AND table_1.column_1 IN (?, ?, ?))
? = 0
? = 1
? = 2
----
1
1
2
2

query  rowsort
SELECT table_1.column_1 AS alias_1, 1 AS alias_2 FROM table_1 WHERE ((table_1.column_1 IS NOT NULL) AND table_1.column_1 IN (?, ?, ?))
? = 0
? = 1
? = 2
----
1
1
2
1

query  rowsort
SELECT table_1.column_1 AS alias_1, table_1.column_1 AS alias_2, 1 AS alias_3 FROM table_1 WHERE ((table_1.column_1 IS NULL) OR (table_1.column_1 IS NOT NULL))
----
1
1
1
2
2
1
NULL
NULL
1

query  rowsort
SELECT table_1.column_1 AS alias_1, table_1.column_1 AS alias_2 FROM table_1 WHERE (((table_1.column_1 IS NULL) OR (table_1.column_1 IS NOT NULL)) AND table_1.column_1 IN (?, ?, ?))
? = 0
? = 1
? = 2
----
1
1
2
2

query  rowsort
SELECT table_1.column_1 AS alias_1, 1 AS alias_2 FROM table_1 WHERE ((table_1.column_1 IS NULL) AND table_1.column_1 IN (?, ?, ?))
? = 0
? = 1
? = 2
----


query  rowsort
SELECT table_1.column_1 AS alias_1, 1 AS alias_2 FROM table_1 WHERE ((table_1.column_1 IS NOT NULL) AND table_1.column_1 IN (?, ?, ?))
? = 0
? = 1
? = 2
----
1
1
2
1

query  rowsort
SELECT table_1.column_1 AS alias_1, table_1.column_1 AS alias_2, table_1.column_1 AS alias_3, table_1.column_1 AS alias_4 FROM table_1 WHERE ((((table_1.column_1 IS NULL) AND (table_1.column_1 IS NOT NULL)) OR (table_1.column_1 IS NULL)) OR (table_1.column_1 IS NOT NULL))
----
1
1
1
1
2
2
2
2
NULL
NULL
NULL
NULL

query  rowsort
SELECT table_1.column_1 AS alias_1, table_1.column_1 AS alias_2, table_1.column_1 AS alias_3, 1 AS alias_4 FROM table_1 WHERE (((table_1.column_1 IS NULL) AND (table_1.column_1 IS NOT NULL)) OR (table_1.column_1 IS NULL))
----
NULL
NULL
NULL
1

query  rowsort
SELECT table_1.column_1 AS alias_1, table_1.column_1 AS alias_2, table_1.column_1 AS alias_3 FROM table_1 WHERE ((((table_1.column_1 IS NULL) AND (table_1.column_1 IS NOT NULL)) OR (table_1.column_1 IS NULL)) AND table_1.column_1 IN (?, ?, ?))
? = 0
? = 1
? = 2
----


query  rowsort
SELECT table_1.column_1 AS alias_1, table_1.column_1 AS alias_2, table_1.column_1 AS alias_3, 1 AS alias_4 FROM table_1 WHERE (((table_1.column_1 IS NULL) AND (table_1.column_1 IS NOT NULL)) OR (table_1.column_1 IS NOT NULL))
----
1
1
1
1
2
2
2
1

query  rowsort
SELECT table_1.column_1 AS alias_1, table_1.column_1 AS alias_2, table_1.column_1 AS alias_3 FROM table_1 WHERE ((((table_1.column_1 IS NULL) AND (table_1.column_1 IS NOT NULL)) OR (table_1.column_1 IS NOT NULL)) AND table_1.column_1 IN (?, ?, ?))
? = 0
? = 1
? = 2
----
1
1
1
2
2
2

query  rowsort
SELECT table_1.column_1 AS alias_1, table_1.column_1 AS alias_2, 1 AS alias_3 FROM table_1 WHERE (((table_1.column_1 IS NULL) AND (table_1.column_1 IS NOT NULL)) AND table_1.column_1 IN (?, ?, ?))
? = 0
? = 1
? = 2
----


query  rowsort
SELECT table_1.column_1 AS alias_1, table_1.column_1 AS alias_2, table_1.column_1 AS alias_3, 1 AS alias_4 FROM table_1 WHERE (((table_1.column_1 IS NULL) OR (table_1.column_1 IS NULL)) OR (table_1.column_1 IS NOT NULL))
----
1
1
1
1
2
2
2
1
NULL
NULL
NULL
1

query  rowsort
SELECT table_1.column_1 AS alias_1, table_1.column_1 AS alias_2, table_1.column_1 AS alias_3 FROM table_1 WHERE ((((table_1.column_1 IS NULL) OR (table_1.column_1 IS NULL)) OR (table_1.column_1 IS NOT NULL)) AND table_1.column_1 IN (?, ?, ?))
? = 0
? = 1
? = 2
----
1
1
1
2
2
2

query  rowsort
SELECT table_1.column_1 AS alias_1, table_1.column_1 AS alias_2, 1 AS alias_3 FROM table_1 WHERE (((table_1.column_1 IS NULL) OR (table_1.column_1 IS NULL)) AND table_1.column_1 IN (?, ?, ?))
? = 0
? = 1
? = 2
----


query  rowsort
SELECT table_1.column_1 AS alias_1, table_1.column_1 AS alias_2, 1 AS alias_3 FROM table_1 WHERE (((table_1.column_1 IS NULL) OR (table_1.column_1 IS NOT NULL)) AND table_1.column_1 IN (?, ?, ?))
? = 0
? = 1
? = 2
----
1
1
1
2
2
1

query  rowsort
SELECT table_1.column_1 AS alias_1, table_1.column_1 AS alias_2, table_1.column_1 AS alias_3, 1 AS alias_4 FROM table_1 WHERE (((table_1.column_1 IS NOT NULL) OR (table_1.column_1 IS NULL)) OR (table_1.column_1 IS NOT NULL))
----
1
1
1
1
2
2
2
1
NULL
NULL
NULL
1

query  rowsort
SELECT table_1.column_1 AS alias_1, table_1.column_1 AS alias_2, table_1.column_1 AS alias_3 FROM table_1 WHERE ((((table_1.column_1 IS NOT NULL) OR (table_1.column_1 IS NULL)) OR (table_1.column_1 IS NOT NULL)) AND table_1.column_1 IN (?, ?, ?))
? = 0
? = 1
? = 2
----
1
1
1
2
2
2

query  rowsort
SELECT table_1.column_1 AS alias_1, table_1.column_1 AS alias_2, 1 AS alias_3 FROM table_1 WHERE (((table_1.column_1 IS NOT NULL) OR (table_1.column_1 IS NULL)) AND table_1.column_1 IN (?, ?, ?))
? = 0
? = 1
? = 2
----
1
1
1
2
2
1

query  rowsort
SELECT table_1.column_1 AS alias_1, table_1.column_1 AS alias_2, 1 AS alias_3 FROM table_1 WHERE (((table_1.column_1 IS NOT NULL) OR (table_1.column_1 IS NOT NULL)) AND table_1.column_1 IN (?, ?, ?))
? = 0
? = 1
? = 2
----
1
1
1
2
2
1

query  rowsort
SELECT table_1.column_1 AS alias_1, table_1.column_1 AS alias_2, 1 AS alias_3 FROM table_1 WHERE (((table_1.column_1 IS NULL) OR (table_1.column_1 IS NOT NULL)) AND table_1.column_1 IN (?, ?, ?))
? = 0
? = 1
? = 2
----
1
1
1
2
2
1

query  rowsort
SELECT table_1.column_1 AS alias_1, table_1.column_1 AS alias_2, table_1.column_1 AS alias_3, table_1.column_1 AS alias_4, 1 AS alias_5 FROM table_1 WHERE ((((table_1.column_1 IS NULL) AND (table_1.column_1 IS NOT NULL)) OR (table_1.column_1 IS NULL)) OR (table_1.column_1 IS NOT NULL))
----
1
1
1
1
1
2
2
2
2
1
NULL
NULL
NULL
NULL
1

query  rowsort
SELECT table_1.column_1 AS alias_1, table_1.column_1 AS alias_2, table_1.column_1 AS alias_3, table_1.column_1 AS alias_4 FROM table_1 WHERE (((((table_1.column_1 IS NULL) AND (table_1.column_1 IS NOT NULL)) OR (table_1.column_1 IS NULL)) OR (table_1.column_1 IS NOT NULL)) AND table_1.column_1 IN (?, ?, ?))
? = 0
? = 1
? = 2
----
1
1
1
1
2
2
2
2

query  rowsort
SELECT table_1.column_1 AS alias_1, table_1.column_1 AS alias_2, table_1.column_1 AS alias_3, 1 AS alias_4 FROM table_1 WHERE ((((table_1.column_1 IS NULL) AND (table_1.column_1 IS NOT NULL)) OR (table_1.column_1 IS NULL)) AND table_1.column_1 IN (?, ?, ?))
? = 0
? = 1
? = 2
----


query  rowsort
SELECT table_1.column_1 AS alias_1, table_1.column_1 AS alias_2, table_1.column_1 AS alias_3, 1 AS alias_4 FROM table_1 WHERE ((((table_1.column_1 IS NULL) AND (table_1.column_1 IS NOT NULL)) OR (table_1.column_1 IS NOT NULL)) AND table_1.column_1 IN (?, ?, ?))
? = 0
? = 1
? = 2
----
1
1
1
1
2
2
2
1

query  rowsort
SELECT table_1.column_1 AS alias_1, table_1.column_1 AS alias_2, table_1.column_1 AS alias_3, 1 AS alias_4 FROM table_1 WHERE ((((table_1.column_1 IS NULL) OR (table_1.column_1 IS NULL)) OR (table_1.column_1 IS NOT NULL)) AND table_1.column_1 IN (?, ?, ?))
? = 0
? = 1
? = 2
----
1
1
1
1
2
2
2
1

query  rowsort
SELECT table_1.column_1 AS alias_1, table_1.column_1 AS alias_2, table_1.column_1 AS alias_3, 1 AS alias_4 FROM table_1 WHERE ((((table_1.column_1 IS NOT NULL) OR (table_1.column_1 IS NULL)) OR (table_1.column_1 IS NOT NULL)) AND table_1.column_1 IN (?, ?, ?))
? = 0
? = 1
? = 2
----
1
1
1
1
2
2
2
1

query  rowsort
SELECT table_1.column_1 AS alias_1, table_1.column_1 AS alias_2, table_1.column_1 AS alias_3, table_1.column_1 AS alias_4, 1 AS alias_5 FROM table_1 WHERE (((((table_1.column_1 IS NULL) AND (table_1.column_1 IS NOT NULL)) OR (table_1.column_1 IS NULL)) OR (table_1.column_1 IS NOT NULL)) AND table_1.column_1 IN (?, ?, ?))
? = 0
? = 1
? = 2
----
1
1
1
1
1
2
2
2
2
1
