# Generated by:
#     target/debug/noria-logictest permute --compare-to mysql://root:noria@127.1/noria -d 3 -o logictests/generated/mysql/ --only range_param --random --include-deletes --rows-per-table 10 --subquery-depth 1 --overwrite-tests

statement ok
CREATE TABLE `table_1` (`column_2` INT, `column_1` INT, PRIMARY KEY (`column_2`))


statement ok
INSERT INTO `table_1` (`column_2`, `column_1`) VALUES (0, NULL), (1, -914944039), (2, NULL), (3, 1077133211), (4, NULL), (5, -1856899867), (6, NULL), (7, 833879684), (8, NULL), (9, 595070466)


query  rowsort
SELECT `table_1`.`column_1` AS `alias_1` FROM `table_1` WHERE (`table_1`.`column_1` IS NULL)
----
NULL
NULL
NULL
NULL
NULL

query  rowsort
SELECT `table_1`.`column_1` AS `alias_1` FROM `table_1` WHERE (`table_1`.`column_1` IS NOT NULL)
----
-1856899867
-914944039
1077133211
595070466
833879684

query  rowsort
SELECT `table_1`.`column_1` AS `alias_1` FROM `table_1` WHERE (`table_1`.`column_1` IS NULL)
----
NULL
NULL
NULL
NULL
NULL

query  rowsort
SELECT `table_1`.`column_1` AS `alias_1` FROM `table_1` WHERE (`table_1`.`column_1` IS NOT NULL)
----
-1856899867
-914944039
1077133211
595070466
833879684

query  rowsort
SELECT `table_1`.`column_1` AS `alias_1` FROM `table_1` WHERE (`table_1`.`column_1` > ?)
? = 10
----
1077133211
595070466
833879684

query  rowsort
SELECT `table_1`.`column_1` AS `alias_1`, `table_1`.`column_1` AS `alias_2` FROM `table_1` WHERE ((`table_1`.`column_1` IS NULL) AND (`table_1`.`column_1` IS NOT NULL))
----


query  rowsort
SELECT `table_1`.`column_1` AS `alias_1`, `table_1`.`column_1` AS `alias_2` FROM `table_1` WHERE ((`table_1`.`column_1` IS NULL) OR (`table_1`.`column_1` IS NULL))
----
NULL
NULL
NULL
NULL
NULL
NULL
NULL
NULL
NULL
NULL

query  rowsort
SELECT `table_1`.`column_1` AS `alias_1`, `table_1`.`column_1` AS `alias_2` FROM `table_1` WHERE ((`table_1`.`column_1` IS NULL) OR (`table_1`.`column_1` IS NOT NULL))
----
-1856899867
-1856899867
-914944039
-914944039
1077133211
1077133211
595070466
595070466
833879684
833879684
NULL
NULL
NULL
NULL
NULL
NULL
NULL
NULL
NULL
NULL

query  rowsort
SELECT `table_1`.`column_1` AS `alias_1` FROM `table_1` WHERE ((`table_1`.`column_1` IS NULL) AND (`table_1`.`column_1` > ?))
? = 10
----


query  rowsort
SELECT `table_1`.`column_1` AS `alias_1`, `table_1`.`column_1` AS `alias_2` FROM `table_1` WHERE ((`table_1`.`column_1` IS NOT NULL) OR (`table_1`.`column_1` IS NULL))
----
-1856899867
-1856899867
-914944039
-914944039
1077133211
1077133211
595070466
595070466
833879684
833879684
NULL
NULL
NULL
NULL
NULL
NULL
NULL
NULL
NULL
NULL

query  rowsort
SELECT `table_1`.`column_1` AS `alias_1`, `table_1`.`column_1` AS `alias_2` FROM `table_1` WHERE ((`table_1`.`column_1` IS NOT NULL) OR (`table_1`.`column_1` IS NOT NULL))
----
-1856899867
-1856899867
-914944039
-914944039
1077133211
1077133211
595070466
595070466
833879684
833879684

query  rowsort
SELECT `table_1`.`column_1` AS `alias_1` FROM `table_1` WHERE ((`table_1`.`column_1` IS NOT NULL) AND (`table_1`.`column_1` > ?))
? = 10
----
1077133211
595070466
833879684

query  rowsort
SELECT `table_1`.`column_1` AS `alias_1`, `table_1`.`column_1` AS `alias_2` FROM `table_1` WHERE ((`table_1`.`column_1` IS NULL) OR (`table_1`.`column_1` IS NOT NULL))
----
-1856899867
-1856899867
-914944039
-914944039
1077133211
1077133211
595070466
595070466
833879684
833879684
NULL
NULL
NULL
NULL
NULL
NULL
NULL
NULL
NULL
NULL

query  rowsort
SELECT `table_1`.`column_1` AS `alias_1` FROM `table_1` WHERE ((`table_1`.`column_1` IS NULL) AND (`table_1`.`column_1` > ?))
? = 10
----


query  rowsort
SELECT `table_1`.`column_1` AS `alias_1` FROM `table_1` WHERE ((`table_1`.`column_1` IS NOT NULL) AND (`table_1`.`column_1` > ?))
? = 10
----
1077133211
595070466
833879684

query  rowsort
SELECT `table_1`.`column_1` AS `alias_1`, `table_1`.`column_1` AS `alias_2`, `table_1`.`column_1` AS `alias_3` FROM `table_1` WHERE (((`table_1`.`column_1` IS NULL) AND (`table_1`.`column_1` IS NOT NULL)) OR (`table_1`.`column_1` IS NULL))
----
NULL
NULL
NULL
NULL
NULL
NULL
NULL
NULL
NULL
NULL
NULL
NULL
NULL
NULL
NULL

query  rowsort
SELECT `table_1`.`column_1` AS `alias_1`, `table_1`.`column_1` AS `alias_2`, `table_1`.`column_1` AS `alias_3` FROM `table_1` WHERE (((`table_1`.`column_1` IS NULL) AND (`table_1`.`column_1` IS NOT NULL)) OR (`table_1`.`column_1` IS NOT NULL))
----
-1856899867
-1856899867
-1856899867
-914944039
-914944039
-914944039
1077133211
1077133211
1077133211
595070466
595070466
595070466
833879684
833879684
833879684

query  rowsort
SELECT `table_1`.`column_1` AS `alias_1`, `table_1`.`column_1` AS `alias_2` FROM `table_1` WHERE (((`table_1`.`column_1` IS NULL) AND (`table_1`.`column_1` IS NOT NULL)) AND (`table_1`.`column_1` > ?))
? = 10
----


query  rowsort
SELECT `table_1`.`column_1` AS `alias_1`, `table_1`.`column_1` AS `alias_2`, `table_1`.`column_1` AS `alias_3` FROM `table_1` WHERE (((`table_1`.`column_1` IS NULL) OR (`table_1`.`column_1` IS NULL)) OR (`table_1`.`column_1` IS NOT NULL))
----
30 values hashing to e0d855902503a1d8a56bab8bb373b8b3

query  rowsort
SELECT `table_1`.`column_1` AS `alias_1`, `table_1`.`column_1` AS `alias_2` FROM `table_1` WHERE (((`table_1`.`column_1` IS NULL) OR (`table_1`.`column_1` IS NULL)) AND (`table_1`.`column_1` > ?))
? = 10
----


query  rowsort
SELECT `table_1`.`column_1` AS `alias_1`, `table_1`.`column_1` AS `alias_2` FROM `table_1` WHERE (((`table_1`.`column_1` IS NULL) OR (`table_1`.`column_1` IS NOT NULL)) AND (`table_1`.`column_1` > ?))
? = 10
----
1077133211
1077133211
595070466
595070466
833879684
833879684

query  rowsort
SELECT `table_1`.`column_1` AS `alias_1`, `table_1`.`column_1` AS `alias_2`, `table_1`.`column_1` AS `alias_3` FROM `table_1` WHERE (((`table_1`.`column_1` IS NOT NULL) OR (`table_1`.`column_1` IS NULL)) OR (`table_1`.`column_1` IS NOT NULL))
----
30 values hashing to e0d855902503a1d8a56bab8bb373b8b3

query  rowsort
SELECT `table_1`.`column_1` AS `alias_1`, `table_1`.`column_1` AS `alias_2` FROM `table_1` WHERE (((`table_1`.`column_1` IS NOT NULL) OR (`table_1`.`column_1` IS NULL)) AND (`table_1`.`column_1` > ?))
? = 10
----
1077133211
1077133211
595070466
595070466
833879684
833879684

query  rowsort
SELECT `table_1`.`column_1` AS `alias_1`, `table_1`.`column_1` AS `alias_2` FROM `table_1` WHERE (((`table_1`.`column_1` IS NOT NULL) OR (`table_1`.`column_1` IS NOT NULL)) AND (`table_1`.`column_1` > ?))
? = 10
----
1077133211
1077133211
595070466
595070466
833879684
833879684

query  rowsort
SELECT `table_1`.`column_1` AS `alias_1`, `table_1`.`column_1` AS `alias_2` FROM `table_1` WHERE (((`table_1`.`column_1` IS NULL) OR (`table_1`.`column_1` IS NOT NULL)) AND (`table_1`.`column_1` > ?))
? = 10
----
1077133211
1077133211
595070466
595070466
833879684
833879684

query  rowsort
SELECT `table_1`.`column_1` AS `alias_1`, `table_1`.`column_1` AS `alias_2`, `table_1`.`column_1` AS `alias_3`, `table_1`.`column_1` AS `alias_4` FROM `table_1` WHERE ((((`table_1`.`column_1` IS NULL) AND (`table_1`.`column_1` IS NOT NULL)) OR (`table_1`.`column_1` IS NULL)) OR (`table_1`.`column_1` IS NOT NULL))
----
40 values hashing to 055bd0fd4ac3d37f6eb1c94e16932cc6

query  rowsort
SELECT `table_1`.`column_1` AS `alias_1`, `table_1`.`column_1` AS `alias_2`, `table_1`.`column_1` AS `alias_3` FROM `table_1` WHERE ((((`table_1`.`column_1` IS NULL) AND (`table_1`.`column_1` IS NOT NULL)) OR (`table_1`.`column_1` IS NULL)) AND (`table_1`.`column_1` > ?))
? = 10
----


query  rowsort
SELECT `table_1`.`column_1` AS `alias_1`, `table_1`.`column_1` AS `alias_2`, `table_1`.`column_1` AS `alias_3` FROM `table_1` WHERE ((((`table_1`.`column_1` IS NULL) AND (`table_1`.`column_1` IS NOT NULL)) OR (`table_1`.`column_1` IS NOT NULL)) AND (`table_1`.`column_1` > ?))
? = 10
----
1077133211
1077133211
1077133211
595070466
595070466
595070466
833879684
833879684
833879684

query  rowsort
SELECT `table_1`.`column_1` AS `alias_1`, `table_1`.`column_1` AS `alias_2`, `table_1`.`column_1` AS `alias_3` FROM `table_1` WHERE ((((`table_1`.`column_1` IS NULL) OR (`table_1`.`column_1` IS NULL)) OR (`table_1`.`column_1` IS NOT NULL)) AND (`table_1`.`column_1` > ?))
? = 10
----
1077133211
1077133211
1077133211
595070466
595070466
595070466
833879684
833879684
833879684

query  rowsort
SELECT `table_1`.`column_1` AS `alias_1`, `table_1`.`column_1` AS `alias_2`, `table_1`.`column_1` AS `alias_3` FROM `table_1` WHERE ((((`table_1`.`column_1` IS NOT NULL) OR (`table_1`.`column_1` IS NULL)) OR (`table_1`.`column_1` IS NOT NULL)) AND (`table_1`.`column_1` > ?))
? = 10
----
1077133211
1077133211
1077133211
595070466
595070466
595070466
833879684
833879684
833879684

query  rowsort
SELECT `table_1`.`column_1` AS `alias_1`, `table_1`.`column_1` AS `alias_2`, `table_1`.`column_1` AS `alias_3`, `table_1`.`column_1` AS `alias_4` FROM `table_1` WHERE (((((`table_1`.`column_1` IS NULL) AND (`table_1`.`column_1` IS NOT NULL)) OR (`table_1`.`column_1` IS NULL)) OR (`table_1`.`column_1` IS NOT NULL)) AND (`table_1`.`column_1` > ?))
? = 10
----
1077133211
1077133211
1077133211
1077133211
595070466
595070466
595070466
595070466
833879684
833879684
833879684
833879684

statement ok
DELETE FROM `table_1` WHERE (`column_2` = 0)


statement ok
DELETE FROM `table_1` WHERE (`column_2` = 1)


statement ok
DELETE FROM `table_1` WHERE (`column_2` = 2)


statement ok
DELETE FROM `table_1` WHERE (`column_2` = 3)


statement ok
DELETE FROM `table_1` WHERE (`column_2` = 4)


query  rowsort
SELECT `table_1`.`column_1` AS `alias_1` FROM `table_1` WHERE (`table_1`.`column_1` IS NULL)
----
NULL
NULL

query  rowsort
SELECT `table_1`.`column_1` AS `alias_1` FROM `table_1` WHERE (`table_1`.`column_1` IS NOT NULL)
----
-1856899867
595070466
833879684

query  rowsort
SELECT `table_1`.`column_1` AS `alias_1` FROM `table_1` WHERE (`table_1`.`column_1` IS NULL)
----
NULL
NULL

query  rowsort
SELECT `table_1`.`column_1` AS `alias_1` FROM `table_1` WHERE (`table_1`.`column_1` IS NOT NULL)
----
-1856899867
595070466
833879684

query  rowsort
SELECT `table_1`.`column_1` AS `alias_1` FROM `table_1` WHERE (`table_1`.`column_1` > ?)
? = 10
----
595070466
833879684

query  rowsort
SELECT `table_1`.`column_1` AS `alias_1`, `table_1`.`column_1` AS `alias_2` FROM `table_1` WHERE ((`table_1`.`column_1` IS NULL) AND (`table_1`.`column_1` IS NOT NULL))
----


query  rowsort
SELECT `table_1`.`column_1` AS `alias_1`, `table_1`.`column_1` AS `alias_2` FROM `table_1` WHERE ((`table_1`.`column_1` IS NULL) OR (`table_1`.`column_1` IS NULL))
----
NULL
NULL
NULL
NULL

query  rowsort
SELECT `table_1`.`column_1` AS `alias_1`, `table_1`.`column_1` AS `alias_2` FROM `table_1` WHERE ((`table_1`.`column_1` IS NULL) OR (`table_1`.`column_1` IS NOT NULL))
----
-1856899867
-1856899867
595070466
595070466
833879684
833879684
NULL
NULL
NULL
NULL

query  rowsort
SELECT `table_1`.`column_1` AS `alias_1` FROM `table_1` WHERE ((`table_1`.`column_1` IS NULL) AND (`table_1`.`column_1` > ?))
? = 10
----


query  rowsort
SELECT `table_1`.`column_1` AS `alias_1`, `table_1`.`column_1` AS `alias_2` FROM `table_1` WHERE ((`table_1`.`column_1` IS NOT NULL) OR (`table_1`.`column_1` IS NULL))
----
-1856899867
-1856899867
595070466
595070466
833879684
833879684
NULL
NULL
NULL
NULL

query  rowsort
SELECT `table_1`.`column_1` AS `alias_1`, `table_1`.`column_1` AS `alias_2` FROM `table_1` WHERE ((`table_1`.`column_1` IS NOT NULL) OR (`table_1`.`column_1` IS NOT NULL))
----
-1856899867
-1856899867
595070466
595070466
833879684
833879684

query  rowsort
SELECT `table_1`.`column_1` AS `alias_1` FROM `table_1` WHERE ((`table_1`.`column_1` IS NOT NULL) AND (`table_1`.`column_1` > ?))
? = 10
----
595070466
833879684

query  rowsort
SELECT `table_1`.`column_1` AS `alias_1`, `table_1`.`column_1` AS `alias_2` FROM `table_1` WHERE ((`table_1`.`column_1` IS NULL) OR (`table_1`.`column_1` IS NOT NULL))
----
-1856899867
-1856899867
595070466
595070466
833879684
833879684
NULL
NULL
NULL
NULL

query  rowsort
SELECT `table_1`.`column_1` AS `alias_1` FROM `table_1` WHERE ((`table_1`.`column_1` IS NULL) AND (`table_1`.`column_1` > ?))
? = 10
----


query  rowsort
SELECT `table_1`.`column_1` AS `alias_1` FROM `table_1` WHERE ((`table_1`.`column_1` IS NOT NULL) AND (`table_1`.`column_1` > ?))
? = 10
----
595070466
833879684

query  rowsort
SELECT `table_1`.`column_1` AS `alias_1`, `table_1`.`column_1` AS `alias_2`, `table_1`.`column_1` AS `alias_3` FROM `table_1` WHERE (((`table_1`.`column_1` IS NULL) AND (`table_1`.`column_1` IS NOT NULL)) OR (`table_1`.`column_1` IS NULL))
----
NULL
NULL
NULL
NULL
NULL
NULL

query  rowsort
SELECT `table_1`.`column_1` AS `alias_1`, `table_1`.`column_1` AS `alias_2`, `table_1`.`column_1` AS `alias_3` FROM `table_1` WHERE (((`table_1`.`column_1` IS NULL) AND (`table_1`.`column_1` IS NOT NULL)) OR (`table_1`.`column_1` IS NOT NULL))
----
-1856899867
-1856899867
-1856899867
595070466
595070466
595070466
833879684
833879684
833879684

query  rowsort
SELECT `table_1`.`column_1` AS `alias_1`, `table_1`.`column_1` AS `alias_2` FROM `table_1` WHERE (((`table_1`.`column_1` IS NULL) AND (`table_1`.`column_1` IS NOT NULL)) AND (`table_1`.`column_1` > ?))
? = 10
----


query  rowsort
SELECT `table_1`.`column_1` AS `alias_1`, `table_1`.`column_1` AS `alias_2`, `table_1`.`column_1` AS `alias_3` FROM `table_1` WHERE (((`table_1`.`column_1` IS NULL) OR (`table_1`.`column_1` IS NULL)) OR (`table_1`.`column_1` IS NOT NULL))
----
-1856899867
-1856899867
-1856899867
595070466
595070466
595070466
833879684
833879684
833879684
NULL
NULL
NULL
NULL
NULL
NULL

query  rowsort
SELECT `table_1`.`column_1` AS `alias_1`, `table_1`.`column_1` AS `alias_2` FROM `table_1` WHERE (((`table_1`.`column_1` IS NULL) OR (`table_1`.`column_1` IS NULL)) AND (`table_1`.`column_1` > ?))
? = 10
----


query  rowsort
SELECT `table_1`.`column_1` AS `alias_1`, `table_1`.`column_1` AS `alias_2` FROM `table_1` WHERE (((`table_1`.`column_1` IS NULL) OR (`table_1`.`column_1` IS NOT NULL)) AND (`table_1`.`column_1` > ?))
? = 10
----
595070466
595070466
833879684
833879684

query  rowsort
SELECT `table_1`.`column_1` AS `alias_1`, `table_1`.`column_1` AS `alias_2`, `table_1`.`column_1` AS `alias_3` FROM `table_1` WHERE (((`table_1`.`column_1` IS NOT NULL) OR (`table_1`.`column_1` IS NULL)) OR (`table_1`.`column_1` IS NOT NULL))
----
-1856899867
-1856899867
-1856899867
595070466
595070466
595070466
833879684
833879684
833879684
NULL
NULL
NULL
NULL
NULL
NULL

query  rowsort
SELECT `table_1`.`column_1` AS `alias_1`, `table_1`.`column_1` AS `alias_2` FROM `table_1` WHERE (((`table_1`.`column_1` IS NOT NULL) OR (`table_1`.`column_1` IS NULL)) AND (`table_1`.`column_1` > ?))
? = 10
----
595070466
595070466
833879684
833879684

query  rowsort
SELECT `table_1`.`column_1` AS `alias_1`, `table_1`.`column_1` AS `alias_2` FROM `table_1` WHERE (((`table_1`.`column_1` IS NOT NULL) OR (`table_1`.`column_1` IS NOT NULL)) AND (`table_1`.`column_1` > ?))
? = 10
----
595070466
595070466
833879684
833879684

query  rowsort
SELECT `table_1`.`column_1` AS `alias_1`, `table_1`.`column_1` AS `alias_2` FROM `table_1` WHERE (((`table_1`.`column_1` IS NULL) OR (`table_1`.`column_1` IS NOT NULL)) AND (`table_1`.`column_1` > ?))
? = 10
----
595070466
595070466
833879684
833879684

query  rowsort
SELECT `table_1`.`column_1` AS `alias_1`, `table_1`.`column_1` AS `alias_2`, `table_1`.`column_1` AS `alias_3`, `table_1`.`column_1` AS `alias_4` FROM `table_1` WHERE ((((`table_1`.`column_1` IS NULL) AND (`table_1`.`column_1` IS NOT NULL)) OR (`table_1`.`column_1` IS NULL)) OR (`table_1`.`column_1` IS NOT NULL))
----
-1856899867
-1856899867
-1856899867
-1856899867
595070466
595070466
595070466
595070466
833879684
833879684
833879684
833879684
NULL
NULL
NULL
NULL
NULL
NULL
NULL
NULL

query  rowsort
SELECT `table_1`.`column_1` AS `alias_1`, `table_1`.`column_1` AS `alias_2`, `table_1`.`column_1` AS `alias_3` FROM `table_1` WHERE ((((`table_1`.`column_1` IS NULL) AND (`table_1`.`column_1` IS NOT NULL)) OR (`table_1`.`column_1` IS NULL)) AND (`table_1`.`column_1` > ?))
? = 10
----


query  rowsort
SELECT `table_1`.`column_1` AS `alias_1`, `table_1`.`column_1` AS `alias_2`, `table_1`.`column_1` AS `alias_3` FROM `table_1` WHERE ((((`table_1`.`column_1` IS NULL) AND (`table_1`.`column_1` IS NOT NULL)) OR (`table_1`.`column_1` IS NOT NULL)) AND (`table_1`.`column_1` > ?))
? = 10
----
595070466
595070466
595070466
833879684
833879684
833879684

query  rowsort
SELECT `table_1`.`column_1` AS `alias_1`, `table_1`.`column_1` AS `alias_2`, `table_1`.`column_1` AS `alias_3` FROM `table_1` WHERE ((((`table_1`.`column_1` IS NULL) OR (`table_1`.`column_1` IS NULL)) OR (`table_1`.`column_1` IS NOT NULL)) AND (`table_1`.`column_1` > ?))
? = 10
----
595070466
595070466
595070466
833879684
833879684
833879684

query  rowsort
SELECT `table_1`.`column_1` AS `alias_1`, `table_1`.`column_1` AS `alias_2`, `table_1`.`column_1` AS `alias_3` FROM `table_1` WHERE ((((`table_1`.`column_1` IS NOT NULL) OR (`table_1`.`column_1` IS NULL)) OR (`table_1`.`column_1` IS NOT NULL)) AND (`table_1`.`column_1` > ?))
? = 10
----
595070466
595070466
595070466
833879684
833879684
833879684

query  rowsort
SELECT `table_1`.`column_1` AS `alias_1`, `table_1`.`column_1` AS `alias_2`, `table_1`.`column_1` AS `alias_3`, `table_1`.`column_1` AS `alias_4` FROM `table_1` WHERE (((((`table_1`.`column_1` IS NULL) AND (`table_1`.`column_1` IS NOT NULL)) OR (`table_1`.`column_1` IS NULL)) OR (`table_1`.`column_1` IS NOT NULL)) AND (`table_1`.`column_1` > ?))
? = 10
----
595070466
595070466
595070466
595070466
833879684
833879684
833879684
833879684
