# Generated by:
#     target/debug/noria-logictest permute --compare-to mysql://root:noria@127.1/noria -d 3 -o logictests/generated/mysql/ --only range_param --random --include-deletes --rows-per-table 10 --subquery-depth 1

statement ok
CREATE TABLE `table_1` (`column_11` INT, `column_6` INT, `column_1` INT, `column_2` INT, `column_7` INT, `column_5` INT, `column_3` INT, `column_8` INT, `column_9` INT, `column_4` INT, `column_12` INT, `column_10` INT, `column_13` INT, PRIMARY KEY (`column_13`))


statement ok
INSERT INTO `table_1` (`column_11`, `column_6`, `column_1`, `column_2`, `column_7`, `column_5`, `column_3`, `column_8`, `column_9`, `column_4`, `column_12`, `column_10`, `column_13`) VALUES (-1996252862, 5776027, -1255262406, 1564808126, 565291045, 1288966893, 1033395504, -759254176, -2082664648, 2016647452, 310594543, -1040134276, 0), (1907949418, 81453554, 1986917423, -832167032, 431304980, -1029775581, -101934235, 1400558367, 1193428297, 290079170, 1249513800, 940270734, 1), (-438638489, -1929289333, 986644737, 2077102418, -1745918283, -1476741960, 1063603018, 1040961910, 1531203050, -1964947483, 1003980694, 351483686, 2), (-2094114106, 886378778, 477588428, 1467879557, -618851032, 340144624, -1927548719, 96631314, 1901912307, 1047970682, 1053328475, 2011331577, 3), (-1290106665, 85181266, -1000356628, -2054142032, 1264289336, -764502800, 1171144144, -1267562569, -2057219646, -88624711, 1634086772, -1094598626, 4), (1825144403, 967330130, 867077090, 17440832, -994320378, -1316284481, -672215246, 1934455472, 28313817, -2026504891, -1249731306, -429467811, 5), (-85106441, 1057917457, -1683386078, 917264534, -868189628, 352328631, -1182467842, 1143148317, 1694351982, -1600662508, 360005511, -1939202874, 6), (-1065189377, -106782708, 1649216154, 1999002330, -1836542405, 2030148603, -128866598, 1076245852, -316041987, -676843598, 1676504115, 1119499476, 7), (1106882269, 157001876, -547789517, -1645828919, 431622594, 289339122, 716537705, -582831312, -270407791, -168407757, 1660139246, 1579514100, 8), (-94685396, 1868494255, 270521575, 377671091, 1709308286, -317607788, 1246606669, 429856082, -1797340459, -166825695, 640826574, 271185572, 9)


query  rowsort
SELECT count(`table_1`.`column_1`) AS `alias_1` FROM `table_1` INNER JOIN (SELECT count(`table_1`.`column_2`) AS `alias_2` FROM `table_1`) AS alias_3 ON (`table_1`.`column_1` = `alias_3`.`alias_2`)
----
0

query  rowsort
SELECT count(`table_1`.`column_3`) AS `alias_1` FROM `table_1` INNER JOIN (SELECT `table_1`.`column_1` AS `alias_2` FROM `table_1`) AS alias_3 ON (`table_1`.`column_1` = `alias_3`.`alias_2`)
----
10

query  rowsort
SELECT count(`table_1`.`column_4`) AS `alias_1` FROM `table_1` INNER JOIN (SELECT count(`table_1`.`column_5`) AS `alias_2` FROM `table_1`) AS alias_3 ON (`table_1`.`column_4` = `alias_3`.`alias_2`)
----
0

query  rowsort
SELECT `table_1`.`column_6` AS `alias_3` FROM `table_1` INNER JOIN (SELECT count(`table_1`.`column_6`) AS `alias_1` FROM `table_1`) AS alias_2 ON (`table_1`.`column_6` = `alias_2`.`alias_1`) WHERE (`table_1`.`column_4` > ?)
? = 10
----


query  rowsort
SELECT `table_1`.`column_6` AS `alias_3` FROM `table_1` INNER JOIN (SELECT `table_1`.`column_6` AS `alias_1` FROM `table_1`) AS alias_2 ON (`table_1`.`column_6` = `alias_2`.`alias_1`) WHERE (`table_1`.`column_6` > ?)
? = 10
----
1057917457
157001876
1868494255
5776027
81453554
85181266
886378778
967330130

query  rowsort
SELECT `table_1`.`column_7` AS `alias_3` FROM `table_1` INNER JOIN (SELECT count(`table_1`.`column_7`) AS `alias_1` FROM `table_1`) AS alias_2 ON (`table_1`.`column_7` = `alias_2`.`alias_1`) WHERE (`table_1`.`column_6` > ?)
? = 10
----


query  rowsort
SELECT count(`table_1`.`column_8`) AS `alias_1` FROM `table_1` INNER JOIN (SELECT count(`table_1`.`column_9`) AS `alias_2` FROM `table_1`) AS alias_3 ON (`table_1`.`column_6` = `alias_3`.`alias_2`) WHERE (`table_1`.`column_6` > ?)
? = 10
----
0

query  rowsort
SELECT count(`table_1`.`column_10`) AS `alias_1` FROM `table_1` INNER JOIN (SELECT `table_1`.`column_6` AS `alias_2` FROM `table_1`) AS alias_3 ON (`table_1`.`column_6` = `alias_3`.`alias_2`) WHERE (`table_1`.`column_6` > ?)
? = 10
----
8

query  rowsort
SELECT count(`table_1`.`column_11`) AS `alias_1` FROM `table_1` INNER JOIN (SELECT count(`table_1`.`column_12`) AS `alias_2` FROM `table_1`) AS alias_3 ON (`table_1`.`column_11` = `alias_3`.`alias_2`) WHERE (`table_1`.`column_11` > ?)
? = 10
----
0

statement ok
DELETE FROM `table_1` WHERE (`column_13` = 0)


statement ok
DELETE FROM `table_1` WHERE (`column_13` = 1)


statement ok
DELETE FROM `table_1` WHERE (`column_13` = 2)


statement ok
DELETE FROM `table_1` WHERE (`column_13` = 3)


statement ok
DELETE FROM `table_1` WHERE (`column_13` = 4)


query  rowsort
SELECT count(`table_1`.`column_1`) AS `alias_1` FROM `table_1` INNER JOIN (SELECT count(`table_1`.`column_2`) AS `alias_2` FROM `table_1`) AS alias_3 ON (`table_1`.`column_1` = `alias_3`.`alias_2`)
----
0

query  rowsort
SELECT count(`table_1`.`column_3`) AS `alias_1` FROM `table_1` INNER JOIN (SELECT `table_1`.`column_1` AS `alias_2` FROM `table_1`) AS alias_3 ON (`table_1`.`column_1` = `alias_3`.`alias_2`)
----
5

query  rowsort
SELECT count(`table_1`.`column_4`) AS `alias_1` FROM `table_1` INNER JOIN (SELECT count(`table_1`.`column_5`) AS `alias_2` FROM `table_1`) AS alias_3 ON (`table_1`.`column_4` = `alias_3`.`alias_2`)
----
0

query  rowsort
SELECT `table_1`.`column_6` AS `alias_3` FROM `table_1` INNER JOIN (SELECT count(`table_1`.`column_6`) AS `alias_1` FROM `table_1`) AS alias_2 ON (`table_1`.`column_6` = `alias_2`.`alias_1`) WHERE (`table_1`.`column_4` > ?)
? = 10
----


query  rowsort
SELECT `table_1`.`column_6` AS `alias_3` FROM `table_1` INNER JOIN (SELECT `table_1`.`column_6` AS `alias_1` FROM `table_1`) AS alias_2 ON (`table_1`.`column_6` = `alias_2`.`alias_1`) WHERE (`table_1`.`column_6` > ?)
? = 10
----
1057917457
157001876
1868494255
967330130

query  rowsort
SELECT `table_1`.`column_7` AS `alias_3` FROM `table_1` INNER JOIN (SELECT count(`table_1`.`column_7`) AS `alias_1` FROM `table_1`) AS alias_2 ON (`table_1`.`column_7` = `alias_2`.`alias_1`) WHERE (`table_1`.`column_6` > ?)
? = 10
----


query  rowsort
SELECT count(`table_1`.`column_8`) AS `alias_1` FROM `table_1` INNER JOIN (SELECT count(`table_1`.`column_9`) AS `alias_2` FROM `table_1`) AS alias_3 ON (`table_1`.`column_6` = `alias_3`.`alias_2`) WHERE (`table_1`.`column_6` > ?)
? = 10
----
0

query  rowsort
SELECT count(`table_1`.`column_10`) AS `alias_1` FROM `table_1` INNER JOIN (SELECT `table_1`.`column_6` AS `alias_2` FROM `table_1`) AS alias_3 ON (`table_1`.`column_6` = `alias_3`.`alias_2`) WHERE (`table_1`.`column_6` > ?)
? = 10
----
4

query  rowsort
SELECT count(`table_1`.`column_11`) AS `alias_1` FROM `table_1` INNER JOIN (SELECT count(`table_1`.`column_12`) AS `alias_2` FROM `table_1`) AS alias_3 ON (`table_1`.`column_11` = `alias_3`.`alias_2`) WHERE (`table_1`.`column_11` > ?)
? = 10
----
0
