# Generated by:
#     target/debug/noria-logictest permute --compare-to mysql://root:noria@127.1/noria -d 3 -o logictests/generated/mysql/ --only range_param --random --include-deletes --rows-per-table 10 --subquery-depth 1 --overwrite-tests

statement ok
CREATE TABLE `table_1` (`column_1` INT, `column_2` INT, PRIMARY KEY (`column_2`))


statement ok
INSERT INTO `table_1` (`column_1`, `column_2`) VALUES (815787881, 0), (-33992765, 1), (-747166133, 2), (1244158113, 3), (1684538645, 4), (-545172073, 5), (-1434956850, 6), (-782731091, 7), (-1208776987, 8), (1178235075, 9)


query  rowsort
SELECT `table_1`.`column_1` AS `alias_3` FROM `table_1` INNER JOIN (SELECT `table_1`.`column_1` AS `alias_1` FROM `table_1`) AS alias_2 ON (`table_1`.`column_1` = `alias_2`.`alias_1`) WHERE (`table_1`.`column_1` > ?)
? = 10
----
1178235075
1244158113
1684538645
815787881

statement ok
DELETE FROM `table_1` WHERE (`column_2` = 0)


statement ok
DELETE FROM `table_1` WHERE (`column_2` = 1)


statement ok
DELETE FROM `table_1` WHERE (`column_2` = 2)


statement ok
DELETE FROM `table_1` WHERE (`column_2` = 3)


statement ok
DELETE FROM `table_1` WHERE (`column_2` = 4)


query  rowsort
SELECT `table_1`.`column_1` AS `alias_3` FROM `table_1` INNER JOIN (SELECT `table_1`.`column_1` AS `alias_1` FROM `table_1`) AS alias_2 ON (`table_1`.`column_1` = `alias_2`.`alias_1`) WHERE (`table_1`.`column_1` > ?)
? = 10
----
1178235075
