# Generated by:
#     target/debug/noria-logictest permute --compare-to mysql://root:noria@127.1/noria -d 3 -o logictests/generated/mysql/ --only range_param --random --include-deletes --rows-per-table 10 --subquery-depth 1

statement ok
CREATE TABLE `table_1` (`column_13` INT, `column_10` INT, `column_3` INT, `column_2` INT, `column_1` INT, `column_7` INT, `column_8` INT, `column_12` INT, `column_5` INT, `column_6` INT, `column_4` INT, `column_9` INT, `column_11` INT, PRIMARY KEY (`column_13`))


statement ok
INSERT INTO `table_1` (`column_13`, `column_10`, `column_3`, `column_2`, `column_1`, `column_7`, `column_8`, `column_12`, `column_5`, `column_6`, `column_4`, `column_9`, `column_11`) VALUES (0, 2035940850, -458052604, -130924568, -972748070, 95738904, 1315996298, -984508350, 1028515232, -998967073, 1763149715, 1560199415, 1915993113), (1, 1809427531, 42343086, -573508574, -1028806759, -154277000, -1362926930, 1149299570, 265906938, 894680809, -787091845, -118030689, -2052066601), (2, 1658350144, -993747548, -137430752, 861855676, 281129071, -1498409602, -319679059, -1043363058, -406101385, 1195303247, 1632601882, 1527236325), (3, -499439159, 1488581332, 719170095, 1288935799, 633477336, 1707485944, -1049945199, 442122005, -288256311, 1024193412, 2078889597, 1306999997), (4, -1734960359, -1255260436, -958513275, 1094026853, 1884718883, -1783173511, -1903873666, 1994811660, -2001396181, -580740021, -9363022, 1500042065), (5, -1943273993, 1815539896, 116335002, 13826019, 106043019, 792704146, 28079173, 1069823448, -455828438, -449267951, -1422673454, 1724951459), (6, 1344710284, -1861132478, -157229850, 647718142, -693192291, -62560299, 2000714667, 685414185, -1655979956, -66620612, -1736558713, 779714245), (7, 1049905266, 850298408, -1716187847, 1337707412, -284729139, -1168396950, -1433149326, 1995278667, 1175341311, -319919283, 585543350, -1314445763), (8, -748581639, 2014646143, -464597236, -1320233609, -1968816206, 752597105, 117047802, -818321024, -2077394858, -1568261412, 2072638166, -289620723), (9, 1042437646, -380071463, 728307159, 514579677, 357977941, -1304875159, 844611189, 81808106, 1390246899, 969398206, 628682796, -1082650571)


query  rowsort
SELECT count(distinct `table_1`.`column_1`) AS `alias_1` FROM `table_1` INNER JOIN (SELECT count(distinct `table_1`.`column_2`) AS `alias_2` FROM `table_1`) AS alias_3 ON (`table_1`.`column_2` = `alias_3`.`alias_2`)
----
0

query  rowsort
SELECT count(distinct `table_1`.`column_3`) AS `alias_1` FROM `table_1` INNER JOIN (SELECT `table_1`.`column_3` AS `alias_2` FROM `table_1`) AS alias_3 ON (`table_1`.`column_3` = `alias_3`.`alias_2`)
----
10

query  rowsort
SELECT count(distinct `table_1`.`column_4`) AS `alias_1` FROM `table_1` INNER JOIN (SELECT count(distinct `table_1`.`column_5`) AS `alias_2` FROM `table_1`) AS alias_3 ON (`table_1`.`column_4` = `alias_3`.`alias_2`)
----
0

query  rowsort
SELECT `table_1`.`column_4` AS `alias_3` FROM `table_1` INNER JOIN (SELECT count(distinct `table_1`.`column_6`) AS `alias_1` FROM `table_1`) AS alias_2 ON (`table_1`.`column_4` = `alias_2`.`alias_1`) WHERE (`table_1`.`column_4` > ?)
? = 10
----


query  rowsort
SELECT `table_1`.`column_4` AS `alias_3` FROM `table_1` INNER JOIN (SELECT `table_1`.`column_4` AS `alias_1` FROM `table_1`) AS alias_2 ON (`table_1`.`column_4` = `alias_2`.`alias_1`) WHERE (`table_1`.`column_4` > ?)
? = 10
----
1024193412
1195303247
1763149715
969398206

query  rowsort
SELECT `table_1`.`column_4` AS `alias_3` FROM `table_1` INNER JOIN (SELECT count(distinct `table_1`.`column_7`) AS `alias_1` FROM `table_1`) AS alias_2 ON (`table_1`.`column_4` = `alias_2`.`alias_1`) WHERE (`table_1`.`column_4` > ?)
? = 10
----


query  rowsort
SELECT count(distinct `table_1`.`column_8`) AS `alias_1` FROM `table_1` INNER JOIN (SELECT count(distinct `table_1`.`column_9`) AS `alias_2` FROM `table_1`) AS alias_3 ON (`table_1`.`column_3` = `alias_3`.`alias_2`) WHERE (`table_1`.`column_3` > ?)
? = 10
----
0

query  rowsort
SELECT count(distinct `table_1`.`column_10`) AS `alias_1` FROM `table_1` INNER JOIN (SELECT `table_1`.`column_10` AS `alias_2` FROM `table_1`) AS alias_3 ON (`table_1`.`column_10` = `alias_3`.`alias_2`) WHERE (`table_1`.`column_10` > ?)
? = 10
----
6

query  rowsort
SELECT count(distinct `table_1`.`column_11`) AS `alias_1` FROM `table_1` INNER JOIN (SELECT count(distinct `table_1`.`column_12`) AS `alias_2` FROM `table_1`) AS alias_3 ON (`table_1`.`column_10` = `alias_3`.`alias_2`) WHERE (`table_1`.`column_10` > ?)
? = 10
----
0

statement ok
DELETE FROM `table_1` WHERE (`column_13` = 0)


statement ok
DELETE FROM `table_1` WHERE (`column_13` = 1)


statement ok
DELETE FROM `table_1` WHERE (`column_13` = 2)


statement ok
DELETE FROM `table_1` WHERE (`column_13` = 3)


statement ok
DELETE FROM `table_1` WHERE (`column_13` = 4)


query  rowsort
SELECT count(distinct `table_1`.`column_1`) AS `alias_1` FROM `table_1` INNER JOIN (SELECT count(distinct `table_1`.`column_2`) AS `alias_2` FROM `table_1`) AS alias_3 ON (`table_1`.`column_2` = `alias_3`.`alias_2`)
----
0

query  rowsort
SELECT count(distinct `table_1`.`column_3`) AS `alias_1` FROM `table_1` INNER JOIN (SELECT `table_1`.`column_3` AS `alias_2` FROM `table_1`) AS alias_3 ON (`table_1`.`column_3` = `alias_3`.`alias_2`)
----
5

query  rowsort
SELECT count(distinct `table_1`.`column_4`) AS `alias_1` FROM `table_1` INNER JOIN (SELECT count(distinct `table_1`.`column_5`) AS `alias_2` FROM `table_1`) AS alias_3 ON (`table_1`.`column_4` = `alias_3`.`alias_2`)
----
0

query  rowsort
SELECT `table_1`.`column_4` AS `alias_3` FROM `table_1` INNER JOIN (SELECT count(distinct `table_1`.`column_6`) AS `alias_1` FROM `table_1`) AS alias_2 ON (`table_1`.`column_4` = `alias_2`.`alias_1`) WHERE (`table_1`.`column_4` > ?)
? = 10
----


query  rowsort
SELECT `table_1`.`column_4` AS `alias_3` FROM `table_1` INNER JOIN (SELECT `table_1`.`column_4` AS `alias_1` FROM `table_1`) AS alias_2 ON (`table_1`.`column_4` = `alias_2`.`alias_1`) WHERE (`table_1`.`column_4` > ?)
? = 10
----
969398206

query  rowsort
SELECT `table_1`.`column_4` AS `alias_3` FROM `table_1` INNER JOIN (SELECT count(distinct `table_1`.`column_7`) AS `alias_1` FROM `table_1`) AS alias_2 ON (`table_1`.`column_4` = `alias_2`.`alias_1`) WHERE (`table_1`.`column_4` > ?)
? = 10
----


query  rowsort
SELECT count(distinct `table_1`.`column_8`) AS `alias_1` FROM `table_1` INNER JOIN (SELECT count(distinct `table_1`.`column_9`) AS `alias_2` FROM `table_1`) AS alias_3 ON (`table_1`.`column_3` = `alias_3`.`alias_2`) WHERE (`table_1`.`column_3` > ?)
? = 10
----
0

query  rowsort
SELECT count(distinct `table_1`.`column_10`) AS `alias_1` FROM `table_1` INNER JOIN (SELECT `table_1`.`column_10` AS `alias_2` FROM `table_1`) AS alias_3 ON (`table_1`.`column_10` = `alias_3`.`alias_2`) WHERE (`table_1`.`column_10` > ?)
? = 10
----
3

query  rowsort
SELECT count(distinct `table_1`.`column_11`) AS `alias_1` FROM `table_1` INNER JOIN (SELECT count(distinct `table_1`.`column_12`) AS `alias_2` FROM `table_1`) AS alias_3 ON (`table_1`.`column_10` = `alias_3`.`alias_2`) WHERE (`table_1`.`column_10` > ?)
? = 10
----
0
