# Generated by:
#     target/debug/noria-logictest permute --compare-to mysql://root:noria@127.1/noria -d 3 -o logictests/generated/mysql/ --only range_param --random --include-deletes --rows-per-table 10 --subquery-depth 1

statement ok
CREATE TABLE `table_1` (`column_1` INT, `column_5` INT, `column_7` INT, `column_3` INT, `column_8` INT, `column_2` INT, `column_4` INT, `column_9` INT, `column_10` INT, `column_12` INT, `column_13` INT, `column_6` INT, `column_11` INT, PRIMARY KEY (`column_13`))


statement ok
INSERT INTO `table_1` (`column_1`, `column_5`, `column_7`, `column_3`, `column_8`, `column_2`, `column_4`, `column_9`, `column_10`, `column_12`, `column_13`, `column_6`, `column_11`) VALUES (996769850, -384904807, -227382725, 1398950617, -134081597, -1352442639, -544663330, 57156464, -1422844959, 610390317, 0, 2027980393, -1349174984), (642208764, -1436158, -290162647, -515675501, 1649200854, 796542016, -166522216, 670977492, 247711738, 851776167, 1, 801653227, 830657969), (598664490, 74829284, 366745085, 657499973, 1229937956, -1942843584, 1833159391, 635176099, 2030247452, 2043473089, 2, 558578039, -1593375524), (2070346907, -1526073132, 1800046637, -523742851, 749186932, 1982613494, 1065498332, -2133833608, -1150772737, -1669122308, 3, 533766838, 297347371), (440534333, 244751890, 645134297, 1975590615, 1275718999, -1444121607, 1083535397, 596650444, 2064355180, -1581249659, 4, -1160596512, 1283501395), (2078495388, -152629553, -62294505, 196811519, 587453235, 1802115261, 1203803329, 1302011659, -559617223, -1891457711, 5, 1876469842, 2120829851), (-327601791, -437109041, 623381196, 1297083117, 520836228, 599424612, -1602895280, -382480117, 829528717, -325268012, 6, 783771118, -460714279), (-509111025, 1787591169, 555453483, -1812940606, 1631184668, 460746472, 1044701938, -91340469, -1905746205, 1705857607, 7, 1533229549, -1173274680), (1864454160, -859398846, 863373763, -2036458151, -586887679, 1563623723, 1771480326, 927458736, 1759347550, 1098786596, 8, 1239697441, -2027509984), (-1978400174, 91076674, 1231617310, -196426692, 2027421530, -1790821468, -1446706384, -1738433754, 128384895, -1317901218, 9, -366513416, 1434044312)


query  rowsort
SELECT sum(distinct `table_1`.`column_1`) AS `alias_1` FROM `table_1` INNER JOIN (SELECT sum(distinct `table_1`.`column_2`) AS `alias_2` FROM `table_1`) AS alias_3 ON (`table_1`.`column_2` = `alias_3`.`alias_2`)
----
NULL

query  rowsort
SELECT sum(distinct `table_1`.`column_3`) AS `alias_1` FROM `table_1` INNER JOIN (SELECT `table_1`.`column_2` AS `alias_2` FROM `table_1`) AS alias_3 ON (`table_1`.`column_2` = `alias_3`.`alias_2`)
----
440692040

query  rowsort
SELECT sum(distinct `table_1`.`column_4`) AS `alias_1` FROM `table_1` INNER JOIN (SELECT sum(distinct `table_1`.`column_5`) AS `alias_2` FROM `table_1`) AS alias_3 ON (`table_1`.`column_2` = `alias_3`.`alias_2`)
----
NULL

query  rowsort
SELECT `table_1`.`column_2` AS `alias_3` FROM `table_1` INNER JOIN (SELECT sum(distinct `table_1`.`column_6`) AS `alias_1` FROM `table_1`) AS alias_2 ON (`table_1`.`column_2` = `alias_2`.`alias_1`) WHERE (`table_1`.`column_2` > ?)
? = 10
----


query  rowsort
SELECT `table_1`.`column_2` AS `alias_3` FROM `table_1` INNER JOIN (SELECT `table_1`.`column_2` AS `alias_1` FROM `table_1`) AS alias_2 ON (`table_1`.`column_2` = `alias_2`.`alias_1`) WHERE (`table_1`.`column_2` > ?)
? = 10
----
1563623723
1802115261
1982613494
460746472
599424612
796542016

query  rowsort
SELECT `table_1`.`column_2` AS `alias_3` FROM `table_1` INNER JOIN (SELECT sum(distinct `table_1`.`column_7`) AS `alias_1` FROM `table_1`) AS alias_2 ON (`table_1`.`column_2` = `alias_2`.`alias_1`) WHERE (`table_1`.`column_2` > ?)
? = 10
----


query  rowsort
SELECT sum(distinct `table_1`.`column_8`) AS `alias_1` FROM `table_1` INNER JOIN (SELECT sum(distinct `table_1`.`column_9`) AS `alias_2` FROM `table_1`) AS alias_3 ON (`table_1`.`column_1` = `alias_3`.`alias_2`) WHERE (`table_1`.`column_1` > ?)
? = 10
----
NULL

query  rowsort
SELECT sum(distinct `table_1`.`column_10`) AS `alias_1` FROM `table_1` INNER JOIN (SELECT `table_1`.`column_1` AS `alias_2` FROM `table_1`) AS alias_3 ON (`table_1`.`column_1` = `alias_3`.`alias_2`) WHERE (`table_1`.`column_1` > ?)
? = 10
----
2968427001

query  rowsort
SELECT sum(distinct `table_1`.`column_11`) AS `alias_1` FROM `table_1` INNER JOIN (SELECT sum(distinct `table_1`.`column_12`) AS `alias_2` FROM `table_1`) AS alias_3 ON (`table_1`.`column_1` = `alias_3`.`alias_2`) WHERE (`table_1`.`column_1` > ?)
? = 10
----
NULL

statement ok
DELETE FROM `table_1` WHERE (`column_13` = 0)


statement ok
DELETE FROM `table_1` WHERE (`column_13` = 1)


statement ok
DELETE FROM `table_1` WHERE (`column_13` = 2)


statement ok
DELETE FROM `table_1` WHERE (`column_13` = 3)


statement ok
DELETE FROM `table_1` WHERE (`column_13` = 4)


query  rowsort
SELECT sum(distinct `table_1`.`column_1`) AS `alias_1` FROM `table_1` INNER JOIN (SELECT sum(distinct `table_1`.`column_2`) AS `alias_2` FROM `table_1`) AS alias_3 ON (`table_1`.`column_2` = `alias_3`.`alias_2`)
----
NULL

query  rowsort
SELECT sum(distinct `table_1`.`column_3`) AS `alias_1` FROM `table_1` INNER JOIN (SELECT `table_1`.`column_2` AS `alias_2` FROM `table_1`) AS alias_3 ON (`table_1`.`column_2` = `alias_3`.`alias_2`)
----
-2551930813

query  rowsort
SELECT sum(distinct `table_1`.`column_4`) AS `alias_1` FROM `table_1` INNER JOIN (SELECT sum(distinct `table_1`.`column_5`) AS `alias_2` FROM `table_1`) AS alias_3 ON (`table_1`.`column_2` = `alias_3`.`alias_2`)
----
NULL

query  rowsort
SELECT `table_1`.`column_2` AS `alias_3` FROM `table_1` INNER JOIN (SELECT sum(distinct `table_1`.`column_6`) AS `alias_1` FROM `table_1`) AS alias_2 ON (`table_1`.`column_2` = `alias_2`.`alias_1`) WHERE (`table_1`.`column_2` > ?)
? = 10
----


query  rowsort
SELECT `table_1`.`column_2` AS `alias_3` FROM `table_1` INNER JOIN (SELECT `table_1`.`column_2` AS `alias_1` FROM `table_1`) AS alias_2 ON (`table_1`.`column_2` = `alias_2`.`alias_1`) WHERE (`table_1`.`column_2` > ?)
? = 10
----
1563623723
1802115261
460746472
599424612

query  rowsort
SELECT `table_1`.`column_2` AS `alias_3` FROM `table_1` INNER JOIN (SELECT sum(distinct `table_1`.`column_7`) AS `alias_1` FROM `table_1`) AS alias_2 ON (`table_1`.`column_2` = `alias_2`.`alias_1`) WHERE (`table_1`.`column_2` > ?)
? = 10
----


query  rowsort
SELECT sum(distinct `table_1`.`column_8`) AS `alias_1` FROM `table_1` INNER JOIN (SELECT sum(distinct `table_1`.`column_9`) AS `alias_2` FROM `table_1`) AS alias_3 ON (`table_1`.`column_1` = `alias_3`.`alias_2`) WHERE (`table_1`.`column_1` > ?)
? = 10
----
NULL

query  rowsort
SELECT sum(distinct `table_1`.`column_10`) AS `alias_1` FROM `table_1` INNER JOIN (SELECT `table_1`.`column_1` AS `alias_2` FROM `table_1`) AS alias_3 ON (`table_1`.`column_1` = `alias_3`.`alias_2`) WHERE (`table_1`.`column_1` > ?)
? = 10
----
1199730327

query  rowsort
SELECT sum(distinct `table_1`.`column_11`) AS `alias_1` FROM `table_1` INNER JOIN (SELECT sum(distinct `table_1`.`column_12`) AS `alias_2` FROM `table_1`) AS alias_3 ON (`table_1`.`column_1` = `alias_3`.`alias_2`) WHERE (`table_1`.`column_1` > ?)
? = 10
----
NULL
