# Generated by:
#     target/debug/noria-logictest permute --compare-to mysql://root:noria@127.1/noria -d 3 -o logictests/generated/mysql/ --only range_param --random --include-deletes --rows-per-table 10 --subquery-depth 1

statement ok
CREATE TABLE `table_1` (`column_2` INT, `column_1` INT, PRIMARY KEY (`column_2`))


statement ok
INSERT INTO `table_1` (`column_2`, `column_1`) VALUES (0, 844787739), (1, 1476241947), (2, -1524598274), (3, 109474148), (4, -451933571), (5, -525671380), (6, -767132510), (7, 1719505999), (8, 907249455), (9, -648863717)


query  rowsort
SELECT `table_1`.`column_1` AS `alias_3` FROM `table_1` INNER JOIN (SELECT `table_1`.`column_1` AS `alias_1` FROM `table_1`) AS alias_2 ON (`table_1`.`column_1` = `alias_2`.`alias_1`) WHERE ((`table_1`.`column_1` = ?) AND (`table_1`.`column_1` = ?))
? = 1
? = 1
----


query  rowsort
SELECT `table_1`.`column_1` AS `alias_3` FROM `table_1` INNER JOIN (SELECT `table_1`.`column_1` AS `alias_1` FROM `table_1`) AS alias_2 ON (`table_1`.`column_1` = `alias_2`.`alias_1`) WHERE ((`table_1`.`column_1` = ?) AND (`table_1`.`column_1` = ?))
? = 1
? = 1
----


query  rowsort
SELECT `table_1`.`column_1` AS `alias_3` FROM `table_1` INNER JOIN (SELECT `table_1`.`column_1` AS `alias_1` FROM `table_1`) AS alias_2 ON (`table_1`.`column_1` = `alias_2`.`alias_1`) WHERE ((`table_1`.`column_1` = ?) AND (`table_1`.`column_1` = ?))
? = 1
? = 1
----


query  rowsort
SELECT `table_1`.`column_1` AS `alias_3` FROM `table_1` INNER JOIN (SELECT `table_1`.`column_1` AS `alias_1` FROM `table_1`) AS alias_2 ON (`table_1`.`column_1` = `alias_2`.`alias_1`) WHERE (`table_1`.`column_1` > ?)
? = 10
----
109474148
1476241947
1719505999
844787739
907249455

query  rowsort
SELECT `table_1`.`column_1` AS `alias_3` FROM `table_1` INNER JOIN (SELECT `table_1`.`column_1` AS `alias_1` FROM `table_1`) AS alias_2 ON (`table_1`.`column_1` = `alias_2`.`alias_1`) WHERE (`table_1`.`column_1` > ?)
? = 10
----
109474148
1476241947
1719505999
844787739
907249455

query  rowsort
SELECT `table_1`.`column_1` AS `alias_3` FROM `table_1` INNER JOIN (SELECT `table_1`.`column_1` AS `alias_1` FROM `table_1`) AS alias_2 ON (`table_1`.`column_1` = `alias_2`.`alias_1`) WHERE (`table_1`.`column_1` > ?)
? = 10
----
109474148
1476241947
1719505999
844787739
907249455

query  rowsort
SELECT `table_1`.`column_1` AS `alias_3` FROM `table_1` INNER JOIN (SELECT `table_1`.`column_1` AS `alias_1` FROM `table_1`) AS alias_2 ON (`table_1`.`column_1` = `alias_2`.`alias_1`) WHERE (((`table_1`.`column_1` = ?) AND (`table_1`.`column_1` = ?)) AND (`table_1`.`column_1` > ?))
? = 1
? = 1
? = 10
----


query  rowsort
SELECT `table_1`.`column_1` AS `alias_3` FROM `table_1` INNER JOIN (SELECT `table_1`.`column_1` AS `alias_1` FROM `table_1`) AS alias_2 ON (`table_1`.`column_1` = `alias_2`.`alias_1`) WHERE (((`table_1`.`column_1` = ?) AND (`table_1`.`column_1` = ?)) AND (`table_1`.`column_1` > ?))
? = 1
? = 1
? = 10
----


query  rowsort
SELECT `table_1`.`column_1` AS `alias_3` FROM `table_1` INNER JOIN (SELECT `table_1`.`column_1` AS `alias_1` FROM `table_1`) AS alias_2 ON (`table_1`.`column_1` = `alias_2`.`alias_1`) WHERE (((`table_1`.`column_1` = ?) AND (`table_1`.`column_1` = ?)) AND (`table_1`.`column_1` > ?))
? = 1
? = 1
? = 10
----


statement ok
DELETE FROM `table_1` WHERE (`column_2` = 0)


statement ok
DELETE FROM `table_1` WHERE (`column_2` = 1)


statement ok
DELETE FROM `table_1` WHERE (`column_2` = 2)


statement ok
DELETE FROM `table_1` WHERE (`column_2` = 3)


statement ok
DELETE FROM `table_1` WHERE (`column_2` = 4)


query  rowsort
SELECT `table_1`.`column_1` AS `alias_3` FROM `table_1` INNER JOIN (SELECT `table_1`.`column_1` AS `alias_1` FROM `table_1`) AS alias_2 ON (`table_1`.`column_1` = `alias_2`.`alias_1`) WHERE ((`table_1`.`column_1` = ?) AND (`table_1`.`column_1` = ?))
? = 1
? = 1
----


query  rowsort
SELECT `table_1`.`column_1` AS `alias_3` FROM `table_1` INNER JOIN (SELECT `table_1`.`column_1` AS `alias_1` FROM `table_1`) AS alias_2 ON (`table_1`.`column_1` = `alias_2`.`alias_1`) WHERE ((`table_1`.`column_1` = ?) AND (`table_1`.`column_1` = ?))
? = 1
? = 1
----


query  rowsort
SELECT `table_1`.`column_1` AS `alias_3` FROM `table_1` INNER JOIN (SELECT `table_1`.`column_1` AS `alias_1` FROM `table_1`) AS alias_2 ON (`table_1`.`column_1` = `alias_2`.`alias_1`) WHERE ((`table_1`.`column_1` = ?) AND (`table_1`.`column_1` = ?))
? = 1
? = 1
----


query  rowsort
SELECT `table_1`.`column_1` AS `alias_3` FROM `table_1` INNER JOIN (SELECT `table_1`.`column_1` AS `alias_1` FROM `table_1`) AS alias_2 ON (`table_1`.`column_1` = `alias_2`.`alias_1`) WHERE (`table_1`.`column_1` > ?)
? = 10
----
1719505999
907249455

query  rowsort
SELECT `table_1`.`column_1` AS `alias_3` FROM `table_1` INNER JOIN (SELECT `table_1`.`column_1` AS `alias_1` FROM `table_1`) AS alias_2 ON (`table_1`.`column_1` = `alias_2`.`alias_1`) WHERE (`table_1`.`column_1` > ?)
? = 10
----
1719505999
907249455

query  rowsort
SELECT `table_1`.`column_1` AS `alias_3` FROM `table_1` INNER JOIN (SELECT `table_1`.`column_1` AS `alias_1` FROM `table_1`) AS alias_2 ON (`table_1`.`column_1` = `alias_2`.`alias_1`) WHERE (`table_1`.`column_1` > ?)
? = 10
----
1719505999
907249455

query  rowsort
SELECT `table_1`.`column_1` AS `alias_3` FROM `table_1` INNER JOIN (SELECT `table_1`.`column_1` AS `alias_1` FROM `table_1`) AS alias_2 ON (`table_1`.`column_1` = `alias_2`.`alias_1`) WHERE (((`table_1`.`column_1` = ?) AND (`table_1`.`column_1` = ?)) AND (`table_1`.`column_1` > ?))
? = 1
? = 1
? = 10
----


query  rowsort
SELECT `table_1`.`column_1` AS `alias_3` FROM `table_1` INNER JOIN (SELECT `table_1`.`column_1` AS `alias_1` FROM `table_1`) AS alias_2 ON (`table_1`.`column_1` = `alias_2`.`alias_1`) WHERE (((`table_1`.`column_1` = ?) AND (`table_1`.`column_1` = ?)) AND (`table_1`.`column_1` > ?))
? = 1
? = 1
? = 10
----


query  rowsort
SELECT `table_1`.`column_1` AS `alias_3` FROM `table_1` INNER JOIN (SELECT `table_1`.`column_1` AS `alias_1` FROM `table_1`) AS alias_2 ON (`table_1`.`column_1` = `alias_2`.`alias_1`) WHERE (((`table_1`.`column_1` = ?) AND (`table_1`.`column_1` = ?)) AND (`table_1`.`column_1` > ?))
? = 1
? = 1
? = 10
----

