# Generated by:
#     target/debug/noria-logictest permute --compare-to mysql://root:noria@127.1/noria -d 3 -o logictests/generated/mysql/ --only range_param --random --include-deletes --rows-per-table 10 --subquery-depth 1

statement ok
CREATE TABLE `table_1` (`column_6` INT, `column_3` INT, `column_7` INT, `column_12` INT, `column_5` INT, `column_2` INT, `column_4` INT, `column_9` INT, `column_10` INT, `column_11` INT, `column_1` INT, `column_8` INT, `column_13` INT, PRIMARY KEY (`column_13`))


statement ok
INSERT INTO `table_1` (`column_6`, `column_3`, `column_7`, `column_12`, `column_5`, `column_2`, `column_4`, `column_9`, `column_10`, `column_11`, `column_1`, `column_8`, `column_13`) VALUES (-491651984, -1905707767, 909044474, -2123554810, 642670189, -941260966, 795136672, -1642488350, 1746983045, 2016811528, -119890388, -790304850, 0), (1857917333, -514258224, -1994548153, -2083497322, 1331281140, 690667268, -1868141273, 304354540, 1374607943, 1120826654, 1262672254, 966554225, 1), (981595437, 1925746051, -1716819171, 224946391, -967614564, -80300736, 1168399006, 578447637, 1239513189, 2010549777, -925162658, -1405625931, 2), (-1306907741, -1833314870, -861653447, -1321164016, 1577041319, 1186251297, -596578157, -60778390, 717578492, -1338089731, -1117888003, -439844542, 3), (1959797336, -574713971, -1581854667, -1186763482, 1404397647, -110910096, -206767640, -101022294, -828928028, 718263068, -1032893583, 884495558, 4), (-1952132244, -912995405, -1403988945, -1689026102, -1415926850, 852977795, -393471939, 1174197492, -246062388, 1953482275, 576467176, 378526050, 5), (468806750, 1902816340, -207228920, -1651075002, 1325029688, 177399540, 1145250320, -64660054, 1861969032, -1166339180, -31865627, 2099046099, 6), (1476909457, -1748802863, 1754056679, 769884492, -966164378, 1042866858, -1573623412, 1441907277, -1265487899, 1854611634, 554013776, 165709699, 7), (1974323713, 1673333845, -1928873319, -822223380, -1096309174, 1430020261, -604397358, -310340338, 938418054, -5807074, 1346288186, 1649141627, 8), (1207975609, 881230345, 1281831335, -2076205733, 2092435294, -1430506652, 1072512572, 2011500244, 639865047, -424024996, 137316823, -643643506, 9)


query  rowsort
SELECT max(`table_1`.`column_1`) AS `alias_1` FROM `table_1` INNER JOIN (SELECT max(`table_1`.`column_2`) AS `alias_2` FROM `table_1`) AS alias_3 ON (`table_1`.`column_2` = `alias_3`.`alias_2`)
----
1346288186

query  rowsort
SELECT max(`table_1`.`column_3`) AS `alias_1` FROM `table_1` INNER JOIN (SELECT `table_1`.`column_3` AS `alias_2` FROM `table_1`) AS alias_3 ON (`table_1`.`column_3` = `alias_3`.`alias_2`)
----
1925746051

query  rowsort
SELECT max(`table_1`.`column_4`) AS `alias_1` FROM `table_1` INNER JOIN (SELECT max(`table_1`.`column_5`) AS `alias_2` FROM `table_1`) AS alias_3 ON (`table_1`.`column_3` = `alias_3`.`alias_2`)
----
NULL

query  rowsort
SELECT `table_1`.`column_6` AS `alias_3` FROM `table_1` INNER JOIN (SELECT max(`table_1`.`column_6`) AS `alias_1` FROM `table_1`) AS alias_2 ON (`table_1`.`column_6` = `alias_2`.`alias_1`) WHERE (`table_1`.`column_3` > ?)
? = 10
----
1974323713

query  rowsort
SELECT `table_1`.`column_6` AS `alias_3` FROM `table_1` INNER JOIN (SELECT `table_1`.`column_6` AS `alias_1` FROM `table_1`) AS alias_2 ON (`table_1`.`column_6` = `alias_2`.`alias_1`) WHERE (`table_1`.`column_6` > ?)
? = 10
----
1207975609
1476909457
1857917333
1959797336
1974323713
468806750
981595437

query  rowsort
SELECT `table_1`.`column_6` AS `alias_3` FROM `table_1` INNER JOIN (SELECT max(`table_1`.`column_7`) AS `alias_1` FROM `table_1`) AS alias_2 ON (`table_1`.`column_6` = `alias_2`.`alias_1`) WHERE (`table_1`.`column_6` > ?)
? = 10
----


query  rowsort
SELECT max(`table_1`.`column_8`) AS `alias_1` FROM `table_1` INNER JOIN (SELECT max(`table_1`.`column_9`) AS `alias_2` FROM `table_1`) AS alias_3 ON (`table_1`.`column_6` = `alias_3`.`alias_2`) WHERE (`table_1`.`column_6` > ?)
? = 10
----
NULL

query  rowsort
SELECT max(`table_1`.`column_10`) AS `alias_1` FROM `table_1` INNER JOIN (SELECT `table_1`.`column_6` AS `alias_2` FROM `table_1`) AS alias_3 ON (`table_1`.`column_6` = `alias_3`.`alias_2`) WHERE (`table_1`.`column_6` > ?)
? = 10
----
1861969032

query  rowsort
SELECT max(`table_1`.`column_11`) AS `alias_1` FROM `table_1` INNER JOIN (SELECT max(`table_1`.`column_12`) AS `alias_2` FROM `table_1`) AS alias_3 ON (`table_1`.`column_6` = `alias_3`.`alias_2`) WHERE (`table_1`.`column_6` > ?)
? = 10
----
NULL

statement ok
DELETE FROM `table_1` WHERE (`column_13` = 0)


statement ok
DELETE FROM `table_1` WHERE (`column_13` = 1)


statement ok
DELETE FROM `table_1` WHERE (`column_13` = 2)


statement ok
DELETE FROM `table_1` WHERE (`column_13` = 3)


statement ok
DELETE FROM `table_1` WHERE (`column_13` = 4)


query  rowsort
SELECT max(`table_1`.`column_1`) AS `alias_1` FROM `table_1` INNER JOIN (SELECT max(`table_1`.`column_2`) AS `alias_2` FROM `table_1`) AS alias_3 ON (`table_1`.`column_2` = `alias_3`.`alias_2`)
----
1346288186

query  rowsort
SELECT max(`table_1`.`column_3`) AS `alias_1` FROM `table_1` INNER JOIN (SELECT `table_1`.`column_3` AS `alias_2` FROM `table_1`) AS alias_3 ON (`table_1`.`column_3` = `alias_3`.`alias_2`)
----
1902816340

query  rowsort
SELECT max(`table_1`.`column_4`) AS `alias_1` FROM `table_1` INNER JOIN (SELECT max(`table_1`.`column_5`) AS `alias_2` FROM `table_1`) AS alias_3 ON (`table_1`.`column_3` = `alias_3`.`alias_2`)
----
NULL

query  rowsort
SELECT `table_1`.`column_6` AS `alias_3` FROM `table_1` INNER JOIN (SELECT max(`table_1`.`column_6`) AS `alias_1` FROM `table_1`) AS alias_2 ON (`table_1`.`column_6` = `alias_2`.`alias_1`) WHERE (`table_1`.`column_3` > ?)
? = 10
----
1974323713

query  rowsort
SELECT `table_1`.`column_6` AS `alias_3` FROM `table_1` INNER JOIN (SELECT `table_1`.`column_6` AS `alias_1` FROM `table_1`) AS alias_2 ON (`table_1`.`column_6` = `alias_2`.`alias_1`) WHERE (`table_1`.`column_6` > ?)
? = 10
----
1207975609
1476909457
1974323713
468806750

query  rowsort
SELECT `table_1`.`column_6` AS `alias_3` FROM `table_1` INNER JOIN (SELECT max(`table_1`.`column_7`) AS `alias_1` FROM `table_1`) AS alias_2 ON (`table_1`.`column_6` = `alias_2`.`alias_1`) WHERE (`table_1`.`column_6` > ?)
? = 10
----


query  rowsort
SELECT max(`table_1`.`column_8`) AS `alias_1` FROM `table_1` INNER JOIN (SELECT max(`table_1`.`column_9`) AS `alias_2` FROM `table_1`) AS alias_3 ON (`table_1`.`column_6` = `alias_3`.`alias_2`) WHERE (`table_1`.`column_6` > ?)
? = 10
----
NULL

query  rowsort
SELECT max(`table_1`.`column_10`) AS `alias_1` FROM `table_1` INNER JOIN (SELECT `table_1`.`column_6` AS `alias_2` FROM `table_1`) AS alias_3 ON (`table_1`.`column_6` = `alias_3`.`alias_2`) WHERE (`table_1`.`column_6` > ?)
? = 10
----
1861969032

query  rowsort
SELECT max(`table_1`.`column_11`) AS `alias_1` FROM `table_1` INNER JOIN (SELECT max(`table_1`.`column_12`) AS `alias_2` FROM `table_1`) AS alias_3 ON (`table_1`.`column_6` = `alias_3`.`alias_2`) WHERE (`table_1`.`column_6` > ?)
? = 10
----
NULL
