# Generated by:
#     target/debug/noria-logictest permute --compare-to mysql://root:noria@127.1/noria -d 3 -o logictests/generated/mysql/ --only range_param --random --include-deletes --rows-per-table 10 --subquery-depth 1

statement ok
CREATE TABLE `table_1` (`column_2` INT, `column_1` INT, PRIMARY KEY (`column_2`))


statement ok
INSERT INTO `table_1` (`column_2`, `column_1`) VALUES (0, 249851460), (1, 784439889), (2, -1895440922), (3, 1904762737), (4, -2087728866), (5, -2116725204), (6, -1426052158), (7, -1844584430), (8, -366696151), (9, 1284288253)


query  rowsort
SELECT `table_1`.`column_1` AS `alias_3` FROM `table_1` INNER JOIN (SELECT `table_1`.`column_1` AS `alias_1` FROM `table_1`) AS alias_2 ON (`table_1`.`column_1` = `alias_2`.`alias_1`) WHERE ((`table_1`.`column_1` > ?) AND (`table_1`.`column_1` > ?))
? = 10
? = 10
----
1284288253
1904762737
249851460
784439889

query  rowsort
SELECT `table_1`.`column_1` AS `alias_3` FROM `table_1` INNER JOIN (SELECT `table_1`.`column_1` AS `alias_1` FROM `table_1`) AS alias_2 ON (`table_1`.`column_1` = `alias_2`.`alias_1`) WHERE ((`table_1`.`column_1` > ?) AND (`table_1`.`column_1` > ?))
? = 10
? = 10
----
1284288253
1904762737
249851460
784439889

query  rowsort
SELECT `table_1`.`column_1` AS `alias_3` FROM `table_1` INNER JOIN (SELECT `table_1`.`column_1` AS `alias_1` FROM `table_1`) AS alias_2 ON (`table_1`.`column_1` = `alias_2`.`alias_1`) WHERE ((`table_1`.`column_1` > ?) AND (`table_1`.`column_1` > ?))
? = 10
? = 10
----
1284288253
1904762737
249851460
784439889

query  rowsort
SELECT `table_1`.`column_1` AS `alias_3` FROM `table_1` INNER JOIN (SELECT `table_1`.`column_1` AS `alias_1` FROM `table_1`) AS alias_2 ON (`table_1`.`column_1` = `alias_2`.`alias_1`) WHERE (`table_1`.`column_1` > ?)
? = 10
----
1284288253
1904762737
249851460
784439889

query  rowsort
SELECT `table_1`.`column_1` AS `alias_3` FROM `table_1` INNER JOIN (SELECT `table_1`.`column_1` AS `alias_1` FROM `table_1`) AS alias_2 ON (`table_1`.`column_1` = `alias_2`.`alias_1`) WHERE (`table_1`.`column_1` > ?)
? = 10
----
1284288253
1904762737
249851460
784439889

query  rowsort
SELECT `table_1`.`column_1` AS `alias_3` FROM `table_1` INNER JOIN (SELECT `table_1`.`column_1` AS `alias_1` FROM `table_1`) AS alias_2 ON (`table_1`.`column_1` = `alias_2`.`alias_1`) WHERE (`table_1`.`column_1` > ?)
? = 10
----
1284288253
1904762737
249851460
784439889

query  rowsort
SELECT `table_1`.`column_1` AS `alias_3` FROM `table_1` INNER JOIN (SELECT `table_1`.`column_1` AS `alias_1` FROM `table_1`) AS alias_2 ON (`table_1`.`column_1` = `alias_2`.`alias_1`) WHERE (((`table_1`.`column_1` > ?) AND (`table_1`.`column_1` > ?)) AND (`table_1`.`column_1` > ?))
? = 10
? = 10
? = 10
----
1284288253
1904762737
249851460
784439889

query  rowsort
SELECT `table_1`.`column_1` AS `alias_3` FROM `table_1` INNER JOIN (SELECT `table_1`.`column_1` AS `alias_1` FROM `table_1`) AS alias_2 ON (`table_1`.`column_1` = `alias_2`.`alias_1`) WHERE (((`table_1`.`column_1` > ?) AND (`table_1`.`column_1` > ?)) AND (`table_1`.`column_1` > ?))
? = 10
? = 10
? = 10
----
1284288253
1904762737
249851460
784439889

query  rowsort
SELECT `table_1`.`column_1` AS `alias_3` FROM `table_1` INNER JOIN (SELECT `table_1`.`column_1` AS `alias_1` FROM `table_1`) AS alias_2 ON (`table_1`.`column_1` = `alias_2`.`alias_1`) WHERE (((`table_1`.`column_1` > ?) AND (`table_1`.`column_1` > ?)) AND (`table_1`.`column_1` > ?))
? = 10
? = 10
? = 10
----
1284288253
1904762737
249851460
784439889

statement ok
DELETE FROM `table_1` WHERE (`column_2` = 0)


statement ok
DELETE FROM `table_1` WHERE (`column_2` = 1)


statement ok
DELETE FROM `table_1` WHERE (`column_2` = 2)


statement ok
DELETE FROM `table_1` WHERE (`column_2` = 3)


statement ok
DELETE FROM `table_1` WHERE (`column_2` = 4)


query  rowsort
SELECT `table_1`.`column_1` AS `alias_3` FROM `table_1` INNER JOIN (SELECT `table_1`.`column_1` AS `alias_1` FROM `table_1`) AS alias_2 ON (`table_1`.`column_1` = `alias_2`.`alias_1`) WHERE ((`table_1`.`column_1` > ?) AND (`table_1`.`column_1` > ?))
? = 10
? = 10
----
1284288253

query  rowsort
SELECT `table_1`.`column_1` AS `alias_3` FROM `table_1` INNER JOIN (SELECT `table_1`.`column_1` AS `alias_1` FROM `table_1`) AS alias_2 ON (`table_1`.`column_1` = `alias_2`.`alias_1`) WHERE ((`table_1`.`column_1` > ?) AND (`table_1`.`column_1` > ?))
? = 10
? = 10
----
1284288253

query  rowsort
SELECT `table_1`.`column_1` AS `alias_3` FROM `table_1` INNER JOIN (SELECT `table_1`.`column_1` AS `alias_1` FROM `table_1`) AS alias_2 ON (`table_1`.`column_1` = `alias_2`.`alias_1`) WHERE ((`table_1`.`column_1` > ?) AND (`table_1`.`column_1` > ?))
? = 10
? = 10
----
1284288253

query  rowsort
SELECT `table_1`.`column_1` AS `alias_3` FROM `table_1` INNER JOIN (SELECT `table_1`.`column_1` AS `alias_1` FROM `table_1`) AS alias_2 ON (`table_1`.`column_1` = `alias_2`.`alias_1`) WHERE (`table_1`.`column_1` > ?)
? = 10
----
1284288253

query  rowsort
SELECT `table_1`.`column_1` AS `alias_3` FROM `table_1` INNER JOIN (SELECT `table_1`.`column_1` AS `alias_1` FROM `table_1`) AS alias_2 ON (`table_1`.`column_1` = `alias_2`.`alias_1`) WHERE (`table_1`.`column_1` > ?)
? = 10
----
1284288253

query  rowsort
SELECT `table_1`.`column_1` AS `alias_3` FROM `table_1` INNER JOIN (SELECT `table_1`.`column_1` AS `alias_1` FROM `table_1`) AS alias_2 ON (`table_1`.`column_1` = `alias_2`.`alias_1`) WHERE (`table_1`.`column_1` > ?)
? = 10
----
1284288253

query  rowsort
SELECT `table_1`.`column_1` AS `alias_3` FROM `table_1` INNER JOIN (SELECT `table_1`.`column_1` AS `alias_1` FROM `table_1`) AS alias_2 ON (`table_1`.`column_1` = `alias_2`.`alias_1`) WHERE (((`table_1`.`column_1` > ?) AND (`table_1`.`column_1` > ?)) AND (`table_1`.`column_1` > ?))
? = 10
? = 10
? = 10
----
1284288253

query  rowsort
SELECT `table_1`.`column_1` AS `alias_3` FROM `table_1` INNER JOIN (SELECT `table_1`.`column_1` AS `alias_1` FROM `table_1`) AS alias_2 ON (`table_1`.`column_1` = `alias_2`.`alias_1`) WHERE (((`table_1`.`column_1` > ?) AND (`table_1`.`column_1` > ?)) AND (`table_1`.`column_1` > ?))
? = 10
? = 10
? = 10
----
1284288253

query  rowsort
SELECT `table_1`.`column_1` AS `alias_3` FROM `table_1` INNER JOIN (SELECT `table_1`.`column_1` AS `alias_1` FROM `table_1`) AS alias_2 ON (`table_1`.`column_1` = `alias_2`.`alias_1`) WHERE (((`table_1`.`column_1` > ?) AND (`table_1`.`column_1` > ?)) AND (`table_1`.`column_1` > ?))
? = 10
? = 10
? = 10
----
1284288253
