# Generated by:
#     target/debug/noria-logictest permute --compare-to mysql://root:noria@127.1/noria -d 3 -o logictests/generated/mysql/ --only range_param --random --include-deletes --rows-per-table 10 --subquery-depth 1 --overwrite-tests

statement ok
CREATE TABLE `table_1` (`column_1` INT, `column_3` INT, `column_4` INT, `column_2` INT, PRIMARY KEY (`column_4`))


statement ok
CREATE TABLE `table_2` (`column_1` INT, `column_2` INT, `column_3` INT, PRIMARY KEY (`column_3`))


statement ok
CREATE TABLE `table_3` (`column_3` INT, `column_2` INT, `column_1` INT, PRIMARY KEY (`column_3`))


statement ok
INSERT INTO `table_1` (`column_1`, `column_3`, `column_4`, `column_2`) VALUES (628432413, 270713391, 0, -883183280), (-1248633231, -1972750554, 1, -1091600832), (1627603280, 1787850912, 2, 832522708), (-329373193, -1381651668, 3, 1068931014), (251557750, -542947166, 4, -1931904369), (-950749147, 354617461, 5, 1141100388), (-1459599976, 994121329, 6, -1914472850), (-2072787707, 220737191, 7, -1462136125), (-17286983, -240764955, 8, -90129599), (189405839, 1395041447, 9, 1708214232)


statement ok
INSERT INTO `table_2` (`column_1`, `column_2`, `column_3`) VALUES (-1866556097, -1512764682, 0), (-2073535842, -1887942250, 1), (399788751, -969716782, 2), (-1931399235, 1061416118, 3), (-80995236, -1866056893, 4), (1824047212, 1622890687, 5), (1951130294, 327842150, 6), (722453513, 1041733557, 7), (744051168, -946933019, 8), (811205657, -796719170, 9)


statement ok
INSERT INTO `table_3` (`column_3`, `column_2`, `column_1`) VALUES (0, 1709399263, 1258316834), (1, 736291650, -1953933940), (2, -308659248, 2006805270), (3, 1218569823, 1350568321), (4, 1806707198, -1718966161), (5, -1418117199, 1213857671), (6, 1783818018, -97184270), (7, 1487446669, -2045320516), (8, 1629258239, -1824269439), (9, -1574268832, 944483504)


query  rowsort
SELECT `table_1`.`column_2` AS `alias_1`, `table_2`.`column_2` AS `alias_2` FROM `table_1` LEFT JOIN `table_2` ON (`table_1`.`column_1` = `table_2`.`column_1`)
----
-1091600832
NULL
-1462136125
NULL
-1914472850
NULL
-1931904369
NULL
-883183280
NULL
-90129599
NULL
1068931014
NULL
1141100388
NULL
1708214232
NULL
832522708
NULL

query  rowsort
SELECT `table_1`.`column_1` AS `alias_1` FROM `table_1` WHERE (`table_1`.`column_1` > ?)
? = 10
----
1627603280
189405839
251557750
628432413

query  rowsort
SELECT `table_1`.`column_3` AS `alias_1`, `table_3`.`column_2` AS `alias_2` FROM `table_1` LEFT JOIN `table_3` ON (`table_1`.`column_1` = `table_3`.`column_1`) WHERE (`table_1`.`column_1` > ?)
? = 10
----
-542947166
NULL
1395041447
NULL
1787850912
NULL
270713391
NULL

statement ok
DELETE FROM `table_1` WHERE (`column_4` = 0)


statement ok
DELETE FROM `table_1` WHERE (`column_4` = 1)


statement ok
DELETE FROM `table_1` WHERE (`column_4` = 2)


statement ok
DELETE FROM `table_1` WHERE (`column_4` = 3)


statement ok
DELETE FROM `table_1` WHERE (`column_4` = 4)


statement ok
DELETE FROM `table_2` WHERE (`column_3` = 0)


statement ok
DELETE FROM `table_2` WHERE (`column_3` = 1)


statement ok
DELETE FROM `table_2` WHERE (`column_3` = 2)


statement ok
DELETE FROM `table_2` WHERE (`column_3` = 3)


statement ok
DELETE FROM `table_2` WHERE (`column_3` = 4)


statement ok
DELETE FROM `table_3` WHERE (`column_3` = 0)


statement ok
DELETE FROM `table_3` WHERE (`column_3` = 1)


statement ok
DELETE FROM `table_3` WHERE (`column_3` = 2)


statement ok
DELETE FROM `table_3` WHERE (`column_3` = 3)


statement ok
DELETE FROM `table_3` WHERE (`column_3` = 4)


query  rowsort
SELECT `table_1`.`column_2` AS `alias_1`, `table_2`.`column_2` AS `alias_2` FROM `table_1` LEFT JOIN `table_2` ON (`table_1`.`column_1` = `table_2`.`column_1`)
----
-1462136125
NULL
-1914472850
NULL
-90129599
NULL
1141100388
NULL
1708214232
NULL

query  rowsort
SELECT `table_1`.`column_1` AS `alias_1` FROM `table_1` WHERE (`table_1`.`column_1` > ?)
? = 10
----
189405839

query  rowsort
SELECT `table_1`.`column_3` AS `alias_1`, `table_3`.`column_2` AS `alias_2` FROM `table_1` LEFT JOIN `table_3` ON (`table_1`.`column_1` = `table_3`.`column_1`) WHERE (`table_1`.`column_1` > ?)
? = 10
----
1395041447
NULL
