# Generated by:
#     target/debug/noria-logictest permute --compare-to mysql://root:noria@127.1/noria -d 3 -o logictests/generated/mysql/ --only range_param --random --include-deletes --rows-per-table 10 --subquery-depth 1

statement ok
CREATE TABLE `table_5` (`column_2` INT, `column_3` INT, `column_4` INT, `column_1` INT, PRIMARY KEY (`column_4`))


statement ok
CREATE TABLE `table_8` (`column_2` INT, `column_1` INT, `column_3` INT, PRIMARY KEY (`column_3`))


statement ok
CREATE TABLE `table_3` (`column_3` INT, `column_2` INT, `column_1` INT, PRIMARY KEY (`column_3`))


statement ok
CREATE TABLE `table_1` (`column_1` INT, `column_2` INT, `column_3` INT, PRIMARY KEY (`column_3`))


statement ok
CREATE TABLE `table_7` (`column_3` INT, `column_2` INT, `column_1` INT, PRIMARY KEY (`column_3`))


statement ok
CREATE TABLE `table_9` (`column_3` INT, `column_1` INT, `column_2` INT, PRIMARY KEY (`column_3`))


statement ok
CREATE TABLE `table_4` (`column_4` INT, `column_5` INT, `column_3` INT, `column_1` INT, `column_2` INT, `column_6` INT, `column_7` INT, PRIMARY KEY (`column_7`))


statement ok
CREATE TABLE `table_2` (`column_4` INT, `column_5` INT, `column_3` INT, `column_1` INT, `column_2` INT, PRIMARY KEY (`column_5`))


statement ok
CREATE TABLE `table_6` (`column_2` INT, `column_3` INT, `column_1` INT, PRIMARY KEY (`column_3`))


statement ok
INSERT INTO `table_5` (`column_2`, `column_3`, `column_4`, `column_1`) VALUES (-1215808904, 1388765000, 0, -597069024), (-2086495991, -781387743, 1, 1728749061), (-90258387, 35630603, 2, 1390425059), (1912779610, -562021189, 3, -1300261508), (949312572, 1973624149, 4, -2492563), (331238323, 1902313738, 5, -153575280), (1471225563, 63088749, 6, -674243595), (-293021773, 2130052102, 7, 738055398), (848392690, 1715738245, 8, 1167687419), (200299935, 1489410316, 9, -333168352)


statement ok
INSERT INTO `table_8` (`column_2`, `column_1`, `column_3`) VALUES (17790750, -1846199023, 0), (-141338694, -1737667563, 1), (-154979351, 1448504126, 2), (-1365691488, -476692054, 3), (68143660, 841808176, 4), (-1569647109, 191845934, 5), (-1663626695, 1430584100, 6), (1326310315, 785016578, 7), (-417428997, 77504848, 8), (41977271, 878271447, 9)


statement ok
INSERT INTO `table_3` (`column_3`, `column_2`, `column_1`) VALUES (0, -1880856704, -371940233), (1, 1593492467, -210505709), (2, 2129418264, -1444017716), (3, 392948940, -2135688492), (4, 1604461320, 1011143755), (5, -1131083721, -533671304), (6, 177246208, -1004999934), (7, -764134393, 1368530522), (8, 1641812787, -1331817635), (9, -391387758, 4332017)


statement ok
INSERT INTO `table_1` (`column_1`, `column_2`, `column_3`) VALUES (-1699059300, -970646625, 0), (1016822668, -1643138043, 1), (-255595420, -1120566205, 2), (-270522034, 1829882054, 3), (975282316, -2022760686, 4), (985916549, 691490124, 5), (-1396302240, -1539748938, 6), (-1606384683, -434549705, 7), (-1445758097, -1440853808, 8), (-856167674, 506634465, 9)


statement ok
INSERT INTO `table_7` (`column_3`, `column_2`, `column_1`) VALUES (0, 2062920801, 2001974818), (1, 1633858308, -1718545175), (2, -659560260, 1045734901), (3, -433777639, 663985652), (4, 788047975, -189403616), (5, 1976801543, -1947916317), (6, -372865445, -995194511), (7, -2099777386, 258193413), (8, 2076199832, -1579795951), (9, 653307332, 139199911)


statement ok
INSERT INTO `table_9` (`column_3`, `column_1`, `column_2`) VALUES (0, 786470536, -2112853368), (1, -1252898886, 263641800), (2, 75174548, 605854853), (3, -1621840930, 588433459), (4, 171668822, 1753392078), (5, 554070482, 1910791421), (6, 1722937461, 1692442734), (7, 571508771, -1553595661), (8, 1020302858, 1870581434), (9, 1498526760, -1516591264)


statement ok
INSERT INTO `table_4` (`column_4`, `column_5`, `column_3`, `column_1`, `column_2`, `column_6`, `column_7`) VALUES (1916001106, -1606115891, 939432621, 833327050, 1340747526, -679211318, 0), (-1473373794, 1607124599, -774483853, 1333202999, -1621630821, -440761688, 1), (-1206067411, -1292307284, 1948900354, 946376688, 1196916418, -1061217798, 2), (-1756024315, 1415285814, -782015284, -882420792, -1527489263, 1213212636, 3), (927732628, -223298694, 295011510, 1676163860, -1037849424, 1953650296, 4), (-706825206, -2114334725, -1776721149, 1764715257, -678624533, 1490077264, 5), (-584295856, 642850327, -674364802, -1007562770, 1643757193, 1075209173, 6), (-268577462, -226863496, 915563906, 958055884, -1705443972, 966285687, 7), (-465985330, 640885417, -2103245450, 739643763, -533757176, 368163137, 8), (445774962, -1936890464, -1376373530, -1026993682, -1641255630, 201875363, 9)


statement ok
INSERT INTO `table_2` (`column_4`, `column_5`, `column_3`, `column_1`, `column_2`) VALUES (-2143979133, 0, 1150520265, 1791926541, 862769032), (-991080900, 1, 1217924675, -153563210, 187448856), (-1620617593, 2, 1069662711, 932478581, -204763633), (-2099253510, 3, -686644301, -754122570, 1974032893), (-1851600818, 4, -1807552129, 882273358, 262025893), (1538231114, 5, -695062746, 1114589560, -1850319670), (-23990675, 6, 706986480, -635689908, -1939699125), (-203999329, 7, -1099243719, 537466014, -92467470), (2112828778, 8, -1717461389, 1315957002, 2143372845), (705532432, 9, 1771183816, -206984117, -957847504)


statement ok
INSERT INTO `table_6` (`column_2`, `column_3`, `column_1`) VALUES (1442196462, 0, 1883041182), (556360199, 1, -1644062979), (-1703877435, 2, 282928750), (-1493625147, 3, 779439004), (-1259915096, 4, 124690562), (1805434101, 5, 1662099096), (1685398854, 6, 535120060), (-776336710, 7, 1574943967), (2081387331, 8, -1601026247), (-2102234666, 9, -1384573396)


query  rowsort
SELECT `table_1`.`column_2` AS `alias_1`, `table_2`.`column_2` AS `alias_2` FROM `table_1` LEFT JOIN `table_2` ON (`table_1`.`column_1` = `table_2`.`column_1`)
----
-1120566205
NULL
-1440853808
NULL
-1539748938
NULL
-1643138043
NULL
-2022760686
NULL
-434549705
NULL
-970646625
NULL
1829882054
NULL
506634465
NULL
691490124
NULL

query  nosort
SELECT `table_2`.`column_1` AS `alias_1` FROM `table_2` ORDER BY `table_2`.`column_1` ASC LIMIT 10
----
-754122570
-635689908
-206984117
-153563210
537466014
882273358
932478581
1114589560
1315957002
1791926541

query  nosort
SELECT `table_2`.`column_1` AS `alias_1` FROM `table_2` ORDER BY `table_2`.`column_1` DESC LIMIT 10
----
1791926541
1315957002
1114589560
932478581
882273358
537466014
-153563210
-206984117
-635689908
-754122570

query  rowsort
SELECT `table_2`.`column_1` AS `alias_1` FROM `table_2` WHERE (`table_2`.`column_1` > ?)
? = 10
----
1114589560
1315957002
1791926541
537466014
882273358
932478581

query  nosort
SELECT `table_2`.`column_3` AS `alias_1`, `table_3`.`column_2` AS `alias_2` FROM `table_2` LEFT JOIN `table_3` ON (`table_2`.`column_1` = `table_3`.`column_1`) ORDER BY `table_2`.`column_3` ASC LIMIT 10
----
-1807552129
NULL
-1717461389
NULL
-1099243719
NULL
-695062746
NULL
-686644301
NULL
706986480
NULL
1069662711
NULL
1150520265
NULL
1217924675
NULL
1771183816
NULL

query  nosort
SELECT `table_2`.`column_4` AS `alias_1`, `table_4`.`column_2` AS `alias_2` FROM `table_2` LEFT JOIN `table_4` ON (`table_2`.`column_3` = `table_4`.`column_1`) ORDER BY `table_2`.`column_4` DESC LIMIT 10
----
2112828778
NULL
1538231114
NULL
705532432
NULL
-23990675
NULL
-203999329
NULL
-991080900
NULL
-1620617593
NULL
-1851600818
NULL
-2099253510
NULL
-2143979133
NULL

query  rowsort
SELECT `table_4`.`column_3` AS `alias_1`, `table_5`.`column_2` AS `alias_2` FROM `table_4` LEFT JOIN `table_5` ON (`table_4`.`column_2` = `table_5`.`column_1`) WHERE (`table_4`.`column_2` > ?)
? = 10
----
-674364802
NULL
1948900354
NULL
939432621
NULL

query  nosort
SELECT `table_4`.`column_2` AS `alias_1` FROM `table_4` ORDER BY `table_4`.`column_2` DESC LIMIT 10
----
1643757193
1340747526
1196916418
-533757176
-678624533
-1037849424
-1527489263
-1621630821
-1641255630
-1705443972

query  nosort
SELECT `table_4`.`column_2` AS `alias_1` FROM `table_4` WHERE (`table_4`.`column_2` > ?) ORDER BY `table_4`.`column_2` ASC LIMIT 10
? = 10
----
1196916418
1340747526
1643757193

query  nosort
SELECT `table_4`.`column_2` AS `alias_1` FROM `table_4` WHERE (`table_4`.`column_2` > ?) ORDER BY `table_4`.`column_2` DESC LIMIT 10
? = 10
----
1643757193
1340747526
1196916418

query  nosort
SELECT `table_4`.`column_4` AS `alias_1`, `table_6`.`column_2` AS `alias_2` FROM `table_4` LEFT JOIN `table_6` ON (`table_4`.`column_2` = `table_6`.`column_1`) ORDER BY `table_4`.`column_4` DESC LIMIT 10
----
1916001106
NULL
927732628
NULL
445774962
NULL
-268577462
NULL
-465985330
NULL
-584295856
NULL
-706825206
NULL
-1206067411
NULL
-1473373794
NULL
-1756024315
NULL

query  nosort
SELECT `table_4`.`column_5` AS `alias_1`, `table_7`.`column_2` AS `alias_2` FROM `table_4` LEFT JOIN `table_7` ON (`table_4`.`column_4` = `table_7`.`column_1`) WHERE (`table_4`.`column_4` > ?) ORDER BY `table_4`.`column_4` ASC LIMIT 10
? = 10
----
-1936890464
NULL
-223298694
NULL
-1606115891
NULL

query  nosort
SELECT `table_4`.`column_6` AS `alias_1`, `table_8`.`column_2` AS `alias_2` FROM `table_4` LEFT JOIN `table_8` ON (`table_4`.`column_4` = `table_8`.`column_1`) WHERE (`table_4`.`column_4` > ?) ORDER BY `table_4`.`column_4` DESC LIMIT 10
? = 10
----
-679211318
NULL
1953650296
NULL
201875363
NULL

query  nosort
SELECT `table_5`.`column_2` AS `alias_1` FROM `table_5` WHERE (`table_5`.`column_2` > ?) ORDER BY `table_5`.`column_2` DESC LIMIT 10
? = 10
----
1912779610
1471225563
949312572
848392690
331238323
200299935

query  nosort
SELECT `table_5`.`column_3` AS `alias_1`, `table_9`.`column_2` AS `alias_2` FROM `table_5` LEFT JOIN `table_9` ON (`table_5`.`column_2` = `table_9`.`column_1`) WHERE (`table_5`.`column_2` > ?) ORDER BY `table_5`.`column_2` DESC LIMIT 10
? = 10
----
-562021189
NULL
63088749
NULL
1973624149
NULL
1715738245
NULL
1902313738
NULL
1489410316
NULL

statement ok
DELETE FROM `table_5` WHERE (`column_4` = 0)


statement ok
DELETE FROM `table_5` WHERE (`column_4` = 1)


statement ok
DELETE FROM `table_5` WHERE (`column_4` = 2)


statement ok
DELETE FROM `table_5` WHERE (`column_4` = 3)


statement ok
DELETE FROM `table_5` WHERE (`column_4` = 4)


statement ok
DELETE FROM `table_8` WHERE (`column_3` = 0)


statement ok
DELETE FROM `table_8` WHERE (`column_3` = 1)


statement ok
DELETE FROM `table_8` WHERE (`column_3` = 2)


statement ok
DELETE FROM `table_8` WHERE (`column_3` = 3)


statement ok
DELETE FROM `table_8` WHERE (`column_3` = 4)


statement ok
DELETE FROM `table_3` WHERE (`column_3` = 0)


statement ok
DELETE FROM `table_3` WHERE (`column_3` = 1)


statement ok
DELETE FROM `table_3` WHERE (`column_3` = 2)


statement ok
DELETE FROM `table_3` WHERE (`column_3` = 3)


statement ok
DELETE FROM `table_3` WHERE (`column_3` = 4)


statement ok
DELETE FROM `table_1` WHERE (`column_3` = 0)


statement ok
DELETE FROM `table_1` WHERE (`column_3` = 1)


statement ok
DELETE FROM `table_1` WHERE (`column_3` = 2)


statement ok
DELETE FROM `table_1` WHERE (`column_3` = 3)


statement ok
DELETE FROM `table_1` WHERE (`column_3` = 4)


statement ok
DELETE FROM `table_7` WHERE (`column_3` = 0)


statement ok
DELETE FROM `table_7` WHERE (`column_3` = 1)


statement ok
DELETE FROM `table_7` WHERE (`column_3` = 2)


statement ok
DELETE FROM `table_7` WHERE (`column_3` = 3)


statement ok
DELETE FROM `table_7` WHERE (`column_3` = 4)


statement ok
DELETE FROM `table_9` WHERE (`column_3` = 0)


statement ok
DELETE FROM `table_9` WHERE (`column_3` = 1)


statement ok
DELETE FROM `table_9` WHERE (`column_3` = 2)


statement ok
DELETE FROM `table_9` WHERE (`column_3` = 3)


statement ok
DELETE FROM `table_9` WHERE (`column_3` = 4)


statement ok
DELETE FROM `table_4` WHERE (`column_7` = 0)


statement ok
DELETE FROM `table_4` WHERE (`column_7` = 1)


statement ok
DELETE FROM `table_4` WHERE (`column_7` = 2)


statement ok
DELETE FROM `table_4` WHERE (`column_7` = 3)


statement ok
DELETE FROM `table_4` WHERE (`column_7` = 4)


statement ok
DELETE FROM `table_2` WHERE (`column_5` = 0)


statement ok
DELETE FROM `table_2` WHERE (`column_5` = 1)


statement ok
DELETE FROM `table_2` WHERE (`column_5` = 2)


statement ok
DELETE FROM `table_2` WHERE (`column_5` = 3)


statement ok
DELETE FROM `table_2` WHERE (`column_5` = 4)


statement ok
DELETE FROM `table_6` WHERE (`column_3` = 0)


statement ok
DELETE FROM `table_6` WHERE (`column_3` = 1)


statement ok
DELETE FROM `table_6` WHERE (`column_3` = 2)


statement ok
DELETE FROM `table_6` WHERE (`column_3` = 3)


statement ok
DELETE FROM `table_6` WHERE (`column_3` = 4)


query  rowsort
SELECT `table_1`.`column_2` AS `alias_1`, `table_2`.`column_2` AS `alias_2` FROM `table_1` LEFT JOIN `table_2` ON (`table_1`.`column_1` = `table_2`.`column_1`)
----
-1440853808
NULL
-1539748938
NULL
-434549705
NULL
506634465
NULL
691490124
NULL

query  nosort
SELECT `table_2`.`column_1` AS `alias_1` FROM `table_2` ORDER BY `table_2`.`column_1` ASC LIMIT 10
----
-635689908
-206984117
537466014
1114589560
1315957002

query  nosort
SELECT `table_2`.`column_1` AS `alias_1` FROM `table_2` ORDER BY `table_2`.`column_1` DESC LIMIT 10
----
1315957002
1114589560
537466014
-206984117
-635689908

query  rowsort
SELECT `table_2`.`column_1` AS `alias_1` FROM `table_2` WHERE (`table_2`.`column_1` > ?)
? = 10
----
1114589560
1315957002
537466014

query  nosort
SELECT `table_2`.`column_3` AS `alias_1`, `table_3`.`column_2` AS `alias_2` FROM `table_2` LEFT JOIN `table_3` ON (`table_2`.`column_1` = `table_3`.`column_1`) ORDER BY `table_2`.`column_3` ASC LIMIT 10
----
-1717461389
NULL
-1099243719
NULL
-695062746
NULL
706986480
NULL
1771183816
NULL

query  nosort
SELECT `table_2`.`column_4` AS `alias_1`, `table_4`.`column_2` AS `alias_2` FROM `table_2` LEFT JOIN `table_4` ON (`table_2`.`column_3` = `table_4`.`column_1`) ORDER BY `table_2`.`column_4` DESC LIMIT 10
----
2112828778
NULL
1538231114
NULL
705532432
NULL
-23990675
NULL
-203999329
NULL

query  rowsort
SELECT `table_4`.`column_3` AS `alias_1`, `table_5`.`column_2` AS `alias_2` FROM `table_4` LEFT JOIN `table_5` ON (`table_4`.`column_2` = `table_5`.`column_1`) WHERE (`table_4`.`column_2` > ?)
? = 10
----
-674364802
NULL

query  nosort
SELECT `table_4`.`column_2` AS `alias_1` FROM `table_4` ORDER BY `table_4`.`column_2` DESC LIMIT 10
----
1643757193
-533757176
-678624533
-1641255630
-1705443972

query  nosort
SELECT `table_4`.`column_2` AS `alias_1` FROM `table_4` WHERE (`table_4`.`column_2` > ?) ORDER BY `table_4`.`column_2` ASC LIMIT 10
? = 10
----
1643757193

query  nosort
SELECT `table_4`.`column_2` AS `alias_1` FROM `table_4` WHERE (`table_4`.`column_2` > ?) ORDER BY `table_4`.`column_2` DESC LIMIT 10
? = 10
----
1643757193

query  nosort
SELECT `table_4`.`column_4` AS `alias_1`, `table_6`.`column_2` AS `alias_2` FROM `table_4` LEFT JOIN `table_6` ON (`table_4`.`column_2` = `table_6`.`column_1`) ORDER BY `table_4`.`column_4` DESC LIMIT 10
----
445774962
NULL
-268577462
NULL
-465985330
NULL
-584295856
NULL
-706825206
NULL

query  nosort
SELECT `table_4`.`column_5` AS `alias_1`, `table_7`.`column_2` AS `alias_2` FROM `table_4` LEFT JOIN `table_7` ON (`table_4`.`column_4` = `table_7`.`column_1`) WHERE (`table_4`.`column_4` > ?) ORDER BY `table_4`.`column_4` ASC LIMIT 10
? = 10
----
-1936890464
NULL

query  nosort
SELECT `table_4`.`column_6` AS `alias_1`, `table_8`.`column_2` AS `alias_2` FROM `table_4` LEFT JOIN `table_8` ON (`table_4`.`column_4` = `table_8`.`column_1`) WHERE (`table_4`.`column_4` > ?) ORDER BY `table_4`.`column_4` DESC LIMIT 10
? = 10
----
201875363
NULL

query  nosort
SELECT `table_5`.`column_2` AS `alias_1` FROM `table_5` WHERE (`table_5`.`column_2` > ?) ORDER BY `table_5`.`column_2` DESC LIMIT 10
? = 10
----
1471225563
848392690
331238323
200299935

query  nosort
SELECT `table_5`.`column_3` AS `alias_1`, `table_9`.`column_2` AS `alias_2` FROM `table_5` LEFT JOIN `table_9` ON (`table_5`.`column_2` = `table_9`.`column_1`) WHERE (`table_5`.`column_2` > ?) ORDER BY `table_5`.`column_2` DESC LIMIT 10
? = 10
----
63088749
NULL
1715738245
NULL
1902313738
NULL
1489410316
NULL
