# Generated by:
#     target/debug/noria-logictest permute --compare-to mysql://root:noria@127.1/noria -d 3 -o logictests/generated/mysql/ --only range_param --random --include-deletes --rows-per-table 10 --subquery-depth 1

statement ok
CREATE TABLE `table_12` (`column_3` INT, `column_2` INT, `column_1` INT, PRIMARY KEY (`column_3`))


statement ok
CREATE TABLE `table_4` (`column_7` INT, `column_5` INT, `column_2` INT, `column_3` INT, `column_1` INT, `column_4` INT, `column_6` INT, PRIMARY KEY (`column_7`))


statement ok
CREATE TABLE `table_13` (`column_2` INT, `column_1` INT, `column_3` INT, PRIMARY KEY (`column_3`))


statement ok
CREATE TABLE `table_2` (`column_3` INT, `column_2` INT, `column_1` INT, PRIMARY KEY (`column_3`))


statement ok
CREATE TABLE `table_8` (`column_1` INT, `column_2` INT, `column_3` INT, PRIMARY KEY (`column_3`))


statement ok
CREATE TABLE `table_11` (`column_3` INT, `column_1` INT, `column_2` INT, PRIMARY KEY (`column_3`))


statement ok
CREATE TABLE `table_1` (`column_4` INT, `column_9` INT, `column_2` INT, `column_7` INT, `column_8` INT, `column_3` INT, `column_5` INT, `column_1` INT, `column_6` INT, PRIMARY KEY (`column_9`))


statement ok
CREATE TABLE `table_5` (`column_3` INT, `column_1` INT, `column_2` INT, PRIMARY KEY (`column_3`))


statement ok
CREATE TABLE `table_6` (`column_2` INT, `column_3` INT, `column_1` INT, PRIMARY KEY (`column_3`))


statement ok
CREATE TABLE `table_7` (`column_3` INT, `column_1` INT, `column_2` INT, PRIMARY KEY (`column_3`))


statement ok
CREATE TABLE `table_10` (`column_3` INT, `column_2` INT, `column_1` INT, PRIMARY KEY (`column_3`))


statement ok
CREATE TABLE `table_9` (`column_4` INT, `column_3` INT, `column_2` INT, `column_1` INT, PRIMARY KEY (`column_4`))


statement ok
CREATE TABLE `table_3` (`column_3` INT, `column_2` INT, `column_1` INT, PRIMARY KEY (`column_3`))


statement ok
INSERT INTO `table_12` (`column_3`, `column_2`, `column_1`) VALUES (0, -1316223396, 1155213476), (1, -1168847665, -1909411744), (2, -1294076644, 1907663096), (3, -1665154804, -424440142), (4, -1657787860, -700664670), (5, -913121940, -1176034823), (6, 704036506, -1664274356), (7, -1086634794, 748141033), (8, 1168629213, 1513973078), (9, -2007820664, -514565330)


statement ok
INSERT INTO `table_4` (`column_7`, `column_5`, `column_2`, `column_3`, `column_1`, `column_4`, `column_6`) VALUES (0, -867854280, -1066189328, 474117141, -854504089, 1307211301, -733008165), (1, -1291110938, 920828150, -252376864, -975850857, -57231015, 1017143719), (2, -344116750, -1886522355, -1742111958, -1631005346, -1359524079, 1412254801), (3, 200684476, -1137395493, -2383376, -597196804, -907111582, 17876328), (4, 1986836745, -292209513, -1305393928, -1576700445, 1357741161, 296859075), (5, 639536438, -210067470, -270720251, 1976994016, 1573605989, -1710321102), (6, -2049117067, -1991747200, 1536486167, 446850437, 1512170129, 828067510), (7, -655085761, 572270348, 887482807, 1704000728, -859189621, -435096486), (8, 1316743441, -1773949732, -292555330, 1437155267, 2061963754, 1495921751), (9, 1534095464, 1580000652, -1801947785, -1361525072, 1355854712, -561307744)


statement ok
INSERT INTO `table_13` (`column_2`, `column_1`, `column_3`) VALUES (1684127182, -596720138, 0), (568571549, 414129206, 1), (2067614256, -2835176, 2), (-415707679, 1270949798, 3), (-1346531475, -744108888, 4), (698903771, -1374686850, 5), (-1167028413, 1357184675, 6), (-617924369, 1037190118, 7), (1618382560, 511091208, 8), (-58816654, -601762068, 9)


statement ok
INSERT INTO `table_2` (`column_3`, `column_2`, `column_1`) VALUES (0, -1361733813, 692906744), (1, -1441988192, 205728074), (2, -1619404521, 689264230), (3, -516120907, -1018440479), (4, 462518909, -236131173), (5, 2057479647, -926633552), (6, 1497496986, -766705153), (7, 181330954, 356653526), (8, -203631593, -999700071), (9, 677464203, 2068243490)


statement ok
INSERT INTO `table_8` (`column_1`, `column_2`, `column_3`) VALUES (-1713574250, -1931787255, 0), (-1605144949, -659333238, 1), (890024086, -2102105515, 2), (583341269, -1493648611, 3), (-290655174, -1508606114, 4), (268422879, 752043923, 5), (-488499552, 1747272418, 6), (-1425918799, 470782780, 7), (450751577, 1412538683, 8), (895512709, -1345049207, 9)


statement ok
INSERT INTO `table_11` (`column_3`, `column_1`, `column_2`) VALUES (0, 744786308, -1563043732), (1, 566658027, -56269531), (2, -812305681, -367282552), (3, 1517000365, 161826936), (4, -640331883, -2043844387), (5, -1673576519, -1713383526), (6, 1270655044, 1655015965), (7, 1488261148, 389013028), (8, 1569162234, -202196769), (9, 1534294085, 1041097301)


statement ok
INSERT INTO `table_1` (`column_4`, `column_9`, `column_2`, `column_7`, `column_8`, `column_3`, `column_5`, `column_1`, `column_6`) VALUES (-535158645, 0, 1112514415, -642164588, 1500414882, -2144224392, -1440601464, 65586452, -1571795444), (758298868, 1, -83539963, -643723678, -1368156183, -1600366791, 1354593782, -1457413959, -158558812), (125340276, 2, -953789381, 169339757, 904537560, 939049910, 637471763, -1024161792, -449152043), (26193429, 3, 97422116, -1196702593, -1743959519, -382588253, -1289147528, 1454091274, 199307814), (-1902450255, 4, -813138964, 306312672, -468831379, 490956369, -2033580201, 911489722, -358283532), (2070313813, 5, 605853122, -322039093, -936923777, 425346282, 476949349, -207575824, 295180851), (1115690547, 6, -577613704, -1870954259, 2042824032, 1101179144, 989117655, -2087842666, -1227048397), (282395791, 7, 1310123730, -1195013823, -1711205539, 512280151, -1664791993, -136943561, -976046459), (1595026327, 8, -270441754, -1329066237, 1874817866, -1232094033, -469561632, -624830397, 2013192089), (1740856882, 9, -720284869, -249788754, 335290197, 1693825923, 616622758, -2051469910, -260932139)


statement ok
INSERT INTO `table_5` (`column_3`, `column_1`, `column_2`) VALUES (0, -24548438, 1920289481), (1, -1136271495, -348741706), (2, -440656817, 1723539662), (3, -458319156, -1534777366), (4, -1693454896, -53441452), (5, -1269570023, -1420040662), (6, -116648142, -2074058445), (7, 474387174, 672336457), (8, -1420206002, 1570350327), (9, 722365700, 3340503)


statement ok
INSERT INTO `table_6` (`column_2`, `column_3`, `column_1`) VALUES (-154894055, 0, 84645609), (508956281, 1, -984301336), (-1909124375, 2, -259569863), (-1137757364, 3, -1954088342), (-1379296666, 4, -1744343042), (-679441173, 5, 1934582287), (-1897485625, 6, -1062957787), (-1043463747, 7, -1443445847), (1069351148, 8, 2051520548), (-707109667, 9, -504833922)


statement ok
INSERT INTO `table_7` (`column_3`, `column_1`, `column_2`) VALUES (0, -1980679779, 307773349), (1, -1047801860, 1178407413), (2, 1454753647, -1942392432), (3, 1059814095, -1535959844), (4, 2022905137, 1333782911), (5, 844707411, -1825714491), (6, 1899372414, 1929216122), (7, 269894064, -704799537), (8, -1561291481, 886722187), (9, 1825982834, 388688591)


statement ok
INSERT INTO `table_10` (`column_3`, `column_2`, `column_1`) VALUES (0, 1943808522, -2014466253), (1, -940006701, 1632961791), (2, -1392255474, -1712021939), (3, 834045019, -773409644), (4, 1622164619, 409101516), (5, 1796427976, 147446936), (6, -885140448, -1025203101), (7, -2030044499, -7457736), (8, -23907575, 530685563), (9, -593247896, -346083653)


statement ok
INSERT INTO `table_9` (`column_4`, `column_3`, `column_2`, `column_1`) VALUES (0, 1708064926, 1257638316, 2057301527), (1, 1186461213, 2024724682, 1899776617), (2, 2045559530, -887844797, -2134891816), (3, -1876702498, -1780014820, -1107262846), (4, 1010510393, -213356113, 1256570082), (5, 155745500, -1447231954, 1436702142), (6, -791852343, 1898131003, 1154676561), (7, -1202010442, -956484083, 461586938), (8, -354391177, 2085455219, 2060019798), (9, 984416698, 674676758, 350493937)


statement ok
INSERT INTO `table_3` (`column_3`, `column_2`, `column_1`) VALUES (0, 1300272764, -48967852), (1, -1854998224, 1823970637), (2, 452866382, 679170505), (3, 1381876487, -505424594), (4, 361838356, -758393123), (5, -759745617, -1954164575), (6, 1239868616, 2075807798), (7, 1338365776, -1892215708), (8, 1794174097, -1994455703), (9, -594168541, 192551109)


query  rowsort
WITH `alias_5` AS (SELECT `table_1`.`column_3` AS `alias_3`, `table_3`.`column_2` AS `alias_4` FROM `table_1` LEFT JOIN `table_3` ON (`table_1`.`column_1` = `table_3`.`column_1`)) SELECT `table_1`.`column_2` AS `alias_1`, `table_2`.`column_2` AS `alias_2` FROM `table_1` LEFT JOIN `table_2` ON (`table_1`.`column_1` = `table_2`.`column_1`) INNER JOIN `alias_5` ON (`table_1`.`column_3` = `alias_5`.`alias_3`)
----
-270441754
NULL
-577613704
NULL
-720284869
NULL
-813138964
NULL
-83539963
NULL
-953789381
NULL
1112514415
NULL
1310123730
NULL
605853122
NULL
97422116
NULL

query  rowsort
WITH `alias_4` AS (SELECT `table_4`.`column_1` AS `alias_3` FROM `table_4`) SELECT `table_1`.`column_4` AS `alias_1`, `table_4`.`column_2` AS `alias_2` FROM `table_1` LEFT JOIN `table_4` ON (`table_1`.`column_3` = `table_4`.`column_1`) INNER JOIN `alias_4` ON (`table_1`.`column_4` = `alias_4`.`alias_3`)
----


query  rowsort
WITH `alias_5` AS (SELECT `table_1`.`column_6` AS `alias_3`, `table_6`.`column_2` AS `alias_4` FROM `table_1` LEFT JOIN `table_6` ON (`table_1`.`column_4` = `table_6`.`column_1`)) SELECT `table_1`.`column_5` AS `alias_1`, `table_5`.`column_2` AS `alias_2` FROM `table_1` LEFT JOIN `table_5` ON (`table_1`.`column_4` = `table_5`.`column_1`) INNER JOIN `alias_5` ON (`table_1`.`column_4` = `alias_5`.`alias_3`)
----


query  rowsort
WITH `alias_3` AS (SELECT `table_1`.`column_7` AS `alias_1`, `table_7`.`column_2` AS `alias_2` FROM `table_1` LEFT JOIN `table_7` ON (`table_1`.`column_4` = `table_7`.`column_1`)) SELECT `table_1`.`column_7` AS `alias_4` FROM `table_1` INNER JOIN `alias_3` ON (`table_1`.`column_7` = `alias_3`.`alias_1`) WHERE (`table_1`.`column_4` > ?)
? = 10
----
-1195013823
-1196702593
-1329066237
-1870954259
-249788754
-322039093
-643723678
169339757

query  rowsort
WITH `alias_2` AS (SELECT `table_1`.`column_7` AS `alias_1` FROM `table_1`) SELECT `table_1`.`column_7` AS `alias_3` FROM `table_1` INNER JOIN `alias_2` ON (`table_1`.`column_7` = `alias_2`.`alias_1`) WHERE (`table_1`.`column_7` > ?)
? = 10
----
169339757
306312672

query  rowsort
WITH `alias_3` AS (SELECT `table_1`.`column_8` AS `alias_1`, `table_8`.`column_2` AS `alias_2` FROM `table_1` LEFT JOIN `table_8` ON (`table_1`.`column_7` = `table_8`.`column_1`)) SELECT `table_1`.`column_4` AS `alias_4` FROM `table_1` INNER JOIN `alias_3` ON (`table_1`.`column_4` = `alias_3`.`alias_1`) WHERE (`table_1`.`column_7` > ?)
? = 10
----


query  rowsort
WITH `alias_5` AS (SELECT `table_9`.`column_3` AS `alias_3`, `table_10`.`column_2` AS `alias_4` FROM `table_9` LEFT JOIN `table_10` ON (`table_9`.`column_2` = `table_10`.`column_1`)) SELECT `table_4`.`column_3` AS `alias_1`, `table_9`.`column_2` AS `alias_2` FROM `table_4` LEFT JOIN `table_9` ON (`table_4`.`column_1` = `table_9`.`column_1`) INNER JOIN `alias_5` ON (`table_4`.`column_3` = `alias_5`.`alias_3`) WHERE (`table_4`.`column_3` > ?)
? = 10
----


query  rowsort
WITH `alias_4` AS (SELECT `table_4`.`column_2` AS `alias_3` FROM `table_4`) SELECT `table_4`.`column_4` AS `alias_1`, `table_11`.`column_2` AS `alias_2` FROM `table_4` LEFT JOIN `table_11` ON (`table_4`.`column_3` = `table_11`.`column_1`) INNER JOIN `alias_4` ON (`table_4`.`column_2` = `alias_4`.`alias_3`) WHERE (`table_4`.`column_2` > ?)
? = 10
----
-57231015
NULL
-859189621
NULL
1355854712
NULL

query  rowsort
WITH `alias_5` AS (SELECT `table_4`.`column_6` AS `alias_3`, `table_13`.`column_2` AS `alias_4` FROM `table_4` LEFT JOIN `table_13` ON (`table_4`.`column_5` = `table_13`.`column_1`)) SELECT `table_4`.`column_5` AS `alias_1`, `table_12`.`column_2` AS `alias_2` FROM `table_4` LEFT JOIN `table_12` ON (`table_4`.`column_2` = `table_12`.`column_1`) INNER JOIN `alias_5` ON (`table_4`.`column_5` = `alias_5`.`alias_3`) WHERE (`table_4`.`column_5` > ?)
? = 10
----


statement ok
DELETE FROM `table_12` WHERE (`column_3` = 0)


statement ok
DELETE FROM `table_12` WHERE (`column_3` = 1)


statement ok
DELETE FROM `table_12` WHERE (`column_3` = 2)


statement ok
DELETE FROM `table_12` WHERE (`column_3` = 3)


statement ok
DELETE FROM `table_12` WHERE (`column_3` = 4)


statement ok
DELETE FROM `table_4` WHERE (`column_7` = 0)


statement ok
DELETE FROM `table_4` WHERE (`column_7` = 1)


statement ok
DELETE FROM `table_4` WHERE (`column_7` = 2)


statement ok
DELETE FROM `table_4` WHERE (`column_7` = 3)


statement ok
DELETE FROM `table_4` WHERE (`column_7` = 4)


statement ok
DELETE FROM `table_13` WHERE (`column_3` = 0)


statement ok
DELETE FROM `table_13` WHERE (`column_3` = 1)


statement ok
DELETE FROM `table_13` WHERE (`column_3` = 2)


statement ok
DELETE FROM `table_13` WHERE (`column_3` = 3)


statement ok
DELETE FROM `table_13` WHERE (`column_3` = 4)


statement ok
DELETE FROM `table_2` WHERE (`column_3` = 0)


statement ok
DELETE FROM `table_2` WHERE (`column_3` = 1)


statement ok
DELETE FROM `table_2` WHERE (`column_3` = 2)


statement ok
DELETE FROM `table_2` WHERE (`column_3` = 3)


statement ok
DELETE FROM `table_2` WHERE (`column_3` = 4)


statement ok
DELETE FROM `table_8` WHERE (`column_3` = 0)


statement ok
DELETE FROM `table_8` WHERE (`column_3` = 1)


statement ok
DELETE FROM `table_8` WHERE (`column_3` = 2)


statement ok
DELETE FROM `table_8` WHERE (`column_3` = 3)


statement ok
DELETE FROM `table_8` WHERE (`column_3` = 4)


statement ok
DELETE FROM `table_11` WHERE (`column_3` = 0)


statement ok
DELETE FROM `table_11` WHERE (`column_3` = 1)


statement ok
DELETE FROM `table_11` WHERE (`column_3` = 2)


statement ok
DELETE FROM `table_11` WHERE (`column_3` = 3)


statement ok
DELETE FROM `table_11` WHERE (`column_3` = 4)


statement ok
DELETE FROM `table_1` WHERE (`column_9` = 0)


statement ok
DELETE FROM `table_1` WHERE (`column_9` = 1)


statement ok
DELETE FROM `table_1` WHERE (`column_9` = 2)


statement ok
DELETE FROM `table_1` WHERE (`column_9` = 3)


statement ok
DELETE FROM `table_1` WHERE (`column_9` = 4)


statement ok
DELETE FROM `table_5` WHERE (`column_3` = 0)


statement ok
DELETE FROM `table_5` WHERE (`column_3` = 1)


statement ok
DELETE FROM `table_5` WHERE (`column_3` = 2)


statement ok
DELETE FROM `table_5` WHERE (`column_3` = 3)


statement ok
DELETE FROM `table_5` WHERE (`column_3` = 4)


statement ok
DELETE FROM `table_6` WHERE (`column_3` = 0)


statement ok
DELETE FROM `table_6` WHERE (`column_3` = 1)


statement ok
DELETE FROM `table_6` WHERE (`column_3` = 2)


statement ok
DELETE FROM `table_6` WHERE (`column_3` = 3)


statement ok
DELETE FROM `table_6` WHERE (`column_3` = 4)


statement ok
DELETE FROM `table_7` WHERE (`column_3` = 0)


statement ok
DELETE FROM `table_7` WHERE (`column_3` = 1)


statement ok
DELETE FROM `table_7` WHERE (`column_3` = 2)


statement ok
DELETE FROM `table_7` WHERE (`column_3` = 3)


statement ok
DELETE FROM `table_7` WHERE (`column_3` = 4)


statement ok
DELETE FROM `table_10` WHERE (`column_3` = 0)


statement ok
DELETE FROM `table_10` WHERE (`column_3` = 1)


statement ok
DELETE FROM `table_10` WHERE (`column_3` = 2)


statement ok
DELETE FROM `table_10` WHERE (`column_3` = 3)


statement ok
DELETE FROM `table_10` WHERE (`column_3` = 4)


statement ok
DELETE FROM `table_9` WHERE (`column_4` = 0)


statement ok
DELETE FROM `table_9` WHERE (`column_4` = 1)


statement ok
DELETE FROM `table_9` WHERE (`column_4` = 2)


statement ok
DELETE FROM `table_9` WHERE (`column_4` = 3)


statement ok
DELETE FROM `table_9` WHERE (`column_4` = 4)


statement ok
DELETE FROM `table_3` WHERE (`column_3` = 0)


statement ok
DELETE FROM `table_3` WHERE (`column_3` = 1)


statement ok
DELETE FROM `table_3` WHERE (`column_3` = 2)


statement ok
DELETE FROM `table_3` WHERE (`column_3` = 3)


statement ok
DELETE FROM `table_3` WHERE (`column_3` = 4)


query  rowsort
WITH `alias_5` AS (SELECT `table_1`.`column_3` AS `alias_3`, `table_3`.`column_2` AS `alias_4` FROM `table_1` LEFT JOIN `table_3` ON (`table_1`.`column_1` = `table_3`.`column_1`)) SELECT `table_1`.`column_2` AS `alias_1`, `table_2`.`column_2` AS `alias_2` FROM `table_1` LEFT JOIN `table_2` ON (`table_1`.`column_1` = `table_2`.`column_1`) INNER JOIN `alias_5` ON (`table_1`.`column_3` = `alias_5`.`alias_3`)
----
-270441754
NULL
-577613704
NULL
-720284869
NULL
1310123730
NULL
605853122
NULL

query  rowsort
WITH `alias_4` AS (SELECT `table_4`.`column_1` AS `alias_3` FROM `table_4`) SELECT `table_1`.`column_4` AS `alias_1`, `table_4`.`column_2` AS `alias_2` FROM `table_1` LEFT JOIN `table_4` ON (`table_1`.`column_3` = `table_4`.`column_1`) INNER JOIN `alias_4` ON (`table_1`.`column_4` = `alias_4`.`alias_3`)
----


query  rowsort
WITH `alias_5` AS (SELECT `table_1`.`column_6` AS `alias_3`, `table_6`.`column_2` AS `alias_4` FROM `table_1` LEFT JOIN `table_6` ON (`table_1`.`column_4` = `table_6`.`column_1`)) SELECT `table_1`.`column_5` AS `alias_1`, `table_5`.`column_2` AS `alias_2` FROM `table_1` LEFT JOIN `table_5` ON (`table_1`.`column_4` = `table_5`.`column_1`) INNER JOIN `alias_5` ON (`table_1`.`column_4` = `alias_5`.`alias_3`)
----


query  rowsort
WITH `alias_3` AS (SELECT `table_1`.`column_7` AS `alias_1`, `table_7`.`column_2` AS `alias_2` FROM `table_1` LEFT JOIN `table_7` ON (`table_1`.`column_4` = `table_7`.`column_1`)) SELECT `table_1`.`column_7` AS `alias_4` FROM `table_1` INNER JOIN `alias_3` ON (`table_1`.`column_7` = `alias_3`.`alias_1`) WHERE (`table_1`.`column_4` > ?)
? = 10
----
-1195013823
-1329066237
-1870954259
-249788754
-322039093

query  rowsort
WITH `alias_2` AS (SELECT `table_1`.`column_7` AS `alias_1` FROM `table_1`) SELECT `table_1`.`column_7` AS `alias_3` FROM `table_1` INNER JOIN `alias_2` ON (`table_1`.`column_7` = `alias_2`.`alias_1`) WHERE (`table_1`.`column_7` > ?)
? = 10
----


query  rowsort
WITH `alias_3` AS (SELECT `table_1`.`column_8` AS `alias_1`, `table_8`.`column_2` AS `alias_2` FROM `table_1` LEFT JOIN `table_8` ON (`table_1`.`column_7` = `table_8`.`column_1`)) SELECT `table_1`.`column_4` AS `alias_4` FROM `table_1` INNER JOIN `alias_3` ON (`table_1`.`column_4` = `alias_3`.`alias_1`) WHERE (`table_1`.`column_7` > ?)
? = 10
----


query  rowsort
WITH `alias_5` AS (SELECT `table_9`.`column_3` AS `alias_3`, `table_10`.`column_2` AS `alias_4` FROM `table_9` LEFT JOIN `table_10` ON (`table_9`.`column_2` = `table_10`.`column_1`)) SELECT `table_4`.`column_3` AS `alias_1`, `table_9`.`column_2` AS `alias_2` FROM `table_4` LEFT JOIN `table_9` ON (`table_4`.`column_1` = `table_9`.`column_1`) INNER JOIN `alias_5` ON (`table_4`.`column_3` = `alias_5`.`alias_3`) WHERE (`table_4`.`column_3` > ?)
? = 10
----


query  rowsort
WITH `alias_4` AS (SELECT `table_4`.`column_2` AS `alias_3` FROM `table_4`) SELECT `table_4`.`column_4` AS `alias_1`, `table_11`.`column_2` AS `alias_2` FROM `table_4` LEFT JOIN `table_11` ON (`table_4`.`column_3` = `table_11`.`column_1`) INNER JOIN `alias_4` ON (`table_4`.`column_2` = `alias_4`.`alias_3`) WHERE (`table_4`.`column_2` > ?)
? = 10
----
-859189621
NULL
1355854712
NULL

query  rowsort
WITH `alias_5` AS (SELECT `table_4`.`column_6` AS `alias_3`, `table_13`.`column_2` AS `alias_4` FROM `table_4` LEFT JOIN `table_13` ON (`table_4`.`column_5` = `table_13`.`column_1`)) SELECT `table_4`.`column_5` AS `alias_1`, `table_12`.`column_2` AS `alias_2` FROM `table_4` LEFT JOIN `table_12` ON (`table_4`.`column_2` = `table_12`.`column_1`) INNER JOIN `alias_5` ON (`table_4`.`column_5` = `alias_5`.`alias_3`) WHERE (`table_4`.`column_5` > ?)
? = 10
----

