# Generated by:
#     target/debug/noria-logictest permute --compare-to mysql://root:noria@127.1/noria -d 3 -o logictests/generated/mysql/ --only range_param --random --include-deletes --rows-per-table 10 --subquery-depth 1

statement ok
CREATE TABLE `table_1` (`column_3` INT, `column_2` INT, `column_1` INT, `column_4` INT, PRIMARY KEY (`column_4`))


statement ok
CREATE TABLE `table_2` (`column_1` INT, `column_3` INT, `column_2` INT, `column_5` INT, `column_4` INT, PRIMARY KEY (`column_5`))


statement ok
CREATE TABLE `table_3` (`column_1` INT, `column_3` INT, `column_2` INT, PRIMARY KEY (`column_3`))


statement ok
CREATE TABLE `table_4` (`column_1` INT, `column_2` INT, `column_3` INT, PRIMARY KEY (`column_3`))


statement ok
CREATE TABLE `table_5` (`column_1` INT, `column_2` INT, `column_3` INT, PRIMARY KEY (`column_3`))


statement ok
INSERT INTO `table_1` (`column_3`, `column_2`, `column_1`, `column_4`) VALUES (353401058, 219735886, -860226561, 0), (-656181996, 1921745402, 1379400727, 1), (840012158, -317242752, 153339368, 2), (1841272518, 1179198373, -649576686, 3), (2005390881, -349440279, 1146627136, 4), (-1783335963, 1299943366, -556202995, 5), (-472841078, 580592433, -679646063, 6), (1886527005, -223668056, 1911244240, 7), (-38949422, 334221559, -1458311990, 8), (-1784341336, 767704729, -2008801662, 9)


statement ok
INSERT INTO `table_2` (`column_1`, `column_3`, `column_2`, `column_5`, `column_4`) VALUES (-317154442, -1396634428, -835325301, 0, 1698449786), (2050442501, -1182074244, -1122049723, 1, 641822233), (-451217717, -1894930167, 662253232, 2, 693454155), (-561478043, 877362550, -1456757747, 3, 2008769001), (1621535291, -518611512, 390759115, 4, -109998617), (91472563, -27350423, -1639263883, 5, -1135381100), (-39970306, -2019181865, 1993409058, 6, -1435363659), (951847521, -1039541273, 1381349861, 7, -2100746086), (871694472, 761736853, 1828903594, 8, 937574860), (-274677246, 1643361384, 461819426, 9, -436605356)


statement ok
INSERT INTO `table_3` (`column_1`, `column_3`, `column_2`) VALUES (-1333539112, 0, 1764467123), (-1153838204, 1, -691759622), (1453263293, 2, 1176256850), (-722865192, 3, -1899071101), (-481052311, 4, 539240632), (1306424214, 5, 656504408), (-1110317031, 6, -1011509295), (2050694379, 7, 1306508482), (1519564886, 8, 1474914099), (2058570583, 9, 564585029)


statement ok
INSERT INTO `table_4` (`column_1`, `column_2`, `column_3`) VALUES (-500337629, -92235901, 0), (-946969528, -50568111, 1), (1308934832, 551275703, 2), (1300051442, -791897260, 3), (1618711032, -1904190153, 4), (1664141555, 467647074, 5), (-889660606, 1281182882, 6), (1597759612, 505929182, 7), (209932523, 1642453806, 8), (-1910418210, 745197363, 9)


statement ok
INSERT INTO `table_5` (`column_1`, `column_2`, `column_3`) VALUES (809439882, 1269188061, 0), (-1226169881, 2005899970, 1), (737021346, 1199120211, 2), (-193498174, -252675888, 3), (444258534, -1157223081, 4), (-1974357755, -982342214, 5), (-1213315147, 1532390672, 6), (1312061470, 1478359478, 7), (1323341229, 1112158203, 8), (1676325541, 1888898599, 9)


query  rowsort
SELECT `table_1`.`column_2` AS `alias_1`, `table_2`.`column_2` AS `alias_2` FROM `table_1` LEFT JOIN `table_2` ON (`table_1`.`column_1` = `table_2`.`column_1`)
----
-223668056
NULL
-317242752
NULL
-349440279
NULL
1179198373
NULL
1299943366
NULL
1921745402
NULL
219735886
NULL
334221559
NULL
580592433
NULL
767704729
NULL

query  rowsort
SELECT `table_2`.`column_2` AS `alias_1` FROM `table_2` WHERE ((`table_2`.`column_2` = ?) AND (`table_2`.`column_2` = ?))
? = 1
? = 1
----


query  rowsort
SELECT `table_2`.`column_2` AS `alias_1` FROM `table_2` WHERE (`table_2`.`column_2` > ?)
? = 10
----
1381349861
1828903594
1993409058
390759115
461819426
662253232

query  rowsort
SELECT `table_2`.`column_3` AS `alias_1`, `table_3`.`column_2` AS `alias_2` FROM `table_2` LEFT JOIN `table_3` ON (`table_2`.`column_2` = `table_3`.`column_1`) WHERE ((`table_2`.`column_2` = ?) AND (`table_2`.`column_2` = ?))
? = 1
? = 1
----


query  rowsort
SELECT `table_2`.`column_4` AS `alias_1`, `table_4`.`column_2` AS `alias_2` FROM `table_2` LEFT JOIN `table_4` ON (`table_2`.`column_2` = `table_4`.`column_1`) WHERE (`table_2`.`column_1` > ?)
? = 10
----
-109998617
NULL
-1135381100
NULL
-2100746086
NULL
641822233
NULL
937574860
NULL

query  rowsort
SELECT `table_1`.`column_2` AS `alias_1` FROM `table_1` WHERE (((`table_1`.`column_2` = ?) AND (`table_1`.`column_2` = ?)) AND (`table_1`.`column_2` > ?))
? = 1
? = 1
? = 10
----


query  rowsort
SELECT `table_1`.`column_3` AS `alias_1`, `table_5`.`column_2` AS `alias_2` FROM `table_1` LEFT JOIN `table_5` ON (`table_1`.`column_2` = `table_5`.`column_1`) WHERE (((`table_1`.`column_3` = ?) AND (`table_1`.`column_3` = ?)) AND (`table_1`.`column_3` > ?))
? = 1
? = 1
? = 10
----


statement ok
DELETE FROM `table_1` WHERE (`column_4` = 0)


statement ok
DELETE FROM `table_1` WHERE (`column_4` = 1)


statement ok
DELETE FROM `table_1` WHERE (`column_4` = 2)


statement ok
DELETE FROM `table_1` WHERE (`column_4` = 3)


statement ok
DELETE FROM `table_1` WHERE (`column_4` = 4)


statement ok
DELETE FROM `table_2` WHERE (`column_5` = 0)


statement ok
DELETE FROM `table_2` WHERE (`column_5` = 1)


statement ok
DELETE FROM `table_2` WHERE (`column_5` = 2)


statement ok
DELETE FROM `table_2` WHERE (`column_5` = 3)


statement ok
DELETE FROM `table_2` WHERE (`column_5` = 4)


statement ok
DELETE FROM `table_3` WHERE (`column_3` = 0)


statement ok
DELETE FROM `table_3` WHERE (`column_3` = 1)


statement ok
DELETE FROM `table_3` WHERE (`column_3` = 2)


statement ok
DELETE FROM `table_3` WHERE (`column_3` = 3)


statement ok
DELETE FROM `table_3` WHERE (`column_3` = 4)


statement ok
DELETE FROM `table_4` WHERE (`column_3` = 0)


statement ok
DELETE FROM `table_4` WHERE (`column_3` = 1)


statement ok
DELETE FROM `table_4` WHERE (`column_3` = 2)


statement ok
DELETE FROM `table_4` WHERE (`column_3` = 3)


statement ok
DELETE FROM `table_4` WHERE (`column_3` = 4)


statement ok
DELETE FROM `table_5` WHERE (`column_3` = 0)


statement ok
DELETE FROM `table_5` WHERE (`column_3` = 1)


statement ok
DELETE FROM `table_5` WHERE (`column_3` = 2)


statement ok
DELETE FROM `table_5` WHERE (`column_3` = 3)


statement ok
DELETE FROM `table_5` WHERE (`column_3` = 4)


query  rowsort
SELECT `table_1`.`column_2` AS `alias_1`, `table_2`.`column_2` AS `alias_2` FROM `table_1` LEFT JOIN `table_2` ON (`table_1`.`column_1` = `table_2`.`column_1`)
----
-223668056
NULL
1299943366
NULL
334221559
NULL
580592433
NULL
767704729
NULL

query  rowsort
SELECT `table_2`.`column_2` AS `alias_1` FROM `table_2` WHERE ((`table_2`.`column_2` = ?) AND (`table_2`.`column_2` = ?))
? = 1
? = 1
----


query  rowsort
SELECT `table_2`.`column_2` AS `alias_1` FROM `table_2` WHERE (`table_2`.`column_2` > ?)
? = 10
----
1381349861
1828903594
1993409058
461819426

query  rowsort
SELECT `table_2`.`column_3` AS `alias_1`, `table_3`.`column_2` AS `alias_2` FROM `table_2` LEFT JOIN `table_3` ON (`table_2`.`column_2` = `table_3`.`column_1`) WHERE ((`table_2`.`column_2` = ?) AND (`table_2`.`column_2` = ?))
? = 1
? = 1
----


query  rowsort
SELECT `table_2`.`column_4` AS `alias_1`, `table_4`.`column_2` AS `alias_2` FROM `table_2` LEFT JOIN `table_4` ON (`table_2`.`column_2` = `table_4`.`column_1`) WHERE (`table_2`.`column_1` > ?)
? = 10
----
-1135381100
NULL
-2100746086
NULL
937574860
NULL

query  rowsort
SELECT `table_1`.`column_2` AS `alias_1` FROM `table_1` WHERE (((`table_1`.`column_2` = ?) AND (`table_1`.`column_2` = ?)) AND (`table_1`.`column_2` > ?))
? = 1
? = 1
? = 10
----


query  rowsort
SELECT `table_1`.`column_3` AS `alias_1`, `table_5`.`column_2` AS `alias_2` FROM `table_1` LEFT JOIN `table_5` ON (`table_1`.`column_2` = `table_5`.`column_1`) WHERE (((`table_1`.`column_3` = ?) AND (`table_1`.`column_3` = ?)) AND (`table_1`.`column_3` > ?))
? = 1
? = 1
? = 10
----

