# Generated by:
#     target/debug/noria-logictest permute --compare-to mysql://root:noria@127.1/noria -d 3 -o logictests/generated/mysql/ --only range_param --random --include-deletes --rows-per-table 10 --subquery-depth 1

statement ok
CREATE TABLE `table_1` (`column_10` INT, `column_4` INT, `column_2` INT, `column_7` INT, `column_9` INT, `column_5` INT, `column_6` INT, `column_3` INT, `column_8` INT, `column_1` INT, PRIMARY KEY (`column_10`))


statement ok
CREATE TABLE `table_2` (`column_1` INT, `column_3` INT, `column_2` INT, PRIMARY KEY (`column_3`))


statement ok
CREATE TABLE `table_3` (`column_3` INT, `column_1` INT, `column_2` INT, PRIMARY KEY (`column_3`))


statement ok
CREATE TABLE `table_4` (`column_3` INT, `column_1` INT, `column_2` INT, PRIMARY KEY (`column_3`))


statement ok
CREATE TABLE `table_5` (`column_2` INT, `column_3` INT, `column_1` INT, PRIMARY KEY (`column_3`))


statement ok
INSERT INTO `table_1` (`column_10`, `column_4`, `column_2`, `column_7`, `column_9`, `column_5`, `column_6`, `column_3`, `column_8`, `column_1`) VALUES (0, -1922298962, 456250269, 519208344, -1667836053, 1049771027, 1670856851, 629619306, 677516642, -1528547026), (1, 1486589735, 1221037705, 328420804, -1857497467, 277254889, 1180431521, -390993127, 812174700, -424351741), (2, 1619037285, 1486742724, 1197865995, 1309417287, 959362331, 1649528089, 1879328259, 1399700426, -299259290), (3, 630027523, -1401369589, 1250964483, 256757273, -1088981975, -2095118798, -1721697108, -167827700, -561826259), (4, 544409641, -1257103056, 1446422877, 916356690, 1726356536, 706797837, 2051701725, -1536633194, -1508791912), (5, -1106986514, -975897073, 569442789, -2079043369, 1684477951, -4025694, -2034337954, -1246834596, -185744130), (6, -1800311456, 453047093, 336682942, 1231873591, -800536960, -1341988707, 1064840402, -1279220511, 442713540), (7, 522826035, 1174317663, -748466318, -1899980130, 75292269, 657362768, -556332926, -534286233, 982515473), (8, 1425397872, 318147178, -157919202, -1638340994, -624360090, 2135078593, 1842014841, 2141756208, 592307711), (9, -104206227, -382640114, 1510304502, -423365852, 413731719, -1623754134, -426677874, 499635393, 186808385)


statement ok
INSERT INTO `table_2` (`column_1`, `column_3`, `column_2`) VALUES (1404683012, 0, 1751678718), (-104560096, 1, -2120234270), (86105091, 2, -1080455930), (236916157, 3, 1107199208), (416730241, 4, -1326699234), (-2022996753, 5, -1088081228), (786416386, 6, 829258261), (-2093873853, 7, 2130363078), (-1701090484, 8, 1531612308), (1689908747, 9, -668018897)


statement ok
INSERT INTO `table_3` (`column_3`, `column_1`, `column_2`) VALUES (0, 1323342098, 1159039682), (1, 1576641965, 1443393316), (2, 1766607364, 1623124033), (3, -663961754, -1578878505), (4, 1983939868, -1395965715), (5, 1230192109, 1083924244), (6, 1851195068, 630438201), (7, -1991018224, 1127596069), (8, 408742735, -1074608282), (9, 347855204, -1276326956)


statement ok
INSERT INTO `table_4` (`column_3`, `column_1`, `column_2`) VALUES (0, -492210948, -1537617450), (1, -1675377063, -269994768), (2, -2098528516, -1319245591), (3, 767180694, 154034381), (4, -1810072143, 1354234878), (5, -75783217, -2015494932), (6, -423334306, 310524873), (7, 228564514, 733878056), (8, 598594243, -2057517108), (9, 1207635880, -1885933234)


statement ok
INSERT INTO `table_5` (`column_2`, `column_3`, `column_1`) VALUES (-1253191370, 0, 1986261150), (-1674634818, 1, 883436489), (-762979773, 2, -646540525), (-1122848044, 3, -1081771360), (679101636, 4, -657075562), (1988679961, 5, 2102599035), (1631872011, 6, -2079539334), (375871947, 7, 975833757), (-1356043823, 8, -677257001), (660757277, 9, -346170090)


query  rowsort
SELECT `table_1`.`column_2` AS `alias_1`, `table_2`.`column_2` AS `alias_2` FROM `table_1` LEFT JOIN `table_2` ON (`table_1`.`column_1` = `table_2`.`column_1`)
----
-1257103056
NULL
-1401369589
NULL
-382640114
NULL
-975897073
NULL
1174317663
NULL
1221037705
NULL
1486742724
NULL
318147178
NULL
453047093
NULL
456250269
NULL

query  rowsort
SELECT max(`table_1`.`column_3`) AS `alias_1` FROM `table_1`
----
2051701725

query  rowsort
SELECT `table_1`.`column_2` AS `alias_1` FROM `table_1` WHERE (`table_1`.`column_2` > ?)
? = 10
----
1174317663
1221037705
1486742724
318147178
453047093
456250269

query  rowsort
SELECT `table_1`.`column_4` AS `alias_1`, `table_3`.`column_2` AS `alias_2`, max(`table_1`.`column_5`) AS `alias_3` FROM `table_1` LEFT JOIN `table_3` ON (`table_1`.`column_2` = `table_3`.`column_1`) GROUP BY `table_1`.`column_4`, `table_3`.`column_2`
----
30 values hashing to 316a36a660800717c7c0328b3f369531

query  rowsort
SELECT `table_1`.`column_6` AS `alias_1`, `table_4`.`column_2` AS `alias_2` FROM `table_1` LEFT JOIN `table_4` ON (`table_1`.`column_5` = `table_4`.`column_1`) WHERE (`table_1`.`column_5` > ?)
? = 10
----
-1623754134
NULL
-4025694
NULL
1180431521
NULL
1649528089
NULL
1670856851
NULL
657362768
NULL
706797837
NULL

query  rowsort
SELECT max(`table_1`.`column_7`) AS `alias_1` FROM `table_1` WHERE (`table_1`.`column_5` > ?)
? = 10
----
1510304502

query  rowsort
SELECT `table_1`.`column_8` AS `alias_1`, `table_5`.`column_2` AS `alias_2`, max(`table_1`.`column_9`) AS `alias_3` FROM `table_1` LEFT JOIN `table_5` ON (`table_1`.`column_5` = `table_5`.`column_1`) WHERE (`table_1`.`column_4` > ?) GROUP BY `table_1`.`column_8`, `table_5`.`column_2`
? = 10
----
-1536633194
NULL
916356690
-167827700
NULL
256757273
-534286233
NULL
-1899980130
1399700426
NULL
1309417287
2141756208
NULL
-1638340994
812174700
NULL
-1857497467

statement ok
DELETE FROM `table_1` WHERE (`column_10` = 0)


statement ok
DELETE FROM `table_1` WHERE (`column_10` = 1)


statement ok
DELETE FROM `table_1` WHERE (`column_10` = 2)


statement ok
DELETE FROM `table_1` WHERE (`column_10` = 3)


statement ok
DELETE FROM `table_1` WHERE (`column_10` = 4)


statement ok
DELETE FROM `table_2` WHERE (`column_3` = 0)


statement ok
DELETE FROM `table_2` WHERE (`column_3` = 1)


statement ok
DELETE FROM `table_2` WHERE (`column_3` = 2)


statement ok
DELETE FROM `table_2` WHERE (`column_3` = 3)


statement ok
DELETE FROM `table_2` WHERE (`column_3` = 4)


statement ok
DELETE FROM `table_3` WHERE (`column_3` = 0)


statement ok
DELETE FROM `table_3` WHERE (`column_3` = 1)


statement ok
DELETE FROM `table_3` WHERE (`column_3` = 2)


statement ok
DELETE FROM `table_3` WHERE (`column_3` = 3)


statement ok
DELETE FROM `table_3` WHERE (`column_3` = 4)


statement ok
DELETE FROM `table_4` WHERE (`column_3` = 0)


statement ok
DELETE FROM `table_4` WHERE (`column_3` = 1)


statement ok
DELETE FROM `table_4` WHERE (`column_3` = 2)


statement ok
DELETE FROM `table_4` WHERE (`column_3` = 3)


statement ok
DELETE FROM `table_4` WHERE (`column_3` = 4)


statement ok
DELETE FROM `table_5` WHERE (`column_3` = 0)


statement ok
DELETE FROM `table_5` WHERE (`column_3` = 1)


statement ok
DELETE FROM `table_5` WHERE (`column_3` = 2)


statement ok
DELETE FROM `table_5` WHERE (`column_3` = 3)


statement ok
DELETE FROM `table_5` WHERE (`column_3` = 4)


query  rowsort
SELECT `table_1`.`column_2` AS `alias_1`, `table_2`.`column_2` AS `alias_2` FROM `table_1` LEFT JOIN `table_2` ON (`table_1`.`column_1` = `table_2`.`column_1`)
----
-382640114
NULL
-975897073
NULL
1174317663
NULL
318147178
NULL
453047093
NULL

query  rowsort
SELECT max(`table_1`.`column_3`) AS `alias_1` FROM `table_1`
----
1842014841

query  rowsort
SELECT `table_1`.`column_2` AS `alias_1` FROM `table_1` WHERE (`table_1`.`column_2` > ?)
? = 10
----
1174317663
318147178
453047093

query  rowsort
SELECT `table_1`.`column_4` AS `alias_1`, `table_3`.`column_2` AS `alias_2`, max(`table_1`.`column_5`) AS `alias_3` FROM `table_1` LEFT JOIN `table_3` ON (`table_1`.`column_2` = `table_3`.`column_1`) GROUP BY `table_1`.`column_4`, `table_3`.`column_2`
----
-104206227
NULL
413731719
-1106986514
NULL
1684477951
-1800311456
NULL
-800536960
1425397872
NULL
-624360090
522826035
NULL
75292269

query  rowsort
SELECT `table_1`.`column_6` AS `alias_1`, `table_4`.`column_2` AS `alias_2` FROM `table_1` LEFT JOIN `table_4` ON (`table_1`.`column_5` = `table_4`.`column_1`) WHERE (`table_1`.`column_5` > ?)
? = 10
----
-1623754134
NULL
-4025694
NULL
657362768
NULL

query  rowsort
SELECT max(`table_1`.`column_7`) AS `alias_1` FROM `table_1` WHERE (`table_1`.`column_5` > ?)
? = 10
----
1510304502

query  rowsort
SELECT `table_1`.`column_8` AS `alias_1`, `table_5`.`column_2` AS `alias_2`, max(`table_1`.`column_9`) AS `alias_3` FROM `table_1` LEFT JOIN `table_5` ON (`table_1`.`column_5` = `table_5`.`column_1`) WHERE (`table_1`.`column_4` > ?) GROUP BY `table_1`.`column_8`, `table_5`.`column_2`
? = 10
----
-534286233
NULL
-1899980130
2141756208
NULL
-1638340994
