# Generated by:
#     target/debug/noria-logictest permute --compare-to mysql://root:noria@127.1/noria -d 3 -o logictests/generated/mysql/ --only range_param --random --include-deletes --rows-per-table 10 --subquery-depth 1

statement ok
CREATE TABLE `table_9` (`column_2` INT, `column_3` INT, `column_1` INT, PRIMARY KEY (`column_3`))


statement ok
CREATE TABLE `table_6` (`column_2` INT, `column_3` INT, `column_1` INT, PRIMARY KEY (`column_3`))


statement ok
CREATE TABLE `table_1` (`column_5` INT, `column_2` INT, `column_7` INT, `column_4` INT, `column_6` INT, `column_1` INT, `column_9` INT, `column_8` INT, `column_10` INT, `column_3` INT, PRIMARY KEY (`column_10`))


statement ok
CREATE TABLE `table_2` (`column_2` INT, `column_3` INT, `column_1` INT, PRIMARY KEY (`column_3`))


statement ok
CREATE TABLE `table_3` (`column_3` INT, `column_2` INT, `column_1` INT, PRIMARY KEY (`column_3`))


statement ok
CREATE TABLE `table_5` (`column_1` INT, `column_2` INT, `column_3` INT, PRIMARY KEY (`column_3`))


statement ok
CREATE TABLE `table_7` (`column_2` INT, `column_3` INT, `column_1` INT, PRIMARY KEY (`column_3`))


statement ok
CREATE TABLE `table_4` (`column_2` INT, `column_3` INT, `column_1` INT, PRIMARY KEY (`column_3`))


statement ok
CREATE TABLE `table_8` (`column_2` INT, `column_3` INT, `column_1` INT, PRIMARY KEY (`column_3`))


statement ok
INSERT INTO `table_9` (`column_2`, `column_3`, `column_1`) VALUES (-1025669453, 0, -970476636), (1268630450, 1, -1744842755), (-1586019527, 2, 1463056670), (499323229, 3, -435577245), (1383699874, 4, -195320674), (-741570761, 5, 540886135), (1362713207, 6, -134946108), (-363568151, 7, 1343352054), (-1211490938, 8, -1673906700), (1497135423, 9, -828176590)


statement ok
INSERT INTO `table_6` (`column_2`, `column_3`, `column_1`) VALUES (335973908, 0, 113174502), (-281350989, 1, 358370748), (-852600732, 2, -1493979587), (1241301694, 3, -1108266806), (-1731686194, 4, 542415937), (-1583537507, 5, 2081059352), (1171258046, 6, 1054537845), (783224234, 7, 2035896286), (1381334491, 8, -1874612981), (-1606818173, 9, 1191571702)


statement ok
INSERT INTO `table_1` (`column_5`, `column_2`, `column_7`, `column_4`, `column_6`, `column_1`, `column_9`, `column_8`, `column_10`, `column_3`) VALUES (-1525418688, 448353444, 1592498222, -1696101239, 1873041659, -329245179, -1352388773, 1445616784, 0, -818714408), (-1032440752, -1756028617, -1607283096, 1015932129, -2059002443, -109505084, 977361823, 587081101, 1, -140014234), (1056804525, 1809134452, 738488643, -1793233411, 1659452258, 1738676342, -774826753, -544086853, 2, 452414244), (-1840195208, -1418631163, -2045058900, 2075089480, -1410287795, 707863927, 381596741, 1773327881, 3, 187606436), (-1206842358, 819517155, -578304321, -1680765261, 94377304, 1229951997, -277623304, -669266891, 4, -819652665), (247933394, -1894973566, -197758217, 1383620274, -1146793755, -200001842, 1582938384, 696787030, 5, -1794275245), (-2145481518, -1402980572, -464886474, 1645606694, -1055299993, -71587811, 1090022188, -262781125, 6, -1381939489), (-72289224, -1999675001, -653270444, 1792771161, 1725617238, -1068798856, -1931571773, -1956767774, 7, -809373281), (158979924, -1547008184, 218566018, 1787994410, -2109429476, 1794076771, 901361254, 913786375, 8, 1921680723), (-429604206, -1560216662, -692631242, -646268745, -503513602, 1530172007, 592346774, 883667811, 9, 1650307512)


statement ok
INSERT INTO `table_2` (`column_2`, `column_3`, `column_1`) VALUES (-900789385, 0, 1462175066), (-1991042151, 1, 245315698), (1351529767, 2, -703369052), (117297811, 3, 209401393), (-857454701, 4, 433763036), (-1079389032, 5, 1976866780), (265979813, 6, -838050204), (435021801, 7, -1903108232), (-189495580, 8, 730616626), (-1969091362, 9, -932265552)


statement ok
INSERT INTO `table_3` (`column_3`, `column_2`, `column_1`) VALUES (0, 182897273, -1515677206), (1, -468891942, 1142257956), (2, 815436345, -528306290), (3, 1441237854, -1274682795), (4, -731873022, -1649264135), (5, -33398606, 1580806138), (6, -891674076, -1854172601), (7, -623793877, -86564465), (8, -1350993846, 959309920), (9, 1910775824, -1459718512)


statement ok
INSERT INTO `table_5` (`column_1`, `column_2`, `column_3`) VALUES (1491408872, 1488387729, 0), (-1762581866, 946628632, 1), (-1299508590, -1891559360, 2), (1565382987, -182292447, 3), (1607956196, 836260114, 4), (-1957976757, -1192963868, 5), (-1767017034, 111270865, 6), (613302117, -200932021, 7), (425345894, 287585001, 8), (2053883203, -1179577186, 9)


statement ok
INSERT INTO `table_7` (`column_2`, `column_3`, `column_1`) VALUES (1499238052, 0, 1807303981), (-770702955, 1, -1303046903), (1594356116, 2, -1783512909), (1930441389, 3, 326606691), (-1962787246, 4, -888116001), (-923112356, 5, 1695969854), (-2002540790, 6, 2120048029), (-77516943, 7, -1374341068), (-167541869, 8, -1345581767), (1666605095, 9, 1664344125)


statement ok
INSERT INTO `table_4` (`column_2`, `column_3`, `column_1`) VALUES (-28144104, 0, -917150113), (1226488355, 1, 1006325289), (-1016975570, 2, 1265718690), (2020313886, 3, 1783042966), (-2048322514, 4, 1772283146), (-1068926647, 5, 1388129488), (-100423254, 6, 61056118), (-905300509, 7, -986978815), (2043618845, 8, -1752554634), (139561126, 9, 598846889)


statement ok
INSERT INTO `table_8` (`column_2`, `column_3`, `column_1`) VALUES (-926193816, 0, -2030935671), (-758020163, 1, -504970347), (-78550758, 2, -856978801), (-1828606177, 3, -1559666673), (-2012437660, 4, -1382727319), (-1775953461, 5, -557602058), (-1577498636, 6, -326223412), (628568461, 7, -1412133165), (756846070, 8, 450101855), (-936684187, 9, -38800511)


query  rowsort
SELECT `table_1`.`column_2` AS `alias_1`, `table_2`.`column_2` AS `alias_2` FROM `table_1` LEFT JOIN `table_2` ON (`table_1`.`column_1` = `table_2`.`column_1`)
----
-1402980572
NULL
-1418631163
NULL
-1547008184
NULL
-1560216662
NULL
-1756028617
NULL
-1894973566
NULL
-1999675001
NULL
1809134452
NULL
448353444
NULL
819517155
NULL

query  rowsort
SELECT `table_1`.`column_3` AS `alias_1`, `table_3`.`column_2` AS `alias_2` FROM `table_1` INNER JOIN `table_3` ON (`table_1`.`column_2` = `table_3`.`column_1`)
----


query  rowsort
SELECT `table_1`.`column_2` AS `alias_1` FROM `table_1` WHERE (`table_1`.`column_2` > ?)
? = 10
----
1809134452
448353444
819517155

query  rowsort
SELECT `table_1`.`column_4` AS `alias_1`, `table_4`.`column_2` AS `alias_2`, `table_1`.`column_5` AS `alias_3`, `table_5`.`column_2` AS `alias_4` FROM `table_1` LEFT JOIN `table_4` ON (`table_1`.`column_2` = `table_4`.`column_1`) INNER JOIN `table_5` ON (`table_1`.`column_2` = `table_5`.`column_1`)
----


query  rowsort
SELECT `table_1`.`column_6` AS `alias_1`, `table_6`.`column_2` AS `alias_2` FROM `table_1` LEFT JOIN `table_6` ON (`table_1`.`column_5` = `table_6`.`column_1`) WHERE (`table_1`.`column_6` > ?)
? = 10
----
1659452258
NULL
1725617238
NULL
1873041659
NULL
94377304
NULL

query  rowsort
SELECT `table_1`.`column_7` AS `alias_1`, `table_7`.`column_2` AS `alias_2` FROM `table_1` INNER JOIN `table_7` ON (`table_1`.`column_6` = `table_7`.`column_1`) WHERE (`table_1`.`column_6` > ?)
? = 10
----


query  rowsort
SELECT `table_1`.`column_8` AS `alias_1`, `table_8`.`column_2` AS `alias_2`, `table_1`.`column_9` AS `alias_3`, `table_9`.`column_2` AS `alias_4` FROM `table_1` LEFT JOIN `table_8` ON (`table_1`.`column_6` = `table_8`.`column_1`) INNER JOIN `table_9` ON (`table_1`.`column_5` = `table_9`.`column_1`) WHERE (`table_1`.`column_5` > ?)
? = 10
----


statement ok
DELETE FROM `table_9` WHERE (`column_3` = 0)


statement ok
DELETE FROM `table_9` WHERE (`column_3` = 1)


statement ok
DELETE FROM `table_9` WHERE (`column_3` = 2)


statement ok
DELETE FROM `table_9` WHERE (`column_3` = 3)


statement ok
DELETE FROM `table_9` WHERE (`column_3` = 4)


statement ok
DELETE FROM `table_6` WHERE (`column_3` = 0)


statement ok
DELETE FROM `table_6` WHERE (`column_3` = 1)


statement ok
DELETE FROM `table_6` WHERE (`column_3` = 2)


statement ok
DELETE FROM `table_6` WHERE (`column_3` = 3)


statement ok
DELETE FROM `table_6` WHERE (`column_3` = 4)


statement ok
DELETE FROM `table_1` WHERE (`column_10` = 0)


statement ok
DELETE FROM `table_1` WHERE (`column_10` = 1)


statement ok
DELETE FROM `table_1` WHERE (`column_10` = 2)


statement ok
DELETE FROM `table_1` WHERE (`column_10` = 3)


statement ok
DELETE FROM `table_1` WHERE (`column_10` = 4)


statement ok
DELETE FROM `table_2` WHERE (`column_3` = 0)


statement ok
DELETE FROM `table_2` WHERE (`column_3` = 1)


statement ok
DELETE FROM `table_2` WHERE (`column_3` = 2)


statement ok
DELETE FROM `table_2` WHERE (`column_3` = 3)


statement ok
DELETE FROM `table_2` WHERE (`column_3` = 4)


statement ok
DELETE FROM `table_3` WHERE (`column_3` = 0)


statement ok
DELETE FROM `table_3` WHERE (`column_3` = 1)


statement ok
DELETE FROM `table_3` WHERE (`column_3` = 2)


statement ok
DELETE FROM `table_3` WHERE (`column_3` = 3)


statement ok
DELETE FROM `table_3` WHERE (`column_3` = 4)


statement ok
DELETE FROM `table_5` WHERE (`column_3` = 0)


statement ok
DELETE FROM `table_5` WHERE (`column_3` = 1)


statement ok
DELETE FROM `table_5` WHERE (`column_3` = 2)


statement ok
DELETE FROM `table_5` WHERE (`column_3` = 3)


statement ok
DELETE FROM `table_5` WHERE (`column_3` = 4)


statement ok
DELETE FROM `table_7` WHERE (`column_3` = 0)


statement ok
DELETE FROM `table_7` WHERE (`column_3` = 1)


statement ok
DELETE FROM `table_7` WHERE (`column_3` = 2)


statement ok
DELETE FROM `table_7` WHERE (`column_3` = 3)


statement ok
DELETE FROM `table_7` WHERE (`column_3` = 4)


statement ok
DELETE FROM `table_4` WHERE (`column_3` = 0)


statement ok
DELETE FROM `table_4` WHERE (`column_3` = 1)


statement ok
DELETE FROM `table_4` WHERE (`column_3` = 2)


statement ok
DELETE FROM `table_4` WHERE (`column_3` = 3)


statement ok
DELETE FROM `table_4` WHERE (`column_3` = 4)


statement ok
DELETE FROM `table_8` WHERE (`column_3` = 0)


statement ok
DELETE FROM `table_8` WHERE (`column_3` = 1)


statement ok
DELETE FROM `table_8` WHERE (`column_3` = 2)


statement ok
DELETE FROM `table_8` WHERE (`column_3` = 3)


statement ok
DELETE FROM `table_8` WHERE (`column_3` = 4)


query  rowsort
SELECT `table_1`.`column_2` AS `alias_1`, `table_2`.`column_2` AS `alias_2` FROM `table_1` LEFT JOIN `table_2` ON (`table_1`.`column_1` = `table_2`.`column_1`)
----
-1402980572
NULL
-1547008184
NULL
-1560216662
NULL
-1894973566
NULL
-1999675001
NULL

query  rowsort
SELECT `table_1`.`column_3` AS `alias_1`, `table_3`.`column_2` AS `alias_2` FROM `table_1` INNER JOIN `table_3` ON (`table_1`.`column_2` = `table_3`.`column_1`)
----


query  rowsort
SELECT `table_1`.`column_2` AS `alias_1` FROM `table_1` WHERE (`table_1`.`column_2` > ?)
? = 10
----


query  rowsort
SELECT `table_1`.`column_4` AS `alias_1`, `table_4`.`column_2` AS `alias_2`, `table_1`.`column_5` AS `alias_3`, `table_5`.`column_2` AS `alias_4` FROM `table_1` LEFT JOIN `table_4` ON (`table_1`.`column_2` = `table_4`.`column_1`) INNER JOIN `table_5` ON (`table_1`.`column_2` = `table_5`.`column_1`)
----


query  rowsort
SELECT `table_1`.`column_6` AS `alias_1`, `table_6`.`column_2` AS `alias_2` FROM `table_1` LEFT JOIN `table_6` ON (`table_1`.`column_5` = `table_6`.`column_1`) WHERE (`table_1`.`column_6` > ?)
? = 10
----
1725617238
NULL

query  rowsort
SELECT `table_1`.`column_7` AS `alias_1`, `table_7`.`column_2` AS `alias_2` FROM `table_1` INNER JOIN `table_7` ON (`table_1`.`column_6` = `table_7`.`column_1`) WHERE (`table_1`.`column_6` > ?)
? = 10
----


query  rowsort
SELECT `table_1`.`column_8` AS `alias_1`, `table_8`.`column_2` AS `alias_2`, `table_1`.`column_9` AS `alias_3`, `table_9`.`column_2` AS `alias_4` FROM `table_1` LEFT JOIN `table_8` ON (`table_1`.`column_6` = `table_8`.`column_1`) INNER JOIN `table_9` ON (`table_1`.`column_5` = `table_9`.`column_1`) WHERE (`table_1`.`column_5` > ?)
? = 10
----

