# Generated by:
#     target/debug/noria-logictest permute --compare-to mysql://root:noria@127.1/noria -d 3 -o logictests/generated/mysql/ --only range_param --random --include-deletes --rows-per-table 10 --subquery-depth 1

statement ok
CREATE TABLE `table_4` (`column_2` INT, `column_3` INT, `column_4` INT, `column_1` INT, PRIMARY KEY (`column_4`))


statement ok
CREATE TABLE `table_5` (`column_3` INT, `column_1` INT, `column_2` INT, PRIMARY KEY (`column_3`))


statement ok
CREATE TABLE `table_1` (`column_1` INT, `column_3` INT, `column_4` INT, `column_2` INT, `column_5` INT, PRIMARY KEY (`column_5`))


statement ok
CREATE TABLE `table_2` (`column_1` INT, `column_2` INT, `column_3` INT, PRIMARY KEY (`column_3`))


statement ok
CREATE TABLE `table_3` (`column_1` INT, `column_2` INT, `column_3` INT, PRIMARY KEY (`column_3`))


statement ok
INSERT INTO `table_4` (`column_2`, `column_3`, `column_4`, `column_1`) VALUES (-1558405149, 602407214, 0, 369147445), (338951527, 91268418, 1, -461267195), (1529726388, 1900064913, 2, 1689017711), (-305508159, 544534982, 3, 908616791), (188966633, 611305804, 4, -2018523246), (-612429801, 848183655, 5, -144994455), (-1195728548, -554676524, 6, -1844799325), (660073316, 1254827772, 7, 1015306370), (-346811643, -1268468868, 8, 724449782), (-1863993135, -1285054011, 9, -566045017)


statement ok
INSERT INTO `table_5` (`column_3`, `column_1`, `column_2`) VALUES (0, -1090145812, -1305188275), (1, 1152734483, 1735528737), (2, 1467442095, -1136495373), (3, 1377273192, -601729633), (4, 1706933090, 870636940), (5, -2003413444, -434804179), (6, -1872969622, 506005813), (7, -1714680833, -1637468027), (8, -409362452, 1527847440), (9, 1774112353, -1132710858)


statement ok
INSERT INTO `table_1` (`column_1`, `column_3`, `column_4`, `column_2`, `column_5`) VALUES (-1244060077, -1121933057, 1550767185, -904252687, 0), (319709162, -1887308775, 1920761625, -921431710, 1), (-792521064, -1480651264, -951398184, -1293206227, 2), (-50250924, 470088560, 601615293, -1037685003, 3), (-497158906, -1118243788, 911759169, 1524269888, 4), (1483030019, -508656351, -138995616, 154293373, 5), (1580688193, 788036216, -278954289, 1672670707, 6), (-677929283, 683166822, -1528499659, 1655852828, 7), (-322036757, -2007033951, 116905395, 528828414, 8), (1252732446, -1359736394, -524112055, 465305574, 9)


statement ok
INSERT INTO `table_2` (`column_1`, `column_2`, `column_3`) VALUES (1990387108, 1382905855, 0), (-922671570, -1929528231, 1), (-553523420, 800598405, 2), (-1477554571, 588202336, 3), (-805188459, -1162386632, 4), (1975832743, -1269994880, 5), (-1214229904, -100104690, 6), (1633494514, -291164657, 7), (-915966129, -83216786, 8), (41073287, -1485208609, 9)


statement ok
INSERT INTO `table_3` (`column_1`, `column_2`, `column_3`) VALUES (399962724, 1363896153, 0), (-1700311721, 2124870060, 1), (907270748, 372434867, 2), (1446273497, -268096826, 3), (985628432, -771310567, 4), (537057739, 2107373280, 5), (552525946, 1079683614, 6), (-433703006, -618194361, 7), (-1176563184, -1596846872, 8), (990478018, -1542041571, 9)


query  rowsort
SELECT `table_1`.`column_2` AS `alias_1`, `table_2`.`column_2` AS `alias_2` FROM `table_1` LEFT JOIN `table_2` ON (`table_1`.`column_1` = `table_2`.`column_1`)
----
-1037685003
NULL
-1293206227
NULL
-904252687
NULL
-921431710
NULL
1524269888
NULL
154293373
NULL
1655852828
NULL
1672670707
NULL
465305574
NULL
528828414
NULL

query  rowsort
SELECT DISTINCT `table_1`.`column_1` AS `alias_1` FROM `table_1`
----
-1244060077
-322036757
-497158906
-50250924
-677929283
-792521064
1252732446
1483030019
1580688193
319709162

query  rowsort
SELECT `table_1`.`column_1` AS `alias_1` FROM `table_1` WHERE (`table_1`.`column_1` > ?)
? = 10
----
1252732446
1483030019
1580688193
319709162

query  rowsort
SELECT DISTINCT `table_1`.`column_3` AS `alias_1`, `table_3`.`column_2` AS `alias_2` FROM `table_1` LEFT JOIN `table_3` ON (`table_1`.`column_1` = `table_3`.`column_1`)
----
-1118243788
NULL
-1121933057
NULL
-1359736394
NULL
-1480651264
NULL
-1887308775
NULL
-2007033951
NULL
-508656351
NULL
470088560
NULL
683166822
NULL
788036216
NULL

query  rowsort
SELECT `table_1`.`column_4` AS `alias_1`, `table_4`.`column_2` AS `alias_2` FROM `table_1` LEFT JOIN `table_4` ON (`table_1`.`column_1` = `table_4`.`column_1`) WHERE (`table_1`.`column_1` > ?)
? = 10
----
-138995616
NULL
-278954289
NULL
-524112055
NULL
1920761625
NULL

query  rowsort
SELECT DISTINCT `table_4`.`column_2` AS `alias_1` FROM `table_4` WHERE (`table_4`.`column_2` > ?)
? = 10
----
1529726388
188966633
338951527
660073316

query  rowsort
SELECT DISTINCT `table_4`.`column_3` AS `alias_1`, `table_5`.`column_2` AS `alias_2` FROM `table_4` LEFT JOIN `table_5` ON (`table_4`.`column_2` = `table_5`.`column_1`) WHERE (`table_4`.`column_2` > ?)
? = 10
----
1254827772
NULL
1900064913
NULL
611305804
NULL
91268418
NULL

statement ok
DELETE FROM `table_4` WHERE (`column_4` = 0)


statement ok
DELETE FROM `table_4` WHERE (`column_4` = 1)


statement ok
DELETE FROM `table_4` WHERE (`column_4` = 2)


statement ok
DELETE FROM `table_4` WHERE (`column_4` = 3)


statement ok
DELETE FROM `table_4` WHERE (`column_4` = 4)


statement ok
DELETE FROM `table_5` WHERE (`column_3` = 0)


statement ok
DELETE FROM `table_5` WHERE (`column_3` = 1)


statement ok
DELETE FROM `table_5` WHERE (`column_3` = 2)


statement ok
DELETE FROM `table_5` WHERE (`column_3` = 3)


statement ok
DELETE FROM `table_5` WHERE (`column_3` = 4)


statement ok
DELETE FROM `table_1` WHERE (`column_5` = 0)


statement ok
DELETE FROM `table_1` WHERE (`column_5` = 1)


statement ok
DELETE FROM `table_1` WHERE (`column_5` = 2)


statement ok
DELETE FROM `table_1` WHERE (`column_5` = 3)


statement ok
DELETE FROM `table_1` WHERE (`column_5` = 4)


statement ok
DELETE FROM `table_2` WHERE (`column_3` = 0)


statement ok
DELETE FROM `table_2` WHERE (`column_3` = 1)


statement ok
DELETE FROM `table_2` WHERE (`column_3` = 2)


statement ok
DELETE FROM `table_2` WHERE (`column_3` = 3)


statement ok
DELETE FROM `table_2` WHERE (`column_3` = 4)


statement ok
DELETE FROM `table_3` WHERE (`column_3` = 0)


statement ok
DELETE FROM `table_3` WHERE (`column_3` = 1)


statement ok
DELETE FROM `table_3` WHERE (`column_3` = 2)


statement ok
DELETE FROM `table_3` WHERE (`column_3` = 3)


statement ok
DELETE FROM `table_3` WHERE (`column_3` = 4)


query  rowsort
SELECT `table_1`.`column_2` AS `alias_1`, `table_2`.`column_2` AS `alias_2` FROM `table_1` LEFT JOIN `table_2` ON (`table_1`.`column_1` = `table_2`.`column_1`)
----
154293373
NULL
1655852828
NULL
1672670707
NULL
465305574
NULL
528828414
NULL

query  rowsort
SELECT DISTINCT `table_1`.`column_1` AS `alias_1` FROM `table_1`
----
-322036757
-677929283
1252732446
1483030019
1580688193

query  rowsort
SELECT `table_1`.`column_1` AS `alias_1` FROM `table_1` WHERE (`table_1`.`column_1` > ?)
? = 10
----
1252732446
1483030019
1580688193

query  rowsort
SELECT DISTINCT `table_1`.`column_3` AS `alias_1`, `table_3`.`column_2` AS `alias_2` FROM `table_1` LEFT JOIN `table_3` ON (`table_1`.`column_1` = `table_3`.`column_1`)
----
-1359736394
NULL
-2007033951
NULL
-508656351
NULL
683166822
NULL
788036216
NULL

query  rowsort
SELECT `table_1`.`column_4` AS `alias_1`, `table_4`.`column_2` AS `alias_2` FROM `table_1` LEFT JOIN `table_4` ON (`table_1`.`column_1` = `table_4`.`column_1`) WHERE (`table_1`.`column_1` > ?)
? = 10
----
-138995616
NULL
-278954289
NULL
-524112055
NULL

query  rowsort
SELECT DISTINCT `table_4`.`column_2` AS `alias_1` FROM `table_4` WHERE (`table_4`.`column_2` > ?)
? = 10
----
660073316

query  rowsort
SELECT DISTINCT `table_4`.`column_3` AS `alias_1`, `table_5`.`column_2` AS `alias_2` FROM `table_4` LEFT JOIN `table_5` ON (`table_4`.`column_2` = `table_5`.`column_1`) WHERE (`table_4`.`column_2` > ?)
? = 10
----
1254827772
NULL
