# Generated by:
#     target/debug/noria-logictest permute --compare-to mysql://root:noria@127.1/noria -d 3 -o logictests/generated/mysql/ --only range_param --random --include-deletes --rows-per-table 10 --subquery-depth 1

statement ok
CREATE TABLE `table_1` (`column_3` INT, `column_5` INT, `column_10` INT, `column_1` INT, `column_4` INT, `column_6` INT, `column_2` INT, `column_9` INT, `column_7` INT, `column_8` INT, PRIMARY KEY (`column_10`))


statement ok
CREATE TABLE `table_2` (`column_2` INT, `column_1` INT, `column_3` INT, PRIMARY KEY (`column_3`))


statement ok
CREATE TABLE `table_3` (`column_3` INT, `column_2` INT, `column_1` INT, PRIMARY KEY (`column_3`))


statement ok
CREATE TABLE `table_5` (`column_3` INT, `column_2` INT, `column_1` INT, PRIMARY KEY (`column_3`))


statement ok
CREATE TABLE `table_4` (`column_2` INT, `column_1` INT, `column_3` INT, PRIMARY KEY (`column_3`))


statement ok
INSERT INTO `table_1` (`column_3`, `column_5`, `column_10`, `column_1`, `column_4`, `column_6`, `column_2`, `column_9`, `column_7`, `column_8`) VALUES (1639097046, -1726400794, 0, 6497462, -310855860, 935114773, 425079815, 1188604515, 585176514, 358494803), (1130772710, 33085248, 1, -787265344, -1234217275, -1127302425, -1805521936, 252995703, 766681447, 2091028878), (-1781406140, 1262275787, 2, 570899290, 1289158388, 632862154, 2047169819, -1840592678, 553235771, -631224793), (-967780495, 901575820, 3, -1085850929, 273762718, -856536504, -1464578141, -890699200, -83399871, -638624631), (-1708149679, -171388521, 4, 620923011, 958202236, 266088488, 2074305587, -618053027, 90345007, 120415682), (-2130458127, -203130753, 5, -10961773, -820763849, -1825879327, -187074138, -1006751354, -217522659, 1998705885), (837424156, -1264282911, 6, 621031636, -1700565376, -496171445, 16858916, -1872941244, 766436716, 822957297), (84547816, -1144632794, 7, -459519272, -203155162, -1297820955, -648002152, 1420198856, 859383201, 1685264735), (-735001180, -1990486335, 8, -1938492237, 921228455, 1932829067, 254136059, -1774021814, 1876371738, 1744580644), (796586222, -1949027302, 9, 1348718719, -1735474778, -413708458, 794169569, 1293996316, -58749694, -1454720117)


statement ok
INSERT INTO `table_2` (`column_2`, `column_1`, `column_3`) VALUES (651012782, -1234162605, 0), (-1500879065, -357820647, 1), (-180902637, 809299093, 2), (-1617081015, -479928375, 3), (-264464208, -151564744, 4), (2147081259, -2100824665, 5), (1953465352, 1860650172, 6), (253433860, 315629067, 7), (-989378165, -1125239850, 8), (-549754069, -1170634771, 9)


statement ok
INSERT INTO `table_3` (`column_3`, `column_2`, `column_1`) VALUES (0, -1478470418, 220770389), (1, -439097363, -1168704029), (2, -1798523101, -287093410), (3, 496415167, -348749326), (4, -1990626817, -1564895999), (5, 1112193631, -541584408), (6, 1380533051, 934933674), (7, -2146009893, 1445138580), (8, -746704858, 1677261867), (9, 972654450, -821053495)


statement ok
INSERT INTO `table_5` (`column_3`, `column_2`, `column_1`) VALUES (0, 109129455, 1815481547), (1, 1002192851, 740313534), (2, 2012781348, -42130864), (3, 1326848180, -1381580750), (4, -144455282, -1969843984), (5, 471783543, 150983936), (6, 1994429566, -1090833744), (7, 815364581, 1042178238), (8, 233296242, -1976416870), (9, -542693046, 963687092)


statement ok
INSERT INTO `table_4` (`column_2`, `column_1`, `column_3`) VALUES (1559219069, 68009721, 0), (-1704400189, -1534298269, 1), (-1341140519, -1766822957, 2), (1813916572, 1593189575, 3), (1561713505, -485892192, 4), (-932711827, -1564488136, 5), (1539976314, 1937573673, 6), (-370387305, 1510545256, 7), (846938346, -438221572, 8), (1855237945, -2051175326, 9)


query  rowsort
SELECT `table_1`.`column_2` AS `alias_1`, `table_2`.`column_2` AS `alias_2` FROM `table_1` LEFT JOIN `table_2` ON (`table_1`.`column_1` = `table_2`.`column_1`)
----
-1464578141
NULL
-1805521936
NULL
-187074138
NULL
-648002152
NULL
16858916
NULL
2047169819
NULL
2074305587
NULL
254136059
NULL
425079815
NULL
794169569
NULL

query  rowsort
SELECT count(distinct `table_1`.`column_3`) AS `alias_1` FROM `table_1`
----
10

query  rowsort
SELECT `table_1`.`column_1` AS `alias_1` FROM `table_1` WHERE (`table_1`.`column_1` > ?)
? = 10
----
1348718719
570899290
620923011
621031636
6497462

query  rowsort
SELECT `table_1`.`column_4` AS `alias_1`, `table_3`.`column_2` AS `alias_2`, count(distinct `table_1`.`column_5`) AS `alias_3` FROM `table_1` LEFT JOIN `table_3` ON (`table_1`.`column_1` = `table_3`.`column_1`) GROUP BY `table_1`.`column_4`, `table_3`.`column_2`
----
30 values hashing to 1afd1d0cd5b15b7f2cdbd8eff21e8fda

query  rowsort
SELECT `table_1`.`column_6` AS `alias_1`, `table_4`.`column_2` AS `alias_2` FROM `table_1` LEFT JOIN `table_4` ON (`table_1`.`column_2` = `table_4`.`column_1`) WHERE (`table_1`.`column_2` > ?)
? = 10
----
-413708458
NULL
-496171445
NULL
1932829067
NULL
266088488
NULL
632862154
NULL
935114773
NULL

query  rowsort
SELECT count(distinct `table_1`.`column_7`) AS `alias_1` FROM `table_1` WHERE (`table_1`.`column_2` > ?)
? = 10
----
6

query  rowsort
SELECT `table_1`.`column_8` AS `alias_1`, `table_5`.`column_2` AS `alias_2`, count(distinct `table_1`.`column_9`) AS `alias_3` FROM `table_1` LEFT JOIN `table_5` ON (`table_1`.`column_2` = `table_5`.`column_1`) WHERE (`table_1`.`column_3` > ?) GROUP BY `table_1`.`column_8`, `table_5`.`column_2`
? = 10
----
-1454720117
NULL
1
1685264735
NULL
1
2091028878
NULL
1
358494803
NULL
1
822957297
NULL
1

statement ok
DELETE FROM `table_1` WHERE (`column_10` = 0)


statement ok
DELETE FROM `table_1` WHERE (`column_10` = 1)


statement ok
DELETE FROM `table_1` WHERE (`column_10` = 2)


statement ok
DELETE FROM `table_1` WHERE (`column_10` = 3)


statement ok
DELETE FROM `table_1` WHERE (`column_10` = 4)


statement ok
DELETE FROM `table_2` WHERE (`column_3` = 0)


statement ok
DELETE FROM `table_2` WHERE (`column_3` = 1)


statement ok
DELETE FROM `table_2` WHERE (`column_3` = 2)


statement ok
DELETE FROM `table_2` WHERE (`column_3` = 3)


statement ok
DELETE FROM `table_2` WHERE (`column_3` = 4)


statement ok
DELETE FROM `table_3` WHERE (`column_3` = 0)


statement ok
DELETE FROM `table_3` WHERE (`column_3` = 1)


statement ok
DELETE FROM `table_3` WHERE (`column_3` = 2)


statement ok
DELETE FROM `table_3` WHERE (`column_3` = 3)


statement ok
DELETE FROM `table_3` WHERE (`column_3` = 4)


statement ok
DELETE FROM `table_5` WHERE (`column_3` = 0)


statement ok
DELETE FROM `table_5` WHERE (`column_3` = 1)


statement ok
DELETE FROM `table_5` WHERE (`column_3` = 2)


statement ok
DELETE FROM `table_5` WHERE (`column_3` = 3)


statement ok
DELETE FROM `table_5` WHERE (`column_3` = 4)


statement ok
DELETE FROM `table_4` WHERE (`column_3` = 0)


statement ok
DELETE FROM `table_4` WHERE (`column_3` = 1)


statement ok
DELETE FROM `table_4` WHERE (`column_3` = 2)


statement ok
DELETE FROM `table_4` WHERE (`column_3` = 3)


statement ok
DELETE FROM `table_4` WHERE (`column_3` = 4)


query  rowsort
SELECT `table_1`.`column_2` AS `alias_1`, `table_2`.`column_2` AS `alias_2` FROM `table_1` LEFT JOIN `table_2` ON (`table_1`.`column_1` = `table_2`.`column_1`)
----
-187074138
NULL
-648002152
NULL
16858916
NULL
254136059
NULL
794169569
NULL

query  rowsort
SELECT count(distinct `table_1`.`column_3`) AS `alias_1` FROM `table_1`
----
5

query  rowsort
SELECT `table_1`.`column_1` AS `alias_1` FROM `table_1` WHERE (`table_1`.`column_1` > ?)
? = 10
----
1348718719
621031636

query  rowsort
SELECT `table_1`.`column_4` AS `alias_1`, `table_3`.`column_2` AS `alias_2`, count(distinct `table_1`.`column_5`) AS `alias_3` FROM `table_1` LEFT JOIN `table_3` ON (`table_1`.`column_1` = `table_3`.`column_1`) GROUP BY `table_1`.`column_4`, `table_3`.`column_2`
----
-1700565376
NULL
1
-1735474778
NULL
1
-203155162
NULL
1
-820763849
NULL
1
921228455
NULL
1

query  rowsort
SELECT `table_1`.`column_6` AS `alias_1`, `table_4`.`column_2` AS `alias_2` FROM `table_1` LEFT JOIN `table_4` ON (`table_1`.`column_2` = `table_4`.`column_1`) WHERE (`table_1`.`column_2` > ?)
? = 10
----
-413708458
NULL
-496171445
NULL
1932829067
NULL

query  rowsort
SELECT count(distinct `table_1`.`column_7`) AS `alias_1` FROM `table_1` WHERE (`table_1`.`column_2` > ?)
? = 10
----
3

query  rowsort
SELECT `table_1`.`column_8` AS `alias_1`, `table_5`.`column_2` AS `alias_2`, count(distinct `table_1`.`column_9`) AS `alias_3` FROM `table_1` LEFT JOIN `table_5` ON (`table_1`.`column_2` = `table_5`.`column_1`) WHERE (`table_1`.`column_3` > ?) GROUP BY `table_1`.`column_8`, `table_5`.`column_2`
? = 10
----
-1454720117
NULL
1
1685264735
NULL
1
822957297
NULL
1
