# Generated by:
#     target/debug/noria-logictest permute --compare-to mysql://root:noria@127.1/noria -d 3 -o logictests/generated/mysql/ --only range_param --random --include-deletes --rows-per-table 10 --subquery-depth 1

statement ok
CREATE TABLE `table_4` (`column_3` INT, `column_4` INT, `column_2` INT, `column_1` INT, PRIMARY KEY (`column_4`))


statement ok
CREATE TABLE `table_1` (`column_3` INT, `column_4` INT, `column_5` INT, `column_1` INT, `column_2` INT, PRIMARY KEY (`column_5`))


statement ok
CREATE TABLE `table_5` (`column_2` INT, `column_3` INT, `column_1` INT, PRIMARY KEY (`column_3`))


statement ok
CREATE TABLE `table_2` (`column_3` INT, `column_1` INT, `column_2` INT, PRIMARY KEY (`column_3`))


statement ok
CREATE TABLE `table_3` (`column_1` INT, `column_2` INT, `column_3` INT, PRIMARY KEY (`column_3`))


statement ok
INSERT INTO `table_4` (`column_3`, `column_4`, `column_2`, `column_1`) VALUES (-1138883210, 0, 1, 988421913), (-1260404285, 1, 563992191, 1132671869), (-1213751407, 2, 2, 1253913943), (282616038, 3, -1822991632, 1315001476), (-55409023, 4, 0, -270100621), (-1996361075, 5, -1704796994, -1524079336), (-467792085, 6, 1, 555969465), (1773053857, 7, 1951926545, 1153518510), (1898628457, 8, 2, 744527344), (1956257093, 9, -776387484, -651287745)


statement ok
INSERT INTO `table_1` (`column_3`, `column_4`, `column_5`, `column_1`, `column_2`) VALUES (-1795827459, 1522089085, 0, 1, -1012777250), (-275477735, -1185965761, 1, -2052371598, -227438622), (1239910932, -245521457, 2, 2, 1191703658), (-373099906, -1901981898, 3, 776628050, -708881006), (-1120393688, -1584857917, 4, 0, 893169086), (497168753, -1590944310, 5, -1767714977, -2071492448), (1551610279, 660482841, 6, 1, 77309344), (45515858, -1380618266, 7, -1517453807, -1611050560), (884390031, 1342711131, 8, 2, 414741473), (2066858975, 150079711, 9, 1790475784, 2016858093)


statement ok
INSERT INTO `table_5` (`column_2`, `column_3`, `column_1`) VALUES (492777239, 0, -231849542), (2041834717, 1, -1010272040), (1511218170, 2, -7170732), (-2137300375, 3, -1513160040), (1975564295, 4, 670588517), (1550946248, 5, -56249599), (897411911, 6, -1407102881), (1719508178, 7, -1678141399), (-2090766567, 8, 349462907), (1492109240, 9, -2118414353)


statement ok
INSERT INTO `table_2` (`column_3`, `column_1`, `column_2`) VALUES (0, 365171181, 628784916), (1, -1716696986, -1807779680), (2, 1959832510, 172424221), (3, -786527581, -720276465), (4, -1875428455, 1072044413), (5, -2101706130, -1304706597), (6, -1221847108, 1280860882), (7, -388111470, 1216710138), (8, 326787224, -1742510486), (9, 2022543632, -2040490229)


statement ok
INSERT INTO `table_3` (`column_1`, `column_2`, `column_3`) VALUES (-1523359922, 1149407169, 0), (620461515, -906634470, 1), (142488699, -1953454186, 2), (786989430, -1535672760, 3), (-437523907, -1441553816, 4), (-402343373, 834366810, 5), (705059357, 449756013, 6), (154549230, 100666715, 7), (1983591190, -790189566, 8), (-177397813, -53016285, 9)


query  rowsort
SELECT `table_1`.`column_2` AS `alias_1`, `table_2`.`column_2` AS `alias_2` FROM `table_1` LEFT JOIN `table_2` ON (`table_1`.`column_1` = `table_2`.`column_1`)
----
-1012777250
NULL
-1611050560
NULL
-2071492448
NULL
-227438622
NULL
-708881006
NULL
1191703658
NULL
2016858093
NULL
414741473
NULL
77309344
NULL
893169086
NULL

query  rowsort
SELECT `table_1`.`column_1` AS `alias_1` FROM `table_1` WHERE `table_1`.`column_1` IN (?, ?, ?)
? = 0
? = 1
? = 2
----
0
1
1
2
2

query  rowsort
SELECT `table_1`.`column_1` AS `alias_1` FROM `table_1` WHERE (`table_1`.`column_1` > ?)
? = 10
----
1790475784
776628050

query  rowsort
SELECT `table_1`.`column_3` AS `alias_1`, `table_3`.`column_2` AS `alias_2` FROM `table_1` LEFT JOIN `table_3` ON (`table_1`.`column_1` = `table_3`.`column_1`) WHERE `table_1`.`column_1` IN (?, ?, ?)
? = 0
? = 1
? = 2
----
-1120393688
NULL
-1795827459
NULL
1239910932
NULL
1551610279
NULL
884390031
NULL

query  rowsort
SELECT `table_1`.`column_4` AS `alias_1`, `table_4`.`column_2` AS `alias_2` FROM `table_1` LEFT JOIN `table_4` ON (`table_1`.`column_1` = `table_4`.`column_1`) WHERE (`table_1`.`column_3` > ?)
? = 10
----
-1380618266
NULL
-1590944310
NULL
-245521457
NULL
1342711131
NULL
150079711
NULL
660482841
NULL

query  rowsort
SELECT `table_4`.`column_2` AS `alias_1` FROM `table_4` WHERE (`table_4`.`column_2` IN (?, ?, ?) AND (`table_4`.`column_2` > ?))
? = 0
? = 1
? = 2
? = 10
----


query  rowsort
SELECT `table_4`.`column_3` AS `alias_1`, `table_5`.`column_2` AS `alias_2` FROM `table_4` LEFT JOIN `table_5` ON (`table_4`.`column_2` = `table_5`.`column_1`) WHERE (`table_4`.`column_2` IN (?, ?, ?) AND (`table_4`.`column_2` > ?))
? = 0
? = 1
? = 2
? = 10
----


statement ok
DELETE FROM `table_4` WHERE (`column_4` = 0)


statement ok
DELETE FROM `table_4` WHERE (`column_4` = 1)


statement ok
DELETE FROM `table_4` WHERE (`column_4` = 2)


statement ok
DELETE FROM `table_4` WHERE (`column_4` = 3)


statement ok
DELETE FROM `table_4` WHERE (`column_4` = 4)


statement ok
DELETE FROM `table_1` WHERE (`column_5` = 0)


statement ok
DELETE FROM `table_1` WHERE (`column_5` = 1)


statement ok
DELETE FROM `table_1` WHERE (`column_5` = 2)


statement ok
DELETE FROM `table_1` WHERE (`column_5` = 3)


statement ok
DELETE FROM `table_1` WHERE (`column_5` = 4)


statement ok
DELETE FROM `table_5` WHERE (`column_3` = 0)


statement ok
DELETE FROM `table_5` WHERE (`column_3` = 1)


statement ok
DELETE FROM `table_5` WHERE (`column_3` = 2)


statement ok
DELETE FROM `table_5` WHERE (`column_3` = 3)


statement ok
DELETE FROM `table_5` WHERE (`column_3` = 4)


statement ok
DELETE FROM `table_2` WHERE (`column_3` = 0)


statement ok
DELETE FROM `table_2` WHERE (`column_3` = 1)


statement ok
DELETE FROM `table_2` WHERE (`column_3` = 2)


statement ok
DELETE FROM `table_2` WHERE (`column_3` = 3)


statement ok
DELETE FROM `table_2` WHERE (`column_3` = 4)


statement ok
DELETE FROM `table_3` WHERE (`column_3` = 0)


statement ok
DELETE FROM `table_3` WHERE (`column_3` = 1)


statement ok
DELETE FROM `table_3` WHERE (`column_3` = 2)


statement ok
DELETE FROM `table_3` WHERE (`column_3` = 3)


statement ok
DELETE FROM `table_3` WHERE (`column_3` = 4)


query  rowsort
SELECT `table_1`.`column_2` AS `alias_1`, `table_2`.`column_2` AS `alias_2` FROM `table_1` LEFT JOIN `table_2` ON (`table_1`.`column_1` = `table_2`.`column_1`)
----
-1611050560
NULL
-2071492448
NULL
2016858093
NULL
414741473
NULL
77309344
NULL

query  rowsort
SELECT `table_1`.`column_1` AS `alias_1` FROM `table_1` WHERE `table_1`.`column_1` IN (?, ?, ?)
? = 0
? = 1
? = 2
----
1
2

query  rowsort
SELECT `table_1`.`column_1` AS `alias_1` FROM `table_1` WHERE (`table_1`.`column_1` > ?)
? = 10
----
1790475784

query  rowsort
SELECT `table_1`.`column_3` AS `alias_1`, `table_3`.`column_2` AS `alias_2` FROM `table_1` LEFT JOIN `table_3` ON (`table_1`.`column_1` = `table_3`.`column_1`) WHERE `table_1`.`column_1` IN (?, ?, ?)
? = 0
? = 1
? = 2
----
1551610279
NULL
884390031
NULL

query  rowsort
SELECT `table_1`.`column_4` AS `alias_1`, `table_4`.`column_2` AS `alias_2` FROM `table_1` LEFT JOIN `table_4` ON (`table_1`.`column_1` = `table_4`.`column_1`) WHERE (`table_1`.`column_3` > ?)
? = 10
----
-1380618266
NULL
-1590944310
NULL
1342711131
NULL
150079711
NULL
660482841
NULL

query  rowsort
SELECT `table_4`.`column_2` AS `alias_1` FROM `table_4` WHERE (`table_4`.`column_2` IN (?, ?, ?) AND (`table_4`.`column_2` > ?))
? = 0
? = 1
? = 2
? = 10
----


query  rowsort
SELECT `table_4`.`column_3` AS `alias_1`, `table_5`.`column_2` AS `alias_2` FROM `table_4` LEFT JOIN `table_5` ON (`table_4`.`column_2` = `table_5`.`column_1`) WHERE (`table_4`.`column_2` IN (?, ?, ?) AND (`table_4`.`column_2` > ?))
? = 0
? = 1
? = 2
? = 10
----

