# Generated by:
#     target/debug/noria-logictest permute --compare-to mysql://root:noria@127.1/noria -d 3 -o logictests/generated/mysql/ --only range_param --random --include-deletes --rows-per-table 10 --subquery-depth 1

statement ok
CREATE TABLE `table_2` (`column_1` INT, `column_2` INT, `column_4` INT, `column_9` INT, `column_7` INT, `column_5` INT, `column_6` INT, `column_3` INT, `column_8` INT, `column_10` INT, PRIMARY KEY (`column_10`))


statement ok
CREATE TABLE `table_1` (`column_3` INT, `column_1` INT, `column_2` INT, PRIMARY KEY (`column_3`))


statement ok
CREATE TABLE `table_3` (`column_1` INT, `column_3` INT, `column_2` INT, PRIMARY KEY (`column_3`))


statement ok
CREATE TABLE `table_4` (`column_3` INT, `column_2` INT, `column_1` INT, PRIMARY KEY (`column_3`))


statement ok
CREATE TABLE `table_5` (`column_1` INT, `column_2` INT, `column_3` INT, PRIMARY KEY (`column_3`))


statement ok
INSERT INTO `table_2` (`column_1`, `column_2`, `column_4`, `column_9`, `column_7`, `column_5`, `column_6`, `column_3`, `column_8`, `column_10`) VALUES (-1626550708, -1735139372, -1105330368, -1824026495, -461640658, 1982082835, 1883008626, 1291585507, -867443864, 0), (-137979124, 186960957, 542711587, -1619360042, -725762697, -1364610727, 167646315, 1795809634, -1695348691, 1), (-1637111894, -1378105879, -1580178905, 1179218144, 61549536, 621135739, -1353736171, -1325912200, 1846473847, 2), (934074647, 1360135784, -1193403551, 710980579, -1639881707, 1638526508, -1365042951, 144632874, 1951640952, 3), (-1821196374, -947857182, -309770609, 1392182987, 207159467, -713503427, -913444438, -1335918141, -299905133, 4), (-870702355, 1524339520, 1433739969, 287758767, 1983721668, 121797672, 444880930, -1987031156, 657674135, 5), (1497412907, -1803192196, 1734603457, -1651512928, 1182365792, 1113909645, -313178018, -984525027, -2094061998, 6), (1593916921, 1058382952, -114508196, -947024737, -140492275, -1359014822, 736471358, -599532364, 864459941, 7), (881749197, -570443727, 802402759, -408733698, -1814945390, 79238041, -1475176158, -466439256, 757756652, 8), (-609604576, -1669033538, 1233670630, -969936498, 581200012, 1981701725, 1714629520, -31982188, -2037261046, 9)


statement ok
INSERT INTO `table_1` (`column_3`, `column_1`, `column_2`) VALUES (0, 628871080, 643392584), (1, 1394473864, -764683515), (2, -1369265385, -1864949446), (3, 526516165, 210593516), (4, 1269761490, -1905132398), (5, -2121813881, 762173362), (6, 283217136, 441943512), (7, -2139226021, -1350217340), (8, -1242432514, 709996453), (9, 1784698238, 1156690996)


statement ok
INSERT INTO `table_3` (`column_1`, `column_3`, `column_2`) VALUES (130688501, 0, 1408954516), (-256880486, 1, -1763038160), (-1064368114, 2, -394354284), (-316212045, 3, 165143054), (-941206983, 4, -1012890894), (691607853, 5, 1711993566), (1066041855, 6, 1139085751), (-1680404622, 7, -1018512086), (-987442265, 8, -839207228), (1225686385, 9, 1006318811)


statement ok
INSERT INTO `table_4` (`column_3`, `column_2`, `column_1`) VALUES (0, -1553956525, -299082581), (1, 380311741, 83921460), (2, 79191235, -985109603), (3, -1644845153, 85345549), (4, 1419873601, 1698150850), (5, -1090757396, -1461856874), (6, -1060187015, -1928012977), (7, -2101530553, 1341788152), (8, 1424894840, 1583036526), (9, -1993392120, -1853554455)


statement ok
INSERT INTO `table_5` (`column_1`, `column_2`, `column_3`) VALUES (1109489749, -1033410653, 0), (1955616897, 1015914886, 1), (-740928173, 1086705402, 2), (-491789235, -183783319, 3), (1128745202, 590934732, 4), (-1462353994, 1744886231, 5), (302369834, -1836185423, 6), (376022316, -981246952, 7), (263227264, -2079962970, 8), (-1524131372, -23758709, 9)


query  rowsort
SELECT `table_1`.`column_2` AS `alias_1`, `table_2`.`column_2` AS `alias_2` FROM `table_1` LEFT JOIN `table_2` ON (`table_1`.`column_1` = `table_2`.`column_1`)
----
-1350217340
NULL
-1864949446
NULL
-1905132398
NULL
-764683515
NULL
1156690996
NULL
210593516
NULL
441943512
NULL
643392584
NULL
709996453
NULL
762173362
NULL

query  rowsort
SELECT sum(`table_2`.`column_3`) AS `alias_1` FROM `table_2`
----
-3499312317

query  rowsort
SELECT `table_2`.`column_1` AS `alias_1` FROM `table_2` WHERE (`table_2`.`column_1` > ?)
? = 10
----
1497412907
1593916921
881749197
934074647

query  rowsort
SELECT `table_2`.`column_4` AS `alias_1`, `table_3`.`column_2` AS `alias_2`, sum(`table_2`.`column_5`) AS `alias_3` FROM `table_2` LEFT JOIN `table_3` ON (`table_2`.`column_1` = `table_3`.`column_1`) GROUP BY `table_2`.`column_4`, `table_3`.`column_2`
----
30 values hashing to 2ed0f8eafa7227fd61dbde9bab7f5d3c

query  rowsort
SELECT `table_2`.`column_6` AS `alias_1`, `table_4`.`column_2` AS `alias_2` FROM `table_2` LEFT JOIN `table_4` ON (`table_2`.`column_1` = `table_4`.`column_1`) WHERE (`table_2`.`column_1` > ?)
? = 10
----
-1365042951
NULL
-1475176158
NULL
-313178018
NULL
736471358
NULL

query  rowsort
SELECT sum(`table_2`.`column_7`) AS `alias_1` FROM `table_2` WHERE (`table_2`.`column_1` > ?)
? = 10
----
-2412953580

query  rowsort
SELECT `table_2`.`column_8` AS `alias_1`, `table_5`.`column_2` AS `alias_2`, sum(`table_2`.`column_9`) AS `alias_3` FROM `table_2` LEFT JOIN `table_5` ON (`table_2`.`column_1` = `table_5`.`column_1`) WHERE (`table_2`.`column_1` > ?) GROUP BY `table_2`.`column_8`, `table_5`.`column_2`
? = 10
----
-2094061998
NULL
-1651512928
1951640952
NULL
710980579
757756652
NULL
-408733698
864459941
NULL
-947024737

statement ok
DELETE FROM `table_2` WHERE (`column_10` = 0)


statement ok
DELETE FROM `table_2` WHERE (`column_10` = 1)


statement ok
DELETE FROM `table_2` WHERE (`column_10` = 2)


statement ok
DELETE FROM `table_2` WHERE (`column_10` = 3)


statement ok
DELETE FROM `table_2` WHERE (`column_10` = 4)


statement ok
DELETE FROM `table_1` WHERE (`column_3` = 0)


statement ok
DELETE FROM `table_1` WHERE (`column_3` = 1)


statement ok
DELETE FROM `table_1` WHERE (`column_3` = 2)


statement ok
DELETE FROM `table_1` WHERE (`column_3` = 3)


statement ok
DELETE FROM `table_1` WHERE (`column_3` = 4)


statement ok
DELETE FROM `table_3` WHERE (`column_3` = 0)


statement ok
DELETE FROM `table_3` WHERE (`column_3` = 1)


statement ok
DELETE FROM `table_3` WHERE (`column_3` = 2)


statement ok
DELETE FROM `table_3` WHERE (`column_3` = 3)


statement ok
DELETE FROM `table_3` WHERE (`column_3` = 4)


statement ok
DELETE FROM `table_4` WHERE (`column_3` = 0)


statement ok
DELETE FROM `table_4` WHERE (`column_3` = 1)


statement ok
DELETE FROM `table_4` WHERE (`column_3` = 2)


statement ok
DELETE FROM `table_4` WHERE (`column_3` = 3)


statement ok
DELETE FROM `table_4` WHERE (`column_3` = 4)


statement ok
DELETE FROM `table_5` WHERE (`column_3` = 0)


statement ok
DELETE FROM `table_5` WHERE (`column_3` = 1)


statement ok
DELETE FROM `table_5` WHERE (`column_3` = 2)


statement ok
DELETE FROM `table_5` WHERE (`column_3` = 3)


statement ok
DELETE FROM `table_5` WHERE (`column_3` = 4)


query  rowsort
SELECT `table_1`.`column_2` AS `alias_1`, `table_2`.`column_2` AS `alias_2` FROM `table_1` LEFT JOIN `table_2` ON (`table_1`.`column_1` = `table_2`.`column_1`)
----
-1350217340
NULL
1156690996
NULL
441943512
NULL
709996453
NULL
762173362
NULL

query  rowsort
SELECT sum(`table_2`.`column_3`) AS `alias_1` FROM `table_2`
----
-4069509991

query  rowsort
SELECT `table_2`.`column_1` AS `alias_1` FROM `table_2` WHERE (`table_2`.`column_1` > ?)
? = 10
----
1497412907
1593916921
881749197

query  rowsort
SELECT `table_2`.`column_4` AS `alias_1`, `table_3`.`column_2` AS `alias_2`, sum(`table_2`.`column_5`) AS `alias_3` FROM `table_2` LEFT JOIN `table_3` ON (`table_2`.`column_1` = `table_3`.`column_1`) GROUP BY `table_2`.`column_4`, `table_3`.`column_2`
----
-114508196
NULL
-1359014822
1233670630
NULL
1981701725
1433739969
NULL
121797672
1734603457
NULL
1113909645
802402759
NULL
79238041

query  rowsort
SELECT `table_2`.`column_6` AS `alias_1`, `table_4`.`column_2` AS `alias_2` FROM `table_2` LEFT JOIN `table_4` ON (`table_2`.`column_1` = `table_4`.`column_1`) WHERE (`table_2`.`column_1` > ?)
? = 10
----
-1475176158
NULL
-313178018
NULL
736471358
NULL

query  rowsort
SELECT sum(`table_2`.`column_7`) AS `alias_1` FROM `table_2` WHERE (`table_2`.`column_1` > ?)
? = 10
----
-773071873

query  rowsort
SELECT `table_2`.`column_8` AS `alias_1`, `table_5`.`column_2` AS `alias_2`, sum(`table_2`.`column_9`) AS `alias_3` FROM `table_2` LEFT JOIN `table_5` ON (`table_2`.`column_1` = `table_5`.`column_1`) WHERE (`table_2`.`column_1` > ?) GROUP BY `table_2`.`column_8`, `table_5`.`column_2`
? = 10
----
-2094061998
NULL
-1651512928
757756652
NULL
-408733698
864459941
NULL
-947024737
