# Generated by:
#     target/debug/noria-logictest permute --compare-to mysql://root:noria@127.1/noria -d 3 -o logictests/generated/mysql/ --only range_param --random --include-deletes --rows-per-table 10 --subquery-depth 1

statement ok
CREATE TABLE `table_4` (`column_2` INT, `column_3` INT, `column_4` INT, `column_1` INT, PRIMARY KEY (`column_4`))


statement ok
CREATE TABLE `table_2` (`column_1` INT, `column_3` INT, `column_5` INT, `column_4` INT, `column_2` INT, PRIMARY KEY (`column_5`))


statement ok
CREATE TABLE `table_3` (`column_2` INT, `column_1` INT, `column_3` INT, PRIMARY KEY (`column_3`))


statement ok
CREATE TABLE `table_5` (`column_1` INT, `column_2` INT, `column_3` INT, PRIMARY KEY (`column_3`))


statement ok
CREATE TABLE `table_1` (`column_1` INT, `column_3` INT, `column_2` INT, PRIMARY KEY (`column_3`))


statement ok
INSERT INTO `table_4` (`column_2`, `column_3`, `column_4`, `column_1`) VALUES (383962111, -1759486486, 0, -1795837846), (-1345839567, -1050409152, 1, 1855546731), (687551905, -401554479, 2, -310083036), (1221020619, 2056552311, 3, 1779283190), (2013540891, 718683084, 4, -1604008017), (1223701447, 1993623660, 5, -1657883635), (2009332748, 752306376, 6, -119732506), (79931922, 1781574293, 7, 1183185934), (1744793976, -1175409483, 8, -1682206140), (-1796081214, -497215995, 9, 2030899043)


statement ok
INSERT INTO `table_2` (`column_1`, `column_3`, `column_5`, `column_4`, `column_2`) VALUES (276299406, 1294480598, 0, 1580911245, 2083005282), (378666961, -145916096, 1, 817964922, 1102126269), (779017134, -708945163, 2, -850888133, -1024068544), (501011758, -734604777, 3, 638586578, 962120891), (-1150567243, -114517390, 4, -220993666, -767999015), (-1298167429, 456581982, 5, 1547744229, 856988382), (-88584231, -1749880947, 6, -733062278, -352119134), (1880474122, -1178615069, 7, -2008525451, -730605835), (694842575, 1370555059, 8, 2082304581, -150159628), (-1437271430, 950029388, 9, 565527259, 157105323)


statement ok
INSERT INTO `table_3` (`column_2`, `column_1`, `column_3`) VALUES (-251546003, 488635342, 0), (421024168, 2011131870, 1), (239411569, -205718380, 2), (218152700, -431905982, 3), (940346411, -1378071673, 4), (953047758, 361324345, 5), (-567328637, -1049893486, 6), (1052149680, -1907870544, 7), (1517108485, -248055085, 8), (-339544975, -1150179700, 9)


statement ok
INSERT INTO `table_5` (`column_1`, `column_2`, `column_3`) VALUES (-585399250, -95221256, 0), (-1708587708, -471868797, 1), (1764071548, 2136771761, 2), (-1504174633, -825242140, 3), (-1644965087, 1026555650, 4), (1562437435, 1045636458, 5), (-1520659422, -1374356019, 6), (1072137112, -1269115217, 7), (528005107, 233528920, 8), (-1109077242, -541028921, 9)


statement ok
INSERT INTO `table_1` (`column_1`, `column_3`, `column_2`) VALUES (1826264745, 0, 1781386313), (-2023835006, 1, 1077107829), (305970586, 2, -62302100), (1356222765, 3, -126412126), (287669959, 4, 419520716), (-2127574037, 5, 866496611), (106242121, 6, 1388739101), (-1234713480, 7, 1763742835), (661427161, 8, 1033831099), (-653233052, 9, 1543231919)


query  rowsort
SELECT `table_1`.`column_2` AS `alias_1`, `table_2`.`column_2` AS `alias_2` FROM `table_1` LEFT JOIN `table_2` ON (`table_1`.`column_1` = `table_2`.`column_1`)
----
-126412126
NULL
-62302100
NULL
1033831099
NULL
1077107829
NULL
1388739101
NULL
1543231919
NULL
1763742835
NULL
1781386313
NULL
419520716
NULL
866496611
NULL

query  rowsort
SELECT `table_2`.`column_1` AS `alias_1` FROM `table_2` WHERE ((`table_2`.`column_1` > ?) AND (`table_2`.`column_1` > ?))
? = 10
? = 10
----
1880474122
276299406
378666961
501011758
694842575
779017134

query  rowsort
SELECT `table_2`.`column_1` AS `alias_1` FROM `table_2` WHERE (`table_2`.`column_1` > ?)
? = 10
----
1880474122
276299406
378666961
501011758
694842575
779017134

query  rowsort
SELECT `table_2`.`column_3` AS `alias_1`, `table_3`.`column_2` AS `alias_2` FROM `table_2` LEFT JOIN `table_3` ON (`table_2`.`column_1` = `table_3`.`column_1`) WHERE ((`table_2`.`column_1` > ?) AND (`table_2`.`column_1` > ?))
? = 10
? = 10
----
-1178615069
NULL
-145916096
NULL
-708945163
NULL
-734604777
NULL
1294480598
NULL
1370555059
NULL

query  rowsort
SELECT `table_2`.`column_4` AS `alias_1`, `table_4`.`column_2` AS `alias_2` FROM `table_2` LEFT JOIN `table_4` ON (`table_2`.`column_1` = `table_4`.`column_1`) WHERE (`table_2`.`column_1` > ?)
? = 10
----
-2008525451
NULL
-850888133
NULL
1580911245
NULL
2082304581
NULL
638586578
NULL
817964922
NULL

query  rowsort
SELECT `table_4`.`column_2` AS `alias_1` FROM `table_4` WHERE (((`table_4`.`column_2` > ?) AND (`table_4`.`column_2` > ?)) AND (`table_4`.`column_2` > ?))
? = 10
? = 10
? = 10
----
1221020619
1223701447
1744793976
2009332748
2013540891
383962111
687551905
79931922

query  rowsort
SELECT `table_4`.`column_3` AS `alias_1`, `table_5`.`column_2` AS `alias_2` FROM `table_4` LEFT JOIN `table_5` ON (`table_4`.`column_2` = `table_5`.`column_1`) WHERE (((`table_4`.`column_2` > ?) AND (`table_4`.`column_2` > ?)) AND (`table_4`.`column_2` > ?))
? = 10
? = 10
? = 10
----
-1175409483
NULL
-1759486486
NULL
-401554479
NULL
1781574293
NULL
1993623660
NULL
2056552311
NULL
718683084
NULL
752306376
NULL

statement ok
DELETE FROM `table_4` WHERE (`column_4` = 0)


statement ok
DELETE FROM `table_4` WHERE (`column_4` = 1)


statement ok
DELETE FROM `table_4` WHERE (`column_4` = 2)


statement ok
DELETE FROM `table_4` WHERE (`column_4` = 3)


statement ok
DELETE FROM `table_4` WHERE (`column_4` = 4)


statement ok
DELETE FROM `table_2` WHERE (`column_5` = 0)


statement ok
DELETE FROM `table_2` WHERE (`column_5` = 1)


statement ok
DELETE FROM `table_2` WHERE (`column_5` = 2)


statement ok
DELETE FROM `table_2` WHERE (`column_5` = 3)


statement ok
DELETE FROM `table_2` WHERE (`column_5` = 4)


statement ok
DELETE FROM `table_3` WHERE (`column_3` = 0)


statement ok
DELETE FROM `table_3` WHERE (`column_3` = 1)


statement ok
DELETE FROM `table_3` WHERE (`column_3` = 2)


statement ok
DELETE FROM `table_3` WHERE (`column_3` = 3)


statement ok
DELETE FROM `table_3` WHERE (`column_3` = 4)


statement ok
DELETE FROM `table_5` WHERE (`column_3` = 0)


statement ok
DELETE FROM `table_5` WHERE (`column_3` = 1)


statement ok
DELETE FROM `table_5` WHERE (`column_3` = 2)


statement ok
DELETE FROM `table_5` WHERE (`column_3` = 3)


statement ok
DELETE FROM `table_5` WHERE (`column_3` = 4)


statement ok
DELETE FROM `table_1` WHERE (`column_3` = 0)


statement ok
DELETE FROM `table_1` WHERE (`column_3` = 1)


statement ok
DELETE FROM `table_1` WHERE (`column_3` = 2)


statement ok
DELETE FROM `table_1` WHERE (`column_3` = 3)


statement ok
DELETE FROM `table_1` WHERE (`column_3` = 4)


query  rowsort
SELECT `table_1`.`column_2` AS `alias_1`, `table_2`.`column_2` AS `alias_2` FROM `table_1` LEFT JOIN `table_2` ON (`table_1`.`column_1` = `table_2`.`column_1`)
----
1033831099
NULL
1388739101
NULL
1543231919
NULL
1763742835
NULL
866496611
NULL

query  rowsort
SELECT `table_2`.`column_1` AS `alias_1` FROM `table_2` WHERE ((`table_2`.`column_1` > ?) AND (`table_2`.`column_1` > ?))
? = 10
? = 10
----
1880474122
694842575

query  rowsort
SELECT `table_2`.`column_1` AS `alias_1` FROM `table_2` WHERE (`table_2`.`column_1` > ?)
? = 10
----
1880474122
694842575

query  rowsort
SELECT `table_2`.`column_3` AS `alias_1`, `table_3`.`column_2` AS `alias_2` FROM `table_2` LEFT JOIN `table_3` ON (`table_2`.`column_1` = `table_3`.`column_1`) WHERE ((`table_2`.`column_1` > ?) AND (`table_2`.`column_1` > ?))
? = 10
? = 10
----
-1178615069
NULL
1370555059
NULL

query  rowsort
SELECT `table_2`.`column_4` AS `alias_1`, `table_4`.`column_2` AS `alias_2` FROM `table_2` LEFT JOIN `table_4` ON (`table_2`.`column_1` = `table_4`.`column_1`) WHERE (`table_2`.`column_1` > ?)
? = 10
----
-2008525451
NULL
2082304581
NULL

query  rowsort
SELECT `table_4`.`column_2` AS `alias_1` FROM `table_4` WHERE (((`table_4`.`column_2` > ?) AND (`table_4`.`column_2` > ?)) AND (`table_4`.`column_2` > ?))
? = 10
? = 10
? = 10
----
1223701447
1744793976
2009332748
79931922

query  rowsort
SELECT `table_4`.`column_3` AS `alias_1`, `table_5`.`column_2` AS `alias_2` FROM `table_4` LEFT JOIN `table_5` ON (`table_4`.`column_2` = `table_5`.`column_1`) WHERE (((`table_4`.`column_2` > ?) AND (`table_4`.`column_2` > ?)) AND (`table_4`.`column_2` > ?))
? = 10
? = 10
? = 10
----
-1175409483
NULL
1781574293
NULL
1993623660
NULL
752306376
NULL
