# Generated by:
#     target/debug/noria-logictest permute --compare-to mysql://root:noria@127.1/noria -d 3 -o logictests/generated/mysql/ --only range_param --random --include-deletes --rows-per-table 10 --subquery-depth 1

statement ok
CREATE TABLE `table_1` (`column_2` INT, `column_4` INT, `column_6` INT, `column_5` INT, `column_1` INT, `column_3` INT, PRIMARY KEY (`column_6`))


statement ok
CREATE TABLE `table_5` (`column_1` INT, `column_2` INT, `column_3` INT, PRIMARY KEY (`column_3`))


statement ok
CREATE TABLE `table_3` (`column_1` INT, `column_2` INT, `column_3` INT, PRIMARY KEY (`column_3`))


statement ok
CREATE TABLE `table_2` (`column_6` INT, `column_7` INT, `column_4` INT, `column_5` INT, `column_1` INT, `column_2` INT, `column_3` INT, PRIMARY KEY (`column_7`))


statement ok
CREATE TABLE `table_4` (`column_3` INT, `column_2` INT, `column_1` INT, PRIMARY KEY (`column_3`))


statement ok
INSERT INTO `table_1` (`column_2`, `column_4`, `column_6`, `column_5`, `column_1`, `column_3`) VALUES (-2043092545, -1580894587, 0, -1390051699, -2062794489, -1372002168), (2038813058, 616345821, 1, 1072858408, -1924469880, -481947539), (-317179258, -616404096, 2, 540872170, -1265427947, -741106906), (98335976, 1742353100, 3, 74897661, 47246372, -977328641), (-2102031990, 1901899392, 4, -1347279452, 1143205833, -335788929), (188720875, 1389244929, 5, -1640197779, 1994138490, -1985989665), (1284824656, 385275066, 6, -1811023954, -41199969, -2000846576), (146268568, 1898805518, 7, -444785878, 1716539748, 1645375842), (2046668222, 1933584223, 8, -16158998, -1477294614, 1307335750), (-893378722, 884563186, 9, 1569958050, -342095619, 16676905)


statement ok
INSERT INTO `table_5` (`column_1`, `column_2`, `column_3`) VALUES (618206268, -1668009596, 0), (-384018546, 1467228466, 1), (324091774, 2126984023, 2), (562674554, 88336317, 3), (-193876545, 2012446215, 4), (2040832261, -1992722251, 5), (-555645397, -12696507, 6), (-1184444283, 456072458, 7), (-224219978, -612825216, 8), (1777286953, 605484590, 9)


statement ok
INSERT INTO `table_3` (`column_1`, `column_2`, `column_3`) VALUES (-61627083, 321798672, 0), (-2125378599, -123463349, 1), (-1448453119, -541094552, 2), (-2003182505, 955955192, 3), (-695880691, 688240475, 4), (785755663, -349441808, 5), (-1284435717, -710658229, 6), (477238829, 1833332307, 7), (159547381, 1271014706, 8), (1677590401, -2121184694, 9)


statement ok
INSERT INTO `table_2` (`column_6`, `column_7`, `column_4`, `column_5`, `column_1`, `column_2`, `column_3`) VALUES (1770550861, 0, -639254077, -1811928921, 1331730810, 2002682565, 2112820857), (546954558, 1, -200530698, -1870660743, 439780734, -230845788, -1547079370), (-658889893, 2, -1021405196, 937243040, -752585868, -1460255924, -89918970), (-48877126, 3, 231184793, 441306261, -506507627, 1048236124, -1510023335), (355386843, 4, -1232448292, 1246542992, -624776811, -1649430050, -58533277), (1824616034, 5, 568169792, -1660521370, 1833190211, -707807847, 132424723), (-1070980717, 6, -1967330496, -1117773842, 1036457794, -1981320781, -1292811364), (-924153310, 7, 152641565, 1267270291, -2104110845, -2006090461, -810439141), (-1427816821, 8, 1230872668, -1673257316, -706476332, 34491461, 1002524077), (-1206067393, 9, 1211478024, 1337098675, 1178682970, -1701401632, 1886834943)


statement ok
INSERT INTO `table_4` (`column_3`, `column_2`, `column_1`) VALUES (0, 108983283, 970439270), (1, 924710210, -1306250086), (2, 992068962, -1001034418), (3, -750165837, -1529444050), (4, -2007060331, 1899720340), (5, 727207207, 335137497), (6, 1199553560, -202415150), (7, 1208343604, 1034406667), (8, 233235392, 931313508), (9, -822631848, 986213352)


query  rowsort
SELECT `table_1`.`column_2` AS `alias_1`, `table_2`.`column_2` AS `alias_2` FROM `table_1` LEFT JOIN `table_2` ON (`table_1`.`column_1` = `table_2`.`column_1`)
----
-2043092545
NULL
-2102031990
NULL
-317179258
NULL
-893378722
NULL
1284824656
NULL
146268568
NULL
188720875
NULL
2038813058
NULL
2046668222
NULL
98335976
NULL

query  rowsort
SELECT avg(distinct `table_2`.`column_3`) AS `alias_1` FROM `table_2`
----
-17420085.7000

query  rowsort
SELECT `table_2`.`column_1` AS `alias_1` FROM `table_2` WHERE (`table_2`.`column_1` > ?)
? = 10
----
1036457794
1178682970
1331730810
1833190211
439780734

query  rowsort
SELECT `table_2`.`column_4` AS `alias_1`, `table_3`.`column_2` AS `alias_2`, avg(distinct `table_2`.`column_5`) AS `alias_3` FROM `table_2` LEFT JOIN `table_3` ON (`table_2`.`column_1` = `table_3`.`column_1`) GROUP BY `table_2`.`column_4`, `table_3`.`column_2`
----
30 values hashing to fe75374b10a93052f1f8a253b90d67ef

query  rowsort
SELECT `table_2`.`column_6` AS `alias_1`, `table_4`.`column_2` AS `alias_2` FROM `table_2` LEFT JOIN `table_4` ON (`table_2`.`column_4` = `table_4`.`column_1`) WHERE (`table_2`.`column_6` > ?)
? = 10
----
1770550861
NULL
1824616034
NULL
355386843
NULL
546954558
NULL

query  rowsort
SELECT avg(distinct `table_1`.`column_3`) AS `alias_1` FROM `table_1` WHERE (`table_1`.`column_2` > ?)
? = 10
----
-415566804.8333

query  rowsort
SELECT `table_1`.`column_4` AS `alias_1`, `table_5`.`column_2` AS `alias_2`, avg(distinct `table_1`.`column_5`) AS `alias_3` FROM `table_1` LEFT JOIN `table_5` ON (`table_1`.`column_2` = `table_5`.`column_1`) WHERE (`table_1`.`column_2` > ?) GROUP BY `table_1`.`column_4`, `table_5`.`column_2`
? = 10
----
1389244929
NULL
-1640197779.0000
1742353100
NULL
74897661.0000
1898805518
NULL
-444785878.0000
1933584223
NULL
-16158998.0000
385275066
NULL
-1811023954.0000
616345821
NULL
1072858408.0000

statement ok
DELETE FROM `table_1` WHERE (`column_6` = 0)


statement ok
DELETE FROM `table_1` WHERE (`column_6` = 1)


statement ok
DELETE FROM `table_1` WHERE (`column_6` = 2)


statement ok
DELETE FROM `table_1` WHERE (`column_6` = 3)


statement ok
DELETE FROM `table_1` WHERE (`column_6` = 4)


statement ok
DELETE FROM `table_5` WHERE (`column_3` = 0)


statement ok
DELETE FROM `table_5` WHERE (`column_3` = 1)


statement ok
DELETE FROM `table_5` WHERE (`column_3` = 2)


statement ok
DELETE FROM `table_5` WHERE (`column_3` = 3)


statement ok
DELETE FROM `table_5` WHERE (`column_3` = 4)


statement ok
DELETE FROM `table_3` WHERE (`column_3` = 0)


statement ok
DELETE FROM `table_3` WHERE (`column_3` = 1)


statement ok
DELETE FROM `table_3` WHERE (`column_3` = 2)


statement ok
DELETE FROM `table_3` WHERE (`column_3` = 3)


statement ok
DELETE FROM `table_3` WHERE (`column_3` = 4)


statement ok
DELETE FROM `table_2` WHERE (`column_7` = 0)


statement ok
DELETE FROM `table_2` WHERE (`column_7` = 1)


statement ok
DELETE FROM `table_2` WHERE (`column_7` = 2)


statement ok
DELETE FROM `table_2` WHERE (`column_7` = 3)


statement ok
DELETE FROM `table_2` WHERE (`column_7` = 4)


statement ok
DELETE FROM `table_4` WHERE (`column_3` = 0)


statement ok
DELETE FROM `table_4` WHERE (`column_3` = 1)


statement ok
DELETE FROM `table_4` WHERE (`column_3` = 2)


statement ok
DELETE FROM `table_4` WHERE (`column_3` = 3)


statement ok
DELETE FROM `table_4` WHERE (`column_3` = 4)


query  rowsort
SELECT `table_1`.`column_2` AS `alias_1`, `table_2`.`column_2` AS `alias_2` FROM `table_1` LEFT JOIN `table_2` ON (`table_1`.`column_1` = `table_2`.`column_1`)
----
-893378722
NULL
1284824656
NULL
146268568
NULL
188720875
NULL
2046668222
NULL

query  rowsort
SELECT avg(distinct `table_2`.`column_3`) AS `alias_1` FROM `table_2`
----
183706647.6000

query  rowsort
SELECT `table_2`.`column_1` AS `alias_1` FROM `table_2` WHERE (`table_2`.`column_1` > ?)
? = 10
----
1036457794
1178682970
1833190211

query  rowsort
SELECT `table_2`.`column_4` AS `alias_1`, `table_3`.`column_2` AS `alias_2`, avg(distinct `table_2`.`column_5`) AS `alias_3` FROM `table_2` LEFT JOIN `table_3` ON (`table_2`.`column_1` = `table_3`.`column_1`) GROUP BY `table_2`.`column_4`, `table_3`.`column_2`
----
-1967330496
NULL
-1117773842.0000
1211478024
NULL
1337098675.0000
1230872668
NULL
-1673257316.0000
152641565
NULL
1267270291.0000
568169792
NULL
-1660521370.0000

query  rowsort
SELECT `table_2`.`column_6` AS `alias_1`, `table_4`.`column_2` AS `alias_2` FROM `table_2` LEFT JOIN `table_4` ON (`table_2`.`column_4` = `table_4`.`column_1`) WHERE (`table_2`.`column_6` > ?)
? = 10
----
1824616034
NULL

query  rowsort
SELECT avg(distinct `table_1`.`column_3`) AS `alias_1` FROM `table_1` WHERE (`table_1`.`column_2` > ?)
? = 10
----
-258531162.2500

query  rowsort
SELECT `table_1`.`column_4` AS `alias_1`, `table_5`.`column_2` AS `alias_2`, avg(distinct `table_1`.`column_5`) AS `alias_3` FROM `table_1` LEFT JOIN `table_5` ON (`table_1`.`column_2` = `table_5`.`column_1`) WHERE (`table_1`.`column_2` > ?) GROUP BY `table_1`.`column_4`, `table_5`.`column_2`
? = 10
----
1389244929
NULL
-1640197779.0000
1898805518
NULL
-444785878.0000
1933584223
NULL
-16158998.0000
385275066
NULL
-1811023954.0000
