# Generated by:
#     target/debug/noria-logictest permute --compare-to mysql://root:noria@127.1/noria -d 3 -o logictests/generated/mysql/ --only range_param --random --include-deletes --rows-per-table 10 --subquery-depth 1

statement ok
CREATE TABLE `table_4` (`column_4` INT, `column_2` INT, `column_3` INT, `column_1` INT, PRIMARY KEY (`column_4`))


statement ok
CREATE TABLE `table_1` (`column_1` INT, `column_2` INT, `column_3` INT, PRIMARY KEY (`column_3`))


statement ok
CREATE TABLE `table_2` (`column_4` INT, `column_5` INT, `column_3` INT, `column_1` INT, `column_2` INT, PRIMARY KEY (`column_5`))


statement ok
CREATE TABLE `table_3` (`column_1` INT, `column_2` INT, `column_3` INT, PRIMARY KEY (`column_3`))


statement ok
CREATE TABLE `table_5` (`column_2` INT, `column_1` INT, `column_3` INT, PRIMARY KEY (`column_3`))


statement ok
INSERT INTO `table_4` (`column_4`, `column_2`, `column_3`, `column_1`) VALUES (0, 1300999117, -1499910507, -128222300), (1, 500483103, -1721781552, -711607810), (2, 478616708, 1720626653, -1037460105), (3, 65438490, 997570794, -1137665039), (4, 1392299199, -920967252, 806058512), (5, 1751918773, -488423473, -680999300), (6, 1944621822, 1996049606, 1777848423), (7, 1561889074, -1856814556, 227426377), (8, -920496523, -1804188279, -726160255), (9, -561149200, -663785405, -182383411)


statement ok
INSERT INTO `table_1` (`column_1`, `column_2`, `column_3`) VALUES (819490518, -1582280552, 0), (8949713, 979325175, 1), (-754051759, 526944791, 2), (165714861, 544756925, 3), (1053828126, 2125036567, 4), (-53816399, -1904065490, 5), (936613451, 986018375, 6), (-2079793298, 1225712048, 7), (1887685242, 1698799074, 8), (1865188823, 346454219, 9)


statement ok
INSERT INTO `table_2` (`column_4`, `column_5`, `column_3`, `column_1`, `column_2`) VALUES (-192878321, 0, 1657888614, 24215025, 1160986093), (752543694, 1, -744332313, 243796208, -492408873), (-616579126, 2, 107049617, -1387855820, -649784091), (-1889807191, 3, -411148787, -2012548579, 245951170), (1162221448, 4, -312057578, 1314904647, 1388572017), (905124893, 5, -1831944557, -803571649, -1689791492), (-513240882, 6, -1849253514, 1794846019, -1481482395), (338455691, 7, 982821668, 1346004995, -88545761), (351534734, 8, -1317724087, 1923681651, 1573045436), (1288440313, 9, 661294597, 1602414131, -1857885700)


statement ok
INSERT INTO `table_3` (`column_1`, `column_2`, `column_3`) VALUES (661474841, 969444897, 0), (-1655602751, 1441638885, 1), (185259309, -779472792, 2), (122320216, 500853782, 3), (-1781616638, -2145618291, 4), (-244929743, -861513913, 5), (-581829183, 741511478, 6), (-1547110395, -118599161, 7), (634662293, -1902990944, 8), (1776397408, 1315471263, 9)


statement ok
INSERT INTO `table_5` (`column_2`, `column_1`, `column_3`) VALUES (1477105100, 1849552619, 0), (214819477, 555292193, 1), (481014848, -1475667392, 2), (-9208804, 1057954840, 3), (698060954, 192166952, 4), (-1410017468, -911416116, 5), (2075488562, -1478466171, 6), (1377299263, 915440953, 7), (2104058990, -922563203, 8), (370152009, 1107849595, 9)


query  rowsort
SELECT `table_1`.`column_2` AS `alias_1`, `table_2`.`column_2` AS `alias_2` FROM `table_1` LEFT JOIN `table_2` ON (`table_1`.`column_1` = `table_2`.`column_1`)
----
-1582280552
NULL
-1904065490
NULL
1225712048
NULL
1698799074
NULL
2125036567
NULL
346454219
NULL
526944791
NULL
544756925
NULL
979325175
NULL
986018375
NULL

query  rowsort
SELECT `table_2`.`column_1` AS `alias_1` FROM `table_2` WHERE (`table_2`.`column_1` > ?)
? = 10
----
1314904647
1346004995
1602414131
1794846019
1923681651
24215025
243796208

query  rowsort
SELECT `table_2`.`column_1` AS `alias_1` FROM `table_2` WHERE (`table_2`.`column_1` > ?)
? = 10
----
1314904647
1346004995
1602414131
1794846019
1923681651
24215025
243796208

query  rowsort
SELECT `table_2`.`column_3` AS `alias_1`, `table_3`.`column_2` AS `alias_2` FROM `table_2` LEFT JOIN `table_3` ON (`table_2`.`column_1` = `table_3`.`column_1`) WHERE (`table_2`.`column_1` > ?)
? = 10
----
-1317724087
NULL
-1849253514
NULL
-312057578
NULL
-744332313
NULL
1657888614
NULL
661294597
NULL
982821668
NULL

query  rowsort
SELECT `table_2`.`column_4` AS `alias_1`, `table_4`.`column_2` AS `alias_2` FROM `table_2` LEFT JOIN `table_4` ON (`table_2`.`column_1` = `table_4`.`column_1`) WHERE (`table_2`.`column_4` > ?)
? = 10
----
1162221448
NULL
1288440313
NULL
338455691
NULL
351534734
NULL
752543694
NULL
905124893
NULL

query  rowsort
SELECT `table_4`.`column_1` AS `alias_1` FROM `table_4` WHERE ((`table_4`.`column_1` > ?) AND (`table_4`.`column_1` > ?))
? = 10
? = 10
----
1777848423
227426377
806058512

query  rowsort
SELECT `table_4`.`column_3` AS `alias_1`, `table_5`.`column_2` AS `alias_2` FROM `table_4` LEFT JOIN `table_5` ON (`table_4`.`column_1` = `table_5`.`column_1`) WHERE ((`table_4`.`column_3` > ?) AND (`table_4`.`column_3` > ?))
? = 10
? = 10
----
1720626653
NULL
1996049606
NULL
997570794
NULL

statement ok
DELETE FROM `table_4` WHERE (`column_4` = 0)


statement ok
DELETE FROM `table_4` WHERE (`column_4` = 1)


statement ok
DELETE FROM `table_4` WHERE (`column_4` = 2)


statement ok
DELETE FROM `table_4` WHERE (`column_4` = 3)


statement ok
DELETE FROM `table_4` WHERE (`column_4` = 4)


statement ok
DELETE FROM `table_1` WHERE (`column_3` = 0)


statement ok
DELETE FROM `table_1` WHERE (`column_3` = 1)


statement ok
DELETE FROM `table_1` WHERE (`column_3` = 2)


statement ok
DELETE FROM `table_1` WHERE (`column_3` = 3)


statement ok
DELETE FROM `table_1` WHERE (`column_3` = 4)


statement ok
DELETE FROM `table_2` WHERE (`column_5` = 0)


statement ok
DELETE FROM `table_2` WHERE (`column_5` = 1)


statement ok
DELETE FROM `table_2` WHERE (`column_5` = 2)


statement ok
DELETE FROM `table_2` WHERE (`column_5` = 3)


statement ok
DELETE FROM `table_2` WHERE (`column_5` = 4)


statement ok
DELETE FROM `table_3` WHERE (`column_3` = 0)


statement ok
DELETE FROM `table_3` WHERE (`column_3` = 1)


statement ok
DELETE FROM `table_3` WHERE (`column_3` = 2)


statement ok
DELETE FROM `table_3` WHERE (`column_3` = 3)


statement ok
DELETE FROM `table_3` WHERE (`column_3` = 4)


statement ok
DELETE FROM `table_5` WHERE (`column_3` = 0)


statement ok
DELETE FROM `table_5` WHERE (`column_3` = 1)


statement ok
DELETE FROM `table_5` WHERE (`column_3` = 2)


statement ok
DELETE FROM `table_5` WHERE (`column_3` = 3)


statement ok
DELETE FROM `table_5` WHERE (`column_3` = 4)


query  rowsort
SELECT `table_1`.`column_2` AS `alias_1`, `table_2`.`column_2` AS `alias_2` FROM `table_1` LEFT JOIN `table_2` ON (`table_1`.`column_1` = `table_2`.`column_1`)
----
-1904065490
NULL
1225712048
NULL
1698799074
NULL
346454219
NULL
986018375
NULL

query  rowsort
SELECT `table_2`.`column_1` AS `alias_1` FROM `table_2` WHERE (`table_2`.`column_1` > ?)
? = 10
----
1346004995
1602414131
1794846019
1923681651

query  rowsort
SELECT `table_2`.`column_1` AS `alias_1` FROM `table_2` WHERE (`table_2`.`column_1` > ?)
? = 10
----
1346004995
1602414131
1794846019
1923681651

query  rowsort
SELECT `table_2`.`column_3` AS `alias_1`, `table_3`.`column_2` AS `alias_2` FROM `table_2` LEFT JOIN `table_3` ON (`table_2`.`column_1` = `table_3`.`column_1`) WHERE (`table_2`.`column_1` > ?)
? = 10
----
-1317724087
NULL
-1849253514
NULL
661294597
NULL
982821668
NULL

query  rowsort
SELECT `table_2`.`column_4` AS `alias_1`, `table_4`.`column_2` AS `alias_2` FROM `table_2` LEFT JOIN `table_4` ON (`table_2`.`column_1` = `table_4`.`column_1`) WHERE (`table_2`.`column_4` > ?)
? = 10
----
1288440313
NULL
338455691
NULL
351534734
NULL
905124893
NULL

query  rowsort
SELECT `table_4`.`column_1` AS `alias_1` FROM `table_4` WHERE ((`table_4`.`column_1` > ?) AND (`table_4`.`column_1` > ?))
? = 10
? = 10
----
1777848423
227426377

query  rowsort
SELECT `table_4`.`column_3` AS `alias_1`, `table_5`.`column_2` AS `alias_2` FROM `table_4` LEFT JOIN `table_5` ON (`table_4`.`column_1` = `table_5`.`column_1`) WHERE ((`table_4`.`column_3` > ?) AND (`table_4`.`column_3` > ?))
? = 10
? = 10
----
1996049606
NULL
