# Generated by:
#     target/debug/noria-logictest permute --compare-to mysql://root:noria@127.1/noria -d 3 -o logictests/generated/mysql/ --only range_param --random --include-deletes --rows-per-table 10 --subquery-depth 1 --overwrite-tests

statement ok
CREATE TABLE `table_1` (`column_5` INT, `column_8` INT, `column_3` INT, `column_2` INT, `column_9` INT, `column_7` INT, `column_6` INT, `column_1` INT, `column_4` INT, PRIMARY KEY (`column_9`))


statement ok
CREATE TABLE `table_2` (`column_2` INT, `column_1` INT, `column_3` INT, PRIMARY KEY (`column_3`))


statement ok
CREATE TABLE `table_4` (`column_1` INT, `column_2` INT, `column_3` INT, PRIMARY KEY (`column_3`))


statement ok
CREATE TABLE `table_5` (`column_1` INT, `column_2` INT, `column_3` INT, PRIMARY KEY (`column_3`))


statement ok
CREATE TABLE `table_3` (`column_1` INT, `column_2` INT, `column_3` INT, PRIMARY KEY (`column_3`))


statement ok
INSERT INTO `table_1` (`column_5`, `column_8`, `column_3`, `column_2`, `column_9`, `column_7`, `column_6`, `column_1`, `column_4`) VALUES (1063084071, -2132018419, -1003075524, 893989415, 0, 1656416911, -166138551, 1959457416, 15932217), (-220042075, 18390053, 652237117, 1115450012, 1, 1200796822, 1214940520, 520557109, 1366573806), (1413618926, 1034501229, 1304705611, 1683579904, 2, -1206384366, 1958245123, 1477378135, -1301059376), (147115893, 1320084848, -1265782598, -1089226289, 3, 1419303999, 287176670, 57056446, -1523168107), (-468712810, -282543558, 1110636364, 1692031869, 4, 973646560, 956867631, 1360800403, -1611985687), (-99718820, 1866122804, -1558983230, 87483184, 5, -1175245979, -778594243, 632981031, 1046613530), (18111840, -1901284373, 443287377, -1331801830, 6, 1742172870, -1948244375, -1987263569, -19727852), (997499236, -129590778, 1786019888, -1034224099, 7, 2012450696, -963379051, -1926800521, 1668763900), (-1584318123, -1594636523, 576836934, 2066516622, 8, -350912512, 564487331, 890574640, -473041651), (1072925167, 1961944404, -1715278138, 1471544735, 9, -1728007596, 685535040, -1839947292, -1423237861)


statement ok
INSERT INTO `table_2` (`column_2`, `column_1`, `column_3`) VALUES (1774709850, 1866285310, 0), (135945568, 1123383207, 1), (1106893763, -1020866658, 2), (-1249676299, 1409173838, 3), (-1690781466, 1561911233, 4), (-1073425871, 979944242, 5), (1693311959, -1008923744, 6), (-69043266, 2130650457, 7), (691659388, -505068869, 8), (-2120960322, -1842545793, 9)


statement ok
INSERT INTO `table_4` (`column_1`, `column_2`, `column_3`) VALUES (-979102040, 254007991, 0), (-145351555, 867743149, 1), (1132542098, 374248088, 2), (742985558, 403721810, 3), (-1407385702, -282592336, 4), (-894776301, -1419302118, 5), (-1367803521, 1165292953, 6), (-632535010, 501886528, 7), (2139662056, 1964564164, 8), (1629530106, -667792124, 9)


statement ok
INSERT INTO `table_5` (`column_1`, `column_2`, `column_3`) VALUES (-67013032, 1827107347, 0), (930564202, -1639220934, 1), (1120660677, 392251491, 2), (580898300, 1485124384, 3), (3375925, 1590146096, 4), (112865437, -151801582, 5), (-1030811223, 1663744266, 6), (2144532735, -1153663018, 7), (-998110148, -710156502, 8), (-1442031967, 1664452818, 9)


statement ok
INSERT INTO `table_3` (`column_1`, `column_2`, `column_3`) VALUES (-1728601908, -2122584028, 0), (-1868631580, 1519411670, 1), (-261882358, 1945636392, 2), (-1966017904, -750507005, 3), (-2027740134, -310388441, 4), (-1859233742, -94583310, 5), (-462718438, -459953603, 6), (-566164964, 668345504, 7), (-131096199, 1920730393, 8), (1361587753, -1042627214, 9)


query  rowsort
SELECT max(`table_1`.`column_1`) AS `alias_1` FROM `table_1`
----
1959457416

query  rowsort
SELECT `table_1`.`column_2` AS `alias_1`, `table_2`.`column_2` AS `alias_2` FROM `table_1` INNER JOIN `table_2` ON (`table_1`.`column_1` = `table_2`.`column_1`)
----


query  rowsort
SELECT `table_1`.`column_1` AS `alias_1` FROM `table_1` WHERE (`table_1`.`column_1` > ?)
? = 10
----
1360800403
1477378135
1959457416
520557109
57056446
632981031
890574640

query  rowsort
SELECT max(`table_1`.`column_3`) AS `alias_1`, `table_1`.`column_4` AS `alias_2`, `table_3`.`column_2` AS `alias_3` FROM `table_1` INNER JOIN `table_3` ON (`table_1`.`column_1` = `table_3`.`column_1`) GROUP BY `table_1`.`column_4`, `table_3`.`column_2`
----


query  rowsort
SELECT max(`table_1`.`column_5`) AS `alias_1` FROM `table_1` WHERE (`table_1`.`column_2` > ?)
? = 10
----
1413618926

query  rowsort
SELECT `table_1`.`column_6` AS `alias_1`, `table_4`.`column_2` AS `alias_2` FROM `table_1` INNER JOIN `table_4` ON (`table_1`.`column_2` = `table_4`.`column_1`) WHERE (`table_1`.`column_6` > ?)
? = 10
----


query  rowsort
SELECT max(`table_1`.`column_7`) AS `alias_1`, `table_1`.`column_8` AS `alias_2`, `table_5`.`column_2` AS `alias_3` FROM `table_1` INNER JOIN `table_5` ON (`table_1`.`column_6` = `table_5`.`column_1`) WHERE (`table_1`.`column_5` > ?) GROUP BY `table_1`.`column_8`, `table_5`.`column_2`
? = 10
----


statement ok
DELETE FROM `table_1` WHERE (`column_9` = 0)


statement ok
DELETE FROM `table_1` WHERE (`column_9` = 1)


statement ok
DELETE FROM `table_1` WHERE (`column_9` = 2)


statement ok
DELETE FROM `table_1` WHERE (`column_9` = 3)


statement ok
DELETE FROM `table_1` WHERE (`column_9` = 4)


statement ok
DELETE FROM `table_2` WHERE (`column_3` = 0)


statement ok
DELETE FROM `table_2` WHERE (`column_3` = 1)


statement ok
DELETE FROM `table_2` WHERE (`column_3` = 2)


statement ok
DELETE FROM `table_2` WHERE (`column_3` = 3)


statement ok
DELETE FROM `table_2` WHERE (`column_3` = 4)


statement ok
DELETE FROM `table_4` WHERE (`column_3` = 0)


statement ok
DELETE FROM `table_4` WHERE (`column_3` = 1)


statement ok
DELETE FROM `table_4` WHERE (`column_3` = 2)


statement ok
DELETE FROM `table_4` WHERE (`column_3` = 3)


statement ok
DELETE FROM `table_4` WHERE (`column_3` = 4)


statement ok
DELETE FROM `table_5` WHERE (`column_3` = 0)


statement ok
DELETE FROM `table_5` WHERE (`column_3` = 1)


statement ok
DELETE FROM `table_5` WHERE (`column_3` = 2)


statement ok
DELETE FROM `table_5` WHERE (`column_3` = 3)


statement ok
DELETE FROM `table_5` WHERE (`column_3` = 4)


statement ok
DELETE FROM `table_3` WHERE (`column_3` = 0)


statement ok
DELETE FROM `table_3` WHERE (`column_3` = 1)


statement ok
DELETE FROM `table_3` WHERE (`column_3` = 2)


statement ok
DELETE FROM `table_3` WHERE (`column_3` = 3)


statement ok
DELETE FROM `table_3` WHERE (`column_3` = 4)


query  rowsort
SELECT max(`table_1`.`column_1`) AS `alias_1` FROM `table_1`
----
890574640

query  rowsort
SELECT `table_1`.`column_2` AS `alias_1`, `table_2`.`column_2` AS `alias_2` FROM `table_1` INNER JOIN `table_2` ON (`table_1`.`column_1` = `table_2`.`column_1`)
----


query  rowsort
SELECT `table_1`.`column_1` AS `alias_1` FROM `table_1` WHERE (`table_1`.`column_1` > ?)
? = 10
----
632981031
890574640

query  rowsort
SELECT max(`table_1`.`column_3`) AS `alias_1`, `table_1`.`column_4` AS `alias_2`, `table_3`.`column_2` AS `alias_3` FROM `table_1` INNER JOIN `table_3` ON (`table_1`.`column_1` = `table_3`.`column_1`) GROUP BY `table_1`.`column_4`, `table_3`.`column_2`
----


query  rowsort
SELECT max(`table_1`.`column_5`) AS `alias_1` FROM `table_1` WHERE (`table_1`.`column_2` > ?)
? = 10
----
1072925167

query  rowsort
SELECT `table_1`.`column_6` AS `alias_1`, `table_4`.`column_2` AS `alias_2` FROM `table_1` INNER JOIN `table_4` ON (`table_1`.`column_2` = `table_4`.`column_1`) WHERE (`table_1`.`column_6` > ?)
? = 10
----


query  rowsort
SELECT max(`table_1`.`column_7`) AS `alias_1`, `table_1`.`column_8` AS `alias_2`, `table_5`.`column_2` AS `alias_3` FROM `table_1` INNER JOIN `table_5` ON (`table_1`.`column_6` = `table_5`.`column_1`) WHERE (`table_1`.`column_5` > ?) GROUP BY `table_1`.`column_8`, `table_5`.`column_2`
? = 10
----

