# Generated by:
#     target/debug/noria-logictest permute --compare-to mysql://root:noria@127.1/noria -d 3 -o logictests/generated/mysql/ --only range_param --random --include-deletes --rows-per-table 10 --subquery-depth 1 --overwrite-tests

statement ok
CREATE TABLE `table_1` (`column_7` INT, `column_3` INT, `column_9` INT, `column_5` INT, `column_2` INT, `column_8` INT, `column_1` INT, `column_4` INT, `column_6` INT, PRIMARY KEY (`column_9`))


statement ok
INSERT INTO `table_1` (`column_7`, `column_3`, `column_9`, `column_5`, `column_2`, `column_8`, `column_1`, `column_4`, `column_6`) VALUES (1518563537, 1083550822, 0, -316637717, 494223752, -451529014, -1766699836, 2011374794, -472704056), (-1781752502, 345284084, 1, 898416035, 1077392656, 2120087751, -796769236, -769035441, -1145071788), (901485564, 1178584282, 2, -323720659, 318289125, -1539235974, 2140782047, -924715104, -2100179395), (-1783355210, -311593131, 3, 261068291, -1026987541, 334619379, -323895694, -2000016222, -1708495359), (-2101291925, 511334907, 4, 1636789970, 1698980097, -595988615, -181867916, -1356392655, 1845404284), (-1727047172, -1555511559, 5, -1638237932, 226836437, -1351519504, -1365613244, 827334760, 1277829332), (696671607, 1063177882, 6, 1377702599, 1688598046, -192750224, -288652506, -505399671, 343031578), (-636397151, -1479957333, 7, -303383158, -361346124, 1673873870, -578967614, -356394822, 261909097), (-256122560, 299786129, 8, 620940865, 7821288, -1166190071, -1595455757, -386374928, 932149064), (-1592617451, 1938245237, 9, -443936699, -1870949563, 253077922, -1314409174, 199170617, 1179396608)


query  rowsort
SELECT max(`table_1`.`column_1`) AS `alias_1` FROM `table_1`
----
2140782047

query  rowsort
SELECT avg(`table_1`.`column_2`) AS `alias_1` FROM `table_1`
----
225285817.3000

query  rowsort
SELECT `table_1`.`column_2` AS `alias_1` FROM `table_1` WHERE (`table_1`.`column_2` > ?)
? = 10
----
1077392656
1688598046
1698980097
226836437
318289125
494223752
7821288

query  rowsort
SELECT max(`table_1`.`column_3`) AS `alias_1`, avg(`table_1`.`column_4`) AS `alias_2` FROM `table_1`
----
1938245237
-326044867.2000

query  rowsort
SELECT max(`table_1`.`column_5`) AS `alias_1` FROM `table_1` WHERE (`table_1`.`column_2` > ?)
? = 10
----
1636789970

query  rowsort
SELECT avg(`table_1`.`column_6`) AS `alias_1` FROM `table_1` WHERE (`table_1`.`column_2` > ?)
? = 10
----
97208431.2857

query  rowsort
SELECT max(`table_1`.`column_7`) AS `alias_1`, avg(`table_1`.`column_8`) AS `alias_2` FROM `table_1` WHERE (`table_1`.`column_7` > ?)
? = 10
----
1518563537
-727838404.0000

statement ok
DELETE FROM `table_1` WHERE (`column_9` = 0)


statement ok
DELETE FROM `table_1` WHERE (`column_9` = 1)


statement ok
DELETE FROM `table_1` WHERE (`column_9` = 2)


statement ok
DELETE FROM `table_1` WHERE (`column_9` = 3)


statement ok
DELETE FROM `table_1` WHERE (`column_9` = 4)


query  rowsort
SELECT max(`table_1`.`column_1`) AS `alias_1` FROM `table_1`
----
-288652506

query  rowsort
SELECT avg(`table_1`.`column_2`) AS `alias_1` FROM `table_1`
----
-61807983.2000

query  rowsort
SELECT `table_1`.`column_2` AS `alias_1` FROM `table_1` WHERE (`table_1`.`column_2` > ?)
? = 10
----
1688598046
226836437
7821288

query  rowsort
SELECT max(`table_1`.`column_3`) AS `alias_1`, avg(`table_1`.`column_4`) AS `alias_2` FROM `table_1`
----
1938245237
-44332808.8000

query  rowsort
SELECT max(`table_1`.`column_5`) AS `alias_1` FROM `table_1` WHERE (`table_1`.`column_2` > ?)
? = 10
----
1377702599

query  rowsort
SELECT avg(`table_1`.`column_6`) AS `alias_1` FROM `table_1` WHERE (`table_1`.`column_2` > ?)
? = 10
----
851003324.6667

query  rowsort
SELECT max(`table_1`.`column_7`) AS `alias_1`, avg(`table_1`.`column_8`) AS `alias_2` FROM `table_1` WHERE (`table_1`.`column_7` > ?)
? = 10
----
696671607
-192750224.0000
