# Generated by:
#     target/debug/noria-logictest permute --compare-to mysql://root:noria@127.1/noria -d 3 -o logictests/generated/mysql/ --only range_param --random --include-deletes --rows-per-table 10 --subquery-depth 1 --overwrite-tests

statement ok
CREATE TABLE `table_1` (`column_4` INT, `column_6` INT, `column_9` INT, `column_3` INT, `column_5` INT, `column_7` INT, `column_1` INT, `column_2` INT, `column_8` INT, PRIMARY KEY (`column_9`))


statement ok
INSERT INTO `table_1` (`column_4`, `column_6`, `column_9`, `column_3`, `column_5`, `column_7`, `column_1`, `column_2`, `column_8`) VALUES (-1164075136, -452725179, 0, -1615456393, -1553706824, -1386854400, -1792804528, -1878789998, 2127989803), (901459719, -203736526, 1, 1138516434, -846439281, 1658146783, -1498737353, -1284729949, 67124510), (673744034, 240225030, 2, -1797089158, -623695282, -792227986, -1940460897, -654934897, -1542203634), (-1084412991, 685184829, 3, 124449308, -1052695844, 1706647446, 1934077136, -826284498, 2088266516), (2097673324, 853508922, 4, 590304187, -1716342391, -1996797720, 950958182, -1230817326, 2014905061), (-963247679, -1995625034, 5, -1486263813, 1549651818, 540701873, -625519821, 792194974, 2040186233), (1874586585, -120334815, 6, 784994926, -1488728842, -826160346, 1591715603, -173369861, -2140614247), (81338875, 1510593706, 7, -110058169, 1137998386, 1885261790, 1730598775, -1065692976, 1230152675), (-2087287025, -893956825, 8, 296297938, 1186127418, -933536778, 1158594789, -255994346, -221147002), (532754566, 242889241, 9, -87483975, 1076640863, 1542237948, 874191589, 1621610542, 1143040925)


query  rowsort
SELECT max(`table_1`.`column_1`) AS `alias_1` FROM `table_1`
----
1934077136

query  rowsort
SELECT avg(distinct `table_1`.`column_2`) AS `alias_1` FROM `table_1`
----
-495680833.5000

query  rowsort
SELECT `table_1`.`column_1` AS `alias_1` FROM `table_1` WHERE (`table_1`.`column_1` > ?)
? = 10
----
1158594789
1591715603
1730598775
1934077136
874191589
950958182

query  rowsort
SELECT max(`table_1`.`column_3`) AS `alias_1`, avg(distinct `table_1`.`column_4`) AS `alias_2` FROM `table_1`
----
1138516434
86253427.2000

query  rowsort
SELECT max(`table_1`.`column_5`) AS `alias_1` FROM `table_1` WHERE (`table_1`.`column_3` > ?)
? = 10
----
1186127418

query  rowsort
SELECT avg(distinct `table_1`.`column_6`) AS `alias_1` FROM `table_1` WHERE (`table_1`.`column_3` > ?)
? = 10
----
64133117.0000

query  rowsort
SELECT max(`table_1`.`column_7`) AS `alias_1`, avg(distinct `table_1`.`column_8`) AS `alias_2` FROM `table_1` WHERE (`table_1`.`column_4` > ?)
? = 10
----
1885261790
128734215.0000

statement ok
DELETE FROM `table_1` WHERE (`column_9` = 0)


statement ok
DELETE FROM `table_1` WHERE (`column_9` = 1)


statement ok
DELETE FROM `table_1` WHERE (`column_9` = 2)


statement ok
DELETE FROM `table_1` WHERE (`column_9` = 3)


statement ok
DELETE FROM `table_1` WHERE (`column_9` = 4)


query  rowsort
SELECT max(`table_1`.`column_1`) AS `alias_1` FROM `table_1`
----
1730598775

query  rowsort
SELECT avg(distinct `table_1`.`column_2`) AS `alias_1` FROM `table_1`
----
183749666.6000

query  rowsort
SELECT `table_1`.`column_1` AS `alias_1` FROM `table_1` WHERE (`table_1`.`column_1` > ?)
? = 10
----
1158594789
1591715603
1730598775
874191589

query  rowsort
SELECT max(`table_1`.`column_3`) AS `alias_1`, avg(distinct `table_1`.`column_4`) AS `alias_2` FROM `table_1`
----
784994926
-112370935.6000

query  rowsort
SELECT max(`table_1`.`column_5`) AS `alias_1` FROM `table_1` WHERE (`table_1`.`column_3` > ?)
? = 10
----
1186127418

query  rowsort
SELECT avg(distinct `table_1`.`column_6`) AS `alias_1` FROM `table_1` WHERE (`table_1`.`column_3` > ?)
? = 10
----
-507145820.0000

query  rowsort
SELECT max(`table_1`.`column_7`) AS `alias_1`, avg(distinct `table_1`.`column_8`) AS `alias_2` FROM `table_1` WHERE (`table_1`.`column_4` > ?)
? = 10
----
1885261790
77526451.0000
