# Generated by:
#     target/debug/noria-logictest permute --compare-to mysql://root:noria@127.1/noria -d 3 -o logictests/generated/mysql/ --only range_param --random --include-deletes --rows-per-table 10 --subquery-depth 1 --overwrite-tests

statement ok
CREATE TABLE `table_1` (`column_2` INT, `column_4` INT, `column_1` INT, `column_3` INT, `column_5` INT, PRIMARY KEY (`column_5`))


statement ok
INSERT INTO `table_1` (`column_2`, `column_4`, `column_1`, `column_3`, `column_5`) VALUES (-1963913442, -437012927, 1898813695, -39947105, 0), (-1123423010, -1660328797, 271442869, -730369780, 1), (-312314903, -1236466110, -879891476, 1925837729, 2), (424095926, -1447007700, 564867245, 144455258, 3), (1896353594, -152022182, -1645508419, -1815131137, 4), (999030752, -237041055, -423456687, 1379534736, 5), (-904597062, 1860097991, -1883550310, -2007076550, 6), (-48199764, 428377441, 323237016, -914163660, 7), (-1453376888, 783166782, -309355255, -253898046, 8), (708149597, 1064423663, -1730367620, 1647424141, 9)


query  rowsort
SELECT max(`table_1`.`column_1`) AS `alias_1` FROM `table_1`
----
1898813695

query  rowsort
SELECT `table_1`.`column_1` AS `alias_1` FROM `table_1` WHERE ((`table_1`.`column_1` > ?) AND (`table_1`.`column_1` > ?))
? = 10
? = 10
----
1898813695
271442869
323237016
564867245

query  rowsort
SELECT `table_1`.`column_1` AS `alias_1` FROM `table_1` WHERE (`table_1`.`column_1` > ?)
? = 10
----
1898813695
271442869
323237016
564867245

query  rowsort
SELECT max(`table_1`.`column_2`) AS `alias_1` FROM `table_1` WHERE ((`table_1`.`column_1` > ?) AND (`table_1`.`column_1` > ?))
? = 10
? = 10
----
424095926

query  rowsort
SELECT max(`table_1`.`column_3`) AS `alias_1` FROM `table_1` WHERE (`table_1`.`column_1` > ?)
? = 10
----
144455258

query  rowsort
SELECT `table_1`.`column_1` AS `alias_1` FROM `table_1` WHERE (((`table_1`.`column_1` > ?) AND (`table_1`.`column_1` > ?)) AND (`table_1`.`column_1` > ?))
? = 10
? = 10
? = 10
----
1898813695
271442869
323237016
564867245

query  rowsort
SELECT max(`table_1`.`column_4`) AS `alias_1` FROM `table_1` WHERE (((`table_1`.`column_2` > ?) AND (`table_1`.`column_2` > ?)) AND (`table_1`.`column_2` > ?))
? = 10
? = 10
? = 10
----
1064423663

statement ok
DELETE FROM `table_1` WHERE (`column_5` = 0)


statement ok
DELETE FROM `table_1` WHERE (`column_5` = 1)


statement ok
DELETE FROM `table_1` WHERE (`column_5` = 2)


statement ok
DELETE FROM `table_1` WHERE (`column_5` = 3)


statement ok
DELETE FROM `table_1` WHERE (`column_5` = 4)


query  rowsort
SELECT max(`table_1`.`column_1`) AS `alias_1` FROM `table_1`
----
323237016

query  rowsort
SELECT `table_1`.`column_1` AS `alias_1` FROM `table_1` WHERE ((`table_1`.`column_1` > ?) AND (`table_1`.`column_1` > ?))
? = 10
? = 10
----
323237016

query  rowsort
SELECT `table_1`.`column_1` AS `alias_1` FROM `table_1` WHERE (`table_1`.`column_1` > ?)
? = 10
----
323237016

query  rowsort
SELECT max(`table_1`.`column_2`) AS `alias_1` FROM `table_1` WHERE ((`table_1`.`column_1` > ?) AND (`table_1`.`column_1` > ?))
? = 10
? = 10
----
-48199764

query  rowsort
SELECT max(`table_1`.`column_3`) AS `alias_1` FROM `table_1` WHERE (`table_1`.`column_1` > ?)
? = 10
----
-914163660

query  rowsort
SELECT `table_1`.`column_1` AS `alias_1` FROM `table_1` WHERE (((`table_1`.`column_1` > ?) AND (`table_1`.`column_1` > ?)) AND (`table_1`.`column_1` > ?))
? = 10
? = 10
? = 10
----
323237016

query  rowsort
SELECT max(`table_1`.`column_4`) AS `alias_1` FROM `table_1` WHERE (((`table_1`.`column_2` > ?) AND (`table_1`.`column_2` > ?)) AND (`table_1`.`column_2` > ?))
? = 10
? = 10
? = 10
----
1064423663
