# Generated by:
#     target/debug/noria-logictest permute --compare-to mysql://root:noria@127.1/noria -d 3 -o logictests/generated/mysql/ --only range_param --random --include-deletes --rows-per-table 10 --subquery-depth 1 --overwrite-tests

statement ok
CREATE TABLE `table_1` (`column_6` INT, `column_1` INT, `column_4` INT, `column_8` INT, `column_5` INT, `column_2` INT, `column_3` INT, `column_9` INT, `column_7` INT, PRIMARY KEY (`column_9`))


statement ok
INSERT INTO `table_1` (`column_6`, `column_1`, `column_4`, `column_8`, `column_5`, `column_2`, `column_3`, `column_9`, `column_7`) VALUES (-1595431345, -1314592758, 2096808781, -205886672, -809367692, 1404551445, -2064975951, 0, 1280367343), (1503710436, -1216096257, 1803547356, -1324026777, -2053773804, -786339183, 431692837, 1, -1828473337), (-31240095, -1600451418, -741644872, 55944995, -1858793738, -954658604, 807607480, 2, -1216973070), (1916278693, -598526777, 1948164438, 665134098, -1701940129, -1703631277, -1025600183, 3, 311998571), (1964417265, 536119301, -251881471, 1150079198, 1180725887, 1269880598, 1592274046, 4, -674001833), (-1453256320, -1755534317, -329556151, 719987329, -74528318, 1495951147, 1477846050, 5, 830956466), (-2099814975, -1811370427, 401497818, -1611725059, 1720323489, -2103846274, 1530118609, 6, -1829876953), (-1405803753, 1552343682, -1244673807, 805233316, 1928513231, -1204418776, 557809669, 7, 309534753), (1302397083, 82314080, 80113609, -797248614, -768179224, -1363799375, -1992818463, 8, -1330966841), (-609656053, 1327325452, -114954, 1480617421, -1003594283, -913431135, -330375139, 9, -2134173572)


query  rowsort
SELECT max(`table_1`.`column_1`) AS `alias_1` FROM `table_1`
----
1552343682

query  rowsort
SELECT count(distinct `table_1`.`column_2`) AS `alias_1` FROM `table_1`
----
10

query  rowsort
SELECT `table_1`.`column_1` AS `alias_1` FROM `table_1` WHERE (`table_1`.`column_1` > ?)
? = 10
----
1327325452
1552343682
536119301
82314080

query  rowsort
SELECT max(`table_1`.`column_3`) AS `alias_1`, count(distinct `table_1`.`column_4`) AS `alias_2` FROM `table_1`
----
1592274046
10

query  rowsort
SELECT max(`table_1`.`column_5`) AS `alias_1` FROM `table_1` WHERE (`table_1`.`column_2` > ?)
? = 10
----
1180725887

query  rowsort
SELECT count(distinct `table_1`.`column_6`) AS `alias_1` FROM `table_1` WHERE (`table_1`.`column_2` > ?)
? = 10
----
3

query  rowsort
SELECT max(`table_1`.`column_7`) AS `alias_1`, count(distinct `table_1`.`column_8`) AS `alias_2` FROM `table_1` WHERE (`table_1`.`column_6` > ?)
? = 10
----
311998571
4

statement ok
DELETE FROM `table_1` WHERE (`column_9` = 0)


statement ok
DELETE FROM `table_1` WHERE (`column_9` = 1)


statement ok
DELETE FROM `table_1` WHERE (`column_9` = 2)


statement ok
DELETE FROM `table_1` WHERE (`column_9` = 3)


statement ok
DELETE FROM `table_1` WHERE (`column_9` = 4)


query  rowsort
SELECT max(`table_1`.`column_1`) AS `alias_1` FROM `table_1`
----
1552343682

query  rowsort
SELECT count(distinct `table_1`.`column_2`) AS `alias_1` FROM `table_1`
----
5

query  rowsort
SELECT `table_1`.`column_1` AS `alias_1` FROM `table_1` WHERE (`table_1`.`column_1` > ?)
? = 10
----
1327325452
1552343682
82314080

query  rowsort
SELECT max(`table_1`.`column_3`) AS `alias_1`, count(distinct `table_1`.`column_4`) AS `alias_2` FROM `table_1`
----
1530118609
5

query  rowsort
SELECT max(`table_1`.`column_5`) AS `alias_1` FROM `table_1` WHERE (`table_1`.`column_2` > ?)
? = 10
----
-74528318

query  rowsort
SELECT count(distinct `table_1`.`column_6`) AS `alias_1` FROM `table_1` WHERE (`table_1`.`column_2` > ?)
? = 10
----
1

query  rowsort
SELECT max(`table_1`.`column_7`) AS `alias_1`, count(distinct `table_1`.`column_8`) AS `alias_2` FROM `table_1` WHERE (`table_1`.`column_6` > ?)
? = 10
----
-1330966841
1
