# Generated by:
#     target/debug/noria-logictest permute --compare-to mysql://root:noria@127.1/noria -d 3 -o logictests/generated/mysql/ --only range_param --random --include-deletes --rows-per-table 10 --subquery-depth 1 --overwrite-tests

statement ok
CREATE TABLE `table_1` (`column_2` INT, `column_3` INT, `column_1` INT, `column_4` INT, `column_5` INT, PRIMARY KEY (`column_5`))


statement ok
INSERT INTO `table_1` (`column_2`, `column_3`, `column_1`, `column_4`, `column_5`) VALUES (1783519600, 2054587041, -880978434, 1408331116, 0), (1892197625, 792597401, -976144139, 1759694653, 1), (-471577909, -2079008316, -192264513, 781231718, 2), (-1845727890, -1714105401, 931837782, 1539498958, 3), (-962827617, -717351040, 794971063, -1878861010, 4), (-1076480710, 473985796, -527752018, 1241830189, 5), (-1173426397, 1093888279, -1851616885, -204072469, 6), (1974495712, 1733761561, -1273234893, 497748652, 7), (-856267261, -1583314301, -1986358819, -1920674096, 8), (-970276039, -1036471882, 944464187, -1356626644, 9)


query  rowsort
SELECT max(`table_1`.`column_1`) AS `alias_1` FROM `table_1`
----
944464187

query  rowsort
SELECT `table_1`.`column_1` AS `alias_1` FROM `table_1` WHERE (`table_1`.`column_1` > ?)
? = 10
----
794971063
931837782
944464187

query  rowsort
SELECT `table_1`.`column_1` AS `alias_1` FROM `table_1` WHERE (`table_1`.`column_1` > ?)
? = 10
----
794971063
931837782
944464187

query  rowsort
SELECT max(`table_1`.`column_2`) AS `alias_1` FROM `table_1` WHERE (`table_1`.`column_2` > ?)
? = 10
----
1974495712

query  rowsort
SELECT max(`table_1`.`column_3`) AS `alias_1` FROM `table_1` WHERE (`table_1`.`column_2` > ?)
? = 10
----
2054587041

query  rowsort
SELECT `table_1`.`column_2` AS `alias_1` FROM `table_1` WHERE ((`table_1`.`column_2` > ?) AND (`table_1`.`column_2` > ?))
? = 10
? = 10
----
1783519600
1892197625
1974495712

query  rowsort
SELECT max(`table_1`.`column_4`) AS `alias_1` FROM `table_1` WHERE ((`table_1`.`column_2` > ?) AND (`table_1`.`column_2` > ?))
? = 10
? = 10
----
1759694653

statement ok
DELETE FROM `table_1` WHERE (`column_5` = 0)


statement ok
DELETE FROM `table_1` WHERE (`column_5` = 1)


statement ok
DELETE FROM `table_1` WHERE (`column_5` = 2)


statement ok
DELETE FROM `table_1` WHERE (`column_5` = 3)


statement ok
DELETE FROM `table_1` WHERE (`column_5` = 4)


query  rowsort
SELECT max(`table_1`.`column_1`) AS `alias_1` FROM `table_1`
----
944464187

query  rowsort
SELECT `table_1`.`column_1` AS `alias_1` FROM `table_1` WHERE (`table_1`.`column_1` > ?)
? = 10
----
944464187

query  rowsort
SELECT `table_1`.`column_1` AS `alias_1` FROM `table_1` WHERE (`table_1`.`column_1` > ?)
? = 10
----
944464187

query  rowsort
SELECT max(`table_1`.`column_2`) AS `alias_1` FROM `table_1` WHERE (`table_1`.`column_2` > ?)
? = 10
----
1974495712

query  rowsort
SELECT max(`table_1`.`column_3`) AS `alias_1` FROM `table_1` WHERE (`table_1`.`column_2` > ?)
? = 10
----
1733761561

query  rowsort
SELECT `table_1`.`column_2` AS `alias_1` FROM `table_1` WHERE ((`table_1`.`column_2` > ?) AND (`table_1`.`column_2` > ?))
? = 10
? = 10
----
1974495712

query  rowsort
SELECT max(`table_1`.`column_4`) AS `alias_1` FROM `table_1` WHERE ((`table_1`.`column_2` > ?) AND (`table_1`.`column_2` > ?))
? = 10
? = 10
----
497748652
