# Generated by:
#     target/debug/noria-logictest permute --compare-to mysql://root:noria@127.1/noria -d 3 -o logictests/generated/mysql/ --only range_param --random --include-deletes --rows-per-table 10 --subquery-depth 1 --overwrite-tests

statement ok
CREATE TABLE `table_1` (`column_2` INT, `column_6` INT, `column_8` INT, `column_9` INT, `column_5` INT, `column_3` INT, `column_11` INT, `column_13` INT, `column_12` INT, `column_7` INT, `column_10` INT, `column_1` INT, `column_4` INT, PRIMARY KEY (`column_13`))


statement ok
INSERT INTO `table_1` (`column_2`, `column_6`, `column_8`, `column_9`, `column_5`, `column_3`, `column_11`, `column_13`, `column_12`, `column_7`, `column_10`, `column_1`, `column_4`) VALUES (-497316846, -1205930991, -908175112, -1229066939, -734217473, -1411683872, -419118045, 0, 630724989, -446729831, 1278524798, -1538667104, -1114823574), (-750039227, 2110054987, -1071164065, -2041716705, 431776453, 1906594413, 2053594929, 1, 755732521, 1933371341, 1246218241, 378049895, 1790511623), (-527278327, 1602416777, -679805342, -1075137372, -1272131866, 749327944, 2054834443, 2, 2095288250, 59726525, 1200992096, -1033497300, -1959534232), (-647254076, 755818485, 1116653485, 1268464021, 1336220833, -1637940599, 1592027320, 3, 1437989819, 300508765, 91720691, 1786183132, 327179805), (-618624164, 1427281800, 1212812518, 1257617358, -1580456658, 1374114851, -1132237106, 4, -986258745, -1923262572, 935098680, 1987390221, 422302106), (942540777, 1835735457, -425647663, -159928768, 458144277, 1269372856, 458987168, 5, -1564310820, 1673777448, -1029880558, 2004757561, -614501723), (962060569, 1161296718, 1508943310, -468150411, -1428972635, -441948898, -979687950, 6, 138878002, 837447469, -1476668259, -2005933792, 281274406), (-1109220360, 1388315006, 527375392, -1039388349, -414720961, -853889507, 631243301, 7, -2094799959, -1980141213, 890768315, 1215580332, -434599807), (544642318, -641342163, -731706575, 442335339, -2073824952, 1869105762, -1592090029, 8, -1885364831, -338011369, 1514770527, -1062534243, 754144837), (-2010853952, 1774725986, 993647386, 567395665, -1246374085, -887526057, 1608157741, 9, -30502036, 478010809, 480221999, -192783707, -1345791614)


query  rowsort
WITH `alias_3` AS (SELECT max(`table_1`.`column_2`) AS `alias_2` FROM `table_1`) SELECT max(`table_1`.`column_1`) AS `alias_1` FROM `table_1` INNER JOIN `alias_3` ON (`table_1`.`column_2` = `alias_3`.`alias_2`)
----
-2005933792

query  rowsort
WITH `alias_3` AS (SELECT `table_1`.`column_2` AS `alias_2` FROM `table_1`) SELECT max(`table_1`.`column_3`) AS `alias_1` FROM `table_1` INNER JOIN `alias_3` ON (`table_1`.`column_2` = `alias_3`.`alias_2`)
----
1906594413

query  rowsort
WITH `alias_3` AS (SELECT max(`table_1`.`column_5`) AS `alias_2` FROM `table_1`) SELECT max(`table_1`.`column_4`) AS `alias_1` FROM `table_1` INNER JOIN `alias_3` ON (`table_1`.`column_2` = `alias_3`.`alias_2`)
----
NULL

query  rowsort
WITH `alias_2` AS (SELECT max(`table_1`.`column_6`) AS `alias_1` FROM `table_1`) SELECT `table_1`.`column_2` AS `alias_3` FROM `table_1` INNER JOIN `alias_2` ON (`table_1`.`column_2` = `alias_2`.`alias_1`) WHERE (`table_1`.`column_2` > ?)
? = 10
----


query  rowsort
WITH `alias_2` AS (SELECT `table_1`.`column_2` AS `alias_1` FROM `table_1`) SELECT `table_1`.`column_2` AS `alias_3` FROM `table_1` INNER JOIN `alias_2` ON (`table_1`.`column_2` = `alias_2`.`alias_1`) WHERE (`table_1`.`column_2` > ?)
? = 10
----
544642318
942540777
962060569

query  rowsort
WITH `alias_2` AS (SELECT max(`table_1`.`column_7`) AS `alias_1` FROM `table_1`) SELECT `table_1`.`column_2` AS `alias_3` FROM `table_1` INNER JOIN `alias_2` ON (`table_1`.`column_2` = `alias_2`.`alias_1`) WHERE (`table_1`.`column_2` > ?)
? = 10
----


query  rowsort
WITH `alias_3` AS (SELECT max(`table_1`.`column_9`) AS `alias_2` FROM `table_1`) SELECT max(`table_1`.`column_8`) AS `alias_1` FROM `table_1` INNER JOIN `alias_3` ON (`table_1`.`column_2` = `alias_3`.`alias_2`) WHERE (`table_1`.`column_2` > ?)
? = 10
----
NULL

query  rowsort
WITH `alias_3` AS (SELECT `table_1`.`column_2` AS `alias_2` FROM `table_1`) SELECT max(`table_1`.`column_10`) AS `alias_1` FROM `table_1` INNER JOIN `alias_3` ON (`table_1`.`column_2` = `alias_3`.`alias_2`) WHERE (`table_1`.`column_2` > ?)
? = 10
----
1514770527

query  rowsort
WITH `alias_3` AS (SELECT max(`table_1`.`column_12`) AS `alias_2` FROM `table_1`) SELECT max(`table_1`.`column_11`) AS `alias_1` FROM `table_1` INNER JOIN `alias_3` ON (`table_1`.`column_2` = `alias_3`.`alias_2`) WHERE (`table_1`.`column_2` > ?)
? = 10
----
NULL

statement ok
DELETE FROM `table_1` WHERE (`column_13` = 0)


statement ok
DELETE FROM `table_1` WHERE (`column_13` = 1)


statement ok
DELETE FROM `table_1` WHERE (`column_13` = 2)


statement ok
DELETE FROM `table_1` WHERE (`column_13` = 3)


statement ok
DELETE FROM `table_1` WHERE (`column_13` = 4)


query  rowsort
WITH `alias_3` AS (SELECT max(`table_1`.`column_2`) AS `alias_2` FROM `table_1`) SELECT max(`table_1`.`column_1`) AS `alias_1` FROM `table_1` INNER JOIN `alias_3` ON (`table_1`.`column_2` = `alias_3`.`alias_2`)
----
-2005933792

query  rowsort
WITH `alias_3` AS (SELECT `table_1`.`column_2` AS `alias_2` FROM `table_1`) SELECT max(`table_1`.`column_3`) AS `alias_1` FROM `table_1` INNER JOIN `alias_3` ON (`table_1`.`column_2` = `alias_3`.`alias_2`)
----
1869105762

query  rowsort
WITH `alias_3` AS (SELECT max(`table_1`.`column_5`) AS `alias_2` FROM `table_1`) SELECT max(`table_1`.`column_4`) AS `alias_1` FROM `table_1` INNER JOIN `alias_3` ON (`table_1`.`column_2` = `alias_3`.`alias_2`)
----
NULL

query  rowsort
WITH `alias_2` AS (SELECT max(`table_1`.`column_6`) AS `alias_1` FROM `table_1`) SELECT `table_1`.`column_2` AS `alias_3` FROM `table_1` INNER JOIN `alias_2` ON (`table_1`.`column_2` = `alias_2`.`alias_1`) WHERE (`table_1`.`column_2` > ?)
? = 10
----


query  rowsort
WITH `alias_2` AS (SELECT `table_1`.`column_2` AS `alias_1` FROM `table_1`) SELECT `table_1`.`column_2` AS `alias_3` FROM `table_1` INNER JOIN `alias_2` ON (`table_1`.`column_2` = `alias_2`.`alias_1`) WHERE (`table_1`.`column_2` > ?)
? = 10
----
544642318
942540777
962060569

query  rowsort
WITH `alias_2` AS (SELECT max(`table_1`.`column_7`) AS `alias_1` FROM `table_1`) SELECT `table_1`.`column_2` AS `alias_3` FROM `table_1` INNER JOIN `alias_2` ON (`table_1`.`column_2` = `alias_2`.`alias_1`) WHERE (`table_1`.`column_2` > ?)
? = 10
----


query  rowsort
WITH `alias_3` AS (SELECT max(`table_1`.`column_9`) AS `alias_2` FROM `table_1`) SELECT max(`table_1`.`column_8`) AS `alias_1` FROM `table_1` INNER JOIN `alias_3` ON (`table_1`.`column_2` = `alias_3`.`alias_2`) WHERE (`table_1`.`column_2` > ?)
? = 10
----
NULL

query  rowsort
WITH `alias_3` AS (SELECT `table_1`.`column_2` AS `alias_2` FROM `table_1`) SELECT max(`table_1`.`column_10`) AS `alias_1` FROM `table_1` INNER JOIN `alias_3` ON (`table_1`.`column_2` = `alias_3`.`alias_2`) WHERE (`table_1`.`column_2` > ?)
? = 10
----
1514770527

query  rowsort
WITH `alias_3` AS (SELECT max(`table_1`.`column_12`) AS `alias_2` FROM `table_1`) SELECT max(`table_1`.`column_11`) AS `alias_1` FROM `table_1` INNER JOIN `alias_3` ON (`table_1`.`column_2` = `alias_3`.`alias_2`) WHERE (`table_1`.`column_2` > ?)
? = 10
----
NULL
