# Generated by:
#     target/debug/noria-logictest permute --compare-to mysql://root:noria@127.1/noria -d 3 -o logictests/generated/mysql/ --only range_param --random --include-deletes --rows-per-table 10 --subquery-depth 1 --overwrite-tests

statement ok
CREATE TABLE `table_1` (`column_2` INT, `column_8` INT, `column_1` INT, `column_3` INT, `column_7` INT, `column_9` INT, `column_5` INT, `column_6` INT, `column_4` INT, PRIMARY KEY (`column_9`))


statement ok
CREATE TABLE `table_2` (`column_1` INT, `column_2` INT, `column_3` INT, PRIMARY KEY (`column_3`))


statement ok
CREATE TABLE `table_3` (`column_3` INT, `column_1` INT, `column_2` INT, PRIMARY KEY (`column_3`))


statement ok
CREATE TABLE `table_5` (`column_2` INT, `column_3` INT, `column_1` INT, PRIMARY KEY (`column_3`))


statement ok
CREATE TABLE `table_4` (`column_1` INT, `column_2` INT, `column_3` INT, PRIMARY KEY (`column_3`))


statement ok
INSERT INTO `table_1` (`column_2`, `column_8`, `column_1`, `column_3`, `column_7`, `column_9`, `column_5`, `column_6`, `column_4`) VALUES (-866378616, 652591462, -1214093734, -720773287, 1598447177, 0, -1016881283, 1385003307, 2122721374), (-51694499, 1613804443, -1992484504, -573756481, -1045008489, 1, 1034266193, -652267072, 1211348898), (-396423358, 1139699815, -560767788, 327522628, -577594358, 2, -1884017715, -1493282639, -1375212327), (-566547292, 229740709, -1514942037, 477853652, -2060470307, 3, 856893687, -310367000, -1550157161), (814405591, -227632073, 1946605976, -1786814216, -292317244, 4, 1993358433, -1135495199, 1645255096), (1737732594, -410331553, 1716870832, 2010021353, 1360665311, 5, 1867412699, -1851319476, 965984281), (-1827209444, 944764413, 705679461, 1052670913, -1173344309, 6, 1834639179, -1718308900, 556904428), (188881396, 529930240, 1487772700, 1474541566, -520993264, 7, 1606799385, -2027149192, 1649340224), (1550036143, -1359359908, 164352577, 515592254, 2009096346, 8, 343855010, -2000144584, -577279887), (-1600883713, -956128653, 326803823, -337033854, -1383172336, 9, 1898270486, -392673954, -610316397)


statement ok
INSERT INTO `table_2` (`column_1`, `column_2`, `column_3`) VALUES (-686520743, -1797930177, 0), (1136404035, 622385645, 1), (1959068284, -1033168224, 2), (-1073402959, 218826059, 3), (1512491716, -515181566, 4), (1364581551, -219499826, 5), (-296871800, -646303857, 6), (-492354861, -1147055802, 7), (-331650659, 623164992, 8), (1801326095, -1531700959, 9)


statement ok
INSERT INTO `table_3` (`column_3`, `column_1`, `column_2`) VALUES (0, 520488524, 547768972), (1, -726866317, -394938761), (2, 634479120, -1651032529), (3, 1874774960, 1905953566), (4, -425634031, -1636957501), (5, 879290534, 555598436), (6, 95985599, 1550917349), (7, 874243913, -1940106409), (8, 696150451, 1514088084), (9, 626463032, 120039208)


statement ok
INSERT INTO `table_5` (`column_2`, `column_3`, `column_1`) VALUES (-1896959707, 0, -1099955585), (996397594, 1, -876405843), (-176614740, 2, 571102868), (-1211435673, 3, 1382919124), (-310661916, 4, -1006444893), (1341592374, 5, 681605401), (-822129826, 6, 416268333), (-254401280, 7, 1685138699), (1190205578, 8, 1747044527), (-2019575234, 9, 1569690497)


statement ok
INSERT INTO `table_4` (`column_1`, `column_2`, `column_3`) VALUES (-2080045897, -319323537, 0), (387390201, 433513141, 1), (-1312016636, -1010455004, 2), (1289840657, -1334852929, 3), (-524264793, -1552835579, 4), (-2066082960, -699596623, 5), (761333892, -2033172236, 6), (-375717824, 863739614, 7), (2087162431, -264332187, 8), (-1770709423, 1996330722, 9)


query  rowsort
SELECT max(`table_1`.`column_1`) AS `alias_1` FROM `table_1`
----
1946605976

query  rowsort
SELECT `table_1`.`column_2` AS `alias_1`, `table_2`.`column_2` AS `alias_2` FROM `table_1` LEFT JOIN `table_2` ON (`table_1`.`column_1` = `table_2`.`column_1`)
----
-1600883713
NULL
-1827209444
NULL
-396423358
NULL
-51694499
NULL
-566547292
NULL
-866378616
NULL
1550036143
NULL
1737732594
NULL
188881396
NULL
814405591
NULL

query  rowsort
SELECT `table_1`.`column_2` AS `alias_1` FROM `table_1` WHERE (`table_1`.`column_2` > ?)
? = 10
----
1550036143
1737732594
188881396
814405591

query  rowsort
SELECT max(`table_1`.`column_3`) AS `alias_1`, `table_1`.`column_4` AS `alias_2`, `table_3`.`column_2` AS `alias_3` FROM `table_1` LEFT JOIN `table_3` ON (`table_1`.`column_2` = `table_3`.`column_1`) GROUP BY `table_1`.`column_4`, `table_3`.`column_2`
----
30 values hashing to f6c9914e9d224f1d97467d8a79da1cfe

query  rowsort
SELECT max(`table_1`.`column_5`) AS `alias_1` FROM `table_1` WHERE (`table_1`.`column_2` > ?)
? = 10
----
1993358433

query  rowsort
SELECT `table_1`.`column_6` AS `alias_1`, `table_4`.`column_2` AS `alias_2` FROM `table_1` LEFT JOIN `table_4` ON (`table_1`.`column_2` = `table_4`.`column_1`) WHERE (`table_1`.`column_2` > ?)
? = 10
----
-1135495199
NULL
-1851319476
NULL
-2000144584
NULL
-2027149192
NULL

query  rowsort
SELECT max(`table_1`.`column_7`) AS `alias_1`, `table_1`.`column_8` AS `alias_2`, `table_5`.`column_2` AS `alias_3` FROM `table_1` LEFT JOIN `table_5` ON (`table_1`.`column_2` = `table_5`.`column_1`) WHERE (`table_1`.`column_2` > ?) GROUP BY `table_1`.`column_8`, `table_5`.`column_2`
? = 10
----
-292317244
-227632073
NULL
-520993264
529930240
NULL
1360665311
-410331553
NULL
2009096346
-1359359908
NULL

statement ok
DELETE FROM `table_1` WHERE (`column_9` = 0)


statement ok
DELETE FROM `table_1` WHERE (`column_9` = 1)


statement ok
DELETE FROM `table_1` WHERE (`column_9` = 2)


statement ok
DELETE FROM `table_1` WHERE (`column_9` = 3)


statement ok
DELETE FROM `table_1` WHERE (`column_9` = 4)


statement ok
DELETE FROM `table_2` WHERE (`column_3` = 0)


statement ok
DELETE FROM `table_2` WHERE (`column_3` = 1)


statement ok
DELETE FROM `table_2` WHERE (`column_3` = 2)


statement ok
DELETE FROM `table_2` WHERE (`column_3` = 3)


statement ok
DELETE FROM `table_2` WHERE (`column_3` = 4)


statement ok
DELETE FROM `table_3` WHERE (`column_3` = 0)


statement ok
DELETE FROM `table_3` WHERE (`column_3` = 1)


statement ok
DELETE FROM `table_3` WHERE (`column_3` = 2)


statement ok
DELETE FROM `table_3` WHERE (`column_3` = 3)


statement ok
DELETE FROM `table_3` WHERE (`column_3` = 4)


statement ok
DELETE FROM `table_5` WHERE (`column_3` = 0)


statement ok
DELETE FROM `table_5` WHERE (`column_3` = 1)


statement ok
DELETE FROM `table_5` WHERE (`column_3` = 2)


statement ok
DELETE FROM `table_5` WHERE (`column_3` = 3)


statement ok
DELETE FROM `table_5` WHERE (`column_3` = 4)


statement ok
DELETE FROM `table_4` WHERE (`column_3` = 0)


statement ok
DELETE FROM `table_4` WHERE (`column_3` = 1)


statement ok
DELETE FROM `table_4` WHERE (`column_3` = 2)


statement ok
DELETE FROM `table_4` WHERE (`column_3` = 3)


statement ok
DELETE FROM `table_4` WHERE (`column_3` = 4)


query  rowsort
SELECT max(`table_1`.`column_1`) AS `alias_1` FROM `table_1`
----
1716870832

query  rowsort
SELECT `table_1`.`column_2` AS `alias_1`, `table_2`.`column_2` AS `alias_2` FROM `table_1` LEFT JOIN `table_2` ON (`table_1`.`column_1` = `table_2`.`column_1`)
----
-1600883713
NULL
-1827209444
NULL
1550036143
NULL
1737732594
NULL
188881396
NULL

query  rowsort
SELECT `table_1`.`column_2` AS `alias_1` FROM `table_1` WHERE (`table_1`.`column_2` > ?)
? = 10
----
1550036143
1737732594
188881396

query  rowsort
SELECT max(`table_1`.`column_3`) AS `alias_1`, `table_1`.`column_4` AS `alias_2`, `table_3`.`column_2` AS `alias_3` FROM `table_1` LEFT JOIN `table_3` ON (`table_1`.`column_2` = `table_3`.`column_1`) GROUP BY `table_1`.`column_4`, `table_3`.`column_2`
----
-337033854
-610316397
NULL
1052670913
556904428
NULL
1474541566
1649340224
NULL
2010021353
965984281
NULL
515592254
-577279887
NULL

query  rowsort
SELECT max(`table_1`.`column_5`) AS `alias_1` FROM `table_1` WHERE (`table_1`.`column_2` > ?)
? = 10
----
1867412699

query  rowsort
SELECT `table_1`.`column_6` AS `alias_1`, `table_4`.`column_2` AS `alias_2` FROM `table_1` LEFT JOIN `table_4` ON (`table_1`.`column_2` = `table_4`.`column_1`) WHERE (`table_1`.`column_2` > ?)
? = 10
----
-1851319476
NULL
-2000144584
NULL
-2027149192
NULL

query  rowsort
SELECT max(`table_1`.`column_7`) AS `alias_1`, `table_1`.`column_8` AS `alias_2`, `table_5`.`column_2` AS `alias_3` FROM `table_1` LEFT JOIN `table_5` ON (`table_1`.`column_2` = `table_5`.`column_1`) WHERE (`table_1`.`column_2` > ?) GROUP BY `table_1`.`column_8`, `table_5`.`column_2`
? = 10
----
-520993264
529930240
NULL
1360665311
-410331553
NULL
2009096346
-1359359908
NULL
