# Generated by:
#     target/debug/noria-logictest permute --compare-to mysql://root:noria@127.1/noria -d 3 -o logictests/generated/mysql/ --only range_param --random --include-deletes --rows-per-table 10 --subquery-depth 1 --overwrite-tests

statement ok
CREATE TABLE `table_1` (`column_2` INT, `column_4` INT, `column_3` INT, `column_5` INT, `column_1` INT, PRIMARY KEY (`column_5`))


statement ok
INSERT INTO `table_1` (`column_2`, `column_4`, `column_3`, `column_5`, `column_1`) VALUES (758612261, -95593287, 1481295205, 0, -1324208594), (947650612, -1705278569, 355191711, 1, 5944839), (1462494122, -1036481367, 728444192, 2, 947464425), (-1954232240, 99145726, -908633629, 3, -1896444668), (-364820239, 799566309, -1105528874, 4, -1108896167), (1037750780, -510802588, -1123566714, 5, -1474403189), (611438824, 1774870665, 1672454450, 6, 286099040), (-132698593, -1578051867, 2070335374, 7, -474010473), (1069910764, -1075448611, -1607882357, 8, -2119462001), (-935442197, -1392669842, 25582053, 9, 1498085431)


query  rowsort
SELECT max(`table_1`.`column_1`) AS `alias_1` FROM `table_1`
----
1498085431

query  rowsort
SELECT DISTINCT `table_1`.`column_1` AS `alias_1` FROM `table_1`
----
-1108896167
-1324208594
-1474403189
-1896444668
-2119462001
-474010473
1498085431
286099040
5944839
947464425

query  rowsort
SELECT `table_1`.`column_1` AS `alias_1` FROM `table_1` WHERE (`table_1`.`column_1` > ?)
? = 10
----
1498085431
286099040
5944839
947464425

query  rowsort
SELECT DISTINCT max(`table_1`.`column_2`) AS `alias_1` FROM `table_1`
----
1462494122

query  rowsort
SELECT max(`table_1`.`column_3`) AS `alias_1` FROM `table_1` WHERE (`table_1`.`column_3` > ?)
? = 10
----
2070335374

query  rowsort
SELECT DISTINCT `table_1`.`column_3` AS `alias_1` FROM `table_1` WHERE (`table_1`.`column_3` > ?)
? = 10
----
1481295205
1672454450
2070335374
25582053
355191711
728444192

query  rowsort
SELECT DISTINCT max(`table_1`.`column_4`) AS `alias_1` FROM `table_1` WHERE (`table_1`.`column_2` > ?)
? = 10
----
1774870665

statement ok
DELETE FROM `table_1` WHERE (`column_5` = 0)


statement ok
DELETE FROM `table_1` WHERE (`column_5` = 1)


statement ok
DELETE FROM `table_1` WHERE (`column_5` = 2)


statement ok
DELETE FROM `table_1` WHERE (`column_5` = 3)


statement ok
DELETE FROM `table_1` WHERE (`column_5` = 4)


query  rowsort
SELECT max(`table_1`.`column_1`) AS `alias_1` FROM `table_1`
----
1498085431

query  rowsort
SELECT DISTINCT `table_1`.`column_1` AS `alias_1` FROM `table_1`
----
-1474403189
-2119462001
-474010473
1498085431
286099040

query  rowsort
SELECT `table_1`.`column_1` AS `alias_1` FROM `table_1` WHERE (`table_1`.`column_1` > ?)
? = 10
----
1498085431
286099040

query  rowsort
SELECT DISTINCT max(`table_1`.`column_2`) AS `alias_1` FROM `table_1`
----
1069910764

query  rowsort
SELECT max(`table_1`.`column_3`) AS `alias_1` FROM `table_1` WHERE (`table_1`.`column_3` > ?)
? = 10
----
2070335374

query  rowsort
SELECT DISTINCT `table_1`.`column_3` AS `alias_1` FROM `table_1` WHERE (`table_1`.`column_3` > ?)
? = 10
----
1672454450
2070335374
25582053

query  rowsort
SELECT DISTINCT max(`table_1`.`column_4`) AS `alias_1` FROM `table_1` WHERE (`table_1`.`column_2` > ?)
? = 10
----
1774870665
