# Generated by:
#     target/debug/noria-logictest permute --compare-to mysql://root:noria@127.1/noria -d 3 -o logictests/generated/mysql/ --only range_param --random --include-deletes --rows-per-table 10 --subquery-depth 1 --overwrite-tests

statement ok
CREATE TABLE `table_1` (`column_8` INT, `column_3` INT, `column_7` INT, `column_1` INT, `column_2` INT, `column_4` INT, `column_5` INT, `column_6` INT, `column_9` INT, PRIMARY KEY (`column_9`))


statement ok
INSERT INTO `table_1` (`column_8`, `column_3`, `column_7`, `column_1`, `column_2`, `column_4`, `column_5`, `column_6`, `column_9`) VALUES (1666165794, -731050780, 775205567, -1766607151, -1066816239, -1283230145, -855870015, -217174951, 0), (1608110020, -1591984348, 1764597517, 733248483, 2061442553, -1275581800, 1057582435, 1307422898, 1), (-11113604, -666632442, -542517223, -1683613110, 759640662, 269968788, -1892020201, -1437074200, 2), (1331597494, 1868174957, -1113071708, -89227998, -1102710755, 315325110, 20820611, 2118572473, 3), (1374314848, 609878757, -1441210733, 999018312, 1575243853, 684220095, -1583065161, 982874051, 4), (339755468, 1266487460, -1413886092, -1905541412, -1159425329, 645895245, 442898309, -560338287, 5), (298717167, -1258099112, 625055085, 1211768257, 1368034933, 1392482785, 936845110, -606726075, 6), (803012305, 1524158214, 191329190, 1364828737, -734177383, -420704489, 2119309596, 776430035, 7), (-1821374991, -1054741594, 1259429575, -551916055, 1592223205, -2077927130, -1218376813, 679275093, 8), (1396867688, 496155610, 1742767442, -1207953076, -1669678205, -471420800, 1966031114, 1776072663, 9)


query  rowsort
SELECT max(`table_1`.`column_1`) AS `alias_1` FROM `table_1`
----
1364828737

query  rowsort
SELECT count(`table_1`.`column_2`) AS `alias_1` FROM `table_1`
----
10

query  rowsort
SELECT `table_1`.`column_1` AS `alias_1` FROM `table_1` WHERE (`table_1`.`column_1` > ?)
? = 10
----
1211768257
1364828737
733248483
999018312

query  rowsort
SELECT max(`table_1`.`column_3`) AS `alias_1`, count(`table_1`.`column_4`) AS `alias_2` FROM `table_1`
----
1868174957
10

query  rowsort
SELECT max(`table_1`.`column_5`) AS `alias_1` FROM `table_1` WHERE (`table_1`.`column_1` > ?)
? = 10
----
2119309596

query  rowsort
SELECT count(`table_1`.`column_6`) AS `alias_1` FROM `table_1` WHERE (`table_1`.`column_1` > ?)
? = 10
----
4

query  rowsort
SELECT max(`table_1`.`column_7`) AS `alias_1`, count(`table_1`.`column_8`) AS `alias_2` FROM `table_1` WHERE (`table_1`.`column_8` > ?)
? = 10
----
1764597517
8

statement ok
DELETE FROM `table_1` WHERE (`column_9` = 0)


statement ok
DELETE FROM `table_1` WHERE (`column_9` = 1)


statement ok
DELETE FROM `table_1` WHERE (`column_9` = 2)


statement ok
DELETE FROM `table_1` WHERE (`column_9` = 3)


statement ok
DELETE FROM `table_1` WHERE (`column_9` = 4)


query  rowsort
SELECT max(`table_1`.`column_1`) AS `alias_1` FROM `table_1`
----
1364828737

query  rowsort
SELECT count(`table_1`.`column_2`) AS `alias_1` FROM `table_1`
----
5

query  rowsort
SELECT `table_1`.`column_1` AS `alias_1` FROM `table_1` WHERE (`table_1`.`column_1` > ?)
? = 10
----
1211768257
1364828737

query  rowsort
SELECT max(`table_1`.`column_3`) AS `alias_1`, count(`table_1`.`column_4`) AS `alias_2` FROM `table_1`
----
1524158214
5

query  rowsort
SELECT max(`table_1`.`column_5`) AS `alias_1` FROM `table_1` WHERE (`table_1`.`column_1` > ?)
? = 10
----
2119309596

query  rowsort
SELECT count(`table_1`.`column_6`) AS `alias_1` FROM `table_1` WHERE (`table_1`.`column_1` > ?)
? = 10
----
2

query  rowsort
SELECT max(`table_1`.`column_7`) AS `alias_1`, count(`table_1`.`column_8`) AS `alias_2` FROM `table_1` WHERE (`table_1`.`column_8` > ?)
? = 10
----
1742767442
4
