# Generated by:
#     target/debug/noria-logictest permute --compare-to mysql://root:noria@127.1/noria -d 3 -o logictests/generated/mysql/ --only range_param --random --include-deletes --rows-per-table 10 --subquery-depth 1 --overwrite-tests

statement ok
CREATE TABLE `table_1` (`column_4` INT, `column_6` INT, `column_3` INT, `column_1` INT, `column_5` INT, `column_2` INT, `column_7` INT, `column_8` INT, `column_9` INT, PRIMARY KEY (`column_9`))


statement ok
INSERT INTO `table_1` (`column_4`, `column_6`, `column_3`, `column_1`, `column_5`, `column_2`, `column_7`, `column_8`, `column_9`) VALUES (1998021635, -2079734349, 302158171, 181545186, -329660226, -1450388167, -1794715404, 2119688445, 0), (1491825645, -2009900397, 1732094405, 402547886, 1621409490, -247764669, 774744992, 1624940026, 1), (2015288397, -1480027817, 137854957, -2009348146, 1282409564, 824422362, -1965145654, 2137244614, 2), (766193134, 1845880836, 1955756811, -1680622827, -6004094, 1923959592, 1360731921, -404823636, 3), (395384620, -728887972, 1481365590, -1106849159, -595365458, 124540840, -1618762799, -1340972433, 4), (897268497, 292449612, -2045396959, -1680309540, 323893939, -1060643795, -238286671, -198591596, 5), (-1346928957, -824854600, 18806558, 1797725261, -331101727, -1013572990, -1041158387, 2140917588, 6), (-564487287, -1165323798, -1990345689, -1695985031, -2020396018, -1598828741, -1601627937, 857361455, 7), (-964740350, -1861901263, 954885922, -654204327, 579533914, 1464520943, 757048929, 218658597, 8), (726271605, 980269630, 1784251655, 1480481659, -1129435886, 1259562898, -1881751681, 762865683, 9)


query  rowsort
SELECT max(`table_1`.`column_1`) AS `alias_1` FROM `table_1`
----
1797725261

query  rowsort
SELECT min(`table_1`.`column_2`) AS `alias_1` FROM `table_1`
----
-1598828741

query  rowsort
SELECT `table_1`.`column_2` AS `alias_1` FROM `table_1` WHERE (`table_1`.`column_2` > ?)
? = 10
----
124540840
1259562898
1464520943
1923959592
824422362

query  rowsort
SELECT max(`table_1`.`column_3`) AS `alias_1`, min(`table_1`.`column_4`) AS `alias_2` FROM `table_1`
----
1955756811
-1346928957

query  rowsort
SELECT max(`table_1`.`column_5`) AS `alias_1` FROM `table_1` WHERE (`table_1`.`column_4` > ?)
? = 10
----
1621409490

query  rowsort
SELECT min(`table_1`.`column_6`) AS `alias_1` FROM `table_1` WHERE (`table_1`.`column_4` > ?)
? = 10
----
-2079734349

query  rowsort
SELECT max(`table_1`.`column_7`) AS `alias_1`, min(`table_1`.`column_8`) AS `alias_2` FROM `table_1` WHERE (`table_1`.`column_4` > ?)
? = 10
----
1360731921
-1340972433

statement ok
DELETE FROM `table_1` WHERE (`column_9` = 0)


statement ok
DELETE FROM `table_1` WHERE (`column_9` = 1)


statement ok
DELETE FROM `table_1` WHERE (`column_9` = 2)


statement ok
DELETE FROM `table_1` WHERE (`column_9` = 3)


statement ok
DELETE FROM `table_1` WHERE (`column_9` = 4)


query  rowsort
SELECT max(`table_1`.`column_1`) AS `alias_1` FROM `table_1`
----
1797725261

query  rowsort
SELECT min(`table_1`.`column_2`) AS `alias_1` FROM `table_1`
----
-1598828741

query  rowsort
SELECT `table_1`.`column_2` AS `alias_1` FROM `table_1` WHERE (`table_1`.`column_2` > ?)
? = 10
----
1259562898
1464520943

query  rowsort
SELECT max(`table_1`.`column_3`) AS `alias_1`, min(`table_1`.`column_4`) AS `alias_2` FROM `table_1`
----
1784251655
-1346928957

query  rowsort
SELECT max(`table_1`.`column_5`) AS `alias_1` FROM `table_1` WHERE (`table_1`.`column_4` > ?)
? = 10
----
323893939

query  rowsort
SELECT min(`table_1`.`column_6`) AS `alias_1` FROM `table_1` WHERE (`table_1`.`column_4` > ?)
? = 10
----
292449612

query  rowsort
SELECT max(`table_1`.`column_7`) AS `alias_1`, min(`table_1`.`column_8`) AS `alias_2` FROM `table_1` WHERE (`table_1`.`column_4` > ?)
? = 10
----
-238286671
-198591596
