# Generated by:
#     target/debug/noria-logictest permute --compare-to mysql://root:noria@127.1/noria -d 3 -o logictests/generated/mysql/ --only range_param --random --include-deletes --rows-per-table 10 --subquery-depth 1 --overwrite-tests

statement ok
CREATE TABLE `table_1` (`column_5` INT, `column_2` INT, `column_3` INT, `column_4` INT, `column_1` INT, PRIMARY KEY (`column_5`))


statement ok
INSERT INTO `table_1` (`column_5`, `column_2`, `column_3`, `column_4`, `column_1`) VALUES (0, 10070434, 847456991, 1587626463, -1612147866), (1, -1838847000, -642658069, -1565727349, -1307940952), (2, -2132065485, -644206419, 3901030, 1195033587), (3, -1633110050, -1069771168, -1207484491, -365574279), (4, 169992724, 375575468, -1536964059, -910159599), (5, 750260431, -1784085481, 164957796, 1207112268), (6, 78445606, -333413588, 1026137102, -930965143), (7, 1042971663, 1010591803, 55322888, 880177891), (8, 730844897, -1433045399, 1864315463, 226085843), (9, -2087742143, -274619519, 1674943409, -2137379690)


query  rowsort
SELECT min(`table_1`.`column_1`) AS `alias_1` FROM `table_1`
----
-2137379690

query  rowsort
SELECT `table_1`.`column_1` AS `alias_1` FROM `table_1` WHERE (`table_1`.`column_1` > ?)
? = 10
----
1195033587
1207112268
226085843
880177891

query  rowsort
SELECT `table_1`.`column_1` AS `alias_1` FROM `table_1` WHERE (`table_1`.`column_1` > ?)
? = 10
----
1195033587
1207112268
226085843
880177891

query  rowsort
SELECT min(`table_1`.`column_2`) AS `alias_1` FROM `table_1` WHERE (`table_1`.`column_1` > ?)
? = 10
----
-2132065485

query  rowsort
SELECT min(`table_1`.`column_3`) AS `alias_1` FROM `table_1` WHERE (`table_1`.`column_3` > ?)
? = 10
----
375575468

query  rowsort
SELECT `table_1`.`column_3` AS `alias_1` FROM `table_1` WHERE ((`table_1`.`column_3` > ?) AND (`table_1`.`column_3` > ?))
? = 10
? = 10
----
1010591803
375575468
847456991

query  rowsort
SELECT min(`table_1`.`column_4`) AS `alias_1` FROM `table_1` WHERE ((`table_1`.`column_2` > ?) AND (`table_1`.`column_2` > ?))
? = 10
? = 10
----
-1536964059

statement ok
DELETE FROM `table_1` WHERE (`column_5` = 0)


statement ok
DELETE FROM `table_1` WHERE (`column_5` = 1)


statement ok
DELETE FROM `table_1` WHERE (`column_5` = 2)


statement ok
DELETE FROM `table_1` WHERE (`column_5` = 3)


statement ok
DELETE FROM `table_1` WHERE (`column_5` = 4)


query  rowsort
SELECT min(`table_1`.`column_1`) AS `alias_1` FROM `table_1`
----
-2137379690

query  rowsort
SELECT `table_1`.`column_1` AS `alias_1` FROM `table_1` WHERE (`table_1`.`column_1` > ?)
? = 10
----
1207112268
226085843
880177891

query  rowsort
SELECT `table_1`.`column_1` AS `alias_1` FROM `table_1` WHERE (`table_1`.`column_1` > ?)
? = 10
----
1207112268
226085843
880177891

query  rowsort
SELECT min(`table_1`.`column_2`) AS `alias_1` FROM `table_1` WHERE (`table_1`.`column_1` > ?)
? = 10
----
730844897

query  rowsort
SELECT min(`table_1`.`column_3`) AS `alias_1` FROM `table_1` WHERE (`table_1`.`column_3` > ?)
? = 10
----
1010591803

query  rowsort
SELECT `table_1`.`column_3` AS `alias_1` FROM `table_1` WHERE ((`table_1`.`column_3` > ?) AND (`table_1`.`column_3` > ?))
? = 10
? = 10
----
1010591803

query  rowsort
SELECT min(`table_1`.`column_4`) AS `alias_1` FROM `table_1` WHERE ((`table_1`.`column_2` > ?) AND (`table_1`.`column_2` > ?))
? = 10
? = 10
----
55322888
