# Generated by:
#     target/debug/noria-logictest permute --compare-to mysql://root:noria@127.1/noria -d 3 -o logictests/generated/mysql/ --only range_param --random --include-deletes --rows-per-table 10 --subquery-depth 1 --overwrite-tests

statement ok
CREATE TABLE `table_1` (`column_1` INT, `column_3` INT, `column_5` INT, `column_8` INT, `column_9` INT, `column_6` INT, `column_7` INT, `column_2` INT, `column_4` INT, PRIMARY KEY (`column_9`))


statement ok
INSERT INTO `table_1` (`column_1`, `column_3`, `column_5`, `column_8`, `column_9`, `column_6`, `column_7`, `column_2`, `column_4`) VALUES (1657913738, -1724180764, -776199722, 1412719269, 0, -683802459, 211929603, 1151512952, -19228422), (457121180, -366631403, -590004367, 948187454, 1, 936740936, -1784403491, 1559244, 1825682774), (-1053318284, 1296203561, 1684502211, -1108069177, 2, 242782680, 223561107, -834125700, 101276217), (163198875, -650522753, 279711397, 1400310503, 3, 1463974203, 1410746042, 405870909, 1962229059), (622869376, -1102834647, -2131183258, -1252079258, 4, 1807504534, 366276077, -484555996, 275192249), (-1995684758, 771742200, -874096931, 1891340925, 5, 2058882509, -658472372, 329507903, 1823153169), (-248446534, 164824793, -1382451800, -1625290611, 6, 1806517286, 1507949985, -1301233776, 1899948387), (335899740, -1279570317, -200229347, 591910124, 7, -902675867, 472292971, 1745784982, 1686231341), (-637018093, -747150015, -400712414, -2025264593, 8, -1148253085, -1101270247, -1004537, 159291782), (1435919291, -1100255905, 178993305, -1339168968, 9, 1814584288, -276551236, 167387810, -1167882595)


query  rowsort
SELECT min(`table_1`.`column_1`) AS `alias_1` FROM `table_1`
----
-1995684758

query  rowsort
SELECT count(`table_1`.`column_2`) AS `alias_1` FROM `table_1`
----
10

query  rowsort
SELECT `table_1`.`column_1` AS `alias_1` FROM `table_1` WHERE (`table_1`.`column_1` > ?)
? = 10
----
1435919291
163198875
1657913738
335899740
457121180
622869376

query  rowsort
SELECT min(`table_1`.`column_3`) AS `alias_1`, count(`table_1`.`column_4`) AS `alias_2` FROM `table_1`
----
-1724180764
10

query  rowsort
SELECT min(`table_1`.`column_5`) AS `alias_1` FROM `table_1` WHERE (`table_1`.`column_1` > ?)
? = 10
----
-2131183258

query  rowsort
SELECT count(`table_1`.`column_6`) AS `alias_1` FROM `table_1` WHERE (`table_1`.`column_1` > ?)
? = 10
----
6

query  rowsort
SELECT min(`table_1`.`column_7`) AS `alias_1`, count(`table_1`.`column_8`) AS `alias_2` FROM `table_1` WHERE (`table_1`.`column_1` > ?)
? = 10
----
-1784403491
6

statement ok
DELETE FROM `table_1` WHERE (`column_9` = 0)


statement ok
DELETE FROM `table_1` WHERE (`column_9` = 1)


statement ok
DELETE FROM `table_1` WHERE (`column_9` = 2)


statement ok
DELETE FROM `table_1` WHERE (`column_9` = 3)


statement ok
DELETE FROM `table_1` WHERE (`column_9` = 4)


query  rowsort
SELECT min(`table_1`.`column_1`) AS `alias_1` FROM `table_1`
----
-1995684758

query  rowsort
SELECT count(`table_1`.`column_2`) AS `alias_1` FROM `table_1`
----
5

query  rowsort
SELECT `table_1`.`column_1` AS `alias_1` FROM `table_1` WHERE (`table_1`.`column_1` > ?)
? = 10
----
1435919291
335899740

query  rowsort
SELECT min(`table_1`.`column_3`) AS `alias_1`, count(`table_1`.`column_4`) AS `alias_2` FROM `table_1`
----
-1279570317
5

query  rowsort
SELECT min(`table_1`.`column_5`) AS `alias_1` FROM `table_1` WHERE (`table_1`.`column_1` > ?)
? = 10
----
-200229347

query  rowsort
SELECT count(`table_1`.`column_6`) AS `alias_1` FROM `table_1` WHERE (`table_1`.`column_1` > ?)
? = 10
----
2

query  rowsort
SELECT min(`table_1`.`column_7`) AS `alias_1`, count(`table_1`.`column_8`) AS `alias_2` FROM `table_1` WHERE (`table_1`.`column_1` > ?)
? = 10
----
-276551236
2
