# Generated by:
#     target/debug/noria-logictest permute --compare-to mysql://root:noria@127.1/noria -d 3 -o logictests/generated/mysql/ --only range_param --random --include-deletes --rows-per-table 10 --subquery-depth 1 --overwrite-tests

statement ok
CREATE TABLE `table_1` (`column_9` INT, `column_2` INT, `column_4` INT, `column_5` INT, `column_3` INT, `column_6` INT, `column_1` INT, `column_8` INT, `column_7` INT, PRIMARY KEY (`column_9`))


statement ok
INSERT INTO `table_1` (`column_9`, `column_2`, `column_4`, `column_5`, `column_3`, `column_6`, `column_1`, `column_8`, `column_7`) VALUES (0, -1720050655, -603257860, 1233970219, -352672628, -80016136, 2030256833, -1379601195, -1613604572), (1, -1245738145, -55387349, -689583284, -1922630479, -1065346286, -979415009, 573185020, -1437628644), (2, 1677418616, 1254106112, 800528414, 323745388, 1279357334, -507700425, -801719113, -62668915), (3, -1672162165, -820049864, 8048589, 66142276, 1767441921, -722846465, -1267081870, 342620894), (4, -500648658, 1376903598, 1620840308, -319918988, 862716570, 648033551, -375786664, 314273259), (5, -1834894789, -796803600, -1929959889, 953897419, 274509661, -230270546, 1818967270, -1402917009), (6, 503939987, -682069990, -1350064017, 452755200, 110038348, -810421533, -1047552893, 610250747), (7, 1645442915, -2143555979, 190475210, 388884161, -696213690, -1550119794, 2001938706, 827161914), (8, -1866791485, -798766005, -146147048, -359254940, 2021221415, -1985165432, 1410214198, 190058100), (9, 884921641, 338077368, -1984432663, -884749759, 977841135, 1219800314, -1317462602, 124236054)


query  rowsort
SELECT min(`table_1`.`column_1`) AS `alias_1` FROM `table_1`
----
-1985165432

query  nosort
SELECT `table_1`.`column_1` AS `alias_1` FROM `table_1` ORDER BY `table_1`.`column_1` ASC LIMIT 10
----
-1985165432
-1550119794
-979415009
-810421533
-722846465
-507700425
-230270546
648033551
1219800314
2030256833

query  nosort
SELECT `table_1`.`column_1` AS `alias_1` FROM `table_1` ORDER BY `table_1`.`column_1` DESC LIMIT 10
----
2030256833
1219800314
648033551
-230270546
-507700425
-722846465
-810421533
-979415009
-1550119794
-1985165432

query  rowsort
SELECT `table_1`.`column_1` AS `alias_1` FROM `table_1` WHERE (`table_1`.`column_1` > ?)
? = 10
----
1219800314
2030256833
648033551

query  nosort
SELECT min(`table_1`.`column_2`) AS `alias_1` FROM `table_1` GROUP BY `table_1`.`column_2` ORDER BY `table_1`.`column_2` ASC LIMIT 10
----
-1866791485
-1834894789
-1720050655
-1672162165
-1245738145
-500648658
503939987
884921641
1645442915
1677418616

query  nosort
SELECT min(`table_1`.`column_3`) AS `alias_1` FROM `table_1` GROUP BY `table_1`.`column_3` ORDER BY `table_1`.`column_3` DESC LIMIT 10
----
953897419
452755200
388884161
323745388
66142276
-319918988
-352672628
-359254940
-884749759
-1922630479

query  rowsort
SELECT min(`table_1`.`column_4`) AS `alias_1` FROM `table_1` WHERE (`table_1`.`column_2` > ?)
? = 10
----
-2143555979

query  nosort
SELECT `table_1`.`column_2` AS `alias_1` FROM `table_1` ORDER BY `table_1`.`column_2` DESC LIMIT 10
----
1677418616
1645442915
884921641
503939987
-500648658
-1245738145
-1672162165
-1720050655
-1834894789
-1866791485

query  nosort
SELECT `table_1`.`column_2` AS `alias_1` FROM `table_1` WHERE (`table_1`.`column_2` > ?) ORDER BY `table_1`.`column_2` ASC LIMIT 10
? = 10
----
503939987
884921641
1645442915
1677418616

query  nosort
SELECT `table_1`.`column_2` AS `alias_1` FROM `table_1` WHERE (`table_1`.`column_2` > ?) ORDER BY `table_1`.`column_2` DESC LIMIT 10
? = 10
----
1677418616
1645442915
884921641
503939987

query  nosort
SELECT min(`table_1`.`column_5`) AS `alias_1` FROM `table_1` GROUP BY `table_1`.`column_2` ORDER BY `table_1`.`column_2` DESC LIMIT 10
----
800528414
190475210
-1984432663
-1350064017
1620840308
-689583284
8048589
1233970219
-1929959889
-146147048

query  nosort
SELECT min(`table_1`.`column_6`) AS `alias_1` FROM `table_1` WHERE (`table_1`.`column_2` > ?) GROUP BY `table_1`.`column_2` ORDER BY `table_1`.`column_2` ASC LIMIT 10
? = 10
----
110038348
977841135
-696213690
1279357334

query  nosort
SELECT min(`table_1`.`column_7`) AS `alias_1` FROM `table_1` WHERE (`table_1`.`column_7` > ?) GROUP BY `table_1`.`column_7` ORDER BY `table_1`.`column_7` DESC LIMIT 10
? = 10
----
827161914
610250747
342620894
314273259
190058100
124236054

query  nosort
SELECT `table_1`.`column_7` AS `alias_1` FROM `table_1` WHERE (`table_1`.`column_7` > ?) ORDER BY `table_1`.`column_7` DESC LIMIT 10
? = 10
----
827161914
610250747
342620894
314273259
190058100
124236054

query  nosort
SELECT min(`table_1`.`column_8`) AS `alias_1` FROM `table_1` WHERE (`table_1`.`column_2` > ?) GROUP BY `table_1`.`column_2` ORDER BY `table_1`.`column_2` DESC LIMIT 10
? = 10
----
-801719113
2001938706
-1317462602
-1047552893

statement ok
DELETE FROM `table_1` WHERE (`column_9` = 0)


statement ok
DELETE FROM `table_1` WHERE (`column_9` = 1)


statement ok
DELETE FROM `table_1` WHERE (`column_9` = 2)


statement ok
DELETE FROM `table_1` WHERE (`column_9` = 3)


statement ok
DELETE FROM `table_1` WHERE (`column_9` = 4)


query  rowsort
SELECT min(`table_1`.`column_1`) AS `alias_1` FROM `table_1`
----
-1985165432

query  nosort
SELECT `table_1`.`column_1` AS `alias_1` FROM `table_1` ORDER BY `table_1`.`column_1` ASC LIMIT 10
----
-1985165432
-1550119794
-810421533
-230270546
1219800314

query  nosort
SELECT `table_1`.`column_1` AS `alias_1` FROM `table_1` ORDER BY `table_1`.`column_1` DESC LIMIT 10
----
1219800314
-230270546
-810421533
-1550119794
-1985165432

query  rowsort
SELECT `table_1`.`column_1` AS `alias_1` FROM `table_1` WHERE (`table_1`.`column_1` > ?)
? = 10
----
1219800314

query  nosort
SELECT min(`table_1`.`column_2`) AS `alias_1` FROM `table_1` GROUP BY `table_1`.`column_2` ORDER BY `table_1`.`column_2` ASC LIMIT 10
----
-1866791485
-1834894789
503939987
884921641
1645442915

query  nosort
SELECT min(`table_1`.`column_3`) AS `alias_1` FROM `table_1` GROUP BY `table_1`.`column_3` ORDER BY `table_1`.`column_3` DESC LIMIT 10
----
953897419
452755200
388884161
-359254940
-884749759

query  rowsort
SELECT min(`table_1`.`column_4`) AS `alias_1` FROM `table_1` WHERE (`table_1`.`column_2` > ?)
? = 10
----
-2143555979

query  nosort
SELECT `table_1`.`column_2` AS `alias_1` FROM `table_1` ORDER BY `table_1`.`column_2` DESC LIMIT 10
----
1645442915
884921641
503939987
-1834894789
-1866791485

query  nosort
SELECT `table_1`.`column_2` AS `alias_1` FROM `table_1` WHERE (`table_1`.`column_2` > ?) ORDER BY `table_1`.`column_2` ASC LIMIT 10
? = 10
----
503939987
884921641
1645442915

query  nosort
SELECT `table_1`.`column_2` AS `alias_1` FROM `table_1` WHERE (`table_1`.`column_2` > ?) ORDER BY `table_1`.`column_2` DESC LIMIT 10
? = 10
----
1645442915
884921641
503939987

query  nosort
SELECT min(`table_1`.`column_5`) AS `alias_1` FROM `table_1` GROUP BY `table_1`.`column_2` ORDER BY `table_1`.`column_2` DESC LIMIT 10
----
190475210
-1984432663
-1350064017
-1929959889
-146147048

query  nosort
SELECT min(`table_1`.`column_6`) AS `alias_1` FROM `table_1` WHERE (`table_1`.`column_2` > ?) GROUP BY `table_1`.`column_2` ORDER BY `table_1`.`column_2` ASC LIMIT 10
? = 10
----
110038348
977841135
-696213690

query  nosort
SELECT min(`table_1`.`column_7`) AS `alias_1` FROM `table_1` WHERE (`table_1`.`column_7` > ?) GROUP BY `table_1`.`column_7` ORDER BY `table_1`.`column_7` DESC LIMIT 10
? = 10
----
827161914
610250747
190058100
124236054

query  nosort
SELECT `table_1`.`column_7` AS `alias_1` FROM `table_1` WHERE (`table_1`.`column_7` > ?) ORDER BY `table_1`.`column_7` DESC LIMIT 10
? = 10
----
827161914
610250747
190058100
124236054

query  nosort
SELECT min(`table_1`.`column_8`) AS `alias_1` FROM `table_1` WHERE (`table_1`.`column_2` > ?) GROUP BY `table_1`.`column_2` ORDER BY `table_1`.`column_2` DESC LIMIT 10
? = 10
----
2001938706
-1317462602
-1047552893
