# Generated by:
#     target/debug/noria-logictest permute --compare-to mysql://root:noria@127.1/noria -d 3 -o logictests/generated/mysql/ --only range_param --random --include-deletes --rows-per-table 10 --subquery-depth 1 --overwrite-tests

statement ok
CREATE TABLE `table_5` (`column_2` INT, `column_1` INT, `column_3` INT, PRIMARY KEY (`column_3`))


statement ok
CREATE TABLE `table_3` (`column_6` INT, `column_4` INT, `column_7` INT, `column_1` INT, `column_2` INT, `column_3` INT, `column_5` INT, PRIMARY KEY (`column_7`))


statement ok
CREATE TABLE `table_1` (`column_2` INT, `column_5` INT, `column_4` INT, `column_3` INT, `column_1` INT, PRIMARY KEY (`column_5`))


statement ok
CREATE TABLE `table_4` (`column_1` INT, `column_3` INT, `column_2` INT, PRIMARY KEY (`column_3`))


statement ok
CREATE TABLE `table_2` (`column_3` INT, `column_1` INT, `column_2` INT, PRIMARY KEY (`column_3`))


statement ok
INSERT INTO `table_5` (`column_2`, `column_1`, `column_3`) VALUES (-1010913963, -544079601, 0), (-1355863007, -1703830536, 1), (-1828753239, 1089679678, 2), (465289740, -1630993205, 3), (-1769894037, -926994540, 4), (-1654494622, -1631229918, 5), (-715260691, 1235875182, 6), (1964271310, -136348867, 7), (-1426002290, -233459325, 8), (527975109, 371294162, 9)


statement ok
INSERT INTO `table_3` (`column_6`, `column_4`, `column_7`, `column_1`, `column_2`, `column_3`, `column_5`) VALUES (1458565443, -611954357, 0, 2084910185, -1509036323, 524552449, 346892120), (-420748399, -1442639814, 1, -868328469, 1193695548, -267242961, 2060716957), (-1662950827, 410614011, 2, 643185554, 606551619, 404620594, 104767325), (-2146347583, 734933551, 3, -1268521179, 2040883360, -1457774230, -2033865164), (321372365, 80308740, 4, 1701702469, -771880198, 128377332, 108242942), (-1990832847, -354054212, 5, -634705178, 2119355461, -1031479675, 893656971), (-1935772348, -189743336, 6, 316789504, -1354453355, 1529193918, 1727130650), (2089405216, 276526821, 7, -2088669874, -1083399429, 802254598, -1991660051), (-1301879662, -1658958959, 8, 1699670942, 1034272514, -1202335854, 1514607311), (1272888734, 1741987887, 9, 938953107, 1671610375, 848272484, 1886774007)


statement ok
INSERT INTO `table_1` (`column_2`, `column_5`, `column_4`, `column_3`, `column_1`) VALUES (506735924, 0, -1740840106, 1657358447, -185356326), (1415993204, 1, -1575308489, 1961638274, -942562121), (-1283433588, 2, -470925943, 333466468, 1892585941), (-397102094, 3, 1727643100, -262089397, -685782516), (940498504, 4, -384379955, -15391595, -1819016425), (-858805339, 5, -1900131569, 2114294198, -1207851540), (373237024, 6, -1197924936, -1050161301, -212469013), (1900739740, 7, -991345723, -186985986, 103172399), (-1600102841, 8, -854926035, 2044790266, 1692488934), (1802226182, 9, -1504065631, -271761841, -1264897514)


statement ok
INSERT INTO `table_4` (`column_1`, `column_3`, `column_2`) VALUES (-4881292, 0, 303632625), (-1516265195, 1, -1585589747), (1150600986, 2, 1390986249), (861094791, 3, 340274199), (-2016127072, 4, 1054333641), (-1815489592, 5, 1724584376), (1416516732, 6, 1862341692), (2073374603, 7, -1633920816), (2131056821, 8, 220064690), (877802533, 9, -1626438613)


statement ok
INSERT INTO `table_2` (`column_3`, `column_1`, `column_2`) VALUES (0, 1804837802, 8981806), (1, 1635763055, 1896986777), (2, 2093045434, 747057296), (3, 2096107195, 1913484857), (4, -150846381, -1386876142), (5, 1869618757, -1870501761), (6, 677378968, -1494126382), (7, -1323382477, -1885663687), (8, 2013833646, 1301616405), (9, 1158270497, 734516628)


query  rowsort
SELECT min(`table_1`.`column_1`) AS `alias_1` FROM `table_1`
----
-1819016425

query  rowsort
SELECT `table_1`.`column_2` AS `alias_1`, `table_2`.`column_2` AS `alias_2` FROM `table_1` INNER JOIN `table_2` ON (`table_1`.`column_1` = `table_2`.`column_1`)
----


query  rowsort
SELECT `table_1`.`column_2` AS `alias_1` FROM `table_1` WHERE (`table_1`.`column_2` > ?)
? = 10
----
1415993204
1802226182
1900739740
373237024
506735924
940498504

query  rowsort
SELECT min(`table_1`.`column_3`) AS `alias_1`, `table_1`.`column_4` AS `alias_2`, `table_3`.`column_2` AS `alias_3` FROM `table_1` INNER JOIN `table_3` ON (`table_1`.`column_2` = `table_3`.`column_1`) GROUP BY `table_1`.`column_4`, `table_3`.`column_2`
----


query  rowsort
SELECT min(`table_3`.`column_3`) AS `alias_1` FROM `table_3` WHERE (`table_3`.`column_1` > ?)
? = 10
----
-1202335854

query  rowsort
SELECT `table_3`.`column_4` AS `alias_1`, `table_4`.`column_2` AS `alias_2` FROM `table_3` INNER JOIN `table_4` ON (`table_3`.`column_1` = `table_4`.`column_1`) WHERE (`table_3`.`column_4` > ?)
? = 10
----


query  rowsort
SELECT min(`table_3`.`column_5`) AS `alias_1`, `table_3`.`column_6` AS `alias_2`, `table_5`.`column_2` AS `alias_3` FROM `table_3` INNER JOIN `table_5` ON (`table_3`.`column_4` = `table_5`.`column_1`) WHERE (`table_3`.`column_6` > ?) GROUP BY `table_3`.`column_6`, `table_5`.`column_2`
? = 10
----


statement ok
DELETE FROM `table_5` WHERE (`column_3` = 0)


statement ok
DELETE FROM `table_5` WHERE (`column_3` = 1)


statement ok
DELETE FROM `table_5` WHERE (`column_3` = 2)


statement ok
DELETE FROM `table_5` WHERE (`column_3` = 3)


statement ok
DELETE FROM `table_5` WHERE (`column_3` = 4)


statement ok
DELETE FROM `table_3` WHERE (`column_7` = 0)


statement ok
DELETE FROM `table_3` WHERE (`column_7` = 1)


statement ok
DELETE FROM `table_3` WHERE (`column_7` = 2)


statement ok
DELETE FROM `table_3` WHERE (`column_7` = 3)


statement ok
DELETE FROM `table_3` WHERE (`column_7` = 4)


statement ok
DELETE FROM `table_1` WHERE (`column_5` = 0)


statement ok
DELETE FROM `table_1` WHERE (`column_5` = 1)


statement ok
DELETE FROM `table_1` WHERE (`column_5` = 2)


statement ok
DELETE FROM `table_1` WHERE (`column_5` = 3)


statement ok
DELETE FROM `table_1` WHERE (`column_5` = 4)


statement ok
DELETE FROM `table_4` WHERE (`column_3` = 0)


statement ok
DELETE FROM `table_4` WHERE (`column_3` = 1)


statement ok
DELETE FROM `table_4` WHERE (`column_3` = 2)


statement ok
DELETE FROM `table_4` WHERE (`column_3` = 3)


statement ok
DELETE FROM `table_4` WHERE (`column_3` = 4)


statement ok
DELETE FROM `table_2` WHERE (`column_3` = 0)


statement ok
DELETE FROM `table_2` WHERE (`column_3` = 1)


statement ok
DELETE FROM `table_2` WHERE (`column_3` = 2)


statement ok
DELETE FROM `table_2` WHERE (`column_3` = 3)


statement ok
DELETE FROM `table_2` WHERE (`column_3` = 4)


query  rowsort
SELECT min(`table_1`.`column_1`) AS `alias_1` FROM `table_1`
----
-1264897514

query  rowsort
SELECT `table_1`.`column_2` AS `alias_1`, `table_2`.`column_2` AS `alias_2` FROM `table_1` INNER JOIN `table_2` ON (`table_1`.`column_1` = `table_2`.`column_1`)
----


query  rowsort
SELECT `table_1`.`column_2` AS `alias_1` FROM `table_1` WHERE (`table_1`.`column_2` > ?)
? = 10
----
1802226182
1900739740
373237024

query  rowsort
SELECT min(`table_1`.`column_3`) AS `alias_1`, `table_1`.`column_4` AS `alias_2`, `table_3`.`column_2` AS `alias_3` FROM `table_1` INNER JOIN `table_3` ON (`table_1`.`column_2` = `table_3`.`column_1`) GROUP BY `table_1`.`column_4`, `table_3`.`column_2`
----


query  rowsort
SELECT min(`table_3`.`column_3`) AS `alias_1` FROM `table_3` WHERE (`table_3`.`column_1` > ?)
? = 10
----
-1202335854

query  rowsort
SELECT `table_3`.`column_4` AS `alias_1`, `table_4`.`column_2` AS `alias_2` FROM `table_3` INNER JOIN `table_4` ON (`table_3`.`column_1` = `table_4`.`column_1`) WHERE (`table_3`.`column_4` > ?)
? = 10
----


query  rowsort
SELECT min(`table_3`.`column_5`) AS `alias_1`, `table_3`.`column_6` AS `alias_2`, `table_5`.`column_2` AS `alias_3` FROM `table_3` INNER JOIN `table_5` ON (`table_3`.`column_4` = `table_5`.`column_1`) WHERE (`table_3`.`column_6` > ?) GROUP BY `table_3`.`column_6`, `table_5`.`column_2`
? = 10
----

