# Generated by:
#     target/debug/noria-logictest permute --compare-to mysql://root:noria@127.1/noria -d 3 -o logictests/generated/mysql/ --only range_param --random --include-deletes --rows-per-table 10 --subquery-depth 1 --overwrite-tests

statement ok
CREATE TABLE `table_1` (`column_4` INT, `column_7` INT, `column_5` INT, `column_3` INT, `column_9` INT, `column_8` INT, `column_1` INT, `column_6` INT, `column_2` INT, PRIMARY KEY (`column_9`))


statement ok
INSERT INTO `table_1` (`column_4`, `column_7`, `column_5`, `column_3`, `column_9`, `column_8`, `column_1`, `column_6`, `column_2`) VALUES (1835187703, -1235007333, 1794053966, 305763880, 0, 1093906793, -526207852, -2124695660, 921813867), (-1732968280, 1516756218, 1532272834, -1823111903, 1, -1463978767, -853875264, -1029761808, -657807442), (-1299296281, -376244900, 1564340707, 568524802, 2, 2091665374, -1340566842, 877786506, -1531547834), (-317629015, -1329075729, -1535764654, -1545597621, 3, -1736573980, -471935890, -1737142563, -1513197259), (788487631, 800805631, -984118110, -765150091, 4, 1753697743, 1641633717, -287521527, -1855161721), (-458973130, -1756615515, -1693620624, -1413618110, 5, 83473134, 601109008, -1480660583, -1717122324), (1669006533, -418749464, 49257643, 1576196137, 6, 890485362, 629533250, -140270532, -739489974), (1391689344, 2108763171, 910063895, 1878086357, 7, -1285288568, 1051788258, 1506969001, 778521976), (769364999, -435524023, 1899883864, 2015088774, 8, -1650781786, 163858548, 149063361, -2116497516), (-1496227766, 789404724, 892432056, 2090081563, 9, -1834933646, 1631201111, -1441624573, -587528940)


query  rowsort
SELECT min(`table_1`.`column_1`) AS `alias_1` FROM `table_1`
----
-1340566842

query  rowsort
SELECT max(`table_1`.`column_2`) AS `alias_1` FROM `table_1`
----
921813867

query  rowsort
SELECT `table_1`.`column_1` AS `alias_1` FROM `table_1` WHERE (`table_1`.`column_1` > ?)
? = 10
----
1051788258
1631201111
163858548
1641633717
601109008
629533250

query  rowsort
SELECT min(`table_1`.`column_3`) AS `alias_1`, max(`table_1`.`column_4`) AS `alias_2` FROM `table_1`
----
-1823111903
1835187703

query  rowsort
SELECT min(`table_1`.`column_5`) AS `alias_1` FROM `table_1` WHERE (`table_1`.`column_1` > ?)
? = 10
----
-1693620624

query  rowsort
SELECT max(`table_1`.`column_6`) AS `alias_1` FROM `table_1` WHERE (`table_1`.`column_1` > ?)
? = 10
----
1506969001

query  rowsort
SELECT min(`table_1`.`column_7`) AS `alias_1`, max(`table_1`.`column_8`) AS `alias_2` FROM `table_1` WHERE (`table_1`.`column_4` > ?)
? = 10
----
-1235007333
1753697743

statement ok
DELETE FROM `table_1` WHERE (`column_9` = 0)


statement ok
DELETE FROM `table_1` WHERE (`column_9` = 1)


statement ok
DELETE FROM `table_1` WHERE (`column_9` = 2)


statement ok
DELETE FROM `table_1` WHERE (`column_9` = 3)


statement ok
DELETE FROM `table_1` WHERE (`column_9` = 4)


query  rowsort
SELECT min(`table_1`.`column_1`) AS `alias_1` FROM `table_1`
----
163858548

query  rowsort
SELECT max(`table_1`.`column_2`) AS `alias_1` FROM `table_1`
----
778521976

query  rowsort
SELECT `table_1`.`column_1` AS `alias_1` FROM `table_1` WHERE (`table_1`.`column_1` > ?)
? = 10
----
1051788258
1631201111
163858548
601109008
629533250

query  rowsort
SELECT min(`table_1`.`column_3`) AS `alias_1`, max(`table_1`.`column_4`) AS `alias_2` FROM `table_1`
----
-1413618110
1669006533

query  rowsort
SELECT min(`table_1`.`column_5`) AS `alias_1` FROM `table_1` WHERE (`table_1`.`column_1` > ?)
? = 10
----
-1693620624

query  rowsort
SELECT max(`table_1`.`column_6`) AS `alias_1` FROM `table_1` WHERE (`table_1`.`column_1` > ?)
? = 10
----
1506969001

query  rowsort
SELECT min(`table_1`.`column_7`) AS `alias_1`, max(`table_1`.`column_8`) AS `alias_2` FROM `table_1` WHERE (`table_1`.`column_4` > ?)
? = 10
----
-435524023
890485362
