# Generated by:
#     target/debug/noria-logictest permute --compare-to mysql://root:noria@127.1/noria -d 3 -o logictests/generated/mysql/ --only range_param --random --include-deletes --rows-per-table 10 --subquery-depth 1 --overwrite-tests

statement ok
CREATE TABLE `table_2` (`column_5` INT, `column_2` INT, `column_7` INT, `column_3` INT, `column_4` INT, `column_9` INT, `column_8` INT, `column_6` INT, `column_1` INT, PRIMARY KEY (`column_9`))


statement ok
CREATE TABLE `table_3` (`column_1` INT, `column_2` INT, `column_3` INT, PRIMARY KEY (`column_3`))


statement ok
CREATE TABLE `table_5` (`column_1` INT, `column_3` INT, `column_2` INT, PRIMARY KEY (`column_3`))


statement ok
CREATE TABLE `table_4` (`column_1` INT, `column_2` INT, `column_3` INT, PRIMARY KEY (`column_3`))


statement ok
CREATE TABLE `table_1` (`column_1` INT, `column_3` INT, `column_2` INT, PRIMARY KEY (`column_3`))


statement ok
INSERT INTO `table_2` (`column_5`, `column_2`, `column_7`, `column_3`, `column_4`, `column_9`, `column_8`, `column_6`, `column_1`) VALUES (-1054153064, 2041368374, -1136848885, -322733886, -787300442, 0, -1706302566, 1080825699, -1314127859), (-57981902, -1601381160, -1079482542, 1091880738, -1837359445, 1, 1864214964, -1718351014, -1855751309), (1892215416, 1083801172, 776183608, -70273928, -212301440, 2, 614071007, 1093981854, 1806912649), (-2099137494, 436005372, -1115633552, -149441519, -425294818, 3, -263699764, -1361479663, 1967843129), (30647566, 94605251, -252049854, 379533546, -1542742796, 4, -473010885, -1740463011, 883184864), (1601800369, -788127674, 1921271673, 1125468729, -587998596, 5, 5954157, -799100192, 50685154), (-223976271, -2058048936, -663246373, 266416002, 2059847999, 6, 121794989, -543982250, 447409844), (318970435, 1651626117, 1445539209, -433337343, 767116005, 7, -1774751040, -1635993511, -1724885807), (1501955987, -2116255885, -500749273, 812770898, -74687555, 8, -1012627079, 1531075555, 672342349), (510767086, 587021747, 1780337653, 1518549207, 1786512743, 9, -1366251479, 916037147, 445180620)


statement ok
INSERT INTO `table_3` (`column_1`, `column_2`, `column_3`) VALUES (2093271678, -865075745, 0), (348271360, 1730155691, 1), (635518422, -377409433, 2), (367682260, 601741249, 3), (1607172154, -2082556620, 4), (1809086102, 1901569311, 5), (-959370526, 1483590390, 6), (235513085, 1803701646, 7), (1658520651, 362790300, 8), (-556364489, -755046281, 9)


statement ok
INSERT INTO `table_5` (`column_1`, `column_3`, `column_2`) VALUES (-228041626, 0, -707097447), (-1753352437, 1, 728321167), (-1323141870, 2, 444845560), (1060652007, 3, -264871448), (-775954303, 4, 1692483913), (1875969565, 5, 1031762893), (-400280366, 6, 912674877), (899755192, 7, -456465235), (-1311567816, 8, 1854926084), (-397671598, 9, -1355443079)


statement ok
INSERT INTO `table_4` (`column_1`, `column_2`, `column_3`) VALUES (-630762193, -505820376, 0), (845051950, -1424097978, 1), (488517832, -914821076, 2), (-1712704791, 834487495, 3), (-1983202180, -30556874, 4), (1515806931, -1193271624, 5), (-753499221, -1271368532, 6), (-1302849430, -861028448, 7), (-1811889450, -386118470, 8), (-1663712759, 1206447710, 9)


statement ok
INSERT INTO `table_1` (`column_1`, `column_3`, `column_2`) VALUES (-1388267605, 0, 748878093), (1171150876, 1, 335197191), (-1127043327, 2, 457657968), (-1653363591, 3, -1361862724), (695011700, 4, 423839515), (2146626001, 5, -2047174703), (1135387211, 6, -1814133971), (-1949082652, 7, 630604990), (-1656450393, 8, -623803766), (-1435903657, 9, -890925888)


query  rowsort
SELECT min(`table_1`.`column_1`) AS `alias_1` FROM `table_1`
----
-1949082652

query  rowsort
SELECT `table_1`.`column_2` AS `alias_1`, `table_2`.`column_2` AS `alias_2` FROM `table_1` LEFT JOIN `table_2` ON (`table_1`.`column_1` = `table_2`.`column_1`)
----
-1361862724
NULL
-1814133971
NULL
-2047174703
NULL
-623803766
NULL
-890925888
NULL
335197191
NULL
423839515
NULL
457657968
NULL
630604990
NULL
748878093
NULL

query  rowsort
SELECT `table_2`.`column_1` AS `alias_1` FROM `table_2` WHERE (`table_2`.`column_1` > ?)
? = 10
----
1806912649
1967843129
445180620
447409844
50685154
672342349
883184864

query  rowsort
SELECT min(`table_2`.`column_3`) AS `alias_1`, `table_2`.`column_4` AS `alias_2`, `table_3`.`column_2` AS `alias_3` FROM `table_2` LEFT JOIN `table_3` ON (`table_2`.`column_3` = `table_3`.`column_1`) GROUP BY `table_2`.`column_4`, `table_3`.`column_2`
----
30 values hashing to 31c91d6bd669159bde1a9ae18845bd51

query  rowsort
SELECT min(`table_2`.`column_5`) AS `alias_1` FROM `table_2` WHERE (`table_2`.`column_5` > ?)
? = 10
----
30647566

query  rowsort
SELECT `table_2`.`column_6` AS `alias_1`, `table_4`.`column_2` AS `alias_2` FROM `table_2` LEFT JOIN `table_4` ON (`table_2`.`column_5` = `table_4`.`column_1`) WHERE (`table_2`.`column_5` > ?)
? = 10
----
-1635993511
NULL
-1740463011
NULL
-799100192
NULL
1093981854
NULL
1531075555
NULL
916037147
NULL

query  rowsort
SELECT min(`table_2`.`column_7`) AS `alias_1`, `table_2`.`column_8` AS `alias_2`, `table_5`.`column_2` AS `alias_3` FROM `table_2` LEFT JOIN `table_5` ON (`table_2`.`column_7` = `table_5`.`column_1`) WHERE (`table_2`.`column_5` > ?) GROUP BY `table_2`.`column_8`, `table_5`.`column_2`
? = 10
----
-252049854
-473010885
NULL
-500749273
-1012627079
NULL
1445539209
-1774751040
NULL
1780337653
-1366251479
NULL
1921271673
5954157
NULL
776183608
614071007
NULL

statement ok
DELETE FROM `table_2` WHERE (`column_9` = 0)


statement ok
DELETE FROM `table_2` WHERE (`column_9` = 1)


statement ok
DELETE FROM `table_2` WHERE (`column_9` = 2)


statement ok
DELETE FROM `table_2` WHERE (`column_9` = 3)


statement ok
DELETE FROM `table_2` WHERE (`column_9` = 4)


statement ok
DELETE FROM `table_3` WHERE (`column_3` = 0)


statement ok
DELETE FROM `table_3` WHERE (`column_3` = 1)


statement ok
DELETE FROM `table_3` WHERE (`column_3` = 2)


statement ok
DELETE FROM `table_3` WHERE (`column_3` = 3)


statement ok
DELETE FROM `table_3` WHERE (`column_3` = 4)


statement ok
DELETE FROM `table_5` WHERE (`column_3` = 0)


statement ok
DELETE FROM `table_5` WHERE (`column_3` = 1)


statement ok
DELETE FROM `table_5` WHERE (`column_3` = 2)


statement ok
DELETE FROM `table_5` WHERE (`column_3` = 3)


statement ok
DELETE FROM `table_5` WHERE (`column_3` = 4)


statement ok
DELETE FROM `table_4` WHERE (`column_3` = 0)


statement ok
DELETE FROM `table_4` WHERE (`column_3` = 1)


statement ok
DELETE FROM `table_4` WHERE (`column_3` = 2)


statement ok
DELETE FROM `table_4` WHERE (`column_3` = 3)


statement ok
DELETE FROM `table_4` WHERE (`column_3` = 4)


statement ok
DELETE FROM `table_1` WHERE (`column_3` = 0)


statement ok
DELETE FROM `table_1` WHERE (`column_3` = 1)


statement ok
DELETE FROM `table_1` WHERE (`column_3` = 2)


statement ok
DELETE FROM `table_1` WHERE (`column_3` = 3)


statement ok
DELETE FROM `table_1` WHERE (`column_3` = 4)


query  rowsort
SELECT min(`table_1`.`column_1`) AS `alias_1` FROM `table_1`
----
-1949082652

query  rowsort
SELECT `table_1`.`column_2` AS `alias_1`, `table_2`.`column_2` AS `alias_2` FROM `table_1` LEFT JOIN `table_2` ON (`table_1`.`column_1` = `table_2`.`column_1`)
----
-1814133971
NULL
-2047174703
NULL
-623803766
NULL
-890925888
NULL
630604990
NULL

query  rowsort
SELECT `table_2`.`column_1` AS `alias_1` FROM `table_2` WHERE (`table_2`.`column_1` > ?)
? = 10
----
445180620
447409844
50685154
672342349

query  rowsort
SELECT min(`table_2`.`column_3`) AS `alias_1`, `table_2`.`column_4` AS `alias_2`, `table_3`.`column_2` AS `alias_3` FROM `table_2` LEFT JOIN `table_3` ON (`table_2`.`column_3` = `table_3`.`column_1`) GROUP BY `table_2`.`column_4`, `table_3`.`column_2`
----
-433337343
767116005
NULL
1125468729
-587998596
NULL
1518549207
1786512743
NULL
266416002
2059847999
NULL
812770898
-74687555
NULL

query  rowsort
SELECT min(`table_2`.`column_5`) AS `alias_1` FROM `table_2` WHERE (`table_2`.`column_5` > ?)
? = 10
----
318970435

query  rowsort
SELECT `table_2`.`column_6` AS `alias_1`, `table_4`.`column_2` AS `alias_2` FROM `table_2` LEFT JOIN `table_4` ON (`table_2`.`column_5` = `table_4`.`column_1`) WHERE (`table_2`.`column_5` > ?)
? = 10
----
-1635993511
NULL
-799100192
NULL
1531075555
NULL
916037147
NULL

query  rowsort
SELECT min(`table_2`.`column_7`) AS `alias_1`, `table_2`.`column_8` AS `alias_2`, `table_5`.`column_2` AS `alias_3` FROM `table_2` LEFT JOIN `table_5` ON (`table_2`.`column_7` = `table_5`.`column_1`) WHERE (`table_2`.`column_5` > ?) GROUP BY `table_2`.`column_8`, `table_5`.`column_2`
? = 10
----
-500749273
-1012627079
NULL
1445539209
-1774751040
NULL
1780337653
-1366251479
NULL
1921271673
5954157
NULL
