# Generated by:
#     target/debug/noria-logictest permute --compare-to mysql://root:noria@127.1/noria -d 3 -o logictests/generated/mysql/ --only range_param --random --include-deletes --rows-per-table 10 --subquery-depth 1 --overwrite-tests

statement ok
CREATE TABLE `table_1` (`column_5` INT, `column_4` INT, `column_7` INT, `column_8` INT, `column_6` INT, `column_1` INT, `column_9` INT, `column_3` INT, `column_2` INT, PRIMARY KEY (`column_9`))


statement ok
INSERT INTO `table_1` (`column_5`, `column_4`, `column_7`, `column_8`, `column_6`, `column_1`, `column_9`, `column_3`, `column_2`) VALUES (799148013, 1776940255, -379712987, -1438271374, 591869991, -691499292, 0, 1057417484, -839953723), (1092001151, -584871342, 563848164, 171985163, -2057146287, -640598482, 1, 869696059, -208735989), (109046431, 1306081057, 1517302837, 405663093, 515117430, -1993079526, 2, -942775372, 1177260433), (-1994801169, 255881297, -607636703, 1229873991, -830414704, -1720820425, 3, -89120994, -639489531), (2137988258, 191116647, -1446162895, 1218537725, -511415993, -1912346196, 4, 39637147, 126485904), (-1728830910, 59766068, 248106942, 1974315226, 333286620, 160450247, 5, -860934524, -1622879298), (-1029895487, -1634582216, 853266007, 1772208057, -1936406289, -1134522308, 6, -85161782, -95406572), (-1502421720, -1811094467, -1051444869, 1943028415, -808861153, -1727203266, 7, -1343715986, -315451626), (-1703487874, 1436461283, -1127786194, -1199960359, 851108215, 1660462157, 8, -2001099619, -1415228750), (-1834081647, 1913115761, -1105098973, 180656625, -1517142577, 342654423, 9, -1165343186, 353625718)


query  rowsort
SELECT min(`table_1`.`column_1`) AS `alias_1` FROM `table_1`
----
-1993079526

query  rowsort
SELECT sum(`table_1`.`column_2`) AS `alias_1` FROM `table_1`
----
-3479773434

query  rowsort
SELECT `table_1`.`column_1` AS `alias_1` FROM `table_1` WHERE (`table_1`.`column_1` > ?)
? = 10
----
160450247
1660462157
342654423

query  rowsort
SELECT min(`table_1`.`column_3`) AS `alias_1`, sum(`table_1`.`column_4`) AS `alias_2` FROM `table_1`
----
-2001099619
2908814343

query  rowsort
SELECT min(`table_1`.`column_5`) AS `alias_1` FROM `table_1` WHERE (`table_1`.`column_5` > ?)
? = 10
----
109046431

query  rowsort
SELECT sum(`table_1`.`column_6`) AS `alias_1` FROM `table_1` WHERE (`table_1`.`column_5` > ?)
? = 10
----
-1461574859

query  rowsort
SELECT min(`table_1`.`column_7`) AS `alias_1`, sum(`table_1`.`column_8`) AS `alias_2` FROM `table_1` WHERE (`table_1`.`column_5` > ?)
? = 10
----
-1446162895
357914607

statement ok
DELETE FROM `table_1` WHERE (`column_9` = 0)


statement ok
DELETE FROM `table_1` WHERE (`column_9` = 1)


statement ok
DELETE FROM `table_1` WHERE (`column_9` = 2)


statement ok
DELETE FROM `table_1` WHERE (`column_9` = 3)


statement ok
DELETE FROM `table_1` WHERE (`column_9` = 4)


query  rowsort
SELECT min(`table_1`.`column_1`) AS `alias_1` FROM `table_1`
----
-1727203266

query  rowsort
SELECT sum(`table_1`.`column_2`) AS `alias_1` FROM `table_1`
----
-3095340528

query  rowsort
SELECT `table_1`.`column_1` AS `alias_1` FROM `table_1` WHERE (`table_1`.`column_1` > ?)
? = 10
----
160450247
1660462157
342654423

query  rowsort
SELECT min(`table_1`.`column_3`) AS `alias_1`, sum(`table_1`.`column_4`) AS `alias_2` FROM `table_1`
----
-2001099619
-36333571

query  rowsort
SELECT min(`table_1`.`column_5`) AS `alias_1` FROM `table_1` WHERE (`table_1`.`column_5` > ?)
? = 10
----
NULL

query  rowsort
SELECT sum(`table_1`.`column_6`) AS `alias_1` FROM `table_1` WHERE (`table_1`.`column_5` > ?)
? = 10
----
NULL

query  rowsort
SELECT min(`table_1`.`column_7`) AS `alias_1`, sum(`table_1`.`column_8`) AS `alias_2` FROM `table_1` WHERE (`table_1`.`column_5` > ?)
? = 10
----
NULL
NULL
