# Generated by:
#     target/debug/noria-logictest permute --compare-to mysql://root:noria@127.1/noria -d 3 -o logictests/generated/mysql/ --only range_param --random --include-deletes --rows-per-table 10 --subquery-depth 1 --overwrite-tests

statement ok
CREATE TABLE `table_1` (`column_1` INT, `column_4` INT, `column_2` INT, `column_5` INT, `column_3` INT, PRIMARY KEY (`column_5`))


statement ok
INSERT INTO `table_1` (`column_1`, `column_4`, `column_2`, `column_5`, `column_3`) VALUES (-1488988884, 1970948214, -867566722, 0, -432811849), (-192724801, 1530712808, 442885901, 1, -352857882), (793451973, 1898084391, 995460378, 2, -1985125362), (-614357899, -15263140, -476706344, 3, 1045797560), (457306660, 263013167, 2046291059, 4, -1987551430), (2103168085, 1048564076, -233621781, 5, -441753982), (-1913233860, -801192534, 2087993928, 6, -1849256123), (1629204342, 2129637254, 1627197954, 7, 912388560), (718975429, -400612642, -1710628276, 8, -106751640), (1121738250, 576022878, 1879597271, 9, -1571398336)


query  rowsort
SELECT min(`table_1`.`column_1`) AS `alias_1` FROM `table_1`
----
-1913233860

query  rowsort
SELECT 1 AS `alias_1`
----
1

query  rowsort
SELECT `table_1`.`column_1` AS `alias_1` FROM `table_1` WHERE (`table_1`.`column_1` > ?)
? = 10
----
1121738250
1629204342
2103168085
457306660
718975429
793451973

query  rowsort
SELECT min(`table_1`.`column_2`) AS `alias_1`, 1 AS `alias_2` FROM `table_1`
----
-1710628276
1

query  rowsort
SELECT min(`table_1`.`column_3`) AS `alias_1` FROM `table_1` WHERE (`table_1`.`column_1` > ?)
? = 10
----
-1987551430

query  rowsort
SELECT 1 AS `alias_1` FROM `table_1` WHERE (`table_1`.`column_1` > ?)
? = 10
----
1
1
1
1
1
1

query  rowsort
SELECT min(`table_1`.`column_4`) AS `alias_1`, 1 AS `alias_2` FROM `table_1` WHERE (`table_1`.`column_1` > ?)
? = 10
----
-400612642
1

statement ok
DELETE FROM `table_1` WHERE (`column_5` = 0)


statement ok
DELETE FROM `table_1` WHERE (`column_5` = 1)


statement ok
DELETE FROM `table_1` WHERE (`column_5` = 2)


statement ok
DELETE FROM `table_1` WHERE (`column_5` = 3)


statement ok
DELETE FROM `table_1` WHERE (`column_5` = 4)


query  rowsort
SELECT min(`table_1`.`column_1`) AS `alias_1` FROM `table_1`
----
-1913233860

query  rowsort
SELECT 1 AS `alias_1`
----
1

query  rowsort
SELECT `table_1`.`column_1` AS `alias_1` FROM `table_1` WHERE (`table_1`.`column_1` > ?)
? = 10
----
1121738250
1629204342
2103168085
718975429

query  rowsort
SELECT min(`table_1`.`column_2`) AS `alias_1`, 1 AS `alias_2` FROM `table_1`
----
-1710628276
1

query  rowsort
SELECT min(`table_1`.`column_3`) AS `alias_1` FROM `table_1` WHERE (`table_1`.`column_1` > ?)
? = 10
----
-1571398336

query  rowsort
SELECT 1 AS `alias_1` FROM `table_1` WHERE (`table_1`.`column_1` > ?)
? = 10
----
1
1
1
1

query  rowsort
SELECT min(`table_1`.`column_4`) AS `alias_1`, 1 AS `alias_2` FROM `table_1` WHERE (`table_1`.`column_1` > ?)
? = 10
----
-400612642
1
