# Generated by:
#     target/debug/noria-logictest permute --compare-to mysql://root:noria@127.1/noria -d 3 -o logictests/generated/mysql/ --only range_param --random --include-deletes --rows-per-table 10 --subquery-depth 1 --overwrite-tests

statement ok
CREATE TABLE `table_1` (`column_3` INT, `column_4` INT, `column_1` INT, `column_2` INT, `column_8` INT, `column_6` INT, `column_9` INT, `column_5` INT, `column_7` INT, PRIMARY KEY (`column_9`))


statement ok
INSERT INTO `table_1` (`column_3`, `column_4`, `column_1`, `column_2`, `column_8`, `column_6`, `column_9`, `column_5`, `column_7`) VALUES (-905321834, 1433687714, 1407011923, -1157510195, 870522207, -1734444875, 0, 1493921459, -1551159581), (125492408, -609222395, -294490914, -386132413, -1255240863, -108785409, 1, -1131833397, 624865584), (1143701960, -1209353765, -158670601, -792795578, 322548225, -2001757259, 2, -402722525, 1499070742), (-2106375571, 278324105, 2114962816, 912369404, -1165439069, 1658436935, 3, -13497219, 541100633), (-958181957, -1887656087, -1502160763, 1134332517, 108610534, 1624884532, 4, 1375270769, 995138836), (302673766, -1863726219, -1860470981, 696991922, -1215935491, 1419448091, 5, -1776521404, 953257987), (-329257096, -2011420861, 963661496, -1950696170, 640991909, -1759544876, 6, -1109221819, 461150300), (-1760273667, 2141221762, 70046917, -623170022, 794776524, 1512471360, 7, -882435489, -1101782936), (422704620, -2050656024, 1668799005, -124826400, -642797670, 1541445057, 8, -856588541, -2003949057), (1109255638, -1883246373, 1546643398, 1957367177, 1992025832, -73021677, 9, -1733809551, 1916353774)


query  rowsort
SELECT min(`table_1`.`column_1`) AS `alias_1` FROM `table_1`
----
-1860470981

query  rowsort
SELECT count(distinct `table_1`.`column_2`) AS `alias_1` FROM `table_1`
----
10

query  rowsort
SELECT `table_1`.`column_1` AS `alias_1` FROM `table_1` WHERE (`table_1`.`column_1` > ?)
? = 10
----
1407011923
1546643398
1668799005
2114962816
70046917
963661496

query  rowsort
SELECT min(`table_1`.`column_3`) AS `alias_1`, count(distinct `table_1`.`column_4`) AS `alias_2` FROM `table_1`
----
-2106375571
10

query  rowsort
SELECT min(`table_1`.`column_5`) AS `alias_1` FROM `table_1` WHERE (`table_1`.`column_3` > ?)
? = 10
----
-1776521404

query  rowsort
SELECT count(distinct `table_1`.`column_6`) AS `alias_1` FROM `table_1` WHERE (`table_1`.`column_3` > ?)
? = 10
----
5

query  rowsort
SELECT min(`table_1`.`column_7`) AS `alias_1`, count(distinct `table_1`.`column_8`) AS `alias_2` FROM `table_1` WHERE (`table_1`.`column_3` > ?)
? = 10
----
-2003949057
5

statement ok
DELETE FROM `table_1` WHERE (`column_9` = 0)


statement ok
DELETE FROM `table_1` WHERE (`column_9` = 1)


statement ok
DELETE FROM `table_1` WHERE (`column_9` = 2)


statement ok
DELETE FROM `table_1` WHERE (`column_9` = 3)


statement ok
DELETE FROM `table_1` WHERE (`column_9` = 4)


query  rowsort
SELECT min(`table_1`.`column_1`) AS `alias_1` FROM `table_1`
----
-1860470981

query  rowsort
SELECT count(distinct `table_1`.`column_2`) AS `alias_1` FROM `table_1`
----
5

query  rowsort
SELECT `table_1`.`column_1` AS `alias_1` FROM `table_1` WHERE (`table_1`.`column_1` > ?)
? = 10
----
1546643398
1668799005
70046917
963661496

query  rowsort
SELECT min(`table_1`.`column_3`) AS `alias_1`, count(distinct `table_1`.`column_4`) AS `alias_2` FROM `table_1`
----
-1760273667
5

query  rowsort
SELECT min(`table_1`.`column_5`) AS `alias_1` FROM `table_1` WHERE (`table_1`.`column_3` > ?)
? = 10
----
-1776521404

query  rowsort
SELECT count(distinct `table_1`.`column_6`) AS `alias_1` FROM `table_1` WHERE (`table_1`.`column_3` > ?)
? = 10
----
3

query  rowsort
SELECT min(`table_1`.`column_7`) AS `alias_1`, count(distinct `table_1`.`column_8`) AS `alias_2` FROM `table_1` WHERE (`table_1`.`column_3` > ?)
? = 10
----
-2003949057
3
