# Generated by:
#     target/debug/noria-logictest permute --compare-to mysql://root:noria@127.1/noria -d 3 -o logictests/generated/mysql/ --only range_param --random --include-deletes --rows-per-table 10 --subquery-depth 1

statement ok
CREATE TABLE `table_1` (`column_1` INT, `column_4` INT, `column_2` INT, `column_3` INT, `column_5` INT, `column_6` INT, PRIMARY KEY (`column_6`))


statement ok
INSERT INTO `table_1` (`column_1`, `column_4`, `column_2`, `column_3`, `column_5`, `column_6`) VALUES (1085444458, 303872422, -914532832, 957230761, -1250383181, 0), (1533250437, 1055828342, 834428283, -892853935, 1463615328, 1), (1810855301, -1885605590, 508067691, -318473110, -2000464232, 2), (-1903920366, -47177047, -1735368469, -1407910586, -613998679, 3), (-471899370, -1887367272, -224523595, -1994565848, 1955801279, 4), (1545789257, 1211460095, 986764594, 1624823612, -991993847, 5), (-1104501203, 120799118, -639502500, -1409115260, -539132865, 6), (-1176529880, -1416990693, 1760467963, 375341701, -1645320212, 7), (-581154538, 505042475, -1377547466, -2070350623, 701521346, 8), (-1745669228, -6661381, -476260991, 1545173060, -1087703612, 9)


query  rowsort
SELECT `table_1`.`column_1` AS `alias_1` FROM `table_1` WHERE ((`table_1`.`column_1` > ?) AND (`table_1`.`column_1` > ?))
? = 10
? = 10
----
1085444458
1533250437
1545789257
1810855301

query  rowsort
SELECT min(`table_1`.`column_2`) AS `alias_1` FROM `table_1`
----
-1735368469

query  rowsort
SELECT `table_1`.`column_1` AS `alias_1` FROM `table_1` WHERE (`table_1`.`column_1` > ?)
? = 10
----
1085444458
1533250437
1545789257
1810855301

query  rowsort
SELECT min(`table_1`.`column_3`) AS `alias_1` FROM `table_1` WHERE ((`table_1`.`column_1` > ?) AND (`table_1`.`column_1` > ?))
? = 10
? = 10
----
-892853935

query  rowsort
SELECT `table_1`.`column_3` AS `alias_1` FROM `table_1` WHERE (((`table_1`.`column_3` > ?) AND (`table_1`.`column_3` > ?)) AND (`table_1`.`column_3` > ?))
? = 10
? = 10
? = 10
----
1545173060
1624823612
375341701
957230761

query  rowsort
SELECT min(`table_1`.`column_4`) AS `alias_1` FROM `table_1` WHERE (`table_1`.`column_1` > ?)
? = 10
----
-1885605590

query  rowsort
SELECT min(`table_1`.`column_5`) AS `alias_1` FROM `table_1` WHERE (((`table_1`.`column_1` > ?) AND (`table_1`.`column_1` > ?)) AND (`table_1`.`column_1` > ?))
? = 10
? = 10
? = 10
----
-2000464232

statement ok
DELETE FROM `table_1` WHERE (`column_6` = 0)


statement ok
DELETE FROM `table_1` WHERE (`column_6` = 1)


statement ok
DELETE FROM `table_1` WHERE (`column_6` = 2)


statement ok
DELETE FROM `table_1` WHERE (`column_6` = 3)


statement ok
DELETE FROM `table_1` WHERE (`column_6` = 4)


query  rowsort
SELECT `table_1`.`column_1` AS `alias_1` FROM `table_1` WHERE ((`table_1`.`column_1` > ?) AND (`table_1`.`column_1` > ?))
? = 10
? = 10
----
1545789257

query  rowsort
SELECT min(`table_1`.`column_2`) AS `alias_1` FROM `table_1`
----
-1377547466

query  rowsort
SELECT `table_1`.`column_1` AS `alias_1` FROM `table_1` WHERE (`table_1`.`column_1` > ?)
? = 10
----
1545789257

query  rowsort
SELECT min(`table_1`.`column_3`) AS `alias_1` FROM `table_1` WHERE ((`table_1`.`column_1` > ?) AND (`table_1`.`column_1` > ?))
? = 10
? = 10
----
1624823612

query  rowsort
SELECT `table_1`.`column_3` AS `alias_1` FROM `table_1` WHERE (((`table_1`.`column_3` > ?) AND (`table_1`.`column_3` > ?)) AND (`table_1`.`column_3` > ?))
? = 10
? = 10
? = 10
----
1545173060
1624823612
375341701

query  rowsort
SELECT min(`table_1`.`column_4`) AS `alias_1` FROM `table_1` WHERE (`table_1`.`column_1` > ?)
? = 10
----
1211460095

query  rowsort
SELECT min(`table_1`.`column_5`) AS `alias_1` FROM `table_1` WHERE (((`table_1`.`column_1` > ?) AND (`table_1`.`column_1` > ?)) AND (`table_1`.`column_1` > ?))
? = 10
? = 10
? = 10
----
-991993847
