# Generated by:
#     target/debug/noria-logictest permute --compare-to mysql://root:noria@127.1/noria -d 3 -o logictests/generated/mysql/ --only range_param --random --include-deletes --rows-per-table 10 --subquery-depth 1

statement ok
CREATE TABLE `table_1` (`column_2` INT, `column_1` INT, PRIMARY KEY (`column_2`))


statement ok
INSERT INTO `table_1` (`column_2`, `column_1`) VALUES (0, 730294767), (1, 1792949458), (2, -1153553788), (3, -1787823948), (4, -908738145), (5, -754695564), (6, -1378816814), (7, 2059396507), (8, -418474361), (9, -1905105854)


query  rowsort
SELECT `table_1`.`column_1` AS `alias_1` FROM `table_1` WHERE ((`table_1`.`column_1` > ?) AND (`table_1`.`column_1` > ?))
? = 10
? = 10
----
1792949458
2059396507
730294767

query  nosort
SELECT `table_1`.`column_1` AS `alias_1` FROM `table_1` ORDER BY `table_1`.`column_1` ASC LIMIT 10
----
-1905105854
-1787823948
-1378816814
-1153553788
-908738145
-754695564
-418474361
730294767
1792949458
2059396507

query  nosort
SELECT `table_1`.`column_1` AS `alias_1` FROM `table_1` ORDER BY `table_1`.`column_1` DESC LIMIT 10
----
2059396507
1792949458
730294767
-418474361
-754695564
-908738145
-1153553788
-1378816814
-1787823948
-1905105854

query  rowsort
SELECT `table_1`.`column_1` AS `alias_1` FROM `table_1` WHERE (`table_1`.`column_1` > ?)
? = 10
----
1792949458
2059396507
730294767

query  nosort
SELECT `table_1`.`column_1` AS `alias_1` FROM `table_1` WHERE ((`table_1`.`column_1` > ?) AND (`table_1`.`column_1` > ?)) ORDER BY `table_1`.`column_1` ASC LIMIT 10
? = 10
? = 10
----
730294767
1792949458
2059396507

query  nosort
SELECT `table_1`.`column_1` AS `alias_1` FROM `table_1` WHERE ((`table_1`.`column_1` > ?) AND (`table_1`.`column_1` > ?)) ORDER BY `table_1`.`column_1` DESC LIMIT 10
? = 10
? = 10
----
2059396507
1792949458
730294767

query  rowsort
SELECT `table_1`.`column_1` AS `alias_1` FROM `table_1` WHERE (((`table_1`.`column_1` > ?) AND (`table_1`.`column_1` > ?)) AND (`table_1`.`column_1` > ?))
? = 10
? = 10
? = 10
----
1792949458
2059396507
730294767

query  nosort
SELECT `table_1`.`column_1` AS `alias_1` FROM `table_1` ORDER BY `table_1`.`column_1` DESC LIMIT 10
----
2059396507
1792949458
730294767
-418474361
-754695564
-908738145
-1153553788
-1378816814
-1787823948
-1905105854

query  nosort
SELECT `table_1`.`column_1` AS `alias_1` FROM `table_1` WHERE (`table_1`.`column_1` > ?) ORDER BY `table_1`.`column_1` ASC LIMIT 10
? = 10
----
730294767
1792949458
2059396507

query  nosort
SELECT `table_1`.`column_1` AS `alias_1` FROM `table_1` WHERE (`table_1`.`column_1` > ?) ORDER BY `table_1`.`column_1` DESC LIMIT 10
? = 10
----
2059396507
1792949458
730294767

query  nosort
SELECT `table_1`.`column_1` AS `alias_1` FROM `table_1` WHERE ((`table_1`.`column_1` > ?) AND (`table_1`.`column_1` > ?)) ORDER BY `table_1`.`column_1` DESC LIMIT 10
? = 10
? = 10
----
2059396507
1792949458
730294767

query  nosort
SELECT `table_1`.`column_1` AS `alias_1` FROM `table_1` WHERE (((`table_1`.`column_1` > ?) AND (`table_1`.`column_1` > ?)) AND (`table_1`.`column_1` > ?)) ORDER BY `table_1`.`column_1` ASC LIMIT 10
? = 10
? = 10
? = 10
----
730294767
1792949458
2059396507

query  nosort
SELECT `table_1`.`column_1` AS `alias_1` FROM `table_1` WHERE (((`table_1`.`column_1` > ?) AND (`table_1`.`column_1` > ?)) AND (`table_1`.`column_1` > ?)) ORDER BY `table_1`.`column_1` DESC LIMIT 10
? = 10
? = 10
? = 10
----
2059396507
1792949458
730294767

query  nosort
SELECT `table_1`.`column_1` AS `alias_1` FROM `table_1` WHERE (`table_1`.`column_1` > ?) ORDER BY `table_1`.`column_1` DESC LIMIT 10
? = 10
----
2059396507
1792949458
730294767

query  nosort
SELECT `table_1`.`column_1` AS `alias_1` FROM `table_1` WHERE (((`table_1`.`column_1` > ?) AND (`table_1`.`column_1` > ?)) AND (`table_1`.`column_1` > ?)) ORDER BY `table_1`.`column_1` DESC LIMIT 10
? = 10
? = 10
? = 10
----
2059396507
1792949458
730294767

statement ok
DELETE FROM `table_1` WHERE (`column_2` = 0)


statement ok
DELETE FROM `table_1` WHERE (`column_2` = 1)


statement ok
DELETE FROM `table_1` WHERE (`column_2` = 2)


statement ok
DELETE FROM `table_1` WHERE (`column_2` = 3)


statement ok
DELETE FROM `table_1` WHERE (`column_2` = 4)


query  rowsort
SELECT `table_1`.`column_1` AS `alias_1` FROM `table_1` WHERE ((`table_1`.`column_1` > ?) AND (`table_1`.`column_1` > ?))
? = 10
? = 10
----
2059396507

query  nosort
SELECT `table_1`.`column_1` AS `alias_1` FROM `table_1` ORDER BY `table_1`.`column_1` ASC LIMIT 10
----
-1905105854
-1378816814
-754695564
-418474361
2059396507

query  nosort
SELECT `table_1`.`column_1` AS `alias_1` FROM `table_1` ORDER BY `table_1`.`column_1` DESC LIMIT 10
----
2059396507
-418474361
-754695564
-1378816814
-1905105854

query  rowsort
SELECT `table_1`.`column_1` AS `alias_1` FROM `table_1` WHERE (`table_1`.`column_1` > ?)
? = 10
----
2059396507

query  nosort
SELECT `table_1`.`column_1` AS `alias_1` FROM `table_1` WHERE ((`table_1`.`column_1` > ?) AND (`table_1`.`column_1` > ?)) ORDER BY `table_1`.`column_1` ASC LIMIT 10
? = 10
? = 10
----
2059396507

query  nosort
SELECT `table_1`.`column_1` AS `alias_1` FROM `table_1` WHERE ((`table_1`.`column_1` > ?) AND (`table_1`.`column_1` > ?)) ORDER BY `table_1`.`column_1` DESC LIMIT 10
? = 10
? = 10
----
2059396507

query  rowsort
SELECT `table_1`.`column_1` AS `alias_1` FROM `table_1` WHERE (((`table_1`.`column_1` > ?) AND (`table_1`.`column_1` > ?)) AND (`table_1`.`column_1` > ?))
? = 10
? = 10
? = 10
----
2059396507

query  nosort
SELECT `table_1`.`column_1` AS `alias_1` FROM `table_1` ORDER BY `table_1`.`column_1` DESC LIMIT 10
----
2059396507
-418474361
-754695564
-1378816814
-1905105854

query  nosort
SELECT `table_1`.`column_1` AS `alias_1` FROM `table_1` WHERE (`table_1`.`column_1` > ?) ORDER BY `table_1`.`column_1` ASC LIMIT 10
? = 10
----
2059396507

query  nosort
SELECT `table_1`.`column_1` AS `alias_1` FROM `table_1` WHERE (`table_1`.`column_1` > ?) ORDER BY `table_1`.`column_1` DESC LIMIT 10
? = 10
----
2059396507

query  nosort
SELECT `table_1`.`column_1` AS `alias_1` FROM `table_1` WHERE ((`table_1`.`column_1` > ?) AND (`table_1`.`column_1` > ?)) ORDER BY `table_1`.`column_1` DESC LIMIT 10
? = 10
? = 10
----
2059396507

query  nosort
SELECT `table_1`.`column_1` AS `alias_1` FROM `table_1` WHERE (((`table_1`.`column_1` > ?) AND (`table_1`.`column_1` > ?)) AND (`table_1`.`column_1` > ?)) ORDER BY `table_1`.`column_1` ASC LIMIT 10
? = 10
? = 10
? = 10
----
2059396507

query  nosort
SELECT `table_1`.`column_1` AS `alias_1` FROM `table_1` WHERE (((`table_1`.`column_1` > ?) AND (`table_1`.`column_1` > ?)) AND (`table_1`.`column_1` > ?)) ORDER BY `table_1`.`column_1` DESC LIMIT 10
? = 10
? = 10
? = 10
----
2059396507

query  nosort
SELECT `table_1`.`column_1` AS `alias_1` FROM `table_1` WHERE (`table_1`.`column_1` > ?) ORDER BY `table_1`.`column_1` DESC LIMIT 10
? = 10
----
2059396507

query  nosort
SELECT `table_1`.`column_1` AS `alias_1` FROM `table_1` WHERE (((`table_1`.`column_1` > ?) AND (`table_1`.`column_1` > ?)) AND (`table_1`.`column_1` > ?)) ORDER BY `table_1`.`column_1` DESC LIMIT 10
? = 10
? = 10
? = 10
----
2059396507
