# Generated by:
#     target/debug/noria-logictest permute --compare-to mysql://root:noria@127.1/noria -d 3 -o logictests/generated/mysql/ --only range_param --random --include-deletes --rows-per-table 10 --subquery-depth 1

statement ok
CREATE TABLE `table_1` (`column_3` INT, `column_6` INT, `column_5` INT, `column_2` INT, `column_1` INT, `column_4` INT, PRIMARY KEY (`column_6`))


statement ok
INSERT INTO `table_1` (`column_3`, `column_6`, `column_5`, `column_2`, `column_1`, `column_4`) VALUES (1258824715, 0, -438664843, 705352838, -914031564, 325861388), (422100003, 1, -12915379, -1001268591, 1408226058, -2136818940), (-341886740, 2, 1764849681, 240382967, -443572057, 608585969), (380779705, 3, -988637002, -736974029, -380588526, 1717405522), (1934764906, 4, -1307049485, -47995485, 2120575808, 501103538), (-1540575091, 5, 1305407572, 1405919343, 1308882496, 238506837), (-785052068, 6, 45650545, -1152382908, 1997051744, 570372674), (202987626, 7, 480817534, 1588003728, 689928246, -1754490613), (790996976, 8, 174917180, 533727518, 920355634, -1425738215), (-572828226, 9, -388186610, -450863698, -1375122672, 1835582022)


query  rowsort
SELECT `table_1`.`column_1` AS `alias_1` FROM `table_1` WHERE ((`table_1`.`column_1` = ?) AND (`table_1`.`column_1` = ?))
? = 1
? = 1
----


query  rowsort
SELECT max(`table_1`.`column_2`) AS `alias_1` FROM `table_1`
----
1588003728

query  rowsort
SELECT `table_1`.`column_1` AS `alias_1` FROM `table_1` WHERE (`table_1`.`column_1` > ?)
? = 10
----
1308882496
1408226058
1997051744
2120575808
689928246
920355634

query  rowsort
SELECT max(`table_1`.`column_3`) AS `alias_1` FROM `table_1` WHERE ((`table_1`.`column_1` = ?) AND (`table_1`.`column_1` = ?))
? = 1
? = 1
----
NULL

query  rowsort
SELECT `table_1`.`column_3` AS `alias_1` FROM `table_1` WHERE (((`table_1`.`column_3` = ?) AND (`table_1`.`column_3` = ?)) AND (`table_1`.`column_3` > ?))
? = 1
? = 1
? = 10
----


query  rowsort
SELECT max(`table_1`.`column_4`) AS `alias_1` FROM `table_1` WHERE (`table_1`.`column_3` > ?)
? = 10
----
1717405522

query  rowsort
SELECT max(`table_1`.`column_5`) AS `alias_1` FROM `table_1` WHERE (((`table_1`.`column_3` = ?) AND (`table_1`.`column_3` = ?)) AND (`table_1`.`column_3` > ?))
? = 1
? = 1
? = 10
----
NULL

statement ok
DELETE FROM `table_1` WHERE (`column_6` = 0)


statement ok
DELETE FROM `table_1` WHERE (`column_6` = 1)


statement ok
DELETE FROM `table_1` WHERE (`column_6` = 2)


statement ok
DELETE FROM `table_1` WHERE (`column_6` = 3)


statement ok
DELETE FROM `table_1` WHERE (`column_6` = 4)


query  rowsort
SELECT `table_1`.`column_1` AS `alias_1` FROM `table_1` WHERE ((`table_1`.`column_1` = ?) AND (`table_1`.`column_1` = ?))
? = 1
? = 1
----


query  rowsort
SELECT max(`table_1`.`column_2`) AS `alias_1` FROM `table_1`
----
1588003728

query  rowsort
SELECT `table_1`.`column_1` AS `alias_1` FROM `table_1` WHERE (`table_1`.`column_1` > ?)
? = 10
----
1308882496
1997051744
689928246
920355634

query  rowsort
SELECT max(`table_1`.`column_3`) AS `alias_1` FROM `table_1` WHERE ((`table_1`.`column_1` = ?) AND (`table_1`.`column_1` = ?))
? = 1
? = 1
----
NULL

query  rowsort
SELECT `table_1`.`column_3` AS `alias_1` FROM `table_1` WHERE (((`table_1`.`column_3` = ?) AND (`table_1`.`column_3` = ?)) AND (`table_1`.`column_3` > ?))
? = 1
? = 1
? = 10
----


query  rowsort
SELECT max(`table_1`.`column_4`) AS `alias_1` FROM `table_1` WHERE (`table_1`.`column_3` > ?)
? = 10
----
-1425738215

query  rowsort
SELECT max(`table_1`.`column_5`) AS `alias_1` FROM `table_1` WHERE (((`table_1`.`column_3` = ?) AND (`table_1`.`column_3` = ?)) AND (`table_1`.`column_3` > ?))
? = 1
? = 1
? = 10
----
NULL
