# Generated by:
#     target/debug/noria-logictest permute --compare-to mysql://root:noria@127.1/noria -d 3 -o logictests/generated/mysql/ --only range_param --random --include-deletes --rows-per-table 10 --subquery-depth 1

statement ok
CREATE TABLE `table_1` (`column_2` INT, `column_5` INT, `column_1` INT, `column_4` INT, `column_6` INT, `column_3` INT, PRIMARY KEY (`column_6`))


statement ok
INSERT INTO `table_1` (`column_2`, `column_5`, `column_1`, `column_4`, `column_6`, `column_3`) VALUES (90782434, -1945224111, -217937625, 114576522, 0, -1896224599), (-1124828853, -2098030248, -794173689, 1329281507, 1, 115317017), (-2047542692, -434099056, 728912753, -977916924, 2, -231405857), (1282911912, 94797712, 103357726, 2089301123, 3, 1611253380), (-2014755626, 1388796, -958652592, 1580813195, 4, -1671108395), (-724348533, 639357107, 274149529, 2050753490, 5, 562780021), (1731687273, -854082360, -1604073887, -969373413, 6, -1239844826), (1410315825, 426934120, -1987521468, -1060355489, 7, 1325263127), (-1863631193, 862966338, -1822123935, -1143511389, 8, 1920503704), (1747512013, 1338393347, -1798500485, 941168915, 9, -76543222)


query  rowsort
SELECT `table_1`.`column_1` AS `alias_1` FROM `table_1` WHERE ((`table_1`.`column_1` = ?) AND (`table_1`.`column_1` = ?))
? = 1
? = 1
----


query  rowsort
SELECT count(`table_1`.`column_2`) AS `alias_1` FROM `table_1`
----
10

query  rowsort
SELECT `table_1`.`column_2` AS `alias_1` FROM `table_1` WHERE (`table_1`.`column_2` > ?)
? = 10
----
1282911912
1410315825
1731687273
1747512013
90782434

query  rowsort
SELECT count(`table_1`.`column_3`) AS `alias_1` FROM `table_1` WHERE ((`table_1`.`column_2` = ?) AND (`table_1`.`column_2` = ?))
? = 1
? = 1
----
0

query  rowsort
SELECT `table_1`.`column_2` AS `alias_1` FROM `table_1` WHERE (((`table_1`.`column_2` = ?) AND (`table_1`.`column_2` = ?)) AND (`table_1`.`column_2` > ?))
? = 1
? = 1
? = 10
----


query  rowsort
SELECT count(`table_1`.`column_4`) AS `alias_1` FROM `table_1` WHERE (`table_1`.`column_2` > ?)
? = 10
----
5

query  rowsort
SELECT count(`table_1`.`column_5`) AS `alias_1` FROM `table_1` WHERE (((`table_1`.`column_2` = ?) AND (`table_1`.`column_2` = ?)) AND (`table_1`.`column_2` > ?))
? = 1
? = 1
? = 10
----
0

statement ok
DELETE FROM `table_1` WHERE (`column_6` = 0)


statement ok
DELETE FROM `table_1` WHERE (`column_6` = 1)


statement ok
DELETE FROM `table_1` WHERE (`column_6` = 2)


statement ok
DELETE FROM `table_1` WHERE (`column_6` = 3)


statement ok
DELETE FROM `table_1` WHERE (`column_6` = 4)


query  rowsort
SELECT `table_1`.`column_1` AS `alias_1` FROM `table_1` WHERE ((`table_1`.`column_1` = ?) AND (`table_1`.`column_1` = ?))
? = 1
? = 1
----


query  rowsort
SELECT count(`table_1`.`column_2`) AS `alias_1` FROM `table_1`
----
5

query  rowsort
SELECT `table_1`.`column_2` AS `alias_1` FROM `table_1` WHERE (`table_1`.`column_2` > ?)
? = 10
----
1410315825
1731687273
1747512013

query  rowsort
SELECT count(`table_1`.`column_3`) AS `alias_1` FROM `table_1` WHERE ((`table_1`.`column_2` = ?) AND (`table_1`.`column_2` = ?))
? = 1
? = 1
----
0

query  rowsort
SELECT `table_1`.`column_2` AS `alias_1` FROM `table_1` WHERE (((`table_1`.`column_2` = ?) AND (`table_1`.`column_2` = ?)) AND (`table_1`.`column_2` > ?))
? = 1
? = 1
? = 10
----


query  rowsort
SELECT count(`table_1`.`column_4`) AS `alias_1` FROM `table_1` WHERE (`table_1`.`column_2` > ?)
? = 10
----
3

query  rowsort
SELECT count(`table_1`.`column_5`) AS `alias_1` FROM `table_1` WHERE (((`table_1`.`column_2` = ?) AND (`table_1`.`column_2` = ?)) AND (`table_1`.`column_2` > ?))
? = 1
? = 1
? = 10
----
0
