# Generated by:
#     target/debug/noria-logictest permute --compare-to mysql://root:noria@127.1/noria -d 3 -o logictests/generated/mysql/ --only range_param --random --include-deletes --rows-per-table 10 --subquery-depth 1

statement ok
CREATE TABLE `table_1` (`column_1` INT, `column_6` INT, `column_4` INT, `column_3` INT, `column_5` INT, `column_2` INT, PRIMARY KEY (`column_6`))


statement ok
INSERT INTO `table_1` (`column_1`, `column_6`, `column_4`, `column_3`, `column_5`, `column_2`) VALUES (1759343752, 0, 1299307611, 519277028, 2119451431, -1560726295), (983238482, 1, -1186511163, 1139654748, -722026156, -604999886), (186989305, 2, -1743298518, -2063773631, -642516483, 1812838584), (1774487327, 3, -1294746149, -1384694343, 1758673055, 1998314833), (-736177490, 4, 530762952, 1575667310, 690355383, -1191581547), (-823431410, 5, -1537212397, 1313980507, 224374974, 1600080279), (2091561231, 6, -2048475114, 1059662431, 1270828476, -1274349030), (479230470, 7, 255792275, 1859153805, 663242175, 893199553), (1208309293, 8, -2060954491, 1252518681, 2090898584, -1955120470), (1048717463, 9, -909146063, -1616479169, 793522182, -1730934941)


query  rowsort
SELECT `table_1`.`column_1` AS `alias_1` FROM `table_1` WHERE ((`table_1`.`column_1` = ?) AND (`table_1`.`column_1` = ?))
? = 1
? = 1
----


query  rowsort
SELECT count(distinct `table_1`.`column_2`) AS `alias_1` FROM `table_1`
----
10

query  rowsort
SELECT `table_1`.`column_2` AS `alias_1` FROM `table_1` WHERE (`table_1`.`column_2` > ?)
? = 10
----
1600080279
1812838584
1998314833
893199553

query  rowsort
SELECT count(distinct `table_1`.`column_3`) AS `alias_1` FROM `table_1` WHERE ((`table_1`.`column_2` = ?) AND (`table_1`.`column_2` = ?))
? = 1
? = 1
----
0

query  rowsort
SELECT `table_1`.`column_2` AS `alias_1` FROM `table_1` WHERE (((`table_1`.`column_2` = ?) AND (`table_1`.`column_2` = ?)) AND (`table_1`.`column_2` > ?))
? = 1
? = 1
? = 10
----


query  rowsort
SELECT count(distinct `table_1`.`column_4`) AS `alias_1` FROM `table_1` WHERE (`table_1`.`column_1` > ?)
? = 10
----
8

query  rowsort
SELECT count(distinct `table_1`.`column_5`) AS `alias_1` FROM `table_1` WHERE (((`table_1`.`column_1` = ?) AND (`table_1`.`column_1` = ?)) AND (`table_1`.`column_1` > ?))
? = 1
? = 1
? = 10
----
0

statement ok
DELETE FROM `table_1` WHERE (`column_6` = 0)


statement ok
DELETE FROM `table_1` WHERE (`column_6` = 1)


statement ok
DELETE FROM `table_1` WHERE (`column_6` = 2)


statement ok
DELETE FROM `table_1` WHERE (`column_6` = 3)


statement ok
DELETE FROM `table_1` WHERE (`column_6` = 4)


query  rowsort
SELECT `table_1`.`column_1` AS `alias_1` FROM `table_1` WHERE ((`table_1`.`column_1` = ?) AND (`table_1`.`column_1` = ?))
? = 1
? = 1
----


query  rowsort
SELECT count(distinct `table_1`.`column_2`) AS `alias_1` FROM `table_1`
----
5

query  rowsort
SELECT `table_1`.`column_2` AS `alias_1` FROM `table_1` WHERE (`table_1`.`column_2` > ?)
? = 10
----
1600080279
893199553

query  rowsort
SELECT count(distinct `table_1`.`column_3`) AS `alias_1` FROM `table_1` WHERE ((`table_1`.`column_2` = ?) AND (`table_1`.`column_2` = ?))
? = 1
? = 1
----
0

query  rowsort
SELECT `table_1`.`column_2` AS `alias_1` FROM `table_1` WHERE (((`table_1`.`column_2` = ?) AND (`table_1`.`column_2` = ?)) AND (`table_1`.`column_2` > ?))
? = 1
? = 1
? = 10
----


query  rowsort
SELECT count(distinct `table_1`.`column_4`) AS `alias_1` FROM `table_1` WHERE (`table_1`.`column_1` > ?)
? = 10
----
4

query  rowsort
SELECT count(distinct `table_1`.`column_5`) AS `alias_1` FROM `table_1` WHERE (((`table_1`.`column_1` = ?) AND (`table_1`.`column_1` = ?)) AND (`table_1`.`column_1` > ?))
? = 1
? = 1
? = 10
----
0
