# Generated by:
#     target/debug/noria-logictest permute --compare-to mysql://root:noria@127.1/noria -d 3 -o logictests/generated/mysql/ --only range_param --random --include-deletes --rows-per-table 10 --subquery-depth 1

statement ok
CREATE TABLE `table_4` (`column_2` INT, `column_4` INT, `column_1` INT, `column_3` INT, PRIMARY KEY (`column_4`))


statement ok
CREATE TABLE `table_3` (`column_3` INT, `column_1` INT, `column_2` INT, PRIMARY KEY (`column_3`))


statement ok
CREATE TABLE `table_2` (`column_5` INT, `column_3` INT, `column_1` INT, `column_4` INT, `column_2` INT, PRIMARY KEY (`column_5`))


statement ok
CREATE TABLE `table_1` (`column_2` INT, `column_1` INT, `column_3` INT, PRIMARY KEY (`column_3`))


statement ok
CREATE TABLE `table_5` (`column_3` INT, `column_1` INT, `column_2` INT, PRIMARY KEY (`column_3`))


statement ok
INSERT INTO `table_4` (`column_2`, `column_4`, `column_1`, `column_3`) VALUES (-556618767, 0, -2096060629, -787156233), (448437965, 1, 1586527552, 1245744462), (102423702, 2, 1470146243, 906839072), (2033455023, 3, -1962505372, 786080087), (-107376938, 4, 403688265, 1427495921), (-2066466605, 5, -1372001455, -1089118246), (399284621, 6, -734789166, -1153534565), (1551309516, 7, 1638717753, -1717987370), (234636124, 8, 1593749449, -1516500399), (-1309271038, 9, -1641007482, -803906092)


statement ok
INSERT INTO `table_3` (`column_3`, `column_1`, `column_2`) VALUES (0, 1908385196, 1640955978), (1, -940222313, 1441538952), (2, 1692457325, 1985540957), (3, -1449465461, 518431242), (4, 885218114, -584357564), (5, -1690536542, 1928531925), (6, -448431550, 1335249982), (7, 1227094245, 353732701), (8, 1804665665, -787284697), (9, 1029741307, 1799355108)


statement ok
INSERT INTO `table_2` (`column_5`, `column_3`, `column_1`, `column_4`, `column_2`) VALUES (0, -1974257926, 441183676, 1078971199, 548860334), (1, 941178850, -874644604, -205774626, -1340867393), (2, 205778587, -988547366, 273465298, -135629876), (3, 632792882, 1527916759, 407764727, -1440088307), (4, 594500531, -1749675840, -947462317, 896938364), (5, -432572492, -977282885, -902451203, -1036654298), (6, -27985713, 1128907618, -1464603399, 1253077917), (7, 1479727604, 1784339039, -889315922, 1407106983), (8, 1323976896, 1078301226, -737332610, 633182429), (9, -1931347275, -449525784, -1486311276, 803542838)


statement ok
INSERT INTO `table_1` (`column_2`, `column_1`, `column_3`) VALUES (-1227388281, -1358195594, 0), (-880322167, -1739043799, 1), (1602043525, 2037153824, 2), (2135476722, 1557078790, 3), (1943128817, 949304228, 4), (-1973004151, 82016946, 5), (1515605900, 1933622069, 6), (734292752, -982615244, 7), (1791568766, 2022131238, 8), (1554204859, 148113714, 9)


statement ok
INSERT INTO `table_5` (`column_3`, `column_1`, `column_2`) VALUES (0, -705559419, 310877861), (1, -260640441, 1071178797), (2, -1906794636, -219421058), (3, 1050027271, 887228728), (4, -466355312, -497278393), (5, 976638088, -201291264), (6, -1720994731, 765740540), (7, -2005085229, -1603580250), (8, -2116654854, -987534405), (9, -61358861, -1179451199)


query  rowsort
SELECT `table_1`.`column_1` AS `alias_1` FROM `table_1` WHERE ((`table_1`.`column_1` = ?) AND (`table_1`.`column_1` = ?))
? = 1
? = 1
----


query  rowsort
SELECT `table_1`.`column_2` AS `alias_1`, `table_2`.`column_2` AS `alias_2` FROM `table_1` INNER JOIN `table_2` ON (`table_1`.`column_1` = `table_2`.`column_1`)
----


query  rowsort
SELECT `table_2`.`column_1` AS `alias_1` FROM `table_2` WHERE (`table_2`.`column_1` > ?)
? = 10
----
1078301226
1128907618
1527916759
1784339039
441183676

query  rowsort
SELECT `table_2`.`column_3` AS `alias_1`, `table_3`.`column_2` AS `alias_2` FROM `table_2` INNER JOIN `table_3` ON (`table_2`.`column_1` = `table_3`.`column_1`) WHERE ((`table_2`.`column_1` = ?) AND (`table_2`.`column_1` = ?))
? = 1
? = 1
----


query  rowsort
SELECT `table_2`.`column_3` AS `alias_1` FROM `table_2` WHERE (((`table_2`.`column_3` = ?) AND (`table_2`.`column_3` = ?)) AND (`table_2`.`column_3` > ?))
? = 1
? = 1
? = 10
----


query  rowsort
SELECT `table_2`.`column_4` AS `alias_1`, `table_4`.`column_2` AS `alias_2` FROM `table_2` INNER JOIN `table_4` ON (`table_2`.`column_3` = `table_4`.`column_1`) WHERE (`table_2`.`column_3` > ?)
? = 10
----


query  rowsort
SELECT `table_4`.`column_3` AS `alias_1`, `table_5`.`column_2` AS `alias_2` FROM `table_4` INNER JOIN `table_5` ON (`table_4`.`column_2` = `table_5`.`column_1`) WHERE (((`table_4`.`column_2` = ?) AND (`table_4`.`column_2` = ?)) AND (`table_4`.`column_2` > ?))
? = 1
? = 1
? = 10
----


statement ok
DELETE FROM `table_4` WHERE (`column_4` = 0)


statement ok
DELETE FROM `table_4` WHERE (`column_4` = 1)


statement ok
DELETE FROM `table_4` WHERE (`column_4` = 2)


statement ok
DELETE FROM `table_4` WHERE (`column_4` = 3)


statement ok
DELETE FROM `table_4` WHERE (`column_4` = 4)


statement ok
DELETE FROM `table_3` WHERE (`column_3` = 0)


statement ok
DELETE FROM `table_3` WHERE (`column_3` = 1)


statement ok
DELETE FROM `table_3` WHERE (`column_3` = 2)


statement ok
DELETE FROM `table_3` WHERE (`column_3` = 3)


statement ok
DELETE FROM `table_3` WHERE (`column_3` = 4)


statement ok
DELETE FROM `table_2` WHERE (`column_5` = 0)


statement ok
DELETE FROM `table_2` WHERE (`column_5` = 1)


statement ok
DELETE FROM `table_2` WHERE (`column_5` = 2)


statement ok
DELETE FROM `table_2` WHERE (`column_5` = 3)


statement ok
DELETE FROM `table_2` WHERE (`column_5` = 4)


statement ok
DELETE FROM `table_1` WHERE (`column_3` = 0)


statement ok
DELETE FROM `table_1` WHERE (`column_3` = 1)


statement ok
DELETE FROM `table_1` WHERE (`column_3` = 2)


statement ok
DELETE FROM `table_1` WHERE (`column_3` = 3)


statement ok
DELETE FROM `table_1` WHERE (`column_3` = 4)


statement ok
DELETE FROM `table_5` WHERE (`column_3` = 0)


statement ok
DELETE FROM `table_5` WHERE (`column_3` = 1)


statement ok
DELETE FROM `table_5` WHERE (`column_3` = 2)


statement ok
DELETE FROM `table_5` WHERE (`column_3` = 3)


statement ok
DELETE FROM `table_5` WHERE (`column_3` = 4)


query  rowsort
SELECT `table_1`.`column_1` AS `alias_1` FROM `table_1` WHERE ((`table_1`.`column_1` = ?) AND (`table_1`.`column_1` = ?))
? = 1
? = 1
----


query  rowsort
SELECT `table_1`.`column_2` AS `alias_1`, `table_2`.`column_2` AS `alias_2` FROM `table_1` INNER JOIN `table_2` ON (`table_1`.`column_1` = `table_2`.`column_1`)
----


query  rowsort
SELECT `table_2`.`column_1` AS `alias_1` FROM `table_2` WHERE (`table_2`.`column_1` > ?)
? = 10
----
1078301226
1128907618
1784339039

query  rowsort
SELECT `table_2`.`column_3` AS `alias_1`, `table_3`.`column_2` AS `alias_2` FROM `table_2` INNER JOIN `table_3` ON (`table_2`.`column_1` = `table_3`.`column_1`) WHERE ((`table_2`.`column_1` = ?) AND (`table_2`.`column_1` = ?))
? = 1
? = 1
----


query  rowsort
SELECT `table_2`.`column_3` AS `alias_1` FROM `table_2` WHERE (((`table_2`.`column_3` = ?) AND (`table_2`.`column_3` = ?)) AND (`table_2`.`column_3` > ?))
? = 1
? = 1
? = 10
----


query  rowsort
SELECT `table_2`.`column_4` AS `alias_1`, `table_4`.`column_2` AS `alias_2` FROM `table_2` INNER JOIN `table_4` ON (`table_2`.`column_3` = `table_4`.`column_1`) WHERE (`table_2`.`column_3` > ?)
? = 10
----


query  rowsort
SELECT `table_4`.`column_3` AS `alias_1`, `table_5`.`column_2` AS `alias_2` FROM `table_4` INNER JOIN `table_5` ON (`table_4`.`column_2` = `table_5`.`column_1`) WHERE (((`table_4`.`column_2` = ?) AND (`table_4`.`column_2` = ?)) AND (`table_4`.`column_2` > ?))
? = 1
? = 1
? = 10
----

