# Generated by:
#     target/debug/noria-logictest permute --compare-to mysql://root:noria@127.1/noria -d 3 -o logictests/generated/mysql/ --only range_param --random --include-deletes --rows-per-table 10 --subquery-depth 1

statement ok
CREATE TABLE `table_3` (`column_5` INT, `column_3` INT, `column_1` INT, `column_4` INT, `column_2` INT, PRIMARY KEY (`column_5`))


statement ok
CREATE TABLE `table_1` (`column_3` INT, `column_2` INT, `column_1` INT, `column_4` INT, PRIMARY KEY (`column_4`))


statement ok
CREATE TABLE `table_2` (`column_1` INT, `column_3` INT, `column_2` INT, PRIMARY KEY (`column_3`))


statement ok
CREATE TABLE `table_4` (`column_2` INT, `column_1` INT, `column_3` INT, PRIMARY KEY (`column_3`))


statement ok
CREATE TABLE `table_5` (`column_1` INT, `column_2` INT, `column_3` INT, PRIMARY KEY (`column_3`))


statement ok
INSERT INTO `table_3` (`column_5`, `column_3`, `column_1`, `column_4`, `column_2`) VALUES (0, -441534736, -301417208, -923441790, -1327622858), (1, 1662808082, -1126621529, 828872438, -2004358231), (2, 2094735978, 869761743, 159378362, 458178390), (3, 1945641085, -1785435252, -1193591922, 546191492), (4, -963711886, -881733617, -794990021, -1307979076), (5, 1969839950, -1927381926, -617669322, 421285670), (6, -936117314, 473314121, 1978598096, -292127431), (7, 1719886416, -131027464, 78040048, 870702126), (8, -861547810, 1812438084, 1051337982, 275693219), (9, 361054742, -672313002, 1294051427, 562430667)


statement ok
INSERT INTO `table_1` (`column_3`, `column_2`, `column_1`, `column_4`) VALUES (-1766354755, -1793637383, -1812307571, 0), (-1032836619, 607466507, 1181904491, 1), (565538965, -904263311, 948345650, 2), (-17837430, 1794659357, 2107212246, 3), (-1362959307, -1685904052, -1503667004, 4), (225524860, 1932359167, 762695554, 5), (1909770481, -1918369355, 1354825501, 6), (-1200835792, 2063032187, -1388413955, 7), (1165105848, 294139441, 1254170451, 8), (-754819498, 2107578587, 685232785, 9)


statement ok
INSERT INTO `table_2` (`column_1`, `column_3`, `column_2`) VALUES (-160415438, 0, 827944307), (45155151, 1, -1893462645), (1198662953, 2, -1410361005), (-962646616, 3, 889025598), (-1254864553, 4, 1907352444), (1286119819, 5, 949820343), (2050337352, 6, 725304961), (-1456861685, 7, -1621906300), (1801750619, 8, -1427307058), (-1835302892, 9, -1690442021)


statement ok
INSERT INTO `table_4` (`column_2`, `column_1`, `column_3`) VALUES (1664414853, 1505985398, 0), (-1893712718, 436793116, 1), (-1051310289, -1176889792, 2), (221667331, 1545075716, 3), (-733367316, 1945016686, 4), (910627242, 417035660, 5), (-2123056257, 1626091361, 6), (1579695715, 819368199, 7), (1600473541, -841120239, 8), (553848136, -129803597, 9)


statement ok
INSERT INTO `table_5` (`column_1`, `column_2`, `column_3`) VALUES (935779217, 1763288096, 0), (2096189835, 824202230, 1), (306529902, -1456664509, 2), (-1793881952, 209392439, 3), (1778964168, -1694032182, 4), (-295003118, 485176627, 5), (2063427138, -2122603894, 6), (-2094460922, 717300891, 7), (639557421, -1084348686, 8), (-29359001, -1034230425, 9)


query  rowsort
SELECT `table_1`.`column_1` AS `alias_1` FROM `table_1` WHERE ((`table_1`.`column_1` = ?) AND (`table_1`.`column_1` = ?))
? = 1
? = 1
----


query  rowsort
SELECT `table_1`.`column_2` AS `alias_1`, `table_2`.`column_2` AS `alias_2` FROM `table_1` LEFT JOIN `table_2` ON (`table_1`.`column_1` = `table_2`.`column_1`)
----
-1685904052
NULL
-1793637383
NULL
-1918369355
NULL
-904263311
NULL
1794659357
NULL
1932359167
NULL
2063032187
NULL
2107578587
NULL
294139441
NULL
607466507
NULL

query  rowsort
SELECT `table_1`.`column_2` AS `alias_1` FROM `table_1` WHERE (`table_1`.`column_2` > ?)
? = 10
----
1794659357
1932359167
2063032187
2107578587
294139441
607466507

query  rowsort
SELECT `table_1`.`column_3` AS `alias_1`, `table_3`.`column_2` AS `alias_2` FROM `table_1` LEFT JOIN `table_3` ON (`table_1`.`column_2` = `table_3`.`column_1`) WHERE ((`table_1`.`column_2` = ?) AND (`table_1`.`column_2` = ?))
? = 1
? = 1
----


query  rowsort
SELECT `table_3`.`column_1` AS `alias_1` FROM `table_3` WHERE (((`table_3`.`column_1` = ?) AND (`table_3`.`column_1` = ?)) AND (`table_3`.`column_1` > ?))
? = 1
? = 1
? = 10
----


query  rowsort
SELECT `table_3`.`column_3` AS `alias_1`, `table_4`.`column_2` AS `alias_2` FROM `table_3` LEFT JOIN `table_4` ON (`table_3`.`column_1` = `table_4`.`column_1`) WHERE (`table_3`.`column_3` > ?)
? = 10
----
1662808082
NULL
1719886416
NULL
1945641085
NULL
1969839950
NULL
2094735978
NULL
361054742
NULL

query  rowsort
SELECT `table_3`.`column_4` AS `alias_1`, `table_5`.`column_2` AS `alias_2` FROM `table_3` LEFT JOIN `table_5` ON (`table_3`.`column_3` = `table_5`.`column_1`) WHERE (((`table_3`.`column_3` = ?) AND (`table_3`.`column_3` = ?)) AND (`table_3`.`column_3` > ?))
? = 1
? = 1
? = 10
----


statement ok
DELETE FROM `table_3` WHERE (`column_5` = 0)


statement ok
DELETE FROM `table_3` WHERE (`column_5` = 1)


statement ok
DELETE FROM `table_3` WHERE (`column_5` = 2)


statement ok
DELETE FROM `table_3` WHERE (`column_5` = 3)


statement ok
DELETE FROM `table_3` WHERE (`column_5` = 4)


statement ok
DELETE FROM `table_1` WHERE (`column_4` = 0)


statement ok
DELETE FROM `table_1` WHERE (`column_4` = 1)


statement ok
DELETE FROM `table_1` WHERE (`column_4` = 2)


statement ok
DELETE FROM `table_1` WHERE (`column_4` = 3)


statement ok
DELETE FROM `table_1` WHERE (`column_4` = 4)


statement ok
DELETE FROM `table_2` WHERE (`column_3` = 0)


statement ok
DELETE FROM `table_2` WHERE (`column_3` = 1)


statement ok
DELETE FROM `table_2` WHERE (`column_3` = 2)


statement ok
DELETE FROM `table_2` WHERE (`column_3` = 3)


statement ok
DELETE FROM `table_2` WHERE (`column_3` = 4)


statement ok
DELETE FROM `table_4` WHERE (`column_3` = 0)


statement ok
DELETE FROM `table_4` WHERE (`column_3` = 1)


statement ok
DELETE FROM `table_4` WHERE (`column_3` = 2)


statement ok
DELETE FROM `table_4` WHERE (`column_3` = 3)


statement ok
DELETE FROM `table_4` WHERE (`column_3` = 4)


statement ok
DELETE FROM `table_5` WHERE (`column_3` = 0)


statement ok
DELETE FROM `table_5` WHERE (`column_3` = 1)


statement ok
DELETE FROM `table_5` WHERE (`column_3` = 2)


statement ok
DELETE FROM `table_5` WHERE (`column_3` = 3)


statement ok
DELETE FROM `table_5` WHERE (`column_3` = 4)


query  rowsort
SELECT `table_1`.`column_1` AS `alias_1` FROM `table_1` WHERE ((`table_1`.`column_1` = ?) AND (`table_1`.`column_1` = ?))
? = 1
? = 1
----


query  rowsort
SELECT `table_1`.`column_2` AS `alias_1`, `table_2`.`column_2` AS `alias_2` FROM `table_1` LEFT JOIN `table_2` ON (`table_1`.`column_1` = `table_2`.`column_1`)
----
-1918369355
NULL
1932359167
NULL
2063032187
NULL
2107578587
NULL
294139441
NULL

query  rowsort
SELECT `table_1`.`column_2` AS `alias_1` FROM `table_1` WHERE (`table_1`.`column_2` > ?)
? = 10
----
1932359167
2063032187
2107578587
294139441

query  rowsort
SELECT `table_1`.`column_3` AS `alias_1`, `table_3`.`column_2` AS `alias_2` FROM `table_1` LEFT JOIN `table_3` ON (`table_1`.`column_2` = `table_3`.`column_1`) WHERE ((`table_1`.`column_2` = ?) AND (`table_1`.`column_2` = ?))
? = 1
? = 1
----


query  rowsort
SELECT `table_3`.`column_1` AS `alias_1` FROM `table_3` WHERE (((`table_3`.`column_1` = ?) AND (`table_3`.`column_1` = ?)) AND (`table_3`.`column_1` > ?))
? = 1
? = 1
? = 10
----


query  rowsort
SELECT `table_3`.`column_3` AS `alias_1`, `table_4`.`column_2` AS `alias_2` FROM `table_3` LEFT JOIN `table_4` ON (`table_3`.`column_1` = `table_4`.`column_1`) WHERE (`table_3`.`column_3` > ?)
? = 10
----
1719886416
NULL
1969839950
NULL
361054742
NULL

query  rowsort
SELECT `table_3`.`column_4` AS `alias_1`, `table_5`.`column_2` AS `alias_2` FROM `table_3` LEFT JOIN `table_5` ON (`table_3`.`column_3` = `table_5`.`column_1`) WHERE (((`table_3`.`column_3` = ?) AND (`table_3`.`column_3` = ?)) AND (`table_3`.`column_3` > ?))
? = 1
? = 1
? = 10
----

