# Generated by:
#     target/debug/noria-logictest permute --compare-to mysql://root:noria@127.1/noria -d 3 -o logictests/generated/mysql/ --only range_param --random --include-deletes --rows-per-table 10 --subquery-depth 1

statement ok
CREATE TABLE `table_1` (`column_3` INT, `column_5` INT, `column_1` INT, `column_4` INT, `column_6` INT, `column_2` INT, PRIMARY KEY (`column_6`))


statement ok
INSERT INTO `table_1` (`column_3`, `column_5`, `column_1`, `column_4`, `column_6`, `column_2`) VALUES (-1369262663, 1094478695, -2075290042, 964598676, 0, -82544123), (-1540429752, -1989443304, -358152810, -1066794938, 1, 243683348), (-2001214425, 284929755, -1915516262, -721365408, 2, -113151893), (1026195300, 1513777704, -1176164248, 322379354, 3, -861855657), (1932265246, -1902987777, 1441047245, 421920272, 4, -578367543), (-80214272, 702016213, 1788848312, 1044705768, 5, -1292726064), (821035884, 1246342999, -845873293, -1308411421, 6, -1065412618), (1265323210, 2007215052, -1274515479, 269190371, 7, 2046686118), (40667432, 1223135423, 672450175, -1233590147, 8, 111230823), (802528709, 2125650905, 1064637623, -796371351, 9, 776996057)


query  rowsort
SELECT `table_1`.`column_1` AS `alias_1` FROM `table_1` WHERE ((`table_1`.`column_1` = ?) AND (`table_1`.`column_1` = ?))
? = 1
? = 1
----


query  rowsort
SELECT sum(`table_1`.`column_2`) AS `alias_1` FROM `table_1`
----
-815461552

query  rowsort
SELECT `table_1`.`column_2` AS `alias_1` FROM `table_1` WHERE (`table_1`.`column_2` > ?)
? = 10
----
111230823
2046686118
243683348
776996057

query  rowsort
SELECT sum(`table_1`.`column_3`) AS `alias_1` FROM `table_1` WHERE ((`table_1`.`column_2` = ?) AND (`table_1`.`column_2` = ?))
? = 1
? = 1
----
NULL

query  rowsort
SELECT `table_1`.`column_2` AS `alias_1` FROM `table_1` WHERE (((`table_1`.`column_2` = ?) AND (`table_1`.`column_2` = ?)) AND (`table_1`.`column_2` > ?))
? = 1
? = 1
? = 10
----


query  rowsort
SELECT sum(`table_1`.`column_4`) AS `alias_1` FROM `table_1` WHERE (`table_1`.`column_3` > ?)
? = 10
----
-2324882922

query  rowsort
SELECT sum(`table_1`.`column_5`) AS `alias_1` FROM `table_1` WHERE (((`table_1`.`column_3` = ?) AND (`table_1`.`column_3` = ?)) AND (`table_1`.`column_3` > ?))
? = 1
? = 1
? = 10
----
NULL

statement ok
DELETE FROM `table_1` WHERE (`column_6` = 0)


statement ok
DELETE FROM `table_1` WHERE (`column_6` = 1)


statement ok
DELETE FROM `table_1` WHERE (`column_6` = 2)


statement ok
DELETE FROM `table_1` WHERE (`column_6` = 3)


statement ok
DELETE FROM `table_1` WHERE (`column_6` = 4)


query  rowsort
SELECT `table_1`.`column_1` AS `alias_1` FROM `table_1` WHERE ((`table_1`.`column_1` = ?) AND (`table_1`.`column_1` = ?))
? = 1
? = 1
----


query  rowsort
SELECT sum(`table_1`.`column_2`) AS `alias_1` FROM `table_1`
----
576774316

query  rowsort
SELECT `table_1`.`column_2` AS `alias_1` FROM `table_1` WHERE (`table_1`.`column_2` > ?)
? = 10
----
111230823
2046686118
776996057

query  rowsort
SELECT sum(`table_1`.`column_3`) AS `alias_1` FROM `table_1` WHERE ((`table_1`.`column_2` = ?) AND (`table_1`.`column_2` = ?))
? = 1
? = 1
----
NULL

query  rowsort
SELECT `table_1`.`column_2` AS `alias_1` FROM `table_1` WHERE (((`table_1`.`column_2` = ?) AND (`table_1`.`column_2` = ?)) AND (`table_1`.`column_2` > ?))
? = 1
? = 1
? = 10
----


query  rowsort
SELECT sum(`table_1`.`column_4`) AS `alias_1` FROM `table_1` WHERE (`table_1`.`column_3` > ?)
? = 10
----
-3069182548

query  rowsort
SELECT sum(`table_1`.`column_5`) AS `alias_1` FROM `table_1` WHERE (((`table_1`.`column_3` = ?) AND (`table_1`.`column_3` = ?)) AND (`table_1`.`column_3` > ?))
? = 1
? = 1
? = 10
----
NULL
