# Generated by:
#     target/debug/noria-logictest permute --compare-to mysql://root:noria@127.1/noria -d 3 -o logictests/generated/mysql/ --only range_param --random --include-deletes --rows-per-table 10 --subquery-depth 1

statement ok
CREATE TABLE `table_1` (`column_2` INT, `column_5` INT, `column_4` INT, `column_6` INT, `column_3` INT, `column_1` INT, PRIMARY KEY (`column_6`))


statement ok
CREATE TABLE `table_4` (`column_1` INT, `column_2` INT, `column_3` INT, PRIMARY KEY (`column_3`))


statement ok
CREATE TABLE `table_3` (`column_3` INT, `column_1` INT, `column_2` INT, PRIMARY KEY (`column_3`))


statement ok
CREATE TABLE `table_5` (`column_3` INT, `column_1` INT, `column_2` INT, PRIMARY KEY (`column_3`))


statement ok
CREATE TABLE `table_2` (`column_2` INT, `column_3` INT, `column_1` INT, PRIMARY KEY (`column_3`))


statement ok
INSERT INTO `table_1` (`column_2`, `column_5`, `column_4`, `column_6`, `column_3`, `column_1`) VALUES (1026591606, -963478525, 557602664, 0, 1526288393, 356080562), (-1214688688, 1813851082, -652512296, 1, -1927209847, -1293510161), (2134682663, 12007598, 928343914, 2, 765625636, -1996001728), (-1749197198, -383117832, 1289184542, 3, 2104771002, -1919788887), (-793735345, -376344909, 875090803, 4, -1423806805, 20873675), (-1948132815, 1363083946, 725879561, 5, 1945182566, -1299043818), (-540211515, -1160378028, 438152616, 6, 1745490606, 1936830254), (1553942558, 156959964, -134444915, 7, -427368219, 25863497), (996163986, -84217259, -102395150, 8, 555622788, 1102902788), (683844637, 1424213531, -292683140, 9, -1063735280, 914417595)


statement ok
INSERT INTO `table_4` (`column_1`, `column_2`, `column_3`) VALUES (1060137819, -2087234296, 0), (1016722666, -1612487533, 1), (-966306344, 614714955, 2), (-1925100520, 1286333716, 3), (666898747, 1563376353, 4), (954832926, -763874768, 5), (-1076445618, 1352461154, 6), (1442573546, -311242003, 7), (163756768, 48323300, 8), (1046287279, 181222122, 9)


statement ok
INSERT INTO `table_3` (`column_3`, `column_1`, `column_2`) VALUES (0, -1507676633, -2086824203), (1, -1743995940, -1791116981), (2, -975699347, -1144835184), (3, 907122869, -189342453), (4, 1519649220, -1034426545), (5, 161428076, 1382565873), (6, -1583536646, 988916476), (7, 778835335, 1934002176), (8, 1852775057, 587389718), (9, -247038869, 1273742464)


statement ok
INSERT INTO `table_5` (`column_3`, `column_1`, `column_2`) VALUES (0, 1501030821, 1373525865), (1, -569080917, 953648591), (2, -443282589, -1577103061), (3, 1063119038, 1080869549), (4, -907594338, -1663989862), (5, 824233119, -672096658), (6, 1235504330, 557686644), (7, 1956019986, -524733922), (8, 2020772154, -2039948489), (9, -1301863121, 1555474551)


statement ok
INSERT INTO `table_2` (`column_2`, `column_3`, `column_1`) VALUES (-1138410240, 0, -148888939), (-1774893210, 1, 1997324225), (-1911792644, 2, 1957396261), (-1752872323, 3, 1670857697), (-1654362950, 4, 1054988309), (-950629156, 5, 317633287), (-1890236196, 6, 1324844596), (586338917, 7, 2018328265), (-100817577, 8, -492306650), (-35759255, 9, -1502870822)


query  rowsort
SELECT `table_1`.`column_1` AS `alias_1` FROM `table_1` WHERE ((`table_1`.`column_1` > ?) AND (`table_1`.`column_1` > ?))
? = 10
? = 10
----
1102902788
1936830254
20873675
25863497
356080562
914417595

query  rowsort
SELECT `table_1`.`column_2` AS `alias_1`, `table_2`.`column_2` AS `alias_2` FROM `table_1` LEFT JOIN `table_2` ON (`table_1`.`column_1` = `table_2`.`column_1`)
----
-1214688688
NULL
-1749197198
NULL
-1948132815
NULL
-540211515
NULL
-793735345
NULL
1026591606
NULL
1553942558
NULL
2134682663
NULL
683844637
NULL
996163986
NULL

query  rowsort
SELECT `table_1`.`column_1` AS `alias_1` FROM `table_1` WHERE (`table_1`.`column_1` > ?)
? = 10
----
1102902788
1936830254
20873675
25863497
356080562
914417595

query  rowsort
SELECT `table_1`.`column_3` AS `alias_1`, `table_3`.`column_2` AS `alias_2` FROM `table_1` LEFT JOIN `table_3` ON (`table_1`.`column_1` = `table_3`.`column_1`) WHERE ((`table_1`.`column_1` > ?) AND (`table_1`.`column_1` > ?))
? = 10
? = 10
----
-1063735280
NULL
-1423806805
NULL
-427368219
NULL
1526288393
NULL
1745490606
NULL
555622788
NULL

query  rowsort
SELECT `table_1`.`column_3` AS `alias_1` FROM `table_1` WHERE (((`table_1`.`column_3` > ?) AND (`table_1`.`column_3` > ?)) AND (`table_1`.`column_3` > ?))
? = 10
? = 10
? = 10
----
1526288393
1745490606
1945182566
2104771002
555622788
765625636

query  rowsort
SELECT `table_1`.`column_4` AS `alias_1`, `table_4`.`column_2` AS `alias_2` FROM `table_1` LEFT JOIN `table_4` ON (`table_1`.`column_3` = `table_4`.`column_1`) WHERE (`table_1`.`column_2` > ?)
? = 10
----
-102395150
NULL
-134444915
NULL
-292683140
NULL
557602664
NULL
928343914
NULL

query  rowsort
SELECT `table_1`.`column_5` AS `alias_1`, `table_5`.`column_2` AS `alias_2` FROM `table_1` LEFT JOIN `table_5` ON (`table_1`.`column_2` = `table_5`.`column_1`) WHERE (((`table_1`.`column_2` > ?) AND (`table_1`.`column_2` > ?)) AND (`table_1`.`column_2` > ?))
? = 10
? = 10
? = 10
----
-84217259
NULL
-963478525
NULL
12007598
NULL
1424213531
NULL
156959964
NULL

statement ok
DELETE FROM `table_1` WHERE (`column_6` = 0)


statement ok
DELETE FROM `table_1` WHERE (`column_6` = 1)


statement ok
DELETE FROM `table_1` WHERE (`column_6` = 2)


statement ok
DELETE FROM `table_1` WHERE (`column_6` = 3)


statement ok
DELETE FROM `table_1` WHERE (`column_6` = 4)


statement ok
DELETE FROM `table_4` WHERE (`column_3` = 0)


statement ok
DELETE FROM `table_4` WHERE (`column_3` = 1)


statement ok
DELETE FROM `table_4` WHERE (`column_3` = 2)


statement ok
DELETE FROM `table_4` WHERE (`column_3` = 3)


statement ok
DELETE FROM `table_4` WHERE (`column_3` = 4)


statement ok
DELETE FROM `table_3` WHERE (`column_3` = 0)


statement ok
DELETE FROM `table_3` WHERE (`column_3` = 1)


statement ok
DELETE FROM `table_3` WHERE (`column_3` = 2)


statement ok
DELETE FROM `table_3` WHERE (`column_3` = 3)


statement ok
DELETE FROM `table_3` WHERE (`column_3` = 4)


statement ok
DELETE FROM `table_5` WHERE (`column_3` = 0)


statement ok
DELETE FROM `table_5` WHERE (`column_3` = 1)


statement ok
DELETE FROM `table_5` WHERE (`column_3` = 2)


statement ok
DELETE FROM `table_5` WHERE (`column_3` = 3)


statement ok
DELETE FROM `table_5` WHERE (`column_3` = 4)


statement ok
DELETE FROM `table_2` WHERE (`column_3` = 0)


statement ok
DELETE FROM `table_2` WHERE (`column_3` = 1)


statement ok
DELETE FROM `table_2` WHERE (`column_3` = 2)


statement ok
DELETE FROM `table_2` WHERE (`column_3` = 3)


statement ok
DELETE FROM `table_2` WHERE (`column_3` = 4)


query  rowsort
SELECT `table_1`.`column_1` AS `alias_1` FROM `table_1` WHERE ((`table_1`.`column_1` > ?) AND (`table_1`.`column_1` > ?))
? = 10
? = 10
----
1102902788
1936830254
25863497
914417595

query  rowsort
SELECT `table_1`.`column_2` AS `alias_1`, `table_2`.`column_2` AS `alias_2` FROM `table_1` LEFT JOIN `table_2` ON (`table_1`.`column_1` = `table_2`.`column_1`)
----
-1948132815
NULL
-540211515
NULL
1553942558
NULL
683844637
NULL
996163986
NULL

query  rowsort
SELECT `table_1`.`column_1` AS `alias_1` FROM `table_1` WHERE (`table_1`.`column_1` > ?)
? = 10
----
1102902788
1936830254
25863497
914417595

query  rowsort
SELECT `table_1`.`column_3` AS `alias_1`, `table_3`.`column_2` AS `alias_2` FROM `table_1` LEFT JOIN `table_3` ON (`table_1`.`column_1` = `table_3`.`column_1`) WHERE ((`table_1`.`column_1` > ?) AND (`table_1`.`column_1` > ?))
? = 10
? = 10
----
-1063735280
NULL
-427368219
NULL
1745490606
NULL
555622788
NULL

query  rowsort
SELECT `table_1`.`column_3` AS `alias_1` FROM `table_1` WHERE (((`table_1`.`column_3` > ?) AND (`table_1`.`column_3` > ?)) AND (`table_1`.`column_3` > ?))
? = 10
? = 10
? = 10
----
1745490606
1945182566
555622788

query  rowsort
SELECT `table_1`.`column_4` AS `alias_1`, `table_4`.`column_2` AS `alias_2` FROM `table_1` LEFT JOIN `table_4` ON (`table_1`.`column_3` = `table_4`.`column_1`) WHERE (`table_1`.`column_2` > ?)
? = 10
----
-102395150
NULL
-134444915
NULL
-292683140
NULL

query  rowsort
SELECT `table_1`.`column_5` AS `alias_1`, `table_5`.`column_2` AS `alias_2` FROM `table_1` LEFT JOIN `table_5` ON (`table_1`.`column_2` = `table_5`.`column_1`) WHERE (((`table_1`.`column_2` > ?) AND (`table_1`.`column_2` > ?)) AND (`table_1`.`column_2` > ?))
? = 10
? = 10
? = 10
----
-84217259
NULL
1424213531
NULL
156959964
NULL
