# Generated by:
#     target/debug/noria-logictest permute --compare-to mysql://root:noria@127.1/noria -d 3 -o logictests/generated/mysql/ --only range_param --random --include-deletes --rows-per-table 10 --subquery-depth 1

statement ok
CREATE TABLE `table_1` (`column_4` INT, `column_2` INT, `column_1` INT, `column_6` INT, `column_5` INT, `column_3` INT, PRIMARY KEY (`column_6`))


statement ok
INSERT INTO `table_1` (`column_4`, `column_2`, `column_1`, `column_6`, `column_5`, `column_3`) VALUES (-686878802, -987352191, -339126593, 0, -1237508769, 949593867), (-1116972026, -383984203, 2135613441, 1, 1630161572, -2068544187), (1914025764, 805208294, 498061040, 2, 21092091, 446111663), (528287727, -1365892219, -697928815, 3, -526139027, -1791484764), (64727839, -1868285400, 1014730852, 4, 1676613954, 516295821), (-1622293832, 1153164954, -1999804131, 5, -1072450097, -214978625), (1757936457, -1579220639, -1621719959, 6, 83338199, -754215136), (83595700, -922043444, 609877824, 7, -340016072, -1414546941), (-2117587610, 1651992159, 1519636135, 8, -1769858322, -944750392), (1172824057, 928425419, -160007531, 9, -1036625804, 428773715)


query  rowsort
SELECT `table_1`.`column_1` AS `alias_1` FROM `table_1` WHERE ((`table_1`.`column_1` > ?) AND (`table_1`.`column_1` > ?))
? = 10
? = 10
----
1014730852
1519636135
2135613441
498061040
609877824

query  rowsort
SELECT sum(`table_1`.`column_2`) AS `alias_1` FROM `table_1`
----
-2567987270

query  rowsort
SELECT `table_1`.`column_2` AS `alias_1` FROM `table_1` WHERE (`table_1`.`column_2` > ?)
? = 10
----
1153164954
1651992159
805208294
928425419

query  rowsort
SELECT sum(`table_1`.`column_3`) AS `alias_1` FROM `table_1` WHERE ((`table_1`.`column_2` > ?) AND (`table_1`.`column_2` > ?))
? = 10
? = 10
----
-284843639

query  rowsort
SELECT `table_1`.`column_3` AS `alias_1` FROM `table_1` WHERE (((`table_1`.`column_3` > ?) AND (`table_1`.`column_3` > ?)) AND (`table_1`.`column_3` > ?))
? = 10
? = 10
? = 10
----
428773715
446111663
516295821
949593867

query  rowsort
SELECT sum(`table_1`.`column_4`) AS `alias_1` FROM `table_1` WHERE (`table_1`.`column_4` > ?)
? = 10
----
5521397544

query  rowsort
SELECT sum(`table_1`.`column_5`) AS `alias_1` FROM `table_1` WHERE (((`table_1`.`column_4` > ?) AND (`table_1`.`column_4` > ?)) AND (`table_1`.`column_4` > ?))
? = 10
? = 10
? = 10
----
-121736659

statement ok
DELETE FROM `table_1` WHERE (`column_6` = 0)


statement ok
DELETE FROM `table_1` WHERE (`column_6` = 1)


statement ok
DELETE FROM `table_1` WHERE (`column_6` = 2)


statement ok
DELETE FROM `table_1` WHERE (`column_6` = 3)


statement ok
DELETE FROM `table_1` WHERE (`column_6` = 4)


query  rowsort
SELECT `table_1`.`column_1` AS `alias_1` FROM `table_1` WHERE ((`table_1`.`column_1` > ?) AND (`table_1`.`column_1` > ?))
? = 10
? = 10
----
1519636135
609877824

query  rowsort
SELECT sum(`table_1`.`column_2`) AS `alias_1` FROM `table_1`
----
1232318449

query  rowsort
SELECT `table_1`.`column_2` AS `alias_1` FROM `table_1` WHERE (`table_1`.`column_2` > ?)
? = 10
----
1153164954
1651992159
928425419

query  rowsort
SELECT sum(`table_1`.`column_3`) AS `alias_1` FROM `table_1` WHERE ((`table_1`.`column_2` > ?) AND (`table_1`.`column_2` > ?))
? = 10
? = 10
----
-730955302

query  rowsort
SELECT `table_1`.`column_3` AS `alias_1` FROM `table_1` WHERE (((`table_1`.`column_3` > ?) AND (`table_1`.`column_3` > ?)) AND (`table_1`.`column_3` > ?))
? = 10
? = 10
? = 10
----
428773715

query  rowsort
SELECT sum(`table_1`.`column_4`) AS `alias_1` FROM `table_1` WHERE (`table_1`.`column_4` > ?)
? = 10
----
3014356214

query  rowsort
SELECT sum(`table_1`.`column_5`) AS `alias_1` FROM `table_1` WHERE (((`table_1`.`column_4` > ?) AND (`table_1`.`column_4` > ?)) AND (`table_1`.`column_4` > ?))
? = 10
? = 10
? = 10
----
-1293303677
