# Generated by:
#     target/debug/noria-logictest permute --compare-to mysql://root:noria@127.1/noria -d 3 -o logictests/generated/mysql/ --only range_param --random --include-deletes --rows-per-table 10 --subquery-depth 1 --overwrite-tests

statement ok
CREATE TABLE `table_1` (`column_3` INT, `column_1` INT, `column_2` INT, PRIMARY KEY (`column_3`))


statement ok
INSERT INTO `table_1` (`column_3`, `column_1`, `column_2`) VALUES (0, 1, 1142258310), (1, -1785532911, 1322949641), (2, 1, -39735725), (3, 337281951, -2014298012), (4, 1, 2069658458), (5, 1269459462, -1425274127), (6, 1, -527420571), (7, 1125117129, 1213153359), (8, 1, -1309597231), (9, 1638810329, -156226598)


query  rowsort
SELECT `table_1`.`column_1` AS `alias_1` FROM `table_1` WHERE (`table_1`.`column_1` != `table_1`.`column_2`)
----
-1785532911
1
1
1
1
1
1125117129
1269459462
1638810329
337281951

query  rowsort
SELECT `table_1`.`column_1` AS `alias_1` FROM `table_1` WHERE (`table_1`.`column_1` != `table_1`.`column_2`)
----
-1785532911
1
1
1
1
1
1125117129
1269459462
1638810329
337281951

query  rowsort
SELECT `table_1`.`column_1` AS `alias_1` FROM `table_1` WHERE (`table_1`.`column_1` != 1)
----
-1785532911
1125117129
1269459462
1638810329
337281951

query  rowsort
SELECT `table_1`.`column_1` AS `alias_1` FROM `table_1` WHERE (`table_1`.`column_1` != 1)
----
-1785532911
1125117129
1269459462
1638810329
337281951

query  rowsort
SELECT `table_1`.`column_1` AS `alias_1` FROM `table_1` WHERE (`table_1`.`column_1` > ?)
? = 10
----
1125117129
1269459462
1638810329
337281951

query  rowsort
SELECT `table_1`.`column_1` AS `alias_1`, `table_1`.`column_1` AS `alias_2` FROM `table_1` WHERE ((`table_1`.`column_1` != `table_1`.`column_2`) OR (`table_1`.`column_1` != `table_1`.`column_2`))
----
-1785532911
-1785532911
1
1
1
1
1
1
1
1
1
1
1125117129
1125117129
1269459462
1269459462
1638810329
1638810329
337281951
337281951

query  rowsort
SELECT `table_1`.`column_1` AS `alias_1`, `table_1`.`column_1` AS `alias_2` FROM `table_1` WHERE ((`table_1`.`column_1` != `table_1`.`column_2`) AND (`table_1`.`column_1` != 1))
----
-1785532911
-1785532911
1125117129
1125117129
1269459462
1269459462
1638810329
1638810329
337281951
337281951

query  rowsort
SELECT `table_1`.`column_1` AS `alias_1`, `table_1`.`column_1` AS `alias_2` FROM `table_1` WHERE ((`table_1`.`column_1` != `table_1`.`column_2`) OR (`table_1`.`column_1` != 1))
----
-1785532911
-1785532911
1
1
1
1
1
1
1
1
1
1
1125117129
1125117129
1269459462
1269459462
1638810329
1638810329
337281951
337281951

query  rowsort
SELECT `table_1`.`column_1` AS `alias_1` FROM `table_1` WHERE ((`table_1`.`column_1` != `table_1`.`column_2`) AND (`table_1`.`column_1` > ?))
? = 10
----
1125117129
1269459462
1638810329
337281951

query  rowsort
SELECT `table_1`.`column_1` AS `alias_1`, `table_1`.`column_1` AS `alias_2` FROM `table_1` WHERE ((`table_1`.`column_1` != `table_1`.`column_2`) AND (`table_1`.`column_1` != 1))
----
-1785532911
-1785532911
1125117129
1125117129
1269459462
1269459462
1638810329
1638810329
337281951
337281951

query  rowsort
SELECT `table_1`.`column_1` AS `alias_1`, `table_1`.`column_1` AS `alias_2` FROM `table_1` WHERE ((`table_1`.`column_1` != `table_1`.`column_2`) OR (`table_1`.`column_1` != 1))
----
-1785532911
-1785532911
1
1
1
1
1
1
1
1
1
1
1125117129
1125117129
1269459462
1269459462
1638810329
1638810329
337281951
337281951

query  rowsort
SELECT `table_1`.`column_1` AS `alias_1` FROM `table_1` WHERE ((`table_1`.`column_1` != `table_1`.`column_2`) AND (`table_1`.`column_1` > ?))
? = 10
----
1125117129
1269459462
1638810329
337281951

query  rowsort
SELECT `table_1`.`column_1` AS `alias_1`, `table_1`.`column_1` AS `alias_2` FROM `table_1` WHERE ((`table_1`.`column_1` != 1) OR (`table_1`.`column_1` != 1))
----
-1785532911
-1785532911
1125117129
1125117129
1269459462
1269459462
1638810329
1638810329
337281951
337281951

query  rowsort
SELECT `table_1`.`column_1` AS `alias_1` FROM `table_1` WHERE ((`table_1`.`column_1` != 1) AND (`table_1`.`column_1` > ?))
? = 10
----
1125117129
1269459462
1638810329
337281951

query  rowsort
SELECT `table_1`.`column_1` AS `alias_1` FROM `table_1` WHERE ((`table_1`.`column_1` != 1) AND (`table_1`.`column_1` > ?))
? = 10
----
1125117129
1269459462
1638810329
337281951

query  rowsort
SELECT `table_1`.`column_1` AS `alias_1`, `table_1`.`column_1` AS `alias_2`, `table_1`.`column_1` AS `alias_3` FROM `table_1` WHERE (((`table_1`.`column_1` != `table_1`.`column_2`) OR (`table_1`.`column_1` != `table_1`.`column_2`)) AND (`table_1`.`column_1` != 1))
----
-1785532911
-1785532911
-1785532911
1125117129
1125117129
1125117129
1269459462
1269459462
1269459462
1638810329
1638810329
1638810329
337281951
337281951
337281951

query  rowsort
SELECT `table_1`.`column_1` AS `alias_1`, `table_1`.`column_1` AS `alias_2`, `table_1`.`column_1` AS `alias_3` FROM `table_1` WHERE (((`table_1`.`column_1` != `table_1`.`column_2`) OR (`table_1`.`column_1` != `table_1`.`column_2`)) OR (`table_1`.`column_1` != 1))
----
30 values hashing to 45d465e14e141846da1d4bcb423fde84

query  rowsort
SELECT `table_1`.`column_1` AS `alias_1`, `table_1`.`column_1` AS `alias_2` FROM `table_1` WHERE (((`table_1`.`column_1` != `table_1`.`column_2`) OR (`table_1`.`column_1` != `table_1`.`column_2`)) AND (`table_1`.`column_1` > ?))
? = 10
----
1125117129
1125117129
1269459462
1269459462
1638810329
1638810329
337281951
337281951

query  rowsort
SELECT `table_1`.`column_1` AS `alias_1`, `table_1`.`column_1` AS `alias_2`, `table_1`.`column_1` AS `alias_3` FROM `table_1` WHERE (((`table_1`.`column_1` != `table_1`.`column_2`) AND (`table_1`.`column_1` != 1)) OR (`table_1`.`column_1` != 1))
----
-1785532911
-1785532911
-1785532911
1125117129
1125117129
1125117129
1269459462
1269459462
1269459462
1638810329
1638810329
1638810329
337281951
337281951
337281951

query  rowsort
SELECT `table_1`.`column_1` AS `alias_1`, `table_1`.`column_1` AS `alias_2` FROM `table_1` WHERE (((`table_1`.`column_1` != `table_1`.`column_2`) AND (`table_1`.`column_1` != 1)) AND (`table_1`.`column_1` > ?))
? = 10
----
1125117129
1125117129
1269459462
1269459462
1638810329
1638810329
337281951
337281951

query  rowsort
SELECT `table_1`.`column_1` AS `alias_1`, `table_1`.`column_1` AS `alias_2` FROM `table_1` WHERE (((`table_1`.`column_1` != `table_1`.`column_2`) OR (`table_1`.`column_1` != 1)) AND (`table_1`.`column_1` > ?))
? = 10
----
1125117129
1125117129
1269459462
1269459462
1638810329
1638810329
337281951
337281951

query  rowsort
SELECT `table_1`.`column_1` AS `alias_1`, `table_1`.`column_1` AS `alias_2`, `table_1`.`column_1` AS `alias_3` FROM `table_1` WHERE (((`table_1`.`column_1` != `table_1`.`column_2`) AND (`table_1`.`column_1` != 1)) OR (`table_1`.`column_1` != 1))
----
-1785532911
-1785532911
-1785532911
1125117129
1125117129
1125117129
1269459462
1269459462
1269459462
1638810329
1638810329
1638810329
337281951
337281951
337281951

query  rowsort
SELECT `table_1`.`column_1` AS `alias_1`, `table_1`.`column_1` AS `alias_2` FROM `table_1` WHERE (((`table_1`.`column_1` != `table_1`.`column_2`) AND (`table_1`.`column_1` != 1)) AND (`table_1`.`column_1` > ?))
? = 10
----
1125117129
1125117129
1269459462
1269459462
1638810329
1638810329
337281951
337281951

query  rowsort
SELECT `table_1`.`column_1` AS `alias_1`, `table_1`.`column_1` AS `alias_2` FROM `table_1` WHERE (((`table_1`.`column_1` != `table_1`.`column_2`) OR (`table_1`.`column_1` != 1)) AND (`table_1`.`column_1` > ?))
? = 10
----
1125117129
1125117129
1269459462
1269459462
1638810329
1638810329
337281951
337281951

query  rowsort
SELECT `table_1`.`column_1` AS `alias_1`, `table_1`.`column_1` AS `alias_2` FROM `table_1` WHERE (((`table_1`.`column_1` != 1) OR (`table_1`.`column_1` != 1)) AND (`table_1`.`column_1` > ?))
? = 10
----
1125117129
1125117129
1269459462
1269459462
1638810329
1638810329
337281951
337281951

query  rowsort
SELECT `table_1`.`column_1` AS `alias_1`, `table_1`.`column_1` AS `alias_2`, `table_1`.`column_1` AS `alias_3`, `table_1`.`column_1` AS `alias_4` FROM `table_1` WHERE ((((`table_1`.`column_1` != `table_1`.`column_2`) OR (`table_1`.`column_1` != `table_1`.`column_2`)) AND (`table_1`.`column_1` != 1)) OR (`table_1`.`column_1` != 1))
----
-1785532911
-1785532911
-1785532911
-1785532911
1125117129
1125117129
1125117129
1125117129
1269459462
1269459462
1269459462
1269459462
1638810329
1638810329
1638810329
1638810329
337281951
337281951
337281951
337281951

query  rowsort
SELECT `table_1`.`column_1` AS `alias_1`, `table_1`.`column_1` AS `alias_2`, `table_1`.`column_1` AS `alias_3` FROM `table_1` WHERE ((((`table_1`.`column_1` != `table_1`.`column_2`) OR (`table_1`.`column_1` != `table_1`.`column_2`)) AND (`table_1`.`column_1` != 1)) AND (`table_1`.`column_1` > ?))
? = 10
----
1125117129
1125117129
1125117129
1269459462
1269459462
1269459462
1638810329
1638810329
1638810329
337281951
337281951
337281951

query  rowsort
SELECT `table_1`.`column_1` AS `alias_1`, `table_1`.`column_1` AS `alias_2`, `table_1`.`column_1` AS `alias_3` FROM `table_1` WHERE ((((`table_1`.`column_1` != `table_1`.`column_2`) OR (`table_1`.`column_1` != `table_1`.`column_2`)) OR (`table_1`.`column_1` != 1)) AND (`table_1`.`column_1` > ?))
? = 10
----
1125117129
1125117129
1125117129
1269459462
1269459462
1269459462
1638810329
1638810329
1638810329
337281951
337281951
337281951

query  rowsort
SELECT `table_1`.`column_1` AS `alias_1`, `table_1`.`column_1` AS `alias_2`, `table_1`.`column_1` AS `alias_3` FROM `table_1` WHERE ((((`table_1`.`column_1` != `table_1`.`column_2`) AND (`table_1`.`column_1` != 1)) OR (`table_1`.`column_1` != 1)) AND (`table_1`.`column_1` > ?))
? = 10
----
1125117129
1125117129
1125117129
1269459462
1269459462
1269459462
1638810329
1638810329
1638810329
337281951
337281951
337281951

query  rowsort
SELECT `table_1`.`column_1` AS `alias_1`, `table_1`.`column_1` AS `alias_2`, `table_1`.`column_1` AS `alias_3` FROM `table_1` WHERE ((((`table_1`.`column_1` != `table_1`.`column_2`) AND (`table_1`.`column_1` != 1)) OR (`table_1`.`column_1` != 1)) AND (`table_1`.`column_1` > ?))
? = 10
----
1125117129
1125117129
1125117129
1269459462
1269459462
1269459462
1638810329
1638810329
1638810329
337281951
337281951
337281951

query  rowsort
SELECT `table_1`.`column_1` AS `alias_1`, `table_1`.`column_1` AS `alias_2`, `table_1`.`column_1` AS `alias_3`, `table_1`.`column_1` AS `alias_4` FROM `table_1` WHERE (((((`table_1`.`column_1` != `table_1`.`column_2`) OR (`table_1`.`column_1` != `table_1`.`column_2`)) AND (`table_1`.`column_1` != 1)) OR (`table_1`.`column_1` != 1)) AND (`table_1`.`column_1` > ?))
? = 10
----
1125117129
1125117129
1125117129
1125117129
1269459462
1269459462
1269459462
1269459462
1638810329
1638810329
1638810329
1638810329
337281951
337281951
337281951
337281951

statement ok
DELETE FROM `table_1` WHERE (`column_3` = 0)


statement ok
DELETE FROM `table_1` WHERE (`column_3` = 1)


statement ok
DELETE FROM `table_1` WHERE (`column_3` = 2)


statement ok
DELETE FROM `table_1` WHERE (`column_3` = 3)


statement ok
DELETE FROM `table_1` WHERE (`column_3` = 4)


query  rowsort
SELECT `table_1`.`column_1` AS `alias_1` FROM `table_1` WHERE (`table_1`.`column_1` != `table_1`.`column_2`)
----
1
1
1125117129
1269459462
1638810329

query  rowsort
SELECT `table_1`.`column_1` AS `alias_1` FROM `table_1` WHERE (`table_1`.`column_1` != `table_1`.`column_2`)
----
1
1
1125117129
1269459462
1638810329

query  rowsort
SELECT `table_1`.`column_1` AS `alias_1` FROM `table_1` WHERE (`table_1`.`column_1` != 1)
----
1125117129
1269459462
1638810329

query  rowsort
SELECT `table_1`.`column_1` AS `alias_1` FROM `table_1` WHERE (`table_1`.`column_1` != 1)
----
1125117129
1269459462
1638810329

query  rowsort
SELECT `table_1`.`column_1` AS `alias_1` FROM `table_1` WHERE (`table_1`.`column_1` > ?)
? = 10
----
1125117129
1269459462
1638810329

query  rowsort
SELECT `table_1`.`column_1` AS `alias_1`, `table_1`.`column_1` AS `alias_2` FROM `table_1` WHERE ((`table_1`.`column_1` != `table_1`.`column_2`) OR (`table_1`.`column_1` != `table_1`.`column_2`))
----
1
1
1
1
1125117129
1125117129
1269459462
1269459462
1638810329
1638810329

query  rowsort
SELECT `table_1`.`column_1` AS `alias_1`, `table_1`.`column_1` AS `alias_2` FROM `table_1` WHERE ((`table_1`.`column_1` != `table_1`.`column_2`) AND (`table_1`.`column_1` != 1))
----
1125117129
1125117129
1269459462
1269459462
1638810329
1638810329

query  rowsort
SELECT `table_1`.`column_1` AS `alias_1`, `table_1`.`column_1` AS `alias_2` FROM `table_1` WHERE ((`table_1`.`column_1` != `table_1`.`column_2`) OR (`table_1`.`column_1` != 1))
----
1
1
1
1
1125117129
1125117129
1269459462
1269459462
1638810329
1638810329

query  rowsort
SELECT `table_1`.`column_1` AS `alias_1` FROM `table_1` WHERE ((`table_1`.`column_1` != `table_1`.`column_2`) AND (`table_1`.`column_1` > ?))
? = 10
----
1125117129
1269459462
1638810329

query  rowsort
SELECT `table_1`.`column_1` AS `alias_1`, `table_1`.`column_1` AS `alias_2` FROM `table_1` WHERE ((`table_1`.`column_1` != `table_1`.`column_2`) AND (`table_1`.`column_1` != 1))
----
1125117129
1125117129
1269459462
1269459462
1638810329
1638810329

query  rowsort
SELECT `table_1`.`column_1` AS `alias_1`, `table_1`.`column_1` AS `alias_2` FROM `table_1` WHERE ((`table_1`.`column_1` != `table_1`.`column_2`) OR (`table_1`.`column_1` != 1))
----
1
1
1
1
1125117129
1125117129
1269459462
1269459462
1638810329
1638810329

query  rowsort
SELECT `table_1`.`column_1` AS `alias_1` FROM `table_1` WHERE ((`table_1`.`column_1` != `table_1`.`column_2`) AND (`table_1`.`column_1` > ?))
? = 10
----
1125117129
1269459462
1638810329

query  rowsort
SELECT `table_1`.`column_1` AS `alias_1`, `table_1`.`column_1` AS `alias_2` FROM `table_1` WHERE ((`table_1`.`column_1` != 1) OR (`table_1`.`column_1` != 1))
----
1125117129
1125117129
1269459462
1269459462
1638810329
1638810329

query  rowsort
SELECT `table_1`.`column_1` AS `alias_1` FROM `table_1` WHERE ((`table_1`.`column_1` != 1) AND (`table_1`.`column_1` > ?))
? = 10
----
1125117129
1269459462
1638810329

query  rowsort
SELECT `table_1`.`column_1` AS `alias_1` FROM `table_1` WHERE ((`table_1`.`column_1` != 1) AND (`table_1`.`column_1` > ?))
? = 10
----
1125117129
1269459462
1638810329

query  rowsort
SELECT `table_1`.`column_1` AS `alias_1`, `table_1`.`column_1` AS `alias_2`, `table_1`.`column_1` AS `alias_3` FROM `table_1` WHERE (((`table_1`.`column_1` != `table_1`.`column_2`) OR (`table_1`.`column_1` != `table_1`.`column_2`)) AND (`table_1`.`column_1` != 1))
----
1125117129
1125117129
1125117129
1269459462
1269459462
1269459462
1638810329
1638810329
1638810329

query  rowsort
SELECT `table_1`.`column_1` AS `alias_1`, `table_1`.`column_1` AS `alias_2`, `table_1`.`column_1` AS `alias_3` FROM `table_1` WHERE (((`table_1`.`column_1` != `table_1`.`column_2`) OR (`table_1`.`column_1` != `table_1`.`column_2`)) OR (`table_1`.`column_1` != 1))
----
1
1
1
1
1
1
1125117129
1125117129
1125117129
1269459462
1269459462
1269459462
1638810329
1638810329
1638810329

query  rowsort
SELECT `table_1`.`column_1` AS `alias_1`, `table_1`.`column_1` AS `alias_2` FROM `table_1` WHERE (((`table_1`.`column_1` != `table_1`.`column_2`) OR (`table_1`.`column_1` != `table_1`.`column_2`)) AND (`table_1`.`column_1` > ?))
? = 10
----
1125117129
1125117129
1269459462
1269459462
1638810329
1638810329

query  rowsort
SELECT `table_1`.`column_1` AS `alias_1`, `table_1`.`column_1` AS `alias_2`, `table_1`.`column_1` AS `alias_3` FROM `table_1` WHERE (((`table_1`.`column_1` != `table_1`.`column_2`) AND (`table_1`.`column_1` != 1)) OR (`table_1`.`column_1` != 1))
----
1125117129
1125117129
1125117129
1269459462
1269459462
1269459462
1638810329
1638810329
1638810329

query  rowsort
SELECT `table_1`.`column_1` AS `alias_1`, `table_1`.`column_1` AS `alias_2` FROM `table_1` WHERE (((`table_1`.`column_1` != `table_1`.`column_2`) AND (`table_1`.`column_1` != 1)) AND (`table_1`.`column_1` > ?))
? = 10
----
1125117129
1125117129
1269459462
1269459462
1638810329
1638810329

query  rowsort
SELECT `table_1`.`column_1` AS `alias_1`, `table_1`.`column_1` AS `alias_2` FROM `table_1` WHERE (((`table_1`.`column_1` != `table_1`.`column_2`) OR (`table_1`.`column_1` != 1)) AND (`table_1`.`column_1` > ?))
? = 10
----
1125117129
1125117129
1269459462
1269459462
1638810329
1638810329

query  rowsort
SELECT `table_1`.`column_1` AS `alias_1`, `table_1`.`column_1` AS `alias_2`, `table_1`.`column_1` AS `alias_3` FROM `table_1` WHERE (((`table_1`.`column_1` != `table_1`.`column_2`) AND (`table_1`.`column_1` != 1)) OR (`table_1`.`column_1` != 1))
----
1125117129
1125117129
1125117129
1269459462
1269459462
1269459462
1638810329
1638810329
1638810329

query  rowsort
SELECT `table_1`.`column_1` AS `alias_1`, `table_1`.`column_1` AS `alias_2` FROM `table_1` WHERE (((`table_1`.`column_1` != `table_1`.`column_2`) AND (`table_1`.`column_1` != 1)) AND (`table_1`.`column_1` > ?))
? = 10
----
1125117129
1125117129
1269459462
1269459462
1638810329
1638810329

query  rowsort
SELECT `table_1`.`column_1` AS `alias_1`, `table_1`.`column_1` AS `alias_2` FROM `table_1` WHERE (((`table_1`.`column_1` != `table_1`.`column_2`) OR (`table_1`.`column_1` != 1)) AND (`table_1`.`column_1` > ?))
? = 10
----
1125117129
1125117129
1269459462
1269459462
1638810329
1638810329

query  rowsort
SELECT `table_1`.`column_1` AS `alias_1`, `table_1`.`column_1` AS `alias_2` FROM `table_1` WHERE (((`table_1`.`column_1` != 1) OR (`table_1`.`column_1` != 1)) AND (`table_1`.`column_1` > ?))
? = 10
----
1125117129
1125117129
1269459462
1269459462
1638810329
1638810329

query  rowsort
SELECT `table_1`.`column_1` AS `alias_1`, `table_1`.`column_1` AS `alias_2`, `table_1`.`column_1` AS `alias_3`, `table_1`.`column_1` AS `alias_4` FROM `table_1` WHERE ((((`table_1`.`column_1` != `table_1`.`column_2`) OR (`table_1`.`column_1` != `table_1`.`column_2`)) AND (`table_1`.`column_1` != 1)) OR (`table_1`.`column_1` != 1))
----
1125117129
1125117129
1125117129
1125117129
1269459462
1269459462
1269459462
1269459462
1638810329
1638810329
1638810329
1638810329

query  rowsort
SELECT `table_1`.`column_1` AS `alias_1`, `table_1`.`column_1` AS `alias_2`, `table_1`.`column_1` AS `alias_3` FROM `table_1` WHERE ((((`table_1`.`column_1` != `table_1`.`column_2`) OR (`table_1`.`column_1` != `table_1`.`column_2`)) AND (`table_1`.`column_1` != 1)) AND (`table_1`.`column_1` > ?))
? = 10
----
1125117129
1125117129
1125117129
1269459462
1269459462
1269459462
1638810329
1638810329
1638810329

query  rowsort
SELECT `table_1`.`column_1` AS `alias_1`, `table_1`.`column_1` AS `alias_2`, `table_1`.`column_1` AS `alias_3` FROM `table_1` WHERE ((((`table_1`.`column_1` != `table_1`.`column_2`) OR (`table_1`.`column_1` != `table_1`.`column_2`)) OR (`table_1`.`column_1` != 1)) AND (`table_1`.`column_1` > ?))
? = 10
----
1125117129
1125117129
1125117129
1269459462
1269459462
1269459462
1638810329
1638810329
1638810329

query  rowsort
SELECT `table_1`.`column_1` AS `alias_1`, `table_1`.`column_1` AS `alias_2`, `table_1`.`column_1` AS `alias_3` FROM `table_1` WHERE ((((`table_1`.`column_1` != `table_1`.`column_2`) AND (`table_1`.`column_1` != 1)) OR (`table_1`.`column_1` != 1)) AND (`table_1`.`column_1` > ?))
? = 10
----
1125117129
1125117129
1125117129
1269459462
1269459462
1269459462
1638810329
1638810329
1638810329

query  rowsort
SELECT `table_1`.`column_1` AS `alias_1`, `table_1`.`column_1` AS `alias_2`, `table_1`.`column_1` AS `alias_3` FROM `table_1` WHERE ((((`table_1`.`column_1` != `table_1`.`column_2`) AND (`table_1`.`column_1` != 1)) OR (`table_1`.`column_1` != 1)) AND (`table_1`.`column_1` > ?))
? = 10
----
1125117129
1125117129
1125117129
1269459462
1269459462
1269459462
1638810329
1638810329
1638810329

query  rowsort
SELECT `table_1`.`column_1` AS `alias_1`, `table_1`.`column_1` AS `alias_2`, `table_1`.`column_1` AS `alias_3`, `table_1`.`column_1` AS `alias_4` FROM `table_1` WHERE (((((`table_1`.`column_1` != `table_1`.`column_2`) OR (`table_1`.`column_1` != `table_1`.`column_2`)) AND (`table_1`.`column_1` != 1)) OR (`table_1`.`column_1` != 1)) AND (`table_1`.`column_1` > ?))
? = 10
----
1125117129
1125117129
1125117129
1125117129
1269459462
1269459462
1269459462
1269459462
1638810329
1638810329
1638810329
1638810329
