# Generated by:
#     target/debug/noria-logictest permute --compare-to mysql://root:noria@127.1/noria -d 3 -o logictests/generated/mysql/ --only range_param --random --include-deletes --rows-per-table 10 --subquery-depth 1

statement ok
CREATE TABLE `table_1` (`column_4` INT, `column_5` INT, `column_2` INT, `column_3` INT, `column_1` INT, PRIMARY KEY (`column_5`))


statement ok
INSERT INTO `table_1` (`column_4`, `column_5`, `column_2`, `column_3`, `column_1`) VALUES (-1587685019, 0, -1979817597, -1276849348, -1968824831), (1371969227, 1, 1078549722, 602638256, -1053244499), (1754408970, 2, 914684587, 752054495, 186539519), (-346237648, 3, -1450795567, -1726696152, 427334164), (1329451159, 4, -1297686763, 359668639, -1050318821), (-235877484, 5, 452211111, -146761869, 1946078047), (554612428, 6, 180502006, -925679509, 1412119200), (432272988, 7, -6742030, 262656039, 1900405544), (2073287765, 8, 1504219917, 434409977, -1735315529), (-311526922, 9, -884123472, -946456513, 464874428)


query  rowsort
SELECT 1 AS `alias_1`
----
1

query  rowsort
SELECT count(`table_1`.`column_1`) AS `alias_1` FROM `table_1`
----
10

query  rowsort
SELECT `table_1`.`column_1` AS `alias_1` FROM `table_1` WHERE (`table_1`.`column_1` > ?)
? = 10
----
1412119200
186539519
1900405544
1946078047
427334164
464874428

query  rowsort
SELECT 1 AS `alias_1`, count(`table_1`.`column_2`) AS `alias_2` FROM `table_1`
----
1
10

query  rowsort
SELECT 1 AS `alias_1` FROM `table_1` WHERE (`table_1`.`column_1` > ?)
? = 10
----
1
1
1
1
1
1

query  rowsort
SELECT count(`table_1`.`column_3`) AS `alias_1` FROM `table_1` WHERE (`table_1`.`column_1` > ?)
? = 10
----
6

query  rowsort
SELECT 1 AS `alias_1`, count(`table_1`.`column_4`) AS `alias_2` FROM `table_1` WHERE (`table_1`.`column_4` > ?)
? = 10
----
1
6

statement ok
DELETE FROM `table_1` WHERE (`column_5` = 0)


statement ok
DELETE FROM `table_1` WHERE (`column_5` = 1)


statement ok
DELETE FROM `table_1` WHERE (`column_5` = 2)


statement ok
DELETE FROM `table_1` WHERE (`column_5` = 3)


statement ok
DELETE FROM `table_1` WHERE (`column_5` = 4)


query  rowsort
SELECT 1 AS `alias_1`
----
1

query  rowsort
SELECT count(`table_1`.`column_1`) AS `alias_1` FROM `table_1`
----
5

query  rowsort
SELECT `table_1`.`column_1` AS `alias_1` FROM `table_1` WHERE (`table_1`.`column_1` > ?)
? = 10
----
1412119200
1900405544
1946078047
464874428

query  rowsort
SELECT 1 AS `alias_1`, count(`table_1`.`column_2`) AS `alias_2` FROM `table_1`
----
1
5

query  rowsort
SELECT 1 AS `alias_1` FROM `table_1` WHERE (`table_1`.`column_1` > ?)
? = 10
----
1
1
1
1

query  rowsort
SELECT count(`table_1`.`column_3`) AS `alias_1` FROM `table_1` WHERE (`table_1`.`column_1` > ?)
? = 10
----
4

query  rowsort
SELECT 1 AS `alias_1`, count(`table_1`.`column_4`) AS `alias_2` FROM `table_1` WHERE (`table_1`.`column_4` > ?)
? = 10
----
1
3
