# Generated by:
#     target/debug/noria-logictest permute --compare-to mysql://root:noria@127.1/noria -d 3 -o logictests/generated/mysql/ --only range_param --random --include-deletes --rows-per-table 10 --subquery-depth 1

statement ok
CREATE TABLE `table_1` (`column_4` INT, `column_3` INT, `column_5` INT, `column_2` INT, `column_1` INT, PRIMARY KEY (`column_5`))


statement ok
INSERT INTO `table_1` (`column_4`, `column_3`, `column_5`, `column_2`, `column_1`) VALUES (1735410771, -1402508255, 0, -1555259345, -1824554219), (-1943072402, -1232338834, 1, 170350580, -1584272155), (-919771725, 568705772, 2, -1580175558, -79272677), (1619943519, -1166004930, 3, -126374805, -1746360984), (-2005923162, 1272651802, 4, 1930363814, 959514130), (8826352, 592119672, 5, -200645876, 1256335617), (1970365545, -1549513647, 6, -1293815766, -1488034572), (455656222, 910280647, 7, 70595105, -769865624), (-994809207, 1518454420, 8, 1090040558, -1686340804), (299430536, -1478096995, 9, 152352323, 506630001)


query  rowsort
SELECT 1 AS `alias_1`
----
1

query  rowsort
SELECT sum(`table_1`.`column_1`) AS `alias_1` FROM `table_1`
----
-6456221287

query  rowsort
SELECT `table_1`.`column_1` AS `alias_1` FROM `table_1` WHERE (`table_1`.`column_1` > ?)
? = 10
----
1256335617
506630001
959514130

query  rowsort
SELECT 1 AS `alias_1`, sum(`table_1`.`column_2`) AS `alias_2` FROM `table_1`
----
1
-1342568970

query  rowsort
SELECT 1 AS `alias_1` FROM `table_1` WHERE (`table_1`.`column_2` > ?)
? = 10
----
1
1
1
1
1

query  rowsort
SELECT sum(`table_1`.`column_3`) AS `alias_1` FROM `table_1` WHERE (`table_1`.`column_2` > ?)
? = 10
----
990951040

query  rowsort
SELECT 1 AS `alias_1`, sum(`table_1`.`column_4`) AS `alias_2` FROM `table_1` WHERE (`table_1`.`column_4` > ?)
? = 10
----
1
6089632945

statement ok
DELETE FROM `table_1` WHERE (`column_5` = 0)


statement ok
DELETE FROM `table_1` WHERE (`column_5` = 1)


statement ok
DELETE FROM `table_1` WHERE (`column_5` = 2)


statement ok
DELETE FROM `table_1` WHERE (`column_5` = 3)


statement ok
DELETE FROM `table_1` WHERE (`column_5` = 4)


query  rowsort
SELECT 1 AS `alias_1`
----
1

query  rowsort
SELECT sum(`table_1`.`column_1`) AS `alias_1` FROM `table_1`
----
-2181275382

query  rowsort
SELECT `table_1`.`column_1` AS `alias_1` FROM `table_1` WHERE (`table_1`.`column_1` > ?)
? = 10
----
1256335617
506630001

query  rowsort
SELECT 1 AS `alias_1`, sum(`table_1`.`column_2`) AS `alias_2` FROM `table_1`
----
1
-181473656

query  rowsort
SELECT 1 AS `alias_1` FROM `table_1` WHERE (`table_1`.`column_2` > ?)
? = 10
----
1
1
1

query  rowsort
SELECT sum(`table_1`.`column_3`) AS `alias_1` FROM `table_1` WHERE (`table_1`.`column_2` > ?)
? = 10
----
950638072

query  rowsort
SELECT 1 AS `alias_1`, sum(`table_1`.`column_4`) AS `alias_2` FROM `table_1` WHERE (`table_1`.`column_4` > ?)
? = 10
----
1
2734278655
