# Generated by:
#     target/debug/noria-logictest permute --compare-to mysql://root:noria@127.1/noria -d 3 -o logictests/generated/mysql/ --only range_param --random --include-deletes --rows-per-table 10 --subquery-depth 1

statement ok
CREATE TABLE `table_1` (`column_4` INT, `column_5` INT, `column_1` INT, `column_2` INT, `column_3` INT, PRIMARY KEY (`column_5`))


statement ok
INSERT INTO `table_1` (`column_4`, `column_5`, `column_1`, `column_2`, `column_3`) VALUES (-837957156, 0, -1293271244, -1617456674, -174643031), (-1253517529, 1, 598394305, -1667175244, -536290353), (1121816323, 2, 1923729360, 1036691865, 1646816784), (-1511400095, 3, 1138948920, -117367691, 751460407), (-1669859617, 4, -235015950, -1552017591, 21175459), (232354426, 5, 438717972, 1771022180, 2073893381), (-436236736, 6, -1307762604, -142228788, 1660288540), (1851279824, 7, -1686169041, -941533489, 1823384775), (-964742577, 8, 1043718915, 1257722929, -1557509843), (-1779875219, 9, -1378004584, -458785510, -1699263806)


query  rowsort
SELECT 1 AS `alias_1`
----
1

query  rowsort
SELECT avg(distinct `table_1`.`column_1`) AS `alias_1` FROM `table_1`
----
-75671395.1000

query  rowsort
SELECT `table_1`.`column_1` AS `alias_1` FROM `table_1` WHERE (`table_1`.`column_1` > ?)
? = 10
----
1043718915
1138948920
1923729360
438717972
598394305

query  rowsort
SELECT 1 AS `alias_1`, avg(distinct `table_1`.`column_2`) AS `alias_2` FROM `table_1`
----
1
-243112801.3000

query  rowsort
SELECT 1 AS `alias_1` FROM `table_1` WHERE (`table_1`.`column_1` > ?)
? = 10
----
1
1
1
1
1

query  rowsort
SELECT avg(distinct `table_1`.`column_3`) AS `alias_1` FROM `table_1` WHERE (`table_1`.`column_1` > ?)
? = 10
----
475674075.2000

query  rowsort
SELECT 1 AS `alias_1`, avg(distinct `table_1`.`column_4`) AS `alias_2` FROM `table_1` WHERE (`table_1`.`column_4` > ?)
? = 10
----
1
1068483524.3333

statement ok
DELETE FROM `table_1` WHERE (`column_5` = 0)


statement ok
DELETE FROM `table_1` WHERE (`column_5` = 1)


statement ok
DELETE FROM `table_1` WHERE (`column_5` = 2)


statement ok
DELETE FROM `table_1` WHERE (`column_5` = 3)


statement ok
DELETE FROM `table_1` WHERE (`column_5` = 4)


query  rowsort
SELECT 1 AS `alias_1`
----
1

query  rowsort
SELECT avg(distinct `table_1`.`column_1`) AS `alias_1` FROM `table_1`
----
-577899868.4000

query  rowsort
SELECT `table_1`.`column_1` AS `alias_1` FROM `table_1` WHERE (`table_1`.`column_1` > ?)
? = 10
----
1043718915
438717972

query  rowsort
SELECT 1 AS `alias_1`, avg(distinct `table_1`.`column_2`) AS `alias_2` FROM `table_1`
----
1
297239464.4000

query  rowsort
SELECT 1 AS `alias_1` FROM `table_1` WHERE (`table_1`.`column_1` > ?)
? = 10
----
1
1

query  rowsort
SELECT avg(distinct `table_1`.`column_3`) AS `alias_1` FROM `table_1` WHERE (`table_1`.`column_1` > ?)
? = 10
----
258191769.0000

query  rowsort
SELECT 1 AS `alias_1`, avg(distinct `table_1`.`column_4`) AS `alias_2` FROM `table_1` WHERE (`table_1`.`column_4` > ?)
? = 10
----
1
1041817125.0000
