# Generated by:
#     target/debug/noria-logictest permute --compare-to mysql://root:noria@127.1/noria -d 3 -o logictests/generated/mysql/ --only range_param --random --include-deletes --rows-per-table 10 --subquery-depth 1

statement ok
CREATE TABLE `table_1` (`column_1` INT, `column_2` INT, `column_4` INT, `column_5` INT, `column_3` INT, PRIMARY KEY (`column_5`))


statement ok
INSERT INTO `table_1` (`column_1`, `column_2`, `column_4`, `column_5`, `column_3`) VALUES (-1630549563, 95007772, 1330648449, 0, 1121543598), (58813813, -2024155287, -425633311, 1, -1292751366), (461516307, -1497789082, -833672328, 2, 1009722927), (-1843510719, 963707932, 1510506677, 3, -1250524603), (372235665, 1928287280, 656271224, 4, -100064850), (1848687690, 147074364, -1208316345, 5, -831804593), (1568931901, -275299268, 1069074040, 6, 96420172), (1165039795, -1490586876, -857461023, 7, -467849897), (-904654340, -1444912467, -1950028061, 8, -390448824), (1742165910, -486910871, 3872371, 9, -764867382)


query  rowsort
SELECT 1 AS `alias_1`
----
1

query  rowsort
SELECT count(distinct `table_1`.`column_1`) AS `alias_1` FROM `table_1`
----
10

query  rowsort
SELECT `table_1`.`column_1` AS `alias_1` FROM `table_1` WHERE (`table_1`.`column_1` > ?)
? = 10
----
1165039795
1568931901
1742165910
1848687690
372235665
461516307
58813813

query  rowsort
SELECT 1 AS `alias_1`, count(distinct `table_1`.`column_2`) AS `alias_2` FROM `table_1`
----
1
10

query  rowsort
SELECT 1 AS `alias_1` FROM `table_1` WHERE (`table_1`.`column_1` > ?)
? = 10
----
1
1
1
1
1
1
1

query  rowsort
SELECT count(distinct `table_1`.`column_3`) AS `alias_1` FROM `table_1` WHERE (`table_1`.`column_1` > ?)
? = 10
----
7

query  rowsort
SELECT 1 AS `alias_1`, count(distinct `table_1`.`column_4`) AS `alias_2` FROM `table_1` WHERE (`table_1`.`column_1` > ?)
? = 10
----
1
7

statement ok
DELETE FROM `table_1` WHERE (`column_5` = 0)


statement ok
DELETE FROM `table_1` WHERE (`column_5` = 1)


statement ok
DELETE FROM `table_1` WHERE (`column_5` = 2)


statement ok
DELETE FROM `table_1` WHERE (`column_5` = 3)


statement ok
DELETE FROM `table_1` WHERE (`column_5` = 4)


query  rowsort
SELECT 1 AS `alias_1`
----
1

query  rowsort
SELECT count(distinct `table_1`.`column_1`) AS `alias_1` FROM `table_1`
----
5

query  rowsort
SELECT `table_1`.`column_1` AS `alias_1` FROM `table_1` WHERE (`table_1`.`column_1` > ?)
? = 10
----
1165039795
1568931901
1742165910
1848687690

query  rowsort
SELECT 1 AS `alias_1`, count(distinct `table_1`.`column_2`) AS `alias_2` FROM `table_1`
----
1
5

query  rowsort
SELECT 1 AS `alias_1` FROM `table_1` WHERE (`table_1`.`column_1` > ?)
? = 10
----
1
1
1
1

query  rowsort
SELECT count(distinct `table_1`.`column_3`) AS `alias_1` FROM `table_1` WHERE (`table_1`.`column_1` > ?)
? = 10
----
4

query  rowsort
SELECT 1 AS `alias_1`, count(distinct `table_1`.`column_4`) AS `alias_2` FROM `table_1` WHERE (`table_1`.`column_1` > ?)
? = 10
----
1
4
