# Generated by:
#     target/debug/noria-logictest permute --compare-to mysql://root:noria@127.1/noria -d 3 -o logictests/generated/mysql/ --only range_param --random --include-deletes --rows-per-table 10 --subquery-depth 1

statement ok
CREATE TABLE `table_1` (`column_2` INT, `column_1` INT, PRIMARY KEY (`column_2`))


statement ok
INSERT INTO `table_1` (`column_2`, `column_1`) VALUES (0, 622848754), (1, 1999578380), (2, 733376557), (3, 1681373002), (4, -135475793), (5, -730799579), (6, 660801398), (7, -126004411), (8, -1170075372), (9, -1787998281)


query  rowsort
SELECT 1 AS `alias_1`
----
1

query  rowsort
SELECT `table_1`.`column_1` AS `alias_1` FROM `table_1` WHERE ((`table_1`.`column_1` > ?) AND (`table_1`.`column_1` > ?))
? = 10
? = 10
----
1681373002
1999578380
622848754
660801398
733376557

query  rowsort
SELECT `table_1`.`column_1` AS `alias_1` FROM `table_1` WHERE (`table_1`.`column_1` > ?)
? = 10
----
1681373002
1999578380
622848754
660801398
733376557

query  rowsort
SELECT 1 AS `alias_1` FROM `table_1` WHERE ((`table_1`.`column_1` > ?) AND (`table_1`.`column_1` > ?))
? = 10
? = 10
----
1
1
1
1
1

query  rowsort
SELECT 1 AS `alias_1` FROM `table_1` WHERE (`table_1`.`column_1` > ?)
? = 10
----
1
1
1
1
1

query  rowsort
SELECT `table_1`.`column_1` AS `alias_1` FROM `table_1` WHERE (((`table_1`.`column_1` > ?) AND (`table_1`.`column_1` > ?)) AND (`table_1`.`column_1` > ?))
? = 10
? = 10
? = 10
----
1681373002
1999578380
622848754
660801398
733376557

query  rowsort
SELECT 1 AS `alias_1` FROM `table_1` WHERE (((`table_1`.`column_1` > ?) AND (`table_1`.`column_1` > ?)) AND (`table_1`.`column_1` > ?))
? = 10
? = 10
? = 10
----
1
1
1
1
1

statement ok
DELETE FROM `table_1` WHERE (`column_2` = 0)


statement ok
DELETE FROM `table_1` WHERE (`column_2` = 1)


statement ok
DELETE FROM `table_1` WHERE (`column_2` = 2)


statement ok
DELETE FROM `table_1` WHERE (`column_2` = 3)


statement ok
DELETE FROM `table_1` WHERE (`column_2` = 4)


query  rowsort
SELECT 1 AS `alias_1`
----
1

query  rowsort
SELECT `table_1`.`column_1` AS `alias_1` FROM `table_1` WHERE ((`table_1`.`column_1` > ?) AND (`table_1`.`column_1` > ?))
? = 10
? = 10
----
660801398

query  rowsort
SELECT `table_1`.`column_1` AS `alias_1` FROM `table_1` WHERE (`table_1`.`column_1` > ?)
? = 10
----
660801398

query  rowsort
SELECT 1 AS `alias_1` FROM `table_1` WHERE ((`table_1`.`column_1` > ?) AND (`table_1`.`column_1` > ?))
? = 10
? = 10
----
1

query  rowsort
SELECT 1 AS `alias_1` FROM `table_1` WHERE (`table_1`.`column_1` > ?)
? = 10
----
1

query  rowsort
SELECT `table_1`.`column_1` AS `alias_1` FROM `table_1` WHERE (((`table_1`.`column_1` > ?) AND (`table_1`.`column_1` > ?)) AND (`table_1`.`column_1` > ?))
? = 10
? = 10
? = 10
----
660801398

query  rowsort
SELECT 1 AS `alias_1` FROM `table_1` WHERE (((`table_1`.`column_1` > ?) AND (`table_1`.`column_1` > ?)) AND (`table_1`.`column_1` > ?))
? = 10
? = 10
? = 10
----
1
