# Generated by:
#     target/debug/noria-logictest permute --compare-to mysql://root:noria@127.1/noria -d 3 -o logictests/generated/mysql/ --only range_param --random --include-deletes --rows-per-table 10 --subquery-depth 1

statement ok
CREATE TABLE `table_1` (`column_2` INT, `column_5` INT, `column_3` INT, `column_1` INT, `column_6` INT, `column_4` INT, PRIMARY KEY (`column_6`))


statement ok
INSERT INTO `table_1` (`column_2`, `column_5`, `column_3`, `column_1`, `column_6`, `column_4`) VALUES (-798342781, -478569079, -1144628880, -1050175370, 0, -1093485245), (1760377863, -1239716181, -1242852141, 2024749756, 1, 1938668389), (51475054, 356291610, -1672047147, 471289892, 2, 1209103313), (-1193613635, 753543733, 1742354212, -646875280, 3, 467799858), (1394866509, 355072671, -1571870120, -2017641726, 4, 555546137), (208859325, 604980878, -256578274, 1953472760, 5, 1354372678), (-973563833, 1590611543, -983567069, -1504763809, 6, 178753479), (-1478412478, -366839588, -1703176794, 1944255871, 7, 825255995), (-1532408022, -631954275, 1607937030, -1232602954, 8, 659810051), (394948643, 1275842083, -1108160065, 199544955, 9, -1322250029)


query  rowsort
SELECT `table_1`.`column_1` AS `alias_1` FROM `table_1` WHERE (`table_1`.`column_1` > ?)
? = 10
----
1944255871
1953472760
199544955
2024749756
471289892

query  rowsort
SELECT min(`table_1`.`column_2`) AS `alias_1` FROM `table_1`
----
-1532408022

query  rowsort
SELECT `table_1`.`column_1` AS `alias_1` FROM `table_1` WHERE (`table_1`.`column_1` > ?)
? = 10
----
1944255871
1953472760
199544955
2024749756
471289892

query  rowsort
SELECT min(`table_1`.`column_3`) AS `alias_1` FROM `table_1` WHERE (`table_1`.`column_1` > ?)
? = 10
----
-1703176794

query  rowsort
SELECT `table_1`.`column_3` AS `alias_1` FROM `table_1` WHERE ((`table_1`.`column_3` > ?) AND (`table_1`.`column_3` > ?))
? = 10
? = 10
----
1607937030
1742354212

query  rowsort
SELECT min(`table_1`.`column_4`) AS `alias_1` FROM `table_1` WHERE (`table_1`.`column_2` > ?)
? = 10
----
-1322250029

query  rowsort
SELECT min(`table_1`.`column_5`) AS `alias_1` FROM `table_1` WHERE ((`table_1`.`column_2` > ?) AND (`table_1`.`column_2` > ?))
? = 10
? = 10
----
-1239716181

statement ok
DELETE FROM `table_1` WHERE (`column_6` = 0)


statement ok
DELETE FROM `table_1` WHERE (`column_6` = 1)


statement ok
DELETE FROM `table_1` WHERE (`column_6` = 2)


statement ok
DELETE FROM `table_1` WHERE (`column_6` = 3)


statement ok
DELETE FROM `table_1` WHERE (`column_6` = 4)


query  rowsort
SELECT `table_1`.`column_1` AS `alias_1` FROM `table_1` WHERE (`table_1`.`column_1` > ?)
? = 10
----
1944255871
1953472760
199544955

query  rowsort
SELECT min(`table_1`.`column_2`) AS `alias_1` FROM `table_1`
----
-1532408022

query  rowsort
SELECT `table_1`.`column_1` AS `alias_1` FROM `table_1` WHERE (`table_1`.`column_1` > ?)
? = 10
----
1944255871
1953472760
199544955

query  rowsort
SELECT min(`table_1`.`column_3`) AS `alias_1` FROM `table_1` WHERE (`table_1`.`column_1` > ?)
? = 10
----
-1703176794

query  rowsort
SELECT `table_1`.`column_3` AS `alias_1` FROM `table_1` WHERE ((`table_1`.`column_3` > ?) AND (`table_1`.`column_3` > ?))
? = 10
? = 10
----
1607937030

query  rowsort
SELECT min(`table_1`.`column_4`) AS `alias_1` FROM `table_1` WHERE (`table_1`.`column_2` > ?)
? = 10
----
-1322250029

query  rowsort
SELECT min(`table_1`.`column_5`) AS `alias_1` FROM `table_1` WHERE ((`table_1`.`column_2` > ?) AND (`table_1`.`column_2` > ?))
? = 10
? = 10
----
604980878
