# Generated by:
#     target/debug/noria-logictest permute --compare-to mysql://root:noria@127.1/noria -d 3 -o logictests/generated/mysql/ --only range_param --random --include-deletes --rows-per-table 10 --subquery-depth 1

statement ok
CREATE TABLE `table_1` (`column_2` INT, `column_5` INT, `column_4` INT, `column_6` INT, `column_1` INT, `column_3` INT, PRIMARY KEY (`column_6`))


statement ok
INSERT INTO `table_1` (`column_2`, `column_5`, `column_4`, `column_6`, `column_1`, `column_3`) VALUES (-1852547317, -621355253, 604608939, 0, -2068942881, -925594053), (-1769489531, -2041157235, 1615157896, 1, 1145647053, -919417310), (1370803846, -1748265813, 92521174, 2, -1073250458, 1639814994), (-865189347, 713163249, 308891534, 3, -1266354724, -757879547), (-1675049764, 2082176017, -809670179, 4, 275824113, -754846180), (-618535989, -1780213594, -721894499, 5, 140355640, -659146829), (-1957883550, 279973513, -442222605, 6, -492493838, -2114696348), (-665292159, -942894820, -255580415, 7, -1625810528, -1420483272), (786991445, 1339604806, 1929387743, 8, 2086314833, -325045089), (-191143174, -1567734556, -934270873, 9, 799213712, 424505382)


query  rowsort
SELECT `table_1`.`column_1` AS `alias_1` FROM `table_1` WHERE (`table_1`.`column_1` > ?)
? = 10
----
1145647053
140355640
2086314833
275824113
799213712

query  rowsort
SELECT avg(distinct `table_1`.`column_2`) AS `alias_1` FROM `table_1`
----
-743733554.0000

query  rowsort
SELECT `table_1`.`column_2` AS `alias_1` FROM `table_1` WHERE (`table_1`.`column_2` > ?)
? = 10
----
1370803846
786991445

query  rowsort
SELECT avg(distinct `table_1`.`column_3`) AS `alias_1` FROM `table_1` WHERE (`table_1`.`column_2` > ?)
? = 10
----
657384952.5000

query  rowsort
SELECT `table_1`.`column_2` AS `alias_1` FROM `table_1` WHERE ((`table_1`.`column_2` > ?) AND (`table_1`.`column_2` > ?))
? = 10
? = 10
----
1370803846
786991445

query  rowsort
SELECT avg(distinct `table_1`.`column_4`) AS `alias_1` FROM `table_1` WHERE (`table_1`.`column_2` > ?)
? = 10
----
1010954458.5000

query  rowsort
SELECT avg(distinct `table_1`.`column_5`) AS `alias_1` FROM `table_1` WHERE ((`table_1`.`column_2` > ?) AND (`table_1`.`column_2` > ?))
? = 10
? = 10
----
-204330503.5000

statement ok
DELETE FROM `table_1` WHERE (`column_6` = 0)


statement ok
DELETE FROM `table_1` WHERE (`column_6` = 1)


statement ok
DELETE FROM `table_1` WHERE (`column_6` = 2)


statement ok
DELETE FROM `table_1` WHERE (`column_6` = 3)


statement ok
DELETE FROM `table_1` WHERE (`column_6` = 4)


query  rowsort
SELECT `table_1`.`column_1` AS `alias_1` FROM `table_1` WHERE (`table_1`.`column_1` > ?)
? = 10
----
140355640
2086314833
799213712

query  rowsort
SELECT avg(distinct `table_1`.`column_2`) AS `alias_1` FROM `table_1`
----
-529172685.4000

query  rowsort
SELECT `table_1`.`column_2` AS `alias_1` FROM `table_1` WHERE (`table_1`.`column_2` > ?)
? = 10
----
786991445

query  rowsort
SELECT avg(distinct `table_1`.`column_3`) AS `alias_1` FROM `table_1` WHERE (`table_1`.`column_2` > ?)
? = 10
----
-325045089.0000

query  rowsort
SELECT `table_1`.`column_2` AS `alias_1` FROM `table_1` WHERE ((`table_1`.`column_2` > ?) AND (`table_1`.`column_2` > ?))
? = 10
? = 10
----
786991445

query  rowsort
SELECT avg(distinct `table_1`.`column_4`) AS `alias_1` FROM `table_1` WHERE (`table_1`.`column_2` > ?)
? = 10
----
1929387743.0000

query  rowsort
SELECT avg(distinct `table_1`.`column_5`) AS `alias_1` FROM `table_1` WHERE ((`table_1`.`column_2` > ?) AND (`table_1`.`column_2` > ?))
? = 10
? = 10
----
1339604806.0000
