# Generated by:
#     target/debug/noria-logictest permute --compare-to mysql://root:noria@127.1/noria -d 3 -o logictests/generated/mysql/ --only range_param --random --include-deletes --rows-per-table 10 --subquery-depth 1

statement ok
CREATE TABLE `table_1` (`column_3` INT, `column_1` INT, `column_4` INT, `column_5` INT, `column_6` INT, `column_2` INT, PRIMARY KEY (`column_6`))


statement ok
INSERT INTO `table_1` (`column_3`, `column_1`, `column_4`, `column_5`, `column_6`, `column_2`) VALUES (-1130296687, -1313174849, -1068589245, -2129696286, 0, -726149122), (496903342, 1218979258, 1918766966, -1566427831, 1, 1155181535), (600721638, -687431942, 666112540, 695215172, 2, -787943010), (-783608019, 1432938344, -1399809635, -331887959, 3, -1754007548), (824261267, 246428643, -222058370, -320782171, 4, -1881618771), (-1088118323, -1441752650, 724006755, -1523450682, 5, 1571863002), (-161083510, 1032079402, -1046249037, 513078095, 6, -1297355704), (-1946561330, 1061746459, -966139225, 1161237295, 7, -574558398), (2111387774, -1141060573, 1114596234, -1181054743, 8, 137236775), (1749539157, 1849716371, -1231700743, 816958698, 9, 1043529015)


query  rowsort
SELECT `table_1`.`column_1` AS `alias_1` FROM `table_1` WHERE (`table_1`.`column_1` > ?)
? = 10
----
1032079402
1061746459
1218979258
1432938344
1849716371
246428643

query  rowsort
SELECT count(distinct `table_1`.`column_2`) AS `alias_1` FROM `table_1`
----
10

query  rowsort
SELECT `table_1`.`column_1` AS `alias_1` FROM `table_1` WHERE (`table_1`.`column_1` > ?)
? = 10
----
1032079402
1061746459
1218979258
1432938344
1849716371
246428643

query  rowsort
SELECT count(distinct `table_1`.`column_3`) AS `alias_1` FROM `table_1` WHERE (`table_1`.`column_1` > ?)
? = 10
----
6

query  rowsort
SELECT `table_1`.`column_3` AS `alias_1` FROM `table_1` WHERE ((`table_1`.`column_3` > ?) AND (`table_1`.`column_3` > ?))
? = 10
? = 10
----
1749539157
2111387774
496903342
600721638
824261267

query  rowsort
SELECT count(distinct `table_1`.`column_4`) AS `alias_1` FROM `table_1` WHERE (`table_1`.`column_3` > ?)
? = 10
----
5

query  rowsort
SELECT count(distinct `table_1`.`column_5`) AS `alias_1` FROM `table_1` WHERE ((`table_1`.`column_3` > ?) AND (`table_1`.`column_3` > ?))
? = 10
? = 10
----
5

statement ok
DELETE FROM `table_1` WHERE (`column_6` = 0)


statement ok
DELETE FROM `table_1` WHERE (`column_6` = 1)


statement ok
DELETE FROM `table_1` WHERE (`column_6` = 2)


statement ok
DELETE FROM `table_1` WHERE (`column_6` = 3)


statement ok
DELETE FROM `table_1` WHERE (`column_6` = 4)


query  rowsort
SELECT `table_1`.`column_1` AS `alias_1` FROM `table_1` WHERE (`table_1`.`column_1` > ?)
? = 10
----
1032079402
1061746459
1849716371

query  rowsort
SELECT count(distinct `table_1`.`column_2`) AS `alias_1` FROM `table_1`
----
5

query  rowsort
SELECT `table_1`.`column_1` AS `alias_1` FROM `table_1` WHERE (`table_1`.`column_1` > ?)
? = 10
----
1032079402
1061746459
1849716371

query  rowsort
SELECT count(distinct `table_1`.`column_3`) AS `alias_1` FROM `table_1` WHERE (`table_1`.`column_1` > ?)
? = 10
----
3

query  rowsort
SELECT `table_1`.`column_3` AS `alias_1` FROM `table_1` WHERE ((`table_1`.`column_3` > ?) AND (`table_1`.`column_3` > ?))
? = 10
? = 10
----
1749539157
2111387774

query  rowsort
SELECT count(distinct `table_1`.`column_4`) AS `alias_1` FROM `table_1` WHERE (`table_1`.`column_3` > ?)
? = 10
----
2

query  rowsort
SELECT count(distinct `table_1`.`column_5`) AS `alias_1` FROM `table_1` WHERE ((`table_1`.`column_3` > ?) AND (`table_1`.`column_3` > ?))
? = 10
? = 10
----
2
