# Generated by:
#     target/debug/noria-logictest permute --compare-to mysql://root:noria@127.1/noria -d 3 -o logictests/generated/mysql/ --only range_param --random --include-deletes --rows-per-table 10 --subquery-depth 1

statement ok
CREATE TABLE `table_1` (`column_5` INT, `column_4` INT, `column_2` INT, `column_1` INT, `column_6` INT, `column_3` INT, PRIMARY KEY (`column_6`))


statement ok
INSERT INTO `table_1` (`column_5`, `column_4`, `column_2`, `column_1`, `column_6`, `column_3`) VALUES (1368846871, -1173924229, -1475344771, -1434704036, 0, -1314385121), (634447616, 572412649, 540142730, 32917075, 1, -2138819378), (667260460, 1309470158, -1495319744, -817138390, 2, 479500515), (-2055655932, 1007157666, 1342499817, 1678694242, 3, 1769098015), (518301054, -1562305088, 1321942637, 135353797, 4, -599907220), (291643931, -1620052668, -20702636, -298650265, 5, -782863863), (-1857081534, -1101103038, 352696721, 1163486305, 6, 601147265), (340715872, -485474300, 573889799, 414003914, 7, -1161860315), (1795657551, 1622344546, 1106774501, -1389356040, 8, 1008341341), (-650441548, 1719966788, -1300470188, -363036425, 9, 1218520688)


query  rowsort
SELECT `table_1`.`column_1` AS `alias_1` FROM `table_1` WHERE (`table_1`.`column_1` > ?)
? = 10
----
1163486305
135353797
1678694242
32917075
414003914

query  rowsort
SELECT avg(`table_1`.`column_2`) AS `alias_1` FROM `table_1`
----
94610886.6000

query  rowsort
SELECT `table_1`.`column_2` AS `alias_1` FROM `table_1` WHERE (`table_1`.`column_2` > ?)
? = 10
----
1106774501
1321942637
1342499817
352696721
540142730
573889799

query  rowsort
SELECT avg(`table_1`.`column_3`) AS `alias_1` FROM `table_1` WHERE (`table_1`.`column_2` > ?)
? = 10
----
-87000048.6667

query  rowsort
SELECT `table_1`.`column_3` AS `alias_1` FROM `table_1` WHERE ((`table_1`.`column_3` > ?) AND (`table_1`.`column_3` > ?))
? = 10
? = 10
----
1008341341
1218520688
1769098015
479500515
601147265

query  rowsort
SELECT avg(`table_1`.`column_4`) AS `alias_1` FROM `table_1` WHERE (`table_1`.`column_4` > ?)
? = 10
----
1246270361.4000

query  rowsort
SELECT avg(`table_1`.`column_5`) AS `alias_1` FROM `table_1` WHERE ((`table_1`.`column_4` > ?) AND (`table_1`.`column_5` > ?))
? = 10
? = 10
----
1032455209.0000

statement ok
DELETE FROM `table_1` WHERE (`column_6` = 0)


statement ok
DELETE FROM `table_1` WHERE (`column_6` = 1)


statement ok
DELETE FROM `table_1` WHERE (`column_6` = 2)


statement ok
DELETE FROM `table_1` WHERE (`column_6` = 3)


statement ok
DELETE FROM `table_1` WHERE (`column_6` = 4)


query  rowsort
SELECT `table_1`.`column_1` AS `alias_1` FROM `table_1` WHERE (`table_1`.`column_1` > ?)
? = 10
----
1163486305
414003914

query  rowsort
SELECT avg(`table_1`.`column_2`) AS `alias_1` FROM `table_1`
----
142437639.4000

query  rowsort
SELECT `table_1`.`column_2` AS `alias_1` FROM `table_1` WHERE (`table_1`.`column_2` > ?)
? = 10
----
1106774501
352696721
573889799

query  rowsort
SELECT avg(`table_1`.`column_3`) AS `alias_1` FROM `table_1` WHERE (`table_1`.`column_2` > ?)
? = 10
----
149209430.3333

query  rowsort
SELECT `table_1`.`column_3` AS `alias_1` FROM `table_1` WHERE ((`table_1`.`column_3` > ?) AND (`table_1`.`column_3` > ?))
? = 10
? = 10
----
1008341341
1218520688
601147265

query  rowsort
SELECT avg(`table_1`.`column_4`) AS `alias_1` FROM `table_1` WHERE (`table_1`.`column_4` > ?)
? = 10
----
1671155667.0000

query  rowsort
SELECT avg(`table_1`.`column_5`) AS `alias_1` FROM `table_1` WHERE ((`table_1`.`column_4` > ?) AND (`table_1`.`column_5` > ?))
? = 10
? = 10
----
1795657551.0000
