# Generated by:
#     target/debug/noria-logictest permute -d 3 -o logictests/generated/mysql --only in_parameter --compare-to mysql://root:noria@localhost/mysql --subquery-depth 1 --rows-per-table 5 --include-deletes --overwrite-tests

statement ok
CREATE TABLE table_1 (column_4 INT, column_5 INT, column_1 INT, column_2 INT, column_6 INT, column_3 INT, PRIMARY KEY (column_6))


statement ok
INSERT INTO table_1 (column_4, column_5, column_1, column_2, column_6, column_3) VALUES (1, 1, 2, 1, 0, 1), (1, 1, 1, 1, 1, 1), (2, 1, 0, 1, 2, 2), (1, 1, 1, 1, 3, 1), (0, 1, 1, 1, 4, 0)


query  rowsort
SELECT table_1.column_1 AS alias_1 FROM table_1 WHERE (table_1.column_1 = ?)
? = 1
----
1
1
1

query  rowsort
SELECT avg(table_1.column_2) AS alias_1 FROM table_1
----
1.0000

query  rowsort
SELECT table_1.column_1 AS alias_1 FROM table_1 WHERE table_1.column_1 IN (?, ?, ?)
? = 0
? = 1
? = 2
----
0
1
1
1
2

query  rowsort
SELECT avg(table_1.column_3) AS alias_1 FROM table_1 WHERE (table_1.column_1 = ?)
? = 1
----
0.6667

query  rowsort
SELECT table_1.column_3 AS alias_1 FROM table_1 WHERE ((table_1.column_3 = ?) AND table_1.column_3 IN (?, ?, ?))
? = 1
? = 0
? = 1
? = 2
----
1
1
1

query  rowsort
SELECT avg(table_1.column_4) AS alias_1 FROM table_1 WHERE table_1.column_4 IN (?, ?, ?)
? = 0
? = 1
? = 2
----
1.0000

query  rowsort
SELECT avg(table_1.column_5) AS alias_1 FROM table_1 WHERE ((table_1.column_4 = ?) AND table_1.column_4 IN (?, ?, ?))
? = 1
? = 0
? = 1
? = 2
----
1.0000

statement ok
DELETE FROM table_1 WHERE (column_6 = 0)


statement ok
DELETE FROM table_1 WHERE (column_6 = 1)


query  rowsort
SELECT table_1.column_1 AS alias_1 FROM table_1 WHERE (table_1.column_1 = ?)
? = 1
----
1
1

query  rowsort
SELECT avg(table_1.column_2) AS alias_1 FROM table_1
----
1.0000

query  rowsort
SELECT table_1.column_1 AS alias_1 FROM table_1 WHERE table_1.column_1 IN (?, ?, ?)
? = 0
? = 1
? = 2
----
0
1
1

query  rowsort
SELECT avg(table_1.column_3) AS alias_1 FROM table_1 WHERE (table_1.column_1 = ?)
? = 1
----
0.5000

query  rowsort
SELECT table_1.column_3 AS alias_1 FROM table_1 WHERE ((table_1.column_3 = ?) AND table_1.column_3 IN (?, ?, ?))
? = 1
? = 0
? = 1
? = 2
----
1

query  rowsort
SELECT avg(table_1.column_4) AS alias_1 FROM table_1 WHERE table_1.column_4 IN (?, ?, ?)
? = 0
? = 1
? = 2
----
1.0000

query  rowsort
SELECT avg(table_1.column_5) AS alias_1 FROM table_1 WHERE ((table_1.column_4 = ?) AND table_1.column_4 IN (?, ?, ?))
? = 1
? = 0
? = 1
? = 2
----
1.0000
