# Generated by:
#     target/debug/noria-logictest permute --compare-to mysql://root:noria@127.1/noria -d 3 -o logictests/generated/mysql/ --only range_param --random --include-deletes --rows-per-table 10 --subquery-depth 1

statement ok
CREATE TABLE `table_1` (`column_5` INT, `column_4` INT, `column_6` INT, `column_1` INT, `column_3` INT, `column_2` INT, PRIMARY KEY (`column_6`))


statement ok
INSERT INTO `table_1` (`column_5`, `column_4`, `column_6`, `column_1`, `column_3`, `column_2`) VALUES (1910522327, -1955300781, 0, 945606356, 137393060, 7634471), (-251135506, 1109898837, 1, -2127503785, 648031659, -2133279317), (1460592139, -786072172, 2, -737648784, 1270139269, 1504876510), (2059772756, 422325417, 3, 396205706, 678943231, -963337433), (2051289290, 160281591, 4, -1393030491, 253866754, -437252790), (-770913711, -1412832670, 5, 2039157077, -2059878088, -844965059), (-1879458727, -1265086342, 6, 1050154480, 1731012169, 361773110), (-1922058751, 2040847645, 7, 51840169, 1112611685, -411280185), (344778431, 765998175, 8, 451965945, 1568674883, 1086967829), (232589403, -1104747410, 9, 4626079, 386701733, 71675377)


query  rowsort
SELECT `table_1`.`column_1` AS `alias_1` FROM `table_1` WHERE (`table_1`.`column_1` = ?)
? = 1
----


query  rowsort
SELECT max(`table_1`.`column_2`) AS `alias_1` FROM `table_1`
----
1504876510

query  rowsort
SELECT `table_1`.`column_1` AS `alias_1` FROM `table_1` WHERE (`table_1`.`column_1` > ?)
? = 10
----
1050154480
2039157077
396205706
451965945
4626079
51840169
945606356

query  rowsort
SELECT max(`table_1`.`column_3`) AS `alias_1` FROM `table_1` WHERE (`table_1`.`column_1` = ?)
? = 1
----
NULL

query  rowsort
SELECT `table_1`.`column_1` AS `alias_1` FROM `table_1` WHERE ((`table_1`.`column_1` = ?) AND (`table_1`.`column_1` > ?))
? = 1
? = 10
----


query  rowsort
SELECT max(`table_1`.`column_4`) AS `alias_1` FROM `table_1` WHERE (`table_1`.`column_4` > ?)
? = 10
----
2040847645

query  rowsort
SELECT max(`table_1`.`column_5`) AS `alias_1` FROM `table_1` WHERE ((`table_1`.`column_4` = ?) AND (`table_1`.`column_5` > ?))
? = 1
? = 10
----
NULL

statement ok
DELETE FROM `table_1` WHERE (`column_6` = 0)


statement ok
DELETE FROM `table_1` WHERE (`column_6` = 1)


statement ok
DELETE FROM `table_1` WHERE (`column_6` = 2)


statement ok
DELETE FROM `table_1` WHERE (`column_6` = 3)


statement ok
DELETE FROM `table_1` WHERE (`column_6` = 4)


query  rowsort
SELECT `table_1`.`column_1` AS `alias_1` FROM `table_1` WHERE (`table_1`.`column_1` = ?)
? = 1
----


query  rowsort
SELECT max(`table_1`.`column_2`) AS `alias_1` FROM `table_1`
----
1086967829

query  rowsort
SELECT `table_1`.`column_1` AS `alias_1` FROM `table_1` WHERE (`table_1`.`column_1` > ?)
? = 10
----
1050154480
2039157077
451965945
4626079
51840169

query  rowsort
SELECT max(`table_1`.`column_3`) AS `alias_1` FROM `table_1` WHERE (`table_1`.`column_1` = ?)
? = 1
----
NULL

query  rowsort
SELECT `table_1`.`column_1` AS `alias_1` FROM `table_1` WHERE ((`table_1`.`column_1` = ?) AND (`table_1`.`column_1` > ?))
? = 1
? = 10
----


query  rowsort
SELECT max(`table_1`.`column_4`) AS `alias_1` FROM `table_1` WHERE (`table_1`.`column_4` > ?)
? = 10
----
2040847645

query  rowsort
SELECT max(`table_1`.`column_5`) AS `alias_1` FROM `table_1` WHERE ((`table_1`.`column_4` = ?) AND (`table_1`.`column_5` > ?))
? = 1
? = 10
----
NULL
