# Generated by:
#     target/debug/noria-logictest permute --compare-to mysql://root:noria@127.1/noria -d 3 -o logictests/generated/mysql/ --only range_param --random --include-deletes --rows-per-table 10 --subquery-depth 1

statement ok
CREATE TABLE `table_3` (`column_2` INT, `column_3` INT, `column_1` INT, `column_4` INT, PRIMARY KEY (`column_4`))


statement ok
CREATE TABLE `table_4` (`column_2` INT, `column_3` INT, `column_1` INT, PRIMARY KEY (`column_3`))


statement ok
CREATE TABLE `table_5` (`column_1` INT, `column_3` INT, `column_2` INT, PRIMARY KEY (`column_3`))


statement ok
CREATE TABLE `table_1` (`column_5` INT, `column_1` INT, `column_2` INT, `column_4` INT, `column_3` INT, PRIMARY KEY (`column_5`))


statement ok
CREATE TABLE `table_2` (`column_3` INT, `column_1` INT, `column_2` INT, PRIMARY KEY (`column_3`))


statement ok
INSERT INTO `table_3` (`column_2`, `column_3`, `column_1`, `column_4`) VALUES (-52900192, -265175338, -1470275683, 0), (1536353894, 2103756484, 1778689942, 1), (1902980700, 226348261, -1255445056, 2), (-1193944707, 1651929754, -1295812391, 3), (-497800505, -1968840998, 1638102000, 4), (673157841, 787156386, 1299929261, 5), (621680169, 1020849812, -122274617, 6), (-769309509, 1577347543, -1126235120, 7), (1621054376, 512854724, 1177169578, 8), (1921595445, -1968041303, -1563207728, 9)


statement ok
INSERT INTO `table_4` (`column_2`, `column_3`, `column_1`) VALUES (-149400111, 0, -1365122461), (417388438, 1, 757671789), (-90563807, 2, -657389882), (-353564156, 3, -1754195333), (-1578843497, 4, 290774383), (318934295, 5, 10157483), (1087110241, 6, 1032744060), (-181527240, 7, 1487916542), (-1106147527, 8, 1761934698), (1182006720, 9, 33701126)


statement ok
INSERT INTO `table_5` (`column_1`, `column_3`, `column_2`) VALUES (-544463337, 0, -505787279), (-738234931, 1, -2132662665), (-393416548, 2, -966473790), (1306772613, 3, 145628098), (312705979, 4, 736437421), (-730864453, 5, 622541223), (-1803680308, 6, -873153859), (1938086894, 7, -1704803382), (-410657453, 8, -881745985), (-1156834677, 9, 1627627106)


statement ok
INSERT INTO `table_1` (`column_5`, `column_1`, `column_2`, `column_4`, `column_3`) VALUES (0, 834326945, -516870796, -1368802114, 131698054), (1, 1609383769, -1223205260, -1594402710, 827362084), (2, -1561220315, -540222503, -137738140, 1377888943), (3, -947395362, -1507764558, -398117595, 179073914), (4, 76562042, 72714523, 2016976641, -1961274944), (5, 1488521921, 440861477, -427916310, 2145306184), (6, 2014051757, -663650691, 1288668357, -35047263), (7, 1558536423, 1602790579, -371982764, 1187072727), (8, -1109481014, 2069079119, 696099194, 553613532), (9, -2040927407, -383908252, -208099826, 1805559365)


statement ok
INSERT INTO `table_2` (`column_3`, `column_1`, `column_2`) VALUES (0, -1804647379, -161055111), (1, -1453732981, -1337171262), (2, -1972881116, 1246840419), (3, 1245059155, 2097545424), (4, 229241820, -334625155), (5, -254411575, 2076852067), (6, -831703172, -1822314542), (7, 373427196, -2100528837), (8, -1243874769, 1364278373), (9, 533868042, 910188999)


query  rowsort
SELECT `table_1`.`column_1` AS `alias_1` FROM `table_1` WHERE (`table_1`.`column_1` = ?)
? = 1
----


query  rowsort
SELECT `table_1`.`column_2` AS `alias_1`, `table_2`.`column_2` AS `alias_2` FROM `table_1` INNER JOIN `table_2` ON (`table_1`.`column_1` = `table_2`.`column_1`)
----


query  rowsort
SELECT `table_1`.`column_2` AS `alias_1` FROM `table_1` WHERE (`table_1`.`column_2` > ?)
? = 10
----
1602790579
2069079119
440861477
72714523

query  rowsort
SELECT `table_1`.`column_3` AS `alias_1`, `table_3`.`column_2` AS `alias_2` FROM `table_1` INNER JOIN `table_3` ON (`table_1`.`column_2` = `table_3`.`column_1`) WHERE (`table_1`.`column_2` = ?)
? = 1
----


query  rowsort
SELECT `table_1`.`column_2` AS `alias_1` FROM `table_1` WHERE ((`table_1`.`column_2` = ?) AND (`table_1`.`column_2` > ?))
? = 1
? = 10
----


query  rowsort
SELECT `table_1`.`column_4` AS `alias_1`, `table_4`.`column_2` AS `alias_2` FROM `table_1` INNER JOIN `table_4` ON (`table_1`.`column_2` = `table_4`.`column_1`) WHERE (`table_1`.`column_1` > ?)
? = 10
----


query  rowsort
SELECT `table_3`.`column_3` AS `alias_1`, `table_5`.`column_2` AS `alias_2` FROM `table_3` INNER JOIN `table_5` ON (`table_3`.`column_1` = `table_5`.`column_1`) WHERE ((`table_3`.`column_1` = ?) AND (`table_3`.`column_1` > ?))
? = 1
? = 10
----


statement ok
DELETE FROM `table_3` WHERE (`column_4` = 0)


statement ok
DELETE FROM `table_3` WHERE (`column_4` = 1)


statement ok
DELETE FROM `table_3` WHERE (`column_4` = 2)


statement ok
DELETE FROM `table_3` WHERE (`column_4` = 3)


statement ok
DELETE FROM `table_3` WHERE (`column_4` = 4)


statement ok
DELETE FROM `table_4` WHERE (`column_3` = 0)


statement ok
DELETE FROM `table_4` WHERE (`column_3` = 1)


statement ok
DELETE FROM `table_4` WHERE (`column_3` = 2)


statement ok
DELETE FROM `table_4` WHERE (`column_3` = 3)


statement ok
DELETE FROM `table_4` WHERE (`column_3` = 4)


statement ok
DELETE FROM `table_5` WHERE (`column_3` = 0)


statement ok
DELETE FROM `table_5` WHERE (`column_3` = 1)


statement ok
DELETE FROM `table_5` WHERE (`column_3` = 2)


statement ok
DELETE FROM `table_5` WHERE (`column_3` = 3)


statement ok
DELETE FROM `table_5` WHERE (`column_3` = 4)


statement ok
DELETE FROM `table_1` WHERE (`column_5` = 0)


statement ok
DELETE FROM `table_1` WHERE (`column_5` = 1)


statement ok
DELETE FROM `table_1` WHERE (`column_5` = 2)


statement ok
DELETE FROM `table_1` WHERE (`column_5` = 3)


statement ok
DELETE FROM `table_1` WHERE (`column_5` = 4)


statement ok
DELETE FROM `table_2` WHERE (`column_3` = 0)


statement ok
DELETE FROM `table_2` WHERE (`column_3` = 1)


statement ok
DELETE FROM `table_2` WHERE (`column_3` = 2)


statement ok
DELETE FROM `table_2` WHERE (`column_3` = 3)


statement ok
DELETE FROM `table_2` WHERE (`column_3` = 4)


query  rowsort
SELECT `table_1`.`column_1` AS `alias_1` FROM `table_1` WHERE (`table_1`.`column_1` = ?)
? = 1
----


query  rowsort
SELECT `table_1`.`column_2` AS `alias_1`, `table_2`.`column_2` AS `alias_2` FROM `table_1` INNER JOIN `table_2` ON (`table_1`.`column_1` = `table_2`.`column_1`)
----


query  rowsort
SELECT `table_1`.`column_2` AS `alias_1` FROM `table_1` WHERE (`table_1`.`column_2` > ?)
? = 10
----
1602790579
2069079119
440861477

query  rowsort
SELECT `table_1`.`column_3` AS `alias_1`, `table_3`.`column_2` AS `alias_2` FROM `table_1` INNER JOIN `table_3` ON (`table_1`.`column_2` = `table_3`.`column_1`) WHERE (`table_1`.`column_2` = ?)
? = 1
----


query  rowsort
SELECT `table_1`.`column_2` AS `alias_1` FROM `table_1` WHERE ((`table_1`.`column_2` = ?) AND (`table_1`.`column_2` > ?))
? = 1
? = 10
----


query  rowsort
SELECT `table_1`.`column_4` AS `alias_1`, `table_4`.`column_2` AS `alias_2` FROM `table_1` INNER JOIN `table_4` ON (`table_1`.`column_2` = `table_4`.`column_1`) WHERE (`table_1`.`column_1` > ?)
? = 10
----


query  rowsort
SELECT `table_3`.`column_3` AS `alias_1`, `table_5`.`column_2` AS `alias_2` FROM `table_3` INNER JOIN `table_5` ON (`table_3`.`column_1` = `table_5`.`column_1`) WHERE ((`table_3`.`column_1` = ?) AND (`table_3`.`column_1` > ?))
? = 1
? = 10
----

