# Generated by:
#     target/debug/noria-logictest permute --compare-to mysql://root:noria@127.1/noria -d 3 -o logictests/generated/mysql/ --only range_param --random --include-deletes --rows-per-table 10 --subquery-depth 1

statement ok
CREATE TABLE `table_1` (`column_3` INT, `column_5` INT, `column_4` INT, `column_6` INT, `column_1` INT, `column_2` INT, PRIMARY KEY (`column_6`))


statement ok
INSERT INTO `table_1` (`column_3`, `column_5`, `column_4`, `column_6`, `column_1`, `column_2`) VALUES (1511616299, 1739802756, -1074348823, 0, -103691247, 471113529), (320862904, 9152057, 413478747, 1, -726767564, -361167407), (-2043827873, 791861334, 1461000196, 2, 614361446, -240373905), (373052649, -561546546, -2143030369, 3, 1491995752, 336633636), (1074367646, 315528747, -270080280, 4, -943495333, -639941950), (-20231928, -937475521, 2091991537, 5, -80447323, 924563259), (361548022, 1213816457, 1273710299, 6, 1839684437, 175425525), (-590782848, -327423369, 2073631287, 7, 378441560, 1664859444), (-1578395865, 1694537194, -1634693921, 8, -1841132982, 2089797938), (357878222, 434474856, 1449721672, 9, 901186004, -2142308374)


query  rowsort
SELECT `table_1`.`column_1` AS `alias_1` FROM `table_1` WHERE (`table_1`.`column_1` = ?)
? = 1
----


query  rowsort
SELECT min(`table_1`.`column_2`) AS `alias_1` FROM `table_1`
----
-2142308374

query  rowsort
SELECT `table_1`.`column_1` AS `alias_1` FROM `table_1` WHERE (`table_1`.`column_1` > ?)
? = 10
----
1491995752
1839684437
378441560
614361446
901186004

query  rowsort
SELECT min(`table_1`.`column_3`) AS `alias_1` FROM `table_1` WHERE (`table_1`.`column_1` = ?)
? = 1
----
NULL

query  rowsort
SELECT `table_1`.`column_1` AS `alias_1` FROM `table_1` WHERE ((`table_1`.`column_1` = ?) AND (`table_1`.`column_1` > ?))
? = 1
? = 10
----


query  rowsort
SELECT min(`table_1`.`column_4`) AS `alias_1` FROM `table_1` WHERE (`table_1`.`column_3` > ?)
? = 10
----
-2143030369

query  rowsort
SELECT min(`table_1`.`column_5`) AS `alias_1` FROM `table_1` WHERE ((`table_1`.`column_3` = ?) AND (`table_1`.`column_3` > ?))
? = 1
? = 10
----
NULL

statement ok
DELETE FROM `table_1` WHERE (`column_6` = 0)


statement ok
DELETE FROM `table_1` WHERE (`column_6` = 1)


statement ok
DELETE FROM `table_1` WHERE (`column_6` = 2)


statement ok
DELETE FROM `table_1` WHERE (`column_6` = 3)


statement ok
DELETE FROM `table_1` WHERE (`column_6` = 4)


query  rowsort
SELECT `table_1`.`column_1` AS `alias_1` FROM `table_1` WHERE (`table_1`.`column_1` = ?)
? = 1
----


query  rowsort
SELECT min(`table_1`.`column_2`) AS `alias_1` FROM `table_1`
----
-2142308374

query  rowsort
SELECT `table_1`.`column_1` AS `alias_1` FROM `table_1` WHERE (`table_1`.`column_1` > ?)
? = 10
----
1839684437
378441560
901186004

query  rowsort
SELECT min(`table_1`.`column_3`) AS `alias_1` FROM `table_1` WHERE (`table_1`.`column_1` = ?)
? = 1
----
NULL

query  rowsort
SELECT `table_1`.`column_1` AS `alias_1` FROM `table_1` WHERE ((`table_1`.`column_1` = ?) AND (`table_1`.`column_1` > ?))
? = 1
? = 10
----


query  rowsort
SELECT min(`table_1`.`column_4`) AS `alias_1` FROM `table_1` WHERE (`table_1`.`column_3` > ?)
? = 10
----
1273710299

query  rowsort
SELECT min(`table_1`.`column_5`) AS `alias_1` FROM `table_1` WHERE ((`table_1`.`column_3` = ?) AND (`table_1`.`column_3` > ?))
? = 1
? = 10
----
NULL
