# Generated by:
#     target/debug/noria-logictest permute --compare-to mysql://root:noria@127.1/noria -d 3 -o logictests/generated/mysql/ --only range_param --random --include-deletes --rows-per-table 10 --subquery-depth 1

statement ok
CREATE TABLE `table_1` (`column_4` INT, `column_3` INT, `column_6` INT, `column_1` INT, `column_5` INT, `column_2` INT, PRIMARY KEY (`column_6`))


statement ok
INSERT INTO `table_1` (`column_4`, `column_3`, `column_6`, `column_1`, `column_5`, `column_2`) VALUES (463967871, -1422497004, 0, 1254184371, -1769974109, 946175725), (1364269620, -932501400, 1, 228794819, 2068533101, -1276394002), (2052260641, 1628876767, 2, 1360958279, 20728937, -1822132156), (-2023513811, -751303461, 3, 740167714, -1621749787, -1913496217), (484921718, -568717424, 4, -615353407, 366354150, -740505323), (839489151, -485645586, 5, -269967931, 324003214, 808605483), (207989708, -1355163037, 6, -298294107, 1950326944, 30217035), (900946691, -1535321751, 7, 2063030197, 1793451639, -2041527222), (628158314, -1656342205, 8, 1919033204, -830442462, -1957351349), (1625065450, -162228935, 9, 2086888663, 2029945486, 1075724634)


query  rowsort
SELECT `table_1`.`column_1` AS `alias_1` FROM `table_1` WHERE (`table_1`.`column_1` = ?)
? = 1
----


query  rowsort
SELECT avg(`table_1`.`column_2`) AS `alias_1` FROM `table_1`
----
-689068339.2000

query  rowsort
SELECT `table_1`.`column_1` AS `alias_1` FROM `table_1` WHERE (`table_1`.`column_1` > ?)
? = 10
----
1254184371
1360958279
1919033204
2063030197
2086888663
228794819
740167714

query  rowsort
SELECT avg(`table_1`.`column_3`) AS `alias_1` FROM `table_1` WHERE (`table_1`.`column_1` = ?)
? = 1
----
NULL

query  rowsort
SELECT `table_1`.`column_1` AS `alias_1` FROM `table_1` WHERE ((`table_1`.`column_1` = ?) AND (`table_1`.`column_1` > ?))
? = 1
? = 10
----


query  rowsort
SELECT avg(`table_1`.`column_4`) AS `alias_1` FROM `table_1` WHERE (`table_1`.`column_4` > ?)
? = 10
----
951896573.7778

query  rowsort
SELECT avg(`table_1`.`column_5`) AS `alias_1` FROM `table_1` WHERE ((`table_1`.`column_4` = ?) AND (`table_1`.`column_4` > ?))
? = 1
? = 10
----
NULL

statement ok
DELETE FROM `table_1` WHERE (`column_6` = 0)


statement ok
DELETE FROM `table_1` WHERE (`column_6` = 1)


statement ok
DELETE FROM `table_1` WHERE (`column_6` = 2)


statement ok
DELETE FROM `table_1` WHERE (`column_6` = 3)


statement ok
DELETE FROM `table_1` WHERE (`column_6` = 4)


query  rowsort
SELECT `table_1`.`column_1` AS `alias_1` FROM `table_1` WHERE (`table_1`.`column_1` = ?)
? = 1
----


query  rowsort
SELECT avg(`table_1`.`column_2`) AS `alias_1` FROM `table_1`
----
-416866283.8000

query  rowsort
SELECT `table_1`.`column_1` AS `alias_1` FROM `table_1` WHERE (`table_1`.`column_1` > ?)
? = 10
----
1919033204
2063030197
2086888663

query  rowsort
SELECT avg(`table_1`.`column_3`) AS `alias_1` FROM `table_1` WHERE (`table_1`.`column_1` = ?)
? = 1
----
NULL

query  rowsort
SELECT `table_1`.`column_1` AS `alias_1` FROM `table_1` WHERE ((`table_1`.`column_1` = ?) AND (`table_1`.`column_1` > ?))
? = 1
? = 10
----


query  rowsort
SELECT avg(`table_1`.`column_4`) AS `alias_1` FROM `table_1` WHERE (`table_1`.`column_4` > ?)
? = 10
----
840329862.8000

query  rowsort
SELECT avg(`table_1`.`column_5`) AS `alias_1` FROM `table_1` WHERE ((`table_1`.`column_4` = ?) AND (`table_1`.`column_4` > ?))
? = 1
? = 10
----
NULL
