# Generated by:
#     target/debug/noria-logictest permute --compare-to mysql://root:noria@127.1/noria -d 3 -o logictests/generated/mysql/ --only range_param --random --include-deletes --rows-per-table 10 --subquery-depth 1

statement ok
CREATE TABLE `table_1` (`column_5` INT, `column_3` INT, `column_6` INT, `column_2` INT, `column_4` INT, `column_1` INT, PRIMARY KEY (`column_6`))


statement ok
INSERT INTO `table_1` (`column_5`, `column_3`, `column_6`, `column_2`, `column_4`, `column_1`) VALUES (647090060, -1089196853, 0, 1439832591, -1400825501, -1584220838), (-728394359, 1547658175, 1, -1743504763, 626575431, 891663662), (-1557092080, -888908125, 2, -618098323, -733463441, -891650258), (1509980990, -959736913, 3, 1191215717, -1549108797, -1804595111), (-1030900469, 1504949315, 4, 707978780, -895743491, 306479000), (-1415657887, -1770042705, 5, 1311007394, 428630238, 1247535572), (767169788, -1366598315, 6, -1569289914, 228699509, -1383983205), (679528073, 170464140, 7, -1276168254, -2007753216, -2108747746), (-1535675835, 1980102045, 8, -1188855376, -316702268, 567581366), (1204562087, 1375150848, 9, 673411793, 1837772998, 1427004138)


query  rowsort
SELECT `table_1`.`column_1` AS `alias_1` FROM `table_1` WHERE (`table_1`.`column_1` = ?)
? = 1
----


query  rowsort
SELECT avg(distinct `table_1`.`column_2`) AS `alias_1` FROM `table_1`
----
-107247035.5000

query  rowsort
SELECT `table_1`.`column_2` AS `alias_1` FROM `table_1` WHERE (`table_1`.`column_2` > ?)
? = 10
----
1191215717
1311007394
1439832591
673411793
707978780

query  rowsort
SELECT avg(distinct `table_1`.`column_3`) AS `alias_1` FROM `table_1` WHERE (`table_1`.`column_2` = ?)
? = 1
----
NULL

query  rowsort
SELECT `table_1`.`column_2` AS `alias_1` FROM `table_1` WHERE ((`table_1`.`column_2` = ?) AND (`table_1`.`column_2` > ?))
? = 1
? = 10
----


query  rowsort
SELECT avg(distinct `table_1`.`column_4`) AS `alias_1` FROM `table_1` WHERE (`table_1`.`column_3` > ?)
? = 10
----
-151170109.2000

query  rowsort
SELECT avg(distinct `table_1`.`column_5`) AS `alias_1` FROM `table_1` WHERE ((`table_1`.`column_3` = ?) AND (`table_1`.`column_5` > ?))
? = 1
? = 10
----
NULL

statement ok
DELETE FROM `table_1` WHERE (`column_6` = 0)


statement ok
DELETE FROM `table_1` WHERE (`column_6` = 1)


statement ok
DELETE FROM `table_1` WHERE (`column_6` = 2)


statement ok
DELETE FROM `table_1` WHERE (`column_6` = 3)


statement ok
DELETE FROM `table_1` WHERE (`column_6` = 4)


query  rowsort
SELECT `table_1`.`column_1` AS `alias_1` FROM `table_1` WHERE (`table_1`.`column_1` = ?)
? = 1
----


query  rowsort
SELECT avg(distinct `table_1`.`column_2`) AS `alias_1` FROM `table_1`
----
-409978871.4000

query  rowsort
SELECT `table_1`.`column_2` AS `alias_1` FROM `table_1` WHERE (`table_1`.`column_2` > ?)
? = 10
----
1311007394
673411793

query  rowsort
SELECT avg(distinct `table_1`.`column_3`) AS `alias_1` FROM `table_1` WHERE (`table_1`.`column_2` = ?)
? = 1
----
NULL

query  rowsort
SELECT `table_1`.`column_2` AS `alias_1` FROM `table_1` WHERE ((`table_1`.`column_2` = ?) AND (`table_1`.`column_2` > ?))
? = 1
? = 10
----


query  rowsort
SELECT avg(distinct `table_1`.`column_4`) AS `alias_1` FROM `table_1` WHERE (`table_1`.`column_3` > ?)
? = 10
----
-162227495.3333

query  rowsort
SELECT avg(distinct `table_1`.`column_5`) AS `alias_1` FROM `table_1` WHERE ((`table_1`.`column_3` = ?) AND (`table_1`.`column_5` > ?))
? = 1
? = 10
----
NULL
