# Generated by:
#     target/debug/noria-logictest permute --compare-to mysql://root:noria@127.1/noria -d 3 -o logictests/generated/mysql/ --only range_param --random --include-deletes --rows-per-table 10 --subquery-depth 1

statement ok
CREATE TABLE `table_2` (`column_2` INT, `column_1` INT, `column_3` INT, `column_6` INT, `column_4` INT, `column_5` INT, PRIMARY KEY (`column_6`))


statement ok
CREATE TABLE `table_5` (`column_1` INT, `column_2` INT, `column_3` INT, PRIMARY KEY (`column_3`))


statement ok
CREATE TABLE `table_1` (`column_1` INT, `column_2` INT, `column_3` INT, PRIMARY KEY (`column_3`))


statement ok
CREATE TABLE `table_3` (`column_1` INT, `column_2` INT, `column_3` INT, PRIMARY KEY (`column_3`))


statement ok
CREATE TABLE `table_4` (`column_1` INT, `column_3` INT, `column_2` INT, PRIMARY KEY (`column_3`))


statement ok
INSERT INTO `table_2` (`column_2`, `column_1`, `column_3`, `column_6`, `column_4`, `column_5`) VALUES (-420817439, -800456951, -503687638, 0, -312544865, -1308879318), (-1256296200, 994976336, 1390227710, 1, 2087815646, -712745150), (1590982105, -840126562, 390738899, 2, -95075272, 1742279238), (846277345, -1647210944, -962551711, 3, 2145942812, 525292544), (350719047, -1763714858, 1273227997, 4, 357141263, 718363893), (-653883110, 323257085, -1112391940, 5, 498511141, 1387401882), (156460471, -974857381, 285149413, 6, -1331231771, 1113631266), (-694072477, 558767797, 1725756697, 7, 191686926, 1781458803), (2141370422, -155683639, -475939827, 8, -62861984, -1246076429), (611294809, -649125748, -1155390950, 9, 39176290, 1584776748)


statement ok
INSERT INTO `table_5` (`column_1`, `column_2`, `column_3`) VALUES (1966012129, -1001757610, 0), (-1106402288, -163347253, 1), (194575712, -1669844666, 2), (-1351840956, 1454288524, 3), (1152929684, 887787141, 4), (-1221494641, -87531658, 5), (-1441423959, 633535159, 6), (-1549120847, 2011172699, 7), (27933284, 429778202, 8), (437910999, 1705190439, 9)


statement ok
INSERT INTO `table_1` (`column_1`, `column_2`, `column_3`) VALUES (1592123020, 1599659963, 0), (-1647266001, -2142823988, 1), (942741832, 2063933072, 2), (-36465871, -841644937, 3), (1380349998, -1318511047, 4), (1350939430, -573134634, 5), (338679260, 982874179, 6), (563456225, -64118967, 7), (1615123609, -227714380, 8), (-997579175, -1891884196, 9)


statement ok
INSERT INTO `table_3` (`column_1`, `column_2`, `column_3`) VALUES (1387277701, -1711554354, 0), (1506735988, 1784278357, 1), (250589049, 1440497295, 2), (1451783452, 75919029, 3), (-388862043, -1418062381, 4), (975318344, -356240468, 5), (-1938744799, 1432803467, 6), (-430096520, -1355211554, 7), (-627275385, -381931062, 8), (-988336780, -730845126, 9)


statement ok
INSERT INTO `table_4` (`column_1`, `column_3`, `column_2`) VALUES (-1322228122, 0, -1921956853), (1747757432, 1, -1209353162), (-222975643, 2, 284810031), (240169631, 3, 1926516163), (-155408838, 4, 2139815300), (274407128, 5, -1730429473), (1242198751, 6, -2058557583), (-1298963073, 7, 545364567), (-1320130552, 8, -1518645284), (-430348876, 9, -364716033)


query  rowsort
SELECT `table_1`.`column_1` AS `alias_1` FROM `table_1` WHERE (`table_1`.`column_1` = ?)
? = 1
----


query  rowsort
SELECT `table_1`.`column_2` AS `alias_1`, `table_2`.`column_2` AS `alias_2` FROM `table_1` LEFT JOIN `table_2` ON (`table_1`.`column_1` = `table_2`.`column_1`)
----
-1318511047
NULL
-1891884196
NULL
-2142823988
NULL
-227714380
NULL
-573134634
NULL
-64118967
NULL
-841644937
NULL
1599659963
NULL
2063933072
NULL
982874179
NULL

query  rowsort
SELECT `table_2`.`column_2` AS `alias_1` FROM `table_2` WHERE (`table_2`.`column_2` > ?)
? = 10
----
156460471
1590982105
2141370422
350719047
611294809
846277345

query  rowsort
SELECT `table_2`.`column_3` AS `alias_1`, `table_3`.`column_2` AS `alias_2` FROM `table_2` LEFT JOIN `table_3` ON (`table_2`.`column_2` = `table_3`.`column_1`) WHERE (`table_2`.`column_2` = ?)
? = 1
----


query  rowsort
SELECT `table_2`.`column_2` AS `alias_1` FROM `table_2` WHERE ((`table_2`.`column_2` = ?) AND (`table_2`.`column_2` > ?))
? = 1
? = 10
----


query  rowsort
SELECT `table_2`.`column_4` AS `alias_1`, `table_4`.`column_2` AS `alias_2` FROM `table_2` LEFT JOIN `table_4` ON (`table_2`.`column_2` = `table_4`.`column_1`) WHERE (`table_2`.`column_2` > ?)
? = 10
----
-1331231771
NULL
-62861984
NULL
-95075272
NULL
2145942812
NULL
357141263
NULL
39176290
NULL

query  rowsort
SELECT `table_2`.`column_5` AS `alias_1`, `table_5`.`column_2` AS `alias_2` FROM `table_2` LEFT JOIN `table_5` ON (`table_2`.`column_2` = `table_5`.`column_1`) WHERE ((`table_2`.`column_2` = ?) AND (`table_2`.`column_2` > ?))
? = 1
? = 10
----


statement ok
DELETE FROM `table_2` WHERE (`column_6` = 0)


statement ok
DELETE FROM `table_2` WHERE (`column_6` = 1)


statement ok
DELETE FROM `table_2` WHERE (`column_6` = 2)


statement ok
DELETE FROM `table_2` WHERE (`column_6` = 3)


statement ok
DELETE FROM `table_2` WHERE (`column_6` = 4)


statement ok
DELETE FROM `table_5` WHERE (`column_3` = 0)


statement ok
DELETE FROM `table_5` WHERE (`column_3` = 1)


statement ok
DELETE FROM `table_5` WHERE (`column_3` = 2)


statement ok
DELETE FROM `table_5` WHERE (`column_3` = 3)


statement ok
DELETE FROM `table_5` WHERE (`column_3` = 4)


statement ok
DELETE FROM `table_1` WHERE (`column_3` = 0)


statement ok
DELETE FROM `table_1` WHERE (`column_3` = 1)


statement ok
DELETE FROM `table_1` WHERE (`column_3` = 2)


statement ok
DELETE FROM `table_1` WHERE (`column_3` = 3)


statement ok
DELETE FROM `table_1` WHERE (`column_3` = 4)


statement ok
DELETE FROM `table_3` WHERE (`column_3` = 0)


statement ok
DELETE FROM `table_3` WHERE (`column_3` = 1)


statement ok
DELETE FROM `table_3` WHERE (`column_3` = 2)


statement ok
DELETE FROM `table_3` WHERE (`column_3` = 3)


statement ok
DELETE FROM `table_3` WHERE (`column_3` = 4)


statement ok
DELETE FROM `table_4` WHERE (`column_3` = 0)


statement ok
DELETE FROM `table_4` WHERE (`column_3` = 1)


statement ok
DELETE FROM `table_4` WHERE (`column_3` = 2)


statement ok
DELETE FROM `table_4` WHERE (`column_3` = 3)


statement ok
DELETE FROM `table_4` WHERE (`column_3` = 4)


query  rowsort
SELECT `table_1`.`column_1` AS `alias_1` FROM `table_1` WHERE (`table_1`.`column_1` = ?)
? = 1
----


query  rowsort
SELECT `table_1`.`column_2` AS `alias_1`, `table_2`.`column_2` AS `alias_2` FROM `table_1` LEFT JOIN `table_2` ON (`table_1`.`column_1` = `table_2`.`column_1`)
----
-1891884196
NULL
-227714380
NULL
-573134634
NULL
-64118967
NULL
982874179
NULL

query  rowsort
SELECT `table_2`.`column_2` AS `alias_1` FROM `table_2` WHERE (`table_2`.`column_2` > ?)
? = 10
----
156460471
2141370422
611294809

query  rowsort
SELECT `table_2`.`column_3` AS `alias_1`, `table_3`.`column_2` AS `alias_2` FROM `table_2` LEFT JOIN `table_3` ON (`table_2`.`column_2` = `table_3`.`column_1`) WHERE (`table_2`.`column_2` = ?)
? = 1
----


query  rowsort
SELECT `table_2`.`column_2` AS `alias_1` FROM `table_2` WHERE ((`table_2`.`column_2` = ?) AND (`table_2`.`column_2` > ?))
? = 1
? = 10
----


query  rowsort
SELECT `table_2`.`column_4` AS `alias_1`, `table_4`.`column_2` AS `alias_2` FROM `table_2` LEFT JOIN `table_4` ON (`table_2`.`column_2` = `table_4`.`column_1`) WHERE (`table_2`.`column_2` > ?)
? = 10
----
-1331231771
NULL
-62861984
NULL
39176290
NULL

query  rowsort
SELECT `table_2`.`column_5` AS `alias_1`, `table_5`.`column_2` AS `alias_2` FROM `table_2` LEFT JOIN `table_5` ON (`table_2`.`column_2` = `table_5`.`column_1`) WHERE ((`table_2`.`column_2` = ?) AND (`table_2`.`column_2` > ?))
? = 1
? = 10
----

