# Generated by:
#     target/debug/noria-logictest permute --compare-to mysql://root:noria@127.1/noria -d 3 -o logictests/generated/mysql/ --only range_param --random --include-deletes --rows-per-table 10 --subquery-depth 1 --overwrite-tests

statement ok
CREATE TABLE `table_1` (`column_4` INT, `column_5` INT, `column_3` INT, `column_2` INT, `column_1` INT, PRIMARY KEY (`column_5`))


statement ok
INSERT INTO `table_1` (`column_4`, `column_5`, `column_3`, `column_2`, `column_1`) VALUES (-1965198210, 0, -977270315, 496437931, 1457627698), (-1215517624, 1, 2021280875, 504189709, 2011762077), (-32773016, 2, 1795423146, -1900043388, 1190808473), (1594427100, 3, 640462976, 692722455, 412019302), (990753553, 4, -1411619604, 250121592, -1434113972), (1249642036, 5, 1963701190, 1434081714, 1961417266), (1911873944, 6, -1873361753, 1102986320, -1735916355), (-1704080572, 7, 1910436360, -819394134, 952317430), (-1392018742, 8, -1026166935, 1522857156, 1333005205), (1248131556, 9, 1524886295, 1172368479, 1870927648)


query  rowsort
SELECT sum(`table_1`.`column_1`) AS `alias_1` FROM `table_1`
----
8019854772

query  rowsort
SELECT 1 AS `alias_1`
----
1

query  rowsort
SELECT `table_1`.`column_1` AS `alias_1` FROM `table_1` WHERE (`table_1`.`column_1` > ?)
? = 10
----
1190808473
1333005205
1457627698
1870927648
1961417266
2011762077
412019302
952317430

query  rowsort
SELECT sum(`table_1`.`column_2`) AS `alias_1`, 1 AS `alias_2` FROM `table_1`
----
4456327834
1

query  rowsort
SELECT sum(`table_1`.`column_3`) AS `alias_1` FROM `table_1` WHERE (`table_1`.`column_2` > ?)
? = 10
----
861912729

query  rowsort
SELECT 1 AS `alias_1` FROM `table_1` WHERE (`table_1`.`column_2` > ?)
? = 10
----
1
1
1
1
1
1
1
1

query  rowsort
SELECT sum(`table_1`.`column_4`) AS `alias_1`, 1 AS `alias_2` FROM `table_1` WHERE (`table_1`.`column_4` > ?)
? = 10
----
6994828189
1

statement ok
DELETE FROM `table_1` WHERE (`column_5` = 0)


statement ok
DELETE FROM `table_1` WHERE (`column_5` = 1)


statement ok
DELETE FROM `table_1` WHERE (`column_5` = 2)


statement ok
DELETE FROM `table_1` WHERE (`column_5` = 3)


statement ok
DELETE FROM `table_1` WHERE (`column_5` = 4)


query  rowsort
SELECT sum(`table_1`.`column_1`) AS `alias_1` FROM `table_1`
----
4381751194

query  rowsort
SELECT 1 AS `alias_1`
----
1

query  rowsort
SELECT `table_1`.`column_1` AS `alias_1` FROM `table_1` WHERE (`table_1`.`column_1` > ?)
? = 10
----
1333005205
1870927648
1961417266
952317430

query  rowsort
SELECT sum(`table_1`.`column_2`) AS `alias_1`, 1 AS `alias_2` FROM `table_1`
----
4412899535
1

query  rowsort
SELECT sum(`table_1`.`column_3`) AS `alias_1` FROM `table_1` WHERE (`table_1`.`column_2` > ?)
? = 10
----
589058797

query  rowsort
SELECT 1 AS `alias_1` FROM `table_1` WHERE (`table_1`.`column_2` > ?)
? = 10
----
1
1
1
1

query  rowsort
SELECT sum(`table_1`.`column_4`) AS `alias_1`, 1 AS `alias_2` FROM `table_1` WHERE (`table_1`.`column_4` > ?)
? = 10
----
4409647536
1
