# Generated by:
#     target/debug/noria-logictest permute --compare-to mysql://root:noria@127.1/noria -d 3 -o logictests/generated/mysql/ --only range_param --random --include-deletes --rows-per-table 10 --subquery-depth 1 --overwrite-tests

statement ok
CREATE TABLE `table_3` (`column_3` INT, `column_4` INT, `column_5` INT, `column_1` INT, `column_2` INT, PRIMARY KEY (`column_5`))


statement ok
CREATE TABLE `table_4` (`column_2` INT, `column_3` INT, `column_1` INT, PRIMARY KEY (`column_3`))


statement ok
CREATE TABLE `table_1` (`column_1` INT, `column_5` INT, `column_6` INT, `column_7` INT, `column_4` INT, `column_3` INT, `column_2` INT, PRIMARY KEY (`column_7`))


statement ok
CREATE TABLE `table_5` (`column_2` INT, `column_3` INT, `column_1` INT, PRIMARY KEY (`column_3`))


statement ok
CREATE TABLE `table_2` (`column_2` INT, `column_3` INT, `column_1` INT, PRIMARY KEY (`column_3`))


statement ok
INSERT INTO `table_3` (`column_3`, `column_4`, `column_5`, `column_1`, `column_2`) VALUES (262698982, 2122972475, 0, -436183288, -1821450821), (1530478126, 186026100, 1, 1026621743, 79733278), (2068148571, -1569812775, 2, 182437676, -1489921516), (1797897859, -369576086, 3, -779539429, -621424638), (-1505576145, -1416936004, 4, 800821672, -2084317736), (-2069132574, 1437190080, 5, -1058319174, -1309026866), (781211855, -1653531927, 6, 993195422, -1608825060), (-293325175, -291073341, 7, -2058334873, 235001416), (908084797, 1886823828, 8, 44048769, -1649216262), (1767547945, -624877933, 9, 1215916822, 254437533)


statement ok
INSERT INTO `table_4` (`column_2`, `column_3`, `column_1`) VALUES (1206883909, 0, 703350463), (802751079, 1, -1020713260), (-956305975, 2, -8525816), (-1297791755, 3, 1703080154), (616248720, 4, -1149399973), (2061637498, 5, -773377827), (118843957, 6, 374676440), (-1384451137, 7, -1732537279), (-1278555920, 8, 322755605), (-1567018262, 9, 16043715)


statement ok
INSERT INTO `table_1` (`column_1`, `column_5`, `column_6`, `column_7`, `column_4`, `column_3`, `column_2`) VALUES (-1003850334, -1055112271, 1978401552, 0, 224796620, 2031251996, 430587059), (1126092412, 1387681328, 53195484, 1, -519332564, 578911855, -1849948569), (-1339409666, -811979640, 1286646383, 2, -160779653, -526319644, -1702939752), (1227729673, -1309764963, -1473292622, 3, -153676217, -534023360, -40939549), (385227517, 612279179, -1031146667, 4, 1383597630, 1397002307, -1065270323), (1773237589, -1180544398, -1115404431, 5, -691495312, 1501958634, 2087466374), (34553616, -1321266727, 546253068, 6, 2070802360, -1671391333, 1180132214), (-1288169121, 1828580648, -1022324186, 7, 1216101060, 293596308, 577477929), (788542929, 1778886281, -444568563, 8, -1419582349, -482635147, 346558313), (994983342, -874849158, -1035034118, 9, 1043556194, -2015209531, -1283249366)


statement ok
INSERT INTO `table_5` (`column_2`, `column_3`, `column_1`) VALUES (-1901427019, 0, 152331621), (341485111, 1, 1002547759), (-1286870388, 2, -555552971), (-1118232539, 3, -310672810), (-1781056201, 4, -2006727731), (548488637, 5, 1288624390), (2054874952, 6, -1129909632), (-1784199840, 7, 578109522), (-90838536, 8, 62737664), (953668349, 9, -1092057343)


statement ok
INSERT INTO `table_2` (`column_2`, `column_3`, `column_1`) VALUES (-460153435, 0, 56475434), (638417211, 1, 1865768710), (-1560788452, 2, -1921790772), (-1169844160, 3, 1723314754), (-1617244699, 4, 539372037), (44804637, 5, 433769630), (216819577, 6, 671106016), (-874625772, 7, -903575959), (420979041, 8, 1834381150), (1255987459, 9, 397776158)


query  rowsort
SELECT sum(`table_1`.`column_1`) AS `alias_1` FROM `table_1`
----
2698937957

query  rowsort
SELECT `table_1`.`column_2` AS `alias_1`, `table_2`.`column_2` AS `alias_2` FROM `table_1` LEFT JOIN `table_2` ON (`table_1`.`column_1` = `table_2`.`column_1`)
----
-1065270323
NULL
-1283249366
NULL
-1702939752
NULL
-1849948569
NULL
-40939549
NULL
1180132214
NULL
2087466374
NULL
346558313
NULL
430587059
NULL
577477929
NULL

query  rowsort
SELECT `table_1`.`column_1` AS `alias_1` FROM `table_1` WHERE (`table_1`.`column_1` > ?)
? = 10
----
1126092412
1227729673
1773237589
34553616
385227517
788542929
994983342

query  rowsort
SELECT sum(`table_1`.`column_3`) AS `alias_1`, `table_1`.`column_4` AS `alias_2`, `table_3`.`column_2` AS `alias_3` FROM `table_1` LEFT JOIN `table_3` ON (`table_1`.`column_1` = `table_3`.`column_1`) GROUP BY `table_1`.`column_4`, `table_3`.`column_2`
----
30 values hashing to b286892fb2ffc9b7ce5924e24f377269

query  rowsort
SELECT sum(`table_1`.`column_5`) AS `alias_1` FROM `table_1` WHERE (`table_1`.`column_1` > ?)
? = 10
----
-907578458

query  rowsort
SELECT `table_1`.`column_6` AS `alias_1`, `table_4`.`column_2` AS `alias_2` FROM `table_1` LEFT JOIN `table_4` ON (`table_1`.`column_1` = `table_4`.`column_1`) WHERE (`table_1`.`column_1` > ?)
? = 10
----
-1031146667
NULL
-1035034118
NULL
-1115404431
NULL
-1473292622
NULL
-444568563
NULL
53195484
NULL
546253068
NULL

query  rowsort
SELECT sum(`table_3`.`column_3`) AS `alias_1`, `table_3`.`column_4` AS `alias_2`, `table_5`.`column_2` AS `alias_3` FROM `table_3` LEFT JOIN `table_5` ON (`table_3`.`column_3` = `table_5`.`column_1`) WHERE (`table_3`.`column_3` > ?) GROUP BY `table_3`.`column_4`, `table_5`.`column_2`
? = 10
----
21 values hashing to 82a6248f6924fd1e229888880df11445

statement ok
DELETE FROM `table_3` WHERE (`column_5` = 0)


statement ok
DELETE FROM `table_3` WHERE (`column_5` = 1)


statement ok
DELETE FROM `table_3` WHERE (`column_5` = 2)


statement ok
DELETE FROM `table_3` WHERE (`column_5` = 3)


statement ok
DELETE FROM `table_3` WHERE (`column_5` = 4)


statement ok
DELETE FROM `table_4` WHERE (`column_3` = 0)


statement ok
DELETE FROM `table_4` WHERE (`column_3` = 1)


statement ok
DELETE FROM `table_4` WHERE (`column_3` = 2)


statement ok
DELETE FROM `table_4` WHERE (`column_3` = 3)


statement ok
DELETE FROM `table_4` WHERE (`column_3` = 4)


statement ok
DELETE FROM `table_1` WHERE (`column_7` = 0)


statement ok
DELETE FROM `table_1` WHERE (`column_7` = 1)


statement ok
DELETE FROM `table_1` WHERE (`column_7` = 2)


statement ok
DELETE FROM `table_1` WHERE (`column_7` = 3)


statement ok
DELETE FROM `table_1` WHERE (`column_7` = 4)


statement ok
DELETE FROM `table_5` WHERE (`column_3` = 0)


statement ok
DELETE FROM `table_5` WHERE (`column_3` = 1)


statement ok
DELETE FROM `table_5` WHERE (`column_3` = 2)


statement ok
DELETE FROM `table_5` WHERE (`column_3` = 3)


statement ok
DELETE FROM `table_5` WHERE (`column_3` = 4)


statement ok
DELETE FROM `table_2` WHERE (`column_3` = 0)


statement ok
DELETE FROM `table_2` WHERE (`column_3` = 1)


statement ok
DELETE FROM `table_2` WHERE (`column_3` = 2)


statement ok
DELETE FROM `table_2` WHERE (`column_3` = 3)


statement ok
DELETE FROM `table_2` WHERE (`column_3` = 4)


query  rowsort
SELECT sum(`table_1`.`column_1`) AS `alias_1` FROM `table_1`
----
2303148355

query  rowsort
SELECT `table_1`.`column_2` AS `alias_1`, `table_2`.`column_2` AS `alias_2` FROM `table_1` LEFT JOIN `table_2` ON (`table_1`.`column_1` = `table_2`.`column_1`)
----
-1283249366
NULL
1180132214
NULL
2087466374
NULL
346558313
NULL
577477929
NULL

query  rowsort
SELECT `table_1`.`column_1` AS `alias_1` FROM `table_1` WHERE (`table_1`.`column_1` > ?)
? = 10
----
1773237589
34553616
788542929
994983342

query  rowsort
SELECT sum(`table_1`.`column_3`) AS `alias_1`, `table_1`.`column_4` AS `alias_2`, `table_3`.`column_2` AS `alias_3` FROM `table_1` LEFT JOIN `table_3` ON (`table_1`.`column_1` = `table_3`.`column_1`) GROUP BY `table_1`.`column_4`, `table_3`.`column_2`
----
-1671391333
2070802360
NULL
-2015209531
1043556194
NULL
-482635147
-1419582349
NULL
1501958634
-691495312
NULL
293596308
1216101060
NULL

query  rowsort
SELECT sum(`table_1`.`column_5`) AS `alias_1` FROM `table_1` WHERE (`table_1`.`column_1` > ?)
? = 10
----
-1597774002

query  rowsort
SELECT `table_1`.`column_6` AS `alias_1`, `table_4`.`column_2` AS `alias_2` FROM `table_1` LEFT JOIN `table_4` ON (`table_1`.`column_1` = `table_4`.`column_1`) WHERE (`table_1`.`column_1` > ?)
? = 10
----
-1035034118
NULL
-1115404431
NULL
-444568563
NULL
546253068
NULL

query  rowsort
SELECT sum(`table_3`.`column_3`) AS `alias_1`, `table_3`.`column_4` AS `alias_2`, `table_5`.`column_2` AS `alias_3` FROM `table_3` LEFT JOIN `table_5` ON (`table_3`.`column_3` = `table_5`.`column_1`) WHERE (`table_3`.`column_3` > ?) GROUP BY `table_3`.`column_4`, `table_5`.`column_2`
? = 10
----
1767547945
-624877933
NULL
781211855
-1653531927
NULL
908084797
1886823828
NULL
