# Generated by:
#     target/debug/noria-logictest permute --compare-to mysql://root:noria@127.1/noria -d 3 -o logictests/generated/mysql/ --only range_param --random --include-deletes --rows-per-table 10 --subquery-depth 1 --overwrite-tests

statement ok
CREATE TABLE `table_1` (`column_7` INT, `column_5` INT, `column_6` INT, `column_8` INT, `column_3` INT, `column_1` INT, `column_2` INT, `column_9` INT, `column_4` INT, PRIMARY KEY (`column_9`))


statement ok
INSERT INTO `table_1` (`column_7`, `column_5`, `column_6`, `column_8`, `column_3`, `column_1`, `column_2`, `column_9`, `column_4`) VALUES (-1657461063, -1413327581, 1591266142, -1826310506, 2045827838, -610590673, -241599206, 0, 2106908783), (-640076611, 1693897839, 2043001546, 1975778981, 511618149, 2135525783, 1751001134, 1, -1182285809), (-989221262, -1794281939, 2016492257, 1138722091, 1007457221, -267506963, 1286417316, 2, 569488159), (511055101, 1688083713, 1324608359, -1110398192, -701509950, 669416890, 447245796, 3, 1030910942), (-1260483258, 1059779952, -1679996842, -1764696509, 1159137320, -1612763773, 1243117992, 4, 435606933), (1678176594, 1197978430, 1264914075, 1275400963, 1061892487, 568091797, 187904812, 5, -1626196974), (-1156759184, 1915124768, -1146979614, -1318285240, -1751068420, -1110201625, 1383029889, 6, 1996785333), (-850407881, -334812273, 561785754, -1651186366, 1700298131, -872755438, 745666789, 7, 1212714985), (-447247584, -658339583, 290927508, 2023680979, 1665843360, -657112005, -267499996, 8, 223351964), (1946847169, 2118297310, -29622977, -378493736, 1804768528, -547951558, -1420628313, 9, 889899496)


query  rowsort
SELECT sum(`table_1`.`column_1`) AS `alias_1` FROM `table_1`
----
-2305847565

query  rowsort
SELECT count(distinct `table_1`.`column_2`) AS `alias_1` FROM `table_1`
----
10

query  rowsort
SELECT `table_1`.`column_2` AS `alias_1` FROM `table_1` WHERE (`table_1`.`column_2` > ?)
? = 10
----
1243117992
1286417316
1383029889
1751001134
187904812
447245796
745666789

query  rowsort
SELECT sum(`table_1`.`column_3`) AS `alias_1`, count(distinct `table_1`.`column_4`) AS `alias_2` FROM `table_1`
----
8504264664
10

query  rowsort
SELECT sum(`table_1`.`column_5`) AS `alias_1` FROM `table_1` WHERE (`table_1`.`column_3` > ?)
? = 10
----
1869192155

query  rowsort
SELECT count(distinct `table_1`.`column_6`) AS `alias_1` FROM `table_1` WHERE (`table_1`.`column_3` > ?)
? = 10
----
8

query  rowsort
SELECT sum(`table_1`.`column_7`) AS `alias_1`, count(distinct `table_1`.`column_8`) AS `alias_2` FROM `table_1` WHERE (`table_1`.`column_7` > ?)
? = 10
----
4136078864
3

statement ok
DELETE FROM `table_1` WHERE (`column_9` = 0)


statement ok
DELETE FROM `table_1` WHERE (`column_9` = 1)


statement ok
DELETE FROM `table_1` WHERE (`column_9` = 2)


statement ok
DELETE FROM `table_1` WHERE (`column_9` = 3)


statement ok
DELETE FROM `table_1` WHERE (`column_9` = 4)


query  rowsort
SELECT sum(`table_1`.`column_1`) AS `alias_1` FROM `table_1`
----
-2619928829

query  rowsort
SELECT count(distinct `table_1`.`column_2`) AS `alias_1` FROM `table_1`
----
5

query  rowsort
SELECT `table_1`.`column_2` AS `alias_1` FROM `table_1` WHERE (`table_1`.`column_2` > ?)
? = 10
----
1383029889
187904812
745666789

query  rowsort
SELECT sum(`table_1`.`column_3`) AS `alias_1`, count(distinct `table_1`.`column_4`) AS `alias_2` FROM `table_1`
----
4481734086
5

query  rowsort
SELECT sum(`table_1`.`column_5`) AS `alias_1` FROM `table_1` WHERE (`table_1`.`column_3` > ?)
? = 10
----
2323123884

query  rowsort
SELECT count(distinct `table_1`.`column_6`) AS `alias_1` FROM `table_1` WHERE (`table_1`.`column_3` > ?)
? = 10
----
4

query  rowsort
SELECT sum(`table_1`.`column_7`) AS `alias_1`, count(distinct `table_1`.`column_8`) AS `alias_2` FROM `table_1` WHERE (`table_1`.`column_7` > ?)
? = 10
----
3625023763
2
