# Generated by:
#     target/debug/noria-logictest permute --compare-to mysql://root:noria@127.1/noria -d 3 -o logictests/generated/mysql/ --only range_param --random --include-deletes --rows-per-table 10 --subquery-depth 1 --overwrite-tests

statement ok
CREATE TABLE `table_1` (`column_5` INT, `column_9` INT, `column_7` INT, `column_2` INT, `column_8` INT, `column_4` INT, `column_6` INT, `column_1` INT, `column_3` INT, PRIMARY KEY (`column_9`))


statement ok
INSERT INTO `table_1` (`column_5`, `column_9`, `column_7`, `column_2`, `column_8`, `column_4`, `column_6`, `column_1`, `column_3`) VALUES (-881323115, 0, 1484413186, 1561987695, -755086123, 932609482, -528058524, 345986804, -801143559), (1921365127, 1, -1458790382, 1703297508, 375033047, -633702864, 2003409636, 676258059, 398562492), (828166746, 2, -662408002, -1651295457, -128515502, 541943158, -875335505, -838898645, -1718663792), (-900833030, 3, 177057891, 904848805, 999551591, -630051320, 2075769679, 1927127454, 1182720832), (1675859994, 4, -321459592, 785227691, -968776412, 1036507038, -2093400499, -1607315016, 1465534879), (862021604, 5, 1950849804, -2100961641, 531978035, -1583859861, 1797179074, 1288326213, 459300697), (-332696009, 6, 2005905609, -512963827, 1844398954, -1752848744, 883439410, 1989562392, -1422786963), (654080230, 7, -2035508356, 612811842, -1342027189, 1854104329, 114899451, -270809563, -1226779900), (2118661193, 8, -373126583, -613867547, -223490401, -1396178878, 1738784660, 2059287308, 1531847632), (841901766, 9, 285577658, 508364933, 253623849, -1745366735, -1730593645, 813366753, -456097884)


query  rowsort
SELECT sum(`table_1`.`column_1`) AS `alias_1` FROM `table_1`
----
6382891759

query  rowsort
SELECT sum(distinct `table_1`.`column_2`) AS `alias_1` FROM `table_1`
----
1197450002

query  rowsort
SELECT `table_1`.`column_1` AS `alias_1` FROM `table_1` WHERE (`table_1`.`column_1` > ?)
? = 10
----
1288326213
1927127454
1989562392
2059287308
345986804
676258059
813366753

query  rowsort
SELECT sum(`table_1`.`column_3`) AS `alias_1`, sum(distinct `table_1`.`column_4`) AS `alias_2` FROM `table_1`
----
-587505566
-3376844395

query  rowsort
SELECT sum(`table_1`.`column_5`) AS `alias_1` FROM `table_1` WHERE (`table_1`.`column_4` > ?)
? = 10
----
2276783855

query  rowsort
SELECT sum(distinct `table_1`.`column_6`) AS `alias_1` FROM `table_1` WHERE (`table_1`.`column_4` > ?)
? = 10
----
-3381895077

query  rowsort
SELECT sum(`table_1`.`column_7`) AS `alias_1`, sum(distinct `table_1`.`column_8`) AS `alias_2` FROM `table_1` WHERE (`table_1`.`column_5` > ?)
? = 10
----
-2614865453
-1502174573

statement ok
DELETE FROM `table_1` WHERE (`column_9` = 0)


statement ok
DELETE FROM `table_1` WHERE (`column_9` = 1)


statement ok
DELETE FROM `table_1` WHERE (`column_9` = 2)


statement ok
DELETE FROM `table_1` WHERE (`column_9` = 3)


statement ok
DELETE FROM `table_1` WHERE (`column_9` = 4)


query  rowsort
SELECT sum(`table_1`.`column_1`) AS `alias_1` FROM `table_1`
----
5879733103

query  rowsort
SELECT sum(distinct `table_1`.`column_2`) AS `alias_1` FROM `table_1`
----
-2106616240

query  rowsort
SELECT `table_1`.`column_1` AS `alias_1` FROM `table_1` WHERE (`table_1`.`column_1` > ?)
? = 10
----
1288326213
1989562392
2059287308
813366753

query  rowsort
SELECT sum(`table_1`.`column_3`) AS `alias_1`, sum(distinct `table_1`.`column_4`) AS `alias_2` FROM `table_1`
----
-1114516418
-4624149889

query  rowsort
SELECT sum(`table_1`.`column_5`) AS `alias_1` FROM `table_1` WHERE (`table_1`.`column_4` > ?)
? = 10
----
654080230

query  rowsort
SELECT sum(distinct `table_1`.`column_6`) AS `alias_1` FROM `table_1` WHERE (`table_1`.`column_4` > ?)
? = 10
----
114899451

query  rowsort
SELECT sum(`table_1`.`column_7`) AS `alias_1`, sum(distinct `table_1`.`column_8`) AS `alias_2` FROM `table_1` WHERE (`table_1`.`column_5` > ?)
? = 10
----
-172207477
-779915706
