# Generated by:
#     target/debug/noria-logictest permute --compare-to mysql://root:noria@127.1/noria -d 3 -o logictests/generated/mysql/ --only range_param --random --include-deletes --rows-per-table 10 --subquery-depth 1 --overwrite-tests

statement ok
CREATE TABLE `table_1` (`column_2` INT, `column_6` INT, `column_7` INT, `column_4` INT, `column_1` INT, `column_8` INT, `column_9` INT, `column_5` INT, `column_3` INT, PRIMARY KEY (`column_9`))


statement ok
INSERT INTO `table_1` (`column_2`, `column_6`, `column_7`, `column_4`, `column_1`, `column_8`, `column_9`, `column_5`, `column_3`) VALUES (104837516, 1057247130, 39322776, -1650711137, -1389287533, 630961418, 0, -1560644690, 2134003171), (416570551, 2128808667, -171694403, 1776578876, 766766423, -711854861, 1, 1204740517, -1301116232), (1671114846, -7596278, -1552529448, -147296333, 724393699, 239675709, 2, -3349776, -272751548), (1815971172, 868223610, 953413951, 954318676, 801009992, -2109292405, 3, 2056888085, 1824715126), (1965405319, 855156803, 735941255, -1106230389, -1756374906, 1264791820, 4, 1359389019, -357878965), (-1831887108, 1499856856, 265879353, 801884598, -291085232, 1165492270, 5, -984390528, -544893154), (-1030127276, 476928242, 289049780, 1163947388, 12076701, -1250814184, 6, -156447103, -1777209264), (-1547335343, -653425864, -1180906222, 721816326, -1356932647, -767120075, 7, -1889762436, -1382912644), (-130269851, -419724065, 1419560591, -26992717, 273810049, 574617059, 8, 1610642000, -1751344937), (449890242, 1791870061, 824583601, 1794710144, 1280593110, 929039725, 9, 105545976, -884527324)


query  rowsort
SELECT sum(`table_1`.`column_1`) AS `alias_1` FROM `table_1`
----
-935030344

query  nosort
SELECT `table_1`.`column_1` AS `alias_1` FROM `table_1` ORDER BY `table_1`.`column_1` ASC LIMIT 10
----
-1756374906
-1389287533
-1356932647
-291085232
12076701
273810049
724393699
766766423
801009992
1280593110

query  nosort
SELECT `table_1`.`column_1` AS `alias_1` FROM `table_1` ORDER BY `table_1`.`column_1` DESC LIMIT 10
----
1280593110
801009992
766766423
724393699
273810049
12076701
-291085232
-1356932647
-1389287533
-1756374906

query  rowsort
SELECT `table_1`.`column_1` AS `alias_1` FROM `table_1` WHERE (`table_1`.`column_1` > ?)
? = 10
----
12076701
1280593110
273810049
724393699
766766423
801009992

query  nosort
SELECT sum(`table_1`.`column_2`) AS `alias_1` FROM `table_1` GROUP BY `table_1`.`column_2` ORDER BY `table_1`.`column_2` ASC LIMIT 10
----
-1831887108
-1547335343
-1030127276
-130269851
104837516
416570551
449890242
1671114846
1815971172
1965405319

query  nosort
SELECT sum(`table_1`.`column_3`) AS `alias_1` FROM `table_1` GROUP BY `table_1`.`column_2` ORDER BY `table_1`.`column_2` DESC LIMIT 10
----
-357878965
1824715126
-272751548
-884527324
-1301116232
2134003171
-1751344937
-1777209264
-1382912644
-544893154

query  rowsort
SELECT sum(`table_1`.`column_4`) AS `alias_1` FROM `table_1` WHERE (`table_1`.`column_2` > ?)
? = 10
----
1621369837

query  nosort
SELECT `table_1`.`column_2` AS `alias_1` FROM `table_1` ORDER BY `table_1`.`column_2` DESC LIMIT 10
----
1965405319
1815971172
1671114846
449890242
416570551
104837516
-130269851
-1030127276
-1547335343
-1831887108

query  nosort
SELECT `table_1`.`column_2` AS `alias_1` FROM `table_1` WHERE (`table_1`.`column_2` > ?) ORDER BY `table_1`.`column_2` ASC LIMIT 10
? = 10
----
104837516
416570551
449890242
1671114846
1815971172
1965405319

query  nosort
SELECT `table_1`.`column_2` AS `alias_1` FROM `table_1` WHERE (`table_1`.`column_2` > ?) ORDER BY `table_1`.`column_2` DESC LIMIT 10
? = 10
----
1965405319
1815971172
1671114846
449890242
416570551
104837516

query  nosort
SELECT sum(`table_1`.`column_5`) AS `alias_1` FROM `table_1` GROUP BY `table_1`.`column_2` ORDER BY `table_1`.`column_2` DESC LIMIT 10
----
1359389019
2056888085
-3349776
105545976
1204740517
-1560644690
1610642000
-156447103
-1889762436
-984390528

query  nosort
SELECT sum(`table_1`.`column_6`) AS `alias_1` FROM `table_1` WHERE (`table_1`.`column_2` > ?) GROUP BY `table_1`.`column_2` ORDER BY `table_1`.`column_2` ASC LIMIT 10
? = 10
----
1057247130
2128808667
1791870061
-7596278
868223610
855156803

query  nosort
SELECT sum(`table_1`.`column_7`) AS `alias_1` FROM `table_1` WHERE (`table_1`.`column_2` > ?) GROUP BY `table_1`.`column_2` ORDER BY `table_1`.`column_2` DESC LIMIT 10
? = 10
----
735941255
953413951
-1552529448
824583601
-171694403
39322776

query  nosort
SELECT `table_1`.`column_2` AS `alias_1` FROM `table_1` WHERE (`table_1`.`column_2` > ?) ORDER BY `table_1`.`column_2` DESC LIMIT 10
? = 10
----
1965405319
1815971172
1671114846
449890242
416570551
104837516

query  nosort
SELECT sum(`table_1`.`column_8`) AS `alias_1` FROM `table_1` WHERE (`table_1`.`column_2` > ?) GROUP BY `table_1`.`column_2` ORDER BY `table_1`.`column_2` DESC LIMIT 10
? = 10
----
1264791820
-2109292405
239675709
929039725
-711854861
630961418

statement ok
DELETE FROM `table_1` WHERE (`column_9` = 0)


statement ok
DELETE FROM `table_1` WHERE (`column_9` = 1)


statement ok
DELETE FROM `table_1` WHERE (`column_9` = 2)


statement ok
DELETE FROM `table_1` WHERE (`column_9` = 3)


statement ok
DELETE FROM `table_1` WHERE (`column_9` = 4)


query  rowsort
SELECT sum(`table_1`.`column_1`) AS `alias_1` FROM `table_1`
----
-81538019

query  nosort
SELECT `table_1`.`column_1` AS `alias_1` FROM `table_1` ORDER BY `table_1`.`column_1` ASC LIMIT 10
----
-1356932647
-291085232
12076701
273810049
1280593110

query  nosort
SELECT `table_1`.`column_1` AS `alias_1` FROM `table_1` ORDER BY `table_1`.`column_1` DESC LIMIT 10
----
1280593110
273810049
12076701
-291085232
-1356932647

query  rowsort
SELECT `table_1`.`column_1` AS `alias_1` FROM `table_1` WHERE (`table_1`.`column_1` > ?)
? = 10
----
12076701
1280593110
273810049

query  nosort
SELECT sum(`table_1`.`column_2`) AS `alias_1` FROM `table_1` GROUP BY `table_1`.`column_2` ORDER BY `table_1`.`column_2` ASC LIMIT 10
----
-1831887108
-1547335343
-1030127276
-130269851
449890242

query  nosort
SELECT sum(`table_1`.`column_3`) AS `alias_1` FROM `table_1` GROUP BY `table_1`.`column_2` ORDER BY `table_1`.`column_2` DESC LIMIT 10
----
-884527324
-1751344937
-1777209264
-1382912644
-544893154

query  rowsort
SELECT sum(`table_1`.`column_4`) AS `alias_1` FROM `table_1` WHERE (`table_1`.`column_2` > ?)
? = 10
----
1794710144

query  nosort
SELECT `table_1`.`column_2` AS `alias_1` FROM `table_1` ORDER BY `table_1`.`column_2` DESC LIMIT 10
----
449890242
-130269851
-1030127276
-1547335343
-1831887108

query  nosort
SELECT `table_1`.`column_2` AS `alias_1` FROM `table_1` WHERE (`table_1`.`column_2` > ?) ORDER BY `table_1`.`column_2` ASC LIMIT 10
? = 10
----
449890242

query  nosort
SELECT `table_1`.`column_2` AS `alias_1` FROM `table_1` WHERE (`table_1`.`column_2` > ?) ORDER BY `table_1`.`column_2` DESC LIMIT 10
? = 10
----
449890242

query  nosort
SELECT sum(`table_1`.`column_5`) AS `alias_1` FROM `table_1` GROUP BY `table_1`.`column_2` ORDER BY `table_1`.`column_2` DESC LIMIT 10
----
105545976
1610642000
-156447103
-1889762436
-984390528

query  nosort
SELECT sum(`table_1`.`column_6`) AS `alias_1` FROM `table_1` WHERE (`table_1`.`column_2` > ?) GROUP BY `table_1`.`column_2` ORDER BY `table_1`.`column_2` ASC LIMIT 10
? = 10
----
1791870061

query  nosort
SELECT sum(`table_1`.`column_7`) AS `alias_1` FROM `table_1` WHERE (`table_1`.`column_2` > ?) GROUP BY `table_1`.`column_2` ORDER BY `table_1`.`column_2` DESC LIMIT 10
? = 10
----
824583601

query  nosort
SELECT `table_1`.`column_2` AS `alias_1` FROM `table_1` WHERE (`table_1`.`column_2` > ?) ORDER BY `table_1`.`column_2` DESC LIMIT 10
? = 10
----
449890242

query  nosort
SELECT sum(`table_1`.`column_8`) AS `alias_1` FROM `table_1` WHERE (`table_1`.`column_2` > ?) GROUP BY `table_1`.`column_2` ORDER BY `table_1`.`column_2` DESC LIMIT 10
? = 10
----
929039725
