# Generated by:
#     target/debug/noria-logictest permute --compare-to mysql://root:noria@127.1/noria -d 3 -o logictests/generated/mysql/ --only range_param --random --include-deletes --rows-per-table 10 --subquery-depth 1 --overwrite-tests

statement ok
CREATE TABLE `table_1` (`column_7` INT, `column_9` INT, `column_1` INT, `column_6` INT, `column_4` INT, `column_8` INT, `column_2` INT, `column_3` INT, `column_5` INT, PRIMARY KEY (`column_9`))


statement ok
INSERT INTO `table_1` (`column_7`, `column_9`, `column_1`, `column_6`, `column_4`, `column_8`, `column_2`, `column_3`, `column_5`) VALUES (414529555, 0, -2043870179, 878503669, 2002018150, 1661492138, -119430774, 1648334131, 1988816710), (-1457536776, 1, -1650853378, 1940007318, -2029376162, -1995769147, 1227478781, -2029735618, -867240502), (914793202, 2, -645816910, -690782598, 1823386417, 1160388362, 502589437, -1267994502, 2136743690), (2038160950, 3, 1774920798, -446898460, 981003953, -691016718, -2090674887, 349546039, 1589785917), (1477683776, 4, -2004651043, 802552842, -859486794, -547818328, -280042393, -92489038, -538436112), (374626590, 5, 748951781, 1643030300, -1149792518, 170346047, 2109991796, -1761642419, -918043490), (-1573201220, 6, 880360256, 1280894665, 891919015, 1958858767, -550447639, -1175138631, 1110667326), (1330430865, 7, -1452131639, 43383675, 687130199, -457333410, 934523620, -1649840972, -27928623), (1904100802, 8, -2128926715, 2087626194, -830085787, 768152717, 2145150713, -806928509, -1760895927), (1331233416, 9, 1826601694, 381776187, 1491482182, -1874216399, -1527797692, 994389531, 1715734953)


query  rowsort
SELECT sum(`table_1`.`column_1`) AS `alias_1` FROM `table_1`
----
-4695415335

query  rowsort
SELECT max(`table_1`.`column_2`) AS `alias_1` FROM `table_1`
----
2145150713

query  rowsort
SELECT `table_1`.`column_2` AS `alias_1` FROM `table_1` WHERE (`table_1`.`column_2` > ?)
? = 10
----
1227478781
2109991796
2145150713
502589437
934523620

query  rowsort
SELECT sum(`table_1`.`column_3`) AS `alias_1`, max(`table_1`.`column_4`) AS `alias_2` FROM `table_1`
----
-5791499988
2002018150

query  rowsort
SELECT sum(`table_1`.`column_5`) AS `alias_1` FROM `table_1` WHERE (`table_1`.`column_2` > ?)
? = 10
----
-1437364852

query  rowsort
SELECT max(`table_1`.`column_6`) AS `alias_1` FROM `table_1` WHERE (`table_1`.`column_2` > ?)
? = 10
----
2087626194

query  rowsort
SELECT sum(`table_1`.`column_7`) AS `alias_1`, max(`table_1`.`column_8`) AS `alias_2` FROM `table_1` WHERE (`table_1`.`column_7` > ?)
? = 10
----
9785559156
1661492138

statement ok
DELETE FROM `table_1` WHERE (`column_9` = 0)


statement ok
DELETE FROM `table_1` WHERE (`column_9` = 1)


statement ok
DELETE FROM `table_1` WHERE (`column_9` = 2)


statement ok
DELETE FROM `table_1` WHERE (`column_9` = 3)


statement ok
DELETE FROM `table_1` WHERE (`column_9` = 4)


query  rowsort
SELECT sum(`table_1`.`column_1`) AS `alias_1` FROM `table_1`
----
-125144623

query  rowsort
SELECT max(`table_1`.`column_2`) AS `alias_1` FROM `table_1`
----
2145150713

query  rowsort
SELECT `table_1`.`column_2` AS `alias_1` FROM `table_1` WHERE (`table_1`.`column_2` > ?)
? = 10
----
2109991796
2145150713
934523620

query  rowsort
SELECT sum(`table_1`.`column_3`) AS `alias_1`, max(`table_1`.`column_4`) AS `alias_2` FROM `table_1`
----
-4399161000
1491482182

query  rowsort
SELECT sum(`table_1`.`column_5`) AS `alias_1` FROM `table_1` WHERE (`table_1`.`column_2` > ?)
? = 10
----
-2706868040

query  rowsort
SELECT max(`table_1`.`column_6`) AS `alias_1` FROM `table_1` WHERE (`table_1`.`column_2` > ?)
? = 10
----
2087626194

query  rowsort
SELECT sum(`table_1`.`column_7`) AS `alias_1`, max(`table_1`.`column_8`) AS `alias_2` FROM `table_1` WHERE (`table_1`.`column_7` > ?)
? = 10
----
4940391673
768152717
