# Generated by:
#     target/debug/noria-logictest permute --compare-to mysql://root:noria@127.1/noria -d 3 -o logictests/generated/mysql/ --only range_param --random --include-deletes --rows-per-table 10 --subquery-depth 1 --overwrite-tests

statement ok
CREATE TABLE `table_4` (`column_1` INT, `column_4` INT, `column_3` INT, `column_2` INT, `column_5` INT, PRIMARY KEY (`column_5`))


statement ok
CREATE TABLE `table_1` (`column_1` INT, `column_5` INT, `column_2` INT, `column_3` INT, `column_4` INT, PRIMARY KEY (`column_5`))


statement ok
CREATE TABLE `table_5` (`column_2` INT, `column_3` INT, `column_1` INT, PRIMARY KEY (`column_3`))


statement ok
CREATE TABLE `table_3` (`column_2` INT, `column_3` INT, `column_1` INT, `column_4` INT, `column_5` INT, PRIMARY KEY (`column_5`))


statement ok
CREATE TABLE `table_2` (`column_2` INT, `column_1` INT, `column_3` INT, PRIMARY KEY (`column_3`))


statement ok
INSERT INTO `table_4` (`column_1`, `column_4`, `column_3`, `column_2`, `column_5`) VALUES (-729779225, -798658398, 322740971, 983830243, 0), (-665725367, -914968751, 1603927237, 1987502594, 1), (662374702, 1533055075, -1231567045, 457128882, 2), (-1951799332, 1738460944, 627668038, 1992103083, 3), (331548446, 1204588434, -1960851721, 1296082545, 4), (584229617, -1525252498, -140100644, 827036051, 5), (440338455, 2119701552, 1022605666, 516330392, 6), (352336098, 1724991874, -734322875, 28112241, 7), (-316732404, -1237262757, 1950026001, 263459482, 8), (-939120663, 772913357, 1292174809, 115439673, 9)


statement ok
INSERT INTO `table_1` (`column_1`, `column_5`, `column_2`, `column_3`, `column_4`) VALUES (584584607, 0, -1419642144, -2017697713, -512396322), (1073692202, 1, 2047327827, 1606983918, 500979019), (1942762994, 2, -56473823, 604003497, -1873378129), (1665201847, 3, 1470314673, -1889931396, 914517698), (-1003604617, 4, -1639597111, 1092532518, -793412450), (2079132775, 5, 371274527, -1565687479, -2133948078), (-1561093381, 6, 309054996, 1335763552, 869855702), (-1107576542, 7, 1998913077, 1210854148, -566546084), (2018293168, 8, 1993926738, -256677003, -261932523), (53942095, 9, -596985909, -2111545913, 185535303)


statement ok
INSERT INTO `table_5` (`column_2`, `column_3`, `column_1`) VALUES (-331263153, 0, 918576129), (-629525611, 1, 1890499496), (1923577385, 2, 684683286), (-1847687856, 3, 2049008196), (1142200939, 4, 1947725442), (-2083001131, 5, 1552699555), (-1866761054, 6, 845135595), (-1982631480, 7, 2114628982), (1674985863, 8, 1998925162), (1961304974, 9, -1312006458)


statement ok
INSERT INTO `table_3` (`column_2`, `column_3`, `column_1`, `column_4`, `column_5`) VALUES (-1744726627, -125503245, 423020306, 1742824134, 0), (814099516, -381705120, 1605374573, -438659308, 1), (-573841206, 1899818279, -691837069, 27653104, 2), (177957395, -1608551911, -237997822, 770737873, 3), (-124474606, 2110506818, 1785940630, 1358939252, 4), (-1957108333, -489963376, 811459841, -996612641, 5), (-857698874, 1630931230, 1019347921, 218017597, 6), (-1154037906, -668153280, -1470536785, 1035767790, 7), (2111653553, 615340437, 1037549774, 1419296171, 8), (-1008352672, 188058102, 404606621, 972454888, 9)


statement ok
INSERT INTO `table_2` (`column_2`, `column_1`, `column_3`) VALUES (-796007761, 1751265704, 0), (-1516378199, 1200367944, 1), (-1180306776, 131703810, 2), (2086764015, 659299232, 3), (1002864900, -1219082414, 4), (-587203388, 1509681141, 5), (-502750385, 661014528, 6), (-698254488, 2116864908, 7), (275464172, -241426443, 8), (783083828, -1282165784, 9)


query  rowsort
SELECT sum(`table_1`.`column_1`) AS `alias_1` FROM `table_1`
----
5745335148

query  rowsort
SELECT `table_1`.`column_2` AS `alias_1`, `table_2`.`column_2` AS `alias_2` FROM `table_1` INNER JOIN `table_2` ON (`table_1`.`column_1` = `table_2`.`column_1`)
----


query  rowsort
SELECT `table_1`.`column_2` AS `alias_1` FROM `table_1` WHERE (`table_1`.`column_2` > ?)
? = 10
----
1470314673
1993926738
1998913077
2047327827
309054996
371274527

query  rowsort
SELECT sum(`table_1`.`column_3`) AS `alias_1`, `table_1`.`column_4` AS `alias_2`, `table_3`.`column_2` AS `alias_3` FROM `table_1` INNER JOIN `table_3` ON (`table_1`.`column_2` = `table_3`.`column_1`) GROUP BY `table_1`.`column_4`, `table_3`.`column_2`
----


query  rowsort
SELECT sum(`table_3`.`column_3`) AS `alias_1` FROM `table_3` WHERE (`table_3`.`column_2` > ?)
? = 10
----
-1374916594

query  rowsort
SELECT `table_3`.`column_4` AS `alias_1`, `table_4`.`column_2` AS `alias_2` FROM `table_3` INNER JOIN `table_4` ON (`table_3`.`column_2` = `table_4`.`column_1`) WHERE (`table_3`.`column_2` > ?)
? = 10
----


query  rowsort
SELECT sum(`table_4`.`column_3`) AS `alias_1`, `table_4`.`column_4` AS `alias_2`, `table_5`.`column_2` AS `alias_3` FROM `table_4` INNER JOIN `table_5` ON (`table_4`.`column_3` = `table_5`.`column_1`) WHERE (`table_4`.`column_1` > ?) GROUP BY `table_4`.`column_4`, `table_5`.`column_2`
? = 10
----


statement ok
DELETE FROM `table_4` WHERE (`column_5` = 0)


statement ok
DELETE FROM `table_4` WHERE (`column_5` = 1)


statement ok
DELETE FROM `table_4` WHERE (`column_5` = 2)


statement ok
DELETE FROM `table_4` WHERE (`column_5` = 3)


statement ok
DELETE FROM `table_4` WHERE (`column_5` = 4)


statement ok
DELETE FROM `table_1` WHERE (`column_5` = 0)


statement ok
DELETE FROM `table_1` WHERE (`column_5` = 1)


statement ok
DELETE FROM `table_1` WHERE (`column_5` = 2)


statement ok
DELETE FROM `table_1` WHERE (`column_5` = 3)


statement ok
DELETE FROM `table_1` WHERE (`column_5` = 4)


statement ok
DELETE FROM `table_5` WHERE (`column_3` = 0)


statement ok
DELETE FROM `table_5` WHERE (`column_3` = 1)


statement ok
DELETE FROM `table_5` WHERE (`column_3` = 2)


statement ok
DELETE FROM `table_5` WHERE (`column_3` = 3)


statement ok
DELETE FROM `table_5` WHERE (`column_3` = 4)


statement ok
DELETE FROM `table_3` WHERE (`column_5` = 0)


statement ok
DELETE FROM `table_3` WHERE (`column_5` = 1)


statement ok
DELETE FROM `table_3` WHERE (`column_5` = 2)


statement ok
DELETE FROM `table_3` WHERE (`column_5` = 3)


statement ok
DELETE FROM `table_3` WHERE (`column_5` = 4)


statement ok
DELETE FROM `table_2` WHERE (`column_3` = 0)


statement ok
DELETE FROM `table_2` WHERE (`column_3` = 1)


statement ok
DELETE FROM `table_2` WHERE (`column_3` = 2)


statement ok
DELETE FROM `table_2` WHERE (`column_3` = 3)


statement ok
DELETE FROM `table_2` WHERE (`column_3` = 4)


query  rowsort
SELECT sum(`table_1`.`column_1`) AS `alias_1` FROM `table_1`
----
1482698115

query  rowsort
SELECT `table_1`.`column_2` AS `alias_1`, `table_2`.`column_2` AS `alias_2` FROM `table_1` INNER JOIN `table_2` ON (`table_1`.`column_1` = `table_2`.`column_1`)
----


query  rowsort
SELECT `table_1`.`column_2` AS `alias_1` FROM `table_1` WHERE (`table_1`.`column_2` > ?)
? = 10
----
1993926738
1998913077
309054996
371274527

query  rowsort
SELECT sum(`table_1`.`column_3`) AS `alias_1`, `table_1`.`column_4` AS `alias_2`, `table_3`.`column_2` AS `alias_3` FROM `table_1` INNER JOIN `table_3` ON (`table_1`.`column_2` = `table_3`.`column_1`) GROUP BY `table_1`.`column_4`, `table_3`.`column_2`
----


query  rowsort
SELECT sum(`table_3`.`column_3`) AS `alias_1` FROM `table_3` WHERE (`table_3`.`column_2` > ?)
? = 10
----
615340437

query  rowsort
SELECT `table_3`.`column_4` AS `alias_1`, `table_4`.`column_2` AS `alias_2` FROM `table_3` INNER JOIN `table_4` ON (`table_3`.`column_2` = `table_4`.`column_1`) WHERE (`table_3`.`column_2` > ?)
? = 10
----


query  rowsort
SELECT sum(`table_4`.`column_3`) AS `alias_1`, `table_4`.`column_4` AS `alias_2`, `table_5`.`column_2` AS `alias_3` FROM `table_4` INNER JOIN `table_5` ON (`table_4`.`column_3` = `table_5`.`column_1`) WHERE (`table_4`.`column_1` > ?) GROUP BY `table_4`.`column_4`, `table_5`.`column_2`
? = 10
----

