# Generated by:
#     target/debug/noria-logictest permute --compare-to mysql://root:noria@127.1/noria -d 3 -o logictests/generated/mysql/ --only range_param --random --include-deletes --rows-per-table 10 --subquery-depth 1 --overwrite-tests

statement ok
CREATE TABLE `table_1` (`column_2` INT, `column_3` INT, `column_1` INT, `column_4` INT, `column_5` INT, PRIMARY KEY (`column_5`))


statement ok
INSERT INTO `table_1` (`column_2`, `column_3`, `column_1`, `column_4`, `column_5`) VALUES (1629345626, 622253119, 606977300, -472503110, 0), (-1964290300, -2011975263, 767901875, -2083064180, 1), (2094410306, 986103603, -563807645, -1379070521, 2), (-1775302943, -27428639, 1396249388, -206318154, 3), (-1078731538, -1465503648, 1322306298, -1931367363, 4), (468961663, -1806566326, 1584591506, 14390236, 5), (-1695668500, 2089887903, -1518303686, 1955015887, 6), (-491622876, -67855743, 2126859503, 1777723450, 7), (-1250204876, 1180254396, -1882537315, -1786199953, 8), (-2062803598, -1379657053, 1476900025, -1311289736, 9)


query  rowsort
SELECT sum(`table_1`.`column_1`) AS `alias_1` FROM `table_1`
----
5317137249

query  rowsort
SELECT DISTINCT `table_1`.`column_1` AS `alias_1` FROM `table_1`
----
-1518303686
-1882537315
-563807645
1322306298
1396249388
1476900025
1584591506
2126859503
606977300
767901875

query  rowsort
SELECT `table_1`.`column_1` AS `alias_1` FROM `table_1` WHERE (`table_1`.`column_1` > ?)
? = 10
----
1322306298
1396249388
1476900025
1584591506
2126859503
606977300
767901875

query  rowsort
SELECT DISTINCT sum(`table_1`.`column_2`) AS `alias_1` FROM `table_1`
----
-6125907036

query  rowsort
SELECT sum(`table_1`.`column_3`) AS `alias_1` FROM `table_1` WHERE (`table_1`.`column_3` > ?)
? = 10
----
4878499021

query  rowsort
SELECT DISTINCT `table_1`.`column_3` AS `alias_1` FROM `table_1` WHERE (`table_1`.`column_3` > ?)
? = 10
----
1180254396
2089887903
622253119
986103603

query  rowsort
SELECT DISTINCT sum(`table_1`.`column_4`) AS `alias_1` FROM `table_1` WHERE (`table_1`.`column_2` > ?)
? = 10
----
-1837183395

statement ok
DELETE FROM `table_1` WHERE (`column_5` = 0)


statement ok
DELETE FROM `table_1` WHERE (`column_5` = 1)


statement ok
DELETE FROM `table_1` WHERE (`column_5` = 2)


statement ok
DELETE FROM `table_1` WHERE (`column_5` = 3)


statement ok
DELETE FROM `table_1` WHERE (`column_5` = 4)


query  rowsort
SELECT sum(`table_1`.`column_1`) AS `alias_1` FROM `table_1`
----
1787510033

query  rowsort
SELECT DISTINCT `table_1`.`column_1` AS `alias_1` FROM `table_1`
----
-1518303686
-1882537315
1476900025
1584591506
2126859503

query  rowsort
SELECT `table_1`.`column_1` AS `alias_1` FROM `table_1` WHERE (`table_1`.`column_1` > ?)
? = 10
----
1476900025
1584591506
2126859503

query  rowsort
SELECT DISTINCT sum(`table_1`.`column_2`) AS `alias_1` FROM `table_1`
----
-5031338187

query  rowsort
SELECT sum(`table_1`.`column_3`) AS `alias_1` FROM `table_1` WHERE (`table_1`.`column_3` > ?)
? = 10
----
3270142299

query  rowsort
SELECT DISTINCT `table_1`.`column_3` AS `alias_1` FROM `table_1` WHERE (`table_1`.`column_3` > ?)
? = 10
----
1180254396
2089887903

query  rowsort
SELECT DISTINCT sum(`table_1`.`column_4`) AS `alias_1` FROM `table_1` WHERE (`table_1`.`column_2` > ?)
? = 10
----
14390236
