# Generated by:
#     target/debug/noria-logictest permute --compare-to mysql://root:noria@127.1/noria -d 3 -o logictests/generated/mysql/ --only range_param --random --include-deletes --rows-per-table 10 --subquery-depth 1 --overwrite-tests

statement ok
CREATE TABLE `table_1` (`column_1` INT, `column_3` INT, `column_5` INT, `column_7` INT, `column_2` INT, `column_6` INT, `column_8` INT, `column_9` INT, `column_4` INT, PRIMARY KEY (`column_9`))


statement ok
INSERT INTO `table_1` (`column_1`, `column_3`, `column_5`, `column_7`, `column_2`, `column_6`, `column_8`, `column_9`, `column_4`) VALUES (2053693944, -742334167, -1124398319, 1463295999, -64508992, -1031070631, -139189405, 0, 1423586550), (-1901383454, -1590294240, 1225628942, 247210052, -1526339901, 1974271192, -1276613234, 1, 1858694708), (-559978088, 1002430206, 374291470, 122142879, -149551609, 930489806, -1645720511, 2, 384706860), (212814153, 2090743167, -446790014, 1349123309, 1032847914, 2082749549, -1173810877, 3, 116178277), (1938249651, -1079225786, -1530070685, -1719039841, 513454878, -866518674, 1920038230, 4, 926621622), (1699102343, -38080772, -737990003, 626333232, 1955704968, 220158008, -492382670, 5, 1257119344), (-1838019801, -451194262, 482173684, 1053044484, -1824538159, 1270781140, 1522601717, 6, 1517018485), (334547764, -932131986, 1997503911, 1212928809, -1768863526, 1989713828, 845180813, 7, -614906269), (-317221840, -488884167, -186071754, 2027080494, 1269521749, -500047614, -456074847, 8, 856879735), (-289355422, 455931612, -1174296459, 1393707460, -570577457, 440558188, 843059250, 9, 1483700818)


query  rowsort
SELECT sum(distinct `table_1`.`column_1`) AS `alias_1` FROM `table_1`
----
1332449250

query  nosort
SELECT `table_1`.`column_1` AS `alias_1` FROM `table_1` ORDER BY `table_1`.`column_1` ASC LIMIT 10
----
-1901383454
-1838019801
-559978088
-317221840
-289355422
212814153
334547764
1699102343
1938249651
2053693944

query  nosort
SELECT `table_1`.`column_1` AS `alias_1` FROM `table_1` ORDER BY `table_1`.`column_1` DESC LIMIT 10
----
2053693944
1938249651
1699102343
334547764
212814153
-289355422
-317221840
-559978088
-1838019801
-1901383454

query  rowsort
SELECT `table_1`.`column_1` AS `alias_1` FROM `table_1` WHERE (`table_1`.`column_1` > ?)
? = 10
----
1699102343
1938249651
2053693944
212814153
334547764

query  nosort
SELECT sum(distinct `table_1`.`column_2`) AS `alias_1` FROM `table_1` GROUP BY `table_1`.`column_1` ORDER BY `table_1`.`column_1` ASC LIMIT 10
----
-1526339901
-1824538159
-149551609
1269521749
-570577457
1032847914
-1768863526
1955704968
513454878
-64508992

query  nosort
SELECT sum(distinct `table_1`.`column_3`) AS `alias_1` FROM `table_1` GROUP BY `table_1`.`column_1` ORDER BY `table_1`.`column_1` DESC LIMIT 10
----
-742334167
-1079225786
-38080772
-932131986
2090743167
455931612
-488884167
1002430206
-451194262
-1590294240

query  rowsort
SELECT sum(distinct `table_1`.`column_4`) AS `alias_1` FROM `table_1` WHERE (`table_1`.`column_1` > ?)
? = 10
----
3108599524

query  nosort
SELECT `table_1`.`column_1` AS `alias_1` FROM `table_1` ORDER BY `table_1`.`column_1` DESC LIMIT 10
----
2053693944
1938249651
1699102343
334547764
212814153
-289355422
-317221840
-559978088
-1838019801
-1901383454

query  nosort
SELECT `table_1`.`column_1` AS `alias_1` FROM `table_1` WHERE (`table_1`.`column_1` > ?) ORDER BY `table_1`.`column_1` ASC LIMIT 10
? = 10
----
212814153
334547764
1699102343
1938249651
2053693944

query  nosort
SELECT `table_1`.`column_1` AS `alias_1` FROM `table_1` WHERE (`table_1`.`column_1` > ?) ORDER BY `table_1`.`column_1` DESC LIMIT 10
? = 10
----
2053693944
1938249651
1699102343
334547764
212814153

query  nosort
SELECT sum(distinct `table_1`.`column_5`) AS `alias_1` FROM `table_1` GROUP BY `table_1`.`column_1` ORDER BY `table_1`.`column_1` DESC LIMIT 10
----
-1124398319
-1530070685
-737990003
1997503911
-446790014
-1174296459
-186071754
374291470
482173684
1225628942

query  nosort
SELECT sum(distinct `table_1`.`column_6`) AS `alias_1` FROM `table_1` WHERE (`table_1`.`column_1` > ?) GROUP BY `table_1`.`column_1` ORDER BY `table_1`.`column_1` ASC LIMIT 10
? = 10
----
2082749549
1989713828
220158008
-866518674
-1031070631

query  nosort
SELECT sum(distinct `table_1`.`column_7`) AS `alias_1` FROM `table_1` WHERE (`table_1`.`column_7` > ?) GROUP BY `table_1`.`column_7` ORDER BY `table_1`.`column_7` DESC LIMIT 10
? = 10
----
2027080494
1463295999
1393707460
1349123309
1212928809
1053044484
626333232
247210052
122142879

query  nosort
SELECT `table_1`.`column_7` AS `alias_1` FROM `table_1` WHERE (`table_1`.`column_7` > ?) ORDER BY `table_1`.`column_7` DESC LIMIT 10
? = 10
----
2027080494
1463295999
1393707460
1349123309
1212928809
1053044484
626333232
247210052
122142879

query  nosort
SELECT sum(distinct `table_1`.`column_8`) AS `alias_1` FROM `table_1` WHERE (`table_1`.`column_1` > ?) GROUP BY `table_1`.`column_1` ORDER BY `table_1`.`column_1` DESC LIMIT 10
? = 10
----
-139189405
1920038230
-492382670
845180813
-1173810877

statement ok
DELETE FROM `table_1` WHERE (`column_9` = 0)


statement ok
DELETE FROM `table_1` WHERE (`column_9` = 1)


statement ok
DELETE FROM `table_1` WHERE (`column_9` = 2)


statement ok
DELETE FROM `table_1` WHERE (`column_9` = 3)


statement ok
DELETE FROM `table_1` WHERE (`column_9` = 4)


query  rowsort
SELECT sum(distinct `table_1`.`column_1`) AS `alias_1` FROM `table_1`
----
-410946956

query  nosort
SELECT `table_1`.`column_1` AS `alias_1` FROM `table_1` ORDER BY `table_1`.`column_1` ASC LIMIT 10
----
-1838019801
-317221840
-289355422
334547764
1699102343

query  nosort
SELECT `table_1`.`column_1` AS `alias_1` FROM `table_1` ORDER BY `table_1`.`column_1` DESC LIMIT 10
----
1699102343
334547764
-289355422
-317221840
-1838019801

query  rowsort
SELECT `table_1`.`column_1` AS `alias_1` FROM `table_1` WHERE (`table_1`.`column_1` > ?)
? = 10
----
1699102343
334547764

query  nosort
SELECT sum(distinct `table_1`.`column_2`) AS `alias_1` FROM `table_1` GROUP BY `table_1`.`column_1` ORDER BY `table_1`.`column_1` ASC LIMIT 10
----
-1824538159
1269521749
-570577457
-1768863526
1955704968

query  nosort
SELECT sum(distinct `table_1`.`column_3`) AS `alias_1` FROM `table_1` GROUP BY `table_1`.`column_1` ORDER BY `table_1`.`column_1` DESC LIMIT 10
----
-38080772
-932131986
455931612
-488884167
-451194262

query  rowsort
SELECT sum(distinct `table_1`.`column_4`) AS `alias_1` FROM `table_1` WHERE (`table_1`.`column_1` > ?)
? = 10
----
642213075

query  nosort
SELECT `table_1`.`column_1` AS `alias_1` FROM `table_1` ORDER BY `table_1`.`column_1` DESC LIMIT 10
----
1699102343
334547764
-289355422
-317221840
-1838019801

query  nosort
SELECT `table_1`.`column_1` AS `alias_1` FROM `table_1` WHERE (`table_1`.`column_1` > ?) ORDER BY `table_1`.`column_1` ASC LIMIT 10
? = 10
----
334547764
1699102343

query  nosort
SELECT `table_1`.`column_1` AS `alias_1` FROM `table_1` WHERE (`table_1`.`column_1` > ?) ORDER BY `table_1`.`column_1` DESC LIMIT 10
? = 10
----
1699102343
334547764

query  nosort
SELECT sum(distinct `table_1`.`column_5`) AS `alias_1` FROM `table_1` GROUP BY `table_1`.`column_1` ORDER BY `table_1`.`column_1` DESC LIMIT 10
----
-737990003
1997503911
-1174296459
-186071754
482173684

query  nosort
SELECT sum(distinct `table_1`.`column_6`) AS `alias_1` FROM `table_1` WHERE (`table_1`.`column_1` > ?) GROUP BY `table_1`.`column_1` ORDER BY `table_1`.`column_1` ASC LIMIT 10
? = 10
----
1989713828
220158008

query  nosort
SELECT sum(distinct `table_1`.`column_7`) AS `alias_1` FROM `table_1` WHERE (`table_1`.`column_7` > ?) GROUP BY `table_1`.`column_7` ORDER BY `table_1`.`column_7` DESC LIMIT 10
? = 10
----
2027080494
1393707460
1212928809
1053044484
626333232

query  nosort
SELECT `table_1`.`column_7` AS `alias_1` FROM `table_1` WHERE (`table_1`.`column_7` > ?) ORDER BY `table_1`.`column_7` DESC LIMIT 10
? = 10
----
2027080494
1393707460
1212928809
1053044484
626333232

query  nosort
SELECT sum(distinct `table_1`.`column_8`) AS `alias_1` FROM `table_1` WHERE (`table_1`.`column_1` > ?) GROUP BY `table_1`.`column_1` ORDER BY `table_1`.`column_1` DESC LIMIT 10
? = 10
----
-492382670
845180813
