# Generated by:
#     target/debug/noria-logictest permute --compare-to mysql://root:noria@127.1/noria -d 3 -o logictests/generated/mysql/ --only range_param --random --include-deletes --rows-per-table 10 --subquery-depth 1 --overwrite-tests

statement ok
CREATE TABLE `table_1` (`column_1` INT, `column_3` INT, `column_9` INT, `column_7` INT, `column_5` INT, `column_2` INT, `column_4` INT, `column_6` INT, `column_8` INT, PRIMARY KEY (`column_9`))


statement ok
INSERT INTO `table_1` (`column_1`, `column_3`, `column_9`, `column_7`, `column_5`, `column_2`, `column_4`, `column_6`, `column_8`) VALUES (-1963990541, 272362209, 0, 456936346, -833501341, 39976098, -1712332828, -2043145704, 2116635343), (945520475, -1239914699, 1, 1623022022, -1145988696, 680455778, 1568873790, -1102614082, -844863646), (1665887914, 517459029, 2, 1397690577, 502014489, 1834640375, 580402066, 396812771, 1470334091), (-585235415, -1535733822, 3, 1333586136, 1705987533, 1624185690, 1999621494, 491815098, -278103876), (-839061760, -2143631065, 4, -1829298235, -877355284, 1683396393, 297218497, -1984280401, 1514414835), (-1127168981, -1017606815, 5, -833262188, 568237802, 795342513, -587305558, 1883910977, 1367313365), (-1471065408, -1311215507, 6, -457862378, -1176907302, -2064656622, -580971445, 1299984452, 405676379), (-1386338314, 136944092, 7, -689181069, -845475795, -1254614413, -983142440, -373163421, 207883553), (1919974159, -75742081, 8, -583276713, -272933029, -1179294601, -1709387395, 1236675900, -1362267221), (840027243, 1644056284, 9, -373209437, 109495984, -127937735, -91378371, 1682581895, 1841901023)


query  rowsort
SELECT sum(distinct `table_1`.`column_1`) AS `alias_1` FROM `table_1`
----
-2001450628

query  rowsort
SELECT min(`table_1`.`column_2`) AS `alias_1` FROM `table_1`
----
-2064656622

query  rowsort
SELECT `table_1`.`column_1` AS `alias_1` FROM `table_1` WHERE (`table_1`.`column_1` > ?)
? = 10
----
1665887914
1919974159
840027243
945520475

query  rowsort
SELECT sum(distinct `table_1`.`column_3`) AS `alias_1`, min(`table_1`.`column_4`) AS `alias_2` FROM `table_1`
----
-4753022375
-1712332828

query  rowsort
SELECT sum(distinct `table_1`.`column_5`) AS `alias_1` FROM `table_1` WHERE (`table_1`.`column_1` > ?)
? = 10
----
-807411252

query  rowsort
SELECT min(`table_1`.`column_6`) AS `alias_1` FROM `table_1` WHERE (`table_1`.`column_1` > ?)
? = 10
----
-1102614082

query  rowsort
SELECT sum(distinct `table_1`.`column_7`) AS `alias_1`, min(`table_1`.`column_8`) AS `alias_2` FROM `table_1` WHERE (`table_1`.`column_1` > ?)
? = 10
----
2064226449
-1362267221

statement ok
DELETE FROM `table_1` WHERE (`column_9` = 0)


statement ok
DELETE FROM `table_1` WHERE (`column_9` = 1)


statement ok
DELETE FROM `table_1` WHERE (`column_9` = 2)


statement ok
DELETE FROM `table_1` WHERE (`column_9` = 3)


statement ok
DELETE FROM `table_1` WHERE (`column_9` = 4)


query  rowsort
SELECT sum(distinct `table_1`.`column_1`) AS `alias_1` FROM `table_1`
----
-1224571301

query  rowsort
SELECT min(`table_1`.`column_2`) AS `alias_1` FROM `table_1`
----
-2064656622

query  rowsort
SELECT `table_1`.`column_1` AS `alias_1` FROM `table_1` WHERE (`table_1`.`column_1` > ?)
? = 10
----
1919974159
840027243

query  rowsort
SELECT sum(distinct `table_1`.`column_3`) AS `alias_1`, min(`table_1`.`column_4`) AS `alias_2` FROM `table_1`
----
-623564027
-1709387395

query  rowsort
SELECT sum(distinct `table_1`.`column_5`) AS `alias_1` FROM `table_1` WHERE (`table_1`.`column_1` > ?)
? = 10
----
-163437045

query  rowsort
SELECT min(`table_1`.`column_6`) AS `alias_1` FROM `table_1` WHERE (`table_1`.`column_1` > ?)
? = 10
----
1236675900

query  rowsort
SELECT sum(distinct `table_1`.`column_7`) AS `alias_1`, min(`table_1`.`column_8`) AS `alias_2` FROM `table_1` WHERE (`table_1`.`column_1` > ?)
? = 10
----
-956486150
-1362267221
