# Generated by:
#     target/debug/noria-logictest permute --compare-to mysql://root:noria@127.1/noria -d 3 -o logictests/generated/mysql/ --only range_param --random --include-deletes --rows-per-table 10 --subquery-depth 1 --overwrite-tests

statement ok
CREATE TABLE `table_1` (`column_3` INT, `column_1` INT, `column_4` INT, `column_7` INT, `column_8` INT, `column_6` INT, `column_5` INT, `column_9` INT, `column_2` INT, PRIMARY KEY (`column_9`))


statement ok
INSERT INTO `table_1` (`column_3`, `column_1`, `column_4`, `column_7`, `column_8`, `column_6`, `column_5`, `column_9`, `column_2`) VALUES (1745026579, 1635764245, -915561068, -485161134, -958660198, -286752567, -1068392340, 0, 570173068), (1243970856, -522601383, 1658973923, 668574396, -27551384, 745071969, -806357842, 1, 469108817), (546071706, -1224993537, -981022998, 2010872070, 101397065, 873281899, 1320317177, 2, 1448494716), (-1627822422, -1900032268, 755272011, -757919923, -1984473568, 1416771155, -329965388, 3, -970347967), (-804039671, 2142074160, 1460104263, 217376638, 345573111, 1448935399, 363317999, 4, -1574212673), (1673728479, -23684582, -674776837, -92640719, -1652104274, 1344402416, -830993246, 5, 201693217), (-1226189077, -1706947110, 171716001, -79113990, -634701877, -1885191724, -1260945135, 6, 290851467), (-740689073, 2306716, 356715022, -1849115111, -730741047, -1853542627, -262089494, 7, 1563092683), (-338372539, -1950215737, -208725305, -376136997, -1138401723, -1694359201, 15963567, 8, 1367337624), (1738130155, 2086213265, 1588835223, 1763163383, 551883202, 527340367, -838570452, 9, 252522560)


query  rowsort
SELECT sum(distinct `table_1`.`column_1`) AS `alias_1` FROM `table_1`
----
-1462116231

query  rowsort
SELECT max(`table_1`.`column_2`) AS `alias_1` FROM `table_1`
----
1563092683

query  rowsort
SELECT `table_1`.`column_2` AS `alias_1` FROM `table_1` WHERE (`table_1`.`column_2` > ?)
? = 10
----
1367337624
1448494716
1563092683
201693217
252522560
290851467
469108817
570173068

query  rowsort
SELECT sum(distinct `table_1`.`column_3`) AS `alias_1`, max(`table_1`.`column_4`) AS `alias_2` FROM `table_1`
----
2209814993
1658973923

query  rowsort
SELECT sum(distinct `table_1`.`column_5`) AS `alias_1` FROM `table_1` WHERE (`table_1`.`column_3` > ?)
? = 10
----
-2223996703

query  rowsort
SELECT max(`table_1`.`column_6`) AS `alias_1` FROM `table_1` WHERE (`table_1`.`column_3` > ?)
? = 10
----
1344402416

query  rowsort
SELECT sum(distinct `table_1`.`column_7`) AS `alias_1`, max(`table_1`.`column_8`) AS `alias_2` FROM `table_1` WHERE (`table_1`.`column_3` > ?)
? = 10
----
3864807996
551883202

statement ok
DELETE FROM `table_1` WHERE (`column_9` = 0)


statement ok
DELETE FROM `table_1` WHERE (`column_9` = 1)


statement ok
DELETE FROM `table_1` WHERE (`column_9` = 2)


statement ok
DELETE FROM `table_1` WHERE (`column_9` = 3)


statement ok
DELETE FROM `table_1` WHERE (`column_9` = 4)


query  rowsort
SELECT sum(distinct `table_1`.`column_1`) AS `alias_1` FROM `table_1`
----
-1592327448

query  rowsort
SELECT max(`table_1`.`column_2`) AS `alias_1` FROM `table_1`
----
1563092683

query  rowsort
SELECT `table_1`.`column_2` AS `alias_1` FROM `table_1` WHERE (`table_1`.`column_2` > ?)
? = 10
----
1367337624
1563092683
201693217
252522560
290851467

query  rowsort
SELECT sum(distinct `table_1`.`column_3`) AS `alias_1`, max(`table_1`.`column_4`) AS `alias_2` FROM `table_1`
----
1106607945
1588835223

query  rowsort
SELECT sum(distinct `table_1`.`column_5`) AS `alias_1` FROM `table_1` WHERE (`table_1`.`column_3` > ?)
? = 10
----
-1669563698

query  rowsort
SELECT max(`table_1`.`column_6`) AS `alias_1` FROM `table_1` WHERE (`table_1`.`column_3` > ?)
? = 10
----
1344402416

query  rowsort
SELECT sum(distinct `table_1`.`column_7`) AS `alias_1`, max(`table_1`.`column_8`) AS `alias_2` FROM `table_1` WHERE (`table_1`.`column_3` > ?)
? = 10
----
1670522664
551883202
