# Generated by:
#     target/debug/noria-logictest permute --compare-to mysql://root:noria@127.1/noria -d 3 -o logictests/generated/mysql/ --only range_param --random --include-deletes --rows-per-table 10 --subquery-depth 1 --overwrite-tests

statement ok
CREATE TABLE `table_1` (`column_3` INT, `column_1` INT, `column_2` INT, `column_4` INT, `column_5` INT, PRIMARY KEY (`column_5`))


statement ok
INSERT INTO `table_1` (`column_3`, `column_1`, `column_2`, `column_4`, `column_5`) VALUES (-880893872, -1963565835, 185221923, -1338751638, 0), (-1009952139, -1533748199, -1738363767, 1485701137, 1), (-772712209, -1033977429, 1912369172, -1146007449, 2), (628204878, -472613740, 1451301760, 220464799, 3), (2053279569, -997220620, 152368071, -1048331569, 4), (-604800454, -227990589, 404555630, -1882138789, 5), (-659723568, -562479795, 1451038368, -766966448, 6), (487553146, -922664736, -493705321, -2031689508, 7), (-1240007962, -1001321022, 725093803, -1708698692, 8), (-146362063, -1703367367, -1066928634, 548758120, 9)


query  rowsort
SELECT sum(distinct `table_1`.`column_1`) AS `alias_1` FROM `table_1`
----
-10418949332

query  rowsort
SELECT 1 AS `alias_1`
----
1

query  rowsort
SELECT `table_1`.`column_1` AS `alias_1` FROM `table_1` WHERE (`table_1`.`column_1` > ?)
? = 10
----


query  rowsort
SELECT sum(distinct `table_1`.`column_2`) AS `alias_1`, 1 AS `alias_2` FROM `table_1`
----
2982951005
1

query  rowsort
SELECT sum(distinct `table_1`.`column_3`) AS `alias_1` FROM `table_1` WHERE (`table_1`.`column_1` > ?)
? = 10
----
NULL

query  rowsort
SELECT 1 AS `alias_1` FROM `table_1` WHERE (`table_1`.`column_1` > ?)
? = 10
----


query  rowsort
SELECT sum(distinct `table_1`.`column_4`) AS `alias_1`, 1 AS `alias_2` FROM `table_1` WHERE (`table_1`.`column_3` > ?)
? = 10
----
-2859556278
1

statement ok
DELETE FROM `table_1` WHERE (`column_5` = 0)


statement ok
DELETE FROM `table_1` WHERE (`column_5` = 1)


statement ok
DELETE FROM `table_1` WHERE (`column_5` = 2)


statement ok
DELETE FROM `table_1` WHERE (`column_5` = 3)


statement ok
DELETE FROM `table_1` WHERE (`column_5` = 4)


query  rowsort
SELECT sum(distinct `table_1`.`column_1`) AS `alias_1` FROM `table_1`
----
-4417823509

query  rowsort
SELECT 1 AS `alias_1`
----
1

query  rowsort
SELECT `table_1`.`column_1` AS `alias_1` FROM `table_1` WHERE (`table_1`.`column_1` > ?)
? = 10
----


query  rowsort
SELECT sum(distinct `table_1`.`column_2`) AS `alias_1`, 1 AS `alias_2` FROM `table_1`
----
1020053846
1

query  rowsort
SELECT sum(distinct `table_1`.`column_3`) AS `alias_1` FROM `table_1` WHERE (`table_1`.`column_1` > ?)
? = 10
----
NULL

query  rowsort
SELECT 1 AS `alias_1` FROM `table_1` WHERE (`table_1`.`column_1` > ?)
? = 10
----


query  rowsort
SELECT sum(distinct `table_1`.`column_4`) AS `alias_1`, 1 AS `alias_2` FROM `table_1` WHERE (`table_1`.`column_3` > ?)
? = 10
----
-2031689508
1
