# Generated by:
#     target/debug/noria-logictest permute --compare-to mysql://root:noria@127.1/noria -d 3 -o logictests/generated/mysql/ --only range_param --random --include-deletes --rows-per-table 10 --subquery-depth 1 --overwrite-tests

statement ok
CREATE TABLE `table_1` (`column_2` INT, `column_8` INT, `column_1` INT, `column_5` INT, `column_3` INT, `column_7` INT, `column_6` INT, `column_9` INT, `column_4` INT, PRIMARY KEY (`column_9`))


statement ok
INSERT INTO `table_1` (`column_2`, `column_8`, `column_1`, `column_5`, `column_3`, `column_7`, `column_6`, `column_9`, `column_4`) VALUES (-335459739, -1291316922, -776662082, 1537760468, -75758472, -829097126, 1499055466, 0, 995404846), (-26812548, -1592315925, 796663906, -2100519413, 2093288444, -619934268, -1417850939, 1, -36133647), (934279208, 1041717944, -99488610, 276185294, 501158297, -1917038575, -59588494, 2, -788683777), (-177742665, 149932006, 1700621233, 762884976, 1566725465, 906211041, -1506962344, 3, -2003013820), (93084734, 1888491221, 1425720178, 1482762652, -1631799399, -1271360792, -501442896, 4, -1529692307), (621381968, 814724426, 552981224, 1373783133, -1961292639, -869433652, -1548668885, 5, -203226997), (1506352727, -1141916463, -1539225309, 876036059, 111918561, -466783482, -373101578, 6, -230075509), (1262850152, -1703523981, 444959406, 907838008, -1748686367, 2023776428, 1283454402, 7, -2127093588), (1102378311, 901638506, -1640526524, 160140793, 522155555, 700707946, -845224631, 8, 270627833), (-1686342373, 702518420, -1073231046, -587907808, 1920627987, -1993655162, -544821059, 9, 2038864208)


query  rowsort
SELECT sum(distinct `table_1`.`column_1`) AS `alias_1` FROM `table_1`
----
-208187624

query  rowsort
SELECT count(`table_1`.`column_2`) AS `alias_1` FROM `table_1`
----
10

query  rowsort
SELECT `table_1`.`column_2` AS `alias_1` FROM `table_1` WHERE (`table_1`.`column_2` > ?)
? = 10
----
1102378311
1262850152
1506352727
621381968
93084734
934279208

query  rowsort
SELECT sum(distinct `table_1`.`column_3`) AS `alias_1`, count(`table_1`.`column_4`) AS `alias_2` FROM `table_1`
----
1298337432
10

query  rowsort
SELECT sum(distinct `table_1`.`column_5`) AS `alias_1` FROM `table_1` WHERE (`table_1`.`column_2` > ?)
? = 10
----
5076745939

query  rowsort
SELECT count(`table_1`.`column_6`) AS `alias_1` FROM `table_1` WHERE (`table_1`.`column_2` > ?)
? = 10
----
6

query  rowsort
SELECT sum(distinct `table_1`.`column_7`) AS `alias_1`, count(`table_1`.`column_8`) AS `alias_2` FROM `table_1` WHERE (`table_1`.`column_2` > ?)
? = 10
----
-1800132127
6

statement ok
DELETE FROM `table_1` WHERE (`column_9` = 0)


statement ok
DELETE FROM `table_1` WHERE (`column_9` = 1)


statement ok
DELETE FROM `table_1` WHERE (`column_9` = 2)


statement ok
DELETE FROM `table_1` WHERE (`column_9` = 3)


statement ok
DELETE FROM `table_1` WHERE (`column_9` = 4)


query  rowsort
SELECT sum(distinct `table_1`.`column_1`) AS `alias_1` FROM `table_1`
----
-3255042249

query  rowsort
SELECT count(`table_1`.`column_2`) AS `alias_1` FROM `table_1`
----
5

query  rowsort
SELECT `table_1`.`column_2` AS `alias_1` FROM `table_1` WHERE (`table_1`.`column_2` > ?)
? = 10
----
1102378311
1262850152
1506352727
621381968

query  rowsort
SELECT sum(distinct `table_1`.`column_3`) AS `alias_1`, count(`table_1`.`column_4`) AS `alias_2` FROM `table_1`
----
-1155276903
5

query  rowsort
SELECT sum(distinct `table_1`.`column_5`) AS `alias_1` FROM `table_1` WHERE (`table_1`.`column_2` > ?)
? = 10
----
3317797993

query  rowsort
SELECT count(`table_1`.`column_6`) AS `alias_1` FROM `table_1` WHERE (`table_1`.`column_2` > ?)
? = 10
----
4

query  rowsort
SELECT sum(distinct `table_1`.`column_7`) AS `alias_1`, count(`table_1`.`column_8`) AS `alias_2` FROM `table_1` WHERE (`table_1`.`column_2` > ?)
? = 10
----
1388267240
4
