# Generated by:
#     target/debug/noria-logictest permute --compare-to mysql://root:noria@127.1/noria -d 3 -o logictests/generated/mysql/ --only range_param --random --include-deletes --rows-per-table 10 --subquery-depth 1 --overwrite-tests

statement ok
CREATE TABLE `table_1` (`column_4` INT, `column_5` INT, `column_3` INT, `column_8` INT, `column_2` INT, `column_6` INT, `column_7` INT, `column_9` INT, `column_1` INT, PRIMARY KEY (`column_9`))


statement ok
INSERT INTO `table_1` (`column_4`, `column_5`, `column_3`, `column_8`, `column_2`, `column_6`, `column_7`, `column_9`, `column_1`) VALUES (-98598889, -205436354, 1174122808, 1401126526, 59811671, -1882056968, 704220056, 0, 1096066151), (438697019, -335913948, -1887358096, 1516928047, 374011554, 1991902741, 901385854, 1, -1677876157), (-1717145536, 1722611693, 310765387, 1953520731, -1948676720, 810677115, -1185957192, 2, 1536891137), (1014863855, 1565941624, -53810807, 476017067, -1610636048, -2126650472, 1034277045, 3, -1941051799), (207731082, 104972963, 59315394, 1830692871, 2011202370, -821611662, -210647732, 4, -1869761509), (-852937559, -937838065, 1474791862, 1198511436, 15233316, -957639878, 1032097530, 5, 1099754171), (-1819361586, -1429356665, 365119019, -209956343, -867511695, 1647476461, 205738067, 6, 1125999889), (132451595, -1034222593, 939336168, -1204050893, -1159493143, -1025708336, 15744403, 7, -747915290), (-1650995203, 968013478, 284437073, 1211897030, -1500135464, -744990584, 1627461090, 8, 961283666), (-406678469, 44068228, -1045852875, -1592924490, -1575912145, 2134100249, 991811247, 9, -1741313761)


query  rowsort
SELECT sum(distinct `table_1`.`column_1`) AS `alias_1` FROM `table_1`
----
-2157923502

query  rowsort
SELECT avg(distinct `table_1`.`column_2`) AS `alias_1` FROM `table_1`
----
-620210630.4000

query  rowsort
SELECT `table_1`.`column_2` AS `alias_1` FROM `table_1` WHERE (`table_1`.`column_2` > ?)
? = 10
----
15233316
2011202370
374011554
59811671

query  rowsort
SELECT sum(distinct `table_1`.`column_3`) AS `alias_1`, avg(distinct `table_1`.`column_4`) AS `alias_2` FROM `table_1`
----
1620865933
-475197369.1000

query  rowsort
SELECT sum(distinct `table_1`.`column_5`) AS `alias_1` FROM `table_1` WHERE (`table_1`.`column_1` > ?)
? = 10
----
117994087

query  rowsort
SELECT avg(distinct `table_1`.`column_6`) AS `alias_1` FROM `table_1` WHERE (`table_1`.`column_1` > ?)
? = 10
----
-225306770.8000

query  rowsort
SELECT sum(distinct `table_1`.`column_7`) AS `alias_1`, avg(distinct `table_1`.`column_8`) AS `alias_2` FROM `table_1` WHERE (`table_1`.`column_4` > ?)
? = 10
----
1740759570
654896773.0000

statement ok
DELETE FROM `table_1` WHERE (`column_9` = 0)


statement ok
DELETE FROM `table_1` WHERE (`column_9` = 1)


statement ok
DELETE FROM `table_1` WHERE (`column_9` = 2)


statement ok
DELETE FROM `table_1` WHERE (`column_9` = 3)


statement ok
DELETE FROM `table_1` WHERE (`column_9` = 4)


query  rowsort
SELECT sum(distinct `table_1`.`column_1`) AS `alias_1` FROM `table_1`
----
697808675

query  rowsort
SELECT avg(distinct `table_1`.`column_2`) AS `alias_1` FROM `table_1`
----
-1017563826.2000

query  rowsort
SELECT `table_1`.`column_2` AS `alias_1` FROM `table_1` WHERE (`table_1`.`column_2` > ?)
? = 10
----
15233316

query  rowsort
SELECT sum(distinct `table_1`.`column_3`) AS `alias_1`, avg(distinct `table_1`.`column_4`) AS `alias_2` FROM `table_1`
----
2017831247
-919504244.4000

query  rowsort
SELECT sum(distinct `table_1`.`column_5`) AS `alias_1` FROM `table_1` WHERE (`table_1`.`column_1` > ?)
? = 10
----
-1399181252

query  rowsort
SELECT avg(distinct `table_1`.`column_6`) AS `alias_1` FROM `table_1` WHERE (`table_1`.`column_1` > ?)
? = 10
----
-18384667.0000

query  rowsort
SELECT sum(distinct `table_1`.`column_7`) AS `alias_1`, avg(distinct `table_1`.`column_8`) AS `alias_2` FROM `table_1` WHERE (`table_1`.`column_4` > ?)
? = 10
----
15744403
-1204050893.0000
