# Generated by:
#     target/debug/noria-logictest permute --compare-to mysql://root:noria@127.1/noria -d 3 -o logictests/generated/mysql/ --only range_param --random --include-deletes --rows-per-table 10 --subquery-depth 1 --overwrite-tests

statement ok
CREATE TABLE `table_1` (`column_4` INT, `column_3` INT, `column_5` INT, `column_1` INT, `column_2` INT, PRIMARY KEY (`column_5`))


statement ok
INSERT INTO `table_1` (`column_4`, `column_3`, `column_5`, `column_1`, `column_2`) VALUES (-930050137, 270338863, 0, 301855792, -1357813035), (1830988387, 1570370254, 1, 2120334097, 393021337), (1551206519, 1494773309, 2, 1468086254, 1143182875), (1602012022, -1518630898, 3, 52908093, 706548615), (1737871315, 1385072547, 4, 291208803, -1468861374), (-2101486790, 1078143392, 5, -1941845349, -956020882), (-640394147, -147664813, 6, 1910806810, -479981270), (-779070773, -171508398, 7, 1039724419, 476369984), (-1059985934, 410497263, 8, -1319271156, 624923081), (1027367632, 932727805, 9, -2036831709, 2064869415)


query  rowsort
SELECT sum(distinct `table_1`.`column_1`) AS `alias_1` FROM `table_1`
----
1886976054

query  rowsort
SELECT `table_1`.`column_1` AS `alias_1` FROM `table_1` WHERE (`table_1`.`column_1` > ?)
? = 10
----
1039724419
1468086254
1910806810
2120334097
291208803
301855792
52908093

query  rowsort
SELECT `table_1`.`column_1` AS `alias_1` FROM `table_1` WHERE (`table_1`.`column_1` > ?)
? = 10
----
1039724419
1468086254
1910806810
2120334097
291208803
301855792
52908093

query  rowsort
SELECT sum(distinct `table_1`.`column_2`) AS `alias_1` FROM `table_1` WHERE (`table_1`.`column_1` > ?)
? = 10
----
-587532868

query  rowsort
SELECT sum(distinct `table_1`.`column_3`) AS `alias_1` FROM `table_1` WHERE (`table_1`.`column_1` > ?)
? = 10
----
2882750864

query  rowsort
SELECT `table_1`.`column_1` AS `alias_1` FROM `table_1` WHERE ((`table_1`.`column_1` > ?) AND (`table_1`.`column_1` > ?))
? = 10
? = 10
----
1039724419
1468086254
1910806810
2120334097
291208803
301855792
52908093

query  rowsort
SELECT sum(distinct `table_1`.`column_4`) AS `alias_1` FROM `table_1` WHERE ((`table_1`.`column_4` > ?) AND (`table_1`.`column_4` > ?))
? = 10
? = 10
----
7749445875

statement ok
DELETE FROM `table_1` WHERE (`column_5` = 0)


statement ok
DELETE FROM `table_1` WHERE (`column_5` = 1)


statement ok
DELETE FROM `table_1` WHERE (`column_5` = 2)


statement ok
DELETE FROM `table_1` WHERE (`column_5` = 3)


statement ok
DELETE FROM `table_1` WHERE (`column_5` = 4)


query  rowsort
SELECT sum(distinct `table_1`.`column_1`) AS `alias_1` FROM `table_1`
----
-2347416985

query  rowsort
SELECT `table_1`.`column_1` AS `alias_1` FROM `table_1` WHERE (`table_1`.`column_1` > ?)
? = 10
----
1039724419
1910806810

query  rowsort
SELECT `table_1`.`column_1` AS `alias_1` FROM `table_1` WHERE (`table_1`.`column_1` > ?)
? = 10
----
1039724419
1910806810

query  rowsort
SELECT sum(distinct `table_1`.`column_2`) AS `alias_1` FROM `table_1` WHERE (`table_1`.`column_1` > ?)
? = 10
----
-3611286

query  rowsort
SELECT sum(distinct `table_1`.`column_3`) AS `alias_1` FROM `table_1` WHERE (`table_1`.`column_1` > ?)
? = 10
----
-319173211

query  rowsort
SELECT `table_1`.`column_1` AS `alias_1` FROM `table_1` WHERE ((`table_1`.`column_1` > ?) AND (`table_1`.`column_1` > ?))
? = 10
? = 10
----
1039724419
1910806810

query  rowsort
SELECT sum(distinct `table_1`.`column_4`) AS `alias_1` FROM `table_1` WHERE ((`table_1`.`column_4` > ?) AND (`table_1`.`column_4` > ?))
? = 10
? = 10
----
1027367632
