# Generated by:
#     target/debug/noria-logictest permute --compare-to mysql://root:noria@127.1/noria -d 3 -o logictests/generated/mysql/ --only range_param --random --include-deletes --rows-per-table 10 --subquery-depth 1 --overwrite-tests

statement ok
CREATE TABLE `table_1` (`column_8` INT, `column_1` INT, `column_5` INT, `column_9` INT, `column_3` INT, `column_6` INT, `column_7` INT, `column_2` INT, `column_4` INT, PRIMARY KEY (`column_9`))


statement ok
INSERT INTO `table_1` (`column_8`, `column_1`, `column_5`, `column_9`, `column_3`, `column_6`, `column_7`, `column_2`, `column_4`) VALUES (987762070, 1701452308, -1948145621, 0, -514698531, 129366634, -1405788833, -563249028, -211073621), (325230076, -878627359, 1679491839, 1, 507594512, -1508888239, 48855988, 778354619, -73157520), (-420630357, -816383023, 412779163, 2, 981793631, 633900968, 252472265, 44298427, -168811653), (1837259107, 1269674668, 275595583, 3, -1401439335, -153986837, 1456648134, -808300071, -2003845267), (-167225039, -1779966195, 1818719541, 4, 1823491882, -1537191070, 37599416, 178037559, 318730201), (1834031768, 1017996638, -1843475449, 5, 689640748, -116802771, -2117180600, 1154435991, -930737805), (629708920, 225774467, 128931415, 6, 1295975435, -1436600725, 1753870575, -1428002041, -225557123), (-129994658, 181265063, 2146043798, 7, -1363249892, 1500985823, -1655939051, 113719630, -2131432081), (-1265947721, -660911238, 1625514331, 8, 1996220223, 721384092, -753588695, -975195338, 395610689), (617675086, 237378594, -52651667, 9, -845660680, 478757761, 1623668412, -922748470, 1174638873)


query  rowsort
SELECT sum(distinct `table_1`.`column_1`) AS `alias_1` FROM `table_1`
----
497653923

query  rowsort
SELECT avg(`table_1`.`column_2`) AS `alias_1` FROM `table_1`
----
-242864872.2000

query  rowsort
SELECT `table_1`.`column_1` AS `alias_1` FROM `table_1` WHERE (`table_1`.`column_1` > ?)
? = 10
----
1017996638
1269674668
1701452308
181265063
225774467
237378594

query  rowsort
SELECT sum(distinct `table_1`.`column_3`) AS `alias_1`, avg(`table_1`.`column_4`) AS `alias_2` FROM `table_1`
----
3169667993
-385563530.7000

query  rowsort
SELECT sum(distinct `table_1`.`column_5`) AS `alias_1` FROM `table_1` WHERE (`table_1`.`column_3` > ?)
? = 10
----
3821960840

query  rowsort
SELECT avg(`table_1`.`column_6`) AS `alias_1` FROM `table_1` WHERE (`table_1`.`column_3` > ?)
? = 10
----
-540699624.1667

query  rowsort
SELECT sum(distinct `table_1`.`column_7`) AS `alias_1`, avg(`table_1`.`column_8`) AS `alias_2` FROM `table_1` WHERE (`table_1`.`column_8` > ?)
? = 10
----
1360073676
1038611171.1667

statement ok
DELETE FROM `table_1` WHERE (`column_9` = 0)


statement ok
DELETE FROM `table_1` WHERE (`column_9` = 1)


statement ok
DELETE FROM `table_1` WHERE (`column_9` = 2)


statement ok
DELETE FROM `table_1` WHERE (`column_9` = 3)


statement ok
DELETE FROM `table_1` WHERE (`column_9` = 4)


query  rowsort
SELECT sum(distinct `table_1`.`column_1`) AS `alias_1` FROM `table_1`
----
1001503524

query  rowsort
SELECT avg(`table_1`.`column_2`) AS `alias_1` FROM `table_1`
----
-411558045.6000

query  rowsort
SELECT `table_1`.`column_1` AS `alias_1` FROM `table_1` WHERE (`table_1`.`column_1` > ?)
? = 10
----
1017996638
181265063
225774467
237378594

query  rowsort
SELECT sum(distinct `table_1`.`column_3`) AS `alias_1`, avg(`table_1`.`column_4`) AS `alias_2` FROM `table_1`
----
1772925834
-343495489.4000

query  rowsort
SELECT sum(distinct `table_1`.`column_5`) AS `alias_1` FROM `table_1` WHERE (`table_1`.`column_3` > ?)
? = 10
----
-89029703

query  rowsort
SELECT avg(`table_1`.`column_6`) AS `alias_1` FROM `table_1` WHERE (`table_1`.`column_3` > ?)
? = 10
----
-277339801.3333

query  rowsort
SELECT sum(distinct `table_1`.`column_7`) AS `alias_1`, avg(`table_1`.`column_8`) AS `alias_2` FROM `table_1` WHERE (`table_1`.`column_8` > ?)
? = 10
----
1260358387
1027138591.3333
