# Generated by:
#     target/debug/noria-logictest permute --compare-to mysql://root:noria@127.1/noria -d 3 -o logictests/generated/mysql/ --only range_param --random --include-deletes --rows-per-table 10 --subquery-depth 1 --overwrite-tests

statement ok
CREATE TABLE `table_5` (`column_1` INT, `column_3` INT, `column_2` INT, PRIMARY KEY (`column_3`))


statement ok
CREATE TABLE `table_4` (`column_2` INT, `column_5` INT, `column_1` INT, `column_3` INT, `column_4` INT, PRIMARY KEY (`column_5`))


statement ok
CREATE TABLE `table_2` (`column_1` INT, `column_7` INT, `column_5` INT, `column_2` INT, `column_3` INT, `column_4` INT, `column_6` INT, PRIMARY KEY (`column_7`))


statement ok
CREATE TABLE `table_1` (`column_1` INT, `column_2` INT, `column_3` INT, PRIMARY KEY (`column_3`))


statement ok
CREATE TABLE `table_3` (`column_2` INT, `column_3` INT, `column_1` INT, PRIMARY KEY (`column_3`))


statement ok
INSERT INTO `table_5` (`column_1`, `column_3`, `column_2`) VALUES (207396097, 0, 169944675), (2041962620, 1, -464983257), (-671259829, 2, 1782767547), (64034650, 3, 1190070450), (-618421491, 4, 1130981385), (1288379093, 5, 974649838), (-862435423, 6, -383596995), (-654720488, 7, 1566859129), (1269309968, 8, -1711040513), (-1742137037, 9, 1226986491)


statement ok
INSERT INTO `table_4` (`column_2`, `column_5`, `column_1`, `column_3`, `column_4`) VALUES (-1437280622, 0, -1651956133, -186926230, 309277711), (1463644479, 1, 272885833, 641939857, -1502243328), (1101403947, 2, -955256927, 386334756, -1180108991), (873333121, 3, 1595803232, -203548744, -1536044305), (641501673, 4, -1171837850, -270403026, -667277481), (1946434183, 5, 2118425694, 933126212, 1002686806), (1327224001, 6, -1880547685, -2028898878, 118080361), (-962516348, 7, -433573, 692979789, 975948163), (1617405446, 8, 130951891, 924532580, 1494865070), (-1709149224, 9, 1568187343, -89785355, 2097725727)


statement ok
INSERT INTO `table_2` (`column_1`, `column_7`, `column_5`, `column_2`, `column_3`, `column_4`, `column_6`) VALUES (1883065772, 0, 49480758, -1559828943, -1333841634, 1073775308, 1082611054), (-68201127, 1, -18446509, -1304411215, 1919616514, 500200511, 799336841), (-1081673721, 2, -1660535982, 1787176365, 118848743, -2003049983, 643108217), (-989835896, 3, 467936051, 330807178, -6355653, -957984910, -673059142), (903036183, 4, -1670897184, -1824379694, -1971380657, -635707540, -2060505947), (1600707854, 5, 1404423630, -1178325455, 1290654749, 1165928576, 480468870), (-1221102953, 6, 1866286086, -1226143910, -73659178, 470856347, -177699857), (1879808039, 7, -615203768, -1090789429, -717239029, -1435434497, 1781442196), (174073229, 8, 199247803, 856071090, 72941230, -2113197334, 1980943715), (1174091129, 9, 665128109, 227069455, -2000269405, -549778733, 583832010)


statement ok
INSERT INTO `table_1` (`column_1`, `column_2`, `column_3`) VALUES (1614909709, 292989405, 0), (-163273047, -1787553468, 1), (-698190736, 184662446, 2), (225455952, -1617478635, 3), (-1208284680, -1686246062, 4), (489439089, 457188119, 5), (-1058470548, -894861284, 6), (-102174278, 1327637621, 7), (-504635313, -1492441145, 8), (-428352270, -1486734689, 9)


statement ok
INSERT INTO `table_3` (`column_2`, `column_3`, `column_1`) VALUES (1648517561, 0, -880342783), (1443334367, 1, 117700674), (-764200479, 2, 1250839921), (-243157713, 3, 402645319), (-2112272189, 4, -1927042466), (-1823325197, 5, -1852507302), (828622142, 6, -618554846), (-872472916, 7, 1820972517), (-2094248231, 8, -1992906362), (-1919058487, 9, -1895799127)


query  rowsort
SELECT sum(distinct `table_1`.`column_1`) AS `alias_1` FROM `table_1`
----
-1833576122

query  rowsort
SELECT `table_1`.`column_2` AS `alias_1`, `table_2`.`column_2` AS `alias_2` FROM `table_1` INNER JOIN `table_2` ON (`table_1`.`column_1` = `table_2`.`column_1`)
----


query  rowsort
SELECT `table_2`.`column_1` AS `alias_1` FROM `table_2` WHERE (`table_2`.`column_1` > ?)
? = 10
----
1174091129
1600707854
174073229
1879808039
1883065772
903036183

query  rowsort
SELECT sum(distinct `table_2`.`column_3`) AS `alias_1`, `table_2`.`column_4` AS `alias_2`, `table_3`.`column_2` AS `alias_3` FROM `table_2` INNER JOIN `table_3` ON (`table_2`.`column_1` = `table_3`.`column_1`) GROUP BY `table_2`.`column_4`, `table_3`.`column_2`
----


query  rowsort
SELECT sum(distinct `table_2`.`column_5`) AS `alias_1` FROM `table_2` WHERE (`table_2`.`column_1` > ?)
? = 10
----
32179348

query  rowsort
SELECT `table_2`.`column_6` AS `alias_1`, `table_4`.`column_2` AS `alias_2` FROM `table_2` INNER JOIN `table_4` ON (`table_2`.`column_1` = `table_4`.`column_1`) WHERE (`table_2`.`column_1` > ?)
? = 10
----


query  rowsort
SELECT sum(distinct `table_4`.`column_3`) AS `alias_1`, `table_4`.`column_4` AS `alias_2`, `table_5`.`column_2` AS `alias_3` FROM `table_4` INNER JOIN `table_5` ON (`table_4`.`column_2` = `table_5`.`column_1`) WHERE (`table_4`.`column_2` > ?) GROUP BY `table_4`.`column_4`, `table_5`.`column_2`
? = 10
----


statement ok
DELETE FROM `table_5` WHERE (`column_3` = 0)


statement ok
DELETE FROM `table_5` WHERE (`column_3` = 1)


statement ok
DELETE FROM `table_5` WHERE (`column_3` = 2)


statement ok
DELETE FROM `table_5` WHERE (`column_3` = 3)


statement ok
DELETE FROM `table_5` WHERE (`column_3` = 4)


statement ok
DELETE FROM `table_4` WHERE (`column_5` = 0)


statement ok
DELETE FROM `table_4` WHERE (`column_5` = 1)


statement ok
DELETE FROM `table_4` WHERE (`column_5` = 2)


statement ok
DELETE FROM `table_4` WHERE (`column_5` = 3)


statement ok
DELETE FROM `table_4` WHERE (`column_5` = 4)


statement ok
DELETE FROM `table_2` WHERE (`column_7` = 0)


statement ok
DELETE FROM `table_2` WHERE (`column_7` = 1)


statement ok
DELETE FROM `table_2` WHERE (`column_7` = 2)


statement ok
DELETE FROM `table_2` WHERE (`column_7` = 3)


statement ok
DELETE FROM `table_2` WHERE (`column_7` = 4)


statement ok
DELETE FROM `table_1` WHERE (`column_3` = 0)


statement ok
DELETE FROM `table_1` WHERE (`column_3` = 1)


statement ok
DELETE FROM `table_1` WHERE (`column_3` = 2)


statement ok
DELETE FROM `table_1` WHERE (`column_3` = 3)


statement ok
DELETE FROM `table_1` WHERE (`column_3` = 4)


statement ok
DELETE FROM `table_3` WHERE (`column_3` = 0)


statement ok
DELETE FROM `table_3` WHERE (`column_3` = 1)


statement ok
DELETE FROM `table_3` WHERE (`column_3` = 2)


statement ok
DELETE FROM `table_3` WHERE (`column_3` = 3)


statement ok
DELETE FROM `table_3` WHERE (`column_3` = 4)


query  rowsort
SELECT sum(distinct `table_1`.`column_1`) AS `alias_1` FROM `table_1`
----
-1604193320

query  rowsort
SELECT `table_1`.`column_2` AS `alias_1`, `table_2`.`column_2` AS `alias_2` FROM `table_1` INNER JOIN `table_2` ON (`table_1`.`column_1` = `table_2`.`column_1`)
----


query  rowsort
SELECT `table_2`.`column_1` AS `alias_1` FROM `table_2` WHERE (`table_2`.`column_1` > ?)
? = 10
----
1174091129
1600707854
174073229
1879808039

query  rowsort
SELECT sum(distinct `table_2`.`column_3`) AS `alias_1`, `table_2`.`column_4` AS `alias_2`, `table_3`.`column_2` AS `alias_3` FROM `table_2` INNER JOIN `table_3` ON (`table_2`.`column_1` = `table_3`.`column_1`) GROUP BY `table_2`.`column_4`, `table_3`.`column_2`
----


query  rowsort
SELECT sum(distinct `table_2`.`column_5`) AS `alias_1` FROM `table_2` WHERE (`table_2`.`column_1` > ?)
? = 10
----
1653595774

query  rowsort
SELECT `table_2`.`column_6` AS `alias_1`, `table_4`.`column_2` AS `alias_2` FROM `table_2` INNER JOIN `table_4` ON (`table_2`.`column_1` = `table_4`.`column_1`) WHERE (`table_2`.`column_1` > ?)
? = 10
----


query  rowsort
SELECT sum(distinct `table_4`.`column_3`) AS `alias_1`, `table_4`.`column_4` AS `alias_2`, `table_5`.`column_2` AS `alias_3` FROM `table_4` INNER JOIN `table_5` ON (`table_4`.`column_2` = `table_5`.`column_1`) WHERE (`table_4`.`column_2` > ?) GROUP BY `table_4`.`column_4`, `table_5`.`column_2`
? = 10
----

