# Generated by:
#     target/debug/noria-logictest permute --compare-to mysql://root:noria@127.1/noria -d 3 -o logictests/generated/mysql/ --only range_param --random --include-deletes --rows-per-table 10 --subquery-depth 1 --overwrite-tests

statement ok
CREATE TABLE `table_1` (`column_4` INT, `column_1` INT, `column_3` INT, `column_5` INT, `column_2` INT, PRIMARY KEY (`column_5`))


statement ok
INSERT INTO `table_1` (`column_4`, `column_1`, `column_3`, `column_5`, `column_2`) VALUES (1, 1, 1692633770, 0, 2), (1918928925, -2049868412, -1339764309, 1, -60820373), (2, 0, -1079109250, 2, 0), (220348139, 1251856572, -87509063, 3, -1060812819), (0, 2, 1660840231, 4, 1), (914947669, 26279176, -1844420171, 5, 307714446), (1, 1, 1683930656, 6, 2), (-200966251, 903395556, -1444511539, 7, -71981409), (2, 0, -465193069, 8, 0), (-459884813, 1516191502, 1490639079, 9, 902768387)


query  rowsort
SELECT sum(distinct `table_1`.`column_1`) AS `alias_1` FROM `table_1`
----
1647854397

query  rowsort
SELECT `table_1`.`column_1` AS `alias_1` FROM `table_1` WHERE `table_1`.`column_1` IN (?, ?, ?)
? = 0
? = 1
? = 2
----
0
0
1
1
2

query  rowsort
SELECT `table_1`.`column_1` AS `alias_1` FROM `table_1` WHERE (`table_1`.`column_1` > ?)
? = 10
----
1251856572
1516191502
26279176
903395556

query  rowsort
SELECT sum(distinct `table_1`.`column_2`) AS `alias_1` FROM `table_1` WHERE `table_1`.`column_2` IN (?, ?, ?)
? = 0
? = 1
? = 2
----
3

query  rowsort
SELECT sum(distinct `table_1`.`column_3`) AS `alias_1` FROM `table_1` WHERE (`table_1`.`column_2` > ?)
? = 10
----
-353781092

query  rowsort
SELECT `table_1`.`column_2` AS `alias_1` FROM `table_1` WHERE (`table_1`.`column_2` IN (?, ?, ?) AND (`table_1`.`column_2` > ?))
? = 0
? = 1
? = 2
? = 10
----


query  rowsort
SELECT sum(distinct `table_1`.`column_4`) AS `alias_1` FROM `table_1` WHERE (`table_1`.`column_4` IN (?, ?, ?) AND (`table_1`.`column_4` > ?))
? = 0
? = 1
? = 2
? = 10
----
NULL

statement ok
DELETE FROM `table_1` WHERE (`column_5` = 0)


statement ok
DELETE FROM `table_1` WHERE (`column_5` = 1)


statement ok
DELETE FROM `table_1` WHERE (`column_5` = 2)


statement ok
DELETE FROM `table_1` WHERE (`column_5` = 3)


statement ok
DELETE FROM `table_1` WHERE (`column_5` = 4)


query  rowsort
SELECT sum(distinct `table_1`.`column_1`) AS `alias_1` FROM `table_1`
----
2445866235

query  rowsort
SELECT `table_1`.`column_1` AS `alias_1` FROM `table_1` WHERE `table_1`.`column_1` IN (?, ?, ?)
? = 0
? = 1
? = 2
----
0
1

query  rowsort
SELECT `table_1`.`column_1` AS `alias_1` FROM `table_1` WHERE (`table_1`.`column_1` > ?)
? = 10
----
1516191502
26279176
903395556

query  rowsort
SELECT sum(distinct `table_1`.`column_2`) AS `alias_1` FROM `table_1` WHERE `table_1`.`column_2` IN (?, ?, ?)
? = 0
? = 1
? = 2
----
2

query  rowsort
SELECT sum(distinct `table_1`.`column_3`) AS `alias_1` FROM `table_1` WHERE (`table_1`.`column_2` > ?)
? = 10
----
-353781092

query  rowsort
SELECT `table_1`.`column_2` AS `alias_1` FROM `table_1` WHERE (`table_1`.`column_2` IN (?, ?, ?) AND (`table_1`.`column_2` > ?))
? = 0
? = 1
? = 2
? = 10
----


query  rowsort
SELECT sum(distinct `table_1`.`column_4`) AS `alias_1` FROM `table_1` WHERE (`table_1`.`column_4` IN (?, ?, ?) AND (`table_1`.`column_4` > ?))
? = 0
? = 1
? = 2
? = 10
----
NULL
