# Generated by:
#     target/debug/noria-logictest permute --compare-to mysql://root:noria@127.1/noria -d 3 -o logictests/generated/mysql/ --only range_param --random --include-deletes --rows-per-table 10 --subquery-depth 1 --overwrite-tests

statement ok
CREATE TABLE `table_2` (`column_9` INT, `column_8` INT, `column_3` INT, `column_7` INT, `column_1` INT, `column_2` INT, `column_5` INT, `column_6` INT, `column_4` INT, PRIMARY KEY (`column_9`))


statement ok
CREATE TABLE `table_1` (`column_2` INT, `column_3` INT, `column_1` INT, PRIMARY KEY (`column_3`))


statement ok
CREATE TABLE `table_3` (`column_1` INT, `column_2` INT, `column_3` INT, PRIMARY KEY (`column_3`))


statement ok
CREATE TABLE `table_4` (`column_3` INT, `column_1` INT, `column_2` INT, PRIMARY KEY (`column_3`))


statement ok
CREATE TABLE `table_5` (`column_2` INT, `column_3` INT, `column_1` INT, PRIMARY KEY (`column_3`))


statement ok
INSERT INTO `table_2` (`column_9`, `column_8`, `column_3`, `column_7`, `column_1`, `column_2`, `column_5`, `column_6`, `column_4`) VALUES (0, 1184850571, 1953601369, -1835245409, -1119349626, -185432122, -1171059043, -849811646, 46406524), (1, -1826540440, -963056239, 293756455, 2020895856, 1273104615, -679287789, -1576476362, 178513467), (2, 1281752534, -1718639202, -1602363361, -1857103453, 1616841019, -471340111, 717485845, -77284488), (3, 90387128, -492257940, -1077526679, -1560107533, -205003478, 1271692750, 1022854000, 782654617), (4, 1615122899, -1707237281, 1184285836, 2014189620, 1785587700, 379295144, 1352112540, -1890482689), (5, -683011125, -1584694352, -1725623752, -830969644, 577257945, -1927300138, 835203278, -1273876763), (6, 769277140, 712767271, 1179783558, -1514798830, -1386384773, 1735413627, 1927819190, -116453289), (7, -1777057398, 767995784, -2083356532, 863747865, 1718395622, -404299181, 338905892, -1871210904), (8, 1811672635, -513775632, -1290287362, -170026314, 20105402, -56130102, -299978296, -1566181862), (9, 1926049677, -611646075, -715711409, 1977781120, -853324446, -1480421916, 1573313120, 403430974)


statement ok
INSERT INTO `table_1` (`column_2`, `column_3`, `column_1`) VALUES (1353055436, 0, -30645901), (879864196, 1, 402501188), (-571378947, 2, -1309558472), (-1573478388, 3, 1729710464), (-1658194476, 4, -1425263174), (-1041295368, 5, -268697366), (-534773935, 6, 780454219), (-402760866, 7, 937833290), (740690098, 8, 112177950), (-1585075587, 9, 529454926)


statement ok
INSERT INTO `table_3` (`column_1`, `column_2`, `column_3`) VALUES (622811827, -1575082025, 0), (1209893332, -1796765842, 1), (1004003022, 306186583, 2), (-1364062772, 1304023879, 3), (-106885969, -429040137, 4), (-1172752684, -1322077521, 5), (796734697, 1852964301, 6), (-1155991540, 768695241, 7), (-1917022183, -138909725, 8), (1854518560, 173734302, 9)


statement ok
INSERT INTO `table_4` (`column_3`, `column_1`, `column_2`) VALUES (0, 1330996914, -424789098), (1, -1042477765, -2045196991), (2, -1573043657, 831163352), (3, 454527349, 1105381533), (4, 1899224275, -1788816076), (5, -804782489, 542208539), (6, -2094676419, -2032310415), (7, -1762803338, 2073150049), (8, -1810708719, -1782490401), (9, -1533974866, -1996783120)


statement ok
INSERT INTO `table_5` (`column_2`, `column_3`, `column_1`) VALUES (-128896291, 0, 1138214878), (741217559, 1, -1539047478), (1380243726, 2, -1260247014), (-1609896754, 3, -564628981), (1677456040, 4, -1340342125), (1861411223, 5, -1133968075), (-189325990, 6, -1766080967), (610227686, 7, -1807817240), (435611667, 8, 1247316411), (-983962957, 9, 1872552111)


query  rowsort
SELECT sum(distinct `table_1`.`column_1`) AS `alias_1` FROM `table_1`
----
1457967124

query  rowsort
SELECT `table_1`.`column_2` AS `alias_1`, `table_2`.`column_2` AS `alias_2` FROM `table_1` LEFT JOIN `table_2` ON (`table_1`.`column_1` = `table_2`.`column_1`)
----
-1041295368
NULL
-1573478388
NULL
-1585075587
NULL
-1658194476
NULL
-402760866
NULL
-534773935
NULL
-571378947
NULL
1353055436
NULL
740690098
NULL
879864196
NULL

query  rowsort
SELECT `table_2`.`column_2` AS `alias_1` FROM `table_2` WHERE (`table_2`.`column_2` > ?)
? = 10
----
1273104615
1616841019
1718395622
1785587700
20105402
577257945

query  rowsort
SELECT sum(distinct `table_2`.`column_3`) AS `alias_1`, `table_2`.`column_4` AS `alias_2`, `table_3`.`column_2` AS `alias_3` FROM `table_2` LEFT JOIN `table_3` ON (`table_2`.`column_2` = `table_3`.`column_1`) GROUP BY `table_2`.`column_4`, `table_3`.`column_2`
----
30 values hashing to 808276fe8a11222d8e8f6e8c591a28b3

query  rowsort
SELECT sum(distinct `table_2`.`column_5`) AS `alias_1` FROM `table_2` WHERE (`table_2`.`column_5` > ?)
? = 10
----
3386401521

query  rowsort
SELECT `table_2`.`column_6` AS `alias_1`, `table_4`.`column_2` AS `alias_2` FROM `table_2` LEFT JOIN `table_4` ON (`table_2`.`column_5` = `table_4`.`column_1`) WHERE (`table_2`.`column_5` > ?)
? = 10
----
1022854000
NULL
1352112540
NULL
1927819190
NULL

query  rowsort
SELECT sum(distinct `table_2`.`column_7`) AS `alias_1`, `table_2`.`column_8` AS `alias_2`, `table_5`.`column_2` AS `alias_3` FROM `table_2` LEFT JOIN `table_5` ON (`table_2`.`column_5` = `table_5`.`column_1`) WHERE (`table_2`.`column_8` > ?) GROUP BY `table_2`.`column_8`, `table_5`.`column_2`
? = 10
----
21 values hashing to 95b53d0320bf9da7d8d40121d2173468

statement ok
DELETE FROM `table_2` WHERE (`column_9` = 0)


statement ok
DELETE FROM `table_2` WHERE (`column_9` = 1)


statement ok
DELETE FROM `table_2` WHERE (`column_9` = 2)


statement ok
DELETE FROM `table_2` WHERE (`column_9` = 3)


statement ok
DELETE FROM `table_2` WHERE (`column_9` = 4)


statement ok
DELETE FROM `table_1` WHERE (`column_3` = 0)


statement ok
DELETE FROM `table_1` WHERE (`column_3` = 1)


statement ok
DELETE FROM `table_1` WHERE (`column_3` = 2)


statement ok
DELETE FROM `table_1` WHERE (`column_3` = 3)


statement ok
DELETE FROM `table_1` WHERE (`column_3` = 4)


statement ok
DELETE FROM `table_3` WHERE (`column_3` = 0)


statement ok
DELETE FROM `table_3` WHERE (`column_3` = 1)


statement ok
DELETE FROM `table_3` WHERE (`column_3` = 2)


statement ok
DELETE FROM `table_3` WHERE (`column_3` = 3)


statement ok
DELETE FROM `table_3` WHERE (`column_3` = 4)


statement ok
DELETE FROM `table_4` WHERE (`column_3` = 0)


statement ok
DELETE FROM `table_4` WHERE (`column_3` = 1)


statement ok
DELETE FROM `table_4` WHERE (`column_3` = 2)


statement ok
DELETE FROM `table_4` WHERE (`column_3` = 3)


statement ok
DELETE FROM `table_4` WHERE (`column_3` = 4)


statement ok
DELETE FROM `table_5` WHERE (`column_3` = 0)


statement ok
DELETE FROM `table_5` WHERE (`column_3` = 1)


statement ok
DELETE FROM `table_5` WHERE (`column_3` = 2)


statement ok
DELETE FROM `table_5` WHERE (`column_3` = 3)


statement ok
DELETE FROM `table_5` WHERE (`column_3` = 4)


query  rowsort
SELECT sum(distinct `table_1`.`column_1`) AS `alias_1` FROM `table_1`
----
2091223019

query  rowsort
SELECT `table_1`.`column_2` AS `alias_1`, `table_2`.`column_2` AS `alias_2` FROM `table_1` LEFT JOIN `table_2` ON (`table_1`.`column_1` = `table_2`.`column_1`)
----
-1041295368
NULL
-1585075587
NULL
-402760866
NULL
-534773935
NULL
740690098
NULL

query  rowsort
SELECT `table_2`.`column_2` AS `alias_1` FROM `table_2` WHERE (`table_2`.`column_2` > ?)
? = 10
----
1718395622
20105402
577257945

query  rowsort
SELECT sum(distinct `table_2`.`column_3`) AS `alias_1`, `table_2`.`column_4` AS `alias_2`, `table_3`.`column_2` AS `alias_3` FROM `table_2` LEFT JOIN `table_3` ON (`table_2`.`column_2` = `table_3`.`column_1`) GROUP BY `table_2`.`column_4`, `table_3`.`column_2`
----
-1584694352
-1273876763
NULL
-513775632
-1566181862
NULL
-611646075
403430974
NULL
712767271
-116453289
NULL
767995784
-1871210904
NULL

query  rowsort
SELECT sum(distinct `table_2`.`column_5`) AS `alias_1` FROM `table_2` WHERE (`table_2`.`column_5` > ?)
? = 10
----
1735413627

query  rowsort
SELECT `table_2`.`column_6` AS `alias_1`, `table_4`.`column_2` AS `alias_2` FROM `table_2` LEFT JOIN `table_4` ON (`table_2`.`column_5` = `table_4`.`column_1`) WHERE (`table_2`.`column_5` > ?)
? = 10
----
1927819190
NULL

query  rowsort
SELECT sum(distinct `table_2`.`column_7`) AS `alias_1`, `table_2`.`column_8` AS `alias_2`, `table_5`.`column_2` AS `alias_3` FROM `table_2` LEFT JOIN `table_5` ON (`table_2`.`column_5` = `table_5`.`column_1`) WHERE (`table_2`.`column_8` > ?) GROUP BY `table_2`.`column_8`, `table_5`.`column_2`
? = 10
----
-1290287362
1811672635
NULL
-715711409
1926049677
NULL
1179783558
769277140
NULL
