# Generated by:
#     target/debug/noria-logictest permute --compare-to mysql://root:noria@127.1/noria -d 3 -o logictests/generated/mysql/ --only range_param --random --include-deletes --rows-per-table 10 --subquery-depth 1 --overwrite-tests

statement ok
CREATE TABLE `table_1` (`column_2` INT, `column_1` INT, `column_3` INT, `column_5` INT, `column_4` INT, PRIMARY KEY (`column_5`))


statement ok
INSERT INTO `table_1` (`column_2`, `column_1`, `column_3`, `column_5`, `column_4`) VALUES (354754636, 1655413869, -1515017360, 0, 696846549), (-1717410234, -199559637, -306115777, 1, -741540387), (1857920721, 1897329246, -526728577, 2, 67174528), (1960360616, 1494567314, 1197553887, 3, 2032208186), (1479398792, -774604181, -55083310, 4, -1849987209), (1383680959, 445189888, 1258924907, 5, 1155602844), (564679162, 1011684706, 1211297699, 6, 1016571808), (1437717591, 767074906, -1972682111, 7, -309150926), (-1241318269, 1731966289, -166984733, 8, -910014599), (2083147581, 458603965, -383699232, 9, 1381711186)


query  rowsort
SELECT sum(distinct `table_1`.`column_1`) AS `alias_1` FROM `table_1`
----
8487666365

query  rowsort
SELECT DISTINCT `table_1`.`column_1` AS `alias_1` FROM `table_1`
----
-199559637
-774604181
1011684706
1494567314
1655413869
1731966289
1897329246
445189888
458603965
767074906

query  rowsort
SELECT `table_1`.`column_1` AS `alias_1` FROM `table_1` WHERE (`table_1`.`column_1` > ?)
? = 10
----
1011684706
1494567314
1655413869
1731966289
1897329246
445189888
458603965
767074906

query  rowsort
SELECT DISTINCT sum(distinct `table_1`.`column_2`) AS `alias_1` FROM `table_1`
----
8162931555

query  rowsort
SELECT sum(distinct `table_1`.`column_3`) AS `alias_1` FROM `table_1` WHERE (`table_1`.`column_2` > ?)
? = 10
----
-785434097

query  rowsort
SELECT DISTINCT `table_1`.`column_2` AS `alias_1` FROM `table_1` WHERE (`table_1`.`column_2` > ?)
? = 10
----
1383680959
1437717591
1479398792
1857920721
1960360616
2083147581
354754636
564679162

query  rowsort
SELECT DISTINCT sum(distinct `table_1`.`column_4`) AS `alias_1` FROM `table_1` WHERE (`table_1`.`column_2` > ?)
? = 10
----
4190976966

statement ok
DELETE FROM `table_1` WHERE (`column_5` = 0)


statement ok
DELETE FROM `table_1` WHERE (`column_5` = 1)


statement ok
DELETE FROM `table_1` WHERE (`column_5` = 2)


statement ok
DELETE FROM `table_1` WHERE (`column_5` = 3)


statement ok
DELETE FROM `table_1` WHERE (`column_5` = 4)


query  rowsort
SELECT sum(distinct `table_1`.`column_1`) AS `alias_1` FROM `table_1`
----
4414519754

query  rowsort
SELECT DISTINCT `table_1`.`column_1` AS `alias_1` FROM `table_1`
----
1011684706
1731966289
445189888
458603965
767074906

query  rowsort
SELECT `table_1`.`column_1` AS `alias_1` FROM `table_1` WHERE (`table_1`.`column_1` > ?)
? = 10
----
1011684706
1731966289
445189888
458603965
767074906

query  rowsort
SELECT DISTINCT sum(distinct `table_1`.`column_2`) AS `alias_1` FROM `table_1`
----
4227907024

query  rowsort
SELECT sum(distinct `table_1`.`column_3`) AS `alias_1` FROM `table_1` WHERE (`table_1`.`column_2` > ?)
? = 10
----
113841263

query  rowsort
SELECT DISTINCT `table_1`.`column_2` AS `alias_1` FROM `table_1` WHERE (`table_1`.`column_2` > ?)
? = 10
----
1383680959
1437717591
2083147581
564679162

query  rowsort
SELECT DISTINCT sum(distinct `table_1`.`column_4`) AS `alias_1` FROM `table_1` WHERE (`table_1`.`column_2` > ?)
? = 10
----
3244734912
