# Generated by:
#     target/debug/noria-logictest permute -d 3 -o logictests/generated/mysql --only in_parameter --compare-to mysql://root:noria@localhost/mysql --subquery-depth 1 --rows-per-table 5 --include-deletes --overwrite-tests

statement ok
CREATE TABLE table_1 (column_2 INT, column_5 INT, column_3 INT, column_4 INT, column_1 INT, PRIMARY KEY (column_5))


statement ok
INSERT INTO table_1 (column_2, column_5, column_3, column_4, column_1) VALUES (2, 0, 1, 1, 2), (1, 1, 1, 1, 1), (1, 2, 1, 1, 1), (1, 3, 1, 1, 1), (0, 4, 1, 1, 0)


query  rowsort
SELECT sum(distinct table_1.column_1) AS alias_1 FROM table_1
----
3

query  rowsort
SELECT 1 AS alias_1
----
1

query  rowsort
SELECT table_1.column_1 AS alias_1 FROM table_1 WHERE table_1.column_1 IN (?, ?, ?)
? = 0
? = 1
? = 2
----
0
1
1
1
2

query  rowsort
SELECT sum(distinct table_1.column_2) AS alias_1, 1 AS alias_2 FROM table_1
----
3
1

query  rowsort
SELECT sum(distinct table_1.column_3) AS alias_1 FROM table_1 WHERE table_1.column_2 IN (?, ?, ?)
? = 0
? = 1
? = 2
----
1

query  rowsort
SELECT 1 AS alias_1 FROM table_1 WHERE table_1.column_2 IN (?, ?, ?)
? = 0
? = 1
? = 2
----
1
1
1
1
1

query  rowsort
SELECT sum(distinct table_1.column_4) AS alias_1, 1 AS alias_2 FROM table_1 WHERE table_1.column_2 IN (?, ?, ?)
? = 0
? = 1
? = 2
----
1
1

statement ok
DELETE FROM table_1 WHERE (column_5 = 0)


statement ok
DELETE FROM table_1 WHERE (column_5 = 1)


query  rowsort
SELECT sum(distinct table_1.column_1) AS alias_1 FROM table_1
----
1

query  rowsort
SELECT 1 AS alias_1
----
1

query  rowsort
SELECT table_1.column_1 AS alias_1 FROM table_1 WHERE table_1.column_1 IN (?, ?, ?)
? = 0
? = 1
? = 2
----
0
1
1

query  rowsort
SELECT sum(distinct table_1.column_2) AS alias_1, 1 AS alias_2 FROM table_1
----
1
1

query  rowsort
SELECT sum(distinct table_1.column_3) AS alias_1 FROM table_1 WHERE table_1.column_2 IN (?, ?, ?)
? = 0
? = 1
? = 2
----
1

query  rowsort
SELECT 1 AS alias_1 FROM table_1 WHERE table_1.column_2 IN (?, ?, ?)
? = 0
? = 1
? = 2
----
1
1
1

query  rowsort
SELECT sum(distinct table_1.column_4) AS alias_1, 1 AS alias_2 FROM table_1 WHERE table_1.column_2 IN (?, ?, ?)
? = 0
? = 1
? = 2
----
1
1
