# Generated by:
#     target/debug/noria-logictest permute --compare-to mysql://root:noria@127.1/noria -d 3 -o logictests/generated/mysql/ --only range_param --random --include-deletes --rows-per-table 10 --subquery-depth 1 --overwrite-tests

statement ok
CREATE TABLE `table_1` (`column_10` INT, `column_5` INT, `column_13` INT, `column_12` INT, `column_1` INT, `column_9` INT, `column_2` INT, `column_6` INT, `column_11` INT, `column_4` INT, `column_3` INT, `column_7` INT, `column_8` INT, PRIMARY KEY (`column_13`))


statement ok
INSERT INTO `table_1` (`column_10`, `column_5`, `column_13`, `column_12`, `column_1`, `column_9`, `column_2`, `column_6`, `column_11`, `column_4`, `column_3`, `column_7`, `column_8`) VALUES (812972830, -1360393421, 0, 1514783494, 1296872260, 349603495, -1827214763, 1138407013, 418108255, 804241968, 855270824, -1418886150, 1915192208), (-278475202, -1434272665, 1, -1508978747, 368414565, 60708215, 1139273841, 1956517009, 845706005, 166546467, -1941420019, -632736138, 1899521337), (-1926514067, -647611528, 2, -474302846, 668977306, -1773188885, 30194954, -1657324575, 745532362, -1457777274, -1593479173, 1785388220, -181833364), (2002522262, 2028924766, 3, 1125277579, 688069092, 144451259, 1228136355, -1514951990, -967021257, -599082075, 1564068881, -1733331112, -1624990776), (-1326746097, 284507301, 4, -1715109122, -407987350, -1893775959, 209091541, -1546020569, 1939792844, 2023059658, 2011291921, -1653759981, 1300332704), (1037015152, 1321302178, 5, 2007804571, -1185939714, -320582765, -1636382235, -855427682, -2019586597, 609680658, -1859661331, 951352180, 1557360779), (1971238701, -325649113, 6, -1995921598, -1280599535, -784633122, 923654831, -745896743, -874060723, 633906158, -611288921, -1053225152, -1678802351), (1614596726, -1779351833, 7, 556577300, -686842461, 1545461517, -1422887463, 784030835, 145997386, -631367529, 1975223763, -499777945, -16082382), (235149261, -1207498623, 8, -574419991, -995199809, 1000134294, -539214775, 1152048654, 1234408256, 1478465551, -929387178, 270118029, 1180473131), (-62670413, 1022807024, 9, 992014820, 1286189713, 362779821, 1251349780, 1483052988, 830008315, 1155604534, -1242049105, -1550156957, 650639956)


query  rowsort
SELECT sum(distinct `table_1`.`column_1`) AS `alias_1` FROM `table_1` INNER JOIN (SELECT sum(distinct `table_1`.`column_2`) AS `alias_2` FROM `table_1`) AS alias_3 ON (`table_1`.`column_2` = `alias_3`.`alias_2`)
----
NULL

query  rowsort
SELECT sum(distinct `table_1`.`column_3`) AS `alias_1` FROM `table_1` INNER JOIN (SELECT `table_1`.`column_2` AS `alias_2` FROM `table_1`) AS alias_3 ON (`table_1`.`column_2` = `alias_3`.`alias_2`)
----
-1771430338

query  rowsort
SELECT sum(distinct `table_1`.`column_4`) AS `alias_1` FROM `table_1` INNER JOIN (SELECT sum(distinct `table_1`.`column_5`) AS `alias_2` FROM `table_1`) AS alias_3 ON (`table_1`.`column_2` = `alias_3`.`alias_2`)
----
NULL

query  rowsort
SELECT `table_1`.`column_2` AS `alias_3` FROM `table_1` INNER JOIN (SELECT sum(distinct `table_1`.`column_6`) AS `alias_1` FROM `table_1`) AS alias_2 ON (`table_1`.`column_2` = `alias_2`.`alias_1`) WHERE (`table_1`.`column_2` > ?)
? = 10
----


query  rowsort
SELECT `table_1`.`column_2` AS `alias_3` FROM `table_1` INNER JOIN (SELECT `table_1`.`column_2` AS `alias_1` FROM `table_1`) AS alias_2 ON (`table_1`.`column_2` = `alias_2`.`alias_1`) WHERE (`table_1`.`column_2` > ?)
? = 10
----
1139273841
1228136355
1251349780
209091541
30194954
923654831

query  rowsort
SELECT `table_1`.`column_2` AS `alias_3` FROM `table_1` INNER JOIN (SELECT sum(distinct `table_1`.`column_7`) AS `alias_1` FROM `table_1`) AS alias_2 ON (`table_1`.`column_2` = `alias_2`.`alias_1`) WHERE (`table_1`.`column_2` > ?)
? = 10
----


query  rowsort
SELECT sum(distinct `table_1`.`column_8`) AS `alias_1` FROM `table_1` INNER JOIN (SELECT sum(distinct `table_1`.`column_9`) AS `alias_2` FROM `table_1`) AS alias_3 ON (`table_1`.`column_5` = `alias_3`.`alias_2`) WHERE (`table_1`.`column_5` > ?)
? = 10
----
NULL

query  rowsort
SELECT sum(distinct `table_1`.`column_10`) AS `alias_1` FROM `table_1` INNER JOIN (SELECT `table_1`.`column_10` AS `alias_2` FROM `table_1`) AS alias_3 ON (`table_1`.`column_10` = `alias_3`.`alias_2`) WHERE (`table_1`.`column_10` > ?)
? = 10
----
7673494932

query  rowsort
SELECT sum(distinct `table_1`.`column_11`) AS `alias_1` FROM `table_1` INNER JOIN (SELECT sum(distinct `table_1`.`column_12`) AS `alias_2` FROM `table_1`) AS alias_3 ON (`table_1`.`column_10` = `alias_3`.`alias_2`) WHERE (`table_1`.`column_10` > ?)
? = 10
----
NULL

statement ok
DELETE FROM `table_1` WHERE (`column_13` = 0)


statement ok
DELETE FROM `table_1` WHERE (`column_13` = 1)


statement ok
DELETE FROM `table_1` WHERE (`column_13` = 2)


statement ok
DELETE FROM `table_1` WHERE (`column_13` = 3)


statement ok
DELETE FROM `table_1` WHERE (`column_13` = 4)


query  rowsort
SELECT sum(distinct `table_1`.`column_1`) AS `alias_1` FROM `table_1` INNER JOIN (SELECT sum(distinct `table_1`.`column_2`) AS `alias_2` FROM `table_1`) AS alias_3 ON (`table_1`.`column_2` = `alias_3`.`alias_2`)
----
NULL

query  rowsort
SELECT sum(distinct `table_1`.`column_3`) AS `alias_1` FROM `table_1` INNER JOIN (SELECT `table_1`.`column_2` AS `alias_2` FROM `table_1`) AS alias_3 ON (`table_1`.`column_2` = `alias_3`.`alias_2`)
----
-2667162772

query  rowsort
SELECT sum(distinct `table_1`.`column_4`) AS `alias_1` FROM `table_1` INNER JOIN (SELECT sum(distinct `table_1`.`column_5`) AS `alias_2` FROM `table_1`) AS alias_3 ON (`table_1`.`column_2` = `alias_3`.`alias_2`)
----
NULL

query  rowsort
SELECT `table_1`.`column_2` AS `alias_3` FROM `table_1` INNER JOIN (SELECT sum(distinct `table_1`.`column_6`) AS `alias_1` FROM `table_1`) AS alias_2 ON (`table_1`.`column_2` = `alias_2`.`alias_1`) WHERE (`table_1`.`column_2` > ?)
? = 10
----


query  rowsort
SELECT `table_1`.`column_2` AS `alias_3` FROM `table_1` INNER JOIN (SELECT `table_1`.`column_2` AS `alias_1` FROM `table_1`) AS alias_2 ON (`table_1`.`column_2` = `alias_2`.`alias_1`) WHERE (`table_1`.`column_2` > ?)
? = 10
----
1251349780
923654831

query  rowsort
SELECT `table_1`.`column_2` AS `alias_3` FROM `table_1` INNER JOIN (SELECT sum(distinct `table_1`.`column_7`) AS `alias_1` FROM `table_1`) AS alias_2 ON (`table_1`.`column_2` = `alias_2`.`alias_1`) WHERE (`table_1`.`column_2` > ?)
? = 10
----


query  rowsort
SELECT sum(distinct `table_1`.`column_8`) AS `alias_1` FROM `table_1` INNER JOIN (SELECT sum(distinct `table_1`.`column_9`) AS `alias_2` FROM `table_1`) AS alias_3 ON (`table_1`.`column_5` = `alias_3`.`alias_2`) WHERE (`table_1`.`column_5` > ?)
? = 10
----
NULL

query  rowsort
SELECT sum(distinct `table_1`.`column_10`) AS `alias_1` FROM `table_1` INNER JOIN (SELECT `table_1`.`column_10` AS `alias_2` FROM `table_1`) AS alias_3 ON (`table_1`.`column_10` = `alias_3`.`alias_2`) WHERE (`table_1`.`column_10` > ?)
? = 10
----
4857999840

query  rowsort
SELECT sum(distinct `table_1`.`column_11`) AS `alias_1` FROM `table_1` INNER JOIN (SELECT sum(distinct `table_1`.`column_12`) AS `alias_2` FROM `table_1`) AS alias_3 ON (`table_1`.`column_10` = `alias_3`.`alias_2`) WHERE (`table_1`.`column_10` > ?)
? = 10
----
NULL
