# Generated by:
#     target/debug/noria-logictest permute --compare-to mysql://root:noria@127.1/noria -d 3 -o logictests/generated/mysql/ --only range_param --random --include-deletes --rows-per-table 10 --subquery-depth 1 --overwrite-tests

statement ok
CREATE TABLE `table_1` (`column_6` INT, `column_3` INT, `column_7` INT, `column_5` INT, `column_4` INT, `column_8` INT, `column_9` INT, `column_2` INT, `column_1` INT, PRIMARY KEY (`column_9`))


statement ok
INSERT INTO `table_1` (`column_6`, `column_3`, `column_7`, `column_5`, `column_4`, `column_8`, `column_9`, `column_2`, `column_1`) VALUES (347098352, 1024948710, -679879092, -877740064, 357834890, 770960578, 0, 743822939, -912338973), (1801828125, 1795867193, 677699101, 1871636194, 460234886, -1356871450, 1, 849728704, -1132215157), (-1918335809, 1080282896, -1154750333, -1624123651, 1906102659, -199449756, 2, 287411081, 2136999838), (-1164974993, 720995197, -476833693, -422271895, -273516767, 2008907270, 3, 57547378, -1263137314), (-968930926, 1696091342, 878935741, 552841692, -114010121, -1765671386, 4, -276351594, -314925249), (1089055976, -932949867, -800344218, 16384475, -566817130, 1380039412, 5, -653632614, 916150535), (1193524803, -1715972635, -1842407802, -1729677919, -1469611829, -952561873, 6, -1272047067, -1317076873), (1987638997, -803015580, 1432305967, 102920007, 1722201746, 1910790989, 7, 2015646929, -1788812984), (1449384669, 1054431506, 632794109, -103957033, -145909012, 509462488, 8, -1178643278, -1721888167), (1847116061, 490585277, -1517911389, 2106509818, 1266621042, -472370860, 9, -1243743931, -1910405874)


query  rowsort
SELECT sum(distinct `table_1`.`column_1`) AS `alias_1` FROM `table_1`
----
-7307650218

query  rowsort
SELECT sum(`table_1`.`column_2`) AS `alias_1` FROM `table_1`
----
-670261453

query  rowsort
SELECT `table_1`.`column_1` AS `alias_1` FROM `table_1` WHERE (`table_1`.`column_1` > ?)
? = 10
----
2136999838
916150535

query  rowsort
SELECT sum(distinct `table_1`.`column_3`) AS `alias_1`, sum(`table_1`.`column_4`) AS `alias_2` FROM `table_1`
----
4411264039
3143130364

query  rowsort
SELECT sum(distinct `table_1`.`column_5`) AS `alias_1` FROM `table_1` WHERE (`table_1`.`column_2` > ?)
? = 10
----
-949579409

query  rowsort
SELECT sum(`table_1`.`column_6`) AS `alias_1` FROM `table_1` WHERE (`table_1`.`column_6` > ?)
? = 10
----
9715646983

query  rowsort
SELECT sum(distinct `table_1`.`column_7`) AS `alias_1`, sum(`table_1`.`column_8`) AS `alias_2` FROM `table_1` WHERE (`table_1`.`column_6` > ?)
? = 10
----
-2097743324
1789449284

statement ok
DELETE FROM `table_1` WHERE (`column_9` = 0)


statement ok
DELETE FROM `table_1` WHERE (`column_9` = 1)


statement ok
DELETE FROM `table_1` WHERE (`column_9` = 2)


statement ok
DELETE FROM `table_1` WHERE (`column_9` = 3)


statement ok
DELETE FROM `table_1` WHERE (`column_9` = 4)


query  rowsort
SELECT sum(distinct `table_1`.`column_1`) AS `alias_1` FROM `table_1`
----
-5822033363

query  rowsort
SELECT sum(`table_1`.`column_2`) AS `alias_1` FROM `table_1`
----
-2332419961

query  rowsort
SELECT `table_1`.`column_1` AS `alias_1` FROM `table_1` WHERE (`table_1`.`column_1` > ?)
? = 10
----
916150535

query  rowsort
SELECT sum(distinct `table_1`.`column_3`) AS `alias_1`, sum(`table_1`.`column_4`) AS `alias_2` FROM `table_1`
----
-1906921299
806484817

query  rowsort
SELECT sum(distinct `table_1`.`column_5`) AS `alias_1` FROM `table_1` WHERE (`table_1`.`column_2` > ?)
? = 10
----
102920007

query  rowsort
SELECT sum(`table_1`.`column_6`) AS `alias_1` FROM `table_1` WHERE (`table_1`.`column_6` > ?)
? = 10
----
7566720506

query  rowsort
SELECT sum(distinct `table_1`.`column_7`) AS `alias_1`, sum(`table_1`.`column_8`) AS `alias_2` FROM `table_1` WHERE (`table_1`.`column_6` > ?)
? = 10
----
-2095563333
2375360156
