# Generated by:
#     target/debug/noria-logictest permute --compare-to mysql://root:noria@127.1/noria -d 3 -o logictests/generated/mysql/ --only range_param --random --include-deletes --rows-per-table 10 --subquery-depth 1 --overwrite-tests

statement ok
CREATE TABLE `table_1` (`column_4` INT, `column_3` INT, `column_1` INT, `column_2` INT, `column_5` INT, PRIMARY KEY (`column_5`))


statement ok
INSERT INTO `table_1` (`column_4`, `column_3`, `column_1`, `column_2`, `column_5`) VALUES (775604016, 1052824849, 532119910, -1953363362, 0), (-2117334397, 179516428, -2066127660, 190124350, 1), (-662297026, -1632444170, -1756899582, 1272806018, 2), (758235708, -452071139, 486850434, 1948091234, 3), (-1465368043, 17285499, -133976953, -2136244757, 4), (-1165515066, 891306432, 623037527, 134214085, 5), (-760069694, 539627098, -1385626993, 1173645425, 6), (-433004362, -2121360440, 454655861, -2078561187, 7), (-1556025475, 1417229748, 291035258, -2024166741, 8), (1867850895, -559194881, -1290040597, -1690504095, 9)


query  rowsort
SELECT sum(distinct `table_1`.`column_1`) AS `alias_1` FROM `table_1`
----
-4244972795

query  rowsort
SELECT `table_1`.`column_1` AS `alias_1` FROM `table_1` WHERE ((`table_1`.`column_1` > ?) AND (`table_1`.`column_1` > ?))
? = 10
? = 10
----
291035258
454655861
486850434
532119910
623037527

query  rowsort
SELECT `table_1`.`column_1` AS `alias_1` FROM `table_1` WHERE (`table_1`.`column_1` > ?)
? = 10
----
291035258
454655861
486850434
532119910
623037527

query  rowsort
SELECT sum(distinct `table_1`.`column_2`) AS `alias_1` FROM `table_1` WHERE ((`table_1`.`column_1` > ?) AND (`table_1`.`column_1` > ?))
? = 10
? = 10
----
-3973785971

query  rowsort
SELECT sum(distinct `table_1`.`column_3`) AS `alias_1` FROM `table_1` WHERE (`table_1`.`column_1` > ?)
? = 10
----
787929450

query  rowsort
SELECT `table_1`.`column_1` AS `alias_1` FROM `table_1` WHERE (((`table_1`.`column_1` > ?) AND (`table_1`.`column_1` > ?)) AND (`table_1`.`column_1` > ?))
? = 10
? = 10
? = 10
----
291035258
454655861
486850434
532119910
623037527

query  rowsort
SELECT sum(distinct `table_1`.`column_4`) AS `alias_1` FROM `table_1` WHERE (((`table_1`.`column_4` > ?) AND (`table_1`.`column_4` > ?)) AND (`table_1`.`column_4` > ?))
? = 10
? = 10
? = 10
----
3401690619

statement ok
DELETE FROM `table_1` WHERE (`column_5` = 0)


statement ok
DELETE FROM `table_1` WHERE (`column_5` = 1)


statement ok
DELETE FROM `table_1` WHERE (`column_5` = 2)


statement ok
DELETE FROM `table_1` WHERE (`column_5` = 3)


statement ok
DELETE FROM `table_1` WHERE (`column_5` = 4)


query  rowsort
SELECT sum(distinct `table_1`.`column_1`) AS `alias_1` FROM `table_1`
----
-1306938944

query  rowsort
SELECT `table_1`.`column_1` AS `alias_1` FROM `table_1` WHERE ((`table_1`.`column_1` > ?) AND (`table_1`.`column_1` > ?))
? = 10
? = 10
----
291035258
454655861
623037527

query  rowsort
SELECT `table_1`.`column_1` AS `alias_1` FROM `table_1` WHERE (`table_1`.`column_1` > ?)
? = 10
----
291035258
454655861
623037527

query  rowsort
SELECT sum(distinct `table_1`.`column_2`) AS `alias_1` FROM `table_1` WHERE ((`table_1`.`column_1` > ?) AND (`table_1`.`column_1` > ?))
? = 10
? = 10
----
-3968513843

query  rowsort
SELECT sum(distinct `table_1`.`column_3`) AS `alias_1` FROM `table_1` WHERE (`table_1`.`column_1` > ?)
? = 10
----
187175740

query  rowsort
SELECT `table_1`.`column_1` AS `alias_1` FROM `table_1` WHERE (((`table_1`.`column_1` > ?) AND (`table_1`.`column_1` > ?)) AND (`table_1`.`column_1` > ?))
? = 10
? = 10
? = 10
----
291035258
454655861
623037527

query  rowsort
SELECT sum(distinct `table_1`.`column_4`) AS `alias_1` FROM `table_1` WHERE (((`table_1`.`column_4` > ?) AND (`table_1`.`column_4` > ?)) AND (`table_1`.`column_4` > ?))
? = 10
? = 10
? = 10
----
1867850895
