# Generated by:
#     target/debug/noria-logictest permute --compare-to mysql://root:noria@127.1/noria -d 3 -o logictests/generated/mysql/ --only range_param --random --include-deletes --rows-per-table 10 --subquery-depth 1 --overwrite-tests

statement ok
CREATE TABLE `table_1` (`column_3` INT, `column_6` INT, `column_1` INT, `column_9` INT, `column_4` INT, `column_5` INT, `column_2` INT, `column_8` INT, `column_7` INT, PRIMARY KEY (`column_9`))


statement ok
INSERT INTO `table_1` (`column_3`, `column_6`, `column_1`, `column_9`, `column_4`, `column_5`, `column_2`, `column_8`, `column_7`) VALUES (-1557759143, 1438581157, -910200242, 0, 1282428396, -1557824101, 2028625019, 408823575, 828760138), (-872985487, -906308944, -1284145023, 1, 971814548, 351757626, -518955813, 2007213924, -2051404992), (-1971330970, -89721906, 187898550, 2, -1591795832, 1516522307, -1695082639, 1210896428, -1731922364), (-1431502950, -76618468, -1749326570, 3, 2000863079, -2055541164, 88621001, 1582907634, -1877007343), (-1692516373, 594110211, 1168145613, 4, 1225139692, 975673895, -939962900, 435143707, 212110285), (-1345652687, 340391443, -1679489577, 5, 514860354, 499216348, -410318603, 1924660074, 1132973789), (1039983280, 89154224, -328342096, 6, 432651661, 557964819, 1109081649, -262297888, -1273458538), (1980088684, -1814613291, -611809499, 7, 293353061, -31659332, -512965981, -1861328070, 774692823), (-520312137, -1734187791, 326619037, 8, 1639953363, -136305737, -1305551715, -509954492, -1642492371), (-2064802714, 1650060724, -837587960, 9, 1302758311, -463351071, 1453196794, -1033541741, -101757799)


query  rowsort
SELECT sum(distinct `table_1`.`column_1`) AS `alias_1` FROM `table_1`
----
-5718237767

query  rowsort
SELECT count(distinct `table_1`.`column_2`) AS `alias_1` FROM `table_1`
----
10

query  rowsort
SELECT `table_1`.`column_2` AS `alias_1` FROM `table_1` WHERE (`table_1`.`column_2` > ?)
? = 10
----
1109081649
1453196794
2028625019
88621001

query  rowsort
SELECT sum(distinct `table_1`.`column_3`) AS `alias_1`, count(distinct `table_1`.`column_4`) AS `alias_2` FROM `table_1`
----
-8436790497
10

query  rowsort
SELECT sum(distinct `table_1`.`column_5`) AS `alias_1` FROM `table_1` WHERE (`table_1`.`column_3` > ?)
? = 10
----
526305487

query  rowsort
SELECT count(distinct `table_1`.`column_6`) AS `alias_1` FROM `table_1` WHERE (`table_1`.`column_3` > ?)
? = 10
----
2

query  rowsort
SELECT sum(distinct `table_1`.`column_7`) AS `alias_1`, count(distinct `table_1`.`column_8`) AS `alias_2` FROM `table_1` WHERE (`table_1`.`column_3` > ?)
? = 10
----
-498765715
2

statement ok
DELETE FROM `table_1` WHERE (`column_9` = 0)


statement ok
DELETE FROM `table_1` WHERE (`column_9` = 1)


statement ok
DELETE FROM `table_1` WHERE (`column_9` = 2)


statement ok
DELETE FROM `table_1` WHERE (`column_9` = 3)


statement ok
DELETE FROM `table_1` WHERE (`column_9` = 4)


query  rowsort
SELECT sum(distinct `table_1`.`column_1`) AS `alias_1` FROM `table_1`
----
-3130610095

query  rowsort
SELECT count(distinct `table_1`.`column_2`) AS `alias_1` FROM `table_1`
----
5

query  rowsort
SELECT `table_1`.`column_2` AS `alias_1` FROM `table_1` WHERE (`table_1`.`column_2` > ?)
? = 10
----
1109081649
1453196794

query  rowsort
SELECT sum(distinct `table_1`.`column_3`) AS `alias_1`, count(distinct `table_1`.`column_4`) AS `alias_2` FROM `table_1`
----
-910695574
5

query  rowsort
SELECT sum(distinct `table_1`.`column_5`) AS `alias_1` FROM `table_1` WHERE (`table_1`.`column_3` > ?)
? = 10
----
526305487

query  rowsort
SELECT count(distinct `table_1`.`column_6`) AS `alias_1` FROM `table_1` WHERE (`table_1`.`column_3` > ?)
? = 10
----
2

query  rowsort
SELECT sum(distinct `table_1`.`column_7`) AS `alias_1`, count(distinct `table_1`.`column_8`) AS `alias_2` FROM `table_1` WHERE (`table_1`.`column_3` > ?)
? = 10
----
-498765715
2
