# Generated by:
#     target/debug/noria-logictest permute --compare-to mysql://root:noria@127.1/noria -d 3 -o logictests/generated/mysql/ --only range_param --random --include-deletes --rows-per-table 10 --subquery-depth 1

statement ok
CREATE TABLE `table_1` (`column_1` INT, `column_7` INT, `column_3` INT, `column_10` INT, `column_4` INT, `column_6` INT, `column_9` INT, `column_8` INT, `column_2` INT, `column_5` INT, PRIMARY KEY (`column_10`))


statement ok
INSERT INTO `table_1` (`column_1`, `column_7`, `column_3`, `column_10`, `column_4`, `column_6`, `column_9`, `column_8`, `column_2`, `column_5`) VALUES (1167372975, -1036293811, -19398369, 0, -1297305645, 1388389893, 1318295513, -1366347388, 1437963953, -187171254), (1609345552, 466037795, 832809456, 1, -1016074169, 2045886326, -1989003243, 1421852082, 1439113243, 2011229369), (-1143775805, 1027486619, 1881578859, 2, -1178996219, -520881657, 319608603, -570007700, -810377599, 1450563599), (106793643, 889819108, 1148217410, 3, 928506053, 882790262, 151926399, 599636085, -2073960135, 560027092), (-1401324606, 726379627, -264806847, 4, 501306135, 867310071, 1774888636, -1789390288, 1062814296, 13439678), (68507468, 1288994049, -452164633, 5, -128648065, 284967517, -1674160855, 629108097, 9342309, 1275272082), (1113401359, -104367809, -918535557, 6, 2036657828, -77350094, 2053533208, 507116712, -596883270, 87286092), (232356736, -1429627700, -300843025, 7, 1207156335, 218235377, 1422691612, -285783684, -525708194, -1713049430), (767169892, -2017325764, -1685527450, 8, 1107302010, -1222665207, -181072927, -445025586, -1925868520, 104480514), (1968919347, -1204686400, -262641101, 9, -1710688079, 1610410517, 1136875142, -1096930327, -1481973411, -765687515)


query  nosort
SELECT `table_1`.`column_1` AS `alias_1` FROM `table_1` ORDER BY `table_1`.`column_1` ASC LIMIT 10
----
-1401324606
-1143775805
68507468
106793643
232356736
767169892
1113401359
1167372975
1609345552
1968919347

query  nosort
SELECT `table_1`.`column_1` AS `alias_1` FROM `table_1` ORDER BY `table_1`.`column_1` DESC LIMIT 10
----
1968919347
1609345552
1167372975
1113401359
767169892
232356736
106793643
68507468
-1143775805
-1401324606

query  rowsort
SELECT max(`table_1`.`column_2`) AS `alias_1` FROM `table_1`
----
1439113243

query  rowsort
SELECT `table_1`.`column_1` AS `alias_1` FROM `table_1` WHERE (`table_1`.`column_1` > ?)
? = 10
----
106793643
1113401359
1167372975
1609345552
1968919347
232356736
68507468
767169892

query  nosort
SELECT `table_1`.`column_1` AS `alias_1` FROM `table_1` ORDER BY `table_1`.`column_1` DESC LIMIT 10
----
1968919347
1609345552
1167372975
1113401359
767169892
232356736
106793643
68507468
-1143775805
-1401324606

query  nosort
SELECT max(`table_1`.`column_3`) AS `alias_1` FROM `table_1` GROUP BY `table_1`.`column_1` ORDER BY `table_1`.`column_1` ASC LIMIT 10
----
-264806847
1881578859
-452164633
1148217410
-300843025
-1685527450
-918535557
-19398369
832809456
-262641101

query  nosort
SELECT `table_1`.`column_1` AS `alias_1` FROM `table_1` WHERE (`table_1`.`column_1` > ?) ORDER BY `table_1`.`column_1` ASC LIMIT 10
? = 10
----
68507468
106793643
232356736
767169892
1113401359
1167372975
1609345552
1968919347

query  nosort
SELECT max(`table_1`.`column_4`) AS `alias_1` FROM `table_1` GROUP BY `table_1`.`column_1` ORDER BY `table_1`.`column_1` DESC LIMIT 10
----
-1710688079
-1016074169
-1297305645
2036657828
1107302010
1207156335
928506053
-128648065
-1178996219
501306135

query  nosort
SELECT `table_1`.`column_1` AS `alias_1` FROM `table_1` WHERE (`table_1`.`column_1` > ?) ORDER BY `table_1`.`column_1` DESC LIMIT 10
? = 10
----
1968919347
1609345552
1167372975
1113401359
767169892
232356736
106793643
68507468

query  rowsort
SELECT max(`table_1`.`column_5`) AS `alias_1` FROM `table_1` WHERE (`table_1`.`column_1` > ?)
? = 10
----
2011229369

query  nosort
SELECT max(`table_1`.`column_6`) AS `alias_1` FROM `table_1` GROUP BY `table_1`.`column_1` ORDER BY `table_1`.`column_1` DESC LIMIT 10
----
1610410517
2045886326
1388389893
-77350094
-1222665207
218235377
882790262
284967517
-520881657
867310071

query  nosort
SELECT `table_1`.`column_1` AS `alias_1` FROM `table_1` WHERE (`table_1`.`column_1` > ?) ORDER BY `table_1`.`column_1` DESC LIMIT 10
? = 10
----
1968919347
1609345552
1167372975
1113401359
767169892
232356736
106793643
68507468

query  nosort
SELECT max(`table_1`.`column_7`) AS `alias_1` FROM `table_1` WHERE (`table_1`.`column_1` > ?) GROUP BY `table_1`.`column_1` ORDER BY `table_1`.`column_1` ASC LIMIT 10
? = 10
----
1288994049
889819108
-1429627700
-2017325764
-104367809
-1036293811
466037795
-1204686400

query  nosort
SELECT max(`table_1`.`column_8`) AS `alias_1` FROM `table_1` WHERE (`table_1`.`column_1` > ?) GROUP BY `table_1`.`column_1` ORDER BY `table_1`.`column_1` DESC LIMIT 10
? = 10
----
-1096930327
1421852082
-1366347388
507116712
-445025586
-285783684
599636085
629108097

query  nosort
SELECT max(`table_1`.`column_9`) AS `alias_1` FROM `table_1` WHERE (`table_1`.`column_1` > ?) GROUP BY `table_1`.`column_1` ORDER BY `table_1`.`column_1` DESC LIMIT 10
? = 10
----
1136875142
-1989003243
1318295513
2053533208
-181072927
1422691612
151926399
-1674160855

statement ok
DELETE FROM `table_1` WHERE (`column_10` = 0)


statement ok
DELETE FROM `table_1` WHERE (`column_10` = 1)


statement ok
DELETE FROM `table_1` WHERE (`column_10` = 2)


statement ok
DELETE FROM `table_1` WHERE (`column_10` = 3)


statement ok
DELETE FROM `table_1` WHERE (`column_10` = 4)


query  nosort
SELECT `table_1`.`column_1` AS `alias_1` FROM `table_1` ORDER BY `table_1`.`column_1` ASC LIMIT 10
----
68507468
232356736
767169892
1113401359
1968919347

query  nosort
SELECT `table_1`.`column_1` AS `alias_1` FROM `table_1` ORDER BY `table_1`.`column_1` DESC LIMIT 10
----
1968919347
1113401359
767169892
232356736
68507468

query  rowsort
SELECT max(`table_1`.`column_2`) AS `alias_1` FROM `table_1`
----
9342309

query  rowsort
SELECT `table_1`.`column_1` AS `alias_1` FROM `table_1` WHERE (`table_1`.`column_1` > ?)
? = 10
----
1113401359
1968919347
232356736
68507468
767169892

query  nosort
SELECT `table_1`.`column_1` AS `alias_1` FROM `table_1` ORDER BY `table_1`.`column_1` DESC LIMIT 10
----
1968919347
1113401359
767169892
232356736
68507468

query  nosort
SELECT max(`table_1`.`column_3`) AS `alias_1` FROM `table_1` GROUP BY `table_1`.`column_1` ORDER BY `table_1`.`column_1` ASC LIMIT 10
----
-452164633
-300843025
-1685527450
-918535557
-262641101

query  nosort
SELECT `table_1`.`column_1` AS `alias_1` FROM `table_1` WHERE (`table_1`.`column_1` > ?) ORDER BY `table_1`.`column_1` ASC LIMIT 10
? = 10
----
68507468
232356736
767169892
1113401359
1968919347

query  nosort
SELECT max(`table_1`.`column_4`) AS `alias_1` FROM `table_1` GROUP BY `table_1`.`column_1` ORDER BY `table_1`.`column_1` DESC LIMIT 10
----
-1710688079
2036657828
1107302010
1207156335
-128648065

query  nosort
SELECT `table_1`.`column_1` AS `alias_1` FROM `table_1` WHERE (`table_1`.`column_1` > ?) ORDER BY `table_1`.`column_1` DESC LIMIT 10
? = 10
----
1968919347
1113401359
767169892
232356736
68507468

query  rowsort
SELECT max(`table_1`.`column_5`) AS `alias_1` FROM `table_1` WHERE (`table_1`.`column_1` > ?)
? = 10
----
1275272082

query  nosort
SELECT max(`table_1`.`column_6`) AS `alias_1` FROM `table_1` GROUP BY `table_1`.`column_1` ORDER BY `table_1`.`column_1` DESC LIMIT 10
----
1610410517
-77350094
-1222665207
218235377
284967517

query  nosort
SELECT `table_1`.`column_1` AS `alias_1` FROM `table_1` WHERE (`table_1`.`column_1` > ?) ORDER BY `table_1`.`column_1` DESC LIMIT 10
? = 10
----
1968919347
1113401359
767169892
232356736
68507468

query  nosort
SELECT max(`table_1`.`column_7`) AS `alias_1` FROM `table_1` WHERE (`table_1`.`column_1` > ?) GROUP BY `table_1`.`column_1` ORDER BY `table_1`.`column_1` ASC LIMIT 10
? = 10
----
1288994049
-1429627700
-2017325764
-104367809
-1204686400

query  nosort
SELECT max(`table_1`.`column_8`) AS `alias_1` FROM `table_1` WHERE (`table_1`.`column_1` > ?) GROUP BY `table_1`.`column_1` ORDER BY `table_1`.`column_1` DESC LIMIT 10
? = 10
----
-1096930327
507116712
-445025586
-285783684
629108097

query  nosort
SELECT max(`table_1`.`column_9`) AS `alias_1` FROM `table_1` WHERE (`table_1`.`column_1` > ?) GROUP BY `table_1`.`column_1` ORDER BY `table_1`.`column_1` DESC LIMIT 10
? = 10
----
1136875142
2053533208
-181072927
1422691612
-1674160855
