# Generated by:
#     target/debug/noria-logictest permute --compare-to mysql://root:noria@127.1/noria -d 3 -o logictests/generated/mysql/ --only range_param --random --include-deletes --rows-per-table 10 --subquery-depth 1

statement ok
CREATE TABLE `table_1` (`column_1` INT, `column_2` INT, PRIMARY KEY (`column_2`))


statement ok
INSERT INTO `table_1` (`column_1`, `column_2`) VALUES (1890450310, 0), (1640045980, 1), (-1254298733, 2), (-2028154857, 3), (-1454028092, 4), (1464156028, 5), (-214059183, 6), (-1077088010, 7), (367467369, 8), (799481636, 9)


query  nosort
SELECT `table_1`.`column_1` AS `alias_1` FROM `table_1` ORDER BY `table_1`.`column_1` ASC LIMIT 10
----
-2028154857
-1454028092
-1254298733
-1077088010
-214059183
367467369
799481636
1464156028
1640045980
1890450310

query  nosort
SELECT `table_1`.`column_1` AS `alias_1` FROM `table_1` ORDER BY `table_1`.`column_1` DESC LIMIT 10
----
1890450310
1640045980
1464156028
799481636
367467369
-214059183
-1077088010
-1254298733
-1454028092
-2028154857

query  rowsort
SELECT `table_1`.`column_1` AS `alias_1` FROM `table_1` WHERE (`table_1`.`column_1` > ?)
? = 10
----
1464156028
1640045980
1890450310
367467369
799481636

query  rowsort
SELECT `table_1`.`column_1` AS `alias_1` FROM `table_1` WHERE (`table_1`.`column_1` > ?)
? = 10
----
1464156028
1640045980
1890450310
367467369
799481636

query  nosort
SELECT `table_1`.`column_1` AS `alias_1` FROM `table_1` ORDER BY `table_1`.`column_1` DESC LIMIT 10
----
1890450310
1640045980
1464156028
799481636
367467369
-214059183
-1077088010
-1254298733
-1454028092
-2028154857

query  nosort
SELECT `table_1`.`column_1` AS `alias_1` FROM `table_1` WHERE (`table_1`.`column_1` > ?) ORDER BY `table_1`.`column_1` ASC LIMIT 10
? = 10
----
367467369
799481636
1464156028
1640045980
1890450310

query  nosort
SELECT `table_1`.`column_1` AS `alias_1` FROM `table_1` WHERE (`table_1`.`column_1` > ?) ORDER BY `table_1`.`column_1` ASC LIMIT 10
? = 10
----
367467369
799481636
1464156028
1640045980
1890450310

query  nosort
SELECT `table_1`.`column_1` AS `alias_1` FROM `table_1` WHERE (`table_1`.`column_1` > ?) ORDER BY `table_1`.`column_1` DESC LIMIT 10
? = 10
----
1890450310
1640045980
1464156028
799481636
367467369

query  nosort
SELECT `table_1`.`column_1` AS `alias_1` FROM `table_1` WHERE (`table_1`.`column_1` > ?) ORDER BY `table_1`.`column_1` DESC LIMIT 10
? = 10
----
1890450310
1640045980
1464156028
799481636
367467369

query  rowsort
SELECT `table_1`.`column_1` AS `alias_1` FROM `table_1` WHERE ((`table_1`.`column_1` > ?) AND (`table_1`.`column_1` > ?))
? = 10
? = 10
----
1464156028
1640045980
1890450310
367467369
799481636

query  nosort
SELECT `table_1`.`column_1` AS `alias_1` FROM `table_1` WHERE (`table_1`.`column_1` > ?) ORDER BY `table_1`.`column_1` DESC LIMIT 10
? = 10
----
1890450310
1640045980
1464156028
799481636
367467369

query  nosort
SELECT `table_1`.`column_1` AS `alias_1` FROM `table_1` WHERE (`table_1`.`column_1` > ?) ORDER BY `table_1`.`column_1` DESC LIMIT 10
? = 10
----
1890450310
1640045980
1464156028
799481636
367467369

query  nosort
SELECT `table_1`.`column_1` AS `alias_1` FROM `table_1` WHERE ((`table_1`.`column_1` > ?) AND (`table_1`.`column_1` > ?)) ORDER BY `table_1`.`column_1` ASC LIMIT 10
? = 10
? = 10
----
367467369
799481636
1464156028
1640045980
1890450310

query  nosort
SELECT `table_1`.`column_1` AS `alias_1` FROM `table_1` WHERE ((`table_1`.`column_1` > ?) AND (`table_1`.`column_1` > ?)) ORDER BY `table_1`.`column_1` DESC LIMIT 10
? = 10
? = 10
----
1890450310
1640045980
1464156028
799481636
367467369

query  nosort
SELECT `table_1`.`column_1` AS `alias_1` FROM `table_1` WHERE ((`table_1`.`column_1` > ?) AND (`table_1`.`column_1` > ?)) ORDER BY `table_1`.`column_1` DESC LIMIT 10
? = 10
? = 10
----
1890450310
1640045980
1464156028
799481636
367467369

statement ok
DELETE FROM `table_1` WHERE (`column_2` = 0)


statement ok
DELETE FROM `table_1` WHERE (`column_2` = 1)


statement ok
DELETE FROM `table_1` WHERE (`column_2` = 2)


statement ok
DELETE FROM `table_1` WHERE (`column_2` = 3)


statement ok
DELETE FROM `table_1` WHERE (`column_2` = 4)


query  nosort
SELECT `table_1`.`column_1` AS `alias_1` FROM `table_1` ORDER BY `table_1`.`column_1` ASC LIMIT 10
----
-1077088010
-214059183
367467369
799481636
1464156028

query  nosort
SELECT `table_1`.`column_1` AS `alias_1` FROM `table_1` ORDER BY `table_1`.`column_1` DESC LIMIT 10
----
1464156028
799481636
367467369
-214059183
-1077088010

query  rowsort
SELECT `table_1`.`column_1` AS `alias_1` FROM `table_1` WHERE (`table_1`.`column_1` > ?)
? = 10
----
1464156028
367467369
799481636

query  rowsort
SELECT `table_1`.`column_1` AS `alias_1` FROM `table_1` WHERE (`table_1`.`column_1` > ?)
? = 10
----
1464156028
367467369
799481636

query  nosort
SELECT `table_1`.`column_1` AS `alias_1` FROM `table_1` ORDER BY `table_1`.`column_1` DESC LIMIT 10
----
1464156028
799481636
367467369
-214059183
-1077088010

query  nosort
SELECT `table_1`.`column_1` AS `alias_1` FROM `table_1` WHERE (`table_1`.`column_1` > ?) ORDER BY `table_1`.`column_1` ASC LIMIT 10
? = 10
----
367467369
799481636
1464156028

query  nosort
SELECT `table_1`.`column_1` AS `alias_1` FROM `table_1` WHERE (`table_1`.`column_1` > ?) ORDER BY `table_1`.`column_1` ASC LIMIT 10
? = 10
----
367467369
799481636
1464156028

query  nosort
SELECT `table_1`.`column_1` AS `alias_1` FROM `table_1` WHERE (`table_1`.`column_1` > ?) ORDER BY `table_1`.`column_1` DESC LIMIT 10
? = 10
----
1464156028
799481636
367467369

query  nosort
SELECT `table_1`.`column_1` AS `alias_1` FROM `table_1` WHERE (`table_1`.`column_1` > ?) ORDER BY `table_1`.`column_1` DESC LIMIT 10
? = 10
----
1464156028
799481636
367467369

query  rowsort
SELECT `table_1`.`column_1` AS `alias_1` FROM `table_1` WHERE ((`table_1`.`column_1` > ?) AND (`table_1`.`column_1` > ?))
? = 10
? = 10
----
1464156028
367467369
799481636

query  nosort
SELECT `table_1`.`column_1` AS `alias_1` FROM `table_1` WHERE (`table_1`.`column_1` > ?) ORDER BY `table_1`.`column_1` DESC LIMIT 10
? = 10
----
1464156028
799481636
367467369

query  nosort
SELECT `table_1`.`column_1` AS `alias_1` FROM `table_1` WHERE (`table_1`.`column_1` > ?) ORDER BY `table_1`.`column_1` DESC LIMIT 10
? = 10
----
1464156028
799481636
367467369

query  nosort
SELECT `table_1`.`column_1` AS `alias_1` FROM `table_1` WHERE ((`table_1`.`column_1` > ?) AND (`table_1`.`column_1` > ?)) ORDER BY `table_1`.`column_1` ASC LIMIT 10
? = 10
? = 10
----
367467369
799481636
1464156028

query  nosort
SELECT `table_1`.`column_1` AS `alias_1` FROM `table_1` WHERE ((`table_1`.`column_1` > ?) AND (`table_1`.`column_1` > ?)) ORDER BY `table_1`.`column_1` DESC LIMIT 10
? = 10
? = 10
----
1464156028
799481636
367467369

query  nosort
SELECT `table_1`.`column_1` AS `alias_1` FROM `table_1` WHERE ((`table_1`.`column_1` > ?) AND (`table_1`.`column_1` > ?)) ORDER BY `table_1`.`column_1` DESC LIMIT 10
? = 10
? = 10
----
1464156028
799481636
367467369
