# Generated by:
#     target/debug/noria-logictest permute --compare-to mysql://root:noria@127.1/noria -d 3 -o logictests/generated/mysql/ --only range_param --random --include-deletes --rows-per-table 10 --subquery-depth 1

statement ok
CREATE TABLE `table_1` (`column_5` INT, `column_4` INT, `column_1` INT, `column_2` INT, `column_3` INT, PRIMARY KEY (`column_5`))


statement ok
CREATE TABLE `table_5` (`column_3` INT, `column_2` INT, `column_1` INT, PRIMARY KEY (`column_3`))


statement ok
CREATE TABLE `table_4` (`column_1` INT, `column_2` INT, `column_3` INT, PRIMARY KEY (`column_3`))


statement ok
CREATE TABLE `table_8` (`column_3` INT, `column_2` INT, `column_1` INT, PRIMARY KEY (`column_3`))


statement ok
CREATE TABLE `table_6` (`column_2` INT, `column_3` INT, `column_1` INT, PRIMARY KEY (`column_3`))


statement ok
CREATE TABLE `table_3` (`column_3` INT, `column_4` INT, `column_1` INT, `column_2` INT, PRIMARY KEY (`column_4`))


statement ok
CREATE TABLE `table_9` (`column_2` INT, `column_1` INT, `column_3` INT, PRIMARY KEY (`column_3`))


statement ok
CREATE TABLE `table_7` (`column_1` INT, `column_2` INT, `column_3` INT, PRIMARY KEY (`column_3`))


statement ok
CREATE TABLE `table_2` (`column_1` INT, `column_5` INT, `column_4` INT, `column_3` INT, `column_6` INT, `column_7` INT, `column_2` INT, PRIMARY KEY (`column_7`))


statement ok
INSERT INTO `table_1` (`column_5`, `column_4`, `column_1`, `column_2`, `column_3`) VALUES (0, -1429808219, 283316700, -624419209, 1327589012), (1, -1455458623, 919096043, 1805507286, -92061300), (2, 1823126513, -437144637, 148831382, -581876065), (3, -1394550866, 1804521002, 1170085151, 1366641992), (4, 1113589381, 1133339309, -1974806344, -226267207), (5, -1123469921, -1494625996, 295113429, 1811917551), (6, 1439131867, -1449081033, -1435845763, -923794339), (7, -1223058720, 687585023, 1211712817, 1911673598), (8, -1853212204, 554286210, 122363319, 1437636177), (9, 188351254, 433857441, -1537002331, 1762998015)


statement ok
INSERT INTO `table_5` (`column_3`, `column_2`, `column_1`) VALUES (0, -1956507911, 1163333375), (1, -1520978651, -1207355257), (2, 1406891881, -678393571), (3, -1172392747, -2015353396), (4, 1374964642, 1517642218), (5, 1460209006, 920057716), (6, 715109637, 520904002), (7, 653618776, -1800391628), (8, -555086531, -1677428029), (9, -1950461612, 301679996)


statement ok
INSERT INTO `table_4` (`column_1`, `column_2`, `column_3`) VALUES (-1868123902, 1984206967, 0), (490309387, -1933707109, 1), (1032889508, -226924084, 2), (-1759917082, 978301378, 3), (-367957760, -470847816, 4), (-997511108, 491344693, 5), (-1301230052, -1652570840, 6), (-857414258, -273246579, 7), (1688010869, -1907969355, 8), (-1389155148, -818962437, 9)


statement ok
INSERT INTO `table_8` (`column_3`, `column_2`, `column_1`) VALUES (0, 107538677, 308224629), (1, -1897898074, -1319740669), (2, -1868487904, 1250909352), (3, 262492964, -1525654395), (4, -375620811, 379311242), (5, -193239148, 355720475), (6, 304510540, -735250202), (7, 1460408458, -1270140525), (8, 1582552405, 1772639128), (9, -1824471377, 64135676)


statement ok
INSERT INTO `table_6` (`column_2`, `column_3`, `column_1`) VALUES (-243124570, 0, -1344379363), (1563071819, 1, 2025838804), (25972843, 2, -1087252439), (-537444347, 3, -508596235), (1628919209, 4, -745434991), (-90177316, 5, -1152631158), (119692196, 6, -580155019), (814721327, 7, 1376574264), (-988051772, 8, -803574934), (2101432033, 9, 1271347835)


statement ok
INSERT INTO `table_3` (`column_3`, `column_4`, `column_1`, `column_2`) VALUES (186503310, 0, 752214381, -336913851), (-1587896057, 1, 1375698661, 1882210029), (1997075843, 2, 1072967345, -216998197), (-1067440669, 3, 2061475423, 1336102855), (485069285, 4, -44536881, 1395508957), (-1115418721, 5, -139450833, 1760161976), (698095846, 6, -1115270488, 596512058), (1142320473, 7, -1606761565, 446439711), (-1412884705, 8, -1923057548, 1257331950), (-1110584708, 9, 875290288, -1829448951)


statement ok
INSERT INTO `table_9` (`column_2`, `column_1`, `column_3`) VALUES (217918886, 399875552, 0), (1550777833, 1118465869, 1), (1837874352, 2060968844, 2), (-691286196, -2112406758, 3), (-579271391, -1069533107, 4), (1143454012, -491572838, 5), (971821573, 2131386666, 6), (-324353151, -772632470, 7), (911621477, -440533317, 8), (-755440186, 1333002694, 9)


statement ok
INSERT INTO `table_7` (`column_1`, `column_2`, `column_3`) VALUES (139577545, -632573001, 0), (-710211629, 756114057, 1), (-155505273, 1003981373, 2), (-169885285, -2039238444, 3), (-525654914, 1746517445, 4), (-565721034, 1557935132, 5), (128524979, -1760795226, 6), (-235971035, 500626670, 7), (1439765087, 977224561, 8), (-1366329522, 216825591, 9)


statement ok
INSERT INTO `table_2` (`column_1`, `column_5`, `column_4`, `column_3`, `column_6`, `column_7`, `column_2`) VALUES (92842773, 1628416599, 122202366, 1005959596, -955115839, 0, -1700443140), (1539308882, 1100440553, -1214391421, -979299946, 868032706, 1, 1556525289), (621877485, 1660388297, 341562447, 713509722, 349703435, 2, 1330910262), (-1017811587, 1590237362, -956452840, 1077257673, -1273053187, 3, 1089119964), (902547087, -1745444467, -1026284050, 1183566868, -2049900955, 4, -757754142), (-1835031769, 716399196, -2058271656, -926210918, -196021778, 5, 987911159), (-1881494871, 889419067, -289602995, -2109717396, 62915235, 6, 414104103), (-1244483345, -1872303783, 1671462280, -565466672, 1137424025, 7, -1887627323), (989629400, 1072023621, -914277230, 1647755490, 1608918003, 8, 283423420), (780701299, -771739953, -61671753, 1243993640, 1669794215, 9, -727774339)


query  nosort
SELECT `table_1`.`column_1` AS `alias_1` FROM `table_1` ORDER BY `table_1`.`column_1` ASC LIMIT 10
----
-1494625996
-1449081033
-437144637
283316700
433857441
554286210
687585023
919096043
1133339309
1804521002

query  nosort
SELECT `table_1`.`column_1` AS `alias_1` FROM `table_1` ORDER BY `table_1`.`column_1` DESC LIMIT 10
----
1804521002
1133339309
919096043
687585023
554286210
433857441
283316700
-437144637
-1449081033
-1494625996

query  rowsort
SELECT `table_1`.`column_2` AS `alias_1`, `table_2`.`column_2` AS `alias_2` FROM `table_1` INNER JOIN `table_2` ON (`table_1`.`column_1` = `table_2`.`column_1`)
----


query  rowsort
SELECT `table_1`.`column_1` AS `alias_1` FROM `table_1` WHERE (`table_1`.`column_1` > ?)
? = 10
----
1133339309
1804521002
283316700
433857441
554286210
687585023
919096043

query  nosort
SELECT `table_1`.`column_1` AS `alias_1` FROM `table_1` ORDER BY `table_1`.`column_1` DESC LIMIT 10
----
1804521002
1133339309
919096043
687585023
554286210
433857441
283316700
-437144637
-1449081033
-1494625996

query  nosort
SELECT `table_1`.`column_3` AS `alias_1`, `table_3`.`column_2` AS `alias_2` FROM `table_1` INNER JOIN `table_3` ON (`table_1`.`column_1` = `table_3`.`column_1`) ORDER BY `table_1`.`column_1` ASC LIMIT 10
----


query  nosort
SELECT `table_3`.`column_1` AS `alias_1` FROM `table_3` WHERE (`table_3`.`column_1` > ?) ORDER BY `table_3`.`column_1` ASC LIMIT 10
? = 10
----
752214381
875290288
1072967345
1375698661
2061475423

query  nosort
SELECT `table_3`.`column_3` AS `alias_1`, `table_4`.`column_2` AS `alias_2` FROM `table_3` INNER JOIN `table_4` ON (`table_3`.`column_1` = `table_4`.`column_1`) ORDER BY `table_3`.`column_1` DESC LIMIT 10
----


query  nosort
SELECT `table_2`.`column_2` AS `alias_1` FROM `table_2` WHERE (`table_2`.`column_2` > ?) ORDER BY `table_2`.`column_2` DESC LIMIT 10
? = 10
----
1556525289
1330910262
1089119964
987911159
414104103
283423420

query  rowsort
SELECT `table_2`.`column_3` AS `alias_1`, `table_5`.`column_2` AS `alias_2` FROM `table_2` INNER JOIN `table_5` ON (`table_2`.`column_2` = `table_5`.`column_1`) WHERE (`table_2`.`column_2` > ?)
? = 10
----


query  nosort
SELECT `table_2`.`column_4` AS `alias_1`, `table_6`.`column_2` AS `alias_2` FROM `table_2` INNER JOIN `table_6` ON (`table_2`.`column_2` = `table_6`.`column_1`) ORDER BY `table_2`.`column_2` DESC LIMIT 10
----


query  nosort
SELECT `table_2`.`column_1` AS `alias_1` FROM `table_2` WHERE (`table_2`.`column_1` > ?) ORDER BY `table_2`.`column_1` DESC LIMIT 10
? = 10
----
1539308882
989629400
902547087
780701299
621877485
92842773

query  nosort
SELECT `table_2`.`column_5` AS `alias_1`, `table_7`.`column_2` AS `alias_2` FROM `table_2` INNER JOIN `table_7` ON (`table_2`.`column_1` = `table_7`.`column_1`) WHERE (`table_2`.`column_1` > ?) ORDER BY `table_2`.`column_1` ASC LIMIT 10
? = 10
----


query  nosort
SELECT `table_2`.`column_6` AS `alias_1`, `table_8`.`column_2` AS `alias_2` FROM `table_2` INNER JOIN `table_8` ON (`table_2`.`column_1` = `table_8`.`column_1`) WHERE (`table_2`.`column_1` > ?) ORDER BY `table_2`.`column_1` DESC LIMIT 10
? = 10
----


query  nosort
SELECT `table_1`.`column_4` AS `alias_1`, `table_9`.`column_2` AS `alias_2` FROM `table_1` INNER JOIN `table_9` ON (`table_1`.`column_1` = `table_9`.`column_1`) WHERE (`table_1`.`column_4` > ?) ORDER BY `table_1`.`column_1` DESC LIMIT 10
? = 10
----


statement ok
DELETE FROM `table_1` WHERE (`column_5` = 0)


statement ok
DELETE FROM `table_1` WHERE (`column_5` = 1)


statement ok
DELETE FROM `table_1` WHERE (`column_5` = 2)


statement ok
DELETE FROM `table_1` WHERE (`column_5` = 3)


statement ok
DELETE FROM `table_1` WHERE (`column_5` = 4)


statement ok
DELETE FROM `table_5` WHERE (`column_3` = 0)


statement ok
DELETE FROM `table_5` WHERE (`column_3` = 1)


statement ok
DELETE FROM `table_5` WHERE (`column_3` = 2)


statement ok
DELETE FROM `table_5` WHERE (`column_3` = 3)


statement ok
DELETE FROM `table_5` WHERE (`column_3` = 4)


statement ok
DELETE FROM `table_4` WHERE (`column_3` = 0)


statement ok
DELETE FROM `table_4` WHERE (`column_3` = 1)


statement ok
DELETE FROM `table_4` WHERE (`column_3` = 2)


statement ok
DELETE FROM `table_4` WHERE (`column_3` = 3)


statement ok
DELETE FROM `table_4` WHERE (`column_3` = 4)


statement ok
DELETE FROM `table_8` WHERE (`column_3` = 0)


statement ok
DELETE FROM `table_8` WHERE (`column_3` = 1)


statement ok
DELETE FROM `table_8` WHERE (`column_3` = 2)


statement ok
DELETE FROM `table_8` WHERE (`column_3` = 3)


statement ok
DELETE FROM `table_8` WHERE (`column_3` = 4)


statement ok
DELETE FROM `table_6` WHERE (`column_3` = 0)


statement ok
DELETE FROM `table_6` WHERE (`column_3` = 1)


statement ok
DELETE FROM `table_6` WHERE (`column_3` = 2)


statement ok
DELETE FROM `table_6` WHERE (`column_3` = 3)


statement ok
DELETE FROM `table_6` WHERE (`column_3` = 4)


statement ok
DELETE FROM `table_3` WHERE (`column_4` = 0)


statement ok
DELETE FROM `table_3` WHERE (`column_4` = 1)


statement ok
DELETE FROM `table_3` WHERE (`column_4` = 2)


statement ok
DELETE FROM `table_3` WHERE (`column_4` = 3)


statement ok
DELETE FROM `table_3` WHERE (`column_4` = 4)


statement ok
DELETE FROM `table_9` WHERE (`column_3` = 0)


statement ok
DELETE FROM `table_9` WHERE (`column_3` = 1)


statement ok
DELETE FROM `table_9` WHERE (`column_3` = 2)


statement ok
DELETE FROM `table_9` WHERE (`column_3` = 3)


statement ok
DELETE FROM `table_9` WHERE (`column_3` = 4)


statement ok
DELETE FROM `table_7` WHERE (`column_3` = 0)


statement ok
DELETE FROM `table_7` WHERE (`column_3` = 1)


statement ok
DELETE FROM `table_7` WHERE (`column_3` = 2)


statement ok
DELETE FROM `table_7` WHERE (`column_3` = 3)


statement ok
DELETE FROM `table_7` WHERE (`column_3` = 4)


statement ok
DELETE FROM `table_2` WHERE (`column_7` = 0)


statement ok
DELETE FROM `table_2` WHERE (`column_7` = 1)


statement ok
DELETE FROM `table_2` WHERE (`column_7` = 2)


statement ok
DELETE FROM `table_2` WHERE (`column_7` = 3)


statement ok
DELETE FROM `table_2` WHERE (`column_7` = 4)


query  nosort
SELECT `table_1`.`column_1` AS `alias_1` FROM `table_1` ORDER BY `table_1`.`column_1` ASC LIMIT 10
----
-1494625996
-1449081033
433857441
554286210
687585023

query  nosort
SELECT `table_1`.`column_1` AS `alias_1` FROM `table_1` ORDER BY `table_1`.`column_1` DESC LIMIT 10
----
687585023
554286210
433857441
-1449081033
-1494625996

query  rowsort
SELECT `table_1`.`column_2` AS `alias_1`, `table_2`.`column_2` AS `alias_2` FROM `table_1` INNER JOIN `table_2` ON (`table_1`.`column_1` = `table_2`.`column_1`)
----


query  rowsort
SELECT `table_1`.`column_1` AS `alias_1` FROM `table_1` WHERE (`table_1`.`column_1` > ?)
? = 10
----
433857441
554286210
687585023

query  nosort
SELECT `table_1`.`column_1` AS `alias_1` FROM `table_1` ORDER BY `table_1`.`column_1` DESC LIMIT 10
----
687585023
554286210
433857441
-1449081033
-1494625996

query  nosort
SELECT `table_1`.`column_3` AS `alias_1`, `table_3`.`column_2` AS `alias_2` FROM `table_1` INNER JOIN `table_3` ON (`table_1`.`column_1` = `table_3`.`column_1`) ORDER BY `table_1`.`column_1` ASC LIMIT 10
----


query  nosort
SELECT `table_3`.`column_1` AS `alias_1` FROM `table_3` WHERE (`table_3`.`column_1` > ?) ORDER BY `table_3`.`column_1` ASC LIMIT 10
? = 10
----
875290288

query  nosort
SELECT `table_3`.`column_3` AS `alias_1`, `table_4`.`column_2` AS `alias_2` FROM `table_3` INNER JOIN `table_4` ON (`table_3`.`column_1` = `table_4`.`column_1`) ORDER BY `table_3`.`column_1` DESC LIMIT 10
----


query  nosort
SELECT `table_2`.`column_2` AS `alias_1` FROM `table_2` WHERE (`table_2`.`column_2` > ?) ORDER BY `table_2`.`column_2` DESC LIMIT 10
? = 10
----
987911159
414104103
283423420

query  rowsort
SELECT `table_2`.`column_3` AS `alias_1`, `table_5`.`column_2` AS `alias_2` FROM `table_2` INNER JOIN `table_5` ON (`table_2`.`column_2` = `table_5`.`column_1`) WHERE (`table_2`.`column_2` > ?)
? = 10
----


query  nosort
SELECT `table_2`.`column_4` AS `alias_1`, `table_6`.`column_2` AS `alias_2` FROM `table_2` INNER JOIN `table_6` ON (`table_2`.`column_2` = `table_6`.`column_1`) ORDER BY `table_2`.`column_2` DESC LIMIT 10
----


query  nosort
SELECT `table_2`.`column_1` AS `alias_1` FROM `table_2` WHERE (`table_2`.`column_1` > ?) ORDER BY `table_2`.`column_1` DESC LIMIT 10
? = 10
----
989629400
780701299

query  nosort
SELECT `table_2`.`column_5` AS `alias_1`, `table_7`.`column_2` AS `alias_2` FROM `table_2` INNER JOIN `table_7` ON (`table_2`.`column_1` = `table_7`.`column_1`) WHERE (`table_2`.`column_1` > ?) ORDER BY `table_2`.`column_1` ASC LIMIT 10
? = 10
----


query  nosort
SELECT `table_2`.`column_6` AS `alias_1`, `table_8`.`column_2` AS `alias_2` FROM `table_2` INNER JOIN `table_8` ON (`table_2`.`column_1` = `table_8`.`column_1`) WHERE (`table_2`.`column_1` > ?) ORDER BY `table_2`.`column_1` DESC LIMIT 10
? = 10
----


query  nosort
SELECT `table_1`.`column_4` AS `alias_1`, `table_9`.`column_2` AS `alias_2` FROM `table_1` INNER JOIN `table_9` ON (`table_1`.`column_1` = `table_9`.`column_1`) WHERE (`table_1`.`column_4` > ?) ORDER BY `table_1`.`column_1` DESC LIMIT 10
? = 10
----

