# Generated by:
#     target/debug/noria-logictest permute --compare-to mysql://root:noria@127.1/noria -d 3 -o logictests/generated/mysql/ --only range_param --random --include-deletes --rows-per-table 10 --subquery-depth 1

statement ok
CREATE TABLE `table_1` (`column_7` INT, `column_4` INT, `column_6` INT, `column_3` INT, `column_2` INT, `column_10` INT, `column_8` INT, `column_9` INT, `column_5` INT, `column_1` INT, PRIMARY KEY (`column_10`))


statement ok
INSERT INTO `table_1` (`column_7`, `column_4`, `column_6`, `column_3`, `column_2`, `column_10`, `column_8`, `column_9`, `column_5`, `column_1`) VALUES (1056785149, 1809193383, -1995948790, 508681527, -1819122774, 0, -1898859990, 946842388, 1384880438, 1609870538), (-1707587973, -1997353901, -2078313525, -1731540294, 270853319, 1, 1059935649, 1073936523, 1346943331, -2050375185), (107997190, -918256233, 2015389252, 1479876245, 1460732880, 2, 321281807, -1896327892, 1232145430, -2119770943), (-219987170, -414982202, 415930822, 1592271927, -896533993, 3, -1312769340, 451836565, -438083218, 46141310), (-1160464190, 1439380550, -845357034, -1487117660, 159612820, 4, 1888057535, -537972345, 1513323291, -1111307477), (-458461928, -652910847, -51199682, -1078954977, -1291895943, 5, 1947637749, 178087285, 203150075, 871205616), (1987158673, -1343699390, -678299175, -555685046, -1596710187, 6, 2129947681, -180436221, -1309057123, -526893425), (208130167, -1572410548, 1616878422, -1215388343, 281416401, 7, -1191599251, -985615640, 1789827338, -244808054), (-1945308483, -1540086691, 663012576, -777585239, 1681048210, 8, -108140617, -1584110109, -214888818, 723295301), (-1718521173, -1571688025, 798385406, -2099351146, -830413864, 9, 1453536894, -1426944541, 707991049, -1254014607)


query  nosort
SELECT `table_1`.`column_1` AS `alias_1` FROM `table_1` ORDER BY `table_1`.`column_1` ASC LIMIT 10
----
-2119770943
-2050375185
-1254014607
-1111307477
-526893425
-244808054
46141310
723295301
871205616
1609870538

query  nosort
SELECT `table_1`.`column_1` AS `alias_1` FROM `table_1` ORDER BY `table_1`.`column_1` DESC LIMIT 10
----
1609870538
871205616
723295301
46141310
-244808054
-526893425
-1111307477
-1254014607
-2050375185
-2119770943

query  rowsort
SELECT sum(distinct `table_1`.`column_2`) AS `alias_1` FROM `table_1`
----
-2581013131

query  rowsort
SELECT `table_1`.`column_2` AS `alias_1` FROM `table_1` WHERE (`table_1`.`column_2` > ?)
? = 10
----
1460732880
159612820
1681048210
270853319
281416401

query  nosort
SELECT `table_1`.`column_2` AS `alias_1` FROM `table_1` ORDER BY `table_1`.`column_2` DESC LIMIT 10
----
1681048210
1460732880
281416401
270853319
159612820
-830413864
-896533993
-1291895943
-1596710187
-1819122774

query  nosort
SELECT sum(distinct `table_1`.`column_3`) AS `alias_1` FROM `table_1` GROUP BY `table_1`.`column_2` ORDER BY `table_1`.`column_2` ASC LIMIT 10
----
508681527
-555685046
-1078954977
1592271927
-2099351146
-1487117660
-1731540294
-1215388343
1479876245
-777585239

query  nosort
SELECT `table_1`.`column_3` AS `alias_1` FROM `table_1` WHERE (`table_1`.`column_3` > ?) ORDER BY `table_1`.`column_3` ASC LIMIT 10
? = 10
----
508681527
1479876245
1592271927

query  nosort
SELECT sum(distinct `table_1`.`column_4`) AS `alias_1` FROM `table_1` GROUP BY `table_1`.`column_3` ORDER BY `table_1`.`column_3` DESC LIMIT 10
----
-414982202
-918256233
1809193383
-1343699390
-1540086691
-652910847
-1572410548
1439380550
-1997353901
-1571688025

query  nosort
SELECT `table_1`.`column_4` AS `alias_1` FROM `table_1` WHERE (`table_1`.`column_4` > ?) ORDER BY `table_1`.`column_4` DESC LIMIT 10
? = 10
----
1809193383
1439380550

query  rowsort
SELECT sum(distinct `table_1`.`column_5`) AS `alias_1` FROM `table_1` WHERE (`table_1`.`column_4` > ?)
? = 10
----
2898203729

query  nosort
SELECT sum(distinct `table_1`.`column_6`) AS `alias_1` FROM `table_1` GROUP BY `table_1`.`column_4` ORDER BY `table_1`.`column_4` DESC LIMIT 10
----
-1995948790
-845357034
415930822
-51199682
2015389252
-678299175
663012576
798385406
1616878422
-2078313525

query  nosort
SELECT `table_1`.`column_6` AS `alias_1` FROM `table_1` WHERE (`table_1`.`column_6` > ?) ORDER BY `table_1`.`column_6` DESC LIMIT 10
? = 10
----
2015389252
1616878422
798385406
663012576
415930822

query  nosort
SELECT sum(distinct `table_1`.`column_7`) AS `alias_1` FROM `table_1` WHERE (`table_1`.`column_6` > ?) GROUP BY `table_1`.`column_6` ORDER BY `table_1`.`column_6` ASC LIMIT 10
? = 10
----
-219987170
-1945308483
-1718521173
208130167
107997190

query  nosort
SELECT sum(distinct `table_1`.`column_8`) AS `alias_1` FROM `table_1` WHERE (`table_1`.`column_7` > ?) GROUP BY `table_1`.`column_6` ORDER BY `table_1`.`column_6` DESC LIMIT 10
? = 10
----
321281807
-1191599251
2129947681
-1898859990

query  nosort
SELECT sum(distinct `table_1`.`column_9`) AS `alias_1` FROM `table_1` WHERE (`table_1`.`column_7` > ?) GROUP BY `table_1`.`column_7` ORDER BY `table_1`.`column_7` DESC LIMIT 10
? = 10
----
-180436221
946842388
-985615640
-1896327892

statement ok
DELETE FROM `table_1` WHERE (`column_10` = 0)


statement ok
DELETE FROM `table_1` WHERE (`column_10` = 1)


statement ok
DELETE FROM `table_1` WHERE (`column_10` = 2)


statement ok
DELETE FROM `table_1` WHERE (`column_10` = 3)


statement ok
DELETE FROM `table_1` WHERE (`column_10` = 4)


query  nosort
SELECT `table_1`.`column_1` AS `alias_1` FROM `table_1` ORDER BY `table_1`.`column_1` ASC LIMIT 10
----
-1254014607
-526893425
-244808054
723295301
871205616

query  nosort
SELECT `table_1`.`column_1` AS `alias_1` FROM `table_1` ORDER BY `table_1`.`column_1` DESC LIMIT 10
----
871205616
723295301
-244808054
-526893425
-1254014607

query  rowsort
SELECT sum(distinct `table_1`.`column_2`) AS `alias_1` FROM `table_1`
----
-1756555383

query  rowsort
SELECT `table_1`.`column_2` AS `alias_1` FROM `table_1` WHERE (`table_1`.`column_2` > ?)
? = 10
----
1681048210
281416401

query  nosort
SELECT `table_1`.`column_2` AS `alias_1` FROM `table_1` ORDER BY `table_1`.`column_2` DESC LIMIT 10
----
1681048210
281416401
-830413864
-1291895943
-1596710187

query  nosort
SELECT sum(distinct `table_1`.`column_3`) AS `alias_1` FROM `table_1` GROUP BY `table_1`.`column_2` ORDER BY `table_1`.`column_2` ASC LIMIT 10
----
-555685046
-1078954977
-2099351146
-1215388343
-777585239

query  nosort
SELECT `table_1`.`column_3` AS `alias_1` FROM `table_1` WHERE (`table_1`.`column_3` > ?) ORDER BY `table_1`.`column_3` ASC LIMIT 10
? = 10
----


query  nosort
SELECT sum(distinct `table_1`.`column_4`) AS `alias_1` FROM `table_1` GROUP BY `table_1`.`column_3` ORDER BY `table_1`.`column_3` DESC LIMIT 10
----
-1343699390
-1540086691
-652910847
-1572410548
-1571688025

query  nosort
SELECT `table_1`.`column_4` AS `alias_1` FROM `table_1` WHERE (`table_1`.`column_4` > ?) ORDER BY `table_1`.`column_4` DESC LIMIT 10
? = 10
----


query  rowsort
SELECT sum(distinct `table_1`.`column_5`) AS `alias_1` FROM `table_1` WHERE (`table_1`.`column_4` > ?)
? = 10
----
NULL

query  nosort
SELECT sum(distinct `table_1`.`column_6`) AS `alias_1` FROM `table_1` GROUP BY `table_1`.`column_4` ORDER BY `table_1`.`column_4` DESC LIMIT 10
----
-51199682
-678299175
663012576
798385406
1616878422

query  nosort
SELECT `table_1`.`column_6` AS `alias_1` FROM `table_1` WHERE (`table_1`.`column_6` > ?) ORDER BY `table_1`.`column_6` DESC LIMIT 10
? = 10
----
1616878422
798385406
663012576

query  nosort
SELECT sum(distinct `table_1`.`column_7`) AS `alias_1` FROM `table_1` WHERE (`table_1`.`column_6` > ?) GROUP BY `table_1`.`column_6` ORDER BY `table_1`.`column_6` ASC LIMIT 10
? = 10
----
-1945308483
-1718521173
208130167

query  nosort
SELECT sum(distinct `table_1`.`column_8`) AS `alias_1` FROM `table_1` WHERE (`table_1`.`column_7` > ?) GROUP BY `table_1`.`column_6` ORDER BY `table_1`.`column_6` DESC LIMIT 10
? = 10
----
-1191599251
2129947681

query  nosort
SELECT sum(distinct `table_1`.`column_9`) AS `alias_1` FROM `table_1` WHERE (`table_1`.`column_7` > ?) GROUP BY `table_1`.`column_7` ORDER BY `table_1`.`column_7` DESC LIMIT 10
? = 10
----
-180436221
-985615640
