# Generated by:
#     target/debug/noria-logictest permute --compare-to mysql://root:noria@127.1/noria -d 3 -o logictests/generated/mysql/ --only range_param --random --include-deletes --rows-per-table 10 --subquery-depth 1

statement ok
CREATE TABLE `table_1` (`column_5` INT, `column_8` INT, `column_3` INT, `column_4` INT, `column_10` INT, `column_6` INT, `column_1` INT, `column_2` INT, `column_7` INT, `column_9` INT, PRIMARY KEY (`column_10`))


statement ok
INSERT INTO `table_1` (`column_5`, `column_8`, `column_3`, `column_4`, `column_10`, `column_6`, `column_1`, `column_2`, `column_7`, `column_9`) VALUES (1590123360, 629499066, 442771872, 200988256, 0, 1625643760, -1574108272, 1907154911, -593639126, -423456219), (-1658967677, 1662949083, 398588730, -834160117, 1, 806402495, -1688638741, 874908266, 25385366, 1450525235), (429968708, 1186546094, -36670963, 226040975, 2, 451792743, -1719035006, 835750466, -8831548, -824709268), (-46751893, -1296818130, -984270033, 1762860821, 3, -1501596723, 603308375, -2004152867, -425214123, 51767243), (1243116417, -2115680635, -1326424948, -1135481997, 4, 1733074762, 1726357105, 411947341, -677155382, 1586513200), (-1440417658, 463516631, -2094305096, 361214719, 5, 2015579255, -75635849, 1295319712, -506746861, 1238938881), (-488511867, 820485078, -123548849, -2131287476, 6, 915151634, 1518664662, 967824749, -1187766293, -75661834), (-407920282, 954518921, -552045599, -763967106, 7, -1973572633, 1491488295, 419226260, -1152283025, -1582843709), (-2049924134, -723901715, 1345546763, -899409583, 8, -1463148622, -1376883099, 721999203, 1061381212, 574395759), (-1742176452, -18987339, -1816204836, 1592020570, 9, 1350262049, -719123099, 73740139, 1056432024, 1513921966)


query  nosort
SELECT `table_1`.`column_1` AS `alias_1` FROM `table_1` ORDER BY `table_1`.`column_1` ASC LIMIT 10
----
-1719035006
-1688638741
-1574108272
-1376883099
-719123099
-75635849
603308375
1491488295
1518664662
1726357105

query  nosort
SELECT `table_1`.`column_1` AS `alias_1` FROM `table_1` ORDER BY `table_1`.`column_1` DESC LIMIT 10
----
1726357105
1518664662
1491488295
603308375
-75635849
-719123099
-1376883099
-1574108272
-1688638741
-1719035006

query  rowsort
SELECT count(distinct `table_1`.`column_2`) AS `alias_1` FROM `table_1`
----
10

query  rowsort
SELECT `table_1`.`column_2` AS `alias_1` FROM `table_1` WHERE (`table_1`.`column_2` > ?)
? = 10
----
1295319712
1907154911
411947341
419226260
721999203
73740139
835750466
874908266
967824749

query  nosort
SELECT `table_1`.`column_2` AS `alias_1` FROM `table_1` ORDER BY `table_1`.`column_2` DESC LIMIT 10
----
1907154911
1295319712
967824749
874908266
835750466
721999203
419226260
411947341
73740139
-2004152867

query  nosort
SELECT count(distinct `table_1`.`column_3`) AS `alias_1` FROM `table_1` GROUP BY `table_1`.`column_2` ORDER BY `table_1`.`column_2` ASC LIMIT 10
----
1
1
1
1
1
1
1
1
1
1

query  nosort
SELECT `table_1`.`column_2` AS `alias_1` FROM `table_1` WHERE (`table_1`.`column_2` > ?) ORDER BY `table_1`.`column_2` ASC LIMIT 10
? = 10
----
73740139
411947341
419226260
721999203
835750466
874908266
967824749
1295319712
1907154911

query  nosort
SELECT count(distinct `table_1`.`column_4`) AS `alias_1` FROM `table_1` GROUP BY `table_1`.`column_2` ORDER BY `table_1`.`column_2` DESC LIMIT 10
----
1
1
1
1
1
1
1
1
1
1

query  nosort
SELECT `table_1`.`column_2` AS `alias_1` FROM `table_1` WHERE (`table_1`.`column_2` > ?) ORDER BY `table_1`.`column_2` DESC LIMIT 10
? = 10
----
1907154911
1295319712
967824749
874908266
835750466
721999203
419226260
411947341
73740139

query  rowsort
SELECT count(distinct `table_1`.`column_5`) AS `alias_1` FROM `table_1` WHERE (`table_1`.`column_5` > ?)
? = 10
----
3

query  nosort
SELECT count(distinct `table_1`.`column_6`) AS `alias_1` FROM `table_1` GROUP BY `table_1`.`column_5` ORDER BY `table_1`.`column_5` DESC LIMIT 10
----
1
1
1
1
1
1
1
1
1
1

query  nosort
SELECT `table_1`.`column_6` AS `alias_1` FROM `table_1` WHERE (`table_1`.`column_6` > ?) ORDER BY `table_1`.`column_6` DESC LIMIT 10
? = 10
----
2015579255
1733074762
1625643760
1350262049
915151634
806402495
451792743

query  nosort
SELECT count(distinct `table_1`.`column_7`) AS `alias_1` FROM `table_1` WHERE (`table_1`.`column_6` > ?) GROUP BY `table_1`.`column_6` ORDER BY `table_1`.`column_6` ASC LIMIT 10
? = 10
----
1
1
1
1
1
1
1

query  nosort
SELECT count(distinct `table_1`.`column_8`) AS `alias_1` FROM `table_1` WHERE (`table_1`.`column_5` > ?) GROUP BY `table_1`.`column_6` ORDER BY `table_1`.`column_6` DESC LIMIT 10
? = 10
----
1
1
1

query  nosort
SELECT count(distinct `table_1`.`column_9`) AS `alias_1` FROM `table_1` WHERE (`table_1`.`column_5` > ?) GROUP BY `table_1`.`column_5` ORDER BY `table_1`.`column_5` DESC LIMIT 10
? = 10
----
1
1
1

statement ok
DELETE FROM `table_1` WHERE (`column_10` = 0)


statement ok
DELETE FROM `table_1` WHERE (`column_10` = 1)


statement ok
DELETE FROM `table_1` WHERE (`column_10` = 2)


statement ok
DELETE FROM `table_1` WHERE (`column_10` = 3)


statement ok
DELETE FROM `table_1` WHERE (`column_10` = 4)


query  nosort
SELECT `table_1`.`column_1` AS `alias_1` FROM `table_1` ORDER BY `table_1`.`column_1` ASC LIMIT 10
----
-1376883099
-719123099
-75635849
1491488295
1518664662

query  nosort
SELECT `table_1`.`column_1` AS `alias_1` FROM `table_1` ORDER BY `table_1`.`column_1` DESC LIMIT 10
----
1518664662
1491488295
-75635849
-719123099
-1376883099

query  rowsort
SELECT count(distinct `table_1`.`column_2`) AS `alias_1` FROM `table_1`
----
5

query  rowsort
SELECT `table_1`.`column_2` AS `alias_1` FROM `table_1` WHERE (`table_1`.`column_2` > ?)
? = 10
----
1295319712
419226260
721999203
73740139
967824749

query  nosort
SELECT `table_1`.`column_2` AS `alias_1` FROM `table_1` ORDER BY `table_1`.`column_2` DESC LIMIT 10
----
1295319712
967824749
721999203
419226260
73740139

query  nosort
SELECT count(distinct `table_1`.`column_3`) AS `alias_1` FROM `table_1` GROUP BY `table_1`.`column_2` ORDER BY `table_1`.`column_2` ASC LIMIT 10
----
1
1
1
1
1

query  nosort
SELECT `table_1`.`column_2` AS `alias_1` FROM `table_1` WHERE (`table_1`.`column_2` > ?) ORDER BY `table_1`.`column_2` ASC LIMIT 10
? = 10
----
73740139
419226260
721999203
967824749
1295319712

query  nosort
SELECT count(distinct `table_1`.`column_4`) AS `alias_1` FROM `table_1` GROUP BY `table_1`.`column_2` ORDER BY `table_1`.`column_2` DESC LIMIT 10
----
1
1
1
1
1

query  nosort
SELECT `table_1`.`column_2` AS `alias_1` FROM `table_1` WHERE (`table_1`.`column_2` > ?) ORDER BY `table_1`.`column_2` DESC LIMIT 10
? = 10
----
1295319712
967824749
721999203
419226260
73740139

query  rowsort
SELECT count(distinct `table_1`.`column_5`) AS `alias_1` FROM `table_1` WHERE (`table_1`.`column_5` > ?)
? = 10
----
0

query  nosort
SELECT count(distinct `table_1`.`column_6`) AS `alias_1` FROM `table_1` GROUP BY `table_1`.`column_5` ORDER BY `table_1`.`column_5` DESC LIMIT 10
----
1
1
1
1
1

query  nosort
SELECT `table_1`.`column_6` AS `alias_1` FROM `table_1` WHERE (`table_1`.`column_6` > ?) ORDER BY `table_1`.`column_6` DESC LIMIT 10
? = 10
----
2015579255
1350262049
915151634

query  nosort
SELECT count(distinct `table_1`.`column_7`) AS `alias_1` FROM `table_1` WHERE (`table_1`.`column_6` > ?) GROUP BY `table_1`.`column_6` ORDER BY `table_1`.`column_6` ASC LIMIT 10
? = 10
----
1
1
1

query  nosort
SELECT count(distinct `table_1`.`column_8`) AS `alias_1` FROM `table_1` WHERE (`table_1`.`column_5` > ?) GROUP BY `table_1`.`column_6` ORDER BY `table_1`.`column_6` DESC LIMIT 10
? = 10
----


query  nosort
SELECT count(distinct `table_1`.`column_9`) AS `alias_1` FROM `table_1` WHERE (`table_1`.`column_5` > ?) GROUP BY `table_1`.`column_5` ORDER BY `table_1`.`column_5` DESC LIMIT 10
? = 10
----

