# Generated by:
#     target/debug/noria-logictest permute --compare-to mysql://root:noria@127.1/noria -d 3 -o logictests/generated/mysql/ --only range_param --random --include-deletes --rows-per-table 10 --subquery-depth 1

statement ok
CREATE TABLE `table_1` (`column_7` INT, `column_2` INT, `column_6` INT, `column_8` INT, `column_1` INT, `column_3` INT, `column_4` INT, `column_5` INT, `column_9` INT, `column_10` INT, PRIMARY KEY (`column_10`))


statement ok
INSERT INTO `table_1` (`column_7`, `column_2`, `column_6`, `column_8`, `column_1`, `column_3`, `column_4`, `column_5`, `column_9`, `column_10`) VALUES (-1763745704, -520619616, 924236181, 178607487, 953193079, -790266559, 248946898, -2107301253, -135321480, 0), (-2018675562, 2011889120, -1694760079, 2013155901, 683813862, 168547544, -136346190, 795271326, 959959917, 1), (1335272854, 1591609061, -1411432990, 971248240, 4349043, -1565560974, -1170836431, 3775589, -109047397, 2), (1040800512, -1072463641, -350438481, 699873325, -148414723, 69043641, 361962649, -442521069, -1636204679, 3), (-557455715, -1534900526, 522148341, 507249770, -2142320221, 125951385, -391322596, -1164511557, -202687227, 4), (2097420402, -614999736, 1252436983, 1513180767, -375110949, 564891523, -1568228509, -2002004421, -2008524218, 5), (-606393687, 1595763469, -831376823, -1924462111, 1119134481, 2027908567, -472896484, -160149036, -1783153016, 6), (-460617718, 1612638852, 1353232386, 1289156584, 1929998840, 1158118941, 1143738387, -683834787, 608539145, 7), (2138975415, 1734654238, -1875056272, 1734616671, -1466441068, 198004812, -763623046, -1514857394, -942313792, 8), (-937225742, 1762994397, 1429527114, 228517034, -617650648, -2007596080, -5358818, 96410536, 341998774, 9)


query  nosort
SELECT `table_1`.`column_1` AS `alias_1` FROM `table_1` ORDER BY `table_1`.`column_1` ASC LIMIT 10
----
-2142320221
-1466441068
-617650648
-375110949
-148414723
4349043
683813862
953193079
1119134481
1929998840

query  nosort
SELECT `table_1`.`column_1` AS `alias_1` FROM `table_1` ORDER BY `table_1`.`column_1` DESC LIMIT 10
----
1929998840
1119134481
953193079
683813862
4349043
-148414723
-375110949
-617650648
-1466441068
-2142320221

query  rowsort
SELECT count(`table_1`.`column_2`) AS `alias_1` FROM `table_1`
----
10

query  rowsort
SELECT `table_1`.`column_2` AS `alias_1` FROM `table_1` WHERE (`table_1`.`column_2` > ?)
? = 10
----
1591609061
1595763469
1612638852
1734654238
1762994397
2011889120

query  nosort
SELECT `table_1`.`column_2` AS `alias_1` FROM `table_1` ORDER BY `table_1`.`column_2` DESC LIMIT 10
----
2011889120
1762994397
1734654238
1612638852
1595763469
1591609061
-520619616
-614999736
-1072463641
-1534900526

query  nosort
SELECT count(`table_1`.`column_3`) AS `alias_1` FROM `table_1` GROUP BY `table_1`.`column_2` ORDER BY `table_1`.`column_2` ASC LIMIT 10
----
1
1
1
1
1
1
1
1
1
1

query  nosort
SELECT `table_1`.`column_2` AS `alias_1` FROM `table_1` WHERE (`table_1`.`column_2` > ?) ORDER BY `table_1`.`column_2` ASC LIMIT 10
? = 10
----
1591609061
1595763469
1612638852
1734654238
1762994397
2011889120

query  nosort
SELECT count(`table_1`.`column_4`) AS `alias_1` FROM `table_1` GROUP BY `table_1`.`column_2` ORDER BY `table_1`.`column_2` DESC LIMIT 10
----
1
1
1
1
1
1
1
1
1
1

query  nosort
SELECT `table_1`.`column_1` AS `alias_1` FROM `table_1` WHERE (`table_1`.`column_1` > ?) ORDER BY `table_1`.`column_1` DESC LIMIT 10
? = 10
----
1929998840
1119134481
953193079
683813862
4349043

query  rowsort
SELECT count(`table_1`.`column_5`) AS `alias_1` FROM `table_1` WHERE (`table_1`.`column_1` > ?)
? = 10
----
5

query  nosort
SELECT count(`table_1`.`column_6`) AS `alias_1` FROM `table_1` GROUP BY `table_1`.`column_1` ORDER BY `table_1`.`column_1` DESC LIMIT 10
----
1
1
1
1
1
1
1
1
1
1

query  nosort
SELECT `table_1`.`column_1` AS `alias_1` FROM `table_1` WHERE (`table_1`.`column_1` > ?) ORDER BY `table_1`.`column_1` DESC LIMIT 10
? = 10
----
1929998840
1119134481
953193079
683813862
4349043

query  nosort
SELECT count(`table_1`.`column_7`) AS `alias_1` FROM `table_1` WHERE (`table_1`.`column_7` > ?) GROUP BY `table_1`.`column_1` ORDER BY `table_1`.`column_1` ASC LIMIT 10
? = 10
----
1
1
1
1

query  nosort
SELECT count(`table_1`.`column_8`) AS `alias_1` FROM `table_1` WHERE (`table_1`.`column_7` > ?) GROUP BY `table_1`.`column_7` ORDER BY `table_1`.`column_7` DESC LIMIT 10
? = 10
----
1
1
1
1

query  nosort
SELECT count(`table_1`.`column_9`) AS `alias_1` FROM `table_1` WHERE (`table_1`.`column_7` > ?) GROUP BY `table_1`.`column_7` ORDER BY `table_1`.`column_7` DESC LIMIT 10
? = 10
----
1
1
1
1

statement ok
DELETE FROM `table_1` WHERE (`column_10` = 0)


statement ok
DELETE FROM `table_1` WHERE (`column_10` = 1)


statement ok
DELETE FROM `table_1` WHERE (`column_10` = 2)


statement ok
DELETE FROM `table_1` WHERE (`column_10` = 3)


statement ok
DELETE FROM `table_1` WHERE (`column_10` = 4)


query  nosort
SELECT `table_1`.`column_1` AS `alias_1` FROM `table_1` ORDER BY `table_1`.`column_1` ASC LIMIT 10
----
-1466441068
-617650648
-375110949
1119134481
1929998840

query  nosort
SELECT `table_1`.`column_1` AS `alias_1` FROM `table_1` ORDER BY `table_1`.`column_1` DESC LIMIT 10
----
1929998840
1119134481
-375110949
-617650648
-1466441068

query  rowsort
SELECT count(`table_1`.`column_2`) AS `alias_1` FROM `table_1`
----
5

query  rowsort
SELECT `table_1`.`column_2` AS `alias_1` FROM `table_1` WHERE (`table_1`.`column_2` > ?)
? = 10
----
1595763469
1612638852
1734654238
1762994397

query  nosort
SELECT `table_1`.`column_2` AS `alias_1` FROM `table_1` ORDER BY `table_1`.`column_2` DESC LIMIT 10
----
1762994397
1734654238
1612638852
1595763469
-614999736

query  nosort
SELECT count(`table_1`.`column_3`) AS `alias_1` FROM `table_1` GROUP BY `table_1`.`column_2` ORDER BY `table_1`.`column_2` ASC LIMIT 10
----
1
1
1
1
1

query  nosort
SELECT `table_1`.`column_2` AS `alias_1` FROM `table_1` WHERE (`table_1`.`column_2` > ?) ORDER BY `table_1`.`column_2` ASC LIMIT 10
? = 10
----
1595763469
1612638852
1734654238
1762994397

query  nosort
SELECT count(`table_1`.`column_4`) AS `alias_1` FROM `table_1` GROUP BY `table_1`.`column_2` ORDER BY `table_1`.`column_2` DESC LIMIT 10
----
1
1
1
1
1

query  nosort
SELECT `table_1`.`column_1` AS `alias_1` FROM `table_1` WHERE (`table_1`.`column_1` > ?) ORDER BY `table_1`.`column_1` DESC LIMIT 10
? = 10
----
1929998840
1119134481

query  rowsort
SELECT count(`table_1`.`column_5`) AS `alias_1` FROM `table_1` WHERE (`table_1`.`column_1` > ?)
? = 10
----
2

query  nosort
SELECT count(`table_1`.`column_6`) AS `alias_1` FROM `table_1` GROUP BY `table_1`.`column_1` ORDER BY `table_1`.`column_1` DESC LIMIT 10
----
1
1
1
1
1

query  nosort
SELECT `table_1`.`column_1` AS `alias_1` FROM `table_1` WHERE (`table_1`.`column_1` > ?) ORDER BY `table_1`.`column_1` DESC LIMIT 10
? = 10
----
1929998840
1119134481

query  nosort
SELECT count(`table_1`.`column_7`) AS `alias_1` FROM `table_1` WHERE (`table_1`.`column_7` > ?) GROUP BY `table_1`.`column_1` ORDER BY `table_1`.`column_1` ASC LIMIT 10
? = 10
----
1
1

query  nosort
SELECT count(`table_1`.`column_8`) AS `alias_1` FROM `table_1` WHERE (`table_1`.`column_7` > ?) GROUP BY `table_1`.`column_7` ORDER BY `table_1`.`column_7` DESC LIMIT 10
? = 10
----
1
1

query  nosort
SELECT count(`table_1`.`column_9`) AS `alias_1` FROM `table_1` WHERE (`table_1`.`column_7` > ?) GROUP BY `table_1`.`column_7` ORDER BY `table_1`.`column_7` DESC LIMIT 10
? = 10
----
1
1
