# Generated by:
#     target/debug/noria-logictest permute --compare-to mysql://root:noria@127.1/noria -d 3 -o logictests/generated/mysql/ --only range_param --random --include-deletes --rows-per-table 10 --subquery-depth 1

statement ok
CREATE TABLE `table_1` (`column_4` INT, `column_5` INT, `column_6` INT, `column_1` INT, `column_2` INT, `column_7` INT, `column_8` INT, `column_9` INT, `column_10` INT, `column_3` INT, PRIMARY KEY (`column_10`))


statement ok
INSERT INTO `table_1` (`column_4`, `column_5`, `column_6`, `column_1`, `column_2`, `column_7`, `column_8`, `column_9`, `column_10`, `column_3`) VALUES (1107511332, -1818143565, -2087980178, -1705507111, -1092316298, 1535831283, 459721071, 1194336748, 0, 218577623), (-1915228585, 417439720, -714568346, -1714306334, -1574927013, -1705613835, -1471250873, -1818409304, 1, 11431378), (-1673605567, -1700470174, -317274575, 1593358657, 318799416, -282433303, 1790991416, -1011252727, 2, 1373445707), (-1950588973, -427566263, 524377676, 2037319671, -745226226, 1691012109, 1780204155, -1646887194, 3, 1208179626), (-861731048, 1844926380, 220179180, -1423773461, -623491823, -1320958755, 1149855799, -984626543, 4, -416864259), (1013636088, -107721334, 969715944, -374509687, -1514127029, 698027664, -523740952, 1731776496, 5, 261840364), (-1315872380, 1663904815, -128497707, -997059545, -793466765, 1781086534, -252009423, 546611153, 6, 99930531), (-1216100855, -1626015971, 1535917987, -1722758329, 430065635, 336088563, 53860836, -809555078, 7, -2003799407), (463917591, -1370668667, -2829253, -1595136359, -1740418710, 1370191501, -1803886613, -637476567, 8, -1584173036), (2045064400, -4312250, -768372696, 491136651, -261452639, -1009693958, -2019650322, -1882565967, 9, 1878302084)


query  nosort
SELECT `table_1`.`column_1` AS `alias_1` FROM `table_1` ORDER BY `table_1`.`column_1` ASC LIMIT 10
----
-1722758329
-1714306334
-1705507111
-1595136359
-1423773461
-997059545
-374509687
491136651
1593358657
2037319671

query  nosort
SELECT `table_1`.`column_1` AS `alias_1` FROM `table_1` ORDER BY `table_1`.`column_1` DESC LIMIT 10
----
2037319671
1593358657
491136651
-374509687
-997059545
-1423773461
-1595136359
-1705507111
-1714306334
-1722758329

query  rowsort
SELECT sum(`table_1`.`column_2`) AS `alias_1` FROM `table_1`
----
-7596561452

query  rowsort
SELECT `table_1`.`column_1` AS `alias_1` FROM `table_1` WHERE (`table_1`.`column_1` > ?)
? = 10
----
1593358657
2037319671
491136651

query  nosort
SELECT `table_1`.`column_1` AS `alias_1` FROM `table_1` ORDER BY `table_1`.`column_1` DESC LIMIT 10
----
2037319671
1593358657
491136651
-374509687
-997059545
-1423773461
-1595136359
-1705507111
-1714306334
-1722758329

query  nosort
SELECT sum(`table_1`.`column_3`) AS `alias_1` FROM `table_1` GROUP BY `table_1`.`column_1` ORDER BY `table_1`.`column_1` ASC LIMIT 10
----
-2003799407
11431378
218577623
-1584173036
-416864259
99930531
261840364
1878302084
1373445707
1208179626

query  nosort
SELECT `table_1`.`column_1` AS `alias_1` FROM `table_1` WHERE (`table_1`.`column_1` > ?) ORDER BY `table_1`.`column_1` ASC LIMIT 10
? = 10
----
491136651
1593358657
2037319671

query  nosort
SELECT sum(`table_1`.`column_4`) AS `alias_1` FROM `table_1` GROUP BY `table_1`.`column_1` ORDER BY `table_1`.`column_1` DESC LIMIT 10
----
-1950588973
-1673605567
2045064400
1013636088
-1315872380
-861731048
463917591
1107511332
-1915228585
-1216100855

query  nosort
SELECT `table_1`.`column_4` AS `alias_1` FROM `table_1` WHERE (`table_1`.`column_4` > ?) ORDER BY `table_1`.`column_4` DESC LIMIT 10
? = 10
----
2045064400
1107511332
1013636088
463917591

query  rowsort
SELECT sum(`table_1`.`column_5`) AS `alias_1` FROM `table_1` WHERE (`table_1`.`column_4` > ?)
? = 10
----
-3300845816

query  nosort
SELECT sum(`table_1`.`column_6`) AS `alias_1` FROM `table_1` GROUP BY `table_1`.`column_4` ORDER BY `table_1`.`column_4` DESC LIMIT 10
----
-768372696
-2087980178
969715944
-2829253
220179180
1535917987
-128497707
-317274575
-714568346
524377676

query  nosort
SELECT `table_1`.`column_4` AS `alias_1` FROM `table_1` WHERE (`table_1`.`column_4` > ?) ORDER BY `table_1`.`column_4` DESC LIMIT 10
? = 10
----
2045064400
1107511332
1013636088
463917591

query  nosort
SELECT sum(`table_1`.`column_7`) AS `alias_1` FROM `table_1` WHERE (`table_1`.`column_4` > ?) GROUP BY `table_1`.`column_4` ORDER BY `table_1`.`column_4` ASC LIMIT 10
? = 10
----
1370191501
698027664
1535831283
-1009693958

query  nosort
SELECT sum(`table_1`.`column_8`) AS `alias_1` FROM `table_1` WHERE (`table_1`.`column_4` > ?) GROUP BY `table_1`.`column_4` ORDER BY `table_1`.`column_4` DESC LIMIT 10
? = 10
----
-2019650322
459721071
-523740952
-1803886613

query  nosort
SELECT sum(`table_1`.`column_9`) AS `alias_1` FROM `table_1` WHERE (`table_1`.`column_4` > ?) GROUP BY `table_1`.`column_4` ORDER BY `table_1`.`column_4` DESC LIMIT 10
? = 10
----
-1882565967
1194336748
1731776496
-637476567

statement ok
DELETE FROM `table_1` WHERE (`column_10` = 0)


statement ok
DELETE FROM `table_1` WHERE (`column_10` = 1)


statement ok
DELETE FROM `table_1` WHERE (`column_10` = 2)


statement ok
DELETE FROM `table_1` WHERE (`column_10` = 3)


statement ok
DELETE FROM `table_1` WHERE (`column_10` = 4)


query  nosort
SELECT `table_1`.`column_1` AS `alias_1` FROM `table_1` ORDER BY `table_1`.`column_1` ASC LIMIT 10
----
-1722758329
-1595136359
-997059545
-374509687
491136651

query  nosort
SELECT `table_1`.`column_1` AS `alias_1` FROM `table_1` ORDER BY `table_1`.`column_1` DESC LIMIT 10
----
491136651
-374509687
-997059545
-1595136359
-1722758329

query  rowsort
SELECT sum(`table_1`.`column_2`) AS `alias_1` FROM `table_1`
----
-3879399508

query  rowsort
SELECT `table_1`.`column_1` AS `alias_1` FROM `table_1` WHERE (`table_1`.`column_1` > ?)
? = 10
----
491136651

query  nosort
SELECT `table_1`.`column_1` AS `alias_1` FROM `table_1` ORDER BY `table_1`.`column_1` DESC LIMIT 10
----
491136651
-374509687
-997059545
-1595136359
-1722758329

query  nosort
SELECT sum(`table_1`.`column_3`) AS `alias_1` FROM `table_1` GROUP BY `table_1`.`column_1` ORDER BY `table_1`.`column_1` ASC LIMIT 10
----
-2003799407
-1584173036
99930531
261840364
1878302084

query  nosort
SELECT `table_1`.`column_1` AS `alias_1` FROM `table_1` WHERE (`table_1`.`column_1` > ?) ORDER BY `table_1`.`column_1` ASC LIMIT 10
? = 10
----
491136651

query  nosort
SELECT sum(`table_1`.`column_4`) AS `alias_1` FROM `table_1` GROUP BY `table_1`.`column_1` ORDER BY `table_1`.`column_1` DESC LIMIT 10
----
2045064400
1013636088
-1315872380
463917591
-1216100855

query  nosort
SELECT `table_1`.`column_4` AS `alias_1` FROM `table_1` WHERE (`table_1`.`column_4` > ?) ORDER BY `table_1`.`column_4` DESC LIMIT 10
? = 10
----
2045064400
1013636088
463917591

query  rowsort
SELECT sum(`table_1`.`column_5`) AS `alias_1` FROM `table_1` WHERE (`table_1`.`column_4` > ?)
? = 10
----
-1482702251

query  nosort
SELECT sum(`table_1`.`column_6`) AS `alias_1` FROM `table_1` GROUP BY `table_1`.`column_4` ORDER BY `table_1`.`column_4` DESC LIMIT 10
----
-768372696
969715944
-2829253
1535917987
-128497707

query  nosort
SELECT `table_1`.`column_4` AS `alias_1` FROM `table_1` WHERE (`table_1`.`column_4` > ?) ORDER BY `table_1`.`column_4` DESC LIMIT 10
? = 10
----
2045064400
1013636088
463917591

query  nosort
SELECT sum(`table_1`.`column_7`) AS `alias_1` FROM `table_1` WHERE (`table_1`.`column_4` > ?) GROUP BY `table_1`.`column_4` ORDER BY `table_1`.`column_4` ASC LIMIT 10
? = 10
----
1370191501
698027664
-1009693958

query  nosort
SELECT sum(`table_1`.`column_8`) AS `alias_1` FROM `table_1` WHERE (`table_1`.`column_4` > ?) GROUP BY `table_1`.`column_4` ORDER BY `table_1`.`column_4` DESC LIMIT 10
? = 10
----
-2019650322
-523740952
-1803886613

query  nosort
SELECT sum(`table_1`.`column_9`) AS `alias_1` FROM `table_1` WHERE (`table_1`.`column_4` > ?) GROUP BY `table_1`.`column_4` ORDER BY `table_1`.`column_4` DESC LIMIT 10
? = 10
----
-1882565967
1731776496
-637476567
