# Generated by:
#     target/debug/noria-logictest generate --operations avg,inner_join,left_join --compare-to mysql://root@localhost/mysql --subquery-depth 1 --rows-per-table 5 -o logictests/generated/avg,inner_join,left_join.test --include-deletes

statement ok
CREATE TABLE table_3 (column_3 INT(32), column_7 INT(32), column_1 INT(32), column_8 INT(32), column_2 INT(32), column_4 INT(32), column_6 INT(32), column_5 INT(32), PRIMARY KEY (column_8))


statement ok
CREATE TABLE table_9 (column_3 INT(32), column_1 INT(32), column_2 INT(32), PRIMARY KEY (column_3))


statement ok
CREATE TABLE table_1 (column_2 INT(32), column_3 INT(32), column_4 INT(32), column_1 INT(32), PRIMARY KEY (column_4))


statement ok
CREATE TABLE table_2 (column_2 INT(32), column_3 INT(32), column_1 INT(32), PRIMARY KEY (column_3))


statement ok
CREATE TABLE table_8 (column_3 INT(32), column_1 INT(32), column_2 INT(32), PRIMARY KEY (column_3))


statement ok
CREATE TABLE table_5 (column_1 INT(32), column_2 INT(32), column_3 INT(32), PRIMARY KEY (column_3))


statement ok
CREATE TABLE table_7 (column_3 INT(32), column_1 INT(32), column_2 INT(32), PRIMARY KEY (column_3))


statement ok
CREATE TABLE table_6 (column_6 INT(32), column_7 INT(32), column_4 INT(32), column_3 INT(32), column_5 INT(32), column_1 INT(32), column_2 INT(32), PRIMARY KEY (column_7))


statement ok
CREATE TABLE table_4 (column_2 INT(32), column_1 INT(32), column_3 INT(32), PRIMARY KEY (column_3))


statement ok
INSERT INTO table_3 (column_6, column_3, column_7, column_1, column_4, column_8, column_5, column_2) VALUES (1, 1, 1, 1, 1, 2, 1, 1), (1, 1, 1, 1, 1, 3, 1, 1), (1, 1, 1, 1, 1, 4, 1, 1), (1, 1, 1, 1, 1, 5, 1, 1), (1, 1, 1, 1, 1, 6, 1, 1)


statement ok
INSERT INTO table_9 (column_3, column_1, column_2) VALUES (2, 1, 1), (3, 1, 1), (4, 1, 1), (5, 1, 1), (6, 1, 1)


statement ok
INSERT INTO table_1 (column_1, column_2, column_3, column_4) VALUES (1, 1, 1, 2), (1, 1, 1, 3), (1, 1, 1, 4), (1, 1, 1, 5), (1, 1, 1, 6)


statement ok
INSERT INTO table_2 (column_3, column_1, column_2) VALUES (2, 1, 1), (3, 1, 1), (4, 1, 1), (5, 1, 1), (6, 1, 1)


statement ok
INSERT INTO table_8 (column_2, column_3, column_1) VALUES (1, 2, 1), (1, 3, 1), (1, 4, 1), (1, 5, 1), (1, 6, 1)


statement ok
INSERT INTO table_5 (column_1, column_2, column_3) VALUES (1, 1, 2), (1, 1, 3), (1, 1, 4), (1, 1, 5), (1, 1, 6)


statement ok
INSERT INTO table_7 (column_3, column_1, column_2) VALUES (2, 1, 1), (3, 1, 1), (4, 1, 1), (5, 1, 1), (6, 1, 1)


statement ok
INSERT INTO table_6 (column_6, column_2, column_7, column_4, column_1, column_5, column_3) VALUES (1, 1, 2, 1, 1, 1, 1), (1, 1, 3, 1, 1, 1, 1), (1, 1, 4, 1, 1, 1, 1), (1, 1, 5, 1, 1, 1, 1), (1, 1, 6, 1, 1, 1, 1)


statement ok
INSERT INTO table_4 (column_3, column_2, column_1) VALUES (2, 1, 1), (3, 1, 1), (4, 1, 1), (5, 1, 1), (6, 1, 1)


query  nosort
SELECT avg(table_1.column_1) AS alias_1 FROM table_1
----
1.0000

query  nosort
SELECT table_1.column_2 AS alias_1, table_2.column_2 AS alias_2 FROM table_1 INNER JOIN table_2 ON (table_1.column_1 = table_2.column_1)
----
50 values hashing to 1f4709ccf33e9b44d9c58ab63929bdf1

query  nosort
SELECT table_1.column_3 AS alias_1, table_3.column_2 AS alias_2 FROM table_1 LEFT JOIN table_3 ON (table_1.column_1 = table_3.column_1)
----
50 values hashing to 1f4709ccf33e9b44d9c58ab63929bdf1

query  nosort
SELECT avg(table_3.column_3) AS alias_1, table_3.column_4 AS alias_2, table_4.column_2 AS alias_3 FROM table_3 INNER JOIN table_4 ON (table_3.column_3 = table_4.column_1) GROUP BY table_3.column_4, table_4.column_2
----
1.0000
1
1

query  nosort
SELECT avg(table_3.column_5) AS alias_1, table_3.column_6 AS alias_2, table_5.column_2 AS alias_3 FROM table_3 LEFT JOIN table_5 ON (table_3.column_3 = table_5.column_1) GROUP BY table_3.column_6, table_5.column_2
----
1.0000
1
1

query  nosort
SELECT table_3.column_7 AS alias_1, table_6.column_2 AS alias_2, table_6.column_3 AS alias_3, table_7.column_2 AS alias_4 FROM table_3 INNER JOIN table_6 ON (table_3.column_3 = table_6.column_1) LEFT JOIN table_7 ON (table_6.column_1 = table_7.column_1)
----
500 values hashing to c48aa515f5fd85400ef9a2e7f8b8a35b

query  nosort
SELECT avg(table_6.column_4) AS alias_1, table_6.column_5 AS alias_2, table_8.column_2 AS alias_3, table_6.column_6 AS alias_4, table_9.column_2 AS alias_5 FROM table_6 INNER JOIN table_8 ON (table_6.column_4 = table_8.column_1) LEFT JOIN table_9 ON (table_6.column_4 = table_9.column_1) GROUP BY table_6.column_5, table_8.column_2, table_6.column_6, table_9.column_2
----
1.0000
1
1
1
1

statement ok
DELETE FROM table_3 WHERE (column_8 = 2)


statement ok
DELETE FROM table_3 WHERE (column_8 = 3)


statement ok
DELETE FROM table_9 WHERE (column_3 = 2)


statement ok
DELETE FROM table_9 WHERE (column_3 = 3)


statement ok
DELETE FROM table_1 WHERE (column_4 = 2)


statement ok
DELETE FROM table_1 WHERE (column_4 = 3)


statement ok
DELETE FROM table_2 WHERE (column_3 = 2)


statement ok
DELETE FROM table_2 WHERE (column_3 = 3)


statement ok
DELETE FROM table_8 WHERE (column_3 = 2)


statement ok
DELETE FROM table_8 WHERE (column_3 = 3)


statement ok
DELETE FROM table_5 WHERE (column_3 = 2)


statement ok
DELETE FROM table_5 WHERE (column_3 = 3)


statement ok
DELETE FROM table_7 WHERE (column_3 = 2)


statement ok
DELETE FROM table_7 WHERE (column_3 = 3)


statement ok
DELETE FROM table_6 WHERE (column_7 = 2)


statement ok
DELETE FROM table_6 WHERE (column_7 = 3)


statement ok
DELETE FROM table_4 WHERE (column_3 = 2)


statement ok
DELETE FROM table_4 WHERE (column_3 = 3)


query  nosort
SELECT avg(table_1.column_1) AS alias_1 FROM table_1
----
1.0000

query  nosort
SELECT table_1.column_2 AS alias_1, table_2.column_2 AS alias_2 FROM table_1 INNER JOIN table_2 ON (table_1.column_1 = table_2.column_1)
----
1
1
1
1
1
1
1
1
1
1
1
1
1
1
1
1
1
1

query  nosort
SELECT table_1.column_3 AS alias_1, table_3.column_2 AS alias_2 FROM table_1 LEFT JOIN table_3 ON (table_1.column_1 = table_3.column_1)
----
1
1
1
1
1
1
1
1
1
1
1
1
1
1
1
1
1
1

query  nosort
SELECT avg(table_3.column_3) AS alias_1, table_3.column_4 AS alias_2, table_4.column_2 AS alias_3 FROM table_3 INNER JOIN table_4 ON (table_3.column_3 = table_4.column_1) GROUP BY table_3.column_4, table_4.column_2
----
1.0000
1
1

query  nosort
SELECT avg(table_3.column_5) AS alias_1, table_3.column_6 AS alias_2, table_5.column_2 AS alias_3 FROM table_3 LEFT JOIN table_5 ON (table_3.column_3 = table_5.column_1) GROUP BY table_3.column_6, table_5.column_2
----
1.0000
1
1

query  nosort
SELECT table_3.column_7 AS alias_1, table_6.column_2 AS alias_2, table_6.column_3 AS alias_3, table_7.column_2 AS alias_4 FROM table_3 INNER JOIN table_6 ON (table_3.column_3 = table_6.column_1) LEFT JOIN table_7 ON (table_6.column_1 = table_7.column_1)
----
108 values hashing to ff26cf0928970b7e2ae36570fa1cf383

query  nosort
SELECT avg(table_6.column_4) AS alias_1, table_6.column_5 AS alias_2, table_8.column_2 AS alias_3, table_6.column_6 AS alias_4, table_9.column_2 AS alias_5 FROM table_6 INNER JOIN table_8 ON (table_6.column_4 = table_8.column_1) LEFT JOIN table_9 ON (table_6.column_4 = table_9.column_1) GROUP BY table_6.column_5, table_8.column_2, table_6.column_6, table_9.column_2
----
1.0000
1
1
1
1
