# Generated by:
#     target/debug/noria-logictest permute --compare-to mysql://root:noria@127.1/noria -d 3 -o logictests/generated/mysql/ --only range_param --random --include-deletes --rows-per-table 10 --subquery-depth 1 --overwrite-tests

statement ok
CREATE TABLE `table_1` (`column_5` INT, `column_4` INT, `column_2` INT, `column_3` INT, `column_1` INT, PRIMARY KEY (`column_5`))


statement ok
INSERT INTO `table_1` (`column_5`, `column_4`, `column_2`, `column_3`, `column_1`) VALUES (0, -1012762796, -556988629, 172869220, -1845289302), (1, 1013840679, -106029034, 1465207438, -810188457), (2, 1179021263, 544267056, 669498452, 1342811231), (3, 255991926, -1493774679, 1373219951, -517924246), (4, -1924117839, 1557637026, -2134610892, 208442031), (5, 790402397, 559935830, 226906093, 1709598084), (6, 1697574623, 1121991320, -655913447, -1537134937), (7, -297287961, -957904754, -985789383, 1998412899), (8, 1384517064, 987097887, -1472451497, 1507101705), (9, 1665609647, 869698013, 1407755395, -425916977)


query  rowsort
SELECT avg(distinct `table_1`.`column_1`) AS `alias_1` FROM `table_1`
----
162991203.1000

query  rowsort
SELECT 1 AS `alias_1`
----
1

query  rowsort
SELECT `table_1`.`column_1` AS `alias_1` FROM `table_1` WHERE (`table_1`.`column_1` > ?)
? = 10
----
1342811231
1507101705
1709598084
1998412899
208442031

query  rowsort
SELECT avg(distinct `table_1`.`column_2`) AS `alias_1`, 1 AS `alias_2` FROM `table_1`
----
252593003.6000
1

query  rowsort
SELECT avg(distinct `table_1`.`column_3`) AS `alias_1` FROM `table_1` WHERE (`table_1`.`column_2` > ?)
? = 10
----
-326469316.0000

query  rowsort
SELECT 1 AS `alias_1` FROM `table_1` WHERE (`table_1`.`column_2` > ?)
? = 10
----
1
1
1
1
1
1

query  rowsort
SELECT avg(distinct `table_1`.`column_4`) AS `alias_1`, 1 AS `alias_2` FROM `table_1` WHERE (`table_1`.`column_4` > ?)
? = 10
----
1140993942.7143
1

statement ok
DELETE FROM `table_1` WHERE (`column_5` = 0)


statement ok
DELETE FROM `table_1` WHERE (`column_5` = 1)


statement ok
DELETE FROM `table_1` WHERE (`column_5` = 2)


statement ok
DELETE FROM `table_1` WHERE (`column_5` = 3)


statement ok
DELETE FROM `table_1` WHERE (`column_5` = 4)


query  rowsort
SELECT avg(distinct `table_1`.`column_1`) AS `alias_1` FROM `table_1`
----
650412154.8000

query  rowsort
SELECT 1 AS `alias_1`
----
1

query  rowsort
SELECT `table_1`.`column_1` AS `alias_1` FROM `table_1` WHERE (`table_1`.`column_1` > ?)
? = 10
----
1507101705
1709598084
1998412899

query  rowsort
SELECT avg(distinct `table_1`.`column_2`) AS `alias_1`, 1 AS `alias_2` FROM `table_1`
----
516163659.2000
1

query  rowsort
SELECT avg(distinct `table_1`.`column_3`) AS `alias_1` FROM `table_1` WHERE (`table_1`.`column_2` > ?)
? = 10
----
-123425864.0000

query  rowsort
SELECT 1 AS `alias_1` FROM `table_1` WHERE (`table_1`.`column_2` > ?)
? = 10
----
1
1
1
1

query  rowsort
SELECT avg(distinct `table_1`.`column_4`) AS `alias_1`, 1 AS `alias_2` FROM `table_1` WHERE (`table_1`.`column_4` > ?)
? = 10
----
1384525932.7500
1
