# Generated by:
#     target/debug/noria-logictest permute --compare-to mysql://root:noria@127.1/noria -d 3 -o logictests/generated/mysql/ --only range_param --random --include-deletes --rows-per-table 10 --subquery-depth 1 --overwrite-tests

statement ok
CREATE TABLE `table_1` (`column_5` INT, `column_2` INT, `column_4` INT, `column_3` INT, `column_1` INT, PRIMARY KEY (`column_5`))


statement ok
INSERT INTO `table_1` (`column_5`, `column_2`, `column_4`, `column_3`, `column_1`) VALUES (0, -209623565, 4585752, -1378729176, 1133733716), (1, -1664643424, 1651532673, -1340906311, -2013452068), (2, 2018496459, 1504782586, -1792994215, 905209322), (3, 428874862, 1201130943, -1646133087, 158902624), (4, -2052417211, -539452485, -550220763, -1697872756), (5, -1568911883, -1453012296, -834411330, -1274730556), (6, -150361840, 1416320722, -551119198, 1819657357), (7, 291602941, 1871224581, -28756058, -97661563), (8, 17446320, 501828483, 404776367, 1810917932), (9, 1191490463, 790237599, 30926914, 542134048)


query  rowsort
SELECT avg(distinct `table_1`.`column_1`) AS `alias_1` FROM `table_1`
----
128683805.6000

query  rowsort
SELECT DISTINCT `table_1`.`column_1` AS `alias_1` FROM `table_1`
----
-1274730556
-1697872756
-2013452068
-97661563
1133733716
158902624
1810917932
1819657357
542134048
905209322

query  rowsort
SELECT `table_1`.`column_1` AS `alias_1` FROM `table_1` WHERE (`table_1`.`column_1` > ?)
? = 10
----
1133733716
158902624
1810917932
1819657357
542134048
905209322

query  rowsort
SELECT DISTINCT avg(distinct `table_1`.`column_2`) AS `alias_1` FROM `table_1`
----
-169804687.8000

query  rowsort
SELECT avg(distinct `table_1`.`column_3`) AS `alias_1` FROM `table_1` WHERE (`table_1`.`column_3` > ?)
? = 10
----
217851640.5000

query  rowsort
SELECT DISTINCT `table_1`.`column_3` AS `alias_1` FROM `table_1` WHERE (`table_1`.`column_3` > ?)
? = 10
----
30926914
404776367

query  rowsort
SELECT DISTINCT avg(distinct `table_1`.`column_4`) AS `alias_1` FROM `table_1` WHERE (`table_1`.`column_2` > ?)
? = 10
----
1173840838.4000

statement ok
DELETE FROM `table_1` WHERE (`column_5` = 0)


statement ok
DELETE FROM `table_1` WHERE (`column_5` = 1)


statement ok
DELETE FROM `table_1` WHERE (`column_5` = 2)


statement ok
DELETE FROM `table_1` WHERE (`column_5` = 3)


statement ok
DELETE FROM `table_1` WHERE (`column_5` = 4)


query  rowsort
SELECT avg(distinct `table_1`.`column_1`) AS `alias_1` FROM `table_1`
----
560063443.6000

query  rowsort
SELECT DISTINCT `table_1`.`column_1` AS `alias_1` FROM `table_1`
----
-1274730556
-97661563
1810917932
1819657357
542134048

query  rowsort
SELECT `table_1`.`column_1` AS `alias_1` FROM `table_1` WHERE (`table_1`.`column_1` > ?)
? = 10
----
1810917932
1819657357
542134048

query  rowsort
SELECT DISTINCT avg(distinct `table_1`.`column_2`) AS `alias_1` FROM `table_1`
----
-43746799.8000

query  rowsort
SELECT avg(distinct `table_1`.`column_3`) AS `alias_1` FROM `table_1` WHERE (`table_1`.`column_3` > ?)
? = 10
----
217851640.5000

query  rowsort
SELECT DISTINCT `table_1`.`column_3` AS `alias_1` FROM `table_1` WHERE (`table_1`.`column_3` > ?)
? = 10
----
30926914
404776367

query  rowsort
SELECT DISTINCT avg(distinct `table_1`.`column_4`) AS `alias_1` FROM `table_1` WHERE (`table_1`.`column_2` > ?)
? = 10
----
1054430221.0000
