# Generated by:
#     target/debug/noria-logictest permute --compare-to mysql://root:noria@127.1/noria -d 3 -o logictests/generated/mysql/ --only range_param --random --include-deletes --rows-per-table 10 --subquery-depth 1 --overwrite-tests

statement ok
CREATE TABLE `table_1` (`column_3` INT, `column_6` INT, `column_1` INT, `column_2` INT, `column_5` INT, `column_4` INT, `column_8` INT, `column_7` INT, `column_9` INT, PRIMARY KEY (`column_9`))


statement ok
INSERT INTO `table_1` (`column_3`, `column_6`, `column_1`, `column_2`, `column_5`, `column_4`, `column_8`, `column_7`, `column_9`) VALUES (1789736892, -125060680, 2137223643, 347141236, 205480267, -1931098613, 864187316, -502646, 0), (-2001342772, 881403694, 136742342, 1532976145, 44204634, -1049803672, -428089653, -535273676, 1), (1325799548, 1207289700, -1911202044, 1539990952, -1021904846, 177221552, 1639685261, -243201396, 2), (-286702211, 2005585257, 2114750059, 129274341, 494826043, -446960446, -1602316317, -1649394476, 3), (1319334521, 2064184187, 1252852533, 1432944571, 774070434, 1863317509, -555654424, -1259632524, 4), (1217493980, -1681497457, -2035054428, -72274019, 60733661, 1691141717, -807392448, 357363894, 5), (604197714, -864903823, -2063770354, -599640496, 944284386, 489730603, 422692601, 1314745358, 6), (486141221, -499543197, -1268661786, 1404006421, -490566325, 394231436, 1931810587, -594944051, 7), (1977067172, -1049285128, 175169351, 509319312, -774992157, -1109614484, 1343624657, -1124653644, 8), (1388792507, -1443245153, 621492169, -534240107, -528205542, 407979750, 1045813208, 1606379309, 9)


query  rowsort
SELECT count(distinct `table_1`.`column_1`) AS `alias_1` FROM `table_1`
----
10

query  rowsort
SELECT avg(`table_1`.`column_2`) AS `alias_1` FROM `table_1`
----
568949835.6000

query  rowsort
SELECT `table_1`.`column_1` AS `alias_1` FROM `table_1` WHERE (`table_1`.`column_1` > ?)
? = 10
----
1252852533
136742342
175169351
2114750059
2137223643
621492169

query  rowsort
SELECT count(distinct `table_1`.`column_3`) AS `alias_1`, avg(`table_1`.`column_4`) AS `alias_2` FROM `table_1`
----
10
48614535.2000

query  rowsort
SELECT count(distinct `table_1`.`column_5`) AS `alias_1` FROM `table_1` WHERE (`table_1`.`column_5` > ?)
? = 10
----
6

query  rowsort
SELECT avg(`table_1`.`column_6`) AS `alias_1` FROM `table_1` WHERE (`table_1`.`column_5` > ?)
? = 10
----
379951863.0000

query  rowsort
SELECT count(distinct `table_1`.`column_7`) AS `alias_1`, avg(`table_1`.`column_8`) AS `alias_2` FROM `table_1` WHERE (`table_1`.`column_3` > ?)
? = 10
----
8
735595844.7500

statement ok
DELETE FROM `table_1` WHERE (`column_9` = 0)


statement ok
DELETE FROM `table_1` WHERE (`column_9` = 1)


statement ok
DELETE FROM `table_1` WHERE (`column_9` = 2)


statement ok
DELETE FROM `table_1` WHERE (`column_9` = 3)


statement ok
DELETE FROM `table_1` WHERE (`column_9` = 4)


query  rowsort
SELECT count(distinct `table_1`.`column_1`) AS `alias_1` FROM `table_1`
----
5

query  rowsort
SELECT avg(`table_1`.`column_2`) AS `alias_1` FROM `table_1`
----
141434222.2000

query  rowsort
SELECT `table_1`.`column_1` AS `alias_1` FROM `table_1` WHERE (`table_1`.`column_1` > ?)
? = 10
----
175169351
621492169

query  rowsort
SELECT count(distinct `table_1`.`column_3`) AS `alias_1`, avg(`table_1`.`column_4`) AS `alias_2` FROM `table_1`
----
5
374693804.4000

query  rowsort
SELECT count(distinct `table_1`.`column_5`) AS `alias_1` FROM `table_1` WHERE (`table_1`.`column_5` > ?)
? = 10
----
2

query  rowsort
SELECT avg(`table_1`.`column_6`) AS `alias_1` FROM `table_1` WHERE (`table_1`.`column_5` > ?)
? = 10
----
-1273200640.0000

query  rowsort
SELECT count(distinct `table_1`.`column_7`) AS `alias_1`, avg(`table_1`.`column_8`) AS `alias_2` FROM `table_1` WHERE (`table_1`.`column_3` > ?)
? = 10
----
5
787309721.0000
