# Generated by:
#     target/debug/noria-logictest permute --compare-to mysql://root:noria@127.1/noria -d 3 -o logictests/generated/mysql/ --only range_param --random --include-deletes --rows-per-table 10 --subquery-depth 1 --overwrite-tests

statement ok
CREATE TABLE `table_1` (`column_3` INT, `column_5` INT, `column_2` INT, `column_4` INT, `column_1` INT, PRIMARY KEY (`column_5`))


statement ok
INSERT INTO `table_1` (`column_3`, `column_5`, `column_2`, `column_4`, `column_1`) VALUES (3868747, 0, -266146791, -1378099141, 1049511522), (1747761924, 1, 216224778, -495308708, 69274168), (313303891, 2, 404801599, 54937079, 1771389977), (-1892677737, 3, -1018168830, 665405813, -33047524), (421094140, 4, 720106506, 2125088778, -678487150), (1717690090, 5, -11143720, -1563460730, -951285671), (-1819732977, 6, 849565746, -1179428300, 1647700156), (-1295653802, 7, 1231506370, -1281450383, -37971557), (-1824589012, 8, -397316614, -1669794201, -1157604149), (1784574386, 9, 82290052, -1046420542, 827957322)


query  rowsort
SELECT count(`table_1`.`column_1`) AS `alias_1` FROM `table_1`
----
10

query  rowsort
SELECT DISTINCT `table_1`.`column_1` AS `alias_1` FROM `table_1`
----
-1157604149
-33047524
-37971557
-678487150
-951285671
1049511522
1647700156
1771389977
69274168
827957322

query  rowsort
SELECT `table_1`.`column_1` AS `alias_1` FROM `table_1` WHERE (`table_1`.`column_1` > ?)
? = 10
----
1049511522
1647700156
1771389977
69274168
827957322

query  rowsort
SELECT DISTINCT count(`table_1`.`column_2`) AS `alias_1` FROM `table_1`
----
10

query  rowsort
SELECT count(`table_1`.`column_3`) AS `alias_1` FROM `table_1` WHERE (`table_1`.`column_3` > ?)
? = 10
----
6

query  rowsort
SELECT DISTINCT `table_1`.`column_3` AS `alias_1` FROM `table_1` WHERE (`table_1`.`column_3` > ?)
? = 10
----
1717690090
1747761924
1784574386
313303891
3868747
421094140

query  rowsort
SELECT DISTINCT count(`table_1`.`column_4`) AS `alias_1` FROM `table_1` WHERE (`table_1`.`column_3` > ?)
? = 10
----
6

statement ok
DELETE FROM `table_1` WHERE (`column_5` = 0)


statement ok
DELETE FROM `table_1` WHERE (`column_5` = 1)


statement ok
DELETE FROM `table_1` WHERE (`column_5` = 2)


statement ok
DELETE FROM `table_1` WHERE (`column_5` = 3)


statement ok
DELETE FROM `table_1` WHERE (`column_5` = 4)


query  rowsort
SELECT count(`table_1`.`column_1`) AS `alias_1` FROM `table_1`
----
5

query  rowsort
SELECT DISTINCT `table_1`.`column_1` AS `alias_1` FROM `table_1`
----
-1157604149
-37971557
-951285671
1647700156
827957322

query  rowsort
SELECT `table_1`.`column_1` AS `alias_1` FROM `table_1` WHERE (`table_1`.`column_1` > ?)
? = 10
----
1647700156
827957322

query  rowsort
SELECT DISTINCT count(`table_1`.`column_2`) AS `alias_1` FROM `table_1`
----
5

query  rowsort
SELECT count(`table_1`.`column_3`) AS `alias_1` FROM `table_1` WHERE (`table_1`.`column_3` > ?)
? = 10
----
2

query  rowsort
SELECT DISTINCT `table_1`.`column_3` AS `alias_1` FROM `table_1` WHERE (`table_1`.`column_3` > ?)
? = 10
----
1717690090
1784574386

query  rowsort
SELECT DISTINCT count(`table_1`.`column_4`) AS `alias_1` FROM `table_1` WHERE (`table_1`.`column_3` > ?)
? = 10
----
2
