# Generated by:
#     target/debug/noria-logictest permute --compare-to mysql://root:noria@127.1/noria -d 3 -o logictests/generated/mysql/ --only range_param --random --include-deletes --rows-per-table 10 --subquery-depth 1

statement ok
CREATE TABLE `table_1` (`column_1` INT, `column_6` INT, `column_5` INT, `column_2` INT, `column_3` INT, `column_4` INT, PRIMARY KEY (`column_6`))


statement ok
INSERT INTO `table_1` (`column_1`, `column_6`, `column_5`, `column_2`, `column_3`, `column_4`) VALUES (-1338705784, 0, 901274263, -436490126, 1863402891, -485760846), (-341190158, 1, -241475694, 1776623115, -941084897, -30438550), (-2011915637, 2, -909194530, 825868774, 958214410, -1054575730), (1811791199, 3, -1373111707, -1689265992, 354504100, -1342517838), (1504719791, 4, 1355379125, -1513919533, 803138823, -125079645), (2033009841, 5, 1534551914, -162639884, -2073650409, -1319082881), (96892735, 6, 1675429485, -785340354, -707861980, -1976121711), (768005793, 7, -957699318, -668876295, -595194980, 167499052), (1261158863, 8, 1032500649, 547113940, 1923623463, -1653904701), (-309979798, 9, -646242844, -993013123, -1590611110, -1056067598)


query  rowsort
SELECT DISTINCT `table_1`.`column_1` AS `alias_1` FROM `table_1`
----
-1338705784
-2011915637
-309979798
-341190158
1261158863
1504719791
1811791199
2033009841
768005793
96892735

query  rowsort
SELECT count(distinct `table_1`.`column_2`) AS `alias_1` FROM `table_1`
----
10

query  rowsort
SELECT `table_1`.`column_1` AS `alias_1` FROM `table_1` WHERE (`table_1`.`column_1` > ?)
? = 10
----
1261158863
1504719791
1811791199
2033009841
768005793
96892735

query  rowsort
SELECT DISTINCT count(distinct `table_1`.`column_3`) AS `alias_1` FROM `table_1`
----
10

query  rowsort
SELECT DISTINCT `table_1`.`column_1` AS `alias_1` FROM `table_1` WHERE (`table_1`.`column_1` > ?)
? = 10
----
1261158863
1504719791
1811791199
2033009841
768005793
96892735

query  rowsort
SELECT count(distinct `table_1`.`column_4`) AS `alias_1` FROM `table_1` WHERE (`table_1`.`column_1` > ?)
? = 10
----
6

query  rowsort
SELECT DISTINCT count(distinct `table_1`.`column_5`) AS `alias_1` FROM `table_1` WHERE (`table_1`.`column_1` > ?)
? = 10
----
6

statement ok
DELETE FROM `table_1` WHERE (`column_6` = 0)


statement ok
DELETE FROM `table_1` WHERE (`column_6` = 1)


statement ok
DELETE FROM `table_1` WHERE (`column_6` = 2)


statement ok
DELETE FROM `table_1` WHERE (`column_6` = 3)


statement ok
DELETE FROM `table_1` WHERE (`column_6` = 4)


query  rowsort
SELECT DISTINCT `table_1`.`column_1` AS `alias_1` FROM `table_1`
----
-309979798
1261158863
2033009841
768005793
96892735

query  rowsort
SELECT count(distinct `table_1`.`column_2`) AS `alias_1` FROM `table_1`
----
5

query  rowsort
SELECT `table_1`.`column_1` AS `alias_1` FROM `table_1` WHERE (`table_1`.`column_1` > ?)
? = 10
----
1261158863
2033009841
768005793
96892735

query  rowsort
SELECT DISTINCT count(distinct `table_1`.`column_3`) AS `alias_1` FROM `table_1`
----
5

query  rowsort
SELECT DISTINCT `table_1`.`column_1` AS `alias_1` FROM `table_1` WHERE (`table_1`.`column_1` > ?)
? = 10
----
1261158863
2033009841
768005793
96892735

query  rowsort
SELECT count(distinct `table_1`.`column_4`) AS `alias_1` FROM `table_1` WHERE (`table_1`.`column_1` > ?)
? = 10
----
4

query  rowsort
SELECT DISTINCT count(distinct `table_1`.`column_5`) AS `alias_1` FROM `table_1` WHERE (`table_1`.`column_1` > ?)
? = 10
----
4
