# Generated by:
#     target/debug/noria-logictest permute --compare-to mysql://root:noria@127.1/noria -d 3 -o logictests/generated/mysql/ --only range_param --random --include-deletes --rows-per-table 10 --subquery-depth 1

statement ok
CREATE TABLE `table_1` (`column_1` INT, `column_2` INT, `column_5` INT, `column_6` INT, `column_4` INT, `column_3` INT, PRIMARY KEY (`column_6`))


statement ok
INSERT INTO `table_1` (`column_1`, `column_2`, `column_5`, `column_6`, `column_4`, `column_3`) VALUES (1099265152, 629743002, -2072012159, 0, 2000782777, 625674818), (353644141, 1144743532, 28512583, 1, 109020658, 1152520131), (1729018549, -541608305, -1464893980, 2, -111345314, 412107763), (-592355703, -1525185793, -1933275898, 3, 1823148075, -498940526), (598858687, 1601928487, -1871504090, 4, 1012425250, 1478309891), (1206278864, 691558263, 257467970, 5, -389388868, -1662288379), (293589026, 1602060182, 201414809, 6, 1791028114, -74002617), (-1944787156, -1923792675, 1406877725, 7, 649526174, -2060576000), (-1701986720, -2087557226, -1839322981, 8, -221625188, -972836705), (-161590953, -1932809536, 940866503, 9, -1567118317, -227368724)


query  rowsort
SELECT DISTINCT `table_1`.`column_1` AS `alias_1` FROM `table_1`
----
-161590953
-1701986720
-1944787156
-592355703
1099265152
1206278864
1729018549
293589026
353644141
598858687

query  rowsort
SELECT max(`table_1`.`column_2`) AS `alias_1` FROM `table_1`
----
1602060182

query  rowsort
SELECT `table_1`.`column_1` AS `alias_1` FROM `table_1` WHERE (`table_1`.`column_1` > ?)
? = 10
----
1099265152
1206278864
1729018549
293589026
353644141
598858687

query  rowsort
SELECT DISTINCT max(`table_1`.`column_3`) AS `alias_1` FROM `table_1`
----
1478309891

query  rowsort
SELECT DISTINCT `table_1`.`column_1` AS `alias_1` FROM `table_1` WHERE (`table_1`.`column_1` > ?)
? = 10
----
1099265152
1206278864
1729018549
293589026
353644141
598858687

query  rowsort
SELECT max(`table_1`.`column_4`) AS `alias_1` FROM `table_1` WHERE (`table_1`.`column_1` > ?)
? = 10
----
2000782777

query  rowsort
SELECT DISTINCT max(`table_1`.`column_5`) AS `alias_1` FROM `table_1` WHERE (`table_1`.`column_1` > ?)
? = 10
----
257467970

statement ok
DELETE FROM `table_1` WHERE (`column_6` = 0)


statement ok
DELETE FROM `table_1` WHERE (`column_6` = 1)


statement ok
DELETE FROM `table_1` WHERE (`column_6` = 2)


statement ok
DELETE FROM `table_1` WHERE (`column_6` = 3)


statement ok
DELETE FROM `table_1` WHERE (`column_6` = 4)


query  rowsort
SELECT DISTINCT `table_1`.`column_1` AS `alias_1` FROM `table_1`
----
-161590953
-1701986720
-1944787156
1206278864
293589026

query  rowsort
SELECT max(`table_1`.`column_2`) AS `alias_1` FROM `table_1`
----
1602060182

query  rowsort
SELECT `table_1`.`column_1` AS `alias_1` FROM `table_1` WHERE (`table_1`.`column_1` > ?)
? = 10
----
1206278864
293589026

query  rowsort
SELECT DISTINCT max(`table_1`.`column_3`) AS `alias_1` FROM `table_1`
----
-74002617

query  rowsort
SELECT DISTINCT `table_1`.`column_1` AS `alias_1` FROM `table_1` WHERE (`table_1`.`column_1` > ?)
? = 10
----
1206278864
293589026

query  rowsort
SELECT max(`table_1`.`column_4`) AS `alias_1` FROM `table_1` WHERE (`table_1`.`column_1` > ?)
? = 10
----
1791028114

query  rowsort
SELECT DISTINCT max(`table_1`.`column_5`) AS `alias_1` FROM `table_1` WHERE (`table_1`.`column_1` > ?)
? = 10
----
257467970
