# Generated by:
#     target/debug/noria-logictest permute --compare-to mysql://root:noria@127.1/noria -d 3 -o logictests/generated/mysql/ --only range_param --random --include-deletes --rows-per-table 10 --subquery-depth 1

statement ok
CREATE TABLE `table_1` (`column_1` INT, `column_2` INT, PRIMARY KEY (`column_2`))


statement ok
INSERT INTO `table_1` (`column_1`, `column_2`) VALUES (-252363178, 0), (1642254980, 1), (186226259, 2), (-1640270621, 3), (-1523841366, 4), (557763238, 5), (368757200, 6), (-1203428146, 7), (-977890965, 8), (-422778418, 9)


query  rowsort
SELECT DISTINCT `table_1`.`column_1` AS `alias_3` FROM `table_1` INNER JOIN (SELECT DISTINCT `table_1`.`column_1` AS `alias_1` FROM `table_1`) AS alias_2 ON (`table_1`.`column_1` = `alias_2`.`alias_1`)
----
-1203428146
-1523841366
-1640270621
-252363178
-422778418
-977890965
1642254980
186226259
368757200
557763238

query  rowsort
SELECT DISTINCT `table_1`.`column_1` AS `alias_3` FROM `table_1` INNER JOIN (SELECT `table_1`.`column_1` AS `alias_1` FROM `table_1`) AS alias_2 ON (`table_1`.`column_1` = `alias_2`.`alias_1`)
----
-1203428146
-1523841366
-1640270621
-252363178
-422778418
-977890965
1642254980
186226259
368757200
557763238

query  rowsort
SELECT DISTINCT `table_1`.`column_1` AS `alias_3` FROM `table_1` INNER JOIN (SELECT DISTINCT `table_1`.`column_1` AS `alias_1` FROM `table_1`) AS alias_2 ON (`table_1`.`column_1` = `alias_2`.`alias_1`)
----
-1203428146
-1523841366
-1640270621
-252363178
-422778418
-977890965
1642254980
186226259
368757200
557763238

query  rowsort
SELECT `table_1`.`column_1` AS `alias_3` FROM `table_1` INNER JOIN (SELECT DISTINCT `table_1`.`column_1` AS `alias_1` FROM `table_1`) AS alias_2 ON (`table_1`.`column_1` = `alias_2`.`alias_1`) WHERE (`table_1`.`column_1` > ?)
? = 10
----
1642254980
186226259
368757200
557763238

query  rowsort
SELECT `table_1`.`column_1` AS `alias_3` FROM `table_1` INNER JOIN (SELECT `table_1`.`column_1` AS `alias_1` FROM `table_1`) AS alias_2 ON (`table_1`.`column_1` = `alias_2`.`alias_1`) WHERE (`table_1`.`column_1` > ?)
? = 10
----
1642254980
186226259
368757200
557763238

query  rowsort
SELECT `table_1`.`column_1` AS `alias_3` FROM `table_1` INNER JOIN (SELECT DISTINCT `table_1`.`column_1` AS `alias_1` FROM `table_1`) AS alias_2 ON (`table_1`.`column_1` = `alias_2`.`alias_1`) WHERE (`table_1`.`column_1` > ?)
? = 10
----
1642254980
186226259
368757200
557763238

query  rowsort
SELECT DISTINCT `table_1`.`column_1` AS `alias_3` FROM `table_1` INNER JOIN (SELECT DISTINCT `table_1`.`column_1` AS `alias_1` FROM `table_1`) AS alias_2 ON (`table_1`.`column_1` = `alias_2`.`alias_1`) WHERE (`table_1`.`column_1` > ?)
? = 10
----
1642254980
186226259
368757200
557763238

query  rowsort
SELECT DISTINCT `table_1`.`column_1` AS `alias_3` FROM `table_1` INNER JOIN (SELECT `table_1`.`column_1` AS `alias_1` FROM `table_1`) AS alias_2 ON (`table_1`.`column_1` = `alias_2`.`alias_1`) WHERE (`table_1`.`column_1` > ?)
? = 10
----
1642254980
186226259
368757200
557763238

query  rowsort
SELECT DISTINCT `table_1`.`column_1` AS `alias_3` FROM `table_1` INNER JOIN (SELECT DISTINCT `table_1`.`column_1` AS `alias_1` FROM `table_1`) AS alias_2 ON (`table_1`.`column_1` = `alias_2`.`alias_1`) WHERE (`table_1`.`column_1` > ?)
? = 10
----
1642254980
186226259
368757200
557763238

statement ok
DELETE FROM `table_1` WHERE (`column_2` = 0)


statement ok
DELETE FROM `table_1` WHERE (`column_2` = 1)


statement ok
DELETE FROM `table_1` WHERE (`column_2` = 2)


statement ok
DELETE FROM `table_1` WHERE (`column_2` = 3)


statement ok
DELETE FROM `table_1` WHERE (`column_2` = 4)


query  rowsort
SELECT DISTINCT `table_1`.`column_1` AS `alias_3` FROM `table_1` INNER JOIN (SELECT DISTINCT `table_1`.`column_1` AS `alias_1` FROM `table_1`) AS alias_2 ON (`table_1`.`column_1` = `alias_2`.`alias_1`)
----
-1203428146
-422778418
-977890965
368757200
557763238

query  rowsort
SELECT DISTINCT `table_1`.`column_1` AS `alias_3` FROM `table_1` INNER JOIN (SELECT `table_1`.`column_1` AS `alias_1` FROM `table_1`) AS alias_2 ON (`table_1`.`column_1` = `alias_2`.`alias_1`)
----
-1203428146
-422778418
-977890965
368757200
557763238

query  rowsort
SELECT DISTINCT `table_1`.`column_1` AS `alias_3` FROM `table_1` INNER JOIN (SELECT DISTINCT `table_1`.`column_1` AS `alias_1` FROM `table_1`) AS alias_2 ON (`table_1`.`column_1` = `alias_2`.`alias_1`)
----
-1203428146
-422778418
-977890965
368757200
557763238

query  rowsort
SELECT `table_1`.`column_1` AS `alias_3` FROM `table_1` INNER JOIN (SELECT DISTINCT `table_1`.`column_1` AS `alias_1` FROM `table_1`) AS alias_2 ON (`table_1`.`column_1` = `alias_2`.`alias_1`) WHERE (`table_1`.`column_1` > ?)
? = 10
----
368757200
557763238

query  rowsort
SELECT `table_1`.`column_1` AS `alias_3` FROM `table_1` INNER JOIN (SELECT `table_1`.`column_1` AS `alias_1` FROM `table_1`) AS alias_2 ON (`table_1`.`column_1` = `alias_2`.`alias_1`) WHERE (`table_1`.`column_1` > ?)
? = 10
----
368757200
557763238

query  rowsort
SELECT `table_1`.`column_1` AS `alias_3` FROM `table_1` INNER JOIN (SELECT DISTINCT `table_1`.`column_1` AS `alias_1` FROM `table_1`) AS alias_2 ON (`table_1`.`column_1` = `alias_2`.`alias_1`) WHERE (`table_1`.`column_1` > ?)
? = 10
----
368757200
557763238

query  rowsort
SELECT DISTINCT `table_1`.`column_1` AS `alias_3` FROM `table_1` INNER JOIN (SELECT DISTINCT `table_1`.`column_1` AS `alias_1` FROM `table_1`) AS alias_2 ON (`table_1`.`column_1` = `alias_2`.`alias_1`) WHERE (`table_1`.`column_1` > ?)
? = 10
----
368757200
557763238

query  rowsort
SELECT DISTINCT `table_1`.`column_1` AS `alias_3` FROM `table_1` INNER JOIN (SELECT `table_1`.`column_1` AS `alias_1` FROM `table_1`) AS alias_2 ON (`table_1`.`column_1` = `alias_2`.`alias_1`) WHERE (`table_1`.`column_1` > ?)
? = 10
----
368757200
557763238

query  rowsort
SELECT DISTINCT `table_1`.`column_1` AS `alias_3` FROM `table_1` INNER JOIN (SELECT DISTINCT `table_1`.`column_1` AS `alias_1` FROM `table_1`) AS alias_2 ON (`table_1`.`column_1` = `alias_2`.`alias_1`) WHERE (`table_1`.`column_1` > ?)
? = 10
----
368757200
557763238
