# Generated by:
#     target/debug/noria-logictest generate --operations equal_filters,inner_join --compare-to mysql://root@localhost/mysql --subquery-depth 1 --rows-per-table 5 -o logictests/generated/equal_filters,inner_join.test --include-deletes
# failure: ENG-332

statement ok
CREATE TABLE table_4 (column_13 INT(32), column_25 INT(32), column_24 INT(32), column_4 INT(32), column_28 INT(32), column_3 INT(1), column_26 INT(32), column_8 INT(32), column_11 INT(32), column_10 INT(32), column_16 INT(32), column_19 INT(32), column_17 INT(32), column_30 INT(32), column_15 INT(32), column_31 INT(32), column_2 INT(32), column_20 INT(32), column_21 INT(32), column_14 INT(32), column_6 INT(32), column_12 INT(32), column_18 INT(32), column_9 INT(32), column_7 INT(32), column_27 INT(32), column_5 INT(32), column_22 INT(32), column_23 INT(32), column_1 INT(32), column_29 INT(32), PRIMARY KEY (column_31))


statement ok
CREATE TABLE table_17 (column_2 INT(32), column_1 INT(32), column_3 INT(32), PRIMARY KEY (column_3))


statement ok
CREATE TABLE table_2 (column_3 INT(1), column_8 INT(32), column_5 INT(32), column_6 INT(32), column_9 INT(32), column_1 INT(32), column_7 INT(32), column_10 INT(32), column_2 INT(32), column_4 INT(32), PRIMARY KEY (column_10))


statement ok
CREATE TABLE table_7 (column_3 INT(32), column_2 INT(32), column_1 INT(32), PRIMARY KEY (column_3))


statement ok
CREATE TABLE table_16 (column_1 INT(32), column_3 INT(32), column_2 INT(32), PRIMARY KEY (column_3))


statement ok
CREATE TABLE table_12 (column_2 INT(32), column_3 INT(32), column_1 INT(32), PRIMARY KEY (column_3))


statement ok
CREATE TABLE table_10 (column_2 INT(32), column_1 INT(32), column_3 INT(32), PRIMARY KEY (column_3))


statement ok
CREATE TABLE table_8 (column_1 INT(32), column_2 INT(32), column_3 INT(32), PRIMARY KEY (column_3))


statement ok
CREATE TABLE table_15 (column_2 INT(32), column_3 INT(32), column_1 INT(32), PRIMARY KEY (column_3))


statement ok
CREATE TABLE table_6 (column_3 INT(32), column_1 INT(32), column_2 INT(32), PRIMARY KEY (column_3))


statement ok
CREATE TABLE table_9 (column_1 INT(32), column_2 INT(32), column_3 INT(32), PRIMARY KEY (column_3))


statement ok
CREATE TABLE table_13 (column_1 INT(32), column_3 INT(32), column_2 INT(32), PRIMARY KEY (column_3))


statement ok
CREATE TABLE table_14 (column_1 INT(32), column_2 INT(32), column_3 INT(32), PRIMARY KEY (column_3))


statement ok
CREATE TABLE table_1 (column_1 INT(1), column_4 INT(32), column_3 INT(32), column_2 INT(32), column_5 INT(32), PRIMARY KEY (column_5))


statement ok
CREATE TABLE table_11 (column_3 INT(1), column_12 INT(32), column_15 INT(32), column_8 INT(32), column_5 INT(32), column_1 INT(32), column_7 INT(32), column_11 INT(32), column_10 INT(32), column_4 INT(32), column_14 INT(32), column_6 INT(32), column_2 INT(32), column_9 INT(32), column_13 INT(32), column_16 INT(32), PRIMARY KEY (column_16))


statement ok
CREATE TABLE table_3 (column_1 INT(32), column_2 INT(32), column_3 INT(32), PRIMARY KEY (column_3))


statement ok
CREATE TABLE table_5 (column_2 INT(32), column_3 INT(32), column_1 INT(32), PRIMARY KEY (column_3))


statement ok
INSERT INTO table_4 (column_24, column_9, column_5, column_12, column_26, column_25, column_10, column_4, column_3, column_28, column_19, column_17, column_20, column_14, column_27, column_23, column_1, column_30, column_29, column_15, column_6, column_16, column_21, column_18, column_11, column_7, column_8, column_22, column_31, column_13, column_2) VALUES (1, 1, 1, 1, 1, 1, 1, 1, 1, 1, 1, 1, 1, 1, 1, 1, 1, 1, 1, 1, 1, 1, 1, 1, 1, 1, 1, 1, 2, 1, 1), (1, 1, 1, 1, 1, 1, 1, 1, 1, 1, 1, 1, 1, 1, 1, 1, 1, 1, 1, 1, 1, 1, 1, 1, 1, 1, 1, 1, 3, 1, 1), (1, 1, 1, 1, 1, 1, 1, 1, 1, 1, 1, 1, 1, 1, 1, 1, 1, 1, 1, 1, 1, 1, 1, 1, 1, 1, 1, 1, 4, 1, 1), (1, 1, 1, 1, 1, 1, 1, 1, 1, 1, 1, 1, 1, 1, 1, 1, 1, 1, 1, 1, 1, 1, 1, 1, 1, 1, 1, 1, 5, 1, 1), (1, 1, 1, 1, 1, 1, 1, 1, 1, 1, 1, 1, 1, 1, 1, 1, 1, 1, 1, 1, 1, 1, 1, 1, 1, 1, 1, 1, 6, 1, 1)


statement ok
INSERT INTO table_17 (column_3, column_1, column_2) VALUES (2, 1, 1), (3, 1, 1), (4, 1, 1), (5, 1, 1), (6, 1, 1)


statement ok
INSERT INTO table_2 (column_6, column_7, column_9, column_10, column_2, column_5, column_4, column_8, column_1, column_3) VALUES (1, 1, 1, 2, 1, 1, 1, 1, 1, 1), (1, 1, 1, 3, 1, 1, 1, 1, 1, 1), (1, 1, 1, 4, 1, 1, 1, 1, 1, 1), (1, 1, 1, 5, 1, 1, 1, 1, 1, 1), (1, 1, 1, 6, 1, 1, 1, 1, 1, 1)


statement ok
INSERT INTO table_7 (column_3, column_2, column_1) VALUES (2, 1, 1), (3, 1, 1), (4, 1, 1), (5, 1, 1), (6, 1, 1)


statement ok
INSERT INTO table_16 (column_1, column_2, column_3) VALUES (1, 1, 2), (1, 1, 3), (1, 1, 4), (1, 1, 5), (1, 1, 6)


statement ok
INSERT INTO table_12 (column_2, column_1, column_3) VALUES (1, 1, 2), (1, 1, 3), (1, 1, 4), (1, 1, 5), (1, 1, 6)


statement ok
INSERT INTO table_10 (column_3, column_2, column_1) VALUES (2, 1, 1), (3, 1, 1), (4, 1, 1), (5, 1, 1), (6, 1, 1)


statement ok
INSERT INTO table_8 (column_1, column_3, column_2) VALUES (1, 2, 1), (1, 3, 1), (1, 4, 1), (1, 5, 1), (1, 6, 1)


statement ok
INSERT INTO table_15 (column_1, column_3, column_2) VALUES (1, 2, 1), (1, 3, 1), (1, 4, 1), (1, 5, 1), (1, 6, 1)


statement ok
INSERT INTO table_6 (column_1, column_2, column_3) VALUES (1, 1, 2), (1, 1, 3), (1, 1, 4), (1, 1, 5), (1, 1, 6)


statement ok
INSERT INTO table_9 (column_2, column_1, column_3) VALUES (1, 1, 2), (1, 1, 3), (1, 1, 4), (1, 1, 5), (1, 1, 6)


statement ok
INSERT INTO table_13 (column_3, column_1, column_2) VALUES (2, 1, 1), (3, 1, 1), (4, 1, 1), (5, 1, 1), (6, 1, 1)


statement ok
INSERT INTO table_14 (column_2, column_1, column_3) VALUES (1, 1, 2), (1, 1, 3), (1, 1, 4), (1, 1, 5), (1, 1, 6)


statement ok
INSERT INTO table_1 (column_3, column_5, column_1, column_4, column_2) VALUES (1, 2, 1, 1, 1), (1, 3, 1, 1, 1), (1, 4, 1, 1, 1), (1, 5, 1, 1, 1), (1, 6, 1, 1, 1)


statement ok
INSERT INTO table_11 (column_2, column_13, column_8, column_16, column_6, column_12, column_1, column_9, column_5, column_7, column_3, column_15, column_11, column_10, column_4, column_14) VALUES (1, 1, 1, 2, 1, 1, 1, 1, 1, 1, 1, 1, 1, 1, 1, 1), (1, 1, 1, 3, 1, 1, 1, 1, 1, 1, 1, 1, 1, 1, 1, 1), (1, 1, 1, 4, 1, 1, 1, 1, 1, 1, 1, 1, 1, 1, 1, 1), (1, 1, 1, 5, 1, 1, 1, 1, 1, 1, 1, 1, 1, 1, 1, 1), (1, 1, 1, 6, 1, 1, 1, 1, 1, 1, 1, 1, 1, 1, 1, 1)


statement ok
INSERT INTO table_3 (column_1, column_2, column_3) VALUES (1, 1, 2), (1, 1, 3), (1, 1, 4), (1, 1, 5), (1, 1, 6)


statement ok
INSERT INTO table_5 (column_3, column_1, column_2) VALUES (2, 1, 1), (3, 1, 1), (4, 1, 1), (5, 1, 1), (6, 1, 1)


query  nosort
SELECT table_1.column_1 AS alias_1 FROM table_1 WHERE (table_1.column_1 = 1)
----
1
1
1
1
1

query  nosort
SELECT table_1.column_1 AS alias_1 FROM table_1 WHERE (table_1.column_1 = 1)
----
1
1
1
1
1

query  nosort
SELECT table_1.column_1 AS alias_1 FROM table_1 WHERE (table_1.column_1 = table_1.column_2)
----
1
1
1
1
1

query  nosort
SELECT table_1.column_1 AS alias_1 FROM table_1 WHERE (table_1.column_1 = table_1.column_3)
----
1
1
1
1
1

query  nosort
SELECT table_1.column_4 AS alias_1, table_2.column_2 AS alias_2 FROM table_1 INNER JOIN table_2 ON (table_1.column_3 = table_2.column_1)
----
50 values hashing to 1f4709ccf33e9b44d9c58ab63929bdf1

query  nosort
SELECT table_2.column_3 AS alias_1, table_2.column_3 AS alias_2 FROM table_2 WHERE ((table_2.column_3 = 1) OR (table_2.column_3 = 1))
----
1
1
1
1
1
1
1
1
1
1

query  nosort
SELECT table_2.column_3 AS alias_1, table_2.column_3 AS alias_2 FROM table_2 WHERE ((table_2.column_3 = 1) AND (table_2.column_3 = table_2.column_4))
----
1
1
1
1
1
1
1
1
1
1

query  nosort
SELECT table_2.column_3 AS alias_1, table_2.column_3 AS alias_2 FROM table_2 WHERE ((table_2.column_3 = 1) OR (table_2.column_3 = table_2.column_5))
----
1
1
1
1
1
1
1
1
1
1

query  nosort
SELECT table_2.column_3 AS alias_1, table_2.column_6 AS alias_2, table_3.column_2 AS alias_3 FROM table_2 INNER JOIN table_3 ON (table_2.column_1 = table_3.column_1) WHERE (table_2.column_3 = 1)
----
75 values hashing to f7f374e7b867af1aa4821514f1b96d8c

query  nosort
SELECT table_2.column_3 AS alias_1, table_2.column_3 AS alias_2 FROM table_2 WHERE ((table_2.column_3 = 1) AND (table_2.column_3 = table_2.column_7))
----
1
1
1
1
1
1
1
1
1
1

query  nosort
SELECT table_2.column_3 AS alias_1, table_2.column_3 AS alias_2 FROM table_2 WHERE ((table_2.column_3 = 1) OR (table_2.column_3 = table_2.column_8))
----
1
1
1
1
1
1
1
1
1
1

query  nosort
SELECT table_2.column_3 AS alias_1, table_2.column_9 AS alias_2, table_4.column_2 AS alias_3 FROM table_2 INNER JOIN table_4 ON (table_2.column_8 = table_4.column_1) WHERE (table_2.column_3 = 1)
----
75 values hashing to f7f374e7b867af1aa4821514f1b96d8c

query  nosort
SELECT table_4.column_3 AS alias_1, table_4.column_3 AS alias_2 FROM table_4 WHERE ((table_4.column_3 = table_4.column_4) OR (table_4.column_3 = table_4.column_5))
----
1
1
1
1
1
1
1
1
1
1

query  nosort
SELECT table_4.column_3 AS alias_1, table_4.column_7 AS alias_2, table_5.column_2 AS alias_3 FROM table_4 INNER JOIN table_5 ON (table_4.column_2 = table_5.column_1) WHERE (table_4.column_3 = table_4.column_6)
----
75 values hashing to f7f374e7b867af1aa4821514f1b96d8c

query  nosort
SELECT table_4.column_3 AS alias_1, table_4.column_9 AS alias_2, table_6.column_2 AS alias_3 FROM table_4 INNER JOIN table_6 ON (table_4.column_6 = table_6.column_1) WHERE (table_4.column_3 = table_4.column_8)
----
75 values hashing to f7f374e7b867af1aa4821514f1b96d8c

query  nosort
SELECT table_4.column_3 AS alias_1, table_4.column_3 AS alias_2, table_4.column_3 AS alias_3 FROM table_4 WHERE (((table_4.column_3 = 1) OR (table_4.column_3 = 1)) AND (table_4.column_3 = table_4.column_10))
----
1
1
1
1
1
1
1
1
1
1
1
1
1
1
1

query  nosort
SELECT table_4.column_3 AS alias_1, table_4.column_3 AS alias_2, table_4.column_3 AS alias_3 FROM table_4 WHERE (((table_4.column_3 = 1) OR (table_4.column_3 = 1)) OR (table_4.column_3 = table_4.column_11))
----
1
1
1
1
1
1
1
1
1
1
1
1
1
1
1

query  nosort
SELECT table_4.column_3 AS alias_1, table_4.column_3 AS alias_2, table_4.column_12 AS alias_3, table_7.column_2 AS alias_4 FROM table_4 INNER JOIN table_7 ON (table_4.column_11 = table_7.column_1) WHERE ((table_4.column_3 = 1) OR (table_4.column_3 = 1))
----
100 values hashing to 2bd4fea509b32167eb41d148e293355c

query  nosort
SELECT table_4.column_3 AS alias_1, table_4.column_3 AS alias_2, table_4.column_3 AS alias_3 FROM table_4 WHERE (((table_4.column_3 = 1) AND (table_4.column_3 = table_4.column_13)) OR (table_4.column_3 = table_4.column_14))
----
1
1
1
1
1
1
1
1
1
1
1
1
1
1
1

query  nosort
SELECT table_4.column_3 AS alias_1, table_4.column_3 AS alias_2, table_4.column_16 AS alias_3, table_8.column_2 AS alias_4 FROM table_4 INNER JOIN table_8 ON (table_4.column_13 = table_8.column_1) WHERE ((table_4.column_3 = 1) AND (table_4.column_3 = table_4.column_15))
----
100 values hashing to 2bd4fea509b32167eb41d148e293355c

query  nosort
SELECT table_4.column_3 AS alias_1, table_4.column_3 AS alias_2, table_4.column_18 AS alias_3, table_9.column_2 AS alias_4 FROM table_4 INNER JOIN table_9 ON (table_4.column_13 = table_9.column_1) WHERE ((table_4.column_3 = 1) OR (table_4.column_3 = table_4.column_17))
----
100 values hashing to 2bd4fea509b32167eb41d148e293355c

query  nosort
SELECT table_4.column_3 AS alias_1, table_4.column_3 AS alias_2, table_4.column_3 AS alias_3 FROM table_4 WHERE (((table_4.column_3 = 1) AND (table_4.column_3 = table_4.column_19)) OR (table_4.column_3 = table_4.column_20))
----
1
1
1
1
1
1
1
1
1
1
1
1
1
1
1

query  nosort
SELECT table_4.column_3 AS alias_1, table_4.column_3 AS alias_2, table_4.column_22 AS alias_3, table_10.column_2 AS alias_4 FROM table_4 INNER JOIN table_10 ON (table_4.column_13 = table_10.column_1) WHERE ((table_4.column_3 = 1) AND (table_4.column_3 = table_4.column_21))
----
100 values hashing to 2bd4fea509b32167eb41d148e293355c

query  nosort
SELECT table_4.column_3 AS alias_1, table_4.column_3 AS alias_2, table_4.column_24 AS alias_3, table_11.column_2 AS alias_4 FROM table_4 INNER JOIN table_11 ON (table_4.column_13 = table_11.column_1) WHERE ((table_4.column_3 = 1) OR (table_4.column_3 = table_4.column_23))
----
100 values hashing to 2bd4fea509b32167eb41d148e293355c

query  nosort
SELECT table_11.column_3 AS alias_1, table_11.column_3 AS alias_2, table_11.column_6 AS alias_3, table_12.column_2 AS alias_4 FROM table_11 INNER JOIN table_12 ON (table_11.column_1 = table_12.column_1) WHERE ((table_11.column_3 = table_11.column_4) OR (table_11.column_3 = table_11.column_5))
----
100 values hashing to 2bd4fea509b32167eb41d148e293355c

query  nosort
SELECT table_11.column_3 AS alias_1, table_11.column_3 AS alias_2, table_11.column_3 AS alias_3, table_11.column_3 AS alias_4 FROM table_11 WHERE ((((table_11.column_3 = 1) OR (table_11.column_3 = 1)) AND (table_11.column_3 = table_11.column_7)) OR (table_11.column_3 = table_11.column_8))
----
1
1
1
1
1
1
1
1
1
1
1
1
1
1
1
1
1
1
1
1

query  nosort
SELECT table_11.column_3 AS alias_1, table_11.column_3 AS alias_2, table_11.column_3 AS alias_3, table_11.column_10 AS alias_4, table_13.column_2 AS alias_5 FROM table_11 INNER JOIN table_13 ON (table_11.column_4 = table_13.column_1) WHERE (((table_11.column_3 = 1) OR (table_11.column_3 = 1)) AND (table_11.column_3 = table_11.column_9))
----
125 values hashing to 5abf30bf0129095ac01cfe68e7985b65

query  nosort
SELECT table_11.column_3 AS alias_1, table_11.column_3 AS alias_2, table_11.column_3 AS alias_3, table_11.column_12 AS alias_4, table_14.column_2 AS alias_5 FROM table_11 INNER JOIN table_14 ON (table_11.column_10 = table_14.column_1) WHERE (((table_11.column_3 = 1) OR (table_11.column_3 = 1)) OR (table_11.column_3 = table_11.column_11))
----
125 values hashing to 5abf30bf0129095ac01cfe68e7985b65

query  nosort
SELECT table_11.column_3 AS alias_1, table_11.column_3 AS alias_2, table_11.column_3 AS alias_3, table_11.column_15 AS alias_4, table_15.column_2 AS alias_5 FROM table_11 INNER JOIN table_15 ON (table_11.column_10 = table_15.column_1) WHERE (((table_11.column_3 = 1) AND (table_11.column_3 = table_11.column_13)) OR (table_11.column_3 = table_11.column_14))
----
125 values hashing to 5abf30bf0129095ac01cfe68e7985b65

query  nosort
SELECT table_4.column_3 AS alias_1, table_4.column_3 AS alias_2, table_4.column_3 AS alias_3, table_4.column_27 AS alias_4, table_16.column_2 AS alias_5 FROM table_4 INNER JOIN table_16 ON (table_4.column_13 = table_16.column_1) WHERE (((table_4.column_3 = 1) AND (table_4.column_3 = table_4.column_25)) OR (table_4.column_3 = table_4.column_26))
----
125 values hashing to 5abf30bf0129095ac01cfe68e7985b65

query  nosort
SELECT table_4.column_3 AS alias_1, table_4.column_3 AS alias_2, table_4.column_3 AS alias_3, table_4.column_3 AS alias_4, table_4.column_30 AS alias_5, table_17.column_2 AS alias_6 FROM table_4 INNER JOIN table_17 ON (table_4.column_13 = table_17.column_1) WHERE ((((table_4.column_3 = 1) OR (table_4.column_3 = 1)) AND (table_4.column_3 = table_4.column_28)) OR (table_4.column_3 = table_4.column_29))
----
150 values hashing to 716d82fac06dd2321f904a3662c17ebd

statement ok
DELETE FROM table_4 WHERE (column_31 = 2)


statement ok
DELETE FROM table_4 WHERE (column_31 = 3)


statement ok
DELETE FROM table_17 WHERE (column_3 = 2)


statement ok
DELETE FROM table_17 WHERE (column_3 = 3)


statement ok
DELETE FROM table_2 WHERE (column_10 = 2)


statement ok
DELETE FROM table_2 WHERE (column_10 = 3)


statement ok
DELETE FROM table_7 WHERE (column_3 = 2)


statement ok
DELETE FROM table_7 WHERE (column_3 = 3)


statement ok
DELETE FROM table_16 WHERE (column_3 = 2)


statement ok
DELETE FROM table_16 WHERE (column_3 = 3)


statement ok
DELETE FROM table_12 WHERE (column_3 = 2)


statement ok
DELETE FROM table_12 WHERE (column_3 = 3)


statement ok
DELETE FROM table_10 WHERE (column_3 = 2)


statement ok
DELETE FROM table_10 WHERE (column_3 = 3)


statement ok
DELETE FROM table_8 WHERE (column_3 = 2)


statement ok
DELETE FROM table_8 WHERE (column_3 = 3)


statement ok
DELETE FROM table_15 WHERE (column_3 = 2)


statement ok
DELETE FROM table_15 WHERE (column_3 = 3)


statement ok
DELETE FROM table_6 WHERE (column_3 = 2)


statement ok
DELETE FROM table_6 WHERE (column_3 = 3)


statement ok
DELETE FROM table_9 WHERE (column_3 = 2)


statement ok
DELETE FROM table_9 WHERE (column_3 = 3)


statement ok
DELETE FROM table_13 WHERE (column_3 = 2)


statement ok
DELETE FROM table_13 WHERE (column_3 = 3)


statement ok
DELETE FROM table_14 WHERE (column_3 = 2)


statement ok
DELETE FROM table_14 WHERE (column_3 = 3)


statement ok
DELETE FROM table_1 WHERE (column_5 = 2)


statement ok
DELETE FROM table_1 WHERE (column_5 = 3)


statement ok
DELETE FROM table_11 WHERE (column_16 = 2)


statement ok
DELETE FROM table_11 WHERE (column_16 = 3)


statement ok
DELETE FROM table_3 WHERE (column_3 = 2)


statement ok
DELETE FROM table_3 WHERE (column_3 = 3)


statement ok
DELETE FROM table_5 WHERE (column_3 = 2)


statement ok
DELETE FROM table_5 WHERE (column_3 = 3)


query  nosort
SELECT table_1.column_1 AS alias_1 FROM table_1 WHERE (table_1.column_1 = 1)
----
1
1
1

query  nosort
SELECT table_1.column_1 AS alias_1 FROM table_1 WHERE (table_1.column_1 = 1)
----
1
1
1

query  nosort
SELECT table_1.column_1 AS alias_1 FROM table_1 WHERE (table_1.column_1 = table_1.column_2)
----
1
1
1

query  nosort
SELECT table_1.column_1 AS alias_1 FROM table_1 WHERE (table_1.column_1 = table_1.column_3)
----
1
1
1

query  nosort
SELECT table_1.column_4 AS alias_1, table_2.column_2 AS alias_2 FROM table_1 INNER JOIN table_2 ON (table_1.column_3 = table_2.column_1)
----
1
1
1
1
1
1
1
1
1
1
1
1
1
1
1
1
1
1

query  nosort
SELECT table_2.column_3 AS alias_1, table_2.column_3 AS alias_2 FROM table_2 WHERE ((table_2.column_3 = 1) OR (table_2.column_3 = 1))
----
1
1
1
1
1
1

query  nosort
SELECT table_2.column_3 AS alias_1, table_2.column_3 AS alias_2 FROM table_2 WHERE ((table_2.column_3 = 1) AND (table_2.column_3 = table_2.column_4))
----
1
1
1
1
1
1

query  nosort
SELECT table_2.column_3 AS alias_1, table_2.column_3 AS alias_2 FROM table_2 WHERE ((table_2.column_3 = 1) OR (table_2.column_3 = table_2.column_5))
----
1
1
1
1
1
1

query  nosort
SELECT table_2.column_3 AS alias_1, table_2.column_6 AS alias_2, table_3.column_2 AS alias_3 FROM table_2 INNER JOIN table_3 ON (table_2.column_1 = table_3.column_1) WHERE (table_2.column_3 = 1)
----
27 values hashing to da8a72a7967c0c73d91239275230aed9

query  nosort
SELECT table_2.column_3 AS alias_1, table_2.column_3 AS alias_2 FROM table_2 WHERE ((table_2.column_3 = 1) AND (table_2.column_3 = table_2.column_7))
----
1
1
1
1
1
1

query  nosort
SELECT table_2.column_3 AS alias_1, table_2.column_3 AS alias_2 FROM table_2 WHERE ((table_2.column_3 = 1) OR (table_2.column_3 = table_2.column_8))
----
1
1
1
1
1
1

query  nosort
SELECT table_2.column_3 AS alias_1, table_2.column_9 AS alias_2, table_4.column_2 AS alias_3 FROM table_2 INNER JOIN table_4 ON (table_2.column_8 = table_4.column_1) WHERE (table_2.column_3 = 1)
----
27 values hashing to da8a72a7967c0c73d91239275230aed9

query  nosort
SELECT table_4.column_3 AS alias_1, table_4.column_3 AS alias_2 FROM table_4 WHERE ((table_4.column_3 = table_4.column_4) OR (table_4.column_3 = table_4.column_5))
----
1
1
1
1
1
1

query  nosort
SELECT table_4.column_3 AS alias_1, table_4.column_7 AS alias_2, table_5.column_2 AS alias_3 FROM table_4 INNER JOIN table_5 ON (table_4.column_2 = table_5.column_1) WHERE (table_4.column_3 = table_4.column_6)
----
27 values hashing to da8a72a7967c0c73d91239275230aed9

query  nosort
SELECT table_4.column_3 AS alias_1, table_4.column_9 AS alias_2, table_6.column_2 AS alias_3 FROM table_4 INNER JOIN table_6 ON (table_4.column_6 = table_6.column_1) WHERE (table_4.column_3 = table_4.column_8)
----
27 values hashing to da8a72a7967c0c73d91239275230aed9

query  nosort
SELECT table_4.column_3 AS alias_1, table_4.column_3 AS alias_2, table_4.column_3 AS alias_3 FROM table_4 WHERE (((table_4.column_3 = 1) OR (table_4.column_3 = 1)) AND (table_4.column_3 = table_4.column_10))
----
1
1
1
1
1
1
1
1
1

query  nosort
SELECT table_4.column_3 AS alias_1, table_4.column_3 AS alias_2, table_4.column_3 AS alias_3 FROM table_4 WHERE (((table_4.column_3 = 1) OR (table_4.column_3 = 1)) OR (table_4.column_3 = table_4.column_11))
----
1
1
1
1
1
1
1
1
1

query  nosort
SELECT table_4.column_3 AS alias_1, table_4.column_3 AS alias_2, table_4.column_12 AS alias_3, table_7.column_2 AS alias_4 FROM table_4 INNER JOIN table_7 ON (table_4.column_11 = table_7.column_1) WHERE ((table_4.column_3 = 1) OR (table_4.column_3 = 1))
----
36 values hashing to 00004f87f1a5ef9c1ae8120ee074bb84

query  nosort
SELECT table_4.column_3 AS alias_1, table_4.column_3 AS alias_2, table_4.column_3 AS alias_3 FROM table_4 WHERE (((table_4.column_3 = 1) AND (table_4.column_3 = table_4.column_13)) OR (table_4.column_3 = table_4.column_14))
----
1
1
1
1
1
1
1
1
1

query  nosort
SELECT table_4.column_3 AS alias_1, table_4.column_3 AS alias_2, table_4.column_16 AS alias_3, table_8.column_2 AS alias_4 FROM table_4 INNER JOIN table_8 ON (table_4.column_13 = table_8.column_1) WHERE ((table_4.column_3 = 1) AND (table_4.column_3 = table_4.column_15))
----
36 values hashing to 00004f87f1a5ef9c1ae8120ee074bb84

query  nosort
SELECT table_4.column_3 AS alias_1, table_4.column_3 AS alias_2, table_4.column_18 AS alias_3, table_9.column_2 AS alias_4 FROM table_4 INNER JOIN table_9 ON (table_4.column_13 = table_9.column_1) WHERE ((table_4.column_3 = 1) OR (table_4.column_3 = table_4.column_17))
----
36 values hashing to 00004f87f1a5ef9c1ae8120ee074bb84

query  nosort
SELECT table_4.column_3 AS alias_1, table_4.column_3 AS alias_2, table_4.column_3 AS alias_3 FROM table_4 WHERE (((table_4.column_3 = 1) AND (table_4.column_3 = table_4.column_19)) OR (table_4.column_3 = table_4.column_20))
----
1
1
1
1
1
1
1
1
1

query  nosort
SELECT table_4.column_3 AS alias_1, table_4.column_3 AS alias_2, table_4.column_22 AS alias_3, table_10.column_2 AS alias_4 FROM table_4 INNER JOIN table_10 ON (table_4.column_13 = table_10.column_1) WHERE ((table_4.column_3 = 1) AND (table_4.column_3 = table_4.column_21))
----
36 values hashing to 00004f87f1a5ef9c1ae8120ee074bb84

query  nosort
SELECT table_4.column_3 AS alias_1, table_4.column_3 AS alias_2, table_4.column_24 AS alias_3, table_11.column_2 AS alias_4 FROM table_4 INNER JOIN table_11 ON (table_4.column_13 = table_11.column_1) WHERE ((table_4.column_3 = 1) OR (table_4.column_3 = table_4.column_23))
----
36 values hashing to 00004f87f1a5ef9c1ae8120ee074bb84

query  nosort
SELECT table_11.column_3 AS alias_1, table_11.column_3 AS alias_2, table_11.column_6 AS alias_3, table_12.column_2 AS alias_4 FROM table_11 INNER JOIN table_12 ON (table_11.column_1 = table_12.column_1) WHERE ((table_11.column_3 = table_11.column_4) OR (table_11.column_3 = table_11.column_5))
----
36 values hashing to 00004f87f1a5ef9c1ae8120ee074bb84

query  nosort
SELECT table_11.column_3 AS alias_1, table_11.column_3 AS alias_2, table_11.column_3 AS alias_3, table_11.column_3 AS alias_4 FROM table_11 WHERE ((((table_11.column_3 = 1) OR (table_11.column_3 = 1)) AND (table_11.column_3 = table_11.column_7)) OR (table_11.column_3 = table_11.column_8))
----
1
1
1
1
1
1
1
1
1
1
1
1

query  nosort
SELECT table_11.column_3 AS alias_1, table_11.column_3 AS alias_2, table_11.column_3 AS alias_3, table_11.column_10 AS alias_4, table_13.column_2 AS alias_5 FROM table_11 INNER JOIN table_13 ON (table_11.column_4 = table_13.column_1) WHERE (((table_11.column_3 = 1) OR (table_11.column_3 = 1)) AND (table_11.column_3 = table_11.column_9))
----
45 values hashing to 930323d678b557f397333f1dc2efed79

query  nosort
SELECT table_11.column_3 AS alias_1, table_11.column_3 AS alias_2, table_11.column_3 AS alias_3, table_11.column_12 AS alias_4, table_14.column_2 AS alias_5 FROM table_11 INNER JOIN table_14 ON (table_11.column_10 = table_14.column_1) WHERE (((table_11.column_3 = 1) OR (table_11.column_3 = 1)) OR (table_11.column_3 = table_11.column_11))
----
45 values hashing to 930323d678b557f397333f1dc2efed79

query  nosort
SELECT table_11.column_3 AS alias_1, table_11.column_3 AS alias_2, table_11.column_3 AS alias_3, table_11.column_15 AS alias_4, table_15.column_2 AS alias_5 FROM table_11 INNER JOIN table_15 ON (table_11.column_10 = table_15.column_1) WHERE (((table_11.column_3 = 1) AND (table_11.column_3 = table_11.column_13)) OR (table_11.column_3 = table_11.column_14))
----
45 values hashing to 930323d678b557f397333f1dc2efed79

query  nosort
SELECT table_4.column_3 AS alias_1, table_4.column_3 AS alias_2, table_4.column_3 AS alias_3, table_4.column_27 AS alias_4, table_16.column_2 AS alias_5 FROM table_4 INNER JOIN table_16 ON (table_4.column_13 = table_16.column_1) WHERE (((table_4.column_3 = 1) AND (table_4.column_3 = table_4.column_25)) OR (table_4.column_3 = table_4.column_26))
----
45 values hashing to 930323d678b557f397333f1dc2efed79

query  nosort
SELECT table_4.column_3 AS alias_1, table_4.column_3 AS alias_2, table_4.column_3 AS alias_3, table_4.column_3 AS alias_4, table_4.column_30 AS alias_5, table_17.column_2 AS alias_6 FROM table_4 INNER JOIN table_17 ON (table_4.column_13 = table_17.column_1) WHERE ((((table_4.column_3 = 1) OR (table_4.column_3 = 1)) AND (table_4.column_3 = table_4.column_28)) OR (table_4.column_3 = table_4.column_29))
----
54 values hashing to ad3049ffb0fc76f4c8b8a6e301076ea3
