# Generated by:
#     target/debug/noria-logictest permute --compare-to mysql://root:noria@127.1/noria -d 3 -o logictests/generated/mysql/ --only range_param --random --include-deletes --rows-per-table 10 --subquery-depth 1

statement ok
CREATE TABLE `table_2` (`column_4` INT, `column_1` INT, `column_2` INT, `column_3` INT, PRIMARY KEY (`column_4`))


statement ok
CREATE TABLE `table_4` (`column_2` INT, `column_1` INT, `column_3` INT, PRIMARY KEY (`column_3`))


statement ok
CREATE TABLE `table_5` (`column_3` INT, `column_2` INT, `column_1` INT, PRIMARY KEY (`column_3`))


statement ok
CREATE TABLE `table_1` (`column_3` INT, `column_1` INT, `column_2` INT, `column_4` INT, `column_5` INT, PRIMARY KEY (`column_5`))


statement ok
CREATE TABLE `table_3` (`column_1` INT, `column_2` INT, `column_3` INT, PRIMARY KEY (`column_3`))


statement ok
INSERT INTO `table_2` (`column_4`, `column_1`, `column_2`, `column_3`) VALUES (0, 23643608, 484350054, 1971121840), (1, 325556422, 1035079352, -2141673655), (2, 1199281368, 1855594721, 1446800808), (3, -1765484912, -993587857, 733927919), (4, -720607958, 1196825699, 2012675774), (5, -1591132143, -1872660939, -997764023), (6, -1928069132, 826658767, -333327751), (7, 976587, 434061690, -1755260144), (8, 749786675, -1824330824, -114870644), (9, 629322825, -43624182, -1643655772)


statement ok
INSERT INTO `table_4` (`column_2`, `column_1`, `column_3`) VALUES (-1237563265, 1770993280, 0), (-1715440325, -1287278277, 1), (1294386964, 1206614191, 2), (1415273586, 2021733370, 3), (1699438579, 1286654254, 4), (-565916349, 1812476306, 5), (-904140267, -1467451146, 6), (1460605695, -1840203952, 7), (1429887340, -477205356, 8), (1406146548, 2000476682, 9)


statement ok
INSERT INTO `table_5` (`column_3`, `column_2`, `column_1`) VALUES (0, 1748034146, 626168394), (1, 547431946, -997260204), (2, 687515243, -1692980776), (3, 297652214, 1831754256), (4, 2119296553, 1463333671), (5, 2115650688, 180345642), (6, 562957307, 1365985086), (7, -789531343, -435820733), (8, -166731151, -562564807), (9, -1533515951, 1372196218)


statement ok
INSERT INTO `table_1` (`column_3`, `column_1`, `column_2`, `column_4`, `column_5`) VALUES (-1342869271, 1014441280, 345552721, -1057602569, 0), (-682856752, -1617575020, 609644482, 1787383038, 1), (61835924, 256358103, 12056577, -1217828823, 2), (-585459908, 400128857, 1394869050, 1864282642, 3), (-138676816, -1546277610, -650756703, 1145282290, 4), (1493127706, 2013552674, 221809982, 798132625, 5), (1542201561, 800475867, 1572746806, -146338709, 6), (1666826049, 1433750934, 1657011913, -1419601774, 7), (-135073146, -1256525925, -158813115, 893117785, 8), (-497767081, -776255209, 1632821183, 1708125356, 9)


statement ok
INSERT INTO `table_3` (`column_1`, `column_2`, `column_3`) VALUES (-342237135, 458890055, 0), (-1609848172, 496403334, 1), (675270614, 1465205703, 2), (1818893580, 1306078160, 3), (2100479525, -1218405285, 4), (-589398391, 1913109424, 5), (-267986264, 1521220998, 6), (814863618, -1886244794, 7), (2125187055, 264142191, 8), (2103312805, -1494078379, 9)


query  rowsort
SELECT `table_1`.`column_2` AS `alias_1`, `table_2`.`column_2` AS `alias_2` FROM `table_1` INNER JOIN `table_2` ON (`table_1`.`column_1` = `table_2`.`column_1`)
----


query  rowsort
SELECT `table_1`.`column_2` AS `alias_1` FROM `table_1` WHERE (`table_1`.`column_2` = ?)
? = 1
----


query  rowsort
SELECT `table_1`.`column_2` AS `alias_1` FROM `table_1` WHERE (`table_1`.`column_2` > ?)
? = 10
----
12056577
1394869050
1572746806
1632821183
1657011913
221809982
345552721
609644482

query  rowsort
SELECT `table_1`.`column_3` AS `alias_1`, `table_3`.`column_2` AS `alias_2` FROM `table_1` INNER JOIN `table_3` ON (`table_1`.`column_2` = `table_3`.`column_1`) WHERE (`table_1`.`column_3` = ?)
? = 1
----


query  rowsort
SELECT `table_1`.`column_4` AS `alias_1`, `table_4`.`column_2` AS `alias_2` FROM `table_1` INNER JOIN `table_4` ON (`table_1`.`column_3` = `table_4`.`column_1`) WHERE (`table_1`.`column_3` > ?)
? = 10
----


query  rowsort
SELECT `table_2`.`column_1` AS `alias_1` FROM `table_2` WHERE ((`table_2`.`column_1` = ?) AND (`table_2`.`column_1` > ?))
? = 1
? = 10
----


query  rowsort
SELECT `table_2`.`column_3` AS `alias_1`, `table_5`.`column_2` AS `alias_2` FROM `table_2` INNER JOIN `table_5` ON (`table_2`.`column_1` = `table_5`.`column_1`) WHERE ((`table_2`.`column_1` = ?) AND (`table_2`.`column_1` > ?))
? = 1
? = 10
----


statement ok
DELETE FROM `table_2` WHERE (`column_4` = 0)


statement ok
DELETE FROM `table_2` WHERE (`column_4` = 1)


statement ok
DELETE FROM `table_2` WHERE (`column_4` = 2)


statement ok
DELETE FROM `table_2` WHERE (`column_4` = 3)


statement ok
DELETE FROM `table_2` WHERE (`column_4` = 4)


statement ok
DELETE FROM `table_4` WHERE (`column_3` = 0)


statement ok
DELETE FROM `table_4` WHERE (`column_3` = 1)


statement ok
DELETE FROM `table_4` WHERE (`column_3` = 2)


statement ok
DELETE FROM `table_4` WHERE (`column_3` = 3)


statement ok
DELETE FROM `table_4` WHERE (`column_3` = 4)


statement ok
DELETE FROM `table_5` WHERE (`column_3` = 0)


statement ok
DELETE FROM `table_5` WHERE (`column_3` = 1)


statement ok
DELETE FROM `table_5` WHERE (`column_3` = 2)


statement ok
DELETE FROM `table_5` WHERE (`column_3` = 3)


statement ok
DELETE FROM `table_5` WHERE (`column_3` = 4)


statement ok
DELETE FROM `table_1` WHERE (`column_5` = 0)


statement ok
DELETE FROM `table_1` WHERE (`column_5` = 1)


statement ok
DELETE FROM `table_1` WHERE (`column_5` = 2)


statement ok
DELETE FROM `table_1` WHERE (`column_5` = 3)


statement ok
DELETE FROM `table_1` WHERE (`column_5` = 4)


statement ok
DELETE FROM `table_3` WHERE (`column_3` = 0)


statement ok
DELETE FROM `table_3` WHERE (`column_3` = 1)


statement ok
DELETE FROM `table_3` WHERE (`column_3` = 2)


statement ok
DELETE FROM `table_3` WHERE (`column_3` = 3)


statement ok
DELETE FROM `table_3` WHERE (`column_3` = 4)


query  rowsort
SELECT `table_1`.`column_2` AS `alias_1`, `table_2`.`column_2` AS `alias_2` FROM `table_1` INNER JOIN `table_2` ON (`table_1`.`column_1` = `table_2`.`column_1`)
----


query  rowsort
SELECT `table_1`.`column_2` AS `alias_1` FROM `table_1` WHERE (`table_1`.`column_2` = ?)
? = 1
----


query  rowsort
SELECT `table_1`.`column_2` AS `alias_1` FROM `table_1` WHERE (`table_1`.`column_2` > ?)
? = 10
----
1572746806
1632821183
1657011913
221809982

query  rowsort
SELECT `table_1`.`column_3` AS `alias_1`, `table_3`.`column_2` AS `alias_2` FROM `table_1` INNER JOIN `table_3` ON (`table_1`.`column_2` = `table_3`.`column_1`) WHERE (`table_1`.`column_3` = ?)
? = 1
----


query  rowsort
SELECT `table_1`.`column_4` AS `alias_1`, `table_4`.`column_2` AS `alias_2` FROM `table_1` INNER JOIN `table_4` ON (`table_1`.`column_3` = `table_4`.`column_1`) WHERE (`table_1`.`column_3` > ?)
? = 10
----


query  rowsort
SELECT `table_2`.`column_1` AS `alias_1` FROM `table_2` WHERE ((`table_2`.`column_1` = ?) AND (`table_2`.`column_1` > ?))
? = 1
? = 10
----


query  rowsort
SELECT `table_2`.`column_3` AS `alias_1`, `table_5`.`column_2` AS `alias_2` FROM `table_2` INNER JOIN `table_5` ON (`table_2`.`column_1` = `table_5`.`column_1`) WHERE ((`table_2`.`column_1` = ?) AND (`table_2`.`column_1` > ?))
? = 1
? = 10
----

