# Generated by:
#     target/debug/noria-logictest permute --compare-to mysql://root:noria@127.1/noria -d 3 -o logictests/generated/mysql/ --only range_param --random --include-deletes --rows-per-table 10 --subquery-depth 1

statement ok
CREATE TABLE `table_5` (`column_6` INT, `column_5` INT, `column_3` INT, `column_2` INT, `column_7` INT, `column_1` INT, `column_4` INT, PRIMARY KEY (`column_7`))


statement ok
CREATE TABLE `table_1` (`column_2` INT, `column_4` INT, `column_3` INT, `column_1` INT, PRIMARY KEY (`column_4`))


statement ok
CREATE TABLE `table_7` (`column_2` INT, `column_1` INT, `column_3` INT, PRIMARY KEY (`column_3`))


statement ok
CREATE TABLE `table_2` (`column_1` INT, `column_5` INT, `column_2` INT, `column_4` INT, `column_3` INT, PRIMARY KEY (`column_5`))


statement ok
CREATE TABLE `table_4` (`column_1` INT, `column_2` INT, `column_3` INT, PRIMARY KEY (`column_3`))


statement ok
CREATE TABLE `table_3` (`column_1` INT, `column_3` INT, `column_2` INT, PRIMARY KEY (`column_3`))


statement ok
CREATE TABLE `table_8` (`column_2` INT, `column_1` INT, `column_3` INT, PRIMARY KEY (`column_3`))


statement ok
CREATE TABLE `table_9` (`column_1` INT, `column_3` INT, `column_2` INT, PRIMARY KEY (`column_3`))


statement ok
CREATE TABLE `table_6` (`column_3` INT, `column_1` INT, `column_2` INT, PRIMARY KEY (`column_3`))


statement ok
INSERT INTO `table_5` (`column_6`, `column_5`, `column_3`, `column_2`, `column_7`, `column_1`, `column_4`) VALUES (-546539932, 636274712, -434361522, 858702366, 0, 1108137329, 413532516), (816487571, -1355584913, 525921268, 2050572107, 1, -499729837, -674813600), (-444676698, -2029006500, 229456530, -1651864578, 2, 950989085, -707093342), (822904919, -1670003519, -346507967, 1091355989, 3, -1029231243, -71631844), (-681996062, 1254215203, 137851249, -793478909, 4, 655292315, -1916619836), (-939511694, 645585679, -1594223758, -1422415224, 5, 1492191694, 958757364), (-1040077417, -716762207, 222941046, -1959371499, 6, -96274058, 730795153), (2043125079, 2024747030, 1510405794, 2122502119, 7, 1287567538, 1415719693), (285806919, -1302933414, -1396526583, -674814263, 8, -782620652, -1442595552), (-312438238, -1764749170, -1294263166, -1837782606, 9, -1909832242, 1752038102)


statement ok
INSERT INTO `table_1` (`column_2`, `column_4`, `column_3`, `column_1`) VALUES (-1881242736, 0, -1899553478, -539861298), (1773002251, 1, -209956526, -886093368), (-1902172310, 2, -1070707504, 978094375), (-986035896, 3, 899610611, 1248430827), (1122418988, 4, -1589527364, 1766966878), (759222915, 5, -1904637261, -273053370), (410260938, 6, 938633631, -1323593713), (365039091, 7, 1878762071, 1288540441), (-1480905682, 8, -446579215, 1456039580), (1363080319, 9, -760873909, -1242495541)


statement ok
INSERT INTO `table_7` (`column_2`, `column_1`, `column_3`) VALUES (-1360019520, 1134556001, 0), (-342156240, 692835637, 1), (755913884, 49386492, 2), (31128833, 1601337182, 3), (-1145536338, 1748035880, 4), (-184068913, 1931121852, 5), (373954504, 1239270290, 6), (1695296595, -2051595601, 7), (1858360851, 904313162, 8), (989765001, 98798196, 9)


statement ok
INSERT INTO `table_2` (`column_1`, `column_5`, `column_2`, `column_4`, `column_3`) VALUES (-2144213507, 0, 1011993219, -866293208, 2051279278), (-1636898285, 1, 523664873, -918568347, 247196421), (1296632939, 2, -684103639, -2123703857, -814174179), (1798467525, 3, -409147797, -2135872479, 1491351658), (604503990, 4, 1742626918, -1445900769, -1886708070), (-323978795, 5, -530067866, -2011376736, 609490621), (-2129818024, 6, -1362572305, 150952661, 2015771598), (1336114121, 7, -458865216, 651270315, 1626786712), (2003266546, 8, 471695469, -809121396, 1019793967), (874303188, 9, -945894377, -1115145831, 651159299)


statement ok
INSERT INTO `table_4` (`column_1`, `column_2`, `column_3`) VALUES (1893797642, 257418425, 0), (1414834420, -131841443, 1), (351207859, 31060873, 2), (-1871116135, -188664929, 3), (222073919, 1448649520, 4), (-1635088637, -2043326846, 5), (-2001560523, -314502864, 6), (-360844635, -1149460787, 7), (433430111, -2029422526, 8), (-1226487821, -169817094, 9)


statement ok
INSERT INTO `table_3` (`column_1`, `column_3`, `column_2`) VALUES (769225129, 0, 579719823), (-762387411, 1, -2036272841), (-1357139548, 2, -377252314), (583102897, 3, -1067041138), (-2029205547, 4, 1996636696), (-301864703, 5, -2037702346), (124359996, 6, 275203633), (1500626123, 7, -1142203356), (433119664, 8, -1222506901), (1540929848, 9, -1263048710)


statement ok
INSERT INTO `table_8` (`column_2`, `column_1`, `column_3`) VALUES (-1949849324, 1839582563, 0), (-2005801999, 2031199666, 1), (-803419788, -1905187312, 2), (1585568567, 1994649742, 3), (1670061671, 1101269270, 4), (-1705454199, -207999092, 5), (1076397218, 1610146958, 6), (-1329327250, -274929828, 7), (-278504045, -1150060825, 8), (1652376052, -1190932669, 9)


statement ok
INSERT INTO `table_9` (`column_1`, `column_3`, `column_2`) VALUES (-439497583, 0, 262124488), (1672676524, 1, -147152848), (-1868412653, 2, -2044190870), (-804845005, 3, 1776039501), (1609726491, 4, -1166328999), (-1478659128, 5, 2009778585), (-1130905347, 6, -1876555703), (-791618544, 7, -1052818156), (-1484308679, 8, 1054515216), (-268884307, 9, 371594880)


statement ok
INSERT INTO `table_6` (`column_3`, `column_1`, `column_2`) VALUES (0, 1254832480, -1551999725), (1, -707258124, -310198266), (2, -2140365866, -754852726), (3, -2051614984, -205990122), (4, 1262235584, 182152088), (5, -1126850223, -1036008511), (6, 508316594, 2127588697), (7, -1613394901, 1717259652), (8, 1610669528, 1266799417), (9, 1370158524, 425639259)


query  rowsort
SELECT `table_1`.`column_2` AS `alias_1`, `table_2`.`column_2` AS `alias_2` FROM `table_1` INNER JOIN `table_2` ON (`table_1`.`column_1` = `table_2`.`column_1`)
----


query  nosort
SELECT `table_2`.`column_1` AS `alias_1` FROM `table_2` ORDER BY `table_2`.`column_1` ASC LIMIT 10
----
-2144213507
-2129818024
-1636898285
-323978795
604503990
874303188
1296632939
1336114121
1798467525
2003266546

query  nosort
SELECT `table_2`.`column_1` AS `alias_1` FROM `table_2` ORDER BY `table_2`.`column_1` DESC LIMIT 10
----
2003266546
1798467525
1336114121
1296632939
874303188
604503990
-323978795
-1636898285
-2129818024
-2144213507

query  rowsort
SELECT `table_2`.`column_1` AS `alias_1` FROM `table_2` WHERE (`table_2`.`column_1` > ?)
? = 10
----
1296632939
1336114121
1798467525
2003266546
604503990
874303188

query  nosort
SELECT `table_2`.`column_3` AS `alias_1`, `table_3`.`column_2` AS `alias_2` FROM `table_2` INNER JOIN `table_3` ON (`table_2`.`column_1` = `table_3`.`column_1`) ORDER BY `table_2`.`column_1` ASC LIMIT 10
----


query  nosort
SELECT `table_2`.`column_4` AS `alias_1`, `table_4`.`column_2` AS `alias_2` FROM `table_2` INNER JOIN `table_4` ON (`table_2`.`column_1` = `table_4`.`column_1`) ORDER BY `table_2`.`column_1` DESC LIMIT 10
----


query  rowsort
SELECT `table_1`.`column_3` AS `alias_1`, `table_5`.`column_2` AS `alias_2` FROM `table_1` INNER JOIN `table_5` ON (`table_1`.`column_2` = `table_5`.`column_1`) WHERE (`table_1`.`column_2` > ?)
? = 10
----


query  nosort
SELECT `table_5`.`column_2` AS `alias_1` FROM `table_5` ORDER BY `table_5`.`column_2` DESC LIMIT 10
----
2122502119
2050572107
1091355989
858702366
-674814263
-793478909
-1422415224
-1651864578
-1837782606
-1959371499

query  nosort
SELECT `table_5`.`column_2` AS `alias_1` FROM `table_5` WHERE (`table_5`.`column_2` > ?) ORDER BY `table_5`.`column_2` ASC LIMIT 10
? = 10
----
858702366
1091355989
2050572107
2122502119

query  nosort
SELECT `table_5`.`column_2` AS `alias_1` FROM `table_5` WHERE (`table_5`.`column_2` > ?) ORDER BY `table_5`.`column_2` DESC LIMIT 10
? = 10
----
2122502119
2050572107
1091355989
858702366

query  nosort
SELECT `table_5`.`column_3` AS `alias_1`, `table_6`.`column_2` AS `alias_2` FROM `table_5` INNER JOIN `table_6` ON (`table_5`.`column_2` = `table_6`.`column_1`) ORDER BY `table_5`.`column_2` DESC LIMIT 10
----


query  nosort
SELECT `table_5`.`column_4` AS `alias_1`, `table_7`.`column_2` AS `alias_2` FROM `table_5` INNER JOIN `table_7` ON (`table_5`.`column_2` = `table_7`.`column_1`) WHERE (`table_5`.`column_3` > ?) ORDER BY `table_5`.`column_3` ASC LIMIT 10
? = 10
----


query  nosort
SELECT `table_5`.`column_5` AS `alias_1`, `table_8`.`column_2` AS `alias_2` FROM `table_5` INNER JOIN `table_8` ON (`table_5`.`column_3` = `table_8`.`column_1`) WHERE (`table_5`.`column_5` > ?) ORDER BY `table_5`.`column_5` DESC LIMIT 10
? = 10
----


query  nosort
SELECT `table_5`.`column_5` AS `alias_1` FROM `table_5` WHERE (`table_5`.`column_5` > ?) ORDER BY `table_5`.`column_5` DESC LIMIT 10
? = 10
----
2024747030
1254215203
645585679
636274712

query  nosort
SELECT `table_5`.`column_6` AS `alias_1`, `table_9`.`column_2` AS `alias_2` FROM `table_5` INNER JOIN `table_9` ON (`table_5`.`column_5` = `table_9`.`column_1`) WHERE (`table_5`.`column_6` > ?) ORDER BY `table_5`.`column_6` DESC LIMIT 10
? = 10
----


statement ok
DELETE FROM `table_5` WHERE (`column_7` = 0)


statement ok
DELETE FROM `table_5` WHERE (`column_7` = 1)


statement ok
DELETE FROM `table_5` WHERE (`column_7` = 2)


statement ok
DELETE FROM `table_5` WHERE (`column_7` = 3)


statement ok
DELETE FROM `table_5` WHERE (`column_7` = 4)


statement ok
DELETE FROM `table_1` WHERE (`column_4` = 0)


statement ok
DELETE FROM `table_1` WHERE (`column_4` = 1)


statement ok
DELETE FROM `table_1` WHERE (`column_4` = 2)


statement ok
DELETE FROM `table_1` WHERE (`column_4` = 3)


statement ok
DELETE FROM `table_1` WHERE (`column_4` = 4)


statement ok
DELETE FROM `table_7` WHERE (`column_3` = 0)


statement ok
DELETE FROM `table_7` WHERE (`column_3` = 1)


statement ok
DELETE FROM `table_7` WHERE (`column_3` = 2)


statement ok
DELETE FROM `table_7` WHERE (`column_3` = 3)


statement ok
DELETE FROM `table_7` WHERE (`column_3` = 4)


statement ok
DELETE FROM `table_2` WHERE (`column_5` = 0)


statement ok
DELETE FROM `table_2` WHERE (`column_5` = 1)


statement ok
DELETE FROM `table_2` WHERE (`column_5` = 2)


statement ok
DELETE FROM `table_2` WHERE (`column_5` = 3)


statement ok
DELETE FROM `table_2` WHERE (`column_5` = 4)


statement ok
DELETE FROM `table_4` WHERE (`column_3` = 0)


statement ok
DELETE FROM `table_4` WHERE (`column_3` = 1)


statement ok
DELETE FROM `table_4` WHERE (`column_3` = 2)


statement ok
DELETE FROM `table_4` WHERE (`column_3` = 3)


statement ok
DELETE FROM `table_4` WHERE (`column_3` = 4)


statement ok
DELETE FROM `table_3` WHERE (`column_3` = 0)


statement ok
DELETE FROM `table_3` WHERE (`column_3` = 1)


statement ok
DELETE FROM `table_3` WHERE (`column_3` = 2)


statement ok
DELETE FROM `table_3` WHERE (`column_3` = 3)


statement ok
DELETE FROM `table_3` WHERE (`column_3` = 4)


statement ok
DELETE FROM `table_8` WHERE (`column_3` = 0)


statement ok
DELETE FROM `table_8` WHERE (`column_3` = 1)


statement ok
DELETE FROM `table_8` WHERE (`column_3` = 2)


statement ok
DELETE FROM `table_8` WHERE (`column_3` = 3)


statement ok
DELETE FROM `table_8` WHERE (`column_3` = 4)


statement ok
DELETE FROM `table_9` WHERE (`column_3` = 0)


statement ok
DELETE FROM `table_9` WHERE (`column_3` = 1)


statement ok
DELETE FROM `table_9` WHERE (`column_3` = 2)


statement ok
DELETE FROM `table_9` WHERE (`column_3` = 3)


statement ok
DELETE FROM `table_9` WHERE (`column_3` = 4)


statement ok
DELETE FROM `table_6` WHERE (`column_3` = 0)


statement ok
DELETE FROM `table_6` WHERE (`column_3` = 1)


statement ok
DELETE FROM `table_6` WHERE (`column_3` = 2)


statement ok
DELETE FROM `table_6` WHERE (`column_3` = 3)


statement ok
DELETE FROM `table_6` WHERE (`column_3` = 4)


query  rowsort
SELECT `table_1`.`column_2` AS `alias_1`, `table_2`.`column_2` AS `alias_2` FROM `table_1` INNER JOIN `table_2` ON (`table_1`.`column_1` = `table_2`.`column_1`)
----


query  nosort
SELECT `table_2`.`column_1` AS `alias_1` FROM `table_2` ORDER BY `table_2`.`column_1` ASC LIMIT 10
----
-2129818024
-323978795
874303188
1336114121
2003266546

query  nosort
SELECT `table_2`.`column_1` AS `alias_1` FROM `table_2` ORDER BY `table_2`.`column_1` DESC LIMIT 10
----
2003266546
1336114121
874303188
-323978795
-2129818024

query  rowsort
SELECT `table_2`.`column_1` AS `alias_1` FROM `table_2` WHERE (`table_2`.`column_1` > ?)
? = 10
----
1336114121
2003266546
874303188

query  nosort
SELECT `table_2`.`column_3` AS `alias_1`, `table_3`.`column_2` AS `alias_2` FROM `table_2` INNER JOIN `table_3` ON (`table_2`.`column_1` = `table_3`.`column_1`) ORDER BY `table_2`.`column_1` ASC LIMIT 10
----


query  nosort
SELECT `table_2`.`column_4` AS `alias_1`, `table_4`.`column_2` AS `alias_2` FROM `table_2` INNER JOIN `table_4` ON (`table_2`.`column_1` = `table_4`.`column_1`) ORDER BY `table_2`.`column_1` DESC LIMIT 10
----


query  rowsort
SELECT `table_1`.`column_3` AS `alias_1`, `table_5`.`column_2` AS `alias_2` FROM `table_1` INNER JOIN `table_5` ON (`table_1`.`column_2` = `table_5`.`column_1`) WHERE (`table_1`.`column_2` > ?)
? = 10
----


query  nosort
SELECT `table_5`.`column_2` AS `alias_1` FROM `table_5` ORDER BY `table_5`.`column_2` DESC LIMIT 10
----
2122502119
-674814263
-1422415224
-1837782606
-1959371499

query  nosort
SELECT `table_5`.`column_2` AS `alias_1` FROM `table_5` WHERE (`table_5`.`column_2` > ?) ORDER BY `table_5`.`column_2` ASC LIMIT 10
? = 10
----
2122502119

query  nosort
SELECT `table_5`.`column_2` AS `alias_1` FROM `table_5` WHERE (`table_5`.`column_2` > ?) ORDER BY `table_5`.`column_2` DESC LIMIT 10
? = 10
----
2122502119

query  nosort
SELECT `table_5`.`column_3` AS `alias_1`, `table_6`.`column_2` AS `alias_2` FROM `table_5` INNER JOIN `table_6` ON (`table_5`.`column_2` = `table_6`.`column_1`) ORDER BY `table_5`.`column_2` DESC LIMIT 10
----


query  nosort
SELECT `table_5`.`column_4` AS `alias_1`, `table_7`.`column_2` AS `alias_2` FROM `table_5` INNER JOIN `table_7` ON (`table_5`.`column_2` = `table_7`.`column_1`) WHERE (`table_5`.`column_3` > ?) ORDER BY `table_5`.`column_3` ASC LIMIT 10
? = 10
----


query  nosort
SELECT `table_5`.`column_5` AS `alias_1`, `table_8`.`column_2` AS `alias_2` FROM `table_5` INNER JOIN `table_8` ON (`table_5`.`column_3` = `table_8`.`column_1`) WHERE (`table_5`.`column_5` > ?) ORDER BY `table_5`.`column_5` DESC LIMIT 10
? = 10
----


query  nosort
SELECT `table_5`.`column_5` AS `alias_1` FROM `table_5` WHERE (`table_5`.`column_5` > ?) ORDER BY `table_5`.`column_5` DESC LIMIT 10
? = 10
----
2024747030
645585679

query  nosort
SELECT `table_5`.`column_6` AS `alias_1`, `table_9`.`column_2` AS `alias_2` FROM `table_5` INNER JOIN `table_9` ON (`table_5`.`column_5` = `table_9`.`column_1`) WHERE (`table_5`.`column_6` > ?) ORDER BY `table_5`.`column_6` DESC LIMIT 10
? = 10
----

