# Generated by:
#     target/debug/noria-logictest permute --compare-to mysql://root:noria@127.1/noria -d 3 -o logictests/generated/mysql/ --only range_param --random --include-deletes --rows-per-table 10 --subquery-depth 1

statement ok
CREATE TABLE `table_1` (`column_1` INT, `column_2` INT, PRIMARY KEY (`column_2`))


statement ok
INSERT INTO `table_1` (`column_1`, `column_2`) VALUES (252214386, 0), (1729046962, 1), (1613688308, 2), (-1210248929, 3), (-1790670908, 4), (1564476498, 5), (364530266, 6), (1429702185, 7), (870608286, 8), (489811450, 9)


query  rowsort
SELECT DISTINCT `table_1`.`column_1` AS `alias_3` FROM `table_1` INNER JOIN (SELECT DISTINCT `table_1`.`column_1` AS `alias_1` FROM `table_1`) AS alias_2 ON (`table_1`.`column_1` = `alias_2`.`alias_1`)
----
-1210248929
-1790670908
1429702185
1564476498
1613688308
1729046962
252214386
364530266
489811450
870608286

query  rowsort
SELECT DISTINCT `table_1`.`column_1` AS `alias_3` FROM `table_1` INNER JOIN (SELECT `table_1`.`column_1` AS `alias_1` FROM `table_1`) AS alias_2 ON (`table_1`.`column_1` = `alias_2`.`alias_1`)
----
-1210248929
-1790670908
1429702185
1564476498
1613688308
1729046962
252214386
364530266
489811450
870608286

query  rowsort
SELECT DISTINCT `table_1`.`column_1` AS `alias_3` FROM `table_1` INNER JOIN (SELECT DISTINCT `table_1`.`column_1` AS `alias_1` FROM `table_1`) AS alias_2 ON (`table_1`.`column_1` = `alias_2`.`alias_1`)
----
-1210248929
-1790670908
1429702185
1564476498
1613688308
1729046962
252214386
364530266
489811450
870608286

query  rowsort
SELECT `table_1`.`column_1` AS `alias_3` FROM `table_1` INNER JOIN (SELECT DISTINCT `table_1`.`column_1` AS `alias_1` FROM `table_1`) AS alias_2 ON (`table_1`.`column_1` = `alias_2`.`alias_1`) WHERE (`table_1`.`column_1` > ?)
? = 10
----
1429702185
1564476498
1613688308
1729046962
252214386
364530266
489811450
870608286

query  rowsort
SELECT `table_1`.`column_1` AS `alias_3` FROM `table_1` INNER JOIN (SELECT `table_1`.`column_1` AS `alias_1` FROM `table_1`) AS alias_2 ON (`table_1`.`column_1` = `alias_2`.`alias_1`) WHERE (`table_1`.`column_1` > ?)
? = 10
----
1429702185
1564476498
1613688308
1729046962
252214386
364530266
489811450
870608286

query  rowsort
SELECT `table_1`.`column_1` AS `alias_3` FROM `table_1` INNER JOIN (SELECT DISTINCT `table_1`.`column_1` AS `alias_1` FROM `table_1`) AS alias_2 ON (`table_1`.`column_1` = `alias_2`.`alias_1`) WHERE (`table_1`.`column_1` > ?)
? = 10
----
1429702185
1564476498
1613688308
1729046962
252214386
364530266
489811450
870608286

query  rowsort
SELECT DISTINCT `table_1`.`column_1` AS `alias_3` FROM `table_1` INNER JOIN (SELECT DISTINCT `table_1`.`column_1` AS `alias_1` FROM `table_1`) AS alias_2 ON (`table_1`.`column_1` = `alias_2`.`alias_1`) WHERE (`table_1`.`column_1` > ?)
? = 10
----
1429702185
1564476498
1613688308
1729046962
252214386
364530266
489811450
870608286

query  rowsort
SELECT DISTINCT `table_1`.`column_1` AS `alias_3` FROM `table_1` INNER JOIN (SELECT `table_1`.`column_1` AS `alias_1` FROM `table_1`) AS alias_2 ON (`table_1`.`column_1` = `alias_2`.`alias_1`) WHERE (`table_1`.`column_1` > ?)
? = 10
----
1429702185
1564476498
1613688308
1729046962
252214386
364530266
489811450
870608286

query  rowsort
SELECT DISTINCT `table_1`.`column_1` AS `alias_3` FROM `table_1` INNER JOIN (SELECT DISTINCT `table_1`.`column_1` AS `alias_1` FROM `table_1`) AS alias_2 ON (`table_1`.`column_1` = `alias_2`.`alias_1`) WHERE (`table_1`.`column_1` > ?)
? = 10
----
1429702185
1564476498
1613688308
1729046962
252214386
364530266
489811450
870608286

statement ok
DELETE FROM `table_1` WHERE (`column_2` = 0)


statement ok
DELETE FROM `table_1` WHERE (`column_2` = 1)


statement ok
DELETE FROM `table_1` WHERE (`column_2` = 2)


statement ok
DELETE FROM `table_1` WHERE (`column_2` = 3)


statement ok
DELETE FROM `table_1` WHERE (`column_2` = 4)


query  rowsort
SELECT DISTINCT `table_1`.`column_1` AS `alias_3` FROM `table_1` INNER JOIN (SELECT DISTINCT `table_1`.`column_1` AS `alias_1` FROM `table_1`) AS alias_2 ON (`table_1`.`column_1` = `alias_2`.`alias_1`)
----
1429702185
1564476498
364530266
489811450
870608286

query  rowsort
SELECT DISTINCT `table_1`.`column_1` AS `alias_3` FROM `table_1` INNER JOIN (SELECT `table_1`.`column_1` AS `alias_1` FROM `table_1`) AS alias_2 ON (`table_1`.`column_1` = `alias_2`.`alias_1`)
----
1429702185
1564476498
364530266
489811450
870608286

query  rowsort
SELECT DISTINCT `table_1`.`column_1` AS `alias_3` FROM `table_1` INNER JOIN (SELECT DISTINCT `table_1`.`column_1` AS `alias_1` FROM `table_1`) AS alias_2 ON (`table_1`.`column_1` = `alias_2`.`alias_1`)
----
1429702185
1564476498
364530266
489811450
870608286

query  rowsort
SELECT `table_1`.`column_1` AS `alias_3` FROM `table_1` INNER JOIN (SELECT DISTINCT `table_1`.`column_1` AS `alias_1` FROM `table_1`) AS alias_2 ON (`table_1`.`column_1` = `alias_2`.`alias_1`) WHERE (`table_1`.`column_1` > ?)
? = 10
----
1429702185
1564476498
364530266
489811450
870608286

query  rowsort
SELECT `table_1`.`column_1` AS `alias_3` FROM `table_1` INNER JOIN (SELECT `table_1`.`column_1` AS `alias_1` FROM `table_1`) AS alias_2 ON (`table_1`.`column_1` = `alias_2`.`alias_1`) WHERE (`table_1`.`column_1` > ?)
? = 10
----
1429702185
1564476498
364530266
489811450
870608286

query  rowsort
SELECT `table_1`.`column_1` AS `alias_3` FROM `table_1` INNER JOIN (SELECT DISTINCT `table_1`.`column_1` AS `alias_1` FROM `table_1`) AS alias_2 ON (`table_1`.`column_1` = `alias_2`.`alias_1`) WHERE (`table_1`.`column_1` > ?)
? = 10
----
1429702185
1564476498
364530266
489811450
870608286

query  rowsort
SELECT DISTINCT `table_1`.`column_1` AS `alias_3` FROM `table_1` INNER JOIN (SELECT DISTINCT `table_1`.`column_1` AS `alias_1` FROM `table_1`) AS alias_2 ON (`table_1`.`column_1` = `alias_2`.`alias_1`) WHERE (`table_1`.`column_1` > ?)
? = 10
----
1429702185
1564476498
364530266
489811450
870608286

query  rowsort
SELECT DISTINCT `table_1`.`column_1` AS `alias_3` FROM `table_1` INNER JOIN (SELECT `table_1`.`column_1` AS `alias_1` FROM `table_1`) AS alias_2 ON (`table_1`.`column_1` = `alias_2`.`alias_1`) WHERE (`table_1`.`column_1` > ?)
? = 10
----
1429702185
1564476498
364530266
489811450
870608286

query  rowsort
SELECT DISTINCT `table_1`.`column_1` AS `alias_3` FROM `table_1` INNER JOIN (SELECT DISTINCT `table_1`.`column_1` AS `alias_1` FROM `table_1`) AS alias_2 ON (`table_1`.`column_1` = `alias_2`.`alias_1`) WHERE (`table_1`.`column_1` > ?)
? = 10
----
1429702185
1564476498
364530266
489811450
870608286
