# Generated by:
#     target/debug/noria-logictest permute --compare-to mysql://root:noria@127.1/noria -d 3 -o logictests/generated/mysql/ --only range_param --random --include-deletes --rows-per-table 10 --subquery-depth 1

statement ok
CREATE TABLE `table_1` (`column_3` INT, `column_2` INT, `column_8` INT, `column_1` INT, `column_11` INT, `column_4` INT, `column_6` INT, `column_10` INT, `column_12` INT, `column_7` INT, `column_5` INT, `column_9` INT, `column_13` INT, PRIMARY KEY (`column_13`))


statement ok
INSERT INTO `table_1` (`column_3`, `column_2`, `column_8`, `column_1`, `column_11`, `column_4`, `column_6`, `column_10`, `column_12`, `column_7`, `column_5`, `column_9`, `column_13`) VALUES (1279877491, -948946090, -22869427, -1360065876, 1568704928, -554352072, 1683377861, 1390374681, 1192113564, -18469677, 1145523350, -203590971, 0), (-38955796, -739096305, -1230190328, 130306484, 1201272017, -600944344, -820614472, 1921561438, 263030576, 1690361843, 1937415610, -1921713783, 1), (198619421, 1337038491, -734596840, -2006644457, -641063365, 977169656, 1405826432, 1514213368, -257300225, -2116940008, -934610390, -5340281, 2), (-2387018, -1716278562, 2022860045, 1869033163, -854496837, -1618806438, 1341865936, -437710265, -60832898, -724122613, 554045270, 472050651, 3), (1577301656, -1490129861, -1604192543, -1060878228, 465953785, 335124703, -156912331, 310805976, 1264585825, 170731697, -1335575579, 1315303874, 4), (1349973710, -1348376783, 23659322, -1135962734, -137422894, -1818116566, 89631266, 464803820, 1503901088, -1460223785, 902599467, -532563197, 5), (381670189, -1463400604, 1300841078, 672978242, 1749420163, 1276796963, 654610315, -1113529120, 1645099430, -10754760, 1881193870, 1758489357, 6), (-1779690766, 881400614, -471086564, 1020449650, 1520783963, -355865206, 1615249205, -114003899, -945784362, -616417173, -891391854, 1639379650, 7), (-87536927, 2127451874, 706108765, 1353957652, 488953347, -1564798449, -511125875, -81851712, 1513919087, -449485356, -835828807, -102837352, 8), (1455549796, 1024180730, 1194920660, -552344305, -473055348, 2028134285, -291453947, -732765939, 770212661, -556036672, -1133746306, 10900590, 9)


query  rowsort
SELECT min(`table_1`.`column_1`) AS `alias_1` FROM `table_1` INNER JOIN (SELECT min(`table_1`.`column_2`) AS `alias_2` FROM `table_1`) AS alias_3 ON (`table_1`.`column_1` = `alias_3`.`alias_2`)
----
NULL

query  rowsort
SELECT min(`table_1`.`column_3`) AS `alias_1` FROM `table_1` INNER JOIN (SELECT `table_1`.`column_1` AS `alias_2` FROM `table_1`) AS alias_3 ON (`table_1`.`column_1` = `alias_3`.`alias_2`)
----
-1779690766

query  rowsort
SELECT min(`table_1`.`column_4`) AS `alias_1` FROM `table_1` INNER JOIN (SELECT min(`table_1`.`column_5`) AS `alias_2` FROM `table_1`) AS alias_3 ON (`table_1`.`column_3` = `alias_3`.`alias_2`)
----
NULL

query  rowsort
SELECT `table_1`.`column_6` AS `alias_3` FROM `table_1` INNER JOIN (SELECT min(`table_1`.`column_6`) AS `alias_1` FROM `table_1`) AS alias_2 ON (`table_1`.`column_6` = `alias_2`.`alias_1`) WHERE (`table_1`.`column_3` > ?)
? = 10
----


query  rowsort
SELECT `table_1`.`column_6` AS `alias_3` FROM `table_1` INNER JOIN (SELECT `table_1`.`column_6` AS `alias_1` FROM `table_1`) AS alias_2 ON (`table_1`.`column_6` = `alias_2`.`alias_1`) WHERE (`table_1`.`column_6` > ?)
? = 10
----
1341865936
1405826432
1615249205
1683377861
654610315
89631266

query  rowsort
SELECT `table_1`.`column_6` AS `alias_3` FROM `table_1` INNER JOIN (SELECT min(`table_1`.`column_7`) AS `alias_1` FROM `table_1`) AS alias_2 ON (`table_1`.`column_6` = `alias_2`.`alias_1`) WHERE (`table_1`.`column_6` > ?)
? = 10
----


query  rowsort
SELECT min(`table_1`.`column_8`) AS `alias_1` FROM `table_1` INNER JOIN (SELECT min(`table_1`.`column_9`) AS `alias_2` FROM `table_1`) AS alias_3 ON (`table_1`.`column_3` = `alias_3`.`alias_2`) WHERE (`table_1`.`column_3` > ?)
? = 10
----
NULL

query  rowsort
SELECT min(`table_1`.`column_10`) AS `alias_1` FROM `table_1` INNER JOIN (SELECT `table_1`.`column_3` AS `alias_2` FROM `table_1`) AS alias_3 ON (`table_1`.`column_3` = `alias_3`.`alias_2`) WHERE (`table_1`.`column_3` > ?)
? = 10
----
-1113529120

query  rowsort
SELECT min(`table_1`.`column_11`) AS `alias_1` FROM `table_1` INNER JOIN (SELECT min(`table_1`.`column_12`) AS `alias_2` FROM `table_1`) AS alias_3 ON (`table_1`.`column_3` = `alias_3`.`alias_2`) WHERE (`table_1`.`column_3` > ?)
? = 10
----
NULL

statement ok
DELETE FROM `table_1` WHERE (`column_13` = 0)


statement ok
DELETE FROM `table_1` WHERE (`column_13` = 1)


statement ok
DELETE FROM `table_1` WHERE (`column_13` = 2)


statement ok
DELETE FROM `table_1` WHERE (`column_13` = 3)


statement ok
DELETE FROM `table_1` WHERE (`column_13` = 4)


query  rowsort
SELECT min(`table_1`.`column_1`) AS `alias_1` FROM `table_1` INNER JOIN (SELECT min(`table_1`.`column_2`) AS `alias_2` FROM `table_1`) AS alias_3 ON (`table_1`.`column_1` = `alias_3`.`alias_2`)
----
NULL

query  rowsort
SELECT min(`table_1`.`column_3`) AS `alias_1` FROM `table_1` INNER JOIN (SELECT `table_1`.`column_1` AS `alias_2` FROM `table_1`) AS alias_3 ON (`table_1`.`column_1` = `alias_3`.`alias_2`)
----
-1779690766

query  rowsort
SELECT min(`table_1`.`column_4`) AS `alias_1` FROM `table_1` INNER JOIN (SELECT min(`table_1`.`column_5`) AS `alias_2` FROM `table_1`) AS alias_3 ON (`table_1`.`column_3` = `alias_3`.`alias_2`)
----
NULL

query  rowsort
SELECT `table_1`.`column_6` AS `alias_3` FROM `table_1` INNER JOIN (SELECT min(`table_1`.`column_6`) AS `alias_1` FROM `table_1`) AS alias_2 ON (`table_1`.`column_6` = `alias_2`.`alias_1`) WHERE (`table_1`.`column_3` > ?)
? = 10
----


query  rowsort
SELECT `table_1`.`column_6` AS `alias_3` FROM `table_1` INNER JOIN (SELECT `table_1`.`column_6` AS `alias_1` FROM `table_1`) AS alias_2 ON (`table_1`.`column_6` = `alias_2`.`alias_1`) WHERE (`table_1`.`column_6` > ?)
? = 10
----
1615249205
654610315
89631266

query  rowsort
SELECT `table_1`.`column_6` AS `alias_3` FROM `table_1` INNER JOIN (SELECT min(`table_1`.`column_7`) AS `alias_1` FROM `table_1`) AS alias_2 ON (`table_1`.`column_6` = `alias_2`.`alias_1`) WHERE (`table_1`.`column_6` > ?)
? = 10
----


query  rowsort
SELECT min(`table_1`.`column_8`) AS `alias_1` FROM `table_1` INNER JOIN (SELECT min(`table_1`.`column_9`) AS `alias_2` FROM `table_1`) AS alias_3 ON (`table_1`.`column_3` = `alias_3`.`alias_2`) WHERE (`table_1`.`column_3` > ?)
? = 10
----
NULL

query  rowsort
SELECT min(`table_1`.`column_10`) AS `alias_1` FROM `table_1` INNER JOIN (SELECT `table_1`.`column_3` AS `alias_2` FROM `table_1`) AS alias_3 ON (`table_1`.`column_3` = `alias_3`.`alias_2`) WHERE (`table_1`.`column_3` > ?)
? = 10
----
-1113529120

query  rowsort
SELECT min(`table_1`.`column_11`) AS `alias_1` FROM `table_1` INNER JOIN (SELECT min(`table_1`.`column_12`) AS `alias_2` FROM `table_1`) AS alias_3 ON (`table_1`.`column_3` = `alias_3`.`alias_2`) WHERE (`table_1`.`column_3` > ?)
? = 10
----
NULL
