# Generated by:
#     target/debug/noria-logictest permute --compare-to mysql://root:noria@127.1/noria -d 3 -o logictests/generated/mysql/ --only range_param --random --include-deletes --rows-per-table 10 --subquery-depth 1

statement ok
CREATE TABLE `table_1` (`column_7` INT, `column_3` INT, `column_9` INT, `column_10` INT, `column_12` INT, `column_11` INT, `column_13` INT, `column_5` INT, `column_4` INT, `column_8` INT, `column_1` INT, `column_2` INT, `column_6` INT, PRIMARY KEY (`column_13`))


statement ok
INSERT INTO `table_1` (`column_7`, `column_3`, `column_9`, `column_10`, `column_12`, `column_11`, `column_13`, `column_5`, `column_4`, `column_8`, `column_1`, `column_2`, `column_6`) VALUES (-1535834974, -2039965254, 2132563601, -1413065606, 286350915, -1438560146, 0, 51824679, -1766300735, 226651316, -1995224271, -1941083761, 1762575054), (116746667, 223297737, -837063660, 711612201, 800845046, 2102421386, 1, -373153575, -2102258269, 612137722, -272927749, -1475076315, -745675197), (1579245130, 1301743524, 885267416, -2027051940, -1216335932, -2086190922, 2, -848019466, 1846188907, 1320550436, -855347900, 2124183281, 764785252), (605426040, 870440028, 1601074727, -651712620, -751311071, -1875707859, 3, 1375915058, 1020178672, -402920647, 1517243808, 1585324454, 1865013736), (-1042159497, -378764518, -970191187, 623859372, -529229069, -1023685988, 4, 1735276038, 702455253, 1567849017, -1595573533, 487352883, -2095302174), (497952324, -504310575, 1858534967, -1616119753, 1394262668, 1178064792, 5, 725413290, -1321461722, 1150548334, -1025737085, -1422580813, 818738409), (-391900119, 1384661327, 643504484, 279513511, -1026436204, -452266793, 6, 1686726402, 400721463, 1860974382, 1893827719, -1210856962, 156146060), (2042031931, -1809774633, -1580296208, 1668761739, -2136965862, 1956368227, 7, 247339003, -1468315187, 1990140675, 1425205031, 741190831, -1799325370), (294109251, -1167544512, 1238893353, -1276656953, 491421051, -370538532, 8, 43385715, 417093957, -1015163376, -372090976, 1374700157, -184422698), (-1197554785, 1267273640, -707527943, -1252159744, -220873456, 1740569944, 9, -527762890, -10036260, 219145681, -2090732350, 38147818, -388797604)


query  rowsort
SELECT avg(distinct `table_1`.`column_1`) AS `alias_1` FROM `table_1` INNER JOIN (SELECT avg(distinct `table_1`.`column_2`) AS `alias_2` FROM `table_1`) AS alias_3 ON (`table_1`.`column_1` = `alias_3`.`alias_2`)
----
NULL

query  rowsort
SELECT avg(distinct `table_1`.`column_3`) AS `alias_1` FROM `table_1` INNER JOIN (SELECT `table_1`.`column_1` AS `alias_2` FROM `table_1`) AS alias_3 ON (`table_1`.`column_1` = `alias_3`.`alias_2`)
----
-85294323.6000

query  rowsort
SELECT avg(distinct `table_1`.`column_4`) AS `alias_1` FROM `table_1` INNER JOIN (SELECT avg(distinct `table_1`.`column_5`) AS `alias_2` FROM `table_1`) AS alias_3 ON (`table_1`.`column_5` = `alias_3`.`alias_2`)
----
NULL

query  rowsort
SELECT `table_1`.`column_5` AS `alias_3` FROM `table_1` INNER JOIN (SELECT avg(distinct `table_1`.`column_6`) AS `alias_1` FROM `table_1`) AS alias_2 ON (`table_1`.`column_5` = `alias_2`.`alias_1`) WHERE (`table_1`.`column_5` > ?)
? = 10
----


query  rowsort
SELECT `table_1`.`column_5` AS `alias_3` FROM `table_1` INNER JOIN (SELECT `table_1`.`column_5` AS `alias_1` FROM `table_1`) AS alias_2 ON (`table_1`.`column_5` = `alias_2`.`alias_1`) WHERE (`table_1`.`column_5` > ?)
? = 10
----
1375915058
1686726402
1735276038
247339003
43385715
51824679
725413290

query  rowsort
SELECT `table_1`.`column_5` AS `alias_3` FROM `table_1` INNER JOIN (SELECT avg(distinct `table_1`.`column_7`) AS `alias_1` FROM `table_1`) AS alias_2 ON (`table_1`.`column_5` = `alias_2`.`alias_1`) WHERE (`table_1`.`column_5` > ?)
? = 10
----


query  rowsort
SELECT avg(distinct `table_1`.`column_8`) AS `alias_1` FROM `table_1` INNER JOIN (SELECT avg(distinct `table_1`.`column_9`) AS `alias_2` FROM `table_1`) AS alias_3 ON (`table_1`.`column_7` = `alias_3`.`alias_2`) WHERE (`table_1`.`column_7` > ?)
? = 10
----
NULL

query  rowsort
SELECT avg(distinct `table_1`.`column_10`) AS `alias_1` FROM `table_1` INNER JOIN (SELECT `table_1`.`column_7` AS `alias_2` FROM `table_1`) AS alias_3 ON (`table_1`.`column_7` = `alias_3`.`alias_2`) WHERE (`table_1`.`column_7` > ?)
? = 10
----
-531861221.0000

query  rowsort
SELECT avg(distinct `table_1`.`column_11`) AS `alias_1` FROM `table_1` INNER JOIN (SELECT avg(distinct `table_1`.`column_12`) AS `alias_2` FROM `table_1`) AS alias_3 ON (`table_1`.`column_7` = `alias_3`.`alias_2`) WHERE (`table_1`.`column_7` > ?)
? = 10
----
NULL

statement ok
DELETE FROM `table_1` WHERE (`column_13` = 0)


statement ok
DELETE FROM `table_1` WHERE (`column_13` = 1)


statement ok
DELETE FROM `table_1` WHERE (`column_13` = 2)


statement ok
DELETE FROM `table_1` WHERE (`column_13` = 3)


statement ok
DELETE FROM `table_1` WHERE (`column_13` = 4)


query  rowsort
SELECT avg(distinct `table_1`.`column_1`) AS `alias_1` FROM `table_1` INNER JOIN (SELECT avg(distinct `table_1`.`column_2`) AS `alias_2` FROM `table_1`) AS alias_3 ON (`table_1`.`column_1` = `alias_3`.`alias_2`)
----
NULL

query  rowsort
SELECT avg(distinct `table_1`.`column_3`) AS `alias_1` FROM `table_1` INNER JOIN (SELECT `table_1`.`column_1` AS `alias_2` FROM `table_1`) AS alias_3 ON (`table_1`.`column_1` = `alias_3`.`alias_2`)
----
-165938950.6000

query  rowsort
SELECT avg(distinct `table_1`.`column_4`) AS `alias_1` FROM `table_1` INNER JOIN (SELECT avg(distinct `table_1`.`column_5`) AS `alias_2` FROM `table_1`) AS alias_3 ON (`table_1`.`column_5` = `alias_3`.`alias_2`)
----
NULL

query  rowsort
SELECT `table_1`.`column_5` AS `alias_3` FROM `table_1` INNER JOIN (SELECT avg(distinct `table_1`.`column_6`) AS `alias_1` FROM `table_1`) AS alias_2 ON (`table_1`.`column_5` = `alias_2`.`alias_1`) WHERE (`table_1`.`column_5` > ?)
? = 10
----


query  rowsort
SELECT `table_1`.`column_5` AS `alias_3` FROM `table_1` INNER JOIN (SELECT `table_1`.`column_5` AS `alias_1` FROM `table_1`) AS alias_2 ON (`table_1`.`column_5` = `alias_2`.`alias_1`) WHERE (`table_1`.`column_5` > ?)
? = 10
----
1686726402
247339003
43385715
725413290

query  rowsort
SELECT `table_1`.`column_5` AS `alias_3` FROM `table_1` INNER JOIN (SELECT avg(distinct `table_1`.`column_7`) AS `alias_1` FROM `table_1`) AS alias_2 ON (`table_1`.`column_5` = `alias_2`.`alias_1`) WHERE (`table_1`.`column_5` > ?)
? = 10
----


query  rowsort
SELECT avg(distinct `table_1`.`column_8`) AS `alias_1` FROM `table_1` INNER JOIN (SELECT avg(distinct `table_1`.`column_9`) AS `alias_2` FROM `table_1`) AS alias_3 ON (`table_1`.`column_7` = `alias_3`.`alias_2`) WHERE (`table_1`.`column_7` > ?)
? = 10
----
NULL

query  rowsort
SELECT avg(distinct `table_1`.`column_10`) AS `alias_1` FROM `table_1` INNER JOIN (SELECT `table_1`.`column_7` AS `alias_2` FROM `table_1`) AS alias_3 ON (`table_1`.`column_7` = `alias_3`.`alias_2`) WHERE (`table_1`.`column_7` > ?)
? = 10
----
-408004989.0000

query  rowsort
SELECT avg(distinct `table_1`.`column_11`) AS `alias_1` FROM `table_1` INNER JOIN (SELECT avg(distinct `table_1`.`column_12`) AS `alias_2` FROM `table_1`) AS alias_3 ON (`table_1`.`column_7` = `alias_3`.`alias_2`) WHERE (`table_1`.`column_7` > ?)
? = 10
----
NULL
