# Generated by:
#     target/debug/noria-logictest permute --compare-to mysql://root:noria@127.1/noria -d 3 -o logictests/generated/mysql/ --only range_param --random --include-deletes --rows-per-table 10 --subquery-depth 1

statement ok
CREATE TABLE `table_4` (`column_2` INT, `column_4` INT, `column_3` INT, `column_1` INT, PRIMARY KEY (`column_4`))


statement ok
CREATE TABLE `table_3` (`column_2` INT, `column_3` INT, `column_1` INT, PRIMARY KEY (`column_3`))


statement ok
CREATE TABLE `table_2` (`column_2` INT, `column_3` INT, `column_1` INT, PRIMARY KEY (`column_3`))


statement ok
CREATE TABLE `table_1` (`column_4` INT, `column_1` INT, `column_2` INT, `column_3` INT, `column_5` INT, PRIMARY KEY (`column_5`))


statement ok
CREATE TABLE `table_5` (`column_1` INT, `column_3` INT, `column_2` INT, PRIMARY KEY (`column_3`))


statement ok
INSERT INTO `table_4` (`column_2`, `column_4`, `column_3`, `column_1`) VALUES (-983979348, 0, 155836340, 1225183008), (1868340567, 1, -1341094236, 1821810719), (-1126782073, 2, -436610386, -2012424842), (896734386, 3, 1818027901, 91602970), (-1893517439, 4, -1859102169, -1427132583), (-1681671699, 5, 1657643796, -422868727), (204725781, 6, -1096465066, 925374437), (-1054149774, 7, -58824322, 1046186898), (-1670245632, 8, -2029466239, 1011979190), (107931385, 9, 285126316, 1173001816)


statement ok
INSERT INTO `table_3` (`column_2`, `column_3`, `column_1`) VALUES (-139933298, 0, -730622048), (805798178, 1, 276125270), (-2064213296, 2, -2020438962), (-55186674, 3, 837984996), (1675308023, 4, 998107524), (-163197160, 5, 353233001), (-230633104, 6, -340660467), (54489076, 7, -1873070131), (1735002114, 8, 1772731109), (161666806, 9, -1781499502)


statement ok
INSERT INTO `table_2` (`column_2`, `column_3`, `column_1`) VALUES (982186150, 0, -1541713045), (389871840, 1, 1438218326), (867305772, 2, -306781439), (587744257, 3, -1203542693), (-2119042035, 4, 477011641), (-723259369, 5, -30100990), (-1979649554, 6, -347791702), (837549664, 7, 395472518), (768905048, 8, 901912208), (-1858077872, 9, 1037826132)


statement ok
INSERT INTO `table_1` (`column_4`, `column_1`, `column_2`, `column_3`, `column_5`) VALUES (1902427270, -157702816, -308354824, -1512660840, 0), (619309946, -1293598384, 439962813, 661417949, 1), (-521409174, 1686434790, 1767716036, 1211863565, 2), (1931176456, -2122312761, 1796999241, -1705624834, 3), (800470932, 104432430, 1584714493, -1825278698, 4), (-1686803458, 1092397195, -1065345515, 288982434, 5), (1350655981, -251546427, -1054491736, 749643915, 6), (1531109462, 2108865785, 1826764486, -1037119371, 7), (-934101352, 263187630, 2074515531, 1355929458, 8), (1411321511, -10069371, -1181115420, -1942888396, 9)


statement ok
INSERT INTO `table_5` (`column_1`, `column_3`, `column_2`) VALUES (386023456, 0, 1616578051), (2041210265, 1, -390556848), (-1748448090, 2, -1275578011), (601540533, 3, 1094007744), (-1592686933, 4, -828679943), (1367848731, 5, 649813806), (-1135387492, 6, -2039299208), (-1817714946, 7, -724377869), (630467886, 8, -1853952157), (-1833498241, 9, -1742336774)


query  rowsort
SELECT `table_1`.`column_2` AS `alias_1`, `table_2`.`column_2` AS `alias_2` FROM `table_1` LEFT JOIN `table_2` ON (`table_1`.`column_1` = `table_2`.`column_1`)
----
-1054491736
NULL
-1065345515
NULL
-1181115420
NULL
-308354824
NULL
1584714493
NULL
1767716036
NULL
1796999241
NULL
1826764486
NULL
2074515531
NULL
439962813
NULL

query  rowsort
SELECT 1 AS `alias_1`
----
1

query  rowsort
SELECT `table_1`.`column_1` AS `alias_1` FROM `table_1` WHERE (`table_1`.`column_1` > ?)
? = 10
----
104432430
1092397195
1686434790
2108865785
263187630

query  rowsort
SELECT `table_1`.`column_3` AS `alias_1`, `table_3`.`column_2` AS `alias_2`, 1 AS `alias_3` FROM `table_1` LEFT JOIN `table_3` ON (`table_1`.`column_1` = `table_3`.`column_1`)
----
30 values hashing to 3b0c09934d0aa1363d9fba71fd302655

query  rowsort
SELECT `table_1`.`column_4` AS `alias_1`, `table_4`.`column_2` AS `alias_2` FROM `table_1` LEFT JOIN `table_4` ON (`table_1`.`column_1` = `table_4`.`column_1`) WHERE (`table_1`.`column_4` > ?)
? = 10
----
1350655981
NULL
1411321511
NULL
1531109462
NULL
1902427270
NULL
1931176456
NULL
619309946
NULL
800470932
NULL

query  rowsort
SELECT 1 AS `alias_1` FROM `table_4` WHERE (`table_4`.`column_2` > ?)
? = 10
----
1
1
1
1

query  rowsort
SELECT `table_4`.`column_3` AS `alias_1`, `table_5`.`column_2` AS `alias_2`, 1 AS `alias_3` FROM `table_4` LEFT JOIN `table_5` ON (`table_4`.`column_2` = `table_5`.`column_1`) WHERE (`table_4`.`column_3` > ?)
? = 10
----
155836340
NULL
1
1657643796
NULL
1
1818027901
NULL
1
285126316
NULL
1

statement ok
DELETE FROM `table_4` WHERE (`column_4` = 0)


statement ok
DELETE FROM `table_4` WHERE (`column_4` = 1)


statement ok
DELETE FROM `table_4` WHERE (`column_4` = 2)


statement ok
DELETE FROM `table_4` WHERE (`column_4` = 3)


statement ok
DELETE FROM `table_4` WHERE (`column_4` = 4)


statement ok
DELETE FROM `table_3` WHERE (`column_3` = 0)


statement ok
DELETE FROM `table_3` WHERE (`column_3` = 1)


statement ok
DELETE FROM `table_3` WHERE (`column_3` = 2)


statement ok
DELETE FROM `table_3` WHERE (`column_3` = 3)


statement ok
DELETE FROM `table_3` WHERE (`column_3` = 4)


statement ok
DELETE FROM `table_2` WHERE (`column_3` = 0)


statement ok
DELETE FROM `table_2` WHERE (`column_3` = 1)


statement ok
DELETE FROM `table_2` WHERE (`column_3` = 2)


statement ok
DELETE FROM `table_2` WHERE (`column_3` = 3)


statement ok
DELETE FROM `table_2` WHERE (`column_3` = 4)


statement ok
DELETE FROM `table_1` WHERE (`column_5` = 0)


statement ok
DELETE FROM `table_1` WHERE (`column_5` = 1)


statement ok
DELETE FROM `table_1` WHERE (`column_5` = 2)


statement ok
DELETE FROM `table_1` WHERE (`column_5` = 3)


statement ok
DELETE FROM `table_1` WHERE (`column_5` = 4)


statement ok
DELETE FROM `table_5` WHERE (`column_3` = 0)


statement ok
DELETE FROM `table_5` WHERE (`column_3` = 1)


statement ok
DELETE FROM `table_5` WHERE (`column_3` = 2)


statement ok
DELETE FROM `table_5` WHERE (`column_3` = 3)


statement ok
DELETE FROM `table_5` WHERE (`column_3` = 4)


query  rowsort
SELECT `table_1`.`column_2` AS `alias_1`, `table_2`.`column_2` AS `alias_2` FROM `table_1` LEFT JOIN `table_2` ON (`table_1`.`column_1` = `table_2`.`column_1`)
----
-1054491736
NULL
-1065345515
NULL
-1181115420
NULL
1826764486
NULL
2074515531
NULL

query  rowsort
SELECT 1 AS `alias_1`
----
1

query  rowsort
SELECT `table_1`.`column_1` AS `alias_1` FROM `table_1` WHERE (`table_1`.`column_1` > ?)
? = 10
----
1092397195
2108865785
263187630

query  rowsort
SELECT `table_1`.`column_3` AS `alias_1`, `table_3`.`column_2` AS `alias_2`, 1 AS `alias_3` FROM `table_1` LEFT JOIN `table_3` ON (`table_1`.`column_1` = `table_3`.`column_1`)
----
-1037119371
NULL
1
-1942888396
NULL
1
1355929458
NULL
1
288982434
NULL
1
749643915
NULL
1

query  rowsort
SELECT `table_1`.`column_4` AS `alias_1`, `table_4`.`column_2` AS `alias_2` FROM `table_1` LEFT JOIN `table_4` ON (`table_1`.`column_1` = `table_4`.`column_1`) WHERE (`table_1`.`column_4` > ?)
? = 10
----
1350655981
NULL
1411321511
NULL
1531109462
NULL

query  rowsort
SELECT 1 AS `alias_1` FROM `table_4` WHERE (`table_4`.`column_2` > ?)
? = 10
----
1
1

query  rowsort
SELECT `table_4`.`column_3` AS `alias_1`, `table_5`.`column_2` AS `alias_2`, 1 AS `alias_3` FROM `table_4` LEFT JOIN `table_5` ON (`table_4`.`column_2` = `table_5`.`column_1`) WHERE (`table_4`.`column_3` > ?)
? = 10
----
1657643796
NULL
1
285126316
NULL
1
