# Generated by:
#     target/debug/noria-logictest permute --compare-to mysql://root:noria@127.1/noria -d 3 -o logictests/generated/mysql/ --only range_param --random --include-deletes --rows-per-table 10 --subquery-depth 1

statement ok
CREATE TABLE `table_1` (`column_2` INT, `column_3` INT, `column_5` INT, `column_6` INT, `column_1` INT, `column_4` INT, PRIMARY KEY (`column_6`))


statement ok
INSERT INTO `table_1` (`column_2`, `column_3`, `column_5`, `column_6`, `column_1`, `column_4`) VALUES (-392095974, -848438265, -1858961939, 0, -1564635179, -363603748), (1241563659, -1390486102, 1326461504, 1, 1571050829, -2107293696), (-1100917702, -2033185646, -874419486, 2, -133881357, 1114720685), (952367796, -2063460542, 727398474, 3, 1544916176, 696780132), (831640746, 948729537, -1018497795, 4, 1070747526, -1363006096), (25004897, 2045154812, 2137936460, 5, 1792855305, -569508172), (-421096489, 1042600206, 878486984, 6, -1004741301, 1077704904), (-1083413288, -536720971, 1574115562, 7, -1380109655, 2119345666), (1111917930, -1086133963, -1298550898, 8, -488968327, 1071011173), (2011906280, -1945664982, 683569805, 9, 861001958, -987648613)


query  rowsort
SELECT `table_1`.`column_1` AS `alias_1` FROM `table_1` WHERE ((`table_1`.`column_1` = ?) AND (`table_1`.`column_1` = ?))
? = 1
? = 1
----


query  rowsort
SELECT avg(`table_1`.`column_2`) AS `alias_1` FROM `table_1`
----
317687785.5000

query  rowsort
SELECT `table_1`.`column_2` AS `alias_1` FROM `table_1` WHERE (`table_1`.`column_2` > ?)
? = 10
----
1111917930
1241563659
2011906280
25004897
831640746
952367796

query  rowsort
SELECT avg(`table_1`.`column_3`) AS `alias_1` FROM `table_1` WHERE ((`table_1`.`column_2` = ?) AND (`table_1`.`column_2` = ?))
? = 1
? = 1
----
NULL

query  rowsort
SELECT `table_1`.`column_2` AS `alias_1` FROM `table_1` WHERE (((`table_1`.`column_2` = ?) AND (`table_1`.`column_2` = ?)) AND (`table_1`.`column_2` > ?))
? = 1
? = 1
? = 10
----


query  rowsort
SELECT avg(`table_1`.`column_4`) AS `alias_1` FROM `table_1` WHERE (`table_1`.`column_2` > ?)
? = 10
----
-543277545.3333

query  rowsort
SELECT avg(`table_1`.`column_5`) AS `alias_1` FROM `table_1` WHERE (((`table_1`.`column_2` = ?) AND (`table_1`.`column_2` = ?)) AND (`table_1`.`column_2` > ?))
? = 1
? = 1
? = 10
----
NULL

statement ok
DELETE FROM `table_1` WHERE (`column_6` = 0)


statement ok
DELETE FROM `table_1` WHERE (`column_6` = 1)


statement ok
DELETE FROM `table_1` WHERE (`column_6` = 2)


statement ok
DELETE FROM `table_1` WHERE (`column_6` = 3)


statement ok
DELETE FROM `table_1` WHERE (`column_6` = 4)


query  rowsort
SELECT `table_1`.`column_1` AS `alias_1` FROM `table_1` WHERE ((`table_1`.`column_1` = ?) AND (`table_1`.`column_1` = ?))
? = 1
? = 1
----


query  rowsort
SELECT avg(`table_1`.`column_2`) AS `alias_1` FROM `table_1`
----
328863866.0000

query  rowsort
SELECT `table_1`.`column_2` AS `alias_1` FROM `table_1` WHERE (`table_1`.`column_2` > ?)
? = 10
----
1111917930
2011906280
25004897

query  rowsort
SELECT avg(`table_1`.`column_3`) AS `alias_1` FROM `table_1` WHERE ((`table_1`.`column_2` = ?) AND (`table_1`.`column_2` = ?))
? = 1
? = 1
----
NULL

query  rowsort
SELECT `table_1`.`column_2` AS `alias_1` FROM `table_1` WHERE (((`table_1`.`column_2` = ?) AND (`table_1`.`column_2` = ?)) AND (`table_1`.`column_2` > ?))
? = 1
? = 1
? = 10
----


query  rowsort
SELECT avg(`table_1`.`column_4`) AS `alias_1` FROM `table_1` WHERE (`table_1`.`column_2` > ?)
? = 10
----
-162048537.3333

query  rowsort
SELECT avg(`table_1`.`column_5`) AS `alias_1` FROM `table_1` WHERE (((`table_1`.`column_2` = ?) AND (`table_1`.`column_2` = ?)) AND (`table_1`.`column_2` > ?))
? = 1
? = 1
? = 10
----
NULL
