# Generated by:
#     target/debug/noria-logictest permute --compare-to mysql://root:noria@127.1/noria -d 3 -o logictests/generated/mysql/ --only range_param --random --include-deletes --rows-per-table 10 --subquery-depth 1 --overwrite-tests

statement ok
CREATE TABLE `table_1` (`column_2` INT, `column_1` INT, PRIMARY KEY (`column_2`))


statement ok
INSERT INTO `table_1` (`column_2`, `column_1`) VALUES (0, 1257408999), (1, 528357814), (2, 301436611), (3, 305250864), (4, 543038260), (5, -1931559812), (6, -227401790), (7, 1121165614), (8, 241498541), (9, 1617987357)


query  rowsort
SELECT 1 AS `alias_1`
----
1

query  rowsort
SELECT `table_1`.`column_1` AS `alias_1` FROM `table_1` WHERE (`table_1`.`column_1` > ?)
? = 10
----
1121165614
1257408999
1617987357
241498541
301436611
305250864
528357814
543038260

query  rowsort
SELECT 1 AS `alias_1` FROM `table_1` WHERE (`table_1`.`column_1` > ?)
? = 10
----
1
1
1
1
1
1
1
1

statement ok
DELETE FROM `table_1` WHERE (`column_2` = 0)


statement ok
DELETE FROM `table_1` WHERE (`column_2` = 1)


statement ok
DELETE FROM `table_1` WHERE (`column_2` = 2)


statement ok
DELETE FROM `table_1` WHERE (`column_2` = 3)


statement ok
DELETE FROM `table_1` WHERE (`column_2` = 4)


query  rowsort
SELECT 1 AS `alias_1`
----
1

query  rowsort
SELECT `table_1`.`column_1` AS `alias_1` FROM `table_1` WHERE (`table_1`.`column_1` > ?)
? = 10
----
1121165614
1617987357
241498541

query  rowsort
SELECT 1 AS `alias_1` FROM `table_1` WHERE (`table_1`.`column_1` > ?)
? = 10
----
1
1
1
