# Generated by:
#     target/debug/noria-logictest permute --compare-to mysql://root:noria@127.1/noria -d 3 -o logictests/generated/mysql/ --only range_param --random --include-deletes --rows-per-table 10 --subquery-depth 1

statement ok
CREATE TABLE `table_1` (`column_1` INT, `column_2` INT, `column_3` INT, `column_5` INT, `column_4` INT, PRIMARY KEY (`column_5`))


statement ok
INSERT INTO `table_1` (`column_1`, `column_2`, `column_3`, `column_5`, `column_4`) VALUES (1042854659, -718683660, 290680163, 0, 571506422), (-644031559, 1590634604, 737534498, 1, 434757005), (432897272, 695518167, -1186554194, 2, -1373940791), (1099625855, 1434385122, -1960697289, 3, 623346376), (-1506578595, -221766929, 413929696, 4, -1003928088), (713376353, -778951594, 1897912313, 5, -1795836521), (-201881749, 1189638541, 569019833, 6, 143316875), (-730199260, 503805679, -1370228850, 7, 856745885), (1173683394, -1321354880, 1162920039, 8, 735788975), (920066340, 270778848, -1748536421, 9, 957798284)


query  rowsort
SELECT 1 AS `alias_1`
----
1

query  rowsort
SELECT avg(`table_1`.`column_1`) AS `alias_1` FROM `table_1`
----
229981271.0000

query  rowsort
SELECT `table_1`.`column_1` AS `alias_1` FROM `table_1` WHERE (`table_1`.`column_1` > ?)
? = 10
----
1042854659
1099625855
1173683394
432897272
713376353
920066340

query  rowsort
SELECT 1 AS `alias_1`, avg(`table_1`.`column_2`) AS `alias_2` FROM `table_1`
----
1
264400389.8000

query  rowsort
SELECT 1 AS `alias_1` FROM `table_1` WHERE (`table_1`.`column_1` > ?)
? = 10
----
1
1
1
1
1
1

query  rowsort
SELECT avg(`table_1`.`column_3`) AS `alias_1` FROM `table_1` WHERE (`table_1`.`column_1` > ?)
? = 10
----
-257379231.5000

query  rowsort
SELECT 1 AS `alias_1`, avg(`table_1`.`column_4`) AS `alias_2` FROM `table_1` WHERE (`table_1`.`column_1` > ?)
? = 10
----
1
-46889542.5000

statement ok
DELETE FROM `table_1` WHERE (`column_5` = 0)


statement ok
DELETE FROM `table_1` WHERE (`column_5` = 1)


statement ok
DELETE FROM `table_1` WHERE (`column_5` = 2)


statement ok
DELETE FROM `table_1` WHERE (`column_5` = 3)


statement ok
DELETE FROM `table_1` WHERE (`column_5` = 4)


query  rowsort
SELECT 1 AS `alias_1`
----
1

query  rowsort
SELECT avg(`table_1`.`column_1`) AS `alias_1` FROM `table_1`
----
375009015.6000

query  rowsort
SELECT `table_1`.`column_1` AS `alias_1` FROM `table_1` WHERE (`table_1`.`column_1` > ?)
? = 10
----
1173683394
713376353
920066340

query  rowsort
SELECT 1 AS `alias_1`, avg(`table_1`.`column_2`) AS `alias_2` FROM `table_1`
----
1
-27216681.2000

query  rowsort
SELECT 1 AS `alias_1` FROM `table_1` WHERE (`table_1`.`column_1` > ?)
? = 10
----
1
1
1

query  rowsort
SELECT avg(`table_1`.`column_3`) AS `alias_1` FROM `table_1` WHERE (`table_1`.`column_1` > ?)
? = 10
----
437431977.0000

query  rowsort
SELECT 1 AS `alias_1`, avg(`table_1`.`column_4`) AS `alias_2` FROM `table_1` WHERE (`table_1`.`column_1` > ?)
? = 10
----
1
-34083087.3333
