# Generated by:
#     target/debug/noria-logictest permute --compare-to mysql://root:noria@127.1/noria -d 3 -o logictests/generated/mysql/ --only range_param --random --include-deletes --rows-per-table 10 --subquery-depth 1

statement ok
CREATE TABLE `table_2` (`column_6` INT, `column_3` INT, `column_2` INT, `column_4` INT, `column_1` INT, `column_5` INT, PRIMARY KEY (`column_6`))


statement ok
CREATE TABLE `table_3` (`column_2` INT, `column_1` INT, `column_3` INT, PRIMARY KEY (`column_3`))


statement ok
CREATE TABLE `table_4` (`column_3` INT, `column_2` INT, `column_1` INT, PRIMARY KEY (`column_3`))


statement ok
CREATE TABLE `table_5` (`column_2` INT, `column_1` INT, `column_3` INT, PRIMARY KEY (`column_3`))


statement ok
CREATE TABLE `table_1` (`column_1` INT, `column_2` INT, `column_3` INT, PRIMARY KEY (`column_3`))


statement ok
INSERT INTO `table_2` (`column_6`, `column_3`, `column_2`, `column_4`, `column_1`, `column_5`) VALUES (0, 1214906297, -921192668, -463420620, -79761671, -596222166), (1, 392791320, -1976330165, 1620564073, 548177059, -720776100), (2, 615000360, -88877418, 1584146509, 1721144175, -1303967543), (3, 1226825505, 939156806, -893402495, 1339425422, -1402175511), (4, 434312928, -1643908725, -252965164, -1254185762, -1336516563), (5, 1050862501, -694344275, 1020249253, -1384754429, -117754303), (6, -387919740, 733524052, -1931716940, -2072159334, -2056809770), (7, 1629376244, -725845531, 1129348734, 738318297, -592495234), (8, 651012891, 28585677, -182527285, -620272956, -222579273), (9, -1265521940, -1663871025, 1782218180, 451457984, -1429655722)


statement ok
INSERT INTO `table_3` (`column_2`, `column_1`, `column_3`) VALUES (1636850333, 1446379215, 0), (1026877003, -251833171, 1), (738691105, 843312981, 2), (1584831432, 1937017054, 3), (-1797204992, -1563305435, 4), (1739933098, -154606232, 5), (1719511407, -621635489, 6), (473634418, 107346012, 7), (1630156075, -273246236, 8), (1710727727, -703774220, 9)


statement ok
INSERT INTO `table_4` (`column_3`, `column_2`, `column_1`) VALUES (0, 22888989, -1421711760), (1, 606944908, 1076879392), (2, 651232565, -1850355251), (3, -62481216, 350803215), (4, -306727628, 1446760836), (5, 786656121, 443531010), (6, 1757850461, 99069381), (7, -1784273449, -1290713486), (8, -597791570, 505259232), (9, 1514245934, -1560580648)


statement ok
INSERT INTO `table_5` (`column_2`, `column_1`, `column_3`) VALUES (1703924476, -2052764768, 0), (-1317407339, 1419196359, 1), (-91580597, 1848302435, 2), (-1182297121, -1006812126, 3), (-782402236, 167049378, 4), (774644552, 408041821, 5), (-1323344254, -823333466, 6), (-1898025444, 1600692686, 7), (442893346, -1869646650, 8), (410879252, 183998522, 9)


statement ok
INSERT INTO `table_1` (`column_1`, `column_2`, `column_3`) VALUES (905383153, 552321714, 0), (-657720221, -1616369766, 1), (2035738085, -325585442, 2), (-248157508, -288344814, 3), (-1257956273, 1905324049, 4), (668056095, 1937439791, 5), (-37367522, -266499784, 6), (-1306571328, 556799851, 7), (1221342833, 1464438807, 8), (1887232073, 1078456512, 9)


query  rowsort
SELECT 1 AS `alias_1`
----
1

query  rowsort
SELECT `table_1`.`column_2` AS `alias_1`, `table_2`.`column_2` AS `alias_2` FROM `table_1` LEFT JOIN `table_2` ON (`table_1`.`column_1` = `table_2`.`column_1`)
----
-1616369766
NULL
-266499784
NULL
-288344814
NULL
-325585442
NULL
1078456512
NULL
1464438807
NULL
1905324049
NULL
1937439791
NULL
552321714
NULL
556799851
NULL

query  rowsort
SELECT `table_2`.`column_1` AS `alias_1` FROM `table_2` WHERE (`table_2`.`column_1` > ?)
? = 10
----
1339425422
1721144175
451457984
548177059
738318297

query  rowsort
SELECT 1 AS `alias_1`, `table_2`.`column_3` AS `alias_2`, `table_3`.`column_2` AS `alias_3` FROM `table_2` LEFT JOIN `table_3` ON (`table_2`.`column_1` = `table_3`.`column_1`)
----
30 values hashing to db64a135f7e7a4220053ea38ac286f6c

query  rowsort
SELECT 1 AS `alias_1` FROM `table_2` WHERE (`table_2`.`column_1` > ?)
? = 10
----
1
1
1
1
1

query  rowsort
SELECT `table_2`.`column_4` AS `alias_1`, `table_4`.`column_2` AS `alias_2` FROM `table_2` LEFT JOIN `table_4` ON (`table_2`.`column_1` = `table_4`.`column_1`) WHERE (`table_2`.`column_3` > ?)
? = 10
----
-182527285
NULL
-252965164
NULL
-463420620
NULL
-893402495
NULL
1020249253
NULL
1129348734
NULL
1584146509
NULL
1620564073
NULL

query  rowsort
SELECT 1 AS `alias_1`, `table_2`.`column_5` AS `alias_2`, `table_5`.`column_2` AS `alias_3` FROM `table_2` LEFT JOIN `table_5` ON (`table_2`.`column_3` = `table_5`.`column_1`) WHERE (`table_2`.`column_3` > ?)
? = 10
----
24 values hashing to 3c9462f02c7d27ab40127894b1e8d330

statement ok
DELETE FROM `table_2` WHERE (`column_6` = 0)


statement ok
DELETE FROM `table_2` WHERE (`column_6` = 1)


statement ok
DELETE FROM `table_2` WHERE (`column_6` = 2)


statement ok
DELETE FROM `table_2` WHERE (`column_6` = 3)


statement ok
DELETE FROM `table_2` WHERE (`column_6` = 4)


statement ok
DELETE FROM `table_3` WHERE (`column_3` = 0)


statement ok
DELETE FROM `table_3` WHERE (`column_3` = 1)


statement ok
DELETE FROM `table_3` WHERE (`column_3` = 2)


statement ok
DELETE FROM `table_3` WHERE (`column_3` = 3)


statement ok
DELETE FROM `table_3` WHERE (`column_3` = 4)


statement ok
DELETE FROM `table_4` WHERE (`column_3` = 0)


statement ok
DELETE FROM `table_4` WHERE (`column_3` = 1)


statement ok
DELETE FROM `table_4` WHERE (`column_3` = 2)


statement ok
DELETE FROM `table_4` WHERE (`column_3` = 3)


statement ok
DELETE FROM `table_4` WHERE (`column_3` = 4)


statement ok
DELETE FROM `table_5` WHERE (`column_3` = 0)


statement ok
DELETE FROM `table_5` WHERE (`column_3` = 1)


statement ok
DELETE FROM `table_5` WHERE (`column_3` = 2)


statement ok
DELETE FROM `table_5` WHERE (`column_3` = 3)


statement ok
DELETE FROM `table_5` WHERE (`column_3` = 4)


statement ok
DELETE FROM `table_1` WHERE (`column_3` = 0)


statement ok
DELETE FROM `table_1` WHERE (`column_3` = 1)


statement ok
DELETE FROM `table_1` WHERE (`column_3` = 2)


statement ok
DELETE FROM `table_1` WHERE (`column_3` = 3)


statement ok
DELETE FROM `table_1` WHERE (`column_3` = 4)


query  rowsort
SELECT 1 AS `alias_1`
----
1

query  rowsort
SELECT `table_1`.`column_2` AS `alias_1`, `table_2`.`column_2` AS `alias_2` FROM `table_1` LEFT JOIN `table_2` ON (`table_1`.`column_1` = `table_2`.`column_1`)
----
-266499784
NULL
1078456512
NULL
1464438807
NULL
1937439791
NULL
556799851
NULL

query  rowsort
SELECT `table_2`.`column_1` AS `alias_1` FROM `table_2` WHERE (`table_2`.`column_1` > ?)
? = 10
----
451457984
738318297

query  rowsort
SELECT 1 AS `alias_1`, `table_2`.`column_3` AS `alias_2`, `table_3`.`column_2` AS `alias_3` FROM `table_2` LEFT JOIN `table_3` ON (`table_2`.`column_1` = `table_3`.`column_1`)
----
1
-1265521940
NULL
1
-387919740
NULL
1
1050862501
NULL
1
1629376244
NULL
1
651012891
NULL

query  rowsort
SELECT 1 AS `alias_1` FROM `table_2` WHERE (`table_2`.`column_1` > ?)
? = 10
----
1
1

query  rowsort
SELECT `table_2`.`column_4` AS `alias_1`, `table_4`.`column_2` AS `alias_2` FROM `table_2` LEFT JOIN `table_4` ON (`table_2`.`column_1` = `table_4`.`column_1`) WHERE (`table_2`.`column_3` > ?)
? = 10
----
-182527285
NULL
1020249253
NULL
1129348734
NULL

query  rowsort
SELECT 1 AS `alias_1`, `table_2`.`column_5` AS `alias_2`, `table_5`.`column_2` AS `alias_3` FROM `table_2` LEFT JOIN `table_5` ON (`table_2`.`column_3` = `table_5`.`column_1`) WHERE (`table_2`.`column_3` > ?)
? = 10
----
1
-117754303
NULL
1
-222579273
NULL
1
-592495234
NULL
