# Generated by:
#     target/debug/noria-logictest permute --compare-to mysql://root:noria@127.1/noria -d 3 -o logictests/generated/mysql/ --only range_param --random --include-deletes --rows-per-table 10 --subquery-depth 1 --overwrite-tests

statement ok
CREATE TABLE `table_1` (`column_8` INT, `column_1` INT, `column_6` INT, `column_5` INT, `column_3` INT, `column_9` INT, `column_7` INT, `column_2` INT, `column_4` INT, PRIMARY KEY (`column_9`))


statement ok
INSERT INTO `table_1` (`column_8`, `column_1`, `column_6`, `column_5`, `column_3`, `column_9`, `column_7`, `column_2`, `column_4`) VALUES (-642248635, -486872533, -1731440716, 1444399052, -592514609, 0, 1890119518, 1396173527, 1679875252), (148596021, -1423672116, -2123899470, -852475200, 462633884, 1, 1576956769, 1959757455, 169903546), (1717389446, -1501953692, -1927822853, 568322395, -1292000276, 2, 1598225139, 1251841011, -1115461892), (-1623926872, 1514026493, 1488190590, -851213244, 140943395, 3, 1888833921, -315492574, 1215650548), (690194814, -843442912, -579744547, -1106081031, -1982742134, 4, -524235566, -239167368, 293655720), (-1374666772, -187665239, 561020739, -715734951, -73946135, 5, -1417949006, -858580031, 121897788), (-218534905, -2050432572, -29511728, -1757637691, -829550909, 6, -602736819, 3431755, 561671700), (-217346339, 1169932054, 1676885866, 1951602982, 1292847529, 7, -867031767, 1006934558, 435659064), (-1991173450, -1123003705, -810576147, 1314529571, -857518894, 8, 1517740621, -1107647959, 1002435819), (-808980594, -1890685285, 77439967, 267761457, 1088298209, 9, 893722827, 93496511, -1135686165)


query  rowsort
SELECT sum(`table_1`.`column_1`) AS `alias_1` FROM `table_1`
----
-6823769507

query  rowsort
SELECT avg(`table_1`.`column_2`) AS `alias_1` FROM `table_1`
----
319074688.5000

query  rowsort
SELECT `table_1`.`column_2` AS `alias_1` FROM `table_1` WHERE (`table_1`.`column_2` > ?)
? = 10
----
1006934558
1251841011
1396173527
1959757455
3431755
93496511

query  rowsort
SELECT sum(`table_1`.`column_3`) AS `alias_1`, avg(`table_1`.`column_4`) AS `alias_2` FROM `table_1`
----
-2643549940
322960138.0000

query  rowsort
SELECT sum(`table_1`.`column_5`) AS `alias_1` FROM `table_1` WHERE (`table_1`.`column_5` > ?)
? = 10
----
5546615457

query  rowsort
SELECT avg(`table_1`.`column_6`) AS `alias_1` FROM `table_1` WHERE (`table_1`.`column_5` > ?)
? = 10
----
-543102776.6000

query  rowsort
SELECT sum(`table_1`.`column_7`) AS `alias_1`, avg(`table_1`.`column_8`) AS `alias_2` FROM `table_1` WHERE (`table_1`.`column_8` > ?)
? = 10
----
2650946342
852060093.6667

statement ok
DELETE FROM `table_1` WHERE (`column_9` = 0)


statement ok
DELETE FROM `table_1` WHERE (`column_9` = 1)


statement ok
DELETE FROM `table_1` WHERE (`column_9` = 2)


statement ok
DELETE FROM `table_1` WHERE (`column_9` = 3)


statement ok
DELETE FROM `table_1` WHERE (`column_9` = 4)


query  rowsort
SELECT sum(`table_1`.`column_1`) AS `alias_1` FROM `table_1`
----
-4081854747

query  rowsort
SELECT avg(`table_1`.`column_2`) AS `alias_1` FROM `table_1`
----
-172473033.2000

query  rowsort
SELECT `table_1`.`column_2` AS `alias_1` FROM `table_1` WHERE (`table_1`.`column_2` > ?)
? = 10
----
1006934558
3431755
93496511

query  rowsort
SELECT sum(`table_1`.`column_3`) AS `alias_1`, avg(`table_1`.`column_4`) AS `alias_2` FROM `table_1`
----
620129800
197195641.2000

query  rowsort
SELECT sum(`table_1`.`column_5`) AS `alias_1` FROM `table_1` WHERE (`table_1`.`column_5` > ?)
? = 10
----
3533894010

query  rowsort
SELECT avg(`table_1`.`column_6`) AS `alias_1` FROM `table_1` WHERE (`table_1`.`column_5` > ?)
? = 10
----
314583228.6667

query  rowsort
SELECT sum(`table_1`.`column_7`) AS `alias_1`, avg(`table_1`.`column_8`) AS `alias_2` FROM `table_1` WHERE (`table_1`.`column_8` > ?)
? = 10
----
NULL
NULL
