# Generated by:
#     target/debug/noria-logictest permute --compare-to mysql://root:noria@127.1/noria -d 3 -o logictests/generated/mysql/ --only range_param --random --include-deletes --rows-per-table 10 --subquery-depth 1 --overwrite-tests

statement ok
CREATE TABLE `table_1` (`column_3` INT, `column_5` INT, `column_2` INT, `column_4` INT, `column_1` INT, PRIMARY KEY (`column_5`))


statement ok
INSERT INTO `table_1` (`column_3`, `column_5`, `column_2`, `column_4`, `column_1`) VALUES (2086178478, 0, -615834654, 1991651991, -1141056949), (-1287127817, 1, 912020046, 54791862, 362099354), (-1586599953, 2, 960453562, -1641222138, 2040381446), (2113096041, 3, -685705580, 1441659851, 581814612), (-1137195854, 4, -1677825903, 1852071256, -1322279245), (1078249243, 5, 89325269, -1348458195, -220083824), (-1689175427, 6, 1752428837, -2010923474, 2081797466), (205330401, 7, -160467737, -1186886408, -112317262), (572997363, 8, -969932428, 905488414, -172595378), (-1584747027, 9, -152912772, 2069311619, -820657788)


query  rowsort
SELECT sum(`table_1`.`column_1`) AS `alias_1` FROM `table_1`
----
1277102432

query  rowsort
SELECT `table_1`.`column_1` AS `alias_1` FROM `table_1` WHERE ((`table_1`.`column_1` > ?) AND (`table_1`.`column_1` > ?))
? = 10
? = 10
----
2040381446
2081797466
362099354
581814612

query  rowsort
SELECT `table_1`.`column_1` AS `alias_1` FROM `table_1` WHERE (`table_1`.`column_1` > ?)
? = 10
----
2040381446
2081797466
362099354
581814612

query  rowsort
SELECT sum(`table_1`.`column_2`) AS `alias_1` FROM `table_1` WHERE ((`table_1`.`column_2` > ?) AND (`table_1`.`column_2` > ?))
? = 10
? = 10
----
3714227714

query  rowsort
SELECT sum(`table_1`.`column_3`) AS `alias_1` FROM `table_1` WHERE (`table_1`.`column_2` > ?)
? = 10
----
-3484653954

query  rowsort
SELECT `table_1`.`column_2` AS `alias_1` FROM `table_1` WHERE (((`table_1`.`column_2` > ?) AND (`table_1`.`column_2` > ?)) AND (`table_1`.`column_2` > ?))
? = 10
? = 10
? = 10
----
1752428837
89325269
912020046
960453562

query  rowsort
SELECT sum(`table_1`.`column_4`) AS `alias_1` FROM `table_1` WHERE (((`table_1`.`column_3` > ?) AND (`table_1`.`column_3` > ?)) AND (`table_1`.`column_3` > ?))
? = 10
? = 10
? = 10
----
1803455653

statement ok
DELETE FROM `table_1` WHERE (`column_5` = 0)


statement ok
DELETE FROM `table_1` WHERE (`column_5` = 1)


statement ok
DELETE FROM `table_1` WHERE (`column_5` = 2)


statement ok
DELETE FROM `table_1` WHERE (`column_5` = 3)


statement ok
DELETE FROM `table_1` WHERE (`column_5` = 4)


query  rowsort
SELECT sum(`table_1`.`column_1`) AS `alias_1` FROM `table_1`
----
756143214

query  rowsort
SELECT `table_1`.`column_1` AS `alias_1` FROM `table_1` WHERE ((`table_1`.`column_1` > ?) AND (`table_1`.`column_1` > ?))
? = 10
? = 10
----
2081797466

query  rowsort
SELECT `table_1`.`column_1` AS `alias_1` FROM `table_1` WHERE (`table_1`.`column_1` > ?)
? = 10
----
2081797466

query  rowsort
SELECT sum(`table_1`.`column_2`) AS `alias_1` FROM `table_1` WHERE ((`table_1`.`column_2` > ?) AND (`table_1`.`column_2` > ?))
? = 10
? = 10
----
1841754106

query  rowsort
SELECT sum(`table_1`.`column_3`) AS `alias_1` FROM `table_1` WHERE (`table_1`.`column_2` > ?)
? = 10
----
-610926184

query  rowsort
SELECT `table_1`.`column_2` AS `alias_1` FROM `table_1` WHERE (((`table_1`.`column_2` > ?) AND (`table_1`.`column_2` > ?)) AND (`table_1`.`column_2` > ?))
? = 10
? = 10
? = 10
----
1752428837
89325269

query  rowsort
SELECT sum(`table_1`.`column_4`) AS `alias_1` FROM `table_1` WHERE (((`table_1`.`column_3` > ?) AND (`table_1`.`column_3` > ?)) AND (`table_1`.`column_3` > ?))
? = 10
? = 10
? = 10
----
-1629856189
