# Generated by:
#     target/debug/noria-logictest permute --compare-to mysql://root:noria@127.1/noria -d 3 -o logictests/generated/mysql/ --only range_param --random --include-deletes --rows-per-table 10 --subquery-depth 1 --overwrite-tests

statement ok
CREATE TABLE `table_1` (`column_6` INT, `column_7` INT, `column_8` INT, `column_4` INT, `column_1` INT, `column_5` INT, `column_2` INT, `column_9` INT, `column_3` INT, PRIMARY KEY (`column_9`))


statement ok
INSERT INTO `table_1` (`column_6`, `column_7`, `column_8`, `column_4`, `column_1`, `column_5`, `column_2`, `column_9`, `column_3`) VALUES (-376467758, 1299906221, 1552158713, 276819525, 1567618176, -1099843976, 2036003287, 0, 857604378), (1338119263, 333287661, -671220860, 2080669141, -1827816449, 1258577338, 748885660, 1, 979060194), (-1754581871, 773926901, -1654667845, 1957087955, 1938613248, 586453140, -1265970473, 2, 814488704), (1301112429, -1021815544, -583786692, 1247891507, -1254070080, -1264024964, -1064298425, 3, -1092791238), (-1959263538, 2016439062, -1123946185, -1390410797, -1606256624, -882806104, 1642378823, 4, -712736563), (270825167, 393141534, 1290164207, 900413225, 1272140635, -442856125, -1462781766, 5, -931773558), (2043410432, -1674488157, -775266486, 231839552, 1358102203, 63079093, -1105541866, 6, -2052185690), (-48226481, -1140195554, -1872474902, -1749448947, 492191870, -2063561689, -257622905, 7, -2125439842), (1671680624, -2089487104, 985952925, 781527582, 1861567386, -832919726, -1397326191, 8, 889988192), (91177320, -264139244, -2122530055, -1174543294, 1275289619, 1493185882, -563227510, 9, 487058861)


query  rowsort
SELECT sum(`table_1`.`column_1`) AS `alias_1` FROM `table_1`
----
5077379984

query  rowsort
SELECT count(`table_1`.`column_2`) AS `alias_1` FROM `table_1`
----
10

query  rowsort
SELECT `table_1`.`column_2` AS `alias_1` FROM `table_1` WHERE (`table_1`.`column_2` > ?)
? = 10
----
1642378823
2036003287
748885660

query  rowsort
SELECT sum(`table_1`.`column_3`) AS `alias_1`, count(`table_1`.`column_4`) AS `alias_2` FROM `table_1`
----
-2886726562
10

query  rowsort
SELECT sum(`table_1`.`column_5`) AS `alias_1` FROM `table_1` WHERE (`table_1`.`column_2` > ?)
? = 10
----
-724072742

query  rowsort
SELECT count(`table_1`.`column_6`) AS `alias_1` FROM `table_1` WHERE (`table_1`.`column_2` > ?)
? = 10
----
3

query  rowsort
SELECT sum(`table_1`.`column_7`) AS `alias_1`, count(`table_1`.`column_8`) AS `alias_2` FROM `table_1` WHERE (`table_1`.`column_6` > ?)
? = 10
----
-4323500854
6

statement ok
DELETE FROM `table_1` WHERE (`column_9` = 0)


statement ok
DELETE FROM `table_1` WHERE (`column_9` = 1)


statement ok
DELETE FROM `table_1` WHERE (`column_9` = 2)


statement ok
DELETE FROM `table_1` WHERE (`column_9` = 3)


statement ok
DELETE FROM `table_1` WHERE (`column_9` = 4)


query  rowsort
SELECT sum(`table_1`.`column_1`) AS `alias_1` FROM `table_1`
----
6259291713

query  rowsort
SELECT count(`table_1`.`column_2`) AS `alias_1` FROM `table_1`
----
5

query  rowsort
SELECT `table_1`.`column_2` AS `alias_1` FROM `table_1` WHERE (`table_1`.`column_2` > ?)
? = 10
----


query  rowsort
SELECT sum(`table_1`.`column_3`) AS `alias_1`, count(`table_1`.`column_4`) AS `alias_2` FROM `table_1`
----
-3732352037
5

query  rowsort
SELECT sum(`table_1`.`column_5`) AS `alias_1` FROM `table_1` WHERE (`table_1`.`column_2` > ?)
? = 10
----
NULL

query  rowsort
SELECT count(`table_1`.`column_6`) AS `alias_1` FROM `table_1` WHERE (`table_1`.`column_2` > ?)
? = 10
----
0

query  rowsort
SELECT sum(`table_1`.`column_7`) AS `alias_1`, count(`table_1`.`column_8`) AS `alias_2` FROM `table_1` WHERE (`table_1`.`column_6` > ?)
? = 10
----
-3634972971
4
