# Generated by:
#     target/debug/noria-logictest permute --compare-to mysql://root:noria@127.1/noria -d 3 -o logictests/generated/mysql/ --only range_param --random --include-deletes --rows-per-table 10 --subquery-depth 1 --overwrite-tests

statement ok
CREATE TABLE `table_1` (`column_6` INT, `column_12` INT, `column_4` INT, `column_10` INT, `column_5` INT, `column_1` INT, `column_7` INT, `column_8` INT, `column_11` INT, `column_9` INT, `column_2` INT, `column_3` INT, `column_13` INT, PRIMARY KEY (`column_13`))


statement ok
INSERT INTO `table_1` (`column_6`, `column_12`, `column_4`, `column_10`, `column_5`, `column_1`, `column_7`, `column_8`, `column_11`, `column_9`, `column_2`, `column_3`, `column_13`) VALUES (-236419909, -906178025, 406660224, 1771412493, 1512770107, 1237543741, -30430325, -1185035948, -644722767, 1365108824, -455576160, 150493210, 0), (1986800882, -178819480, -1786615132, 118222171, 1020788922, 2020904981, 946062656, 2090641132, 1696869701, -119427461, 659725973, 1853295045, 1), (-252251317, -2025780643, 1224278627, -288483062, 418161603, -1148092213, 1174178619, 666944445, 1192861461, 1727549023, -323287381, -1999816705, 2), (1153040526, 1662592760, -9591946, 1719689499, 1246565701, -844263135, 1052334572, -2121813749, 894222905, 981470953, 1552585091, -870009606, 3), (1792703444, -1006453694, -123737914, -1322944160, -1186026147, 210330312, -289325680, -2144842565, -578762215, 2066471258, 1713511587, 2010840790, 4), (975312032, -1474649894, 1617743758, -1077692635, 835086753, 1161189003, -1505609261, -1313461597, 648000232, -526618424, -2106760176, -2098599138, 5), (1911868528, 2138396863, -542429403, -122512381, 1617754579, -2127630699, -2009278180, 1244000066, 826820144, 999418864, -1642607249, 986915965, 6), (-1711172927, -664177395, 811423542, 184850207, -1952020602, -1124333603, -119571412, 1376676096, -2024779490, 973899378, 812308101, 1837488575, 7), (1104186414, -1983135373, -418608294, -817431926, 1132877923, -1137080659, 306650741, 1358220815, -855008288, 1612738059, -2031170579, -1408092772, 8), (61934152, 503227357, 673404957, 1382939181, -1332969968, 1970937221, 1918642066, 1714782490, 1164702565, 587179488, -742103314, 1985538314, 9)


query  rowsort
SELECT sum(`table_1`.`column_1`) AS `alias_1` FROM `table_1` INNER JOIN (SELECT sum(`table_1`.`column_2`) AS `alias_2` FROM `table_1`) AS alias_3 ON (`table_1`.`column_2` = `alias_3`.`alias_2`)
----
NULL

query  rowsort
SELECT sum(`table_1`.`column_3`) AS `alias_1` FROM `table_1` INNER JOIN (SELECT `table_1`.`column_2` AS `alias_2` FROM `table_1`) AS alias_3 ON (`table_1`.`column_2` = `alias_3`.`alias_2`)
----
2448053678

query  rowsort
SELECT sum(`table_1`.`column_4`) AS `alias_1` FROM `table_1` INNER JOIN (SELECT sum(`table_1`.`column_5`) AS `alias_2` FROM `table_1`) AS alias_3 ON (`table_1`.`column_5` = `alias_3`.`alias_2`)
----
NULL

query  rowsort
SELECT `table_1`.`column_5` AS `alias_3` FROM `table_1` INNER JOIN (SELECT sum(`table_1`.`column_6`) AS `alias_1` FROM `table_1`) AS alias_2 ON (`table_1`.`column_5` = `alias_2`.`alias_1`) WHERE (`table_1`.`column_5` > ?)
? = 10
----


query  rowsort
SELECT `table_1`.`column_5` AS `alias_3` FROM `table_1` INNER JOIN (SELECT `table_1`.`column_5` AS `alias_1` FROM `table_1`) AS alias_2 ON (`table_1`.`column_5` = `alias_2`.`alias_1`) WHERE (`table_1`.`column_5` > ?)
? = 10
----
1020788922
1132877923
1246565701
1512770107
1617754579
418161603
835086753

query  rowsort
SELECT `table_1`.`column_5` AS `alias_3` FROM `table_1` INNER JOIN (SELECT sum(`table_1`.`column_7`) AS `alias_1` FROM `table_1`) AS alias_2 ON (`table_1`.`column_5` = `alias_2`.`alias_1`) WHERE (`table_1`.`column_5` > ?)
? = 10
----


query  rowsort
SELECT sum(`table_1`.`column_8`) AS `alias_1` FROM `table_1` INNER JOIN (SELECT sum(`table_1`.`column_9`) AS `alias_2` FROM `table_1`) AS alias_3 ON (`table_1`.`column_6` = `alias_3`.`alias_2`) WHERE (`table_1`.`column_6` > ?)
? = 10
----
NULL

query  rowsort
SELECT sum(`table_1`.`column_10`) AS `alias_1` FROM `table_1` INNER JOIN (SELECT `table_1`.`column_6` AS `alias_2` FROM `table_1`) AS alias_3 ON (`table_1`.`column_6` = `alias_3`.`alias_2`) WHERE (`table_1`.`column_6` > ?)
? = 10
----
-119730251

query  rowsort
SELECT sum(`table_1`.`column_11`) AS `alias_1` FROM `table_1` INNER JOIN (SELECT sum(`table_1`.`column_12`) AS `alias_2` FROM `table_1`) AS alias_3 ON (`table_1`.`column_6` = `alias_3`.`alias_2`) WHERE (`table_1`.`column_6` > ?)
? = 10
----
NULL

statement ok
DELETE FROM `table_1` WHERE (`column_13` = 0)


statement ok
DELETE FROM `table_1` WHERE (`column_13` = 1)


statement ok
DELETE FROM `table_1` WHERE (`column_13` = 2)


statement ok
DELETE FROM `table_1` WHERE (`column_13` = 3)


statement ok
DELETE FROM `table_1` WHERE (`column_13` = 4)


query  rowsort
SELECT sum(`table_1`.`column_1`) AS `alias_1` FROM `table_1` INNER JOIN (SELECT sum(`table_1`.`column_2`) AS `alias_2` FROM `table_1`) AS alias_3 ON (`table_1`.`column_2` = `alias_3`.`alias_2`)
----
NULL

query  rowsort
SELECT sum(`table_1`.`column_3`) AS `alias_1` FROM `table_1` INNER JOIN (SELECT `table_1`.`column_2` AS `alias_2` FROM `table_1`) AS alias_3 ON (`table_1`.`column_2` = `alias_3`.`alias_2`)
----
1303250944

query  rowsort
SELECT sum(`table_1`.`column_4`) AS `alias_1` FROM `table_1` INNER JOIN (SELECT sum(`table_1`.`column_5`) AS `alias_2` FROM `table_1`) AS alias_3 ON (`table_1`.`column_5` = `alias_3`.`alias_2`)
----
NULL

query  rowsort
SELECT `table_1`.`column_5` AS `alias_3` FROM `table_1` INNER JOIN (SELECT sum(`table_1`.`column_6`) AS `alias_1` FROM `table_1`) AS alias_2 ON (`table_1`.`column_5` = `alias_2`.`alias_1`) WHERE (`table_1`.`column_5` > ?)
? = 10
----


query  rowsort
SELECT `table_1`.`column_5` AS `alias_3` FROM `table_1` INNER JOIN (SELECT `table_1`.`column_5` AS `alias_1` FROM `table_1`) AS alias_2 ON (`table_1`.`column_5` = `alias_2`.`alias_1`) WHERE (`table_1`.`column_5` > ?)
? = 10
----
1132877923
1617754579
835086753

query  rowsort
SELECT `table_1`.`column_5` AS `alias_3` FROM `table_1` INNER JOIN (SELECT sum(`table_1`.`column_7`) AS `alias_1` FROM `table_1`) AS alias_2 ON (`table_1`.`column_5` = `alias_2`.`alias_1`) WHERE (`table_1`.`column_5` > ?)
? = 10
----


query  rowsort
SELECT sum(`table_1`.`column_8`) AS `alias_1` FROM `table_1` INNER JOIN (SELECT sum(`table_1`.`column_9`) AS `alias_2` FROM `table_1`) AS alias_3 ON (`table_1`.`column_6` = `alias_3`.`alias_2`) WHERE (`table_1`.`column_6` > ?)
? = 10
----
NULL

query  rowsort
SELECT sum(`table_1`.`column_10`) AS `alias_1` FROM `table_1` INNER JOIN (SELECT `table_1`.`column_6` AS `alias_2` FROM `table_1`) AS alias_3 ON (`table_1`.`column_6` = `alias_3`.`alias_2`) WHERE (`table_1`.`column_6` > ?)
? = 10
----
-634697761

query  rowsort
SELECT sum(`table_1`.`column_11`) AS `alias_1` FROM `table_1` INNER JOIN (SELECT sum(`table_1`.`column_12`) AS `alias_2` FROM `table_1`) AS alias_3 ON (`table_1`.`column_6` = `alias_3`.`alias_2`) WHERE (`table_1`.`column_6` > ?)
? = 10
----
NULL
