# Generated by:
#     target/debug/noria-logictest permute --compare-to mysql://root:noria@127.1/noria -d 3 -o logictests/generated/mysql/ --only range_param --random --include-deletes --rows-per-table 10 --subquery-depth 1 --overwrite-tests

statement ok
CREATE TABLE `table_1` (`column_9` INT, `column_2` INT, `column_4` INT, `column_6` INT, `column_3` INT, `column_1` INT, `column_8` INT, `column_5` INT, `column_7` INT, PRIMARY KEY (`column_9`))


statement ok
INSERT INTO `table_1` (`column_9`, `column_2`, `column_4`, `column_6`, `column_3`, `column_1`, `column_8`, `column_5`, `column_7`) VALUES (0, 1867877198, 1173714411, -742782748, -406194120, 1267839439, -1985590342, 1484430794, -1283227173), (1, -1391079949, 439414810, -1719782230, 824920514, 147845030, 1543145576, 1848718286, -2046590776), (2, -420748102, -343223204, -1445539911, -235695621, 1457772728, -631132371, 32170315, -535760456), (3, 1079012609, 817983447, 232327997, 92541260, 146912560, 622292027, 924544364, 778780535), (4, 58899678, 1508314776, 1872614193, 739563523, -1422746027, -1051743704, 286351109, -480312563), (5, 85422921, 1038900526, 1536191403, 1607520246, 1382019808, -1497398468, 2097500738, 290690549), (6, -1916162606, -1793070489, -1986855179, -1120427255, -1963927050, -256893812, 585346016, 661103474), (7, 1778890952, -153062633, 1504122645, 1645975874, 1772888304, -1201529625, -1746325696, 81836411), (8, 817016891, 899579751, 499431348, 476806047, -120745454, 1689839666, -90024612, 1108571256), (9, -140738297, -576972115, -1728819174, 278014358, 880169005, 1115174348, 1391379113, 350468820)


query  rowsort
SELECT sum(`table_1`.`column_1`) AS `alias_1` FROM `table_1`
----
3548028343

query  rowsort
SELECT min(`table_1`.`column_2`) AS `alias_1` FROM `table_1`
----
-1916162606

query  rowsort
SELECT `table_1`.`column_2` AS `alias_1` FROM `table_1` WHERE (`table_1`.`column_2` > ?)
? = 10
----
1079012609
1778890952
1867877198
58899678
817016891
85422921

query  rowsort
SELECT sum(`table_1`.`column_3`) AS `alias_1`, min(`table_1`.`column_4`) AS `alias_2` FROM `table_1`
----
3903024826
-1793070489

query  rowsort
SELECT sum(`table_1`.`column_5`) AS `alias_1` FROM `table_1` WHERE (`table_1`.`column_3` > ?)
? = 10
----
4712143302

query  rowsort
SELECT min(`table_1`.`column_6`) AS `alias_1` FROM `table_1` WHERE (`table_1`.`column_6` > ?)
? = 10
----
232327997

query  rowsort
SELECT sum(`table_1`.`column_7`) AS `alias_1`, min(`table_1`.`column_8`) AS `alias_2` FROM `table_1` WHERE (`table_1`.`column_2` > ?)
? = 10
----
496339015
-1985590342

statement ok
DELETE FROM `table_1` WHERE (`column_9` = 0)


statement ok
DELETE FROM `table_1` WHERE (`column_9` = 1)


statement ok
DELETE FROM `table_1` WHERE (`column_9` = 2)


statement ok
DELETE FROM `table_1` WHERE (`column_9` = 3)


statement ok
DELETE FROM `table_1` WHERE (`column_9` = 4)


query  rowsort
SELECT sum(`table_1`.`column_1`) AS `alias_1` FROM `table_1`
----
1950404613

query  rowsort
SELECT min(`table_1`.`column_2`) AS `alias_1` FROM `table_1`
----
-1916162606

query  rowsort
SELECT `table_1`.`column_2` AS `alias_1` FROM `table_1` WHERE (`table_1`.`column_2` > ?)
? = 10
----
1778890952
817016891
85422921

query  rowsort
SELECT sum(`table_1`.`column_3`) AS `alias_1`, min(`table_1`.`column_4`) AS `alias_2` FROM `table_1`
----
2887889270
-1793070489

query  rowsort
SELECT sum(`table_1`.`column_5`) AS `alias_1` FROM `table_1` WHERE (`table_1`.`column_3` > ?)
? = 10
----
1652529543

query  rowsort
SELECT min(`table_1`.`column_6`) AS `alias_1` FROM `table_1` WHERE (`table_1`.`column_6` > ?)
? = 10
----
499431348

query  rowsort
SELECT sum(`table_1`.`column_7`) AS `alias_1`, min(`table_1`.`column_8`) AS `alias_2` FROM `table_1` WHERE (`table_1`.`column_2` > ?)
? = 10
----
1481098216
-1497398468
