# Generated by:
#     target/debug/noria-logictest permute --compare-to mysql://root:noria@127.1/noria -d 3 -o logictests/generated/mysql/ --only range_param --random --include-deletes --rows-per-table 10 --subquery-depth 1 --overwrite-tests

statement ok
CREATE TABLE `table_1` (`column_2` INT, `column_10` INT, `column_8` INT, `column_5` INT, `column_6` INT, `column_11` INT, `column_12` INT, `column_3` INT, `column_7` INT, `column_9` INT, `column_13` INT, `column_1` INT, `column_4` INT, PRIMARY KEY (`column_13`))


statement ok
INSERT INTO `table_1` (`column_2`, `column_10`, `column_8`, `column_5`, `column_6`, `column_11`, `column_12`, `column_3`, `column_7`, `column_9`, `column_13`, `column_1`, `column_4`) VALUES (726393567, 486621491, -1129292026, 1293551447, 1097636733, 180889403, -1415976634, 370369704, 1386326863, -1496307719, 0, -1876706235, -356225478), (-151835673, -1725960656, -1699181579, 68841912, -1871286123, -174518908, 690682010, -1107916365, 528005542, -566409015, 1, 1835037251, -522427510), (1161613491, -153801286, 345159991, -1786566029, 505712260, 2127819268, 154831939, -1553846159, -2115059009, -2112051769, 2, -1304220621, 1587502034), (-829848642, 1661045675, -1696372553, -727340855, -103933328, 1834803706, -1757356556, -345527545, 1108326677, 4860553, 3, 851555138, -700834269), (-1264564090, 807035434, -1101799709, 2047959243, -1290813215, 907450234, 383545073, 915582989, -326119884, -550677615, 4, -1726158630, 2079021771), (1003202090, -2023774377, 1115018102, -1136375078, -264344503, 456851653, -412071521, -1187846419, 365867210, -801098398, 5, 867757311, 2140446932), (-1488152516, 1572829673, -731190729, 1707180142, -1656908071, 2025794041, 826546343, -2008015146, 577040723, 700486204, 6, 1347456598, 744040815), (-1136968864, 9583804, 1584983378, 8685106, 1591510822, 780433761, 165317050, -1064797881, -1789163240, 1109581038, 7, -1840281678, 1717168092), (-295251567, 1875618940, 1647922151, -2031856871, 1238103736, 289521021, 1536391612, 1286939922, 1947901972, -1002112844, 8, 954306457, 1432251322), (1621671889, -1026551724, 1547494293, -838618908, -565877037, -569120228, 854812032, -662571909, 1086705958, -1812591461, 9, 99212893, 824561052)


query  rowsort
WITH `alias_3` AS (SELECT sum(distinct `table_1`.`column_2`) AS `alias_2` FROM `table_1`) SELECT sum(distinct `table_1`.`column_1`) AS `alias_1` FROM `table_1` INNER JOIN `alias_3` ON (`table_1`.`column_1` = `alias_3`.`alias_2`)
----
NULL

query  rowsort
WITH `alias_3` AS (SELECT `table_1`.`column_3` AS `alias_2` FROM `table_1`) SELECT sum(distinct `table_1`.`column_3`) AS `alias_1` FROM `table_1` INNER JOIN `alias_3` ON (`table_1`.`column_3` = `alias_3`.`alias_2`)
----
-5357628809

query  rowsort
WITH `alias_3` AS (SELECT sum(distinct `table_1`.`column_5`) AS `alias_2` FROM `table_1`) SELECT sum(distinct `table_1`.`column_4`) AS `alias_1` FROM `table_1` INNER JOIN `alias_3` ON (`table_1`.`column_4` = `alias_3`.`alias_2`)
----
NULL

query  rowsort
WITH `alias_2` AS (SELECT sum(distinct `table_1`.`column_6`) AS `alias_1` FROM `table_1`) SELECT `table_1`.`column_4` AS `alias_3` FROM `table_1` INNER JOIN `alias_2` ON (`table_1`.`column_4` = `alias_2`.`alias_1`) WHERE (`table_1`.`column_4` > ?)
? = 10
----


query  rowsort
WITH `alias_2` AS (SELECT `table_1`.`column_4` AS `alias_1` FROM `table_1`) SELECT `table_1`.`column_4` AS `alias_3` FROM `table_1` INNER JOIN `alias_2` ON (`table_1`.`column_4` = `alias_2`.`alias_1`) WHERE (`table_1`.`column_4` > ?)
? = 10
----
1432251322
1587502034
1717168092
2079021771
2140446932
744040815
824561052

query  rowsort
WITH `alias_2` AS (SELECT sum(distinct `table_1`.`column_7`) AS `alias_1` FROM `table_1`) SELECT `table_1`.`column_4` AS `alias_3` FROM `table_1` INNER JOIN `alias_2` ON (`table_1`.`column_4` = `alias_2`.`alias_1`) WHERE (`table_1`.`column_4` > ?)
? = 10
----


query  rowsort
WITH `alias_3` AS (SELECT sum(distinct `table_1`.`column_9`) AS `alias_2` FROM `table_1`) SELECT sum(distinct `table_1`.`column_8`) AS `alias_1` FROM `table_1` INNER JOIN `alias_3` ON (`table_1`.`column_2` = `alias_3`.`alias_2`) WHERE (`table_1`.`column_2` > ?)
? = 10
----
NULL

query  rowsort
WITH `alias_3` AS (SELECT `table_1`.`column_2` AS `alias_2` FROM `table_1`) SELECT sum(distinct `table_1`.`column_10`) AS `alias_1` FROM `table_1` INNER JOIN `alias_3` ON (`table_1`.`column_2` = `alias_3`.`alias_2`) WHERE (`table_1`.`column_2` > ?)
? = 10
----
-2717505896

query  rowsort
WITH `alias_3` AS (SELECT sum(distinct `table_1`.`column_12`) AS `alias_2` FROM `table_1`) SELECT sum(distinct `table_1`.`column_11`) AS `alias_1` FROM `table_1` INNER JOIN `alias_3` ON (`table_1`.`column_2` = `alias_3`.`alias_2`) WHERE (`table_1`.`column_2` > ?)
? = 10
----
NULL

statement ok
DELETE FROM `table_1` WHERE (`column_13` = 0)


statement ok
DELETE FROM `table_1` WHERE (`column_13` = 1)


statement ok
DELETE FROM `table_1` WHERE (`column_13` = 2)


statement ok
DELETE FROM `table_1` WHERE (`column_13` = 3)


statement ok
DELETE FROM `table_1` WHERE (`column_13` = 4)


query  rowsort
WITH `alias_3` AS (SELECT sum(distinct `table_1`.`column_2`) AS `alias_2` FROM `table_1`) SELECT sum(distinct `table_1`.`column_1`) AS `alias_1` FROM `table_1` INNER JOIN `alias_3` ON (`table_1`.`column_1` = `alias_3`.`alias_2`)
----
NULL

query  rowsort
WITH `alias_3` AS (SELECT `table_1`.`column_3` AS `alias_2` FROM `table_1`) SELECT sum(distinct `table_1`.`column_3`) AS `alias_1` FROM `table_1` INNER JOIN `alias_3` ON (`table_1`.`column_3` = `alias_3`.`alias_2`)
----
-3636291433

query  rowsort
WITH `alias_3` AS (SELECT sum(distinct `table_1`.`column_5`) AS `alias_2` FROM `table_1`) SELECT sum(distinct `table_1`.`column_4`) AS `alias_1` FROM `table_1` INNER JOIN `alias_3` ON (`table_1`.`column_4` = `alias_3`.`alias_2`)
----
NULL

query  rowsort
WITH `alias_2` AS (SELECT sum(distinct `table_1`.`column_6`) AS `alias_1` FROM `table_1`) SELECT `table_1`.`column_4` AS `alias_3` FROM `table_1` INNER JOIN `alias_2` ON (`table_1`.`column_4` = `alias_2`.`alias_1`) WHERE (`table_1`.`column_4` > ?)
? = 10
----


query  rowsort
WITH `alias_2` AS (SELECT `table_1`.`column_4` AS `alias_1` FROM `table_1`) SELECT `table_1`.`column_4` AS `alias_3` FROM `table_1` INNER JOIN `alias_2` ON (`table_1`.`column_4` = `alias_2`.`alias_1`) WHERE (`table_1`.`column_4` > ?)
? = 10
----
1432251322
1717168092
2140446932
744040815
824561052

query  rowsort
WITH `alias_2` AS (SELECT sum(distinct `table_1`.`column_7`) AS `alias_1` FROM `table_1`) SELECT `table_1`.`column_4` AS `alias_3` FROM `table_1` INNER JOIN `alias_2` ON (`table_1`.`column_4` = `alias_2`.`alias_1`) WHERE (`table_1`.`column_4` > ?)
? = 10
----


query  rowsort
WITH `alias_3` AS (SELECT sum(distinct `table_1`.`column_9`) AS `alias_2` FROM `table_1`) SELECT sum(distinct `table_1`.`column_8`) AS `alias_1` FROM `table_1` INNER JOIN `alias_3` ON (`table_1`.`column_2` = `alias_3`.`alias_2`) WHERE (`table_1`.`column_2` > ?)
? = 10
----
NULL

query  rowsort
WITH `alias_3` AS (SELECT `table_1`.`column_2` AS `alias_2` FROM `table_1`) SELECT sum(distinct `table_1`.`column_10`) AS `alias_1` FROM `table_1` INNER JOIN `alias_3` ON (`table_1`.`column_2` = `alias_3`.`alias_2`) WHERE (`table_1`.`column_2` > ?)
? = 10
----
-3050326101

query  rowsort
WITH `alias_3` AS (SELECT sum(distinct `table_1`.`column_12`) AS `alias_2` FROM `table_1`) SELECT sum(distinct `table_1`.`column_11`) AS `alias_1` FROM `table_1` INNER JOIN `alias_3` ON (`table_1`.`column_2` = `alias_3`.`alias_2`) WHERE (`table_1`.`column_2` > ?)
? = 10
----
NULL
