# Generated by:
#     target/debug/noria-logictest permute --compare-to mysql://root:noria@127.1/noria -d 3 -o logictests/generated/mysql/ --only range_param --random --include-deletes --rows-per-table 10 --subquery-depth 1

statement ok
CREATE TABLE `table_1` (`column_8` INT, `column_1` INT, `column_2` INT, `column_4` INT, `column_9` INT, `column_3` INT, `column_6` INT, `column_7` INT, `column_5` INT, `column_10` INT, PRIMARY KEY (`column_10`))


statement ok
INSERT INTO `table_1` (`column_8`, `column_1`, `column_2`, `column_4`, `column_9`, `column_3`, `column_6`, `column_7`, `column_5`, `column_10`) VALUES (-2068331692, 2019958742, 1711198337, 1592590412, 1403097397, 2009158033, 566208841, 1586875315, -52838378, 0), (-1163280946, -2144231981, -327455342, 956891513, 1330538959, -651400330, -547078891, -1723227702, 1987919409, 1), (-1213906215, 629936266, 145473767, -488257739, 1420235981, 1211247794, -126777511, 447061462, -1892506781, 2), (-1664052889, -1836334485, 1299227978, -1795693550, 634263623, -1387755973, -947700480, -1876141740, -1341145494, 3), (-1169679487, 1458677704, -460194977, 282662548, -182819711, 1526433737, 1238436678, 672728249, 669448847, 4), (1542103631, -822848234, 1581271439, -907729744, -1909014221, -558600601, 23920999, 792134706, -193703406, 5), (1825888965, 710427253, 161359647, -933863856, -555722233, 481575900, -1649465115, 1624310384, -1576354986, 6), (710511266, -1560574510, 1674406410, 509972425, 1308841270, -548658993, -1385717348, 616479858, -1277442408, 7), (1558817490, 2052811060, 17078242, 871227781, -267746251, -218254166, -1777461740, -1904145821, -1370474878, 8), (-1472521342, 1172979694, -511017030, -1333373062, 776641753, 1681309847, 942259142, -333524396, 179879907, 9)


query  nosort
SELECT `table_1`.`column_1` AS `alias_1` FROM `table_1` ORDER BY `table_1`.`column_1` ASC LIMIT 10
----
-2144231981
-1836334485
-1560574510
-822848234
629936266
710427253
1172979694
1458677704
2019958742
2052811060

query  nosort
SELECT `table_1`.`column_1` AS `alias_1` FROM `table_1` ORDER BY `table_1`.`column_1` DESC LIMIT 10
----
2052811060
2019958742
1458677704
1172979694
710427253
629936266
-822848234
-1560574510
-1836334485
-2144231981

query  rowsort
SELECT avg(`table_1`.`column_2`) AS `alias_1` FROM `table_1`
----
529134847.1000

query  rowsort
SELECT `table_1`.`column_1` AS `alias_1` FROM `table_1` WHERE (`table_1`.`column_1` > ?)
? = 10
----
1172979694
1458677704
2019958742
2052811060
629936266
710427253

query  nosort
SELECT `table_1`.`column_1` AS `alias_1` FROM `table_1` ORDER BY `table_1`.`column_1` DESC LIMIT 10
----
2052811060
2019958742
1458677704
1172979694
710427253
629936266
-822848234
-1560574510
-1836334485
-2144231981

query  nosort
SELECT avg(`table_1`.`column_3`) AS `alias_1` FROM `table_1` GROUP BY `table_1`.`column_1` ORDER BY `table_1`.`column_1` ASC LIMIT 10
----
-651400330.0000
-1387755973.0000
-548658993.0000
-558600601.0000
1211247794.0000
481575900.0000
1681309847.0000
1526433737.0000
2009158033.0000
-218254166.0000

query  nosort
SELECT `table_1`.`column_1` AS `alias_1` FROM `table_1` WHERE (`table_1`.`column_1` > ?) ORDER BY `table_1`.`column_1` ASC LIMIT 10
? = 10
----
629936266
710427253
1172979694
1458677704
2019958742
2052811060

query  nosort
SELECT avg(`table_1`.`column_4`) AS `alias_1` FROM `table_1` GROUP BY `table_1`.`column_1` ORDER BY `table_1`.`column_1` DESC LIMIT 10
----
871227781.0000
1592590412.0000
282662548.0000
-1333373062.0000
-933863856.0000
-488257739.0000
-907729744.0000
509972425.0000
-1795693550.0000
956891513.0000

query  nosort
SELECT `table_1`.`column_1` AS `alias_1` FROM `table_1` WHERE (`table_1`.`column_1` > ?) ORDER BY `table_1`.`column_1` DESC LIMIT 10
? = 10
----
2052811060
2019958742
1458677704
1172979694
710427253
629936266

query  rowsort
SELECT avg(`table_1`.`column_5`) AS `alias_1` FROM `table_1` WHERE (`table_1`.`column_1` > ?)
? = 10
----
-673807711.5000

query  nosort
SELECT avg(`table_1`.`column_6`) AS `alias_1` FROM `table_1` GROUP BY `table_1`.`column_1` ORDER BY `table_1`.`column_1` DESC LIMIT 10
----
-1777461740.0000
566208841.0000
1238436678.0000
942259142.0000
-1649465115.0000
-126777511.0000
23920999.0000
-1385717348.0000
-947700480.0000
-547078891.0000

query  nosort
SELECT `table_1`.`column_1` AS `alias_1` FROM `table_1` WHERE (`table_1`.`column_1` > ?) ORDER BY `table_1`.`column_1` DESC LIMIT 10
? = 10
----
2052811060
2019958742
1458677704
1172979694
710427253
629936266

query  nosort
SELECT avg(`table_1`.`column_7`) AS `alias_1` FROM `table_1` WHERE (`table_1`.`column_1` > ?) GROUP BY `table_1`.`column_1` ORDER BY `table_1`.`column_1` ASC LIMIT 10
? = 10
----
447061462.0000
1624310384.0000
-333524396.0000
672728249.0000
1586875315.0000
-1904145821.0000

query  nosort
SELECT avg(`table_1`.`column_8`) AS `alias_1` FROM `table_1` WHERE (`table_1`.`column_8` > ?) GROUP BY `table_1`.`column_1` ORDER BY `table_1`.`column_1` DESC LIMIT 10
? = 10
----
1558817490.0000
1825888965.0000
1542103631.0000
710511266.0000

query  nosort
SELECT avg(`table_1`.`column_9`) AS `alias_1` FROM `table_1` WHERE (`table_1`.`column_8` > ?) GROUP BY `table_1`.`column_8` ORDER BY `table_1`.`column_8` DESC LIMIT 10
? = 10
----
-555722233.0000
-267746251.0000
-1909014221.0000
1308841270.0000

statement ok
DELETE FROM `table_1` WHERE (`column_10` = 0)


statement ok
DELETE FROM `table_1` WHERE (`column_10` = 1)


statement ok
DELETE FROM `table_1` WHERE (`column_10` = 2)


statement ok
DELETE FROM `table_1` WHERE (`column_10` = 3)


statement ok
DELETE FROM `table_1` WHERE (`column_10` = 4)


query  nosort
SELECT `table_1`.`column_1` AS `alias_1` FROM `table_1` ORDER BY `table_1`.`column_1` ASC LIMIT 10
----
-1560574510
-822848234
710427253
1172979694
2052811060

query  nosort
SELECT `table_1`.`column_1` AS `alias_1` FROM `table_1` ORDER BY `table_1`.`column_1` DESC LIMIT 10
----
2052811060
1172979694
710427253
-822848234
-1560574510

query  rowsort
SELECT avg(`table_1`.`column_2`) AS `alias_1` FROM `table_1`
----
584619741.6000

query  rowsort
SELECT `table_1`.`column_1` AS `alias_1` FROM `table_1` WHERE (`table_1`.`column_1` > ?)
? = 10
----
1172979694
2052811060
710427253

query  nosort
SELECT `table_1`.`column_1` AS `alias_1` FROM `table_1` ORDER BY `table_1`.`column_1` DESC LIMIT 10
----
2052811060
1172979694
710427253
-822848234
-1560574510

query  nosort
SELECT avg(`table_1`.`column_3`) AS `alias_1` FROM `table_1` GROUP BY `table_1`.`column_1` ORDER BY `table_1`.`column_1` ASC LIMIT 10
----
-548658993.0000
-558600601.0000
481575900.0000
1681309847.0000
-218254166.0000

query  nosort
SELECT `table_1`.`column_1` AS `alias_1` FROM `table_1` WHERE (`table_1`.`column_1` > ?) ORDER BY `table_1`.`column_1` ASC LIMIT 10
? = 10
----
710427253
1172979694
2052811060

query  nosort
SELECT avg(`table_1`.`column_4`) AS `alias_1` FROM `table_1` GROUP BY `table_1`.`column_1` ORDER BY `table_1`.`column_1` DESC LIMIT 10
----
871227781.0000
-1333373062.0000
-933863856.0000
-907729744.0000
509972425.0000

query  nosort
SELECT `table_1`.`column_1` AS `alias_1` FROM `table_1` WHERE (`table_1`.`column_1` > ?) ORDER BY `table_1`.`column_1` DESC LIMIT 10
? = 10
----
2052811060
1172979694
710427253

query  rowsort
SELECT avg(`table_1`.`column_5`) AS `alias_1` FROM `table_1` WHERE (`table_1`.`column_1` > ?)
? = 10
----
-922316652.3333

query  nosort
SELECT avg(`table_1`.`column_6`) AS `alias_1` FROM `table_1` GROUP BY `table_1`.`column_1` ORDER BY `table_1`.`column_1` DESC LIMIT 10
----
-1777461740.0000
942259142.0000
-1649465115.0000
23920999.0000
-1385717348.0000

query  nosort
SELECT `table_1`.`column_1` AS `alias_1` FROM `table_1` WHERE (`table_1`.`column_1` > ?) ORDER BY `table_1`.`column_1` DESC LIMIT 10
? = 10
----
2052811060
1172979694
710427253

query  nosort
SELECT avg(`table_1`.`column_7`) AS `alias_1` FROM `table_1` WHERE (`table_1`.`column_1` > ?) GROUP BY `table_1`.`column_1` ORDER BY `table_1`.`column_1` ASC LIMIT 10
? = 10
----
1624310384.0000
-333524396.0000
-1904145821.0000

query  nosort
SELECT avg(`table_1`.`column_8`) AS `alias_1` FROM `table_1` WHERE (`table_1`.`column_8` > ?) GROUP BY `table_1`.`column_1` ORDER BY `table_1`.`column_1` DESC LIMIT 10
? = 10
----
1558817490.0000
1825888965.0000
1542103631.0000
710511266.0000

query  nosort
SELECT avg(`table_1`.`column_9`) AS `alias_1` FROM `table_1` WHERE (`table_1`.`column_8` > ?) GROUP BY `table_1`.`column_8` ORDER BY `table_1`.`column_8` DESC LIMIT 10
? = 10
----
-555722233.0000
-267746251.0000
-1909014221.0000
1308841270.0000
