# Generated by:
#     target/debug/noria-logictest permute --compare-to mysql://root:noria@127.1/noria -d 3 -o logictests/generated/mysql/ --only range_param --random --include-deletes --rows-per-table 10 --subquery-depth 1 --overwrite-tests

statement ok
CREATE TABLE `table_1` (`column_3` INT, `column_2` INT, `column_1` INT, `column_5` INT, `column_4` INT, PRIMARY KEY (`column_5`))


statement ok
INSERT INTO `table_1` (`column_3`, `column_2`, `column_1`, `column_5`, `column_4`) VALUES (0, -572439694, 2, 0, 2090719040), (-1432985152, -477455816, 396376403, 1, 826273189), (1, -22798288, 0, 2, 847315625), (-1203730743, 1239530285, -1007786275, 3, 1363863015), (2, -230002483, 1, 4, -1248220721), (-328493713, 2085890083, 314209314, 5, 1966044119), (0, 1324121511, 2, 6, -598136116), (2132467405, 1955875833, -892385717, 7, -1447017664), (1, 534581872, 0, 8, 157593063), (-1327466535, -822841919, -515124889, 9, 1641600496)


query  rowsort
SELECT avg(`table_1`.`column_1`) AS `alias_1` FROM `table_1`
----
-170471115.9000

query  rowsort
SELECT `table_1`.`column_1` AS `alias_1` FROM `table_1` WHERE `table_1`.`column_1` IN (?, ?, ?)
? = 0
? = 1
? = 2
----
0
0
1
2
2

query  rowsort
SELECT `table_1`.`column_1` AS `alias_1` FROM `table_1` WHERE (`table_1`.`column_1` > ?)
? = 10
----
314209314
396376403

query  rowsort
SELECT avg(`table_1`.`column_2`) AS `alias_1` FROM `table_1` WHERE `table_1`.`column_1` IN (?, ?, ?)
? = 0
? = 1
? = 2
----
206692583.6000

query  rowsort
SELECT avg(`table_1`.`column_3`) AS `alias_1` FROM `table_1` WHERE (`table_1`.`column_1` > ?)
? = 10
----
-880739432.5000

query  rowsort
SELECT `table_1`.`column_1` AS `alias_1` FROM `table_1` WHERE (`table_1`.`column_1` IN (?, ?, ?) AND (`table_1`.`column_1` > ?))
? = 0
? = 1
? = 2
? = 10
----


query  rowsort
SELECT avg(`table_1`.`column_4`) AS `alias_1` FROM `table_1` WHERE (`table_1`.`column_3` IN (?, ?, ?) AND (`table_1`.`column_3` > ?))
? = 0
? = 1
? = 2
? = 10
----
NULL

statement ok
DELETE FROM `table_1` WHERE (`column_5` = 0)


statement ok
DELETE FROM `table_1` WHERE (`column_5` = 1)


statement ok
DELETE FROM `table_1` WHERE (`column_5` = 2)


statement ok
DELETE FROM `table_1` WHERE (`column_5` = 3)


statement ok
DELETE FROM `table_1` WHERE (`column_5` = 4)


query  rowsort
SELECT avg(`table_1`.`column_1`) AS `alias_1` FROM `table_1`
----
-218660258.0000

query  rowsort
SELECT `table_1`.`column_1` AS `alias_1` FROM `table_1` WHERE `table_1`.`column_1` IN (?, ?, ?)
? = 0
? = 1
? = 2
----
0
2

query  rowsort
SELECT `table_1`.`column_1` AS `alias_1` FROM `table_1` WHERE (`table_1`.`column_1` > ?)
? = 10
----
314209314

query  rowsort
SELECT avg(`table_1`.`column_2`) AS `alias_1` FROM `table_1` WHERE `table_1`.`column_1` IN (?, ?, ?)
? = 0
? = 1
? = 2
----
929351691.5000

query  rowsort
SELECT avg(`table_1`.`column_3`) AS `alias_1` FROM `table_1` WHERE (`table_1`.`column_1` > ?)
? = 10
----
-328493713.0000

query  rowsort
SELECT `table_1`.`column_1` AS `alias_1` FROM `table_1` WHERE (`table_1`.`column_1` IN (?, ?, ?) AND (`table_1`.`column_1` > ?))
? = 0
? = 1
? = 2
? = 10
----


query  rowsort
SELECT avg(`table_1`.`column_4`) AS `alias_1` FROM `table_1` WHERE (`table_1`.`column_3` IN (?, ?, ?) AND (`table_1`.`column_3` > ?))
? = 0
? = 1
? = 2
? = 10
----
NULL
