# Generated by:
#     target/debug/noria-logictest permute --compare-to mysql://root:noria@127.1/noria -d 3 -o logictests/generated/mysql/ --only range_param --random --include-deletes --rows-per-table 10 --subquery-depth 1 --overwrite-tests

statement ok
CREATE TABLE `table_1` (`column_1` INT, `column_4` INT, `column_5` INT, `column_2` INT, `column_3` INT, PRIMARY KEY (`column_5`))


statement ok
INSERT INTO `table_1` (`column_1`, `column_4`, `column_5`, `column_2`, `column_3`) VALUES (448165075, -1840149165, 0, -726131394, -802354882), (-1302628493, -11951812, 1, -97774216, -381299722), (-1155278280, -2025920455, 2, -1707975620, -839090419), (-563572248, -42613821, 3, 1702365957, -172796764), (1881799113, 1720304252, 4, -1863354233, 1624098646), (-1468567086, 1514242398, 5, 1285609234, -1791659248), (134991765, -40309949, 6, 920613643, -791723611), (-1367433784, -1852778429, 7, 288853712, -1128131533), (-2042440189, 1498163249, 8, -1051790470, 65325963), (-41310960, 1785640232, 9, -1833561481, -1024303204)


query  rowsort
SELECT avg(`table_1`.`column_1`) AS `alias_1` FROM `table_1`
----
-547627508.7000

query  rowsort
SELECT DISTINCT `table_1`.`column_1` AS `alias_1` FROM `table_1`
----
-1155278280
-1302628493
-1367433784
-1468567086
-2042440189
-41310960
-563572248
134991765
1881799113
448165075

query  rowsort
SELECT `table_1`.`column_1` AS `alias_1` FROM `table_1` WHERE (`table_1`.`column_1` > ?)
? = 10
----
134991765
1881799113
448165075

query  rowsort
SELECT DISTINCT avg(`table_1`.`column_2`) AS `alias_1` FROM `table_1`
----
-308314486.8000

query  rowsort
SELECT avg(`table_1`.`column_3`) AS `alias_1` FROM `table_1` WHERE (`table_1`.`column_3` > ?)
? = 10
----
844712304.5000

query  rowsort
SELECT DISTINCT `table_1`.`column_3` AS `alias_1` FROM `table_1` WHERE (`table_1`.`column_3` > ?)
? = 10
----
1624098646
65325963

query  rowsort
SELECT DISTINCT avg(`table_1`.`column_4`) AS `alias_1` FROM `table_1` WHERE (`table_1`.`column_1` > ?)
? = 10
----
-53384954.0000

statement ok
DELETE FROM `table_1` WHERE (`column_5` = 0)


statement ok
DELETE FROM `table_1` WHERE (`column_5` = 1)


statement ok
DELETE FROM `table_1` WHERE (`column_5` = 2)


statement ok
DELETE FROM `table_1` WHERE (`column_5` = 3)


statement ok
DELETE FROM `table_1` WHERE (`column_5` = 4)


query  rowsort
SELECT avg(`table_1`.`column_1`) AS `alias_1` FROM `table_1`
----
-956952050.8000

query  rowsort
SELECT DISTINCT `table_1`.`column_1` AS `alias_1` FROM `table_1`
----
-1367433784
-1468567086
-2042440189
-41310960
134991765

query  rowsort
SELECT `table_1`.`column_1` AS `alias_1` FROM `table_1` WHERE (`table_1`.`column_1` > ?)
? = 10
----
134991765

query  rowsort
SELECT DISTINCT avg(`table_1`.`column_2`) AS `alias_1` FROM `table_1`
----
-78055072.4000

query  rowsort
SELECT avg(`table_1`.`column_3`) AS `alias_1` FROM `table_1` WHERE (`table_1`.`column_3` > ?)
? = 10
----
65325963.0000

query  rowsort
SELECT DISTINCT `table_1`.`column_3` AS `alias_1` FROM `table_1` WHERE (`table_1`.`column_3` > ?)
? = 10
----
65325963

query  rowsort
SELECT DISTINCT avg(`table_1`.`column_4`) AS `alias_1` FROM `table_1` WHERE (`table_1`.`column_1` > ?)
? = 10
----
-40309949.0000
