# Generated by:
#     target/debug/noria-logictest permute --compare-to mysql://root:noria@127.1/noria -d 3 -o logictests/generated/mysql/ --only range_param --random --include-deletes --rows-per-table 10 --subquery-depth 1 --overwrite-tests

statement ok
CREATE TABLE `table_1` (`column_2` INT, `column_9` INT, `column_4` INT, `column_7` INT, `column_1` INT, `column_5` INT, `column_6` INT, `column_3` INT, `column_8` INT, PRIMARY KEY (`column_9`))


statement ok
INSERT INTO `table_1` (`column_2`, `column_9`, `column_4`, `column_7`, `column_1`, `column_5`, `column_6`, `column_3`, `column_8`) VALUES (1729257201, 0, 1820567174, 437500161, -2095584150, -1400084455, -961570948, 614172166, 906256401), (550299331, 1, -650777503, 532329625, -1231569864, 1146908782, -1938557479, -874763320, 1925919418), (964748749, 2, -2104492475, -1639234941, 1609115154, -1845112921, 1891138553, 891522771, 735799118), (-227801107, 3, -23915564, 84951585, -487102813, -1500214684, -327546529, -1671474466, -1091079645), (1504219956, 4, 436630848, 1795008738, -1507116165, -2084300599, 1990107551, -794316789, 1573071370), (302731861, 5, 1541160651, -1437031514, 1943748528, -1632468386, 935710898, 586407304, 1718830927), (816272654, 6, -84104845, -1998390706, -1569541057, -62105837, 906950639, 2091546868, -1833405296), (-143712327, 7, 725417501, -1056118937, -697291468, 437593223, 1141981852, 884542709, 1378878361), (1564439150, 8, -2105240571, -558000420, 1150652787, 545144983, -1355080318, 635709599, 597474144), (1906030580, 9, -1764193021, 1228705745, -459907402, -70471986, -2143064355, 1898262250, -2106389047)


query  rowsort
SELECT avg(`table_1`.`column_1`) AS `alias_1` FROM `table_1`
----
-334459645.0000

query  rowsort
SELECT avg(distinct `table_1`.`column_2`) AS `alias_1` FROM `table_1`
----
896648604.8000

query  rowsort
SELECT `table_1`.`column_1` AS `alias_1` FROM `table_1` WHERE (`table_1`.`column_1` > ?)
? = 10
----
1150652787
1609115154
1943748528

query  rowsort
SELECT avg(`table_1`.`column_3`) AS `alias_1`, avg(distinct `table_1`.`column_4`) AS `alias_2` FROM `table_1`
----
426160909.2000
-220894780.5000

query  rowsort
SELECT avg(`table_1`.`column_5`) AS `alias_1` FROM `table_1` WHERE (`table_1`.`column_1` > ?)
? = 10
----
-977478774.6667

query  rowsort
SELECT avg(distinct `table_1`.`column_6`) AS `alias_1` FROM `table_1` WHERE (`table_1`.`column_1` > ?)
? = 10
----
490589711.0000

query  rowsort
SELECT avg(`table_1`.`column_7`) AS `alias_1`, avg(distinct `table_1`.`column_8`) AS `alias_2` FROM `table_1` WHERE (`table_1`.`column_2` > ?)
? = 10
----
-204889164.0000
439694629.3750

statement ok
DELETE FROM `table_1` WHERE (`column_9` = 0)


statement ok
DELETE FROM `table_1` WHERE (`column_9` = 1)


statement ok
DELETE FROM `table_1` WHERE (`column_9` = 2)


statement ok
DELETE FROM `table_1` WHERE (`column_9` = 3)


statement ok
DELETE FROM `table_1` WHERE (`column_9` = 4)


query  rowsort
SELECT avg(`table_1`.`column_1`) AS `alias_1` FROM `table_1`
----
73532277.6000

query  rowsort
SELECT avg(distinct `table_1`.`column_2`) AS `alias_1` FROM `table_1`
----
889152383.6000

query  rowsort
SELECT `table_1`.`column_1` AS `alias_1` FROM `table_1` WHERE (`table_1`.`column_1` > ?)
? = 10
----
1150652787
1943748528

query  rowsort
SELECT avg(`table_1`.`column_3`) AS `alias_1`, avg(distinct `table_1`.`column_4`) AS `alias_2` FROM `table_1`
----
1219293746.0000
-337392057.0000

query  rowsort
SELECT avg(`table_1`.`column_5`) AS `alias_1` FROM `table_1` WHERE (`table_1`.`column_1` > ?)
? = 10
----
-543661701.5000

query  rowsort
SELECT avg(distinct `table_1`.`column_6`) AS `alias_1` FROM `table_1` WHERE (`table_1`.`column_1` > ?)
? = 10
----
-209684710.0000

query  rowsort
SELECT avg(`table_1`.`column_7`) AS `alias_1`, avg(distinct `table_1`.`column_8`) AS `alias_2` FROM `table_1` WHERE (`table_1`.`column_2` > ?)
? = 10
----
-691179223.7500
-405872318.0000
