# Generated by:
#     target/debug/noria-logictest permute --compare-to mysql://root:noria@127.1/noria -d 3 -o logictests/generated/mysql/ --only range_param --random --include-deletes --rows-per-table 10 --subquery-depth 1 --overwrite-tests

statement ok
CREATE TABLE `table_1` (`column_7` INT, `column_5` INT, `column_1` INT, `column_8` INT, `column_9` INT, `column_3` INT, `column_6` INT, `column_2` INT, `column_4` INT, PRIMARY KEY (`column_9`))


statement ok
INSERT INTO `table_1` (`column_7`, `column_5`, `column_1`, `column_8`, `column_9`, `column_3`, `column_6`, `column_2`, `column_4`) VALUES (2140589378, 2014575863, 2086895487, -1489805124, 0, 1541315345, -109258426, 940604088, -1314292300), (-1291644892, -978020314, 1529595109, -202195786, 1, -886078184, 567993541, -667512930, -1788039187), (-1304748532, -1090948007, -1747123672, -237995735, 2, 22316802, -38431686, 909897945, -2138862775), (-1340821438, 1396522815, -1764118282, 907815517, 3, 1036808219, -1604896066, 2064349699, -1233263022), (1719904653, -746640547, -1775070115, -2089085629, 4, 800941000, 643537637, 1833736483, -494967147), (-1361431296, -66570923, 819535971, 881948874, 5, 206218957, 86087327, 685619534, -1411349065), (-1481287206, -817405955, -1638958032, -785070068, 6, 70492245, -1525728460, 1208163569, -432729412), (175039353, 179084805, -1548715341, 830719173, 7, -1660495080, -986810622, -1533770890, 484265135), (1748209894, 549125723, 1604291727, -1271909918, 8, 948578102, -1432651255, 359300325, -1902529805), (-1623092242, 638389343, 1207175817, 77316519, 9, -2112227238, 1552493416, -2021396590, -1552624939)


query  rowsort
SELECT avg(`table_1`.`column_1`) AS `alias_1` FROM `table_1`
----
-122649133.1000

query  nosort
SELECT `table_1`.`column_1` AS `alias_1` FROM `table_1` ORDER BY `table_1`.`column_1` ASC LIMIT 10
----
-1775070115
-1764118282
-1747123672
-1638958032
-1548715341
819535971
1207175817
1529595109
1604291727
2086895487

query  nosort
SELECT `table_1`.`column_1` AS `alias_1` FROM `table_1` ORDER BY `table_1`.`column_1` DESC LIMIT 10
----
2086895487
1604291727
1529595109
1207175817
819535971
-1548715341
-1638958032
-1747123672
-1764118282
-1775070115

query  rowsort
SELECT `table_1`.`column_1` AS `alias_1` FROM `table_1` WHERE (`table_1`.`column_1` > ?)
? = 10
----
1207175817
1529595109
1604291727
2086895487
819535971

query  nosort
SELECT avg(`table_1`.`column_2`) AS `alias_1` FROM `table_1` GROUP BY `table_1`.`column_1` ORDER BY `table_1`.`column_1` ASC LIMIT 10
----
1833736483.0000
2064349699.0000
909897945.0000
1208163569.0000
-1533770890.0000
685619534.0000
-2021396590.0000
-667512930.0000
359300325.0000
940604088.0000

query  nosort
SELECT avg(`table_1`.`column_3`) AS `alias_1` FROM `table_1` GROUP BY `table_1`.`column_1` ORDER BY `table_1`.`column_1` DESC LIMIT 10
----
1541315345.0000
948578102.0000
-886078184.0000
-2112227238.0000
206218957.0000
-1660495080.0000
70492245.0000
22316802.0000
1036808219.0000
800941000.0000

query  rowsort
SELECT avg(`table_1`.`column_4`) AS `alias_1` FROM `table_1` WHERE (`table_1`.`column_3` > ?)
? = 10
----
-1275427646.5714

query  nosort
SELECT `table_1`.`column_3` AS `alias_1` FROM `table_1` ORDER BY `table_1`.`column_3` DESC LIMIT 10
----
1541315345
1036808219
948578102
800941000
206218957
70492245
22316802
-886078184
-1660495080
-2112227238

query  nosort
SELECT `table_1`.`column_3` AS `alias_1` FROM `table_1` WHERE (`table_1`.`column_3` > ?) ORDER BY `table_1`.`column_3` ASC LIMIT 10
? = 10
----
22316802
70492245
206218957
800941000
948578102
1036808219
1541315345

query  nosort
SELECT `table_1`.`column_3` AS `alias_1` FROM `table_1` WHERE (`table_1`.`column_3` > ?) ORDER BY `table_1`.`column_3` DESC LIMIT 10
? = 10
----
1541315345
1036808219
948578102
800941000
206218957
70492245
22316802

query  nosort
SELECT avg(`table_1`.`column_5`) AS `alias_1` FROM `table_1` GROUP BY `table_1`.`column_3` ORDER BY `table_1`.`column_3` DESC LIMIT 10
----
2014575863.0000
1396522815.0000
549125723.0000
-746640547.0000
-66570923.0000
-817405955.0000
-1090948007.0000
-978020314.0000
179084805.0000
638389343.0000

query  nosort
SELECT avg(`table_1`.`column_6`) AS `alias_1` FROM `table_1` WHERE (`table_1`.`column_3` > ?) GROUP BY `table_1`.`column_3` ORDER BY `table_1`.`column_3` ASC LIMIT 10
? = 10
----
-38431686.0000
-1525728460.0000
86087327.0000
643537637.0000
-1432651255.0000
-1604896066.0000
-109258426.0000

query  nosort
SELECT avg(`table_1`.`column_7`) AS `alias_1` FROM `table_1` WHERE (`table_1`.`column_7` > ?) GROUP BY `table_1`.`column_7` ORDER BY `table_1`.`column_7` DESC LIMIT 10
? = 10
----
2140589378.0000
1748209894.0000
1719904653.0000
175039353.0000

query  nosort
SELECT `table_1`.`column_7` AS `alias_1` FROM `table_1` WHERE (`table_1`.`column_7` > ?) ORDER BY `table_1`.`column_7` DESC LIMIT 10
? = 10
----
2140589378
1748209894
1719904653
175039353

query  nosort
SELECT avg(`table_1`.`column_8`) AS `alias_1` FROM `table_1` WHERE (`table_1`.`column_7` > ?) GROUP BY `table_1`.`column_7` ORDER BY `table_1`.`column_7` DESC LIMIT 10
? = 10
----
-1489805124.0000
-1271909918.0000
-2089085629.0000
830719173.0000

statement ok
DELETE FROM `table_1` WHERE (`column_9` = 0)


statement ok
DELETE FROM `table_1` WHERE (`column_9` = 1)


statement ok
DELETE FROM `table_1` WHERE (`column_9` = 2)


statement ok
DELETE FROM `table_1` WHERE (`column_9` = 3)


statement ok
DELETE FROM `table_1` WHERE (`column_9` = 4)


query  rowsort
SELECT avg(`table_1`.`column_1`) AS `alias_1` FROM `table_1`
----
88666028.4000

query  nosort
SELECT `table_1`.`column_1` AS `alias_1` FROM `table_1` ORDER BY `table_1`.`column_1` ASC LIMIT 10
----
-1638958032
-1548715341
819535971
1207175817
1604291727

query  nosort
SELECT `table_1`.`column_1` AS `alias_1` FROM `table_1` ORDER BY `table_1`.`column_1` DESC LIMIT 10
----
1604291727
1207175817
819535971
-1548715341
-1638958032

query  rowsort
SELECT `table_1`.`column_1` AS `alias_1` FROM `table_1` WHERE (`table_1`.`column_1` > ?)
? = 10
----
1207175817
1604291727
819535971

query  nosort
SELECT avg(`table_1`.`column_2`) AS `alias_1` FROM `table_1` GROUP BY `table_1`.`column_1` ORDER BY `table_1`.`column_1` ASC LIMIT 10
----
1208163569.0000
-1533770890.0000
685619534.0000
-2021396590.0000
359300325.0000

query  nosort
SELECT avg(`table_1`.`column_3`) AS `alias_1` FROM `table_1` GROUP BY `table_1`.`column_1` ORDER BY `table_1`.`column_1` DESC LIMIT 10
----
948578102.0000
-2112227238.0000
206218957.0000
-1660495080.0000
70492245.0000

query  rowsort
SELECT avg(`table_1`.`column_4`) AS `alias_1` FROM `table_1` WHERE (`table_1`.`column_3` > ?)
? = 10
----
-1248869427.3333

query  nosort
SELECT `table_1`.`column_3` AS `alias_1` FROM `table_1` ORDER BY `table_1`.`column_3` DESC LIMIT 10
----
948578102
206218957
70492245
-1660495080
-2112227238

query  nosort
SELECT `table_1`.`column_3` AS `alias_1` FROM `table_1` WHERE (`table_1`.`column_3` > ?) ORDER BY `table_1`.`column_3` ASC LIMIT 10
? = 10
----
70492245
206218957
948578102

query  nosort
SELECT `table_1`.`column_3` AS `alias_1` FROM `table_1` WHERE (`table_1`.`column_3` > ?) ORDER BY `table_1`.`column_3` DESC LIMIT 10
? = 10
----
948578102
206218957
70492245

query  nosort
SELECT avg(`table_1`.`column_5`) AS `alias_1` FROM `table_1` GROUP BY `table_1`.`column_3` ORDER BY `table_1`.`column_3` DESC LIMIT 10
----
549125723.0000
-66570923.0000
-817405955.0000
179084805.0000
638389343.0000

query  nosort
SELECT avg(`table_1`.`column_6`) AS `alias_1` FROM `table_1` WHERE (`table_1`.`column_3` > ?) GROUP BY `table_1`.`column_3` ORDER BY `table_1`.`column_3` ASC LIMIT 10
? = 10
----
-1525728460.0000
86087327.0000
-1432651255.0000

query  nosort
SELECT avg(`table_1`.`column_7`) AS `alias_1` FROM `table_1` WHERE (`table_1`.`column_7` > ?) GROUP BY `table_1`.`column_7` ORDER BY `table_1`.`column_7` DESC LIMIT 10
? = 10
----
1748209894.0000
175039353.0000

query  nosort
SELECT `table_1`.`column_7` AS `alias_1` FROM `table_1` WHERE (`table_1`.`column_7` > ?) ORDER BY `table_1`.`column_7` DESC LIMIT 10
? = 10
----
1748209894
175039353

query  nosort
SELECT avg(`table_1`.`column_8`) AS `alias_1` FROM `table_1` WHERE (`table_1`.`column_7` > ?) GROUP BY `table_1`.`column_7` ORDER BY `table_1`.`column_7` DESC LIMIT 10
? = 10
----
-1271909918.0000
830719173.0000
