# Generated by:
#     target/debug/noria-logictest permute --compare-to mysql://root:noria@127.1/noria -d 3 -o logictests/generated/mysql/ --only range_param --random --include-deletes --rows-per-table 10 --subquery-depth 1 --overwrite-tests

statement ok
CREATE TABLE `table_1` (`column_8` INT, `column_10` INT, `column_11` INT, `column_13` INT, `column_7` INT, `column_4` INT, `column_3` INT, `column_1` INT, `column_6` INT, `column_9` INT, `column_5` INT, `column_12` INT, `column_2` INT, PRIMARY KEY (`column_13`))


statement ok
INSERT INTO `table_1` (`column_8`, `column_10`, `column_11`, `column_13`, `column_7`, `column_4`, `column_3`, `column_1`, `column_6`, `column_9`, `column_5`, `column_12`, `column_2`) VALUES (696794658, 1513585206, -487850111, 0, 1319855789, 1958696802, 963552666, 1468396594, 367396722, -2127887540, -1948992889, -1340262973, 1711768897), (1248681351, 2093599564, 489610945, 1, -1158295856, -1231933532, -1518937593, 533458117, -118959502, -1283591781, 962083680, 794018267, -968897261), (-80603350, -493447786, -1279206634, 2, -461815750, 799830739, 1493639451, -37550692, 715883948, -292511193, -1896648019, -312092357, -742347669), (186051267, 1247566269, 146003667, 3, 826608778, -1835437575, -967585973, -1783592932, 302020778, 93820180, 833535785, -1235621854, -1589968953), (492694775, 2056655255, -184263837, 4, 1387401984, -1426510088, 245377602, 207436314, -1385348883, 1159310460, -1660476353, -1996485757, 2142996450), (858544352, -96790173, 271078034, 5, 2027800451, 2076025312, -873180636, -212503077, 2021637784, -2095034892, -2072187100, 1895119658, 438980709), (-455245902, 547826978, 1047910951, 6, 1734377936, -1466893139, 651824844, -924140879, 659061440, -607889727, 913035279, 1277735620, 2048884462), (1408678805, 989274205, 26335651, 7, 1740405070, 1728298559, 981023664, 1781025002, -1240823951, 1092387241, 126472531, -1485760799, 2135246617), (-909340888, 1013653269, 1150632355, 8, -337813470, 1334989135, 1932257429, -404902283, -817850092, 70241908, 1307869874, -759438402, -1230524989), (-1853554581, 2095537316, 1721549586, 9, -1746886262, 943947124, -1118979046, 659615374, -291257570, 1859623857, -30257594, 1890411257, 821672806)


query  rowsort
SELECT avg(`table_1`.`column_1`) AS `alias_1` FROM `table_1` INNER JOIN (SELECT avg(`table_1`.`column_2`) AS `alias_2` FROM `table_1`) AS alias_3 ON (`table_1`.`column_1` = `alias_3`.`alias_2`)
----
NULL

query  rowsort
SELECT avg(`table_1`.`column_3`) AS `alias_1` FROM `table_1` INNER JOIN (SELECT `table_1`.`column_3` AS `alias_2` FROM `table_1`) AS alias_3 ON (`table_1`.`column_3` = `alias_3`.`alias_2`)
----
178899240.8000

query  rowsort
SELECT avg(`table_1`.`column_4`) AS `alias_1` FROM `table_1` INNER JOIN (SELECT avg(`table_1`.`column_5`) AS `alias_2` FROM `table_1`) AS alias_3 ON (`table_1`.`column_2` = `alias_3`.`alias_2`)
----
NULL

query  rowsort
SELECT `table_1`.`column_2` AS `alias_3` FROM `table_1` INNER JOIN (SELECT avg(`table_1`.`column_6`) AS `alias_1` FROM `table_1`) AS alias_2 ON (`table_1`.`column_2` = `alias_2`.`alias_1`) WHERE (`table_1`.`column_2` > ?)
? = 10
----


query  rowsort
SELECT `table_1`.`column_2` AS `alias_3` FROM `table_1` INNER JOIN (SELECT `table_1`.`column_2` AS `alias_1` FROM `table_1`) AS alias_2 ON (`table_1`.`column_2` = `alias_2`.`alias_1`) WHERE (`table_1`.`column_2` > ?)
? = 10
----
1711768897
2048884462
2135246617
2142996450
438980709
821672806

query  rowsort
SELECT `table_1`.`column_2` AS `alias_3` FROM `table_1` INNER JOIN (SELECT avg(`table_1`.`column_7`) AS `alias_1` FROM `table_1`) AS alias_2 ON (`table_1`.`column_2` = `alias_2`.`alias_1`) WHERE (`table_1`.`column_2` > ?)
? = 10
----


query  rowsort
SELECT avg(`table_1`.`column_8`) AS `alias_1` FROM `table_1` INNER JOIN (SELECT avg(`table_1`.`column_9`) AS `alias_2` FROM `table_1`) AS alias_3 ON (`table_1`.`column_8` = `alias_3`.`alias_2`) WHERE (`table_1`.`column_8` > ?)
? = 10
----
NULL

query  rowsort
SELECT avg(`table_1`.`column_10`) AS `alias_1` FROM `table_1` INNER JOIN (SELECT `table_1`.`column_8` AS `alias_2` FROM `table_1`) AS alias_3 ON (`table_1`.`column_8` = `alias_3`.`alias_2`) WHERE (`table_1`.`column_8` > ?)
? = 10
----
1300648387.6667

query  rowsort
SELECT avg(`table_1`.`column_11`) AS `alias_1` FROM `table_1` INNER JOIN (SELECT avg(`table_1`.`column_12`) AS `alias_2` FROM `table_1`) AS alias_3 ON (`table_1`.`column_8` = `alias_3`.`alias_2`) WHERE (`table_1`.`column_8` > ?)
? = 10
----
NULL

statement ok
DELETE FROM `table_1` WHERE (`column_13` = 0)


statement ok
DELETE FROM `table_1` WHERE (`column_13` = 1)


statement ok
DELETE FROM `table_1` WHERE (`column_13` = 2)


statement ok
DELETE FROM `table_1` WHERE (`column_13` = 3)


statement ok
DELETE FROM `table_1` WHERE (`column_13` = 4)


query  rowsort
SELECT avg(`table_1`.`column_1`) AS `alias_1` FROM `table_1` INNER JOIN (SELECT avg(`table_1`.`column_2`) AS `alias_2` FROM `table_1`) AS alias_3 ON (`table_1`.`column_1` = `alias_3`.`alias_2`)
----
NULL

query  rowsort
SELECT avg(`table_1`.`column_3`) AS `alias_1` FROM `table_1` INNER JOIN (SELECT `table_1`.`column_3` AS `alias_2` FROM `table_1`) AS alias_3 ON (`table_1`.`column_3` = `alias_3`.`alias_2`)
----
314589251.0000

query  rowsort
SELECT avg(`table_1`.`column_4`) AS `alias_1` FROM `table_1` INNER JOIN (SELECT avg(`table_1`.`column_5`) AS `alias_2` FROM `table_1`) AS alias_3 ON (`table_1`.`column_2` = `alias_3`.`alias_2`)
----
NULL

query  rowsort
SELECT `table_1`.`column_2` AS `alias_3` FROM `table_1` INNER JOIN (SELECT avg(`table_1`.`column_6`) AS `alias_1` FROM `table_1`) AS alias_2 ON (`table_1`.`column_2` = `alias_2`.`alias_1`) WHERE (`table_1`.`column_2` > ?)
? = 10
----


query  rowsort
SELECT `table_1`.`column_2` AS `alias_3` FROM `table_1` INNER JOIN (SELECT `table_1`.`column_2` AS `alias_1` FROM `table_1`) AS alias_2 ON (`table_1`.`column_2` = `alias_2`.`alias_1`) WHERE (`table_1`.`column_2` > ?)
? = 10
----
2048884462
2135246617
438980709
821672806

query  rowsort
SELECT `table_1`.`column_2` AS `alias_3` FROM `table_1` INNER JOIN (SELECT avg(`table_1`.`column_7`) AS `alias_1` FROM `table_1`) AS alias_2 ON (`table_1`.`column_2` = `alias_2`.`alias_1`) WHERE (`table_1`.`column_2` > ?)
? = 10
----


query  rowsort
SELECT avg(`table_1`.`column_8`) AS `alias_1` FROM `table_1` INNER JOIN (SELECT avg(`table_1`.`column_9`) AS `alias_2` FROM `table_1`) AS alias_3 ON (`table_1`.`column_8` = `alias_3`.`alias_2`) WHERE (`table_1`.`column_8` > ?)
? = 10
----
NULL

query  rowsort
SELECT avg(`table_1`.`column_10`) AS `alias_1` FROM `table_1` INNER JOIN (SELECT `table_1`.`column_8` AS `alias_2` FROM `table_1`) AS alias_3 ON (`table_1`.`column_8` = `alias_3`.`alias_2`) WHERE (`table_1`.`column_8` > ?)
? = 10
----
446242016.0000

query  rowsort
SELECT avg(`table_1`.`column_11`) AS `alias_1` FROM `table_1` INNER JOIN (SELECT avg(`table_1`.`column_12`) AS `alias_2` FROM `table_1`) AS alias_3 ON (`table_1`.`column_8` = `alias_3`.`alias_2`) WHERE (`table_1`.`column_8` > ?)
? = 10
----
NULL
