# Generated by:
#     target/debug/noria-logictest generate --operations avg --compare-to mysql://root@localhost/mysql --subquery-depth 1 --rows-per-table 5 -o logictests/generated/avg.test --include-deletes

statement ok
CREATE TABLE table_1 (column_2 INT(32), column_1 INT(32), PRIMARY KEY (column_2))


statement ok
INSERT INTO table_1 (column_2, column_1) VALUES (2, 1), (3, 1), (4, 1), (5, 1), (6, 1)


query  nosort
SELECT avg(table_1.column_1) AS alias_1 FROM table_1
----
1.0000

statement ok
DELETE FROM table_1 WHERE (column_2 = 2)


statement ok
DELETE FROM table_1 WHERE (column_2 = 3)


query  nosort
SELECT avg(table_1.column_1) AS alias_1 FROM table_1
----
1.0000
