# Generated by:
#     target/debug/noria-logictest permute --compare-to mysql://root:noria@127.1/noria -d 3 -o logictests/generated/mysql/ --only range_param --random --include-deletes --rows-per-table 10 --subquery-depth 1 --overwrite-tests

statement ok
CREATE TABLE `table_1` (`column_1` INT, `column_4` INT, `column_2` INT, `column_5` INT, `column_3` INT, PRIMARY KEY (`column_5`))


statement ok
INSERT INTO `table_1` (`column_1`, `column_4`, `column_2`, `column_5`, `column_3`) VALUES (0, 1589624969, 0, 0, -1142077363), (-1902673938, -1043153754, 809665060, 1, -804951226), (1, -2020109910, 1, 2, 1512181808), (1732078101, 1052121811, -1691198295, 3, -436970031), (2, -1978264809, 2, 4, 211345681), (-1991405397, -41293748, 1686517306, 5, 1693611094), (0, -753625867, 0, 6, -844861519), (124818717, 287125874, -269062881, 7, 1838839276), (1, 983933848, 1, 8, 699773469), (-1328904111, -1777477085, 1957446716, 9, 1267721385)


query  rowsort
SELECT avg(distinct `table_1`.`column_1`) AS `alias_1` FROM `table_1`
----
-420760828.1250

query  rowsort
SELECT `table_1`.`column_1` AS `alias_1` FROM `table_1` WHERE `table_1`.`column_1` IN (?, ?, ?)
? = 0
? = 1
? = 2
----
0
0
1
1
2

query  rowsort
SELECT `table_1`.`column_1` AS `alias_1` FROM `table_1` WHERE (`table_1`.`column_1` > ?)
? = 10
----
124818717
1732078101

query  rowsort
SELECT avg(distinct `table_1`.`column_2`) AS `alias_1` FROM `table_1` WHERE `table_1`.`column_2` IN (?, ?, ?)
? = 0
? = 1
? = 2
----
1.0000

query  rowsort
SELECT avg(distinct `table_1`.`column_3`) AS `alias_1` FROM `table_1` WHERE (`table_1`.`column_2` > ?)
? = 10
----
718793751.0000

query  rowsort
SELECT `table_1`.`column_2` AS `alias_1` FROM `table_1` WHERE (`table_1`.`column_2` IN (?, ?, ?) AND (`table_1`.`column_2` > ?))
? = 0
? = 1
? = 2
? = 10
----


query  rowsort
SELECT avg(distinct `table_1`.`column_4`) AS `alias_1` FROM `table_1` WHERE (`table_1`.`column_1` IN (?, ?, ?) AND (`table_1`.`column_1` > ?))
? = 0
? = 1
? = 2
? = 10
----
NULL

statement ok
DELETE FROM `table_1` WHERE (`column_5` = 0)


statement ok
DELETE FROM `table_1` WHERE (`column_5` = 1)


statement ok
DELETE FROM `table_1` WHERE (`column_5` = 2)


statement ok
DELETE FROM `table_1` WHERE (`column_5` = 3)


statement ok
DELETE FROM `table_1` WHERE (`column_5` = 4)


query  rowsort
SELECT avg(distinct `table_1`.`column_1`) AS `alias_1` FROM `table_1`
----
-639098158.0000

query  rowsort
SELECT `table_1`.`column_1` AS `alias_1` FROM `table_1` WHERE `table_1`.`column_1` IN (?, ?, ?)
? = 0
? = 1
? = 2
----
0
1

query  rowsort
SELECT `table_1`.`column_1` AS `alias_1` FROM `table_1` WHERE (`table_1`.`column_1` > ?)
? = 10
----
124818717

query  rowsort
SELECT avg(distinct `table_1`.`column_2`) AS `alias_1` FROM `table_1` WHERE `table_1`.`column_2` IN (?, ?, ?)
? = 0
? = 1
? = 2
----
0.5000

query  rowsort
SELECT avg(distinct `table_1`.`column_3`) AS `alias_1` FROM `table_1` WHERE (`table_1`.`column_2` > ?)
? = 10
----
1480666239.5000

query  rowsort
SELECT `table_1`.`column_2` AS `alias_1` FROM `table_1` WHERE (`table_1`.`column_2` IN (?, ?, ?) AND (`table_1`.`column_2` > ?))
? = 0
? = 1
? = 2
? = 10
----


query  rowsort
SELECT avg(distinct `table_1`.`column_4`) AS `alias_1` FROM `table_1` WHERE (`table_1`.`column_1` IN (?, ?, ?) AND (`table_1`.`column_1` > ?))
? = 0
? = 1
? = 2
? = 10
----
NULL
