# Generated by:
#     target/debug/noria-logictest permute --compare-to mysql://root:noria@127.1/noria -d 3 -o logictests/generated/mysql/ --only range_param --random --include-deletes --rows-per-table 10 --subquery-depth 1 --overwrite-tests

statement ok
CREATE TABLE `table_1` (`column_11` INT, `column_5` INT, `column_9` INT, `column_7` INT, `column_1` INT, `column_8` INT, `column_10` INT, `column_13` INT, `column_3` INT, `column_2` INT, `column_4` INT, `column_6` INT, `column_12` INT, PRIMARY KEY (`column_13`))


statement ok
INSERT INTO `table_1` (`column_11`, `column_5`, `column_9`, `column_7`, `column_1`, `column_8`, `column_10`, `column_13`, `column_3`, `column_2`, `column_4`, `column_6`, `column_12`) VALUES (-2072084846, -1970019141, 353100181, -1622899082, 1299129345, -443132024, 806769294, 0, -60706343, 477317078, 1005464774, 1242082681, 312578054), (-1873999513, 346729938, 1077651055, 2129797901, -1438741898, 1476940684, -536325080, 1, 1471550698, 810857672, -2093542659, 753475018, -1753507883), (1723549316, -1988816333, 443547404, -1127655962, -2089704000, -1021324929, 367192092, 2, -154844554, 79861951, -506933190, -1457646435, -983033702), (243524006, 326796514, -352204273, 416092666, -1427977196, -415333785, 1053792972, 3, 8499843, -1866247533, -1745213613, 1351720130, -933059873), (144258568, -1590801359, 817154042, -434197899, 1581957061, -1238754374, 861110483, 4, 68964780, 73779909, -345841944, -1812695960, -693725827), (-855774773, -705442451, 196612690, 769999956, -1067180880, 708716233, 127279585, 5, 982700756, 2086589496, 195771109, 1390006140, -1898832196), (-694780177, -950122295, -1333999169, 1235717644, -2108963253, 532904549, 144105336, 6, -392799414, -1295957669, 1032150671, 1172974813, 1432365430), (-1541976219, 1925572276, -1733109326, -1518374587, 1489357818, 709059881, -1252620236, 7, -1072830184, 1332581384, 1527250284, -1695637371, 2063282693), (97499642, -1566247262, 519513336, -388058421, 201436760, 874084972, -531083023, 8, 561232857, 202185656, -301507011, -1788088533, -953488926), (1422281479, -292754614, -814758701, -1467257779, -1129000375, -1834913340, 706415077, 9, -2104761217, 453528181, -1044762798, 335461361, -2062074679)


query  rowsort
SELECT avg(distinct `table_1`.`column_1`) AS `alias_1` FROM `table_1` INNER JOIN (SELECT avg(distinct `table_1`.`column_2`) AS `alias_2` FROM `table_1`) AS alias_3 ON (`table_1`.`column_2` = `alias_3`.`alias_2`)
----
NULL

query  rowsort
SELECT avg(distinct `table_1`.`column_3`) AS `alias_1` FROM `table_1` INNER JOIN (SELECT `table_1`.`column_2` AS `alias_2` FROM `table_1`) AS alias_3 ON (`table_1`.`column_2` = `alias_3`.`alias_2`)
----
-69299277.8000

query  rowsort
SELECT avg(distinct `table_1`.`column_4`) AS `alias_1` FROM `table_1` INNER JOIN (SELECT avg(distinct `table_1`.`column_5`) AS `alias_2` FROM `table_1`) AS alias_3 ON (`table_1`.`column_3` = `alias_3`.`alias_2`)
----
NULL

query  rowsort
SELECT `table_1`.`column_3` AS `alias_3` FROM `table_1` INNER JOIN (SELECT avg(distinct `table_1`.`column_6`) AS `alias_1` FROM `table_1`) AS alias_2 ON (`table_1`.`column_3` = `alias_2`.`alias_1`) WHERE (`table_1`.`column_3` > ?)
? = 10
----


query  rowsort
SELECT `table_1`.`column_3` AS `alias_3` FROM `table_1` INNER JOIN (SELECT `table_1`.`column_3` AS `alias_1` FROM `table_1`) AS alias_2 ON (`table_1`.`column_3` = `alias_2`.`alias_1`) WHERE (`table_1`.`column_3` > ?)
? = 10
----
1471550698
561232857
68964780
8499843
982700756

query  rowsort
SELECT `table_1`.`column_3` AS `alias_3` FROM `table_1` INNER JOIN (SELECT avg(distinct `table_1`.`column_7`) AS `alias_1` FROM `table_1`) AS alias_2 ON (`table_1`.`column_3` = `alias_2`.`alias_1`) WHERE (`table_1`.`column_3` > ?)
? = 10
----


query  rowsort
SELECT avg(distinct `table_1`.`column_8`) AS `alias_1` FROM `table_1` INNER JOIN (SELECT avg(distinct `table_1`.`column_9`) AS `alias_2` FROM `table_1`) AS alias_3 ON (`table_1`.`column_5` = `alias_3`.`alias_2`) WHERE (`table_1`.`column_5` > ?)
? = 10
----
NULL

query  rowsort
SELECT avg(distinct `table_1`.`column_10`) AS `alias_1` FROM `table_1` INNER JOIN (SELECT `table_1`.`column_5` AS `alias_2` FROM `table_1`) AS alias_3 ON (`table_1`.`column_5` = `alias_3`.`alias_2`) WHERE (`table_1`.`column_5` > ?)
? = 10
----
-245050781.3333

query  rowsort
SELECT avg(distinct `table_1`.`column_11`) AS `alias_1` FROM `table_1` INNER JOIN (SELECT avg(distinct `table_1`.`column_12`) AS `alias_2` FROM `table_1`) AS alias_3 ON (`table_1`.`column_11` = `alias_3`.`alias_2`) WHERE (`table_1`.`column_11` > ?)
? = 10
----
NULL

statement ok
DELETE FROM `table_1` WHERE (`column_13` = 0)


statement ok
DELETE FROM `table_1` WHERE (`column_13` = 1)


statement ok
DELETE FROM `table_1` WHERE (`column_13` = 2)


statement ok
DELETE FROM `table_1` WHERE (`column_13` = 3)


statement ok
DELETE FROM `table_1` WHERE (`column_13` = 4)


query  rowsort
SELECT avg(distinct `table_1`.`column_1`) AS `alias_1` FROM `table_1` INNER JOIN (SELECT avg(distinct `table_1`.`column_2`) AS `alias_2` FROM `table_1`) AS alias_3 ON (`table_1`.`column_2` = `alias_3`.`alias_2`)
----
NULL

query  rowsort
SELECT avg(distinct `table_1`.`column_3`) AS `alias_1` FROM `table_1` INNER JOIN (SELECT `table_1`.`column_2` AS `alias_2` FROM `table_1`) AS alias_3 ON (`table_1`.`column_2` = `alias_3`.`alias_2`)
----
-405291440.4000

query  rowsort
SELECT avg(distinct `table_1`.`column_4`) AS `alias_1` FROM `table_1` INNER JOIN (SELECT avg(distinct `table_1`.`column_5`) AS `alias_2` FROM `table_1`) AS alias_3 ON (`table_1`.`column_3` = `alias_3`.`alias_2`)
----
NULL

query  rowsort
SELECT `table_1`.`column_3` AS `alias_3` FROM `table_1` INNER JOIN (SELECT avg(distinct `table_1`.`column_6`) AS `alias_1` FROM `table_1`) AS alias_2 ON (`table_1`.`column_3` = `alias_2`.`alias_1`) WHERE (`table_1`.`column_3` > ?)
? = 10
----


query  rowsort
SELECT `table_1`.`column_3` AS `alias_3` FROM `table_1` INNER JOIN (SELECT `table_1`.`column_3` AS `alias_1` FROM `table_1`) AS alias_2 ON (`table_1`.`column_3` = `alias_2`.`alias_1`) WHERE (`table_1`.`column_3` > ?)
? = 10
----
561232857
982700756

query  rowsort
SELECT `table_1`.`column_3` AS `alias_3` FROM `table_1` INNER JOIN (SELECT avg(distinct `table_1`.`column_7`) AS `alias_1` FROM `table_1`) AS alias_2 ON (`table_1`.`column_3` = `alias_2`.`alias_1`) WHERE (`table_1`.`column_3` > ?)
? = 10
----


query  rowsort
SELECT avg(distinct `table_1`.`column_8`) AS `alias_1` FROM `table_1` INNER JOIN (SELECT avg(distinct `table_1`.`column_9`) AS `alias_2` FROM `table_1`) AS alias_3 ON (`table_1`.`column_5` = `alias_3`.`alias_2`) WHERE (`table_1`.`column_5` > ?)
? = 10
----
NULL

query  rowsort
SELECT avg(distinct `table_1`.`column_10`) AS `alias_1` FROM `table_1` INNER JOIN (SELECT `table_1`.`column_5` AS `alias_2` FROM `table_1`) AS alias_3 ON (`table_1`.`column_5` = `alias_3`.`alias_2`) WHERE (`table_1`.`column_5` > ?)
? = 10
----
-1252620236.0000

query  rowsort
SELECT avg(distinct `table_1`.`column_11`) AS `alias_1` FROM `table_1` INNER JOIN (SELECT avg(distinct `table_1`.`column_12`) AS `alias_2` FROM `table_1`) AS alias_3 ON (`table_1`.`column_11` = `alias_3`.`alias_2`) WHERE (`table_1`.`column_11` > ?)
? = 10
----
NULL
