# Generated by:
#     target/debug/noria-logictest permute --compare-to mysql://root:noria@127.1/noria -d 3 -o logictests/generated/mysql/ --only range_param --random --include-deletes --rows-per-table 10 --subquery-depth 1 --overwrite-tests

statement ok
CREATE TABLE `table_1` (`column_4` INT, `column_3` INT, `column_2` INT, `column_1` INT, `column_8` INT, `column_9` INT, `column_5` INT, `column_7` INT, `column_6` INT, PRIMARY KEY (`column_9`))


statement ok
INSERT INTO `table_1` (`column_4`, `column_3`, `column_2`, `column_1`, `column_8`, `column_9`, `column_5`, `column_7`, `column_6`) VALUES (1336169920, 1537719347, -72687907, -1994477247, -969984687, 0, -1079599831, -901467322, 621988892), (2136968865, 1171202751, -12151404, -288366417, 626418202, 1, 1940596122, -248628318, -233144522), (-1875572002, -1515144733, 1959727204, -482924119, -701579914, 2, -2096415353, 1276092996, -1694406791), (264898435, 1641970104, -2052827144, -1758954002, 194062166, 3, 747913962, -1445575376, -509548312), (-2104527170, -1503580671, 660801920, -166835183, -778936950, 4, -90588987, 1744129462, -1984046216), (-1099568696, -1804588606, 601473228, -1802229675, -1385940862, 5, -382618223, -389787103, 449581366), (1656136832, -856374577, -1264373653, -1547882693, 147786757, 6, 1003739675, 2042885129, -1189677536), (-564488172, -910149644, -1727368668, 164605138, 808569750, 7, 11394536, -8260929, -1702356859), (-310026487, -125442922, 68825684, -773208361, 952338195, 8, -104098152, -881203803, 39547718), (-1404332981, -825802602, 218096577, -132859745, -1100051387, 9, 962487772, -420548226, 30005486)


query  rowsort
SELECT avg(distinct `table_1`.`column_1`) AS `alias_1` FROM `table_1`
----
-878313230.4000

query  rowsort
SELECT count(distinct `table_1`.`column_2`) AS `alias_1` FROM `table_1`
----
10

query  rowsort
SELECT `table_1`.`column_1` AS `alias_1` FROM `table_1` WHERE (`table_1`.`column_1` > ?)
? = 10
----
164605138

query  rowsort
SELECT avg(distinct `table_1`.`column_3`) AS `alias_1`, count(distinct `table_1`.`column_4`) AS `alias_2` FROM `table_1`
----
-319019155.3000
10

query  rowsort
SELECT avg(distinct `table_1`.`column_5`) AS `alias_1` FROM `table_1` WHERE (`table_1`.`column_4` > ?)
? = 10
----
653162482.0000

query  rowsort
SELECT count(distinct `table_1`.`column_6`) AS `alias_1` FROM `table_1` WHERE (`table_1`.`column_4` > ?)
? = 10
----
4

query  rowsort
SELECT avg(distinct `table_1`.`column_7`) AS `alias_1`, count(distinct `table_1`.`column_8`) AS `alias_2` FROM `table_1` WHERE (`table_1`.`column_4` > ?)
? = 10
----
-138196471.7500
4

statement ok
DELETE FROM `table_1` WHERE (`column_9` = 0)


statement ok
DELETE FROM `table_1` WHERE (`column_9` = 1)


statement ok
DELETE FROM `table_1` WHERE (`column_9` = 2)


statement ok
DELETE FROM `table_1` WHERE (`column_9` = 3)


statement ok
DELETE FROM `table_1` WHERE (`column_9` = 4)


query  rowsort
SELECT avg(distinct `table_1`.`column_1`) AS `alias_1` FROM `table_1`
----
-818315067.2000

query  rowsort
SELECT count(distinct `table_1`.`column_2`) AS `alias_1` FROM `table_1`
----
5

query  rowsort
SELECT `table_1`.`column_1` AS `alias_1` FROM `table_1` WHERE (`table_1`.`column_1` > ?)
? = 10
----
164605138

query  rowsort
SELECT avg(distinct `table_1`.`column_3`) AS `alias_1`, count(distinct `table_1`.`column_4`) AS `alias_2` FROM `table_1`
----
-904471670.2000
5

query  rowsort
SELECT avg(distinct `table_1`.`column_5`) AS `alias_1` FROM `table_1` WHERE (`table_1`.`column_4` > ?)
? = 10
----
1003739675.0000

query  rowsort
SELECT count(distinct `table_1`.`column_6`) AS `alias_1` FROM `table_1` WHERE (`table_1`.`column_4` > ?)
? = 10
----
1

query  rowsort
SELECT avg(distinct `table_1`.`column_7`) AS `alias_1`, count(distinct `table_1`.`column_8`) AS `alias_2` FROM `table_1` WHERE (`table_1`.`column_4` > ?)
? = 10
----
2042885129.0000
1
