# Generated by:
#     target/debug/noria-logictest permute --compare-to mysql://root:noria@127.1/noria -d 3 -o logictests/generated/mysql/ --only range_param --random --include-deletes --rows-per-table 10 --subquery-depth 1 --overwrite-tests

statement ok
CREATE TABLE `table_1` (`column_4` INT, `column_7` INT, `column_2` INT, `column_5` INT, `column_6` INT, `column_1` INT, `column_8` INT, `column_3` INT, `column_9` INT, PRIMARY KEY (`column_9`))


statement ok
INSERT INTO `table_1` (`column_4`, `column_7`, `column_2`, `column_5`, `column_6`, `column_1`, `column_8`, `column_3`, `column_9`) VALUES (811807555, -1524482145, -1704318733, 1240216354, -1815320584, -1701039272, 412627847, -270216979, 0), (2129571105, -700691180, 2049337190, 1040598620, -1639088049, 1271375705, 706790256, 529301960, 1), (-741072037, 1732139328, -1840342925, 923468399, 1462606658, 421838934, -1783364956, -1500646046, 2), (-1063527099, 1633706245, 1187062097, -1561372244, 1886236166, 1296822957, 421214896, -2004767741, 3), (1575501110, -1513353034, 1514994716, 1982746033, -708733007, 1340227501, 412080312, -1932232134, 4), (2002242812, 322760648, 1308612453, -1488160593, -1992841337, 501401275, -1389872633, 626174887, 5), (-486144923, 329834587, 870732273, 353389705, -1141577093, -684330764, 1172037965, 1928511055, 6), (1921001854, -204539530, -1293062225, 898674851, 1458070895, 1591895425, 993943934, 1592018071, 7), (-425027002, -1126207364, -1199846054, -104261507, 1965385158, -1304713174, 290394301, -1053400713, 8), (-1055341153, 416501552, -533294575, 226535158, -211741253, 1571191227, -620788406, -23925008, 9)


query  rowsort
SELECT avg(distinct `table_1`.`column_1`) AS `alias_1` FROM `table_1`
----
430466981.4000

query  nosort
SELECT `table_1`.`column_1` AS `alias_1` FROM `table_1` ORDER BY `table_1`.`column_1` ASC LIMIT 10
----
-1701039272
-1304713174
-684330764
421838934
501401275
1271375705
1296822957
1340227501
1571191227
1591895425

query  nosort
SELECT `table_1`.`column_1` AS `alias_1` FROM `table_1` ORDER BY `table_1`.`column_1` DESC LIMIT 10
----
1591895425
1571191227
1340227501
1296822957
1271375705
501401275
421838934
-684330764
-1304713174
-1701039272

query  rowsort
SELECT `table_1`.`column_1` AS `alias_1` FROM `table_1` WHERE (`table_1`.`column_1` > ?)
? = 10
----
1271375705
1296822957
1340227501
1571191227
1591895425
421838934
501401275

query  nosort
SELECT avg(distinct `table_1`.`column_2`) AS `alias_1` FROM `table_1` GROUP BY `table_1`.`column_1` ORDER BY `table_1`.`column_1` ASC LIMIT 10
----
-1704318733.0000
-1199846054.0000
870732273.0000
-1840342925.0000
1308612453.0000
2049337190.0000
1187062097.0000
1514994716.0000
-533294575.0000
-1293062225.0000

query  nosort
SELECT avg(distinct `table_1`.`column_3`) AS `alias_1` FROM `table_1` GROUP BY `table_1`.`column_1` ORDER BY `table_1`.`column_1` DESC LIMIT 10
----
1592018071.0000
-23925008.0000
-1932232134.0000
-2004767741.0000
529301960.0000
626174887.0000
-1500646046.0000
1928511055.0000
-1053400713.0000
-270216979.0000

query  rowsort
SELECT avg(distinct `table_1`.`column_4`) AS `alias_1` FROM `table_1` WHERE (`table_1`.`column_1` > ?)
? = 10
----
681196656.0000

query  nosort
SELECT `table_1`.`column_1` AS `alias_1` FROM `table_1` ORDER BY `table_1`.`column_1` DESC LIMIT 10
----
1591895425
1571191227
1340227501
1296822957
1271375705
501401275
421838934
-684330764
-1304713174
-1701039272

query  nosort
SELECT `table_1`.`column_1` AS `alias_1` FROM `table_1` WHERE (`table_1`.`column_1` > ?) ORDER BY `table_1`.`column_1` ASC LIMIT 10
? = 10
----
421838934
501401275
1271375705
1296822957
1340227501
1571191227
1591895425

query  nosort
SELECT `table_1`.`column_1` AS `alias_1` FROM `table_1` WHERE (`table_1`.`column_1` > ?) ORDER BY `table_1`.`column_1` DESC LIMIT 10
? = 10
----
1591895425
1571191227
1340227501
1296822957
1271375705
501401275
421838934

query  nosort
SELECT avg(distinct `table_1`.`column_5`) AS `alias_1` FROM `table_1` GROUP BY `table_1`.`column_1` ORDER BY `table_1`.`column_1` DESC LIMIT 10
----
898674851.0000
226535158.0000
1982746033.0000
-1561372244.0000
1040598620.0000
-1488160593.0000
923468399.0000
353389705.0000
-104261507.0000
1240216354.0000

query  nosort
SELECT avg(distinct `table_1`.`column_6`) AS `alias_1` FROM `table_1` WHERE (`table_1`.`column_1` > ?) GROUP BY `table_1`.`column_1` ORDER BY `table_1`.`column_1` ASC LIMIT 10
? = 10
----
1462606658.0000
-1992841337.0000
-1639088049.0000
1886236166.0000
-708733007.0000
-211741253.0000
1458070895.0000

query  nosort
SELECT avg(distinct `table_1`.`column_7`) AS `alias_1` FROM `table_1` WHERE (`table_1`.`column_1` > ?) GROUP BY `table_1`.`column_1` ORDER BY `table_1`.`column_1` DESC LIMIT 10
? = 10
----
-204539530.0000
416501552.0000
-1513353034.0000
1633706245.0000
-700691180.0000
322760648.0000
1732139328.0000

query  nosort
SELECT `table_1`.`column_1` AS `alias_1` FROM `table_1` WHERE (`table_1`.`column_1` > ?) ORDER BY `table_1`.`column_1` DESC LIMIT 10
? = 10
----
1591895425
1571191227
1340227501
1296822957
1271375705
501401275
421838934

query  nosort
SELECT avg(distinct `table_1`.`column_8`) AS `alias_1` FROM `table_1` WHERE (`table_1`.`column_4` > ?) GROUP BY `table_1`.`column_4` ORDER BY `table_1`.`column_4` DESC LIMIT 10
? = 10
----
706790256.0000
-1389872633.0000
993943934.0000
412080312.0000
412627847.0000

statement ok
DELETE FROM `table_1` WHERE (`column_9` = 0)


statement ok
DELETE FROM `table_1` WHERE (`column_9` = 1)


statement ok
DELETE FROM `table_1` WHERE (`column_9` = 2)


statement ok
DELETE FROM `table_1` WHERE (`column_9` = 3)


statement ok
DELETE FROM `table_1` WHERE (`column_9` = 4)


query  rowsort
SELECT avg(distinct `table_1`.`column_1`) AS `alias_1` FROM `table_1`
----
335088797.8000

query  nosort
SELECT `table_1`.`column_1` AS `alias_1` FROM `table_1` ORDER BY `table_1`.`column_1` ASC LIMIT 10
----
-1304713174
-684330764
501401275
1571191227
1591895425

query  nosort
SELECT `table_1`.`column_1` AS `alias_1` FROM `table_1` ORDER BY `table_1`.`column_1` DESC LIMIT 10
----
1591895425
1571191227
501401275
-684330764
-1304713174

query  rowsort
SELECT `table_1`.`column_1` AS `alias_1` FROM `table_1` WHERE (`table_1`.`column_1` > ?)
? = 10
----
1571191227
1591895425
501401275

query  nosort
SELECT avg(distinct `table_1`.`column_2`) AS `alias_1` FROM `table_1` GROUP BY `table_1`.`column_1` ORDER BY `table_1`.`column_1` ASC LIMIT 10
----
-1199846054.0000
870732273.0000
1308612453.0000
-533294575.0000
-1293062225.0000

query  nosort
SELECT avg(distinct `table_1`.`column_3`) AS `alias_1` FROM `table_1` GROUP BY `table_1`.`column_1` ORDER BY `table_1`.`column_1` DESC LIMIT 10
----
1592018071.0000
-23925008.0000
626174887.0000
1928511055.0000
-1053400713.0000

query  rowsort
SELECT avg(distinct `table_1`.`column_4`) AS `alias_1` FROM `table_1` WHERE (`table_1`.`column_1` > ?)
? = 10
----
955967837.6667

query  nosort
SELECT `table_1`.`column_1` AS `alias_1` FROM `table_1` ORDER BY `table_1`.`column_1` DESC LIMIT 10
----
1591895425
1571191227
501401275
-684330764
-1304713174

query  nosort
SELECT `table_1`.`column_1` AS `alias_1` FROM `table_1` WHERE (`table_1`.`column_1` > ?) ORDER BY `table_1`.`column_1` ASC LIMIT 10
? = 10
----
501401275
1571191227
1591895425

query  nosort
SELECT `table_1`.`column_1` AS `alias_1` FROM `table_1` WHERE (`table_1`.`column_1` > ?) ORDER BY `table_1`.`column_1` DESC LIMIT 10
? = 10
----
1591895425
1571191227
501401275

query  nosort
SELECT avg(distinct `table_1`.`column_5`) AS `alias_1` FROM `table_1` GROUP BY `table_1`.`column_1` ORDER BY `table_1`.`column_1` DESC LIMIT 10
----
898674851.0000
226535158.0000
-1488160593.0000
353389705.0000
-104261507.0000

query  nosort
SELECT avg(distinct `table_1`.`column_6`) AS `alias_1` FROM `table_1` WHERE (`table_1`.`column_1` > ?) GROUP BY `table_1`.`column_1` ORDER BY `table_1`.`column_1` ASC LIMIT 10
? = 10
----
-1992841337.0000
-211741253.0000
1458070895.0000

query  nosort
SELECT avg(distinct `table_1`.`column_7`) AS `alias_1` FROM `table_1` WHERE (`table_1`.`column_1` > ?) GROUP BY `table_1`.`column_1` ORDER BY `table_1`.`column_1` DESC LIMIT 10
? = 10
----
-204539530.0000
416501552.0000
322760648.0000

query  nosort
SELECT `table_1`.`column_1` AS `alias_1` FROM `table_1` WHERE (`table_1`.`column_1` > ?) ORDER BY `table_1`.`column_1` DESC LIMIT 10
? = 10
----
1591895425
1571191227
501401275

query  nosort
SELECT avg(distinct `table_1`.`column_8`) AS `alias_1` FROM `table_1` WHERE (`table_1`.`column_4` > ?) GROUP BY `table_1`.`column_4` ORDER BY `table_1`.`column_4` DESC LIMIT 10
? = 10
----
-1389872633.0000
993943934.0000
