# Generated by:
#     target/debug/noria-logictest permute --compare-to mysql://root:noria@127.1/noria -d 3 -o logictests/generated/mysql/ --only range_param --random --include-deletes --rows-per-table 10 --subquery-depth 1 --overwrite-tests

statement ok
CREATE TABLE `table_4` (`column_5` INT, `column_2` INT, `column_1` INT, `column_3` INT, `column_4` INT, PRIMARY KEY (`column_5`))


statement ok
CREATE TABLE `table_1` (`column_4` INT, `column_7` INT, `column_1` INT, `column_2` INT, `column_3` INT, `column_5` INT, `column_6` INT, PRIMARY KEY (`column_7`))


statement ok
CREATE TABLE `table_3` (`column_1` INT, `column_2` INT, `column_3` INT, PRIMARY KEY (`column_3`))


statement ok
CREATE TABLE `table_5` (`column_2` INT, `column_1` INT, `column_3` INT, PRIMARY KEY (`column_3`))


statement ok
CREATE TABLE `table_2` (`column_1` INT, `column_3` INT, `column_2` INT, PRIMARY KEY (`column_3`))


statement ok
INSERT INTO `table_4` (`column_5`, `column_2`, `column_1`, `column_3`, `column_4`) VALUES (0, 1936022477, 1182570723, -1322208945, -1173046056), (1, -876974665, 657900695, 1421132756, -656304786), (2, 662737294, 1707662621, -164229393, 267560369), (3, -974742848, 1606930232, 1424360558, -1489150686), (4, -1207861347, 83685191, 477542475, 915674252), (5, 2116548185, 2093300141, 1962499840, -1598875209), (6, 253536490, 2035137246, 1236895532, 903911171), (7, 651318609, -1907914188, 448446394, -1457251884), (8, -1539211452, -803180817, 568913096, -582314699), (9, 531708953, 1742494858, -1901075708, -10035430)


statement ok
INSERT INTO `table_1` (`column_4`, `column_7`, `column_1`, `column_2`, `column_3`, `column_5`, `column_6`) VALUES (-1049364692, 0, 1231455903, 1177973115, -2007908654, 472072559, -25681591), (-119126789, 1, -1415868297, 1681817817, 1758972104, -133800582, -1415118481), (-1862304442, 2, 876042020, 1240413930, -1805648728, 2134544200, -633056595), (1242767647, 3, 1955451198, 913983828, 276217634, 1505154828, -581229634), (677165120, 4, 631870774, -676424170, 689671394, 385530055, 1576286392), (-1276403046, 5, 518209992, -1565518870, -1534019834, -1610850885, 2066380821), (1324944278, 6, 1128474260, -759637582, -1249930118, 265597482, -286988182), (239346449, 7, -291446953, 1177735459, 174107756, 1094471293, 945853953), (-1893465722, 8, -91398421, 758990969, -1363475148, -332415181, -1482768348), (-736726439, 9, -118792466, 1556996583, 1032533777, 1098878138, 888989812)


statement ok
INSERT INTO `table_3` (`column_1`, `column_2`, `column_3`) VALUES (1577557825, -1674811135, 0), (1418073093, 502334434, 1), (-1395485598, -1554191546, 2), (-379671669, -850482613, 3), (1387761389, 2126520374, 4), (1280292668, -571661567, 5), (950945862, 529898636, 6), (1611279465, -663230978, 7), (-2134950341, 184592871, 8), (-1875453748, -391213616, 9)


statement ok
INSERT INTO `table_5` (`column_2`, `column_1`, `column_3`) VALUES (-878867488, -1812513928, 0), (176537723, 2012793749, 1), (1961941806, -2083378255, 2), (-1279789129, 832808403, 3), (350244062, 34574350, 4), (230151216, 5873131, 5), (1098873720, 1712334906, 6), (2046877079, -1708398360, 7), (-343222487, 885195737, 8), (-324614514, -148346241, 9)


statement ok
INSERT INTO `table_2` (`column_1`, `column_3`, `column_2`) VALUES (1712759773, 0, -1533021555), (1106303959, 1, -2143861969), (-1561627972, 2, -925735977), (1719917753, 3, 594530441), (-822182413, 4, 1171749938), (-52076354, 5, 1658961566), (-546008780, 6, -786818959), (1230415480, 7, 2133799079), (2083023503, 8, -1846270968), (-85956204, 9, 864248993)


query  rowsort
SELECT count(distinct `table_1`.`column_1`) AS `alias_1` FROM `table_1`
----
10

query  rowsort
SELECT `table_1`.`column_2` AS `alias_1`, `table_2`.`column_2` AS `alias_2` FROM `table_1` LEFT JOIN `table_2` ON (`table_1`.`column_1` = `table_2`.`column_1`)
----
-1565518870
NULL
-676424170
NULL
-759637582
NULL
1177735459
NULL
1177973115
NULL
1240413930
NULL
1556996583
NULL
1681817817
NULL
758990969
NULL
913983828
NULL

query  rowsort
SELECT `table_1`.`column_2` AS `alias_1` FROM `table_1` WHERE (`table_1`.`column_2` > ?)
? = 10
----
1177735459
1177973115
1240413930
1556996583
1681817817
758990969
913983828

query  rowsort
SELECT count(distinct `table_1`.`column_3`) AS `alias_1`, `table_1`.`column_4` AS `alias_2`, `table_3`.`column_2` AS `alias_3` FROM `table_1` LEFT JOIN `table_3` ON (`table_1`.`column_2` = `table_3`.`column_1`) GROUP BY `table_1`.`column_4`, `table_3`.`column_2`
----
30 values hashing to 23f033bae72f3cc006f1d0b2226eee0c

query  rowsort
SELECT count(distinct `table_1`.`column_5`) AS `alias_1` FROM `table_1` WHERE (`table_1`.`column_4` > ?)
? = 10
----
4

query  rowsort
SELECT `table_1`.`column_6` AS `alias_1`, `table_4`.`column_2` AS `alias_2` FROM `table_1` LEFT JOIN `table_4` ON (`table_1`.`column_4` = `table_4`.`column_1`) WHERE (`table_1`.`column_4` > ?)
? = 10
----
-286988182
NULL
-581229634
NULL
1576286392
NULL
945853953
NULL

query  rowsort
SELECT count(distinct `table_4`.`column_3`) AS `alias_1`, `table_4`.`column_4` AS `alias_2`, `table_5`.`column_2` AS `alias_3` FROM `table_4` LEFT JOIN `table_5` ON (`table_4`.`column_2` = `table_5`.`column_1`) WHERE (`table_4`.`column_2` > ?) GROUP BY `table_4`.`column_4`, `table_5`.`column_2`
? = 10
----
1
-10035430
NULL
1
-1173046056
NULL
1
-1457251884
NULL
1
-1598875209
NULL
1
267560369
NULL
1
903911171
NULL

statement ok
DELETE FROM `table_4` WHERE (`column_5` = 0)


statement ok
DELETE FROM `table_4` WHERE (`column_5` = 1)


statement ok
DELETE FROM `table_4` WHERE (`column_5` = 2)


statement ok
DELETE FROM `table_4` WHERE (`column_5` = 3)


statement ok
DELETE FROM `table_4` WHERE (`column_5` = 4)


statement ok
DELETE FROM `table_1` WHERE (`column_7` = 0)


statement ok
DELETE FROM `table_1` WHERE (`column_7` = 1)


statement ok
DELETE FROM `table_1` WHERE (`column_7` = 2)


statement ok
DELETE FROM `table_1` WHERE (`column_7` = 3)


statement ok
DELETE FROM `table_1` WHERE (`column_7` = 4)


statement ok
DELETE FROM `table_3` WHERE (`column_3` = 0)


statement ok
DELETE FROM `table_3` WHERE (`column_3` = 1)


statement ok
DELETE FROM `table_3` WHERE (`column_3` = 2)


statement ok
DELETE FROM `table_3` WHERE (`column_3` = 3)


statement ok
DELETE FROM `table_3` WHERE (`column_3` = 4)


statement ok
DELETE FROM `table_5` WHERE (`column_3` = 0)


statement ok
DELETE FROM `table_5` WHERE (`column_3` = 1)


statement ok
DELETE FROM `table_5` WHERE (`column_3` = 2)


statement ok
DELETE FROM `table_5` WHERE (`column_3` = 3)


statement ok
DELETE FROM `table_5` WHERE (`column_3` = 4)


statement ok
DELETE FROM `table_2` WHERE (`column_3` = 0)


statement ok
DELETE FROM `table_2` WHERE (`column_3` = 1)


statement ok
DELETE FROM `table_2` WHERE (`column_3` = 2)


statement ok
DELETE FROM `table_2` WHERE (`column_3` = 3)


statement ok
DELETE FROM `table_2` WHERE (`column_3` = 4)


query  rowsort
SELECT count(distinct `table_1`.`column_1`) AS `alias_1` FROM `table_1`
----
5

query  rowsort
SELECT `table_1`.`column_2` AS `alias_1`, `table_2`.`column_2` AS `alias_2` FROM `table_1` LEFT JOIN `table_2` ON (`table_1`.`column_1` = `table_2`.`column_1`)
----
-1565518870
NULL
-759637582
NULL
1177735459
NULL
1556996583
NULL
758990969
NULL

query  rowsort
SELECT `table_1`.`column_2` AS `alias_1` FROM `table_1` WHERE (`table_1`.`column_2` > ?)
? = 10
----
1177735459
1556996583
758990969

query  rowsort
SELECT count(distinct `table_1`.`column_3`) AS `alias_1`, `table_1`.`column_4` AS `alias_2`, `table_3`.`column_2` AS `alias_3` FROM `table_1` LEFT JOIN `table_3` ON (`table_1`.`column_2` = `table_3`.`column_1`) GROUP BY `table_1`.`column_4`, `table_3`.`column_2`
----
1
-1276403046
NULL
1
-1893465722
NULL
1
-736726439
NULL
1
1324944278
NULL
1
239346449
NULL

query  rowsort
SELECT count(distinct `table_1`.`column_5`) AS `alias_1` FROM `table_1` WHERE (`table_1`.`column_4` > ?)
? = 10
----
2

query  rowsort
SELECT `table_1`.`column_6` AS `alias_1`, `table_4`.`column_2` AS `alias_2` FROM `table_1` LEFT JOIN `table_4` ON (`table_1`.`column_4` = `table_4`.`column_1`) WHERE (`table_1`.`column_4` > ?)
? = 10
----
-286988182
NULL
945853953
NULL

query  rowsort
SELECT count(distinct `table_4`.`column_3`) AS `alias_1`, `table_4`.`column_4` AS `alias_2`, `table_5`.`column_2` AS `alias_3` FROM `table_4` LEFT JOIN `table_5` ON (`table_4`.`column_2` = `table_5`.`column_1`) WHERE (`table_4`.`column_2` > ?) GROUP BY `table_4`.`column_4`, `table_5`.`column_2`
? = 10
----
1
-10035430
NULL
1
-1457251884
NULL
1
-1598875209
NULL
1
903911171
NULL
