# Generated by:
#     target/debug/noria-logictest permute --compare-to mysql://root:noria@127.1/noria -d 3 -o logictests/generated/mysql/ --only range_param --random --include-deletes --rows-per-table 10 --subquery-depth 1 --overwrite-tests

statement ok
CREATE TABLE `table_1` (`column_4` INT, `column_5` INT, `column_2` INT, `column_1` INT, `column_3` INT, PRIMARY KEY (`column_5`))


statement ok
INSERT INTO `table_1` (`column_4`, `column_5`, `column_2`, `column_1`, `column_3`) VALUES (-123182737, 0, 1635772381, -16887501, -1541481394), (1410158741, 1, -1824281761, -988547691, 888129383), (154740130, 2, 504545871, 1400756019, 1563454027), (-312942616, 3, 193502759, 481287584, -1662358051), (1195406958, 4, -1220570236, -1806229539, -1391842902), (1945779912, 5, -978088765, 540412181, 1861749293), (-1080755083, 6, -1777898901, 1100152017, -1258103504), (-847244424, 7, -510984318, 1054420860, 4869223), (-1108714033, 8, 1055341614, 1791089692, 890764881), (-109544465, 9, 1455309206, -537109396, 449371146)


query  rowsort
SELECT count(distinct `table_1`.`column_1`) AS `alias_1` FROM `table_1`
----
10

query  rowsort
SELECT `table_1`.`column_1` AS `alias_1` FROM `table_1` WHERE (`table_1`.`column_1` > ?)
? = 10
----
1054420860
1100152017
1400756019
1791089692
481287584
540412181

query  rowsort
SELECT `table_1`.`column_1` AS `alias_1` FROM `table_1` WHERE (`table_1`.`column_1` > ?)
? = 10
----
1054420860
1100152017
1400756019
1791089692
481287584
540412181

query  rowsort
SELECT count(distinct `table_1`.`column_2`) AS `alias_1` FROM `table_1` WHERE (`table_1`.`column_1` > ?)
? = 10
----
6

query  rowsort
SELECT count(distinct `table_1`.`column_3`) AS `alias_1` FROM `table_1` WHERE (`table_1`.`column_1` > ?)
? = 10
----
6

query  rowsort
SELECT `table_1`.`column_1` AS `alias_1` FROM `table_1` WHERE ((`table_1`.`column_1` > ?) AND (`table_1`.`column_1` > ?))
? = 10
? = 10
----
1054420860
1100152017
1400756019
1791089692
481287584
540412181

query  rowsort
SELECT count(distinct `table_1`.`column_4`) AS `alias_1` FROM `table_1` WHERE ((`table_1`.`column_4` > ?) AND (`table_1`.`column_4` > ?))
? = 10
? = 10
----
4

statement ok
DELETE FROM `table_1` WHERE (`column_5` = 0)


statement ok
DELETE FROM `table_1` WHERE (`column_5` = 1)


statement ok
DELETE FROM `table_1` WHERE (`column_5` = 2)


statement ok
DELETE FROM `table_1` WHERE (`column_5` = 3)


statement ok
DELETE FROM `table_1` WHERE (`column_5` = 4)


query  rowsort
SELECT count(distinct `table_1`.`column_1`) AS `alias_1` FROM `table_1`
----
5

query  rowsort
SELECT `table_1`.`column_1` AS `alias_1` FROM `table_1` WHERE (`table_1`.`column_1` > ?)
? = 10
----
1054420860
1100152017
1791089692
540412181

query  rowsort
SELECT `table_1`.`column_1` AS `alias_1` FROM `table_1` WHERE (`table_1`.`column_1` > ?)
? = 10
----
1054420860
1100152017
1791089692
540412181

query  rowsort
SELECT count(distinct `table_1`.`column_2`) AS `alias_1` FROM `table_1` WHERE (`table_1`.`column_1` > ?)
? = 10
----
4

query  rowsort
SELECT count(distinct `table_1`.`column_3`) AS `alias_1` FROM `table_1` WHERE (`table_1`.`column_1` > ?)
? = 10
----
4

query  rowsort
SELECT `table_1`.`column_1` AS `alias_1` FROM `table_1` WHERE ((`table_1`.`column_1` > ?) AND (`table_1`.`column_1` > ?))
? = 10
? = 10
----
1054420860
1100152017
1791089692
540412181

query  rowsort
SELECT count(distinct `table_1`.`column_4`) AS `alias_1` FROM `table_1` WHERE ((`table_1`.`column_4` > ?) AND (`table_1`.`column_4` > ?))
? = 10
? = 10
----
1
