# Generated by:
#     target/debug/noria-logictest permute --compare-to mysql://root:noria@127.1/noria -d 3 -o logictests/generated/mysql/ --only range_param --random --include-deletes --rows-per-table 10 --subquery-depth 1 --overwrite-tests

statement ok
CREATE TABLE `table_1` (`column_9` INT, `column_7` INT, `column_4` INT, `column_5` INT, `column_6` INT, `column_2` INT, `column_1` INT, `column_8` INT, `column_3` INT, PRIMARY KEY (`column_9`))


statement ok
INSERT INTO `table_1` (`column_9`, `column_7`, `column_4`, `column_5`, `column_6`, `column_2`, `column_1`, `column_8`, `column_3`) VALUES (0, -1376879375, 1727147038, 2016905416, -670320704, -1994211786, -862813402, -1778840761, -113017327), (1, -80702114, 1213793277, -538013997, 215009158, 21779127, 997686851, 888152011, -2140317427), (2, 1312896439, -84090722, -1733379491, 839244130, -826901880, 1805819879, 1790923067, 1944860426), (3, -413082887, -1115619573, -1029221633, 570327527, -1439849370, 862617121, 867741344, 846996361), (4, 776548624, 1632080181, -1093567834, -1534684430, -1006451428, 1743585070, 1341395267, 1982043568), (5, 1107342484, -1577668170, -1296274577, 178594680, 170529312, -1763064759, 1093555546, -75500429), (6, -668292502, 736764408, 1944298900, 157940839, -1809299488, -601069120, 975493807, -1101519290), (7, 1268493116, 1512628468, 1613333601, -858890492, 1958291428, 887784216, 1627123302, -1376369958), (8, 391609116, 1016822491, -325952066, -2045137995, 484071682, 2035069931, 949192520, 1115243845), (9, -1599052519, -1314507205, 614031685, 634971725, -1410078295, -322964591, -826531285, 301099343)


query  rowsort
SELECT count(`table_1`.`column_1`) AS `alias_1` FROM `table_1`
----
10

query  rowsort
SELECT max(`table_1`.`column_2`) AS `alias_1` FROM `table_1`
----
1958291428

query  rowsort
SELECT `table_1`.`column_1` AS `alias_1` FROM `table_1` WHERE (`table_1`.`column_1` > ?)
? = 10
----
1743585070
1805819879
2035069931
862617121
887784216
997686851

query  rowsort
SELECT count(`table_1`.`column_3`) AS `alias_1`, max(`table_1`.`column_4`) AS `alias_2` FROM `table_1`
----
10
1727147038

query  rowsort
SELECT count(`table_1`.`column_5`) AS `alias_1` FROM `table_1` WHERE (`table_1`.`column_5` > ?)
? = 10
----
4

query  rowsort
SELECT max(`table_1`.`column_6`) AS `alias_1` FROM `table_1` WHERE (`table_1`.`column_5` > ?)
? = 10
----
634971725

query  rowsort
SELECT count(`table_1`.`column_7`) AS `alias_1`, max(`table_1`.`column_8`) AS `alias_2` FROM `table_1` WHERE (`table_1`.`column_7` > ?)
? = 10
----
5
1790923067

statement ok
DELETE FROM `table_1` WHERE (`column_9` = 0)


statement ok
DELETE FROM `table_1` WHERE (`column_9` = 1)


statement ok
DELETE FROM `table_1` WHERE (`column_9` = 2)


statement ok
DELETE FROM `table_1` WHERE (`column_9` = 3)


statement ok
DELETE FROM `table_1` WHERE (`column_9` = 4)


query  rowsort
SELECT count(`table_1`.`column_1`) AS `alias_1` FROM `table_1`
----
5

query  rowsort
SELECT max(`table_1`.`column_2`) AS `alias_1` FROM `table_1`
----
1958291428

query  rowsort
SELECT `table_1`.`column_1` AS `alias_1` FROM `table_1` WHERE (`table_1`.`column_1` > ?)
? = 10
----
2035069931
887784216

query  rowsort
SELECT count(`table_1`.`column_3`) AS `alias_1`, max(`table_1`.`column_4`) AS `alias_2` FROM `table_1`
----
5
1512628468

query  rowsort
SELECT count(`table_1`.`column_5`) AS `alias_1` FROM `table_1` WHERE (`table_1`.`column_5` > ?)
? = 10
----
3

query  rowsort
SELECT max(`table_1`.`column_6`) AS `alias_1` FROM `table_1` WHERE (`table_1`.`column_5` > ?)
? = 10
----
634971725

query  rowsort
SELECT count(`table_1`.`column_7`) AS `alias_1`, max(`table_1`.`column_8`) AS `alias_2` FROM `table_1` WHERE (`table_1`.`column_7` > ?)
? = 10
----
3
1627123302
