# Generated by:
#     target/debug/noria-logictest generate --operations count,distinct --compare-to mysql://root@localhost/mysql --subquery-depth 1 --rows-per-table 5 -o logictests/generated/count,distinct.test --include-deletes

statement ok
CREATE TABLE table_1 (column_1 INT(32), column_2 INT(32), column_3 INT(32), PRIMARY KEY (column_3))


statement ok
INSERT INTO table_1 (column_1, column_2, column_3) VALUES (1, 1, 2), (1, 1, 3), (1, 1, 4), (1, 1, 5), (1, 1, 6)


query  nosort
SELECT count(table_1.column_1) AS alias_1 FROM table_1
----
5

query  nosort
SELECT DISTINCT table_1.column_1 AS alias_1 FROM table_1
----
1

query  nosort
SELECT DISTINCT count(table_1.column_2) AS alias_1 FROM table_1
----
5

statement ok
DELETE FROM table_1 WHERE (column_3 = 2)


statement ok
DELETE FROM table_1 WHERE (column_3 = 3)


query  nosort
SELECT count(table_1.column_1) AS alias_1 FROM table_1
----
3

query  nosort
SELECT DISTINCT table_1.column_1 AS alias_1 FROM table_1
----
1

query  nosort
SELECT DISTINCT count(table_1.column_2) AS alias_1 FROM table_1
----
3
