# Generated by:
#     target/debug/noria-logictest permute --compare-to mysql://root:noria@127.1/noria -d 3 -o logictests/generated/mysql/ --only range_param --random --include-deletes --rows-per-table 10 --subquery-depth 1

statement ok
CREATE TABLE `table_1` (`column_1` INT, `column_2` INT, PRIMARY KEY (`column_2`))


statement ok
INSERT INTO `table_1` (`column_1`, `column_2`) VALUES (-715625673, 0), (-584481440, 1), (-1516295350, 2), (-568576819, 3), (1794038167, 4), (-988321276, 5), (1758244016, 6), (676250260, 7), (-406804908, 8), (2129848281, 9)


query  rowsort
WITH `alias_2` AS (SELECT DISTINCT `table_1`.`column_1` AS `alias_1` FROM `table_1`) SELECT DISTINCT `table_1`.`column_1` AS `alias_3` FROM `table_1` INNER JOIN `alias_2` ON (`table_1`.`column_1` = `alias_2`.`alias_1`)
----
-1516295350
-406804908
-568576819
-584481440
-715625673
-988321276
1758244016
1794038167
2129848281
676250260

query  rowsort
WITH `alias_2` AS (SELECT `table_1`.`column_1` AS `alias_1` FROM `table_1`) SELECT DISTINCT `table_1`.`column_1` AS `alias_3` FROM `table_1` INNER JOIN `alias_2` ON (`table_1`.`column_1` = `alias_2`.`alias_1`)
----
-1516295350
-406804908
-568576819
-584481440
-715625673
-988321276
1758244016
1794038167
2129848281
676250260

query  rowsort
WITH `alias_2` AS (SELECT DISTINCT `table_1`.`column_1` AS `alias_1` FROM `table_1`) SELECT DISTINCT `table_1`.`column_1` AS `alias_3` FROM `table_1` INNER JOIN `alias_2` ON (`table_1`.`column_1` = `alias_2`.`alias_1`)
----
-1516295350
-406804908
-568576819
-584481440
-715625673
-988321276
1758244016
1794038167
2129848281
676250260

query  rowsort
WITH `alias_2` AS (SELECT DISTINCT `table_1`.`column_1` AS `alias_1` FROM `table_1`) SELECT `table_1`.`column_1` AS `alias_3` FROM `table_1` INNER JOIN `alias_2` ON (`table_1`.`column_1` = `alias_2`.`alias_1`) WHERE (`table_1`.`column_1` > ?)
? = 10
----
1758244016
1794038167
2129848281
676250260

query  rowsort
WITH `alias_2` AS (SELECT `table_1`.`column_1` AS `alias_1` FROM `table_1`) SELECT `table_1`.`column_1` AS `alias_3` FROM `table_1` INNER JOIN `alias_2` ON (`table_1`.`column_1` = `alias_2`.`alias_1`) WHERE (`table_1`.`column_1` > ?)
? = 10
----
1758244016
1794038167
2129848281
676250260

query  rowsort
WITH `alias_2` AS (SELECT DISTINCT `table_1`.`column_1` AS `alias_1` FROM `table_1`) SELECT `table_1`.`column_1` AS `alias_3` FROM `table_1` INNER JOIN `alias_2` ON (`table_1`.`column_1` = `alias_2`.`alias_1`) WHERE (`table_1`.`column_1` > ?)
? = 10
----
1758244016
1794038167
2129848281
676250260

query  rowsort
WITH `alias_2` AS (SELECT DISTINCT `table_1`.`column_1` AS `alias_1` FROM `table_1`) SELECT DISTINCT `table_1`.`column_1` AS `alias_3` FROM `table_1` INNER JOIN `alias_2` ON (`table_1`.`column_1` = `alias_2`.`alias_1`) WHERE (`table_1`.`column_1` > ?)
? = 10
----
1758244016
1794038167
2129848281
676250260

query  rowsort
WITH `alias_2` AS (SELECT `table_1`.`column_1` AS `alias_1` FROM `table_1`) SELECT DISTINCT `table_1`.`column_1` AS `alias_3` FROM `table_1` INNER JOIN `alias_2` ON (`table_1`.`column_1` = `alias_2`.`alias_1`) WHERE (`table_1`.`column_1` > ?)
? = 10
----
1758244016
1794038167
2129848281
676250260

query  rowsort
WITH `alias_2` AS (SELECT DISTINCT `table_1`.`column_1` AS `alias_1` FROM `table_1`) SELECT DISTINCT `table_1`.`column_1` AS `alias_3` FROM `table_1` INNER JOIN `alias_2` ON (`table_1`.`column_1` = `alias_2`.`alias_1`) WHERE (`table_1`.`column_1` > ?)
? = 10
----
1758244016
1794038167
2129848281
676250260

statement ok
DELETE FROM `table_1` WHERE (`column_2` = 0)


statement ok
DELETE FROM `table_1` WHERE (`column_2` = 1)


statement ok
DELETE FROM `table_1` WHERE (`column_2` = 2)


statement ok
DELETE FROM `table_1` WHERE (`column_2` = 3)


statement ok
DELETE FROM `table_1` WHERE (`column_2` = 4)


query  rowsort
WITH `alias_2` AS (SELECT DISTINCT `table_1`.`column_1` AS `alias_1` FROM `table_1`) SELECT DISTINCT `table_1`.`column_1` AS `alias_3` FROM `table_1` INNER JOIN `alias_2` ON (`table_1`.`column_1` = `alias_2`.`alias_1`)
----
-406804908
-988321276
1758244016
2129848281
676250260

query  rowsort
WITH `alias_2` AS (SELECT `table_1`.`column_1` AS `alias_1` FROM `table_1`) SELECT DISTINCT `table_1`.`column_1` AS `alias_3` FROM `table_1` INNER JOIN `alias_2` ON (`table_1`.`column_1` = `alias_2`.`alias_1`)
----
-406804908
-988321276
1758244016
2129848281
676250260

query  rowsort
WITH `alias_2` AS (SELECT DISTINCT `table_1`.`column_1` AS `alias_1` FROM `table_1`) SELECT DISTINCT `table_1`.`column_1` AS `alias_3` FROM `table_1` INNER JOIN `alias_2` ON (`table_1`.`column_1` = `alias_2`.`alias_1`)
----
-406804908
-988321276
1758244016
2129848281
676250260

query  rowsort
WITH `alias_2` AS (SELECT DISTINCT `table_1`.`column_1` AS `alias_1` FROM `table_1`) SELECT `table_1`.`column_1` AS `alias_3` FROM `table_1` INNER JOIN `alias_2` ON (`table_1`.`column_1` = `alias_2`.`alias_1`) WHERE (`table_1`.`column_1` > ?)
? = 10
----
1758244016
2129848281
676250260

query  rowsort
WITH `alias_2` AS (SELECT `table_1`.`column_1` AS `alias_1` FROM `table_1`) SELECT `table_1`.`column_1` AS `alias_3` FROM `table_1` INNER JOIN `alias_2` ON (`table_1`.`column_1` = `alias_2`.`alias_1`) WHERE (`table_1`.`column_1` > ?)
? = 10
----
1758244016
2129848281
676250260

query  rowsort
WITH `alias_2` AS (SELECT DISTINCT `table_1`.`column_1` AS `alias_1` FROM `table_1`) SELECT `table_1`.`column_1` AS `alias_3` FROM `table_1` INNER JOIN `alias_2` ON (`table_1`.`column_1` = `alias_2`.`alias_1`) WHERE (`table_1`.`column_1` > ?)
? = 10
----
1758244016
2129848281
676250260

query  rowsort
WITH `alias_2` AS (SELECT DISTINCT `table_1`.`column_1` AS `alias_1` FROM `table_1`) SELECT DISTINCT `table_1`.`column_1` AS `alias_3` FROM `table_1` INNER JOIN `alias_2` ON (`table_1`.`column_1` = `alias_2`.`alias_1`) WHERE (`table_1`.`column_1` > ?)
? = 10
----
1758244016
2129848281
676250260

query  rowsort
WITH `alias_2` AS (SELECT `table_1`.`column_1` AS `alias_1` FROM `table_1`) SELECT DISTINCT `table_1`.`column_1` AS `alias_3` FROM `table_1` INNER JOIN `alias_2` ON (`table_1`.`column_1` = `alias_2`.`alias_1`) WHERE (`table_1`.`column_1` > ?)
? = 10
----
1758244016
2129848281
676250260

query  rowsort
WITH `alias_2` AS (SELECT DISTINCT `table_1`.`column_1` AS `alias_1` FROM `table_1`) SELECT DISTINCT `table_1`.`column_1` AS `alias_3` FROM `table_1` INNER JOIN `alias_2` ON (`table_1`.`column_1` = `alias_2`.`alias_1`) WHERE (`table_1`.`column_1` > ?)
? = 10
----
1758244016
2129848281
676250260
