# Generated by:
#     target/debug/noria-logictest permute --compare-to mysql://root:noria@127.1/noria -d 3 -o logictests/generated/mysql/ --only range_param --random --include-deletes --rows-per-table 10 --subquery-depth 1

statement ok
CREATE TABLE `table_1` (`column_1` INT, `column_6` INT, `column_8` INT, `column_3` INT, `column_4` INT, `column_7` INT, `column_5` INT, `column_10` INT, `column_12` INT, `column_2` INT, `column_11` INT, `column_13` INT, `column_9` INT, PRIMARY KEY (`column_13`))


statement ok
INSERT INTO `table_1` (`column_1`, `column_6`, `column_8`, `column_3`, `column_4`, `column_7`, `column_5`, `column_10`, `column_12`, `column_2`, `column_11`, `column_13`, `column_9`) VALUES (290883632, -1827147086, -955117668, 2015553793, -1115408765, 1335630926, -969133991, -1306448374, 1695659786, 288472080, -1415815789, 0, -601622037), (318480148, 619446847, 376964969, -711488325, 1925652111, 813782956, -1601931138, 246921503, 480753942, -386169884, -668964899, 1, 539752439), (-914669923, 95576098, 453496269, -1078215739, 582268636, 1382864924, 996437328, -1046102899, -718756795, -235865677, -542214947, 2, 1665118144), (80378114, -1100473562, -426765662, 549634130, 1371894570, -1449755173, 589130014, 34499896, -1465504004, -1372348865, 889907003, 3, 325837719), (-622013192, 316900412, -1577777231, -1412417297, -137355028, 1881322909, -1695747169, 18402452, 819080211, 2117792023, -1242698518, 4, -1722892562), (24392112, -2127390187, 1030926184, 875380758, -1358220468, 476004278, 1665192956, 831486966, -667176258, 26874439, 610908355, 5, 1657928961), (-259304573, 2126618023, -1604234611, 1903175382, -527339173, -410864305, 2051204062, -1590408514, 54211227, 46710553, 879343716, 6, 1735423445), (-1159968133, 2115125030, 1912798155, -178647504, -258736691, 65369460, 127021093, -1277150991, 1037673161, -1586271115, -260654646, 7, 1801587409), (-382003715, 1145571198, 206505750, -1061683321, 1815612243, -197572929, -45169761, -1147137486, -1872859907, -1861038987, 2134538422, 8, -205911526), (398020342, -1625345580, 1829316154, -1850686733, -537135137, -1206678211, 357424868, 81594441, -1102247146, -1727960496, 1744389835, 9, 1481406019)


query  rowsort
WITH `alias_3` AS (SELECT avg(`table_1`.`column_2`) AS `alias_2` FROM `table_1`) SELECT avg(`table_1`.`column_1`) AS `alias_1` FROM `table_1` INNER JOIN `alias_3` ON (`table_1`.`column_1` = `alias_3`.`alias_2`)
----
NULL

query  rowsort
WITH `alias_3` AS (SELECT `table_1`.`column_1` AS `alias_2` FROM `table_1`) SELECT avg(`table_1`.`column_3`) AS `alias_1` FROM `table_1` INNER JOIN `alias_3` ON (`table_1`.`column_1` = `alias_3`.`alias_2`)
----
-94939485.6000

query  rowsort
WITH `alias_3` AS (SELECT avg(`table_1`.`column_5`) AS `alias_2` FROM `table_1`) SELECT avg(`table_1`.`column_4`) AS `alias_1` FROM `table_1` INNER JOIN `alias_3` ON (`table_1`.`column_1` = `alias_3`.`alias_2`)
----
NULL

query  rowsort
WITH `alias_2` AS (SELECT avg(`table_1`.`column_6`) AS `alias_1` FROM `table_1`) SELECT `table_1`.`column_1` AS `alias_3` FROM `table_1` INNER JOIN `alias_2` ON (`table_1`.`column_1` = `alias_2`.`alias_1`) WHERE (`table_1`.`column_1` > ?)
? = 10
----


query  rowsort
WITH `alias_2` AS (SELECT `table_1`.`column_1` AS `alias_1` FROM `table_1`) SELECT `table_1`.`column_1` AS `alias_3` FROM `table_1` INNER JOIN `alias_2` ON (`table_1`.`column_1` = `alias_2`.`alias_1`) WHERE (`table_1`.`column_1` > ?)
? = 10
----
24392112
290883632
318480148
398020342
80378114

query  rowsort
WITH `alias_2` AS (SELECT avg(`table_1`.`column_7`) AS `alias_1` FROM `table_1`) SELECT `table_1`.`column_1` AS `alias_3` FROM `table_1` INNER JOIN `alias_2` ON (`table_1`.`column_1` = `alias_2`.`alias_1`) WHERE (`table_1`.`column_1` > ?)
? = 10
----


query  rowsort
WITH `alias_3` AS (SELECT avg(`table_1`.`column_9`) AS `alias_2` FROM `table_1`) SELECT avg(`table_1`.`column_8`) AS `alias_1` FROM `table_1` INNER JOIN `alias_3` ON (`table_1`.`column_1` = `alias_3`.`alias_2`) WHERE (`table_1`.`column_1` > ?)
? = 10
----
NULL

query  rowsort
WITH `alias_3` AS (SELECT `table_1`.`column_1` AS `alias_2` FROM `table_1`) SELECT avg(`table_1`.`column_10`) AS `alias_1` FROM `table_1` INNER JOIN `alias_3` ON (`table_1`.`column_1` = `alias_3`.`alias_2`) WHERE (`table_1`.`column_1` > ?)
? = 10
----
-22389113.6000

query  rowsort
WITH `alias_3` AS (SELECT avg(`table_1`.`column_12`) AS `alias_2` FROM `table_1`) SELECT avg(`table_1`.`column_11`) AS `alias_1` FROM `table_1` INNER JOIN `alias_3` ON (`table_1`.`column_1` = `alias_3`.`alias_2`) WHERE (`table_1`.`column_1` > ?)
? = 10
----
NULL

statement ok
DELETE FROM `table_1` WHERE (`column_13` = 0)


statement ok
DELETE FROM `table_1` WHERE (`column_13` = 1)


statement ok
DELETE FROM `table_1` WHERE (`column_13` = 2)


statement ok
DELETE FROM `table_1` WHERE (`column_13` = 3)


statement ok
DELETE FROM `table_1` WHERE (`column_13` = 4)


query  rowsort
WITH `alias_3` AS (SELECT avg(`table_1`.`column_2`) AS `alias_2` FROM `table_1`) SELECT avg(`table_1`.`column_1`) AS `alias_1` FROM `table_1` INNER JOIN `alias_3` ON (`table_1`.`column_1` = `alias_3`.`alias_2`)
----
NULL

query  rowsort
WITH `alias_3` AS (SELECT `table_1`.`column_1` AS `alias_2` FROM `table_1`) SELECT avg(`table_1`.`column_3`) AS `alias_1` FROM `table_1` INNER JOIN `alias_3` ON (`table_1`.`column_1` = `alias_3`.`alias_2`)
----
-62492283.6000

query  rowsort
WITH `alias_3` AS (SELECT avg(`table_1`.`column_5`) AS `alias_2` FROM `table_1`) SELECT avg(`table_1`.`column_4`) AS `alias_1` FROM `table_1` INNER JOIN `alias_3` ON (`table_1`.`column_1` = `alias_3`.`alias_2`)
----
NULL

query  rowsort
WITH `alias_2` AS (SELECT avg(`table_1`.`column_6`) AS `alias_1` FROM `table_1`) SELECT `table_1`.`column_1` AS `alias_3` FROM `table_1` INNER JOIN `alias_2` ON (`table_1`.`column_1` = `alias_2`.`alias_1`) WHERE (`table_1`.`column_1` > ?)
? = 10
----


query  rowsort
WITH `alias_2` AS (SELECT `table_1`.`column_1` AS `alias_1` FROM `table_1`) SELECT `table_1`.`column_1` AS `alias_3` FROM `table_1` INNER JOIN `alias_2` ON (`table_1`.`column_1` = `alias_2`.`alias_1`) WHERE (`table_1`.`column_1` > ?)
? = 10
----
24392112
398020342

query  rowsort
WITH `alias_2` AS (SELECT avg(`table_1`.`column_7`) AS `alias_1` FROM `table_1`) SELECT `table_1`.`column_1` AS `alias_3` FROM `table_1` INNER JOIN `alias_2` ON (`table_1`.`column_1` = `alias_2`.`alias_1`) WHERE (`table_1`.`column_1` > ?)
? = 10
----


query  rowsort
WITH `alias_3` AS (SELECT avg(`table_1`.`column_9`) AS `alias_2` FROM `table_1`) SELECT avg(`table_1`.`column_8`) AS `alias_1` FROM `table_1` INNER JOIN `alias_3` ON (`table_1`.`column_1` = `alias_3`.`alias_2`) WHERE (`table_1`.`column_1` > ?)
? = 10
----
NULL

query  rowsort
WITH `alias_3` AS (SELECT `table_1`.`column_1` AS `alias_2` FROM `table_1`) SELECT avg(`table_1`.`column_10`) AS `alias_1` FROM `table_1` INNER JOIN `alias_3` ON (`table_1`.`column_1` = `alias_3`.`alias_2`) WHERE (`table_1`.`column_1` > ?)
? = 10
----
456540703.5000

query  rowsort
WITH `alias_3` AS (SELECT avg(`table_1`.`column_12`) AS `alias_2` FROM `table_1`) SELECT avg(`table_1`.`column_11`) AS `alias_1` FROM `table_1` INNER JOIN `alias_3` ON (`table_1`.`column_1` = `alias_3`.`alias_2`) WHERE (`table_1`.`column_1` > ?)
? = 10
----
NULL
