# Generated by:
#     target/debug/noria-logictest permute --compare-to mysql://root:noria@127.1/noria -d 3 -o logictests/generated/mysql/ --only range_param --random --include-deletes --rows-per-table 10 --subquery-depth 1

statement ok
CREATE TABLE `table_1` (`column_2` INT, `column_3` INT, `column_1` INT, `column_6` INT, `column_4` INT, `column_5` INT, PRIMARY KEY (`column_6`))


statement ok
INSERT INTO `table_1` (`column_2`, `column_3`, `column_1`, `column_6`, `column_4`, `column_5`) VALUES (1795478107, 1956403196, -172425025, 0, 1146113459, 56193814), (1686607388, -79788311, 414840755, 1, -582450742, 2052942336), (180622514, 606956945, -938973436, 2, -1091151876, -252970689), (-1414812950, -1299590246, -1567138869, 3, 1022671104, 1159682401), (-2098770547, -932733253, -1989400920, 4, 1408281148, 373294089), (1046222635, -2100422698, 1112325198, 5, -273173445, 121811314), (983822605, 2110081815, -1795622783, 6, 1857578547, 1771210956), (2073313283, -1314376211, -201217894, 7, -625292986, 757516930), (-981903762, -1474225051, -1438219012, 8, -476640644, -1734455078), (-730694322, -451049975, 319860730, 9, -192429286, -1153105942)


query  rowsort
SELECT DISTINCT `table_1`.`column_1` AS `alias_1` FROM `table_1`
----
-1438219012
-1567138869
-172425025
-1795622783
-1989400920
-201217894
-938973436
1112325198
319860730
414840755

query  rowsort
SELECT sum(distinct `table_1`.`column_2`) AS `alias_1` FROM `table_1`
----
2539884951

query  rowsort
SELECT `table_1`.`column_1` AS `alias_1` FROM `table_1` WHERE (`table_1`.`column_1` > ?)
? = 10
----
1112325198
319860730
414840755

query  rowsort
SELECT DISTINCT sum(distinct `table_1`.`column_3`) AS `alias_1` FROM `table_1`
----
-2978743789

query  rowsort
SELECT DISTINCT `table_1`.`column_1` AS `alias_1` FROM `table_1` WHERE (`table_1`.`column_1` > ?)
? = 10
----
1112325198
319860730
414840755

query  rowsort
SELECT sum(distinct `table_1`.`column_4`) AS `alias_1` FROM `table_1` WHERE (`table_1`.`column_2` > ?)
? = 10
----
431622957

query  rowsort
SELECT DISTINCT sum(distinct `table_1`.`column_5`) AS `alias_1` FROM `table_1` WHERE (`table_1`.`column_2` > ?)
? = 10
----
4506704661

statement ok
DELETE FROM `table_1` WHERE (`column_6` = 0)


statement ok
DELETE FROM `table_1` WHERE (`column_6` = 1)


statement ok
DELETE FROM `table_1` WHERE (`column_6` = 2)


statement ok
DELETE FROM `table_1` WHERE (`column_6` = 3)


statement ok
DELETE FROM `table_1` WHERE (`column_6` = 4)


query  rowsort
SELECT DISTINCT `table_1`.`column_1` AS `alias_1` FROM `table_1`
----
-1438219012
-1795622783
-201217894
1112325198
319860730

query  rowsort
SELECT sum(distinct `table_1`.`column_2`) AS `alias_1` FROM `table_1`
----
2390760439

query  rowsort
SELECT `table_1`.`column_1` AS `alias_1` FROM `table_1` WHERE (`table_1`.`column_1` > ?)
? = 10
----
1112325198
319860730

query  rowsort
SELECT DISTINCT sum(distinct `table_1`.`column_3`) AS `alias_1` FROM `table_1`
----
-3229992120

query  rowsort
SELECT DISTINCT `table_1`.`column_1` AS `alias_1` FROM `table_1` WHERE (`table_1`.`column_1` > ?)
? = 10
----
1112325198
319860730

query  rowsort
SELECT sum(distinct `table_1`.`column_4`) AS `alias_1` FROM `table_1` WHERE (`table_1`.`column_2` > ?)
? = 10
----
959112116

query  rowsort
SELECT DISTINCT sum(distinct `table_1`.`column_5`) AS `alias_1` FROM `table_1` WHERE (`table_1`.`column_2` > ?)
? = 10
----
2650539200
