# Generated by:
#     target/debug/noria-logictest permute -d 3 -o logictests/generated/mysql --only in_parameter --compare-to mysql://root:noria@localhost/mysql --subquery-depth 1 --rows-per-table 5 --include-deletes --overwrite-tests

statement ok
CREATE TABLE table_1 (column_8 TEXT, column_3 TEXT, column_6 TEXT, column_2 TEXT, column_9 INT, column_7 TEXT, column_1 TEXT, column_5 TEXT, column_4 TEXT, PRIMARY KEY (column_9))


statement ok
INSERT INTO table_1 (column_8, column_3, column_6, column_2, column_9, column_7, column_1, column_5, column_4) VALUES ('1', '0', 'a', 'a', 0, '1', '2', 'a', 'a'), ('a', 'a', 'a', 'a', 1, 'a', 'a', 'a', 'a'), ('0', '2', 'a', 'a', 2, '2', '0', 'a', 'a'), ('a', 'a', 'a', 'a', 3, 'a', 'a', 'a', 'a'), ('2', '1', 'a', 'a', 4, '0', '1', 'a', 'a')


query  rowsort
SELECT group_concat(table_1.column_1 separator ', ') AS alias_1 FROM table_1
----
2, a, 0, a, 1

query  nosort
SELECT table_1.column_1 AS alias_1 FROM table_1 ORDER BY table_1.column_1 ASC LIMIT 10
----
0
1
2
a
a

query  nosort
SELECT table_1.column_1 AS alias_1 FROM table_1 ORDER BY table_1.column_1 DESC LIMIT 10
----
a
a
2
1
0

query  rowsort
SELECT table_1.column_1 AS alias_1 FROM table_1 WHERE table_1.column_1 IN (?, ?, ?)
? = 0
? = 1
? = 2
----
0
1
2

query  nosort
SELECT group_concat(table_1.column_2 separator ', ') AS alias_1 FROM table_1 GROUP BY table_1.column_2 ORDER BY table_1.column_2 ASC LIMIT 10
----
a, a, a, a, a

query  nosort
SELECT group_concat(table_1.column_3 separator ', ') AS alias_1 FROM table_1 GROUP BY table_1.column_2 ORDER BY table_1.column_2 DESC LIMIT 10
----
0, a, 2, a, 1

query  rowsort
SELECT group_concat(table_1.column_4 separator ', ') AS alias_1 FROM table_1 WHERE table_1.column_3 IN (?, ?, ?)
? = 0
? = 1
? = 2
----
a, a, a

query  nosort
SELECT table_1.column_3 AS alias_1 FROM table_1 ORDER BY table_1.column_3 DESC LIMIT 10
----
a
a
2
1
0

query  nosort
SELECT table_1.column_3 AS alias_1 FROM table_1 WHERE table_1.column_3 IN (?, ?, ?) ORDER BY table_1.column_3 ASC LIMIT 10
? = 0
? = 1
? = 2
----
0
1
2

query  nosort
SELECT table_1.column_3 AS alias_1 FROM table_1 WHERE table_1.column_3 IN (?, ?, ?) ORDER BY table_1.column_3 DESC LIMIT 10
? = 0
? = 1
? = 2
----
2
1
0

query  nosort
SELECT group_concat(table_1.column_5 separator ', ') AS alias_1 FROM table_1 GROUP BY table_1.column_3 ORDER BY table_1.column_3 DESC LIMIT 10
----
a, a
a
a
a

query  nosort
SELECT group_concat(table_1.column_6 separator ', ') AS alias_1 FROM table_1 WHERE table_1.column_3 IN (?, ?, ?) GROUP BY table_1.column_3 ORDER BY table_1.column_3 ASC LIMIT 10
? = 0
? = 1
? = 2
----
a
a
a

query  nosort
SELECT group_concat(table_1.column_7 separator ', ') AS alias_1 FROM table_1 WHERE table_1.column_7 IN (?, ?, ?) GROUP BY table_1.column_7 ORDER BY table_1.column_7 DESC LIMIT 10
? = 0
? = 1
? = 2
----
2
1
0

query  nosort
SELECT table_1.column_7 AS alias_1 FROM table_1 WHERE table_1.column_7 IN (?, ?, ?) ORDER BY table_1.column_7 DESC LIMIT 10
? = 0
? = 1
? = 2
----
2
1
0

query  nosort
SELECT group_concat(table_1.column_8 separator ', ') AS alias_1 FROM table_1 WHERE table_1.column_8 IN (?, ?, ?) GROUP BY table_1.column_8 ORDER BY table_1.column_8 DESC LIMIT 10
? = 0
? = 1
? = 2
----
2
1
0

statement ok
DELETE FROM table_1 WHERE (column_9 = 0)


statement ok
DELETE FROM table_1 WHERE (column_9 = 1)


query  rowsort
SELECT group_concat(table_1.column_1 separator ', ') AS alias_1 FROM table_1
----
0, a, 1

query  nosort
SELECT table_1.column_1 AS alias_1 FROM table_1 ORDER BY table_1.column_1 ASC LIMIT 10
----
0
1
a

query  nosort
SELECT table_1.column_1 AS alias_1 FROM table_1 ORDER BY table_1.column_1 DESC LIMIT 10
----
a
1
0

query  rowsort
SELECT table_1.column_1 AS alias_1 FROM table_1 WHERE table_1.column_1 IN (?, ?, ?)
? = 0
? = 1
? = 2
----
0
1

query  nosort
SELECT group_concat(table_1.column_2 separator ', ') AS alias_1 FROM table_1 GROUP BY table_1.column_2 ORDER BY table_1.column_2 ASC LIMIT 10
----
a, a, a

query  nosort
SELECT group_concat(table_1.column_3 separator ', ') AS alias_1 FROM table_1 GROUP BY table_1.column_2 ORDER BY table_1.column_2 DESC LIMIT 10
----
2, a, 1

query  rowsort
SELECT group_concat(table_1.column_4 separator ', ') AS alias_1 FROM table_1 WHERE table_1.column_3 IN (?, ?, ?)
? = 0
? = 1
? = 2
----
a, a

query  nosort
SELECT table_1.column_3 AS alias_1 FROM table_1 ORDER BY table_1.column_3 DESC LIMIT 10
----
a
2
1

query  nosort
SELECT table_1.column_3 AS alias_1 FROM table_1 WHERE table_1.column_3 IN (?, ?, ?) ORDER BY table_1.column_3 ASC LIMIT 10
? = 0
? = 1
? = 2
----
1
2

query  nosort
SELECT table_1.column_3 AS alias_1 FROM table_1 WHERE table_1.column_3 IN (?, ?, ?) ORDER BY table_1.column_3 DESC LIMIT 10
? = 0
? = 1
? = 2
----
2
1

query  nosort
SELECT group_concat(table_1.column_5 separator ', ') AS alias_1 FROM table_1 GROUP BY table_1.column_3 ORDER BY table_1.column_3 DESC LIMIT 10
----
a
a
a

query  nosort
SELECT group_concat(table_1.column_6 separator ', ') AS alias_1 FROM table_1 WHERE table_1.column_3 IN (?, ?, ?) GROUP BY table_1.column_3 ORDER BY table_1.column_3 ASC LIMIT 10
? = 0
? = 1
? = 2
----
a
a

query  nosort
SELECT group_concat(table_1.column_7 separator ', ') AS alias_1 FROM table_1 WHERE table_1.column_7 IN (?, ?, ?) GROUP BY table_1.column_7 ORDER BY table_1.column_7 DESC LIMIT 10
? = 0
? = 1
? = 2
----
2
0

query  nosort
SELECT table_1.column_7 AS alias_1 FROM table_1 WHERE table_1.column_7 IN (?, ?, ?) ORDER BY table_1.column_7 DESC LIMIT 10
? = 0
? = 1
? = 2
----
2
0

query  nosort
SELECT group_concat(table_1.column_8 separator ', ') AS alias_1 FROM table_1 WHERE table_1.column_8 IN (?, ?, ?) GROUP BY table_1.column_8 ORDER BY table_1.column_8 DESC LIMIT 10
? = 0
? = 1
? = 2
----
2
0
