# Generated by:
#     target/debug/noria-logictest permute --compare-to mysql://root:noria@127.1/noria -d 3 -o logictests/generated/mysql/ --only range_param --random --include-deletes --rows-per-table 10 --subquery-depth 1

statement ok
CREATE TABLE `table_1` (`column_3` INT, `column_2` INT, `column_4` INT, `column_5` INT, `column_6` INT, `column_1` INT, PRIMARY KEY (`column_6`))


statement ok
INSERT INTO `table_1` (`column_3`, `column_2`, `column_4`, `column_5`, `column_6`, `column_1`) VALUES (2, 2, -817125947, 641475888, 0, 0), (-2140932979, 442384600, -1160721842, 1257376350, 1, 1837824218), (0, 1, 129678588, 1816451522, 2, 1), (-198327257, 1507387246, 551100553, -1206736638, 3, 909001301), (1, 0, -833701706, 606267852, 4, 2), (-2059450628, 590207673, 2104464253, 1316246308, 5, 1087833105), (2, 2, 897573501, -1765455235, 6, 0), (655248850, -1313603564, -1400409294, 19478437, 7, 1488803981), (0, 1, 308487390, 272199935, 8, 1), (2136112405, -594607079, 1711699380, -441888015, 9, -1325151540)


query  rowsort
SELECT `table_1`.`column_1` AS `alias_1` FROM `table_1` WHERE `table_1`.`column_1` IN (?, ?, ?)
? = 0
? = 1
? = 2
----
0
0
1
1
2

query  rowsort
SELECT sum(`table_1`.`column_2`) AS `alias_1` FROM `table_1`
----
631768882

query  rowsort
SELECT `table_1`.`column_2` AS `alias_1` FROM `table_1` WHERE (`table_1`.`column_2` > ?)
? = 10
----
1507387246
442384600
590207673

query  rowsort
SELECT sum(`table_1`.`column_3`) AS `alias_1` FROM `table_1` WHERE `table_1`.`column_2` IN (?, ?, ?)
? = 0
? = 1
? = 2
----
5

query  rowsort
SELECT `table_1`.`column_2` AS `alias_1` FROM `table_1` WHERE (`table_1`.`column_2` IN (?, ?, ?) AND (`table_1`.`column_2` > ?))
? = 0
? = 1
? = 2
? = 10
----


query  rowsort
SELECT sum(`table_1`.`column_4`) AS `alias_1` FROM `table_1` WHERE (`table_1`.`column_3` > ?)
? = 10
----
311290086

query  rowsort
SELECT sum(`table_1`.`column_5`) AS `alias_1` FROM `table_1` WHERE (`table_1`.`column_3` IN (?, ?, ?) AND (`table_1`.`column_3` > ?))
? = 0
? = 1
? = 2
? = 10
----
NULL

statement ok
DELETE FROM `table_1` WHERE (`column_6` = 0)


statement ok
DELETE FROM `table_1` WHERE (`column_6` = 1)


statement ok
DELETE FROM `table_1` WHERE (`column_6` = 2)


statement ok
DELETE FROM `table_1` WHERE (`column_6` = 3)


statement ok
DELETE FROM `table_1` WHERE (`column_6` = 4)


query  rowsort
SELECT `table_1`.`column_1` AS `alias_1` FROM `table_1` WHERE `table_1`.`column_1` IN (?, ?, ?)
? = 0
? = 1
? = 2
----
0
1

query  rowsort
SELECT sum(`table_1`.`column_2`) AS `alias_1` FROM `table_1`
----
-1318002967

query  rowsort
SELECT `table_1`.`column_2` AS `alias_1` FROM `table_1` WHERE (`table_1`.`column_2` > ?)
? = 10
----
590207673

query  rowsort
SELECT sum(`table_1`.`column_3`) AS `alias_1` FROM `table_1` WHERE `table_1`.`column_2` IN (?, ?, ?)
? = 0
? = 1
? = 2
----
2

query  rowsort
SELECT `table_1`.`column_2` AS `alias_1` FROM `table_1` WHERE (`table_1`.`column_2` IN (?, ?, ?) AND (`table_1`.`column_2` > ?))
? = 0
? = 1
? = 2
? = 10
----


query  rowsort
SELECT sum(`table_1`.`column_4`) AS `alias_1` FROM `table_1` WHERE (`table_1`.`column_3` > ?)
? = 10
----
311290086

query  rowsort
SELECT sum(`table_1`.`column_5`) AS `alias_1` FROM `table_1` WHERE (`table_1`.`column_3` IN (?, ?, ?) AND (`table_1`.`column_3` > ?))
? = 0
? = 1
? = 2
? = 10
----
NULL
