# Generated by:
#     target/debug/noria-logictest permute --compare-to mysql://root:noria@127.1/noria -d 3 -o logictests/generated/mysql/ --only range_param --random --include-deletes --rows-per-table 10 --subquery-depth 1

statement ok
CREATE TABLE `table_1` (`column_5` INT, `column_2` INT, `column_1` INT, `column_4` INT, `column_3` INT, `column_6` INT, PRIMARY KEY (`column_6`))


statement ok
INSERT INTO `table_1` (`column_5`, `column_2`, `column_1`, `column_4`, `column_3`, `column_6`) VALUES (1561056659, 2, 0, -1461619233, 1391235243, 0), (1858056625, -1838784475, 936761067, -335472131, 426691403, 1), (290911180, 1, 1, -1415859659, 2111385016, 2), (447509765, -854186931, 643618552, -633462193, 1515823602, 3), (1273634359, 0, 2, -1099101910, -666977816, 4), (-195874124, -672701868, 2016792043, -1478172297, 913520045, 5), (1681303200, 2, 0, -1824794547, 179440346, 6), (-1904528362, 1051161119, -895686857, -1913272327, -1451130012, 7), (726603031, 1, 1, -1524243574, 1350080516, 8), (-576878772, 1866729231, -1056057459, -655742999, -392882420, 9)


query  rowsort
SELECT `table_1`.`column_1` AS `alias_1` FROM `table_1` WHERE `table_1`.`column_1` IN (?, ?, ?)
? = 0
? = 1
? = 2
----
0
0
1
1
2

query  rowsort
SELECT count(distinct `table_1`.`column_2`) AS `alias_1` FROM `table_1`
----
8

query  rowsort
SELECT `table_1`.`column_1` AS `alias_1` FROM `table_1` WHERE (`table_1`.`column_1` > ?)
? = 10
----
2016792043
643618552
936761067

query  rowsort
SELECT count(distinct `table_1`.`column_3`) AS `alias_1` FROM `table_1` WHERE `table_1`.`column_1` IN (?, ?, ?)
? = 0
? = 1
? = 2
----
5

query  rowsort
SELECT `table_1`.`column_1` AS `alias_1` FROM `table_1` WHERE (`table_1`.`column_1` IN (?, ?, ?) AND (`table_1`.`column_1` > ?))
? = 0
? = 1
? = 2
? = 10
----


query  rowsort
SELECT count(distinct `table_1`.`column_4`) AS `alias_1` FROM `table_1` WHERE (`table_1`.`column_2` > ?)
? = 10
----
2

query  rowsort
SELECT count(distinct `table_1`.`column_5`) AS `alias_1` FROM `table_1` WHERE (`table_1`.`column_2` IN (?, ?, ?) AND (`table_1`.`column_5` > ?))
? = 0
? = 1
? = 2
? = 10
----
5

statement ok
DELETE FROM `table_1` WHERE (`column_6` = 0)


statement ok
DELETE FROM `table_1` WHERE (`column_6` = 1)


statement ok
DELETE FROM `table_1` WHERE (`column_6` = 2)


statement ok
DELETE FROM `table_1` WHERE (`column_6` = 3)


statement ok
DELETE FROM `table_1` WHERE (`column_6` = 4)


query  rowsort
SELECT `table_1`.`column_1` AS `alias_1` FROM `table_1` WHERE `table_1`.`column_1` IN (?, ?, ?)
? = 0
? = 1
? = 2
----
0
1

query  rowsort
SELECT count(distinct `table_1`.`column_2`) AS `alias_1` FROM `table_1`
----
5

query  rowsort
SELECT `table_1`.`column_1` AS `alias_1` FROM `table_1` WHERE (`table_1`.`column_1` > ?)
? = 10
----
2016792043

query  rowsort
SELECT count(distinct `table_1`.`column_3`) AS `alias_1` FROM `table_1` WHERE `table_1`.`column_1` IN (?, ?, ?)
? = 0
? = 1
? = 2
----
2

query  rowsort
SELECT `table_1`.`column_1` AS `alias_1` FROM `table_1` WHERE (`table_1`.`column_1` IN (?, ?, ?) AND (`table_1`.`column_1` > ?))
? = 0
? = 1
? = 2
? = 10
----


query  rowsort
SELECT count(distinct `table_1`.`column_4`) AS `alias_1` FROM `table_1` WHERE (`table_1`.`column_2` > ?)
? = 10
----
2

query  rowsort
SELECT count(distinct `table_1`.`column_5`) AS `alias_1` FROM `table_1` WHERE (`table_1`.`column_2` IN (?, ?, ?) AND (`table_1`.`column_5` > ?))
? = 0
? = 1
? = 2
? = 10
----
2
