# Generated by:
#     target/debug/noria-logictest permute --compare-to mysql://root:noria@127.1/noria -d 3 -o logictests/generated/mysql/ --only range_param --random --include-deletes --rows-per-table 10 --subquery-depth 1

statement ok
CREATE TABLE `table_1` (`column_2` INT, `column_1` INT, `column_3` INT, `column_4` INT, `column_5` INT, `column_6` INT, PRIMARY KEY (`column_6`))


statement ok
CREATE TABLE `table_2` (`column_2` INT, `column_3` INT, `column_1` INT, PRIMARY KEY (`column_3`))


statement ok
CREATE TABLE `table_5` (`column_1` INT, `column_2` INT, `column_3` INT, PRIMARY KEY (`column_3`))


statement ok
CREATE TABLE `table_3` (`column_1` INT, `column_2` INT, `column_3` INT, PRIMARY KEY (`column_3`))


statement ok
CREATE TABLE `table_4` (`column_1` INT, `column_2` INT, `column_3` INT, PRIMARY KEY (`column_3`))


statement ok
INSERT INTO `table_1` (`column_2`, `column_1`, `column_3`, `column_4`, `column_5`, `column_6`) VALUES (1310556054, 1922927249, 1843510216, 1206591687, 6443826, 0), (-1197725669, 482526884, -264949319, 1359987390, -920924881, 1), (1299321964, 1083032741, 1965220217, -88152495, 2071119595, 2), (1796550303, -763078022, 1020762068, -316301873, -387915847, 3), (-1320392056, -881755292, -1524664415, -1391305693, -1621258408, 4), (-1212501599, -1537887518, -1655310720, -1791440232, -1184835566, 5), (912372870, 1615475672, -571278585, -1334691232, -512498064, 6), (1867513751, -517615591, 94755534, -1388493052, -1218344263, 7), (432297895, 698733854, -1668346164, 2130640643, -1135282402, 8), (-1925576567, 1726155615, -2044572471, 583028483, -1007587280, 9)


statement ok
INSERT INTO `table_2` (`column_2`, `column_3`, `column_1`) VALUES (-1425675854, 0, -1414821334), (1421223522, 1, -915905199), (-78648522, 2, -1719688326), (1338413402, 3, 593977724), (-1758624028, 4, 1078738498), (804940538, 5, -554387408), (1038273262, 6, -438195261), (-1531455343, 7, 236907999), (-1553549461, 8, -1297882583), (-630569336, 9, -1031613048)


statement ok
INSERT INTO `table_5` (`column_1`, `column_2`, `column_3`) VALUES (424022651, -1356221127, 0), (2061106793, -1398757102, 1), (-818972649, 1334893328, 2), (154903108, 1069491388, 3), (-1724114589, -270155215, 4), (-865381063, -1096405361, 5), (272731849, 45599845, 6), (2116296497, 1103709047, 7), (-2122883014, 1260489431, 8), (287738556, 1845678250, 9)


statement ok
INSERT INTO `table_3` (`column_1`, `column_2`, `column_3`) VALUES (860555684, -1604802147, 0), (-125825038, -379853609, 1), (-1604613114, -1873192261, 2), (509166627, -1648821565, 3), (-866822187, 246348671, 4), (-38769099, -821156483, 5), (-1443292388, 465064818, 6), (-1009873295, 1831020771, 7), (-352621785, -1504864548, 8), (1960220104, -681175095, 9)


statement ok
INSERT INTO `table_4` (`column_1`, `column_2`, `column_3`) VALUES (1592988803, 55437957, 0), (-578219017, 1025938599, 1), (-1957984628, 967714318, 2), (414093376, 205236746, 3), (395987709, -1689161337, 4), (891886960, -548916312, 5), (1482639190, -587782518, 6), (761707643, 776779257, 7), (1626694604, -474843531, 8), (766810598, 628300542, 9)


query  rowsort
SELECT `table_1`.`column_2` AS `alias_1`, `table_2`.`column_2` AS `alias_2` FROM `table_1` INNER JOIN `table_2` ON (`table_1`.`column_1` = `table_2`.`column_1`)
----


query  rowsort
SELECT 1 AS `alias_1`
----
1

query  rowsort
SELECT `table_1`.`column_2` AS `alias_1` FROM `table_1` WHERE (`table_1`.`column_2` > ?)
? = 10
----
1299321964
1310556054
1796550303
1867513751
432297895
912372870

query  rowsort
SELECT `table_1`.`column_3` AS `alias_1`, `table_3`.`column_2` AS `alias_2`, 1 AS `alias_3` FROM `table_1` INNER JOIN `table_3` ON (`table_1`.`column_2` = `table_3`.`column_1`)
----


query  rowsort
SELECT `table_1`.`column_4` AS `alias_1`, `table_4`.`column_2` AS `alias_2` FROM `table_1` INNER JOIN `table_4` ON (`table_1`.`column_2` = `table_4`.`column_1`) WHERE (`table_1`.`column_2` > ?)
? = 10
----


query  rowsort
SELECT 1 AS `alias_1` FROM `table_1` WHERE (`table_1`.`column_2` > ?)
? = 10
----
1
1
1
1
1
1

query  rowsort
SELECT `table_1`.`column_5` AS `alias_1`, `table_5`.`column_2` AS `alias_2`, 1 AS `alias_3` FROM `table_1` INNER JOIN `table_5` ON (`table_1`.`column_2` = `table_5`.`column_1`) WHERE (`table_1`.`column_2` > ?)
? = 10
----


statement ok
DELETE FROM `table_1` WHERE (`column_6` = 0)


statement ok
DELETE FROM `table_1` WHERE (`column_6` = 1)


statement ok
DELETE FROM `table_1` WHERE (`column_6` = 2)


statement ok
DELETE FROM `table_1` WHERE (`column_6` = 3)


statement ok
DELETE FROM `table_1` WHERE (`column_6` = 4)


statement ok
DELETE FROM `table_2` WHERE (`column_3` = 0)


statement ok
DELETE FROM `table_2` WHERE (`column_3` = 1)


statement ok
DELETE FROM `table_2` WHERE (`column_3` = 2)


statement ok
DELETE FROM `table_2` WHERE (`column_3` = 3)


statement ok
DELETE FROM `table_2` WHERE (`column_3` = 4)


statement ok
DELETE FROM `table_5` WHERE (`column_3` = 0)


statement ok
DELETE FROM `table_5` WHERE (`column_3` = 1)


statement ok
DELETE FROM `table_5` WHERE (`column_3` = 2)


statement ok
DELETE FROM `table_5` WHERE (`column_3` = 3)


statement ok
DELETE FROM `table_5` WHERE (`column_3` = 4)


statement ok
DELETE FROM `table_3` WHERE (`column_3` = 0)


statement ok
DELETE FROM `table_3` WHERE (`column_3` = 1)


statement ok
DELETE FROM `table_3` WHERE (`column_3` = 2)


statement ok
DELETE FROM `table_3` WHERE (`column_3` = 3)


statement ok
DELETE FROM `table_3` WHERE (`column_3` = 4)


statement ok
DELETE FROM `table_4` WHERE (`column_3` = 0)


statement ok
DELETE FROM `table_4` WHERE (`column_3` = 1)


statement ok
DELETE FROM `table_4` WHERE (`column_3` = 2)


statement ok
DELETE FROM `table_4` WHERE (`column_3` = 3)


statement ok
DELETE FROM `table_4` WHERE (`column_3` = 4)


query  rowsort
SELECT `table_1`.`column_2` AS `alias_1`, `table_2`.`column_2` AS `alias_2` FROM `table_1` INNER JOIN `table_2` ON (`table_1`.`column_1` = `table_2`.`column_1`)
----


query  rowsort
SELECT 1 AS `alias_1`
----
1

query  rowsort
SELECT `table_1`.`column_2` AS `alias_1` FROM `table_1` WHERE (`table_1`.`column_2` > ?)
? = 10
----
1867513751
432297895
912372870

query  rowsort
SELECT `table_1`.`column_3` AS `alias_1`, `table_3`.`column_2` AS `alias_2`, 1 AS `alias_3` FROM `table_1` INNER JOIN `table_3` ON (`table_1`.`column_2` = `table_3`.`column_1`)
----


query  rowsort
SELECT `table_1`.`column_4` AS `alias_1`, `table_4`.`column_2` AS `alias_2` FROM `table_1` INNER JOIN `table_4` ON (`table_1`.`column_2` = `table_4`.`column_1`) WHERE (`table_1`.`column_2` > ?)
? = 10
----


query  rowsort
SELECT 1 AS `alias_1` FROM `table_1` WHERE (`table_1`.`column_2` > ?)
? = 10
----
1
1
1

query  rowsort
SELECT `table_1`.`column_5` AS `alias_1`, `table_5`.`column_2` AS `alias_2`, 1 AS `alias_3` FROM `table_1` INNER JOIN `table_5` ON (`table_1`.`column_2` = `table_5`.`column_1`) WHERE (`table_1`.`column_2` > ?)
? = 10
----

