# Generated by:
#     target/debug/noria-logictest permute --compare-to mysql://root:noria@127.1/noria -d 3 -o logictests/generated/mysql/ --only range_param --random --include-deletes --rows-per-table 10 --subquery-depth 1

statement ok
CREATE TABLE `table_3` (`column_4` INT, `column_1` INT, `column_3` INT, `column_2` INT, PRIMARY KEY (`column_4`))


statement ok
CREATE TABLE `table_4` (`column_1` INT, `column_3` INT, `column_2` INT, PRIMARY KEY (`column_3`))


statement ok
CREATE TABLE `table_2` (`column_2` INT, `column_3` INT, `column_5` INT, `column_1` INT, `column_4` INT, PRIMARY KEY (`column_5`))


statement ok
CREATE TABLE `table_5` (`column_2` INT, `column_1` INT, `column_3` INT, PRIMARY KEY (`column_3`))


statement ok
CREATE TABLE `table_1` (`column_2` INT, `column_1` INT, `column_3` INT, PRIMARY KEY (`column_3`))


statement ok
INSERT INTO `table_3` (`column_4`, `column_1`, `column_3`, `column_2`) VALUES (0, 182280076, -1069263343, -757214275), (1, 1729657601, 275506980, 2107545283), (2, 1053579588, 1095279752, 2001590169), (3, -1438020561, 275802521, 349349242), (4, -2089265221, 1990372454, 556980790), (5, -185707520, -1362331887, -2137355589), (6, 1301332644, -902949908, 395281581), (7, 1716660326, -713008436, 817782839), (8, 1266490087, -1509968129, -1527468167), (9, -1815607698, 771502086, -1647697071)


statement ok
INSERT INTO `table_4` (`column_1`, `column_3`, `column_2`) VALUES (-608719114, 0, -190500901), (-616288358, 1, 391404694), (342255464, 2, 1954905919), (-1692246327, 3, 1139797352), (1144898961, 4, -394648119), (851811869, 5, -1031104779), (-636374734, 6, -502703913), (1925237346, 7, 528978252), (-1894659152, 8, -1713692003), (1913285446, 9, -1917811391)


statement ok
INSERT INTO `table_2` (`column_2`, `column_3`, `column_5`, `column_1`, `column_4`) VALUES (-809976264, 1377804769, 0, -365796277, -445060258), (-1323607556, 245443125, 1, 193355774, -1151601176), (-1536492190, -327930914, 2, -67467617, 1962504975), (-968623690, -1818119788, 3, 1952457462, 199115999), (-1361596684, 1026193939, 4, -1693565427, -1876819664), (-1933295504, -250833584, 5, -1504301087, -1200584797), (1619825485, -2013989608, 6, 6202616, 255369272), (44358536, -517031459, 7, 1453114643, -1392265153), (1794263914, -1705948731, 8, 359654891, -916477855), (-1152308568, -1696240467, 9, -863157185, 1794803401)


statement ok
INSERT INTO `table_5` (`column_2`, `column_1`, `column_3`) VALUES (669996658, -2008498817, 0), (-810274485, 261922830, 1), (-984386644, 1173773769, 2), (580614647, 1753321079, 3), (-735559977, -1624270769, 4), (1016543464, 90264111, 5), (-1706058367, 547599708, 6), (-1693168801, -1972707829, 7), (-452043794, 511652827, 8), (-1301508791, 1857876742, 9)


statement ok
INSERT INTO `table_1` (`column_2`, `column_1`, `column_3`) VALUES (-138928264, -1937639047, 0), (1883304994, 1005971755, 1), (-1253613588, -329164272, 2), (1670101687, -1676403588, 3), (217216928, 1323106804, 4), (-768443310, 96622537, 5), (324570506, -880160962, 6), (-1429727392, 686598792, 7), (-1816164038, -1738741601, 8), (2116571052, 1311703809, 9)


query  rowsort
SELECT `table_1`.`column_2` AS `alias_1`, `table_2`.`column_2` AS `alias_2` FROM `table_1` INNER JOIN `table_2` ON (`table_1`.`column_1` = `table_2`.`column_1`)
----


query  rowsort
SELECT DISTINCT `table_2`.`column_1` AS `alias_1` FROM `table_2`
----
-1504301087
-1693565427
-365796277
-67467617
-863157185
1453114643
193355774
1952457462
359654891
6202616

query  rowsort
SELECT `table_2`.`column_1` AS `alias_1` FROM `table_2` WHERE (`table_2`.`column_1` > ?)
? = 10
----
1453114643
193355774
1952457462
359654891
6202616

query  rowsort
SELECT DISTINCT `table_2`.`column_3` AS `alias_1`, `table_3`.`column_2` AS `alias_2` FROM `table_2` INNER JOIN `table_3` ON (`table_2`.`column_1` = `table_3`.`column_1`)
----


query  rowsort
SELECT `table_2`.`column_4` AS `alias_1`, `table_4`.`column_2` AS `alias_2` FROM `table_2` INNER JOIN `table_4` ON (`table_2`.`column_1` = `table_4`.`column_1`) WHERE (`table_2`.`column_2` > ?)
? = 10
----


query  rowsort
SELECT DISTINCT `table_3`.`column_1` AS `alias_1` FROM `table_3` WHERE (`table_3`.`column_1` > ?)
? = 10
----
1053579588
1266490087
1301332644
1716660326
1729657601
182280076

query  rowsort
SELECT DISTINCT `table_3`.`column_3` AS `alias_1`, `table_5`.`column_2` AS `alias_2` FROM `table_3` INNER JOIN `table_5` ON (`table_3`.`column_1` = `table_5`.`column_1`) WHERE (`table_3`.`column_1` > ?)
? = 10
----


statement ok
DELETE FROM `table_3` WHERE (`column_4` = 0)


statement ok
DELETE FROM `table_3` WHERE (`column_4` = 1)


statement ok
DELETE FROM `table_3` WHERE (`column_4` = 2)


statement ok
DELETE FROM `table_3` WHERE (`column_4` = 3)


statement ok
DELETE FROM `table_3` WHERE (`column_4` = 4)


statement ok
DELETE FROM `table_4` WHERE (`column_3` = 0)


statement ok
DELETE FROM `table_4` WHERE (`column_3` = 1)


statement ok
DELETE FROM `table_4` WHERE (`column_3` = 2)


statement ok
DELETE FROM `table_4` WHERE (`column_3` = 3)


statement ok
DELETE FROM `table_4` WHERE (`column_3` = 4)


statement ok
DELETE FROM `table_2` WHERE (`column_5` = 0)


statement ok
DELETE FROM `table_2` WHERE (`column_5` = 1)


statement ok
DELETE FROM `table_2` WHERE (`column_5` = 2)


statement ok
DELETE FROM `table_2` WHERE (`column_5` = 3)


statement ok
DELETE FROM `table_2` WHERE (`column_5` = 4)


statement ok
DELETE FROM `table_5` WHERE (`column_3` = 0)


statement ok
DELETE FROM `table_5` WHERE (`column_3` = 1)


statement ok
DELETE FROM `table_5` WHERE (`column_3` = 2)


statement ok
DELETE FROM `table_5` WHERE (`column_3` = 3)


statement ok
DELETE FROM `table_5` WHERE (`column_3` = 4)


statement ok
DELETE FROM `table_1` WHERE (`column_3` = 0)


statement ok
DELETE FROM `table_1` WHERE (`column_3` = 1)


statement ok
DELETE FROM `table_1` WHERE (`column_3` = 2)


statement ok
DELETE FROM `table_1` WHERE (`column_3` = 3)


statement ok
DELETE FROM `table_1` WHERE (`column_3` = 4)


query  rowsort
SELECT `table_1`.`column_2` AS `alias_1`, `table_2`.`column_2` AS `alias_2` FROM `table_1` INNER JOIN `table_2` ON (`table_1`.`column_1` = `table_2`.`column_1`)
----


query  rowsort
SELECT DISTINCT `table_2`.`column_1` AS `alias_1` FROM `table_2`
----
-1504301087
-863157185
1453114643
359654891
6202616

query  rowsort
SELECT `table_2`.`column_1` AS `alias_1` FROM `table_2` WHERE (`table_2`.`column_1` > ?)
? = 10
----
1453114643
359654891
6202616

query  rowsort
SELECT DISTINCT `table_2`.`column_3` AS `alias_1`, `table_3`.`column_2` AS `alias_2` FROM `table_2` INNER JOIN `table_3` ON (`table_2`.`column_1` = `table_3`.`column_1`)
----


query  rowsort
SELECT `table_2`.`column_4` AS `alias_1`, `table_4`.`column_2` AS `alias_2` FROM `table_2` INNER JOIN `table_4` ON (`table_2`.`column_1` = `table_4`.`column_1`) WHERE (`table_2`.`column_2` > ?)
? = 10
----


query  rowsort
SELECT DISTINCT `table_3`.`column_1` AS `alias_1` FROM `table_3` WHERE (`table_3`.`column_1` > ?)
? = 10
----
1266490087
1301332644
1716660326

query  rowsort
SELECT DISTINCT `table_3`.`column_3` AS `alias_1`, `table_5`.`column_2` AS `alias_2` FROM `table_3` INNER JOIN `table_5` ON (`table_3`.`column_1` = `table_5`.`column_1`) WHERE (`table_3`.`column_1` > ?)
? = 10
----

