# Generated by:
#     target/debug/noria-logictest permute --compare-to mysql://root:noria@127.1/noria -d 3 -o logictests/generated/mysql/ --only range_param --random --include-deletes --rows-per-table 10 --subquery-depth 1

statement ok
CREATE TABLE `table_1` (`column_3` INT, `column_10` INT, `column_7` INT, `column_4` INT, `column_2` INT, `column_6` INT, `column_1` INT, `column_9` INT, `column_5` INT, `column_8` INT, PRIMARY KEY (`column_10`))


statement ok
CREATE TABLE `table_4` (`column_2` INT, `column_3` INT, `column_1` INT, PRIMARY KEY (`column_3`))


statement ok
CREATE TABLE `table_2` (`column_1` INT, `column_3` INT, `column_2` INT, PRIMARY KEY (`column_3`))


statement ok
CREATE TABLE `table_3` (`column_3` INT, `column_1` INT, `column_2` INT, PRIMARY KEY (`column_3`))


statement ok
CREATE TABLE `table_5` (`column_1` INT, `column_2` INT, `column_3` INT, PRIMARY KEY (`column_3`))


statement ok
INSERT INTO `table_1` (`column_3`, `column_10`, `column_7`, `column_4`, `column_2`, `column_6`, `column_1`, `column_9`, `column_5`, `column_8`) VALUES (777152124, 0, 993946238, -1532152347, 34038291, 1881097075, 982840554, -576552420, 1754225731, -342869733), (333875648, 1, 558272952, -1673714717, 74841782, -1567824210, -2117556778, 129017458, 402779172, -560823592), (1889564936, 2, -1627383561, -2109946797, 962285168, -1161976721, 1228190596, -143925511, -519480333, -1231411899), (-613645721, 3, 1578165098, -703334018, -2003520543, -1877698436, -1434930382, -1129697537, 808649153, -1698120828), (-2070720872, 4, 1103233241, 1883542838, -2063561406, 105158936, -1263253863, -607184091, -626504369, 1962542613), (1416465665, 5, -1098322278, 1112414653, 758314945, 1748645098, -1640987590, -295472925, -1717414238, -1741258453), (1322491990, 6, -1363546510, -919415863, -1983211167, -1852543164, 1320877376, -276868256, -390570847, -94515313), (-907442262, 7, -964902694, -663419292, -541047740, 2029096490, 335238090, -230299051, 1793864257, 307401207), (-2047072060, 8, -1781501185, -897387425, 805511812, -661365058, -1311928756, 226983367, -574726407, -566155748), (1492945415, 9, 1801014330, -189710517, -1514041273, 248676533, -1066087700, 1055063183, -1078307657, 1062413325)


statement ok
INSERT INTO `table_4` (`column_2`, `column_3`, `column_1`) VALUES (1261304636, 0, 1252720887), (1229533996, 1, -27273760), (1458259932, 2, 1506687015), (-2017323341, 3, 630333391), (2078142754, 4, 960002802), (944247792, 5, 1793644966), (1802165155, 6, -64707501), (-1916500545, 7, -1107478372), (-117822845, 8, 1802779474), (-1153000978, 9, 1784084142)


statement ok
INSERT INTO `table_2` (`column_1`, `column_3`, `column_2`) VALUES (617670176, 0, -1312377187), (2137992373, 1, -1947924384), (987759071, 2, 1058703602), (1506910527, 3, -510732246), (1310704190, 4, 1727924502), (35048068, 5, 1114365345), (454496500, 6, -2058569575), (-1958279554, 7, 467189147), (1677318378, 8, 610687166), (-1719100162, 9, -1044674408)


statement ok
INSERT INTO `table_3` (`column_3`, `column_1`, `column_2`) VALUES (0, 174197114, 671751055), (1, -1260992896, 1868868464), (2, -467325627, -834760556), (3, -431041273, -350422479), (4, -911356619, -1934177989), (5, -1685485924, -888016364), (6, -2114288125, 1525333707), (7, -393083230, 1366736255), (8, 950788499, 119096397), (9, -1011671056, -865028254)


statement ok
INSERT INTO `table_5` (`column_1`, `column_2`, `column_3`) VALUES (-824735778, -74802726, 0), (1525375946, -836117704, 1), (1905182537, -1002665654, 2), (1401540996, 1467161742, 3), (998198274, 883962889, 4), (-1605062899, 749340065, 5), (-1061755477, -593942537, 6), (1755586917, -1763633122, 7), (768047383, -703868826, 8), (-246595046, -1696121105, 9)


query  rowsort
SELECT `table_1`.`column_2` AS `alias_1`, `table_2`.`column_2` AS `alias_2` FROM `table_1` INNER JOIN `table_2` ON (`table_1`.`column_1` = `table_2`.`column_1`)
----


query  rowsort
SELECT count(`table_1`.`column_3`) AS `alias_1` FROM `table_1`
----
10

query  rowsort
SELECT `table_1`.`column_2` AS `alias_1` FROM `table_1` WHERE (`table_1`.`column_2` > ?)
? = 10
----
34038291
74841782
758314945
805511812
962285168

query  rowsort
SELECT `table_1`.`column_4` AS `alias_1`, `table_3`.`column_2` AS `alias_2`, count(`table_1`.`column_5`) AS `alias_3` FROM `table_1` INNER JOIN `table_3` ON (`table_1`.`column_2` = `table_3`.`column_1`) GROUP BY `table_1`.`column_4`, `table_3`.`column_2`
----


query  rowsort
SELECT `table_1`.`column_6` AS `alias_1`, `table_4`.`column_2` AS `alias_2` FROM `table_1` INNER JOIN `table_4` ON (`table_1`.`column_2` = `table_4`.`column_1`) WHERE (`table_1`.`column_2` > ?)
? = 10
----


query  rowsort
SELECT count(`table_1`.`column_7`) AS `alias_1` FROM `table_1` WHERE (`table_1`.`column_2` > ?)
? = 10
----
5

query  rowsort
SELECT `table_1`.`column_8` AS `alias_1`, `table_5`.`column_2` AS `alias_2`, count(`table_1`.`column_9`) AS `alias_3` FROM `table_1` INNER JOIN `table_5` ON (`table_1`.`column_2` = `table_5`.`column_1`) WHERE (`table_1`.`column_3` > ?) GROUP BY `table_1`.`column_8`, `table_5`.`column_2`
? = 10
----


statement ok
DELETE FROM `table_1` WHERE (`column_10` = 0)


statement ok
DELETE FROM `table_1` WHERE (`column_10` = 1)


statement ok
DELETE FROM `table_1` WHERE (`column_10` = 2)


statement ok
DELETE FROM `table_1` WHERE (`column_10` = 3)


statement ok
DELETE FROM `table_1` WHERE (`column_10` = 4)


statement ok
DELETE FROM `table_4` WHERE (`column_3` = 0)


statement ok
DELETE FROM `table_4` WHERE (`column_3` = 1)


statement ok
DELETE FROM `table_4` WHERE (`column_3` = 2)


statement ok
DELETE FROM `table_4` WHERE (`column_3` = 3)


statement ok
DELETE FROM `table_4` WHERE (`column_3` = 4)


statement ok
DELETE FROM `table_2` WHERE (`column_3` = 0)


statement ok
DELETE FROM `table_2` WHERE (`column_3` = 1)


statement ok
DELETE FROM `table_2` WHERE (`column_3` = 2)


statement ok
DELETE FROM `table_2` WHERE (`column_3` = 3)


statement ok
DELETE FROM `table_2` WHERE (`column_3` = 4)


statement ok
DELETE FROM `table_3` WHERE (`column_3` = 0)


statement ok
DELETE FROM `table_3` WHERE (`column_3` = 1)


statement ok
DELETE FROM `table_3` WHERE (`column_3` = 2)


statement ok
DELETE FROM `table_3` WHERE (`column_3` = 3)


statement ok
DELETE FROM `table_3` WHERE (`column_3` = 4)


statement ok
DELETE FROM `table_5` WHERE (`column_3` = 0)


statement ok
DELETE FROM `table_5` WHERE (`column_3` = 1)


statement ok
DELETE FROM `table_5` WHERE (`column_3` = 2)


statement ok
DELETE FROM `table_5` WHERE (`column_3` = 3)


statement ok
DELETE FROM `table_5` WHERE (`column_3` = 4)


query  rowsort
SELECT `table_1`.`column_2` AS `alias_1`, `table_2`.`column_2` AS `alias_2` FROM `table_1` INNER JOIN `table_2` ON (`table_1`.`column_1` = `table_2`.`column_1`)
----


query  rowsort
SELECT count(`table_1`.`column_3`) AS `alias_1` FROM `table_1`
----
5

query  rowsort
SELECT `table_1`.`column_2` AS `alias_1` FROM `table_1` WHERE (`table_1`.`column_2` > ?)
? = 10
----
758314945
805511812

query  rowsort
SELECT `table_1`.`column_4` AS `alias_1`, `table_3`.`column_2` AS `alias_2`, count(`table_1`.`column_5`) AS `alias_3` FROM `table_1` INNER JOIN `table_3` ON (`table_1`.`column_2` = `table_3`.`column_1`) GROUP BY `table_1`.`column_4`, `table_3`.`column_2`
----


query  rowsort
SELECT `table_1`.`column_6` AS `alias_1`, `table_4`.`column_2` AS `alias_2` FROM `table_1` INNER JOIN `table_4` ON (`table_1`.`column_2` = `table_4`.`column_1`) WHERE (`table_1`.`column_2` > ?)
? = 10
----


query  rowsort
SELECT count(`table_1`.`column_7`) AS `alias_1` FROM `table_1` WHERE (`table_1`.`column_2` > ?)
? = 10
----
2

query  rowsort
SELECT `table_1`.`column_8` AS `alias_1`, `table_5`.`column_2` AS `alias_2`, count(`table_1`.`column_9`) AS `alias_3` FROM `table_1` INNER JOIN `table_5` ON (`table_1`.`column_2` = `table_5`.`column_1`) WHERE (`table_1`.`column_3` > ?) GROUP BY `table_1`.`column_8`, `table_5`.`column_2`
? = 10
----

