# Generated by:
#     target/debug/noria-logictest permute --compare-to mysql://root:noria@127.1/noria -d 3 -o logictests/generated/mysql/ --only range_param --random --include-deletes --rows-per-table 10 --subquery-depth 1

statement ok
CREATE TABLE `table_9` (`column_2` INT, `column_4` INT, `column_7` INT, `column_6` INT, `column_3` INT, `column_1` INT, `column_5` INT, PRIMARY KEY (`column_7`))


statement ok
CREATE TABLE `table_5` (`column_3` INT, `column_2` INT, `column_4` INT, `column_1` INT, PRIMARY KEY (`column_4`))


statement ok
CREATE TABLE `table_8` (`column_3` INT, `column_1` INT, `column_2` INT, PRIMARY KEY (`column_3`))


statement ok
CREATE TABLE `table_3` (`column_2` INT, `column_3` INT, `column_1` INT, PRIMARY KEY (`column_3`))


statement ok
CREATE TABLE `table_11` (`column_2` INT, `column_3` INT, `column_1` INT, PRIMARY KEY (`column_3`))


statement ok
CREATE TABLE `table_6` (`column_2` INT, `column_3` INT, `column_1` INT, PRIMARY KEY (`column_3`))


statement ok
CREATE TABLE `table_1` (`column_4` INT, `column_2` INT, `column_3` INT, `column_5` INT, `column_6` INT, `column_7` INT, `column_1` INT, PRIMARY KEY (`column_7`))


statement ok
CREATE TABLE `table_4` (`column_2` INT, `column_3` INT, `column_1` INT, PRIMARY KEY (`column_3`))


statement ok
CREATE TABLE `table_10` (`column_1` INT, `column_3` INT, `column_2` INT, PRIMARY KEY (`column_3`))


statement ok
CREATE TABLE `table_12` (`column_3` INT, `column_1` INT, `column_2` INT, PRIMARY KEY (`column_3`))


statement ok
CREATE TABLE `table_13` (`column_3` INT, `column_2` INT, `column_1` INT, PRIMARY KEY (`column_3`))


statement ok
CREATE TABLE `table_2` (`column_3` INT, `column_4` INT, `column_1` INT, `column_2` INT, PRIMARY KEY (`column_4`))


statement ok
CREATE TABLE `table_7` (`column_2` INT, `column_4` INT, `column_1` INT, `column_3` INT, PRIMARY KEY (`column_4`))


statement ok
INSERT INTO `table_9` (`column_2`, `column_4`, `column_7`, `column_6`, `column_3`, `column_1`, `column_5`) VALUES (318118472, 832997854, 0, -72384314, 1581911314, -1513553420, -268143669), (1142817761, 604081970, 1, 177274419, 948840422, -496346212, 1275975056), (1151449789, 1504027225, 2, 1893686638, -1052789022, -829748929, 2058085354), (2125997489, 643418200, 3, -5365771, -1878305496, -1465891289, 113292038), (-915445702, 2082705874, 4, 1949315290, -1222314878, -1721742229, -990952413), (297948228, -986807837, 5, -281749799, -1520437472, -227197633, -290952462), (816794582, -1359489221, 6, -584273088, -2134360966, -1213833078, -1766125324), (1103107086, -1590213633, 7, -417888668, 734436495, -1789622729, 2032381579), (-522158435, 240936163, 8, 458714054, -1405003796, -1768296298, -746691192), (-1979026888, -42236377, 9, -1912428864, -1793891517, 669717895, 804497834)


statement ok
INSERT INTO `table_5` (`column_3`, `column_2`, `column_4`, `column_1`) VALUES (1843728235, 592694463, 0, 2012479483), (2040854687, 459056112, 1, 19298187), (-1640677151, -1663151234, 2, 1334744333), (2080257391, -56522583, 3, 972250149), (-614892172, 1416018984, 4, 1152849192), (-1766392027, -1959377691, 5, 1255398760), (1050473588, -693425310, 6, -2009782413), (2070367713, 70737193, 7, 90401619), (336769810, 114085593, 8, -1676693208), (222518965, -298965556, 9, 1889512957)


statement ok
INSERT INTO `table_8` (`column_3`, `column_1`, `column_2`) VALUES (0, -513984839, -1419097407), (1, -1419166657, 1845115925), (2, 911347708, 259110518), (3, -980518141, -868956630), (4, 515329045, -1665095781), (5, -756957604, -1357398720), (6, 1529071801, 1620667273), (7, -388742497, -2103164934), (8, 130150161, 1935335324), (9, -166705735, -650517326)


statement ok
INSERT INTO `table_3` (`column_2`, `column_3`, `column_1`) VALUES (-2059047430, 0, 541392599), (-1607077506, 1, -1931193481), (964352278, 2, 824389514), (-825302618, 3, 1307447980), (619083320, 4, 284394768), (-833644588, 5, 1480347551), (-543039292, 6, -1679547930), (-1896296004, 7, -193676811), (1573726094, 8, -728126657), (-590554720, 9, 256113783)


statement ok
INSERT INTO `table_11` (`column_2`, `column_3`, `column_1`) VALUES (-1572851241, 0, -2050375562), (-1360639038, 1, -896439538), (2089896714, 2, -1401903123), (-576454739, 3, -401941896), (-961357249, 4, 911640575), (-1139773887, 5, 1031838946), (1243205598, 6, 97348628), (295252250, 7, -1003135778), (-1601276165, 8, 1245995259), (-1880108370, 9, -1964406777)


statement ok
INSERT INTO `table_6` (`column_2`, `column_3`, `column_1`) VALUES (97904205, 0, -2006231085), (2134781168, 1, 1024419493), (-1980470795, 2, 1628100346), (288938516, 3, -1827505665), (-576798365, 4, -1483399117), (-366351602, 5, 243080091), (1045909856, 6, 10100991), (858121308, 7, 1936251606), (-340638050, 8, -1726681437), (-1886420527, 9, 332829580)


statement ok
INSERT INTO `table_1` (`column_4`, `column_2`, `column_3`, `column_5`, `column_6`, `column_7`, `column_1`) VALUES (2038108845, -528192049, 1661275995, 1806858548, 1759255584, 0, -484968292), (-1310652531, -1969867056, -867396361, -991772520, -1528029205, 1, -668099577), (-1190124706, -1198222420, -995947221, -1443265838, -743786305, 2, -1912445650), (1253094892, -1451104219, -1301486481, 1289604738, -202910690, 3, -954144518), (-1935177125, -1599116108, -1097788307, 1247921631, -295713602, 4, 1710559485), (1535099289, 254525878, -1307837908, -2016832418, -1877948454, 5, 1854685043), (-1519420539, 585029386, 284268171, -1479529988, -1928196334, 6, 64804091), (1067826067, 1439306694, -815405774, -1978670854, 293366282, 7, 562295369), (-1284578804, -1908875707, -1590718901, 1649432905, -823478101, 8, 1403844626), (-2130810339, -735636579, -229990705, 1651624090, 1910050314, 9, -832265459)


statement ok
INSERT INTO `table_4` (`column_2`, `column_3`, `column_1`) VALUES (1652878879, 0, 1296686135), (308516932, 1, 559985417), (643780537, 2, -1164037660), (-1201772482, 3, 1707444236), (-94928933, 4, 1829640313), (1277904291, 5, -1299535155), (-409096685, 6, 1681717993), (-1535133816, 7, -74220600), (1945212135, 8, 64050532), (2035945686, 9, 681569772)


statement ok
INSERT INTO `table_10` (`column_1`, `column_3`, `column_2`) VALUES (808229245, 0, -1475917715), (1039953256, 1, -1675729511), (1643891886, 2, 1415823939), (-22585883, 3, -1607149341), (1223545236, 4, -1788596166), (-981041417, 5, 1831321), (-1470349858, 6, -1746506232), (-1673745578, 7, 127299482), (-402738494, 8, 954744569), (-2126200323, 9, -540809597)


statement ok
INSERT INTO `table_12` (`column_3`, `column_1`, `column_2`) VALUES (0, 667057936, 571628880), (1, 2119404145, 1430262071), (2, -421785121, -1058477437), (3, -1153847084, -651710329), (4, 63012924, 2022799859), (5, -1510312881, 1097410780), (6, -844757180, -1702617538), (7, -1059490297, -1937612248), (8, 940863175, -2013497226), (9, -342204204, -1316759615)


statement ok
INSERT INTO `table_13` (`column_3`, `column_2`, `column_1`) VALUES (0, -607673618, -841608303), (1, 48805054, 599170331), (2, 498486980, 42604006), (3, -1491790746, -1792902504), (4, -1673938345, -955750821), (5, 1197303375, -1253657251), (6, 1601007895, -857153287), (7, 1526668545, 405814658), (8, -284712458, 2039229859), (9, -1594115094, 1385471491)


statement ok
INSERT INTO `table_2` (`column_3`, `column_4`, `column_1`, `column_2`) VALUES (513864121, 0, -142784377, -1500765702), (474433821, 1, 513863294, -284392684), (-373704649, 2, 1629634809, 1084988286), (-36123641, 3, -1775185274, -2130999025), (-1937655424, 4, -883278541, 134023790), (-2022792125, 5, -1105035949, 1017439600), (758001986, 6, -793525238, -1721404906), (-788566248, 7, 1254182750, 1222984714), (1569057527, 8, -1090858793, 365226450), (-723822064, 9, -1863496118, -446018947)


statement ok
INSERT INTO `table_7` (`column_2`, `column_4`, `column_1`, `column_3`) VALUES (1244536923, 0, 1739992667, 1568181024), (1449503615, 1, 175886381, 1862341568), (1077038330, 2, -411601934, 828067510), (-1814518136, 3, -1668271201, 602827976), (10901614, 4, 1253855016, -1059601783), (147437113, 5, 1677151317, 737534470), (-205362927, 6, 1924089304, -949392458), (2132450220, 7, 1981612789, 875145977), (551147169, 8, -408058220, 1969034334), (-1841687946, 9, 50231293, -2071234930)


query  rowsort
WITH `alias_5` AS (SELECT `table_2`.`column_3` AS `alias_3`, `table_3`.`column_2` AS `alias_4` FROM `table_2` INNER JOIN `table_3` ON (`table_2`.`column_1` = `table_3`.`column_1`)) SELECT `table_1`.`column_2` AS `alias_1`, `table_2`.`column_2` AS `alias_2` FROM `table_1` INNER JOIN `table_2` ON (`table_1`.`column_1` = `table_2`.`column_1`) INNER JOIN `alias_5` ON (`table_1`.`column_2` = `alias_5`.`alias_3`)
----


query  rowsort
WITH `alias_4` AS (SELECT `table_1`.`column_2` AS `alias_3` FROM `table_1`) SELECT `table_1`.`column_3` AS `alias_1`, `table_4`.`column_2` AS `alias_2` FROM `table_1` INNER JOIN `table_4` ON (`table_1`.`column_2` = `table_4`.`column_1`) INNER JOIN `alias_4` ON (`table_1`.`column_2` = `alias_4`.`alias_3`)
----


query  rowsort
WITH `alias_5` AS (SELECT `table_1`.`column_5` AS `alias_3`, `table_6`.`column_2` AS `alias_4` FROM `table_1` INNER JOIN `table_6` ON (`table_1`.`column_4` = `table_6`.`column_1`)) SELECT `table_1`.`column_4` AS `alias_1`, `table_5`.`column_2` AS `alias_2` FROM `table_1` INNER JOIN `table_5` ON (`table_1`.`column_2` = `table_5`.`column_1`) INNER JOIN `alias_5` ON (`table_1`.`column_4` = `alias_5`.`alias_3`)
----


query  rowsort
WITH `alias_3` AS (SELECT `table_1`.`column_6` AS `alias_1`, `table_7`.`column_2` AS `alias_2` FROM `table_1` INNER JOIN `table_7` ON (`table_1`.`column_4` = `table_7`.`column_1`)) SELECT `table_1`.`column_4` AS `alias_4` FROM `table_1` INNER JOIN `alias_3` ON (`table_1`.`column_4` = `alias_3`.`alias_1`) WHERE (`table_1`.`column_4` > ?)
? = 10
----


query  rowsort
WITH `alias_2` AS (SELECT `table_7`.`column_2` AS `alias_1` FROM `table_7`) SELECT `table_7`.`column_2` AS `alias_3` FROM `table_7` INNER JOIN `alias_2` ON (`table_7`.`column_2` = `alias_2`.`alias_1`) WHERE (`table_7`.`column_2` > ?)
? = 10
----
1077038330
10901614
1244536923
1449503615
147437113
2132450220
551147169

query  rowsort
WITH `alias_3` AS (SELECT `table_7`.`column_3` AS `alias_1`, `table_8`.`column_2` AS `alias_2` FROM `table_7` INNER JOIN `table_8` ON (`table_7`.`column_2` = `table_8`.`column_1`)) SELECT `table_7`.`column_2` AS `alias_4` FROM `table_7` INNER JOIN `alias_3` ON (`table_7`.`column_2` = `alias_3`.`alias_1`) WHERE (`table_7`.`column_2` > ?)
? = 10
----


query  rowsort
WITH `alias_5` AS (SELECT `table_9`.`column_3` AS `alias_3`, `table_10`.`column_2` AS `alias_4` FROM `table_9` INNER JOIN `table_10` ON (`table_9`.`column_2` = `table_10`.`column_1`)) SELECT `table_5`.`column_3` AS `alias_1`, `table_9`.`column_2` AS `alias_2` FROM `table_5` INNER JOIN `table_9` ON (`table_5`.`column_1` = `table_9`.`column_1`) INNER JOIN `alias_5` ON (`table_5`.`column_3` = `alias_5`.`alias_3`) WHERE (`table_5`.`column_3` > ?)
? = 10
----


query  rowsort
WITH `alias_4` AS (SELECT `table_9`.`column_2` AS `alias_3` FROM `table_9`) SELECT `table_9`.`column_4` AS `alias_1`, `table_11`.`column_2` AS `alias_2` FROM `table_9` INNER JOIN `table_11` ON (`table_9`.`column_2` = `table_11`.`column_1`) INNER JOIN `alias_4` ON (`table_9`.`column_2` = `alias_4`.`alias_3`) WHERE (`table_9`.`column_2` > ?)
? = 10
----


query  rowsort
WITH `alias_5` AS (SELECT `table_9`.`column_6` AS `alias_3`, `table_13`.`column_2` AS `alias_4` FROM `table_9` INNER JOIN `table_13` ON (`table_9`.`column_2` = `table_13`.`column_1`)) SELECT `table_9`.`column_5` AS `alias_1`, `table_12`.`column_2` AS `alias_2` FROM `table_9` INNER JOIN `table_12` ON (`table_9`.`column_2` = `table_12`.`column_1`) INNER JOIN `alias_5` ON (`table_9`.`column_2` = `alias_5`.`alias_3`) WHERE (`table_9`.`column_2` > ?)
? = 10
----


statement ok
DELETE FROM `table_9` WHERE (`column_7` = 0)


statement ok
DELETE FROM `table_9` WHERE (`column_7` = 1)


statement ok
DELETE FROM `table_9` WHERE (`column_7` = 2)


statement ok
DELETE FROM `table_9` WHERE (`column_7` = 3)


statement ok
DELETE FROM `table_9` WHERE (`column_7` = 4)


statement ok
DELETE FROM `table_5` WHERE (`column_4` = 0)


statement ok
DELETE FROM `table_5` WHERE (`column_4` = 1)


statement ok
DELETE FROM `table_5` WHERE (`column_4` = 2)


statement ok
DELETE FROM `table_5` WHERE (`column_4` = 3)


statement ok
DELETE FROM `table_5` WHERE (`column_4` = 4)


statement ok
DELETE FROM `table_8` WHERE (`column_3` = 0)


statement ok
DELETE FROM `table_8` WHERE (`column_3` = 1)


statement ok
DELETE FROM `table_8` WHERE (`column_3` = 2)


statement ok
DELETE FROM `table_8` WHERE (`column_3` = 3)


statement ok
DELETE FROM `table_8` WHERE (`column_3` = 4)


statement ok
DELETE FROM `table_3` WHERE (`column_3` = 0)


statement ok
DELETE FROM `table_3` WHERE (`column_3` = 1)


statement ok
DELETE FROM `table_3` WHERE (`column_3` = 2)


statement ok
DELETE FROM `table_3` WHERE (`column_3` = 3)


statement ok
DELETE FROM `table_3` WHERE (`column_3` = 4)


statement ok
DELETE FROM `table_11` WHERE (`column_3` = 0)


statement ok
DELETE FROM `table_11` WHERE (`column_3` = 1)


statement ok
DELETE FROM `table_11` WHERE (`column_3` = 2)


statement ok
DELETE FROM `table_11` WHERE (`column_3` = 3)


statement ok
DELETE FROM `table_11` WHERE (`column_3` = 4)


statement ok
DELETE FROM `table_6` WHERE (`column_3` = 0)


statement ok
DELETE FROM `table_6` WHERE (`column_3` = 1)


statement ok
DELETE FROM `table_6` WHERE (`column_3` = 2)


statement ok
DELETE FROM `table_6` WHERE (`column_3` = 3)


statement ok
DELETE FROM `table_6` WHERE (`column_3` = 4)


statement ok
DELETE FROM `table_1` WHERE (`column_7` = 0)


statement ok
DELETE FROM `table_1` WHERE (`column_7` = 1)


statement ok
DELETE FROM `table_1` WHERE (`column_7` = 2)


statement ok
DELETE FROM `table_1` WHERE (`column_7` = 3)


statement ok
DELETE FROM `table_1` WHERE (`column_7` = 4)


statement ok
DELETE FROM `table_4` WHERE (`column_3` = 0)


statement ok
DELETE FROM `table_4` WHERE (`column_3` = 1)


statement ok
DELETE FROM `table_4` WHERE (`column_3` = 2)


statement ok
DELETE FROM `table_4` WHERE (`column_3` = 3)


statement ok
DELETE FROM `table_4` WHERE (`column_3` = 4)


statement ok
DELETE FROM `table_10` WHERE (`column_3` = 0)


statement ok
DELETE FROM `table_10` WHERE (`column_3` = 1)


statement ok
DELETE FROM `table_10` WHERE (`column_3` = 2)


statement ok
DELETE FROM `table_10` WHERE (`column_3` = 3)


statement ok
DELETE FROM `table_10` WHERE (`column_3` = 4)


statement ok
DELETE FROM `table_12` WHERE (`column_3` = 0)


statement ok
DELETE FROM `table_12` WHERE (`column_3` = 1)


statement ok
DELETE FROM `table_12` WHERE (`column_3` = 2)


statement ok
DELETE FROM `table_12` WHERE (`column_3` = 3)


statement ok
DELETE FROM `table_12` WHERE (`column_3` = 4)


statement ok
DELETE FROM `table_13` WHERE (`column_3` = 0)


statement ok
DELETE FROM `table_13` WHERE (`column_3` = 1)


statement ok
DELETE FROM `table_13` WHERE (`column_3` = 2)


statement ok
DELETE FROM `table_13` WHERE (`column_3` = 3)


statement ok
DELETE FROM `table_13` WHERE (`column_3` = 4)


statement ok
DELETE FROM `table_2` WHERE (`column_4` = 0)


statement ok
DELETE FROM `table_2` WHERE (`column_4` = 1)


statement ok
DELETE FROM `table_2` WHERE (`column_4` = 2)


statement ok
DELETE FROM `table_2` WHERE (`column_4` = 3)


statement ok
DELETE FROM `table_2` WHERE (`column_4` = 4)


statement ok
DELETE FROM `table_7` WHERE (`column_4` = 0)


statement ok
DELETE FROM `table_7` WHERE (`column_4` = 1)


statement ok
DELETE FROM `table_7` WHERE (`column_4` = 2)


statement ok
DELETE FROM `table_7` WHERE (`column_4` = 3)


statement ok
DELETE FROM `table_7` WHERE (`column_4` = 4)


query  rowsort
WITH `alias_5` AS (SELECT `table_2`.`column_3` AS `alias_3`, `table_3`.`column_2` AS `alias_4` FROM `table_2` INNER JOIN `table_3` ON (`table_2`.`column_1` = `table_3`.`column_1`)) SELECT `table_1`.`column_2` AS `alias_1`, `table_2`.`column_2` AS `alias_2` FROM `table_1` INNER JOIN `table_2` ON (`table_1`.`column_1` = `table_2`.`column_1`) INNER JOIN `alias_5` ON (`table_1`.`column_2` = `alias_5`.`alias_3`)
----


query  rowsort
WITH `alias_4` AS (SELECT `table_1`.`column_2` AS `alias_3` FROM `table_1`) SELECT `table_1`.`column_3` AS `alias_1`, `table_4`.`column_2` AS `alias_2` FROM `table_1` INNER JOIN `table_4` ON (`table_1`.`column_2` = `table_4`.`column_1`) INNER JOIN `alias_4` ON (`table_1`.`column_2` = `alias_4`.`alias_3`)
----


query  rowsort
WITH `alias_5` AS (SELECT `table_1`.`column_5` AS `alias_3`, `table_6`.`column_2` AS `alias_4` FROM `table_1` INNER JOIN `table_6` ON (`table_1`.`column_4` = `table_6`.`column_1`)) SELECT `table_1`.`column_4` AS `alias_1`, `table_5`.`column_2` AS `alias_2` FROM `table_1` INNER JOIN `table_5` ON (`table_1`.`column_2` = `table_5`.`column_1`) INNER JOIN `alias_5` ON (`table_1`.`column_4` = `alias_5`.`alias_3`)
----


query  rowsort
WITH `alias_3` AS (SELECT `table_1`.`column_6` AS `alias_1`, `table_7`.`column_2` AS `alias_2` FROM `table_1` INNER JOIN `table_7` ON (`table_1`.`column_4` = `table_7`.`column_1`)) SELECT `table_1`.`column_4` AS `alias_4` FROM `table_1` INNER JOIN `alias_3` ON (`table_1`.`column_4` = `alias_3`.`alias_1`) WHERE (`table_1`.`column_4` > ?)
? = 10
----


query  rowsort
WITH `alias_2` AS (SELECT `table_7`.`column_2` AS `alias_1` FROM `table_7`) SELECT `table_7`.`column_2` AS `alias_3` FROM `table_7` INNER JOIN `alias_2` ON (`table_7`.`column_2` = `alias_2`.`alias_1`) WHERE (`table_7`.`column_2` > ?)
? = 10
----
147437113
2132450220
551147169

query  rowsort
WITH `alias_3` AS (SELECT `table_7`.`column_3` AS `alias_1`, `table_8`.`column_2` AS `alias_2` FROM `table_7` INNER JOIN `table_8` ON (`table_7`.`column_2` = `table_8`.`column_1`)) SELECT `table_7`.`column_2` AS `alias_4` FROM `table_7` INNER JOIN `alias_3` ON (`table_7`.`column_2` = `alias_3`.`alias_1`) WHERE (`table_7`.`column_2` > ?)
? = 10
----


query  rowsort
WITH `alias_5` AS (SELECT `table_9`.`column_3` AS `alias_3`, `table_10`.`column_2` AS `alias_4` FROM `table_9` INNER JOIN `table_10` ON (`table_9`.`column_2` = `table_10`.`column_1`)) SELECT `table_5`.`column_3` AS `alias_1`, `table_9`.`column_2` AS `alias_2` FROM `table_5` INNER JOIN `table_9` ON (`table_5`.`column_1` = `table_9`.`column_1`) INNER JOIN `alias_5` ON (`table_5`.`column_3` = `alias_5`.`alias_3`) WHERE (`table_5`.`column_3` > ?)
? = 10
----


query  rowsort
WITH `alias_4` AS (SELECT `table_9`.`column_2` AS `alias_3` FROM `table_9`) SELECT `table_9`.`column_4` AS `alias_1`, `table_11`.`column_2` AS `alias_2` FROM `table_9` INNER JOIN `table_11` ON (`table_9`.`column_2` = `table_11`.`column_1`) INNER JOIN `alias_4` ON (`table_9`.`column_2` = `alias_4`.`alias_3`) WHERE (`table_9`.`column_2` > ?)
? = 10
----


query  rowsort
WITH `alias_5` AS (SELECT `table_9`.`column_6` AS `alias_3`, `table_13`.`column_2` AS `alias_4` FROM `table_9` INNER JOIN `table_13` ON (`table_9`.`column_2` = `table_13`.`column_1`)) SELECT `table_9`.`column_5` AS `alias_1`, `table_12`.`column_2` AS `alias_2` FROM `table_9` INNER JOIN `table_12` ON (`table_9`.`column_2` = `table_12`.`column_1`) INNER JOIN `alias_5` ON (`table_9`.`column_2` = `alias_5`.`alias_3`) WHERE (`table_9`.`column_2` > ?)
? = 10
----

