# Generated by:
#     target/debug/noria-logictest permute --compare-to mysql://root:noria@127.1/noria -d 3 -o logictests/generated/mysql/ --only range_param --random --include-deletes --rows-per-table 10 --subquery-depth 1

statement ok
CREATE TABLE `table_2` (`column_4` INT, `column_8` INT, `column_6` INT, `column_2` INT, `column_3` INT, `column_9` INT, `column_1` INT, `column_7` INT, `column_5` INT, PRIMARY KEY (`column_9`))


statement ok
CREATE TABLE `table_4` (`column_1` INT, `column_2` INT, `column_3` INT, PRIMARY KEY (`column_3`))


statement ok
CREATE TABLE `table_1` (`column_3` INT, `column_2` INT, `column_1` INT, PRIMARY KEY (`column_3`))


statement ok
CREATE TABLE `table_5` (`column_1` INT, `column_2` INT, `column_3` INT, PRIMARY KEY (`column_3`))


statement ok
CREATE TABLE `table_3` (`column_2` INT, `column_1` INT, `column_4` INT, `column_3` INT, PRIMARY KEY (`column_4`))


statement ok
INSERT INTO `table_2` (`column_4`, `column_8`, `column_6`, `column_2`, `column_3`, `column_9`, `column_1`, `column_7`, `column_5`) VALUES (-946679959, -1627974676, -53164519, -1584181619, -84896453, 0, -564656503, -1831016372, 824165670), (1555276615, 619846164, -336117881, -1687023423, -959609093, 1, 1246169810, 1719232808, 1524358910), (-197995477, 162135459, 1908020410, -1462066595, -1076743799, 2, -1638290560, -372915684, -1294657646), (-795620434, 1759523651, -640761823, 1982137216, 1448741047, 3, 295723379, -400467620, -1038332171), (458785981, 480476374, 1314738574, 327472507, -510187957, 4, 2119897096, 2055867150, 567537388), (-732648123, -916564860, -1816538848, 622265071, -1004174027, 5, -2033686747, 1161038901, 1439567133), (-2122181917, -476057668, 414170760, 266821456, -1608692543, 6, 2063466811, 1804014126, 1390313921), (2068154447, 1296628565, 554904673, -1971334335, 1047855292, 7, -969425438, -1387991589, -369612736), (-1254338718, 803497619, -107784863, -387167167, 1204359659, 8, -1313843916, -68210593, -1564080884), (949602053, -270993056, -2126972449, 725756353, -823491540, 9, -727331140, 390501567, 1464693959)


statement ok
INSERT INTO `table_4` (`column_1`, `column_2`, `column_3`) VALUES (122572737, -1242842459, 0), (-974120613, 1906477300, 1), (-1185485553, -1050865590, 2), (1577404289, -2140222836, 3), (1561234595, -801193121, 4), (1171623501, 1814744745, 5), (-1809364216, -998596615, 6), (192874565, 571935654, 7), (70157334, -241035645, 8), (186779865, -1809713236, 9)


statement ok
INSERT INTO `table_1` (`column_3`, `column_2`, `column_1`) VALUES (0, 1149996765, -284732118), (1, -632081289, -212979328), (2, 1388509783, -1539775703), (3, -675572165, -622158855), (4, 1620346454, -294703389), (5, -2102601630, -1625833067), (6, -1099092898, -2087461127), (7, -1587369447, 1825284744), (8, -968743947, 2033125128), (9, 2062953824, -1746210147)


statement ok
INSERT INTO `table_5` (`column_1`, `column_2`, `column_3`) VALUES (-1925639143, 898657099, 0), (-561756394, -1571610147, 1), (-463399359, 1715455089, 2), (-473185633, 1138576007, 3), (-777687493, -1298945214, 4), (-1165045096, -1256003982, 5), (-1475154649, -1165407428, 6), (-917801069, 1174588561, 7), (-1921085094, -427550341, 8), (375698922, -599989167, 9)


statement ok
INSERT INTO `table_3` (`column_2`, `column_1`, `column_4`, `column_3`) VALUES (-885333059, 1254101521, 0, -551293154), (-820808745, -773262655, 1, -698676117), (-1259223046, -653795617, 2, -2097548551), (135545131, 2039201088, 3, 414065347), (1502425186, -1873400339, 4, 1435992754), (710117270, 794882575, 5, -940733518), (1804180891, 624866253, 6, 1328560865), (2024596355, -919647572, 7, 1042626338), (553316911, 2734684, 8, -1736610021), (2044670924, 1253996141, 9, -1316282032)


query  rowsort
SELECT `table_1`.`column_2` AS `alias_1`, `table_2`.`column_2` AS `alias_2` FROM `table_1` LEFT JOIN `table_2` ON (`table_1`.`column_1` = `table_2`.`column_1`)
----
-1099092898
NULL
-1587369447
NULL
-2102601630
NULL
-632081289
NULL
-675572165
NULL
-968743947
NULL
1149996765
NULL
1388509783
NULL
1620346454
NULL
2062953824
NULL

query  rowsort
SELECT avg(`table_2`.`column_3`) AS `alias_1` FROM `table_2`
----
-236683941.4000

query  rowsort
SELECT `table_2`.`column_3` AS `alias_1` FROM `table_2` WHERE (`table_2`.`column_3` > ?)
? = 10
----
1047855292
1204359659
1448741047

query  rowsort
SELECT `table_2`.`column_4` AS `alias_1`, `table_3`.`column_2` AS `alias_2`, avg(`table_2`.`column_5`) AS `alias_3` FROM `table_2` LEFT JOIN `table_3` ON (`table_2`.`column_3` = `table_3`.`column_1`) GROUP BY `table_2`.`column_4`, `table_3`.`column_2`
----
30 values hashing to e2cdcdbb3ba075d20a7e0c7e904795da

query  rowsort
SELECT `table_3`.`column_3` AS `alias_1`, `table_4`.`column_2` AS `alias_2` FROM `table_3` LEFT JOIN `table_4` ON (`table_3`.`column_2` = `table_4`.`column_1`) WHERE (`table_3`.`column_2` > ?)
? = 10
----
-1316282032
NULL
-1736610021
NULL
-940733518
NULL
1042626338
NULL
1328560865
NULL
1435992754
NULL
414065347
NULL

query  rowsort
SELECT avg(`table_2`.`column_6`) AS `alias_1` FROM `table_2` WHERE (`table_2`.`column_2` > ?)
? = 10
----
-571072757.2000

query  rowsort
SELECT `table_2`.`column_7` AS `alias_1`, `table_5`.`column_2` AS `alias_2`, avg(`table_2`.`column_8`) AS `alias_3` FROM `table_2` LEFT JOIN `table_5` ON (`table_2`.`column_2` = `table_5`.`column_1`) WHERE (`table_2`.`column_4` > ?) GROUP BY `table_2`.`column_7`, `table_5`.`column_2`
? = 10
----
-1387991589
NULL
1296628565.0000
1719232808
NULL
619846164.0000
2055867150
NULL
480476374.0000
390501567
NULL
-270993056.0000

statement ok
DELETE FROM `table_2` WHERE (`column_9` = 0)


statement ok
DELETE FROM `table_2` WHERE (`column_9` = 1)


statement ok
DELETE FROM `table_2` WHERE (`column_9` = 2)


statement ok
DELETE FROM `table_2` WHERE (`column_9` = 3)


statement ok
DELETE FROM `table_2` WHERE (`column_9` = 4)


statement ok
DELETE FROM `table_4` WHERE (`column_3` = 0)


statement ok
DELETE FROM `table_4` WHERE (`column_3` = 1)


statement ok
DELETE FROM `table_4` WHERE (`column_3` = 2)


statement ok
DELETE FROM `table_4` WHERE (`column_3` = 3)


statement ok
DELETE FROM `table_4` WHERE (`column_3` = 4)


statement ok
DELETE FROM `table_1` WHERE (`column_3` = 0)


statement ok
DELETE FROM `table_1` WHERE (`column_3` = 1)


statement ok
DELETE FROM `table_1` WHERE (`column_3` = 2)


statement ok
DELETE FROM `table_1` WHERE (`column_3` = 3)


statement ok
DELETE FROM `table_1` WHERE (`column_3` = 4)


statement ok
DELETE FROM `table_5` WHERE (`column_3` = 0)


statement ok
DELETE FROM `table_5` WHERE (`column_3` = 1)


statement ok
DELETE FROM `table_5` WHERE (`column_3` = 2)


statement ok
DELETE FROM `table_5` WHERE (`column_3` = 3)


statement ok
DELETE FROM `table_5` WHERE (`column_3` = 4)


statement ok
DELETE FROM `table_3` WHERE (`column_4` = 0)


statement ok
DELETE FROM `table_3` WHERE (`column_4` = 1)


statement ok
DELETE FROM `table_3` WHERE (`column_4` = 2)


statement ok
DELETE FROM `table_3` WHERE (`column_4` = 3)


statement ok
DELETE FROM `table_3` WHERE (`column_4` = 4)


query  rowsort
SELECT `table_1`.`column_2` AS `alias_1`, `table_2`.`column_2` AS `alias_2` FROM `table_1` LEFT JOIN `table_2` ON (`table_1`.`column_1` = `table_2`.`column_1`)
----
-1099092898
NULL
-1587369447
NULL
-2102601630
NULL
-968743947
NULL
2062953824
NULL

query  rowsort
SELECT avg(`table_2`.`column_3`) AS `alias_1` FROM `table_2`
----
-236828631.8000

query  rowsort
SELECT `table_2`.`column_3` AS `alias_1` FROM `table_2` WHERE (`table_2`.`column_3` > ?)
? = 10
----
1047855292
1204359659

query  rowsort
SELECT `table_2`.`column_4` AS `alias_1`, `table_3`.`column_2` AS `alias_2`, avg(`table_2`.`column_5`) AS `alias_3` FROM `table_2` LEFT JOIN `table_3` ON (`table_2`.`column_3` = `table_3`.`column_1`) GROUP BY `table_2`.`column_4`, `table_3`.`column_2`
----
-1254338718
NULL
-1564080884.0000
-2122181917
NULL
1390313921.0000
-732648123
NULL
1439567133.0000
2068154447
NULL
-369612736.0000
949602053
NULL
1464693959.0000

query  rowsort
SELECT `table_3`.`column_3` AS `alias_1`, `table_4`.`column_2` AS `alias_2` FROM `table_3` LEFT JOIN `table_4` ON (`table_3`.`column_2` = `table_4`.`column_1`) WHERE (`table_3`.`column_2` > ?)
? = 10
----
-1316282032
NULL
-1736610021
NULL
-940733518
NULL
1042626338
NULL
1328560865
NULL

query  rowsort
SELECT avg(`table_2`.`column_6`) AS `alias_1` FROM `table_2` WHERE (`table_2`.`column_2` > ?)
? = 10
----
-1176446845.6667

query  rowsort
SELECT `table_2`.`column_7` AS `alias_1`, `table_5`.`column_2` AS `alias_2`, avg(`table_2`.`column_8`) AS `alias_3` FROM `table_2` LEFT JOIN `table_5` ON (`table_2`.`column_2` = `table_5`.`column_1`) WHERE (`table_2`.`column_4` > ?) GROUP BY `table_2`.`column_7`, `table_5`.`column_2`
? = 10
----
-1387991589
NULL
1296628565.0000
390501567
NULL
-270993056.0000
