# Generated by:
#     target/debug/noria-logictest permute --compare-to mysql://root:noria@127.1/noria -d 3 -o logictests/generated/mysql/ --only range_param --random --include-deletes --rows-per-table 10 --subquery-depth 1

statement ok
CREATE TABLE `table_3` (`column_4` INT, `column_3` INT, `column_5` INT, `column_2` INT, `column_1` INT, PRIMARY KEY (`column_5`))


statement ok
CREATE TABLE `table_2` (`column_2` INT, `column_3` INT, `column_1` INT, PRIMARY KEY (`column_3`))


statement ok
CREATE TABLE `table_4` (`column_3` INT, `column_2` INT, `column_1` INT, PRIMARY KEY (`column_3`))


statement ok
CREATE TABLE `table_1` (`column_1` INT, `column_4` INT, `column_3` INT, `column_2` INT, PRIMARY KEY (`column_4`))


statement ok
CREATE TABLE `table_5` (`column_1` INT, `column_2` INT, `column_3` INT, PRIMARY KEY (`column_3`))


statement ok
INSERT INTO `table_3` (`column_4`, `column_3`, `column_5`, `column_2`, `column_1`) VALUES (-1090561297, 1893921319, 0, 2078464656, 1467821027), (-776888771, -1774141741, 1, -919690851, 1178163071), (-8668401, -1054825033, 2, 1918951198, -936498971), (569283097, -104745675, 3, -1197295904, -1379815409), (1910727513, -543320754, 4, 478399527, -493884256), (1615832431, -550780949, 5, 1284672685, 1079598798), (149273012, -1959459089, 6, 1370724501, -91020564), (-1916159842, -247250261, 7, 905815018, 1204603844), (-1864893722, 828922147, 8, 664293956, 382364576), (-50596345, -59927852, 9, -2144145348, -950450786)


statement ok
INSERT INTO `table_2` (`column_2`, `column_3`, `column_1`) VALUES (345025832, 0, 272629837), (-1421147599, 1, 547755385), (630963055, 2, -1635963441), (753457440, 3, 697860583), (-1575443055, 4, 534670656), (210828074, 5, -412756258), (1589300410, 6, 1882553183), (-1395792848, 7, -1896403562), (-1605419230, 8, 1665157028), (-1289730022, 9, 1407613012)


statement ok
INSERT INTO `table_4` (`column_3`, `column_2`, `column_1`) VALUES (0, 692453137, -733729530), (1, -1076464003, -192571343), (2, -202430851, -2075415871), (3, 1156335142, -1542052424), (4, -1685432569, 777710346), (5, 1728156053, 1058625141), (6, -1253096900, -787616309), (7, -1632820022, 1792458956), (8, 964900, -769538351), (9, 947759579, -385113382)


statement ok
INSERT INTO `table_1` (`column_1`, `column_4`, `column_3`, `column_2`) VALUES (142436266, 0, -739061856, 1561495760), (-1677793033, 1, 1155606708, -1659855815), (796896205, 2, 729059866, 238409465), (-1735902768, 3, 939440771, 150400966), (-1138756373, 4, -1112696642, -362754882), (1108414689, 5, -2003832413, -1871234388), (-1647200958, 6, -31526347, 951402669), (959145206, 7, -1745797838, 1418768944), (-812768313, 8, -886238680, 1891004143), (366275253, 9, -98837563, 976074868)


statement ok
INSERT INTO `table_5` (`column_1`, `column_2`, `column_3`) VALUES (1377741893, -178016166, 0), (-164518411, 160588316, 1), (-672455788, -1771825807, 2), (1657103681, -1775026034, 3), (-157724332, -309293731, 4), (942709631, 1496103187, 5), (574229295, 1533741453, 6), (-417937796, 571093408, 7), (-759708985, 1001736441, 8), (1670019527, 788177903, 9)


query  rowsort
SELECT `table_1`.`column_2` AS `alias_1`, `table_2`.`column_2` AS `alias_2` FROM `table_1` LEFT JOIN `table_2` ON (`table_1`.`column_1` = `table_2`.`column_1`)
----
-1659855815
NULL
-1871234388
NULL
-362754882
NULL
1418768944
NULL
150400966
NULL
1561495760
NULL
1891004143
NULL
238409465
NULL
951402669
NULL
976074868
NULL

query  rowsort
SELECT `table_1`.`column_1` AS `alias_1` FROM `table_1` WHERE (`table_1`.`column_1` = ?)
? = 1
----


query  rowsort
SELECT `table_1`.`column_1` AS `alias_1` FROM `table_1` WHERE (`table_1`.`column_1` > ?)
? = 10
----
1108414689
142436266
366275253
796896205
959145206

query  rowsort
SELECT `table_1`.`column_3` AS `alias_1`, `table_3`.`column_2` AS `alias_2` FROM `table_1` LEFT JOIN `table_3` ON (`table_1`.`column_1` = `table_3`.`column_1`) WHERE (`table_1`.`column_3` = ?)
? = 1
----


query  rowsort
SELECT `table_3`.`column_3` AS `alias_1`, `table_4`.`column_2` AS `alias_2` FROM `table_3` LEFT JOIN `table_4` ON (`table_3`.`column_2` = `table_4`.`column_1`) WHERE (`table_3`.`column_2` > ?)
? = 10
----
-1054825033
NULL
-1959459089
NULL
-247250261
NULL
-543320754
NULL
-550780949
NULL
1893921319
NULL
828922147
NULL

query  rowsort
SELECT `table_3`.`column_2` AS `alias_1` FROM `table_3` WHERE ((`table_3`.`column_2` = ?) AND (`table_3`.`column_2` > ?))
? = 1
? = 10
----


query  rowsort
SELECT `table_3`.`column_4` AS `alias_1`, `table_5`.`column_2` AS `alias_2` FROM `table_3` LEFT JOIN `table_5` ON (`table_3`.`column_2` = `table_5`.`column_1`) WHERE ((`table_3`.`column_4` = ?) AND (`table_3`.`column_4` > ?))
? = 1
? = 10
----


statement ok
DELETE FROM `table_3` WHERE (`column_5` = 0)


statement ok
DELETE FROM `table_3` WHERE (`column_5` = 1)


statement ok
DELETE FROM `table_3` WHERE (`column_5` = 2)


statement ok
DELETE FROM `table_3` WHERE (`column_5` = 3)


statement ok
DELETE FROM `table_3` WHERE (`column_5` = 4)


statement ok
DELETE FROM `table_2` WHERE (`column_3` = 0)


statement ok
DELETE FROM `table_2` WHERE (`column_3` = 1)


statement ok
DELETE FROM `table_2` WHERE (`column_3` = 2)


statement ok
DELETE FROM `table_2` WHERE (`column_3` = 3)


statement ok
DELETE FROM `table_2` WHERE (`column_3` = 4)


statement ok
DELETE FROM `table_4` WHERE (`column_3` = 0)


statement ok
DELETE FROM `table_4` WHERE (`column_3` = 1)


statement ok
DELETE FROM `table_4` WHERE (`column_3` = 2)


statement ok
DELETE FROM `table_4` WHERE (`column_3` = 3)


statement ok
DELETE FROM `table_4` WHERE (`column_3` = 4)


statement ok
DELETE FROM `table_1` WHERE (`column_4` = 0)


statement ok
DELETE FROM `table_1` WHERE (`column_4` = 1)


statement ok
DELETE FROM `table_1` WHERE (`column_4` = 2)


statement ok
DELETE FROM `table_1` WHERE (`column_4` = 3)


statement ok
DELETE FROM `table_1` WHERE (`column_4` = 4)


statement ok
DELETE FROM `table_5` WHERE (`column_3` = 0)


statement ok
DELETE FROM `table_5` WHERE (`column_3` = 1)


statement ok
DELETE FROM `table_5` WHERE (`column_3` = 2)


statement ok
DELETE FROM `table_5` WHERE (`column_3` = 3)


statement ok
DELETE FROM `table_5` WHERE (`column_3` = 4)


query  rowsort
SELECT `table_1`.`column_2` AS `alias_1`, `table_2`.`column_2` AS `alias_2` FROM `table_1` LEFT JOIN `table_2` ON (`table_1`.`column_1` = `table_2`.`column_1`)
----
-1871234388
NULL
1418768944
NULL
1891004143
NULL
951402669
NULL
976074868
NULL

query  rowsort
SELECT `table_1`.`column_1` AS `alias_1` FROM `table_1` WHERE (`table_1`.`column_1` = ?)
? = 1
----


query  rowsort
SELECT `table_1`.`column_1` AS `alias_1` FROM `table_1` WHERE (`table_1`.`column_1` > ?)
? = 10
----
1108414689
366275253
959145206

query  rowsort
SELECT `table_1`.`column_3` AS `alias_1`, `table_3`.`column_2` AS `alias_2` FROM `table_1` LEFT JOIN `table_3` ON (`table_1`.`column_1` = `table_3`.`column_1`) WHERE (`table_1`.`column_3` = ?)
? = 1
----


query  rowsort
SELECT `table_3`.`column_3` AS `alias_1`, `table_4`.`column_2` AS `alias_2` FROM `table_3` LEFT JOIN `table_4` ON (`table_3`.`column_2` = `table_4`.`column_1`) WHERE (`table_3`.`column_2` > ?)
? = 10
----
-1959459089
NULL
-247250261
NULL
-550780949
NULL
828922147
NULL

query  rowsort
SELECT `table_3`.`column_2` AS `alias_1` FROM `table_3` WHERE ((`table_3`.`column_2` = ?) AND (`table_3`.`column_2` > ?))
? = 1
? = 10
----


query  rowsort
SELECT `table_3`.`column_4` AS `alias_1`, `table_5`.`column_2` AS `alias_2` FROM `table_3` LEFT JOIN `table_5` ON (`table_3`.`column_2` = `table_5`.`column_1`) WHERE ((`table_3`.`column_4` = ?) AND (`table_3`.`column_4` > ?))
? = 1
? = 10
----

