# Generated by:
#     target/debug/noria-logictest generate --operations min,cte --compare-to mysql://root@localhost/mysql --subquery-depth 1 --rows-per-table 5 -o logictests/generated/min,cte.test --include-deletes
# failure: ENG-341

statement ok
CREATE TABLE table_1 (column_3 INT(32), column_1 INT(32), column_2 INT(32), PRIMARY KEY (column_3))


statement ok
INSERT INTO table_1 (column_2, column_3, column_1) VALUES (1, 2, 1), (1, 3, 1), (1, 4, 1), (1, 5, 1), (1, 6, 1)


query  nosort
WITH alias_3 AS (SELECT min(table_1.column_2) AS alias_2 FROM table_1) SELECT min(table_1.column_1) AS alias_1 FROM table_1 INNER JOIN alias_3 ON (table_1.column_1 = alias_3.alias_2)
----
1

statement ok
DELETE FROM table_1 WHERE (column_3 = 2)


statement ok
DELETE FROM table_1 WHERE (column_3 = 3)


query  nosort
WITH alias_3 AS (SELECT min(table_1.column_2) AS alias_2 FROM table_1) SELECT min(table_1.column_1) AS alias_1 FROM table_1 INNER JOIN alias_3 ON (table_1.column_1 = alias_3.alias_2)
----
1
