# Generated by:
#     target/debug/noria-logictest permute -d 3 -o logictests/generated/mysql --only in_parameter --compare-to mysql://root:noria@localhost/mysql --subquery-depth 1 --rows-per-table 5 --include-deletes --overwrite-tests

statement ok
CREATE TABLE table_4 (column_1 INT, column_2 INT, column_4 INT, column_3 INT, PRIMARY KEY (column_4))


statement ok
CREATE TABLE table_1 (column_1 INT, column_3 INT, column_2 INT, PRIMARY KEY (column_3))


statement ok
CREATE TABLE table_2 (column_1 INT, column_3 INT, column_2 INT, column_5 INT, column_4 INT, PRIMARY KEY (column_5))


statement ok
CREATE TABLE table_3 (column_1 INT, column_3 INT, column_2 INT, PRIMARY KEY (column_3))


statement ok
CREATE TABLE table_5 (column_3 INT, column_2 INT, column_1 INT, PRIMARY KEY (column_3))


statement ok
INSERT INTO table_4 (column_1, column_2, column_4, column_3) VALUES (0, 1, 0, 1), (1, 1, 1, 1), (1, 1, 2, 1), (1, 1, 3, 1), (2, 1, 4, 1)


statement ok
INSERT INTO table_1 (column_1, column_3, column_2) VALUES (1, 0, 1), (1, 1, 1), (1, 2, 1), (1, 3, 1), (1, 4, 1)


statement ok
INSERT INTO table_2 (column_1, column_3, column_2, column_5, column_4) VALUES (2, 1, 1, 0, 1), (1, 1, 1, 1, 1), (0, 0, 1, 2, 1), (1, 1, 1, 3, 1), (1, 2, 1, 4, 1)


statement ok
INSERT INTO table_3 (column_1, column_3, column_2) VALUES (1, 0, 1), (1, 1, 1), (1, 2, 1), (1, 3, 1), (1, 4, 1)


statement ok
INSERT INTO table_5 (column_3, column_2, column_1) VALUES (0, 1, 1), (1, 1, 1), (2, 1, 1), (3, 1, 1), (4, 1, 1)


query  rowsort
SELECT table_1.column_1 AS alias_1 FROM table_1 WHERE ((table_1.column_1 = ?) AND (table_1.column_1 = ?))
? = 1
? = 1
----
1
1
1
1
1

query  rowsort
SELECT table_1.column_2 AS alias_1, table_2.column_2 AS alias_2 FROM table_1 INNER JOIN table_2 ON (table_1.column_1 = table_2.column_1)
----
30 values hashing to 56a22a5394edccfc958048b005afa27b

query  rowsort
SELECT table_2.column_1 AS alias_1 FROM table_2 WHERE table_2.column_1 IN (?, ?, ?)
? = 0
? = 1
? = 2
----
0
1
1
1
2

query  rowsort
SELECT table_2.column_3 AS alias_1, table_3.column_2 AS alias_2 FROM table_2 INNER JOIN table_3 ON (table_2.column_1 = table_3.column_1) WHERE ((table_2.column_1 = ?) AND (table_2.column_1 = ?))
? = 1
? = 1
----
30 values hashing to d6a35598c9ef197171a2e1ca7598ccbd

query  rowsort
SELECT table_2.column_3 AS alias_1 FROM table_2 WHERE (((table_2.column_3 = ?) AND (table_2.column_3 = ?)) AND table_2.column_3 IN (?, ?, ?))
? = 1
? = 1
? = 0
? = 1
? = 2
----
1
1
1

query  rowsort
SELECT table_2.column_4 AS alias_1, table_4.column_2 AS alias_2 FROM table_2 INNER JOIN table_4 ON (table_2.column_3 = table_4.column_1) WHERE table_2.column_1 IN (?, ?, ?)
? = 0
? = 1
? = 2
----
22 values hashing to 657a50526dcb0a169c97bdcbbce0e11f

query  rowsort
SELECT table_4.column_3 AS alias_1, table_5.column_2 AS alias_2 FROM table_4 INNER JOIN table_5 ON (table_4.column_1 = table_5.column_1) WHERE (((table_4.column_1 = ?) AND (table_4.column_1 = ?)) AND table_4.column_1 IN (?, ?, ?))
? = 1
? = 1
? = 0
? = 1
? = 2
----
30 values hashing to 56a22a5394edccfc958048b005afa27b

statement ok
DELETE FROM table_4 WHERE (column_4 = 0)


statement ok
DELETE FROM table_4 WHERE (column_4 = 1)


statement ok
DELETE FROM table_1 WHERE (column_3 = 0)


statement ok
DELETE FROM table_1 WHERE (column_3 = 1)


statement ok
DELETE FROM table_2 WHERE (column_5 = 0)


statement ok
DELETE FROM table_2 WHERE (column_5 = 1)


statement ok
DELETE FROM table_3 WHERE (column_3 = 0)


statement ok
DELETE FROM table_3 WHERE (column_3 = 1)


statement ok
DELETE FROM table_5 WHERE (column_3 = 0)


statement ok
DELETE FROM table_5 WHERE (column_3 = 1)


query  rowsort
SELECT table_1.column_1 AS alias_1 FROM table_1 WHERE ((table_1.column_1 = ?) AND (table_1.column_1 = ?))
? = 1
? = 1
----
1
1
1

query  rowsort
SELECT table_1.column_2 AS alias_1, table_2.column_2 AS alias_2 FROM table_1 INNER JOIN table_2 ON (table_1.column_1 = table_2.column_1)
----
1
1
1
1
1
1
1
1
1
1
1
1

query  rowsort
SELECT table_2.column_1 AS alias_1 FROM table_2 WHERE table_2.column_1 IN (?, ?, ?)
? = 0
? = 1
? = 2
----
0
1
1

query  rowsort
SELECT table_2.column_3 AS alias_1, table_3.column_2 AS alias_2 FROM table_2 INNER JOIN table_3 ON (table_2.column_1 = table_3.column_1) WHERE ((table_2.column_1 = ?) AND (table_2.column_1 = ?))
? = 1
? = 1
----
1
1
1
1
1
1
2
1
2
1
2
1

query  rowsort
SELECT table_2.column_3 AS alias_1 FROM table_2 WHERE (((table_2.column_3 = ?) AND (table_2.column_3 = ?)) AND table_2.column_3 IN (?, ?, ?))
? = 1
? = 1
? = 0
? = 1
? = 2
----
1

query  rowsort
SELECT table_2.column_4 AS alias_1, table_4.column_2 AS alias_2 FROM table_2 INNER JOIN table_4 ON (table_2.column_3 = table_4.column_1) WHERE table_2.column_1 IN (?, ?, ?)
? = 0
? = 1
? = 2
----
1
1
1
1
1
1

query  rowsort
SELECT table_4.column_3 AS alias_1, table_5.column_2 AS alias_2 FROM table_4 INNER JOIN table_5 ON (table_4.column_1 = table_5.column_1) WHERE (((table_4.column_1 = ?) AND (table_4.column_1 = ?)) AND table_4.column_1 IN (?, ?, ?))
? = 1
? = 1
? = 0
? = 1
? = 2
----
1
1
1
1
1
1
1
1
1
1
1
1
