# Generated by:
#     target/debug/noria-logictest permute --compare-to mysql://root:noria@127.1/noria -d 3 -o logictests/generated/mysql/ --only range_param --random --include-deletes --rows-per-table 10 --subquery-depth 1

statement ok
CREATE TABLE `table_1` (`column_2` INT, `column_5` INT, `column_1` INT, `column_6` INT, `column_4` INT, `column_3` INT, PRIMARY KEY (`column_6`))


statement ok
INSERT INTO `table_1` (`column_2`, `column_5`, `column_1`, `column_6`, `column_4`, `column_3`) VALUES (1447646508, 1288373046, -337254814, 0, -1691727806, 1449831744), (1654263473, -922495360, 1281060471, 1, 248073252, -485556118), (1795963052, 1697980984, 1235130054, 2, -1458409923, 1666504083), (-1898151702, 563352584, 184476440, 3, -1312116446, 1054483587), (1723157997, -1687977254, 60482432, 4, -339221622, 1167219417), (-891177591, -1009922863, 1207410826, 5, 1778093652, 1670290236), (-359893038, 1917831936, -1122646982, 6, 1833029477, 1680540323), (1991454021, 466403397, -346026811, 7, 1841187903, -2019543484), (392121404, 1631301379, -21825282, 8, 1232216791, -1489025401), (632260098, -1890097553, 1618832527, 9, 931551117, -2041108629)


query  rowsort
SELECT `table_1`.`column_1` AS `alias_1` FROM `table_1` WHERE ((`table_1`.`column_1` > ?) AND (`table_1`.`column_1` > ?))
? = 10
? = 10
----
1207410826
1235130054
1281060471
1618832527
184476440
60482432

query  rowsort
SELECT avg(`table_1`.`column_2`) AS `alias_1` FROM `table_1`
----
648764422.2000

query  rowsort
SELECT `table_1`.`column_2` AS `alias_1` FROM `table_1` WHERE (`table_1`.`column_2` > ?)
? = 10
----
1447646508
1654263473
1723157997
1795963052
1991454021
392121404
632260098

query  rowsort
SELECT avg(`table_1`.`column_3`) AS `alias_1` FROM `table_1` WHERE ((`table_1`.`column_2` > ?) AND (`table_1`.`column_2` > ?))
? = 10
? = 10
----
-250239769.7143

query  rowsort
SELECT `table_1`.`column_2` AS `alias_1` FROM `table_1` WHERE (((`table_1`.`column_2` > ?) AND (`table_1`.`column_2` > ?)) AND (`table_1`.`column_2` > ?))
? = 10
? = 10
? = 10
----
1447646508
1654263473
1723157997
1795963052
1991454021
392121404
632260098

query  rowsort
SELECT avg(`table_1`.`column_4`) AS `alias_1` FROM `table_1` WHERE (`table_1`.`column_2` > ?)
? = 10
----
109095673.1429

query  rowsort
SELECT avg(`table_1`.`column_5`) AS `alias_1` FROM `table_1` WHERE (((`table_1`.`column_2` > ?) AND (`table_1`.`column_2` > ?)) AND (`table_1`.`column_2` > ?))
? = 10
? = 10
? = 10
----
83355519.8571

statement ok
DELETE FROM `table_1` WHERE (`column_6` = 0)


statement ok
DELETE FROM `table_1` WHERE (`column_6` = 1)


statement ok
DELETE FROM `table_1` WHERE (`column_6` = 2)


statement ok
DELETE FROM `table_1` WHERE (`column_6` = 3)


statement ok
DELETE FROM `table_1` WHERE (`column_6` = 4)


query  rowsort
SELECT `table_1`.`column_1` AS `alias_1` FROM `table_1` WHERE ((`table_1`.`column_1` > ?) AND (`table_1`.`column_1` > ?))
? = 10
? = 10
----
1207410826
1618832527

query  rowsort
SELECT avg(`table_1`.`column_2`) AS `alias_1` FROM `table_1`
----
352952978.8000

query  rowsort
SELECT `table_1`.`column_2` AS `alias_1` FROM `table_1` WHERE (`table_1`.`column_2` > ?)
? = 10
----
1991454021
392121404
632260098

query  rowsort
SELECT avg(`table_1`.`column_3`) AS `alias_1` FROM `table_1` WHERE ((`table_1`.`column_2` > ?) AND (`table_1`.`column_2` > ?))
? = 10
? = 10
----
-1849892504.6667

query  rowsort
SELECT `table_1`.`column_2` AS `alias_1` FROM `table_1` WHERE (((`table_1`.`column_2` > ?) AND (`table_1`.`column_2` > ?)) AND (`table_1`.`column_2` > ?))
? = 10
? = 10
? = 10
----
1991454021
392121404
632260098

query  rowsort
SELECT avg(`table_1`.`column_4`) AS `alias_1` FROM `table_1` WHERE (`table_1`.`column_2` > ?)
? = 10
----
1334985270.3333

query  rowsort
SELECT avg(`table_1`.`column_5`) AS `alias_1` FROM `table_1` WHERE (((`table_1`.`column_2` > ?) AND (`table_1`.`column_2` > ?)) AND (`table_1`.`column_2` > ?))
? = 10
? = 10
? = 10
----
69202407.6667
