# Generated by:
#     target/debug/noria-logictest permute --compare-to mysql://root:noria@127.1/noria -d 3 -o logictests/generated/mysql/ --only range_param --random --include-deletes --rows-per-table 10 --subquery-depth 1

statement ok
CREATE TABLE `table_1` (`column_2` INT, `column_5` INT, `column_1` INT, `column_3` INT, `column_4` INT, PRIMARY KEY (`column_5`))


statement ok
INSERT INTO `table_1` (`column_2`, `column_5`, `column_1`, `column_3`, `column_4`) VALUES (1492072399, 0, -487383364, 1087442314, 431072917), (-759915185, 1, -2094942152, 826967220, -778659197), (-433503654, 2, -1579985277, -94181293, 965461613), (1211381335, 3, -1377831888, -1040365296, 2140666195), (1765738736, 4, -77765396, 2033704760, -519127629), (-802439503, 5, 170395866, 274696383, 150602269), (-1503935045, 6, 1252055307, 111294531, 27643360), (-1252407736, 7, 346940319, -103023762, -1423798982), (1204527244, 8, 1557532729, 152826549, 114802752), (1814854950, 9, 2035297162, 514160700, -312253950)


query  rowsort
SELECT 1 AS `alias_1`
----
1

query  rowsort
SELECT min(`table_1`.`column_1`) AS `alias_1` FROM `table_1`
----
-2094942152

query  rowsort
SELECT `table_1`.`column_1` AS `alias_1` FROM `table_1` WHERE (`table_1`.`column_1` > ?)
? = 10
----
1252055307
1557532729
170395866
2035297162
346940319

query  rowsort
SELECT 1 AS `alias_1`, min(`table_1`.`column_2`) AS `alias_2` FROM `table_1`
----
1
-1503935045

query  rowsort
SELECT 1 AS `alias_1` FROM `table_1` WHERE (`table_1`.`column_2` > ?)
? = 10
----
1
1
1
1
1

query  rowsort
SELECT min(`table_1`.`column_3`) AS `alias_1` FROM `table_1` WHERE (`table_1`.`column_2` > ?)
? = 10
----
-1040365296

query  rowsort
SELECT 1 AS `alias_1`, min(`table_1`.`column_4`) AS `alias_2` FROM `table_1` WHERE (`table_1`.`column_2` > ?)
? = 10
----
1
-519127629

statement ok
DELETE FROM `table_1` WHERE (`column_5` = 0)


statement ok
DELETE FROM `table_1` WHERE (`column_5` = 1)


statement ok
DELETE FROM `table_1` WHERE (`column_5` = 2)


statement ok
DELETE FROM `table_1` WHERE (`column_5` = 3)


statement ok
DELETE FROM `table_1` WHERE (`column_5` = 4)


query  rowsort
SELECT 1 AS `alias_1`
----
1

query  rowsort
SELECT min(`table_1`.`column_1`) AS `alias_1` FROM `table_1`
----
170395866

query  rowsort
SELECT `table_1`.`column_1` AS `alias_1` FROM `table_1` WHERE (`table_1`.`column_1` > ?)
? = 10
----
1252055307
1557532729
170395866
2035297162
346940319

query  rowsort
SELECT 1 AS `alias_1`, min(`table_1`.`column_2`) AS `alias_2` FROM `table_1`
----
1
-1503935045

query  rowsort
SELECT 1 AS `alias_1` FROM `table_1` WHERE (`table_1`.`column_2` > ?)
? = 10
----
1
1

query  rowsort
SELECT min(`table_1`.`column_3`) AS `alias_1` FROM `table_1` WHERE (`table_1`.`column_2` > ?)
? = 10
----
152826549

query  rowsort
SELECT 1 AS `alias_1`, min(`table_1`.`column_4`) AS `alias_2` FROM `table_1` WHERE (`table_1`.`column_2` > ?)
? = 10
----
1
-312253950
