# Generated by:
#     target/debug/noria-logictest permute --compare-to mysql://root:noria@127.1/noria -d 3 -o logictests/generated/mysql/ --only range_param --random --include-deletes --rows-per-table 10 --subquery-depth 1

statement ok
CREATE TABLE `table_5` (`column_3` INT, `column_1` INT, `column_2` INT, PRIMARY KEY (`column_3`))


statement ok
CREATE TABLE `table_3` (`column_1` INT, `column_4` INT, `column_3` INT, `column_2` INT, `column_5` INT, PRIMARY KEY (`column_5`))


statement ok
CREATE TABLE `table_1` (`column_2` INT, `column_1` INT, `column_3` INT, PRIMARY KEY (`column_3`))


statement ok
CREATE TABLE `table_2` (`column_1` INT, `column_2` INT, `column_4` INT, `column_3` INT, PRIMARY KEY (`column_4`))


statement ok
CREATE TABLE `table_4` (`column_3` INT, `column_1` INT, `column_2` INT, PRIMARY KEY (`column_3`))


statement ok
INSERT INTO `table_5` (`column_3`, `column_1`, `column_2`) VALUES (0, -1542081374, 187586295), (1, -1418629082, 991064014), (2, -2052179020, 1245706198), (3, 1007344103, -1036454515), (4, -1448843261, -2039671495), (5, 1143819419, 2081468248), (6, -1680905301, -337123745), (7, 519607215, -215041323), (8, -1369434498, -1255147652), (9, 1195703082, -733837962)


statement ok
INSERT INTO `table_3` (`column_1`, `column_4`, `column_3`, `column_2`, `column_5`) VALUES (581299625, 63333434, 470671202, 1452607031, 0), (1796436051, 429857572, -1051656719, 1638161272, 1), (497841728, 100522095, 697854987, 2092763241, 2), (-1019786032, 1257693118, -1315199391, -49559613, 3), (-1072207242, 824093251, 1019882644, 1455240214, 4), (-1549504664, -1263396498, -747149290, -1679958149, 5), (-1247067815, -126261983, -818374968, 490086538, 6), (1602383932, 1261268498, -904764165, 23173397, 7), (337295212, 1173281487, -217031267, 100255733, 8), (-206120266, 1871562421, -1786128681, -1026144971, 9)


statement ok
INSERT INTO `table_1` (`column_2`, `column_1`, `column_3`) VALUES (-799497815, 1262470777, 0), (1832388881, 2073774068, 1), (-808764707, 1684171061, 2), (183726378, 1246458501, 3), (1731469592, 2060878168, 4), (272349412, 722734536, 5), (-1146333253, -1552164986, 6), (-1774003005, 498823127, 7), (-855450062, -414345415, 8), (1002862928, -48035257, 9)


statement ok
INSERT INTO `table_2` (`column_1`, `column_2`, `column_4`, `column_3`) VALUES (1165405160, -1849454496, 0, -102548048), (364724160, 2021115703, 1, 1546263668), (-531923789, -349197038, 2, 1339002469), (1598956253, -618219965, 3, 1191634117), (-944299520, -45140968, 4, -971413019), (-1164114726, 451885340, 5, 1095133828), (-425607186, -1560838919, 6, -402918104), (-519492577, 42250795, 7, 616315312), (-364510594, -658878493, 8, 766048666), (703564166, -1855502015, 9, -627360912)


statement ok
INSERT INTO `table_4` (`column_3`, `column_1`, `column_2`) VALUES (0, -91275102, -1125538265), (1, -909070634, 1008008260), (2, 127567934, -1644950570), (3, 1213960185, -1636568740), (4, 1931845322, -824730440), (5, 429322268, 1831022499), (6, -391980182, 1473129039), (7, 1529154997, -1914174878), (8, 146605135, 682341923), (9, -116591145, -426425370)


query  rowsort
SELECT 1 AS `alias_1`
----
1

query  rowsort
SELECT `table_1`.`column_2` AS `alias_1`, `table_2`.`column_2` AS `alias_2` FROM `table_1` INNER JOIN `table_2` ON (`table_1`.`column_1` = `table_2`.`column_1`)
----


query  rowsort
SELECT `table_2`.`column_1` AS `alias_1` FROM `table_2` WHERE (`table_2`.`column_1` > ?)
? = 10
----
1165405160
1598956253
364724160
703564166

query  rowsort
SELECT 1 AS `alias_1`, `table_2`.`column_3` AS `alias_2`, `table_3`.`column_2` AS `alias_3` FROM `table_2` INNER JOIN `table_3` ON (`table_2`.`column_1` = `table_3`.`column_1`)
----


query  rowsort
SELECT 1 AS `alias_1` FROM `table_3` WHERE (`table_3`.`column_1` > ?)
? = 10
----
1
1
1
1
1

query  rowsort
SELECT `table_3`.`column_3` AS `alias_1`, `table_4`.`column_2` AS `alias_2` FROM `table_3` INNER JOIN `table_4` ON (`table_3`.`column_1` = `table_4`.`column_1`) WHERE (`table_3`.`column_3` > ?)
? = 10
----


query  rowsort
SELECT 1 AS `alias_1`, `table_3`.`column_4` AS `alias_2`, `table_5`.`column_2` AS `alias_3` FROM `table_3` INNER JOIN `table_5` ON (`table_3`.`column_3` = `table_5`.`column_1`) WHERE (`table_3`.`column_1` > ?)
? = 10
----


statement ok
DELETE FROM `table_5` WHERE (`column_3` = 0)


statement ok
DELETE FROM `table_5` WHERE (`column_3` = 1)


statement ok
DELETE FROM `table_5` WHERE (`column_3` = 2)


statement ok
DELETE FROM `table_5` WHERE (`column_3` = 3)


statement ok
DELETE FROM `table_5` WHERE (`column_3` = 4)


statement ok
DELETE FROM `table_3` WHERE (`column_5` = 0)


statement ok
DELETE FROM `table_3` WHERE (`column_5` = 1)


statement ok
DELETE FROM `table_3` WHERE (`column_5` = 2)


statement ok
DELETE FROM `table_3` WHERE (`column_5` = 3)


statement ok
DELETE FROM `table_3` WHERE (`column_5` = 4)


statement ok
DELETE FROM `table_1` WHERE (`column_3` = 0)


statement ok
DELETE FROM `table_1` WHERE (`column_3` = 1)


statement ok
DELETE FROM `table_1` WHERE (`column_3` = 2)


statement ok
DELETE FROM `table_1` WHERE (`column_3` = 3)


statement ok
DELETE FROM `table_1` WHERE (`column_3` = 4)


statement ok
DELETE FROM `table_2` WHERE (`column_4` = 0)


statement ok
DELETE FROM `table_2` WHERE (`column_4` = 1)


statement ok
DELETE FROM `table_2` WHERE (`column_4` = 2)


statement ok
DELETE FROM `table_2` WHERE (`column_4` = 3)


statement ok
DELETE FROM `table_2` WHERE (`column_4` = 4)


statement ok
DELETE FROM `table_4` WHERE (`column_3` = 0)


statement ok
DELETE FROM `table_4` WHERE (`column_3` = 1)


statement ok
DELETE FROM `table_4` WHERE (`column_3` = 2)


statement ok
DELETE FROM `table_4` WHERE (`column_3` = 3)


statement ok
DELETE FROM `table_4` WHERE (`column_3` = 4)


query  rowsort
SELECT 1 AS `alias_1`
----
1

query  rowsort
SELECT `table_1`.`column_2` AS `alias_1`, `table_2`.`column_2` AS `alias_2` FROM `table_1` INNER JOIN `table_2` ON (`table_1`.`column_1` = `table_2`.`column_1`)
----


query  rowsort
SELECT `table_2`.`column_1` AS `alias_1` FROM `table_2` WHERE (`table_2`.`column_1` > ?)
? = 10
----
703564166

query  rowsort
SELECT 1 AS `alias_1`, `table_2`.`column_3` AS `alias_2`, `table_3`.`column_2` AS `alias_3` FROM `table_2` INNER JOIN `table_3` ON (`table_2`.`column_1` = `table_3`.`column_1`)
----


query  rowsort
SELECT 1 AS `alias_1` FROM `table_3` WHERE (`table_3`.`column_1` > ?)
? = 10
----
1
1

query  rowsort
SELECT `table_3`.`column_3` AS `alias_1`, `table_4`.`column_2` AS `alias_2` FROM `table_3` INNER JOIN `table_4` ON (`table_3`.`column_1` = `table_4`.`column_1`) WHERE (`table_3`.`column_3` > ?)
? = 10
----


query  rowsort
SELECT 1 AS `alias_1`, `table_3`.`column_4` AS `alias_2`, `table_5`.`column_2` AS `alias_3` FROM `table_3` INNER JOIN `table_5` ON (`table_3`.`column_3` = `table_5`.`column_1`) WHERE (`table_3`.`column_1` > ?)
? = 10
----

