# Generated by:
#     target/debug/noria-logictest permute --compare-to mysql://root:noria@127.1/noria -d 3 -o logictests/generated/mysql/ --only range_param --random --include-deletes --rows-per-table 10 --subquery-depth 1

statement ok
CREATE TABLE `table_1` (`column_6` INT, `column_5` INT, `column_3` INT, `column_1` INT, `column_2` INT, `column_4` INT, PRIMARY KEY (`column_6`))


statement ok
INSERT INTO `table_1` (`column_6`, `column_5`, `column_3`, `column_1`, `column_2`, `column_4`) VALUES (0, -1569475851, 894687739, -1174717942, -1342639803, -154167813), (1, -2079684247, 620169560, 2043239749, -1314026455, 1497117966), (2, -63927493, 765136098, -1051151145, -1588340145, 911867832), (3, 1618501037, 2120581536, 404296820, -2077131262, -711564819), (4, -841583489, -1935388972, -1548334585, 1218565604, -1948446137), (5, 1995637452, -1285216179, 248983134, -2043497933, -1896287196), (6, -1717570165, 2062478292, 2137200508, -1033067908, -1047300072), (7, -1742155235, 790572529, 1071399261, -1830856946, -1513999585), (8, 1186456021, -363488694, -34287885, 596510465, -1900329092), (9, 158473979, -425991507, -156698695, 177161575, -165578858)


query  rowsort
SELECT `table_1`.`column_1` AS `alias_1` FROM `table_1` WHERE (`table_1`.`column_1` > ?)
? = 10
----
1071399261
2043239749
2137200508
248983134
404296820

query  rowsort
SELECT sum(distinct `table_1`.`column_2`) AS `alias_1` FROM `table_1`
----
-9237322808

query  rowsort
SELECT `table_1`.`column_1` AS `alias_1` FROM `table_1` WHERE (`table_1`.`column_1` > ?)
? = 10
----
1071399261
2043239749
2137200508
248983134
404296820

query  rowsort
SELECT sum(distinct `table_1`.`column_3`) AS `alias_1` FROM `table_1` WHERE (`table_1`.`column_1` > ?)
? = 10
----
4308585738

query  rowsort
SELECT `table_1`.`column_1` AS `alias_1` FROM `table_1` WHERE ((`table_1`.`column_1` > ?) AND (`table_1`.`column_1` > ?))
? = 10
? = 10
----
1071399261
2043239749
2137200508
248983134
404296820

query  rowsort
SELECT sum(distinct `table_1`.`column_4`) AS `alias_1` FROM `table_1` WHERE (`table_1`.`column_3` > ?)
? = 10
----
-1018046491

query  rowsort
SELECT sum(distinct `table_1`.`column_5`) AS `alias_1` FROM `table_1` WHERE ((`table_1`.`column_3` > ?) AND (`table_1`.`column_5` > ?))
? = 10
? = 10
----
1618501037

statement ok
DELETE FROM `table_1` WHERE (`column_6` = 0)


statement ok
DELETE FROM `table_1` WHERE (`column_6` = 1)


statement ok
DELETE FROM `table_1` WHERE (`column_6` = 2)


statement ok
DELETE FROM `table_1` WHERE (`column_6` = 3)


statement ok
DELETE FROM `table_1` WHERE (`column_6` = 4)


query  rowsort
SELECT `table_1`.`column_1` AS `alias_1` FROM `table_1` WHERE (`table_1`.`column_1` > ?)
? = 10
----
1071399261
2137200508
248983134

query  rowsort
SELECT sum(distinct `table_1`.`column_2`) AS `alias_1` FROM `table_1`
----
-4133750747

query  rowsort
SELECT `table_1`.`column_1` AS `alias_1` FROM `table_1` WHERE (`table_1`.`column_1` > ?)
? = 10
----
1071399261
2137200508
248983134

query  rowsort
SELECT sum(distinct `table_1`.`column_3`) AS `alias_1` FROM `table_1` WHERE (`table_1`.`column_1` > ?)
? = 10
----
1567834642

query  rowsort
SELECT `table_1`.`column_1` AS `alias_1` FROM `table_1` WHERE ((`table_1`.`column_1` > ?) AND (`table_1`.`column_1` > ?))
? = 10
? = 10
----
1071399261
2137200508
248983134

query  rowsort
SELECT sum(distinct `table_1`.`column_4`) AS `alias_1` FROM `table_1` WHERE (`table_1`.`column_3` > ?)
? = 10
----
-2561299657

query  rowsort
SELECT sum(distinct `table_1`.`column_5`) AS `alias_1` FROM `table_1` WHERE ((`table_1`.`column_3` > ?) AND (`table_1`.`column_5` > ?))
? = 10
? = 10
----
NULL
