# Generated by:
#     target/debug/noria-logictest permute --compare-to mysql://root:noria@127.1/noria -d 3 -o logictests/generated/mysql/ --only range_param --random --include-deletes --rows-per-table 10 --subquery-depth 1

statement ok
CREATE TABLE `table_4` (`column_3` INT, `column_2` INT, `column_4` INT, `column_1` INT, PRIMARY KEY (`column_4`))


statement ok
CREATE TABLE `table_2` (`column_1` INT, `column_2` INT, `column_3` INT, `column_5` INT, `column_4` INT, PRIMARY KEY (`column_5`))


statement ok
CREATE TABLE `table_1` (`column_1` INT, `column_2` INT, `column_3` INT, PRIMARY KEY (`column_3`))


statement ok
CREATE TABLE `table_3` (`column_3` INT, `column_2` INT, `column_1` INT, PRIMARY KEY (`column_3`))


statement ok
CREATE TABLE `table_5` (`column_2` INT, `column_3` INT, `column_1` INT, PRIMARY KEY (`column_3`))


statement ok
INSERT INTO `table_4` (`column_3`, `column_2`, `column_4`, `column_1`) VALUES (670577017, -591142779, 0, -318593026), (1178862997, 1000630959, 1, 88531331), (-2058700015, -923495178, 2, 1192091718), (-1681587885, 1794826188, 3, -127280045), (181753433, -169517651, 4, 731858366), (-1821703650, 429149282, 5, -1618971107), (-1071140038, -1488547717, 6, 1755994225), (-458040696, -71891065, 7, -862200465), (389268820, -603625535, 8, 1260739216), (-1676751980, 635171653, 9, -1223030443)


statement ok
INSERT INTO `table_2` (`column_1`, `column_2`, `column_3`, `column_5`, `column_4`) VALUES (1265817171, -182193571, -1063571193, 0, 1569664733), (-826594615, -1654462533, 1095600692, 1, 1143175121), (-1404962165, -1112558005, 918198633, 2, 814711322), (1301234256, -1796407991, 469172111, 3, -138939848), (1184204955, -2050540311, -1595685032, 4, 1496575751), (-1527670752, 1894798028, -525447943, 5, -1668971205), (-1573601589, -1049930668, 1464107357, 6, 240652223), (-1729789355, 1297876737, -1184727994, 7, -2002157407), (1604551524, -716381709, 1247638846, 8, 1158370211), (-205799746, 79381316, -2113537461, 9, 833513802)


statement ok
INSERT INTO `table_1` (`column_1`, `column_2`, `column_3`) VALUES (-685453812, 1394106138, 0), (-468891232, -2026634765, 1), (-712120537, 577322265, 2), (-410587727, 2023910173, 3), (-2077270849, -2146551601, 4), (1538040276, -947939538, 5), (-121635293, 248438606, 6), (-558828048, -491553438, 7), (-1768936265, -1830765249, 8), (-1982558896, 645841770, 9)


statement ok
INSERT INTO `table_3` (`column_3`, `column_2`, `column_1`) VALUES (0, -469581291, -49055611), (1, 278174974, 727372512), (2, -2137104537, -953313434), (3, 1107827344, -37531155), (4, -1259442450, 1648468166), (5, -925869931, -787128179), (6, -1017279431, 148188647), (7, 10894687, -1260630732), (8, 413087826, 1530311031), (9, 689322234, 2026167070)


statement ok
INSERT INTO `table_5` (`column_2`, `column_3`, `column_1`) VALUES (-766450186, 0, 2143256632), (-33407967, 1, 2033102042), (-1013121629, 2, -797206406), (227400847, 3, -1252983404), (1282632978, 4, -1934137901), (-2079602037, 5, -1173536109), (-1388781978, 6, 721796830), (-1568171195, 7, -2121305976), (-491636580, 8, -1664321505), (1982457459, 9, -1289336006)


query  rowsort
SELECT `table_1`.`column_1` AS `alias_1` FROM `table_1` WHERE (`table_1`.`column_1` > ?)
? = 10
----
1538040276

query  rowsort
SELECT `table_1`.`column_2` AS `alias_1`, `table_2`.`column_2` AS `alias_2` FROM `table_1` LEFT JOIN `table_2` ON (`table_1`.`column_1` = `table_2`.`column_1`)
----
-1830765249
NULL
-2026634765
NULL
-2146551601
NULL
-491553438
NULL
-947939538
NULL
1394106138
NULL
2023910173
NULL
248438606
NULL
577322265
NULL
645841770
NULL

query  rowsort
SELECT `table_2`.`column_2` AS `alias_1` FROM `table_2` WHERE (`table_2`.`column_2` > ?)
? = 10
----
1297876737
1894798028
79381316

query  rowsort
SELECT `table_2`.`column_3` AS `alias_1`, `table_3`.`column_2` AS `alias_2` FROM `table_2` LEFT JOIN `table_3` ON (`table_2`.`column_2` = `table_3`.`column_1`) WHERE (`table_2`.`column_2` > ?)
? = 10
----
-1184727994
NULL
-2113537461
NULL
-525447943
NULL

query  rowsort
SELECT `table_2`.`column_2` AS `alias_1` FROM `table_2` WHERE ((`table_2`.`column_2` > ?) AND (`table_2`.`column_2` > ?))
? = 10
? = 10
----
1297876737
1894798028
79381316

query  rowsort
SELECT `table_2`.`column_4` AS `alias_1`, `table_4`.`column_2` AS `alias_2` FROM `table_2` LEFT JOIN `table_4` ON (`table_2`.`column_2` = `table_4`.`column_1`) WHERE (`table_2`.`column_1` > ?)
? = 10
----
-138939848
NULL
1158370211
NULL
1496575751
NULL
1569664733
NULL

query  rowsort
SELECT `table_4`.`column_3` AS `alias_1`, `table_5`.`column_2` AS `alias_2` FROM `table_4` LEFT JOIN `table_5` ON (`table_4`.`column_2` = `table_5`.`column_1`) WHERE ((`table_4`.`column_2` > ?) AND (`table_4`.`column_3` > ?))
? = 10
? = 10
----
1178862997
NULL

statement ok
DELETE FROM `table_4` WHERE (`column_4` = 0)


statement ok
DELETE FROM `table_4` WHERE (`column_4` = 1)


statement ok
DELETE FROM `table_4` WHERE (`column_4` = 2)


statement ok
DELETE FROM `table_4` WHERE (`column_4` = 3)


statement ok
DELETE FROM `table_4` WHERE (`column_4` = 4)


statement ok
DELETE FROM `table_2` WHERE (`column_5` = 0)


statement ok
DELETE FROM `table_2` WHERE (`column_5` = 1)


statement ok
DELETE FROM `table_2` WHERE (`column_5` = 2)


statement ok
DELETE FROM `table_2` WHERE (`column_5` = 3)


statement ok
DELETE FROM `table_2` WHERE (`column_5` = 4)


statement ok
DELETE FROM `table_1` WHERE (`column_3` = 0)


statement ok
DELETE FROM `table_1` WHERE (`column_3` = 1)


statement ok
DELETE FROM `table_1` WHERE (`column_3` = 2)


statement ok
DELETE FROM `table_1` WHERE (`column_3` = 3)


statement ok
DELETE FROM `table_1` WHERE (`column_3` = 4)


statement ok
DELETE FROM `table_3` WHERE (`column_3` = 0)


statement ok
DELETE FROM `table_3` WHERE (`column_3` = 1)


statement ok
DELETE FROM `table_3` WHERE (`column_3` = 2)


statement ok
DELETE FROM `table_3` WHERE (`column_3` = 3)


statement ok
DELETE FROM `table_3` WHERE (`column_3` = 4)


statement ok
DELETE FROM `table_5` WHERE (`column_3` = 0)


statement ok
DELETE FROM `table_5` WHERE (`column_3` = 1)


statement ok
DELETE FROM `table_5` WHERE (`column_3` = 2)


statement ok
DELETE FROM `table_5` WHERE (`column_3` = 3)


statement ok
DELETE FROM `table_5` WHERE (`column_3` = 4)


query  rowsort
SELECT `table_1`.`column_1` AS `alias_1` FROM `table_1` WHERE (`table_1`.`column_1` > ?)
? = 10
----
1538040276

query  rowsort
SELECT `table_1`.`column_2` AS `alias_1`, `table_2`.`column_2` AS `alias_2` FROM `table_1` LEFT JOIN `table_2` ON (`table_1`.`column_1` = `table_2`.`column_1`)
----
-1830765249
NULL
-491553438
NULL
-947939538
NULL
248438606
NULL
645841770
NULL

query  rowsort
SELECT `table_2`.`column_2` AS `alias_1` FROM `table_2` WHERE (`table_2`.`column_2` > ?)
? = 10
----
1297876737
1894798028
79381316

query  rowsort
SELECT `table_2`.`column_3` AS `alias_1`, `table_3`.`column_2` AS `alias_2` FROM `table_2` LEFT JOIN `table_3` ON (`table_2`.`column_2` = `table_3`.`column_1`) WHERE (`table_2`.`column_2` > ?)
? = 10
----
-1184727994
NULL
-2113537461
NULL
-525447943
NULL

query  rowsort
SELECT `table_2`.`column_2` AS `alias_1` FROM `table_2` WHERE ((`table_2`.`column_2` > ?) AND (`table_2`.`column_2` > ?))
? = 10
? = 10
----
1297876737
1894798028
79381316

query  rowsort
SELECT `table_2`.`column_4` AS `alias_1`, `table_4`.`column_2` AS `alias_2` FROM `table_2` LEFT JOIN `table_4` ON (`table_2`.`column_2` = `table_4`.`column_1`) WHERE (`table_2`.`column_1` > ?)
? = 10
----
1158370211
NULL

query  rowsort
SELECT `table_4`.`column_3` AS `alias_1`, `table_5`.`column_2` AS `alias_2` FROM `table_4` LEFT JOIN `table_5` ON (`table_4`.`column_2` = `table_5`.`column_1`) WHERE ((`table_4`.`column_2` > ?) AND (`table_4`.`column_3` > ?))
? = 10
? = 10
----

