# Generated by:
#     target/debug/noria-logictest permute --compare-to mysql://root:noria@127.1/noria -d 3 -o logictests/generated/mysql/ --only range_param --random --include-deletes --rows-per-table 10 --subquery-depth 1

statement ok
CREATE TABLE `table_1` (`column_5` INT, `column_9` INT, `column_8` INT, `column_2` INT, `column_10` INT, `column_4` INT, `column_1` INT, `column_6` INT, `column_7` INT, `column_3` INT, PRIMARY KEY (`column_10`))


statement ok
INSERT INTO `table_1` (`column_5`, `column_9`, `column_8`, `column_2`, `column_10`, `column_4`, `column_1`, `column_6`, `column_7`, `column_3`) VALUES (882673463, -1531521880, -1322559093, 971067376, 0, -790151408, 1744333847, -1228028275, 1758497075, 1076848469), (481736100, 908226166, 982550425, -1216979417, 1, -897519131, 1838639965, -863022961, 1404752884, -1027970855), (-607536359, -678040072, 882224970, 422423222, 2, -904214557, 2078493109, -1594173700, -2087603583, -1961331685), (599563034, 294254150, 243058334, 1452943199, 3, 1191110261, -1232452434, -767892388, -262421943, -83073670), (-1935020411, -34801119, -1836652359, 268791367, 4, 62606241, 39659298, 1158840564, -1463523286, 608621444), (-1089504164, -1151370614, 767764352, 543143810, 5, -1993462035, -106769026, -1239216013, -365282604, 435955152), (1161413782, 809209149, -1633743112, 372841655, 6, 449147876, 1477089955, 1280057272, 1143402899, 958188846), (-1184026866, -1725968901, 1384216076, -1242659858, 7, -1443445663, 121098606, -705773868, -336827881, -201923585), (-570877737, 1772435605, -2103180031, 355082019, 8, 1480901852, -1610592120, 1827573126, -1133101486, 1352452982), (-1132848191, 1135478519, 602703181, -369052241, 9, 1828478175, -1714976064, 540439047, -743294650, 1052990104)


query  nosort
SELECT `table_1`.`column_1` AS `alias_1` FROM `table_1` ORDER BY `table_1`.`column_1` ASC LIMIT 10
----
-1714976064
-1610592120
-1232452434
-106769026
39659298
121098606
1477089955
1744333847
1838639965
2078493109

query  nosort
SELECT `table_1`.`column_1` AS `alias_1` FROM `table_1` ORDER BY `table_1`.`column_1` DESC LIMIT 10
----
2078493109
1838639965
1744333847
1477089955
121098606
39659298
-106769026
-1232452434
-1610592120
-1714976064

query  rowsort
SELECT avg(distinct `table_1`.`column_2`) AS `alias_1` FROM `table_1`
----
155760113.2000

query  rowsort
SELECT `table_1`.`column_1` AS `alias_1` FROM `table_1` WHERE (`table_1`.`column_1` > ?)
? = 10
----
121098606
1477089955
1744333847
1838639965
2078493109
39659298

query  nosort
SELECT `table_1`.`column_1` AS `alias_1` FROM `table_1` ORDER BY `table_1`.`column_1` DESC LIMIT 10
----
2078493109
1838639965
1744333847
1477089955
121098606
39659298
-106769026
-1232452434
-1610592120
-1714976064

query  nosort
SELECT avg(distinct `table_1`.`column_3`) AS `alias_1` FROM `table_1` GROUP BY `table_1`.`column_1` ORDER BY `table_1`.`column_1` ASC LIMIT 10
----
1052990104.0000
1352452982.0000
-83073670.0000
435955152.0000
608621444.0000
-201923585.0000
958188846.0000
1076848469.0000
-1027970855.0000
-1961331685.0000

query  nosort
SELECT `table_1`.`column_1` AS `alias_1` FROM `table_1` WHERE (`table_1`.`column_1` > ?) ORDER BY `table_1`.`column_1` ASC LIMIT 10
? = 10
----
39659298
121098606
1477089955
1744333847
1838639965
2078493109

query  nosort
SELECT avg(distinct `table_1`.`column_4`) AS `alias_1` FROM `table_1` GROUP BY `table_1`.`column_1` ORDER BY `table_1`.`column_1` DESC LIMIT 10
----
-904214557.0000
-897519131.0000
-790151408.0000
449147876.0000
-1443445663.0000
62606241.0000
-1993462035.0000
1191110261.0000
1480901852.0000
1828478175.0000

query  nosort
SELECT `table_1`.`column_4` AS `alias_1` FROM `table_1` WHERE (`table_1`.`column_4` > ?) ORDER BY `table_1`.`column_4` DESC LIMIT 10
? = 10
----
1828478175
1480901852
1191110261
449147876
62606241

query  rowsort
SELECT avg(distinct `table_1`.`column_5`) AS `alias_1` FROM `table_1` WHERE (`table_1`.`column_5` > ?)
? = 10
----
781346594.7500

query  nosort
SELECT avg(distinct `table_1`.`column_6`) AS `alias_1` FROM `table_1` GROUP BY `table_1`.`column_5` ORDER BY `table_1`.`column_5` DESC LIMIT 10
----
1280057272.0000
-1228028275.0000
-767892388.0000
-863022961.0000
1827573126.0000
-1594173700.0000
-1239216013.0000
540439047.0000
-705773868.0000
1158840564.0000

query  nosort
SELECT `table_1`.`column_5` AS `alias_1` FROM `table_1` WHERE (`table_1`.`column_5` > ?) ORDER BY `table_1`.`column_5` DESC LIMIT 10
? = 10
----
1161413782
882673463
599563034
481736100

query  nosort
SELECT avg(distinct `table_1`.`column_7`) AS `alias_1` FROM `table_1` WHERE (`table_1`.`column_5` > ?) GROUP BY `table_1`.`column_5` ORDER BY `table_1`.`column_5` ASC LIMIT 10
? = 10
----
1404752884.0000
-262421943.0000
1758497075.0000
1143402899.0000

query  nosort
SELECT avg(distinct `table_1`.`column_8`) AS `alias_1` FROM `table_1` WHERE (`table_1`.`column_5` > ?) GROUP BY `table_1`.`column_5` ORDER BY `table_1`.`column_5` DESC LIMIT 10
? = 10
----
-1633743112.0000
-1322559093.0000
243058334.0000
982550425.0000

query  nosort
SELECT avg(distinct `table_1`.`column_9`) AS `alias_1` FROM `table_1` WHERE (`table_1`.`column_5` > ?) GROUP BY `table_1`.`column_5` ORDER BY `table_1`.`column_5` DESC LIMIT 10
? = 10
----
809209149.0000
-1531521880.0000
294254150.0000
908226166.0000

statement ok
DELETE FROM `table_1` WHERE (`column_10` = 0)


statement ok
DELETE FROM `table_1` WHERE (`column_10` = 1)


statement ok
DELETE FROM `table_1` WHERE (`column_10` = 2)


statement ok
DELETE FROM `table_1` WHERE (`column_10` = 3)


statement ok
DELETE FROM `table_1` WHERE (`column_10` = 4)


query  nosort
SELECT `table_1`.`column_1` AS `alias_1` FROM `table_1` ORDER BY `table_1`.`column_1` ASC LIMIT 10
----
-1714976064
-1610592120
-106769026
121098606
1477089955

query  nosort
SELECT `table_1`.`column_1` AS `alias_1` FROM `table_1` ORDER BY `table_1`.`column_1` DESC LIMIT 10
----
1477089955
121098606
-106769026
-1610592120
-1714976064

query  rowsort
SELECT avg(distinct `table_1`.`column_2`) AS `alias_1` FROM `table_1`
----
-68128923.0000

query  rowsort
SELECT `table_1`.`column_1` AS `alias_1` FROM `table_1` WHERE (`table_1`.`column_1` > ?)
? = 10
----
121098606
1477089955

query  nosort
SELECT `table_1`.`column_1` AS `alias_1` FROM `table_1` ORDER BY `table_1`.`column_1` DESC LIMIT 10
----
1477089955
121098606
-106769026
-1610592120
-1714976064

query  nosort
SELECT avg(distinct `table_1`.`column_3`) AS `alias_1` FROM `table_1` GROUP BY `table_1`.`column_1` ORDER BY `table_1`.`column_1` ASC LIMIT 10
----
1052990104.0000
1352452982.0000
435955152.0000
-201923585.0000
958188846.0000

query  nosort
SELECT `table_1`.`column_1` AS `alias_1` FROM `table_1` WHERE (`table_1`.`column_1` > ?) ORDER BY `table_1`.`column_1` ASC LIMIT 10
? = 10
----
121098606
1477089955

query  nosort
SELECT avg(distinct `table_1`.`column_4`) AS `alias_1` FROM `table_1` GROUP BY `table_1`.`column_1` ORDER BY `table_1`.`column_1` DESC LIMIT 10
----
449147876.0000
-1443445663.0000
-1993462035.0000
1480901852.0000
1828478175.0000

query  nosort
SELECT `table_1`.`column_4` AS `alias_1` FROM `table_1` WHERE (`table_1`.`column_4` > ?) ORDER BY `table_1`.`column_4` DESC LIMIT 10
? = 10
----
1828478175
1480901852
449147876

query  rowsort
SELECT avg(distinct `table_1`.`column_5`) AS `alias_1` FROM `table_1` WHERE (`table_1`.`column_5` > ?)
? = 10
----
1161413782.0000

query  nosort
SELECT avg(distinct `table_1`.`column_6`) AS `alias_1` FROM `table_1` GROUP BY `table_1`.`column_5` ORDER BY `table_1`.`column_5` DESC LIMIT 10
----
1280057272.0000
1827573126.0000
-1239216013.0000
540439047.0000
-705773868.0000

query  nosort
SELECT `table_1`.`column_5` AS `alias_1` FROM `table_1` WHERE (`table_1`.`column_5` > ?) ORDER BY `table_1`.`column_5` DESC LIMIT 10
? = 10
----
1161413782

query  nosort
SELECT avg(distinct `table_1`.`column_7`) AS `alias_1` FROM `table_1` WHERE (`table_1`.`column_5` > ?) GROUP BY `table_1`.`column_5` ORDER BY `table_1`.`column_5` ASC LIMIT 10
? = 10
----
1143402899.0000

query  nosort
SELECT avg(distinct `table_1`.`column_8`) AS `alias_1` FROM `table_1` WHERE (`table_1`.`column_5` > ?) GROUP BY `table_1`.`column_5` ORDER BY `table_1`.`column_5` DESC LIMIT 10
? = 10
----
-1633743112.0000

query  nosort
SELECT avg(distinct `table_1`.`column_9`) AS `alias_1` FROM `table_1` WHERE (`table_1`.`column_5` > ?) GROUP BY `table_1`.`column_5` ORDER BY `table_1`.`column_5` DESC LIMIT 10
? = 10
----
809209149.0000
