# Generated by:
#     target/debug/noria-logictest permute --compare-to mysql://root:noria@127.1/noria -d 3 -o logictests/generated/mysql/ --only range_param --random --include-deletes --rows-per-table 10 --subquery-depth 1

statement ok
CREATE TABLE `table_1` (`column_2` INT, `column_1` INT, PRIMARY KEY (`column_2`))


statement ok
INSERT INTO `table_1` (`column_2`, `column_1`) VALUES (0, 1012878957), (1, 1569147352), (2, -603209647), (3, -98328706), (4, 1680915830), (5, 1603363884), (6, -2134448678), (7, 45861833), (8, -1873951959), (9, 583174376)


query  nosort
SELECT `table_1`.`column_1` AS `alias_1` FROM `table_1` ORDER BY `table_1`.`column_1` ASC LIMIT 10
----
-2134448678
-1873951959
-603209647
-98328706
45861833
583174376
1012878957
1569147352
1603363884
1680915830

query  nosort
SELECT `table_1`.`column_1` AS `alias_1` FROM `table_1` ORDER BY `table_1`.`column_1` DESC LIMIT 10
----
1680915830
1603363884
1569147352
1012878957
583174376
45861833
-98328706
-603209647
-1873951959
-2134448678

query  rowsort
SELECT `table_1`.`column_1` AS `alias_1` FROM `table_1` WHERE ((`table_1`.`column_1` > ?) AND (`table_1`.`column_1` > ?))
? = 10
? = 10
----
1012878957
1569147352
1603363884
1680915830
45861833
583174376

query  rowsort
SELECT `table_1`.`column_1` AS `alias_1` FROM `table_1` WHERE (`table_1`.`column_1` > ?)
? = 10
----
1012878957
1569147352
1603363884
1680915830
45861833
583174376

query  nosort
SELECT `table_1`.`column_1` AS `alias_1` FROM `table_1` ORDER BY `table_1`.`column_1` DESC LIMIT 10
----
1680915830
1603363884
1569147352
1012878957
583174376
45861833
-98328706
-603209647
-1873951959
-2134448678

query  nosort
SELECT `table_1`.`column_1` AS `alias_1` FROM `table_1` WHERE ((`table_1`.`column_1` > ?) AND (`table_1`.`column_1` > ?)) ORDER BY `table_1`.`column_1` ASC LIMIT 10
? = 10
? = 10
----
45861833
583174376
1012878957
1569147352
1603363884
1680915830

query  nosort
SELECT `table_1`.`column_1` AS `alias_1` FROM `table_1` WHERE (`table_1`.`column_1` > ?) ORDER BY `table_1`.`column_1` ASC LIMIT 10
? = 10
----
45861833
583174376
1012878957
1569147352
1603363884
1680915830

query  nosort
SELECT `table_1`.`column_1` AS `alias_1` FROM `table_1` WHERE ((`table_1`.`column_1` > ?) AND (`table_1`.`column_1` > ?)) ORDER BY `table_1`.`column_1` DESC LIMIT 10
? = 10
? = 10
----
1680915830
1603363884
1569147352
1012878957
583174376
45861833

query  nosort
SELECT `table_1`.`column_1` AS `alias_1` FROM `table_1` WHERE (`table_1`.`column_1` > ?) ORDER BY `table_1`.`column_1` DESC LIMIT 10
? = 10
----
1680915830
1603363884
1569147352
1012878957
583174376
45861833

query  rowsort
SELECT `table_1`.`column_1` AS `alias_1` FROM `table_1` WHERE (((`table_1`.`column_1` > ?) AND (`table_1`.`column_1` > ?)) AND (`table_1`.`column_1` > ?))
? = 10
? = 10
? = 10
----
1012878957
1569147352
1603363884
1680915830
45861833
583174376

query  nosort
SELECT `table_1`.`column_1` AS `alias_1` FROM `table_1` WHERE ((`table_1`.`column_1` > ?) AND (`table_1`.`column_1` > ?)) ORDER BY `table_1`.`column_1` DESC LIMIT 10
? = 10
? = 10
----
1680915830
1603363884
1569147352
1012878957
583174376
45861833

query  nosort
SELECT `table_1`.`column_1` AS `alias_1` FROM `table_1` WHERE (`table_1`.`column_1` > ?) ORDER BY `table_1`.`column_1` DESC LIMIT 10
? = 10
----
1680915830
1603363884
1569147352
1012878957
583174376
45861833

query  nosort
SELECT `table_1`.`column_1` AS `alias_1` FROM `table_1` WHERE (((`table_1`.`column_1` > ?) AND (`table_1`.`column_1` > ?)) AND (`table_1`.`column_1` > ?)) ORDER BY `table_1`.`column_1` ASC LIMIT 10
? = 10
? = 10
? = 10
----
45861833
583174376
1012878957
1569147352
1603363884
1680915830

query  nosort
SELECT `table_1`.`column_1` AS `alias_1` FROM `table_1` WHERE (((`table_1`.`column_1` > ?) AND (`table_1`.`column_1` > ?)) AND (`table_1`.`column_1` > ?)) ORDER BY `table_1`.`column_1` DESC LIMIT 10
? = 10
? = 10
? = 10
----
1680915830
1603363884
1569147352
1012878957
583174376
45861833

query  nosort
SELECT `table_1`.`column_1` AS `alias_1` FROM `table_1` WHERE (((`table_1`.`column_1` > ?) AND (`table_1`.`column_1` > ?)) AND (`table_1`.`column_1` > ?)) ORDER BY `table_1`.`column_1` DESC LIMIT 10
? = 10
? = 10
? = 10
----
1680915830
1603363884
1569147352
1012878957
583174376
45861833

statement ok
DELETE FROM `table_1` WHERE (`column_2` = 0)


statement ok
DELETE FROM `table_1` WHERE (`column_2` = 1)


statement ok
DELETE FROM `table_1` WHERE (`column_2` = 2)


statement ok
DELETE FROM `table_1` WHERE (`column_2` = 3)


statement ok
DELETE FROM `table_1` WHERE (`column_2` = 4)


query  nosort
SELECT `table_1`.`column_1` AS `alias_1` FROM `table_1` ORDER BY `table_1`.`column_1` ASC LIMIT 10
----
-2134448678
-1873951959
45861833
583174376
1603363884

query  nosort
SELECT `table_1`.`column_1` AS `alias_1` FROM `table_1` ORDER BY `table_1`.`column_1` DESC LIMIT 10
----
1603363884
583174376
45861833
-1873951959
-2134448678

query  rowsort
SELECT `table_1`.`column_1` AS `alias_1` FROM `table_1` WHERE ((`table_1`.`column_1` > ?) AND (`table_1`.`column_1` > ?))
? = 10
? = 10
----
1603363884
45861833
583174376

query  rowsort
SELECT `table_1`.`column_1` AS `alias_1` FROM `table_1` WHERE (`table_1`.`column_1` > ?)
? = 10
----
1603363884
45861833
583174376

query  nosort
SELECT `table_1`.`column_1` AS `alias_1` FROM `table_1` ORDER BY `table_1`.`column_1` DESC LIMIT 10
----
1603363884
583174376
45861833
-1873951959
-2134448678

query  nosort
SELECT `table_1`.`column_1` AS `alias_1` FROM `table_1` WHERE ((`table_1`.`column_1` > ?) AND (`table_1`.`column_1` > ?)) ORDER BY `table_1`.`column_1` ASC LIMIT 10
? = 10
? = 10
----
45861833
583174376
1603363884

query  nosort
SELECT `table_1`.`column_1` AS `alias_1` FROM `table_1` WHERE (`table_1`.`column_1` > ?) ORDER BY `table_1`.`column_1` ASC LIMIT 10
? = 10
----
45861833
583174376
1603363884

query  nosort
SELECT `table_1`.`column_1` AS `alias_1` FROM `table_1` WHERE ((`table_1`.`column_1` > ?) AND (`table_1`.`column_1` > ?)) ORDER BY `table_1`.`column_1` DESC LIMIT 10
? = 10
? = 10
----
1603363884
583174376
45861833

query  nosort
SELECT `table_1`.`column_1` AS `alias_1` FROM `table_1` WHERE (`table_1`.`column_1` > ?) ORDER BY `table_1`.`column_1` DESC LIMIT 10
? = 10
----
1603363884
583174376
45861833

query  rowsort
SELECT `table_1`.`column_1` AS `alias_1` FROM `table_1` WHERE (((`table_1`.`column_1` > ?) AND (`table_1`.`column_1` > ?)) AND (`table_1`.`column_1` > ?))
? = 10
? = 10
? = 10
----
1603363884
45861833
583174376

query  nosort
SELECT `table_1`.`column_1` AS `alias_1` FROM `table_1` WHERE ((`table_1`.`column_1` > ?) AND (`table_1`.`column_1` > ?)) ORDER BY `table_1`.`column_1` DESC LIMIT 10
? = 10
? = 10
----
1603363884
583174376
45861833

query  nosort
SELECT `table_1`.`column_1` AS `alias_1` FROM `table_1` WHERE (`table_1`.`column_1` > ?) ORDER BY `table_1`.`column_1` DESC LIMIT 10
? = 10
----
1603363884
583174376
45861833

query  nosort
SELECT `table_1`.`column_1` AS `alias_1` FROM `table_1` WHERE (((`table_1`.`column_1` > ?) AND (`table_1`.`column_1` > ?)) AND (`table_1`.`column_1` > ?)) ORDER BY `table_1`.`column_1` ASC LIMIT 10
? = 10
? = 10
? = 10
----
45861833
583174376
1603363884

query  nosort
SELECT `table_1`.`column_1` AS `alias_1` FROM `table_1` WHERE (((`table_1`.`column_1` > ?) AND (`table_1`.`column_1` > ?)) AND (`table_1`.`column_1` > ?)) ORDER BY `table_1`.`column_1` DESC LIMIT 10
? = 10
? = 10
? = 10
----
1603363884
583174376
45861833

query  nosort
SELECT `table_1`.`column_1` AS `alias_1` FROM `table_1` WHERE (((`table_1`.`column_1` > ?) AND (`table_1`.`column_1` > ?)) AND (`table_1`.`column_1` > ?)) ORDER BY `table_1`.`column_1` DESC LIMIT 10
? = 10
? = 10
? = 10
----
1603363884
583174376
45861833
