# Generated by:
#     target/debug/noria-logictest permute --compare-to mysql://root:noria@127.1/noria -d 3 -o logictests/generated/mysql/ --only range_param --random --include-deletes --rows-per-table 10 --subquery-depth 1

statement ok
CREATE TABLE `table_1` (`column_5` INT, `column_3` INT, `column_7` INT, `column_8` INT, `column_9` INT, `column_2` INT, `column_4` INT, `column_1` INT, `column_6` INT, `column_10` INT, PRIMARY KEY (`column_10`))


statement ok
INSERT INTO `table_1` (`column_5`, `column_3`, `column_7`, `column_8`, `column_9`, `column_2`, `column_4`, `column_1`, `column_6`, `column_10`) VALUES (1088577228, 109572427, 128285126, 80911698, -552539175, 1433182024, 436303112, -1753668410, -342710538, 0), (1250284442, 902913045, 1434752722, 526937606, 1043517001, -1589570535, -284816612, 79600479, 1616098556, 1), (-1110760527, 512519392, 1208587983, -439386389, 173439854, 1452863786, 1812499648, -1599631412, 2147313671, 2), (-1388959263, 1237372695, -948050219, 1911779317, 1133447804, 2060264365, 1754336224, -2060395021, -101829280, 3), (208236943, 1954486702, -1703352392, 955092914, 1839585667, 100231852, 2008697602, -1670584596, -1074225163, 4), (1750592209, -257264476, -1985221151, 1043444700, -407154093, 1598235411, 744528602, 223017655, -1101903508, 5), (-7071858, -1010561314, -1829023628, -2048645466, 118723308, -1460076362, -1254170325, -355539288, 825330917, 6), (-927352659, 864558706, 1195155221, 211802249, -26627908, 1165608513, 419194035, -498156686, -1744355480, 7), (696358747, 883286606, 1063782621, 1435868936, -1099726473, 1034043363, -1920279324, -616102429, -760785388, 8), (1677937582, 1898761756, -1935931211, 914857931, 1941742345, -884765439, 1339150314, 251221214, 513295237, 9)


query  nosort
SELECT `table_1`.`column_1` AS `alias_1` FROM `table_1` ORDER BY `table_1`.`column_1` ASC LIMIT 10
----
-2060395021
-1753668410
-1670584596
-1599631412
-616102429
-498156686
-355539288
79600479
223017655
251221214

query  nosort
SELECT `table_1`.`column_1` AS `alias_1` FROM `table_1` ORDER BY `table_1`.`column_1` DESC LIMIT 10
----
251221214
223017655
79600479
-355539288
-498156686
-616102429
-1599631412
-1670584596
-1753668410
-2060395021

query  rowsort
SELECT min(`table_1`.`column_2`) AS `alias_1` FROM `table_1`
----
-1589570535

query  rowsort
SELECT `table_1`.`column_1` AS `alias_1` FROM `table_1` WHERE (`table_1`.`column_1` > ?)
? = 10
----
223017655
251221214
79600479

query  nosort
SELECT `table_1`.`column_1` AS `alias_1` FROM `table_1` ORDER BY `table_1`.`column_1` DESC LIMIT 10
----
251221214
223017655
79600479
-355539288
-498156686
-616102429
-1599631412
-1670584596
-1753668410
-2060395021

query  nosort
SELECT min(`table_1`.`column_3`) AS `alias_1` FROM `table_1` GROUP BY `table_1`.`column_1` ORDER BY `table_1`.`column_1` ASC LIMIT 10
----
1237372695
109572427
1954486702
512519392
883286606
864558706
-1010561314
902913045
-257264476
1898761756

query  nosort
SELECT `table_1`.`column_1` AS `alias_1` FROM `table_1` WHERE (`table_1`.`column_1` > ?) ORDER BY `table_1`.`column_1` ASC LIMIT 10
? = 10
----
79600479
223017655
251221214

query  nosort
SELECT min(`table_1`.`column_4`) AS `alias_1` FROM `table_1` GROUP BY `table_1`.`column_1` ORDER BY `table_1`.`column_1` DESC LIMIT 10
----
1339150314
744528602
-284816612
-1254170325
419194035
-1920279324
1812499648
2008697602
436303112
1754336224

query  nosort
SELECT `table_1`.`column_2` AS `alias_1` FROM `table_1` WHERE (`table_1`.`column_2` > ?) ORDER BY `table_1`.`column_2` DESC LIMIT 10
? = 10
----
2060264365
1598235411
1452863786
1433182024
1165608513
1034043363
100231852

query  rowsort
SELECT min(`table_1`.`column_5`) AS `alias_1` FROM `table_1` WHERE (`table_1`.`column_2` > ?)
? = 10
----
-1388959263

query  nosort
SELECT min(`table_1`.`column_6`) AS `alias_1` FROM `table_1` GROUP BY `table_1`.`column_2` ORDER BY `table_1`.`column_2` DESC LIMIT 10
----
-101829280
-1101903508
2147313671
-342710538
-1744355480
-760785388
-1074225163
513295237
825330917
1616098556

query  nosort
SELECT `table_1`.`column_2` AS `alias_1` FROM `table_1` WHERE (`table_1`.`column_2` > ?) ORDER BY `table_1`.`column_2` DESC LIMIT 10
? = 10
----
2060264365
1598235411
1452863786
1433182024
1165608513
1034043363
100231852

query  nosort
SELECT min(`table_1`.`column_7`) AS `alias_1` FROM `table_1` WHERE (`table_1`.`column_2` > ?) GROUP BY `table_1`.`column_2` ORDER BY `table_1`.`column_2` ASC LIMIT 10
? = 10
----
-1703352392
1063782621
1195155221
128285126
1208587983
-1985221151
-948050219

query  nosort
SELECT min(`table_1`.`column_8`) AS `alias_1` FROM `table_1` WHERE (`table_1`.`column_5` > ?) GROUP BY `table_1`.`column_2` ORDER BY `table_1`.`column_2` DESC LIMIT 10
? = 10
----
1043444700
80911698
1435868936
955092914
914857931
526937606

query  nosort
SELECT min(`table_1`.`column_9`) AS `alias_1` FROM `table_1` WHERE (`table_1`.`column_5` > ?) GROUP BY `table_1`.`column_5` ORDER BY `table_1`.`column_5` DESC LIMIT 10
? = 10
----
-407154093
1941742345
1043517001
-552539175
-1099726473
1839585667

statement ok
DELETE FROM `table_1` WHERE (`column_10` = 0)


statement ok
DELETE FROM `table_1` WHERE (`column_10` = 1)


statement ok
DELETE FROM `table_1` WHERE (`column_10` = 2)


statement ok
DELETE FROM `table_1` WHERE (`column_10` = 3)


statement ok
DELETE FROM `table_1` WHERE (`column_10` = 4)


query  nosort
SELECT `table_1`.`column_1` AS `alias_1` FROM `table_1` ORDER BY `table_1`.`column_1` ASC LIMIT 10
----
-616102429
-498156686
-355539288
223017655
251221214

query  nosort
SELECT `table_1`.`column_1` AS `alias_1` FROM `table_1` ORDER BY `table_1`.`column_1` DESC LIMIT 10
----
251221214
223017655
-355539288
-498156686
-616102429

query  rowsort
SELECT min(`table_1`.`column_2`) AS `alias_1` FROM `table_1`
----
-1460076362

query  rowsort
SELECT `table_1`.`column_1` AS `alias_1` FROM `table_1` WHERE (`table_1`.`column_1` > ?)
? = 10
----
223017655
251221214

query  nosort
SELECT `table_1`.`column_1` AS `alias_1` FROM `table_1` ORDER BY `table_1`.`column_1` DESC LIMIT 10
----
251221214
223017655
-355539288
-498156686
-616102429

query  nosort
SELECT min(`table_1`.`column_3`) AS `alias_1` FROM `table_1` GROUP BY `table_1`.`column_1` ORDER BY `table_1`.`column_1` ASC LIMIT 10
----
883286606
864558706
-1010561314
-257264476
1898761756

query  nosort
SELECT `table_1`.`column_1` AS `alias_1` FROM `table_1` WHERE (`table_1`.`column_1` > ?) ORDER BY `table_1`.`column_1` ASC LIMIT 10
? = 10
----
223017655
251221214

query  nosort
SELECT min(`table_1`.`column_4`) AS `alias_1` FROM `table_1` GROUP BY `table_1`.`column_1` ORDER BY `table_1`.`column_1` DESC LIMIT 10
----
1339150314
744528602
-1254170325
419194035
-1920279324

query  nosort
SELECT `table_1`.`column_2` AS `alias_1` FROM `table_1` WHERE (`table_1`.`column_2` > ?) ORDER BY `table_1`.`column_2` DESC LIMIT 10
? = 10
----
1598235411
1165608513
1034043363

query  rowsort
SELECT min(`table_1`.`column_5`) AS `alias_1` FROM `table_1` WHERE (`table_1`.`column_2` > ?)
? = 10
----
-927352659

query  nosort
SELECT min(`table_1`.`column_6`) AS `alias_1` FROM `table_1` GROUP BY `table_1`.`column_2` ORDER BY `table_1`.`column_2` DESC LIMIT 10
----
-1101903508
-1744355480
-760785388
513295237
825330917

query  nosort
SELECT `table_1`.`column_2` AS `alias_1` FROM `table_1` WHERE (`table_1`.`column_2` > ?) ORDER BY `table_1`.`column_2` DESC LIMIT 10
? = 10
----
1598235411
1165608513
1034043363

query  nosort
SELECT min(`table_1`.`column_7`) AS `alias_1` FROM `table_1` WHERE (`table_1`.`column_2` > ?) GROUP BY `table_1`.`column_2` ORDER BY `table_1`.`column_2` ASC LIMIT 10
? = 10
----
1063782621
1195155221
-1985221151

query  nosort
SELECT min(`table_1`.`column_8`) AS `alias_1` FROM `table_1` WHERE (`table_1`.`column_5` > ?) GROUP BY `table_1`.`column_2` ORDER BY `table_1`.`column_2` DESC LIMIT 10
? = 10
----
1043444700
1435868936
914857931

query  nosort
SELECT min(`table_1`.`column_9`) AS `alias_1` FROM `table_1` WHERE (`table_1`.`column_5` > ?) GROUP BY `table_1`.`column_5` ORDER BY `table_1`.`column_5` DESC LIMIT 10
? = 10
----
-407154093
1941742345
-1099726473
