# Generated by:
#     target/debug/noria-logictest generate --operations count,avg,max --compare-to postgresql://root@localhost/psql --subquery-depth 1 --rows-per-table 5 -o logictests/generated/test2/count,avg,max.test --include-deletes

statement ok
CREATE TABLE table_1 (column_2 INT, column_1 INT, PRIMARY KEY (column_2))


statement ok
INSERT INTO table_1 (column_2, column_1) VALUES (0, 1), (1, 1), (2, 1), (3, 1), (4, 1)


query  nosort
SELECT count(table_1.column_1) AS alias_1 FROM table_1
----
5

query  nosort
SELECT avg(table_1.column_1) AS alias_1 FROM table_1
----
1.0

query  nosort
SELECT max(table_1.column_1) AS alias_1 FROM table_1
----
1

query  nosort
SELECT count(table_1.column_1) AS alias_1, avg(table_1.column_1) AS alias_2 FROM table_1
----
5
1.0

query  nosort
SELECT count(table_1.column_1) AS alias_1, max(table_1.column_1) AS alias_2 FROM table_1
----
5
1

query  nosort
SELECT avg(table_1.column_1) AS alias_1, max(table_1.column_1) AS alias_2 FROM table_1
----
1.0
1

query  nosort
SELECT count(table_1.column_1) AS alias_1, avg(table_1.column_1) AS alias_2, max(table_1.column_1) AS alias_3 FROM table_1
----
5
1.0
1

statement ok
DELETE FROM table_1 WHERE (column_2 = 0)


statement ok
DELETE FROM table_1 WHERE (column_2 = 1)


query  nosort
SELECT count(table_1.column_1) AS alias_1 FROM table_1
----
3

query  nosort
SELECT avg(table_1.column_1) AS alias_1 FROM table_1
----
1.0

query  nosort
SELECT max(table_1.column_1) AS alias_1 FROM table_1
----
1

query  nosort
SELECT count(table_1.column_1) AS alias_1, avg(table_1.column_1) AS alias_2 FROM table_1
----
3
1.0

query  nosort
SELECT count(table_1.column_1) AS alias_1, max(table_1.column_1) AS alias_2 FROM table_1
----
3
1

query  nosort
SELECT avg(table_1.column_1) AS alias_1, max(table_1.column_1) AS alias_2 FROM table_1
----
1.0
1

query  nosort
SELECT count(table_1.column_1) AS alias_1, avg(table_1.column_1) AS alias_2, max(table_1.column_1) AS alias_3 FROM table_1
----
3
1.0
1
