# Generated by:
#     target/debug/noria-logictest permute --compare-to mysql://root:noria@127.1/noria -d 3 -o logictests/generated/mysql/ --only range_param --random --include-deletes --rows-per-table 10 --subquery-depth 1 --overwrite-tests

statement ok
CREATE TABLE `table_1` (`column_9` INT, `column_1` INT, `column_7` INT, `column_12` INT, `column_6` INT, `column_5` INT, `column_4` INT, `column_3` INT, `column_10` INT, `column_11` INT, `column_13` INT, `column_2` INT, `column_8` INT, PRIMARY KEY (`column_13`))


statement ok
INSERT INTO `table_1` (`column_9`, `column_1`, `column_7`, `column_12`, `column_6`, `column_5`, `column_4`, `column_3`, `column_10`, `column_11`, `column_13`, `column_2`, `column_8`) VALUES (-1722621268, 1142721977, -907788538, -209429900, -273507442, -1873118637, 110247744, 118028176, -1220644292, 24653358, 0, -886068056, -1406799336), (-1996684699, 747028473, -1143519219, -2108070540, -1861125881, -733840661, -997059315, -1185737714, 1948512278, -794857689, 1, -177591247, -149187353), (1492418435, 1564727762, -489474630, -1799973853, -915870609, 819677260, 1900419265, 1716188850, -1314263167, -1723180889, 2, -1340354746, -821194373), (-1956970214, 534206021, -292603433, -1081027240, 731736984, -272279966, -1684748971, -1232883, 1213195286, -1278531884, 3, 1662536907, 16373148), (-1819787319, 1617636706, 1697905860, -109257025, -1993716823, 672153342, -2140332944, 1621432072, 2090566954, -552300310, 4, -1314491764, 1706806908), (-1379759032, 1017687762, 1728369296, 389331907, 201570940, 501792521, -1838460003, -543827179, 676626851, -1022765068, 5, -1946321495, -1350334372), (653836047, -1851463582, 1384133962, 449650520, -660671520, -1280067111, -329482133, 903312917, 703196916, 1803503544, 6, 1712242181, 1172939492), (-618758734, 799412969, 1638891937, 1949051120, -1549657041, -1209532132, -1818709074, -1260553143, 1406855655, -2026007027, 7, 1558577513, 916323446), (1414075292, -537520658, -1517879391, 1957456197, -1701806365, 1953531633, 312514848, 583560891, 392409354, -383169000, 8, 1146642055, -666235244), (1061923729, -1028713503, 1029084894, -396325759, 1786297635, 839536178, 1276859757, 986512731, 1082455098, 2060553219, 9, -1406751183, -1816561532)


query  rowsort
WITH `alias_3` AS (SELECT avg(`table_1`.`column_2`) AS `alias_2` FROM `table_1`) SELECT avg(`table_1`.`column_1`) AS `alias_1` FROM `table_1` INNER JOIN `alias_3` ON (`table_1`.`column_1` = `alias_3`.`alias_2`)
----
NULL

query  rowsort
WITH `alias_3` AS (SELECT `table_1`.`column_3` AS `alias_2` FROM `table_1`) SELECT avg(`table_1`.`column_3`) AS `alias_1` FROM `table_1` INNER JOIN `alias_3` ON (`table_1`.`column_3` = `alias_3`.`alias_2`)
----
293768471.8000

query  rowsort
WITH `alias_3` AS (SELECT avg(`table_1`.`column_5`) AS `alias_2` FROM `table_1`) SELECT avg(`table_1`.`column_4`) AS `alias_1` FROM `table_1` INNER JOIN `alias_3` ON (`table_1`.`column_4` = `alias_3`.`alias_2`)
----
NULL

query  rowsort
WITH `alias_2` AS (SELECT avg(`table_1`.`column_6`) AS `alias_1` FROM `table_1`) SELECT `table_1`.`column_4` AS `alias_3` FROM `table_1` INNER JOIN `alias_2` ON (`table_1`.`column_4` = `alias_2`.`alias_1`) WHERE (`table_1`.`column_4` > ?)
? = 10
----


query  rowsort
WITH `alias_2` AS (SELECT `table_1`.`column_4` AS `alias_1` FROM `table_1`) SELECT `table_1`.`column_4` AS `alias_3` FROM `table_1` INNER JOIN `alias_2` ON (`table_1`.`column_4` = `alias_2`.`alias_1`) WHERE (`table_1`.`column_4` > ?)
? = 10
----
110247744
1276859757
1900419265
312514848

query  rowsort
WITH `alias_2` AS (SELECT avg(`table_1`.`column_7`) AS `alias_1` FROM `table_1`) SELECT `table_1`.`column_4` AS `alias_3` FROM `table_1` INNER JOIN `alias_2` ON (`table_1`.`column_4` = `alias_2`.`alias_1`) WHERE (`table_1`.`column_4` > ?)
? = 10
----


query  rowsort
WITH `alias_3` AS (SELECT avg(`table_1`.`column_9`) AS `alias_2` FROM `table_1`) SELECT avg(`table_1`.`column_8`) AS `alias_1` FROM `table_1` INNER JOIN `alias_3` ON (`table_1`.`column_9` = `alias_3`.`alias_2`) WHERE (`table_1`.`column_1` > ?)
? = 10
----
NULL

query  rowsort
WITH `alias_3` AS (SELECT `table_1`.`column_9` AS `alias_2` FROM `table_1`) SELECT avg(`table_1`.`column_10`) AS `alias_1` FROM `table_1` INNER JOIN `alias_3` ON (`table_1`.`column_9` = `alias_3`.`alias_2`) WHERE (`table_1`.`column_9` > ?)
? = 10
----
215949550.2500

query  rowsort
WITH `alias_3` AS (SELECT avg(`table_1`.`column_12`) AS `alias_2` FROM `table_1`) SELECT avg(`table_1`.`column_11`) AS `alias_1` FROM `table_1` INNER JOIN `alias_3` ON (`table_1`.`column_9` = `alias_3`.`alias_2`) WHERE (`table_1`.`column_9` > ?)
? = 10
----
NULL

statement ok
DELETE FROM `table_1` WHERE (`column_13` = 0)


statement ok
DELETE FROM `table_1` WHERE (`column_13` = 1)


statement ok
DELETE FROM `table_1` WHERE (`column_13` = 2)


statement ok
DELETE FROM `table_1` WHERE (`column_13` = 3)


statement ok
DELETE FROM `table_1` WHERE (`column_13` = 4)


query  rowsort
WITH `alias_3` AS (SELECT avg(`table_1`.`column_2`) AS `alias_2` FROM `table_1`) SELECT avg(`table_1`.`column_1`) AS `alias_1` FROM `table_1` INNER JOIN `alias_3` ON (`table_1`.`column_1` = `alias_3`.`alias_2`)
----
NULL

query  rowsort
WITH `alias_3` AS (SELECT `table_1`.`column_3` AS `alias_2` FROM `table_1`) SELECT avg(`table_1`.`column_3`) AS `alias_1` FROM `table_1` INNER JOIN `alias_3` ON (`table_1`.`column_3` = `alias_3`.`alias_2`)
----
133801243.4000

query  rowsort
WITH `alias_3` AS (SELECT avg(`table_1`.`column_5`) AS `alias_2` FROM `table_1`) SELECT avg(`table_1`.`column_4`) AS `alias_1` FROM `table_1` INNER JOIN `alias_3` ON (`table_1`.`column_4` = `alias_3`.`alias_2`)
----
NULL

query  rowsort
WITH `alias_2` AS (SELECT avg(`table_1`.`column_6`) AS `alias_1` FROM `table_1`) SELECT `table_1`.`column_4` AS `alias_3` FROM `table_1` INNER JOIN `alias_2` ON (`table_1`.`column_4` = `alias_2`.`alias_1`) WHERE (`table_1`.`column_4` > ?)
? = 10
----


query  rowsort
WITH `alias_2` AS (SELECT `table_1`.`column_4` AS `alias_1` FROM `table_1`) SELECT `table_1`.`column_4` AS `alias_3` FROM `table_1` INNER JOIN `alias_2` ON (`table_1`.`column_4` = `alias_2`.`alias_1`) WHERE (`table_1`.`column_4` > ?)
? = 10
----
1276859757
312514848

query  rowsort
WITH `alias_2` AS (SELECT avg(`table_1`.`column_7`) AS `alias_1` FROM `table_1`) SELECT `table_1`.`column_4` AS `alias_3` FROM `table_1` INNER JOIN `alias_2` ON (`table_1`.`column_4` = `alias_2`.`alias_1`) WHERE (`table_1`.`column_4` > ?)
? = 10
----


query  rowsort
WITH `alias_3` AS (SELECT avg(`table_1`.`column_9`) AS `alias_2` FROM `table_1`) SELECT avg(`table_1`.`column_8`) AS `alias_1` FROM `table_1` INNER JOIN `alias_3` ON (`table_1`.`column_9` = `alias_3`.`alias_2`) WHERE (`table_1`.`column_1` > ?)
? = 10
----
NULL

query  rowsort
WITH `alias_3` AS (SELECT `table_1`.`column_9` AS `alias_2` FROM `table_1`) SELECT avg(`table_1`.`column_10`) AS `alias_1` FROM `table_1` INNER JOIN `alias_3` ON (`table_1`.`column_9` = `alias_3`.`alias_2`) WHERE (`table_1`.`column_9` > ?)
? = 10
----
726020456.0000

query  rowsort
WITH `alias_3` AS (SELECT avg(`table_1`.`column_12`) AS `alias_2` FROM `table_1`) SELECT avg(`table_1`.`column_11`) AS `alias_1` FROM `table_1` INNER JOIN `alias_3` ON (`table_1`.`column_9` = `alias_3`.`alias_2`) WHERE (`table_1`.`column_9` > ?)
? = 10
----
NULL
