# Generated by:
#     target/debug/noria-logictest permute --compare-to mysql://root:noria@127.1/noria -d 3 -o logictests/generated/mysql/ --only range_param --random --include-deletes --rows-per-table 10 --subquery-depth 1 --overwrite-tests

statement ok
CREATE TABLE `table_1` (`column_11` INT, `column_8` INT, `column_4` INT, `column_9` INT, `column_12` INT, `column_2` INT, `column_5` INT, `column_6` INT, `column_7` INT, `column_3` INT, `column_10` INT, `column_13` INT, `column_1` INT, PRIMARY KEY (`column_13`))


statement ok
INSERT INTO `table_1` (`column_11`, `column_8`, `column_4`, `column_9`, `column_12`, `column_2`, `column_5`, `column_6`, `column_7`, `column_3`, `column_10`, `column_13`, `column_1`) VALUES (-1668246022, -731386260, 1250151044, -187373656, 824701472, -322090783, -63790058, -1071776761, 376257057, 229749728, -523918262, 0, -235959783), (-2077335419, -334578770, -572597286, 885746545, 1206711228, 574500969, -594022240, -2131480120, 1200062061, 1006496076, 908046237, 1, -17648616), (1684219344, -301140366, -1724841833, -1798784385, -1345530808, 630782070, 1342000020, 1591894816, 637422177, 1381329307, 1297620609, 2, 17385357), (1842762072, 1899819545, -909769558, 1834801735, -307236699, 1470941066, 1427351490, -1819902299, 895400892, -2069679961, 692477985, 3, -629450951), (1386223038, 1780912906, 1696160816, -85894610, -635836322, -969821224, -1071067595, 948866005, -1173370735, 953915265, 1364377992, 4, 2100517082), (-1652198885, -968252147, 517210143, -2054048140, 1498208470, -921511018, 979548749, -1215935772, 1848666140, 929160014, 1547302415, 5, -1671059814), (1119006224, -758902469, -1410537159, -751298315, -1442392982, 1359082897, -1815588384, 429324577, 19837062, -813038226, 154558237, 6, -1430959400), (1015637352, 1708895198, 954428107, 1658402144, 1678707966, 226902994, -1380330647, -1061133303, -85569233, 640221159, 1551792520, 7, 771827267), (843221652, -1886310940, -1216677391, -1037478626, -1495888014, -633680723, 1800303456, -1203973317, 1537221879, -475175382, 817638132, 8, 1733182230), (-1522315294, 664643458, -1229934409, -470758011, 557294128, 1669460850, -649167768, -1671783009, -642092600, -1590931709, -854515157, 9, -1712151994)


query  rowsort
WITH `alias_3` AS (SELECT avg(distinct `table_1`.`column_2`) AS `alias_2` FROM `table_1`) SELECT avg(distinct `table_1`.`column_1`) AS `alias_1` FROM `table_1` INNER JOIN `alias_3` ON (`table_1`.`column_1` = `alias_3`.`alias_2`)
----
NULL

query  rowsort
WITH `alias_3` AS (SELECT `table_1`.`column_3` AS `alias_2` FROM `table_1`) SELECT avg(distinct `table_1`.`column_3`) AS `alias_1` FROM `table_1` INNER JOIN `alias_3` ON (`table_1`.`column_3` = `alias_3`.`alias_2`)
----
19204627.1000

query  rowsort
WITH `alias_3` AS (SELECT avg(distinct `table_1`.`column_5`) AS `alias_2` FROM `table_1`) SELECT avg(distinct `table_1`.`column_4`) AS `alias_1` FROM `table_1` INNER JOIN `alias_3` ON (`table_1`.`column_2` = `alias_3`.`alias_2`)
----
NULL

query  rowsort
WITH `alias_2` AS (SELECT avg(distinct `table_1`.`column_6`) AS `alias_1` FROM `table_1`) SELECT `table_1`.`column_2` AS `alias_3` FROM `table_1` INNER JOIN `alias_2` ON (`table_1`.`column_2` = `alias_2`.`alias_1`) WHERE (`table_1`.`column_2` > ?)
? = 10
----


query  rowsort
WITH `alias_2` AS (SELECT `table_1`.`column_2` AS `alias_1` FROM `table_1`) SELECT `table_1`.`column_2` AS `alias_3` FROM `table_1` INNER JOIN `alias_2` ON (`table_1`.`column_2` = `alias_2`.`alias_1`) WHERE (`table_1`.`column_2` > ?)
? = 10
----
1359082897
1470941066
1669460850
226902994
574500969
630782070

query  rowsort
WITH `alias_2` AS (SELECT avg(distinct `table_1`.`column_7`) AS `alias_1` FROM `table_1`) SELECT `table_1`.`column_2` AS `alias_3` FROM `table_1` INNER JOIN `alias_2` ON (`table_1`.`column_2` = `alias_2`.`alias_1`) WHERE (`table_1`.`column_2` > ?)
? = 10
----


query  rowsort
WITH `alias_3` AS (SELECT avg(distinct `table_1`.`column_9`) AS `alias_2` FROM `table_1`) SELECT avg(distinct `table_1`.`column_8`) AS `alias_1` FROM `table_1` INNER JOIN `alias_3` ON (`table_1`.`column_8` = `alias_3`.`alias_2`) WHERE (`table_1`.`column_8` > ?)
? = 10
----
NULL

query  rowsort
WITH `alias_3` AS (SELECT `table_1`.`column_8` AS `alias_2` FROM `table_1`) SELECT avg(distinct `table_1`.`column_10`) AS `alias_1` FROM `table_1` INNER JOIN `alias_3` ON (`table_1`.`column_8` = `alias_3`.`alias_2`) WHERE (`table_1`.`column_8` > ?)
? = 10
----
688533335.0000

query  rowsort
WITH `alias_3` AS (SELECT avg(distinct `table_1`.`column_12`) AS `alias_2` FROM `table_1`) SELECT avg(distinct `table_1`.`column_11`) AS `alias_1` FROM `table_1` INNER JOIN `alias_3` ON (`table_1`.`column_11` = `alias_3`.`alias_2`) WHERE (`table_1`.`column_11` > ?)
? = 10
----
NULL

statement ok
DELETE FROM `table_1` WHERE (`column_13` = 0)


statement ok
DELETE FROM `table_1` WHERE (`column_13` = 1)


statement ok
DELETE FROM `table_1` WHERE (`column_13` = 2)


statement ok
DELETE FROM `table_1` WHERE (`column_13` = 3)


statement ok
DELETE FROM `table_1` WHERE (`column_13` = 4)


query  rowsort
WITH `alias_3` AS (SELECT avg(distinct `table_1`.`column_2`) AS `alias_2` FROM `table_1`) SELECT avg(distinct `table_1`.`column_1`) AS `alias_1` FROM `table_1` INNER JOIN `alias_3` ON (`table_1`.`column_1` = `alias_3`.`alias_2`)
----
NULL

query  rowsort
WITH `alias_3` AS (SELECT `table_1`.`column_3` AS `alias_2` FROM `table_1`) SELECT avg(distinct `table_1`.`column_3`) AS `alias_1` FROM `table_1` INNER JOIN `alias_3` ON (`table_1`.`column_3` = `alias_3`.`alias_2`)
----
-261952828.8000

query  rowsort
WITH `alias_3` AS (SELECT avg(distinct `table_1`.`column_5`) AS `alias_2` FROM `table_1`) SELECT avg(distinct `table_1`.`column_4`) AS `alias_1` FROM `table_1` INNER JOIN `alias_3` ON (`table_1`.`column_2` = `alias_3`.`alias_2`)
----
NULL

query  rowsort
WITH `alias_2` AS (SELECT avg(distinct `table_1`.`column_6`) AS `alias_1` FROM `table_1`) SELECT `table_1`.`column_2` AS `alias_3` FROM `table_1` INNER JOIN `alias_2` ON (`table_1`.`column_2` = `alias_2`.`alias_1`) WHERE (`table_1`.`column_2` > ?)
? = 10
----


query  rowsort
WITH `alias_2` AS (SELECT `table_1`.`column_2` AS `alias_1` FROM `table_1`) SELECT `table_1`.`column_2` AS `alias_3` FROM `table_1` INNER JOIN `alias_2` ON (`table_1`.`column_2` = `alias_2`.`alias_1`) WHERE (`table_1`.`column_2` > ?)
? = 10
----
1359082897
1669460850
226902994

query  rowsort
WITH `alias_2` AS (SELECT avg(distinct `table_1`.`column_7`) AS `alias_1` FROM `table_1`) SELECT `table_1`.`column_2` AS `alias_3` FROM `table_1` INNER JOIN `alias_2` ON (`table_1`.`column_2` = `alias_2`.`alias_1`) WHERE (`table_1`.`column_2` > ?)
? = 10
----


query  rowsort
WITH `alias_3` AS (SELECT avg(distinct `table_1`.`column_9`) AS `alias_2` FROM `table_1`) SELECT avg(distinct `table_1`.`column_8`) AS `alias_1` FROM `table_1` INNER JOIN `alias_3` ON (`table_1`.`column_8` = `alias_3`.`alias_2`) WHERE (`table_1`.`column_8` > ?)
? = 10
----
NULL

query  rowsort
WITH `alias_3` AS (SELECT `table_1`.`column_8` AS `alias_2` FROM `table_1`) SELECT avg(distinct `table_1`.`column_10`) AS `alias_1` FROM `table_1` INNER JOIN `alias_3` ON (`table_1`.`column_8` = `alias_3`.`alias_2`) WHERE (`table_1`.`column_8` > ?)
? = 10
----
348638681.5000

query  rowsort
WITH `alias_3` AS (SELECT avg(distinct `table_1`.`column_12`) AS `alias_2` FROM `table_1`) SELECT avg(distinct `table_1`.`column_11`) AS `alias_1` FROM `table_1` INNER JOIN `alias_3` ON (`table_1`.`column_11` = `alias_3`.`alias_2`) WHERE (`table_1`.`column_11` > ?)
? = 10
----
NULL
