# Generated by:
#     target/debug/noria-logictest permute --compare-to mysql://root:noria@127.1/noria -d 3 -o logictests/generated/mysql/ --only range_param --random --include-deletes --rows-per-table 10 --subquery-depth 1 --overwrite-tests

statement ok
CREATE TABLE `table_1` (`column_3` INT, `column_4` INT, `column_7` INT, `column_6` INT, `column_5` INT, `column_2` INT, `column_1` INT, `column_9` INT, `column_8` INT, PRIMARY KEY (`column_9`))


statement ok
INSERT INTO `table_1` (`column_3`, `column_4`, `column_7`, `column_6`, `column_5`, `column_2`, `column_1`, `column_9`, `column_8`) VALUES (1710694564, -947217361, -1497179996, -936913999, 1182960336, -1952295800, 1485194769, 0, -1193289661), (-900487702, 841777576, 1108910323, -2010768659, -1420762222, -1540598785, -425031630, 1, -1026334352), (-671576731, 1525884725, 1695067222, -447002342, -1481799280, 1815569502, -325953953, 2, 1509472495), (-771330323, -305796329, -1954622560, -1173661631, 1971266652, -1567260882, -865959939, 3, -1127433276), (1310620611, -1163140472, -1755669529, -381626999, -940218245, -1141997586, 1118775401, 4, 428743656), (-1489355583, -674266111, 849357534, 829135687, 1681733769, 536683971, 738326371, 5, 1401532966), (-1635261113, 1350033412, -721104464, 1707197886, 1716204647, 803216789, 59152953, 6, -51671179), (-242092171, 1462320041, -1129074192, -81860117, -1547161786, -993657750, 1980377626, 7, 347432144), (1051234858, 1134898474, -210131469, -1851217504, 836165893, 958936598, -386004615, 8, -1914867976), (1414882333, 2109324311, -2022316086, 1317548898, -476354929, -1441289775, -53880723, 9, -1606191305)


query  rowsort
SELECT avg(distinct `table_1`.`column_1`) AS `alias_1` FROM `table_1`
----
332499626.0000

query  rowsort
SELECT min(`table_1`.`column_2`) AS `alias_1` FROM `table_1`
----
-1952295800

query  rowsort
SELECT `table_1`.`column_2` AS `alias_1` FROM `table_1` WHERE (`table_1`.`column_2` > ?)
? = 10
----
1815569502
536683971
803216789
958936598

query  rowsort
SELECT avg(distinct `table_1`.`column_3`) AS `alias_1`, min(`table_1`.`column_4`) AS `alias_2` FROM `table_1`
----
-22267125.7000
-1163140472

query  rowsort
SELECT avg(distinct `table_1`.`column_5`) AS `alias_1` FROM `table_1` WHERE (`table_1`.`column_3` > ?)
? = 10
----
150638263.7500

query  rowsort
SELECT min(`table_1`.`column_6`) AS `alias_1` FROM `table_1` WHERE (`table_1`.`column_3` > ?)
? = 10
----
-1851217504

query  rowsort
SELECT avg(distinct `table_1`.`column_7`) AS `alias_1`, min(`table_1`.`column_8`) AS `alias_2` FROM `table_1` WHERE (`table_1`.`column_3` > ?)
? = 10
----
-1371324270.0000
-1914867976

statement ok
DELETE FROM `table_1` WHERE (`column_9` = 0)


statement ok
DELETE FROM `table_1` WHERE (`column_9` = 1)


statement ok
DELETE FROM `table_1` WHERE (`column_9` = 2)


statement ok
DELETE FROM `table_1` WHERE (`column_9` = 3)


statement ok
DELETE FROM `table_1` WHERE (`column_9` = 4)


query  rowsort
SELECT avg(distinct `table_1`.`column_1`) AS `alias_1` FROM `table_1`
----
467594322.4000

query  rowsort
SELECT min(`table_1`.`column_2`) AS `alias_1` FROM `table_1`
----
-1441289775

query  rowsort
SELECT `table_1`.`column_2` AS `alias_1` FROM `table_1` WHERE (`table_1`.`column_2` > ?)
? = 10
----
536683971
803216789
958936598

query  rowsort
SELECT avg(distinct `table_1`.`column_3`) AS `alias_1`, min(`table_1`.`column_4`) AS `alias_2` FROM `table_1`
----
-180118335.2000
-674266111

query  rowsort
SELECT avg(distinct `table_1`.`column_5`) AS `alias_1` FROM `table_1` WHERE (`table_1`.`column_3` > ?)
? = 10
----
179905482.0000

query  rowsort
SELECT min(`table_1`.`column_6`) AS `alias_1` FROM `table_1` WHERE (`table_1`.`column_3` > ?)
? = 10
----
-1851217504

query  rowsort
SELECT avg(distinct `table_1`.`column_7`) AS `alias_1`, min(`table_1`.`column_8`) AS `alias_2` FROM `table_1` WHERE (`table_1`.`column_3` > ?)
? = 10
----
-1116223777.5000
-1914867976
