# Generated by:
#     target/debug/noria-logictest permute --compare-to mysql://root:noria@127.1/noria -d 3 -o logictests/generated/mysql/ --only range_param --random --include-deletes --rows-per-table 10 --subquery-depth 1 --overwrite-tests

statement ok
CREATE TABLE `table_1` (`column_1` INT, `column_4` INT, `column_2` INT, `column_5` INT, `column_6` INT, `column_3` INT, `column_8` INT, `column_7` INT, `column_9` INT, PRIMARY KEY (`column_9`))


statement ok
INSERT INTO `table_1` (`column_1`, `column_4`, `column_2`, `column_5`, `column_6`, `column_3`, `column_8`, `column_7`, `column_9`) VALUES (-636480830, -446702472, -1363123750, 1034967040, 858198626, 1730038738, 2117049714, -247474546, 0), (369907783, 891063121, -153558655, 1279482233, 715657717, 1783254649, 1877816676, -1773266736, 1), (1971896699, -1948141751, 1926849389, -1475801384, 1689440200, 737282861, -2099080635, -1959834653, 2), (520857293, -340225759, 1995448029, -1771511383, 1262517041, 1314477961, 1026843753, 720341201, 3), (2118122697, -763310767, -663082891, -1466408791, -489298268, -472610769, 1183306523, -296220724, 4), (-654117965, 579548107, 2081953509, 1414009667, -1245054586, 1320545817, -1717045630, 1693080459, 5), (-946316754, 1289780710, 1230419445, 1183582652, -198684332, -1284692635, 557538540, 70288656, 6), (-1434403318, 1463489805, 1065380676, 345976298, 1018842879, 1245113436, 5922493, -1460015704, 7), (-1796945721, -1773926118, 1460077265, 833509199, -1003440585, 1678942652, 1889506421, 2114269503, 8), (-1720074569, 630432819, 115906095, -1586068175, 757917260, 1237827191, 556119708, 351884867, 9)


query  rowsort
SELECT count(`table_1`.`column_1`) AS `alias_1` FROM `table_1`
----
10

query  rowsort
SELECT sum(`table_1`.`column_2`) AS `alias_1` FROM `table_1`
----
7696269112

query  rowsort
SELECT `table_1`.`column_1` AS `alias_1` FROM `table_1` WHERE (`table_1`.`column_1` > ?)
? = 10
----
1971896699
2118122697
369907783
520857293

query  rowsort
SELECT count(`table_1`.`column_3`) AS `alias_1`, sum(`table_1`.`column_4`) AS `alias_2` FROM `table_1`
----
10
-417992305

query  rowsort
SELECT count(`table_1`.`column_5`) AS `alias_1` FROM `table_1` WHERE (`table_1`.`column_1` > ?)
? = 10
----
4

query  rowsort
SELECT sum(`table_1`.`column_6`) AS `alias_1` FROM `table_1` WHERE (`table_1`.`column_1` > ?)
? = 10
----
3178316690

query  rowsort
SELECT count(`table_1`.`column_7`) AS `alias_1`, sum(`table_1`.`column_8`) AS `alias_2` FROM `table_1` WHERE (`table_1`.`column_1` > ?)
? = 10
----
4
1988886317

statement ok
DELETE FROM `table_1` WHERE (`column_9` = 0)


statement ok
DELETE FROM `table_1` WHERE (`column_9` = 1)


statement ok
DELETE FROM `table_1` WHERE (`column_9` = 2)


statement ok
DELETE FROM `table_1` WHERE (`column_9` = 3)


statement ok
DELETE FROM `table_1` WHERE (`column_9` = 4)


query  rowsort
SELECT count(`table_1`.`column_1`) AS `alias_1` FROM `table_1`
----
5

query  rowsort
SELECT sum(`table_1`.`column_2`) AS `alias_1` FROM `table_1`
----
5953736990

query  rowsort
SELECT `table_1`.`column_1` AS `alias_1` FROM `table_1` WHERE (`table_1`.`column_1` > ?)
? = 10
----


query  rowsort
SELECT count(`table_1`.`column_3`) AS `alias_1`, sum(`table_1`.`column_4`) AS `alias_2` FROM `table_1`
----
5
2189325323

query  rowsort
SELECT count(`table_1`.`column_5`) AS `alias_1` FROM `table_1` WHERE (`table_1`.`column_1` > ?)
? = 10
----
0

query  rowsort
SELECT sum(`table_1`.`column_6`) AS `alias_1` FROM `table_1` WHERE (`table_1`.`column_1` > ?)
? = 10
----
NULL

query  rowsort
SELECT count(`table_1`.`column_7`) AS `alias_1`, sum(`table_1`.`column_8`) AS `alias_2` FROM `table_1` WHERE (`table_1`.`column_1` > ?)
? = 10
----
0
NULL
