# Generated by:
#     target/debug/noria-logictest permute --compare-to mysql://root:noria@127.1/noria -d 3 -o logictests/generated/mysql/ --only range_param --random --include-deletes --rows-per-table 10 --subquery-depth 1 --overwrite-tests

statement ok
CREATE TABLE `table_1` (`column_8` INT, `column_1` INT, `column_6` INT, `column_2` INT, `column_5` INT, `column_3` INT, `column_4` INT, `column_7` INT, `column_9` INT, PRIMARY KEY (`column_9`))


statement ok
INSERT INTO `table_1` (`column_8`, `column_1`, `column_6`, `column_2`, `column_5`, `column_3`, `column_4`, `column_7`, `column_9`) VALUES (1805889179, 778556842, 447806738, -1610327486, 345883721, -1018748697, -1501968016, 857139944, 0), (-1569665550, -1596303229, 945551018, -1281379389, -1911950541, -1558129138, -113996701, 1633945154, 1), (-1800849108, -788316332, -1952057683, -228544177, -689857912, 1376409473, 12592993, -1530802582, 2), (1540059539, -1419269871, -1654796441, -264276631, -722551780, 1726239970, -1105784854, 1179716733, 3), (-1616328075, -1563442018, 383986595, 89969586, -1475637015, 1829795759, -90022800, -1930288963, 4), (-625707776, 930742222, 1315925963, -2083785575, -1163130590, -1073530918, 1497635457, -487324408, 5), (-470658935, -1330773756, 1216741274, 1183506976, 1552297234, -169162128, 783446397, -142737915, 6), (-2109892723, 1245029816, -789326945, -1527298370, 355927212, 529111545, 437433993, -2097199974, 7), (1885393267, 591297118, 379299380, 646669710, -915653089, 284361667, -1743300889, -1349369539, 8), (-1283106245, -1366197496, 1023737233, -259568737, 1386392452, -81295360, -1142818425, 1562930083, 9)


query  rowsort
SELECT count(`table_1`.`column_1`) AS `alias_1` FROM `table_1`
----
10

query  rowsort
SELECT avg(distinct `table_1`.`column_2`) AS `alias_1` FROM `table_1`
----
-533503409.3000

query  rowsort
SELECT `table_1`.`column_2` AS `alias_1` FROM `table_1` WHERE (`table_1`.`column_2` > ?)
? = 10
----
1183506976
646669710
89969586

query  rowsort
SELECT count(`table_1`.`column_3`) AS `alias_1`, avg(distinct `table_1`.`column_4`) AS `alias_2` FROM `table_1`
----
10
-296678284.5000

query  rowsort
SELECT count(`table_1`.`column_5`) AS `alias_1` FROM `table_1` WHERE (`table_1`.`column_2` > ?)
? = 10
----
3

query  rowsort
SELECT avg(distinct `table_1`.`column_6`) AS `alias_1` FROM `table_1` WHERE (`table_1`.`column_6` > ?)
? = 10
----
816149743.0000

query  rowsort
SELECT count(`table_1`.`column_7`) AS `alias_1`, avg(distinct `table_1`.`column_8`) AS `alias_2` FROM `table_1` WHERE (`table_1`.`column_8` > ?)
? = 10
----
3
1743780661.6667

statement ok
DELETE FROM `table_1` WHERE (`column_9` = 0)


statement ok
DELETE FROM `table_1` WHERE (`column_9` = 1)


statement ok
DELETE FROM `table_1` WHERE (`column_9` = 2)


statement ok
DELETE FROM `table_1` WHERE (`column_9` = 3)


statement ok
DELETE FROM `table_1` WHERE (`column_9` = 4)


query  rowsort
SELECT count(`table_1`.`column_1`) AS `alias_1` FROM `table_1`
----
5

query  rowsort
SELECT avg(distinct `table_1`.`column_2`) AS `alias_1` FROM `table_1`
----
-408095199.2000

query  rowsort
SELECT `table_1`.`column_2` AS `alias_1` FROM `table_1` WHERE (`table_1`.`column_2` > ?)
? = 10
----
1183506976
646669710

query  rowsort
SELECT count(`table_1`.`column_3`) AS `alias_1`, avg(distinct `table_1`.`column_4`) AS `alias_2` FROM `table_1`
----
5
-33520693.4000

query  rowsort
SELECT count(`table_1`.`column_5`) AS `alias_1` FROM `table_1` WHERE (`table_1`.`column_2` > ?)
? = 10
----
2

query  rowsort
SELECT avg(distinct `table_1`.`column_6`) AS `alias_1` FROM `table_1` WHERE (`table_1`.`column_6` > ?)
? = 10
----
983925962.5000

query  rowsort
SELECT count(`table_1`.`column_7`) AS `alias_1`, avg(distinct `table_1`.`column_8`) AS `alias_2` FROM `table_1` WHERE (`table_1`.`column_8` > ?)
? = 10
----
1
1885393267.0000
