# Generated by:
#     target/debug/noria-logictest permute --compare-to mysql://root:noria@127.1/noria -d 3 -o logictests/generated/mysql/ --only range_param --random --include-deletes --rows-per-table 10 --subquery-depth 1 --overwrite-tests

statement ok
CREATE TABLE `table_1` (`column_3` INT, `column_2` INT, `column_4` INT, `column_1` INT, `column_5` INT, PRIMARY KEY (`column_5`))


statement ok
INSERT INTO `table_1` (`column_3`, `column_2`, `column_4`, `column_1`, `column_5`) VALUES (418049263, 1391578925, -433824337, 462147422, 0), (1045372791, 1219967030, 1108437570, 1076908952, 1), (-728984291, -1536788985, -1340433303, 1331832128, 2), (-129995371, -1577390972, 818340720, 1276137891, 3), (1964987055, -1307117021, -745768550, -633328240, 4), (1720031988, -1918879417, 1764614123, -198368230, 5), (497923120, 1505241795, 1666084442, 1944335375, 6), (-129568331, 466575039, -1735028405, -989565993, 7), (-1563454738, -1395536247, 1073090320, 1453142009, 8), (-809145076, 1609312828, 844388511, -651659018, 9)


query  rowsort
SELECT count(distinct `table_1`.`column_1`) AS `alias_1` FROM `table_1`
----
10

query  rowsort
SELECT `table_1`.`column_1` AS `alias_1` FROM `table_1` WHERE (`table_1`.`column_1` = ?)
? = 1
----


query  rowsort
SELECT `table_1`.`column_1` AS `alias_1` FROM `table_1` WHERE (`table_1`.`column_1` > ?)
? = 10
----
1076908952
1276137891
1331832128
1453142009
1944335375
462147422

query  rowsort
SELECT count(distinct `table_1`.`column_2`) AS `alias_1` FROM `table_1` WHERE (`table_1`.`column_1` = ?)
? = 1
----
0

query  rowsort
SELECT count(distinct `table_1`.`column_3`) AS `alias_1` FROM `table_1` WHERE (`table_1`.`column_1` > ?)
? = 10
----
6

query  rowsort
SELECT `table_1`.`column_1` AS `alias_1` FROM `table_1` WHERE ((`table_1`.`column_1` = ?) AND (`table_1`.`column_1` > ?))
? = 1
? = 10
----


query  rowsort
SELECT count(distinct `table_1`.`column_4`) AS `alias_1` FROM `table_1` WHERE ((`table_1`.`column_3` = ?) AND (`table_1`.`column_3` > ?))
? = 1
? = 10
----
0

statement ok
DELETE FROM `table_1` WHERE (`column_5` = 0)


statement ok
DELETE FROM `table_1` WHERE (`column_5` = 1)


statement ok
DELETE FROM `table_1` WHERE (`column_5` = 2)


statement ok
DELETE FROM `table_1` WHERE (`column_5` = 3)


statement ok
DELETE FROM `table_1` WHERE (`column_5` = 4)


query  rowsort
SELECT count(distinct `table_1`.`column_1`) AS `alias_1` FROM `table_1`
----
5

query  rowsort
SELECT `table_1`.`column_1` AS `alias_1` FROM `table_1` WHERE (`table_1`.`column_1` = ?)
? = 1
----


query  rowsort
SELECT `table_1`.`column_1` AS `alias_1` FROM `table_1` WHERE (`table_1`.`column_1` > ?)
? = 10
----
1453142009
1944335375

query  rowsort
SELECT count(distinct `table_1`.`column_2`) AS `alias_1` FROM `table_1` WHERE (`table_1`.`column_1` = ?)
? = 1
----
0

query  rowsort
SELECT count(distinct `table_1`.`column_3`) AS `alias_1` FROM `table_1` WHERE (`table_1`.`column_1` > ?)
? = 10
----
2

query  rowsort
SELECT `table_1`.`column_1` AS `alias_1` FROM `table_1` WHERE ((`table_1`.`column_1` = ?) AND (`table_1`.`column_1` > ?))
? = 1
? = 10
----


query  rowsort
SELECT count(distinct `table_1`.`column_4`) AS `alias_1` FROM `table_1` WHERE ((`table_1`.`column_3` = ?) AND (`table_1`.`column_3` > ?))
? = 1
? = 10
----
0
