# Generated by:
#     target/debug/noria-logictest generate --operations count,min,distinct --compare-to mysql://root@localhost/mysql --subquery-depth 1 --rows-per-table 5 -o logictests/generated/count,min,distinct.test --include-deletes
# failure: ENG-341

statement ok
CREATE TABLE table_1 (column_8 INT(32), column_9 INT(32), column_4 INT(32), column_2 INT(32), column_3 INT(32), column_6 INT(32), column_1 INT(32), column_7 INT(32), column_5 INT(32), PRIMARY KEY (column_9))


statement ok
INSERT INTO table_1 (column_7, column_5, column_4, column_9, column_3, column_8, column_6, column_1, column_2) VALUES (1, 1, 1, 2, 1, 1, 1, 1, 1), (1, 1, 1, 3, 1, 1, 1, 1, 1), (1, 1, 1, 4, 1, 1, 1, 1, 1), (1, 1, 1, 5, 1, 1, 1, 1, 1), (1, 1, 1, 6, 1, 1, 1, 1, 1)


query  nosort
SELECT count(table_1.column_1) AS alias_1 FROM table_1
----
5

query  nosort
SELECT min(table_1.column_2) AS alias_1 FROM table_1
----
1

query  nosort
SELECT DISTINCT table_1.column_1 AS alias_1 FROM table_1
----
1

query  nosort
SELECT count(table_1.column_3) AS alias_1, min(table_1.column_4) AS alias_2 FROM table_1
----
5
1

query  nosort
SELECT DISTINCT count(table_1.column_5) AS alias_1 FROM table_1
----
5

query  nosort
SELECT DISTINCT min(table_1.column_6) AS alias_1 FROM table_1
----
1

query  nosort
SELECT DISTINCT count(table_1.column_7) AS alias_1, min(table_1.column_8) AS alias_2 FROM table_1
----
5
1

statement ok
DELETE FROM table_1 WHERE (column_9 = 2)


statement ok
DELETE FROM table_1 WHERE (column_9 = 3)


query  nosort
SELECT count(table_1.column_1) AS alias_1 FROM table_1
----
3

query  nosort
SELECT min(table_1.column_2) AS alias_1 FROM table_1
----
1

query  nosort
SELECT DISTINCT table_1.column_1 AS alias_1 FROM table_1
----
1

query  nosort
SELECT count(table_1.column_3) AS alias_1, min(table_1.column_4) AS alias_2 FROM table_1
----
3
1

query  nosort
SELECT DISTINCT count(table_1.column_5) AS alias_1 FROM table_1
----
3

query  nosort
SELECT DISTINCT min(table_1.column_6) AS alias_1 FROM table_1
----
1

query  nosort
SELECT DISTINCT count(table_1.column_7) AS alias_1, min(table_1.column_8) AS alias_2 FROM table_1
----
3
1
