# Generated by:
#     target/debug/noria-logictest permute --compare-to mysql://root:noria@127.1/noria -d 3 -o logictests/generated/mysql/ --only range_param --random --include-deletes --rows-per-table 10 --subquery-depth 1 --overwrite-tests

statement ok
CREATE TABLE `table_1` (`column_1` INT, `column_2` INT, `column_4` INT, `column_5` INT, `column_3` INT, PRIMARY KEY (`column_5`))


statement ok
INSERT INTO `table_1` (`column_1`, `column_2`, `column_4`, `column_5`, `column_3`) VALUES (-1836384888, -1348764362, 1880755993, 0, -1325078655), (1210699048, -63067247, 1325069294, 1, -1406264302), (836638095, 1608528327, 1357401540, 2, -1603899006), (846062648, -186617878, -1395708024, 3, -686195527), (71901944, 232110419, -1011940632, 4, 652260663), (-1362290635, -100405572, -1325824033, 5, -1280782665), (652077503, -1881311781, 439023534, 6, -244667941), (-1848646281, -2035470758, 1713990115, 7, 495032959), (1663575351, -599801047, 2112228769, 8, 206081925), (-362609223, 1281618893, 312884478, 9, 909822563)


query  rowsort
SELECT count(distinct `table_1`.`column_1`) AS `alias_1` FROM `table_1`
----
10

query  rowsort
SELECT 1 AS `alias_1`
----
1

query  rowsort
SELECT `table_1`.`column_1` AS `alias_1` FROM `table_1` WHERE (`table_1`.`column_1` > ?)
? = 10
----
1210699048
1663575351
652077503
71901944
836638095
846062648

query  rowsort
SELECT count(distinct `table_1`.`column_2`) AS `alias_1`, 1 AS `alias_2` FROM `table_1`
----
10
1

query  rowsort
SELECT count(distinct `table_1`.`column_3`) AS `alias_1` FROM `table_1` WHERE (`table_1`.`column_1` > ?)
? = 10
----
6

query  rowsort
SELECT 1 AS `alias_1` FROM `table_1` WHERE (`table_1`.`column_1` > ?)
? = 10
----
1
1
1
1
1
1

query  rowsort
SELECT count(distinct `table_1`.`column_4`) AS `alias_1`, 1 AS `alias_2` FROM `table_1` WHERE (`table_1`.`column_1` > ?)
? = 10
----
6
1

statement ok
DELETE FROM `table_1` WHERE (`column_5` = 0)


statement ok
DELETE FROM `table_1` WHERE (`column_5` = 1)


statement ok
DELETE FROM `table_1` WHERE (`column_5` = 2)


statement ok
DELETE FROM `table_1` WHERE (`column_5` = 3)


statement ok
DELETE FROM `table_1` WHERE (`column_5` = 4)


query  rowsort
SELECT count(distinct `table_1`.`column_1`) AS `alias_1` FROM `table_1`
----
5

query  rowsort
SELECT 1 AS `alias_1`
----
1

query  rowsort
SELECT `table_1`.`column_1` AS `alias_1` FROM `table_1` WHERE (`table_1`.`column_1` > ?)
? = 10
----
1663575351
652077503

query  rowsort
SELECT count(distinct `table_1`.`column_2`) AS `alias_1`, 1 AS `alias_2` FROM `table_1`
----
5
1

query  rowsort
SELECT count(distinct `table_1`.`column_3`) AS `alias_1` FROM `table_1` WHERE (`table_1`.`column_1` > ?)
? = 10
----
2

query  rowsort
SELECT 1 AS `alias_1` FROM `table_1` WHERE (`table_1`.`column_1` > ?)
? = 10
----
1
1

query  rowsort
SELECT count(distinct `table_1`.`column_4`) AS `alias_1`, 1 AS `alias_2` FROM `table_1` WHERE (`table_1`.`column_1` > ?)
? = 10
----
2
1
