# Generated by:
#     target/debug/noria-logictest permute --compare-to mysql://root:noria@127.1/noria -d 3 -o logictests/generated/mysql/ --only range_param --random --include-deletes --rows-per-table 10 --subquery-depth 1

statement ok
CREATE TABLE `table_1` (`column_6` INT, `column_8` INT, `column_11` INT, `column_12` INT, `column_5` INT, `column_13` INT, `column_3` INT, `column_2` INT, `column_9` INT, `column_7` INT, `column_10` INT, `column_4` INT, `column_1` INT, PRIMARY KEY (`column_13`))


statement ok
INSERT INTO `table_1` (`column_6`, `column_8`, `column_11`, `column_12`, `column_5`, `column_13`, `column_3`, `column_2`, `column_9`, `column_7`, `column_10`, `column_4`, `column_1`) VALUES (-1140079493, -2040614957, 1396360543, 1550180626, -2127752264, 0, -1024768939, 1768986012, 2006135674, 659531245, 1672263471, 357988476, 823143351), (11470533, 452202463, 711614525, -248415816, -1613444655, 1, -1753926321, -345474244, -1154792706, -1237954335, 2011101060, -1945492418, 1406732534), (1986789674, 909729305, 1732504668, 748461844, -732613159, 2, 1882443182, 1073653964, -52696990, -2048432431, 1294196350, 860557828, -1777208539), (-1950615017, 2002597561, 1340723077, 798495260, 267486082, 3, 1563914764, -231867227, 680209626, -908847569, -571200743, -1011339040, -1660551560), (-1374215746, 560463968, 1279891513, -1790218160, 787682686, 4, -1167253122, -110140924, 971328153, -780547310, 1318426732, 1454462482, 1381018077), (-744970949, -2037271758, -1137403095, -1401147240, 1240848893, 5, -449716358, 1021035122, 1972920085, -7761683, 1506838549, -689004317, -1729347675), (-1498117006, 644123764, -887523631, 1039057907, 2066291989, 6, 589827076, -690053698, -780935457, 2122926903, -872876306, -1780490620, -775438116), (886726404, -1162014327, -1788274623, -1437084965, -656465221, 7, 850319148, 537527455, 1461363539, -1535649078, 1849403318, 322150719, 444620403), (-1005223540, 206880985, 425389178, -1895887377, 2026601223, 8, -1402570424, 1457493228, 630230784, -1323289583, 1421193023, 1461535240, -589455360), (-998675542, -956970851, -1357240657, -1820276619, -2124906845, 9, 588189725, -270666756, -1788643654, -1826458566, 1661412775, -270780550, -1013335685)


query  rowsort
WITH `alias_3` AS (SELECT max(`table_1`.`column_2`) AS `alias_2` FROM `table_1`) SELECT max(`table_1`.`column_1`) AS `alias_1` FROM `table_1` INNER JOIN `alias_3` ON (`table_1`.`column_2` = `alias_3`.`alias_2`)
----
823143351

query  rowsort
WITH `alias_3` AS (SELECT `table_1`.`column_2` AS `alias_2` FROM `table_1`) SELECT max(`table_1`.`column_3`) AS `alias_1` FROM `table_1` INNER JOIN `alias_3` ON (`table_1`.`column_2` = `alias_3`.`alias_2`)
----
1882443182

query  rowsort
WITH `alias_3` AS (SELECT max(`table_1`.`column_5`) AS `alias_2` FROM `table_1`) SELECT max(`table_1`.`column_4`) AS `alias_1` FROM `table_1` INNER JOIN `alias_3` ON (`table_1`.`column_1` = `alias_3`.`alias_2`)
----
NULL

query  rowsort
WITH `alias_2` AS (SELECT max(`table_1`.`column_6`) AS `alias_1` FROM `table_1`) SELECT `table_1`.`column_1` AS `alias_3` FROM `table_1` INNER JOIN `alias_2` ON (`table_1`.`column_1` = `alias_2`.`alias_1`) WHERE (`table_1`.`column_1` > ?)
? = 10
----


query  rowsort
WITH `alias_2` AS (SELECT `table_1`.`column_1` AS `alias_1` FROM `table_1`) SELECT `table_1`.`column_1` AS `alias_3` FROM `table_1` INNER JOIN `alias_2` ON (`table_1`.`column_1` = `alias_2`.`alias_1`) WHERE (`table_1`.`column_1` > ?)
? = 10
----
1381018077
1406732534
444620403
823143351

query  rowsort
WITH `alias_2` AS (SELECT max(`table_1`.`column_7`) AS `alias_1` FROM `table_1`) SELECT `table_1`.`column_1` AS `alias_3` FROM `table_1` INNER JOIN `alias_2` ON (`table_1`.`column_1` = `alias_2`.`alias_1`) WHERE (`table_1`.`column_1` > ?)
? = 10
----


query  rowsort
WITH `alias_3` AS (SELECT max(`table_1`.`column_9`) AS `alias_2` FROM `table_1`) SELECT max(`table_1`.`column_8`) AS `alias_1` FROM `table_1` INNER JOIN `alias_3` ON (`table_1`.`column_6` = `alias_3`.`alias_2`) WHERE (`table_1`.`column_6` > ?)
? = 10
----
NULL

query  rowsort
WITH `alias_3` AS (SELECT `table_1`.`column_6` AS `alias_2` FROM `table_1`) SELECT max(`table_1`.`column_10`) AS `alias_1` FROM `table_1` INNER JOIN `alias_3` ON (`table_1`.`column_6` = `alias_3`.`alias_2`) WHERE (`table_1`.`column_6` > ?)
? = 10
----
2011101060

query  rowsort
WITH `alias_3` AS (SELECT max(`table_1`.`column_12`) AS `alias_2` FROM `table_1`) SELECT max(`table_1`.`column_11`) AS `alias_1` FROM `table_1` INNER JOIN `alias_3` ON (`table_1`.`column_6` = `alias_3`.`alias_2`) WHERE (`table_1`.`column_6` > ?)
? = 10
----
NULL

statement ok
DELETE FROM `table_1` WHERE (`column_13` = 0)


statement ok
DELETE FROM `table_1` WHERE (`column_13` = 1)


statement ok
DELETE FROM `table_1` WHERE (`column_13` = 2)


statement ok
DELETE FROM `table_1` WHERE (`column_13` = 3)


statement ok
DELETE FROM `table_1` WHERE (`column_13` = 4)


query  rowsort
WITH `alias_3` AS (SELECT max(`table_1`.`column_2`) AS `alias_2` FROM `table_1`) SELECT max(`table_1`.`column_1`) AS `alias_1` FROM `table_1` INNER JOIN `alias_3` ON (`table_1`.`column_2` = `alias_3`.`alias_2`)
----
-589455360

query  rowsort
WITH `alias_3` AS (SELECT `table_1`.`column_2` AS `alias_2` FROM `table_1`) SELECT max(`table_1`.`column_3`) AS `alias_1` FROM `table_1` INNER JOIN `alias_3` ON (`table_1`.`column_2` = `alias_3`.`alias_2`)
----
850319148

query  rowsort
WITH `alias_3` AS (SELECT max(`table_1`.`column_5`) AS `alias_2` FROM `table_1`) SELECT max(`table_1`.`column_4`) AS `alias_1` FROM `table_1` INNER JOIN `alias_3` ON (`table_1`.`column_1` = `alias_3`.`alias_2`)
----
NULL

query  rowsort
WITH `alias_2` AS (SELECT max(`table_1`.`column_6`) AS `alias_1` FROM `table_1`) SELECT `table_1`.`column_1` AS `alias_3` FROM `table_1` INNER JOIN `alias_2` ON (`table_1`.`column_1` = `alias_2`.`alias_1`) WHERE (`table_1`.`column_1` > ?)
? = 10
----


query  rowsort
WITH `alias_2` AS (SELECT `table_1`.`column_1` AS `alias_1` FROM `table_1`) SELECT `table_1`.`column_1` AS `alias_3` FROM `table_1` INNER JOIN `alias_2` ON (`table_1`.`column_1` = `alias_2`.`alias_1`) WHERE (`table_1`.`column_1` > ?)
? = 10
----
444620403

query  rowsort
WITH `alias_2` AS (SELECT max(`table_1`.`column_7`) AS `alias_1` FROM `table_1`) SELECT `table_1`.`column_1` AS `alias_3` FROM `table_1` INNER JOIN `alias_2` ON (`table_1`.`column_1` = `alias_2`.`alias_1`) WHERE (`table_1`.`column_1` > ?)
? = 10
----


query  rowsort
WITH `alias_3` AS (SELECT max(`table_1`.`column_9`) AS `alias_2` FROM `table_1`) SELECT max(`table_1`.`column_8`) AS `alias_1` FROM `table_1` INNER JOIN `alias_3` ON (`table_1`.`column_6` = `alias_3`.`alias_2`) WHERE (`table_1`.`column_6` > ?)
? = 10
----
NULL

query  rowsort
WITH `alias_3` AS (SELECT `table_1`.`column_6` AS `alias_2` FROM `table_1`) SELECT max(`table_1`.`column_10`) AS `alias_1` FROM `table_1` INNER JOIN `alias_3` ON (`table_1`.`column_6` = `alias_3`.`alias_2`) WHERE (`table_1`.`column_6` > ?)
? = 10
----
1849403318

query  rowsort
WITH `alias_3` AS (SELECT max(`table_1`.`column_12`) AS `alias_2` FROM `table_1`) SELECT max(`table_1`.`column_11`) AS `alias_1` FROM `table_1` INNER JOIN `alias_3` ON (`table_1`.`column_6` = `alias_3`.`alias_2`) WHERE (`table_1`.`column_6` > ?)
? = 10
----
NULL
