# Generated by:
#     target/debug/noria-logictest permute -d 3 -o logictests/generated/mysql --only in_parameter --compare-to mysql://root:noria@localhost/mysql --subquery-depth 1 --rows-per-table 5 --include-deletes --overwrite-tests

statement ok
CREATE TABLE table_1 (column_5 TEXT, column_9 INT, column_7 TEXT, column_2 INT, column_3 TEXT, column_8 INT, column_6 INT, column_1 TEXT, column_4 INT, PRIMARY KEY (column_9))


statement ok
INSERT INTO table_1 (column_5, column_9, column_7, column_2, column_3, column_8, column_6, column_1, column_4) VALUES ('2', 0, 'a', 1, 'a', 1, 2, '2', 1), ('a', 1, 'a', 1, 'a', 1, 1, 'a', 1), ('0', 2, 'a', 1, 'a', 1, 1, '0', 1), ('a', 3, 'a', 1, 'a', 1, 1, 'a', 1), ('1', 4, 'a', 1, 'a', 1, 0, '1', 1)


query  rowsort
SELECT group_concat(table_1.column_1 separator ', ') AS alias_1 FROM table_1
----
2, a, 0, a, 1

query  rowsort
SELECT avg(table_1.column_2) AS alias_1 FROM table_1
----
1.0000

query  rowsort
SELECT table_1.column_1 AS alias_1 FROM table_1 WHERE table_1.column_1 IN (?, ?, ?)
? = 0
? = 1
? = 2
----
0
1
2

query  rowsort
SELECT group_concat(table_1.column_3 separator ', ') AS alias_1, avg(table_1.column_4) AS alias_2 FROM table_1
----
a, a, a, a, a
1.0000

query  rowsort
SELECT group_concat(table_1.column_5 separator ', ') AS alias_1 FROM table_1 WHERE table_1.column_1 IN (?, ?, ?)
? = 0
? = 1
? = 2
----
2, 0, 1

query  rowsort
SELECT avg(table_1.column_6) AS alias_1 FROM table_1 WHERE table_1.column_6 IN (?, ?, ?)
? = 0
? = 1
? = 2
----
1.0000

query  rowsort
SELECT group_concat(table_1.column_7 separator ', ') AS alias_1, avg(table_1.column_8) AS alias_2 FROM table_1 WHERE table_1.column_5 IN (?, ?, ?)
? = 0
? = 1
? = 2
----
a, a, a
1.0000

statement ok
DELETE FROM table_1 WHERE (column_9 = 0)


statement ok
DELETE FROM table_1 WHERE (column_9 = 1)


query  rowsort
SELECT group_concat(table_1.column_1 separator ', ') AS alias_1 FROM table_1
----
0, a, 1

query  rowsort
SELECT avg(table_1.column_2) AS alias_1 FROM table_1
----
1.0000

query  rowsort
SELECT table_1.column_1 AS alias_1 FROM table_1 WHERE table_1.column_1 IN (?, ?, ?)
? = 0
? = 1
? = 2
----
0
1

query  rowsort
SELECT group_concat(table_1.column_3 separator ', ') AS alias_1, avg(table_1.column_4) AS alias_2 FROM table_1
----
a, a, a
1.0000

query  rowsort
SELECT group_concat(table_1.column_5 separator ', ') AS alias_1 FROM table_1 WHERE table_1.column_1 IN (?, ?, ?)
? = 0
? = 1
? = 2
----
0, 1

query  rowsort
SELECT avg(table_1.column_6) AS alias_1 FROM table_1 WHERE table_1.column_6 IN (?, ?, ?)
? = 0
? = 1
? = 2
----
0.6667

query  rowsort
SELECT group_concat(table_1.column_7 separator ', ') AS alias_1, avg(table_1.column_8) AS alias_2 FROM table_1 WHERE table_1.column_5 IN (?, ?, ?)
? = 0
? = 1
? = 2
----
a, a
1.0000
