# Generated by:
#     target/debug/noria-logictest permute -d 3 -o logictests/generated/mysql --only in_parameter --compare-to mysql://root:noria@localhost/mysql --subquery-depth 1 --rows-per-table 5 --include-deletes --overwrite-tests

statement ok
CREATE TABLE table_1 (column_9 INT, column_3 TEXT, column_5 TEXT, column_4 INT, column_2 INT, column_7 TEXT, column_1 TEXT, column_6 INT, column_8 INT, PRIMARY KEY (column_9))


statement ok
INSERT INTO table_1 (column_9, column_3, column_5, column_4, column_2, column_7, column_1, column_6, column_8) VALUES (0, '0', 'a', 1, 0, 'a', 'a', 1, 1), (1, 'a', 'a', 1, 1, 'a', 'a', 1, 1), (2, '1', 'a', 0, 1, 'a', 'a', 1, 1), (3, 'a', 'a', 1, 1, 'a', 'a', 1, 1), (4, '2', 'a', 2, 2, 'a', 'a', 1, 1)


query  rowsort
SELECT group_concat(table_1.column_1 separator ', ') AS alias_1 FROM table_1
----
a, a, a, a, a

query  rowsort
SELECT min(table_1.column_2) AS alias_1 FROM table_1
----
0

query  rowsort
SELECT table_1.column_2 AS alias_1 FROM table_1 WHERE table_1.column_2 IN (?, ?, ?)
? = 0
? = 1
? = 2
----
0
1
1
1
2

query  rowsort
SELECT group_concat(table_1.column_3 separator ', ') AS alias_1, min(table_1.column_4) AS alias_2 FROM table_1
----
0, a, 1, a, 2
0

query  rowsort
SELECT group_concat(table_1.column_5 separator ', ') AS alias_1 FROM table_1 WHERE table_1.column_4 IN (?, ?, ?)
? = 0
? = 1
? = 2
----
a, a, a, a, a

query  rowsort
SELECT min(table_1.column_6) AS alias_1 FROM table_1 WHERE table_1.column_4 IN (?, ?, ?)
? = 0
? = 1
? = 2
----
1

query  rowsort
SELECT group_concat(table_1.column_7 separator ', ') AS alias_1, min(table_1.column_8) AS alias_2 FROM table_1 WHERE table_1.column_3 IN (?, ?, ?)
? = 0
? = 1
? = 2
----
a, a, a
1

statement ok
DELETE FROM table_1 WHERE (column_9 = 0)


statement ok
DELETE FROM table_1 WHERE (column_9 = 1)


query  rowsort
SELECT group_concat(table_1.column_1 separator ', ') AS alias_1 FROM table_1
----
a, a, a

query  rowsort
SELECT min(table_1.column_2) AS alias_1 FROM table_1
----
1

query  rowsort
SELECT table_1.column_2 AS alias_1 FROM table_1 WHERE table_1.column_2 IN (?, ?, ?)
? = 0
? = 1
? = 2
----
1
1
2

query  rowsort
SELECT group_concat(table_1.column_3 separator ', ') AS alias_1, min(table_1.column_4) AS alias_2 FROM table_1
----
1, a, 2
0

query  rowsort
SELECT group_concat(table_1.column_5 separator ', ') AS alias_1 FROM table_1 WHERE table_1.column_4 IN (?, ?, ?)
? = 0
? = 1
? = 2
----
a, a, a

query  rowsort
SELECT min(table_1.column_6) AS alias_1 FROM table_1 WHERE table_1.column_4 IN (?, ?, ?)
? = 0
? = 1
? = 2
----
1

query  rowsort
SELECT group_concat(table_1.column_7 separator ', ') AS alias_1, min(table_1.column_8) AS alias_2 FROM table_1 WHERE table_1.column_3 IN (?, ?, ?)
? = 0
? = 1
? = 2
----
a, a
1
