# Generated by:
#     target/debug/noria-logictest generate --operations group_concat,max,topk --compare-to mysql://root@localhost/mysql --subquery-depth 1 --rows-per-table 5 -o logictests/generated/group_concat,max,topk.test --include-deletes
# failure: ENG-339

statement ok
CREATE TABLE table_1 (column_4 INT(32), column_8 INT(32), column_13 TEXT, column_11 TEXT, column_1 TEXT, column_9 TEXT, column_6 TEXT, column_17 INT(32), column_14 INT(32), column_15 TEXT, column_3 TEXT, column_16 INT(32), column_12 INT(32), column_5 TEXT, column_7 INT(32), column_2 INT(32), column_10 INT(32), PRIMARY KEY (column_17))


statement ok
INSERT INTO table_1 (column_11, column_9, column_17, column_14, column_4, column_1, column_15, column_7, column_10, column_6, column_16, column_12, column_3, column_13, column_5, column_2, column_8) VALUES ('a', 'a', 2, 1, 1, 'a', 'a', 1, 1, 'a', 1, 1, 'a', 'a', 'a', 1, 1), ('a', 'a', 3, 1, 1, 'a', 'a', 1, 1, 'a', 1, 1, 'a', 'a', 'a', 1, 1), ('a', 'a', 4, 1, 1, 'a', 'a', 1, 1, 'a', 1, 1, 'a', 'a', 'a', 1, 1), ('a', 'a', 5, 1, 1, 'a', 'a', 1, 1, 'a', 1, 1, 'a', 'a', 'a', 1, 1), ('a', 'a', 6, 1, 1, 'a', 'a', 1, 1, 'a', 1, 1, 'a', 'a', 'a', 1, 1)


query  nosort
SELECT group_concat(table_1.column_1 separator ', ') AS alias_1 FROM table_1
----
a, a, a, a, a

query  nosort
SELECT max(table_1.column_2) AS alias_1 FROM table_1
----
1

query  nosort
SELECT table_1.column_1 AS alias_1 FROM table_1 ORDER BY table_1.column_1 ASC LIMIT 10
----
a
a
a
a
a

query  nosort
SELECT table_1.column_1 AS alias_1 FROM table_1 ORDER BY table_1.column_1 DESC LIMIT 10
----
a
a
a
a
a

query  nosort
SELECT group_concat(table_1.column_3 separator ', ') AS alias_1, max(table_1.column_4) AS alias_2 FROM table_1
----
a, a, a, a, a
1

query  nosort
SELECT group_concat(table_1.column_5 separator ', ') AS alias_1 FROM table_1 ORDER BY table_1.column_1 ASC LIMIT 10
----
a, a, a, a, a

query  nosort
SELECT group_concat(table_1.column_6 separator ', ') AS alias_1 FROM table_1 ORDER BY table_1.column_1 DESC LIMIT 10
----
a, a, a, a, a

query  nosort
SELECT max(table_1.column_7) AS alias_1 FROM table_1 ORDER BY table_1.column_1 ASC LIMIT 10
----
1

query  nosort
SELECT max(table_1.column_8) AS alias_1 FROM table_1 ORDER BY table_1.column_4 DESC LIMIT 10
----
1

query  nosort
SELECT table_1.column_4 AS alias_1 FROM table_1 ORDER BY table_1.column_4 DESC LIMIT 10
----
1
1
1
1
1

query  nosort
SELECT group_concat(table_1.column_9 separator ', ') AS alias_1, max(table_1.column_10) AS alias_2 FROM table_1 ORDER BY table_1.column_4 ASC LIMIT 10
----
a, a, a, a, a
1

query  nosort
SELECT group_concat(table_1.column_11 separator ', ') AS alias_1, max(table_1.column_12) AS alias_2 FROM table_1 ORDER BY table_1.column_11 DESC LIMIT 10
----
a, a, a, a, a
1

query  nosort
SELECT group_concat(table_1.column_13 separator ', ') AS alias_1 FROM table_1 ORDER BY table_1.column_11 DESC LIMIT 10
----
a, a, a, a, a

query  nosort
SELECT max(table_1.column_14) AS alias_1 FROM table_1 ORDER BY table_1.column_11 DESC LIMIT 10
----
1

query  nosort
SELECT group_concat(table_1.column_15 separator ', ') AS alias_1, max(table_1.column_16) AS alias_2 FROM table_1 ORDER BY table_1.column_4 DESC LIMIT 10
----
a, a, a, a, a
1

statement ok
DELETE FROM table_1 WHERE (column_17 = 2)


statement ok
DELETE FROM table_1 WHERE (column_17 = 3)


query  nosort
SELECT group_concat(table_1.column_1 separator ', ') AS alias_1 FROM table_1
----
a, a, a

query  nosort
SELECT max(table_1.column_2) AS alias_1 FROM table_1
----
1

query  nosort
SELECT table_1.column_1 AS alias_1 FROM table_1 ORDER BY table_1.column_1 ASC LIMIT 10
----
a
a
a

query  nosort
SELECT table_1.column_1 AS alias_1 FROM table_1 ORDER BY table_1.column_1 DESC LIMIT 10
----
a
a
a

query  nosort
SELECT group_concat(table_1.column_3 separator ', ') AS alias_1, max(table_1.column_4) AS alias_2 FROM table_1
----
a, a, a
1

query  nosort
SELECT group_concat(table_1.column_5 separator ', ') AS alias_1 FROM table_1 ORDER BY table_1.column_1 ASC LIMIT 10
----
a, a, a

query  nosort
SELECT group_concat(table_1.column_6 separator ', ') AS alias_1 FROM table_1 ORDER BY table_1.column_1 DESC LIMIT 10
----
a, a, a

query  nosort
SELECT max(table_1.column_7) AS alias_1 FROM table_1 ORDER BY table_1.column_1 ASC LIMIT 10
----
1

query  nosort
SELECT max(table_1.column_8) AS alias_1 FROM table_1 ORDER BY table_1.column_4 DESC LIMIT 10
----
1

query  nosort
SELECT table_1.column_4 AS alias_1 FROM table_1 ORDER BY table_1.column_4 DESC LIMIT 10
----
1
1
1

query  nosort
SELECT group_concat(table_1.column_9 separator ', ') AS alias_1, max(table_1.column_10) AS alias_2 FROM table_1 ORDER BY table_1.column_4 ASC LIMIT 10
----
a, a, a
1

query  nosort
SELECT group_concat(table_1.column_11 separator ', ') AS alias_1, max(table_1.column_12) AS alias_2 FROM table_1 ORDER BY table_1.column_11 DESC LIMIT 10
----
a, a, a
1

query  nosort
SELECT group_concat(table_1.column_13 separator ', ') AS alias_1 FROM table_1 ORDER BY table_1.column_11 DESC LIMIT 10
----
a, a, a

query  nosort
SELECT max(table_1.column_14) AS alias_1 FROM table_1 ORDER BY table_1.column_11 DESC LIMIT 10
----
1

query  nosort
SELECT group_concat(table_1.column_15 separator ', ') AS alias_1, max(table_1.column_16) AS alias_2 FROM table_1 ORDER BY table_1.column_4 DESC LIMIT 10
----
a, a, a
1
