# Generated by:
#     target/debug/noria-logictest permute --compare-to mysql://root:noria@127.1/noria -d 3 -o logictests/generated/mysql/ --only range_param --random --include-deletes --rows-per-table 10 --subquery-depth 1

statement ok
CREATE TABLE `table_3` (`column_2` INT, `column_4` INT, `column_3` INT, `column_1` INT, `column_5` INT, PRIMARY KEY (`column_5`))


statement ok
CREATE TABLE `table_7` (`column_1` INT, `column_3` INT, `column_2` INT, PRIMARY KEY (`column_3`))


statement ok
CREATE TABLE `table_1` (`column_2` INT, `column_1` INT, `column_3` INT, PRIMARY KEY (`column_3`))


statement ok
CREATE TABLE `table_9` (`column_2` INT, `column_3` INT, `column_1` INT, PRIMARY KEY (`column_3`))


statement ok
CREATE TABLE `table_8` (`column_2` INT, `column_3` INT, `column_1` INT, PRIMARY KEY (`column_3`))


statement ok
CREATE TABLE `table_6` (`column_1` INT, `column_2` INT, `column_3` INT, PRIMARY KEY (`column_3`))


statement ok
CREATE TABLE `table_4` (`column_2` INT, `column_3` INT, `column_1` INT, PRIMARY KEY (`column_3`))


statement ok
CREATE TABLE `table_5` (`column_1` INT, `column_2` INT, `column_6` INT, `column_7` INT, `column_3` INT, `column_4` INT, `column_5` INT, PRIMARY KEY (`column_7`))


statement ok
CREATE TABLE `table_2` (`column_2` INT, `column_3` INT, `column_1` INT, `column_4` INT, PRIMARY KEY (`column_4`))


statement ok
INSERT INTO `table_3` (`column_2`, `column_4`, `column_3`, `column_1`, `column_5`) VALUES (-774249023, 1811084042, -338519372, -1556056417, 0), (-1906731760, -1722074822, -1052621603, -742165930, 1), (1670764048, 556236013, -1619737771, 1607348760, 2), (-1828907922, -556687400, -318058143, 1977008608, 3), (-984436050, 1241566839, -1992384229, 978519926, 4), (70499928, -979224751, -25685062, 1207332098, 5), (-481497289, -96319657, -896110725, -1638340502, 6), (-1969918848, 276357786, 1897474647, 1511678279, 7), (19207264, 1067861865, 1512822304, 833853041, 8), (1980689445, -520483561, -1636298926, -2024950390, 9)


statement ok
INSERT INTO `table_7` (`column_1`, `column_3`, `column_2`) VALUES (1260036351, 0, -1919626250), (-676667213, 1, -1968969741), (2005793376, 2, -1083405710), (1418451089, 3, -1133180156), (-1827262944, 4, 1102950385), (70350047, 5, 431057295), (-1273785301, 6, 1898366963), (-568943523, 7, 289387664), (835946119, 8, 1010736261), (-1899844230, 9, -1711449986)


statement ok
INSERT INTO `table_1` (`column_2`, `column_1`, `column_3`) VALUES (-322789708, 895897924, 0), (1371971233, -1651481237, 1), (-795827983, -1967280097, 2), (-422756138, 144605467, 3), (-1237545278, -2022091863, 4), (194844325, 350540506, 5), (-1324980961, -2142028998, 6), (-1559827504, -1957070550, 7), (-1365086868, 1287413465, 8), (1090252547, 56855442, 9)


statement ok
INSERT INTO `table_9` (`column_2`, `column_3`, `column_1`) VALUES (-85572920, 0, -1681840), (-345089965, 1, 338124157), (697876552, 2, 1344438238), (1969839060, 3, -762644143), (-1047629501, 4, -656584038), (1762198543, 5, -18566497), (-1769091692, 6, 1781619541), (-2027325478, 7, -899148695), (-1441715716, 8, 1900442565), (-111073736, 9, 1587560768)


statement ok
INSERT INTO `table_8` (`column_2`, `column_3`, `column_1`) VALUES (-1127434336, 0, -1287037991), (618268854, 1, -1600362539), (1592360604, 2, 934861567), (1428741067, 3, 1831524138), (-1000937745, 4, 1598142318), (-583080403, 5, 1051964969), (-1398972498, 6, -338671758), (-808013364, 7, 43541257), (-1994368721, 8, -745091660), (-1913456621, 9, -1276919127)


statement ok
INSERT INTO `table_6` (`column_1`, `column_2`, `column_3`) VALUES (1846051594, -1628330135, 0), (-1752007858, -1556684057, 1), (-603146212, -219846410, 2), (-909976586, 1536459695, 3), (-774514508, -944019428, 4), (-1905011953, -1265789550, 5), (1323574795, -1489154640, 6), (771034332, -188048364, 7), (-1688395075, 15240440, 8), (1749831893, -1623825004, 9)


statement ok
INSERT INTO `table_4` (`column_2`, `column_3`, `column_1`) VALUES (-1031211361, 0, 158740794), (-1743529110, 1, -518977480), (-1188250789, 2, -2052904621), (1387585893, 3, -95050587), (1705604130, 4, 19244921), (1117630876, 5, -295790724), (296281736, 6, -1657875702), (-621250684, 7, -1663698386), (735309090, 8, -609992934), (1754588987, 9, 1894338819)


statement ok
INSERT INTO `table_5` (`column_1`, `column_2`, `column_6`, `column_7`, `column_3`, `column_4`, `column_5`) VALUES (-1235871764, 372708544, 529261251, 0, 2110510582, 1947099569, -1963751610), (1499380053, 2084967859, -2110570010, 1, -867120490, -1523591679, -454237004), (736359621, -1350818190, 2138385833, 2, 812014201, 1261104416, 701261645), (161246749, -1262925899, -522363966, 3, -1173976239, 2025795508, 639151232), (-1031307139, 2051232491, 699099978, 4, -243135923, 1880938222, 439418822), (901611147, -749534857, -1783672184, 5, 116325825, -131415275, 2030745830), (-284576394, -873776788, -1657833572, 6, 2042228204, 845472770, -1720662797), (-2129797384, 1308138653, -1109846537, 7, -841680967, 141674847, -2065857223), (1745673030, 1347832073, 504295800, 8, -193382610, 1254325492, -1034413562), (1567194212, -610067056, 2008733908, 9, -657741031, -1718114145, -1747335712)


statement ok
INSERT INTO `table_2` (`column_2`, `column_3`, `column_1`, `column_4`) VALUES (447860564, -1339266899, -2123295077, 0), (1712420348, 1105339819, -1197363509, 1), (1267534849, -1147969128, 1750428017, 2), (277435251, -503276682, -1024020687, 3), (117321499, 506754209, 2000755643, 4), (951103801, -1938978278, 2021285104, 5), (1606235062, -1775999813, 688062975, 6), (39401627, 899145884, 761453740, 7), (1415564120, -90196319, -1552086772, 8), (-1520155796, 596687070, 407119281, 9)


query  rowsort
SELECT `table_1`.`column_2` AS `alias_1`, `table_2`.`column_2` AS `alias_2` FROM `table_1` INNER JOIN `table_2` ON (`table_1`.`column_1` = `table_2`.`column_1`)
----


query  rowsort
SELECT `table_2`.`column_3` AS `alias_1`, `table_3`.`column_2` AS `alias_2` FROM `table_2` LEFT JOIN `table_3` ON (`table_2`.`column_2` = `table_3`.`column_1`)
----
-1147969128
NULL
-1339266899
NULL
-1775999813
NULL
-1938978278
NULL
-503276682
NULL
-90196319
NULL
1105339819
NULL
506754209
NULL
596687070
NULL
899145884
NULL

query  rowsort
SELECT `table_3`.`column_2` AS `alias_1` FROM `table_3` WHERE (`table_3`.`column_2` > ?)
? = 10
----
1670764048
19207264
1980689445
70499928

query  rowsort
SELECT `table_3`.`column_3` AS `alias_1`, `table_4`.`column_2` AS `alias_2`, `table_3`.`column_4` AS `alias_3`, `table_5`.`column_2` AS `alias_4` FROM `table_3` INNER JOIN `table_4` ON (`table_3`.`column_2` = `table_4`.`column_1`) LEFT JOIN `table_5` ON (`table_3`.`column_2` = `table_5`.`column_1`)
----


query  rowsort
SELECT `table_5`.`column_3` AS `alias_1`, `table_6`.`column_2` AS `alias_2` FROM `table_5` INNER JOIN `table_6` ON (`table_5`.`column_1` = `table_6`.`column_1`) WHERE (`table_5`.`column_1` > ?)
? = 10
----


query  rowsort
SELECT `table_5`.`column_4` AS `alias_1`, `table_7`.`column_2` AS `alias_2` FROM `table_5` LEFT JOIN `table_7` ON (`table_5`.`column_1` = `table_7`.`column_1`) WHERE (`table_5`.`column_1` > ?)
? = 10
----
-131415275
NULL
-1523591679
NULL
-1718114145
NULL
1254325492
NULL
1261104416
NULL
2025795508
NULL

query  rowsort
SELECT `table_5`.`column_5` AS `alias_1`, `table_8`.`column_2` AS `alias_2`, `table_5`.`column_6` AS `alias_3`, `table_9`.`column_2` AS `alias_4` FROM `table_5` INNER JOIN `table_8` ON (`table_5`.`column_1` = `table_8`.`column_1`) LEFT JOIN `table_9` ON (`table_5`.`column_1` = `table_9`.`column_1`) WHERE (`table_5`.`column_1` > ?)
? = 10
----


statement ok
DELETE FROM `table_3` WHERE (`column_5` = 0)


statement ok
DELETE FROM `table_3` WHERE (`column_5` = 1)


statement ok
DELETE FROM `table_3` WHERE (`column_5` = 2)


statement ok
DELETE FROM `table_3` WHERE (`column_5` = 3)


statement ok
DELETE FROM `table_3` WHERE (`column_5` = 4)


statement ok
DELETE FROM `table_7` WHERE (`column_3` = 0)


statement ok
DELETE FROM `table_7` WHERE (`column_3` = 1)


statement ok
DELETE FROM `table_7` WHERE (`column_3` = 2)


statement ok
DELETE FROM `table_7` WHERE (`column_3` = 3)


statement ok
DELETE FROM `table_7` WHERE (`column_3` = 4)


statement ok
DELETE FROM `table_1` WHERE (`column_3` = 0)


statement ok
DELETE FROM `table_1` WHERE (`column_3` = 1)


statement ok
DELETE FROM `table_1` WHERE (`column_3` = 2)


statement ok
DELETE FROM `table_1` WHERE (`column_3` = 3)


statement ok
DELETE FROM `table_1` WHERE (`column_3` = 4)


statement ok
DELETE FROM `table_9` WHERE (`column_3` = 0)


statement ok
DELETE FROM `table_9` WHERE (`column_3` = 1)


statement ok
DELETE FROM `table_9` WHERE (`column_3` = 2)


statement ok
DELETE FROM `table_9` WHERE (`column_3` = 3)


statement ok
DELETE FROM `table_9` WHERE (`column_3` = 4)


statement ok
DELETE FROM `table_8` WHERE (`column_3` = 0)


statement ok
DELETE FROM `table_8` WHERE (`column_3` = 1)


statement ok
DELETE FROM `table_8` WHERE (`column_3` = 2)


statement ok
DELETE FROM `table_8` WHERE (`column_3` = 3)


statement ok
DELETE FROM `table_8` WHERE (`column_3` = 4)


statement ok
DELETE FROM `table_6` WHERE (`column_3` = 0)


statement ok
DELETE FROM `table_6` WHERE (`column_3` = 1)


statement ok
DELETE FROM `table_6` WHERE (`column_3` = 2)


statement ok
DELETE FROM `table_6` WHERE (`column_3` = 3)


statement ok
DELETE FROM `table_6` WHERE (`column_3` = 4)


statement ok
DELETE FROM `table_4` WHERE (`column_3` = 0)


statement ok
DELETE FROM `table_4` WHERE (`column_3` = 1)


statement ok
DELETE FROM `table_4` WHERE (`column_3` = 2)


statement ok
DELETE FROM `table_4` WHERE (`column_3` = 3)


statement ok
DELETE FROM `table_4` WHERE (`column_3` = 4)


statement ok
DELETE FROM `table_5` WHERE (`column_7` = 0)


statement ok
DELETE FROM `table_5` WHERE (`column_7` = 1)


statement ok
DELETE FROM `table_5` WHERE (`column_7` = 2)


statement ok
DELETE FROM `table_5` WHERE (`column_7` = 3)


statement ok
DELETE FROM `table_5` WHERE (`column_7` = 4)


statement ok
DELETE FROM `table_2` WHERE (`column_4` = 0)


statement ok
DELETE FROM `table_2` WHERE (`column_4` = 1)


statement ok
DELETE FROM `table_2` WHERE (`column_4` = 2)


statement ok
DELETE FROM `table_2` WHERE (`column_4` = 3)


statement ok
DELETE FROM `table_2` WHERE (`column_4` = 4)


query  rowsort
SELECT `table_1`.`column_2` AS `alias_1`, `table_2`.`column_2` AS `alias_2` FROM `table_1` INNER JOIN `table_2` ON (`table_1`.`column_1` = `table_2`.`column_1`)
----


query  rowsort
SELECT `table_2`.`column_3` AS `alias_1`, `table_3`.`column_2` AS `alias_2` FROM `table_2` LEFT JOIN `table_3` ON (`table_2`.`column_2` = `table_3`.`column_1`)
----
-1775999813
NULL
-1938978278
NULL
-90196319
NULL
596687070
NULL
899145884
NULL

query  rowsort
SELECT `table_3`.`column_2` AS `alias_1` FROM `table_3` WHERE (`table_3`.`column_2` > ?)
? = 10
----
19207264
1980689445
70499928

query  rowsort
SELECT `table_3`.`column_3` AS `alias_1`, `table_4`.`column_2` AS `alias_2`, `table_3`.`column_4` AS `alias_3`, `table_5`.`column_2` AS `alias_4` FROM `table_3` INNER JOIN `table_4` ON (`table_3`.`column_2` = `table_4`.`column_1`) LEFT JOIN `table_5` ON (`table_3`.`column_2` = `table_5`.`column_1`)
----


query  rowsort
SELECT `table_5`.`column_3` AS `alias_1`, `table_6`.`column_2` AS `alias_2` FROM `table_5` INNER JOIN `table_6` ON (`table_5`.`column_1` = `table_6`.`column_1`) WHERE (`table_5`.`column_1` > ?)
? = 10
----


query  rowsort
SELECT `table_5`.`column_4` AS `alias_1`, `table_7`.`column_2` AS `alias_2` FROM `table_5` LEFT JOIN `table_7` ON (`table_5`.`column_1` = `table_7`.`column_1`) WHERE (`table_5`.`column_1` > ?)
? = 10
----
-131415275
NULL
-1718114145
NULL
1254325492
NULL

query  rowsort
SELECT `table_5`.`column_5` AS `alias_1`, `table_8`.`column_2` AS `alias_2`, `table_5`.`column_6` AS `alias_3`, `table_9`.`column_2` AS `alias_4` FROM `table_5` INNER JOIN `table_8` ON (`table_5`.`column_1` = `table_8`.`column_1`) LEFT JOIN `table_9` ON (`table_5`.`column_1` = `table_9`.`column_1`) WHERE (`table_5`.`column_1` > ?)
? = 10
----

