# Generated by:
#     target/debug/noria-logictest permute --compare-to mysql://root:noria@127.1/noria -d 3 -o logictests/generated/mysql/ --only range_param --random --include-deletes --rows-per-table 10 --subquery-depth 1

statement ok
CREATE TABLE `table_2` (`column_4` INT, `column_1` INT, `column_3` INT, `column_2` INT, PRIMARY KEY (`column_4`))


statement ok
CREATE TABLE `table_3` (`column_1` INT, `column_2` INT, `column_3` INT, PRIMARY KEY (`column_3`))


statement ok
CREATE TABLE `table_1` (`column_2` INT, `column_1` INT, `column_4` INT, `column_5` INT, `column_3` INT, PRIMARY KEY (`column_5`))


statement ok
CREATE TABLE `table_5` (`column_2` INT, `column_1` INT, `column_3` INT, PRIMARY KEY (`column_3`))


statement ok
CREATE TABLE `table_4` (`column_3` INT, `column_1` INT, `column_2` INT, PRIMARY KEY (`column_3`))


statement ok
INSERT INTO `table_2` (`column_4`, `column_1`, `column_3`, `column_2`) VALUES (0, 119855377, -113228819, 1293490836), (1, 2037764967, 1199443808, 1054637137), (2, -1362215419, 125743842, 614631464), (3, 1809940617, -1838885130, 1958803759), (4, -940535612, -143815341, 205771799), (5, -673229817, -726807741, -1906096635), (6, -973809779, -537739425, -1978934036), (7, 772929362, 1261820731, -1931536211), (8, -1799361055, 583964730, 2036215030), (9, -52832365, -1096806163, -1597945684)


statement ok
INSERT INTO `table_3` (`column_1`, `column_2`, `column_3`) VALUES (1876263451, -86078411, 0), (-707673693, -10013314, 1), (125526749, 29698581, 2), (-693137663, -2117604628, 3), (489942501, -1428160097, 4), (409185219, -2133982184, 5), (-945993204, -2023949795, 6), (-1551005820, -839188702, 7), (-546843268, 1405011399, 8), (-926355125, 1033652275, 9)


statement ok
INSERT INTO `table_1` (`column_2`, `column_1`, `column_4`, `column_5`, `column_3`) VALUES (2084832062, 21764905, -1087052018, 0, -1115791578), (724859057, -147276978, 1303942455, 1, -135560713), (2016216972, -70700757, 1798393558, 2, -1140272071), (-353429176, 828270599, 1037692441, 3, 801173708), (-552463145, 660020247, -1378213495, 4, 490642854), (-1487076440, -1988345288, -2103207961, 5, 701277434), (528072913, -2038435588, 1877114557, 6, 960961615), (-23018266, -514801016, -9612904, 7, 1358816366), (1644723775, 1615605313, 2095632917, 8, -1111127415), (1258493038, -1770116475, -1384513274, 9, 152980602)


statement ok
INSERT INTO `table_5` (`column_2`, `column_1`, `column_3`) VALUES (296964741, 1745686683, 0), (59655283, -493240210, 1), (-318649686, 1975618342, 2), (-720949723, -1821757523, 3), (-1638768682, -255205209, 4), (1532698256, 678600597, 5), (1153673920, 1300192694, 6), (730783650, 929985613, 7), (1516434756, 2062220309, 8), (-1806420684, 1368630919, 9)


statement ok
INSERT INTO `table_4` (`column_3`, `column_1`, `column_2`) VALUES (0, -684044882, 961572253), (1, 1247028693, 499207949), (2, -139888294, 493118511), (3, 309488089, 698295976), (4, -543215491, -2017620816), (5, 1014227145, -564143629), (6, -928806544, 637931821), (7, -1440765494, 1059340386), (8, -936901019, 1845645517), (9, 2011920007, 788435854)


query  rowsort
SELECT `table_1`.`column_2` AS `alias_1`, `table_2`.`column_2` AS `alias_2` FROM `table_1` INNER JOIN `table_2` ON (`table_1`.`column_1` = `table_2`.`column_1`)
----


query  rowsort
SELECT `table_1`.`column_2` AS `alias_1` FROM `table_1` WHERE ((`table_1`.`column_2` > ?) AND (`table_1`.`column_2` > ?))
? = 10
? = 10
----
1258493038
1644723775
2016216972
2084832062
528072913
724859057

query  rowsort
SELECT `table_1`.`column_2` AS `alias_1` FROM `table_1` WHERE (`table_1`.`column_2` > ?)
? = 10
----
1258493038
1644723775
2016216972
2084832062
528072913
724859057

query  rowsort
SELECT `table_1`.`column_3` AS `alias_1`, `table_3`.`column_2` AS `alias_2` FROM `table_1` INNER JOIN `table_3` ON (`table_1`.`column_2` = `table_3`.`column_1`) WHERE ((`table_1`.`column_2` > ?) AND (`table_1`.`column_2` > ?))
? = 10
? = 10
----


query  rowsort
SELECT `table_1`.`column_4` AS `alias_1`, `table_4`.`column_2` AS `alias_2` FROM `table_1` INNER JOIN `table_4` ON (`table_1`.`column_2` = `table_4`.`column_1`) WHERE (`table_1`.`column_2` > ?)
? = 10
----


query  rowsort
SELECT `table_2`.`column_2` AS `alias_1` FROM `table_2` WHERE (((`table_2`.`column_2` > ?) AND (`table_2`.`column_2` > ?)) AND (`table_2`.`column_2` > ?))
? = 10
? = 10
? = 10
----
1054637137
1293490836
1958803759
2036215030
205771799
614631464

query  rowsort
SELECT `table_2`.`column_3` AS `alias_1`, `table_5`.`column_2` AS `alias_2` FROM `table_2` INNER JOIN `table_5` ON (`table_2`.`column_2` = `table_5`.`column_1`) WHERE (((`table_2`.`column_2` > ?) AND (`table_2`.`column_2` > ?)) AND (`table_2`.`column_2` > ?))
? = 10
? = 10
? = 10
----


statement ok
DELETE FROM `table_2` WHERE (`column_4` = 0)


statement ok
DELETE FROM `table_2` WHERE (`column_4` = 1)


statement ok
DELETE FROM `table_2` WHERE (`column_4` = 2)


statement ok
DELETE FROM `table_2` WHERE (`column_4` = 3)


statement ok
DELETE FROM `table_2` WHERE (`column_4` = 4)


statement ok
DELETE FROM `table_3` WHERE (`column_3` = 0)


statement ok
DELETE FROM `table_3` WHERE (`column_3` = 1)


statement ok
DELETE FROM `table_3` WHERE (`column_3` = 2)


statement ok
DELETE FROM `table_3` WHERE (`column_3` = 3)


statement ok
DELETE FROM `table_3` WHERE (`column_3` = 4)


statement ok
DELETE FROM `table_1` WHERE (`column_5` = 0)


statement ok
DELETE FROM `table_1` WHERE (`column_5` = 1)


statement ok
DELETE FROM `table_1` WHERE (`column_5` = 2)


statement ok
DELETE FROM `table_1` WHERE (`column_5` = 3)


statement ok
DELETE FROM `table_1` WHERE (`column_5` = 4)


statement ok
DELETE FROM `table_5` WHERE (`column_3` = 0)


statement ok
DELETE FROM `table_5` WHERE (`column_3` = 1)


statement ok
DELETE FROM `table_5` WHERE (`column_3` = 2)


statement ok
DELETE FROM `table_5` WHERE (`column_3` = 3)


statement ok
DELETE FROM `table_5` WHERE (`column_3` = 4)


statement ok
DELETE FROM `table_4` WHERE (`column_3` = 0)


statement ok
DELETE FROM `table_4` WHERE (`column_3` = 1)


statement ok
DELETE FROM `table_4` WHERE (`column_3` = 2)


statement ok
DELETE FROM `table_4` WHERE (`column_3` = 3)


statement ok
DELETE FROM `table_4` WHERE (`column_3` = 4)


query  rowsort
SELECT `table_1`.`column_2` AS `alias_1`, `table_2`.`column_2` AS `alias_2` FROM `table_1` INNER JOIN `table_2` ON (`table_1`.`column_1` = `table_2`.`column_1`)
----


query  rowsort
SELECT `table_1`.`column_2` AS `alias_1` FROM `table_1` WHERE ((`table_1`.`column_2` > ?) AND (`table_1`.`column_2` > ?))
? = 10
? = 10
----
1258493038
1644723775
528072913

query  rowsort
SELECT `table_1`.`column_2` AS `alias_1` FROM `table_1` WHERE (`table_1`.`column_2` > ?)
? = 10
----
1258493038
1644723775
528072913

query  rowsort
SELECT `table_1`.`column_3` AS `alias_1`, `table_3`.`column_2` AS `alias_2` FROM `table_1` INNER JOIN `table_3` ON (`table_1`.`column_2` = `table_3`.`column_1`) WHERE ((`table_1`.`column_2` > ?) AND (`table_1`.`column_2` > ?))
? = 10
? = 10
----


query  rowsort
SELECT `table_1`.`column_4` AS `alias_1`, `table_4`.`column_2` AS `alias_2` FROM `table_1` INNER JOIN `table_4` ON (`table_1`.`column_2` = `table_4`.`column_1`) WHERE (`table_1`.`column_2` > ?)
? = 10
----


query  rowsort
SELECT `table_2`.`column_2` AS `alias_1` FROM `table_2` WHERE (((`table_2`.`column_2` > ?) AND (`table_2`.`column_2` > ?)) AND (`table_2`.`column_2` > ?))
? = 10
? = 10
? = 10
----
2036215030

query  rowsort
SELECT `table_2`.`column_3` AS `alias_1`, `table_5`.`column_2` AS `alias_2` FROM `table_2` INNER JOIN `table_5` ON (`table_2`.`column_2` = `table_5`.`column_1`) WHERE (((`table_2`.`column_2` > ?) AND (`table_2`.`column_2` > ?)) AND (`table_2`.`column_2` > ?))
? = 10
? = 10
? = 10
----

