# Generated by:
#     target/debug/noria-logictest permute -d 3 -o logictests/generated/mysql --only in_parameter --compare-to mysql://root:noria@localhost/mysql --subquery-depth 1 --rows-per-table 5 --include-deletes --overwrite-tests

statement ok
CREATE TABLE table_1 (column_1 INT, column_2 INT, PRIMARY KEY (column_2))


statement ok
INSERT INTO table_1 (column_1, column_2) VALUES (0, 0), (1, 1), (1, 2), (1, 3), (NULL, 4)


query  rowsort
SELECT table_1.column_1 AS alias_1 FROM table_1 WHERE (table_1.column_1 IS NULL)
----
NULL

query  rowsort
SELECT table_1.column_1 AS alias_1 FROM table_1 WHERE (table_1.column_1 IS NOT NULL)
----
0
1
1
1

query  rowsort
SELECT table_1.column_1 AS alias_1 FROM table_1 WHERE (table_1.column_1 IS NULL)
----
NULL

query  rowsort
SELECT table_1.column_1 AS alias_1 FROM table_1 WHERE (table_1.column_1 IS NOT NULL)
----
0
1
1
1

query  rowsort
SELECT table_1.column_1 AS alias_1 FROM table_1 WHERE (table_1.column_1 = ?)
? = 1
----
1
1
1

query  rowsort
SELECT table_1.column_1 AS alias_1 FROM table_1 WHERE table_1.column_1 IN (?, ?, ?)
? = 0
? = 1
? = 2
----
0
1
1
1

query  rowsort
SELECT table_1.column_1 AS alias_1, table_1.column_1 AS alias_2 FROM table_1 WHERE ((table_1.column_1 IS NULL) AND (table_1.column_1 IS NOT NULL))
----


query  rowsort
SELECT table_1.column_1 AS alias_1, table_1.column_1 AS alias_2 FROM table_1 WHERE ((table_1.column_1 IS NULL) OR (table_1.column_1 IS NULL))
----
NULL
NULL

query  rowsort
SELECT table_1.column_1 AS alias_1, table_1.column_1 AS alias_2 FROM table_1 WHERE ((table_1.column_1 IS NULL) OR (table_1.column_1 IS NOT NULL))
----
0
0
1
1
1
1
1
1
NULL
NULL

query  rowsort
SELECT table_1.column_1 AS alias_1 FROM table_1 WHERE ((table_1.column_1 IS NULL) AND (table_1.column_1 = ?))
? = 1
----


query  rowsort
SELECT table_1.column_1 AS alias_1 FROM table_1 WHERE ((table_1.column_1 IS NULL) AND table_1.column_1 IN (?, ?, ?))
? = 0
? = 1
? = 2
----


query  rowsort
SELECT table_1.column_1 AS alias_1, table_1.column_1 AS alias_2 FROM table_1 WHERE ((table_1.column_1 IS NOT NULL) OR (table_1.column_1 IS NULL))
----
0
0
1
1
1
1
1
1
NULL
NULL

query  rowsort
SELECT table_1.column_1 AS alias_1, table_1.column_1 AS alias_2 FROM table_1 WHERE ((table_1.column_1 IS NOT NULL) OR (table_1.column_1 IS NOT NULL))
----
0
0
1
1
1
1
1
1

query  rowsort
SELECT table_1.column_1 AS alias_1 FROM table_1 WHERE ((table_1.column_1 IS NOT NULL) AND (table_1.column_1 = ?))
? = 1
----
1
1
1

query  rowsort
SELECT table_1.column_1 AS alias_1 FROM table_1 WHERE ((table_1.column_1 IS NOT NULL) AND table_1.column_1 IN (?, ?, ?))
? = 0
? = 1
? = 2
----
0
1
1
1

query  rowsort
SELECT table_1.column_1 AS alias_1, table_1.column_1 AS alias_2 FROM table_1 WHERE ((table_1.column_1 IS NULL) OR (table_1.column_1 IS NOT NULL))
----
0
0
1
1
1
1
1
1
NULL
NULL

query  rowsort
SELECT table_1.column_1 AS alias_1 FROM table_1 WHERE ((table_1.column_1 IS NULL) AND (table_1.column_1 = ?))
? = 1
----


query  rowsort
SELECT table_1.column_1 AS alias_1 FROM table_1 WHERE ((table_1.column_1 IS NULL) AND table_1.column_1 IN (?, ?, ?))
? = 0
? = 1
? = 2
----


query  rowsort
SELECT table_1.column_1 AS alias_1 FROM table_1 WHERE ((table_1.column_1 IS NOT NULL) AND (table_1.column_1 = ?))
? = 1
----
1
1
1

query  rowsort
SELECT table_1.column_1 AS alias_1 FROM table_1 WHERE ((table_1.column_1 IS NOT NULL) AND table_1.column_1 IN (?, ?, ?))
? = 0
? = 1
? = 2
----
0
1
1
1

query  rowsort
SELECT table_1.column_1 AS alias_1 FROM table_1 WHERE ((table_1.column_1 = ?) AND table_1.column_1 IN (?, ?, ?))
? = 1
? = 0
? = 1
? = 2
----
1
1
1

query  rowsort
SELECT table_1.column_1 AS alias_1, table_1.column_1 AS alias_2, table_1.column_1 AS alias_3 FROM table_1 WHERE (((table_1.column_1 IS NULL) AND (table_1.column_1 IS NOT NULL)) OR (table_1.column_1 IS NULL))
----
NULL
NULL
NULL

query  rowsort
SELECT table_1.column_1 AS alias_1, table_1.column_1 AS alias_2, table_1.column_1 AS alias_3 FROM table_1 WHERE (((table_1.column_1 IS NULL) AND (table_1.column_1 IS NOT NULL)) OR (table_1.column_1 IS NOT NULL))
----
0
0
0
1
1
1
1
1
1
1
1
1

query  rowsort
SELECT table_1.column_1 AS alias_1, table_1.column_1 AS alias_2 FROM table_1 WHERE (((table_1.column_1 IS NULL) AND (table_1.column_1 IS NOT NULL)) AND (table_1.column_1 = ?))
? = 1
----


query  rowsort
SELECT table_1.column_1 AS alias_1, table_1.column_1 AS alias_2 FROM table_1 WHERE (((table_1.column_1 IS NULL) AND (table_1.column_1 IS NOT NULL)) AND table_1.column_1 IN (?, ?, ?))
? = 0
? = 1
? = 2
----


query  rowsort
SELECT table_1.column_1 AS alias_1, table_1.column_1 AS alias_2, table_1.column_1 AS alias_3 FROM table_1 WHERE (((table_1.column_1 IS NULL) OR (table_1.column_1 IS NULL)) OR (table_1.column_1 IS NOT NULL))
----
0
0
0
1
1
1
1
1
1
1
1
1
NULL
NULL
NULL

query  rowsort
SELECT table_1.column_1 AS alias_1, table_1.column_1 AS alias_2 FROM table_1 WHERE (((table_1.column_1 IS NULL) OR (table_1.column_1 IS NULL)) AND (table_1.column_1 = ?))
? = 1
----


query  rowsort
SELECT table_1.column_1 AS alias_1, table_1.column_1 AS alias_2 FROM table_1 WHERE (((table_1.column_1 IS NULL) OR (table_1.column_1 IS NULL)) AND table_1.column_1 IN (?, ?, ?))
? = 0
? = 1
? = 2
----


query  rowsort
SELECT table_1.column_1 AS alias_1, table_1.column_1 AS alias_2 FROM table_1 WHERE (((table_1.column_1 IS NULL) OR (table_1.column_1 IS NOT NULL)) AND (table_1.column_1 = ?))
? = 1
----
1
1
1
1
1
1

query  rowsort
SELECT table_1.column_1 AS alias_1, table_1.column_1 AS alias_2 FROM table_1 WHERE (((table_1.column_1 IS NULL) OR (table_1.column_1 IS NOT NULL)) AND table_1.column_1 IN (?, ?, ?))
? = 0
? = 1
? = 2
----
0
0
1
1
1
1
1
1

query  rowsort
SELECT table_1.column_1 AS alias_1 FROM table_1 WHERE (((table_1.column_1 IS NULL) AND (table_1.column_1 = ?)) AND table_1.column_1 IN (?, ?, ?))
? = 1
? = 0
? = 1
? = 2
----


query  rowsort
SELECT table_1.column_1 AS alias_1, table_1.column_1 AS alias_2, table_1.column_1 AS alias_3 FROM table_1 WHERE (((table_1.column_1 IS NOT NULL) OR (table_1.column_1 IS NULL)) OR (table_1.column_1 IS NOT NULL))
----
0
0
0
1
1
1
1
1
1
1
1
1
NULL
NULL
NULL

query  rowsort
SELECT table_1.column_1 AS alias_1, table_1.column_1 AS alias_2 FROM table_1 WHERE (((table_1.column_1 IS NOT NULL) OR (table_1.column_1 IS NULL)) AND (table_1.column_1 = ?))
? = 1
----
1
1
1
1
1
1

query  rowsort
SELECT table_1.column_1 AS alias_1, table_1.column_1 AS alias_2 FROM table_1 WHERE (((table_1.column_1 IS NOT NULL) OR (table_1.column_1 IS NULL)) AND table_1.column_1 IN (?, ?, ?))
? = 0
? = 1
? = 2
----
0
0
1
1
1
1
1
1

query  rowsort
SELECT table_1.column_1 AS alias_1, table_1.column_1 AS alias_2 FROM table_1 WHERE (((table_1.column_1 IS NOT NULL) OR (table_1.column_1 IS NOT NULL)) AND (table_1.column_1 = ?))
? = 1
----
1
1
1
1
1
1

query  rowsort
SELECT table_1.column_1 AS alias_1, table_1.column_1 AS alias_2 FROM table_1 WHERE (((table_1.column_1 IS NOT NULL) OR (table_1.column_1 IS NOT NULL)) AND table_1.column_1 IN (?, ?, ?))
? = 0
? = 1
? = 2
----
0
0
1
1
1
1
1
1

query  rowsort
SELECT table_1.column_1 AS alias_1 FROM table_1 WHERE (((table_1.column_1 IS NOT NULL) AND (table_1.column_1 = ?)) AND table_1.column_1 IN (?, ?, ?))
? = 1
? = 0
? = 1
? = 2
----
1
1
1

query  rowsort
SELECT table_1.column_1 AS alias_1, table_1.column_1 AS alias_2 FROM table_1 WHERE (((table_1.column_1 IS NULL) OR (table_1.column_1 IS NOT NULL)) AND (table_1.column_1 = ?))
? = 1
----
1
1
1
1
1
1

query  rowsort
SELECT table_1.column_1 AS alias_1, table_1.column_1 AS alias_2 FROM table_1 WHERE (((table_1.column_1 IS NULL) OR (table_1.column_1 IS NOT NULL)) AND table_1.column_1 IN (?, ?, ?))
? = 0
? = 1
? = 2
----
0
0
1
1
1
1
1
1

query  rowsort
SELECT table_1.column_1 AS alias_1 FROM table_1 WHERE (((table_1.column_1 IS NULL) AND (table_1.column_1 = ?)) AND table_1.column_1 IN (?, ?, ?))
? = 1
? = 0
? = 1
? = 2
----


query  rowsort
SELECT table_1.column_1 AS alias_1 FROM table_1 WHERE (((table_1.column_1 IS NOT NULL) AND (table_1.column_1 = ?)) AND table_1.column_1 IN (?, ?, ?))
? = 1
? = 0
? = 1
? = 2
----
1
1
1

query  rowsort
SELECT table_1.column_1 AS alias_1, table_1.column_1 AS alias_2, table_1.column_1 AS alias_3, table_1.column_1 AS alias_4 FROM table_1 WHERE ((((table_1.column_1 IS NULL) AND (table_1.column_1 IS NOT NULL)) OR (table_1.column_1 IS NULL)) OR (table_1.column_1 IS NOT NULL))
----
0
0
0
0
1
1
1
1
1
1
1
1
1
1
1
1
NULL
NULL
NULL
NULL

query  rowsort
SELECT table_1.column_1 AS alias_1, table_1.column_1 AS alias_2, table_1.column_1 AS alias_3 FROM table_1 WHERE ((((table_1.column_1 IS NULL) AND (table_1.column_1 IS NOT NULL)) OR (table_1.column_1 IS NULL)) AND (table_1.column_1 = ?))
? = 1
----


query  rowsort
SELECT table_1.column_1 AS alias_1, table_1.column_1 AS alias_2, table_1.column_1 AS alias_3 FROM table_1 WHERE ((((table_1.column_1 IS NULL) AND (table_1.column_1 IS NOT NULL)) OR (table_1.column_1 IS NULL)) AND table_1.column_1 IN (?, ?, ?))
? = 0
? = 1
? = 2
----


query  rowsort
SELECT table_1.column_1 AS alias_1, table_1.column_1 AS alias_2, table_1.column_1 AS alias_3 FROM table_1 WHERE ((((table_1.column_1 IS NULL) AND (table_1.column_1 IS NOT NULL)) OR (table_1.column_1 IS NOT NULL)) AND (table_1.column_1 = ?))
? = 1
----
1
1
1
1
1
1
1
1
1

query  rowsort
SELECT table_1.column_1 AS alias_1, table_1.column_1 AS alias_2, table_1.column_1 AS alias_3 FROM table_1 WHERE ((((table_1.column_1 IS NULL) AND (table_1.column_1 IS NOT NULL)) OR (table_1.column_1 IS NOT NULL)) AND table_1.column_1 IN (?, ?, ?))
? = 0
? = 1
? = 2
----
0
0
0
1
1
1
1
1
1
1
1
1

query  rowsort
SELECT table_1.column_1 AS alias_1, table_1.column_1 AS alias_2 FROM table_1 WHERE ((((table_1.column_1 IS NULL) AND (table_1.column_1 IS NOT NULL)) AND (table_1.column_1 = ?)) AND table_1.column_1 IN (?, ?, ?))
? = 1
? = 0
? = 1
? = 2
----


query  rowsort
SELECT table_1.column_1 AS alias_1, table_1.column_1 AS alias_2, table_1.column_1 AS alias_3 FROM table_1 WHERE ((((table_1.column_1 IS NULL) OR (table_1.column_1 IS NULL)) OR (table_1.column_1 IS NOT NULL)) AND (table_1.column_1 = ?))
? = 1
----
1
1
1
1
1
1
1
1
1

query  rowsort
SELECT table_1.column_1 AS alias_1, table_1.column_1 AS alias_2, table_1.column_1 AS alias_3 FROM table_1 WHERE ((((table_1.column_1 IS NULL) OR (table_1.column_1 IS NULL)) OR (table_1.column_1 IS NOT NULL)) AND table_1.column_1 IN (?, ?, ?))
? = 0
? = 1
? = 2
----
0
0
0
1
1
1
1
1
1
1
1
1

query  rowsort
SELECT table_1.column_1 AS alias_1, table_1.column_1 AS alias_2 FROM table_1 WHERE ((((table_1.column_1 IS NULL) OR (table_1.column_1 IS NULL)) AND (table_1.column_1 = ?)) AND table_1.column_1 IN (?, ?, ?))
? = 1
? = 0
? = 1
? = 2
----


query  rowsort
SELECT table_1.column_1 AS alias_1, table_1.column_1 AS alias_2 FROM table_1 WHERE ((((table_1.column_1 IS NULL) OR (table_1.column_1 IS NOT NULL)) AND (table_1.column_1 = ?)) AND table_1.column_1 IN (?, ?, ?))
? = 1
? = 0
? = 1
? = 2
----
1
1
1
1
1
1

query  rowsort
SELECT table_1.column_1 AS alias_1, table_1.column_1 AS alias_2, table_1.column_1 AS alias_3 FROM table_1 WHERE ((((table_1.column_1 IS NOT NULL) OR (table_1.column_1 IS NULL)) OR (table_1.column_1 IS NOT NULL)) AND (table_1.column_1 = ?))
? = 1
----
1
1
1
1
1
1
1
1
1

query  rowsort
SELECT table_1.column_1 AS alias_1, table_1.column_1 AS alias_2, table_1.column_1 AS alias_3 FROM table_1 WHERE ((((table_1.column_1 IS NOT NULL) OR (table_1.column_1 IS NULL)) OR (table_1.column_1 IS NOT NULL)) AND table_1.column_1 IN (?, ?, ?))
? = 0
? = 1
? = 2
----
0
0
0
1
1
1
1
1
1
1
1
1

query  rowsort
SELECT table_1.column_1 AS alias_1, table_1.column_1 AS alias_2 FROM table_1 WHERE ((((table_1.column_1 IS NOT NULL) OR (table_1.column_1 IS NULL)) AND (table_1.column_1 = ?)) AND table_1.column_1 IN (?, ?, ?))
? = 1
? = 0
? = 1
? = 2
----
1
1
1
1
1
1

query  rowsort
SELECT table_1.column_1 AS alias_1, table_1.column_1 AS alias_2 FROM table_1 WHERE ((((table_1.column_1 IS NOT NULL) OR (table_1.column_1 IS NOT NULL)) AND (table_1.column_1 = ?)) AND table_1.column_1 IN (?, ?, ?))
? = 1
? = 0
? = 1
? = 2
----
1
1
1
1
1
1

query  rowsort
SELECT table_1.column_1 AS alias_1, table_1.column_1 AS alias_2 FROM table_1 WHERE ((((table_1.column_1 IS NULL) OR (table_1.column_1 IS NOT NULL)) AND (table_1.column_1 = ?)) AND table_1.column_1 IN (?, ?, ?))
? = 1
? = 0
? = 1
? = 2
----
1
1
1
1
1
1

query  rowsort
SELECT table_1.column_1 AS alias_1, table_1.column_1 AS alias_2, table_1.column_1 AS alias_3, table_1.column_1 AS alias_4 FROM table_1 WHERE (((((table_1.column_1 IS NULL) AND (table_1.column_1 IS NOT NULL)) OR (table_1.column_1 IS NULL)) OR (table_1.column_1 IS NOT NULL)) AND (table_1.column_1 = ?))
? = 1
----
1
1
1
1
1
1
1
1
1
1
1
1

query  rowsort
SELECT table_1.column_1 AS alias_1, table_1.column_1 AS alias_2, table_1.column_1 AS alias_3, table_1.column_1 AS alias_4 FROM table_1 WHERE (((((table_1.column_1 IS NULL) AND (table_1.column_1 IS NOT NULL)) OR (table_1.column_1 IS NULL)) OR (table_1.column_1 IS NOT NULL)) AND table_1.column_1 IN (?, ?, ?))
? = 0
? = 1
? = 2
----
0
0
0
0
1
1
1
1
1
1
1
1
1
1
1
1

query  rowsort
SELECT table_1.column_1 AS alias_1, table_1.column_1 AS alias_2, table_1.column_1 AS alias_3 FROM table_1 WHERE (((((table_1.column_1 IS NULL) AND (table_1.column_1 IS NOT NULL)) OR (table_1.column_1 IS NULL)) AND (table_1.column_1 = ?)) AND table_1.column_1 IN (?, ?, ?))
? = 1
? = 0
? = 1
? = 2
----


query  rowsort
SELECT table_1.column_1 AS alias_1, table_1.column_1 AS alias_2, table_1.column_1 AS alias_3 FROM table_1 WHERE (((((table_1.column_1 IS NULL) AND (table_1.column_1 IS NOT NULL)) OR (table_1.column_1 IS NOT NULL)) AND (table_1.column_1 = ?)) AND table_1.column_1 IN (?, ?, ?))
? = 1
? = 0
? = 1
? = 2
----
1
1
1
1
1
1
1
1
1

query  rowsort
SELECT table_1.column_1 AS alias_1, table_1.column_1 AS alias_2, table_1.column_1 AS alias_3 FROM table_1 WHERE (((((table_1.column_1 IS NULL) OR (table_1.column_1 IS NULL)) OR (table_1.column_1 IS NOT NULL)) AND (table_1.column_1 = ?)) AND table_1.column_1 IN (?, ?, ?))
? = 1
? = 0
? = 1
? = 2
----
1
1
1
1
1
1
1
1
1

query  rowsort
SELECT table_1.column_1 AS alias_1, table_1.column_1 AS alias_2, table_1.column_1 AS alias_3 FROM table_1 WHERE (((((table_1.column_1 IS NOT NULL) OR (table_1.column_1 IS NULL)) OR (table_1.column_1 IS NOT NULL)) AND (table_1.column_1 = ?)) AND table_1.column_1 IN (?, ?, ?))
? = 1
? = 0
? = 1
? = 2
----
1
1
1
1
1
1
1
1
1

query  rowsort
SELECT table_1.column_1 AS alias_1, table_1.column_1 AS alias_2, table_1.column_1 AS alias_3, table_1.column_1 AS alias_4 FROM table_1 WHERE ((((((table_1.column_1 IS NULL) AND (table_1.column_1 IS NOT NULL)) OR (table_1.column_1 IS NULL)) OR (table_1.column_1 IS NOT NULL)) AND (table_1.column_1 = ?)) AND table_1.column_1 IN (?, ?, ?))
? = 1
? = 0
? = 1
? = 2
----
1
1
1
1
1
1
1
1
1
1
1
1

statement ok
DELETE FROM table_1 WHERE (column_2 = 0)


statement ok
DELETE FROM table_1 WHERE (column_2 = 1)


query  rowsort
SELECT table_1.column_1 AS alias_1 FROM table_1 WHERE (table_1.column_1 IS NULL)
----
NULL

query  rowsort
SELECT table_1.column_1 AS alias_1 FROM table_1 WHERE (table_1.column_1 IS NOT NULL)
----
1
1

query  rowsort
SELECT table_1.column_1 AS alias_1 FROM table_1 WHERE (table_1.column_1 IS NULL)
----
NULL

query  rowsort
SELECT table_1.column_1 AS alias_1 FROM table_1 WHERE (table_1.column_1 IS NOT NULL)
----
1
1

query  rowsort
SELECT table_1.column_1 AS alias_1 FROM table_1 WHERE (table_1.column_1 = ?)
? = 1
----
1
1

query  rowsort
SELECT table_1.column_1 AS alias_1 FROM table_1 WHERE table_1.column_1 IN (?, ?, ?)
? = 0
? = 1
? = 2
----
1
1

query  rowsort
SELECT table_1.column_1 AS alias_1, table_1.column_1 AS alias_2 FROM table_1 WHERE ((table_1.column_1 IS NULL) AND (table_1.column_1 IS NOT NULL))
----


query  rowsort
SELECT table_1.column_1 AS alias_1, table_1.column_1 AS alias_2 FROM table_1 WHERE ((table_1.column_1 IS NULL) OR (table_1.column_1 IS NULL))
----
NULL
NULL

query  rowsort
SELECT table_1.column_1 AS alias_1, table_1.column_1 AS alias_2 FROM table_1 WHERE ((table_1.column_1 IS NULL) OR (table_1.column_1 IS NOT NULL))
----
1
1
1
1
NULL
NULL

query  rowsort
SELECT table_1.column_1 AS alias_1 FROM table_1 WHERE ((table_1.column_1 IS NULL) AND (table_1.column_1 = ?))
? = 1
----


query  rowsort
SELECT table_1.column_1 AS alias_1 FROM table_1 WHERE ((table_1.column_1 IS NULL) AND table_1.column_1 IN (?, ?, ?))
? = 0
? = 1
? = 2
----


query  rowsort
SELECT table_1.column_1 AS alias_1, table_1.column_1 AS alias_2 FROM table_1 WHERE ((table_1.column_1 IS NOT NULL) OR (table_1.column_1 IS NULL))
----
1
1
1
1
NULL
NULL

query  rowsort
SELECT table_1.column_1 AS alias_1, table_1.column_1 AS alias_2 FROM table_1 WHERE ((table_1.column_1 IS NOT NULL) OR (table_1.column_1 IS NOT NULL))
----
1
1
1
1

query  rowsort
SELECT table_1.column_1 AS alias_1 FROM table_1 WHERE ((table_1.column_1 IS NOT NULL) AND (table_1.column_1 = ?))
? = 1
----
1
1

query  rowsort
SELECT table_1.column_1 AS alias_1 FROM table_1 WHERE ((table_1.column_1 IS NOT NULL) AND table_1.column_1 IN (?, ?, ?))
? = 0
? = 1
? = 2
----
1
1

query  rowsort
SELECT table_1.column_1 AS alias_1, table_1.column_1 AS alias_2 FROM table_1 WHERE ((table_1.column_1 IS NULL) OR (table_1.column_1 IS NOT NULL))
----
1
1
1
1
NULL
NULL

query  rowsort
SELECT table_1.column_1 AS alias_1 FROM table_1 WHERE ((table_1.column_1 IS NULL) AND (table_1.column_1 = ?))
? = 1
----


query  rowsort
SELECT table_1.column_1 AS alias_1 FROM table_1 WHERE ((table_1.column_1 IS NULL) AND table_1.column_1 IN (?, ?, ?))
? = 0
? = 1
? = 2
----


query  rowsort
SELECT table_1.column_1 AS alias_1 FROM table_1 WHERE ((table_1.column_1 IS NOT NULL) AND (table_1.column_1 = ?))
? = 1
----
1
1

query  rowsort
SELECT table_1.column_1 AS alias_1 FROM table_1 WHERE ((table_1.column_1 IS NOT NULL) AND table_1.column_1 IN (?, ?, ?))
? = 0
? = 1
? = 2
----
1
1

query  rowsort
SELECT table_1.column_1 AS alias_1 FROM table_1 WHERE ((table_1.column_1 = ?) AND table_1.column_1 IN (?, ?, ?))
? = 1
? = 0
? = 1
? = 2
----
1
1

query  rowsort
SELECT table_1.column_1 AS alias_1, table_1.column_1 AS alias_2, table_1.column_1 AS alias_3 FROM table_1 WHERE (((table_1.column_1 IS NULL) AND (table_1.column_1 IS NOT NULL)) OR (table_1.column_1 IS NULL))
----
NULL
NULL
NULL

query  rowsort
SELECT table_1.column_1 AS alias_1, table_1.column_1 AS alias_2, table_1.column_1 AS alias_3 FROM table_1 WHERE (((table_1.column_1 IS NULL) AND (table_1.column_1 IS NOT NULL)) OR (table_1.column_1 IS NOT NULL))
----
1
1
1
1
1
1

query  rowsort
SELECT table_1.column_1 AS alias_1, table_1.column_1 AS alias_2 FROM table_1 WHERE (((table_1.column_1 IS NULL) AND (table_1.column_1 IS NOT NULL)) AND (table_1.column_1 = ?))
? = 1
----


query  rowsort
SELECT table_1.column_1 AS alias_1, table_1.column_1 AS alias_2 FROM table_1 WHERE (((table_1.column_1 IS NULL) AND (table_1.column_1 IS NOT NULL)) AND table_1.column_1 IN (?, ?, ?))
? = 0
? = 1
? = 2
----


query  rowsort
SELECT table_1.column_1 AS alias_1, table_1.column_1 AS alias_2, table_1.column_1 AS alias_3 FROM table_1 WHERE (((table_1.column_1 IS NULL) OR (table_1.column_1 IS NULL)) OR (table_1.column_1 IS NOT NULL))
----
1
1
1
1
1
1
NULL
NULL
NULL

query  rowsort
SELECT table_1.column_1 AS alias_1, table_1.column_1 AS alias_2 FROM table_1 WHERE (((table_1.column_1 IS NULL) OR (table_1.column_1 IS NULL)) AND (table_1.column_1 = ?))
? = 1
----


query  rowsort
SELECT table_1.column_1 AS alias_1, table_1.column_1 AS alias_2 FROM table_1 WHERE (((table_1.column_1 IS NULL) OR (table_1.column_1 IS NULL)) AND table_1.column_1 IN (?, ?, ?))
? = 0
? = 1
? = 2
----


query  rowsort
SELECT table_1.column_1 AS alias_1, table_1.column_1 AS alias_2 FROM table_1 WHERE (((table_1.column_1 IS NULL) OR (table_1.column_1 IS NOT NULL)) AND (table_1.column_1 = ?))
? = 1
----
1
1
1
1

query  rowsort
SELECT table_1.column_1 AS alias_1, table_1.column_1 AS alias_2 FROM table_1 WHERE (((table_1.column_1 IS NULL) OR (table_1.column_1 IS NOT NULL)) AND table_1.column_1 IN (?, ?, ?))
? = 0
? = 1
? = 2
----
1
1
1
1

query  rowsort
SELECT table_1.column_1 AS alias_1 FROM table_1 WHERE (((table_1.column_1 IS NULL) AND (table_1.column_1 = ?)) AND table_1.column_1 IN (?, ?, ?))
? = 1
? = 0
? = 1
? = 2
----


query  rowsort
SELECT table_1.column_1 AS alias_1, table_1.column_1 AS alias_2, table_1.column_1 AS alias_3 FROM table_1 WHERE (((table_1.column_1 IS NOT NULL) OR (table_1.column_1 IS NULL)) OR (table_1.column_1 IS NOT NULL))
----
1
1
1
1
1
1
NULL
NULL
NULL

query  rowsort
SELECT table_1.column_1 AS alias_1, table_1.column_1 AS alias_2 FROM table_1 WHERE (((table_1.column_1 IS NOT NULL) OR (table_1.column_1 IS NULL)) AND (table_1.column_1 = ?))
? = 1
----
1
1
1
1

query  rowsort
SELECT table_1.column_1 AS alias_1, table_1.column_1 AS alias_2 FROM table_1 WHERE (((table_1.column_1 IS NOT NULL) OR (table_1.column_1 IS NULL)) AND table_1.column_1 IN (?, ?, ?))
? = 0
? = 1
? = 2
----
1
1
1
1

query  rowsort
SELECT table_1.column_1 AS alias_1, table_1.column_1 AS alias_2 FROM table_1 WHERE (((table_1.column_1 IS NOT NULL) OR (table_1.column_1 IS NOT NULL)) AND (table_1.column_1 = ?))
? = 1
----
1
1
1
1

query  rowsort
SELECT table_1.column_1 AS alias_1, table_1.column_1 AS alias_2 FROM table_1 WHERE (((table_1.column_1 IS NOT NULL) OR (table_1.column_1 IS NOT NULL)) AND table_1.column_1 IN (?, ?, ?))
? = 0
? = 1
? = 2
----
1
1
1
1

query  rowsort
SELECT table_1.column_1 AS alias_1 FROM table_1 WHERE (((table_1.column_1 IS NOT NULL) AND (table_1.column_1 = ?)) AND table_1.column_1 IN (?, ?, ?))
? = 1
? = 0
? = 1
? = 2
----
1
1

query  rowsort
SELECT table_1.column_1 AS alias_1, table_1.column_1 AS alias_2 FROM table_1 WHERE (((table_1.column_1 IS NULL) OR (table_1.column_1 IS NOT NULL)) AND (table_1.column_1 = ?))
? = 1
----
1
1
1
1

query  rowsort
SELECT table_1.column_1 AS alias_1, table_1.column_1 AS alias_2 FROM table_1 WHERE (((table_1.column_1 IS NULL) OR (table_1.column_1 IS NOT NULL)) AND table_1.column_1 IN (?, ?, ?))
? = 0
? = 1
? = 2
----
1
1
1
1

query  rowsort
SELECT table_1.column_1 AS alias_1 FROM table_1 WHERE (((table_1.column_1 IS NULL) AND (table_1.column_1 = ?)) AND table_1.column_1 IN (?, ?, ?))
? = 1
? = 0
? = 1
? = 2
----


query  rowsort
SELECT table_1.column_1 AS alias_1 FROM table_1 WHERE (((table_1.column_1 IS NOT NULL) AND (table_1.column_1 = ?)) AND table_1.column_1 IN (?, ?, ?))
? = 1
? = 0
? = 1
? = 2
----
1
1

query  rowsort
SELECT table_1.column_1 AS alias_1, table_1.column_1 AS alias_2, table_1.column_1 AS alias_3, table_1.column_1 AS alias_4 FROM table_1 WHERE ((((table_1.column_1 IS NULL) AND (table_1.column_1 IS NOT NULL)) OR (table_1.column_1 IS NULL)) OR (table_1.column_1 IS NOT NULL))
----
1
1
1
1
1
1
1
1
NULL
NULL
NULL
NULL

query  rowsort
SELECT table_1.column_1 AS alias_1, table_1.column_1 AS alias_2, table_1.column_1 AS alias_3 FROM table_1 WHERE ((((table_1.column_1 IS NULL) AND (table_1.column_1 IS NOT NULL)) OR (table_1.column_1 IS NULL)) AND (table_1.column_1 = ?))
? = 1
----


query  rowsort
SELECT table_1.column_1 AS alias_1, table_1.column_1 AS alias_2, table_1.column_1 AS alias_3 FROM table_1 WHERE ((((table_1.column_1 IS NULL) AND (table_1.column_1 IS NOT NULL)) OR (table_1.column_1 IS NULL)) AND table_1.column_1 IN (?, ?, ?))
? = 0
? = 1
? = 2
----


query  rowsort
SELECT table_1.column_1 AS alias_1, table_1.column_1 AS alias_2, table_1.column_1 AS alias_3 FROM table_1 WHERE ((((table_1.column_1 IS NULL) AND (table_1.column_1 IS NOT NULL)) OR (table_1.column_1 IS NOT NULL)) AND (table_1.column_1 = ?))
? = 1
----
1
1
1
1
1
1

query  rowsort
SELECT table_1.column_1 AS alias_1, table_1.column_1 AS alias_2, table_1.column_1 AS alias_3 FROM table_1 WHERE ((((table_1.column_1 IS NULL) AND (table_1.column_1 IS NOT NULL)) OR (table_1.column_1 IS NOT NULL)) AND table_1.column_1 IN (?, ?, ?))
? = 0
? = 1
? = 2
----
1
1
1
1
1
1

query  rowsort
SELECT table_1.column_1 AS alias_1, table_1.column_1 AS alias_2 FROM table_1 WHERE ((((table_1.column_1 IS NULL) AND (table_1.column_1 IS NOT NULL)) AND (table_1.column_1 = ?)) AND table_1.column_1 IN (?, ?, ?))
? = 1
? = 0
? = 1
? = 2
----


query  rowsort
SELECT table_1.column_1 AS alias_1, table_1.column_1 AS alias_2, table_1.column_1 AS alias_3 FROM table_1 WHERE ((((table_1.column_1 IS NULL) OR (table_1.column_1 IS NULL)) OR (table_1.column_1 IS NOT NULL)) AND (table_1.column_1 = ?))
? = 1
----
1
1
1
1
1
1

query  rowsort
SELECT table_1.column_1 AS alias_1, table_1.column_1 AS alias_2, table_1.column_1 AS alias_3 FROM table_1 WHERE ((((table_1.column_1 IS NULL) OR (table_1.column_1 IS NULL)) OR (table_1.column_1 IS NOT NULL)) AND table_1.column_1 IN (?, ?, ?))
? = 0
? = 1
? = 2
----
1
1
1
1
1
1

query  rowsort
SELECT table_1.column_1 AS alias_1, table_1.column_1 AS alias_2 FROM table_1 WHERE ((((table_1.column_1 IS NULL) OR (table_1.column_1 IS NULL)) AND (table_1.column_1 = ?)) AND table_1.column_1 IN (?, ?, ?))
? = 1
? = 0
? = 1
? = 2
----


query  rowsort
SELECT table_1.column_1 AS alias_1, table_1.column_1 AS alias_2 FROM table_1 WHERE ((((table_1.column_1 IS NULL) OR (table_1.column_1 IS NOT NULL)) AND (table_1.column_1 = ?)) AND table_1.column_1 IN (?, ?, ?))
? = 1
? = 0
? = 1
? = 2
----
1
1
1
1

query  rowsort
SELECT table_1.column_1 AS alias_1, table_1.column_1 AS alias_2, table_1.column_1 AS alias_3 FROM table_1 WHERE ((((table_1.column_1 IS NOT NULL) OR (table_1.column_1 IS NULL)) OR (table_1.column_1 IS NOT NULL)) AND (table_1.column_1 = ?))
? = 1
----
1
1
1
1
1
1

query  rowsort
SELECT table_1.column_1 AS alias_1, table_1.column_1 AS alias_2, table_1.column_1 AS alias_3 FROM table_1 WHERE ((((table_1.column_1 IS NOT NULL) OR (table_1.column_1 IS NULL)) OR (table_1.column_1 IS NOT NULL)) AND table_1.column_1 IN (?, ?, ?))
? = 0
? = 1
? = 2
----
1
1
1
1
1
1

query  rowsort
SELECT table_1.column_1 AS alias_1, table_1.column_1 AS alias_2 FROM table_1 WHERE ((((table_1.column_1 IS NOT NULL) OR (table_1.column_1 IS NULL)) AND (table_1.column_1 = ?)) AND table_1.column_1 IN (?, ?, ?))
? = 1
? = 0
? = 1
? = 2
----
1
1
1
1

query  rowsort
SELECT table_1.column_1 AS alias_1, table_1.column_1 AS alias_2 FROM table_1 WHERE ((((table_1.column_1 IS NOT NULL) OR (table_1.column_1 IS NOT NULL)) AND (table_1.column_1 = ?)) AND table_1.column_1 IN (?, ?, ?))
? = 1
? = 0
? = 1
? = 2
----
1
1
1
1

query  rowsort
SELECT table_1.column_1 AS alias_1, table_1.column_1 AS alias_2 FROM table_1 WHERE ((((table_1.column_1 IS NULL) OR (table_1.column_1 IS NOT NULL)) AND (table_1.column_1 = ?)) AND table_1.column_1 IN (?, ?, ?))
? = 1
? = 0
? = 1
? = 2
----
1
1
1
1

query  rowsort
SELECT table_1.column_1 AS alias_1, table_1.column_1 AS alias_2, table_1.column_1 AS alias_3, table_1.column_1 AS alias_4 FROM table_1 WHERE (((((table_1.column_1 IS NULL) AND (table_1.column_1 IS NOT NULL)) OR (table_1.column_1 IS NULL)) OR (table_1.column_1 IS NOT NULL)) AND (table_1.column_1 = ?))
? = 1
----
1
1
1
1
1
1
1
1

query  rowsort
SELECT table_1.column_1 AS alias_1, table_1.column_1 AS alias_2, table_1.column_1 AS alias_3, table_1.column_1 AS alias_4 FROM table_1 WHERE (((((table_1.column_1 IS NULL) AND (table_1.column_1 IS NOT NULL)) OR (table_1.column_1 IS NULL)) OR (table_1.column_1 IS NOT NULL)) AND table_1.column_1 IN (?, ?, ?))
? = 0
? = 1
? = 2
----
1
1
1
1
1
1
1
1

query  rowsort
SELECT table_1.column_1 AS alias_1, table_1.column_1 AS alias_2, table_1.column_1 AS alias_3 FROM table_1 WHERE (((((table_1.column_1 IS NULL) AND (table_1.column_1 IS NOT NULL)) OR (table_1.column_1 IS NULL)) AND (table_1.column_1 = ?)) AND table_1.column_1 IN (?, ?, ?))
? = 1
? = 0
? = 1
? = 2
----


query  rowsort
SELECT table_1.column_1 AS alias_1, table_1.column_1 AS alias_2, table_1.column_1 AS alias_3 FROM table_1 WHERE (((((table_1.column_1 IS NULL) AND (table_1.column_1 IS NOT NULL)) OR (table_1.column_1 IS NOT NULL)) AND (table_1.column_1 = ?)) AND table_1.column_1 IN (?, ?, ?))
? = 1
? = 0
? = 1
? = 2
----
1
1
1
1
1
1

query  rowsort
SELECT table_1.column_1 AS alias_1, table_1.column_1 AS alias_2, table_1.column_1 AS alias_3 FROM table_1 WHERE (((((table_1.column_1 IS NULL) OR (table_1.column_1 IS NULL)) OR (table_1.column_1 IS NOT NULL)) AND (table_1.column_1 = ?)) AND table_1.column_1 IN (?, ?, ?))
? = 1
? = 0
? = 1
? = 2
----
1
1
1
1
1
1

query  rowsort
SELECT table_1.column_1 AS alias_1, table_1.column_1 AS alias_2, table_1.column_1 AS alias_3 FROM table_1 WHERE (((((table_1.column_1 IS NOT NULL) OR (table_1.column_1 IS NULL)) OR (table_1.column_1 IS NOT NULL)) AND (table_1.column_1 = ?)) AND table_1.column_1 IN (?, ?, ?))
? = 1
? = 0
? = 1
? = 2
----
1
1
1
1
1
1

query  rowsort
SELECT table_1.column_1 AS alias_1, table_1.column_1 AS alias_2, table_1.column_1 AS alias_3, table_1.column_1 AS alias_4 FROM table_1 WHERE ((((((table_1.column_1 IS NULL) AND (table_1.column_1 IS NOT NULL)) OR (table_1.column_1 IS NULL)) OR (table_1.column_1 IS NOT NULL)) AND (table_1.column_1 = ?)) AND table_1.column_1 IN (?, ?, ?))
? = 1
? = 0
? = 1
? = 2
----
1
1
1
1
1
1
1
1
