# Generated by:
#     target/debug/noria-logictest permute --compare-to mysql://root:noria@127.1/noria -d 3 -o logictests/generated/mysql/ --only range_param --random --include-deletes --rows-per-table 10 --subquery-depth 1

statement ok
CREATE TABLE `table_1` (`column_1` INT, `column_2` INT, PRIMARY KEY (`column_2`))


statement ok
INSERT INTO `table_1` (`column_1`, `column_2`) VALUES (1522660687, 0), (-1623375602, 1), (883304366, 2), (-2066505564, 3), (1361764384, 4), (1488929764, 5), (-1952086915, 6), (1399971143, 7), (-1445533978, 8), (816158750, 9)


query  rowsort
WITH `alias_4` AS (SELECT `table_1`.`column_1` AS `alias_3` FROM `table_1`) SELECT `table_1`.`column_1` AS `alias_5` FROM `table_1` INNER JOIN (SELECT `table_1`.`column_1` AS `alias_1` FROM `table_1`) AS alias_2 ON (`table_1`.`column_1` = `alias_2`.`alias_1`) INNER JOIN `alias_4` ON (`table_1`.`column_1` = `alias_4`.`alias_3`) WHERE (`table_1`.`column_1` > ?)
? = 10
----
1361764384
1399971143
1488929764
1522660687
816158750
883304366

statement ok
DELETE FROM `table_1` WHERE (`column_2` = 0)


statement ok
DELETE FROM `table_1` WHERE (`column_2` = 1)


statement ok
DELETE FROM `table_1` WHERE (`column_2` = 2)


statement ok
DELETE FROM `table_1` WHERE (`column_2` = 3)


statement ok
DELETE FROM `table_1` WHERE (`column_2` = 4)


query  rowsort
WITH `alias_4` AS (SELECT `table_1`.`column_1` AS `alias_3` FROM `table_1`) SELECT `table_1`.`column_1` AS `alias_5` FROM `table_1` INNER JOIN (SELECT `table_1`.`column_1` AS `alias_1` FROM `table_1`) AS alias_2 ON (`table_1`.`column_1` = `alias_2`.`alias_1`) INNER JOIN `alias_4` ON (`table_1`.`column_1` = `alias_4`.`alias_3`) WHERE (`table_1`.`column_1` > ?)
? = 10
----
1399971143
1488929764
816158750
