# Generated by:
#     target/debug/noria-logictest permute --compare-to mysql://root:noria@127.1/noria -d 3 -o logictests/generated/mysql/ --only range_param --random --include-deletes --rows-per-table 10 --subquery-depth 1

statement ok
CREATE TABLE `table_1` (`column_3` INT, `column_9` INT, `column_11` INT, `column_6` INT, `column_7` INT, `column_5` INT, `column_12` INT, `column_1` INT, `column_2` INT, `column_13` INT, `column_8` INT, `column_10` INT, `column_4` INT, PRIMARY KEY (`column_13`))


statement ok
INSERT INTO `table_1` (`column_3`, `column_9`, `column_11`, `column_6`, `column_7`, `column_5`, `column_12`, `column_1`, `column_2`, `column_13`, `column_8`, `column_10`, `column_4`) VALUES (-1614533136, -791925188, -795509648, 563484000, -1889539663, 1963321312, 636790345, -391522614, -333466278, 0, -1566681416, -886809366, 189181138), (1943599854, -1167009297, 112680746, -104178686, -1609585834, 85424690, -552179733, 2051657882, 1002403502, 1, 860899506, 1474982285, -668811850), (-317223382, -1526918487, 1230520592, 569352958, -927311116, -1284710971, 1237787168, 1752468144, 2058954727, 2, -904170155, 1493960925, -317004781), (-1361976190, -992271388, 583036527, 1342846756, 739923477, -49557424, -370345525, 1235207592, 612207277, 3, -1130287189, 1058436066, -1640628064), (-640357799, -95986757, 1051387950, -1975344297, -553723040, -1451424569, 472971566, -179239960, 52477321, 4, 694190246, -1922967213, 1110862025), (686191956, 886286709, -472885871, -1205280611, 1697556532, -1966422448, 49301643, 685596292, 2066487526, 5, -1817962421, -1485205618, 293542593), (544790373, -285391426, 1950763265, -713031637, 1926893938, 1525620568, -733384076, -1590214113, 641373240, 6, 2088859571, -1044292013, 103939861), (-1927009661, -1727551158, -1391283823, 1736014830, -963398201, -199761266, -885328673, -300447588, -385653707, 7, 221179881, -1534726483, -635906970), (-2000257651, -495484684, 1195921490, -710132566, -592785656, -556467266, -2123720058, -1251934051, 1263118692, 8, -426818066, 1349329668, -185902972), (-1227016437, 1881177837, -2058335672, -1526196405, -1716994668, 456567692, 1418705255, -141175195, 1557234213, 9, -1888208940, 1225876307, -1660064516)


query  rowsort
SELECT avg(`table_1`.`column_1`) AS `alias_1` FROM `table_1` INNER JOIN (SELECT avg(`table_1`.`column_2`) AS `alias_2` FROM `table_1`) AS alias_3 ON (`table_1`.`column_2` = `alias_3`.`alias_2`)
----
NULL

query  rowsort
SELECT avg(`table_1`.`column_3`) AS `alias_1` FROM `table_1` INNER JOIN (SELECT `table_1`.`column_2` AS `alias_2` FROM `table_1`) AS alias_3 ON (`table_1`.`column_2` = `alias_3`.`alias_2`)
----
-591379207.3000

query  rowsort
SELECT avg(`table_1`.`column_4`) AS `alias_1` FROM `table_1` INNER JOIN (SELECT avg(`table_1`.`column_5`) AS `alias_2` FROM `table_1`) AS alias_3 ON (`table_1`.`column_2` = `alias_3`.`alias_2`)
----
NULL

query  rowsort
SELECT `table_1`.`column_2` AS `alias_3` FROM `table_1` INNER JOIN (SELECT avg(`table_1`.`column_6`) AS `alias_1` FROM `table_1`) AS alias_2 ON (`table_1`.`column_2` = `alias_2`.`alias_1`) WHERE (`table_1`.`column_2` > ?)
? = 10
----


query  rowsort
SELECT `table_1`.`column_2` AS `alias_3` FROM `table_1` INNER JOIN (SELECT `table_1`.`column_2` AS `alias_1` FROM `table_1`) AS alias_2 ON (`table_1`.`column_2` = `alias_2`.`alias_1`) WHERE (`table_1`.`column_2` > ?)
? = 10
----
1002403502
1263118692
1557234213
2058954727
2066487526
52477321
612207277
641373240

query  rowsort
SELECT `table_1`.`column_2` AS `alias_3` FROM `table_1` INNER JOIN (SELECT avg(`table_1`.`column_7`) AS `alias_1` FROM `table_1`) AS alias_2 ON (`table_1`.`column_2` = `alias_2`.`alias_1`) WHERE (`table_1`.`column_2` > ?)
? = 10
----


query  rowsort
SELECT avg(`table_1`.`column_8`) AS `alias_1` FROM `table_1` INNER JOIN (SELECT avg(`table_1`.`column_9`) AS `alias_2` FROM `table_1`) AS alias_3 ON (`table_1`.`column_3` = `alias_3`.`alias_2`) WHERE (`table_1`.`column_3` > ?)
? = 10
----
NULL

query  rowsort
SELECT avg(`table_1`.`column_10`) AS `alias_1` FROM `table_1` INNER JOIN (SELECT `table_1`.`column_3` AS `alias_2` FROM `table_1`) AS alias_3 ON (`table_1`.`column_3` = `alias_3`.`alias_2`) WHERE (`table_1`.`column_3` > ?)
? = 10
----
-351505115.3333

query  rowsort
SELECT avg(`table_1`.`column_11`) AS `alias_1` FROM `table_1` INNER JOIN (SELECT avg(`table_1`.`column_12`) AS `alias_2` FROM `table_1`) AS alias_3 ON (`table_1`.`column_3` = `alias_3`.`alias_2`) WHERE (`table_1`.`column_3` > ?)
? = 10
----
NULL

statement ok
DELETE FROM `table_1` WHERE (`column_13` = 0)


statement ok
DELETE FROM `table_1` WHERE (`column_13` = 1)


statement ok
DELETE FROM `table_1` WHERE (`column_13` = 2)


statement ok
DELETE FROM `table_1` WHERE (`column_13` = 3)


statement ok
DELETE FROM `table_1` WHERE (`column_13` = 4)


query  rowsort
SELECT avg(`table_1`.`column_1`) AS `alias_1` FROM `table_1` INNER JOIN (SELECT avg(`table_1`.`column_2`) AS `alias_2` FROM `table_1`) AS alias_3 ON (`table_1`.`column_2` = `alias_3`.`alias_2`)
----
NULL

query  rowsort
SELECT avg(`table_1`.`column_3`) AS `alias_1` FROM `table_1` INNER JOIN (SELECT `table_1`.`column_2` AS `alias_2` FROM `table_1`) AS alias_3 ON (`table_1`.`column_2` = `alias_3`.`alias_2`)
----
-784660284.0000

query  rowsort
SELECT avg(`table_1`.`column_4`) AS `alias_1` FROM `table_1` INNER JOIN (SELECT avg(`table_1`.`column_5`) AS `alias_2` FROM `table_1`) AS alias_3 ON (`table_1`.`column_2` = `alias_3`.`alias_2`)
----
NULL

query  rowsort
SELECT `table_1`.`column_2` AS `alias_3` FROM `table_1` INNER JOIN (SELECT avg(`table_1`.`column_6`) AS `alias_1` FROM `table_1`) AS alias_2 ON (`table_1`.`column_2` = `alias_2`.`alias_1`) WHERE (`table_1`.`column_2` > ?)
? = 10
----


query  rowsort
SELECT `table_1`.`column_2` AS `alias_3` FROM `table_1` INNER JOIN (SELECT `table_1`.`column_2` AS `alias_1` FROM `table_1`) AS alias_2 ON (`table_1`.`column_2` = `alias_2`.`alias_1`) WHERE (`table_1`.`column_2` > ?)
? = 10
----
1263118692
1557234213
2066487526
641373240

query  rowsort
SELECT `table_1`.`column_2` AS `alias_3` FROM `table_1` INNER JOIN (SELECT avg(`table_1`.`column_7`) AS `alias_1` FROM `table_1`) AS alias_2 ON (`table_1`.`column_2` = `alias_2`.`alias_1`) WHERE (`table_1`.`column_2` > ?)
? = 10
----


query  rowsort
SELECT avg(`table_1`.`column_8`) AS `alias_1` FROM `table_1` INNER JOIN (SELECT avg(`table_1`.`column_9`) AS `alias_2` FROM `table_1`) AS alias_3 ON (`table_1`.`column_3` = `alias_3`.`alias_2`) WHERE (`table_1`.`column_3` > ?)
? = 10
----
NULL

query  rowsort
SELECT avg(`table_1`.`column_10`) AS `alias_1` FROM `table_1` INNER JOIN (SELECT `table_1`.`column_3` AS `alias_2` FROM `table_1`) AS alias_3 ON (`table_1`.`column_3` = `alias_3`.`alias_2`) WHERE (`table_1`.`column_3` > ?)
? = 10
----
-1264748815.5000

query  rowsort
SELECT avg(`table_1`.`column_11`) AS `alias_1` FROM `table_1` INNER JOIN (SELECT avg(`table_1`.`column_12`) AS `alias_2` FROM `table_1`) AS alias_3 ON (`table_1`.`column_3` = `alias_3`.`alias_2`) WHERE (`table_1`.`column_3` > ?)
? = 10
----
NULL
