# Generated by:
#     target/debug/noria-logictest permute --compare-to mysql://root:noria@127.1/noria -d 3 -o logictests/generated/mysql/ --only range_param --random --include-deletes --rows-per-table 10 --subquery-depth 1

statement ok
CREATE TABLE `table_2` (`column_4` INT, `column_8` INT, `column_9` INT, `column_10` INT, `column_5` INT, `column_2` INT, `column_6` INT, `column_3` INT, `column_11` INT, `column_7` INT, `column_1` INT, PRIMARY KEY (`column_11`))


statement ok
CREATE TABLE `table_7` (`column_2` INT, `column_3` INT, `column_1` INT, PRIMARY KEY (`column_3`))


statement ok
CREATE TABLE `table_4` (`column_3` INT, `column_1` INT, `column_2` INT, PRIMARY KEY (`column_3`))


statement ok
CREATE TABLE `table_5` (`column_3` INT, `column_1` INT, `column_4` INT, `column_2` INT, PRIMARY KEY (`column_4`))


statement ok
CREATE TABLE `table_10` (`column_1` INT, `column_3` INT, `column_2` INT, PRIMARY KEY (`column_3`))


statement ok
CREATE TABLE `table_11` (`column_1` INT, `column_2` INT, `column_3` INT, PRIMARY KEY (`column_3`))


statement ok
CREATE TABLE `table_12` (`column_2` INT, `column_3` INT, `column_1` INT, PRIMARY KEY (`column_3`))


statement ok
CREATE TABLE `table_1` (`column_2` INT, `column_1` INT, `column_3` INT, `column_4` INT, PRIMARY KEY (`column_4`))


statement ok
CREATE TABLE `table_6` (`column_3` INT, `column_1` INT, `column_2` INT, PRIMARY KEY (`column_3`))


statement ok
CREATE TABLE `table_8` (`column_3` INT, `column_1` INT, `column_2` INT, PRIMARY KEY (`column_3`))


statement ok
CREATE TABLE `table_3` (`column_1` INT, `column_2` INT, `column_3` INT, PRIMARY KEY (`column_3`))


statement ok
CREATE TABLE `table_9` (`column_1` INT, `column_2` INT, `column_3` INT, `column_4` INT, PRIMARY KEY (`column_4`))


statement ok
CREATE TABLE `table_13` (`column_2` INT, `column_3` INT, `column_1` INT, PRIMARY KEY (`column_3`))


statement ok
INSERT INTO `table_2` (`column_4`, `column_8`, `column_9`, `column_10`, `column_5`, `column_2`, `column_6`, `column_3`, `column_11`, `column_7`, `column_1`) VALUES (-1307193709, 232127700, -489034005, -1921727649, -1187598673, 1857599237, -953949911, 1027494698, 0, -830404627, -1323895855), (1781955940, -84719569, -1515207017, 1148350792, -1174076102, -1879974009, 1079571646, -140855012, 1, -1700191929, -2056395844), (65688707, -1810894761, 29523989, -783888762, -65631334, -2090651269, -954020135, 589994769, 2, 2035758134, -1825703391), (1191488624, 2137855916, 1392440104, -654584460, -1443685065, 1000699170, -985708617, -775606987, 3, -1434044843, 1517252720), (-1474904759, 573633309, -152626801, -1249817085, -1454642201, -1238814731, -1518658474, 1339884759, 4, 1083664301, -88575835), (560378623, 701416938, -1353531550, -1300912952, 1643716133, -1231926792, -856882031, -1359791194, 5, 101230971, 2045189196), (68819484, -673868797, 627859957, 699063713, 1658442875, 855254798, 1547410485, 229636158, 6, -427981070, 1186698722), (-1428594496, -113754278, -1754409611, -461200194, -537613016, -2101213208, -1675982347, -1472651750, 7, 816690287, -1208115171), (-732103153, -1186095999, -994140036, -219625302, 1574318826, 1255604147, 1750740575, 1429216340, 8, -1255314915, 2042092113), (1689670949, 472265376, 1366239613, -175654544, -1521962263, -496564458, -1749445849, -148102989, 9, -813388068, 2116342060)


statement ok
INSERT INTO `table_7` (`column_2`, `column_3`, `column_1`) VALUES (-1463330581, 0, 991297205), (1727682649, 1, 1660991018), (815597845, 2, -876883733), (-529064470, 3, -1134335177), (-1733988202, 4, 1741086961), (1122315756, 5, 1863246777), (957316863, 6, 1954511822), (-2057097746, 7, -1284680837), (-405059880, 8, -728525694), (-488050483, 9, -1851966172)


statement ok
INSERT INTO `table_4` (`column_3`, `column_1`, `column_2`) VALUES (0, 1520232224, -1260763284), (1, -516266005, -203950336), (2, -1246720462, -2134646380), (3, 1264196476, 44629831), (4, 1180274827, -2142477273), (5, 1176571956, -1540431540), (6, -866215986, -1333965346), (7, -1868337045, -415382177), (8, 1435079680, -1138404486), (9, -1388481480, -578985807)


statement ok
INSERT INTO `table_5` (`column_3`, `column_1`, `column_4`, `column_2`) VALUES (-1096050753, -1014588797, 0, -797614756), (-1508804483, 977805003, 1, 1466599721), (-1363124166, -1487903422, 2, 129223963), (-958310924, -1830142243, 3, 149437346), (-1861256677, -1668172784, 4, 1888115794), (-499690265, -1905492037, 5, 604376523), (-1586636957, -839942797, 6, -694363078), (1505233050, -1234012697, 7, 1891299779), (-1912722140, -639233759, 8, -1900600148), (500976924, 12607304, 9, -1186243218)


statement ok
INSERT INTO `table_10` (`column_1`, `column_3`, `column_2`) VALUES (-20184935, 0, 734249647), (1199229188, 1, -148182040), (1002573187, 2, -1624756018), (-919472046, 3, -1402877726), (-1451258797, 4, 1470083247), (141167067, 5, -1173163652), (214518264, 6, -231209706), (1320820326, 7, -406584596), (-1930594631, 8, -172086911), (1626802813, 9, 498159157)


statement ok
INSERT INTO `table_11` (`column_1`, `column_2`, `column_3`) VALUES (243541969, 1626007473, 0), (1235994446, -1496185628, 1), (612415446, 397048732, 2), (-1193746955, 1569826525, 3), (581213512, -756270180, 4), (331190629, -156335179, 5), (1118800881, -788478848, 6), (-1621059852, 1548424772, 7), (-626888430, 1786463418, 8), (695436073, 443226996, 9)


statement ok
INSERT INTO `table_12` (`column_2`, `column_3`, `column_1`) VALUES (1602973852, 0, 483279042), (-222103477, 1, 1634739788), (-2099100173, 2, -1811614112), (-117925379, 3, -571327047), (-502553329, 4, 616872893), (-2119252843, 5, 1451580548), (535101337, 6, -664226901), (-1904119861, 7, -491664147), (-1718928206, 8, -1424172264), (-232239938, 9, -202066815)


statement ok
INSERT INTO `table_1` (`column_2`, `column_1`, `column_3`, `column_4`) VALUES (-618045781, 1374052220, -1644066629, 0), (436397747, -1303814435, 1040229442, 1), (-269480765, -195973883, 139696499, 2), (510747942, -1706478477, -1098815603, 3), (6859019, 1010361283, -1978288461, 4), (1561282034, 297764082, -1575208793, 5), (1492662286, 1570658352, -460061338, 6), (-1221708615, -1007634566, -597550075, 7), (-510526985, 171715824, -1154286923, 8), (235539712, -64424021, 720076500, 9)


statement ok
INSERT INTO `table_6` (`column_3`, `column_1`, `column_2`) VALUES (0, -427591116, -61606767), (1, 562783259, -1455200627), (2, -1681382905, -838324391), (3, 884973455, 800761554), (4, -928511858, 1804005067), (5, 1518393673, -2062103490), (6, 19021182, -1463510684), (7, -1632144090, 1348394986), (8, -1643195972, 2091132901), (9, -86024495, 1808033089)


statement ok
INSERT INTO `table_8` (`column_3`, `column_1`, `column_2`) VALUES (0, -1634616502, -301325702), (1, 1026736930, -1307466177), (2, -1691029631, 842934851), (3, -189455782, -1814891347), (4, 1613774422, -443323897), (5, -1178173207, 1320236361), (6, -450501324, -672352969), (7, -2010745580, 1323266554), (8, -252037473, -1147423044), (9, 1648556867, 1812524478)


statement ok
INSERT INTO `table_3` (`column_1`, `column_2`, `column_3`) VALUES (-1566291475, 846868795, 0), (-218882320, 596736595, 1), (-1145412710, 1614987938, 2), (2002963125, 778605551, 3), (-258668784, -566398375, 4), (1856316206, 524441391, 5), (133761179, -1517965255, 6), (75324303, -1441848040, 7), (1045838639, 1511055721, 8), (-992912049, 1742192991, 9)


statement ok
INSERT INTO `table_9` (`column_1`, `column_2`, `column_3`, `column_4`) VALUES (2102902324, -944052497, 1621183405, 0), (-1197128400, 1725044481, 1441114891, 1), (-149912393, 1214026634, -1634419556, 2), (-628417929, -120368519, 2046676992, 3), (-1177220856, -332072245, 1494376899, 4), (1084127491, -1897813180, -2101890230, 5), (-1511565694, -1803891648, 2088537055, 6), (151405651, -831860207, -197809027, 7), (-1101046324, -446567452, 626644963, 8), (-1698077630, 1035050988, -2146593792, 9)


statement ok
INSERT INTO `table_13` (`column_2`, `column_3`, `column_1`) VALUES (1753736813, 0, -1139945697), (-407206134, 1, 2116437698), (1405038906, 2, -113362165), (701959900, 3, 2121837835), (790834981, 4, 787019664), (1297687713, 5, 1906345168), (-554635529, 6, -585067700), (312448517, 7, -1659531015), (284793533, 8, 678094506), (-1296283140, 9, 1071869934)


query  rowsort
SELECT `table_1`.`column_2` AS `alias_1`, `table_2`.`column_2` AS `alias_2` FROM `table_1` INNER JOIN `table_2` ON (`table_1`.`column_1` = `table_2`.`column_1`) INNER JOIN (SELECT `table_1`.`column_3` AS `alias_3`, `table_3`.`column_2` AS `alias_4` FROM `table_1` INNER JOIN `table_3` ON (`table_1`.`column_2` = `table_3`.`column_1`)) AS alias_5 ON (`table_1`.`column_2` = `alias_5`.`alias_3`)
----


query  rowsort
SELECT `table_2`.`column_3` AS `alias_1`, `table_4`.`column_2` AS `alias_2` FROM `table_2` INNER JOIN `table_4` ON (`table_2`.`column_1` = `table_4`.`column_1`) INNER JOIN (SELECT `table_2`.`column_3` AS `alias_3` FROM `table_2`) AS alias_4 ON (`table_2`.`column_3` = `alias_4`.`alias_3`)
----


query  rowsort
SELECT `table_2`.`column_4` AS `alias_1`, `table_5`.`column_2` AS `alias_2` FROM `table_2` INNER JOIN `table_5` ON (`table_2`.`column_3` = `table_5`.`column_1`) INNER JOIN (SELECT `table_5`.`column_3` AS `alias_3`, `table_6`.`column_2` AS `alias_4` FROM `table_5` INNER JOIN `table_6` ON (`table_5`.`column_1` = `table_6`.`column_1`)) AS alias_5 ON (`table_2`.`column_2` = `alias_5`.`alias_3`)
----


query  rowsort
SELECT `table_2`.`column_5` AS `alias_4` FROM `table_2` INNER JOIN (SELECT `table_2`.`column_5` AS `alias_1`, `table_7`.`column_2` AS `alias_2` FROM `table_2` INNER JOIN `table_7` ON (`table_2`.`column_2` = `table_7`.`column_1`)) AS alias_3 ON (`table_2`.`column_5` = `alias_3`.`alias_1`) WHERE (`table_2`.`column_2` > ?)
? = 10
----


query  rowsort
SELECT `table_2`.`column_5` AS `alias_3` FROM `table_2` INNER JOIN (SELECT `table_2`.`column_5` AS `alias_1` FROM `table_2`) AS alias_2 ON (`table_2`.`column_5` = `alias_2`.`alias_1`) WHERE (`table_2`.`column_5` > ?)
? = 10
----
1574318826
1643716133
1658442875

query  rowsort
SELECT `table_2`.`column_5` AS `alias_4` FROM `table_2` INNER JOIN (SELECT `table_2`.`column_6` AS `alias_1`, `table_8`.`column_2` AS `alias_2` FROM `table_2` INNER JOIN `table_8` ON (`table_2`.`column_5` = `table_8`.`column_1`)) AS alias_3 ON (`table_2`.`column_5` = `alias_3`.`alias_1`) WHERE (`table_2`.`column_5` > ?)
? = 10
----


query  rowsort
SELECT `table_2`.`column_7` AS `alias_1`, `table_9`.`column_2` AS `alias_2` FROM `table_2` INNER JOIN `table_9` ON (`table_2`.`column_5` = `table_9`.`column_1`) INNER JOIN (SELECT `table_9`.`column_3` AS `alias_3`, `table_10`.`column_2` AS `alias_4` FROM `table_9` INNER JOIN `table_10` ON (`table_9`.`column_1` = `table_10`.`column_1`)) AS alias_5 ON (`table_2`.`column_7` = `alias_5`.`alias_3`) WHERE (`table_2`.`column_7` > ?)
? = 10
----


query  rowsort
SELECT `table_2`.`column_8` AS `alias_1`, `table_11`.`column_2` AS `alias_2` FROM `table_2` INNER JOIN `table_11` ON (`table_2`.`column_7` = `table_11`.`column_1`) INNER JOIN (SELECT `table_11`.`column_1` AS `alias_3` FROM `table_11`) AS alias_4 ON (`table_2`.`column_4` = `alias_4`.`alias_3`) WHERE (`table_2`.`column_4` > ?)
? = 10
----


query  rowsort
SELECT `table_2`.`column_9` AS `alias_1`, `table_12`.`column_2` AS `alias_2` FROM `table_2` INNER JOIN `table_12` ON (`table_2`.`column_4` = `table_12`.`column_1`) INNER JOIN (SELECT `table_2`.`column_10` AS `alias_3`, `table_13`.`column_2` AS `alias_4` FROM `table_2` INNER JOIN `table_13` ON (`table_2`.`column_4` = `table_13`.`column_1`)) AS alias_5 ON (`table_2`.`column_4` = `alias_5`.`alias_3`) WHERE (`table_2`.`column_4` > ?)
? = 10
----


statement ok
DELETE FROM `table_2` WHERE (`column_11` = 0)


statement ok
DELETE FROM `table_2` WHERE (`column_11` = 1)


statement ok
DELETE FROM `table_2` WHERE (`column_11` = 2)


statement ok
DELETE FROM `table_2` WHERE (`column_11` = 3)


statement ok
DELETE FROM `table_2` WHERE (`column_11` = 4)


statement ok
DELETE FROM `table_7` WHERE (`column_3` = 0)


statement ok
DELETE FROM `table_7` WHERE (`column_3` = 1)


statement ok
DELETE FROM `table_7` WHERE (`column_3` = 2)


statement ok
DELETE FROM `table_7` WHERE (`column_3` = 3)


statement ok
DELETE FROM `table_7` WHERE (`column_3` = 4)


statement ok
DELETE FROM `table_4` WHERE (`column_3` = 0)


statement ok
DELETE FROM `table_4` WHERE (`column_3` = 1)


statement ok
DELETE FROM `table_4` WHERE (`column_3` = 2)


statement ok
DELETE FROM `table_4` WHERE (`column_3` = 3)


statement ok
DELETE FROM `table_4` WHERE (`column_3` = 4)


statement ok
DELETE FROM `table_5` WHERE (`column_4` = 0)


statement ok
DELETE FROM `table_5` WHERE (`column_4` = 1)


statement ok
DELETE FROM `table_5` WHERE (`column_4` = 2)


statement ok
DELETE FROM `table_5` WHERE (`column_4` = 3)


statement ok
DELETE FROM `table_5` WHERE (`column_4` = 4)


statement ok
DELETE FROM `table_10` WHERE (`column_3` = 0)


statement ok
DELETE FROM `table_10` WHERE (`column_3` = 1)


statement ok
DELETE FROM `table_10` WHERE (`column_3` = 2)


statement ok
DELETE FROM `table_10` WHERE (`column_3` = 3)


statement ok
DELETE FROM `table_10` WHERE (`column_3` = 4)


statement ok
DELETE FROM `table_11` WHERE (`column_3` = 0)


statement ok
DELETE FROM `table_11` WHERE (`column_3` = 1)


statement ok
DELETE FROM `table_11` WHERE (`column_3` = 2)


statement ok
DELETE FROM `table_11` WHERE (`column_3` = 3)


statement ok
DELETE FROM `table_11` WHERE (`column_3` = 4)


statement ok
DELETE FROM `table_12` WHERE (`column_3` = 0)


statement ok
DELETE FROM `table_12` WHERE (`column_3` = 1)


statement ok
DELETE FROM `table_12` WHERE (`column_3` = 2)


statement ok
DELETE FROM `table_12` WHERE (`column_3` = 3)


statement ok
DELETE FROM `table_12` WHERE (`column_3` = 4)


statement ok
DELETE FROM `table_1` WHERE (`column_4` = 0)


statement ok
DELETE FROM `table_1` WHERE (`column_4` = 1)


statement ok
DELETE FROM `table_1` WHERE (`column_4` = 2)


statement ok
DELETE FROM `table_1` WHERE (`column_4` = 3)


statement ok
DELETE FROM `table_1` WHERE (`column_4` = 4)


statement ok
DELETE FROM `table_6` WHERE (`column_3` = 0)


statement ok
DELETE FROM `table_6` WHERE (`column_3` = 1)


statement ok
DELETE FROM `table_6` WHERE (`column_3` = 2)


statement ok
DELETE FROM `table_6` WHERE (`column_3` = 3)


statement ok
DELETE FROM `table_6` WHERE (`column_3` = 4)


statement ok
DELETE FROM `table_8` WHERE (`column_3` = 0)


statement ok
DELETE FROM `table_8` WHERE (`column_3` = 1)


statement ok
DELETE FROM `table_8` WHERE (`column_3` = 2)


statement ok
DELETE FROM `table_8` WHERE (`column_3` = 3)


statement ok
DELETE FROM `table_8` WHERE (`column_3` = 4)


statement ok
DELETE FROM `table_3` WHERE (`column_3` = 0)


statement ok
DELETE FROM `table_3` WHERE (`column_3` = 1)


statement ok
DELETE FROM `table_3` WHERE (`column_3` = 2)


statement ok
DELETE FROM `table_3` WHERE (`column_3` = 3)


statement ok
DELETE FROM `table_3` WHERE (`column_3` = 4)


statement ok
DELETE FROM `table_9` WHERE (`column_4` = 0)


statement ok
DELETE FROM `table_9` WHERE (`column_4` = 1)


statement ok
DELETE FROM `table_9` WHERE (`column_4` = 2)


statement ok
DELETE FROM `table_9` WHERE (`column_4` = 3)


statement ok
DELETE FROM `table_9` WHERE (`column_4` = 4)


statement ok
DELETE FROM `table_13` WHERE (`column_3` = 0)


statement ok
DELETE FROM `table_13` WHERE (`column_3` = 1)


statement ok
DELETE FROM `table_13` WHERE (`column_3` = 2)


statement ok
DELETE FROM `table_13` WHERE (`column_3` = 3)


statement ok
DELETE FROM `table_13` WHERE (`column_3` = 4)


query  rowsort
SELECT `table_1`.`column_2` AS `alias_1`, `table_2`.`column_2` AS `alias_2` FROM `table_1` INNER JOIN `table_2` ON (`table_1`.`column_1` = `table_2`.`column_1`) INNER JOIN (SELECT `table_1`.`column_3` AS `alias_3`, `table_3`.`column_2` AS `alias_4` FROM `table_1` INNER JOIN `table_3` ON (`table_1`.`column_2` = `table_3`.`column_1`)) AS alias_5 ON (`table_1`.`column_2` = `alias_5`.`alias_3`)
----


query  rowsort
SELECT `table_2`.`column_3` AS `alias_1`, `table_4`.`column_2` AS `alias_2` FROM `table_2` INNER JOIN `table_4` ON (`table_2`.`column_1` = `table_4`.`column_1`) INNER JOIN (SELECT `table_2`.`column_3` AS `alias_3` FROM `table_2`) AS alias_4 ON (`table_2`.`column_3` = `alias_4`.`alias_3`)
----


query  rowsort
SELECT `table_2`.`column_4` AS `alias_1`, `table_5`.`column_2` AS `alias_2` FROM `table_2` INNER JOIN `table_5` ON (`table_2`.`column_3` = `table_5`.`column_1`) INNER JOIN (SELECT `table_5`.`column_3` AS `alias_3`, `table_6`.`column_2` AS `alias_4` FROM `table_5` INNER JOIN `table_6` ON (`table_5`.`column_1` = `table_6`.`column_1`)) AS alias_5 ON (`table_2`.`column_2` = `alias_5`.`alias_3`)
----


query  rowsort
SELECT `table_2`.`column_5` AS `alias_4` FROM `table_2` INNER JOIN (SELECT `table_2`.`column_5` AS `alias_1`, `table_7`.`column_2` AS `alias_2` FROM `table_2` INNER JOIN `table_7` ON (`table_2`.`column_2` = `table_7`.`column_1`)) AS alias_3 ON (`table_2`.`column_5` = `alias_3`.`alias_1`) WHERE (`table_2`.`column_2` > ?)
? = 10
----


query  rowsort
SELECT `table_2`.`column_5` AS `alias_3` FROM `table_2` INNER JOIN (SELECT `table_2`.`column_5` AS `alias_1` FROM `table_2`) AS alias_2 ON (`table_2`.`column_5` = `alias_2`.`alias_1`) WHERE (`table_2`.`column_5` > ?)
? = 10
----
1574318826
1643716133
1658442875

query  rowsort
SELECT `table_2`.`column_5` AS `alias_4` FROM `table_2` INNER JOIN (SELECT `table_2`.`column_6` AS `alias_1`, `table_8`.`column_2` AS `alias_2` FROM `table_2` INNER JOIN `table_8` ON (`table_2`.`column_5` = `table_8`.`column_1`)) AS alias_3 ON (`table_2`.`column_5` = `alias_3`.`alias_1`) WHERE (`table_2`.`column_5` > ?)
? = 10
----


query  rowsort
SELECT `table_2`.`column_7` AS `alias_1`, `table_9`.`column_2` AS `alias_2` FROM `table_2` INNER JOIN `table_9` ON (`table_2`.`column_5` = `table_9`.`column_1`) INNER JOIN (SELECT `table_9`.`column_3` AS `alias_3`, `table_10`.`column_2` AS `alias_4` FROM `table_9` INNER JOIN `table_10` ON (`table_9`.`column_1` = `table_10`.`column_1`)) AS alias_5 ON (`table_2`.`column_7` = `alias_5`.`alias_3`) WHERE (`table_2`.`column_7` > ?)
? = 10
----


query  rowsort
SELECT `table_2`.`column_8` AS `alias_1`, `table_11`.`column_2` AS `alias_2` FROM `table_2` INNER JOIN `table_11` ON (`table_2`.`column_7` = `table_11`.`column_1`) INNER JOIN (SELECT `table_11`.`column_1` AS `alias_3` FROM `table_11`) AS alias_4 ON (`table_2`.`column_4` = `alias_4`.`alias_3`) WHERE (`table_2`.`column_4` > ?)
? = 10
----


query  rowsort
SELECT `table_2`.`column_9` AS `alias_1`, `table_12`.`column_2` AS `alias_2` FROM `table_2` INNER JOIN `table_12` ON (`table_2`.`column_4` = `table_12`.`column_1`) INNER JOIN (SELECT `table_2`.`column_10` AS `alias_3`, `table_13`.`column_2` AS `alias_4` FROM `table_2` INNER JOIN `table_13` ON (`table_2`.`column_4` = `table_13`.`column_1`)) AS alias_5 ON (`table_2`.`column_4` = `alias_5`.`alias_3`) WHERE (`table_2`.`column_4` > ?)
? = 10
----

