# Generated by:
#     target/debug/noria-logictest permute --compare-to mysql://root:noria@127.1/noria -d 3 -o logictests/generated/mysql/ --only range_param --random --include-deletes --rows-per-table 10 --subquery-depth 1 --overwrite-tests

statement ok
CREATE TABLE `table_1` (`column_2` INT, `column_3` INT, `column_1` INT, PRIMARY KEY (`column_3`))


statement ok
INSERT INTO `table_1` (`column_2`, `column_3`, `column_1`) VALUES (-275896227, 0, -1241169008), (-1039369265, 1, 1357454282), (-965140868, 2, 1724405963), (1075304245, 3, 285080002), (1969329479, 4, -1259823147), (1252649232, 5, 90284361), (289358474, 6, -260955895), (-795549178, 7, -1822000124), (1688227429, 8, -1119817978), (-820329870, 9, 1784299117)


query  rowsort
SELECT max(`table_1`.`column_1`) AS `alias_1` FROM `table_1`
----
1784299117

query  rowsort
SELECT `table_1`.`column_1` AS `alias_1` FROM `table_1` WHERE (`table_1`.`column_1` > ?)
? = 10
----
1357454282
1724405963
1784299117
285080002
90284361

query  rowsort
SELECT max(`table_1`.`column_2`) AS `alias_1` FROM `table_1` WHERE (`table_1`.`column_2` > ?)
? = 10
----
1969329479

statement ok
DELETE FROM `table_1` WHERE (`column_3` = 0)


statement ok
DELETE FROM `table_1` WHERE (`column_3` = 1)


statement ok
DELETE FROM `table_1` WHERE (`column_3` = 2)


statement ok
DELETE FROM `table_1` WHERE (`column_3` = 3)


statement ok
DELETE FROM `table_1` WHERE (`column_3` = 4)


query  rowsort
SELECT max(`table_1`.`column_1`) AS `alias_1` FROM `table_1`
----
1784299117

query  rowsort
SELECT `table_1`.`column_1` AS `alias_1` FROM `table_1` WHERE (`table_1`.`column_1` > ?)
? = 10
----
1784299117
90284361

query  rowsort
SELECT max(`table_1`.`column_2`) AS `alias_1` FROM `table_1` WHERE (`table_1`.`column_2` > ?)
? = 10
----
1688227429
