# Generated by:
#     target/debug/noria-logictest permute --compare-to mysql://root:noria@127.1/noria -d 3 -o logictests/generated/mysql/ --only range_param --random --include-deletes --rows-per-table 10 --subquery-depth 1 --overwrite-tests

statement ok
CREATE TABLE `table_1` (`column_1` INT, `column_10` INT, `column_11` INT, `column_12` INT, `column_9` INT, `column_13` INT, `column_7` INT, `column_5` INT, `column_3` INT, `column_2` INT, `column_8` INT, `column_4` INT, `column_6` INT, PRIMARY KEY (`column_13`))


statement ok
INSERT INTO `table_1` (`column_1`, `column_10`, `column_11`, `column_12`, `column_9`, `column_13`, `column_7`, `column_5`, `column_3`, `column_2`, `column_8`, `column_4`, `column_6`) VALUES (68671189, -1223782865, -940444203, 1512294651, 132410140, 0, -146631558, 228136033, 1244492626, -1590941649, 125893681, 507990917, -1252700218), (-115538075, 1133799356, 989253113, 230751927, 1439135452, 1, -232227084, -1762030912, 557638926, -682581134, 660235670, -666474347, -144070039), (-1480922890, 1605825136, 777606973, -1119949773, -385103871, 2, -580810930, 1460858975, 1928622398, -1021399778, -1145265907, -1970012616, -869038857), (1912568549, 917363611, 80821735, 1994581073, -276647359, 3, -2028108473, 1123415402, -2133021465, 98936982, 32038687, -150985242, 1107656128), (2075162540, -352225340, -1654924864, 1255936296, 2065153089, 4, 1977918621, -1064430042, -847781337, 1506166098, -193483284, -208690755, 1573950085), (-755746851, -1300362052, 1006699972, -241087995, -1590138314, 5, -1184057341, 1544043113, -114531749, -183925170, 1802173417, -1195596132, 1950321385), (56258275, -1829223710, -1434963733, -228260909, -980398086, 6, -2105710925, 1955083522, 1077980656, 1007207372, 741613188, -1137199743, 924370368), (-621906590, 1308152619, -2102218282, 690460613, -84764126, 7, 2110633188, -1509578802, -2118355726, -1966552265, -1668813537, -586942899, 289162297), (1962270334, 1979975954, 384547516, -170744023, 2077007876, 8, 2052413995, -1685565911, 1579633738, -353603875, 926026985, -639799243, 1158775544), (-1670984353, -1817571309, -1417867341, 1499961056, 2055329446, 9, -1263847985, 1148254531, -1570892554, 433533366, -1409646783, -1223214683, -822682206)


query  rowsort
SELECT max(`table_1`.`column_1`) AS `alias_1` FROM `table_1` INNER JOIN (SELECT max(`table_1`.`column_2`) AS `alias_2` FROM `table_1`) AS alias_3 ON (`table_1`.`column_1` = `alias_3`.`alias_2`)
----
NULL

query  rowsort
SELECT max(`table_1`.`column_3`) AS `alias_1` FROM `table_1` INNER JOIN (SELECT `table_1`.`column_1` AS `alias_2` FROM `table_1`) AS alias_3 ON (`table_1`.`column_1` = `alias_3`.`alias_2`)
----
1928622398

query  rowsort
SELECT max(`table_1`.`column_4`) AS `alias_1` FROM `table_1` INNER JOIN (SELECT max(`table_1`.`column_5`) AS `alias_2` FROM `table_1`) AS alias_3 ON (`table_1`.`column_1` = `alias_3`.`alias_2`)
----
NULL

query  rowsort
SELECT `table_1`.`column_1` AS `alias_3` FROM `table_1` INNER JOIN (SELECT max(`table_1`.`column_6`) AS `alias_1` FROM `table_1`) AS alias_2 ON (`table_1`.`column_1` = `alias_2`.`alias_1`) WHERE (`table_1`.`column_1` > ?)
? = 10
----


query  rowsort
SELECT `table_1`.`column_1` AS `alias_3` FROM `table_1` INNER JOIN (SELECT `table_1`.`column_1` AS `alias_1` FROM `table_1`) AS alias_2 ON (`table_1`.`column_1` = `alias_2`.`alias_1`) WHERE (`table_1`.`column_1` > ?)
? = 10
----
1912568549
1962270334
2075162540
56258275
68671189

query  rowsort
SELECT `table_1`.`column_1` AS `alias_3` FROM `table_1` INNER JOIN (SELECT max(`table_1`.`column_7`) AS `alias_1` FROM `table_1`) AS alias_2 ON (`table_1`.`column_1` = `alias_2`.`alias_1`) WHERE (`table_1`.`column_1` > ?)
? = 10
----


query  rowsort
SELECT max(`table_1`.`column_8`) AS `alias_1` FROM `table_1` INNER JOIN (SELECT max(`table_1`.`column_9`) AS `alias_2` FROM `table_1`) AS alias_3 ON (`table_1`.`column_1` = `alias_3`.`alias_2`) WHERE (`table_1`.`column_1` > ?)
? = 10
----
NULL

query  rowsort
SELECT max(`table_1`.`column_10`) AS `alias_1` FROM `table_1` INNER JOIN (SELECT `table_1`.`column_1` AS `alias_2` FROM `table_1`) AS alias_3 ON (`table_1`.`column_1` = `alias_3`.`alias_2`) WHERE (`table_1`.`column_1` > ?)
? = 10
----
1979975954

query  rowsort
SELECT max(`table_1`.`column_11`) AS `alias_1` FROM `table_1` INNER JOIN (SELECT max(`table_1`.`column_12`) AS `alias_2` FROM `table_1`) AS alias_3 ON (`table_1`.`column_1` = `alias_3`.`alias_2`) WHERE (`table_1`.`column_1` > ?)
? = 10
----
NULL

statement ok
DELETE FROM `table_1` WHERE (`column_13` = 0)


statement ok
DELETE FROM `table_1` WHERE (`column_13` = 1)


statement ok
DELETE FROM `table_1` WHERE (`column_13` = 2)


statement ok
DELETE FROM `table_1` WHERE (`column_13` = 3)


statement ok
DELETE FROM `table_1` WHERE (`column_13` = 4)


query  rowsort
SELECT max(`table_1`.`column_1`) AS `alias_1` FROM `table_1` INNER JOIN (SELECT max(`table_1`.`column_2`) AS `alias_2` FROM `table_1`) AS alias_3 ON (`table_1`.`column_1` = `alias_3`.`alias_2`)
----
NULL

query  rowsort
SELECT max(`table_1`.`column_3`) AS `alias_1` FROM `table_1` INNER JOIN (SELECT `table_1`.`column_1` AS `alias_2` FROM `table_1`) AS alias_3 ON (`table_1`.`column_1` = `alias_3`.`alias_2`)
----
1579633738

query  rowsort
SELECT max(`table_1`.`column_4`) AS `alias_1` FROM `table_1` INNER JOIN (SELECT max(`table_1`.`column_5`) AS `alias_2` FROM `table_1`) AS alias_3 ON (`table_1`.`column_1` = `alias_3`.`alias_2`)
----
NULL

query  rowsort
SELECT `table_1`.`column_1` AS `alias_3` FROM `table_1` INNER JOIN (SELECT max(`table_1`.`column_6`) AS `alias_1` FROM `table_1`) AS alias_2 ON (`table_1`.`column_1` = `alias_2`.`alias_1`) WHERE (`table_1`.`column_1` > ?)
? = 10
----


query  rowsort
SELECT `table_1`.`column_1` AS `alias_3` FROM `table_1` INNER JOIN (SELECT `table_1`.`column_1` AS `alias_1` FROM `table_1`) AS alias_2 ON (`table_1`.`column_1` = `alias_2`.`alias_1`) WHERE (`table_1`.`column_1` > ?)
? = 10
----
1962270334
56258275

query  rowsort
SELECT `table_1`.`column_1` AS `alias_3` FROM `table_1` INNER JOIN (SELECT max(`table_1`.`column_7`) AS `alias_1` FROM `table_1`) AS alias_2 ON (`table_1`.`column_1` = `alias_2`.`alias_1`) WHERE (`table_1`.`column_1` > ?)
? = 10
----


query  rowsort
SELECT max(`table_1`.`column_8`) AS `alias_1` FROM `table_1` INNER JOIN (SELECT max(`table_1`.`column_9`) AS `alias_2` FROM `table_1`) AS alias_3 ON (`table_1`.`column_1` = `alias_3`.`alias_2`) WHERE (`table_1`.`column_1` > ?)
? = 10
----
NULL

query  rowsort
SELECT max(`table_1`.`column_10`) AS `alias_1` FROM `table_1` INNER JOIN (SELECT `table_1`.`column_1` AS `alias_2` FROM `table_1`) AS alias_3 ON (`table_1`.`column_1` = `alias_3`.`alias_2`) WHERE (`table_1`.`column_1` > ?)
? = 10
----
1979975954

query  rowsort
SELECT max(`table_1`.`column_11`) AS `alias_1` FROM `table_1` INNER JOIN (SELECT max(`table_1`.`column_12`) AS `alias_2` FROM `table_1`) AS alias_3 ON (`table_1`.`column_1` = `alias_3`.`alias_2`) WHERE (`table_1`.`column_1` > ?)
? = 10
----
NULL
