# Generated by:
#     target/debug/noria-logictest permute --compare-to mysql://root:noria@127.1/noria -d 3 -o logictests/generated/mysql/ --only range_param --random --include-deletes --rows-per-table 10 --subquery-depth 1 --overwrite-tests

statement ok
CREATE TABLE `table_1` (`column_3` INT, `column_5` INT, `column_7` INT, `column_8` INT, `column_2` INT, `column_4` INT, `column_1` INT, `column_6` INT, `column_9` INT, PRIMARY KEY (`column_9`))


statement ok
INSERT INTO `table_1` (`column_3`, `column_5`, `column_7`, `column_8`, `column_2`, `column_4`, `column_1`, `column_6`, `column_9`) VALUES (2033961606, -17052776, -1701235812, -1549411030, -1328244251, 1353268873, 747647114, -899203426, 0), (1137914744, -1347051985, -269730730, 1267950050, 1979758141, 2070765754, -83950183, 805905673, 1), (-428331314, -231668142, -84034723, 183531375, -158380702, 1691748674, -558542081, -523618262, 2), (1841195420, 1601411355, -2105358898, -34498375, 1927338721, 1637498794, -352958941, -1874111302, 3), (1549121477, 367597913, 1952010430, 1594301125, -1369575360, -798346104, -1073119999, -524486364, 4), (-1455105063, 315311301, 322034957, -665764694, -1599936328, -321026327, -132422176, 237289326, 5), (-1614846980, 271214058, -2004249559, -1720176737, 1958778895, -2126021269, -2102476349, -32147629, 6), (-1520845906, -955605653, -2007387134, -1946807563, 2006638541, -1894488988, 987814978, -1454176081, 7), (-1510975102, -782151414, -918508059, -302002798, 1321203993, -1053761657, 1510186889, -969231133, 8), (100973882, -1287585716, -962580441, 1183615263, 929023704, -698811772, 667001966, 732849019, 9)


query  rowsort
SELECT max(`table_1`.`column_1`) AS `alias_1` FROM `table_1`
----
1510186889

query  nosort
SELECT `table_1`.`column_1` AS `alias_1` FROM `table_1` ORDER BY `table_1`.`column_1` ASC LIMIT 10
----
-2102476349
-1073119999
-558542081
-352958941
-132422176
-83950183
667001966
747647114
987814978
1510186889

query  nosort
SELECT `table_1`.`column_1` AS `alias_1` FROM `table_1` ORDER BY `table_1`.`column_1` DESC LIMIT 10
----
1510186889
987814978
747647114
667001966
-83950183
-132422176
-352958941
-558542081
-1073119999
-2102476349

query  rowsort
SELECT `table_1`.`column_1` AS `alias_1` FROM `table_1` WHERE (`table_1`.`column_1` > ?)
? = 10
----
1510186889
667001966
747647114
987814978

query  nosort
SELECT max(`table_1`.`column_2`) AS `alias_1` FROM `table_1` GROUP BY `table_1`.`column_1` ORDER BY `table_1`.`column_1` ASC LIMIT 10
----
1958778895
-1369575360
-158380702
1927338721
-1599936328
1979758141
929023704
-1328244251
2006638541
1321203993

query  nosort
SELECT max(`table_1`.`column_3`) AS `alias_1` FROM `table_1` GROUP BY `table_1`.`column_1` ORDER BY `table_1`.`column_1` DESC LIMIT 10
----
-1510975102
-1520845906
2033961606
100973882
1137914744
-1455105063
1841195420
-428331314
1549121477
-1614846980

query  rowsort
SELECT max(`table_1`.`column_4`) AS `alias_1` FROM `table_1` WHERE (`table_1`.`column_4` > ?)
? = 10
----
2070765754

query  nosort
SELECT `table_1`.`column_4` AS `alias_1` FROM `table_1` ORDER BY `table_1`.`column_4` DESC LIMIT 10
----
2070765754
1691748674
1637498794
1353268873
-321026327
-698811772
-798346104
-1053761657
-1894488988
-2126021269

query  nosort
SELECT `table_1`.`column_4` AS `alias_1` FROM `table_1` WHERE (`table_1`.`column_4` > ?) ORDER BY `table_1`.`column_4` ASC LIMIT 10
? = 10
----
1353268873
1637498794
1691748674
2070765754

query  nosort
SELECT `table_1`.`column_4` AS `alias_1` FROM `table_1` WHERE (`table_1`.`column_4` > ?) ORDER BY `table_1`.`column_4` DESC LIMIT 10
? = 10
----
2070765754
1691748674
1637498794
1353268873

query  nosort
SELECT max(`table_1`.`column_5`) AS `alias_1` FROM `table_1` GROUP BY `table_1`.`column_4` ORDER BY `table_1`.`column_4` DESC LIMIT 10
----
-1347051985
-231668142
1601411355
-17052776
315311301
-1287585716
367597913
-782151414
-955605653
271214058

query  nosort
SELECT max(`table_1`.`column_6`) AS `alias_1` FROM `table_1` WHERE (`table_1`.`column_4` > ?) GROUP BY `table_1`.`column_4` ORDER BY `table_1`.`column_4` ASC LIMIT 10
? = 10
----
-899203426
-1874111302
-523618262
805905673

query  nosort
SELECT max(`table_1`.`column_7`) AS `alias_1` FROM `table_1` WHERE (`table_1`.`column_4` > ?) GROUP BY `table_1`.`column_4` ORDER BY `table_1`.`column_4` DESC LIMIT 10
? = 10
----
-269730730
-84034723
-2105358898
-1701235812

query  nosort
SELECT `table_1`.`column_4` AS `alias_1` FROM `table_1` WHERE (`table_1`.`column_4` > ?) ORDER BY `table_1`.`column_4` DESC LIMIT 10
? = 10
----
2070765754
1691748674
1637498794
1353268873

query  nosort
SELECT max(`table_1`.`column_8`) AS `alias_1` FROM `table_1` WHERE (`table_1`.`column_3` > ?) GROUP BY `table_1`.`column_3` ORDER BY `table_1`.`column_3` DESC LIMIT 10
? = 10
----
-1549411030
-34498375
1594301125
1267950050
1183615263

statement ok
DELETE FROM `table_1` WHERE (`column_9` = 0)


statement ok
DELETE FROM `table_1` WHERE (`column_9` = 1)


statement ok
DELETE FROM `table_1` WHERE (`column_9` = 2)


statement ok
DELETE FROM `table_1` WHERE (`column_9` = 3)


statement ok
DELETE FROM `table_1` WHERE (`column_9` = 4)


query  rowsort
SELECT max(`table_1`.`column_1`) AS `alias_1` FROM `table_1`
----
1510186889

query  nosort
SELECT `table_1`.`column_1` AS `alias_1` FROM `table_1` ORDER BY `table_1`.`column_1` ASC LIMIT 10
----
-2102476349
-132422176
667001966
987814978
1510186889

query  nosort
SELECT `table_1`.`column_1` AS `alias_1` FROM `table_1` ORDER BY `table_1`.`column_1` DESC LIMIT 10
----
1510186889
987814978
667001966
-132422176
-2102476349

query  rowsort
SELECT `table_1`.`column_1` AS `alias_1` FROM `table_1` WHERE (`table_1`.`column_1` > ?)
? = 10
----
1510186889
667001966
987814978

query  nosort
SELECT max(`table_1`.`column_2`) AS `alias_1` FROM `table_1` GROUP BY `table_1`.`column_1` ORDER BY `table_1`.`column_1` ASC LIMIT 10
----
1958778895
-1599936328
929023704
2006638541
1321203993

query  nosort
SELECT max(`table_1`.`column_3`) AS `alias_1` FROM `table_1` GROUP BY `table_1`.`column_1` ORDER BY `table_1`.`column_1` DESC LIMIT 10
----
-1510975102
-1520845906
100973882
-1455105063
-1614846980

query  rowsort
SELECT max(`table_1`.`column_4`) AS `alias_1` FROM `table_1` WHERE (`table_1`.`column_4` > ?)
? = 10
----
NULL

query  nosort
SELECT `table_1`.`column_4` AS `alias_1` FROM `table_1` ORDER BY `table_1`.`column_4` DESC LIMIT 10
----
-321026327
-698811772
-1053761657
-1894488988
-2126021269

query  nosort
SELECT `table_1`.`column_4` AS `alias_1` FROM `table_1` WHERE (`table_1`.`column_4` > ?) ORDER BY `table_1`.`column_4` ASC LIMIT 10
? = 10
----


query  nosort
SELECT `table_1`.`column_4` AS `alias_1` FROM `table_1` WHERE (`table_1`.`column_4` > ?) ORDER BY `table_1`.`column_4` DESC LIMIT 10
? = 10
----


query  nosort
SELECT max(`table_1`.`column_5`) AS `alias_1` FROM `table_1` GROUP BY `table_1`.`column_4` ORDER BY `table_1`.`column_4` DESC LIMIT 10
----
315311301
-1287585716
-782151414
-955605653
271214058

query  nosort
SELECT max(`table_1`.`column_6`) AS `alias_1` FROM `table_1` WHERE (`table_1`.`column_4` > ?) GROUP BY `table_1`.`column_4` ORDER BY `table_1`.`column_4` ASC LIMIT 10
? = 10
----


query  nosort
SELECT max(`table_1`.`column_7`) AS `alias_1` FROM `table_1` WHERE (`table_1`.`column_4` > ?) GROUP BY `table_1`.`column_4` ORDER BY `table_1`.`column_4` DESC LIMIT 10
? = 10
----


query  nosort
SELECT `table_1`.`column_4` AS `alias_1` FROM `table_1` WHERE (`table_1`.`column_4` > ?) ORDER BY `table_1`.`column_4` DESC LIMIT 10
? = 10
----


query  nosort
SELECT max(`table_1`.`column_8`) AS `alias_1` FROM `table_1` WHERE (`table_1`.`column_3` > ?) GROUP BY `table_1`.`column_3` ORDER BY `table_1`.`column_3` DESC LIMIT 10
? = 10
----
1183615263
