# Generated by:
#     target/debug/noria-logictest permute --compare-to mysql://root:noria@127.1/noria -d 3 -o logictests/generated/mysql/ --only range_param --random --include-deletes --rows-per-table 10 --subquery-depth 1 --overwrite-tests

statement ok
CREATE TABLE `table_1` (`column_8` INT, `column_6` INT, `column_9` INT, `column_1` INT, `column_4` INT, `column_5` INT, `column_7` INT, `column_3` INT, `column_2` INT, PRIMARY KEY (`column_9`))


statement ok
INSERT INTO `table_1` (`column_8`, `column_6`, `column_9`, `column_1`, `column_4`, `column_5`, `column_7`, `column_3`, `column_2`) VALUES (1941599572, 93528638, 0, -322301893, 1957274364, -569098581, -197576721, 1435492406, -706118570), (-327030527, 518228293, 1, 93046870, 1768261609, 284382484, -2097405049, -240509773, 816856543), (-1117433235, 1041221352, 2, 1854760433, 1170760992, 1071344890, -188667988, 354519384, 91018246), (-1218835218, 1917483521, 3, 495593345, 1527325025, -1150409404, -1377947937, 393467569, 1340477157), (-49024621, 1430586971, 4, -1673283313, -1790843688, -259870645, 1321919555, 1410006310, -1723572621), (1036067970, -90314852, 5, -2089138289, 202281305, -829429657, -506503469, 2046549814, 381102885), (-1562175381, -1086076298, 6, -448366392, 847824929, -753442947, -542696231, 427336463, -964850092), (463493061, 392194647, 7, -1495907333, 76515451, 1248426906, -136082445, 435050205, -1122062983), (-321412523, 1182697540, 8, 412665672, -1500184881, 718404991, 1288918063, 85793708, 1319242924), (-840200289, 1456107779, 9, 4954406, -755932518, 1937390878, 1797347647, -1887825721, 172730548)


query  rowsort
SELECT max(`table_1`.`column_1`) AS `alias_1` FROM `table_1`
----
1854760433

query  rowsort
SELECT sum(distinct `table_1`.`column_2`) AS `alias_1` FROM `table_1`
----
-395175963

query  rowsort
SELECT `table_1`.`column_2` AS `alias_1` FROM `table_1` WHERE (`table_1`.`column_2` > ?)
? = 10
----
1319242924
1340477157
172730548
381102885
816856543
91018246

query  rowsort
SELECT max(`table_1`.`column_3`) AS `alias_1`, sum(distinct `table_1`.`column_4`) AS `alias_2` FROM `table_1`
----
2046549814
3503282588

query  rowsort
SELECT max(`table_1`.`column_5`) AS `alias_1` FROM `table_1` WHERE (`table_1`.`column_5` > ?)
? = 10
----
1937390878

query  rowsort
SELECT sum(distinct `table_1`.`column_6`) AS `alias_1` FROM `table_1` WHERE (`table_1`.`column_5` > ?)
? = 10
----
4590449611

query  rowsort
SELECT max(`table_1`.`column_7`) AS `alias_1`, sum(distinct `table_1`.`column_8`) AS `alias_2` FROM `table_1` WHERE (`table_1`.`column_8` > ?)
? = 10
----
-136082445
3441160603

statement ok
DELETE FROM `table_1` WHERE (`column_9` = 0)


statement ok
DELETE FROM `table_1` WHERE (`column_9` = 1)


statement ok
DELETE FROM `table_1` WHERE (`column_9` = 2)


statement ok
DELETE FROM `table_1` WHERE (`column_9` = 3)


statement ok
DELETE FROM `table_1` WHERE (`column_9` = 4)


query  rowsort
SELECT max(`table_1`.`column_1`) AS `alias_1` FROM `table_1`
----
412665672

query  rowsort
SELECT sum(distinct `table_1`.`column_2`) AS `alias_1` FROM `table_1`
----
-213836718

query  rowsort
SELECT `table_1`.`column_2` AS `alias_1` FROM `table_1` WHERE (`table_1`.`column_2` > ?)
? = 10
----
1319242924
172730548
381102885

query  rowsort
SELECT max(`table_1`.`column_3`) AS `alias_1`, sum(distinct `table_1`.`column_4`) AS `alias_2` FROM `table_1`
----
2046549814
-1129495714

query  rowsort
SELECT max(`table_1`.`column_5`) AS `alias_1` FROM `table_1` WHERE (`table_1`.`column_5` > ?)
? = 10
----
1937390878

query  rowsort
SELECT sum(distinct `table_1`.`column_6`) AS `alias_1` FROM `table_1` WHERE (`table_1`.`column_5` > ?)
? = 10
----
3030999966

query  rowsort
SELECT max(`table_1`.`column_7`) AS `alias_1`, sum(distinct `table_1`.`column_8`) AS `alias_2` FROM `table_1` WHERE (`table_1`.`column_8` > ?)
? = 10
----
-136082445
1499561031
