# Generated by:
#     target/debug/noria-logictest permute --compare-to mysql://root:noria@127.1/noria -d 3 -o logictests/generated/mysql/ --only range_param --random --include-deletes --rows-per-table 10 --subquery-depth 1 --overwrite-tests

statement ok
CREATE TABLE `table_1` (`column_5` INT, `column_9` INT, `column_12` INT, `column_13` INT, `column_10` INT, `column_3` INT, `column_11` INT, `column_8` INT, `column_1` INT, `column_4` INT, `column_2` INT, `column_6` INT, `column_7` INT, PRIMARY KEY (`column_13`))


statement ok
INSERT INTO `table_1` (`column_5`, `column_9`, `column_12`, `column_13`, `column_10`, `column_3`, `column_11`, `column_8`, `column_1`, `column_4`, `column_2`, `column_6`, `column_7`) VALUES (-605254950, -508119082, -1859616460, 0, -1268277987, 796108457, 364875159, -247010405, -1345103790, -1233236259, 1073586057, -148640152, -713401859), (-1444125741, 918788321, 1033107921, 1, 956612261, 55184490, -1753488286, 482890450, 1574084079, 1669530206, -1832882814, -1638670569, 310888783), (568438970, -1244088822, -1273684601, 2, 1090289948, -1005249692, 719899747, -1757723328, -289866874, 1711256533, 141981018, 564450756, -397758600), (2006994254, 971300461, -470301236, 3, -1893348436, -1106366691, 273912156, -656932744, 1984240407, 1361756220, -2013105158, -1314349821, -469555878), (-660218568, -82095860, -665978028, 4, 2033367065, -1262579389, 629403391, -457172334, 375350367, -1261245066, 347478486, 1788049581, -1608032861), (2043456379, 1526212904, -1222414138, 5, 2147237296, 1586325759, 1479178007, 909102309, 2038523553, -563936529, -1084205736, 1156887974, 1120268806), (-1281225838, 1448386918, 233025227, 6, -39277890, 1481166555, -137632946, -1824126855, -778887471, 408423660, -1052947805, 1769402875, -1798652063), (1166793640, 441069182, -1683813929, 7, -553286536, 264787415, -1091249060, 1649043504, -1177938912, 966926335, -216516233, -1302924328, -1929052931), (-1521904612, 705489254, -1065441079, 8, 1904910864, -684320564, -1241432337, -19642549, -2023616171, -498162407, 1218474134, -1320907222, -675191596), (1725788692, 1043750762, -1569642040, 9, -1922128883, 2087161511, 355555433, 1449356259, 1168129357, -2136811976, -516313836, 1098326654, -809501129)


query  rowsort
WITH `alias_3` AS (SELECT min(`table_1`.`column_2`) AS `alias_2` FROM `table_1`) SELECT min(`table_1`.`column_1`) AS `alias_1` FROM `table_1` INNER JOIN `alias_3` ON (`table_1`.`column_2` = `alias_3`.`alias_2`)
----
1984240407

query  rowsort
WITH `alias_3` AS (SELECT `table_1`.`column_2` AS `alias_2` FROM `table_1`) SELECT min(`table_1`.`column_3`) AS `alias_1` FROM `table_1` INNER JOIN `alias_3` ON (`table_1`.`column_2` = `alias_3`.`alias_2`)
----
-1262579389

query  rowsort
WITH `alias_3` AS (SELECT min(`table_1`.`column_5`) AS `alias_2` FROM `table_1`) SELECT min(`table_1`.`column_4`) AS `alias_1` FROM `table_1` INNER JOIN `alias_3` ON (`table_1`.`column_5` = `alias_3`.`alias_2`)
----
-498162407

query  rowsort
WITH `alias_2` AS (SELECT min(`table_1`.`column_6`) AS `alias_1` FROM `table_1`) SELECT `table_1`.`column_5` AS `alias_3` FROM `table_1` INNER JOIN `alias_2` ON (`table_1`.`column_5` = `alias_2`.`alias_1`) WHERE (`table_1`.`column_5` > ?)
? = 10
----


query  rowsort
WITH `alias_2` AS (SELECT `table_1`.`column_5` AS `alias_1` FROM `table_1`) SELECT `table_1`.`column_5` AS `alias_3` FROM `table_1` INNER JOIN `alias_2` ON (`table_1`.`column_5` = `alias_2`.`alias_1`) WHERE (`table_1`.`column_5` > ?)
? = 10
----
1166793640
1725788692
2006994254
2043456379
568438970

query  rowsort
WITH `alias_2` AS (SELECT min(`table_1`.`column_7`) AS `alias_1` FROM `table_1`) SELECT `table_1`.`column_5` AS `alias_3` FROM `table_1` INNER JOIN `alias_2` ON (`table_1`.`column_5` = `alias_2`.`alias_1`) WHERE (`table_1`.`column_5` > ?)
? = 10
----


query  rowsort
WITH `alias_3` AS (SELECT min(`table_1`.`column_9`) AS `alias_2` FROM `table_1`) SELECT min(`table_1`.`column_8`) AS `alias_1` FROM `table_1` INNER JOIN `alias_3` ON (`table_1`.`column_5` = `alias_3`.`alias_2`) WHERE (`table_1`.`column_5` > ?)
? = 10
----
NULL

query  rowsort
WITH `alias_3` AS (SELECT `table_1`.`column_5` AS `alias_2` FROM `table_1`) SELECT min(`table_1`.`column_10`) AS `alias_1` FROM `table_1` INNER JOIN `alias_3` ON (`table_1`.`column_5` = `alias_3`.`alias_2`) WHERE (`table_1`.`column_5` > ?)
? = 10
----
-1922128883

query  rowsort
WITH `alias_3` AS (SELECT min(`table_1`.`column_12`) AS `alias_2` FROM `table_1`) SELECT min(`table_1`.`column_11`) AS `alias_1` FROM `table_1` INNER JOIN `alias_3` ON (`table_1`.`column_5` = `alias_3`.`alias_2`) WHERE (`table_1`.`column_5` > ?)
? = 10
----
NULL

statement ok
DELETE FROM `table_1` WHERE (`column_13` = 0)


statement ok
DELETE FROM `table_1` WHERE (`column_13` = 1)


statement ok
DELETE FROM `table_1` WHERE (`column_13` = 2)


statement ok
DELETE FROM `table_1` WHERE (`column_13` = 3)


statement ok
DELETE FROM `table_1` WHERE (`column_13` = 4)


query  rowsort
WITH `alias_3` AS (SELECT min(`table_1`.`column_2`) AS `alias_2` FROM `table_1`) SELECT min(`table_1`.`column_1`) AS `alias_1` FROM `table_1` INNER JOIN `alias_3` ON (`table_1`.`column_2` = `alias_3`.`alias_2`)
----
2038523553

query  rowsort
WITH `alias_3` AS (SELECT `table_1`.`column_2` AS `alias_2` FROM `table_1`) SELECT min(`table_1`.`column_3`) AS `alias_1` FROM `table_1` INNER JOIN `alias_3` ON (`table_1`.`column_2` = `alias_3`.`alias_2`)
----
-684320564

query  rowsort
WITH `alias_3` AS (SELECT min(`table_1`.`column_5`) AS `alias_2` FROM `table_1`) SELECT min(`table_1`.`column_4`) AS `alias_1` FROM `table_1` INNER JOIN `alias_3` ON (`table_1`.`column_5` = `alias_3`.`alias_2`)
----
-498162407

query  rowsort
WITH `alias_2` AS (SELECT min(`table_1`.`column_6`) AS `alias_1` FROM `table_1`) SELECT `table_1`.`column_5` AS `alias_3` FROM `table_1` INNER JOIN `alias_2` ON (`table_1`.`column_5` = `alias_2`.`alias_1`) WHERE (`table_1`.`column_5` > ?)
? = 10
----


query  rowsort
WITH `alias_2` AS (SELECT `table_1`.`column_5` AS `alias_1` FROM `table_1`) SELECT `table_1`.`column_5` AS `alias_3` FROM `table_1` INNER JOIN `alias_2` ON (`table_1`.`column_5` = `alias_2`.`alias_1`) WHERE (`table_1`.`column_5` > ?)
? = 10
----
1166793640
1725788692
2043456379

query  rowsort
WITH `alias_2` AS (SELECT min(`table_1`.`column_7`) AS `alias_1` FROM `table_1`) SELECT `table_1`.`column_5` AS `alias_3` FROM `table_1` INNER JOIN `alias_2` ON (`table_1`.`column_5` = `alias_2`.`alias_1`) WHERE (`table_1`.`column_5` > ?)
? = 10
----


query  rowsort
WITH `alias_3` AS (SELECT min(`table_1`.`column_9`) AS `alias_2` FROM `table_1`) SELECT min(`table_1`.`column_8`) AS `alias_1` FROM `table_1` INNER JOIN `alias_3` ON (`table_1`.`column_5` = `alias_3`.`alias_2`) WHERE (`table_1`.`column_5` > ?)
? = 10
----
NULL

query  rowsort
WITH `alias_3` AS (SELECT `table_1`.`column_5` AS `alias_2` FROM `table_1`) SELECT min(`table_1`.`column_10`) AS `alias_1` FROM `table_1` INNER JOIN `alias_3` ON (`table_1`.`column_5` = `alias_3`.`alias_2`) WHERE (`table_1`.`column_5` > ?)
? = 10
----
-1922128883

query  rowsort
WITH `alias_3` AS (SELECT min(`table_1`.`column_12`) AS `alias_2` FROM `table_1`) SELECT min(`table_1`.`column_11`) AS `alias_1` FROM `table_1` INNER JOIN `alias_3` ON (`table_1`.`column_5` = `alias_3`.`alias_2`) WHERE (`table_1`.`column_5` > ?)
? = 10
----
NULL
