# Generated by:
#     target/debug/noria-logictest permute --compare-to mysql://root:noria@127.1/noria -d 3 -o logictests/generated/mysql/ --only range_param --random --include-deletes --rows-per-table 10 --subquery-depth 1

statement ok
CREATE TABLE `table_4` (`column_1` INT, `column_3` INT, `column_4` INT, `column_2` INT, PRIMARY KEY (`column_4`))


statement ok
CREATE TABLE `table_1` (`column_3` INT, `column_2` INT, `column_4` INT, `column_1` INT, `column_5` INT, PRIMARY KEY (`column_5`))


statement ok
CREATE TABLE `table_3` (`column_2` INT, `column_1` INT, `column_3` INT, PRIMARY KEY (`column_3`))


statement ok
CREATE TABLE `table_2` (`column_2` INT, `column_3` INT, `column_1` INT, PRIMARY KEY (`column_3`))


statement ok
CREATE TABLE `table_5` (`column_1` INT, `column_3` INT, `column_2` INT, PRIMARY KEY (`column_3`))


statement ok
INSERT INTO `table_4` (`column_1`, `column_3`, `column_4`, `column_2`) VALUES (-916829492, 1278818722, 0, 1214164014), (-620709284, -1636052137, 1, 871133009), (-750105408, 118719301, 2, -1196652405), (1872745604, -949118667, 3, -300280748), (-1190422630, 90466552, 4, -2036386143), (1993353283, -1448931871, 5, 1678299086), (1455991878, 1976961967, 6, 1031502229), (-394252974, 244975397, 7, -1594828583), (1692433783, -1670121974, 8, -1436079962), (2061812548, -340828913, 9, 1377629591)


statement ok
INSERT INTO `table_1` (`column_3`, `column_2`, `column_4`, `column_1`, `column_5`) VALUES (1263224138, 275607953, 681256474, -369042957, 0), (-1396191755, -1467356824, -905829304, -1344564941, 1), (-145950930, 291163049, 1850456263, -1983031405, 2), (-1160656111, 2093781593, -1857915780, -1277531787, 3), (1459955300, -115495116, 566043935, -1548548107, 4), (189114606, -1026160180, 1446128217, -308949784, 5), (1667065174, -521149468, 1571308245, 627213128, 6), (320256048, -1733058997, 1186891054, -1053063463, 7), (-1430734324, 1458108625, 1549258623, 1203803213, 8), (817354831, 1693661311, 668321513, -883687602, 9)


statement ok
INSERT INTO `table_3` (`column_2`, `column_1`, `column_3`) VALUES (-259520766, 1311117021, 0), (-1931841443, -260069007, 1), (1557156806, -1187957547, 2), (461245868, 1748973680, 3), (-878105965, 127710390, 4), (-117220886, -599970245, 5), (182800197, -449026197, 6), (1734952503, 29651999, 7), (2138890362, 926011535, 8), (-254239576, 457852748, 9)


statement ok
INSERT INTO `table_2` (`column_2`, `column_3`, `column_1`) VALUES (437419316, 0, 1219069508), (-1973375333, 1, -262392748), (2056649382, 2, 92633252), (1362794738, 3, -746964685), (1259473725, 4, -1585192194), (-1250486040, 5, 728097946), (-1916895686, 6, -331348714), (-978782122, 7, 737039080), (-525182281, 8, 1131281230), (1659306383, 9, 1569005966)


statement ok
INSERT INTO `table_5` (`column_1`, `column_3`, `column_2`) VALUES (1764034043, 0, -689709146), (-102550956, 1, 1144788908), (1080844341, 2, -273281236), (619884866, 3, -601776055), (-1124600783, 4, 1555945521), (-2060280074, 5, -1915647281), (-1394852648, 6, -2132721628), (1259832477, 7, 1788605574), (689808806, 8, 1234142367), (-533887742, 9, -1076473686)


query  rowsort
SELECT `table_1`.`column_1` AS `alias_1` FROM `table_1` WHERE ((`table_1`.`column_1` > ?) AND (`table_1`.`column_1` > ?))
? = 10
? = 10
----
1203803213
627213128

query  rowsort
SELECT `table_1`.`column_2` AS `alias_1`, `table_2`.`column_2` AS `alias_2` FROM `table_1` INNER JOIN `table_2` ON (`table_1`.`column_1` = `table_2`.`column_1`)
----


query  rowsort
SELECT `table_1`.`column_1` AS `alias_1` FROM `table_1` WHERE (`table_1`.`column_1` > ?)
? = 10
----
1203803213
627213128

query  rowsort
SELECT `table_1`.`column_3` AS `alias_1`, `table_3`.`column_2` AS `alias_2` FROM `table_1` INNER JOIN `table_3` ON (`table_1`.`column_1` = `table_3`.`column_1`) WHERE ((`table_1`.`column_1` > ?) AND (`table_1`.`column_1` > ?))
? = 10
? = 10
----


query  rowsort
SELECT `table_1`.`column_1` AS `alias_1` FROM `table_1` WHERE (((`table_1`.`column_1` > ?) AND (`table_1`.`column_1` > ?)) AND (`table_1`.`column_1` > ?))
? = 10
? = 10
? = 10
----
1203803213
627213128

query  rowsort
SELECT `table_1`.`column_4` AS `alias_1`, `table_4`.`column_2` AS `alias_2` FROM `table_1` INNER JOIN `table_4` ON (`table_1`.`column_1` = `table_4`.`column_1`) WHERE (`table_1`.`column_3` > ?)
? = 10
----


query  rowsort
SELECT `table_4`.`column_3` AS `alias_1`, `table_5`.`column_2` AS `alias_2` FROM `table_4` INNER JOIN `table_5` ON (`table_4`.`column_1` = `table_5`.`column_1`) WHERE (((`table_4`.`column_1` > ?) AND (`table_4`.`column_1` > ?)) AND (`table_4`.`column_1` > ?))
? = 10
? = 10
? = 10
----


statement ok
DELETE FROM `table_4` WHERE (`column_4` = 0)


statement ok
DELETE FROM `table_4` WHERE (`column_4` = 1)


statement ok
DELETE FROM `table_4` WHERE (`column_4` = 2)


statement ok
DELETE FROM `table_4` WHERE (`column_4` = 3)


statement ok
DELETE FROM `table_4` WHERE (`column_4` = 4)


statement ok
DELETE FROM `table_1` WHERE (`column_5` = 0)


statement ok
DELETE FROM `table_1` WHERE (`column_5` = 1)


statement ok
DELETE FROM `table_1` WHERE (`column_5` = 2)


statement ok
DELETE FROM `table_1` WHERE (`column_5` = 3)


statement ok
DELETE FROM `table_1` WHERE (`column_5` = 4)


statement ok
DELETE FROM `table_3` WHERE (`column_3` = 0)


statement ok
DELETE FROM `table_3` WHERE (`column_3` = 1)


statement ok
DELETE FROM `table_3` WHERE (`column_3` = 2)


statement ok
DELETE FROM `table_3` WHERE (`column_3` = 3)


statement ok
DELETE FROM `table_3` WHERE (`column_3` = 4)


statement ok
DELETE FROM `table_2` WHERE (`column_3` = 0)


statement ok
DELETE FROM `table_2` WHERE (`column_3` = 1)


statement ok
DELETE FROM `table_2` WHERE (`column_3` = 2)


statement ok
DELETE FROM `table_2` WHERE (`column_3` = 3)


statement ok
DELETE FROM `table_2` WHERE (`column_3` = 4)


statement ok
DELETE FROM `table_5` WHERE (`column_3` = 0)


statement ok
DELETE FROM `table_5` WHERE (`column_3` = 1)


statement ok
DELETE FROM `table_5` WHERE (`column_3` = 2)


statement ok
DELETE FROM `table_5` WHERE (`column_3` = 3)


statement ok
DELETE FROM `table_5` WHERE (`column_3` = 4)


query  rowsort
SELECT `table_1`.`column_1` AS `alias_1` FROM `table_1` WHERE ((`table_1`.`column_1` > ?) AND (`table_1`.`column_1` > ?))
? = 10
? = 10
----
1203803213
627213128

query  rowsort
SELECT `table_1`.`column_2` AS `alias_1`, `table_2`.`column_2` AS `alias_2` FROM `table_1` INNER JOIN `table_2` ON (`table_1`.`column_1` = `table_2`.`column_1`)
----


query  rowsort
SELECT `table_1`.`column_1` AS `alias_1` FROM `table_1` WHERE (`table_1`.`column_1` > ?)
? = 10
----
1203803213
627213128

query  rowsort
SELECT `table_1`.`column_3` AS `alias_1`, `table_3`.`column_2` AS `alias_2` FROM `table_1` INNER JOIN `table_3` ON (`table_1`.`column_1` = `table_3`.`column_1`) WHERE ((`table_1`.`column_1` > ?) AND (`table_1`.`column_1` > ?))
? = 10
? = 10
----


query  rowsort
SELECT `table_1`.`column_1` AS `alias_1` FROM `table_1` WHERE (((`table_1`.`column_1` > ?) AND (`table_1`.`column_1` > ?)) AND (`table_1`.`column_1` > ?))
? = 10
? = 10
? = 10
----
1203803213
627213128

query  rowsort
SELECT `table_1`.`column_4` AS `alias_1`, `table_4`.`column_2` AS `alias_2` FROM `table_1` INNER JOIN `table_4` ON (`table_1`.`column_1` = `table_4`.`column_1`) WHERE (`table_1`.`column_3` > ?)
? = 10
----


query  rowsort
SELECT `table_4`.`column_3` AS `alias_1`, `table_5`.`column_2` AS `alias_2` FROM `table_4` INNER JOIN `table_5` ON (`table_4`.`column_1` = `table_5`.`column_1`) WHERE (((`table_4`.`column_1` > ?) AND (`table_4`.`column_1` > ?)) AND (`table_4`.`column_1` > ?))
? = 10
? = 10
? = 10
----

