# Generated by:
#     target/debug/noria-logictest permute --compare-to mysql://root:noria@127.1/noria -d 3 -o logictests/generated/mysql/ --only range_param --random --include-deletes --rows-per-table 10 --subquery-depth 1

statement ok
CREATE TABLE `table_1` (`column_6` INT, `column_3` INT, `column_1` INT, `column_2` INT, `column_4` INT, `column_5` INT, PRIMARY KEY (`column_6`))


statement ok
INSERT INTO `table_1` (`column_6`, `column_3`, `column_1`, `column_2`, `column_4`, `column_5`) VALUES (0, -1886286306, -2120908367, 552145895, -1375158862, -1053451711), (1, -1786864608, -2111048133, -56387884, -1421979303, 1195166540), (2, -1789674541, 262491470, -627402863, -1995704996, -1746915820), (3, -2142671265, 327985059, -1748679677, 190000828, 646805518), (4, -207816906, 1132645393, -1088994505, 1075463782, -1823896747), (5, 1119512945, 2072046704, 284985864, 314281115, 1321945542), (6, 871722493, -259161697, 1820282019, 1859570065, -1616539673), (7, 1543495879, 2043730120, -209342455, 107625930, 1307709321), (8, -1952875177, -1377865909, -231906657, -75477827, -302180065), (9, -1352988825, 1915490740, -1755901925, 766103186, -1764792578)


query  rowsort
SELECT `table_1`.`column_1` AS `alias_1` FROM `table_1` WHERE ((`table_1`.`column_1` > ?) AND (`table_1`.`column_1` > ?))
? = 10
? = 10
----
1132645393
1915490740
2043730120
2072046704
262491470
327985059

query  rowsort
SELECT max(`table_1`.`column_2`) AS `alias_1` FROM `table_1`
----
1820282019

query  rowsort
SELECT `table_1`.`column_2` AS `alias_1` FROM `table_1` WHERE (`table_1`.`column_2` > ?)
? = 10
----
1820282019
284985864
552145895

query  rowsort
SELECT max(`table_1`.`column_3`) AS `alias_1` FROM `table_1` WHERE ((`table_1`.`column_2` > ?) AND (`table_1`.`column_2` > ?))
? = 10
? = 10
----
1119512945

query  rowsort
SELECT `table_1`.`column_3` AS `alias_1` FROM `table_1` WHERE (((`table_1`.`column_3` > ?) AND (`table_1`.`column_3` > ?)) AND (`table_1`.`column_3` > ?))
? = 10
? = 10
? = 10
----
1119512945
1543495879
871722493

query  rowsort
SELECT max(`table_1`.`column_4`) AS `alias_1` FROM `table_1` WHERE (`table_1`.`column_3` > ?)
? = 10
----
1859570065

query  rowsort
SELECT max(`table_1`.`column_5`) AS `alias_1` FROM `table_1` WHERE (((`table_1`.`column_3` > ?) AND (`table_1`.`column_3` > ?)) AND (`table_1`.`column_3` > ?))
? = 10
? = 10
? = 10
----
1321945542

statement ok
DELETE FROM `table_1` WHERE (`column_6` = 0)


statement ok
DELETE FROM `table_1` WHERE (`column_6` = 1)


statement ok
DELETE FROM `table_1` WHERE (`column_6` = 2)


statement ok
DELETE FROM `table_1` WHERE (`column_6` = 3)


statement ok
DELETE FROM `table_1` WHERE (`column_6` = 4)


query  rowsort
SELECT `table_1`.`column_1` AS `alias_1` FROM `table_1` WHERE ((`table_1`.`column_1` > ?) AND (`table_1`.`column_1` > ?))
? = 10
? = 10
----
1915490740
2043730120
2072046704

query  rowsort
SELECT max(`table_1`.`column_2`) AS `alias_1` FROM `table_1`
----
1820282019

query  rowsort
SELECT `table_1`.`column_2` AS `alias_1` FROM `table_1` WHERE (`table_1`.`column_2` > ?)
? = 10
----
1820282019
284985864

query  rowsort
SELECT max(`table_1`.`column_3`) AS `alias_1` FROM `table_1` WHERE ((`table_1`.`column_2` > ?) AND (`table_1`.`column_2` > ?))
? = 10
? = 10
----
1119512945

query  rowsort
SELECT `table_1`.`column_3` AS `alias_1` FROM `table_1` WHERE (((`table_1`.`column_3` > ?) AND (`table_1`.`column_3` > ?)) AND (`table_1`.`column_3` > ?))
? = 10
? = 10
? = 10
----
1119512945
1543495879
871722493

query  rowsort
SELECT max(`table_1`.`column_4`) AS `alias_1` FROM `table_1` WHERE (`table_1`.`column_3` > ?)
? = 10
----
1859570065

query  rowsort
SELECT max(`table_1`.`column_5`) AS `alias_1` FROM `table_1` WHERE (((`table_1`.`column_3` > ?) AND (`table_1`.`column_3` > ?)) AND (`table_1`.`column_3` > ?))
? = 10
? = 10
? = 10
----
1321945542
