# Generated by:
#     target/debug/noria-logictest permute --compare-to mysql://root:noria@127.1/noria -d 3 -o logictests/generated/mysql/ --only range_param --random --include-deletes --rows-per-table 10 --subquery-depth 1

statement ok
CREATE TABLE `table_1` (`column_4` INT, `column_1` INT, `column_3` INT, `column_5` INT, `column_2` INT, PRIMARY KEY (`column_5`))


statement ok
INSERT INTO `table_1` (`column_4`, `column_1`, `column_3`, `column_5`, `column_2`) VALUES (1988780896, -234267318, 1108830236, 0, 2009507816), (312808888, -780507151, -980755037, 1, -1817201082), (1468085938, -1719944773, -2125919558, 2, -234326745), (-2088690154, 1469172029, 1664929002, 3, 972354677), (-193380487, 1979196663, -839604964, 4, -1698211178), (252057641, -1518305628, 778370314, 5, 513302468), (534828745, 1577750513, -529162292, 6, -987342432), (-1124896637, -2136420852, -391348421, 7, -363725513), (-260881578, 48258074, 1218421831, 8, -876350174), (-2122469315, -633876048, -622450730, 9, -412208023)


query  rowsort
SELECT 1 AS `alias_1`
----
1

query  rowsort
SELECT sum(distinct `table_1`.`column_1`) AS `alias_1` FROM `table_1`
----
-1948944491

query  rowsort
SELECT `table_1`.`column_1` AS `alias_1` FROM `table_1` WHERE (`table_1`.`column_1` > ?)
? = 10
----
1469172029
1577750513
1979196663
48258074

query  rowsort
SELECT 1 AS `alias_1`, sum(distinct `table_1`.`column_2`) AS `alias_2` FROM `table_1`
----
1
-2894200186

query  rowsort
SELECT 1 AS `alias_1` FROM `table_1` WHERE (`table_1`.`column_1` > ?)
? = 10
----
1
1
1
1

query  rowsort
SELECT sum(distinct `table_1`.`column_3`) AS `alias_1` FROM `table_1` WHERE (`table_1`.`column_1` > ?)
? = 10
----
1514583577

query  rowsort
SELECT 1 AS `alias_1`, sum(distinct `table_1`.`column_4`) AS `alias_2` FROM `table_1` WHERE (`table_1`.`column_4` > ?)
? = 10
----
1
4556562108

statement ok
DELETE FROM `table_1` WHERE (`column_5` = 0)


statement ok
DELETE FROM `table_1` WHERE (`column_5` = 1)


statement ok
DELETE FROM `table_1` WHERE (`column_5` = 2)


statement ok
DELETE FROM `table_1` WHERE (`column_5` = 3)


statement ok
DELETE FROM `table_1` WHERE (`column_5` = 4)


query  rowsort
SELECT 1 AS `alias_1`
----
1

query  rowsort
SELECT sum(distinct `table_1`.`column_1`) AS `alias_1` FROM `table_1`
----
-2662593941

query  rowsort
SELECT `table_1`.`column_1` AS `alias_1` FROM `table_1` WHERE (`table_1`.`column_1` > ?)
? = 10
----
1577750513
48258074

query  rowsort
SELECT 1 AS `alias_1`, sum(distinct `table_1`.`column_2`) AS `alias_2` FROM `table_1`
----
1
-2126323674

query  rowsort
SELECT 1 AS `alias_1` FROM `table_1` WHERE (`table_1`.`column_1` > ?)
? = 10
----
1
1

query  rowsort
SELECT sum(distinct `table_1`.`column_3`) AS `alias_1` FROM `table_1` WHERE (`table_1`.`column_1` > ?)
? = 10
----
689259539

query  rowsort
SELECT 1 AS `alias_1`, sum(distinct `table_1`.`column_4`) AS `alias_2` FROM `table_1` WHERE (`table_1`.`column_4` > ?)
? = 10
----
1
786886386
