# Generated by:
#     target/debug/noria-logictest permute --compare-to mysql://root:noria@127.1/noria -d 3 -o logictests/generated/mysql/ --only range_param --random --include-deletes --rows-per-table 10 --subquery-depth 1 --overwrite-tests

statement ok
CREATE TABLE `table_1` (`column_2` INT, `column_1` INT, PRIMARY KEY (`column_2`))


statement ok
INSERT INTO `table_1` (`column_2`, `column_1`) VALUES (0, -1374140663), (1, 1800244881), (2, -128064954), (3, -1050203883), (4, 332593953), (5, -1395514625), (6, 1434211467), (7, 1538246652), (8, -1995205303), (9, -2083113557)


query  nosort
SELECT `table_1`.`column_1` AS `alias_1` FROM `table_1` ORDER BY `table_1`.`column_1` ASC LIMIT 10
----
-2083113557
-1995205303
-1395514625
-1374140663
-1050203883
-128064954
332593953
1434211467
1538246652
1800244881

query  nosort
SELECT `table_1`.`column_1` AS `alias_1` FROM `table_1` ORDER BY `table_1`.`column_1` DESC LIMIT 10
----
1800244881
1538246652
1434211467
332593953
-128064954
-1050203883
-1374140663
-1395514625
-1995205303
-2083113557

query  rowsort
SELECT `table_1`.`column_1` AS `alias_1` FROM `table_1` WHERE (`table_1`.`column_1` > ?)
? = 10
----
1434211467
1538246652
1800244881
332593953

query  nosort
SELECT `table_1`.`column_1` AS `alias_1` FROM `table_1` ORDER BY `table_1`.`column_1` DESC LIMIT 10
----
1800244881
1538246652
1434211467
332593953
-128064954
-1050203883
-1374140663
-1395514625
-1995205303
-2083113557

query  nosort
SELECT `table_1`.`column_1` AS `alias_1` FROM `table_1` WHERE (`table_1`.`column_1` > ?) ORDER BY `table_1`.`column_1` ASC LIMIT 10
? = 10
----
332593953
1434211467
1538246652
1800244881

query  nosort
SELECT `table_1`.`column_1` AS `alias_1` FROM `table_1` WHERE (`table_1`.`column_1` > ?) ORDER BY `table_1`.`column_1` DESC LIMIT 10
? = 10
----
1800244881
1538246652
1434211467
332593953

query  nosort
SELECT `table_1`.`column_1` AS `alias_1` FROM `table_1` WHERE (`table_1`.`column_1` > ?) ORDER BY `table_1`.`column_1` DESC LIMIT 10
? = 10
----
1800244881
1538246652
1434211467
332593953

statement ok
DELETE FROM `table_1` WHERE (`column_2` = 0)


statement ok
DELETE FROM `table_1` WHERE (`column_2` = 1)


statement ok
DELETE FROM `table_1` WHERE (`column_2` = 2)


statement ok
DELETE FROM `table_1` WHERE (`column_2` = 3)


statement ok
DELETE FROM `table_1` WHERE (`column_2` = 4)


query  nosort
SELECT `table_1`.`column_1` AS `alias_1` FROM `table_1` ORDER BY `table_1`.`column_1` ASC LIMIT 10
----
-2083113557
-1995205303
-1395514625
1434211467
1538246652

query  nosort
SELECT `table_1`.`column_1` AS `alias_1` FROM `table_1` ORDER BY `table_1`.`column_1` DESC LIMIT 10
----
1538246652
1434211467
-1395514625
-1995205303
-2083113557

query  rowsort
SELECT `table_1`.`column_1` AS `alias_1` FROM `table_1` WHERE (`table_1`.`column_1` > ?)
? = 10
----
1434211467
1538246652

query  nosort
SELECT `table_1`.`column_1` AS `alias_1` FROM `table_1` ORDER BY `table_1`.`column_1` DESC LIMIT 10
----
1538246652
1434211467
-1395514625
-1995205303
-2083113557

query  nosort
SELECT `table_1`.`column_1` AS `alias_1` FROM `table_1` WHERE (`table_1`.`column_1` > ?) ORDER BY `table_1`.`column_1` ASC LIMIT 10
? = 10
----
1434211467
1538246652

query  nosort
SELECT `table_1`.`column_1` AS `alias_1` FROM `table_1` WHERE (`table_1`.`column_1` > ?) ORDER BY `table_1`.`column_1` DESC LIMIT 10
? = 10
----
1538246652
1434211467

query  nosort
SELECT `table_1`.`column_1` AS `alias_1` FROM `table_1` WHERE (`table_1`.`column_1` > ?) ORDER BY `table_1`.`column_1` DESC LIMIT 10
? = 10
----
1538246652
1434211467
